Project,Namespace,Ca types,Ce types
OpenTK,OpenTK,OpenTK.Platform.IPlatformFactory' OpenTK.Platform.Windows.WinFactory' OpenTK.Platform.IDisplayDeviceDriver' OpenTK.Graphics.IGraphicsContext' OpenTK.Platform.X11.X11Factory' OpenTK.Graphics.GraphicsContext' OpenTK.Platform.MacOS.CarbonGLNative' OpenTK.Platform.SDL2.Sdl2Factory' OpenTK.Platform.X11.X11GLNative' OpenTK.Graphics.GraphicsMode' OpenTK.Platform.Windows.WinGLNative' OpenTK.Platform.SDL2.Sdl2NativeWindow' OpenTK.Platform.SDL2.Sdl2DisplayDeviceDriver' OpenTK.Platform.MacOS.MacOSFactory' OpenTK.Platform.DisplayDeviceBase' OpenTK.Platform.Factory' OpenTK.Platform.MacOS.AglContext' OpenTK.Platform.Windows.WinDisplayDeviceDriver' OpenTK.Platform.MacOS.QuartzDisplayDeviceDriver' OpenTK.Platform.X11.X11DisplayDevice' OpenTK.Platform.INativeGLWindow' OpenTK.Platform.Egl.EglX11PlatformFactory' OpenTK.Platform.Egl.EglWinPlatformFactory' OpenTK.Platform.Egl.EglContext' OpenTK.Platform.Dummy.DummyGLContext' OpenTK.Graphics.IGraphicsContextInternal' OpenTK.Graphics.GraphicsContextBase' OpenTK.Platform.SDL2.Sdl2GraphicsContext' OpenTK.Platform.Windows.WinRawKeyboard' OpenTK.Platform.Egl.EglMacPlatformFactory' OpenTK.Audio.AudioDeviceEnumerator' OpenTK.Audio.OpenAL.Alc' OpenTK.Platform.Windows.WinRawMouse' OpenTK.Audio.AudioContext' OpenTK.Platform.X11.X11GLContext' OpenTK.Platform.Windows.WinGLContext' OpenTK.Graphics.OpenGL.Arb' OpenTK.Graphics.OpenGL.Ext' OpenTK.Graphics.ES10.GL' OpenTK.Graphics.ES11.GL' OpenTK.Graphics.ES20.GL' OpenTK.Graphics.OpenGL.GL_3dfx' OpenTK.Graphics.OpenGL.Amd' OpenTK.Graphics.OpenGL.Apple' OpenTK.Graphics.OpenGL.Ati' OpenTK.Graphics.OpenGL.Gremedy' OpenTK.Graphics.OpenGL.HP' OpenTK.Graphics.OpenGL.Ibm' OpenTK.Graphics.OpenGL.Ingr' OpenTK.Graphics.OpenGL.Intel' OpenTK.Graphics.OpenGL.Mesa' OpenTK.Graphics.OpenGL.NV' OpenTK.Graphics.OpenGL.Pgi' OpenTK.Graphics.OpenGL.Sgi' OpenTK.Graphics.OpenGL.Sgis' OpenTK.Graphics.OpenGL.Sgix' OpenTK.Graphics.OpenGL.Sun' OpenTK.Graphics.OpenGL.Sunx' OpenTK.Platform.Windows.WinInputBase' OpenTK.Platform.Windows.WinGraphicsMode' OpenTK.Graphics.GraphicsBindingsBase' OpenTK.Platform.X11.Glx' OpenTK.Platform.IGameWindow' OpenTK.Audio.AudioCapture' OpenTK.Platform.Windows.WinRawInput' OpenTK.Audio.OpenAL.AL' OpenTK.Platform.X11.API' OpenTK.Platform.Windows.Functions' OpenTK.Graphics.GraphicsErrorException' OpenTK.Audio.OpenAL.EffectsExtension' OpenTK.Graphics.OpenGL.Core' OpenTK.Graphics.OpenGL.GL' OpenTK.Platform.MacOS.HIDInput,OpenTK.Graphics.GraphicsModeException' OpenTK.Platform.IDisplayDeviceDriver' OpenTK.Platform.Factory' OpenTK.Graphics.GraphicsMode' OpenTK.Input.IInputDriver' OpenTK.Input.KeyboardKeyEventArgs' OpenTK.Platform.IWindowInfo' OpenTK.Graphics.IGraphicsContext' OpenTK.Graphics.IGraphicsContextInternal' OpenTK.Graphics.GraphicsContextFlags' OpenTK.Graphics.GraphicsContext' OpenTK.Input.MouseDevice' OpenTK.Input.KeyboardDevice' OpenTK.Input.JoystickDevice' OpenTK.Platform.IGameWindow' OpenTK.Graphics.OpenGL.GL' OpenTK.Platform.X11.API' OpenTK.Platform.SDL2.SDL
OpenTK,OpenTK.Graphics,OpenTK.Platform.Windows.WinGraphicsMode' OpenTK.Platform.MacOS.MacOSFactory' OpenTK.Platform.Egl.EglGraphicsMode' OpenTK.Platform.SDL2.Sdl2GraphicsMode' OpenTK.Platform.MacOS.MacOSGraphicsMode' OpenTK.Platform.Windows.WinFactory' OpenTK.Platform.X11.X11Factory' OpenTK.Platform.Factory' OpenTK.Platform.X11.X11GraphicsMode' OpenTK.Platform.SDL2.Sdl2Factory' OpenTK.Platform.IPlatformFactory' OpenTK.Platform.Egl.EglWinPlatformFactory' OpenTK.Graphics.OpenGL.ErrorHelper' OpenTK.Graphics.ES11.ErrorHelper' OpenTK.Graphics.ES20.ErrorHelper' OpenTK.Graphics.ES10.ErrorHelper' OpenTK.Platform.Egl.EglSdl2PlatformFactory' OpenTK.Platform.Egl.EglContext' OpenTK.Platform.Egl.EglMacPlatformFactory' OpenTK.Platform.Windows.WinGLContext' OpenTK.Platform.Egl.EglX11PlatformFactory' OpenTK.Platform.MacOS.AglContext' OpenTK.Platform.SDL2.Sdl2GraphicsContext' OpenTK.Platform.X11.X11GLContext' OpenTK.Platform.INativeGLWindow' OpenTK.Platform.Utilities' OpenTK.GameWindow' OpenTK.Platform.Dummy.DummyGLContext' OpenTK.Platform.MacOS.CarbonGLNative' OpenTK.Platform.X11.X11GLNative' OpenTK.NativeWindow' OpenTK.DisplayDevice' OpenTK.Graphics.ES10.GL' OpenTK.Graphics.ES11.GL' OpenTK.Graphics.ES20.GL' OpenTK.Graphics.OpenGL.GL_3dfx' OpenTK.Graphics.OpenGL.Amd' OpenTK.Graphics.OpenGL.Apple' OpenTK.Graphics.OpenGL.Ati' OpenTK.Graphics.OpenGL.Gremedy' OpenTK.Graphics.OpenGL.HP' OpenTK.Graphics.OpenGL.Ibm' OpenTK.Graphics.OpenGL.Ingr' OpenTK.Graphics.OpenGL.Intel' OpenTK.Graphics.OpenGL.Mesa' OpenTK.Graphics.OpenGL.NV' OpenTK.Graphics.OpenGL.Pgi' OpenTK.Graphics.OpenGL.Sgi' OpenTK.Graphics.OpenGL.Sgis' OpenTK.Graphics.OpenGL.Sgix' OpenTK.Graphics.OpenGL.Sun' OpenTK.Graphics.OpenGL.Sunx' OpenTK.Platform.Egl.EglWindowInfo' OpenTK.Platform.Egl.Egl' OpenTK.Platform.DesktopGraphicsContext' OpenTK.Platform.EmbeddedGraphicsContext,OpenTK.GraphicsException' OpenTK.DisplayDevice' OpenTK.Platform.IWindowInfo' OpenTK.ContextHandle' OpenTK.Platform.Factory' OpenTK.Platform.IPlatformFactory' OpenTK.Platform.Dummy.DummyGLContext' OpenTK.BindingsBase
OpenTK,OpenTK.Input,OpenTK.Platform.SDL2.Sdl2Joystick' OpenTK.Platform.Windows.WinRawInput' OpenTK.Platform.MacOS.MacOSFactory' OpenTK.Platform.Windows.WMInput' OpenTK.Platform.X11.X11Joystick' OpenTK.Platform.Windows.WinFactory' OpenTK.Platform.Factory' OpenTK.Platform.Windows.WinMMJoystick' OpenTK.Platform.IPlatformFactory' OpenTK.Platform.SDL2.Sdl2Factory' OpenTK.Platform.SDL2.Sdl2InputDriver' OpenTK.Platform.Windows.WinInputBase' OpenTK.Platform.MacOS.CarbonInput' OpenTK.Platform.X11.X11Factory' OpenTK.Platform.MacOS.HIDInput' OpenTK.Platform.SDL2.Sdl2Keyboard' OpenTK.Platform.Windows.WinRawKeyboard' OpenTK.Platform.X11.X11Keyboard' OpenTK.Platform.SDL2.Sdl2Mouse' OpenTK.Platform.X11.X11Mouse' OpenTK.Platform.Windows.WinRawMouse' OpenTK.Platform.X11.XI2Mouse' OpenTK.GameWindow' OpenTK.Platform.X11.X11Input' OpenTK.Platform.SDL2.Sdl2NativeWindow' OpenTK.Platform.X11.X11GLNative' OpenTK.Platform.Windows.WinGLNative' OpenTK.Platform.MacOS.CarbonGLNative' OpenTK.Platform.Windows.WinKeyMap' OpenTK.Platform.SDL2.Sdl2KeyMap' OpenTK.Platform.X11.X11KeyMap' OpenTK.Platform.MacOS.MacOSKeyMap' OpenTK.INativeWindow' OpenTK.Platform.INativeGLWindow' OpenTK.NativeWindow,OpenTK.Platform.Factory
OpenTK,OpenTK.Platform,OpenTK.Platform.Windows.WinDisplayDeviceDriver' OpenTK.Platform.MacOS.QuartzDisplayDeviceDriver' OpenTK.Platform.SDL2.Sdl2DisplayDeviceDriver' OpenTK.Platform.X11.X11DisplayDevice' OpenTK.GameWindow' OpenTK.Platform.SDL2.Sdl2Factory' OpenTK.Platform.X11.X11Factory' OpenTK.Platform.Windows.WinFactory' OpenTK.Platform.MacOS.MacOSFactory' OpenTK.DisplayDevice' OpenTK.Platform.Egl.EglSdl2PlatformFactory' OpenTK.Platform.SDL2.Sdl2WindowInfo' OpenTK.Platform.Egl.EglMacPlatformFactory' OpenTK.Graphics.GraphicsContextBase' OpenTK.INativeWindow' OpenTK.Platform.SDL2.Sdl2NativeWindow' OpenTK.NativeWindow' OpenTK.Platform.Egl.EglContext' OpenTK.Platform.X11.X11WindowInfo' OpenTK.Platform.Dummy.DummyGLContext' OpenTK.Platform.Egl.EglWinPlatformFactory' OpenTK.Platform.MacOS.CarbonWindowInfo' OpenTK.Platform.Egl.EglX11PlatformFactory' OpenTK.Graphics.IGraphicsContext' OpenTK.Platform.Dummy.DummyWindowInfo' OpenTK.Platform.Egl.EglWindowInfo' OpenTK.Platform.MacOS.CarbonGLNative' OpenTK.Platform.Windows.WinGLContext' OpenTK.Platform.X11.X11GLContext' OpenTK.Platform.MacOS.AglContext' OpenTK.Platform.Windows.WinWindowInfo' OpenTK.Platform.SDL2.Sdl2GraphicsContext' OpenTK.Platform.X11.X11Input' OpenTK.Platform.X11.X11GLNative' OpenTK.Graphics.GraphicsContext' OpenTK.Platform.Windows.WinGLNative' OpenTK.Input.Mouse' OpenTK.Input.Keyboard' OpenTK.Graphics.GraphicsMode' OpenTK.Toolkit' OpenTK.Platform.Windows.Wgl,OpenTK.DisplayDevice' OpenTK.DisplayIndex' OpenTK.DisplayResolution' OpenTK.FrameEventArgs' OpenTK.INativeWindow' OpenTK.Graphics.GraphicsContextBase' OpenTK.Graphics.ES10.GL' OpenTK.Graphics.ES11.GL' OpenTK.Graphics.ES20.GL' OpenTK.ContextHandle' OpenTK.GameWindowFlags' OpenTK.Graphics.IGraphicsMode' OpenTK.Graphics.IGraphicsContext' OpenTK.Graphics.GraphicsMode' OpenTK.Graphics.GraphicsContextFlags' OpenTK.Graphics.GraphicsContext' OpenTK.Input.IGamePadDriver' OpenTK.Input.IKeyboardDriver2' OpenTK.Input.IMouseDriver2' OpenTK.Configuration' OpenTK.Platform.Windows.WinFactory' OpenTK.Platform.Egl.EglX11PlatformFactory' OpenTK.Platform.Egl.EglWinPlatformFactory' OpenTK.Platform.Egl.Egl' OpenTK.Platform.Egl.EglMacPlatformFactory' OpenTK.Platform.Egl.EglSdl2PlatformFactory' OpenTK.Platform.MacOS.MacOSFactory' OpenTK.Platform.X11.X11Factory' OpenTK.Platform.SDL2.Sdl2Factory' OpenTK.Graphics.IGraphicsContextInternal' OpenTK.Platform.Windows.WinWindowInfo' OpenTK.Platform.Dummy.DummyWindowInfo' OpenTK.Platform.MacOS.CarbonWindowInfo' OpenTK.Platform.X11.X11WindowInfo' OpenTK.Platform.X11.XVisualInfo' OpenTK.Platform.SDL2.SDL' OpenTK.Platform.SDL2.Sdl2WindowInfo' OpenTK.WindowBorder' OpenTK.WindowState' OpenTK.Input.IInputDriver' OpenTK.Graphics.OpenGL.GL
OpenTK,OpenTK.Platform.Windows,OpenTK.Platform.Egl.EglWinPlatformFactory' OpenTK.Platform.Factory' OpenTK.Platform.Utilities' OpenTK.Platform.SDL2.Sdl2Factory,OpenTK.NativeWindow' OpenTK.INativeWindow' OpenTK.PlatformException' OpenTK.Input.IGamePadDriver' OpenTK.Input.IInputDriver2' OpenTK.Input.IKeyboardDriver2' OpenTK.Input.IMouseDriver2' OpenTK.ContextHandle' OpenTK.Input.Key' OpenTK.Input.KeyboardState' OpenTK.DisplayDevice' OpenTK.GameWindowFlags' OpenTK.Graphics.IGraphicsMode' OpenTK.Graphics.IGraphicsContext' OpenTK.Graphics.GraphicsMode' OpenTK.Graphics.GraphicsContextFlags' OpenTK.Graphics.GraphicsContext' OpenTK.Platform.IDisplayDeviceDriver' OpenTK.Platform.IWindowInfo' OpenTK.Platform.IPlatformFactory' OpenTK.BlittableValueType' OpenTK.Input.MouseButton' OpenTK.Input.MouseState' OpenTK.DisplayResolution' OpenTK.Platform.DisplayDeviceBase' OpenTK.WindowBorder' OpenTK.WindowState' OpenTK.KeyPressEventArgs' OpenTK.Input.MouseDevice' OpenTK.Input.IInputDriver' OpenTK.Input.KeyboardDevice' OpenTK.Input.JoystickDevice' OpenTK.Input.KeyboardKeyEventArgs' OpenTK.Graphics.IGraphicsContextInternal' OpenTK.Graphics.GraphicsModeException' OpenTK.Graphics.GraphicsContextException' OpenTK.Platform.DesktopGraphicsContext' OpenTK.Input.IJoystickDriver' OpenTK.Input.JoystickDevice<TDetail>' OpenTK.Input.JoystickButton' OpenTK.Input.JoystickAxis' OpenTK.Input.GamePadState' OpenTK.Platform.Utilities' OpenTK.Graphics.GraphicsModeComparer' OpenTK.Graphics.ColorFormat
OpenTK,OpenTK.Platform.Dummy,OpenTK.Platform.Utilities' OpenTK.Graphics.GraphicsContext,OpenTK.Platform.IWindowInfo' OpenTK.ContextHandle' OpenTK.Graphics.IGraphicsContext' OpenTK.Graphics.GraphicsMode' OpenTK.Graphics.GraphicsContextException' OpenTK.Platform.DesktopGraphicsContext
OpenTK,OpenTK.Platform.Egl,OpenTK.Platform.Factory,OpenTK.ContextHandle' OpenTK.Graphics.IGraphicsContext' OpenTK.Graphics.GraphicsMode' OpenTK.Graphics.GraphicsContextFlags' OpenTK.Graphics.GraphicsContext' OpenTK.Platform.IWindowInfo' OpenTK.Platform.X11.X11WindowInfo' OpenTK.Platform.X11.X11Factory' OpenTK.Graphics.IGraphicsMode' OpenTK.Platform.Windows.WinFactory' OpenTK.Platform.Windows.WinWindowInfo' OpenTK.Graphics.GraphicsModeException' OpenTK.Graphics.ColorFormat' OpenTK.Graphics.GraphicsContextException' OpenTK.Platform.EmbeddedGraphicsContext' OpenTK.Platform.MacOS.MacOSFactory' OpenTK.Platform.SDL2.Sdl2Factory
OpenTK,OpenTK.Platform.MacOS.Carbon,OpenTK.Platform.MacOS.CarbonGLNative' OpenTK.Platform.MacOS.HIDInput' OpenTK.Platform.MacOS.QuartzDisplayDeviceDriver' OpenTK.Platform.MacOS.CarbonWindowInfo' OpenTK.Platform.MacOS.AglContext' OpenTK.Platform.MacOS.MacOSKeyMap,OpenTK.Platform.MacOS.OSStatus' OpenTK.Platform.MacOS.CarbonGLNative' OpenTK.Platform.MacOS.MacOSException
OpenTK,OpenTK.Platform.MacOS,OpenTK.Platform.Egl.EglMacPlatformFactory' OpenTK.Platform.Factory' OpenTK.Platform.MacOS.Carbon.API' OpenTK.Platform.MacOS.Carbon.Application' OpenTK.Platform.Utilities' OpenTK.Platform.SDL2.Sdl2Factory,OpenTK.Graphics.IGraphicsMode' OpenTK.Graphics.GraphicsMode' OpenTK.Graphics.GraphicsModeException' OpenTK.Graphics.ColorFormat' OpenTK.DisplayDevice' OpenTK.ContextHandle' OpenTK.GameWindowFlags' OpenTK.INativeWindow' OpenTK.Graphics.IGraphicsContext' OpenTK.Graphics.GraphicsContextFlags' OpenTK.Graphics.GraphicsContext' OpenTK.Input.IGamePadDriver' OpenTK.Input.IInputDriver2' OpenTK.Input.IKeyboardDriver2' OpenTK.Input.IMouseDriver2' OpenTK.Platform.IDisplayDeviceDriver' OpenTK.Platform.IWindowInfo' OpenTK.Platform.IPlatformFactory' OpenTK.Input.Key' OpenTK.Platform.MacOS.Carbon.MacOSKeyCode' OpenTK.WindowBorder' OpenTK.WindowState' OpenTK.KeyPressEventArgs' OpenTK.IntPtrEqualityComparer' OpenTK.Input.IInputDriver' OpenTK.Input.KeyboardDevice' OpenTK.Input.MouseButton' OpenTK.Input.KeyboardKeyEventArgs' OpenTK.Input.Mouse' OpenTK.Platform.MacOS.Carbon.EventInfo' OpenTK.Platform.MacOS.Carbon.Application' OpenTK.Platform.MacOS.Carbon.CarbonPoint' OpenTK.Platform.MacOS.Carbon.Rect' OpenTK.Platform.MacOS.Carbon.HIPoint' OpenTK.Platform.MacOS.Carbon.EventTypeSpec' OpenTK.Platform.MacOS.Carbon.EventClass' OpenTK.Platform.MacOS.Carbon.WindowEventKind' OpenTK.Platform.MacOS.Carbon.MouseEventKind' OpenTK.Platform.MacOS.Carbon.MouseButton' OpenTK.Platform.MacOS.Carbon.KeyboardEventKind' OpenTK.Platform.MacOS.Carbon.WindowRegionCode' OpenTK.Platform.MacOS.Carbon.WindowClass' OpenTK.Platform.MacOS.Carbon.WindowAttributes' OpenTK.Platform.MacOS.Carbon.WindowPositionMethod' OpenTK.Platform.MacOS.Carbon.WindowPartCode' OpenTK.Platform.MacOS.Carbon.API' OpenTK.Platform.MacOS.Carbon.ScrollDelta' OpenTK.Platform.MacOS.Carbon.CG' OpenTK.Platform.MacOS.Carbon.MacOSKeyModifiers' OpenTK.Graphics.IGraphicsContextInternal' OpenTK.Platform.DesktopGraphicsContext' OpenTK.DisplayResolution' OpenTK.Platform.DisplayDeviceBase' OpenTK.Platform.MacOS.Carbon.HIRect' OpenTK.Platform.MacOS.Carbon.CFArray' OpenTK.Platform.MacOS.Carbon.CFDictionary' OpenTK.Input.MouseDevice' OpenTK.Input.JoystickDevice' OpenTK.Input.JoystickDevice<TDetail>' OpenTK.Input.KeyboardState' OpenTK.Input.MouseState' OpenTK.Platform.MacOS.Carbon.CF
OpenTK,OpenTK.Platform.X11,OpenTK.Platform.Utilities' OpenTK.Platform.Egl.EglX11PlatformFactory' OpenTK.Platform.SDL2.Sdl2Factory' OpenTK.Configuration' OpenTK.Platform.Factory,OpenTK.Platform.IWindowInfo' OpenTK.Input.IGamePadDriver' OpenTK.Input.IJoystickDriver' OpenTK.Input.JoystickDevice' OpenTK.Input.JoystickDevice<TDetail>' OpenTK.Input.JoystickButton' OpenTK.Input.JoystickAxis' OpenTK.Input.GamePadState' OpenTK.BindingsBase' OpenTK.PlatformException' OpenTK.DisplayDevice' OpenTK.DisplayResolution' OpenTK.Platform.DisplayDeviceBase' OpenTK.Graphics.IGraphicsMode' OpenTK.Graphics.GraphicsMode' OpenTK.Graphics.GraphicsModeException' OpenTK.Graphics.ColorFormat' OpenTK.WindowBorder' OpenTK.WindowState' OpenTK.GameWindowFlags' OpenTK.KeyPressEventArgs' OpenTK.INativeWindow' OpenTK.Input.MouseDevice' OpenTK.Input.IInputDriver' OpenTK.Input.KeyboardKeyEventArgs' OpenTK.Input.Mouse' OpenTK.Input.Key' OpenTK.ContextHandle' OpenTK.Graphics.IGraphicsContext' OpenTK.Graphics.IGraphicsContextInternal' OpenTK.Graphics.GraphicsContextFlags' OpenTK.Graphics.GraphicsContextException' OpenTK.Platform.DesktopGraphicsContext' OpenTK.Input.KeyboardDevice' OpenTK.Input.MouseButton' OpenTK.Graphics.GraphicsContext' OpenTK.Input.IKeyboardDriver2' OpenTK.Input.IMouseDriver2' OpenTK.Platform.IDisplayDeviceDriver' OpenTK.Platform.IPlatformFactory' OpenTK.Input.KeyboardState' OpenTK.Input.MouseState
OpenTK,OpenTK.Graphics.OpenGL,OpenTK.GameWindow' OpenTK.Platform.DesktopGraphicsContext,OpenTK.Half' OpenTK.AutoGeneratedAttribute' OpenTK.Graphics.GraphicsContext' OpenTK.Graphics.GraphicsErrorException' OpenTK.Graphics.IGraphicsContext' OpenTK.Graphics.GraphicsContextMissingException
OpenTK,OpenTK.Graphics.ES10,OpenTK.Platform.DesktopGraphicsContext' OpenTK.Platform.EmbeddedGraphicsContext,OpenTK.AutoGeneratedAttribute' OpenTK.Graphics.GraphicsContext' OpenTK.Graphics.GraphicsErrorException' OpenTK.Graphics.IGraphicsContext' OpenTK.Graphics.GraphicsContextMissingException
OpenTK,OpenTK.Graphics.ES11,OpenTK.Platform.EmbeddedGraphicsContext' OpenTK.Platform.DesktopGraphicsContext,OpenTK.AutoGeneratedAttribute' OpenTK.Graphics.GraphicsContext' OpenTK.Graphics.GraphicsErrorException' OpenTK.Graphics.IGraphicsContext' OpenTK.Graphics.GraphicsContextMissingException
OpenTK,OpenTK.Graphics.ES20,OpenTK.Platform.DesktopGraphicsContext' OpenTK.Platform.EmbeddedGraphicsContext,OpenTK.AutoGeneratedAttribute' OpenTK.Graphics.GraphicsContext' OpenTK.Graphics.GraphicsErrorException' OpenTK.Graphics.IGraphicsContext' OpenTK.Graphics.GraphicsContextMissingException
OpenTK,OpenTK.Audio,,OpenTK.ContextHandle' OpenTK.Audio.OpenAL.AlcError' OpenTK.Audio.OpenAL.AlcGetString' OpenTK.Audio.OpenAL.AlcGetStringList' OpenTK.Audio.OpenAL.Alc' OpenTK.Audio.OpenAL.AlcContextAttributes' OpenTK.Audio.OpenAL.AlcGetInteger' OpenTK.BlittableValueType<T>' OpenTK.Audio.OpenAL.ALFormat
OpenTK,OpenTK.Audio.OpenAL,OpenTK.Audio.AudioContext' OpenTK.Audio.AudioDeviceEnumerator' OpenTK.Audio.AudioCapture' OpenTK.Audio.AudioDeviceErrorChecker,OpenTK.ContextHandle' OpenTK.Vector3' OpenTK.BlittableValueType
OpenTK,OpenTK.Properties,,
OpenTK,OpenTK.Platform.SDL2,OpenTK.Platform.Utilities' OpenTK.Configuration' OpenTK.Platform.Egl.EglSdl2PlatformFactory' OpenTK.Platform.Factory,OpenTK.DisplayDevice' OpenTK.DisplayResolution' OpenTK.Platform.DisplayDeviceBase' OpenTK.ContextHandle' OpenTK.GameWindowFlags' OpenTK.Configuration' OpenTK.INativeWindow' OpenTK.Graphics.IGraphicsMode' OpenTK.Graphics.IGraphicsContext' OpenTK.Graphics.GraphicsMode' OpenTK.Graphics.GraphicsContextFlags' OpenTK.Graphics.GraphicsContext' OpenTK.Input.IGamePadDriver' OpenTK.Input.IInputDriver2' OpenTK.Input.IKeyboardDriver2' OpenTK.Input.IMouseDriver2' OpenTK.Platform.IDisplayDeviceDriver' OpenTK.Platform.IWindowInfo' OpenTK.Platform.IPlatformFactory' OpenTK.Platform.Windows.Wgl' OpenTK.Platform.Windows.Imports' OpenTK.Platform.MacOS.Cgl' OpenTK.Platform.X11.Glx' OpenTK.Graphics.GraphicsContextException' OpenTK.Platform.DesktopGraphicsContext' OpenTK.Graphics.ColorFormat' OpenTK.Input.IJoystickDriver' OpenTK.Input.JoystickDevice' OpenTK.Input.GamePadState' OpenTK.Input.Key' OpenTK.Input.KeyboardState' OpenTK.Input.MouseButton' OpenTK.Input.MouseState' OpenTK.WindowBorder' OpenTK.WindowState' OpenTK.KeyPressEventArgs' OpenTK.Input.MouseDevice' OpenTK.Input.IInputDriver' OpenTK.Input.KeyboardDevice' OpenTK.Input.KeyboardKeyEventArgs
