Project,Namespace,Ca types,Ce types
Antlr3.Runtime,Antlr.Runtime.Debug,,Antlr.Runtime.BaseRecognizer' Antlr.Runtime.Tree.ITreeAdaptor' Antlr.Runtime.JavaExtensions.ExceptionExtensions' Antlr.Runtime.IToken' Antlr.Runtime.RecognitionException' Antlr.Runtime.TokenTypes' Antlr.Runtime.JavaExtensions.StringExtensions' Antlr.Runtime.ITokenStream' Antlr.Runtime.RecognizerSharedState' Antlr.Runtime.Misc.ErrorManager' Antlr.Runtime.Tree.ITreeNodeStream' Antlr.Runtime.JavaExtensions.StringTokenizer' Antlr.Runtime.TokenChannels' Antlr.Runtime.Tree.TreeParser' Antlr.Runtime.IIntStream' Antlr.Runtime.BitSet' Antlr.Runtime.Tree.ParseTree' Antlr.Runtime.CommonToken' Antlr.Runtime.Misc.Stats' Antlr.Runtime.JavaExtensions.EnumerableExtensions
Antlr3.Runtime,Antlr.Runtime.JavaExtensions,Antlr.Runtime.Debug.Profiler' Antlr.Runtime.Misc.Stats' Antlr.Runtime.Debug.DebugEventSocketProxy' Antlr.Runtime.Debug.RemoteDebugEventSocketListener' Antlr.Runtime.Debug.DebugTreeParser,Antlr.Runtime.Lexer
Antlr3.Runtime,Antlr.Runtime.Misc,Antlr.Runtime.Debug.Profiler' Antlr.Runtime.Debug.DebugParser,Antlr.Runtime.JavaExtensions.EnumerableExtensions
Antlr3.Runtime,Antlr.Runtime.Tree,Antlr.Runtime.RecognitionException' Twiglet.CS2J.Translator.CS2J' Twiglet.CS2J.Translator.Transform.CommonWalker' Twiglet.CS2J.Translator.Transform.CUnit' AntlrCSharp.AntlrUtils' Antlr.Runtime.Debug.DebugEventSocketProxy' Antlr.Runtime.Debug.DebugTreeAdaptor' Antlr.Runtime.Debug.DebugTreeNodeStream' Antlr.Runtime.Debug.TraceDebugEventListener' Antlr.Runtime.Debug.DebugTreeParser' Antlr.Runtime.MismatchedTreeNodeException' Twiglet.CS2J.Translator.Transform.NetFragments' Twiglet.CS2J.Translator.Transform.SyntaxFragments' Antlr.Runtime.Debug.ParseTreeBuilder,Antlr.Runtime.ITokenStream' Antlr.Runtime.TokenTypes' Antlr.Runtime.RecognizerSharedState' Antlr.Runtime.CommonErrorNode' Antlr.Runtime.IToken' Antlr.Runtime.RecognitionException' Antlr.Runtime.CommonToken' Antlr.Runtime.CharStreamConstants' Antlr.Runtime.BaseRecognizer' Antlr.Runtime.IIntStream' Antlr.Runtime.BitSet' Antlr.Runtime.Token
Antlr3.Runtime,Antlr.Runtime,Antlr.Runtime.Tree.CommonTreeNodeStream' Antlr.Runtime.Debug.ProxyToken' Antlr.Runtime.Debug.Profiler' AntlrCSharp.PreProcessor' Antlr.Runtime.Debug.DebugEventSocketProxy' Antlr.Runtime.Tree.BufferedTreeNodeStream' Antlr.Runtime.Tree.TreeIterator' Antlr.Runtime.Tree.CommonTree' Antlr.Runtime.Tree.CommonTreeAdaptor' Antlr.Runtime.Tree.ParseTree' Antlr.Runtime.Tree.TreeParser' Antlr.Runtime.Tree.TreeWizard' Antlr.Runtime.Debug.DebugTreeParser' Twiglet.CS2J.Translator.CS2J' Twiglet.CS2J.Translator.Transform.CommonWalker' Antlr.Runtime.Debug.Tracer' Antlr.Runtime.Debug.DebugParser' Antlr.Runtime.Debug.IDebugEventListener' Antlr.Runtime.Debug.DebugTreeAdaptor' Antlr.Runtime.Debug.BlankDebugEventListener' Antlr.Runtime.Debug.DebugEventHub' Antlr.Runtime.Debug.DebugEventRepeater' Antlr.Runtime.Debug.ParseTreeBuilder' Antlr.Runtime.Tree.BaseTreeAdaptor' Antlr.Runtime.Tree.ITreeAdaptor' Antlr.Runtime.Tree.TreePatternParser' Antlr.Runtime.Tree.TreeFilter' Twiglet.CS2J.Translator.Transform.NetFragments' Twiglet.CS2J.Translator.Transform.SyntaxFragments' Antlr.Runtime.Debug.DebugTokenStream' Antlr.Runtime.Debug.RemoteDebugEventSocketListener' Antlr.Runtime.Debug.TraceDebugEventListener' Antlr.Runtime.Tree.TreePattern' Antlr.Runtime.Tree.WildcardTreePattern' Antlr.Runtime.Tree.TreePatternTreeAdaptor' Antlr.Runtime.Tree.RewriteRuleTokenStream' Antlr.Runtime.JavaExtensions.LexerExtensions,Antlr.Runtime.Tree.ITreeNodeStream' Antlr.Runtime.Tree.ITreeAdaptor' Antlr.Runtime.Tree.ITree' Antlr.Runtime.Tree.CommonTree
Antlr3.Runtime,Antlr.Runtime.Collections,,
