Project,Namespace,Ca types,Ce types
TagServer,StackOverflowTagServer,StackOverflowTagServer.DataStructures.SimpleBloomFilter' StackOverflowTagServer.Querying.ComplexQueryProcessor' StackOverflowTagServer.Querying.BaseQueryProcessor' StackOverflowTagServer.Querying.QueryProcessor' StackOverflowTagServer.Querying.BitMapQueryProcessor,StackOverflowTagServer.CLR.HashSetCache<T>' StackOverflowTagServer.CLR.HashSet<T>' Ewah.EwahCompressedBitArray' StackOverflowTagServer.Querying.IntComparer' StackOverflowTagServer.DataStructures.QueryType' StackOverflowTagServer.Querying.QueryInfo' StackOverflowTagServer.Querying.QueryTester' StackOverflowTagServer.DataStructures.Trie<TValue>' Ewah.EwahCompressedBitArraySerializer' StackOverflowTagServer.Querying.BitMapQueryProcessor' StackOverflowTagServer.Querying.ComplexQueryProcessor' StackOverflowTagServer.Querying.QueryProcessor' StackOverflowTagServer.Querying.QueryResult' StackOverflowTagServer.DataStructures.DisposableAction' StackOverflowTagServer.DataStructures.TrieEntry
TagServer,StackOverflowTagServer.CLR,StackOverflowTagServer.Querying.QueryProcessor' StackOverflowTagServer.BitMapIndexHandler' StackOverflowTagServer.Querying.BaseQueryProcessor' StackOverflowTagServer.Validator' StackOverflowTagServer.Querying.ComplexQueryProcessor' StackOverflowTagServer.TagServer' StackOverflowTagServer.Program' StackOverflowTagServer.WildcardProcessor,
TagServer,Ewah,StackOverflowTagServer.Validator' StackOverflowTagServer.Program' StackOverflowTagServer.TagServer' StackOverflowTagServer.Querying.BitMapQueryProcessor' StackOverflowTagServer.BitMapIndexHandler' StackOverflowTagServer.Serialisation,
TagServer,StackOverflowTagServer.Querying,StackOverflowTagServer.TagServer' StackOverflowTagServer.BitMapIndexHandler' StackOverflowTagServer.Validator' StackOverflowTagServer.Program,StackOverflowTagServer.Logger' StackOverflowTagServer.CLR.HashSetCache<T>' StackOverflowTagServer.DataStructures.QueryType' StackOverflowTagServer.Results' StackOverflowTagServer.TagServer' StackOverflowTagServer.Utils' Ewah.EwahCompressedBitArray' StackOverflowTagServer.CLR.HashSet<T>' StackOverflowTagServer.DataStructures.GCCollectionInfo' StackOverflowTagServer.DataStructures.SimpleBloomFilter
TagServer,StackOverflowTagServer.DataStructures,StackOverflowTagServer.Utils' StackOverflowTagServer.Querying.QueryProcessor' StackOverflowTagServer.WildcardProcessor' StackOverflowTagServer.Program' StackOverflowTagServer.Querying.QueryInfo' StackOverflowTagServer.Querying.ComplexQueryProcessor' StackOverflowTagServer.Querying.BitMapQueryProcessor' StackOverflowTagServer.BitMapIndexHandler' StackOverflowTagServer.Validator' StackOverflowTagServer.Querying.BaseQueryProcessor' StackOverflowTagServer.TagServer,StackOverflowTagServer.Logger
TagServer,StackOverflowTagServer.Properties,,
