Implementation smell,Namespace,Class,File,Method,Description
Complex Method,HpToolsAborter,Program,D:\research\architectureSmells\repos\hpsa_hp-application-automation-tools-plugin\HpToolsAborter\Program.cs,Main,Cyclomatic complexity of the method is 8
Long Statement,HpToolsAborter,Program,D:\research\architectureSmells\repos\hpsa_hp-application-automation-tools-plugin\HpToolsAborter\Program.cs,Main,The length of the statement  "                        Console.Out.WriteLine(string.Format("Stopping a test in a remote machine is not supported. Test in {0} should be stopped manually"'_ciParams["almRunHost"])); " is 157.
Long Statement,HpToolsAborter,Program,D:\research\architectureSmells\repos\hpsa_hp-application-automation-tools-plugin\HpToolsAborter\Program.cs,KillProcessAndChildren,The length of the statement  "            ManagementObjectSearcher searcher = new ManagementObjectSearcher("Select * From Win32_Process Where ParentProcessID=" + pid); " is 125.
Long Statement,HpToolsAborter,Program,D:\research\architectureSmells\repos\hpsa_hp-application-automation-tools-plugin\HpToolsAborter\Program.cs,GetProcessChildren,The length of the statement  "            ManagementObjectSearcher searcher = new ManagementObjectSearcher("Select * From Win32_Process Where ParentProcessID=" + pid); " is 125.
Empty Catch Block,HpToolsAborter,Program,D:\research\architectureSmells\repos\hpsa_hp-application-automation-tools-plugin\HpToolsAborter\Program.cs,KillProcessAndChildren,The method has an empty catch block.
