Project,Namespace,Ca types,Ce types
System.Web.NHaml,System.Web.NHaml.Compilers.Exceptions,,
System.Web.NHaml,System.Web.NHaml.Compilers,System.Web.NHaml.TemplateFactoryFactory' NHaml.Tests.CompiledTemplate_Tests' NHaml.Tests.Compilers.CodeDomClassBuilder_Tests' System.Web.NHaml.Walkers.CodeDom.HamlPartialWalker' System.Web.NHaml.Walkers.CodeDom.HamlNodeDocTypeWalker' System.Web.NHaml.Walkers.CodeDom.HamlNodeCodeWalker' System.Web.NHaml.Walkers.CodeDom.HamlNodeEvalWalker' System.Web.NHaml.Walkers.CodeDom.HamlNodeHamlCommentWalker' System.Web.NHaml.Walkers.CodeDom.HamlNodeHtmlCommentWalker' System.Web.NHaml.Walkers.CodeDom.HamlDocumentWalker' System.Web.NHaml.Walkers.CodeDom.HamlNodeTagWalker' System.Web.NHaml.Walkers.CodeDom.HamlNodeTextContainerWalker' System.Web.NHaml.Walkers.CodeDom.HamlNodeTextLiteralWalker' System.Web.NHaml.Walkers.CodeDom.HamlNodeTextVariableWalker' System.Web.NHaml.Walkers.CodeDom.HamlNodeWalker' System.Web.NHaml.Walkers.CodeDom.HamlWalkerFactory' System.Web.NHaml.Walkers.CodeDom.HamlNodeHtmlAttributeCollectionWalker' NHaml.Tests.Walkers.CodeDom.HamlNodeDocTypeWalker_Tests' NHaml.Tests.Walkers.CodeDom.HamlNodeCodeWalker_Tests' NHaml.Tests.Walkers.CodeDom.HamlNodeTextVariableWalker_Tests' NHaml.Tests.Walkers.CodeDom.HamlNodeEvalWalker_Tests' NHaml.Tests.Walkers.CodeDom.DummyWalker' NHaml.Tests.Walkers.HamlDocumentWalker_Tests,System.Web.NHaml.Parser.Rules.HamlNodeTextVariable' System.Web.NHaml.Parser.HamlNode' System.Web.NHaml.TemplateBase.Template' System.Web.NHaml.TemplateFactory
System.Web.NHaml,System.Web.NHaml.Configuration,NHaml.Tests.Configuration.NHamlConfigurationSection_Tests' NHaml.Web.Mvc3.NHamlMvcViewEngine' HamlSpec.SpecTestRunner' NHaml.Tests.XmlConfigurator_Tests,System.Web.NHaml.TemplateEngine' System.Web.NHaml.TemplateResolution.ITemplateContentProvider' System.Web.NHaml.SimpleTemplateCache' System.Web.NHaml.TemplateFactoryFactory
System.Web.NHaml,System.Web.NHaml.IO,NHaml.Tests.IO.HamlLineLexer_Tests' NHaml.Tests.IO.HamlRuleFactory_Tests' System.Web.NHaml.Parser.HamlTreeParser' NHaml.Tests.IO.HamlFileLexer_Tests' NHaml.Tests.Parser.HamlTreeParser_Tests' System.Web.NHaml.Parser.Rules.HamlNodeDocType' System.Web.NHaml.Parser.Rules.HamlNodePartial' System.Web.NHaml.Parser.Rules.HamlNodeCode' System.Web.NHaml.Parser.Rules.HamlNodeEval' System.Web.NHaml.Parser.Rules.HamlNodeHtmlComment' System.Web.NHaml.Parser.Rules.HamlNodeHamlComment' System.Web.NHaml.Parser.Rules.HamlNodeTag' System.Web.NHaml.Parser.Rules.HamlNodeTextContainer' System.Web.NHaml.Parser.HamlNodeFactory' System.Web.NHaml.Parser.HamlNode' NHaml.Tests.IO.HamlLine_Tests' NHaml.Tests.Parser.HamlNodeFactory_Tests' NHaml.Tests.Parser.Rules.HamlNodeTag_Tests' NHaml.Tests.Parser.Rules.HamlNodeTextContainer_Tests' NHaml.Tests.Walkers.CodeDom.HamlNodeHtmlCommentWalker_Tests' NHaml.Tests.Walkers.HamlDocumentWalker_Tests,System.Web.NHaml.Parser.HamlRuleEnum
System.Web.NHaml,System.Web.NHaml,System.Web.NHaml.Configuration.XmlConfigurator' NHaml.Tests.TemplateFactoryFactory_Tests' NHaml.Tests.CompiledTemplate_Tests' NHaml.Tests.TemplateEngine_Tests' NHaml.Tests.ProxyExtractor_Tests' NHaml.Tests.SimpleTemplateCache_Tests' System.Web.NHaml.Compilers.CodeDomTemplateCompiler' NHaml.Web.Mvc3.NHamlMvcViewEngine' HamlSpec.SpecTestRunner' NHaml.Tests.TemplateFactory_Tests' NHaml.Tests.XmlConfigurator_Tests,System.Web.NHaml.TemplateResolution.ViewSource' System.Web.NHaml.TemplateResolution.ViewSourceCollection' System.Web.NHaml.Parser.ITreeParser' System.Web.NHaml.Walkers.IDocumentWalker' System.Web.NHaml.Compilers.ITemplateFactoryCompiler' System.Web.NHaml.TemplateResolution.ITemplateContentProvider' System.Web.NHaml.TemplateBase.Template' System.Web.NHaml.Parser.HamlDocument' System.Web.NHaml.Parser.Rules.HamlNodePartial' System.Web.NHaml.Crosscutting.Invariant
System.Web.NHaml,System.Web.NHaml.Parser.Rules,System.Web.NHaml.Walkers.CodeDom.HamlNodeDocTypeWalker' System.Web.NHaml.Walkers.CodeDom.HamlWalkerFactory' System.Web.NHaml.Parser.HamlNodeFactory' NHaml.Tests.Walkers.CodeDom.HamlNodeDocTypeWalker_Tests' System.Web.NHaml.TemplateFactoryFactory' System.Web.NHaml.Parser.HamlNode' NHaml.Tests.Parser.HamlNode_Tests' NHaml.Tests.TemplateFactoryFactory_Tests' System.Web.NHaml.Walkers.CodeDom.HamlNodeCodeWalker' NHaml.Tests.Walkers.CodeDom.HamlNodeCodeWalker_Tests' System.Web.NHaml.Compilers.CodeDomClassBuilder' System.Web.NHaml.Walkers.CodeDom.HamlNodeTextVariableWalker' NHaml.Tests.Mocks.ClassBuilderMock' NHaml.Tests.Walkers.CodeDom.HamlNodeTextVariableWalker_Tests' System.Web.NHaml.Walkers.CodeDom.HamlNodeTextLiteralWalker' System.Web.NHaml.Walkers.CodeDom.HamlNodeEvalWalker' NHaml.Tests.Walkers.CodeDom.HamlNodeEvalWalker_Tests' System.Web.NHaml.Walkers.CodeDom.HamlNodeTagWalker' System.Web.NHaml.Walkers.CodeDom.HamlNodeHtmlAttributeCollectionWalker' NHaml.Tests.Parser.Rules.HamlNodeHtmlAttributeCollection_Tests' NHaml.Tests.Parser.Rules.HamlNodeHtmlAttribute_Tests' NHaml.Tests.Walkers.CodeDom.HamlNodeHtmlAttributeCollectionWalker_Tests' NHaml.Tests.Parser.Rules.HamlNodeTag_Tests' System.Web.NHaml.Walkers.CodeDom.HamlNodeHtmlCommentWalker' NHaml.Tests.Parser.Rules.HamlNodeHtmlComment_Tests' NHaml.Tests.Walkers.CodeDom.HamlNodeHtmlCommentWalker_Tests' NHaml.Tests.Walkers.CodeDom.HamlNodeTagWalker_Tests' System.Web.NHaml.Walkers.CodeDom.HamlNodeTextContainerWalker' NHaml.Tests.Parser.Rules.HamlNodeTextContainer_Tests' NHaml.Tests.Walkers.CodeDom.HamlNodeTextContainerWalker_Tests,System.Web.NHaml.IO.HamlLine' System.Web.NHaml.Parser.HamlDocument' System.Web.NHaml.Crosscutting.HtmlStringHelper' System.Web.NHaml.Parser.HamlNode
System.Web.NHaml,System.Web.NHaml.TemplateBase,NHaml.Tests.TemplateBase.HamlDocTypeFactory_Tests' HamlSpec.SpecTestRunner' NHaml.Tests.TemplateBase.Template_Tests' NHaml.Tests.TemplateBase.DummyTemplate' System.Web.NHaml.Compilers.CodeDomClassBuilder' System.Web.NHaml.Compilers.CodeDomTemplateCompiler' System.Web.NHaml.TemplateFactoryFactory' System.Web.NHaml.TemplateFactory' NHaml.Tests.Compilers.CodeDomClassBuilder_Tests' NHaml.Tests.TemplateFactory_Tests' NHaml.Tests.CompiledTemplate_Tests' NHaml.Tests.Walkers.HamlDocumentWalker_Tests,System.Web.NHaml.Crosscutting.Invariant
System.Web.NHaml,System.Web.NHaml.TemplateResolution,NHaml.Tests.Builders.ViewSourceBuilder' System.Web.NHaml.ITemplateEngine' System.Web.NHaml.TemplateFactoryFactory' System.Web.NHaml.ITemplateFactoryFactory' System.Web.NHaml.TemplateEngine' NHaml.Web.Mvc3.NHamlMvcViewEngine' NHaml.Tests.TemplateEngine_Tests' NHaml.Tests.TemplateFactoryFactory_Tests' System.Web.NHaml.Mvc3.MapPathTemplateContentProvider' System.Web.NHaml.Configuration.XmlConfigurator' NHaml.Tests.TemplateResolution.FileViewSource_Tests' System.Web.NHaml.Parser.HamlTreeParser' System.Web.NHaml.Parser.ITreeParser' HamlSpec.SpecTestRunner' NHaml.Tests.Parser.HamlTreeParser_Tests' NHaml.Tests.CompiledTemplate_Tests,System.Web.NHaml.Crosscutting.Invariant
System.Web.NHaml,System.Web.NHaml.Walkers.CodeDom,NHaml.Tests.Walkers.CodeDom.HamlNodeDocTypeWalker_Tests' NHaml.Tests.Walkers.CodeDom.HamlNodeCodeWalker_Tests' NHaml.Tests.Walkers.CodeDom.HamlNodeEvalWalker_Tests' NHaml.Tests.Walkers.CodeDom.HamlNodeHtmlCommentWalker_Tests' NHaml.Tests.Walkers.CodeDom.HamlNodeTextContainerWalker_Tests' NHaml.Tests.Walkers.HamlDocumentWalker_Tests' NHaml.Tests.Walkers.CodeDom.HamlNodeTagWalker_Tests' NHaml.Tests.Walkers.CodeDom.HamlNodeTextVariableWalker_Tests' NHaml.Tests.Walkers.CodeDom.HamlWalkerFactory_Tests' NHaml.Tests.Walkers.CodeDom.DummyWalker' NHaml.Tests.Walkers.CodeDom.HamlNodeHtmlAttributeCollectionWalker_Tests,System.Web.NHaml.Compilers.ITemplateClassBuilder' System.Web.NHaml.Parser.Rules.HamlNodeDocType' System.Web.NHaml.Parser.HamlNode' System.Web.NHaml.Parser.Rules.HamlNodeCode' System.Web.NHaml.Parser.Rules.HamlNodeEval' System.Web.NHaml.Parser.Rules.HamlNodeHtmlComment' System.Web.NHaml.Parser.HamlDocument' System.Web.NHaml.Parser.Rules.HamlNodeTag' System.Web.NHaml.Parser.Rules.HamlNodeHtmlAttributeCollection' System.Web.NHaml.Parser.Rules.HamlNodeHtmlAttribute' System.Web.NHaml.Parser.Rules.HamlNodeTagClass' System.Web.NHaml.Parser.Rules.HamlNodeTextContainer' System.Web.NHaml.Parser.Rules.HamlNodeTagId' System.Web.NHaml.Parser.Rules.WhitespaceRemoval' System.Web.NHaml.Parser.Rules.HamlNodeTextLiteral' System.Web.NHaml.Parser.Rules.HamlNodeTextVariable' System.Web.NHaml.Crosscutting.Invariant' System.Web.NHaml.Parser.Rules.HamlNodeHamlComment' System.Web.NHaml.Parser.Rules.HamlNodePartial
System.Web.NHaml,System.Web.NHaml.Walkers.Exceptions,,
System.Web.NHaml,System.Web.NHaml.Parser.Exceptions,,
System.Web.NHaml,System.Web.NHaml.Crosscutting,System.Web.NHaml.Parser.Rules.HamlNodeHtmlAttribute' System.Web.NHaml.Parser.Rules.HamlNodeHtmlAttributeCollection' System.Web.NHaml.Parser.Rules.HamlNodeTag' System.Web.NHaml.TemplateEngine' System.Web.NHaml.TemplateBase.Template' System.Web.NHaml.TemplateResolution.FileTemplateContentProvider' System.Web.NHaml.Walkers.CodeDom.HamlNodeWalker' NHaml.Web.Mvc3.NHamlMvcView<TModel>' NHaml.Tests.Crosscutting.Invariant_Tests,
System.Web.NHaml,System.Web.NHaml.Parser,NHaml.Tests.Parser.HamlNodeFactory_Tests' System.Web.NHaml.TemplateFactoryFactory' System.Web.NHaml.Parser.Rules.HamlNodePartial' System.Web.NHaml.Walkers.CodeDom.HamlDocumentWalker' System.Web.NHaml.Walkers.IDocumentWalker' NHaml.Tests.Builders.HamlDocumentBuilder' NHaml.Tests.Parser.HamlTreeParser_Tests' NHaml.Tests.TemplateFactoryFactory_Tests' NHaml.Tests.CompiledTemplate_Tests' NHaml.Tests.Walkers.CodeDom.HamlNodeTextContainerWalker_Tests' NHaml.Tests.Walkers.CodeDom.HamlNodeWalker_Tests' NHaml.Tests.Walkers.HamlDocumentWalker_Tests' System.Web.NHaml.Compilers.CodeDomClassBuilder' System.Web.NHaml.Parser.Rules.HamlNodeTextContainer' System.Web.NHaml.Walkers.CodeDom.HamlNodeDocTypeWalker' System.Web.NHaml.Walkers.CodeDom.HamlNodeCodeWalker' System.Web.NHaml.Walkers.CodeDom.HamlNodeEvalWalker' System.Web.NHaml.Walkers.CodeDom.HamlNodeHamlCommentWalker' System.Web.NHaml.Walkers.CodeDom.HamlNodeHtmlCommentWalker' System.Web.NHaml.Walkers.CodeDom.HamlNodeTagWalker' System.Web.NHaml.Walkers.CodeDom.HamlNodeTextContainerWalker' System.Web.NHaml.Walkers.CodeDom.HamlNodeTextLiteralWalker' System.Web.NHaml.Walkers.CodeDom.HamlNodeTextVariableWalker' System.Web.NHaml.Walkers.CodeDom.HamlNodeWalker' System.Web.NHaml.Walkers.CodeDom.HamlNodeHtmlAttributeCollectionWalker' NHaml.Tests.Mocks.ClassBuilderMock' NHaml.Tests.Parser.HamlNode_Tests' NHaml.Tests.Parser.Rules.HamlNodeHtmlAttributeCollection_Tests' NHaml.Tests.Parser.Rules.HamlNodeHtmlAttribute_Tests' NHaml.Tests.Parser.Rules.HamlNodeTag_Tests' NHaml.Tests.Parser.Rules.HamlNodeTextContainer_Tests' System.Web.NHaml.IO.HamlLineLexer' System.Web.NHaml.IO.HamlRuleFactory' System.Web.NHaml.IO.HamlLine' NHaml.Tests.IO.HamlRuleFactory_Tests' NHaml.Tests.IO.HamlLine_Tests' NHaml.Tests.Parser.Rules.HamlNodeHtmlComment_Tests' NHaml.Tests.Walkers.CodeDom.HamlNodeDocTypeWalker_Tests' NHaml.Tests.Walkers.CodeDom.HamlNodeCodeWalker_Tests' NHaml.Tests.Walkers.CodeDom.HamlNodeEvalWalker_Tests' NHaml.Tests.Walkers.CodeDom.HamlNodeHtmlCommentWalker_Tests' NHaml.Tests.Walkers.CodeDom.HamlNodeTagWalker_Tests,System.Web.NHaml.IO.HamlLine' System.Web.NHaml.Parser.Rules.HamlNodeTextContainer' System.Web.NHaml.Parser.Rules.HamlNodeTag' System.Web.NHaml.Parser.Rules.HamlNodeHamlComment' System.Web.NHaml.Parser.Rules.HamlNodeHtmlComment' System.Web.NHaml.Parser.Rules.HamlNodeEval' System.Web.NHaml.Parser.Rules.HamlNodeCode' System.Web.NHaml.Parser.Rules.HamlNodeDocType' System.Web.NHaml.Parser.Rules.HamlNodePartial' System.Web.NHaml.Parser.Rules.WhitespaceRemoval' System.Web.NHaml.IO.HamlFileLexer' System.Web.NHaml.TemplateResolution.ViewSource' System.Web.NHaml.IO.HamlFile
System.Web.NHaml,System.Web.NHaml.Walkers,System.Web.NHaml.TemplateFactoryFactory' NHaml.Tests.CompiledTemplate_Tests,System.Web.NHaml.Parser.HamlDocument
