Project,Namespace,Ca types,Ce types
Hap,Hap.Commands,Hap.Helpers.Commands.Convert.ConvertFromTableCommand' Hap.Helpers.Commands.Import.ImportHtmlPageCommand,Hap.CommonCmdletBase' Hap.Helpers.Commands.Convert.ConvertFromTableCommand' Hap.Helpers.Commands.Convert.ConvertFromTableCommand' Hap.CommonCmdletBase' Hap.Helpers.Commands.Import.ImportHtmlPageCommand' Hap.Helpers.Commands.Import.ImportHtmlPageCommand
Hap,Hap.Helpers.Commands.Convert,Hap.Commands.ConvertFromHapTableCommand,Hap.Commands.ConvertFromHapTableCommand' Hap.Helpers.Commands.HapCommand' Hap.CommonCmdletBase' Hap.FromHtmlNodeToCsvConverter' Hap.SmartString' Hap.Commands.ConvertFromHapTableCommand' Hap.Helpers.Commands.HapCommand' Hap.CommonCmdletBase' Hap.FromHtmlNodeToCsvConverter' Hap.SmartString
Hap,Hap.Helpers.Commands,Hap.Helpers.Commands.Convert.ConvertFromTableCommand' Hap.Helpers.Commands.Import.ImportHtmlPageCommand,Hap.CommonCmdletBase' Hap.CommonCmdletBase
Hap,Hap.Helpers.Commands.Import,Hap.Commands.ImportHapHtmlPageCommand,Hap.Commands.ImportHapHtmlPageCommand' Hap.Helpers.Commands.HapCommand' Hap.CommonCmdletBase' Hap.PageImporter' Hap.PageImporterData' Hap.Commands.ImportHapHtmlPageCommand' Hap.Helpers.Commands.HapCommand' Hap.CommonCmdletBase' Hap.PageImporter' Hap.PageImporterData
Hap,Hap,Hap.Commands.ConvertFromHapTableCommand' Hap.Commands.ConvertFromHapHtmlPageCommand' Hap.Helpers.Commands.Import.ImportHtmlPageCommand' Hap.Helpers.Commands.Convert.ConvertFromTableCommand' Hap.Commands.ImportHapHtmlPageCommand' Hap.Helpers.Commands.HapCommand,
