Project,Namespace,Ca types,Ce types
Coevery.Translations,Coevery.Translations.Controllers,,Coevery.Translations.Helpers.LocalizationHelpers' Coevery.Translations.Permissions' Coevery.Translations.Services.ILocalizationService' Coevery.Translations.Models.LocalizableStringRecord' Coevery.Translations.Models.StringEntry' Coevery.Translations.Services.ILocalizationManagementService' Coevery.Translations.ViewModels.TranslationViewModel' Coevery.Translations.ViewModels.CultureGroupDetailsViewModel
Coevery.Translations,Coevery.Translations.Helpers,Coevery.Translations.Controllers.SystemAdminController' Coevery.Translations.Controllers.CultureController,Coevery.Translations.ViewModels.TranslationViewModel' Coevery.Translations.ViewModels.CultureGroupDetailsViewModel
Coevery.Translations,Coevery.Translations,Coevery.Translations.Controllers.TranslationController' Coevery.Translations.Controllers.CultureController' Coevery.Translations.Controllers.SystemAdminController,Coevery.Translations.Models.LocalizableStringRecord' Coevery.Translations.Models.TranslationRecord
Coevery.Translations,Coevery.Translations.Models,Coevery.Translations.Controllers.SystemAdminController' Coevery.Translations.Migrations' Coevery.Translations.Services.LocalizationService' Coevery.Translations.Services.ILocalizationService' Coevery.Translations.Services.ILocalizationManagementService' Coevery.Translations.Services.LocalizationManagementService,
Coevery.Translations,Coevery.Translations.Services,Coevery.Translations.Controllers.SystemAdminController' Coevery.Translations.Controllers.TranslationController' Coevery.Translations.Controllers.CultureController,Coevery.Translations.Models.StringEntry' Coevery.Translations.Models.StringEntryEqualityComparer' Coevery.Translations.ViewModels.CultureDetailsViewModel' Coevery.Translations.ViewModels.CultureGroupDetailsViewModel' Coevery.Translations.ViewModels.CultureIndexViewModel' Coevery.Translations.Models.LocalizableStringRecord' Coevery.Translations.Models.TranslationRecord' Coevery.Translations.ViewModels.TranslationViewModel' Coevery.Translations.ViewModels.TranslationGroupViewModel' Coevery.Translations.ViewModels.TranslationGroup' Coevery.Translations.ViewModels.CultureTranslationState
Coevery.Translations,Coevery.Translations.ViewModels,Coevery.Translations.Services.ILocalizationService' Coevery.Translations.Services.LocalizationService' Coevery.Translations.Helpers.LocalizationHelpers' Coevery.Translations.Controllers.SystemAdminController,
