Project,Namespace,Ca types,Ce types
SassyStudio.Compiler,SassyStudio.Compiler,SassyStudio.Compiler.Parsing.ImportFile' SassyStudio.Compiler.Parsing.FileReferenceTag' SassyStudio.Compiler.Parsing.IParser' SassyStudio.Compiler.Lexing.ILexer' SassyStudio.Compiler.Parsing.DocumentParser' SassyStudio.Compiler.Parsing.TokenStream' SassyStudio.Compiler.Lexing.Lexer' SassyStudio.Compiler.Parsing.Parser' SassyStudio.Compiler.Parsing.MixinReference' SassyStudio.Compiler.Parsing.UserFunctionReference' SassyStudio.Compiler.Parsing.VariableReference,SassyStudio.Compiler.Parsing.StringValue' SassyStudio.Compiler.Parsing.BlockItem' SassyStudio.Compiler.Parsing.MixinDefinition' SassyStudio.Compiler.Parsing.SassImportDirective' SassyStudio.Compiler.Parsing.UserFunctionDefinition
SassyStudio.Compiler,SassyStudio.Compiler.Parsing,SassyStudio.Compiler.Parsing.Rules.KeyframesDirective' SassyStudio.Compiler.Parsing.Rules.KeyframeSelector' SassyStudio.Compiler.Parsing.Rules.KeyframeRuleBlock' SassyStudio.Compiler.ReverseSearch' SassyStudio.Compiler.Parsing.Selectors.ClassSelector' SassyStudio.Compiler.Parsing.Selectors.PseduoFunction' SassyStudio.Compiler.Parsing.Selectors.PseudoFunctionSelector' SassyStudio.Compiler.Parsing.Selectors.IdSelector' SassyStudio.Compiler.Parsing.Selectors.ExtendOnlySelector' SassyStudio.Compiler.Parsing.Selectors.AttributeSelector' SassyStudio.Compiler.Parsing.Selectors.StringInterpolationSelector' SassyStudio.Compiler.Parsing.Selectors.PseudoClassSelector' SassyStudio.Compiler.Parsing.Selectors.PseudoElementSelector' SassyStudio.Compiler.Parsing.Selectors.UniversalSelector' SassyStudio.Compiler.Parsing.Selectors.TypeSelector' SassyStudio.Compiler.Parsing.Selectors.ParentReferenceSelector' SassyStudio.Compiler.ImportResolver,SassyStudio.Compiler.IParsingExecutionContext' SassyStudio.Compiler.Lexing.ILexer' SassyStudio.Compiler.Lexing.ILexingContext' SassyStudio.Compiler.Lexing.TextStream' SassyStudio.Compiler.Lexing.TokenList' SassyStudio.Compiler.Lexing.ILexerFactory' SassyStudio.Compiler.Parsing.Selectors.AttributeSelector' SassyStudio.Compiler.Parsing.Selectors.ClassSelector' SassyStudio.Compiler.Parsing.Selectors.ExtendOnlySelector' SassyStudio.Compiler.Parsing.Selectors.IdSelector' SassyStudio.Compiler.Parsing.Selectors.ParentReferenceSelector' SassyStudio.Compiler.Parsing.Selectors.PseudoFunctionSelector' SassyStudio.Compiler.Parsing.Selectors.PseudoClassSelector' SassyStudio.Compiler.Parsing.Selectors.PseudoElementSelector' SassyStudio.Compiler.Parsing.Selectors.TypeSelector' SassyStudio.Compiler.Parsing.Selectors.UniversalSelector' SassyStudio.Compiler.ImportResolver' SassyStudio.Compiler.Parsing.Rules.KeyframesDirective' SassyStudio.Compiler.Parsing.Selectors.AdjacentSiblingCombinator' SassyStudio.Compiler.Parsing.Selectors.ChildCombinator' SassyStudio.Compiler.Parsing.Selectors.GeneralSiblingCombinator' SassyStudio.Compiler.Parsing.Selectors.StringInterpolationSelector' SassyStudio.Compiler.ReverseSearch' SassyStudio.Compiler.Parsing.Selectors.DescendantCombinator' SassyStudio.Compiler.Parsing.Selectors.SelectorCombinator
SassyStudio.Compiler,SassyStudio.Compiler.Lexing,SassyStudio.Compiler.Parsing.DocumentParser' SassyStudio.Compiler.Parsing.Parser' SassyStudio.Compiler.Parsing.DocumentParserFactory' SassyStudio.Compiler.Parsing.DefaultParserFactory' SassyStudio.Compiler.Parsing.TokenStream,SassyStudio.Compiler.IParsingExecutionContext
SassyStudio.Compiler,SassyStudio.Compiler.Parsing.Rules,SassyStudio.Compiler.Parsing.ItemFactory,SassyStudio.Compiler.Parsing.BlockItem' SassyStudio.Compiler.Parsing.AtRuleDirective' SassyStudio.Compiler.Parsing.PercentageUnit' SassyStudio.Compiler.Parsing.RuleBlock
SassyStudio.Compiler,SassyStudio.Compiler.Parsing.Selectors,SassyStudio.Compiler.Parsing.SimpleSelector' SassyStudio.Compiler.Parsing.ItemFactory' SassyStudio.Compiler.Parsing.DefaultSassItemFactory' SassyStudio.Compiler.Parsing.PageDirective,SassyStudio.Compiler.Parsing.SimpleSelector' SassyStudio.Compiler.Parsing.StringValue' SassyStudio.Compiler.Parsing.ClassName' SassyStudio.Compiler.Parsing.PlaceholderSelectorName' SassyStudio.Compiler.Parsing.IdName' SassyStudio.Compiler.Parsing.Function' SassyStudio.Compiler.Parsing.StringInterpolation
