Project,Namespace,Ca types,Ce types
Newtonsoft.Json.Net20,Newtonsoft.Json.Bson,Newtonsoft.Json.Converters.BsonObjectIdConverter' Newtonsoft.Json.Converters.RegexConverter,Newtonsoft.Json.Utilities.MathUtils' Newtonsoft.Json.JsonConvert' Newtonsoft.Json.Utilities.ValidationUtils' Newtonsoft.Json.ReadType' Newtonsoft.Json.JsonReaderException' Newtonsoft.Json.JsonToken' Newtonsoft.Json.JsonReader' Newtonsoft.Json.State' Newtonsoft.Json.JsonWriter' Newtonsoft.Json.JsonWriterException
Newtonsoft.Json.Net20,Newtonsoft.Json,Newtonsoft.Json.Serialization.JsonSerializerInternalReader' Newtonsoft.Json.Linq.JToken' Newtonsoft.Json.Schema.JsonSchema' Newtonsoft.Json.Serialization.DefaultContractResolver' Newtonsoft.Json.Serialization.JsonTypeReflector' Newtonsoft.Json.Serialization.JsonSerializerInternalWriter' Newtonsoft.Json.Schema.JsonSchemaGenerator' Newtonsoft.Json.Linq.JContainer' Newtonsoft.Json.Linq.JTokenReader' Newtonsoft.Json.Serialization.JsonContainerContract' Newtonsoft.Json.Schema.Extensions' Newtonsoft.Json.Bson.BsonReader' Newtonsoft.Json.Serialization.JsonContract' Newtonsoft.Json.Linq.JRaw' Newtonsoft.Json.Bson.BsonWriter' Newtonsoft.Json.Linq.JConstructor' Newtonsoft.Json.Linq.JObject' Newtonsoft.Json.Linq.JArray' Newtonsoft.Json.Linq.JProperty' Newtonsoft.Json.Schema.JsonSchemaBuilder' Newtonsoft.Json.Linq.JValue' Newtonsoft.Json.Converters.BinaryConverter' Newtonsoft.Json.Converters.BsonObjectIdConverter' Newtonsoft.Json.Converters.CustomCreationConverter<T>' Newtonsoft.Json.Converters.DataSetConverter' Newtonsoft.Json.Converters.DataTableConverter' Newtonsoft.Json.Converters.KeyValuePairConverter' Newtonsoft.Json.Converters.RegexConverter' Newtonsoft.Json.Converters.StringEnumConverter' Newtonsoft.Json.Converters.VersionConverter' Newtonsoft.Json.Converters.IsoDateTimeConverter' Newtonsoft.Json.Converters.JavaScriptDateTimeConverter' Newtonsoft.Json.Converters.XmlNodeConverter' Newtonsoft.Json.Serialization.JsonSerializerProxy' Newtonsoft.Json.Bson.BsonBinaryWriter' Newtonsoft.Json.Linq.JTokenWriter' Newtonsoft.Json.Serialization.JsonFormatterConverter' Newtonsoft.Json.Serialization.JsonSerializerInternalBase' Newtonsoft.Json.Schema.JsonSchemaWriter,System.Runtime.Serialization.Formatters.FormatterAssemblyStyle' Newtonsoft.Json.Schema.JsonSchema' Newtonsoft.Json.Schema.JsonSchemaModel' Newtonsoft.Json.Schema.JsonSchemaException' Newtonsoft.Json.Utilities.ValidationUtils' Newtonsoft.Json.Linq.JToken' Newtonsoft.Json.Schema.JsonSchemaGenerator' Newtonsoft.Json.Schema.JsonSchemaType' Newtonsoft.Json.Schema.JsonSchemaModelBuilder' Newtonsoft.Json.Linq.JTokenType' Newtonsoft.Json.Utilities.LinqBridge.Enumerable' Newtonsoft.Json.Utilities.StringBuffer' Newtonsoft.Json.Utilities.StringReference' Newtonsoft.Json.Utilities.StringUtils' Newtonsoft.Json.Utilities.Base64Encoder' Newtonsoft.Json.Utilities.JavaScriptUtils' Newtonsoft.Json.Utilities.ConvertUtils' Newtonsoft.Json.Utilities.ReflectionUtils' Newtonsoft.Json.Converters.XmlNodeConverter' Newtonsoft.Json.Serialization.IContractResolver' Newtonsoft.Json.Serialization.IReferenceResolver' Newtonsoft.Json.Serialization.DefaultSerializationBinder' Newtonsoft.Json.Utilities.CollectionUtils' Newtonsoft.Json.Serialization.JsonSerializerInternalReader' Newtonsoft.Json.Serialization.JsonSerializerInternalWriter' Newtonsoft.Json.Serialization.ErrorEventArgs' Newtonsoft.Json.Utilities.EnumUtils' Newtonsoft.Json.Utilities.MiscellaneousUtils
Newtonsoft.Json.Net20,Newtonsoft.Json.Converters,Newtonsoft.Json.JsonConvert,Newtonsoft.Json.JsonWriter' Newtonsoft.Json.JsonSerializer' Newtonsoft.Json.Utilities.ReflectionUtils' Newtonsoft.Json.JsonReader' Newtonsoft.Json.JsonToken' Newtonsoft.Json.JsonSerializationException' Newtonsoft.Json.Bson.BsonObjectId' Newtonsoft.Json.Bson.BsonWriter' Newtonsoft.Json.Serialization.DefaultContractResolver' Newtonsoft.Json.NullValueHandling' Newtonsoft.Json.Bson.BsonReader' Newtonsoft.Json.Utilities.StringUtils' Newtonsoft.Json.Utilities.ConvertUtils' Newtonsoft.Json.JsonConvert' Newtonsoft.Json.Utilities.CollectionUtils' Newtonsoft.Json.Utilities.MiscellaneousUtils' Newtonsoft.Json.Utilities.DateTimeUtils
Newtonsoft.Json.Net20,Newtonsoft.Json.Linq,Newtonsoft.Json.Serialization.JsonSerializerInternalReader' Newtonsoft.Json.JsonValidatingReader' Newtonsoft.Json.Serialization.DefaultContractResolver' Newtonsoft.Json.Serialization.JsonFormatterConverter' Newtonsoft.Json.Serialization.JsonSerializerInternalWriter' Newtonsoft.Json.Schema.Extensions' Newtonsoft.Json.Schema.JsonSchemaWriter' Newtonsoft.Json.Schema.JsonSchemaBuilder' Newtonsoft.Json.Schema.JsonSchemaGenerator' Newtonsoft.Json.SchemaScope,Newtonsoft.Json.Utilities.ValidationUtils' Newtonsoft.Json.JsonTextWriter' Newtonsoft.Json.JsonReader' Newtonsoft.Json.Utilities.ReflectionUtils' Newtonsoft.Json.JsonWriter' Newtonsoft.Json.JsonConverter' Newtonsoft.Json.JsonToken' Newtonsoft.Json.JsonReaderException' Newtonsoft.Json.IJsonLineInfo' Newtonsoft.Json.JsonSerializer' Newtonsoft.Json.State' Newtonsoft.Json.ReadType' Newtonsoft.Json.Utilities.MiscellaneousUtils' Newtonsoft.Json.JsonConvert' Newtonsoft.Json.Formatting' Newtonsoft.Json.Utilities.MathUtils
Newtonsoft.Json.Net20,Newtonsoft.Json.Serialization,Newtonsoft.Json.Converters.DataSetConverter' Newtonsoft.Json.Converters.DataTableConverter' Newtonsoft.Json.Converters.KeyValuePairConverter' Newtonsoft.Json.JsonSerializer' Newtonsoft.Json.Schema.JsonSchemaGenerator' Newtonsoft.Json.Utilities.ConvertUtils,Newtonsoft.Json.JsonContainerAttribute' Newtonsoft.Json.JsonConverterAttribute' Newtonsoft.Json.Utilities.StringUtils' Newtonsoft.Json.MemberSerialization' Newtonsoft.Json.Utilities.ReflectionUtils' Newtonsoft.Json.JsonObjectAttribute' Newtonsoft.Json.JsonConstructorAttribute' Newtonsoft.Json.JsonConverter' Newtonsoft.Json.Utilities.ReflectionDelegateFactory' Newtonsoft.Json.JsonSerializer' Newtonsoft.Json.JsonConvert' Newtonsoft.Json.Utilities.CollectionUtils' Newtonsoft.Json.Linq.JToken' Newtonsoft.Json.Utilities.ConvertUtils' Newtonsoft.Json.Utilities.LinqBridge.IOrderedEnumerable' Newtonsoft.Json.JsonPropertyAttribute' Newtonsoft.Json.Utilities.ValidationUtils' Newtonsoft.Json.Utilities.DynamicReflectionDelegateFactory' Newtonsoft.Json.Utilities.IWrappedCollection' Newtonsoft.Json.ReadType' Newtonsoft.Json.Utilities.IWrappedDictionary' Newtonsoft.Json.Linq.JValue' Newtonsoft.Json.JsonReader' Newtonsoft.Json.JsonToken' Newtonsoft.Json.JsonSerializationException' Newtonsoft.Json.Linq.JRaw' Newtonsoft.Json.Linq.JTokenWriter' Newtonsoft.Json.TypeNameHandling' Newtonsoft.Json.ObjectCreationHandling' Newtonsoft.Json.NullValueHandling' Newtonsoft.Json.DefaultValueHandling' Newtonsoft.Json.Utilities.MiscellaneousUtils' Newtonsoft.Json.ConstructorHandling' Newtonsoft.Json.JsonPosition' Newtonsoft.Json.MissingMemberHandling' Newtonsoft.Json.Required' Newtonsoft.Json.JsonWriter' Newtonsoft.Json.JsonConverterCollection' Newtonsoft.Json.PreserveReferencesHandling' Newtonsoft.Json.ReferenceLoopHandling' Newtonsoft.Json.WriteState' Newtonsoft.Json.JsonArrayAttribute' Newtonsoft.Json.JsonDictionaryAttribute
Newtonsoft.Json.Net20,Newtonsoft.Json.Utilities.LinqBridge,Newtonsoft.Json.SchemaScope' System.Runtime.CompilerServices.Enumerable' System.Runtime.CompilerServices.Lookup<TKey;TElement>' Newtonsoft.Json.Utilities.ReflectionUtils' Newtonsoft.Json.Serialization.DefaultContractResolver' Newtonsoft.Json.Schema.JsonSchemaNode' System.Runtime.CompilerServices.OrderedEnumerable<T;K>' System.Runtime.CompilerServices.Tuple,
Newtonsoft.Json.Net20,System.Runtime.CompilerServices,,Newtonsoft.Json.Utilities.LinqBridge.ILookup' Newtonsoft.Json.Utilities.LinqBridge.IGrouping' Newtonsoft.Json.Utilities.LinqBridge.IOrderedEnumerable' Newtonsoft.Json.Utilities.LinqBridge.Tuple
Newtonsoft.Json.Net20,Newtonsoft.Json.Schema,Newtonsoft.Json.JsonValidatingReader' Newtonsoft.Json.SchemaScope,Newtonsoft.Json.Linq.JToken' Newtonsoft.Json.Utilities.ValidationUtils' Newtonsoft.Json.JsonValidatingReader' Newtonsoft.Json.Utilities.MathUtils' Newtonsoft.Json.Utilities.LinqBridge.IOrderedEnumerable' Newtonsoft.Json.JsonWriter' Newtonsoft.Json.Utilities.CollectionUtils' Newtonsoft.Json.Utilities.EnumUtils' Newtonsoft.Json.JsonReader' Newtonsoft.Json.JsonTextWriter' Newtonsoft.Json.Formatting' Newtonsoft.Json.JsonToken' Newtonsoft.Json.JsonReaderException' Newtonsoft.Json.Serialization.IContractResolver' Newtonsoft.Json.Required' Newtonsoft.Json.JsonContainerAttribute' Newtonsoft.Json.Serialization.JsonTypeReflector' Newtonsoft.Json.Utilities.ReflectionUtils' Newtonsoft.Json.Serialization.JsonContract' Newtonsoft.Json.JsonConverter' Newtonsoft.Json.JsonArrayAttribute' Newtonsoft.Json.Serialization.JsonContractType' Newtonsoft.Json.Utilities.ConvertUtils' Newtonsoft.Json.DefaultValueHandling' Newtonsoft.Json.Serialization.JsonObjectContract' Newtonsoft.Json.Serialization.JsonProperty' Newtonsoft.Json.NullValueHandling' Newtonsoft.Json.Serialization.JsonISerializableContract
Newtonsoft.Json.Net20,Newtonsoft.Json.Utilities,Newtonsoft.Json.JsonTextWriter' Newtonsoft.Json.Serialization.DynamicValueProvider' Newtonsoft.Json.Serialization.DefaultContractResolver' Newtonsoft.Json.Serialization.JsonArrayContract' Newtonsoft.Json.Serialization.JsonDictionaryContract' Newtonsoft.Json.JsonTextReader' Newtonsoft.Json.JsonReader' Newtonsoft.Json.JsonConvert' Newtonsoft.Json.JsonWriter' Newtonsoft.Json.Converters.StringEnumConverter' Newtonsoft.Json.Serialization.JsonContract' Newtonsoft.Json.Serialization.JsonSerializerInternalReader' Newtonsoft.Json.Serialization.JsonSerializerInternalWriter' Newtonsoft.Json.Schema.JsonSchemaGenerator' Newtonsoft.Json.Converters.XmlNodeConverter' Newtonsoft.Json.Schema.JsonSchemaWriter' Newtonsoft.Json.JsonSerializer' Newtonsoft.Json.Bson.BsonBinaryWriter' Newtonsoft.Json.Linq.JValue' Newtonsoft.Json.Schema.JsonSchemaModel' Newtonsoft.Json.Linq.JTokenReader' Newtonsoft.Json.Converters.BinaryConverter' Newtonsoft.Json.Converters.KeyValuePairConverter' Newtonsoft.Json.Converters.IsoDateTimeConverter' Newtonsoft.Json.Converters.JavaScriptDateTimeConverter' Newtonsoft.Json.Linq.Extensions' Newtonsoft.Json.Serialization.JsonProperty' Newtonsoft.Json.Serialization.JsonTypeReflector' Newtonsoft.Json.Serialization.ReflectionValueProvider' Newtonsoft.Json.Serialization.CamelCasePropertyNamesContractResolver' Newtonsoft.Json.Bson.BsonObjectId' Newtonsoft.Json.Bson.BsonReader' Newtonsoft.Json.Bson.BsonWriter' Newtonsoft.Json.JsonValidatingReader' Newtonsoft.Json.Linq.JPath' Newtonsoft.Json.Linq.JPropertyDescriptor' Newtonsoft.Json.Linq.JConstructor' Newtonsoft.Json.Linq.JContainer' Newtonsoft.Json.Linq.JEnumerable' Newtonsoft.Json.Linq.JObject' Newtonsoft.Json.Linq.JTokenWriter' Newtonsoft.Json.Linq.JToken' Newtonsoft.Json.Linq.JProperty' Newtonsoft.Json.Serialization.JsonFormatterConverter' Newtonsoft.Json.Serialization.JsonPropertyCollection' Newtonsoft.Json.Serialization.JsonSerializerInternalBase' Newtonsoft.Json.Serialization.JsonSerializerProxy' Newtonsoft.Json.Schema.Extensions' Newtonsoft.Json.Schema.ValidationEventArgs' Newtonsoft.Json.Schema.JsonSchema' Newtonsoft.Json.Schema.TypeSchema,Newtonsoft.Json.Serialization.JsonTypeReflector' System.Runtime.Serialization.Formatters.FormatterAssemblyStyle' Newtonsoft.Json.Utilities.LinqBridge.IGrouping
