Project,Namespace,Ca types,Ce types
dnlib,dnlib.DotNet.Writer,dnlib.DotNet.Pdb.Portable.ImportScopeBlobWriter' dnlib.Examples.Example6' dnlib.DotNet.Pdb.Portable.LocalConstantSigBlobWriter' dnlib.DotNet.Pdb.Portable.PortablePdbCustomDebugInfoWriter' dnlib.DotNet.Pdb.Dss.MDEmitter' dnlib.DotNet.Pdb.Dss.SymbolWriter' dnlib.DotNet.Pdb.WindowsPdb.ISymbolWriter2' dnlib.DotNet.Pdb.WindowsPdb.PdbCustomDebugInfoWriter' dnlib.DotNet.Pdb.WindowsPdb.WindowsPdbWriter' dnlib.DotNet.AssemblyDef' dnlib.DotNet.ModuleDef' dnlib.DotNet.ModuleDefMD,dnlib.IO.FileOffset' dnlib.PE.RVA' dnlib.IO.IBinaryReader' dnlib.DotNet.MD.BlobStream' dnlib.IO.IImageStream' dnlib.DotNet.Utils' dnlib.DotNet.RecursionCounter' dnlib.DotNet.GenericArguments' dnlib.DotNet.CustomAttribute' dnlib.DotNet.MethodSig' dnlib.DotNet.MemberRef' dnlib.DotNet.TypeSpec' dnlib.DotNet.GenericInstSig' dnlib.DotNet.TypeSig' dnlib.DotNet.SZArraySig' dnlib.DotNet.CAArgument' dnlib.DotNet.ElementType' dnlib.DotNet.ITypeDefOrRef' dnlib.DotNet.UTF8String' dnlib.DotNet.TypeDefOrRefSig' dnlib.DotNet.TypeRef' dnlib.DotNet.TypeDef' dnlib.DotNet.CANamedArgument' dnlib.DotNet.SerializationType' dnlib.DotNet.FullNameCreator' dnlib.DotNet.IType' dnlib.DotNet.IAssembly' dnlib.DotNet.ICustomAttributeType' dnlib.DotNet.Pdb.IMAGE_DEBUG_DIRECTORY' dnlib.DotNet.ModuleDef' dnlib.DotNet.DeclSecurity' dnlib.DotNet.SecurityAttribute' dnlib.DotNet.MD.HeapType' dnlib.DotNet.MD.HotHeapVersion' dnlib.DotNet.MD.Table' dnlib.DotNet.MD.IRawRow' dnlib.DotNet.MD.TableInfo' dnlib.DotNet.MD.ComImageFlags' dnlib.DotNet.MD.RawConstantRow' dnlib.DotNet.MD.ColumnInfo' dnlib.DotNet.MD.RawModuleRow' dnlib.DotNet.MD.RawTypeRefRow' dnlib.DotNet.MD.RawTypeDefRow' dnlib.DotNet.MD.RawFieldPtrRow' dnlib.DotNet.MD.RawFieldRow' dnlib.DotNet.MD.RawMethodPtrRow' dnlib.DotNet.MD.RawMethodRow' dnlib.DotNet.MD.RawParamPtrRow' dnlib.DotNet.MD.RawParamRow' dnlib.DotNet.MD.RawInterfaceImplRow' dnlib.DotNet.MD.RawMemberRefRow' dnlib.DotNet.MD.RawCustomAttributeRow' dnlib.DotNet.MD.RawFieldMarshalRow' dnlib.DotNet.MD.RawDeclSecurityRow' dnlib.DotNet.MD.RawClassLayoutRow' dnlib.DotNet.MD.RawFieldLayoutRow' dnlib.DotNet.MD.RawStandAloneSigRow' dnlib.DotNet.MD.RawEventMapRow' dnlib.DotNet.MD.RawEventPtrRow' dnlib.DotNet.MD.RawEventRow' dnlib.DotNet.MD.RawPropertyMapRow' dnlib.DotNet.MD.RawPropertyPtrRow' dnlib.DotNet.MD.RawPropertyRow' dnlib.DotNet.MD.RawMethodSemanticsRow' dnlib.DotNet.MD.RawMethodImplRow' dnlib.DotNet.MD.RawModuleRefRow' dnlib.DotNet.MD.RawTypeSpecRow' dnlib.DotNet.MD.RawImplMapRow' dnlib.DotNet.MD.RawFieldRVARow' dnlib.DotNet.MD.RawENCLogRow' dnlib.DotNet.MD.RawENCMapRow' dnlib.DotNet.MD.RawAssemblyRow' dnlib.DotNet.MD.RawAssemblyProcessorRow' dnlib.DotNet.MD.RawAssemblyOSRow' dnlib.DotNet.MD.RawAssemblyRefRow' dnlib.DotNet.MD.RawAssemblyRefProcessorRow' dnlib.DotNet.MD.RawAssemblyRefOSRow' dnlib.DotNet.MD.RawFileRow' dnlib.DotNet.MD.RawExportedTypeRow' dnlib.DotNet.MD.RawManifestResourceRow' dnlib.DotNet.MD.RawNestedClassRow' dnlib.DotNet.MD.RawGenericParamRow' dnlib.DotNet.MD.RawMethodSpecRow' dnlib.DotNet.MD.RawGenericParamConstraintRow' dnlib.DotNet.MarshalType' dnlib.DotNet.NativeType' dnlib.DotNet.FixedSysStringMarshalType' dnlib.DotNet.SafeArrayMarshalType' dnlib.DotNet.FixedArrayMarshalType' dnlib.DotNet.ArrayMarshalType' dnlib.DotNet.CustomMarshalType' dnlib.DotNet.InterfaceMarshalType' dnlib.DotNet.RawMarshalType' dnlib.DotNet.Emit.ExceptionHandler' dnlib.DotNet.Emit.ExceptionHandlerType' dnlib.DotNet.Emit.OpCode' dnlib.DotNet.Emit.Instruction' dnlib.DotNet.Emit.Code' dnlib.DotNet.Emit.FlowControl' dnlib.DotNet.ILogger' dnlib.DotNet.ModuleDefMD' dnlib.DotNet.FieldDef' dnlib.DotNet.MethodDef' dnlib.DotNet.ParamDef' dnlib.DotNet.InterfaceImpl' dnlib.DotNet.IHasConstant' dnlib.DotNet.IHasFieldMarshal' dnlib.DotNet.StandAloneSig' dnlib.DotNet.EventDef' dnlib.DotNet.PropertyDef' dnlib.DotNet.ModuleRef' dnlib.DotNet.IMemberForwarded' dnlib.DotNet.AssemblyDef' dnlib.DotNet.AssemblyRef' dnlib.DotNet.FileDef' dnlib.DotNet.ExportedType' dnlib.DotNet.Resource' dnlib.DotNet.GenericParam' dnlib.DotNet.MethodSpec' dnlib.DotNet.GenericParamConstraint' dnlib.DotNet.Pdb.PdbDocument' dnlib.DotNet.Pdb.PdbScope' dnlib.DotNet.Pdb.PdbLocal' dnlib.DotNet.Pdb.PdbConstant' dnlib.DotNet.Pdb.PdbImportScope' dnlib.DotNet.Pdb.PdbAsyncMethodCustomDebugInfo' dnlib.DotNet.Pdb.PdbIteratorMethodCustomDebugInfo' dnlib.DotNet.Pdb.PdbCustomDebugInfo' dnlib.DotNet.EmbeddedResource' dnlib.DotNet.DummyLogger' dnlib.DotNet.LoggerEvent' dnlib.DotNet.Emit.NativeMethodBody' dnlib.DotNet.MDToken' dnlib.DotNet.VTableFixups' dnlib.DotNet.MD.RawStateMachineMethodRow' dnlib.DotNet.MD.RawCustomDebugInformationRow' dnlib.DotNet.Emit.CilBody' dnlib.DotNet.Pdb.PdbMethod' dnlib.DotNet.MD.RawLocalScopeRow' dnlib.DotNet.Emit.LocalList' dnlib.DotNet.IMDTokenProvider' dnlib.DotNet.FieldSig' dnlib.DotNet.MD.CodedToken' dnlib.DotNet.IResolutionScope' dnlib.DotNet.IMethodDefOrRef' dnlib.DotNet.IMemberRefParent' dnlib.DotNet.IImplementation' dnlib.DotNet.PublicKeyBase' dnlib.DotNet.AssemblyAttributes' dnlib.DotNet.ImplMap' dnlib.DotNet.Constant' dnlib.DotNet.MethodSemanticsAttributes' dnlib.DotNet.MethodOverride' dnlib.DotNet.ClassLayout' dnlib.DotNet.AssemblyLinkedResource' dnlib.DotNet.LinkedResource' dnlib.DotNet.CallingConventionSig' dnlib.DotNet.IHasCustomAttribute' dnlib.DotNet.CustomAttributeCollection' dnlib.DotNet.Pdb.SequencePoint' dnlib.DotNet.MD.RawMethodDebugInformationRow' dnlib.DotNet.Pdb.Portable.SequencePointConstants' dnlib.DotNet.IHasCustomDebugInformation' dnlib.DotNet.Pdb.PdbCustomDebugInfoKind' dnlib.DotNet.Pdb.CustomDebugInfoGuids' dnlib.DotNet.Pdb.Portable.PortablePdbCustomDebugInfoWriter' dnlib.DotNet.Pdb.PdbState' dnlib.DotNet.MD.RawDocumentRow' dnlib.DotNet.MD.RawImportScopeRow' dnlib.DotNet.Pdb.Portable.ImportScopeBlobWriter' dnlib.DotNet.MD.RawLocalVariableRow' dnlib.DotNet.MD.RawLocalConstantRow' dnlib.DotNet.Pdb.Portable.LocalConstantSigBlobWriter' dnlib.DotNet.MD.MDHeaderRuntimeVersion' dnlib.DotNet.Emit.Local' dnlib.DotNet.Emit.OperandType' dnlib.DotNet.IVariable' dnlib.W32Resources.Win32Resources' dnlib.DotNet.StrongNameKey' dnlib.DotNet.StrongNamePublicKey' dnlib.DotNet.ModuleKind' dnlib.PE.Subsystem' dnlib.PE.IPEImage' dnlib.DotNet.MD.IMetaData' dnlib.PE.ImageFileHeader' dnlib.PE.ImageNTHeaders' dnlib.PE.IImageOptionalHeader' dnlib.PE.Characteristics' dnlib.DotNet.PublicKey' dnlib.DotNet.Pdb.PdbFileKind' dnlib.DotNet.StrongNameSigner' dnlib.DotNet.Pdb.WindowsPdb.ISymbolWriter2' dnlib.DotNet.Pdb.WindowsPdb.WindowsPdbWriter' dnlib.DotNet.Pdb.WindowsPdb.SymbolWriterCreator' dnlib.PE.ImageDebugType' dnlib.PE.ImageSectionHeader' dnlib.PE.ImageOptionalHeader64' dnlib.DotNet.MD.ImageCor20Header' dnlib.PE.ImageOptionalHeader32' dnlib.PE.ImageDataDirectory' dnlib.DotNet.VTable' dnlib.DotNet.IMethod' dnlib.PE.DllCharacteristics' dnlib.PE.Machine' dnlib.DotNet.FieldDefMD' dnlib.DotNet.MethodDefMD' dnlib.DotNet.ParamDefMD' dnlib.DotNet.EventDefMD' dnlib.DotNet.PropertyDefMD' dnlib.DotNet.CorLibTypeSig' dnlib.DotNet.ICorLibTypes' dnlib.DotNet.TypeDefMD' dnlib.DotNet.MD.MDTable' dnlib.DotNet.MD.TablesStream' dnlib.DotNet.FieldAttributes' dnlib.DotNet.MethodImplAttributes' dnlib.DotNet.MethodAttributes' dnlib.DotNet.PropertySig' dnlib.DotNet.TypeAttributes' dnlib.DotNet.ArraySig' dnlib.DotNet.GenericSig' dnlib.DotNet.ValueArraySig' dnlib.DotNet.FnPtrSig' dnlib.DotNet.ModifierSig' dnlib.DotNet.ModuleSig' dnlib.DotNet.MethodBaseSig' dnlib.DotNet.LocalSig' dnlib.DotNet.GenericInstMethodSig' dnlib.DotNet.MD.StringsStream' dnlib.DotNet.MD.DotNetTableSizes' dnlib.DotNet.MD.MDStreamFlags' dnlib.DotNet.MD.USStream' dnlib.W32Resources.ResourceDirectory' dnlib.W32Resources.ResourceData' dnlib.W32Resources.ResourceDirectoryEntry' dnlib.W32Resources.ResourceName
dnlib,System.Runtime.CompilerServices,,
dnlib,System.Runtime.ExceptionServices,,
dnlib,dnlib.IO,dnlib.Examples.MyHeap' dnlib.DotNet.MD.CompressedMetaData' dnlib.DotNet.MD.ENCMetaData' dnlib.DotNet.MD.HotStream' dnlib.DotNet.MD.HotStreamCLR20' dnlib.DotNet.MD.HotStreamCLR40' dnlib.DotNet.MD.MetaDataHeader' dnlib.DotNet.MD.TablesStream' dnlib.DotNet.Pdb.Managed.PdbReader' dnlib.DotNet.Writer.BinaryReaderChunk' dnlib.DotNet.Writer.ByteArrayChunk' dnlib.DotNet.Writer.ChunkListBase<T>' dnlib.DotNet.Writer.DebugDirectory' dnlib.DotNet.Writer.HeapBase' dnlib.DotNet.Writer.HotHeap' dnlib.DotNet.Writer.HotPool' dnlib.DotNet.Writer.HotTable' dnlib.DotNet.Writer.IChunk' dnlib.DotNet.Writer.ImageCor20Header' dnlib.DotNet.Writer.ImportAddressTable' dnlib.DotNet.Writer.ImportDirectory' dnlib.DotNet.Writer.MetaData' dnlib.DotNet.Writer.MetaDataHeader' dnlib.DotNet.Writer.MethodBody' dnlib.DotNet.Writer.MethodBodyChunks' dnlib.DotNet.Writer.ModuleWriterBase' dnlib.DotNet.Writer.NetResources' dnlib.DotNet.Writer.PEHeaders' dnlib.DotNet.Writer.RelocDirectory' dnlib.DotNet.Writer.StartupStub' dnlib.DotNet.Writer.StrongNameSignature' dnlib.DotNet.Writer.TablesHeap' dnlib.DotNet.Writer.UniqueChunkList<T>' dnlib.DotNet.Writer.Win32ResourcesChunk' dnlib.PE.IRvaFileOffsetConverter' dnlib.PE.IPEImage' dnlib.PE.IPEType' dnlib.PE.PEImage' dnlib.PE.FilePEType' dnlib.PE.MemoryPEType' dnlib.PE.PEInfo' dnlib.DotNet.CustomAttribute' dnlib.DotNet.CustomAttributeReader' dnlib.DotNet.DeclSecurityReader' dnlib.DotNet.MarshalBlobReader' dnlib.DotNet.ModuleLoader' dnlib.DotNet.SignatureReader' dnlib.DotNet.Emit.DynamicMethodBodyReader' dnlib.DotNet.Emit.MethodBodyReader' dnlib.DotNet.Emit.MethodBodyReaderBase' dnlib.DotNet.MD.ColumnInfo' dnlib.DotNet.Pdb.Managed.PdbAddress' dnlib.DotNet.Pdb.Portable.PortablePdbCustomDebugInfoReader' dnlib.DotNet.Pdb.WindowsPdb.PdbCustomDebugInfoReader' dnlib.DotNet.Resources.ResourceReader' dnlib.DotNet.Writer.NativeModuleWriter' dnlib.DotNet.Writer.OrigSection' dnlib.W32Resources.ResourceData' dnlib.W32Resources.ResourceDirectoryPE' dnlib.W32Resources.Win32ResourcesPE' dnlib.Examples.Example5' dnlib.DotNet.ModuleDefMD' dnlib.DotNet.EmbeddedResource' dnlib.DotNet.VTableFixups' dnlib.DotNet.MD.BlobStream' dnlib.DotNet.MD.DotNetStream' dnlib.DotNet.MD.HeapStream' dnlib.DotNet.MD.GuidStream' dnlib.DotNet.MD.HotHeapStream' dnlib.DotNet.MD.HotHeapStreamCLR20' dnlib.DotNet.MD.HotHeapStreamCLR40' dnlib.DotNet.MD.HotTableStream' dnlib.DotNet.MD.HotTableStreamCLR20' dnlib.DotNet.MD.HotTableStreamCLR40' dnlib.DotNet.MD.ImageCor20Header' dnlib.DotNet.MD.MDTable' dnlib.DotNet.MD.MetaData' dnlib.DotNet.MD.SortedTable' dnlib.DotNet.MD.MetaDataCreator' dnlib.DotNet.MD.PdbStream' dnlib.DotNet.MD.StreamHeader' dnlib.DotNet.MD.StringsStream' dnlib.DotNet.MD.USStream' dnlib.DotNet.Pdb.ManagedSymbolReaderCreator' dnlib.DotNet.Pdb.SymbolReaderCreator' dnlib.DotNet.Pdb.Dss.ImageStreamIStream' dnlib.DotNet.Pdb.Dss.PinnedMetaData' dnlib.DotNet.Pdb.Dss.SymbolReaderCreator' dnlib.DotNet.Pdb.Managed.NumericReader' dnlib.DotNet.Pdb.Managed.DbiDocument' dnlib.DotNet.Pdb.Managed.DbiFunction' dnlib.DotNet.Pdb.Managed.DbiModule' dnlib.DotNet.Pdb.Managed.DbiScope' dnlib.DotNet.Pdb.Managed.DbiVariable' dnlib.DotNet.Pdb.Managed.MsfStream' dnlib.DotNet.Pdb.Managed.SymbolReaderCreator' dnlib.DotNet.Pdb.Portable.DocumentNameReader' dnlib.DotNet.Pdb.Portable.ImportScopeBlobReader' dnlib.DotNet.Pdb.Portable.LocalConstantSigBlobReader' dnlib.DotNet.Pdb.Portable.PortablePdbReader' dnlib.DotNet.Pdb.Portable.SymbolReaderCreator' dnlib.DotNet.Pdb.Portable.SymbolScopeImpl' dnlib.DotNet.Writer.BlobHeap' dnlib.DotNet.Writer.StringsHeap' dnlib.DotNet.Writer.USHeap' dnlib.PE.ImageDebugDirectory' dnlib.PE.PEExtensions' dnlib.PE.ImageDataDirectory' dnlib.PE.ImageDosHeader' dnlib.PE.ImageFileHeader' dnlib.PE.ImageNTHeaders' dnlib.PE.ImageOptionalHeader32' dnlib.PE.ImageOptionalHeader64' dnlib.PE.ImageSectionHeader' dnlib.DotNet.Pdb.ImageStreamUtils,
dnlib,dnlib.PE,dnlib.DotNet.ModuleDef' dnlib.DotNet.ModuleDefMD' dnlib.DotNet.Writer.ModuleWriterOptionsBase' dnlib.DotNet.Writer.NativeModuleWriter' dnlib.DotNet.Writer.PEHeaders' dnlib.DotNet.Writer.PEHeadersOptions' dnlib.DotNet.MD.CompressedMetaData' dnlib.DotNet.MD.MetaDataCreator' dnlib.W32Resources.Win32ResourcesPE' dnlib.DotNet.Pdb.Portable.SymbolReaderCreator' dnlib.DotNet.Pdb.IMAGE_DEBUG_DIRECTORY' dnlib.DotNet.Writer.ModuleWriterBase' dnlib.Examples.Example5' dnlib.DotNet.VTableFixups' dnlib.DotNet.MD.ENCMetaData' dnlib.DotNet.MD.MetaData' dnlib.DotNet.Pdb.Dss.SymbolReaderCreator' dnlib.DotNet.MD.ImageCor20Header' dnlib.DotNet.Writer.OrigSection' dnlib.DotNet.ModuleDefUser' dnlib.DotNet.ModuleDefMD2' dnlib.Examples.MyHeap' dnlib.DotNet.FieldDef' dnlib.DotNet.FieldDefMD' dnlib.DotNet.IMethodDecrypter' dnlib.DotNet.MethodDef' dnlib.DotNet.MethodDefMD' dnlib.DotNet.ModuleLoader' dnlib.DotNet.VTable' dnlib.DotNet.Emit.NativeMethodBody' dnlib.DotNet.MD.TablesStream' dnlib.DotNet.Writer.BinaryReaderChunk' dnlib.DotNet.Writer.ByteArrayChunk' dnlib.DotNet.Writer.ChunkListBase<T>' dnlib.DotNet.Writer.DebugDirectory' dnlib.DotNet.Writer.HeapBase' dnlib.DotNet.Writer.HotHeap' dnlib.DotNet.Writer.HotPool' dnlib.DotNet.Writer.HotTable' dnlib.DotNet.Writer.IChunk' dnlib.DotNet.Writer.ImageCor20Header' dnlib.DotNet.Writer.ImportAddressTable' dnlib.DotNet.Writer.ImportDirectory' dnlib.DotNet.Writer.MetaData' dnlib.DotNet.Writer.MetaDataHeader' dnlib.DotNet.Writer.MethodBody' dnlib.DotNet.Writer.MethodBodyChunks' dnlib.DotNet.Writer.NetResources' dnlib.DotNet.Writer.RelocDirectory' dnlib.DotNet.Writer.StartupStub' dnlib.DotNet.Writer.StrongNameSignature' dnlib.DotNet.Writer.TablesHeap' dnlib.DotNet.Writer.UniqueChunkList<T>' dnlib.DotNet.Writer.Win32ResourcesChunk' dnlib.W32Resources.ResourceDirectoryPE,dnlib.IO.IImageStream' dnlib.IO.FileOffset' dnlib.W32Resources.Win32Resources' dnlib.W32Resources.ResourceData' dnlib.W32Resources.ResourceName' dnlib.IO.IImageStreamCreator' dnlib.Utils.UserValue' dnlib.W32Resources.Win32ResourcesPE' dnlib.IO.MemoryMappedFileStreamCreator' dnlib.IO.UnmanagedMemoryStreamCreator
dnlib,dnlib,,
dnlib,dnlib.Threading,dnlib.DotNet.ModuleDef' dnlib.DotNet.ModuleLoader' dnlib.DotNet.AssemblyDef' dnlib.DotNet.AssemblyDefMD' dnlib.DotNet.Extensions' dnlib.DotNet.AssemblyRef' dnlib.DotNet.AssemblyRefMD' dnlib.DotNet.MethodSig' dnlib.DotNet.PropertySig' dnlib.DotNet.LocalSig' dnlib.DotNet.GenericInstMethodSig' dnlib.DotNet.CustomAttribute' dnlib.DotNet.CAArgument' dnlib.DotNet.CustomAttributeReader' dnlib.DotNet.DeclSecurity' dnlib.DotNet.DeclSecurityUser' dnlib.DotNet.DeclSecurityMD' dnlib.DotNet.DeclSecurityReader' dnlib.DotNet.EventDef' dnlib.DotNet.EventDefMD' dnlib.DotNet.ExportedType' dnlib.DotNet.ExportedTypeMD' dnlib.DotNet.FieldDef' dnlib.DotNet.FieldDefMD' dnlib.DotNet.FileDef' dnlib.DotNet.FileDefMD' dnlib.DotNet.GenericParam' dnlib.DotNet.GenericParamMD' dnlib.DotNet.GenericParamConstraint' dnlib.DotNet.GenericParamConstraintMD' dnlib.DotNet.InterfaceImpl' dnlib.DotNet.InterfaceImplMD' dnlib.DotNet.ManifestResource' dnlib.DotNet.ManifestResourceMD' dnlib.DotNet.MemberRef' dnlib.DotNet.MemberRefMD' dnlib.DotNet.MethodDef' dnlib.DotNet.MethodDefMD' dnlib.DotNet.MethodSpec' dnlib.DotNet.MethodSpecMD' dnlib.DotNet.ModuleDefMD2' dnlib.DotNet.ModuleRef' dnlib.DotNet.ModuleRefMD' dnlib.DotNet.ParamDef' dnlib.DotNet.ParamDefMD' dnlib.DotNet.PropertyDef' dnlib.DotNet.PropertyDefMD' dnlib.DotNet.SecurityAttribute' dnlib.DotNet.SignatureReader' dnlib.DotNet.StandAloneSig' dnlib.DotNet.StandAloneSigMD' dnlib.DotNet.TypeDef' dnlib.DotNet.TypeDefMD' dnlib.DotNet.TypeRef' dnlib.DotNet.TypeRefMD' dnlib.DotNet.GenericInstSig' dnlib.DotNet.ArraySig' dnlib.DotNet.SZArraySig' dnlib.DotNet.TypeSpec' dnlib.DotNet.TypeSpecMD' dnlib.DotNet.VTableFixups' dnlib.DotNet.VTable' dnlib.DotNet.Emit.Instruction' dnlib.DotNet.Emit.CilBody' dnlib.DotNet.Emit.OpCode' dnlib.DotNet.MD.CompressedMetaData' dnlib.DotNet.MD.HotStream' dnlib.DotNet.MD.MetaData' dnlib.DotNet.Pdb.PdbUsingGroupsCustomDebugInfo' dnlib.DotNet.Pdb.PdbStateMachineHoistedLocalScopesCustomDebugInfo' dnlib.DotNet.Pdb.PdbDynamicLocalsCustomDebugInfo' dnlib.DotNet.Pdb.PdbDynamicLocal' dnlib.DotNet.Pdb.PdbTupleElementNamesCustomDebugInfo' dnlib.DotNet.Pdb.PdbTupleElementNames' dnlib.DotNet.Pdb.PortablePdbTupleElementNamesCustomDebugInfo' dnlib.DotNet.Pdb.PdbAsyncMethodSteppingInformationCustomDebugInfo' dnlib.DotNet.Pdb.PdbAsyncMethodCustomDebugInfo,
dnlib,dnlib.Utils,dnlib.W32Resources.ResourceDirectory' dnlib.DotNet.ResourceCollection' dnlib.PE.PEImage' dnlib.W32Resources.Win32ResourcesPE,
dnlib,dnlib.W32Resources,dnlib.DotNet.ModuleDef' dnlib.DotNet.ModuleLoader' dnlib.DotNet.Writer.Win32ResourcesChunk' dnlib.PE.PEExtensions' dnlib.DotNet.ModuleDefMD' dnlib.DotNet.Writer.ModuleWriter' dnlib.DotNet.Writer.ModuleWriterOptionsBase' dnlib.DotNet.Writer.ModuleWriterBase' dnlib.DotNet.Writer.NativeModuleWriter' dnlib.PE.PEImage,dnlib.IO.IBinaryReader' dnlib.Utils.ILazyList' dnlib.PE.RVA' dnlib.IO.MemoryImageStream' dnlib.PE.IRvaFileOffsetConverter' dnlib.IO.IImageStream' dnlib.Utils.UserValue' dnlib.PE.IPEImage' dnlib.PE.IImageOptionalHeader' dnlib.PE.ImageNTHeaders' dnlib.PE.ImageDataDirectory
