Project,Namespace,Ca types,Ce types
dnlib,dnlib.DotNet,dnlib.DotNet.Writer.MetaData' dnlib.Examples.Example3' dnlib.DotNet.Pdb.PdbState' dnlib.DotNet.Writer.ModuleWriterOptionsBase' dnlib.DotNet.Writer.ModuleWriterBase' dnlib.Examples.Example4' dnlib.DotNet.MD.TablesStream' dnlib.DotNet.Pdb.PdbImportAssemblyNamespace' dnlib.DotNet.Pdb.PdbAliasAssemblyReference' dnlib.DotNet.Pdb.PdbAliasAssemblyNamespace' dnlib.DotNet.Pdb.Portable.ImportScopeBlobReader' dnlib.DotNet.Resources.ResourceDataCreator' dnlib.DotNet.Resources.ResourceWriter' dnlib.DotNet.Emit.DynamicMethodBodyReader' dnlib.DotNet.Writer.PreserveTokensMetaData' dnlib.DotNet.Writer.SignatureWriter' dnlib.DotNet.Pdb.Managed.DbiScope' dnlib.DotNet.Pdb.WindowsPdb.WindowsPdbWriter' dnlib.Examples.Example2' dnlib.DotNet.Emit.Instruction' dnlib.DotNet.Emit.MethodBodyReader' dnlib.DotNet.Emit.MethodBodyReaderBase' dnlib.DotNet.Emit.OpCode' dnlib.DotNet.Writer.CustomAttributeWriter' dnlib.DotNet.Writer.DeclSecurityWriter' dnlib.DotNet.Emit.MethodTableToTypeConverter' dnlib.DotNet.Pdb.Portable.LocalConstantSigBlobReader' dnlib.DotNet.Pdb.Portable.LocalConstantSigBlobWriter' dnlib.DotNet.MD.ENCMetaData' dnlib.DotNet.Writer.NormalMetaData' dnlib.DotNet.Writer.ModuleWriter' dnlib.DotNet.Writer.NativeModuleWriter' dnlib.DotNet.Emit.InstructionPrinter' dnlib.DotNet.Writer.MarshalBlobWriter' dnlib.DotNet.Pdb.Dss.SymbolReaderImpl' dnlib.DotNet.Pdb.Dss.SymbolScopeImpl' dnlib.DotNet.Pdb.Managed.PdbReader' dnlib.DotNet.Pdb.Portable.PortablePdbCustomDebugInfoReader' dnlib.DotNet.Pdb.Portable.PortablePdbReader' dnlib.DotNet.Pdb.Portable.SymbolScopeImpl' dnlib.DotNet.Pdb.Symbols.SymbolReader' dnlib.DotNet.Pdb.Symbols.SymbolScope' dnlib.DotNet.Pdb.WindowsPdb.PdbCustomDebugInfoReader' dnlib.DotNet.Emit.Extensions' dnlib.Examples.Example1' dnlib.DotNet.Emit.ExceptionHandler' dnlib.DotNet.Pdb.PdbImportType' dnlib.DotNet.Pdb.PdbAliasType' dnlib.DotNet.Writer.ISignatureWriterHelper' dnlib.DotNet.Pdb.PdbForwardMethodInfoCustomDebugInfo' dnlib.DotNet.Pdb.PdbForwardModuleInfoCustomDebugInfo' dnlib.DotNet.Pdb.WindowsPdb.PdbCustomDebugInfoWriter' dnlib.DotNet.Pdb.WindowsPdb.PdbCustomDebugInfoWriterContext' dnlib.DotNet.Writer.MethodBodyWriterBase' dnlib.Examples.Example6' dnlib.DotNet.MD.CodedToken' dnlib.DotNet.MD.MetaData' dnlib.DotNet.Pdb.Dss.MDEmitter' dnlib.DotNet.Pdb.Portable.ImportScopeBlobWriter' dnlib.DotNet.Pdb.WindowsPdb.PseudoCustomDebugInfoFactory' dnlib.DotNet.Writer.MethodBodyWriter' dnlib.DotNet.Pdb.PdbAsyncStepInfo' dnlib.DotNet.Pdb.PdbIteratorMethodCustomDebugInfo' dnlib.DotNet.Pdb.Dss.SymbolMethodImpl' dnlib.DotNet.Pdb.Managed.DbiFunction' dnlib.DotNet.Pdb.Portable.PortablePdbCustomDebugInfoWriter' dnlib.DotNet.Pdb.Portable.SymbolMethodImpl' dnlib.DotNet.Pdb.Symbols.SymbolMethod' dnlib.DotNet.Pdb.WindowsPdb.CurrentMethod' dnlib.DotNet.Writer.SerializerMethodContext' dnlib.DotNet.Resources.ResourceReader' dnlib.DotNet.Writer.HotHeap' dnlib.DotNet.Writer.ModuleWriterOptions' dnlib.Examples.Example5' dnlib.DotNet.Writer.NativeModuleWriterOptions' dnlib.DotNet.Emit.MethodUtils' dnlib.DotNet.Pdb.PdbStateMachineTypeNameCustomDebugInfo' dnlib.DotNet.Emit.Local' dnlib.DotNet.Pdb.PdbConstant' dnlib.DotNet.MD.StringsStream' dnlib.DotNet.Writer.StringsHeap' dnlib.DotNet.Writer.WriterUtils' dnlib.DotNet.Writer.BlobHeap' dnlib.DotNet.Writer.ByteArrayChunk' dnlib.DotNet.Writer.DebugDirectory' dnlib.DotNet.Writer.HeapBase' dnlib.DotNet.Writer.HotPool20' dnlib.DotNet.Writer.HotPool40' dnlib.DotNet.Writer.HotTable' dnlib.DotNet.Writer.HotTable20' dnlib.DotNet.Writer.HotTable40' dnlib.DotNet.Writer.MetaDataHeader' dnlib.DotNet.Writer.MethodBody' dnlib.DotNet.Writer.NetResources' dnlib.DotNet.Writer.PEHeaders' dnlib.DotNet.Writer.PESection' dnlib.DotNet.Writer.SectionSizes' dnlib.DotNet.Writer.TablesHeap' dnlib.DotNet.Writer.USHeap' dnlib.DotNet.Writer.Win32ResourcesChunk,dnlib.Threading.ThreadSafeListCreator' dnlib.DotNet.Writer.ModuleWriterOptions' dnlib.DotNet.MD.RidList' dnlib.DotNet.MD.IMetaData' dnlib.DotNet.MD.Table' dnlib.DotNet.MD.RawCustomAttributeRow' dnlib.DotNet.MD.TablesStream' dnlib.DotNet.MD.MDTable' dnlib.DotNet.MD.StringsStream' dnlib.DotNet.MD.BlobStream' dnlib.IO.IBinaryReader' dnlib.IO.MemoryImageStream' dnlib.IO.IImageStream' dnlib.PE.RVA' dnlib.DotNet.Emit.MethodBody' dnlib.DotNet.Emit.CilBody' dnlib.DotNet.Emit.Local' dnlib.DotNet.Emit.OpCode' dnlib.DotNet.Emit.Instruction' dnlib.DotNet.Emit.OperandType' dnlib.DotNet.Emit.ExceptionHandler' dnlib.DotNet.Pdb.PdbImplType' dnlib.PE.Characteristics' dnlib.PE.DllCharacteristics' dnlib.DotNet.Pdb.PdbState' dnlib.W32Resources.Win32Resources' dnlib.DotNet.MD.ComImageFlags' dnlib.DotNet.Writer.ModuleWriter' dnlib.W32Resources.ResourceData' dnlib.W32Resources.ResourceName' dnlib.DotNet.Pdb.PdbFileKind' dnlib.PE.Machine' dnlib.Threading.ICancellationToken' dnlib.DotNet.MD.CodedToken' dnlib.DotNet.MD.MDHeaderRuntimeVersion' dnlib.DotNet.MD.GuidStream' dnlib.DotNet.MD.MetaData' dnlib.DotNet.MD.RandomRidList' dnlib.PE.IPEImage' dnlib.PE.ImageDataDirectory' dnlib.DotNet.MD.ImageCor20Header' dnlib.DotNet.MD.MetaDataCreator' dnlib.PE.ImageLayout' dnlib.PE.ImageFileHeader' dnlib.PE.ImageNTHeaders' dnlib.PE.IImageOptionalHeader' dnlib.DotNet.Pdb.Symbols.SymbolReader' dnlib.DotNet.Pdb.SymbolReaderCreator' dnlib.PE.Subsystem' dnlib.DotNet.MD.RawFieldMarshalRow' dnlib.DotNet.Emit.MethodBodyReader' dnlib.DotNet.MD.RawManifestResourceRow' dnlib.DotNet.Emit.NativeMethodBody' dnlib.DotNet.MD.USStream' dnlib.DotNet.Writer.NativeModuleWriter' dnlib.DotNet.Writer.NativeModuleWriterOptions' dnlib.DotNet.MD.RawFieldRow' dnlib.DotNet.MD.RawMethodRow' dnlib.DotNet.MD.RawMemberRefRow' dnlib.DotNet.MD.RawConstantRow' dnlib.DotNet.MD.RawDeclSecurityRow' dnlib.DotNet.MD.RawStandAloneSigRow' dnlib.DotNet.MD.RawPropertyRow' dnlib.DotNet.MD.RawTypeSpecRow' dnlib.DotNet.MD.RawAssemblyRow' dnlib.DotNet.MD.RawAssemblyRefRow' dnlib.DotNet.MD.RawFileRow' dnlib.DotNet.MD.RawMethodSpecRow' dnlib.DotNet.Pdb.PdbMethod' dnlib.W32Resources.ResourceDirectory' dnlib.Utils.IListListener' dnlib.DotNet.Emit.OpCodes
dnlib,dnlib.DotNet.Emit,dnlib.DotNet.Writer.MaxStackCalculator' dnlib.DotNet.Writer.MethodBodyWriterBase' dnlib.DotNet.MemberFinder' dnlib.DotNet.ModuleLoader' dnlib.DotNet.Writer.MethodBodyWriter' dnlib.DotNet.Pdb.StateMachineHoistedLocalScope' dnlib.DotNet.Pdb.PdbTupleElementNames' dnlib.DotNet.Pdb.PdbAsyncStepInfo' dnlib.DotNet.Pdb.PdbState' dnlib.DotNet.Pdb.Portable.PortablePdbCustomDebugInfoReader' dnlib.DotNet.Pdb.Portable.PortablePdbCustomDebugInfoWriter' dnlib.DotNet.Pdb.Portable.PortablePdbReader' dnlib.DotNet.Pdb.WindowsPdb.PdbCustomDebugInfoReader' dnlib.DotNet.Pdb.WindowsPdb.PdbCustomDebugInfoWriter' dnlib.DotNet.Pdb.WindowsPdb.PseudoCustomDebugInfoFactory' dnlib.DotNet.Pdb.WindowsPdb.WindowsPdbWriter' dnlib.DotNet.Pdb.WindowsPdb.SequencePointHelper' dnlib.DotNet.Pdb.WindowsPdb.CurrentMethod' dnlib.DotNet.Writer.MetaData' dnlib.DotNet.Writer.SerializerMethodContext' dnlib.Examples.Example2' dnlib.DotNet.Pdb.PdbDynamicLocal' dnlib.DotNet.Pdb.PdbLocal' dnlib.DotNet.IMethodDecrypter' dnlib.DotNet.MethodDef' dnlib.DotNet.MethodDefMD' dnlib.DotNet.ModuleDefMD' dnlib.Examples.Example3' dnlib.Examples.Example4' dnlib.DotNet.TypeDef' dnlib.DotNet.Pdb.Dss.SymbolReaderImpl' dnlib.DotNet.Pdb.Dss.SymbolMethodImpl' dnlib.DotNet.Pdb.Managed.DbiFunction' dnlib.DotNet.Pdb.Managed.PdbReader' dnlib.DotNet.Pdb.Portable.SymbolMethodImpl' dnlib.DotNet.Pdb.Symbols.SymbolMethod,dnlib.DotNet.Pdb.SequencePoint' dnlib.DotNet.IMDTokenProvider' dnlib.DotNet.ModuleDef' dnlib.DotNet.Importer' dnlib.DotNet.GenericParamContext' dnlib.DotNet.MethodDef' dnlib.DotNet.ImporterOptions' dnlib.IO.MemoryImageStream' dnlib.DotNet.LocalSig' dnlib.DotNet.SignatureReader' dnlib.DotNet.MethodDefUser' dnlib.DotNet.TypeSig' dnlib.DotNet.MethodSig' dnlib.DotNet.ParameterList' dnlib.DotNet.MethodImplAttributes' dnlib.DotNet.MethodAttributes' dnlib.DotNet.ICorLibTypes' dnlib.DotNet.CorLibTypeSig' dnlib.IO.IBinaryReader' dnlib.DotNet.IField' dnlib.DotNet.IMethod' dnlib.DotNet.ITokenOperand' dnlib.DotNet.ITypeDefOrRef' dnlib.DotNet.CallingConventionSig' dnlib.DotNet.MD.CodedToken' dnlib.DotNet.MDToken' dnlib.DotNet.MD.Table' dnlib.Threading.ThreadSafeListCreator' dnlib.DotNet.MemberRef' dnlib.DotNet.Parameter' dnlib.DotNet.ElementType' dnlib.DotNet.IFullName' dnlib.DotNet.FullNameCreator' dnlib.DotNet.Pdb.PdbLocalAttributes' dnlib.PE.RVA' dnlib.DotNet.Pdb.PdbMethod' dnlib.DotNet.StandAloneSig' dnlib.DotNet.IVariable
dnlib,dnlib.DotNet.MD,dnlib.DotNet.AssemblyDefMD' dnlib.DotNet.AssemblyRefMD' dnlib.DotNet.ConstantMD' dnlib.DotNet.CustomAttributeReader' dnlib.DotNet.DeclSecurityMD' dnlib.DotNet.DeclSecurityReader' dnlib.DotNet.FileDefMD' dnlib.DotNet.MarshalBlobReader' dnlib.DotNet.ModuleDefMD' dnlib.DotNet.Pdb.Portable.DocumentNameReader' dnlib.DotNet.Pdb.Portable.ImportScopeBlobReader' dnlib.DotNet.Pdb.Portable.PortablePdbReader' dnlib.DotNet.Pdb.Portable.SymbolScopeImpl' dnlib.DotNet.Writer.BlobHeap' dnlib.DotNet.ModuleDef' dnlib.DotNet.Emit.DynamicMethodBodyReader' dnlib.DotNet.Pdb.Portable.LocalConstantSigBlobWriter' dnlib.DotNet.Writer.MetaData' dnlib.DotNet.Writer.MDTableWriter' dnlib.DotNet.ModuleDefUser' dnlib.DotNet.ModuleDefMD2' dnlib.DotNet.Writer.Cor20HeaderOptions' dnlib.DotNet.Writer.ImageCor20Header' dnlib.DotNet.Writer.ModuleWriterOptionsBase' dnlib.DotNet.Writer.ModuleWriterBase' dnlib.DotNet.Writer.NativeModuleWriter' dnlib.DotNet.Writer.TablesHeap' dnlib.DotNet.Writer.HotHeap' dnlib.DotNet.Writer.HotHeap20' dnlib.DotNet.Writer.HotHeap40' dnlib.DotNet.Writer.HotPool' dnlib.DotNet.Writer.HotPool20' dnlib.DotNet.Writer.HotPool40' dnlib.DotNet.Writer.HotTable' dnlib.Examples.Example5' dnlib.DotNet.EventDefMD' dnlib.DotNet.ExportedTypeMD' dnlib.DotNet.FieldDefMD' dnlib.DotNet.GenericParamMD' dnlib.DotNet.GenericParamConstraintMD' dnlib.DotNet.InterfaceImplMD' dnlib.DotNet.ManifestResourceMD' dnlib.DotNet.MemberRefMD' dnlib.DotNet.MethodDefMD' dnlib.DotNet.MethodSpecMD' dnlib.DotNet.ModuleRefMD' dnlib.DotNet.ParamDefMD' dnlib.DotNet.PropertyDefMD' dnlib.DotNet.StandAloneSigMD' dnlib.DotNet.TypeDefMD' dnlib.DotNet.TypeRefMD' dnlib.DotNet.TypeSpecMD' dnlib.DotNet.VTableFixups' dnlib.DotNet.Pdb.ManagedSymbolReaderCreator' dnlib.DotNet.Pdb.SymbolReaderCreator' dnlib.DotNet.Pdb.Dss.SymbolReaderCreator' dnlib.DotNet.Pdb.Portable.SymbolReaderCreator' dnlib.DotNet.Writer.MetaDataHeaderOptions' dnlib.DotNet.ClassLayoutMD' dnlib.DotNet.ImplMapMD' dnlib.DotNet.Writer.PreserveTokensMetaData' dnlib.DotNet.Writer.NormalMetaData' dnlib.DotNet.Pdb.Dss.MDEmitter' dnlib.DotNet.Writer.StringsHeap' dnlib.Examples.Example6' dnlib.DotNet.MDToken' dnlib.DotNet.ModuleLoader' dnlib.DotNet.Pdb.PdbState' dnlib.DotNet.Pdb.Portable.PortablePdbCustomDebugInfoReader' dnlib.DotNet.Pdb.WindowsPdb.PseudoCustomDebugInfoFactory' dnlib.DotNet.Pdb.WindowsPdb.WindowsPdbWriter' dnlib.DotNet.Writer.MDTable<T>' dnlib.DotNet.Writer.ModuleWriter' dnlib.DotNet.Writer.HotTable20' dnlib.DotNet.Writer.HotTable40' dnlib.DotNet.Writer.USHeap,dnlib.IO.IImageStream' dnlib.IO.MemoryImageStream' dnlib.DotNet.MDToken' dnlib.IO.IBinaryReader' dnlib.PE.IPEImage' dnlib.IO.FileOffset' dnlib.PE.ImageDataDirectory' dnlib.Threading.ThreadSafeListCreator' dnlib.PE.IImageOptionalHeader' dnlib.PE.ImageNTHeaders' dnlib.DotNet.UTF8String' dnlib.DotNet.FieldAttributes' dnlib.DotNet.MethodAttributes' dnlib.DotNet.EventAttributes' dnlib.DotNet.PropertyAttributes' dnlib.PE.ImageLayout' dnlib.PE.RVA' dnlib.DotNet.ElementType' dnlib.DotNet.SecurityAction' dnlib.DotNet.MethodSemanticsAttributes' dnlib.DotNet.AssemblyHashAlgorithm
dnlib,dnlib.DotNet.Pdb,dnlib.DotNet.Pdb.Portable.PortablePdbCustomDebugInfoReader' dnlib.DotNet.Writer.MetaData' dnlib.DotNet.Pdb.Dss.SymbolReaderCreator' dnlib.DotNet.Pdb.Managed.SymbolReaderCreator' dnlib.DotNet.Pdb.Dss.SymbolWriter' dnlib.DotNet.Pdb.WindowsPdb.ISymbolWriter2' dnlib.DotNet.Pdb.WindowsPdb.WindowsPdbWriter' dnlib.DotNet.Writer.DebugDirectoryEntry' dnlib.DotNet.Writer.DebugDirectory' dnlib.DotNet.Writer.ModuleWriterBase' dnlib.DotNet.Pdb.Dss.SymbolScopeImpl' dnlib.DotNet.Pdb.Managed.DbiScope' dnlib.DotNet.Pdb.Portable.SymbolScopeImpl' dnlib.DotNet.Pdb.Portable.PortablePdbCustomDebugInfoWriter' dnlib.DotNet.Pdb.WindowsPdb.PdbCustomDebugInfoReader' dnlib.DotNet.Pdb.WindowsPdb.PdbCustomDebugInfoWriter' dnlib.DotNet.Pdb.Dss.SymbolDocumentImpl' dnlib.DotNet.Pdb.Dss.SymbolVariableImpl' dnlib.DotNet.Pdb.Managed.DbiDocument' dnlib.DotNet.Pdb.Managed.DbiVariable' dnlib.DotNet.Pdb.Portable.PortablePdbReader' dnlib.DotNet.Pdb.Portable.SymbolDocumentImpl' dnlib.DotNet.Pdb.Portable.SymbolVariableImpl' dnlib.DotNet.Pdb.Dss.SymbolReaderImpl' dnlib.DotNet.Pdb.Managed.PdbReader' dnlib.DotNet.Pdb.WindowsPdb.PseudoCustomDebugInfoFactory' dnlib.DotNet.ModuleDef' dnlib.DotNet.Pdb.Portable.SymbolReaderCreator' dnlib.DotNet.Pdb.Portable.ImportDefinitionKindUtils' dnlib.DotNet.Pdb.Portable.ImportScopeBlobReader' dnlib.DotNet.Pdb.Portable.ImportScopeBlobWriter' dnlib.DotNet.Emit.Local' dnlib.DotNet.ModuleLoader' dnlib.DotNet.Emit.CilBody' dnlib.DotNet.Pdb.WindowsPdb.SequencePointHelper' dnlib.DotNet.ModuleCreationOptions' dnlib.DotNet.ModuleDefMD' dnlib.DotNet.Writer.MethodScopeDebugInfo' dnlib.DotNet.Emit.Extensions' dnlib.DotNet.Emit.Instruction,dnlib.IO.MemoryImageStream' dnlib.PE.ImageDebugType' dnlib.DotNet.Pdb.Symbols.SymbolReader' dnlib.DotNet.MD.IMetaData' dnlib.IO.IImageStream' dnlib.DotNet.Pdb.Portable.SymbolReaderCreator' dnlib.DotNet.Pdb.Managed.SymbolReaderCreator' dnlib.DotNet.TypeSig' dnlib.Threading.ThreadSafeListCreator' dnlib.DotNet.IMethodDefOrRef' dnlib.DotNet.Emit.Instruction' dnlib.DotNet.TypeDef' dnlib.DotNet.Emit.Local' dnlib.DotNet.MethodDef' dnlib.DotNet.AssemblyRef' dnlib.DotNet.ITypeDefOrRef' dnlib.DotNet.Pdb.Symbols.SymbolDocument' dnlib.DotNet.UTF8String' dnlib.DotNet.ModuleDef' dnlib.DotNet.ModuleDefMD' dnlib.DotNet.Pdb.Symbols.SymbolMethod' dnlib.DotNet.GenericParamContext' dnlib.DotNet.Emit.CilBody' dnlib.DotNet.AssemblyDef' dnlib.DotNet.CustomAttributeCollection' dnlib.DotNet.Pdb.Symbols.SymbolSequencePoint' dnlib.DotNet.GenericInstSig' dnlib.DotNet.GenericParam' dnlib.DotNet.Pdb.Symbols.SymbolScope' dnlib.DotNet.Pdb.Symbols.SymbolVariable' dnlib.DotNet.Emit.LocalList' dnlib.DotNet.Pdb.Symbols.SymbolNamespace' dnlib.DotNet.ElementType' dnlib.DotNet.GenericSig' dnlib.DotNet.ValueTypeSig' dnlib.DotNet.MDToken' dnlib.DotNet.MD.Table' dnlib.DotNet.Pdb.Dss.SymbolReaderCreator
dnlib,dnlib.DotNet.Pdb.Dss,dnlib.DotNet.Pdb.SymbolReaderCreator' dnlib.DotNet.Pdb.WindowsPdb.SymbolWriterCreator,dnlib.DotNet.ModuleDef' dnlib.DotNet.Pdb.Symbols.SymbolDocument' dnlib.DotNet.MDToken' dnlib.DotNet.MethodDef' dnlib.DotNet.Pdb.PdbAsyncMethodCustomDebugInfo' dnlib.DotNet.Pdb.WindowsPdb.PseudoCustomDebugInfoFactory' dnlib.DotNet.Pdb.WindowsPdb.PdbCustomDebugInfoReader' dnlib.DotNet.Emit.CilBody' dnlib.DotNet.GenericParamContext' dnlib.IO.IImageStream' dnlib.DotNet.Writer.MetaData' dnlib.DotNet.Writer.TablesHeap' dnlib.DotNet.MD.Table' dnlib.DotNet.TypeDef' dnlib.DotNet.MD.RawMethodRow' dnlib.DotNet.UTF8String' dnlib.DotNet.MD.RawTypeDefRow' dnlib.IO.UnmanagedMemoryImageStream' dnlib.IO.MemoryImageStream' dnlib.DotNet.Pdb.PdbCustomDebugInfo' dnlib.DotNet.Pdb.Symbols.SymbolScope' dnlib.DotNet.Pdb.Symbols.SymbolSequencePoint' dnlib.DotNet.Pdb.Symbols.SymbolAsyncStepInfo' dnlib.DotNet.Pdb.ImageStreamUtils' dnlib.DotNet.Pdb.Symbols.SymbolReader' dnlib.DotNet.MD.IMetaData' dnlib.PE.IPEImage' dnlib.PE.ImageDataDirectory' dnlib.DotNet.MD.ImageCor20Header' dnlib.DotNet.Pdb.Symbols.SymbolMethod' dnlib.DotNet.Pdb.Symbols.SymbolVariable' dnlib.DotNet.Pdb.Symbols.SymbolNamespace' dnlib.DotNet.Pdb.PdbConstant' dnlib.DotNet.TypeSig' dnlib.DotNet.SignatureReader' dnlib.DotNet.Pdb.IMAGE_DEBUG_DIRECTORY
dnlib,dnlib.DotNet.Pdb.Managed,dnlib.DotNet.Pdb.ManagedSymbolReaderCreator,dnlib.IO.IImageStream' dnlib.IO.IBinaryReader' dnlib.DotNet.Pdb.PdbCustomDebugInfo' dnlib.DotNet.Pdb.Symbols.SymbolSequencePoint' dnlib.DotNet.Pdb.Symbols.SymbolAsyncStepInfo' dnlib.DotNet.RecursionCounter' dnlib.DotNet.MethodDef' dnlib.DotNet.Emit.CilBody' dnlib.DotNet.Pdb.Symbols.SymbolMethod' dnlib.DotNet.Pdb.Symbols.SymbolScope' dnlib.DotNet.Pdb.PdbConstant' dnlib.DotNet.TypeSig' dnlib.DotNet.StandAloneSig' dnlib.DotNet.FieldSig' dnlib.DotNet.ModuleDef' dnlib.DotNet.GenericParamContext' dnlib.DotNet.Pdb.PdbLocalAttributes' dnlib.DotNet.Pdb.Symbols.SymbolDocument' dnlib.IO.FileOffset' dnlib.DotNet.MDToken' dnlib.DotNet.Pdb.PdbAsyncMethodCustomDebugInfo' dnlib.DotNet.Pdb.WindowsPdb.PseudoCustomDebugInfoFactory' dnlib.DotNet.Pdb.WindowsPdb.PdbCustomDebugInfoReader' dnlib.DotNet.Pdb.Symbols.SymbolReader' dnlib.DotNet.Pdb.ImageStreamUtils' dnlib.IO.MemoryImageStream
dnlib,dnlib.DotNet.Pdb.Portable,dnlib.DotNet.Writer.MetaData' dnlib.DotNet.Pdb.ManagedSymbolReaderCreator,dnlib.DotNet.MD.BlobStream' dnlib.IO.IImageStream' dnlib.DotNet.Pdb.PdbImportDefinitionKind' dnlib.DotNet.ModuleDef' dnlib.DotNet.AssemblyRef' dnlib.DotNet.Pdb.PdbImport' dnlib.DotNet.ITypeDefOrRef' dnlib.DotNet.MD.CodedToken' dnlib.DotNet.Writer.IWriterError' dnlib.DotNet.Writer.MetaData' dnlib.DotNet.Writer.BlobHeap' dnlib.DotNet.Pdb.PdbImportNamespace' dnlib.DotNet.MDToken' dnlib.DotNet.Pdb.PdbImportAssemblyNamespace' dnlib.DotNet.Pdb.PdbImportType' dnlib.DotNet.Pdb.PdbImportXmlNamespace' dnlib.DotNet.Pdb.PdbImportAssemblyReferenceAlias' dnlib.DotNet.Pdb.PdbAliasAssemblyReference' dnlib.DotNet.Pdb.PdbAliasNamespace' dnlib.DotNet.Pdb.PdbAliasAssemblyNamespace' dnlib.DotNet.Pdb.PdbAliasType' dnlib.DotNet.GenericParamContext' dnlib.DotNet.RecursionCounter' dnlib.DotNet.UTF8String' dnlib.DotNet.TypeSig' dnlib.DotNet.ElementType' dnlib.DotNet.ICorLibTypes' dnlib.DotNet.IAssembly' dnlib.DotNet.TypeRef' dnlib.DotNet.TypeDef' dnlib.DotNet.ISignatureReaderHelper' dnlib.DotNet.CorLibTypeSig' dnlib.DotNet.ValueTypeSig' dnlib.DotNet.ClassSig' dnlib.DotNet.ModifierSig' dnlib.DotNet.Emit.CilBody' dnlib.IO.IBinaryReader' dnlib.DotNet.Pdb.PdbCustomDebugInfo' dnlib.IO.MemoryImageStream' dnlib.DotNet.Pdb.CustomDebugInfoGuids' dnlib.DotNet.Pdb.PdbUnknownCustomDebugInfo' dnlib.DotNet.Emit.Instruction' dnlib.DotNet.Pdb.PdbAsyncMethodSteppingInformationCustomDebugInfo' dnlib.DotNet.MethodDef' dnlib.DotNet.MD.Table' dnlib.DotNet.Pdb.PdbDefaultNamespaceCustomDebugInfo' dnlib.DotNet.Pdb.PdbDynamicLocalVariablesCustomDebugInfo' dnlib.DotNet.Pdb.PdbEmbeddedSourceCustomDebugInfo' dnlib.DotNet.Pdb.PdbEditAndContinueLambdaMapCustomDebugInfo' dnlib.DotNet.Pdb.PdbEditAndContinueLocalSlotMapCustomDebugInfo' dnlib.DotNet.Pdb.PdbSourceLinkCustomDebugInfo' dnlib.DotNet.Pdb.PdbStateMachineHoistedLocalScopesCustomDebugInfo' dnlib.DotNet.Pdb.PortablePdbTupleElementNamesCustomDebugInfo' dnlib.DotNet.Writer.SerializerMethodContext' dnlib.DotNet.Writer.BinaryWriterContext' dnlib.DotNet.Pdb.PdbCustomDebugInfoKind' dnlib.DotNet.Pdb.StateMachineHoistedLocalScope' dnlib.DotNet.Pdb.PdbAsyncMethodCustomDebugInfo' dnlib.DotNet.Pdb.PdbAsyncStepInfo' dnlib.DotNet.Pdb.PdbFileKind' dnlib.DotNet.MD.IMetaData' dnlib.DotNet.Pdb.Symbols.SymbolDocument' dnlib.DotNet.Pdb.Symbols.SymbolAsyncStepInfo' dnlib.DotNet.Pdb.Symbols.SymbolSequencePoint' dnlib.DotNet.MD.MetaDataCreator' dnlib.DotNet.Pdb.PdbDocumentConstants' dnlib.DotNet.MD.MDTable' dnlib.DotNet.MD.TablesStream' dnlib.DotNet.MD.GuidStream' dnlib.DotNet.MD.RidList' dnlib.DotNet.Pdb.PdbImportScope' dnlib.DotNet.MD.StringsStream' dnlib.DotNet.Pdb.PdbLocalAttributes' dnlib.DotNet.Pdb.PdbIteratorMethodCustomDebugInfo' dnlib.DotNet.Pdb.Symbols.SymbolScope' dnlib.PE.IPEImage' dnlib.PE.ImageDebugDirectory' dnlib.DotNet.Pdb.Symbols.SymbolReader' dnlib.PE.ImageDebugType' dnlib.DotNet.Pdb.Symbols.SymbolMethod' dnlib.DotNet.Pdb.Symbols.SymbolNamespace' dnlib.DotNet.Pdb.PdbConstant
dnlib,dnlib.DotNet.Pdb.Symbols,dnlib.DotNet.Pdb.Dss.SymbolMethodImpl' dnlib.DotNet.Pdb.Managed.DbiFunction' dnlib.DotNet.Pdb.Portable.PortablePdbReader' dnlib.DotNet.Pdb.WindowsPdb.PseudoCustomDebugInfoFactory' dnlib.DotNet.Pdb.PdbDocument' dnlib.DotNet.Pdb.Dss.SymbolReaderImpl' dnlib.DotNet.Pdb.Managed.PdbReader' dnlib.DotNet.Pdb.PdbState' dnlib.DotNet.Pdb.Dss.SymbolScopeImpl' dnlib.DotNet.Pdb.Managed.DbiScope' dnlib.DotNet.Pdb.Portable.SymbolScopeImpl' dnlib.DotNet.ModuleDefMD' dnlib.DotNet.Pdb.ManagedSymbolReaderCreator' dnlib.DotNet.Pdb.SymbolReaderCreator' dnlib.DotNet.Pdb.Dss.SymbolReaderCreator' dnlib.DotNet.Pdb.Managed.SymbolReaderCreator' dnlib.DotNet.Pdb.Portable.SymbolReaderCreator' dnlib.DotNet.Pdb.CreateScopeState' dnlib.DotNet.Pdb.Portable.SymbolMethodImpl' dnlib.DotNet.Pdb.Managed.DbiModule,dnlib.DotNet.MethodDef' dnlib.DotNet.Emit.CilBody' dnlib.DotNet.ModuleDef' dnlib.DotNet.GenericParamContext
dnlib,dnlib.DotNet.Pdb.WindowsPdb,dnlib.DotNet.Writer.ModuleWriterBase' dnlib.DotNet.Pdb.Dss.SymbolReaderImpl' dnlib.DotNet.Pdb.Managed.PdbReader,dnlib.DotNet.Pdb.IMAGE_DEBUG_DIRECTORY' dnlib.DotNet.Writer.MetaData' dnlib.DotNet.ModuleDef' dnlib.DotNet.TypeDef' dnlib.DotNet.Emit.CilBody' dnlib.DotNet.GenericParamContext' dnlib.IO.IBinaryReader' dnlib.IO.MemoryImageStream' dnlib.DotNet.MethodDef' dnlib.DotNet.Pdb.PdbCustomDebugInfoKind' dnlib.DotNet.Pdb.PdbCustomDebugInfo' dnlib.DotNet.IMethodDefOrRef' dnlib.DotNet.Emit.Local' dnlib.DotNet.Pdb.PdbUsingGroupsCustomDebugInfo' dnlib.DotNet.Pdb.PdbStateMachineHoistedLocalScopesCustomDebugInfo' dnlib.DotNet.Emit.Instruction' dnlib.DotNet.Pdb.PdbDynamicLocalsCustomDebugInfo' dnlib.DotNet.Pdb.PdbDynamicLocal' dnlib.DotNet.Pdb.PdbTupleElementNamesCustomDebugInfo' dnlib.DotNet.Pdb.PdbTupleElementNames' dnlib.DotNet.Emit.LocalList' dnlib.DotNet.Pdb.PdbForwardMethodInfoCustomDebugInfo' dnlib.DotNet.Pdb.PdbForwardModuleInfoCustomDebugInfo' dnlib.DotNet.Pdb.PdbStateMachineTypeNameCustomDebugInfo' dnlib.DotNet.Pdb.PdbEditAndContinueLocalSlotMapCustomDebugInfo' dnlib.DotNet.Pdb.PdbEditAndContinueLambdaMapCustomDebugInfo' dnlib.DotNet.Pdb.PdbUnknownCustomDebugInfo' dnlib.DotNet.UTF8String' dnlib.DotNet.ILogger' dnlib.DotNet.MDToken' dnlib.DotNet.LoggerEvent' dnlib.DotNet.Pdb.StateMachineHoistedLocalScope' dnlib.DotNet.MemberRef' dnlib.DotNet.Pdb.PdbAsyncMethodCustomDebugInfo' dnlib.DotNet.MD.Table' dnlib.DotNet.Pdb.Symbols.SymbolAsyncStepInfo' dnlib.DotNet.Pdb.Dss.SymbolWriterCreator' dnlib.DotNet.Pdb.PdbState' dnlib.DotNet.Pdb.Compiler' dnlib.DotNet.Pdb.PdbDocument' dnlib.DotNet.Pdb.PdbMethod' dnlib.DotNet.Pdb.PdbScope' dnlib.DotNet.Pdb.PdbAsyncStepInfo' dnlib.DotNet.FieldSig' dnlib.DotNet.Pdb.PdbConstant' dnlib.DotNet.Pdb.PdbLocal' dnlib.DotNet.Pdb.PdbLocalAttributes' dnlib.DotNet.DummyLogger' dnlib.DotNet.Pdb.SequencePoint
dnlib,dnlib.DotNet.Resources,,dnlib.DotNet.ModuleDef' dnlib.DotNet.ModuleDefMD' dnlib.DotNet.ITypeDefOrRef' dnlib.DotNet.IAssembly' dnlib.DotNet.TypeNameParser' dnlib.DotNet.UTF8String' dnlib.DotNet.AssemblyRef' dnlib.DotNet.ICorLibTypes' dnlib.IO.IBinaryReader' dnlib.IO.IImageStream
