Project,Namespace,Ca types,Ce types
MyExpenses.Portable,MyExpenses.Portable.BusinessLayer.Contracts,MyExpenses.Portable.Models.Expense,MyExpenses.Portable.Interfaces.IBusinessEntity
MyExpenses.Portable,MyExpenses.Portable.DataLayer,MyExpenses.Portable.Services.ExpenseService,MyExpenses.Portable.Helpers.ServiceContainer' MyExpenses.Portable.Interfaces.ICloudService' MyExpenses.Portable.Interfaces.IBusinessEntity' MyExpenses.Portable.Models.Expense
MyExpenses.Portable,MyExpenses.Portable.Helpers,MyExpenses.Portable.ViewModels.ExpenseViewModel' MyExpenses.Portable.ViewModels.ExpensesViewModel' MyExpenses.Portable.DataLayer.ExpenseDatabase' MyExpenses.Portable.Services.ExpenseService,
MyExpenses.Portable,MyExpenses.Portable.Interfaces,MyExpenses.PlatformSpecific.AzureService' MyExpenses.Portable.DataLayer.ExpenseDatabase' MyExpenses.Portable.Services.ExpenseService' MyExpenses.Portable.BusinessLayer.Contracts.BusinessEntityBase' MyExpenses.Portable.ViewModels.ExpensesViewModel' MyExpenses.Portable.ViewModels.ExpenseViewModel,MyExpenses.Portable.Models.Expense
MyExpenses.Portable,MyExpenses.PlatformSpecific,,MyExpenses.Portable.Interfaces.ICloudService' MyExpenses.Portable.Models.Expense
MyExpenses.Portable,MyExpenses.Portable.Services,MyExpenses.Portable.ViewModels.ExpensesViewModel,MyExpenses.Portable.DataLayer.ExpenseDatabase' MyExpenses.Portable.Helpers.ServiceContainer' MyExpenses.Portable.Interfaces.ICloudService' MyExpenses.Portable.Interfaces.IExpenseService' MyExpenses.Portable.Interfaces.IMessageDialog' MyExpenses.Portable.Models.Expense
MyExpenses.Portable,MyExpenses.Portable.Models,MyExpenses.Portable.ViewModels.ExpensesViewModel' MyExpenses.Portable.Interfaces.ICloudService' MyExpenses.Portable.Interfaces.IExpenseService' MyExpenses.Portable.ViewModels.ExpenseViewModel' MyExpenses.PlatformSpecific.AzureService' MyExpenses.Portable.DataLayer.ExpenseDatabase' MyExpenses.Portable.Services.ExpenseService,MyExpenses.Portable.BusinessLayer.Contracts.BusinessEntityBase
MyExpenses.Portable,MyExpenses.Portable.ViewModels,,MyExpenses.Portable.Helpers.RelayCommand' MyExpenses.Portable.Helpers.RelayCommand<T>' MyExpenses.Portable.Helpers.ServiceContainer' MyExpenses.Portable.Interfaces.IExpenseService' MyExpenses.Portable.Interfaces.IMessageDialog' MyExpenses.Portable.Services.ExpenseService' MyExpenses.Portable.Models.Alert' MyExpenses.Portable.Models.Expense
