Project,Namespace,Ca types,Ce types
NAnt.Core,NAnt.Core.Attributes,NAnt.Core.AttributeConfigurator' NAnt.Core.Filters.FilterChainConfigurator' NAnt.Core.Tasks.NAntSchemaGenerator' NDoc.Documenter.NAnt.NAntDocumenter' NDoc.Documenter.NAnt.NAntXsltUtilities' NAnt.Core.TaskContainer' Tests.NAnt.Core.Attributes.DateTimeValidatorAttributeTest' NAnt.Core.Element' NAnt.Core.TypeFactory' NAnt.Core.Filters.FilterBuilder' NAnt.Core.Task' NAnt.Core.Tasks.ExternalProgramBase' Tests.NAnt.Core.Attributes.StringValidatorAttributeTest,NAnt.Core.Util.ResourceUtils
NAnt.Core,NAnt.Core,NAnt.Core.Tasks.CopyTask' NAnt.Core.Tasks.ExternalProgramBase' NAnt.Core.Tasks.MoveTask' NAnt.Core.Tasks.CatchElement' NAnt.VSNet.SolutionBase' NAnt.VSNet.WrapperReferenceBase' Tests.NAnt.Compression.Tasks.ZipTaskTest' Tests.NAnt.Core.ElementTest' Tests.NAnt.Core.ExpressionEvaluatorTest' Tests.NAnt.Core.ProjectTest' Tests.NAnt.Core.TaskContainerTest' Tests.NAnt.Core.Functions.FileFunctionsTest' Tests.NAnt.Core.Tasks.AttribTaskTest' Tests.NAnt.Core.Tasks.CopyTest' Tests.NAnt.Core.Tasks.LoadTasksTest' Tests.NAnt.Core.Tasks.PropertyTest' Tests.NAnt.Core.Tasks.SysInfoTaskTest' Tests.NAnt.Core.Tasks.XmlPeekTest' Tests.NAnt.Core.Tasks.XmlPokeTest' Tests.NAnt.Console.NAntTest' NAnt.Core.Types.FileSet' NAnt.Core.Types.PathSet' NDoc.Documenter.NAnt.NAntXsltUtilities' NAnt.Core.Tasks.NAntSchemaTask' NAnt.Core.Tasks.NAntTask' Tests.NAnt.Core.DirectoryScannerTest' NAnt.Core.Configuration.RuntimeEngine' NAnt.Core.Filters.FilterChainConfigurator' NAnt.Core.Tasks.NAntSchemaGenerator' Tests.NAnt.Core.ExpressionTokenizerTest' NAnt.Core.Extensibility.FunctionArgument' NAnt.Core.Filters.FilterChain' NAnt.Core.Functions.FrameworkFunctions' NAnt.Core.Functions.NAntFunctions' NAnt.Core.Tasks.AvailableTask' NAnt.Core.Tasks.PropertyTask' NAnt.Core.Util.GacCache' NAnt.DotNet.Tasks.AssemblyLinkerTask' NAnt.DotNet.Tasks.CompilerBase' NAnt.DotNet.Tasks.CscTask' NAnt.DotNet.Tasks.JscTask' NAnt.DotNet.Tasks.ResGenTask' NAnt.DotNet.Tasks.VbcTask' NAnt.DotNet.Types.AssemblyFileSet' NAnt.MSBuild.BuildEngine.Engine' NAnt.MSBuild.BuildEngine.Loader' NAnt.MSBuild.MSBuildEngine' NAnt.MSBuild.MSBuildProject' NAnt.MSBuild.NAntLogger' NAnt.VSNet.AssemblyReferenceBase' NAnt.VSNet.CSharpProject' NAnt.VSNet.JSharpProject' NAnt.VSNet.VBProject' NAnt.VSNet.VcConfigurationBase' NAnt.VSNet.Tasks.SolutionTask' Tests.NAnt.Core.FrameworkInfoTest' NAnt.DotNet.Tasks.CompilerInfo' NAnt.Compression.Tasks.ZipTask' NAnt.DotNet.Tasks.TypedValueGatherer' NAnt.MSBuild.MSBuildConfiguration' NAnt.VSNet.ConfigurationBase' NAnt.VSNet.FileReferenceBase' NAnt.VSNet.ManagedAssemblyReference' NAnt.VSNet.ManagedProjectBase' NAnt.VSNet.ManagedWrapperReference' NAnt.VSNet.ProjectEntryCollection' NAnt.VSNet.ProjectFactory' NAnt.VSNet.ProjectReferenceBase' NAnt.VSNet.ProjectSettings' NAnt.VSNet.SolutionFactory' NAnt.VSNet.VcAssemblyReference' NAnt.VSNet.VcProject' NAnt.VSNet.VcWrapperReference' Tests.NAnt.Core.LocationTest' Tests.NAnt.Core.Functions.EnvironmentFunctionsTest' NAnt.Core.Tasks.IncludeTask' NAnt.Compression.Tasks.ExpandBaseTask' NAnt.Compression.Tasks.GUnzip' NAnt.Compression.Tasks.TarTask' NAnt.Compression.Tasks.UnTarTask' NAnt.Compression.Tasks.UnZipTask' NAnt.Core.Extensibility.PluginScanner' NAnt.Core.Functions.PkgConfigFunctions' NAnt.Core.Tasks.AttribTask' NAnt.Core.Tasks.DeleteTask' NAnt.Core.Tasks.EchoTask' NAnt.Core.Tasks.GetTask' NAnt.Core.Tasks.LoadTasksTask' NAnt.Core.Tasks.MailTask' NAnt.Core.Tasks.MkDirTask' NAnt.Core.Tasks.RegexTask' NAnt.Core.Tasks.SetEnvTask' NAnt.Core.Tasks.SleepTask' NAnt.Core.Tasks.StyleTask' NAnt.Core.Tasks.SysInfoTask' NAnt.Core.Tasks.TouchTask' NAnt.Core.Tasks.TStampTask' NAnt.Core.Tasks.UpToDateTask' NAnt.Core.Tasks.XmlPeekTask' NAnt.Core.Tasks.XmlPokeTask' NAnt.Core.Util.AssemblyResolver' NAnt.DotNet.Tasks.AssemblyInfoTask' NAnt.DotNet.Tasks.DelaySignTask' NAnt.DotNet.Tasks.IlasmTask' NAnt.DotNet.Tasks.LicenseTask' NAnt.DotNet.Tasks.LicenseGatherer' NAnt.DotNet.Tasks.NDocTask' NAnt.DotNet.Tasks.RegsvcsTask' NAnt.DotNet.Tasks.ScriptTask' NAnt.DotNet.Tasks.VjcTask' NAnt.MSNet.Tasks.IldasmTask' NAnt.NUnit1.Tasks.NUnitTask' NAnt.NUnit2.Tasks.NUnit2Task' NAnt.SourceControl.Tasks.AbstractCvsTask' NAnt.SourceControl.Tasks.AbstractSourceControlTask' NAnt.SourceControl.Tasks.CvsPass' NAnt.VisualCpp.Tasks.ClTask' NAnt.VisualCpp.Tasks.LibTask' NAnt.VisualCpp.Tasks.LinkTask' NAnt.VisualCpp.Tasks.McTask' NAnt.VisualCpp.Tasks.MidlTask' NAnt.VisualCpp.Tasks.RcTask' NAnt.VSNet.ConfigurationSettings' NAnt.VSNet.ProjectBase' NAnt.VSNet.ReferenceBase' NAnt.Win32.Functions.CygpathFunctions' NAnt.Win32.Tasks.AxImpTask' NAnt.Win32.Tasks.ReadRegistryTask' NAnt.Win32.Tasks.RegAsmTask' NAnt.Win32.Tasks.TlbExpTask' NAnt.Win32.Tasks.TlbImpTask' Tests.NAnt.Core.BuildFilesInResourcesTest' Tests.NAnt.Core.BuildTestBase' Tests.NAnt.Core.ConcurrencyTest' Tests.NAnt.Core.ElementTest1Task' Tests.NAnt.Core.ConditionalElementTestTask' Tests.NAnt.Core.TestTask' Tests.NAnt.Core.TestBuildListener' Tests.NAnt.Core.Tasks.EchoTest' Tests.NAnt.Core.Util.XmlLoggerTest' Tests.NAnt.SourceControl.Tasks.CheckoutTaskTest' Tests.NAnt.SourceControl.Tasks.CvsTaskTest' Tests.NAnt.SourceControl.Tasks.UpdateTaskTest' Tests.NAnt.VSNet.Tasks.CSharpSolutionTests' Tests.NAnt.VSNet.Tasks.SolutionTestBase' Tests.NAnt.Core.MockBuildEventListener' Tests.NAnt.Core.TargetTest' Tests.NAnt.VisualCpp.VisualCppTestBase' NAnt.Core.Functions.PlatformFunctions' NAnt.Core.Util.FileUtils' NAnt.Core.Util.GacResolver' Tests.NAnt.Core.FileSetTest' Tests.NAnt.Core.Tasks.AvailableTest' Tests.NAnt.Core.Tasks.ExecTaskTest' Tests.NAnt.Core.Tasks.MoveTest' Tests.NAnt.Core.Tasks.StyleTaskTest' Tests.NAnt.Core.Tasks.ScriptTest' Tests.NAnt.Core.Util.FileUtilsTest' NAnt.Core.Filters.ExpandProperties' NAnt.Core.Functions.AssemblyFunctions' NAnt.Core.Functions.AssemblyNameFunctions' NAnt.Core.Functions.BooleanConversionFunctions' NAnt.Core.Functions.ConversionFunctions' NAnt.Core.Functions.DateTimeFunctions' NAnt.Core.Functions.DateTimeConversionFunctions' NAnt.Core.Functions.DirectoryFunctions' NAnt.Core.Functions.DoubleConversionFunctions' NAnt.Core.Functions.EnvironmentFunctions' NAnt.Core.Functions.FileFunctions' NAnt.Core.Functions.FileVersionInfoFunctions' NAnt.Core.Functions.Int32ConversionFunctions' NAnt.Core.Functions.Int64ConversionFunctions' NAnt.Core.Functions.MathFunctions' NAnt.Core.Functions.ProjectFunctions' NAnt.Core.Functions.TargetFunctions' NAnt.Core.Functions.TaskFunctions' NAnt.Core.Functions.PropertyFunctions' NAnt.Core.Functions.OperatingSystemFunctions' NAnt.Core.Functions.PathFunctions' NAnt.Core.Functions.StringFunctions' NAnt.Core.Functions.TimeSpanFunctions' NAnt.Core.Functions.TimeSpanConversionFunctions' NAnt.Core.Functions.VersionFunctions' NAnt.Core.Functions.VersionConversionFunctions' NAnt.Core.Tasks.CallTask' NAnt.Core.Tasks.FailTask' NAnt.Core.Tasks.LoopTask' NAnt.Core.Types.Pattern' NAnt.Core.Types.PatternSet' NAnt.MSBuild.DummyTask' NAnt.MSBuild.Functions.MSBuildFunctions' NAnt.VSNet.Resource' Tests.NAnt.Core.ExceptionTest' Tests.NAnt.Core.CoercionFunctions' Tests.NAnt.Core.PropertyDictionaryTest' Tests.NAnt.Core.Functions.TargetFunctionsTest' Tests.NAnt.DotNet.Tasks.LicenseTaskTest' Tests.NAnt.VisualCpp.Tasks.LinkTaskTest_CompileOnDemand' NAnt.Core.Tasks.IfTask' NAnt.Core.Tasks.ChooseTask' NAnt.Core.Tasks.When' NAnt.Core.Tasks.TryCatchTask,NAnt.Core.Util.CommandLineParser' NAnt.Core.Util.AssemblyResolver' NAnt.Core.Util.CommandLineArgumentException' NAnt.Core.Util.ResourceUtils' NAnt.Core.Tasks.LoadTasksTask' NAnt.Core.Types.FileSet' NAnt.Core.Util.ReflectionUtils' NAnt.Core.Extensibility.ExtensionAssembly' NAnt.Core.Attributes.ElementNameAttribute' NAnt.Core.Attributes.FrameworkConfigurableAttribute' NAnt.Core.Attributes.BuildAttributeAttribute' NAnt.Core.Attributes.ValidatorAttribute' NAnt.Core.Attributes.BuildElementArrayAttribute' NAnt.Core.Attributes.BuildElementCollectionAttribute' NAnt.Core.Attributes.BuildElementAttribute' NAnt.Core.Types.PathSet' NAnt.Core.Util.StringUtils' NAnt.Core.Extensibility.FunctionArgument' NAnt.Core.Configuration.Runtime' NAnt.Core.Util.FileUtils' NAnt.Core.Tasks.CallTask' NAnt.Core.Tasks.PropertyTask' NAnt.Core.Extensibility.IPluginConsumer' NAnt.Core.Extensibility.PluginScanner' NAnt.Core.Filters.FilterBuilderCollection' NAnt.Core.Filters.FilterBuilder' NAnt.Core.Filters.Filter' NAnt.Core.Attributes.TaskNameAttribute' NAnt.Core.Attributes.FunctionSetAttribute' NAnt.Core.Attributes.FunctionAttribute' NAnt.Core.Util.StopWatchStack
NAnt.Core,NAnt.Core.Configuration,NAnt.Core.Functions.NAntFunctions' NAnt.Core.Tasks.ExternalProgramBase' NAnt.Core.FrameworkInfo,NAnt.Core.Types.EnvironmentSet' NAnt.Core.Types.ManagedExecution' NAnt.Core.Types.ArgumentCollection' NAnt.Core.Element
NAnt.Core,NAnt.Core.Extensibility,NAnt.Core.DataTypeBaseBuilder' NAnt.Core.Task' NAnt.Core.TaskBuilder' NAnt.Core.TypeFactory' NAnt.Core.Filters.FilterBuilder' NAnt.Core.ExpressionEvalBase' NAnt.VSNet.Tasks.SolutionTask,NAnt.Core.Position' NAnt.Core.Task' NAnt.Core.Level
NAnt.Core,NAnt.Core.Filters,NAnt.Core.TypeFactory' NAnt.Core.Util.FileUtils' NDoc.Documenter.NAnt.NAntXsltUtilities' NAnt.Core.Tasks.CopyTask' NAnt.Core.Tasks.LoadFileTask,NAnt.Core.Util.ResourceUtils' NAnt.Core.PropertyDictionary' NAnt.Core.Project' NAnt.Core.Types.Token' NAnt.Core.Attributes.ElementNameAttribute' NAnt.Core.Extensibility.ExtensionAssembly' NAnt.Core.FrameworkInfo' NAnt.Core.Element' NAnt.Core.Attributes.BuildElementArrayAttribute' NAnt.Core.AttributeConfigurator' NAnt.Core.TypeFactory
NAnt.Core,NAnt.Core.Functions,Tests.NAnt.VisualCpp.VisualCppTestBase,NAnt.Core.Project' NAnt.Core.PropertyDictionary' NAnt.Core.Util.StringUtils' NAnt.Core.Util.ResourceUtils' NAnt.Core.Types.FileSet' NAnt.Core.FrameworkInfo' NAnt.Core.FrameworkTypes' NAnt.Core.Configuration.DirList' NAnt.Core.Configuration.Runtime' NAnt.Core.Util.FileUtils' NAnt.Core.TargetCollection' NAnt.Core.Target' NAnt.Core.TaskBuilderCollection' NAnt.Core.TypeFactory' NAnt.Core.TaskBuilder' NAnt.Core.PlatformHelper' NAnt.Core.Tasks.ExecTask' NAnt.Core.Types.ArgumentCollection' NAnt.Core.Tasks.ExternalProgramBase' NAnt.Core.Types.Argument' NAnt.Core.Level
NAnt.Core,NAnt.Core.Tasks,NAnt.VSNet.ProjectBase' Tests.NAnt.Core.Tasks.AvailableTest' NAnt.Core.Project' NAnt.DotNet.Tasks.LicenseTask' NAnt.DotNet.Tasks.ResGenTask' NAnt.Win32.Tasks.RegAsmTask' NAnt.VSNet.WrapperReferenceBase' NAnt.VSNet.Tasks.SolutionTask' Tests.NAnt.Core.Tasks.EchoTest' NAnt.Core.Functions.PkgConfigFunctions' NAnt.VSNet.VcProject' NAnt.Win32.Functions.CygpathFunctions' NAnt.DotNet.Tasks.AssemblyLinkerTask' NAnt.DotNet.Tasks.CompilerBase' NAnt.DotNet.Tasks.DelaySignTask' NAnt.DotNet.Tasks.IlasmTask' NAnt.DotNet.Tasks.RegsvcsTask' NAnt.MSNet.Tasks.IldasmTask' NAnt.SourceControl.Tasks.AbstractSourceControlTask' NAnt.VisualCpp.Tasks.ClTask' NAnt.VisualCpp.Tasks.LibTask' NAnt.VisualCpp.Tasks.LinkTask' NAnt.VisualCpp.Tasks.McTask' NAnt.VisualCpp.Tasks.MidlTask' NAnt.VisualCpp.Tasks.RcTask' NAnt.Win32.Tasks.AxImpTask' NAnt.Win32.Tasks.TlbExpTask' NAnt.Win32.Tasks.TlbImpTask' Tests.NAnt.Core.Tasks.ExternalProgramBaseTest' NAnt.Core.ConsoleDriver' NAnt.Core.ProjectSettingsLoader' NAnt.Core.TypeFactory' Tests.NAnt.Core.Tasks.MailTaskTest' NAnt.MSBuild.MSBuildProject,NAnt.Core.Types.FileSet' NAnt.Core.Project' NAnt.Core.Level' NAnt.Core.Util.ResourceUtils' NAnt.Core.FrameworkInfoDictionary' NAnt.Core.FrameworkInfo' NAnt.Core.Target' NAnt.Core.TargetCollection' NAnt.Core.Filters.FilterChain' NAnt.Core.PlatformHelper' NAnt.Core.Util.FileUtils' NAnt.Core.BuildException' NAnt.Core.Types.EnvironmentSet' NAnt.Core.Types.Option' NAnt.Core.Types.EnvironmentVariable' NAnt.Core.Types.ArgumentCollection' NAnt.Core.Types.ManagedExecution' NAnt.Core.Configuration.ManagedExecutionMode' NAnt.Core.Configuration.RuntimeEngine' NAnt.Core.Attributes.ProgramLocationAttribute' NAnt.Core.Attributes.LocationType' NAnt.Core.Types.Proxy' NAnt.Core.Types.Credential' NAnt.Core.TaskContainer' NAnt.Core.LocationMap' NAnt.Core.TypeFactory' NAnt.Core.TaskBuilderCollection' NAnt.Core.DataTypeBaseBuilderCollection' NAnt.Core.TaskBuilder' NAnt.Core.DataTypeBaseBuilder' NAnt.Core.Attributes.TaskAttributeAttribute' NAnt.Core.Attributes.BuildElementAttribute' NAnt.Core.Attributes.BuildElementArrayAttribute' NAnt.Core.Attributes.BuildElementCollectionAttribute' NAnt.Core.Element' NAnt.Core.Attributes.TaskNameAttribute' NAnt.Core.Attributes.ElementNameAttribute' NAnt.Core.PropertyDictionary' NAnt.Core.DataTypeBaseDictionary' NAnt.Core.Types.PathSet' NAnt.Core.Types.EnvironmentVariableCollection' NAnt.Core.Types.XsltParameterCollection' NAnt.Core.Types.XsltExtensionObjectCollection' NAnt.Core.Types.XsltParameter' NAnt.Core.Types.XsltExtensionObject' NAnt.Core.Types.FormatterCollection' NAnt.Core.Types.Formatter' NAnt.Core.Types.XmlNamespaceCollection' NAnt.Core.Types.XmlNamespace' NAnt.Core.ElementContainer
NAnt.Core,NAnt.Core.Types,NAnt.Core.Functions.PkgConfigFunctions' NAnt.DotNet.Tasks.AssemblyLinkerTask' NAnt.DotNet.Tasks.CompilerBase' NAnt.VSNet.VcProject' NAnt.Win32.Functions.CygpathFunctions' NAnt.Core.Configuration.RuntimeEngine' NAnt.Core.Tasks.ExternalProgramBase' NAnt.DotNet.Tasks.CscTask' NAnt.DotNet.Tasks.LicenseTask' NAnt.SourceControl.Tasks.AbstractCvsTask' NAnt.SourceControl.Tasks.AbstractSourceControlTask' NAnt.VisualCpp.Tasks.ClTask' NAnt.Win32.Tasks.AxImpTask' NAnt.Core.Tasks.GetTask' NAnt.Core.Tasks.StyleTask' NAnt.DotNet.Tasks.NDocTask' NAnt.Core.Tasks.ExecTask' NAnt.Core.Tasks.SetEnvTask' NAnt.Core.Configuration.ManagedExecutionMode' NAnt.Core.ConsoleDriver' NAnt.Core.FrameworkInfo' NAnt.Core.MailLogger' NAnt.Core.ProjectSettingsLoader' NAnt.Core.Functions.FileFunctions' NAnt.Core.Tasks.AttribTask' NAnt.Core.Tasks.CopyTask' NAnt.Core.Tasks.DeleteTask' NAnt.Core.Tasks.IfTask' NAnt.Core.Tasks.LoadTasksTask' NAnt.Core.Tasks.LoopTask' NAnt.Core.Tasks.InElement' NAnt.Core.Tasks.MailTask' NAnt.Core.Tasks.MoveTask' NAnt.Core.Tasks.NAntTask' NAnt.Core.Tasks.TouchTask' NAnt.Core.Tasks.UpToDateTask' NAnt.DotNet.Tasks.DelaySignTask' NAnt.DotNet.Tasks.IlasmTask' NAnt.DotNet.Tasks.ResGenTask' NAnt.DotNet.Types.AssemblyFileSet' NAnt.DotNet.Types.ResourceFileSet' NAnt.VSNet.WhidbeySolution' NAnt.MSNet.Tasks.IldasmTask' NAnt.SourceControl.Types.CvsFileSet' NAnt.VisualCpp.Tasks.LibTask' NAnt.VisualCpp.Tasks.LinkTask' NAnt.VisualCpp.Tasks.MidlTask' NAnt.VisualCpp.Tasks.RcTask' NAnt.VSNet.ManagedProjectBase' NAnt.VSNet.ProjectBase' NAnt.VSNet.SolutionBase' NAnt.VSNet.WrapperReferenceBase' NAnt.VSNet.Everett.Solution' NAnt.VSNet.Rainier.Solution' NAnt.VSNet.Tasks.SolutionTask' NAnt.Win32.Tasks.RegAsmTask' NAnt.Win32.Tasks.TlbExpTask' NAnt.Win32.Tasks.TlbImpTask' Tests.NAnt.Core.FrameworkInfoTest' Tests.NAnt.Core.TaskContainerTest' Tests.NAnt.Core.FileSetTest' Tests.NAnt.Core.Tasks.MailTaskTest' Tests.NAnt.VisualCpp.Tasks.LinkTaskTest_CompileOnDemand' NAnt.Core.Tasks.TStampTask' NAnt.Core.Configuration.ManagedExecutionModes' Tests.NAnt.Core.Tasks.ExternalProgramBaseTest' NAnt.Core.AttributeConfigurator' NAnt.Core.PathSetAttributeSetter' NAnt.DotNet.Tasks.ScriptTask' NAnt.Core.Filters.ReplaceTokens' NAnt.Core.Tasks.XmlPeekTask' NAnt.Core.Tasks.XmlPokeTask,NAnt.Core.DirectoryScanner' NAnt.Core.PathScanner' NAnt.Core.DataTypeBase' NAnt.Core.Util.ResourceUtils' NAnt.Core.Util.StringUtils' NAnt.Core.Project' NAnt.Core.Level
NAnt.Core,NAnt.Core.Util,NAnt.Core.ConsoleDriver' NAnt.DotNet.Tasks.TypedValueGatherer' NAnt.DotNet.Tasks.LicenseGatherer' Tests.NAnt.Core.Util.XmlLoggerTest' NAnt.Core.FrameworkInfo' NAnt.Core.PathScanner' NAnt.Core.Functions.NAntFunctions' NAnt.Core.Tasks.CopyTask' NAnt.Core.Tasks.LoadFileTask' NAnt.Core.Tasks.MoveTask' NAnt.DotNet.Tasks.LicenseTask' NAnt.DotNet.Tasks.NDocTask' NAnt.DotNet.Tasks.ResGenTask' NAnt.MSBuild.MSBuildConfiguration' NAnt.MSBuild.MSBuildProject' NAnt.VisualCpp.Tasks.ClTask' NAnt.VSNet.AssemblyReferenceBase' NAnt.VSNet.ConfigurationSettings' NAnt.VSNet.CSharpProject' NAnt.VSNet.FileReferenceBase' NAnt.VSNet.JSharpProject' NAnt.VSNet.ManagedProjectBase' NAnt.VSNet.LocalizedResourceSet' NAnt.VSNet.ManagedWrapperReference' NAnt.VSNet.ProjectBase' NAnt.VSNet.ProjectSettings' NAnt.VSNet.ReferencesResolver' NAnt.VSNet.Resource' NAnt.VSNet.SolutionBase' NAnt.VSNet.VBProject' NAnt.VSNet.VcFileConfiguration' NAnt.VSNet.VcProject' NAnt.VSNet.VcProjectConfiguration' NAnt.VSNet.VcWrapperReference' NAnt.VSNet.WrapperReferenceBase' NAnt.Win32.Tasks.RegAsmTask' Tests.NAnt.Core.Util.FileUtilsTest' NAnt.MSBuild.MSBuildAssemblyReference' NAnt.MSBuild.MSBuildProjectProvider' NAnt.MSBuild.MSBuildProjectReference' NAnt.VSNet.WhidbeySolution' NAnt.VSNet.WhidbeySolutionProvider' NAnt.VSNet.OrcasSolution' NAnt.VSNet.OrcasSolutionProvider' NAnt.VSNet.RosarioSolution' NAnt.VSNet.RosarioSolutionProvider' NAnt.VSNet.CSharpProjectProvider' NAnt.VSNet.GenericSolution' NAnt.VSNet.JSharpProjectProvider' NAnt.VSNet.ManagedAssemblyReference' NAnt.VSNet.ManagedProjectReference' NAnt.VSNet.ProjectFactory' NAnt.VSNet.ProjectReferenceBase' NAnt.VSNet.SolutionFactory' NAnt.VSNet.VBProjectProvider' NAnt.VSNet.VcAssemblyReference' NAnt.VSNet.VCProjectProvider' NAnt.VSNet.VcProjectReference' NAnt.VSNet.Everett.Solution' NAnt.VSNet.Everett.SolutionProvider' NAnt.VSNet.Extensibility.IProjectBuildProvider' NAnt.VSNet.Extensibility.ISolutionBuildProvider' NAnt.VSNet.Rainier.Solution' NAnt.VSNet.Rainier.SolutionProvider' NAnt.Core.Attributes.BooleanValidatorAttribute' NAnt.Core.Attributes.DateTimeValidatorAttribute' NAnt.Core.Attributes.Int32ValidatorAttribute' NAnt.Core.Attributes.StringValidatorAttribute' NAnt.Core.DataTypeBase' NAnt.Core.Element' NAnt.Core.AttributeConfigurator' NAnt.Core.EnumAttributeSetter' NAnt.Core.EncodingAttributeSetter' NAnt.Core.FileAttributeSetter' NAnt.Core.DirectoryAttributeSetter' NAnt.Core.PathSetAttributeSetter' NAnt.Core.UriAttributeSetter' NAnt.Core.ConvertableAttributeSetter' NAnt.Core.ExpressionEvalBase' NAnt.Core.ExpressionEvaluator' NAnt.Core.ExpressionTokenizer' NAnt.Core.DefaultLogger' NAnt.Core.Project' NAnt.Core.ProjectSettingsLoader' NAnt.Core.PropertyDictionary' NAnt.Core.Target' NAnt.Core.TargetCollection' NAnt.Core.Task' NAnt.Core.TaskContainer' NAnt.Core.TypeFactory' NAnt.Core.ElementContainer' NAnt.Core.Filters.ExpandProperties' NAnt.Core.Filters.ReplaceString' NAnt.Core.Filters.ReplaceTokens' NAnt.Core.Filters.TabsToSpaces' NAnt.Core.Filters.FilterChain' NAnt.Core.Filters.FilterChainConfigurator' NAnt.Core.Functions.EnvironmentFunctions' NAnt.Core.Functions.FrameworkFunctions' NAnt.Core.Functions.TargetFunctions' NAnt.Core.Functions.TaskFunctions' NAnt.Core.Functions.PropertyFunctions' NAnt.Core.Functions.PkgConfigFunctions' NAnt.Core.Tasks.AttribTask' NAnt.Core.Tasks.AvailableTask' NAnt.Core.Tasks.DeleteTask' NAnt.Core.Tasks.EchoTask' NAnt.Core.Tasks.ExecTask' NAnt.Core.Tasks.ExternalProgramBase' NAnt.Core.Tasks.GetTask' NAnt.Core.Tasks.IncludeTask' NAnt.Core.Tasks.LoadTasksTask' NAnt.Core.Tasks.LoopTask' NAnt.Core.Tasks.MailTask' NAnt.Core.Tasks.MkDirTask' NAnt.Core.Tasks.NAntSchemaGenerator' NAnt.Core.Tasks.NAntTask' NAnt.Core.Tasks.PropertyTask' NAnt.Core.Tasks.RegexTask' NAnt.Core.Tasks.StyleTask' NAnt.Core.Tasks.TouchTask' NAnt.Core.Tasks.XmlPeekTask' NAnt.Core.Tasks.XmlPokeTask' NAnt.Core.Types.FileSet' NAnt.Core.Types.XsltExtensionObject' NAnt.DotNet.Tasks.AssemblyInfoTask' NAnt.DotNet.Tasks.CodeProvider' NAnt.DotNet.Tasks.AssemblyLinkerTask' NAnt.DotNet.Tasks.CompilerBase' NAnt.DotNet.Tasks.CscTask' NAnt.DotNet.Tasks.DelaySignTask' NAnt.DotNet.Tasks.IlasmTask' NAnt.DotNet.Tasks.JscTask' NAnt.DotNet.Tasks.RegsvcsTask' NAnt.DotNet.Tasks.ScriptTask' NAnt.DotNet.Tasks.VbcTask' NAnt.DotNet.Tasks.VjcTask' NAnt.MSNet.Tasks.IldasmTask' NAnt.MSNet.Tasks.ServiceControllerTask' NAnt.VisualCpp.Tasks.LinkTask' NAnt.Core.XmlLogger' Tests.NAnt.Core.Util.StopWatchStackTest' NAnt.Core.Functions.DirectoryFunctions' NAnt.Core.Functions.ProjectFunctions' NAnt.Core.Functions.PathFunctions' NAnt.Core.Types.PathSet' NAnt.SourceControl.Tasks.AbstractSourceControlTask' NAnt.VSNet.ReferenceBase,NAnt.Core.Task' NAnt.Core.Level' NAnt.Core.Filters.Filter' NAnt.Core.Filters.FilterCollection' NAnt.Core.Filters.FilterChain' NAnt.Core.PlatformHelper' NAnt.Core.Project' NAnt.Core.FrameworkInfo
