Namespace,Type,NOF,NOM,NOP,NOPF,NOPM,LOC,WMC,NC,DIT,LCOM,Fan-Out,Fan-In,Fan-Out types,Fan-In types
FSpot.Exporters.PicasaWeb,GoogleExport,35,18,1,5,8,387,43,0,1,0.17,27,1,FSpot.Core.IPhoto' FSpot.UI.Dialog.ThreadProgressDialog' FSpot.Exporters.PicasaWeb.GoogleAccount' Mono.Google.Picasa.PicasaAlbum' Mono.Google.Picasa.PicasaAlbumCollection' GtkBeans.Builder' GtkBeans.ObjectAttribute' FSpot.Widgets.TrayView' FSpot.Exporters.PicasaWeb.GoogleAccountManager' FSpot.Core.IBrowsableCollection' Mono.Google.Picasa.PicasaWeb' FSpot.Settings.Preferences' GLib.Format' Mono.Google.Picasa.UploadProgressEventArgs' FSpot.Filters.FilterSet' Mono.Google.Picasa.PicasaPicture' Hyena.Log' FSpot.Core.IPhotoVersion' Hyena.SafeUri' FSpot.Filters.FilterRequest' FSpot.App' FSpot.Database.ExportStore' FSpot.Database.Db' FSpot.Photo' FSpot.Core.Tag' GtkBeans.Global' Mono.Google.CaptchaException,FSpot.Exporters.PicasaWeb.GoogleAddAlbum
FSpot.Exporters.PicasaWeb,DateComparer,0,1,0,0,1,7,1,0,0,-1,1,0,FSpot.Core.IPhoto,
FSpot.Exporters.PicasaWeb,GoogleAddAlbum,12,3,1,0,1,68,5,0,0,0,7,0,GtkBeans.ObjectAttribute' GtkBeans.Builder' FSpot.Exporters.PicasaWeb.GoogleExport' Mono.Google.Picasa.PicasaWeb' Hyena.Widgets.HigMessageDialog' System.Web.HttpUtility' Mono.Google.Picasa.AlbumAccess,
FSpot.Exporters.PicasaWeb,GoogleAccountDialog,15,5,1,0,2,97,10,0,0,0,9,0,FSpot.Exporters.PicasaWeb.GoogleAccount' GtkBeans.Builder' GtkBeans.ObjectAttribute' FSpot.Imaging.IImageFileFactory' FSpot.Utils.TinyIoCContainer' FSpot.App' Mono.Google.CaptchaException' FSpot.Imaging.IImageFile' FSpot.Exporters.PicasaWeb.GoogleAccountManager,
FSpot.Exporters.PicasaWeb,GoogleAccountManager,3,10,0,0,8,106,19,0,0,0.2,2,2,FSpot.Exporters.PicasaWeb.GoogleAccount' Hyena.Log,FSpot.Exporters.PicasaWeb.GoogleExport' FSpot.Exporters.PicasaWeb.GoogleAccountDialog
FSpot.Exporters.PicasaWeb,GoogleAccount,6,4,6,0,3,90,5,0,0,0,4,3,Mono.Google.GoogleConnection' Mono.Google.Picasa.PicasaWeb' Hyena.Log' Mono.Google.GoogleService,FSpot.Exporters.PicasaWeb.GoogleExport' FSpot.Exporters.PicasaWeb.GoogleAccountDialog' FSpot.Exporters.PicasaWeb.GoogleAccountManager
