Namespace,Type,NOF,NOM,NOP,NOPF,NOPM,LOC,WMC,NC,DIT,LCOM,Fan-Out,Fan-In,Fan-Out types,Fan-In types
Microsoft.OData.Client,OperationResponse,3,1,4,0,0,51,1,3,0,0,4,8,Microsoft.OData.Client.HeaderCollection' Microsoft.OData.Client.HeaderCollection' Microsoft.OData.Client.HeaderCollection' Microsoft.OData.Client.HeaderCollection,Microsoft.OData.Client.DataServiceActionQuery' Microsoft.OData.Client.ChangeOperationResponse' Microsoft.OData.Client.InvokeResponse' Microsoft.OData.Client.QueryOperationResponse' Microsoft.OData.Client.SaveResult' Microsoft.OData.Client.BatchSaveResult' Microsoft.OData.Client.DataServiceResponse' Microsoft.OData.Client.DataServiceContext
Microsoft.OData.Client,QueryOperationResponse<T>,0,3,1,0,2,51,3,0,1,-1,24,6,Microsoft.OData.Client.DataServiceQueryContinuation<T>' Microsoft.OData.Client.HeaderCollection' Microsoft.OData.Client.DataServiceRequest' Microsoft.OData.Client.QueryOperationResponse' Microsoft.OData.Client.MaterializeAtom' Microsoft.OData.Client.Strings' Microsoft.OData.Client.DataServiceQueryContinuation<T>' Microsoft.OData.Client.DataServiceRequest' Microsoft.OData.Client.HeaderCollection' Microsoft.OData.Client.QueryOperationResponse' Microsoft.OData.Client.MaterializeAtom' Microsoft.OData.Client.Strings' Microsoft.OData.Client.DataServiceQueryContinuation<T>' Microsoft.OData.Client.HeaderCollection' Microsoft.OData.Client.DataServiceRequest' Microsoft.OData.Client.QueryOperationResponse' Microsoft.OData.Client.MaterializeAtom' Microsoft.OData.Client.Strings' Microsoft.OData.Client.DataServiceQueryContinuation<T>' Microsoft.OData.Client.HeaderCollection' Microsoft.OData.Client.DataServiceRequest' Microsoft.OData.Client.QueryOperationResponse' Microsoft.OData.Client.MaterializeAtom' Microsoft.OData.Client.Strings,Microsoft.OData.Client.QueryOperationResponse' Microsoft.OData.Client.QueryResult' Microsoft.OData.Client.DataServiceRequest' Microsoft.OData.Client.DataServiceQuery<TElement>' Microsoft.OData.Client.DataServiceCollection<T>' Microsoft.OData.Client.DataServiceContext
Microsoft.OData.Client,QueryOperationResponse,2,7,3,0,4,141,12,1,1,0.71,46,10,Microsoft.OData.Client.DataServiceQueryContinuation' Microsoft.OData.Client.DataServiceQueryContinuation<T>' Microsoft.OData.Client.HeaderCollection' Microsoft.OData.Client.DataServiceClientException' Microsoft.OData.Client.DataServiceRequest' Microsoft.OData.Client.OperationResponse' Microsoft.OData.Client.QueryOperationResponse<T>' Microsoft.OData.Client.Error' Microsoft.OData.Client.MaterializeAtom' Microsoft.OData.Client.Strings' Microsoft.OData.Client.DataServiceClientException' Microsoft.OData.Client.DataServiceQueryContinuation' Microsoft.OData.Client.DataServiceQueryContinuation<T>' Microsoft.OData.Client.DataServiceRequest' Microsoft.OData.Client.HeaderCollection' Microsoft.OData.Client.OperationResponse' Microsoft.OData.Client.QueryOperationResponse' Microsoft.OData.Client.QueryOperationResponse<T>' Microsoft.OData.Client.Util' Microsoft.OData.Client.Error' Microsoft.OData.Client.MaterializeAtom' Microsoft.OData.Client.Strings' Microsoft.OData.Client.DataServiceQueryContinuation' Microsoft.OData.Client.DataServiceQueryContinuation<T>' Microsoft.OData.Client.HeaderCollection' Microsoft.OData.Client.DataServiceClientException' Microsoft.OData.Client.DataServiceRequest' Microsoft.OData.Client.OperationResponse' Microsoft.OData.Client.QueryOperationResponse<T>' Microsoft.OData.Client.QueryOperationResponse' Microsoft.OData.Client.Error' Microsoft.OData.Client.MaterializeAtom' Microsoft.OData.Client.Util' Microsoft.OData.Client.Strings' Microsoft.OData.Client.DataServiceQueryContinuation' Microsoft.OData.Client.DataServiceQueryContinuation<T>' Microsoft.OData.Client.HeaderCollection' Microsoft.OData.Client.DataServiceClientException' Microsoft.OData.Client.DataServiceRequest' Microsoft.OData.Client.OperationResponse' Microsoft.OData.Client.QueryOperationResponse<T>' Microsoft.OData.Client.QueryOperationResponse' Microsoft.OData.Client.Error' Microsoft.OData.Client.MaterializeAtom' Microsoft.OData.Client.Util' Microsoft.OData.Client.Strings,Microsoft.OData.Client.DataServiceQueryException' Microsoft.OData.Client.LoadCompletedEventArgs' Microsoft.OData.Client.LoadPropertyResult' Microsoft.OData.Client.QueryResult' Microsoft.OData.Client.QueryOperationResponse<T>' Microsoft.OData.Client.BatchSaveResult' Microsoft.OData.Client.DataServiceRequest' Microsoft.OData.Client.DataServiceCollection<T>' Microsoft.OData.Client.DataServiceQuery<TElement>' Microsoft.OData.Client.DataServiceContext
Microsoft.OData.Client,Error,0,16,0,0,0,127,16,0,0,-1,11,45,Microsoft.OData.Client.InternalError' Microsoft.OData.Client.Strings' Microsoft.OData.Client.Error' Microsoft.OData.Client.InternalError' Microsoft.OData.Client.Strings' Microsoft.OData.Client.Error' Microsoft.OData.Client.InternalError' Microsoft.OData.Client.Strings' Microsoft.OData.Client.Error' Microsoft.OData.Client.InternalError' Microsoft.OData.Client.Strings,Microsoft.OData.Client.LiteralFormatter' Microsoft.OData.Client.CommonUtil' Microsoft.OData.Client.Materialization.CollectionValueMaterializationPolicy' Microsoft.OData.Client.Materialization.EntityTrackingAdapter' Microsoft.OData.Client.ClientEdmModel' Microsoft.OData.Client.Materialization.StructuralValueMaterializationPolicy' Microsoft.OData.Client.Materialization.EntryValueMaterializationPolicy' Microsoft.OData.Client.Metadata.ClientTypeCache' Microsoft.OData.Client.Materialization.FeedAndEntryMaterializerAdapter' Microsoft.OData.Client.BatchSaveResult' Microsoft.OData.Client.ContentTypeUtil' Microsoft.OData.Client.LoadPropertyResult' Microsoft.OData.Client.BaseSaveResult' Microsoft.OData.Client.HeaderCollection' Microsoft.OData.Client.Materialization.ODataLinksMaterializer' Microsoft.OData.Client.GetReadStreamResult' Microsoft.OData.Client.EntityTracker' Microsoft.OData.Client.RequestInfo' Microsoft.OData.Client.QueryResult' Microsoft.OData.Client.UriWriter' Microsoft.OData.Client.ODataPropertyConverter' Microsoft.OData.Client.DataServiceQueryProvider' Microsoft.OData.Client.KeyAttribute' Microsoft.OData.Client.DataServiceStreamResponse' Microsoft.OData.Client.ClientConvert' Microsoft.OData.Client.DataServiceCollection<T>' Microsoft.OData.Client.Materialization.ODataEntityMaterializer' Microsoft.OData.Client.Metadata.ClientTypeUtil' Microsoft.OData.Client.DataServiceQuery' Microsoft.OData.Client.QueryOperationResponse' Microsoft.OData.Client.Metadata.ClientTypeAnnotation' Microsoft.OData.Client.Metadata.ClientPropertyAnnotation' Microsoft.OData.Client.Materialization.ODataMaterializer' Microsoft.OData.Client.SendingRequestEventArgs' Microsoft.OData.Client.TypeResolver' Microsoft.OData.Client.MaterializeAtom' Microsoft.OData.Client.BaseAsyncResult' Microsoft.OData.Client.UriResolver' Microsoft.OData.Client.Serializer' Microsoft.OData.Client.ResourceBinder' Microsoft.OData.Client.SaveResult' Microsoft.OData.Client.Util' Microsoft.OData.Client.DataServiceUrlKeyDelimiter' Microsoft.OData.Client.WebUtil' Microsoft.OData.Client.DataServiceContext
Microsoft.OData.Client,InternalError,0,0,0,0,0,44,0,0,0,-1,0,10,,Microsoft.OData.Client.GetReadStreamResult' Microsoft.OData.Client.Error' Microsoft.OData.Client.Materialization.FeedAndEntryMaterializerAdapter' Microsoft.OData.Client.Util' Microsoft.OData.Client.BatchSaveResult' Microsoft.OData.Client.SaveResult' Microsoft.OData.Client.QueryResult' Microsoft.OData.Client.BaseSaveResult' Microsoft.OData.Client.DataServiceContext' Microsoft.OData.Client.BaseAsyncResult
Microsoft.OData.Client,MaterializeAtom,8,17,5,0,3,492,43,1,0,0.47,75,9,Microsoft.OData.Client.BaseEntityType' Microsoft.OData.Client.ClientEdmModel' Microsoft.OData.Client.DataServiceQueryContinuation' Microsoft.OData.Client.ProjectionPlan' Microsoft.OData.Client.ResponseInfo' Microsoft.OData.Client.PrimitiveType' Microsoft.OData.Client.QueryComponents' Microsoft.OData.Client.Error' Microsoft.OData.Client.ResultsWrapper' Microsoft.OData.Client.Util' Microsoft.OData.Client.DataServiceContext' Microsoft.OData.Client.Strings' Microsoft.OData.Client.Materialization.EntityTrackingAdapter' Microsoft.OData.Client.Materialization.ODataMaterializerContext' Microsoft.OData.Client.Materialization.ODataEntriesEntityMaterializer' Microsoft.OData.Client.Materialization.ODataEntityMaterializer' Microsoft.OData.Client.Materialization.ODataMaterializer' Microsoft.OData.Client.Metadata.ClientTypeUtil' Microsoft.OData.Client.QueryComponents' Microsoft.OData.Client.BaseEntityType' Microsoft.OData.Client.ClientEdmModel' Microsoft.OData.Client.DataServiceContext' Microsoft.OData.Client.DataServiceQueryContinuation' Microsoft.OData.Client.ProjectionPlan' Microsoft.OData.Client.ResponseInfo' Microsoft.OData.Client.PrimitiveType' Microsoft.OData.Client.Util' Microsoft.OData.Client.Error' Microsoft.OData.Client.MaterializeAtom' Microsoft.OData.Client.ResultsWrapper' Microsoft.OData.Client.Strings' Microsoft.OData.Client.Materialization.EntityTrackingAdapter' Microsoft.OData.Client.Materialization.ODataEntityMaterializer' Microsoft.OData.Client.Materialization.ODataEntriesEntityMaterializer' Microsoft.OData.Client.Materialization.ODataMaterializer' Microsoft.OData.Client.Materialization.ODataMaterializerContext' Microsoft.OData.Client.Metadata.ClientTypeUtil' Microsoft.OData.Client.BaseEntityType' Microsoft.OData.Client.ClientEdmModel' Microsoft.OData.Client.DataServiceQueryContinuation' Microsoft.OData.Client.ProjectionPlan' Microsoft.OData.Client.ResponseInfo' Microsoft.OData.Client.PrimitiveType' Microsoft.OData.Client.QueryComponents' Microsoft.OData.Client.Error' Microsoft.OData.Client.MaterializeAtom' Microsoft.OData.Client.ResultsWrapper' Microsoft.OData.Client.Util' Microsoft.OData.Client.DataServiceContext' Microsoft.OData.Client.Strings' Microsoft.OData.Client.Materialization.EntityTrackingAdapter' Microsoft.OData.Client.Materialization.ODataMaterializerContext' Microsoft.OData.Client.Materialization.ODataEntriesEntityMaterializer' Microsoft.OData.Client.Materialization.ODataEntityMaterializer' Microsoft.OData.Client.Materialization.ODataMaterializer' Microsoft.OData.Client.Metadata.ClientTypeUtil' Microsoft.OData.Client.BaseEntityType' Microsoft.OData.Client.ClientEdmModel' Microsoft.OData.Client.DataServiceQueryContinuation' Microsoft.OData.Client.ProjectionPlan' Microsoft.OData.Client.ResponseInfo' Microsoft.OData.Client.PrimitiveType' Microsoft.OData.Client.QueryComponents' Microsoft.OData.Client.Error' Microsoft.OData.Client.MaterializeAtom' Microsoft.OData.Client.ResultsWrapper' Microsoft.OData.Client.Util' Microsoft.OData.Client.DataServiceContext' Microsoft.OData.Client.Strings' Microsoft.OData.Client.Materialization.EntityTrackingAdapter' Microsoft.OData.Client.Materialization.ODataMaterializerContext' Microsoft.OData.Client.Materialization.ODataEntriesEntityMaterializer' Microsoft.OData.Client.Materialization.ODataEntityMaterializer' Microsoft.OData.Client.Materialization.ODataMaterializer' Microsoft.OData.Client.Metadata.ClientTypeUtil,Microsoft.OData.Client.QueryOperationResponse<T>' Microsoft.OData.Client.PrimitiveTypeConverter' Microsoft.OData.Client.QueryOperationResponse' Microsoft.OData.Client.DataServiceRequest' Microsoft.OData.Client.BatchSaveResult' Microsoft.OData.Client.BaseSaveResult' Microsoft.OData.Client.QueryResult' Microsoft.OData.Client.LoadPropertyResult' Microsoft.OData.Client.SaveResult
Microsoft.OData.Client,ResultsWrapper,3,4,1,0,1,65,5,0,1,0.75,0,1,,Microsoft.OData.Client.MaterializeAtom
Microsoft.OData.Client,MediaEntryAttribute,1,1,1,0,1,24,1,0,0,0,4,2,Microsoft.OData.Client.Util' Microsoft.OData.Client.Util' Microsoft.OData.Client.Util' Microsoft.OData.Client.Util,Microsoft.OData.Client.Metadata.ClientTypeAnnotation' Microsoft.OData.Client.ClientEdmModel
Microsoft.OData.Client,MergeOption,0,0,0,0,0,36,0,0,0,-1,0,15,,Microsoft.OData.Client.EntityTrackerBase' Microsoft.OData.Client.Materialization.ODataLoadNavigationPropertyMaterializer' Microsoft.OData.Client.Materialization.FeedAndEntryMaterializerAdapter' Microsoft.OData.Client.LoadPropertyResult' Microsoft.OData.Client.BaseSaveResult' Microsoft.OData.Client.ResponseInfo' Microsoft.OData.Client.LoadPropertyResponseInfo' Microsoft.OData.Client.RequestInfo' Microsoft.OData.Client.EntityDescriptor' Microsoft.OData.Client.Util' Microsoft.OData.Client.Materialization.EntityTrackingAdapter' Microsoft.OData.Client.EntityTracker' Microsoft.OData.Client.Materialization.EntryValueMaterializationPolicy' Microsoft.OData.Client.AtomMaterializerLog' Microsoft.OData.Client.DataServiceContext
Microsoft.OData.Client,MimeTypePropertyAttribute,2,1,2,0,1,28,1,0,0,0,0,1,,Microsoft.OData.Client.ClientEdmModel
Microsoft.OData.Client,EntityDescriptor,10,29,31,0,0,818,63,0,1,0.52,76,15,Microsoft.OData.Client.ClientEdmModel' Microsoft.OData.Client.ClientEdmStructuredValue' Microsoft.OData.Client.DataServiceSaveStream' Microsoft.OData.Client.LinkInfo' Microsoft.OData.Client.OperationDescriptor' Microsoft.OData.Client.AtomMaterializerLog' Microsoft.OData.Client.DescriptorKind' Microsoft.OData.Client.Descriptor' Microsoft.OData.Client.LinkDescriptor' Microsoft.OData.Client.MergeOption' Microsoft.OData.Client.EntityStates' Microsoft.OData.Client.StreamDescriptor' Microsoft.OData.Client.UriResolver' Microsoft.OData.Client.UriUtil' Microsoft.OData.Client.Util' Microsoft.OData.Client.Strings' Microsoft.OData.Client.Metadata.ClientTypeAnnotation' Microsoft.OData.Client.Metadata.ClientPropertyAnnotation' Microsoft.OData.Client.AtomMaterializerLog' Microsoft.OData.Client.ClientEdmModel' Microsoft.OData.Client.ClientEdmStructuredValue' Microsoft.OData.Client.DataServiceSaveStream' Microsoft.OData.Client.DescriptorKind' Microsoft.OData.Client.Descriptor' Microsoft.OData.Client.EntityDescriptor' Microsoft.OData.Client.EntityStates' Microsoft.OData.Client.LinkDescriptor' Microsoft.OData.Client.LinkInfo' Microsoft.OData.Client.MergeOption' Microsoft.OData.Client.OperationDescriptor' Microsoft.OData.Client.StreamDescriptor' Microsoft.OData.Client.UriResolver' Microsoft.OData.Client.UriUtil' Microsoft.OData.Client.Util' Microsoft.OData.Client.Strings' Microsoft.OData.Client.Metadata.ClientPropertyAnnotation' Microsoft.OData.Client.Metadata.ClientTypeAnnotation' Microsoft.OData.Client.ClientEdmModel' Microsoft.OData.Client.ClientEdmStructuredValue' Microsoft.OData.Client.DataServiceSaveStream' Microsoft.OData.Client.LinkInfo' Microsoft.OData.Client.OperationDescriptor' Microsoft.OData.Client.AtomMaterializerLog' Microsoft.OData.Client.DescriptorKind' Microsoft.OData.Client.Descriptor' Microsoft.OData.Client.LinkDescriptor' Microsoft.OData.Client.MergeOption' Microsoft.OData.Client.EntityDescriptor' Microsoft.OData.Client.EntityStates' Microsoft.OData.Client.StreamDescriptor' Microsoft.OData.Client.UriResolver' Microsoft.OData.Client.UriUtil' Microsoft.OData.Client.Util' Microsoft.OData.Client.Strings' Microsoft.OData.Client.Metadata.ClientTypeAnnotation' Microsoft.OData.Client.Metadata.ClientPropertyAnnotation' Microsoft.OData.Client.ClientEdmModel' Microsoft.OData.Client.ClientEdmStructuredValue' Microsoft.OData.Client.DataServiceSaveStream' Microsoft.OData.Client.LinkInfo' Microsoft.OData.Client.OperationDescriptor' Microsoft.OData.Client.AtomMaterializerLog' Microsoft.OData.Client.DescriptorKind' Microsoft.OData.Client.Descriptor' Microsoft.OData.Client.LinkDescriptor' Microsoft.OData.Client.MergeOption' Microsoft.OData.Client.EntityDescriptor' Microsoft.OData.Client.EntityStates' Microsoft.OData.Client.StreamDescriptor' Microsoft.OData.Client.UriResolver' Microsoft.OData.Client.UriUtil' Microsoft.OData.Client.Util' Microsoft.OData.Client.Strings' Microsoft.OData.Client.Metadata.ClientTypeAnnotation' Microsoft.OData.Client.Metadata.ClientPropertyAnnotation' Microsoft.OData.Service.UriUtil,Microsoft.OData.Client.LoadPropertyResult' Microsoft.OData.Client.EntityTrackerBase' Microsoft.OData.Client.Materialization.ODataLoadNavigationPropertyMaterializer' Microsoft.OData.Client.LoadPropertyResponseInfo' Microsoft.OData.Client.RequestInfo' Microsoft.OData.Client.BatchSaveResult' Microsoft.OData.Client.AtomMaterializerLog' Microsoft.OData.Client.BindingObserver' Microsoft.OData.Client.Materialization.MaterializerEntry' Microsoft.OData.Client.StreamDescriptor' Microsoft.OData.Client.SaveResult' Microsoft.OData.Client.Serializer' Microsoft.OData.Client.EntityTracker' Microsoft.OData.Client.BaseSaveResult' Microsoft.OData.Client.DataServiceContext
Microsoft.OData.Client,EntityStates,0,0,0,0,0,24,0,0,0,-1,0,17,,Microsoft.OData.Client.EntityTrackerBase' Microsoft.OData.Client.Materialization.EntityTrackingAdapter' Microsoft.OData.Client.LinkDescriptor' Microsoft.OData.Client.BatchSaveResult' Microsoft.OData.Client.OperationDescriptor' Microsoft.OData.Client.StreamDescriptor' Microsoft.OData.Client.Util' Microsoft.OData.Client.EntityDescriptor' Microsoft.OData.Client.Serializer' Microsoft.OData.Client.SaveResult' Microsoft.OData.Client.AtomMaterializerLog' Microsoft.OData.Client.LoadPropertyResult' Microsoft.OData.Client.Descriptor' Microsoft.OData.Client.EntityTracker' Microsoft.OData.Client.BindingObserver' Microsoft.OData.Client.BaseSaveResult' Microsoft.OData.Client.DataServiceContext
Microsoft.OData.Client,SaveChangesOptions,0,0,0,0,0,19,0,0,0,-1,0,6,,Microsoft.OData.Client.BatchSaveResult' Microsoft.OData.Client.SaveResult' Microsoft.OData.Client.Util' Microsoft.OData.Client.BaseSaveResult' Microsoft.OData.Client.Serializer' Microsoft.OData.Client.DataServiceContext
Microsoft.OData.Client,SaveResult,4,19,3,0,0,844,62,2,2,0,163,4,Microsoft.OData.Client.CommonUtil' Microsoft.OData.Client.ContentTypeUtil' Microsoft.OData.Client.BaseSaveResult' Microsoft.OData.Client.StreamRequestKind' Microsoft.OData.Client.ClientEdmModel' Microsoft.OData.Client.ContentStream' Microsoft.OData.Client.HttpStack' Microsoft.OData.Client.DataServiceSaveStream' Microsoft.OData.Client.ODataRequestMessageWrapper' Microsoft.OData.Client.HeaderCollection' Microsoft.OData.Client.ResponseInfo' Microsoft.OData.Client.HttpWebResponseMessage' Microsoft.OData.Client.BaseAsyncResult' Microsoft.OData.Client.AsyncStateBag' Microsoft.OData.Client.PerRequest' Microsoft.OData.Client.DataServiceRequestException' Microsoft.OData.Client.DescriptorKind' Microsoft.OData.Client.Descriptor' Microsoft.OData.Client.LinkDescriptor' Microsoft.OData.Client.ChangeOperationResponse' Microsoft.OData.Client.ClientConvert' Microsoft.OData.Client.DataServiceClientException' Microsoft.OData.Client.DataServiceResponse' Microsoft.OData.Client.OperationResponse' Microsoft.OData.Client.Error' Microsoft.OData.Client.InternalError' Microsoft.OData.Client.MaterializeAtom' Microsoft.OData.Client.EntityDescriptor' Microsoft.OData.Client.EntityStates' Microsoft.OData.Client.SaveChangesOptions' Microsoft.OData.Client.CachedResponse' Microsoft.OData.Client.StreamDescriptor' Microsoft.OData.Client.Util' Microsoft.OData.Client.DataServiceContext' Microsoft.OData.Client.WebUtil' Microsoft.OData.Client.XmlConstants' Microsoft.OData.Client.Strings' Microsoft.OData.Client.Materialization.ODataReaderEntityMaterializer' Microsoft.OData.Client.Materialization.MaterializerEntry' Microsoft.OData.Client.Metadata.ClientTypeAnnotation' Microsoft.OData.Client.BaseAsyncResult' Microsoft.OData.Client.AsyncStateBag' Microsoft.OData.Client.PerRequest' Microsoft.OData.Client.BaseSaveResult' Microsoft.OData.Client.StreamRequestKind' Microsoft.OData.Client.ChangeOperationResponse' Microsoft.OData.Client.ClientConvert' Microsoft.OData.Client.ClientEdmModel' Microsoft.OData.Client.CommonUtil' Microsoft.OData.Client.ContentStream' Microsoft.OData.Client.ContentTypeUtil' Microsoft.OData.Client.DataServiceClientException' Microsoft.OData.Client.DataServiceContext' Microsoft.OData.Client.DataServiceRequestException' Microsoft.OData.Client.DataServiceResponse' Microsoft.OData.Client.DataServiceSaveStream' Microsoft.OData.Client.DescriptorKind' Microsoft.OData.Client.Descriptor' Microsoft.OData.Client.EntityDescriptor' Microsoft.OData.Client.EntityStates' Microsoft.OData.Client.HeaderCollection' Microsoft.OData.Client.HttpStack' Microsoft.OData.Client.LinkDescriptor' Microsoft.OData.Client.HttpWebResponseMessage' Microsoft.OData.Client.ODataRequestMessageWrapper' Microsoft.OData.Client.OperationResponse' Microsoft.OData.Client.ResponseInfo' Microsoft.OData.Client.SaveChangesOptions' Microsoft.OData.Client.CachedResponse' Microsoft.OData.Client.StreamDescriptor' Microsoft.OData.Client.Util' Microsoft.OData.Client.WebUtil' Microsoft.OData.Client.XmlConstants' Microsoft.OData.Client.Error' Microsoft.OData.Client.InternalError' Microsoft.OData.Client.MaterializeAtom' Microsoft.OData.Client.Strings' Microsoft.OData.Client.Materialization.MaterializerEntry' Microsoft.OData.Client.Materialization.ODataReaderEntityMaterializer' Microsoft.OData.Client.Metadata.ClientTypeAnnotation' Microsoft.OData.Client.BaseSaveResult' Microsoft.OData.Client.StreamRequestKind' Microsoft.OData.Client.ClientEdmModel' Microsoft.OData.Client.CommonUtil' Microsoft.OData.Client.ContentStream' Microsoft.OData.Client.ContentTypeUtil' Microsoft.OData.Client.HttpStack' Microsoft.OData.Client.DataServiceSaveStream' Microsoft.OData.Client.ODataRequestMessageWrapper' Microsoft.OData.Client.HeaderCollection' Microsoft.OData.Client.ResponseInfo' Microsoft.OData.Client.HttpWebResponseMessage' Microsoft.OData.Client.BaseAsyncResult' Microsoft.OData.Client.AsyncStateBag' Microsoft.OData.Client.PerRequest' Microsoft.OData.Client.DataServiceRequestException' Microsoft.OData.Client.DescriptorKind' Microsoft.OData.Client.Descriptor' Microsoft.OData.Client.LinkDescriptor' Microsoft.OData.Client.ChangeOperationResponse' Microsoft.OData.Client.ClientConvert' Microsoft.OData.Client.DataServiceClientException' Microsoft.OData.Client.DataServiceResponse' Microsoft.OData.Client.OperationResponse' Microsoft.OData.Client.Error' Microsoft.OData.Client.InternalError' Microsoft.OData.Client.MaterializeAtom' Microsoft.OData.Client.EntityDescriptor' Microsoft.OData.Client.EntityStates' Microsoft.OData.Client.SaveChangesOptions' Microsoft.OData.Client.CachedResponse' Microsoft.OData.Client.StreamDescriptor' Microsoft.OData.Client.Util' Microsoft.OData.Client.DataServiceContext' Microsoft.OData.Client.WebUtil' Microsoft.OData.Client.XmlConstants' Microsoft.OData.Client.Strings' Microsoft.OData.Client.Materialization.ODataReaderEntityMaterializer' Microsoft.OData.Client.Materialization.MaterializerEntry' Microsoft.OData.Client.Metadata.ClientTypeAnnotation' Microsoft.OData.Client.BaseSaveResult' Microsoft.OData.Client.StreamRequestKind' Microsoft.OData.Client.ClientEdmModel' Microsoft.OData.Client.CommonUtil' Microsoft.OData.Client.ContentStream' Microsoft.OData.Client.ContentTypeUtil' Microsoft.OData.Client.HttpStack' Microsoft.OData.Client.DataServiceSaveStream' Microsoft.OData.Client.ODataRequestMessageWrapper' Microsoft.OData.Client.HeaderCollection' Microsoft.OData.Client.ResponseInfo' Microsoft.OData.Client.HttpWebResponseMessage' Microsoft.OData.Client.BaseAsyncResult' Microsoft.OData.Client.AsyncStateBag' Microsoft.OData.Client.PerRequest' Microsoft.OData.Client.DataServiceRequestException' Microsoft.OData.Client.DescriptorKind' Microsoft.OData.Client.Descriptor' Microsoft.OData.Client.LinkDescriptor' Microsoft.OData.Client.ChangeOperationResponse' Microsoft.OData.Client.ClientConvert' Microsoft.OData.Client.DataServiceClientException' Microsoft.OData.Client.DataServiceResponse' Microsoft.OData.Client.OperationResponse' Microsoft.OData.Client.Error' Microsoft.OData.Client.InternalError' Microsoft.OData.Client.MaterializeAtom' Microsoft.OData.Client.EntityDescriptor' Microsoft.OData.Client.EntityStates' Microsoft.OData.Client.SaveChangesOptions' Microsoft.OData.Client.CachedResponse' Microsoft.OData.Client.StreamDescriptor' Microsoft.OData.Client.Util' Microsoft.OData.Client.DataServiceContext' Microsoft.OData.Client.WebUtil' Microsoft.OData.Client.XmlConstants' Microsoft.OData.Client.Strings' Microsoft.OData.Client.Materialization.ODataReaderEntityMaterializer' Microsoft.OData.Client.Materialization.MaterializerEntry' Microsoft.OData.Client.Metadata.ClientTypeAnnotation' Microsoft.OData.Service.CommonUtil' Microsoft.OData.Service.ContentTypeUtil' Microsoft.OData.Service.XmlConstants,Microsoft.OData.Client.GetReadStreamResult' Microsoft.OData.Client.QueryResult' Microsoft.OData.Client.BaseSaveResult' Microsoft.OData.Client.DataServiceContext
Microsoft.OData.Client,CachedResponse,6,1,0,6,0,36,1,0,0,0,0,1,,Microsoft.OData.Client.SaveResult
Microsoft.OData.Client,SendingRequestEventArgs,2,1,2,0,0,45,1,0,0,0,12,2,Microsoft.OData.Client.Error' Microsoft.OData.Client.Util' Microsoft.OData.Client.Strings' Microsoft.OData.Client.Util' Microsoft.OData.Client.Error' Microsoft.OData.Client.Strings' Microsoft.OData.Client.Error' Microsoft.OData.Client.Util' Microsoft.OData.Client.Strings' Microsoft.OData.Client.Error' Microsoft.OData.Client.Util' Microsoft.OData.Client.Strings,Microsoft.OData.Client.RequestInfo' Microsoft.OData.Client.DataServiceContext
