Project,Namespace,Ca types,Ce types
Orleans.Core,Orleans.ApplicationParts,Orleans.ClientBuilderExtensions' Orleans.Configuration.Validators.ApplicationPartValidator' Orleans.ApplicationPartManagerExtensions' Orleans.DefaultClientServices' Orleans.Serialization.BuiltInTypesSerializationFeaturePopulator' Orleans.Runtime.TypeMetadataCache' Orleans.ClientBuilder' Orleans.Serialization.SerializationManager,
Orleans.Core,Orleans,Orleans.Configuration.Validators.ApplicationPartValidator' Orleans.Providers.ClientProviderRuntime' Orleans.Streams.StreamConsumer<T>' Orleans.Providers.Streams.SimpleMessageStream.SimpleMessageStreamProducer<T>' Orleans.Storage.IGrainStorage' Orleans.Storage.IMemoryStorageGrain' Orleans.Configuration.OptionConfigureExtensionMethods' Orleans.Providers.Streams.Common.PersistentStreamProvider' Orleans.LogConsistency.LogConsistentGrain<TView>' Orleans.Hosting.ClusterClientPersistentStreamConfigurator' Orleans.Configuration.Overrides.OptionsOverrides' Orleans.Hosting.ClientStreamExtensions' Orleans.Messaging.ClientMessageCenter' Orleans.Configuration.ClusterOptionsValidator' Orleans.Configuration.Validators.ClientClusteringValidator' Orleans.Configuration.Validators.LoadSheddingValidator' Orleans.Runtime.IRuntimeClient' Orleans.Streams.ImplicitStreamSubscriberTable' Orleans.Runtime.GrainReferenceRuntime' Orleans.Streams.ImplicitStreamPubSub' Orleans.Runtime.OutgoingCallInvoker' Orleans.Configuration.StreamLifecycleOptions' Orleans.Runtime.Messaging.ConnectionManagerLifecycleAdapter<TLifecycle>' Orleans.Runtime.LoggingUtils' Orleans.Internal.OrleansTaskExtentions' Orleans.Runtime.Messaging.ClientOutboundConnection' Orleans.Runtime.Messaging.Connection' Orleans.Runtime.TypeUtils' Orleans.Runtime.Message' Orleans.Providers.ProviderTypeLoader' Orleans.Runtime.AssemblyLoader' Orleans.Runtime.CallbackData' Orleans.Runtime.OrleansLoggerExtension' Orleans.Runtime.NoOpHostEnvironmentStatistics' Orleans.Runtime.LogStatistics' Orleans.Runtime.TaskSchedulerAgent' Orleans.Providers.Streams.SimpleMessageStream.SimpleMessageStreamProducerExtension' Orleans.Threading.ThreadPoolThread' Orleans.Streams.StreamConsumerExtension' Orleans.Threading.ThreadPoolExecutor' Orleans.Runtime.Utils' Orleans.Runtime.AsynchAgent' Orleans.Messaging.GatewayManager' Orleans.Serialization.SerializationManager' Orleans.Runtime.SafeTimerBase' Orleans.Runtime.MembershipTableSnapshot' Orleans.Runtime.IManagementGrain' Orleans.Serialization.SerializationContext' Orleans.Serialization.ILFieldBuilder,Orleans.ApplicationParts.ApplicationPartManager' Orleans.ApplicationParts.AssemblyPart' Orleans.ApplicationParts.IApplicationFeatureProvider' Orleans.ApplicationParts.IApplicationPart' Orleans.ApplicationParts.IApplicationPartManager' Orleans.ApplicationParts.IApplicationPartManagerWithAssemblies' Orleans.Runtime.AssemblyLoader' Orleans.Runtime.AssemblyLoaderCriteria' Orleans.Runtime.AssemblyLoaderPathNameCriterion' Orleans.Runtime.AssemblyLoaderReflectionCriterion' Orleans.Runtime.RuntimeVersion' Orleans.Hosting.HostBuilderContext' Orleans.Timers.Internal.TimerManager' Orleans.Runtime.Configuration.ConfigUtilities' Orleans.Hosting.ClientApplicationLifetime' Orleans.Hosting.EnvironmentName' Orleans.Hosting.HostDefaults' Orleans.Hosting.HostingEnvironment' Orleans.Hosting.IHostingEnvironment' Orleans.Hosting.ServiceProviderBuilder' Orleans.Serialization.SerializationManager' Orleans.Configuration.ClusterOptions' Orleans.Configuration.StaticGatewayListProviderOptions' Orleans.Hosting.DelegateServiceProviderFactory' Orleans.Messaging.IGatewayListProvider' Orleans.Messaging.StaticGatewayListProvider' Orleans.Runtime.IRuntimeClient' Orleans.Runtime.Utils' Orleans.Configuration.ClientMessagingOptions' Orleans.Streams.IStreamProviderRuntime' Orleans.ApplicationParts.AssemblyAttributeFeatureProvider<TFeature>' Orleans.Runtime.CachedTypeResolver' Orleans.Runtime.ITypeResolver' Orleans.Runtime.TypeMetadataCache' Orleans.Runtime.IMessageCenter' Orleans.Runtime.MessageFactory' Orleans.Runtime.ExecutorService' Orleans.Runtime.GrainCancellationTokenRuntime' Orleans.Runtime.GrainReferenceRuntime' Orleans.Runtime.IGrainReferenceConverter' Orleans.Runtime.NoOpHostEnvironmentStatistics' Orleans.Runtime.ApplicationRequestsStatisticsGroup' Orleans.Runtime.ClientStatisticsManager' Orleans.Runtime.SchedulerStatisticsGroup' Orleans.Runtime.StageAnalysisStatisticsGroup' Orleans.Runtime.ITelemetryProducer' Orleans.Runtime.TelemetryManager' Orleans.Runtime.KeyedServiceCollection<TKey;TService>' Orleans.Configuration.ClusterOptionsValidator' Orleans.Configuration.StatisticsOptions' Orleans.Configuration.ConnectionOptions' Orleans.Configuration.Validators.ApplicationPartValidator' Orleans.Configuration.Validators.ClientClusteringValidator' Orleans.Messaging.ClientMessageCenter' Orleans.Messaging.GatewayManager' Orleans.Runtime.Messaging.IMessageSerializer' Orleans.Runtime.Messaging.MessageSerializer' Orleans.Runtime.Messaging.ClientOutboundConnectionFactory' Orleans.Runtime.Messaging.ConnectionFactory' Orleans.Runtime.Messaging.ConnectionManager' Orleans.Runtime.Messaging.ConnectionManagerLifecycleAdapter<TLifecycle>' Orleans.Runtime.Messaging.INetworkingTrace' Orleans.Runtime.Messaging.NetworkingTrace' Orleans.Networking.Shared.SharedMemoryPool' Orleans.Networking.Shared.SocketConnectionFactory' Orleans.Networking.Shared.SocketSchedulers' Orleans.Providers.ClientProviderRuntime' Orleans.Providers.IProviderRuntime' Orleans.Serialization.BinaryFormatterISerializableSerializer' Orleans.Serialization.BinaryFormatterSerializer' Orleans.Serialization.BuiltInTypesSerializationFeaturePopulator' Orleans.Serialization.FieldUtils' Orleans.Serialization.IKeyedSerializer' Orleans.Serialization.ILBasedSerializer' Orleans.Serialization.SerializationStatisticsGroup' Orleans.Statistics.AppEnvironmentStatistics' Orleans.Streams.Core.IStreamSubscriptionManagerAdmin' Orleans.Streams.Core.StreamSubscriptionManagerAdmin' Orleans.Runtime.TypeUtils' Orleans.Runtime.GrainClassData' Orleans.CodeGeneration.GrainInterfaceUtils' Orleans.Utilities.CachedReadConcurrentDictionary<TKey;TValue>' Orleans.Runtime.ValueStopwatch' Orleans.Runtime.Message' Orleans.Runtime.Directions' Orleans.Runtime.Response' Orleans.Runtime.RequestContextExtensions' Orleans.Runtime.MessagingStatisticsGroup' Orleans.Runtime.Phase' Orleans.Runtime.OrleansOutsideRuntimeClientEvent' Orleans.Runtime.EventSourceUtils' Orleans.Runtime.CorrelationId' Orleans.Runtime.Categories' Orleans.Runtime.ResponseTypes' Orleans.Runtime.RejectionTypes' Orleans.Runtime.CallbackData' Orleans.Runtime.IGrainTypeResolver' Orleans.Runtime.SharedCallbackData' Orleans.Runtime.BufferPool' Orleans.Runtime.ThreadTrackingStatistic' Orleans.Runtime.AsyncTaskSafeTimer' Orleans.Runtime.SafeTimer' Orleans.Configuration.TypeManagementOptions' Orleans.Runtime.SiloStatus' Orleans.Runtime.LogFormatter' Orleans.Runtime.SiloRuntimeStatistics' Orleans.Runtime.SimpleGrainStatistic' Orleans.Runtime.DetailedGrainStatistic' Orleans.Runtime.DetailedGrainReport
Orleans.Core,Orleans.Runtime,Orleans.ApplicationPartManagerExtensions' Orleans.Streams.FilterPredicateWrapperData' Orleans.Serialization.BinaryFormatterSerializer' Orleans.DefaultClientServices' Orleans.Serialization.ILBasedSerializer' Orleans.Serialization.TypeSerializer' Orleans.Serialization.OrleansJsonSerializationBinder' Orleans.Serialization.OrleansJsonSerializer' Orleans.Serialization.SerializationManager' Orleans.Serialization.BuiltInTypes' Orleans.GrainFactory' Orleans.Storage.GrainStorageExtensions' Orleans.CodeGeneration.GrainInterfaceUtils' Orleans.Streams.ImplicitStreamSubscriberTable' Orleans.Providers.LoadedProviderTypeLoaders' Orleans.Providers.ProviderTypeLoader' Orleans.CodeGeneration.GenericMethodInvoker' Orleans.Serialization.TypeUtilities' Orleans.GrainCasterFactory' Orleans.Serialization.ILSerializerGenerator' Orleans.Serialization.ReflectedSerializationMethodInfo' Orleans.OutsideRuntimeClient' Orleans.Internal.AsyncExecutorWithRetries' Orleans.MembershipEntry' Orleans.Serialization.BuiltInTypesSerializationFeaturePopulator' Orleans.Serialization.BinaryTokenStreamWriter2<TBufferWriter>' Orleans.Serialization.BinaryTokenStreamWriterExtensions' Orleans.Serialization.BinaryTokenStreamWriter' Orleans.Serialization.BinaryTokenStreamReaderExtensinons' Orleans.Runtime.Messaging.Connection' Orleans.Runtime.Messaging.ClientOutboundConnection' Orleans.Messaging.ClientMessageCenter' Orleans.LogConsistency.ProtocolTransportException' Orleans.Storage.InconsistentStateException' Orleans.Runtime.Messaging.IMessageSerializer' Orleans.Runtime.Messaging.MessageSerializer' Orleans.InvokableObjectManager' Orleans.Runtime.Messaging.ClientOutboundConnectionFactory' Orleans.Configuration.MessagingOptions' Orleans.Configuration.ClusterOptionsValidator' Orleans.Streams.QueueId' Orleans.Streams.StreamId' Orleans.Streams.HashRingBasedStreamQueueMapper' Orleans.Streams.IStreamProviderRuntime' Orleans.Providers.ClientProviderRuntime' Orleans.LogConsistency.LogConsistentGrain<TView>' Orleans.Threading.ThreadPoolExecutor' Orleans.Configuration.Validators.ApplicationPartValidator' Orleans.ClusterClient' Orleans.Serialization.GrainReferenceSerializer' Orleans.Providers.Streams.SimpleMessageStream.SimpleMessageStreamProvider' Orleans.Providers.Streams.Common.PersistentStreamProvider' Orleans.Streams.StreamImpl<T>' Orleans.Streams.PersistentStreamProducer<T>' Orleans.Streams.IConsistentRingStreamQueueMapper' Orleans.Runtime.Configuration.ConfigUtilities' Orleans.Runtime.Placement.IPlacementContext' Orleans.MembershipTableData' Orleans.Configuration.Validators.LoadSheddingValidator' Orleans.Serialization.SerializationStatisticsGroup' Orleans.Threading.ThreadPoolThread' Orleans.ISiloControl' Orleans.Threading.ThreadPoolTrackingStatistic' Orleans.Threading.WorkItem' Orleans.Configuration.TelemetryOptionsExtensions' Orleans.Runtime.Configuration.TelemetryConfiguration' Orleans.Messaging.GatewayManager' Orleans.LifecycleSubject' Orleans.Streams.StreamConsumerData' Orleans.ReminderTableData' Orleans.Providers.Streams.SimpleMessageStream.SimpleMessageStreamProducerExtension,Orleans.ErrorCode' Orleans.Utilities.CachedReadConcurrentDictionary<TKey;TValue>' Orleans.ApplicationParts.IApplicationPartManager' Orleans.Serialization.BinaryTokenStreamReader' Orleans.Serialization.BinaryTokenStreamWriter' Orleans.Serialization.SerializationManager' Orleans.Serialization.SerializationTokenType' Orleans.Transactions.ITransactionInfo' Orleans.Transactions.TransactionContext' Orleans.Threading.ExecutionExceptionFilter' Orleans.Threading.ThreadPoolExecutorOptions' Orleans.Threading.Builder' Orleans.Threading.ThreadPoolExecutor' Orleans.Threading.ExecutionContext' Orleans.Threading.ExecutionActionFilter' Orleans.Internal.AsyncExecutorWithRetries' Orleans.Internal.IBackoffProvider' Orleans.Internal.FixedBackoff' Orleans.Internal.OrleansTaskExtentions' Orleans.CodeGeneration.GrainInterfaceUtils' Orleans.IInternalGrainFactory' Orleans.InterfaceToImplementationMappingCache' Orleans.Streams.IStreamProviderRuntime' Orleans.Streams.ImplicitStreamSubscriberTable' Orleans.MembershipTableData' Orleans.MembershipEntry' Orleans.Configuration.MessagingOptions' Orleans.Configuration.StatisticsOptions' Orleans.Serialization.SerializationStatisticsGroup' Orleans.Configuration.LoadSheddingOptions' Orleans.Messaging.ConnectionDirection' Orleans.Runtime.Configuration.StatisticsLevel' Orleans.MultiCluster.IMultiClusterGatewayInfo' Orleans.MultiCluster.MultiClusterConfiguration' Orleans.GrainDirectory.UnregistrationCause' Orleans.GrainDirectory.GrainDirectoryEntryStatus' Orleans.GrainDirectory.IGrainDirectory' Orleans.Configuration.TelemetryOptions
Orleans.Core,Orleans.Internal,Orleans.Runtime.GrainCancellationTokenRuntime' Orleans.Runtime.GrainReferenceRuntime' Orleans.CodeGeneration.GenericMethodInvoker' Orleans.Messaging.GatewayManager,Orleans.Runtime.LogFormatter' Orleans.Runtime.Constants' Orleans.ErrorCode
Orleans.Core,Orleans.CodeGeneration,Orleans.GrainFactory' Orleans.Streams.ImplicitStreamSubscriberTable' Orleans.Runtime.GrainInterfaceMap' Orleans.InterfaceToImplementationMappingCache,Orleans.Runtime.TypeUtils' Orleans.Internal.OrleansTaskExtentions' Orleans.Serialization.ILDelegateBuilder<TDelegate>' Orleans.Serialization.ILFieldBuilder' Orleans.Runtime.ConsoleText' Orleans.Runtime.Constants' Orleans.Runtime.Utils' Orleans.Utilities.RuntimeTypeNameFormatter
Orleans.Core,Orleans.Configuration,Orleans.Messaging.ClientMessageCenter' Orleans.ClusterClient' Orleans.OutsideRuntimeClient' Orleans.DefaultClientServices' Orleans.Providers.ClientProviderRuntime' Orleans.Configuration.Overrides.OptionsOverrides' Orleans.ClientBuilderExtensions' Orleans.Messaging.StaticGatewayListProvider' Orleans.Messaging.GatewayManager' Orleans.Runtime.SiloRuntimeStatistics' Orleans.Configuration.Validators.LoadSheddingValidator' Orleans.Runtime.BufferPool' Orleans.Runtime.SharedCallbackData' Orleans.Runtime.Configuration.ConfigUtilities' Orleans.Runtime.Messaging.ClientOutboundConnection' Orleans.Runtime.Messaging.MessageSerializer' Orleans.Runtime.Messaging.Connection' Orleans.Serialization.SerializationManager' Orleans.Threading.ThreadPoolThread' Orleans.Runtime.QueueTrackingStatistic' Orleans.Runtime.StageAnalysisStatisticsGroup' Orleans.Runtime.ApplicationRequestsStatisticsGroup' Orleans.Runtime.SchedulerStatisticsGroup' Orleans.Serialization.SerializationStatisticsGroup' Orleans.Runtime.ThreadTrackingStatistic' Orleans.Threading.ThreadPoolExecutor' Orleans.Threading.ThreadPoolTrackingStatistic' Orleans.Runtime.ClientStatisticsManager' Orleans.Runtime.TelemetryManager' Orleans.Runtime.Messaging.ClientOutboundConnectionFactory' Orleans.Runtime.Messaging.ConnectionFactory' Orleans.Runtime.Messaging.ConnectionManager' Orleans.Hosting.ClusterClientPersistentStreamConfiguratorExtensions' Orleans.Providers.Streams.Common.PersistentStreamProvider' Orleans.Hosting.PersistentStreamConfiguratorExtensions' Orleans.Streams.HashRingBasedStreamQueueMapper' Orleans.Providers.Streams.SimpleMessageStream.SimpleMessageStreamProvider' Orleans.Hosting.ClientStreamExtensions,Orleans.IOptionFormatter' Orleans.IOptionFormatterResolver' Orleans.IConfigurationValidator' Orleans.Runtime.Constants' Orleans.Runtime.Configuration.StatisticsLevel' Orleans.Runtime.ITelemetryConsumer' Orleans.Runtime.Messaging.NetworkProtocolVersion' Orleans.ServiceLifecycleStage' Orleans.Streams.StreamPubSubType
Orleans.Core,Orleans.Runtime.Configuration,Orleans.RedactConnectionStringAttribute' Orleans.OutsideRuntimeClient' Orleans.Threading.ThreadPoolThread' Orleans.Threading.ThreadPoolTrackingStatistic' Orleans.Runtime.ThreadTrackingStatistic' Orleans.Serialization.SerializationStatisticsGroup' Orleans.Messaging.ClientMessageCenter' Orleans.Configuration.StatisticsOptions' Orleans.Runtime.SchedulerStatisticsGroup' Orleans.Runtime.StatisticsLevelExtensions,Orleans.Runtime.RuntimeVersion' Orleans.Runtime.Utils' Orleans.Configuration.MessagingOptions' Orleans.Runtime.ITelemetryConsumer
Orleans.Core,Orleans.Hosting,Orleans.ClusterClient' Orleans.ClientBuilder' Orleans.ClientBuilderExtensions' Orleans.ApplicationPartManagerExtensions' Orleans.IClientBuilder,Orleans.IClientBuilder' Orleans.Configuration.SimpleMessageStreamProviderOptions' Orleans.Streams.IQueueAdapterFactory' Orleans.Configuration.StreamPubSubOptions' Orleans.Streams.StreamPubSubType' Orleans.Configuration.StreamLifecycleOptions' Orleans.IClusterClientLifecycle' Orleans.Providers.Streams.Common.PersistentStreamProvider' Orleans.Providers.Streams.SimpleMessageStream.SimpleMessageStreamProvider
Orleans.Core,Orleans.Configuration.Overrides,,Orleans.IClientBuilder' Orleans.Configuration.ClusterOptions
Orleans.Core,Orleans.Configuration.Internal,,
Orleans.Core,Orleans.Configuration.Validators,Orleans.DefaultClientServices,Orleans.ApplicationParts.ApplicationPartManager' Orleans.ApplicationParts.AssemblyPart' Orleans.ApplicationParts.IApplicationFeatureProvider' Orleans.ApplicationParts.IApplicationPartManager' Orleans.ApplicationPartManagerExtensions' Orleans.IConfigurationValidator' Orleans.Runtime.ILocalSiloDetails' Orleans.Messaging.IGatewayListProvider' Orleans.Runtime.NoOpHostEnvironmentStatistics' Orleans.Configuration.LoadSheddingOptions
Orleans.Core,Orleans.GrainDirectory,Orleans.Runtime.IRemoteGrainDirectory' Orleans.SystemTargetInterfaces.RemoteClusterActivationResponse' Orleans.Runtime.IActivationInfo' Orleans.Runtime.IGrainInfo' Orleans.Serialization.BinaryTokenStreamReaderExtensinons,
Orleans.Core,Orleans.Streams,Orleans.Providers.Streams.Common.PersistentStreamProvider' Orleans.Streams.Core.StreamSubscriptionManager' Orleans.Providers.Streams.SimpleMessageStream.SimpleMessageStreamProvider' Orleans.Providers.Streams.SimpleMessageStream.SimpleMessageStreamProducerExtension' Orleans.Providers.Streams.SimpleMessageStream.SimpleMessageStreamProducer<T>' Orleans.Providers.ClientProviderRuntime' Orleans.Streams.Core.StreamSubscriptionManagerAdmin' Orleans.IInternalClusterClient' Orleans.Runtime.IRuntimeClient' Orleans.ClusterClient' Orleans.OutsideRuntimeClient' Orleans.DefaultClientServices' Orleans.Hosting.PersistentStreamConfiguratorExtensions' Orleans.Configuration.StreamPubSubOptions' Orleans.Configuration.SimpleMessageStreamProviderOptions' Orleans.Messaging.ClientMessageCenter' Orleans.Runtime.IClusterTypeManager' Orleans.Hosting.ClusterClientPersistentStreamConfigurator' Orleans.Hosting.ClientStreamExtensions,Orleans.Runtime.IRingIdentifier' Orleans.AsyncLock' Orleans.ErrorCode' Orleans.Streams.Core.StreamSubscription' Orleans.Runtime.IRuntimeClient' Orleans.Providers.Streams.Common.PersistentStreamProviderCommand' Orleans.Runtime.RequestContextExtensions' Orleans.Serialization.SerializationManager' Orleans.Runtime.Utils' Orleans.Runtime.CachedTypeResolver' Orleans.Runtime.ITypeResolver' Orleans.Runtime.IConsistentRingProviderForGrains' Orleans.Providers.IProviderRuntime' Orleans.IInternalGrainFactory' Orleans.Runtime.TypeUtils' Orleans.CodeGeneration.GrainInterfaceUtils' Orleans.Runtime.HashRing<T>' Orleans.Runtime.IRingRange' Orleans.Runtime.RangeFactory' Orleans.Configuration.HashRingStreamQueueMapperOptions
Orleans.Core,Orleans.LogConsistency,,Orleans.MultiCluster.ILogConsistencyProtocolMessage' Orleans.MultiCluster.MultiClusterConfiguration' Orleans.Serialization.SerializationManager' Orleans.Runtime.Message' Orleans.Storage.IGrainStorage' Orleans.ClientOptionsLogger' Orleans.Runtime.IGrainActivationContext' Orleans.MultiCluster.ILogConsistencyProtocolParticipant' Orleans.Storage.BadGrainStorageConfigException
Orleans.Core,Orleans.Messaging,Orleans.Runtime.Messaging.ClientOutboundConnectionFactory' Orleans.Runtime.Messaging.ClientOutboundConnection' Orleans.OutsideRuntimeClient' Orleans.DefaultClientServices' Orleans.Configuration.Validators.ClientClusteringValidator' Orleans.ClientBuilderExtensions' Orleans.Runtime.Messaging.Connection' Orleans.Runtime.NetworkingStatisticsGroup' Orleans.Runtime.MessagingStatisticsGroup,Orleans.IClusterConnectionStatusListener' Orleans.IInternalGrainFactory' Orleans.ErrorCode' Orleans.Runtime.IMessageCenter' Orleans.Runtime.Message' Orleans.Runtime.Categories' Orleans.Runtime.Directions' Orleans.Runtime.RejectionTypes' Orleans.Runtime.MessageFactory' Orleans.Runtime.Constants' Orleans.Runtime.IGrainTypeResolver' Orleans.Runtime.IRuntimeClient' Orleans.Runtime.IClusterTypeManager' Orleans.Runtime.IntValueStatistic' Orleans.Runtime.MessagingStatisticsGroup' Orleans.Runtime.QueueTrackingStatistic' Orleans.Runtime.StatisticNames' Orleans.Runtime.Utils' Orleans.Configuration.ClientMessagingOptions' Orleans.Configuration.MessagingOptions' Orleans.Configuration.StatisticsOptions' Orleans.Runtime.Configuration.StatisticsLevel' Orleans.Streams.ImplicitStreamSubscriberTable' Orleans.Runtime.Messaging.Connection' Orleans.Runtime.Messaging.ConnectionManager' Orleans.Serialization.SerializationManager' Orleans.Runtime.SafeTimer' Orleans.Internal.SafeRandom' Orleans.Configuration.GatewayOptions' Orleans.Configuration.StaticGatewayListProviderOptions
Orleans.Core,Orleans.Runtime.Messaging,Orleans.DefaultClientServices' Orleans.Messaging.ClientMessageCenter' Orleans.Messaging.GatewayManager' Orleans.Configuration.ConnectionOptions,Orleans.Runtime.Message' Orleans.Runtime.HeadersContainer' Orleans.Configuration.MessagingOptions' Orleans.Networking.Shared.SharedMemoryPool' Orleans.Serialization.BinaryTokenStreamReader2' Orleans.Serialization.BinaryTokenStreamWriter2<TBufferWriter>' Orleans.Serialization.DeserializationContext' Orleans.Serialization.SerializationContext' Orleans.Serialization.SerializationManager' Orleans.ErrorCode' Orleans.Runtime.IMessageCenter' Orleans.Runtime.Directions' Orleans.Runtime.RejectionTypes' Orleans.Runtime.MessageFactory' Orleans.Runtime.MessagingStatisticsGroup' Orleans.Configuration.ConnectionOptions' Orleans.Messaging.ClientMessageCenter' Orleans.Messaging.ConnectionDirection' Orleans.Configuration.ClientConnectionOptions' Orleans.Runtime.ResponseTypes' Orleans.Runtime.Response' Orleans.Runtime.CounterStatistic' Orleans.Runtime.NetworkingStatisticsGroup' Orleans.ServiceLifecycleStage' Orleans.Serialization.SerializationTokenType
Orleans.Core,Orleans.MultiCluster,Orleans.Runtime.IManagementGrain' Orleans.LogConsistency.LogConsistentGrain<TView>' Orleans.LogConsistency.ILogViewAdaptor' Orleans.LogConsistency.ILogConsistencyProtocolServices' Orleans.SystemTargetInterfaces.ILogConsistencyProtocolGateway,
Orleans.Core,Orleans.Networking.Shared,Orleans.Runtime.Messaging.MessageSerializer' Orleans.DefaultClientServices,
Orleans.Core,Orleans.Runtime.Placement,,Orleans.Runtime.SiloStatus
Orleans.Core,Orleans.Providers,Orleans.OutsideRuntimeClient' Orleans.DefaultClientServices' Orleans.Providers.Streams.Common.PersistentStreamProvider' Orleans.Storage.IStorageProvider' Orleans.Serialization.OrleansJsonSerializer' Orleans.Streams.IStreamProviderRuntime' Orleans.Providers.Streams.SimpleMessageStream.SimpleMessageStreamProvider,Orleans.AsyncLock' Orleans.GrainFactory' Orleans.IInternalGrainFactory' Orleans.Runtime.IConsistentRingProviderForGrains' Orleans.Runtime.IRuntimeClient' Orleans.Runtime.AsyncTaskSafeTimer' Orleans.Configuration.ClusterOptions' Orleans.Streams.StreamDirectory' Orleans.Streams.IStreamProviderRuntime' Orleans.Streams.StreamPubSubType' Orleans.Streams.IStreamPubSub' Orleans.Streams.GrainBasedPubSubRuntime' Orleans.Streams.ImplicitStreamPubSub' Orleans.Streams.ImplicitStreamSubscriberTable' Orleans.Streams.StreamPubSubImpl' Orleans.Runtime.TypeUtils' Orleans.ErrorCode
Orleans.Core,Orleans.Storage,Orleans.LogConsistency.ILogViewAdaptorFactory' Orleans.LogConsistency.LogConsistentGrain<TView>,Orleans.Runtime.TypeFormattingOptions' Orleans.IGrainState' Orleans.Runtime.Message' Orleans.Providers.IProvider
Orleans.Core,Orleans.LeaseProviders,,
Orleans.Core,Orleans.Runtime.Scheduler,,
Orleans.Core,Orleans.Serialization,Orleans.DefaultClientServices' Orleans.Runtime.GrainIdExtensions' Orleans.Runtime.Messaging.ConnectionPreamble' Orleans.Runtime.Messaging.MessageSerializer' Orleans.CodeGeneration.GenericMethodInvoker' Orleans.LogConsistency.ILogConsistencyProtocolServices' Orleans.Runtime.MessageFactory' Orleans.Runtime.GrainReferenceRuntime' Orleans.ClientBuilder' Orleans.Messaging.ClientMessageCenter' Orleans.Runtime.RequestContextExtensions' Orleans.InvokableObjectManager' Orleans.Transactions.ITransactionInfo' Orleans.Streams.PersistentStreamProducer<T>' Orleans.OutsideRuntimeClient' Orleans.Providers.Streams.SimpleMessageStream.SimpleMessageStreamProvider' Orleans.Providers.Streams.Common.PersistentStreamProvider' Orleans.Providers.Streams.SimpleMessageStream.SimpleMessageStreamProducer<T>' Orleans.Runtime.Message' Orleans.Runtime.ClientStatisticsManager' Orleans.Runtime.LogStatistics,Orleans.Runtime.CachedTypeResolver' Orleans.Runtime.CorrelationId' Orleans.Runtime.Response' Orleans.GrainDirectory.GrainDirectoryEntryStatus' Orleans.Runtime.ByteArrayBuilder' Orleans.Runtime.RuntimeTypeHandlerEqualityComparer' Orleans.Runtime.ITypeResolver' Orleans.Utilities.RuntimeTypeNameFormatter' Orleans.ApplicationParts.IApplicationFeatureProvider' Orleans.ApplicationParts.IApplicationPart' Orleans.Runtime.Message' Orleans.Runtime.Categories' Orleans.Runtime.Directions' Orleans.Runtime.ResponseTypes' Orleans.Runtime.RejectionTypes' Orleans.Runtime.IRuntimeClient' Orleans.Utilities.CachedReadConcurrentDictionary<TKey;TValue>' Orleans.ReferenceEqualsComparer' Orleans.Runtime.TypeUtils' Orleans.Providers.IProviderConfiguration' Orleans.ApplicationParts.IApplicationPartManager' Orleans.ErrorCode' Orleans.Runtime.TypeFormattingOptions' Orleans.Runtime.HeadersContainer' Orleans.Configuration.SerializationProviderOptions' Orleans.Runtime.CounterStorage' Orleans.Runtime.CounterStatistic' Orleans.Runtime.IntValueStatistic' Orleans.Runtime.StatisticNames' Orleans.Runtime.Utils' Orleans.Configuration.StatisticsOptions' Orleans.Runtime.Configuration.StatisticsLevel
Orleans.Core,Orleans.Statistics,Orleans.DefaultClientServices,
Orleans.Core,Orleans.Streams.Core,Orleans.Providers.Streams.Common.PersistentStreamProvider' Orleans.Providers.Streams.SimpleMessageStream.SimpleMessageStreamProvider' Orleans.Streams.PubSub.StreamSubscriptionManagerExtensions' Orleans.DefaultClientServices' Orleans.Streams.IPubSubRendezvousGrain' Orleans.Streams.IStreamPubSub' Orleans.Streams.GrainBasedPubSubRuntime' Orleans.Streams.StreamPubSubImpl' Orleans.Streams.StreamConsumer<T>' Orleans.Streams.ImplicitStreamPubSub,Orleans.Streams.StreamId' Orleans.Streams.IStreamConsumerExtension' Orleans.Streams.IStreamPubSub' Orleans.Streams.IStreamProviderRuntime' Orleans.Streams.StreamPubSubType
