Project,Namespace,Ca types,Ce types
Glimpse.Mvc,Glimpse.Mvc.AlternateType,Glimpse.Mvc.Message.MvcTimelineExtension' Glimpse.Mvc.Display.MvcDisplay' Glimpse.Mvc.Tab.ModelBinding' Glimpse.Mvc.Model.ModelBindingModel' Glimpse.Mvc.Tab.Views' Glimpse.Mvc.Model.ViewsModel' Glimpse.Mvc.Tab.Metadata' Glimpse.Mvc.Inspector.ExecutionInspector' Glimpse.Mvc.Inspector.DependencyInjectionInspector' Glimpse.Mvc.Inspector.ModelBinderInspector' Glimpse.Mvc.Inspector.ViewEngineInspector,Glimpse.Mvc.Message.FilterBounds' Glimpse.Mvc.Message.FilterCategory' Glimpse.Mvc.Message.IBoundedFilterMessage' Glimpse.Mvc.Message.ICanceledBasedFilterMessage' Glimpse.Mvc.Message.IExceptionFilterMessage' Glimpse.Mvc.Message.IExecutionMessage' Glimpse.Mvc.Message.MvcTimelineCategory' Glimpse.Mvc.Message.FilterBounds' Glimpse.Mvc.Message.FilterCategory' Glimpse.Mvc.Message.IBoundedFilterMessage' Glimpse.Mvc.Message.ICanceledBasedFilterMessage' Glimpse.Mvc.Message.IExceptionFilterMessage' Glimpse.Mvc.Message.IExecutionMessage' Glimpse.Mvc.Message.MvcTimelineCategory' Glimpse.Mvc.Message.FilterBounds' Glimpse.Mvc.Message.FilterCategory' Glimpse.Mvc.Message.IBoundedFilterMessage' Glimpse.Mvc.Message.ICanceledBasedFilterMessage' Glimpse.Mvc.Message.IExceptionFilterMessage' Glimpse.Mvc.Message.IExecutionMessage' Glimpse.Mvc.Message.MvcTimelineCategory' Glimpse.Mvc.Message.FilterBounds' Glimpse.Mvc.Message.FilterCategory' Glimpse.Mvc.Message.IBoundedFilterMessage' Glimpse.Mvc.Message.ICanceledBasedFilterMessage' Glimpse.Mvc.Message.IExceptionFilterMessage' Glimpse.Mvc.Message.IExecutionMessage' Glimpse.Mvc.Message.MvcTimelineCategory' Glimpse.Mvc.Message.FilterBounds' Glimpse.Mvc.Message.FilterCategory' Glimpse.Mvc.Message.IBoundedFilterMessage' Glimpse.Mvc.Message.ICanceledBasedFilterMessage' Glimpse.Mvc.Message.IExceptionFilterMessage' Glimpse.Mvc.Message.IExecutionMessage' Glimpse.Mvc.Message.MvcTimelineCategory' Glimpse.Mvc.Message.IInvokeActionResultMessage' Glimpse.Mvc.Message.IInvokeActionResultMessage' Glimpse.Mvc.Message.IInvokeActionResultMessage' Glimpse.Mvc.Message.IInvokeActionResultMessage' Glimpse.Mvc.Message.IInvokeActionResultMessage' Glimpse.Mvc.Message.IFilterMessage' Glimpse.Mvc.Message.IFilterMessage' Glimpse.Mvc.Message.IFilterMessage' Glimpse.Mvc.Message.IFilterMessage' Glimpse.Mvc.Message.IFilterMessage' Glimpse.Mvc2.Backport.IEnumerableValueProvider' Glimpse.Mvc3.Backport.IEnumerableValueProvider' Glimpse.Mvc2.Backport.IUnvalidatedValueProvider' Glimpse.Mvc.Message.IActionMessage' Glimpse.Mvc.Message.IActionMessage' Glimpse.Mvc.Message.IActionMessage' Glimpse.Mvc.Message.IActionMessage' Glimpse.Mvc.Message.IActionMessage' Glimpse.Mvc.Message.IChildActionMessage' Glimpse.Mvc.Resources' Glimpse.Mvc.Message.IChildActionMessage' Glimpse.Mvc.Resources' Glimpse.Mvc.Message.IChildActionMessage' Glimpse.Mvc.Resources' Glimpse.Mvc.Message.IChildActionMessage' Glimpse.Mvc.Resources' Glimpse.Mvc.Message.IChildActionMessage' Glimpse.Mvc.Resources
Glimpse.Mvc,Glimpse.Mvc.Display,,Glimpse.Mvc.AlternateType.Message' Glimpse.Mvc.AlternateType.ActionInvoker' Glimpse.Mvc.AlternateType.InvokeActionMethod' Glimpse.Mvc.AlternateType.View' Glimpse.Mvc.AlternateType.Render' Glimpse.Mvc.AlternateType.ViewEngine' Glimpse.Mvc.AlternateType.FindViews' Glimpse.Mvc.Model.MvcDisplayModel' Glimpse.Mvc.AlternateType.Message' Glimpse.Mvc.AlternateType.ActionInvoker' Glimpse.Mvc.AlternateType.InvokeActionMethod' Glimpse.Mvc.AlternateType.View' Glimpse.Mvc.AlternateType.Render' Glimpse.Mvc.AlternateType.ViewEngine' Glimpse.Mvc.AlternateType.FindViews' Glimpse.Mvc.Model.MvcDisplayModel' Glimpse.Mvc.AlternateType.Message' Glimpse.Mvc.AlternateType.ActionInvoker' Glimpse.Mvc.AlternateType.InvokeActionMethod' Glimpse.Mvc.AlternateType.View' Glimpse.Mvc.AlternateType.Render' Glimpse.Mvc.AlternateType.ViewEngine' Glimpse.Mvc.AlternateType.FindViews' Glimpse.Mvc.Model.MvcDisplayModel' Glimpse.Mvc.AlternateType.Message' Glimpse.Mvc.AlternateType.ActionInvoker' Glimpse.Mvc.AlternateType.InvokeActionMethod' Glimpse.Mvc.AlternateType.View' Glimpse.Mvc.AlternateType.Render' Glimpse.Mvc.AlternateType.ViewEngine' Glimpse.Mvc.AlternateType.FindViews' Glimpse.Mvc.Model.MvcDisplayModel' Glimpse.Mvc.AlternateType.Message' Glimpse.Mvc.AlternateType.ActionInvoker' Glimpse.Mvc.AlternateType.InvokeActionMethod' Glimpse.Mvc.AlternateType.View' Glimpse.Mvc.AlternateType.Render' Glimpse.Mvc.AlternateType.ViewEngine' Glimpse.Mvc.AlternateType.FindViews' Glimpse.Mvc.Model.MvcDisplayModel
Glimpse.Mvc,Glimpse.Mvc.Html,,
Glimpse.Mvc,Glimpse.Mvc.Message,Glimpse.Mvc.Model.ExecutionModel' Glimpse.Mvc.AlternateType.ResultFilter' Glimpse.Mvc.AlternateType.ActionFilter' Glimpse.Mvc.AlternateType.ExceptionFilter' Glimpse.Mvc.AlternateType.AuthorizationFilter' Glimpse.Mvc.AlternateType.View' Glimpse.Mvc.AlternateType.ViewEngine' Glimpse.Mvc.AlternateType.ActionInvoker' Glimpse.Mvc.Tab.Execution' Glimpse.Mvc.AlternateType.AsyncActionInvoker,Glimpse.Mvc.AlternateType.Message' Glimpse.Mvc.AlternateType.ActionInvoker' Glimpse.Mvc.AlternateType.InvokeActionMethod' Glimpse.Mvc.AlternateType.View' Glimpse.Mvc.AlternateType.Render' Glimpse.Mvc.AlternateType.Message' Glimpse.Mvc.AlternateType.ActionInvoker' Glimpse.Mvc.AlternateType.InvokeActionMethod' Glimpse.Mvc.AlternateType.View' Glimpse.Mvc.AlternateType.Render' Glimpse.Mvc.AlternateType.Message' Glimpse.Mvc.AlternateType.ActionInvoker' Glimpse.Mvc.AlternateType.InvokeActionMethod' Glimpse.Mvc.AlternateType.View' Glimpse.Mvc.AlternateType.Render' Glimpse.Mvc.AlternateType.Message' Glimpse.Mvc.AlternateType.ActionInvoker' Glimpse.Mvc.AlternateType.InvokeActionMethod' Glimpse.Mvc.AlternateType.View' Glimpse.Mvc.AlternateType.Render' Glimpse.Mvc.AlternateType.Message' Glimpse.Mvc.AlternateType.ActionInvoker' Glimpse.Mvc.AlternateType.InvokeActionMethod' Glimpse.Mvc.AlternateType.View' Glimpse.Mvc.AlternateType.Render
Glimpse.Mvc,Glimpse.Mvc.Model,Glimpse.Mvc.SerializationConverter.ListOfExecutionModelConverter' Glimpse.Mvc.Tab.Execution' Glimpse.Mvc.SerializationConverter.ListOfMetadataItemModelConverter' Glimpse.Mvc.Tab.Metadata' Glimpse.Mvc.Tab.ModelBinding' Glimpse.Mvc.SerializationConverter.MvcDisplayModelConverter' Glimpse.Mvc.Display.MvcDisplay' Glimpse.Mvc.SerializationConverter.ListOfViewsModelConverter' Glimpse.Mvc.Tab.Views,Glimpse.Mvc.Message.FilterBounds' Glimpse.Mvc.Message.FilterCategory' Glimpse.Mvc.Message.IBoundedFilterMessage' Glimpse.Mvc.Message.IExecutionMessage' Glimpse.Mvc.Message.IFilterMessage' Glimpse.Mvc.Message.FilterBounds' Glimpse.Mvc.Message.FilterCategory' Glimpse.Mvc.Message.IBoundedFilterMessage' Glimpse.Mvc.Message.IExecutionMessage' Glimpse.Mvc.Message.IFilterMessage' Glimpse.Mvc.Message.FilterBounds' Glimpse.Mvc.Message.FilterCategory' Glimpse.Mvc.Message.IBoundedFilterMessage' Glimpse.Mvc.Message.IExecutionMessage' Glimpse.Mvc.Message.IFilterMessage' Glimpse.Mvc.Message.FilterBounds' Glimpse.Mvc.Message.FilterCategory' Glimpse.Mvc.Message.IBoundedFilterMessage' Glimpse.Mvc.Message.IExecutionMessage' Glimpse.Mvc.Message.IFilterMessage' Glimpse.Mvc.Message.FilterBounds' Glimpse.Mvc.Message.FilterCategory' Glimpse.Mvc.Message.IBoundedFilterMessage' Glimpse.Mvc.Message.IExecutionMessage' Glimpse.Mvc.Message.IFilterMessage' Glimpse.Mvc.AlternateType.Message' Glimpse.Mvc.AlternateType.ModelBinder' Glimpse.Mvc.AlternateType.BindModel' Glimpse.Mvc.AlternateType.ValueProvider<T>' Glimpse.Mvc.AlternateType.ContainsPrefix' Glimpse.Mvc.AlternateType.GetValue' Glimpse.Mvc.AlternateType.Message' Glimpse.Mvc.AlternateType.ModelBinder' Glimpse.Mvc.AlternateType.BindModel' Glimpse.Mvc.AlternateType.ValueProvider<T>' Glimpse.Mvc.AlternateType.ContainsPrefix' Glimpse.Mvc.AlternateType.GetValue' Glimpse.Mvc.AlternateType.Message' Glimpse.Mvc.AlternateType.ModelBinder' Glimpse.Mvc.AlternateType.BindModel' Glimpse.Mvc.AlternateType.ValueProvider<T>' Glimpse.Mvc.AlternateType.ContainsPrefix' Glimpse.Mvc.AlternateType.GetValue' Glimpse.Mvc.AlternateType.Message' Glimpse.Mvc.AlternateType.ModelBinder' Glimpse.Mvc.AlternateType.BindModel' Glimpse.Mvc.AlternateType.ValueProvider<T>' Glimpse.Mvc.AlternateType.ContainsPrefix' Glimpse.Mvc.AlternateType.GetValue' Glimpse.Mvc.AlternateType.Message' Glimpse.Mvc.AlternateType.ModelBinder' Glimpse.Mvc.AlternateType.BindModel' Glimpse.Mvc.AlternateType.ValueProvider<T>' Glimpse.Mvc.AlternateType.ContainsPrefix' Glimpse.Mvc.AlternateType.GetValue' Glimpse.Mvc.AlternateType.View' Glimpse.Mvc.AlternateType.Render' Glimpse.Mvc.AlternateType.ViewEngine' Glimpse.Mvc.AlternateType.FindViews' Glimpse.Mvc.AlternateType.View' Glimpse.Mvc.AlternateType.Render' Glimpse.Mvc.AlternateType.ViewEngine' Glimpse.Mvc.AlternateType.FindViews' Glimpse.Mvc.AlternateType.View' Glimpse.Mvc.AlternateType.Render' Glimpse.Mvc.AlternateType.ViewEngine' Glimpse.Mvc.AlternateType.FindViews' Glimpse.Mvc.AlternateType.View' Glimpse.Mvc.AlternateType.Render' Glimpse.Mvc.AlternateType.ViewEngine' Glimpse.Mvc.AlternateType.FindViews' Glimpse.Mvc.AlternateType.View' Glimpse.Mvc.AlternateType.Render' Glimpse.Mvc.AlternateType.ViewEngine' Glimpse.Mvc.AlternateType.FindViews
Glimpse.Mvc,Glimpse.Mvc.Inspector,,Glimpse.Mvc.AlternateType.DependencyResolver' Glimpse.Mvc.Resources' Glimpse.Mvc.AlternateType.DependencyResolver' Glimpse.Mvc.Resources' Glimpse.Mvc.AlternateType.DependencyResolver' Glimpse.Mvc.Resources' Glimpse.Mvc.AlternateType.DependencyResolver' Glimpse.Mvc.Resources' Glimpse.Mvc.AlternateType.ControllerFactory' Glimpse.Mvc.AlternateType.ControllerFactory' Glimpse.Mvc.Resources' Glimpse.Mvc.AlternateType.ControllerFactory' Glimpse.Mvc.AlternateType.ControllerFactory' Glimpse.Mvc.AlternateType.ControllerFactory' Glimpse.Mvc.AlternateType.ModelBinder' Glimpse.Mvc.AlternateType.ModelBinderProvider' Glimpse.Mvc.AlternateType.ValueProviderFactory' Glimpse.Mvc.AlternateType.ModelBinder' Glimpse.Mvc.AlternateType.ValueProviderFactory' Glimpse.Mvc.AlternateType.ModelBinder' Glimpse.Mvc.AlternateType.ModelBinderProvider' Glimpse.Mvc.AlternateType.ValueProviderFactory' Glimpse.Mvc.AlternateType.ModelBinder' Glimpse.Mvc.AlternateType.ModelBinderProvider' Glimpse.Mvc.AlternateType.ValueProviderFactory' Glimpse.Mvc.AlternateType.ModelBinder' Glimpse.Mvc.AlternateType.ModelBinderProvider' Glimpse.Mvc.AlternateType.ValueProviderFactory' Glimpse.Mvc.AlternateType.ViewEngine' Glimpse.Mvc.AlternateType.ViewEngine' Glimpse.Mvc.AlternateType.ViewEngine' Glimpse.Mvc.AlternateType.ViewEngine' Glimpse.Mvc.AlternateType.ViewEngine
Glimpse.Mvc,Glimpse.Mvc,Glimpse.Mvc.AlternateType.ViewEngine' Glimpse.Mvc.Inspector.ExecutionInspector' Glimpse.Mvc.Inspector.ViewEngineInspector' Glimpse.Mvc.Inspector.DependencyInjectionInspector' Glimpse.Mvc.Inspector.ModelBinderInspector,
Glimpse.Mvc,Glimpse.Mvc.SerializationConverter,,Glimpse.Mvc.Model.ExecutionModel' Glimpse.Mvc.Model.ExecutionModel' Glimpse.Mvc.Model.ExecutionModel' Glimpse.Mvc.Model.ExecutionModel' Glimpse.Mvc.Model.ExecutionModel' Glimpse.Mvc.Model.MetadataContentModel' Glimpse.Mvc.Model.MetadataItemModel' Glimpse.Mvc.Model.MetadataContentModel' Glimpse.Mvc.Model.MetadataItemModel' Glimpse.Mvc.Model.MetadataContentModel' Glimpse.Mvc.Model.MetadataItemModel' Glimpse.Mvc.Model.MetadataContentModel' Glimpse.Mvc.Model.MetadataItemModel' Glimpse.Mvc.Model.MetadataContentModel' Glimpse.Mvc.Model.MetadataItemModel' Glimpse.Mvc.Model.ViewsModel' Glimpse.Mvc.Model.ViewsModel' Glimpse.Mvc.Model.ViewsModel' Glimpse.Mvc.Model.ViewsModel' Glimpse.Mvc.Model.ViewsModel' Glimpse.Mvc.Model.MvcDisplayModel' Glimpse.Mvc.Model.MvcDisplayModel' Glimpse.Mvc.Model.MvcDisplayModel' Glimpse.Mvc.Model.MvcDisplayModel' Glimpse.Mvc.Model.MvcDisplayModel
Glimpse.Mvc,Glimpse.Mvc.Tab,,Glimpse.Mvc.Message.IExecutionMessage' Glimpse.Mvc.Model.ExecutionModel' Glimpse.Mvc.Message.IExecutionMessage' Glimpse.Mvc.Model.ExecutionModel' Glimpse.Mvc.Message.IExecutionMessage' Glimpse.Mvc.Model.ExecutionModel' Glimpse.Mvc.Message.IExecutionMessage' Glimpse.Mvc.Model.ExecutionModel' Glimpse.Mvc.Message.IExecutionMessage' Glimpse.Mvc.Model.ExecutionModel' Glimpse.Mvc.AlternateType.Message' Glimpse.Mvc.AlternateType.View' Glimpse.Mvc.AlternateType.Render' Glimpse.Mvc.Model.MetadataContentModel' Glimpse.Mvc.Model.MetadataItemModel' Glimpse.Mvc.Model.MetadataPropertyItemModel' Glimpse.Mvc.AlternateType.Message' Glimpse.Mvc.AlternateType.View' Glimpse.Mvc.AlternateType.Render' Glimpse.Mvc.Model.MetadataContentModel' Glimpse.Mvc.Model.MetadataItemModel' Glimpse.Mvc.Model.MetadataPropertyItemModel' Glimpse.Mvc.AlternateType.Message' Glimpse.Mvc.AlternateType.View' Glimpse.Mvc.AlternateType.Render' Glimpse.Mvc.Model.MetadataContentModel' Glimpse.Mvc.Model.MetadataItemModel' Glimpse.Mvc.Model.MetadataPropertyItemModel' Glimpse.Mvc.AlternateType.Message' Glimpse.Mvc.AlternateType.View' Glimpse.Mvc.AlternateType.Render' Glimpse.Mvc.Model.MetadataContentModel' Glimpse.Mvc.Model.MetadataItemModel' Glimpse.Mvc.Model.MetadataPropertyItemModel' Glimpse.Mvc.AlternateType.Message' Glimpse.Mvc.AlternateType.View' Glimpse.Mvc.AlternateType.Render' Glimpse.Mvc.Model.MetadataContentModel' Glimpse.Mvc.Model.MetadataItemModel' Glimpse.Mvc.Model.MetadataPropertyItemModel' Glimpse.Mvc.AlternateType.ModelBinder' Glimpse.Mvc.AlternateType.BindProperty' Glimpse.Mvc.AlternateType.BindModel' Glimpse.Mvc.AlternateType.ValueProvider<T>' Glimpse.Mvc.AlternateType.ContainsPrefix' Glimpse.Mvc.AlternateType.GetValue' Glimpse.Mvc.Model.ModelBindingModel' Glimpse.Mvc.AlternateType.ModelBinder' Glimpse.Mvc.AlternateType.BindProperty' Glimpse.Mvc.AlternateType.BindModel' Glimpse.Mvc.AlternateType.ValueProvider<T>' Glimpse.Mvc.AlternateType.ContainsPrefix' Glimpse.Mvc.AlternateType.GetValue' Glimpse.Mvc.Model.ModelBindingModel' Glimpse.Mvc2.Backport.IEnumerableValueProvider' Glimpse.Mvc2.Backport.IUnvalidatedValueProvider' Glimpse.Mvc.AlternateType.ModelBinder' Glimpse.Mvc.AlternateType.BindProperty' Glimpse.Mvc.AlternateType.BindModel' Glimpse.Mvc.AlternateType.ValueProvider<T>' Glimpse.Mvc.AlternateType.ContainsPrefix' Glimpse.Mvc.AlternateType.GetValue' Glimpse.Mvc.Model.ModelBindingModel' Glimpse.Mvc3.Backport.IEnumerableValueProvider' Glimpse.Mvc.AlternateType.ModelBinder' Glimpse.Mvc.AlternateType.BindProperty' Glimpse.Mvc.AlternateType.BindModel' Glimpse.Mvc.AlternateType.ValueProvider<T>' Glimpse.Mvc.AlternateType.ContainsPrefix' Glimpse.Mvc.AlternateType.GetValue' Glimpse.Mvc.Model.ModelBindingModel' Glimpse.Mvc.AlternateType.ModelBinder' Glimpse.Mvc.AlternateType.BindProperty' Glimpse.Mvc.AlternateType.BindModel' Glimpse.Mvc.AlternateType.ValueProvider<T>' Glimpse.Mvc.AlternateType.ContainsPrefix' Glimpse.Mvc.AlternateType.GetValue' Glimpse.Mvc.Model.ModelBindingModel' Glimpse.Mvc.AlternateType.ViewEngine' Glimpse.Mvc.AlternateType.FindViews' Glimpse.Mvc.Model.ViewsModel' Glimpse.Mvc.AlternateType.ViewEngine' Glimpse.Mvc.AlternateType.FindViews' Glimpse.Mvc.Model.ViewsModel' Glimpse.Mvc.AlternateType.ViewEngine' Glimpse.Mvc.AlternateType.FindViews' Glimpse.Mvc.Model.ViewsModel' Glimpse.Mvc.AlternateType.ViewEngine' Glimpse.Mvc.AlternateType.FindViews' Glimpse.Mvc.Model.ViewsModel' Glimpse.Mvc.AlternateType.ViewEngine' Glimpse.Mvc.AlternateType.FindViews' Glimpse.Mvc.Model.ViewsModel
