Project,Namespace,Ca types,Ce types
Uhuru.Prison,Uhuru.Prison.Allowances,,Uhuru.Prison.Utilities.WindowsUsersAndGroups' Uhuru.Prison.PrisonUser' Uhuru.Prison.Prison' Uhuru.Prison.RuleInstanceInfo' Uhuru.Prison.RuleType' Uhuru.Prison.PrisonRules' Uhuru.Prison.Logger' Uhuru.Prison.Utilities.Command
Uhuru.Prison,Uhuru.Prison.ExecutorService,Uhuru.Prison.Prison' Uhuru.Prison.ChangeSession.ChangeSessionWindowsService,Uhuru.Prison.Prison
Uhuru.Prison,Uhuru.Prison,Uhuru.Prison.Allowances.IISGroup' Uhuru.Prison.Restrictions.CPU' Uhuru.Prison.Restrictions.Disk' Uhuru.Prison.Restrictions.Filesystem' Uhuru.Prison.Restrictions.Memory' Uhuru.Prison.Cmd.Program' Uhuru.Prison.FakesUnitTest.TestNetwork' Uhuru.Prison.FakesUnitTest.TestWindowStation' Uhuru.Prison.FakesUnitTest.TestHttpsys' Uhuru.Prison.Allowances.Httpsys' Uhuru.Prison.Restrictions.Network' Uhuru.Prison.Restrictions.WindowStation' Uhuru.Prison.Tests.Rules.TestWindowStationRule' Uhuru.Prison.Tests.Rules.TestFilesystemRule' Uhuru.Prison.Tests.Rules.TestNetworkAndFirewall' Uhuru.Prison.Tests.Rules.TestDiskRule' Uhuru.Prison.Tests.Rules.TestMemoryRule' Uhuru.Prison.Tests.JobObjects.TestJobObjects' Uhuru.Prison.Tests.Serialization.TestPrisonSerialization' Uhuru.Prison.FakesUnitTest.JobObjects.TestJobObjects' Uhuru.Prison.FakesUnitTest.TestFilesystem' Uhuru.Prison.FakesUnitTest.TestDisk' Uhuru.Prison.FakesUnitTest.TestPrisonClass' Uhuru.Prison.FakesUnitTest.TestIISGroup' Uhuru.Prison.Tests.Utilities' Uhuru.Prison.FakesUnitTest.PrisonTestsHelper' Uhuru.Prison.Tests.Rules.TestPersistence' Uhuru.Prison.ExecutorService.IExecutor' Uhuru.Prison.ChangeSession.ChangeSessionWindowsService' Uhuru.Prison.ChangeSession.Executor' Uhuru.Prison.Tests.Rules.TestUsers' Uhuru.Prison.FakesUnitTest.TestPrisonUser,Uhuru.Prison.Utilities.WindowsJobObjects.JobObject' Uhuru.Prison.Utilities.Command' Uhuru.Prison.ExecutorService.IExecutor' Uhuru.Prison.Restrictions.WindowStation' Uhuru.Prison.Utilities.WindowsUsersAndGroups' Uhuru.Prison.Utilities.SystemVirtualAddressSpaceQuotas
Uhuru.Prison,Uhuru.Prison.Restrictions,Uhuru.Prison.Prison,Uhuru.Prison.Prison' Uhuru.Prison.RuleInstanceInfo' Uhuru.Prison.RuleType' Uhuru.Prison.PrisonUser' Uhuru.Prison.PrisonRules' Uhuru.Prison.Utilities.WindowsUsersAndGroups' Uhuru.Prison.Utilities.Command' Uhuru.Prison.SECURITY_ATTRIBUTES' Uhuru.Prison.Native' Uhuru.Prison.WINDOWS_STATION_ACCESS_MASK' Uhuru.Prison.ACCESS_MASK
Uhuru.Prison,Uhuru.Prison.Utilities,Uhuru.Prison.Allowances.Httpsys' Uhuru.Prison.Prison' Uhuru.Prison.Restrictions.Filesystem' Uhuru.Prison.Tests.TestDirectoryTools.TestDirectoryTools' Uhuru.Prison.Allowances.IISGroup' Uhuru.Prison.PrisonUser,
Uhuru.Prison,Uhuru.Prison.Utilities.WindowsJobObjects,Uhuru.Prison.Prison' Uhuru.Prison.Tests.Rules.TestMemoryRule,
