Project,Namespace,Ca types,Ce types
Sustainsys.Saml2(netstandard2.0),Sustainsys.Saml2,Sustainsys.Saml2.WebSso.Saml2ArtifactBinding' Sustainsys.Saml2.Configuration.ServiceCertificateElement' Sustainsys.Saml2.Configuration.SPOptions' Sustainsys.Saml2.Configuration.ServiceCertificateCollection' Sustainsys.Saml2.Configuration.FederationCollection' Sustainsys.Saml2.Metadata.EntityDescriptor' Sustainsys.Saml2.Metadata.EntitiesDescriptor' Sustainsys.Saml2.Metadata.AffiliationDescriptor' Sustainsys.Saml2.Metadata.RoleDescriptor' Sustainsys.Saml2.Metadata.MetadataRefreshScheduler' Sustainsys.Saml2.Metadata.MetadataSerializer' Sustainsys.Saml2.WebSso.SignInCommand' Sustainsys.Saml2.Configuration.IdentityProviderCollection' Sustainsys.Saml2.Saml2P.Saml2Response' Sustainsys.Saml2.WebSso.Saml2RedirectBinding' Sustainsys.Saml2.Configuration.Saml2Notifications' Sustainsys.Saml2.WebSso.AcsCommand' Sustainsys.Saml2.WebSso.LogoutCommand' Sustainsys.Saml2.Configuration.SustainsysSaml2Section' Sustainsys.Saml2.Configuration.IdentityProviderDictionary' Sustainsys.Saml2.WebSso.Saml2PostBinding' Sustainsys.Saml2.WebSso.Saml2Binding' Sustainsys.Saml2.Internal.CryptographyExtensions' Sustainsys.Saml2.Configuration.Options' Sustainsys.Saml2.Saml2P.Saml2AuthenticationRequest' Sustainsys.Saml2.Saml2P.Saml2LogoutRequest' Sustainsys.Saml2.Saml2P.Saml2PSecurityTokenHandler' Sustainsys.Saml2.Metadata.ExtendedMetadataSerializer' Sustainsys.Saml2.Saml2P.Saml2IdpEntry' Sustainsys.Saml2.Saml2P.Saml2SoapBinding' Sustainsys.Saml2.Saml2P.Saml2ArtifactResolve' Sustainsys.Saml2.Saml2P.Saml2Scoping' Sustainsys.Saml2.Saml2P.Saml2ArtifactResponse' Sustainsys.Saml2.Saml2P.Saml2LogoutResponse' Sustainsys.Saml2.Saml2P.Saml2RequestBase' Sustainsys.Saml2.Configuration.ServiceCertificateElementCollection' Sustainsys.Saml2.WebSso.CommandResult' Sustainsys.Saml2.WebSso.HttpRequestData' Sustainsys.Saml2.WebSso.UnbindResult' Sustainsys.Saml2.Metadata.MetadataBaseExtensions' Sustainsys.Saml2.Metadata.MetadataLoader' Sustainsys.Saml2.Configuration.XsdDurationConverter' Sustainsys.Saml2.Configuration.MetadataElement,Sustainsys.Saml2.Internal.DelimitedString' Sustainsys.Saml2.Metadata.EntityId' Sustainsys.Saml2.Configuration.FederationElement' Sustainsys.Saml2.Configuration.IOptions' Sustainsys.Saml2.Metadata.EntityDescriptor' Sustainsys.Saml2.Metadata.IdpSsoDescriptor' Sustainsys.Saml2.Metadata.MetadataLoader' Sustainsys.Saml2.Metadata.MetadataRefreshScheduler' Sustainsys.Saml2.Tokens.SecurityKeyIdentifierClause' Sustainsys.Saml2.Tokens.X509RawDataKeyIdentifierClause' Sustainsys.Saml2.Configuration.ConfiguredAndLoadedSigningKeysCollection' Sustainsys.Saml2.Configuration.IdentityProviderElement' Sustainsys.Saml2.Configuration.SigningBehavior' Sustainsys.Saml2.Configuration.SPOptions' Sustainsys.Saml2.Metadata.Endpoint' Sustainsys.Saml2.Metadata.KeyType' Sustainsys.Saml2.Saml2P.ISaml2Message' Sustainsys.Saml2.Saml2P.Saml2AuthenticationRequest' Sustainsys.Saml2.Saml2P.Saml2LogoutRequest' Sustainsys.Saml2.WebSso.CommandResult' Sustainsys.Saml2.WebSso.Saml2Binding' Sustainsys.Saml2.WebSso.Saml2BindingType' Sustainsys.Saml2.WebSso.Saml2Urls' Sustainsys.Saml2.Internal.EnvironmentHelpers' Sustainsys.Saml2.Saml2P.NameIdFormat' Sustainsys.Saml2.Configuration.ServiceCertificateElement' Sustainsys.Saml2.Exceptions.BadFormatSamlResponseException' Sustainsys.Saml2.Exceptions.InvalidSignatureException' Sustainsys.Saml2.Tokens.AsymmetricSecurityKey
Sustainsys.Saml2(netstandard2.0),Sustainsys.Saml2.Configuration,Sustainsys.Saml2.IdentityProvider' Sustainsys.Saml2.Federation' Sustainsys.Saml2.Selectors.SecurityTokenResolver' Sustainsys.Saml2.WebSso.NotFoundCommand' Sustainsys.Saml2.WebSso.ICommand' Sustainsys.Saml2.WebSso.MetadataCommand' Sustainsys.Saml2.WebSso.Saml2PostBinding' Sustainsys.Saml2.WebSso.Saml2Binding' Sustainsys.Saml2.WebSso.Saml2Urls' Sustainsys.Saml2.WebSso.SignInCommand' Sustainsys.Saml2.WebSso.Saml2ArtifactBinding' Sustainsys.Saml2.WebSso.AcsCommand' Sustainsys.Saml2.WebSso.Saml2RedirectBinding' Sustainsys.Saml2.WebSso.LogoutCommand' Sustainsys.Saml2.Saml2P.Saml2Response' Sustainsys.Saml2.Saml2P.Saml2RequestedAuthnContext' Sustainsys.Saml2.ServiceCertificate' Sustainsys.Saml2.Metadata.SPOptionsExtensions' Sustainsys.Saml2.Saml2P.Saml2PSecurityTokenHandler' Sustainsys.Saml2.Saml2P.Saml2PSerializer,Sustainsys.Saml2.Internal.PathHelper' Sustainsys.Saml2.Tokens.SecurityKeyIdentifierClause' Sustainsys.Saml2.Tokens.X509RawDataKeyIdentifierClause' Sustainsys.Saml2.Metadata.ContactType' Sustainsys.Saml2.Metadata.EntityId' Sustainsys.Saml2.Federation' Sustainsys.Saml2.IdentityProvider' Sustainsys.Saml2.Internal.EntityIdEqualityComparer' Sustainsys.Saml2.WebSso.Saml2BindingType' Sustainsys.Saml2.XsdDuration' Sustainsys.Saml2.Saml2P.NameIdFormat' Sustainsys.Saml2.NullLoggerAdapter' Sustainsys.Saml2.Saml2P.AuthnContextComparisonType' Sustainsys.Saml2.StoredRequestState' Sustainsys.Saml2.Metadata.EntityDescriptor' Sustainsys.Saml2.Saml2P.Saml2AuthenticationRequest' Sustainsys.Saml2.Saml2P.Saml2LogoutResponse' Sustainsys.Saml2.Saml2P.Saml2Response' Sustainsys.Saml2.WebSso.CommandResult' Sustainsys.Saml2.WebSso.HttpRequestData' Sustainsys.Saml2.WebSso.UnbindResult' Sustainsys.Saml2.WebSso.Saml2Binding' Sustainsys.Saml2.WebSso.Saml2Urls' Sustainsys.Saml2.CertificateUse' Sustainsys.Saml2.ServiceCertificate' Sustainsys.Saml2.XmlHelpers' Sustainsys.Saml2.CertificateStatus' Sustainsys.Saml2.MetadataPublishOverrideType' Sustainsys.Saml2.ILoggerAdapter' Sustainsys.Saml2.Metadata.AttributeConsumingService' Sustainsys.Saml2.Metadata.ContactPerson' Sustainsys.Saml2.Metadata.Organization' Sustainsys.Saml2.Saml2P.Saml2NameIdPolicy' Sustainsys.Saml2.Saml2P.Saml2PSecurityTokenHandler' Sustainsys.Saml2.Saml2P.Saml2RequestedAuthnContext' Sustainsys.Saml2.Metadata.LocalizedName' Sustainsys.Saml2.Metadata.LocalizedUri' Sustainsys.Saml2.Metadata.RequestedAttribute
Sustainsys.Saml2(netstandard2.0),Sustainsys.Saml2.Exceptions,Sustainsys.Saml2.XmlHelpers' Sustainsys.Saml2.WebSso.AcsCommand' Sustainsys.Saml2.Saml2P.Saml2Response' Sustainsys.Saml2.WebSso.LogoutCommand' Sustainsys.Saml2.Metadata.MetadataLoader' Sustainsys.Saml2.WebSso.Saml2RedirectBinding' Sustainsys.Saml2.Saml2P.Saml2ArtifactResponse,Sustainsys.Saml2.Saml2P.Saml2StatusCode
Sustainsys.Saml2(netstandard2.0),Sustainsys.Saml2.Internal,Sustainsys.Saml2.Saml2P.Saml2SoapBinding' Sustainsys.Saml2.Tokens.EcUtils' Sustainsys.Saml2.Tokens.RsaKeyIdentifierClause' Sustainsys.Saml2.Tokens.DsaKeyIdentifierClause' Sustainsys.Saml2.WebSso.Saml2RedirectBinding' Sustainsys.Saml2.Saml2P.Saml2Response' Sustainsys.Saml2.ClaimsExtensions' Sustainsys.Saml2.Saml2P.Saml2PSecurityTokenHandler' Sustainsys.Saml2.Configuration.IdentityProviderDictionary' Sustainsys.Saml2.ManagedRSASignatureDescription' Sustainsys.Saml2.XmlHelpers' Sustainsys.Saml2.Configuration.CertificateElement' Sustainsys.Saml2.Metadata.MetadataLoader' Sustainsys.Saml2.WebSso.LogoutCommand' Sustainsys.Saml2.WebSso.SignInCommand' Sustainsys.Saml2.WebSso.AcsCommand' Sustainsys.Saml2.WebSso.HttpRequestData' Sustainsys.Saml2.Saml2P.Saml2LogoutResponse' Sustainsys.Saml2.Saml2P.Saml2ArtifactResponse,Sustainsys.Saml2.ManagedRSASHA256SignatureDescription' Sustainsys.Saml2.ManagedRSASHA384SignatureDescription' Sustainsys.Saml2.ManagedRSASHA512SignatureDescription' Sustainsys.Saml2.XmlHelpers' Sustainsys.Saml2.Metadata.EntityId' Sustainsys.Saml2.Saml2P.Saml2StatusCode
Sustainsys.Saml2(netstandard2.0),Sustainsys.Saml2.Metadata,Sustainsys.Saml2.Configuration.SustainsysSaml2Section' Sustainsys.Saml2.Configuration.SPOptions' Sustainsys.Saml2.Configuration.ContactPersonElement' Sustainsys.Saml2.IdentityProvider' Sustainsys.Saml2.Configuration.Saml2Notifications' Sustainsys.Saml2.Federation' Sustainsys.Saml2.Saml2P.Saml2StatusResponseType' Sustainsys.Saml2.Saml2P.ISaml2Message' Sustainsys.Saml2.ClaimsIdentityExtensions' Sustainsys.Saml2.Saml2P.Saml2Scoping' Sustainsys.Saml2.WebSso.AcsCommand' Sustainsys.Saml2.WebSso.Saml2RedirectBinding' Sustainsys.Saml2.StoredRequestState' Sustainsys.Saml2.WebSso.Saml2ArtifactBinding' Sustainsys.Saml2.Configuration.EntityIdConverter' Sustainsys.Saml2.Saml2P.Saml2IdpEntry' Sustainsys.Saml2.WebSso.SignInCommand' Sustainsys.Saml2.Internal.EntityIdEqualityComparer' Sustainsys.Saml2.Configuration.IdentityProviderDictionary' Sustainsys.Saml2.Saml2P.Saml2RequestBase' Sustainsys.Saml2.Saml2P.Saml2Response' Sustainsys.Saml2.WebSso.LogoutCommand,Sustainsys.Saml2.ICachedMetadata' Sustainsys.Saml2.XsdDuration' Sustainsys.Saml2.Saml2Namespaces' Sustainsys.Saml2.Tokens.DsaKeyIdentifierClause' Sustainsys.Saml2.Tokens.EcKeyIdentifierClause' Sustainsys.Saml2.Tokens.KeyNameIdentifierClause' Sustainsys.Saml2.Tokens.RsaKeyIdentifierClause' Sustainsys.Saml2.Tokens.SecurityKeyIdentifier' Sustainsys.Saml2.Tokens.X509IssuerSerialKeyIdentifierClause' Sustainsys.Saml2.Tokens.X509RawDataKeyIdentifierClause' Sustainsys.Saml2.XmlHelpers' Sustainsys.Saml2.Exceptions.InvalidSignatureException' Sustainsys.Saml2.Internal.PathHelper' Sustainsys.Saml2.Tokens.SecurityKeyIdentifierClause' Sustainsys.Saml2.Selectors.NullSecurityTokenResolver' Sustainsys.Saml2.Selectors.SecurityTokenResolver' Sustainsys.Saml2.Configuration.SigningBehavior' Sustainsys.Saml2.Configuration.SPOptions' Sustainsys.Saml2.WebSso.Saml2Binding' Sustainsys.Saml2.WebSso.Saml2Urls
Sustainsys.Saml2(netstandard2.0),Sustainsys.Saml2.Saml2P,Sustainsys.Saml2.Configuration.RequestedAuthnContextElement' Sustainsys.Saml2.WebSso.Saml2PostBinding' Sustainsys.Saml2.WebSso.Saml2RedirectBinding' Sustainsys.Saml2.WebSso.Saml2Binding' Sustainsys.Saml2.IdentityProvider' Sustainsys.Saml2.WebSso.Saml2ArtifactBinding' Sustainsys.Saml2.Configuration.NameIdPolicyElement' Sustainsys.Saml2.NameIdFormatExtension' Sustainsys.Saml2.Configuration.Saml2Notifications' Sustainsys.Saml2.WebSso.LogoutCommand' Sustainsys.Saml2.Configuration.SPOptions' Sustainsys.Saml2.WebSso.AcsCommand' Sustainsys.Saml2.Exceptions.UnsuccessfulSamlOperationException' Sustainsys.Saml2.Internal.StatusCodeHelper,Sustainsys.Saml2.Metadata.EntityId' Sustainsys.Saml2.Saml2Namespaces' Sustainsys.Saml2.Exceptions.UnsuccessfulSamlOperationException' Sustainsys.Saml2.Internal.StatusCodeHelper' Sustainsys.Saml2.SecureKeyGenerator' Sustainsys.Saml2.XmlHelpers' Sustainsys.Saml2.WebSso.Saml2Binding' Sustainsys.Saml2.WebSso.Saml2BindingType' Sustainsys.Saml2.Saml2ClaimTypes' Sustainsys.Saml2.Configuration.SPOptions' Sustainsys.Saml2.Internal.DelimitedString' Sustainsys.Saml2.Configuration.RequestedAuthnContextElement' Sustainsys.Saml2.IdentityProvider' Sustainsys.Saml2.Configuration.IOptions' Sustainsys.Saml2.Exceptions.BadFormatSamlResponseException' Sustainsys.Saml2.Exceptions.Saml2ResponseFailedValidationException' Sustainsys.Saml2.Exceptions.UnexpectedInResponseToException' Sustainsys.Saml2.Internal.DateTimeHelper' Sustainsys.Saml2.Internal.ClientCertificateWebClient
Sustainsys.Saml2(netstandard2.0),Sustainsys.Saml2.Selectors,Sustainsys.Saml2.Metadata.MetadataSerializer' Sustainsys.Saml2.Metadata.SecurityTokenSerializer,Sustainsys.Saml2.Tokens.SecurityKey' Sustainsys.Saml2.Tokens.SecurityKeyIdentifier' Sustainsys.Saml2.Tokens.SecurityKeyIdentifierClause' Sustainsys.Saml2.Tokens.SecurityToken' Sustainsys.Saml2.Configuration.ICustomIdentityConfiguration
Sustainsys.Saml2(netstandard2.0),Sustainsys.Saml2.Tokens,Sustainsys.Saml2.WebSso.Saml2RedirectBinding' Sustainsys.Saml2.XmlHelpers' Sustainsys.Saml2.Metadata.DSigKeyInfo' Sustainsys.Saml2.Selectors.NullSecurityTokenResolver' Sustainsys.Saml2.Selectors.SecurityTokenResolver' Sustainsys.Saml2.Metadata.SecurityTokenSerializer' Sustainsys.Saml2.Metadata.MetadataSerializer' Sustainsys.Saml2.Metadata.MetadataLoader' Sustainsys.Saml2.Configuration.ConfiguredAndLoadedSigningKeysCollection' Sustainsys.Saml2.Federation' Sustainsys.Saml2.IdentityProvider,Sustainsys.Saml2.Internal.CompareHelper
Sustainsys.Saml2(netstandard2.0),Sustainsys.Saml2.WebSso,Sustainsys.Saml2.IdentityProvider' Sustainsys.Saml2.Configuration.Saml2Notifications' Sustainsys.Saml2.Saml2P.Saml2AuthenticationRequest' Sustainsys.Saml2.Metadata.SPOptionsExtensions' Sustainsys.Saml2.Configuration.IdentityProviderElement,Sustainsys.Saml2.IdentityProvider' Sustainsys.Saml2.Saml2Namespaces' Sustainsys.Saml2.StoredRequestState' Sustainsys.Saml2.Configuration.IOptions' Sustainsys.Saml2.Exceptions.BadFormatSamlResponseException' Sustainsys.Saml2.Exceptions.NoSamlResponseFoundException' Sustainsys.Saml2.Internal.PathHelper' Sustainsys.Saml2.Metadata.EntityId' Sustainsys.Saml2.Saml2P.Saml2Response' Sustainsys.Saml2.Internal.QueryStringHelper' Sustainsys.Saml2.Saml2ClaimTypes' Sustainsys.Saml2.TrustLevel' Sustainsys.Saml2.Exceptions.InvalidSignatureException' Sustainsys.Saml2.Exceptions.UnsuccessfulSamlOperationException' Sustainsys.Saml2.Saml2P.Saml2LogoutRequest' Sustainsys.Saml2.Saml2P.Saml2LogoutResponse' Sustainsys.Saml2.Saml2P.Saml2StatusCode' Sustainsys.Saml2.CertificateStatus' Sustainsys.Saml2.CertificateUse' Sustainsys.Saml2.ILoggerAdapter' Sustainsys.Saml2.SecureKeyGenerator' Sustainsys.Saml2.XmlHelpers' Sustainsys.Saml2.Saml2P.ISaml2Message' Sustainsys.Saml2.Saml2P.Saml2ArtifactResolve' Sustainsys.Saml2.Saml2P.Saml2ArtifactResponse' Sustainsys.Saml2.Saml2P.Saml2SoapBinding' Sustainsys.Saml2.Internal.CryptographyExtensions' Sustainsys.Saml2.Internal.EnvironmentHelpers' Sustainsys.Saml2.Tokens.AsymmetricSecurityKey' Sustainsys.Saml2.Configuration.SPOptions
