Implementation smell,Namespace,Class,File,Method,Description
Long Statement,SilverlightDemo,App,C:\repos\andreasjacobsen93_XamarinThirdpartySamples\oxyplot-develop\Source\Examples\Silverlight\SilverlightDemo\App.xaml.cs,ReportErrorToDOM,The length of the statement  "		System.Windows.Browser.HtmlPage.Window.Eval ("throw new Error(\"Unhandled Error in Silverlight Application " + errorMsg + "\");"); " is 130.
Empty Catch Block,SilverlightDemo,App,C:\repos\andreasjacobsen93_XamarinThirdpartySamples\oxyplot-develop\Source\Examples\Silverlight\SilverlightDemo\App.xaml.cs,ReportErrorToDOM,The method has an empty catch block.
Magic Number,SilverlightDemo,MainPage,C:\repos\andreasjacobsen93_XamarinThirdpartySamples\oxyplot-develop\Source\Examples\Silverlight\SilverlightDemo\MainPage.xaml.cs,MainPage,The following statement contains a magic number: tmp.Series.Add (new FunctionSeries (x => Math.Sin (x) / x' -10' 10' 0.03' "sin(x)/x"));  
Magic Number,SilverlightDemo,MainPage,C:\repos\andreasjacobsen93_XamarinThirdpartySamples\oxyplot-develop\Source\Examples\Silverlight\SilverlightDemo\MainPage.xaml.cs,MainPage,The following statement contains a magic number: tmp.Series.Add (new FunctionSeries (x => Math.Sin (x) / x' -10' 10' 0.03' "sin(x)/x"));  
Magic Number,SilverlightDemo,MainPage,C:\repos\andreasjacobsen93_XamarinThirdpartySamples\oxyplot-develop\Source\Examples\Silverlight\SilverlightDemo\MainPage.xaml.cs,MainPage,The following statement contains a magic number: tmp.Series.Add (new FunctionSeries (x => Math.Sin (x) / x' -10' 10' 0.03' "sin(x)/x"));  
