Project,Namespace,Ca types,Ce types
unBand,unBand.BandHelpers,unBand.pages.TilesPage' unBand.Controls.BandColorSelector' unBand.MainWindow' unBand.pages.ActivityLogPage' unBand.pages.LogOutputPage' unBand.pages.ThemePage' unBand.pages.SensorsPage' unBand.pages.MyBandPage,unBand.CargoClientEditor.CargoDll' unBand.BandHelpers.Sensors.BandPedometer
unBand,unBand.Controls,,unBand.CloudHelpers.BandCloudManager' unBand.BandHelpers.BandManager' unBand.Telemetry' unBand.TelemetryCategory' unBand.BandHelpers.BandTheme
unBand,unBand,unBand.pages.ActivityLogPage' unBand.Controls.BandColorSelector' unBand.pages.TilesPage' unBand.pages.ThemePage' unBand.pages.SettingsPage' unBand.pages.AboutPage' unBand.pages.MyBandPage,unBand.Cloud.BandEventType' unBand.CloudHelpers.CloudDataExporterSettings' unBand.BandHelpers.BandManager
unBand,unBand.CloudHelpers,unBand.pages.ActivityLogPage' unBand.Controls.WaitingForMSA' unBand.Settings,unBand.Cloud.BandCloudClient' unBand.Cloud.UserDailyActivity' unBand.Cloud.BandEventBase' unBand.Cloud.IBandEventWithMapPoints' unBand.Cloud.BandEventType' unBand.Cloud.Exporters.EventExporters.Helpers.CSVExporter' unBand.Cloud.Exporters.EventExporters.IEventExporter
unBand,unBand.pages,,unBand.About' unBand.Cloud.BandCloudClient' unBand.BandHelpers.BandManager' unBand.CloudHelpers.CloudDataExporterSettings' unBand.CloudHelpers.BandCloudManager' unBand.Settings' unBand.Telemetry' unBand.TelemetryCategory' unBand.Export' unBand.TelemetryEvent' unBand.CloudHelpers.BandCloudExportProgress' unBand.CloudHelpers.BandEventViewModel' unBand.Cloud.IBandEventWithMapPoints' unBand.Cloud.BandExerciseEventBase' unBand.Cloud.Exporters.EventExporters.IEventExporter' unBand.Cloud.Exporters.EventExporters.GPXExporter' unBand.Cloud.Exporters.EventExporters.TCXExporter' unBand.BandHelpers.BandStrapp' unBand.BandHelpers.BandTiles' unBand.BandHelpers.BandTheme' unBand.MainWindow
unBand,unBand.BandHelpers.Sensors,unBand.BandHelpers.BandSensors,
unBand,unBand.Properties,,
unBand,XamlGeneratedNamespace,,
