Project,Namespace,Ca types,Ce types
Restful.Data.Oracle,Restful.Data.Oracle.Common,Restful.Data.Oracle.CommandBuilders.OracleCommandBuilder' Restful.Data.Oracle.Visitors.OracleOrderByClauseVisitor' Restful.Data.Oracle.CommandBuilders.OracleDeleteCommandBuilder' Restful.Data.Oracle.Visitors.OracleQueryModelVisitor' Restful.Data.Oracle.OracleSessionProvider' Restful.Data.Oracle.CommandBuilders.OracleInsertCommandBuilder' Restful.Data.Oracle.CommandBuilders.OracleUpdateCommandBuilder' Restful.Data.Oracle.Visitors.OracleSelectClauseVisitor' Restful.Data.Oracle.Visitors.OracleWhereClauseVisitor,
Restful.Data.Oracle,Restful.Data.Oracle.CommandBuilders,Restful.Data.Oracle.OracleSessionProviderFactory' Restful.Data.Oracle.OracleSessionProvider' Restful.Data.Oracle.Linq.OracleDeleteProvider' Restful.Data.Oracle.Linq.OracleInsertProvider' Restful.Data.Oracle.Visitors.OracleOrderByClauseVisitor' Restful.Data.Oracle.Visitors.OracleQueryModelVisitor' Restful.Data.Oracle.Visitors.OracleSelectClauseVisitor' Restful.Data.Oracle.Linq.OracleUpdateProvider' Restful.Data.Oracle.Visitors.OracleWhereClauseVisitor,Restful.Data.Oracle.Common.Constants
Restful.Data.Oracle,Restful.Data.Oracle.Linq,Restful.Data.Oracle.OracleSessionProviderFactory,Restful.Data.Oracle.CommandBuilders.OracleDeleteCommandBuilder' Restful.Data.Oracle.CommandBuilders.OracleWherePartsCommandBuilder' Restful.Data.Oracle.Visitors.OracleWhereClauseVisitor' Restful.Data.Oracle.CommandBuilders.OracleInsertCommandBuilder' Restful.Data.Oracle.Visitors.OracleQueryModelVisitor' Restful.Data.Oracle.CommandBuilders.OracleUpdateCommandBuilder
Restful.Data.Oracle,Restful.Data.Oracle.Visitors,Restful.Data.Oracle.Linq.OracleQueryExecutor' Restful.Data.Oracle.Linq.OracleDeleteProvider' Restful.Data.Oracle.Linq.OracleUpdateProvider,Restful.Data.Oracle.Common.Constants' Restful.Data.Oracle.CommandBuilders.OracleOrderByPartsCommandBuilder' Restful.Data.Oracle.CommandBuilders.OracleQueryCommandBuilder' Restful.Data.Oracle.CommandBuilders.OracleSelectPartsCommandBuilder' Restful.Data.Oracle.CommandBuilders.OracleWherePartsCommandBuilder
Restful.Data.Oracle,Restful.Data.Oracle,,Restful.Data.Oracle.Common.Constants' Restful.Data.Oracle.CommandBuilders.OracleCommandBuilder' Restful.Data.Oracle.Linq.OracleDeleteProvider' Restful.Data.Oracle.Linq.OracleInsertProvider' Restful.Data.Oracle.Linq.OracleQueryExecutor' Restful.Data.Oracle.Linq.OracleQueryable<T>' Restful.Data.Oracle.Linq.OracleUpdateProvider
