Project,Namespace,Ca types,Ce types
BugsnagUnity.Android,BugsnagUnity,BugsnagUnity.Payload.NotifierInfo' BugsnagUnity.Payload.App' BugsnagUnity.Payload.Device' BugsnagUnity.Payload.Report' BugsnagUnity.Payload.SessionReport' BugsnagUnity.Payload.User' BugsnagUnity.Payload.Metadata' SimpleJson.SimpleJson' BugsnagUnity.Payload.Exception' BugsnagUnity.Payload.Event' BugsnagUnity.Payload.HandledState' BugsnagUnity.Payload.MethodParameter' BugsnagUnity.Payload.Method,BugsnagUnity.Payload.Breadcrumb' BugsnagUnity.Payload.BreadcrumbType' BugsnagUnity.Payload.IPayload' BugsnagUnity.Payload.Metadata' BugsnagUnity.Payload.User' BugsnagUnity.Payload.Breadcrumb' BugsnagUnity.Payload.BreadcrumbType' BugsnagUnity.Payload.IPayload' BugsnagUnity.Payload.Metadata' BugsnagUnity.Payload.User' BugsnagUnity.Payload.Breadcrumb' BugsnagUnity.Payload.BreadcrumbType' BugsnagUnity.Payload.IPayload' BugsnagUnity.Payload.Metadata' BugsnagUnity.Payload.User' BugsnagUnity.Payload.Breadcrumb' BugsnagUnity.Payload.BreadcrumbType' BugsnagUnity.Payload.IPayload' BugsnagUnity.Payload.Metadata' BugsnagUnity.Payload.User' BugsnagUnity.Payload.Breadcrumb' BugsnagUnity.Payload.BreadcrumbType' BugsnagUnity.Payload.IPayload' BugsnagUnity.Payload.Metadata' BugsnagUnity.Payload.User' BugsnagUnity.Payload.App' BugsnagUnity.Payload.Device' BugsnagUnity.Payload.Event' BugsnagUnity.Payload.Exceptions' BugsnagUnity.Payload.Exception' BugsnagUnity.Payload.HandledState' BugsnagUnity.Payload.Report' BugsnagUnity.Payload.App' BugsnagUnity.Payload.Device' BugsnagUnity.Payload.Event' BugsnagUnity.Payload.Exceptions' BugsnagUnity.Payload.Exception' BugsnagUnity.Payload.HandledState' BugsnagUnity.Payload.Report' BugsnagUnity.Payload.App' BugsnagUnity.Payload.Device' BugsnagUnity.Payload.Event' BugsnagUnity.Payload.Exceptions' BugsnagUnity.Payload.Exception' BugsnagUnity.Payload.HandledState' BugsnagUnity.Payload.Report' BugsnagUnity.Payload.App' BugsnagUnity.Payload.Device' BugsnagUnity.Payload.Event' BugsnagUnity.Payload.Exceptions' BugsnagUnity.Payload.Exception' BugsnagUnity.Payload.HandledState' BugsnagUnity.Payload.Report' BugsnagUnity.Payload.App' BugsnagUnity.Payload.Device' BugsnagUnity.Payload.Event' BugsnagUnity.Payload.Exceptions' BugsnagUnity.Payload.Exception' BugsnagUnity.Payload.HandledState' BugsnagUnity.Payload.Report' SimpleJson.SimpleJson' SimpleJson.SimpleJson' SimpleJson.SimpleJson' SimpleJson.SimpleJson' SimpleJson.SimpleJson' BugsnagUnity.Payload.Session' BugsnagUnity.Payload.Session' BugsnagUnity.Payload.Session' BugsnagUnity.Payload.Session' BugsnagUnity.Payload.Session' BugsnagUnity.Payload.SessionReport' BugsnagUnity.Payload.SessionReport' BugsnagUnity.Payload.SessionReport' BugsnagUnity.Payload.SessionReport' BugsnagUnity.Payload.SessionReport' BugsnagUnity.Payload.NotifierInfo
BugsnagUnity.Android,BugsnagUnity.Payload,BugsnagUnity.NativeClient' BugsnagUnity.INativeClient' BugsnagUnity.Client' BugsnagUnity.SessionTracker' BugsnagUnity.IBreadcrumbs' BugsnagUnity.Bugsnag' BugsnagUnity.Breadcrumbs' BugsnagUnity.NativeInterface' BugsnagUnity.IClient' BugsnagUnity.IDelivery' BugsnagUnity.Delivery' BugsnagUnity.ISessionTracker,BugsnagUnity.IConfiguration' BugsnagUnity.IFilterable' BugsnagUnity.IConfiguration' BugsnagUnity.IFilterable' BugsnagUnity.IConfiguration' BugsnagUnity.IFilterable' BugsnagUnity.IConfiguration' BugsnagUnity.IFilterable' BugsnagUnity.IConfiguration' BugsnagUnity.IFilterable' BugsnagUnity.Severity' BugsnagUnity.Severity' BugsnagUnity.Severity' BugsnagUnity.Severity' BugsnagUnity.Severity' BugsnagUnity.UnityLogMessage' BugsnagUnity.UnityLogMessage' BugsnagUnity.UnityLogMessage' BugsnagUnity.UnityLogMessage' BugsnagUnity.UnityLogMessage' BugsnagUnity.INativeClient' BugsnagUnity.INativeClient' BugsnagUnity.INativeClient' BugsnagUnity.INativeClient' BugsnagUnity.INativeClient' BugsnagUnity.TypeNameHelper' BugsnagUnity.TypeNameHelper' BugsnagUnity.TypeNameHelper' BugsnagUnity.TypeNameHelper' BugsnagUnity.TypeNameHelper' BugsnagUnity.Client' BugsnagUnity.Client' BugsnagUnity.Client' BugsnagUnity.Client' BugsnagUnity.Client' BugsnagUnity.Polyfills.String' BugsnagUnity.Polyfills.String' BugsnagUnity.Polyfills.String' BugsnagUnity.Polyfills.String' BugsnagUnity.Polyfills.String
BugsnagUnity.Android,BugsnagUnity.Polyfills,BugsnagUnity.Payload.PayloadExtensions,
BugsnagUnity.Android,SimpleJson,BugsnagUnity.Delivery,BugsnagUnity.IFilterable' Reflection.ReflectionUtils' BugsnagUnity.IFilterable' Reflection.ReflectionUtils' BugsnagUnity.IFilterable' Reflection.ReflectionUtils' BugsnagUnity.IFilterable' Reflection.ReflectionUtils' BugsnagUnity.IFilterable' Reflection.ReflectionUtils' Reflection.ThreadSafeDictionary<TKey;TValue>' Reflection.ThreadSafeDictionary<TKey;TValue>' Reflection.ThreadSafeDictionary<TKey;TValue>' Reflection.ThreadSafeDictionary<TKey;TValue>' Reflection.ThreadSafeDictionary<TKey;TValue>
BugsnagUnity.Android,Reflection,SimpleJson.SimpleJson' SimpleJson.PocoJsonSerializerStrategy,
