Namespace,Type,NOF,NOM,NOP,NOPF,NOPM,LOC,WMC,NC,DIT,LCOM,Fan-Out,Fan-In,Fan-Out types,Fan-In types
ExtendedTypes,ReportRowTypeConverter,0,3,0,0,3,30,7,0,0,-1,1,0,ExtendedTypes.ReportRow,
ExtendedTypes,ReportTableTypeConverter,0,3,0,0,3,30,7,0,0,-1,1,0,ExtendedTypes.ReportTable,
ExtendedTypes,ReportCell,1,2,2,0,2,15,2,0,0,0,1,13,ExtendedTypes.ReportRow,ConvertModule.ConvertPlug' ExtendedTypes.ReportRow' HtmlDataSource.HtmlDataSourcePlug' MenaModule.MenaPlug' ReportModule.ExcelEditor' ReportModule.OOEditor' ReportModule.ReportEditor' ReportModule.ReportPlug' TextDataSource.TextDataSourcePlug' XmlDataSource.XmlDataSourcePlug' UnitTest.ExtendedTypesUnitTests' UnitTest.ConvertModuleUnitTests' UnitTest.XmlDataSourceUnitTest
ExtendedTypes,ReportRow,1,2,1,0,2,44,3,0,0,0,2,17,ExtendedTypes.ReportTable' ExtendedTypes.ReportCell,ConvertModule.IPlug' ConvertModule.ConvertPlug' ExtendedTypes.ReportRowTypeConverter' ExtendedTypes.ReportCell' ExtendedTypes.ReportTable' HtmlDataSource.HtmlDataSourcePlug' JsonDataSource.JsonDataSourcePlug' MenaModule.IPlug' MenaModule.MenaPlug' ReportModule.IPlug' ReportModule.ReportPlug' SqlDataSource.SqlDataSourcePlug' TextDataSource.TextDataSourcePlug' XmlDataSource.XmlDataSourcePlug' UnitTest.ReportModuleUnitTests' UnitTest.ExtendedTypesUnitTests' UnitTest.ConvertModuleUnitTests
ExtendedTypes,ReportTable,1,3,1,0,3,51,5,0,0,1,1,26,ExtendedTypes.ReportRow,ConvertModule.IPlug' ConvertModule.ConvertPlug' ExtendedTypes.ReportTableTypeConverter' ExtendedTypes.ReportRow' HtmlDataSource.IPlug' HtmlDataSource.HtmlDataSourcePlug' JsonDataSource.IPlug' JsonDataSource.JsonDataSourcePlug' MenaModule.IPlug' MenaModule.MenaPlug' ReportModule.ExcelEditor' ReportModule.OOEditor' ReportModule.ReportEditor' ReportModule.IPlug' ReportModule.ReportPlug' ReportModule.TableReportValue' SqlDataSource.IPlug' SqlDataSource.SqlDataSourcePlug' TextDataSource.IPlug' TextDataSource.TextDataSourcePlug' XmlDataSource.IPlug' XmlDataSource.XmlDataSourcePlug' UnitTest.ReportModuleUnitTests' UnitTest.ExtendedTypesUnitTests' UnitTest.ConvertModuleUnitTests' UnitTest.XmlDataSourceUnitTest
