Namespace,Type,NOF,NOM,NOP,NOPF,NOPM,LOC,WMC,NC,DIT,LCOM,Fan-Out,Fan-In,Fan-Out types,Fan-In types
DD4T.Utils,ClassLoader,0,2,0,0,2,28,5,0,0,-1,1,1,DD4T.Utils.LoggerService,DD4T.Utils.ProviderLoader
DD4T.Utils,ConfigurationKeys,28,0,0,28,0,33,0,0,0,-1,0,0,,
DD4T.Utils,ConfigurationHelper,0,5,18,0,2,181,9,0,0,-1,0,11,,DD4T.Factories.Caching.DefaultCacheAgent' DD4T.Factories.Caching.LastPublishDateChangeMonitor' DD4T.Factories.Resolvers.DefaultPublicationResolver' DD4T.Mvc.Html.DefaultComponentPresentationRenderer' DD4T.Providers.SDLTridion2009.TridionComponentProvider' DD4T.Providers.SDLTridion2011.TridionComponentProvider' DD4T.Providers.SDLTridion2011sp1.TridionComponentProvider' DD4T.Providers.SDLTridion2013.TridionComponentProvider' DD4T.Providers.SDLTridion2013sp1.TridionComponentProvider' DD4T.Utils.ProviderLoader' DD4T.Utils.TridionHelper
DD4T.Utils,LoggerService,1,10,2,0,10,76,20,0,0,1,2,20,DD4T.ContentModel.Logging.ILogWrapper' DD4T.ContentModel.Logging.LoggingCategory,DD4T.Factories.Caching.LastPublishDateChangeMonitor' DD4T.Factories.ComponentFactory' DD4T.Factories.PageFactory' DD4T.Mvc.Attributes.UsesTridionPage' DD4T.Mvc.Controllers.TridionControllerBase' DD4T.Mvc.Html.DefaultComponentPresentationRenderer' DD4T.Mvc.Html.TridionHelper' DD4T.Mvc.Providers.TridionSiteMapProvider' DD4T.Providers.SDLTridion2011.TridionPageProvider' DD4T.Providers.SDLTridion2011sp1.TridionComponentProvider' DD4T.Providers.SDLTridion2011sp1.TridionPageProvider' DD4T.Providers.SDLTridion2013.TridionComponentProvider' DD4T.Providers.SDLTridion2013.TridionPageProvider' DD4T.Providers.SDLTridion2013sp1.TridionComponentProvider' DD4T.Providers.SDLTridion2013sp1.TridionPageProvider' DD4T.Utils.ClassLoader' DD4T.Web.Binaries.BinaryDistributionModule' DD4T.Web.Binaries.BinaryFileManager' DD4T.Web.ResourceManagement.DynamicResourceProviderFactory' DD4T.Web.ResourceManagement.DynamicResourceProvider
DD4T.Utils,ProviderLoader,0,2,0,0,2,52,4,0,0,-1,5,0,DD4T.ContentModel.Contracts.Providers.ProviderVersion' DD4T.Utils.ConfigurationHelper' DD4T.ContentModel.Contracts.Providers.ProviderAssemblyNames' DD4T.Utils.ClassLoader' DD4T.ContentModel.Contracts.Providers.IProvider,
DD4T.Utils,TridionHelper,3,2,1,0,2,33,2,0,0,1,4,6,DD4T.Utils.ConfigurationHelper' DD4T.ContentModel.TcmUri' DD4T.ContentModel.IComponent' DD4T.ContentModel.IComponentPresentation,DD4T.Mvc.Html.DefaultComponentPresentationRenderer' DD4T.Providers.SDLTridion2009.TridionLinkProvider' DD4T.Providers.SDLTridion2011.TridionLinkProvider' DD4T.Providers.SDLTridion2011sp1.TridionLinkProvider' DD4T.Providers.SDLTridion2013.TridionLinkProvider' DD4T.Providers.SDLTridion2013sp1.TridionLinkProvider
