Project,Namespace,Ca types,Ce types
Sitecore.Glimpse.Core,Sitecore.Glimpse.Caching,,Sitecore.Glimpse.ICollectionProvider
Sitecore.Glimpse.Core,Sitecore.Glimpse,Sitecore.Glimpse.Analytics.AnalticsSummary' Sitecore.Glimpse.Analytics.AnalyicsOverviewSection' Sitecore.Glimpse.Analytics.GoalsSection' Sitecore.Glimpse.Analytics.PageViewsSection' Sitecore.Glimpse.Analytics.ProfilesSection' Sitecore.Glimpse.Test.FakeSitecoreRequest' Sitecore.Glimpse.Test.SitecoreTabShould' Sitecore.Glimpse.Test.Analytics.SitecoreAnalyticsTabShould' Sitecore.Glimpse.Caching.CachingCollectionProvider<T>' Sitecore.Glimpse.Analytics.SitecoreAnalyticsTab' Sitecore.Glimpse.Model.LoggedInUser' Sitecore.Glimpse.Core.Test.Model.LoggedInUserBehaviour,
Sitecore.Glimpse.Core,Sitecore.Glimpse.Extensions,,
Sitecore.Glimpse.Core,Sitecore.Glimpse.Model.Analytics,Sitecore.Glimpse.Analytics.GoalsSection' Sitecore.Glimpse.Analytics.PageViewsSection' Sitecore.Glimpse.Analytics.AnalticsSummary' Sitecore.Glimpse.Analytics.ProfilesSection' Sitecore.Glimpse.Test.Analytics.SitecoreAnalyticsTabShould,
Sitecore.Glimpse.Core,Sitecore.Glimpse.Model,Sitecore.Glimpse.ControllersSection' Sitecore.Glimpse.ServicesSection' Sitecore.Glimpse.Core.Test.Model.SitecoreServiceBehaviour' Sitecore.Glimpse.UserListSection' Sitecore.Glimpse.Core.Test.Model.LoggedInUserBehaviour,Sitecore.Glimpse.SystemTime
