Namespace,Type,NOF,NOM,NOP,NOPF,NOPM,LOC,WMC,NC,DIT,LCOM,Fan-Out,Fan-In,Fan-Out types,Fan-In types
GitForce,AppHelper,3,5,0,3,5,64,6,0,0,0,0,4,,GitForce.Settings.Panels.ControlDiff' GitForce.Settings.Panels.ControlMerge' GitForce.ClassMerge' GitForce.ClassDiff
GitForce,Arguments,2,2,0,0,2,86,14,0,0,0,0,2,,GitForce.ClassCommandLine' GitForce.App
GitForce,ClassBranches,3,2,0,3,2,57,8,0,0,0,2,6,GitForce.ExecResult' GitForce.App,GitForce.FormDeleteBranch' GitForce.FormNewBranch' GitForce.FormMergeBranch' GitForce.Main.Right.Panels.PanelRevlist' GitForce.Main.Right.Panels.PanelBranches' GitForce.ClassRepo
GitForce,ClassCommandLine,2,1,0,1,1,99,14,0,0,0,7,1,GitForce.Arguments' GitForce.ClassVersion' GitForce.ClassUtils' GitForce.NativeMethods' GitForce.FormHttpsAuth' GitForce.App' GitForce.Properties.Settings,GitForce.App
GitForce,ClassCommit,4,5,1,4,5,91,5,0,0,0.4,0,6,,GitForce.FormCommitMerge' GitForce.FormCommit' GitForce.FormRename' GitForce.ClassView' GitForce.ClassCommits' GitForce.Main.Right.Panels.PanelCommits
GitForce,ClassCommits,1,4,0,1,4,50,6,0,0,0,1,1,GitForce.ClassCommit,GitForce.ClassRepo
GitForce,ClassConfig,0,4,0,0,4,49,8,0,0,-1,5,11,GitForce.ExecResult' GitForce.ClassGit' GitForce.ClassRepo' GitForce.App' GitForce.MessageType,GitForce.ClassDiff' GitForce.ClassMerge' GitForce.ClassRepo' GitForce.Settings.Panels.ControlGitignore' GitForce.Settings.Panels.ControlGlobal' GitForce.Repo.Edit.Panels.ControlLocal' GitForce.Settings.Panels.ControlUser' GitForce.Repo.Edit.Panels.ControlUser' GitForce.FormMain' GitForce.Settings.Panels.ControlAliases' GitForce.Settings.Panels.ControlFiles
GitForce,ClassDiff,4,4,0,0,4,96,7,0,0,0.5,4,4,GitForce.AppHelper' GitForce.ClassConfig' GitForce.FormDiffMissing' GitForce.Properties.Settings,GitForce.Settings.Panels.ControlDiff' GitForce.ClassRepo' GitForce.App' GitForce.FormRevisionHistory
GitForce,ClassException,1,1,1,0,1,12,1,0,0,0,0,3,,GitForce.FormNewRepoScanAdd' GitForce.ClassRepos' GitForce.Main.Right.Panels.PanelRepos
GitForce,ExecResult,3,2,0,3,2,14,2,0,0,1,0,18,,GitForce.FormDeleteBranch' GitForce.ClassPutty' GitForce.FormCommit' GitForce.ClassRemotes' GitForce.ClassStatus' GitForce.ClassBranches' GitForce.FormGitRun' GitForce.Exec' GitForce.FormUnstash' GitForce.FormShowChangelist' GitForce.FormNewBranch' GitForce.Main.Right.Panels.PanelRevlist' GitForce.ClassConfig' GitForce.RemotesEdit' GitForce.FormRevisionHistory' GitForce.Main.Left.Panels.PanelView' GitForce.ClassGit' GitForce.ClassRepo
GitForce,Exec,7,7,0,0,4,166,18,0,0,0,4,5,GitForce.ExecResult' GitForce.ClassUtils' GitForce.App' GitForce.MessageType,GitForce.ClassPutty' GitForce.ClassHttpsPasswd' GitForce.FormGitRun' GitForce.ClassUtils' GitForce.ClassGit
GitForce,ClassGit,1,3,0,0,3,90,13,0,0,0.67,8,8,GitForce.ExecResult' GitForce.Exec' GitForce.ClassUtils' GitForce.FormGitRun' GitForce.FormPathToGit' GitForce.App' GitForce.MessageType' GitForce.Properties.Settings,GitForce.Settings.Panels.ControlAliases' GitForce.ClassConfig' GitForce.App' GitForce.ClassRepo' GitForce.Main.Right.Panels.PanelRepos' GitForce.FormMain' GitForce.FormNewRepoScanAdd' GitForce.FormSettings
GitForce,GitFileInfo,2,1,0,2,1,19,1,0,0,0,0,2,,GitForce.ClassView' GitForce.GitDirectoryInfo
GitForce,GitDirectoryInfo,3,4,0,3,4,108,10,0,0,0.5,5,3,GitForce.GitFileInfo' GitForce.SortBy' GitForce.App' GitForce.MessageType' GitForce.Properties.Settings,GitForce.ClassRepo' GitForce.Main.Left.Panels.PanelView' GitForce.ClassView
GitForce,SortBy,0,0,0,0,0,1,0,0,0,-1,0,4,,GitForce.ClassRepo' GitForce.ClassView' GitForce.Main.Left.Panels.PanelView' GitForce.GitDirectoryInfo
GitForce,ClassHttpsPasswd,0,1,0,0,1,43,3,0,0,-1,4,1,GitForce.Exec' GitForce.ClassUtils' GitForce.App' GitForce.MessageType,GitForce.App
GitForce,ClassGlobals,2,1,0,2,1,21,2,0,0,0,1,3,GitForce.ClassUtils,GitForce.FormRevisionHistory' GitForce.FormMain' GitForce.Settings.Panels.ControlSpecifications
GitForce,ClassHelp,1,1,0,0,1,34,2,0,0,0,2,7,GitForce.App' GitForce.MessageType,GitForce.FormCustomizeTools' GitForce.FormHttps' GitForce.FormRecreateRepos' GitForce.FormSSH' GitForce.FormEditTools' GitForce.FormAbout' GitForce.FormMain
GitForce,ClassMerge,4,4,0,0,4,106,7,0,0,0.5,4,3,GitForce.AppHelper' GitForce.ClassConfig' GitForce.FormMergeMissing' GitForce.Properties.Settings,GitForce.Main.Right.Panels.PanelCommits' GitForce.Settings.Panels.ControlMerge' GitForce.App
GitForce,PortableSettingsProvider,5,11,7,0,7,181,18,0,0,0.64,1,1,GitForce.ClassUtils,GitForce.Properties.Settings
GitForce,ClassSSH,1,1,0,0,1,33,1,0,0,0,4,1,GitForce.ClassUtils' GitForce.App' GitForce.MessageType' GitForce.Properties.Resources,GitForce.App
GitForce,ClassTabCheck,0,3,0,0,1,99,15,0,0,-1,3,1,GitForce.App' GitForce.MessageType' GitForce.Properties.Settings,GitForce.ClassRepo
GitForce,ClassVersion,4,5,0,2,3,137,11,0,0,0.6,2,4,GitForce.App' GitForce.MessageType,GitForce.FormAbout' GitForce.ClassCommandLine' GitForce.App' GitForce.FormMain
GitForce,ClassPutty,4,7,0,0,7,151,10,0,0,0.29,10,1,GitForce.ExecResult' GitForce.Exec' GitForce.ClassUrl' GitForce.Url' GitForce.ClassUtils' GitForce.NativeMethods' GitForce.App' GitForce.MessageType' GitForce.Properties.Resources' GitForce.Properties.Settings,GitForce.App
GitForce,ClassRemotes,2,8,0,1,8,139,19,0,0,0,3,6,GitForce.ExecResult' GitForce.Remote' GitForce.ClassRepo,GitForce.FormRemoteAddEdit' GitForce.FormNewRepoStep1' GitForce.ClassRepo' GitForce.RemoteEdit' GitForce.RemotesEdit' GitForce.Main.Right.Panels.PanelRepos
GitForce,Remote,5,0,0,5,0,9,0,0,0,-1,0,6,,GitForce.FormRemoteAddEdit' GitForce.RemotesEdit' GitForce.Main.Right.Panels.PanelRepos' GitForce.RemoteEdit' GitForce.FormNewRepoStep1' GitForce.ClassRemotes
GitForce,ClassRepo,10,23,1,8,22,319,33,0,0,0.13,15,18,GitForce.ClassBranches' GitForce.ClassCommits' GitForce.ClassConfig' GitForce.ClassDiff' GitForce.ExecResult' GitForce.ClassGit' GitForce.GitDirectoryInfo' GitForce.SortBy' GitForce.ClassTabCheck' GitForce.ClassRemotes' GitForce.ClassStatus' GitForce.ClassUtils' GitForce.App' GitForce.MessageType' GitForce.Properties.Settings,GitForce.ClassRemotes' GitForce.FormRemoteEdit' GitForce.ClassView' GitForce.RemotesEdit' GitForce.ClassConfig' GitForce.ClassStatus' GitForce.FormRename' GitForce.Repo.Edit.Panels.ControlGitconfig' GitForce.Repo.Edit.Panels.ControlGitignore' GitForce.Repo.Edit.Panels.ControlUser' GitForce.Repo.Edit.Panels.ControlLocal' GitForce.Repo.Edit.Panels.ControlRemotes' GitForce.IRepoSettings' GitForce.FormRepoEdit' GitForce.FormMain' GitForce.FormRecreateRepos' GitForce.Main.Right.Panels.PanelRepos' GitForce.ClassRepos
GitForce,ClassRepos,1,10,2,1,10,225,26,0,0,0,8,2,GitForce.ClassException' GitForce.ClassRepo' GitForce.ClassStatus' GitForce.ClassUtils' GitForce.DirStatType' GitForce.FormRecreateRepos' GitForce.App' GitForce.MessageType,GitForce.FormMain' GitForce.App
GitForce,ClassStatus,3,11,1,1,10,161,22,0,0,0,3,6,GitForce.ExecResult' GitForce.ClassRepo' GitForce.App,GitForce.ClassView' GitForce.FormShowChangelist' GitForce.ClassRepos' GitForce.Main.Left.Panels.PanelView' GitForce.Main.Right.Panels.PanelCommits' GitForce.ClassRepo
GitForce,ClassTool,12,6,0,12,3,207,17,0,0,0.67,4,4,GitForce.ClassUtils' GitForce.FormCustomToolArgs' GitForce.App' GitForce.MessageType,GitForce.FormEditTools' GitForce.Main.Left.Panels.PanelView' GitForce.FormCustomizeTools' GitForce.ClassCustomTools
GitForce,ClassCustomTools,1,4,0,1,4,98,7,0,0,1,4,3,GitForce.ClassTool' GitForce.App' GitForce.MessageType' GitForce.Properties.Settings,GitForce.App' GitForce.FormCustomizeTools' GitForce.FormMain
GitForce,ClassUrl,1,2,0,0,2,183,18,0,0,0,2,4,GitForce.UrlType' GitForce.Url,GitForce.ClassPutty' GitForce.FormHttps' GitForce.FormSSH' GitForce.RemoteEdit
GitForce,UrlType,0,0,0,0,0,1,0,0,0,-1,0,4,,GitForce.FormSSH' GitForce.RemoteEdit' GitForce.FormHttps' GitForce.ClassUrl
GitForce,Url,7,0,0,7,0,10,0,0,0,-1,0,5,,GitForce.ClassPutty' GitForce.FormHttps' GitForce.ClassUrl' GitForce.RemoteEdit' GitForce.FormSSH
GitForce,ClassUtils,1,25,0,0,24,444,62,0,0,0.48,6,34,GitForce.Exec' GitForce.DirStatType' GitForce.NativeMethods' GitForce.App' GitForce.MessageType' GitForce.Properties.Settings,GitForce.RemoteEdit' GitForce.ClassGlobals' GitForce.ClassRepo' GitForce.ClassSSH' GitForce.PortableSettingsProvider' GitForce.Exec' GitForce.TreeViewEx' GitForce.Settings.Panels.ControlSsl' GitForce.FormDeleteRepo' GitForce.FormDiffMissing' GitForce.ClassTool' GitForce.FormEditTools' GitForce.Settings.Panels.ControlGlobal' GitForce.FormMergeMissing' GitForce.ClassPutty' GitForce.FormHttps' GitForce.ClassGit' GitForce.ClassCommandLine' GitForce.FormPathToGit' GitForce.FormSSH' GitForce.FormRevisionHistory' GitForce.RichTextBoxEx' GitForce.FormNewRepoStep1' GitForce.Main.Right.Panels.PanelRevlist' GitForce.FormGitRun' GitForce.Main.Right.Panels.PanelCommits' GitForce.ClassHttpsPasswd' GitForce.Main.Left.Panels.PanelView' GitForce.ClassRepos' GitForce.App' GitForce.FormNewRepoStep2' GitForce.FormMain' GitForce.Main.Right.Panels.PanelRepos' GitForce.FormRecreateRepos
GitForce,DirStatType,0,0,0,0,0,7,0,0,0,-1,0,6,,GitForce.Main.Right.Panels.PanelRepos' GitForce.ClassRepos' GitForce.ClassUtils' GitForce.FormNewRepoStep1' GitForce.FormNewRepoStep2' GitForce.FormRecreateRepos
GitForce,ClassView,2,8,0,0,7,228,34,0,0,0.75,8,2,GitForce.ClassCommit' GitForce.GitFileInfo' GitForce.GitDirectoryInfo' GitForce.SortBy' GitForce.ClassRepo' GitForce.ClassStatus' GitForce.Img' GitForce.Properties.Resources,GitForce.Main.Right.Panels.PanelCommits' GitForce.Main.Left.Panels.PanelView
GitForce,Img,0,0,0,0,0,19,0,0,0,-1,0,3,,GitForce.Main.Right.Panels.PanelCommits' GitForce.Main.Left.Panels.PanelView' GitForce.ClassView
GitForce,NativeMethods,9,9,0,8,7,36,9,0,0,0.89,0,4,,GitForce.ClassCommandLine' GitForce.ClassUtils' GitForce.ClassPutty' GitForce.TabEx
GitForce,ClassWinGeometry,1,4,0,0,3,96,11,0,0,0,2,32,GitForce.Geometry' GitForce.Properties.Settings,GitForce.FormDeleteBranch' GitForce.FormNewBranch' GitForce.FormNewRepoScan' GitForce.FormAbout' GitForce.FormMergeBranch' GitForce.FormLog' GitForce.FormNewRepoStep2' GitForce.FormNewRepoStep1' GitForce.FormRecreateRepos' GitForce.FormRemoteAddEdit' GitForce.FormEditTools' GitForce.FormGitRun' GitForce.FormRename' GitForce.FormRemoteEdit' GitForce.FormReset' GitForce.FormCommitMerge' GitForce.FormRepoEdit' GitForce.FormCustomizeTools' GitForce.FormMain' GitForce.FormRevisionHistory' GitForce.FormDeleteRepo' GitForce.FormSettings' GitForce.FormSwitchToBranch' GitForce.FormChangelistFilter' GitForce.FormShowChangelist' GitForce.FormUnstash' GitForce.FormHttpsAuth' GitForce.FormSSH' GitForce.FormHttps' GitForce.FormCustomToolArgs' GitForce.FormCommit' GitForce.FormStash
GitForce,Geometry,2,0,0,2,0,5,0,0,0,-1,0,1,,GitForce.ClassWinGeometry
GitForce,ClassWorkspace,0,7,0,0,6,96,13,0,0,-1,3,1,GitForce.App' GitForce.MessageType' GitForce.Properties.Settings,GitForce.FormMain
GitForce,FormAbout,15,8,0,0,1,296,9,0,0,0.88,4,1,GitForce.ClassHelp' GitForce.ClassVersion' GitForce.ClassWinGeometry' GitForce.App,GitForce.FormMain
GitForce,FormChangelistFilter,15,5,1,1,1,268,10,0,0,0.6,3,1,GitForce.ClassWinGeometry' GitForce.App' GitForce.MessageType,GitForce.Main.Right.Panels.PanelRevlist
GitForce,FormCommit,14,13,0,0,5,374,25,0,0,0.23,5,1,GitForce.ClassCommit' GitForce.ExecResult' GitForce.ClassWinGeometry' GitForce.App' GitForce.Properties.Settings,GitForce.Main.Right.Panels.PanelCommits
GitForce,FormCommitMerge,10,8,0,0,3,259,14,0,0,0.38,3,1,GitForce.ClassCommit' GitForce.ClassWinGeometry' GitForce.Properties.Settings,GitForce.Main.Right.Panels.PanelCommits
GitForce,FormCustomizeTools,27,13,0,1,1,559,27,0,0,0.31,5,1,GitForce.ClassHelp' GitForce.ClassTool' GitForce.ClassCustomTools' GitForce.ClassWinGeometry' GitForce.FormEditTools,GitForce.FormMain
GitForce,FormCustomToolArgs,7,6,1,0,2,171,8,0,0,0.5,1,1,GitForce.ClassWinGeometry,GitForce.ClassTool
GitForce,FormDeleteBranch,10,7,0,0,1,243,17,0,0,0.29,5,1,GitForce.ClassBranches' GitForce.ExecResult' GitForce.ClassWinGeometry' GitForce.App' GitForce.Properties.Settings,GitForce.Main.Right.Panels.PanelBranches
GitForce,FormDeleteRepo,11,6,0,0,1,225,11,0,0,0.5,3,1,GitForce.ClassUtils' GitForce.ClassWinGeometry' GitForce.App,GitForce.Main.Right.Panels.PanelRepos
GitForce,FormDiffMissing,16,5,0,0,1,323,9,0,0,0.8,2,1,GitForce.ClassUtils' GitForce.FormDownload,GitForce.ClassDiff
GitForce,FormEditTools,29,14,0,1,1,602,23,0,0,0.36,6,1,GitForce.ClassHelp' GitForce.ClassTool' GitForce.ClassUtils' GitForce.ClassWinGeometry' GitForce.App' GitForce.MessageType,GitForce.FormCustomizeTools
GitForce,FormGitRun,10,18,0,0,2,366,31,0,0,0.22,8,1,GitForce.ExecResult' GitForce.Exec' GitForce.ClassUtils' GitForce.ClassWinGeometry' GitForce.FormSSH' GitForce.App' GitForce.MessageType' GitForce.Properties.Settings,GitForce.ClassGit
GitForce,FormHttps,20,16,0,0,1,440,25,0,0,0.19,9,2,GitForce.ClassHelp' GitForce.ClassUrl' GitForce.UrlType' GitForce.Url' GitForce.ClassUtils' GitForce.ClassWinGeometry' GitForce.FormHttpsAuth' GitForce.App' GitForce.MessageType,GitForce.RemoteEdit' GitForce.FormMain
GitForce,FormHttpsAuth,8,6,2,0,1,196,7,0,0,0.5,1,2,GitForce.ClassWinGeometry,GitForce.FormHttps' GitForce.ClassCommandLine
GitForce,FormLog,8,10,0,0,2,208,16,0,0,0.3,3,1,GitForce.ClassWinGeometry' GitForce.App' GitForce.MessageType,GitForce.App
GitForce,FormMain,94,62,0,0,9,1976,155,0,0,0.31,32,4,GitForce.ClassConfig' GitForce.ClassGit' GitForce.ClassGlobals' GitForce.ClassHelp' GitForce.ClassVersion' GitForce.ClassRepo' GitForce.ClassRepos' GitForce.ClassCustomTools' GitForce.ClassUtils' GitForce.ClassWinGeometry' GitForce.ClassWorkspace' GitForce.FormAbout' GitForce.FormCustomizeTools' GitForce.FormHttps' GitForce.SelectveRefreshFlags' GitForce.StatusListBoxItem' GitForce.FormRemoteEdit' GitForce.FormSettings' GitForce.FormSSH' GitForce.FormStash' GitForce.FormUnstash' GitForce.App' GitForce.MessageType' GitForce.TabEx' GitForce.Main.Left.Panels.PanelView' GitForce.Main.Left.Panels.FileOps' GitForce.Main.Right.Panels.PanelBranches' GitForce.Main.Right.Panels.PanelCommits' GitForce.Main.Right.Panels.PanelRepos' GitForce.Main.Right.Panels.PanelRevlist' GitForce.Properties.Resources' GitForce.Properties.Settings,GitForce.Settings.Panels.ControlFiles' GitForce.App' GitForce.Main.Right.Panels.PanelCommits' GitForce.Main.Left.Panels.PanelView
GitForce,SelectveRefreshFlags,0,0,0,0,0,10,0,0,0,-1,0,4,,GitForce.Main.Right.Panels.PanelCommits' GitForce.Settings.Panels.ControlFiles' GitForce.Main.Left.Panels.PanelView' GitForce.FormMain
GitForce,StatusListBoxItem,0,1,2,0,1,10,1,0,0,-1,0,1,,GitForce.FormMain
GitForce,FormMergeBranch,6,5,0,0,1,151,9,0,0,0.6,3,1,GitForce.ClassBranches' GitForce.ClassWinGeometry' GitForce.App,GitForce.Main.Right.Panels.PanelBranches
GitForce,FormMergeMissing,17,4,0,0,1,291,5,0,0,0.75,1,1,GitForce.ClassUtils,GitForce.ClassMerge
GitForce,FormDownload,12,11,1,0,1,268,18,0,0,0.18,0,1,,GitForce.FormDiffMissing
GitForce,FormNewBranch,16,10,0,0,1,382,26,0,0,0.4,4,1,GitForce.ClassBranches' GitForce.ExecResult' GitForce.ClassWinGeometry' GitForce.App,GitForce.Main.Right.Panels.PanelBranches
GitForce,FormNewRepoScan,12,11,0,0,2,278,18,0,0,0.27,3,1,GitForce.ClassWinGeometry' GitForce.FormNewRepoScanProgress' GitForce.Properties.Settings,GitForce.Main.Right.Panels.PanelRepos
GitForce,FormNewRepoScanAdd,6,5,0,0,1,139,9,0,0,0.4,4,1,GitForce.ClassException' GitForce.ClassGit' GitForce.App' GitForce.MessageType,GitForce.Main.Right.Panels.PanelRepos
GitForce,FormNewRepoScanProgress,7,6,0,1,1,144,11,0,0,0.33,0,1,,GitForce.FormNewRepoScan
GitForce,FormNewRepoStep1,14,9,2,1,2,299,14,0,0,0.33,5,1,GitForce.ClassRemotes' GitForce.Remote' GitForce.ClassUtils' GitForce.DirStatType' GitForce.ClassWinGeometry,GitForce.Main.Right.Panels.PanelRepos
GitForce,FormNewRepoStep2,15,7,3,2,1,266,11,0,0,0.43,3,1,GitForce.ClassUtils' GitForce.DirStatType' GitForce.ClassWinGeometry,GitForce.Main.Right.Panels.PanelRepos
GitForce,FormPathToGit,12,6,0,1,1,229,8,0,0,0.33,1,1,GitForce.ClassUtils,GitForce.ClassGit
GitForce,FormRecreateRepos,16,13,1,0,1,464,29,0,0,0.31,7,1,GitForce.ClassHelp' GitForce.ClassRepo' GitForce.ClassUtils' GitForce.DirStatType' GitForce.ClassWinGeometry' GitForce.FormRepoEdit' GitForce.Main.Right.Panels.PanelRepos,GitForce.ClassRepos
GitForce,FormRemoteAddEdit,4,7,0,0,3,150,10,0,0,0.43,4,1,GitForce.ClassRemotes' GitForce.Remote' GitForce.ClassWinGeometry' GitForce.Function,GitForce.RemotesEdit
GitForce,Function,0,0,0,0,0,1,0,0,0,-1,0,2,,GitForce.RemotesEdit' GitForce.FormRemoteAddEdit
GitForce,FormRemoteEdit,3,4,0,0,1,89,5,0,0,0.75,2,2,GitForce.ClassRepo' GitForce.ClassWinGeometry,GitForce.Repo.Edit.Panels.ControlRemotes' GitForce.FormMain
GitForce,FormRename,13,8,0,0,3,310,24,0,0,0.38,3,1,GitForce.ClassCommit' GitForce.ClassRepo' GitForce.ClassWinGeometry,GitForce.Main.Left.Panels.PanelView
GitForce,IRepoSettings,0,3,0,0,0,6,3,5,0,-1,1,6,GitForce.ClassRepo,GitForce.Repo.Edit.Panels.ControlGitconfig' GitForce.Repo.Edit.Panels.ControlGitignore' GitForce.Repo.Edit.Panels.ControlUser' GitForce.Repo.Edit.Panels.ControlRemotes' GitForce.Repo.Edit.Panels.ControlLocal' GitForce.FormRepoEdit
GitForce,FormRepoEdit,9,7,0,0,1,219,12,0,0,0.43,8,2,GitForce.ClassRepo' GitForce.ClassWinGeometry' GitForce.IRepoSettings' GitForce.Repo.Edit.Panels.ControlGitconfig' GitForce.Repo.Edit.Panels.ControlGitignore' GitForce.Repo.Edit.Panels.ControlLocal' GitForce.Repo.Edit.Panels.ControlRemotes' GitForce.Repo.Edit.Panels.ControlUser,GitForce.Main.Right.Panels.PanelRepos' GitForce.FormRecreateRepos
GitForce,FormReset,8,5,0,1,1,176,9,0,0,0.8,1,1,GitForce.ClassWinGeometry,GitForce.Main.Right.Panels.PanelRevlist
GitForce,FormRevisionHistory,20,19,2,0,2,538,41,0,0,0.16,10,3,GitForce.ClassDiff' GitForce.ExecResult' GitForce.ClassGlobals' GitForce.ClassUtils' GitForce.ClassWinGeometry' GitForce.FormShowChangelist' GitForce.App' GitForce.MessageType' GitForce.Main.Right.Panels.PanelRevlist' GitForce.Properties.Settings,GitForce.FormShowChangelist' GitForce.Main.Right.Panels.PanelCommits' GitForce.Main.Left.Panels.PanelView
GitForce,IUserSettings,0,3,0,0,0,6,3,15,0,-1,0,16,,GitForce.Settings.Panels.ControlFiles' GitForce.Settings.Panels.ControlGitconfig' GitForce.Settings.Panels.ControlAliases' GitForce.Settings.Panels.ControlOptions' GitForce.Settings.Panels.ControlGlobal' GitForce.Settings.Panels.ControlMerge' GitForce.Settings.Panels.ControlSsl' GitForce.Settings.Panels.ControlSpecifications' GitForce.Settings.Panels.ControlGitignore' GitForce.Settings.Panels.ControlViewEdit' GitForce.Settings.Panels.ControlUser' GitForce.Settings.Panels.ControlStatus' GitForce.Settings.Panels.ControlCommits' GitForce.Settings.Panels.ControlDoubleClick' GitForce.Settings.Panels.ControlDiff' GitForce.FormSettings
GitForce,FormSettings,9,7,0,0,1,283,12,0,0,0.43,18,1,GitForce.ClassGit' GitForce.ClassWinGeometry' GitForce.IUserSettings' GitForce.Settings.Panels.ControlAliases' GitForce.Settings.Panels.ControlCommits' GitForce.Settings.Panels.ControlDiff' GitForce.Settings.Panels.ControlDoubleClick' GitForce.Settings.Panels.ControlFiles' GitForce.Settings.Panels.ControlGitconfig' GitForce.Settings.Panels.ControlGitignore' GitForce.Settings.Panels.ControlGlobal' GitForce.Settings.Panels.ControlMerge' GitForce.Settings.Panels.ControlOptions' GitForce.Settings.Panels.ControlSpecifications' GitForce.Settings.Panels.ControlSsl' GitForce.Settings.Panels.ControlStatus' GitForce.Settings.Panels.ControlUser' GitForce.Settings.Panels.ControlViewEdit,GitForce.FormMain
GitForce,ControlDirtyHelper,0,1,0,0,1,7,1,0,0,-1,0,8,,GitForce.Settings.Panels.ControlSsl' GitForce.Settings.Panels.ControlOptions' GitForce.Settings.Panels.ControlAliases' GitForce.Settings.Panels.ControlMerge' GitForce.Settings.Panels.ControlDiff' GitForce.Settings.Panels.ControlUser' GitForce.Repo.Edit.Panels.ControlUser' GitForce.Settings.Panels.ControlFiles
GitForce,FormShowChangelist,16,12,0,0,3,433,28,0,0,0.17,7,3,GitForce.ExecResult' GitForce.ClassStatus' GitForce.ClassWinGeometry' GitForce.FormRevisionHistory' GitForce.ListViewEx' GitForce.App' GitForce.Properties.Settings,GitForce.FormRevisionHistory' GitForce.Main.Right.Panels.PanelRevlist' GitForce.FormUnstash
GitForce,FormSSH,34,30,0,0,2,779,42,0,0,0.17,8,4,GitForce.ClassHelp' GitForce.ClassUrl' GitForce.UrlType' GitForce.Url' GitForce.ClassUtils' GitForce.ClassWinGeometry' GitForce.App' GitForce.Properties.Settings,GitForce.RemoteEdit' GitForce.Settings.Panels.ControlSsl' GitForce.FormGitRun' GitForce.FormMain
GitForce,FormStash,7,5,0,0,1,153,6,0,0,0.6,2,1,GitForce.ClassWinGeometry' GitForce.App,GitForce.FormMain
GitForce,FormSwitchToBranch,6,6,0,0,1,143,8,0,0,0.5,2,1,GitForce.ClassWinGeometry' GitForce.App,GitForce.Main.Right.Panels.PanelBranches
GitForce,FormUnstash,9,9,0,0,1,246,13,0,0,0.33,4,1,GitForce.ExecResult' GitForce.ClassWinGeometry' GitForce.FormShowChangelist' GitForce.App,GitForce.FormMain
GitForce,ListBoxEx,0,3,0,0,1,54,8,0,0,-1,0,0,,
GitForce,ListViewEx,0,1,0,0,1,10,1,0,0,-1,0,1,,GitForce.FormShowChangelist
GitForce,ListViewReorderEx,3,5,2,0,1,172,25,0,0,0.4,0,0,,
GitForce,App,20,4,0,19,1,186,15,0,0,0.75,17,51,GitForce.Arguments' GitForce.ClassCommandLine' GitForce.ClassDiff' GitForce.ClassGit' GitForce.ClassHttpsPasswd' GitForce.ClassMerge' GitForce.ClassSSH' GitForce.ClassVersion' GitForce.ClassPutty' GitForce.ClassRepos' GitForce.ClassCustomTools' GitForce.ClassUtils' GitForce.FormLog' GitForce.FormMain' GitForce.MessageType' GitForce.Settings.Panels.ControlViewEdit' GitForce.Properties.Settings,GitForce.ClassHelp' GitForce.RemotesEdit' GitForce.GitDirectoryInfo' GitForce.ClassConfig' GitForce.RemoteEdit' GitForce.ClassGit' GitForce.ClassCommandLine' GitForce.ClassPutty' GitForce.ClassHttpsPasswd' GitForce.Settings.Panels.ControlOptions' GitForce.ClassStatus' GitForce.ClassTabCheck' GitForce.ClassBranches' GitForce.FormChangelistFilter' GitForce.FormAbout' GitForce.Settings.Panels.ControlGitignore' GitForce.FormCommit' GitForce.FormDeleteRepo' GitForce.FormDeleteBranch' GitForce.Exec' GitForce.Settings.Panels.ControlGitconfig' GitForce.FormEditTools' GitForce.FormGitRun' GitForce.Settings.Panels.ControlFiles' GitForce.ClassRepos' GitForce.FormMergeBranch' GitForce.ClassWorkspace' GitForce.Settings.Panels.ControlAliases' GitForce.FormHttps' GitForce.ClassRepo' GitForce.ClassUtils' GitForce.Repo.Edit.Panels.ControlRemotes' GitForce.FormStash' GitForce.FormNewRepoScanAdd' GitForce.FormNewBranch' GitForce.FormShowChangelist' GitForce.FormUnstash' GitForce.FormSSH' GitForce.ClassTool' GitForce.ClassCustomTools' GitForce.ClassVersion' GitForce.FormSwitchToBranch' GitForce.ClassSSH' GitForce.Main.Right.Panels.PanelRevlist' GitForce.Main.Right.Panels.PanelBranches' GitForce.Main.Right.Panels.PanelRepos' GitForce.FormLog' GitForce.FormRevisionHistory' GitForce.FormMain' GitForce.Main.Left.Panels.PanelView' GitForce.Main.Right.Panels.PanelCommits
GitForce,MessageType,0,0,0,0,0,9,0,0,0,-1,0,31,,GitForce.ClassSSH' GitForce.ClassHelp' GitForce.GitDirectoryInfo' GitForce.ClassHttpsPasswd' GitForce.ClassVersion' GitForce.ClassPutty' GitForce.ClassConfig' GitForce.ClassGit' GitForce.RemotesEdit' GitForce.FormChangelistFilter' GitForce.FormEditTools' GitForce.FormGitRun' GitForce.ClassRepo' GitForce.ClassWorkspace' GitForce.ClassTabCheck' GitForce.Settings.Panels.ControlGitignore' GitForce.FormRevisionHistory' GitForce.FormLog' GitForce.FormNewRepoScanAdd' GitForce.FormHttps' GitForce.Main.Right.Panels.PanelCommits' GitForce.Settings.Panels.ControlAliases' GitForce.Main.Right.Panels.PanelRepos' GitForce.Exec' GitForce.ClassRepos' GitForce.App' GitForce.ClassUtils' GitForce.ClassTool' GitForce.ClassCustomTools' GitForce.Main.Left.Panels.PanelView' GitForce.FormMain
GitForce,RichTextBoxEx,57,11,1,0,5,220,16,0,0,0.27,2,0,GitForce.ClassUtils' GitForce.CHARFORMAT2_STRUCT,
GitForce,CHARFORMAT2_STRUCT,20,0,0,20,0,25,0,0,0,-1,0,1,,GitForce.RichTextBoxEx
GitForce,TextBoxEx,2,2,0,0,0,69,8,0,0,0,0,0,,
GitForce,TreeViewEx,3,13,2,0,3,195,32,0,0,0.23,1,1,GitForce.ClassUtils,GitForce.Main.Left.Panels.PanelView
GitForce,UserControlEditFile,4,6,0,1,3,136,9,0,0,0.33,0,0,,
GitForce,UserControlEditGitignore,6,6,1,0,3,221,9,0,0,0.33,0,0,,
GitForce,RemoteEdit,25,19,0,1,6,522,31,0,0,0.21,9,0,GitForce.ClassRemotes' GitForce.Remote' GitForce.ClassUrl' GitForce.UrlType' GitForce.Url' GitForce.ClassUtils' GitForce.FormHttps' GitForce.FormSSH' GitForce.App,
GitForce,RemotesEdit,10,10,0,0,2,280,25,0,0,0.2,8,0,GitForce.ExecResult' GitForce.ClassRemotes' GitForce.Remote' GitForce.ClassRepo' GitForce.FormRemoteAddEdit' GitForce.Function' GitForce.App' GitForce.MessageType,
GitForce,TabEx,0,2,1,0,1,28,4,0,0,-1,1,1,GitForce.NativeMethods,GitForce.FormMain
GitForce.Main.Left.Panels,PanelView,21,38,0,0,8,883,90,0,0,0.13,19,1,GitForce.ExecResult' GitForce.GitDirectoryInfo' GitForce.SortBy' GitForce.ClassStatus' GitForce.ClassTool' GitForce.ClassUtils' GitForce.ClassView' GitForce.Img' GitForce.FormMain' GitForce.SelectveRefreshFlags' GitForce.FormRename' GitForce.FormRevisionHistory' GitForce.App' GitForce.MessageType' GitForce.TreeViewEx' GitForce.Main.Left.Panels.Selection' GitForce.Main.Left.Panels.FileOps' GitForce.Main.Right.Panels.PanelCommits' GitForce.Properties.Settings,GitForce.FormMain
GitForce.Main.Left.Panels,Selection,2,1,0,2,1,17,3,0,0,0,0,1,,GitForce.Main.Left.Panels.PanelView
GitForce.Main.Left.Panels,FileOps,0,0,0,0,0,1,0,0,0,-1,0,2,,GitForce.FormMain' GitForce.Main.Left.Panels.PanelView
GitForce.Main.Right.Panels,PanelBranches,7,12,0,0,3,267,27,0,0,0.33,7,1,GitForce.ClassBranches' GitForce.FormDeleteBranch' GitForce.FormMergeBranch' GitForce.FormNewBranch' GitForce.FormSwitchToBranch' GitForce.App' GitForce.Main.Right.Panels.BranchIcons,GitForce.FormMain
GitForce.Main.Right.Panels,BranchIcons,0,0,0,0,0,1,0,0,0,-1,0,1,,GitForce.Main.Right.Panels.PanelBranches
