Project,Namespace,Ca types,Ce types
BankTransferSample,BankTransferSample.ApplicationMessages,BankTransferSample.EventHandlers.ConsoleLogger' BankTransferSample.ProcessManagers.TransferTransactionProcessManager,
BankTransferSample,BankTransferSample.CommandHandlers,,ENode.Commanding.ICommandContext' BankTransferSample.Commands.CreateAccountCommand' ENode.Infrastructure.ApplicationMessage' BankTransferSample.Commands.ValidateAccountCommand' BankTransferSample.Domain.BankAccount' BankTransferSample.Commands.AddTransactionPreparationCommand' BankTransferSample.Commands.CommitTransactionPreparationCommand' BankTransferSample.Commands.StartDepositTransactionCommand' BankTransferSample.Domain.DepositTransaction' BankTransferSample.Commands.ConfirmDepositPreparationCommand' BankTransferSample.Commands.ConfirmDepositCommand' BankTransferSample.Commands.StartTransferTransactionCommand' BankTransferSample.Domain.TransferTransaction' BankTransferSample.Commands.ConfirmAccountValidatePassedCommand' BankTransferSample.Commands.ConfirmTransferOutPreparationCommand' BankTransferSample.Commands.ConfirmTransferInPreparationCommand' BankTransferSample.Commands.ConfirmTransferOutCommand' BankTransferSample.Commands.ConfirmTransferInCommand' BankTransferSample.Commands.CancelTransferTransactionCommand
BankTransferSample,BankTransferSample.Commands,BankTransferSample.CommandHandlers.BankAccountCommandHandlers' BankTransferSample.CommandHandlers.DepositTransactionCommandHandlers' BankTransferSample.CommandHandlers.TransferTransactionCommandHandlers,BankTransferSample.Domain.TransactionType' BankTransferSample.Domain.PreparationType' BankTransferSample.Domain.TransferTransactionInfo
BankTransferSample,BankTransferSample.Domain,BankTransferSample.CommandHandlers.BankAccountCommandHandlers' BankTransferSample.EventHandlers.ConsoleLogger' BankTransferSample.ProcessManagers.DepositTransactionProcessManager' BankTransferSample.ProcessManagers.TransferTransactionProcessManager' BankTransferSample.Commands.AddTransactionPreparationCommand' BankTransferSample.CommandHandlers.DepositTransactionCommandHandlers' BankTransferSample.EventHandlers.SyncHelper' BankTransferSample.CommandHandlers.TransferTransactionCommandHandlers' BankTransferSample.EventHandlers.CountSyncHelper' BankTransferSample.Commands.StartTransferTransactionCommand,
BankTransferSample,BankTransferSample,,ENode.EQueue.CommandService' ENode.EQueue.CommandConsumer' ENode.EQueue.ApplicationMessagePublisher' ENode.EQueue.ApplicationMessageConsumer' ENode.EQueue.DomainEventPublisher' ENode.EQueue.DomainEventConsumer' ENode.EQueue.PublishableExceptionPublisher' ENode.EQueue.PublishableExceptionConsumer' ENode.Configurations.ENodeConfiguration' ENode.EQueue.CommandResultProcessor' ENode.Commanding.CommandReturnType
BankTransferSample,BankTransferSample.EventHandlers,,BankTransferSample.Domain.AccountCreatedEvent' BankTransferSample.ApplicationMessages.AccountValidatePassedMessage' BankTransferSample.ApplicationMessages.AccountValidateFailedMessage' BankTransferSample.Domain.TransactionPreparation' BankTransferSample.Domain.TransactionPreparationAddedEvent' BankTransferSample.Domain.TransactionType' BankTransferSample.Domain.PreparationType' BankTransferSample.Domain.TransactionPreparationCommittedEvent' BankTransferSample.Domain.TransferTransactionStartedEvent' BankTransferSample.Domain.TransferTransactionInfo' BankTransferSample.Domain.TransferOutPreparationConfirmedEvent' BankTransferSample.Domain.TransferInPreparationConfirmedEvent' BankTransferSample.Domain.TransferTransactionCompletedEvent' BankTransferSample.Domain.InsufficientBalanceException' BankTransferSample.Domain.TransferTransactionCanceledEvent' BankTransferSample.Domain.DepositTransactionCompletedEvent
BankTransferSample,BankTransferSample.ProcessManagers,,ENode.Commanding.ICommandService' BankTransferSample.Domain.DepositTransactionStartedEvent' BankTransferSample.Domain.TransactionType' BankTransferSample.Domain.PreparationType' BankTransferSample.Domain.TransactionPreparation' BankTransferSample.Domain.TransactionPreparationAddedEvent' BankTransferSample.Domain.DepositTransactionPreparationCompletedEvent' BankTransferSample.Domain.TransactionPreparationCommittedEvent' BankTransferSample.Domain.TransferTransactionInfo' BankTransferSample.Domain.TransferTransactionStartedEvent' BankTransferSample.ApplicationMessages.AccountValidatePassedMessage' BankTransferSample.ApplicationMessages.AccountValidateFailedMessage' BankTransferSample.Domain.AccountValidatePassedConfirmCompletedEvent' BankTransferSample.Domain.InsufficientBalanceException' BankTransferSample.Domain.TransferOutPreparationConfirmedEvent' BankTransferSample.Domain.TransferInPreparationConfirmedEvent
BankTransferSample,BankTransferSample.Providers,,ENode.Infrastructure.IApplicationMessage' ENode.Commanding.ICommand' ENode.Eventing.IDomainEvent' ENode.Infrastructure.IPublishableException
