Project,Namespace,Ca types,Ce types
GraphDSRemoteClient,sones.GraphDS.GraphDSRemoteClient,sones.GraphDS.GraphDSRemoteClient.GraphElements.ARemoteEdge' sones.GraphDS.GraphDSRemoteClient.GraphElements.RemoteEdgeType' sones.GraphDS.GraphDSRemoteClient.GraphElements.RemoteVertexType' sones.GraphDS.GraphDSRemoteClient.sonesGraphDSRemoteAPI.ServiceOutgoingEdgePredefinition' sones.GraphDS.GraphDSRemoteClient.sonesGraphDSRemoteAPI.ServicePropertyPredefinition' sones.GraphDS.GraphDSRemoteClient.sonesGraphDSRemoteAPI.ServiceBinaryExpression' sones.GraphDS.GraphDSRemoteClient.sonesGraphDSRemoteAPI.ServiceUnaryExpression' sones.GraphDS.GraphDSRemoteClient.sonesGraphDSRemoteAPI.ServiceVertexView' sones.GraphDS.GraphDSRemoteClient.sonesGraphDSRemoteAPI.ServiceUpdateChangeset' sones.GraphDS.GraphDSRemoteClient.TypeManagement.RemoteBinaryPropertyDefinition' sones.GraphDS.GraphDSRemoteClient.TypeManagement.RemoteIncomingEdgeDefinition' sones.GraphDS.GraphDSRemoteClient.TypeManagement.RemoteOutgoingEdgeDefinition' sones.GraphDS.GraphDSRemoteClient.TypeManagement.RemotePropertyDefinition' sones.GraphDS.GraphDSRemoteClient.GraphElements.ARemoteBaseType' sones.GraphDS.GraphDSRemoteClient.GraphElements.ARemoteGraphElement' sones.GraphDS.GraphDSRemoteClient.GraphElements.RemoteHyperEdge' sones.GraphDS.GraphDSRemoteClient.GraphElements.RemoteSingleEdge' sones.GraphDS.GraphDSRemoteClient.GraphElements.RemoteVertex' sones.GraphDS.GraphDSRemoteClient.sonesGraphDSRemoteAPI.ServiceHyperEdgeView' sones.GraphDS.GraphDSRemoteClient.sonesGraphDSRemoteAPI.ServiceSingleEdgeView' sones.GraphDS.GraphDSRemoteClient.sonesGraphDSRemoteAPI.ServiceQueryResult' sones.GraphDS.GraphDSRemoteClient.TypeManagement.RemoteIndexDefinition' sones.GraphDS.GraphDSRemoteClient.TypeManagement.RemoteUniqueDefinition,sones.GraphDB.TypeSystem.PropertyMultiplicity' sones.GraphDB.TypeSystem.EdgeMultiplicity' sones.GraphDS.GraphDSRemoteClient.TypeManagement.RemoteIndexDefinition' sones.GraphDS.GraphDSRemoteClient.sonesGraphDSRemoteAPI.ServicePropertyMultiplicity' sones.GraphDS.GraphDSRemoteClient.sonesGraphDSRemoteAPI.ServiceEdgeMultiplicity' sones.GraphDS.GraphDSRemoteClient.sonesGraphDSRemoteAPI.ServiceIndexDefinition' sones.GraphDB.TypeSystem.IBaseType' sones.GraphDS.GraphDSRemoteClient.sonesGraphDSRemoteAPI.ServiceVertexType' sones.GraphDS.GraphDSRemoteClient.sonesGraphDSRemoteAPI.ServiceEdgeType' sones.GraphDS.GraphDSRemoteClient.sonesGraphDSRemoteAPI.ServiceBaseType' sones.GraphDS.GraphDSRemoteClient.sonesGraphDSRemoteAPI.ServiceEdgeInstance' sones.Library.PropertyHyperGraph.ISingleEdge' sones.Library.PropertyHyperGraph.IEdge' sones.GraphDB.TypeSystem.IAttributeDefinition' sones.GraphDS.GraphDSRemoteClient.sonesGraphDSRemoteAPI.ServiceAttributeDefinition' sones.GraphDS.GraphDSRemoteClient.sonesGraphDSRemoteAPI.ServiceAttributeType' sones.GraphDS.GraphDSRemoteClient.sonesGraphDSRemoteAPI.ServiceBaseExpression' sones.GraphDB.Expression.BinaryExpression' sones.GraphDB.Expression.PropertyExpression' sones.GraphDB.Expression.SingleLiteralExpression' sones.GraphDB.Expression.CollectionLiteralExpression' sones.GraphDB.Expression.RangeLiteralExpression' sones.GraphDB.Expression.UnaryExpression' sones.GraphDB.Expression.IExpression' sones.GraphDS.GraphDSRemoteClient.sonesGraphDSRemoteAPI.GraphDSService' sones.GraphDS.GraphDSRemoteClient.sonesGraphDSRemoteAPI.VertexTypeService' sones.GraphDS.GraphDSRemoteClient.sonesGraphDSRemoteAPI.VertexInstanceService' sones.GraphDS.GraphDSRemoteClient.sonesGraphDSRemoteAPI.EdgeTypeService' sones.GraphDS.GraphDSRemoteClient.sonesGraphDSRemoteAPI.EdgeInstanceService' sones.GraphDS.GraphDSRemoteClient.sonesGraphDSRemoteAPI.StreamedService' sones.Library.Commons.Security.SecurityToken' sones.Library.Commons.Security.IUserCredentials' sones.Library.Commons.Transaction.IsolationLevel' sones.GraphDS.GraphDSRemoteClient.sonesGraphDSRemoteAPI.ServiceQueryResult' sones.GraphQL.Result.IQueryResult' sones.GraphDB.Request.RequestCreateVertexTypes' sones.GraphDS.GraphDSRemoteClient.GraphElements.RemoteVertexType' sones.GraphDB.Request.RequestCreateVertexType' sones.GraphDB.Request.RequestAlterVertexType' sones.GraphDS.GraphDSRemoteClient.GraphElements.RemoteEdgeType' sones.GraphDB.Request.RequestCreateEdgeType' sones.GraphDB.Request.RequestCreateEdgeTypes' sones.GraphDB.Request.RequestAlterEdgeType' sones.GraphDB.Request.RequestClear' sones.GraphDB.Request.RequestGetVertices' sones.GraphDB.Request.RequestDelete' sones.GraphDS.GraphDSRemoteClient.sonesGraphDSRemoteAPI.ServiceVertexInstance' sones.GraphDS.GraphDSRemoteClient.GraphElements.RemoteVertex' sones.GraphDB.Request.RequestInsertVertex' sones.GraphDB.RequestTruncate' sones.GraphDB.Request.RequestUpdate' sones.GraphDB.Request.RequestDropVertexType' sones.GraphDB.Request.RequestDropEdgeType' sones.GraphDB.Request.RequestDropIndex' sones.GraphDB.Request.RequestCreateIndex' sones.GraphDB.Request.RequestRebuildIndices' sones.GraphDB.Request.RequestGetVertex' sones.GraphDB.Request.RequestTraverseVertex' sones.GraphDB.Request.RequestGetVertexType' sones.GraphDB.Request.RequestGetAllVertexTypes' sones.GraphDB.Request.RequestGetEdgeType' sones.GraphDB.Request.RequestGetAllEdgeTypes' sones.GraphDB.Request.RequestDescribeIndex' sones.GraphDB.Request.RequestGetVertexCount' sones.GraphDS.GraphDSRemoteClient.sonesGraphDSRemoteAPI.ServiceUserPasswordCredentials
GraphDSRemoteClient,sones.GraphDS.GraphDSRemoteClient.ErrorHandling,,
GraphDSRemoteClient,sones.GraphDS.GraphDSRemoteClient.GraphElements,sones.GraphDS.GraphDSRemoteClient.sonesGraphDSRemoteAPI.ServiceEdgeInstance' sones.GraphDS.GraphDSRemoteClient.GraphDS_RemoteClient,sones.GraphDS.GraphDSRemoteClient.IServiceToken' sones.GraphDS.GraphDSRemoteClient.sonesGraphDSRemoteAPI.ServiceBaseType' sones.GraphDB.TypeSystem.IBaseType' sones.Library.PropertyHyperGraph.IVertex' sones.GraphDS.GraphDSRemoteClient.sonesGraphDSRemoteAPI.ServiceEdgeInstance' sones.GraphDS.GraphDSRemoteClient.sonesGraphDSRemoteAPI.EdgeInstanceService' sones.GraphDS.GraphDSRemoteClient.ConvertHelper' sones.GraphDS.GraphDSRemoteClient.sonesGraphDSRemoteAPI.ServiceHyperEdgeInstance' sones.Library.PropertyHyperGraph.ISingleEdge' sones.GraphDS.GraphDSRemoteClient.sonesGraphDSRemoteAPI.ServiceSingleEdgeInstance' sones.GraphDS.GraphDSRemoteClient.sonesGraphDSRemoteAPI.ServiceEdgeType' sones.GraphDS.GraphDSRemoteClient.sonesGraphDSRemoteAPI.EdgeTypeService' sones.GraphDB.TypeSystem.IEdgeType' sones.GraphDB.TypeSystem.IAttributeDefinition' sones.GraphDS.GraphDSRemoteClient.TypeManagement.RemotePropertyDefinition' sones.GraphDS.GraphDSRemoteClient.sonesGraphDSRemoteAPI.ServiceVertexInstance' sones.GraphDS.GraphDSRemoteClient.sonesGraphDSRemoteAPI.VertexInstanceService' sones.GraphDS.GraphDSRemoteClient.sonesGraphDSRemoteAPI.StreamedService' sones.GraphDS.GraphDSRemoteClient.sonesGraphDSRemoteAPI.ServiceVertexStatistics' sones.GraphDS.GraphDSRemoteClient.sonesGraphDSRemoteAPI.ServiceVertexType' sones.GraphDS.GraphDSRemoteClient.sonesGraphDSRemoteAPI.VertexTypeService' sones.GraphDS.GraphDSRemoteClient.TypeManagement.RemoteBinaryPropertyDefinition' sones.GraphDS.GraphDSRemoteClient.TypeManagement.RemoteIncomingEdgeDefinition' sones.GraphDS.GraphDSRemoteClient.TypeManagement.RemoteOutgoingEdgeDefinition' sones.GraphDB.TypeSystem.IVertexType
GraphDSRemoteClient,sones.GraphDS.GraphDSRemoteClient.sonesGraphDSRemoteAPI,sones.GraphDS.GraphDSRemoteClient.ConvertHelper' sones.GraphDS.GraphDSRemoteClient.GraphElements.ARemoteEdge' sones.GraphDS.GraphDSRemoteClient.GraphElements.RemoteVertex' sones.GraphDS.GraphDSRemoteClient.GraphElements.RemoteHyperEdge' sones.GraphDS.GraphDSRemoteClient.GraphElements.RemoteSingleEdge' sones.GraphDS.GraphDSRemoteClient.GraphDS_RemoteClient' sones.GraphDS.GraphDSRemoteClient.TypeManagement.RemotePropertyDefinition' sones.GraphDS.GraphDSRemoteClient.GraphElements.ARemoteBaseType' sones.GraphDS.GraphDSRemoteClient.GraphElements.RemoteEdgeType' sones.GraphDS.GraphDSRemoteClient.GraphElements.RemoteVertexType' sones.GraphDS.GraphDSRemoteClient.TypeManagement.RemoteIndexDefinition' sones.GraphDS.GraphDSRemoteClient.RemoteUserPasswordCredentials' sones.GraphDS.GraphDSRemoteClient.TypeManagement.RemoteOutgoingEdgeDefinition' sones.GraphDS.GraphDSRemoteClient.TypeManagement.RemoteIncomingEdgeDefinition' sones.GraphDS.GraphDSRemoteClient.TypeManagement.RemoteBinaryPropertyDefinition' sones.GraphDS.GraphDSRemoteClient.TypeManagement.RemoteUniqueDefinition' sones.GraphDS.GraphDSRemoteClient.GraphElements.RemoteVertexStatistics,sones.Library.PropertyHyperGraph.IEdge' sones.GraphDS.GraphDSRemoteClient.GraphElements.ARemoteEdge' sones.Library.PropertyHyperGraph.IHyperEdge' sones.Library.PropertyHyperGraph.ISingleEdge' sones.Library.PropertyHyperGraph.IVertex' sones.GraphDB.TypeSystem.VertexTypePredefinition' sones.GraphDB.TypeSystem.BinaryPropertyPredefinition' sones.GraphDB.TypeSystem.IncomingEdgePredefinition' sones.GraphDB.TypeSystem.IndexPredefinition' sones.GraphDB.TypeSystem.OutgoingEdgePredefinition' sones.GraphDS.GraphDSRemoteClient.ConvertHelper' sones.GraphDB.TypeSystem.PropertyPredefinition' sones.GraphDB.TypeSystem.UniquePredefinition' sones.GraphDB.TypeSystem.AAttributePredefinition' sones.GraphDB.TypeSystem.UnknownAttributePredefinition' sones.GraphDB.TypeSystem.IEdgeType' sones.GraphDB.TypeSystem.IVertexType' sones.GraphDB.Request.RequestAlterVertexType' sones.GraphDB.TypeSystem.MandatoryPredefinition' sones.GraphDB.Request.RequestAlterEdgeType' sones.GraphDB.TypeSystem.EdgeTypePredefinition' sones.GraphDB.Request.RequestDelete' sones.GraphDB.Expression.SingleLiteralExpression' sones.GraphDB.Expression.BinaryExpression' sones.Library.CollectionWrapper.ICollectionWrapper' sones.GraphDB.Expression.CollectionLiteralExpression' sones.GraphDB.Expression.RangeLiteralExpression' sones.GraphDB.Expression.UnaryExpression' sones.GraphDB.Expression.PropertyExpression' sones.GraphDB.Request.RequestInsertVertex' sones.GraphDB.TypeSystem.EdgePredefinition' sones.GraphQL.Result.VertexView' sones.GraphDS.GraphDSRemoteClient.IServiceToken' sones.GraphQL.Result.HyperEdgeView' sones.GraphQL.Result.SingleEdgeView' sones.GraphQL.Result.ResultType' sones.GraphQL.Result.QueryResult' sones.GraphDB.Request.RequestGetVertices' sones.GraphDB.Request.RequestUpdate' sones.Library.Commons.VertexStore.Definitions.Update.SingleEdgeUpdateDefinition' sones.Library.Commons.VertexStore.Definitions.Update.StructuredPropertiesUpdate' sones.Library.Commons.VertexStore.Definitions.Update.UnstructuredPropertiesUpdate' sones.Library.Commons.VertexStore.Definitions.VertexInformation' sones.Library.Commons.Security.SecurityToken
GraphDSRemoteClient,sones.GraphDS.GraphDSRemoteClient.TypeManagement,sones.GraphDS.GraphDSRemoteClient.GraphElements.RemoteVertexType' sones.GraphDS.GraphDSRemoteClient.ConvertHelper' sones.GraphDS.GraphDSRemoteClient.GraphDS_RemoteClient' sones.GraphDS.GraphDSRemoteClient.GraphElements.RemoteEdgeType,sones.GraphDS.GraphDSRemoteClient.IServiceToken' sones.GraphDS.GraphDSRemoteClient.sonesGraphDSRemoteAPI.ServiceBinaryPropertyDefinition' sones.GraphDS.GraphDSRemoteClient.ConvertHelper' sones.GraphDB.TypeSystem.IAttributeDefinition' sones.GraphDS.GraphDSRemoteClient.sonesGraphDSRemoteAPI.ServiceIncomingEdgeDefinition' sones.GraphDS.GraphDSRemoteClient.sonesGraphDSRemoteAPI.ServiceIndexDefinition' sones.GraphDS.GraphDSRemoteClient.sonesGraphDSRemoteAPI.ServiceOutgoingEdgeDefinition' sones.GraphDS.GraphDSRemoteClient.sonesGraphDSRemoteAPI.ServicePropertyDefinition' sones.GraphDS.GraphDSRemoteClient.sonesGraphDSRemoteAPI.ServicePropertyMultiplicity' sones.GraphDB.TypeSystem.PropertyMultiplicity' sones.GraphDS.GraphDSRemoteClient.sonesGraphDSRemoteAPI.ServiceUniqueDefinition
