Project,Namespace,Ca types,Ce types
updateController,updateSystemDotNet.Administration.UI.Controls,updateSystemDotNet.Internal.UI.updateSearchDialog' updateSystemDotNet.Internal.UI.updatePreviewDialog' updateSystemDotNet.Internal.UI.updateDownloadDialog,
updateController,updateSystemDotNet.Localization,updateSystemDotNet.updateController' updateSystemDotNet.Internal.UI.updateSearchDialog' updateSystemDotNet.Internal.UI.updatePreviewDialog' updateSystemDotNet.Internal.UI.updateDownloadDialog,updateSystemDotNet.Languages
updateController,updateSystemDotNet.appEventArgs,updateSystemDotNet.Internal.updateUI.updateViewDialog' updateSystemDotNet.Internal.updateUI.updateBaseView' updateSystemDotNet.updateController' testApplication.testForm' updateSystemDotNet.Administration.UI.mainForm' Beispielanwendung_CSharp.mainForm' updateSystemDotNet.Internal.updateUI.Views.viewUpdateCheck' Beispielanwendung_CSharp.customDownloadDialog' updateSystemDotNet.updateDownloadBaseForm' updateSystemDotNet.Internal.UI.updateDownloadDialog' testApplication.myDownloadForm,updateSystemDotNet.Core.Types.updatePackage' updateSystemDotNet.UpdateResult
updateController,updateSystemDotNet.appExceptions,,
updateController,updateSystemDotNet.Core,updateSystemDotNet.Administration.UI.Dialogs.publishUpdatesDialog' updateSystemDotNet.Administration.UI.mainFormPages.updateSubPage' updateSystemDotNet.Core.Types.updatePackage' updateSystemDotNet.Internal.searchProvider' updateSystemDotNet.Internal.Log' updateSystemDotNet.Internal.taskBarManager' updateSystemDotNet.Internal.UI.updatePreviewDialog' updateSystemDotNet.Administration.Core.Publishing.publishBase' updateSystemDotNet.Administration.UI.Dialogs.upgradeProjectDialog' updateSystemDotNet.Administration.Core.Updates.updateFactory,updateSystemDotNet.Core.Types.SupportedArchitectures' updateSystemDotNet.Core.Types.updatePackage' updateSystemDotNet.Core.Types.updateConfiguration
updateController,updateSystemDotNet.Core.Types,updateSystemDotNet.UpdateResult' updateSystemDotNet.Internal.searchProvider' updateSystemDotNet.Internal.UI.updateSearchDialog' updateSystemDotNet.Internal.UI.updatePreviewDialog' Beispielanwendung_CSharp.mainForm' testApplication.testForm' updateSystemDotNet.Administration.UI.updateActionEditor.deleteFilesActionEditor' updateSystemDotNet.Administration.UI.updateActionEditor.fileCopyActionEditor' updateSystemDotNet.Administration.UI.updateActionEditor.renameFileActionEditor' updateSystemDotNet.Administration.Core.Updates.updateFactory' updateSystemDotNet.Core.updateActions.fileCopyAction' updateSystemDotNet.updateController' updateSystemDotNet.Internal.Designer.releaseFilter' updateSystemDotNet.Internal.UI.releaseFilterControl' updateSystemDotNet.Administration.Core.Updates.updatePackageViewFilter' updateSystemDotNet.Administration.UI.Dialogs.updatePackageDialog' updateSystemDotNet.Administration.UI.mainFormPages.updateSubPage' updateSystemDotNet.Internal.updateLogRequest' updateSystemDotNet.Internal.updateDownloader' updateSystemDotNet.Administration.Core.Publishing.publishBase' updateSystemDotNet.Administration.UI.Dialogs.upgradeProjectDialog' updateSystemDotNet.Administration.Core.appEventArgs.updatePackageBuiltEventArgs' updateSystemDotNet.Administration.Core.Publishing.FileSystem.pbsFileSystem' updateSystemDotNet.Administration.Core.Publishing.FTP.pbsFtp' updateSystemDotNet.Administration.Core.Updates.updateProject' updateSystemDotNet.appEventArgs.confirmUpdatePackageEventArgs' updateSystemDotNet.Core.Helper' updateSystemDotNet.Internal.Log' updateSystemDotNet.Administration.Core.appEventArgs.downloadConfigurationCompletedEventArgs' updateSystemDotNet.Core.Serializer' updateSystemDotNet.UpdateSettings' updateSystemDotNet.Internal.UI.updateDownloadDialog,updateSystemDotNet.Languages' updateSystemDotNet.releaseTypes' updateSystemDotNet.Core.Helper
updateController,updateSystemDotNet.Core.updateActions,updateSystemDotNet.Administration.Core.Updates.updateFactory' updateSystemDotNet.Administration.UI.Dialogs.updatePackageDialog' updateSystemDotNet.Administration.UI.updateActionEditor.addRegistryValueActionEditor' updateSystemDotNet.Administration.UI.updateActionEditor.closeProcessActionEditor' updateSystemDotNet.Administration.UI.updateActionEditor.deleteFilesActionEditor' updateSystemDotNet.Administration.UI.updateActionEditor.fileCopyActionEditor' updateSystemDotNet.Administration.UI.updateActionEditor.registryActionEditorBase' updateSystemDotNet.Administration.UI.updateActionEditor.removeRegistryValuesActionEditor' updateSystemDotNet.Administration.UI.updateActionEditor.renameFileActionEditor' updateSystemDotNet.Administration.UI.updateActionEditor.startProcessActionEditor' updateSystemDotNet.Administration.UI.updateActionEditor.startServiceActionEditor' updateSystemDotNet.Administration.UI.updateActionEditor.stopServiceActionEditor,updateSystemDotNet.Core.Types.FileType
updateController,updateSystemDotNet,updateSystemDotNet.Localization.localizationHelper' updateSystemDotNet.Core.Types.changelogDocumentItem' updateSystemDotNet.Internal.ScheduledStart' updateSystemDotNet.Internal.internalHelper' updateSystemDotNet.Internal.updateDownloader' Beispielanwendung_CSharp.mainForm' updateSystemDotNet.Core.Types.releaseFilterType' updateSystemDotNet.Core.Types.releaseInfo' updateSystemDotNet.Core.Types.updatePackage' updateSystemDotNet.Internal.UI.updateSearchDialog' updateSystemDotNet.Internal.UI.updatePreviewDialog' testApplication.testForm' updateSystemDotNet.Administration.Core.Application.applicationSession' updateSystemDotNet.Administration.UI.mainForm' updateSystemDotNet.Internal.Designer.releaseFilter' updateSystemDotNet.Internal.Designer.updateLocationEditor' updateSystemDotNet.Internal.Designer.versionEditor' updateSystemDotNet.Internal.Designer.ControllerActionList' updateSystemDotNet.Internal.searchProvider' updateSystemDotNet.Internal.updateLogRequest' updateSystemDotNet.Internal.UI.updateLocationControl' updateSystemDotNet.Internal.updateUI.updateViewDialog' updateSystemDotNet.Internal.updateUI.Views.viewUpdateCheck' Beispielanwendung_CSharp.customDownloadDialog' updateSystemDotNet.Internal.UI.updateDownloadDialog' testApplication.myDownloadForm' updateSystemDotNet.appEventArgs.updateFoundEventArgs,updateSystemDotNet.Internal.updateDownloader' updateSystemDotNet.Core.Types.releaseInfo' updateSystemDotNet.Internal.ScheduledStart' updateSystemDotNet.Internal.searchProvider' updateSystemDotNet.Internal.UI.updateSearchDialog' updateSystemDotNet.Internal.UI.updatePreviewDialog' updateSystemDotNet.Localization.localizationHelper' updateSystemDotNet.appEventArgs.downloadUpdatesProgressChangedEventArgs' updateSystemDotNet.Core.Types.updateConfiguration' updateSystemDotNet.Internal.Log' updateSystemDotNet.Core.Types.updatePackage' updateSystemDotNet.appEventArgs.confirmUpdatePackageEventArgs' updateSystemDotNet.Internal.updateUI.updateViewDialog' updateSystemDotNet.Internal.updateUI.updateViewStates' updateSystemDotNet.Core.Types.releaseFilterType' updateSystemDotNet.Core.Types.changelogDictionary
updateController,updateSystemDotNet.Internal.Designer,,updateSystemDotNet.updateController' updateSystemDotNet.Internal.UI.releaseFilterControl' updateSystemDotNet.Core.Types.releaseFilterType' updateSystemDotNet.Internal.UI.updateLocationControl' updateSystemDotNet.Internal.UI.versionEditorControl
updateController,updateSystemDotNet.Internal,updateSystemDotNet.Internal.UI.updateLocationControl' updateSystemDotNet.Internal.updateUI.Controls.statusLabel' updateSystemDotNet.updateController' updateSystemDotNet.Internal.UI.updateSearchDialog' updateSystemDotNet.updateDownloadBaseForm,updateSystemDotNet.updateController' updateSystemDotNet.authenticationModes' updateSystemDotNet.Core.Types.SecureContainer' updateSystemDotNet.Core.Serializer' updateSystemDotNet.Core.Types.updateConfiguration' updateSystemDotNet.Core.Types.updatePackage' updateSystemDotNet.Core.Types.SupportedArchitectures' updateSystemDotNet.Core.Helper' updateSystemDotNet.Core.Types.releaseFilterType' updateSystemDotNet.Core.Types.releaseInfo' updateSystemDotNet.Core.Types.VersionEx' updateSystemDotNet.Core.Types.changelogDictionary' updateSystemDotNet.Core.Types.updateLogLinkedAccount' updateSystemDotNet.Interval' updateSystemDotNet.UpdateResult' updateSystemDotNet.UpdateSettings
updateController,updateSystemDotNet.Internal.UI,updateSystemDotNet.Internal.Designer.releaseFilter' updateSystemDotNet.Internal.Designer.updateLocationEditor' updateSystemDotNet.Internal.Designer.versionEditor' updateSystemDotNet.updateController,updateSystemDotNet.Core.Types.releaseFilterType' updateSystemDotNet.updateController' updateSystemDotNet.Internal.updateUI.Controls.statusLabel' updateSystemDotNet.Internal.updateUI.Controls.statusLabelStates' updateSystemDotNet.Internal.internalHelper' updateSystemDotNet.Core.Types.changelogDictionary' updateSystemDotNet.Core.Types.updateConfiguration' updateSystemDotNet.Administration.UI.Controls.buttonArea' updateSystemDotNet.Localization.localizationHelper' updateSystemDotNet.Core.Types.releaseInfo' updateSystemDotNet.releaseTypes' updateSystemDotNet.Internal.searchProvider' updateSystemDotNet.Internal.ScheduledStart' updateSystemDotNet.UpdateSettings' updateSystemDotNet.Core.Types.updatePackage' updateSystemDotNet.Core.Helper' updateSystemDotNet.Core.Types.enhancedVersion' updateSystemDotNet.Core.Types.changelogDocument' updateSystemDotNet.Core.Types.SupportedArchitectures' updateSystemDotNet.updateDownloadBaseForm' updateSystemDotNet.appEventArgs.downloadUpdatesProgressChangedEventArgs' updateSystemDotNet.UpdateResult
updateController,updateSystemDotNet.Internal.updateUI.Controls,updateSystemDotNet.Internal.UI.updateLocationControl' updateSystemDotNet.Internal.UI.updateSearchDialog' updateSystemDotNet.Internal.UI.updateDownloadDialog' updateSystemDotNet.Internal.updateUI.Views.viewUpdateCheck' updateSystemDotNet.Internal.updateUI.Views.viewUpdateDownloadAndApply,updateSystemDotNet.Internal.resourceHelper
updateController,updateSystemDotNet.Internal.updateUI,updateSystemDotNet.Internal.updateUI.Views.viewUpdateCheck' updateSystemDotNet.updateController,updateSystemDotNet.appEventArgs.closeDialogEventArgs' updateSystemDotNet.updateController' updateSystemDotNet.appEventArgs.changeUpdateViewEventArgs
updateController,updateSystemDotNet.Internal.updateUI.Views,,updateSystemDotNet.Internal.updateUI.Controls.statusLabel' updateSystemDotNet.Internal.updateUI.Controls.statusLabelStates' updateSystemDotNet.Internal.updateUI.updateBaseView' updateSystemDotNet.updateController' updateSystemDotNet.appEventArgs.checkForUpdatesCompletedEventArgs' updateSystemDotNet.Internal.updateUI.updateViewStates
updateController,updateSystemDotNet.Properties,,
