Namespace,Type,NOF,NOM,NOP,NOPF,NOPM,LOC,WMC,NC,DIT,LCOM,Fan-Out,Fan-In,Fan-Out types,Fan-In types
Distribox.CommonLib,CommonHelper,1,15,0,0,15,201,21,0,0,0.6,1,17,Distribox.CommonLib.Config,Distribox.CLI.Program' Distribox.CommonLib.Config' Distribox.CommonLib.ConfigData' Distribox.FileSystem.FileWatcher' Distribox.FileSystem.VersionList' Distribox.FileSystem.FileEvent' Distribox.FileSystem.FileItem' Distribox.GUI.Form1' Distribox.Network.AntiEntropyProtocol' Distribox.Network.BandwidthEstimator' Distribox.Network.ProtocolMessageFactory' Distribox.Network.PeerList' Distribox.Network.RequestManager' Distribox.Test.AtomicMessageTest' Distribox.Test.FileItemTest' Distribox.Test.CommonLibTest' Distribox.Test.SingleNodeTest
Distribox.CommonLib,Config,1,1,12,0,0,170,3,0,0,0,4,12,Distribox.CommonLib.ConfigData' Distribox.CommonLib.Properties' Distribox.CommonLib.CommonHelper' Distribox.CommonLib.Logger,Distribox.CLI.Program' Distribox.CommonLib.CommonHelper' Distribox.FileSystem.FileWatcher' Distribox.FileSystem.VersionList' Distribox.FileSystem.VersionControl' Distribox.FileSystem.FileItem' Distribox.GUI.Form1' Distribox.Network.AntiEntropyProtocol' Distribox.Network.BandwidthEstimator' Distribox.Test.BandwidthEstimatorTest' Distribox.Test.CommonLibTest' Distribox.Test.SingleNodeTest
Distribox.CommonLib,ConfigData,0,1,6,0,1,45,1,0,0,-1,2,2,Distribox.CommonLib.Properties' Distribox.CommonLib.CommonHelper,Distribox.CommonLib.Config' Distribox.Test.CommonLibTest
Distribox.CommonLib,GlobalFlag,0,1,1,0,0,15,1,0,0,-1,0,3,,Distribox.FileSystem.FileWatcher' Distribox.FileSystem.FileItem' Distribox.Test.GlobalFlagTest
Distribox.CommonLib,Logger,1,6,0,0,5,70,7,0,0,0,0,7,,Distribox.CommonLib.Config' Distribox.Network.AntiEntropyProtocol' Distribox.Network.AtomicMessageSender' Distribox.Network.BandwidthEstimator' Distribox.Network.PeerList' Distribox.Network.RequestManager' Distribox.Test.CommonLibTest
Distribox.CommonLib,AbsolutePath,2,4,0,0,4,72,7,0,0,0,1,4,Distribox.CommonLib.Properties,Distribox.FileSystem.FileWatcher' Distribox.FileSystem.VersionControl' Distribox.FileSystem.FileItem' Distribox.GUI.Form1
Distribox.CommonLib,Properties,0,0,22,0,0,237,0,0,0,-1,0,9,,Distribox.CommonLib.Config' Distribox.CommonLib.ConfigData' Distribox.CommonLib.AbsolutePath' Distribox.FileSystem.FileWatcher' Distribox.Network.BandwidthEstimator' Distribox.Network.Peer' Distribox.Network.RequestManager' Distribox.Test.BandwidthEstimatorTest' Distribox.Test.CommonLibTest
