Project,Namespace,Ca types,Ce types
Remote,ThoughtWorks.CruiseControl.Remote,ThoughtWorks.CruiseControl.Remote.Monitor.Server' ThoughtWorks.CruiseControl.Remote.Monitor.BuildQueue' ThoughtWorks.CruiseControl.Remote.Monitor.BuildQueueRequest' ThoughtWorks.CruiseControl.Remote.Monitor.ManualServerWatcher' ThoughtWorks.CruiseControl.Remote.Monitor.PollingServerWatcher' ThoughtWorks.CruiseControl.Remote.Monitor.Project' ThoughtWorks.CruiseControl.Remote.Monitor.ProjectBuild' ThoughtWorks.CruiseControl.Remote.Messages.StatusSnapshotResponse' ThoughtWorks.CruiseControl.Remote.Messages.BuildIntegrationRequest' ThoughtWorks.CruiseControl.Remote.Messages.SnapshotResponse' ThoughtWorks.CruiseControl.Remote.Monitor.ServerUpdateArgs' CCNet.CSharpDemos.Plugin.Extensions.DoSomething' ThoughtWorks.CruiseControl.Core.Config.ServerConfigurationHandler' ThoughtWorks.CruiseControl.Core.CruiseServer' ThoughtWorks.CruiseControl.Core.Extensions.DiskSpaceMonitorExtension' ThoughtWorks.CruiseControl.Core.Extensions.IntegrationRequestThrottleExtension' ThoughtWorks.CruiseControl.Core.Extensions.IntegrationPerformanceCountersExtension' ThoughtWorks.CruiseControl.Core.Extensions.WcfServerExtension' ThoughtWorks.CruiseControl.Core.CruiseServerClient' ThoughtWorks.CruiseControl.Core.Extensions.CruiseControlImplementation' ThoughtWorks.CruiseControl.Core.ConsoleRunner' ThoughtWorks.CruiseControl.Core.CruiseManager' ThoughtWorks.CruiseControl.Core.CruiseServerFactory' ThoughtWorks.CruiseControl.Core.RemoteCruiseServer' ThoughtWorks.CruiseControl.Service.AppRunner' ThoughtWorks.CruiseControl.Remote.Messages.FileTransferResponse' ThoughtWorks.CruiseControl.Remote.Events.IntegrationCompletedEventArgs' ThoughtWorks.CruiseControl.Remote.Events.IntegrationStartedEventArgs' ThoughtWorks.CruiseControl.Core.Label.RemoteProjectLabeller' CCNet.CSharpDemos.Plugin.Triggers.FileChangedTrigger' ThoughtWorks.CruiseControl.Core.Project' ThoughtWorks.CruiseControl.Core.ProjectBase' ThoughtWorks.CruiseControl.Core.ProjectIntegrator' ThoughtWorks.CruiseControl.Core.Triggers.RollUpTrigger' ThoughtWorks.CruiseControl.Core.Triggers.FilterTrigger' ThoughtWorks.CruiseControl.Core.Triggers.MultipleTrigger' ThoughtWorks.CruiseControl.Core.Triggers.ParameterTrigger' ThoughtWorks.CruiseControl.Core.Triggers.ProjectTrigger' ThoughtWorks.CruiseControl.Remote.Messages.MessageRequest' ThoughtWorks.CruiseControl.Remote.Messages.LoginRequest' ThoughtWorks.CruiseControl.Remote.Parameters.BooleanParameter' ThoughtWorks.CruiseControl.Remote.Parameters.SelectParameter,ThoughtWorks.CruiseControl.Remote.Messages.CommunicationsMessage' ThoughtWorks.CruiseControl.Remote.Messages.EncryptedRequest' ThoughtWorks.CruiseControl.Remote.Messages.Response' ThoughtWorks.CruiseControl.Remote.Messages.EncryptedResponse' ThoughtWorks.CruiseControl.Remote.Messages.ServerRequest' ThoughtWorks.CruiseControl.Remote.Messages.ResponseResult' ThoughtWorks.CruiseControl.Remote.Messages.LoginRequest' ThoughtWorks.CruiseControl.Remote.Messages.DataResponse' ThoughtWorks.CruiseControl.Remote.Messages.ProjectStatusResponse' ThoughtWorks.CruiseControl.Remote.Messages.BuildIntegrationRequest' ThoughtWorks.CruiseControl.Remote.Messages.MessageRequest' ThoughtWorks.CruiseControl.Remote.Messages.SnapshotResponse' ThoughtWorks.CruiseControl.Remote.Messages.DataListResponse' ThoughtWorks.CruiseControl.Remote.Messages.BuildListRequest' ThoughtWorks.CruiseControl.Remote.Messages.BuildRequest' ThoughtWorks.CruiseControl.Remote.Messages.StatusSnapshotResponse' ThoughtWorks.CruiseControl.Remote.Messages.ChangeConfigurationRequest' ThoughtWorks.CruiseControl.Remote.Messages.ExternalLinksListResponse' ThoughtWorks.CruiseControl.Remote.Messages.LoginResponse' ThoughtWorks.CruiseControl.Remote.Messages.ListUsersResponse' ThoughtWorks.CruiseControl.Remote.Messages.DiagnoseSecurityRequest' ThoughtWorks.CruiseControl.Remote.Messages.DiagnoseSecurityResponse' ThoughtWorks.CruiseControl.Remote.Messages.ReadAuditRequest' ThoughtWorks.CruiseControl.Remote.Messages.ReadAuditResponse' ThoughtWorks.CruiseControl.Remote.Security.AuditFilterBase' ThoughtWorks.CruiseControl.Remote.Messages.BuildParametersResponse' ThoughtWorks.CruiseControl.Remote.Messages.ChangePasswordRequest' ThoughtWorks.CruiseControl.Remote.Messages.ProjectRequest' ThoughtWorks.CruiseControl.Remote.Messages.ListPackagesResponse' ThoughtWorks.CruiseControl.Remote.Messages.FileTransferRequest' ThoughtWorks.CruiseControl.Remote.Messages.FileTransferResponse' ThoughtWorks.CruiseControl.Remote.Messages.ProjectItemRequest' ThoughtWorks.CruiseControl.Remote.Messages.ListRequest' ThoughtWorks.CruiseControl.Remote.Messages.ListBuildSummaryResponse' ThoughtWorks.CruiseControl.Remote.Messages.ErrorMessage' ThoughtWorks.CruiseControl.Remote.Parameters.SelectParameter' ThoughtWorks.CruiseControl.Core.CruiseControlException' ThoughtWorks.CruiseControl.Remote.Parameters.ParameterBase
Remote,ThoughtWorks.CruiseControl.Remote.Messages,ThoughtWorks.CruiseControl.Remote.CommunicationsEventArgs' ThoughtWorks.CruiseControl.Remote.EncryptingConnection' ThoughtWorks.CruiseControl.Remote.CruiseServerClient' ThoughtWorks.CruiseControl.Remote.ICruiseServerClient' ThoughtWorks.CruiseControl.Remote.ICruiseServer' ThoughtWorks.CruiseControl.Remote.Monitor.Server' ThoughtWorks.CruiseControl.Remote.CruiseServerClientBase' ThoughtWorks.CruiseControl.Remote.HttpConnection' ThoughtWorks.CruiseControl.Remote.MessageReceivedEventArgs' ThoughtWorks.CruiseControl.Remote.RemotingConnection' ThoughtWorks.CruiseControl.Remote.ServerConnectionBase' ThoughtWorks.CruiseControl.Remote.XmlConversionUtil' ThoughtWorks.CruiseControl.Remote.IMessageProcessor' ThoughtWorks.CruiseControl.Remote.IServerConnection,ThoughtWorks.CruiseControl.Remote.BuildCondition' ThoughtWorks.CruiseControl.Remote.NameValuePair' ThoughtWorks.CruiseControl.Remote.IFileTransfer' ThoughtWorks.CruiseControl.Remote.CruiseServerSnapshot' ThoughtWorks.CruiseControl.Remote.MessageKind' ThoughtWorks.CruiseControl.Remote.Security.AuditFilterBase' ThoughtWorks.CruiseControl.Remote.ProjectStatusSnapshot
Remote,ThoughtWorks.CruiseControl.Remote.Monitor,,ThoughtWorks.CruiseControl.Remote.CruiseServerClientBase' ThoughtWorks.CruiseControl.Remote.QueueSnapshot' ThoughtWorks.CruiseControl.Remote.QueuedRequestSnapshot' ThoughtWorks.CruiseControl.Remote.CruiseServerSnapshot' ThoughtWorks.CruiseControl.Remote.ProjectStatus' ThoughtWorks.CruiseControl.Remote.ProjectStatusSnapshot' ThoughtWorks.CruiseControl.Remote.Message' ThoughtWorks.CruiseControl.Remote.CruiseServerClientFactory' ThoughtWorks.CruiseControl.Remote.ClientStartUpSettings' ThoughtWorks.CruiseControl.Remote.Messages.LoginRequest' ThoughtWorks.CruiseControl.Remote.QueueSetSnapshot
Remote,ThoughtWorks.CruiseControl.Remote.Mono,ThoughtWorks.CruiseControl.CCCmd.Program' ThoughtWorks.CruiseControl.CCTray.Bootstrap' ThoughtWorks.CruiseControl.Console.AppRunner' Validator.Program,
Remote,ThoughtWorks.CruiseControl.Remote.Events,ThoughtWorks.CruiseControl.Core.CruiseServer' ThoughtWorks.CruiseControl.Core.CruiseServerEventsBase' ThoughtWorks.CruiseControl.Core.ProjectIntegrator' ThoughtWorks.CruiseControl.Core.RemoteCruiseServer' ThoughtWorks.CruiseControl.Core.Extensions.IntegrationRequestThrottleExtension' ThoughtWorks.CruiseControl.Core.Extensions.IntegrationPerformanceCountersExtension' CCNet.CSharpDemos.Plugin.Extensions.DoSomething' ThoughtWorks.CruiseControl.Core.Extensions.DiskSpaceMonitorExtension,ThoughtWorks.CruiseControl.Remote.IntegrationRequest' ThoughtWorks.CruiseControl.Remote.IntegrationStatus
Remote,ThoughtWorks.CruiseControl.Remote.Parameters,ThoughtWorks.CruiseControl.Remote.ProjectStatus' ThoughtWorks.CruiseControl.Remote.NameValuePairSerialiser,ThoughtWorks.CruiseControl.Remote.NameValuePair
Remote,ThoughtWorks.CruiseControl.Remote.Security,ThoughtWorks.CruiseControl.Remote.CruiseServerClient' ThoughtWorks.CruiseControl.Remote.CruiseServerClientBase' ThoughtWorks.CruiseControl.Remote.Messages.ReadAuditRequest,
Remote,ThoughtWorks.CruiseControl.Core,ThoughtWorks.CruiseControl.Core.Sourcecontrol.Vault3' ThoughtWorks.CruiseControl.Core.Tasks.BuilderException' ThoughtWorks.CruiseControl.Core.Util.Log' ThoughtWorks.CruiseControl.Remote.NoSuchProjectException,
