Namespace,Type,NOF,NOM,NOP,NOPF,NOPM,LOC,WMC,NC,DIT,LCOM,Fan-Out,Fan-In,Fan-Out types,Fan-In types
BasicFirewall,AddEditRule,16,10,1,0,3,685,18,0,1,0.3,17,1,BasicFirewall.Rule' fireBwall.Configuration.MultilingualStringManager' fireBwall.Configuration.Language' BasicFirewall.AllRule' BasicFirewall.Direction' BasicFirewall.PacketStatus' BasicFirewall.IPRule' BasicFirewall.TCPAllRule' BasicFirewall.TCPIPPortRule' BasicFirewall.TCPPortRule' BasicFirewall.UDPAllRule' BasicFirewall.UDPPortRule' BasicFirewall.RuleType' BasicFirewall.RuleFactory' BasicFirewall.BasicFirewallModule' fireBwall.Logging.LogCenter' fireBwall.UI.DynamicForm,BasicFirewall.BasicFirewallControl
BasicFirewall,BasicFirewallControl,10,10,0,0,2,370,23,0,1,0.2,7,1,BasicFirewall.BasicFirewallModule' fireBwall.Configuration.Language' fireBwall.Configuration.MultilingualStringManager' BasicFirewall.Rule' BasicFirewall.AddEditRule' fireBwall.Logging.LogCenter' fireBwall.UI.DynamicUserControl,BasicFirewall.BasicFirewallModule
BasicFirewall,BasicFirewallModule,2,10,0,1,6,283,18,0,1,0.7,18,2,fireBwall.Modules.Meta' BasicFirewall.UDPPortRule' BasicFirewall.PortRange' BasicFirewall.PacketStatus' BasicFirewall.Direction' BasicFirewall.TCPPortRule' BasicFirewall.IPRule' fireBwall.Utils.IPAddr' BasicFirewall.BasicFirewallControl' BasicFirewall.RuleSet' fireBwall.Modules.PacketMainReturnType' fireBwall.Logging.LogEvent' BasicFirewall.Rule' fireBwall.Logging.LogCenter' fireBwall.Packets.Packet' fireBwall.Packets.TCPPacket' fireBwall.Utils.Quad' fireBwall.Packets.Protocol,BasicFirewall.AddEditRule' BasicFirewall.BasicFirewallControl
BasicFirewall,RuleFactory,0,1,0,0,1,24,2,0,0,-1,11,1,BasicFirewall.RuleType' fireBwall.Utils.IPAddr' BasicFirewall.IPRule' BasicFirewall.TCPAllRule' BasicFirewall.TCPIPPortRule' BasicFirewall.TCPPortRule' BasicFirewall.UDPAllRule' BasicFirewall.UDPPortRule' BasicFirewall.AllRule' BasicFirewall.PacketStatus' BasicFirewall.Direction,BasicFirewall.AddEditRule
BasicFirewall,RuleSet,1,4,0,1,4,75,8,0,0,0.75,8,1,BasicFirewall.TCPAllRule' BasicFirewall.TCPPortRule' BasicFirewall.TCPIPPortRule' BasicFirewall.UDPPortRule' BasicFirewall.AllRule' BasicFirewall.IPRule' BasicFirewall.UDPAllRule' BasicFirewall.Rule,BasicFirewall.BasicFirewallModule
BasicFirewall,PacketStatus,0,0,0,0,0,7,0,0,0,-1,0,11,,BasicFirewall.AddEditRule' BasicFirewall.BasicFirewallModule' BasicFirewall.RuleFactory' BasicFirewall.Rule' BasicFirewall.TCPAllRule' BasicFirewall.TCPPortRule' BasicFirewall.TCPIPPortRule' BasicFirewall.UDPPortRule' BasicFirewall.UDPAllRule' BasicFirewall.AllRule' BasicFirewall.IPRule
BasicFirewall,Direction,0,0,0,0,0,7,0,0,0,-1,0,11,,BasicFirewall.AddEditRule' BasicFirewall.BasicFirewallModule' BasicFirewall.RuleFactory' BasicFirewall.Rule' BasicFirewall.TCPAllRule' BasicFirewall.TCPPortRule' BasicFirewall.TCPIPPortRule' BasicFirewall.UDPPortRule' BasicFirewall.UDPAllRule' BasicFirewall.AllRule' BasicFirewall.IPRule
BasicFirewall,Rule,2,6,0,2,6,37,6,7,0,1,3,4,BasicFirewall.PacketStatus' BasicFirewall.Direction' fireBwall.Packets.Packet,BasicFirewall.AddEditRule' BasicFirewall.BasicFirewallControl' BasicFirewall.BasicFirewallModule' BasicFirewall.RuleSet
BasicFirewall,RuleType,0,0,0,0,0,11,0,0,0,-1,0,2,,BasicFirewall.AddEditRule' BasicFirewall.RuleFactory
BasicFirewall,PortRange,2,2,0,2,2,17,3,0,0,0,0,3,,BasicFirewall.BasicFirewallModule' BasicFirewall.TCPPortRule' BasicFirewall.UDPPortRule
BasicFirewall,TCPAllRule,3,8,0,2,8,129,18,0,1,0.25,6,3,BasicFirewall.PacketStatus' BasicFirewall.Direction' fireBwall.Packets.TCPPacket' fireBwall.Packets.Packet' fireBwall.Packets.Protocol' fireBwall.Utils.IPAddr,BasicFirewall.AddEditRule' BasicFirewall.RuleFactory' BasicFirewall.RuleSet
BasicFirewall,TCPPortRule,4,10,1,3,9,226,30,0,1,0,7,4,BasicFirewall.PortRange' BasicFirewall.Direction' BasicFirewall.PacketStatus' fireBwall.Packets.TCPPacket' fireBwall.Packets.Packet' fireBwall.Packets.Protocol' fireBwall.Utils.IPAddr,BasicFirewall.AddEditRule' BasicFirewall.BasicFirewallModule' BasicFirewall.RuleFactory' BasicFirewall.RuleSet
BasicFirewall,TCPIPPortRule,5,8,0,4,8,155,19,0,1,0.25,7,3,fireBwall.Utils.IPAddr' BasicFirewall.Direction' BasicFirewall.PacketStatus' fireBwall.Packets.TCPPacket' fireBwall.Packets.Packet' fireBwall.Packets.Protocol' fireBwall.Utils.Utility,BasicFirewall.AddEditRule' BasicFirewall.RuleFactory' BasicFirewall.RuleSet
BasicFirewall,UDPPortRule,4,10,1,3,9,229,29,0,1,0,7,4,BasicFirewall.PortRange' BasicFirewall.Direction' BasicFirewall.PacketStatus' fireBwall.Packets.UDPPacket' fireBwall.Packets.Packet' fireBwall.Packets.Protocol' fireBwall.Utils.IPAddr,BasicFirewall.AddEditRule' BasicFirewall.BasicFirewallModule' BasicFirewall.RuleFactory' BasicFirewall.RuleSet
BasicFirewall,UDPAllRule,3,8,0,2,8,124,17,0,1,0.25,6,3,BasicFirewall.Direction' BasicFirewall.PacketStatus' fireBwall.Packets.UDPPacket' fireBwall.Packets.Packet' fireBwall.Packets.Protocol' fireBwall.Utils.IPAddr,BasicFirewall.AddEditRule' BasicFirewall.RuleFactory' BasicFirewall.RuleSet
BasicFirewall,AllRule,3,8,0,2,8,116,16,0,1,0.25,3,3,BasicFirewall.Direction' BasicFirewall.PacketStatus' fireBwall.Packets.Packet,BasicFirewall.AddEditRule' BasicFirewall.RuleFactory' BasicFirewall.RuleSet
BasicFirewall,IPRule,3,10,1,2,9,169,22,0,1,0.2,6,4,BasicFirewall.Direction' BasicFirewall.PacketStatus' fireBwall.Utils.IPAddr' fireBwall.Packets.IPPacket' fireBwall.Packets.Packet' fireBwall.Packets.Protocol,BasicFirewall.AddEditRule' BasicFirewall.BasicFirewallModule' BasicFirewall.RuleFactory' BasicFirewall.RuleSet
