Project,Namespace,Ca types,Ce types
C-Compiler,ABT,AST.Add' AST.Sub' AST.BinaryIntegralOp' AST.BinaryArithmeticOp' AST.BinaryLogicalOp' AST.IntLiteral' AST.EnumSpec' AST.Enumr' AST.ArrayModifier' AST.Variable' AST.CaseStmt' AST.Negative' AST.BitwiseNot' AST.LogicalNot' AST.SizeofType' AST.SizeofExpr' AST.FloatLiteral' AST.StringLiteral' AST.Decln' AST.DeclnSpecs' AST.FuncDef' AST.InitDeclr' Driver.Compiler' AST.Assignment' AST.AssignOp' AST.StructDecln' AST.ParamDecln' AST.TypeName' AST.TypeSpec' AST.BasicTypeSpec' AST.TypedefName' AST.SpecQualList' AST.StructOrUnionSpec' AST.TypeModifier' AST.FunctionModifier' AST.ParamTypeList' AST.PointerModifier' AST.AbstractDeclr' AST.Initr' AST.InitExpr' AST.InitList' AST.Expr' AST.AssignmentList' AST.ConditionalExpression' AST.FuncCall' AST.Attribute' AST.TranslnUnit' AST.IExternDecln' AST.SemantReturn<T>' AST.SemantReturn' AST.SemanticAnalysis' AST.Stmt' AST.GotoStmt' AST.ContStmt' AST.BreakStmt' AST.ReturnStmt' AST.CompoundStmt' AST.ExprStmt' AST.WhileStmt' AST.DoWhileStmt' AST.ForStmt' AST.SwitchStmt' AST.IfStmt' AST.IfElseStmt' AST.LabeledStmt' AST.DefaultStmt' AST.PostIncrement' AST.PostDecrement' AST.PreIncrement' AST.PreDecrement' AST.Reference' AST.Dereference' AST.Positive' AST.TypeCast' AST.Multiply' AST.Divide' AST.Modulo' AST.LShift' AST.RShift' AST.Less' AST.LEqual' AST.Greater' AST.GEqual' AST.Equal' AST.NotEqual' AST.BitwiseAnd' AST.Xor' AST.BitwiseOr' AST.LogicalAnd' AST.LogicalOr' CompilerTests.CompilerTests' CodeGeneration.CGenState' CompilerTests.TypePrinterTests,CodeGeneration.CGenState' CodeGeneration.Reg' AST.StructOrUnion
C-Compiler,CompilerTests,,LexicalAnalysis.Scanner' Parsing.ParserEnvironment' Parsing.ParserInput' Parsing.IParserResult' AST.ISemantReturn' Parsing.CParsers' AST.TranslnUnit' ABT.TranslnUnit' Parsing.IParser' AST.StorageClsSpec' ABT.VoidType' ABT.CharType' ABT.UCharType' ABT.LongType' ABT.ULongType' ABT.ShortType' ABT.UShortType' ABT.FloatType' ABT.DoubleType' ABT.PointerType' ABT.IncompleteArrayType' ABT.ArrayType' ABT.StructOrUnionType' ABT.FunctionType
C-Compiler,Driver,,AST.TranslnUnit' ABT.TranslnUnit' ABT.Env' LexicalAnalysis.Scanner' Parsing.CParsers' Parsing.IParserResult' AST.ISemantReturn' CodeGeneration.CGenState
C-Compiler,Parsing,CompilerTests.CompilerTests' CompilerTests.TestDeclarations' CompilerTests.TestExpressions' CompilerTests.TestExternalDefinitions' CompilerTests.TestStatements' Driver.Compiler' CompilerTests.ParserTestUtils,AST.Decln' AST.StorageClsSpec' AST.DeclnSpecs' AST.InitDeclr' AST.TypedefName' AST.Declr' AST.PointerModifier' AST.ParamTypeList' AST.ArrayModifier' AST.FunctionModifier' AST.EnumSpec' AST.Enumr' AST.StructOrUnionSpec' AST.StructDecln' AST.SpecQualList' AST.StructDeclr' AST.ParamDeclr' AST.ParamDecln' AST.AbstractDeclr' AST.InitExpr' AST.InitList' AST.TypeName' AST.AssignmentList' AST.Variable' AST.ConditionalExpression' AST.Assignment' AST.MultAssign' AST.DivAssign' AST.ModAssign' AST.AddAssign' AST.SubAssign' AST.LShiftAssign' AST.RShiftAssign' AST.BitwiseAndAssign' AST.XorAssign' AST.BitwiseOrAssign' AST.Dereference' AST.Add' AST.FuncCall' AST.Attribute' AST.PostIncrement' AST.PostDecrement' AST.PreIncrement' AST.PreDecrement' AST.Reference' AST.Positive' AST.Negative' AST.BitwiseNot' AST.LogicalNot' AST.SizeofExpr' AST.SizeofType' AST.TypeCast' AST.Multiply' AST.Divide' AST.Modulo' AST.Sub' AST.LShift' AST.RShift' AST.Less' AST.Greater' AST.LEqual' AST.GEqual' AST.Equal' AST.NotEqual' AST.BitwiseAnd' AST.Xor' AST.BitwiseOr' AST.LogicalAnd' AST.LogicalOr' AST.Expr' AST.TranslnUnit' AST.FuncDef' AST.GotoStmt' AST.ReturnStmt' AST.CompoundStmt' AST.ExprStmt' AST.WhileStmt' AST.DoWhileStmt' AST.ForStmt' AST.IfElseStmt' AST.IfStmt' AST.SwitchStmt' AST.LabeledStmt' AST.CaseStmt' AST.DefaultStmt' LexicalAnalysis.TokenCharConst' LexicalAnalysis.IntSuffix' LexicalAnalysis.TokenInt' LexicalAnalysis.TokenFloat' LexicalAnalysis.TokenString' LexicalAnalysis.OperatorVal' LexicalAnalysis.TokenIdentifier' LexicalAnalysis.KeywordVal
C-Compiler,LexicalAnalysis,Parsing.ConstCharParser' Parsing.ConstFloatParser' AST.FloatLiteral' Parsing.IdentifierParser' Parsing.ConstIntParser' AST.IntLiteral' Parsing.KeywordConsumer' Parsing.KeywordParser<R>' Parsing.KeywordParser' Parsing.OperatorConsumer' CompilerTests.CompilerTests' CompilerTests.ParserTestUtils' CompilerTests.TestExternalDefinitions' Driver.Compiler' Parsing.StringLiteralParser,
C-Compiler,AST,Parsing.CParsers' CompilerTests.TestDeclarations' Parsing.ParserEnvironment' Parsing.Scope' ABT.StructOrUnionType' CompilerTests.CompilerTests' Driver.Compiler,ABT.Expr' ABT.TypeCast' ABT.Assign' ABT.Env' ABT.ExprType' ABT.ExprTypeKind' ABT.ConstULong' ABT.ConstLong' ABT.ConstDouble' ABT.ConstFloat' ABT.Multiply' ABT.LongType' ABT.Add' ABT.ConstPtr' ABT.PointerType' ABT.ArrayType' ABT.Divide' LexicalAnalysis.FloatSuffix' LexicalAnalysis.TokenFloat' LexicalAnalysis.IntSuffix' LexicalAnalysis.TokenInt' ABT.ConstStringLiteral' ABT.StorageClass' ABT.EntryKind' ABT.Entry' ABT.StructOrUnionType' ABT.FunctionType' ABT.Initr' ABT.IncompleteArrayType' ABT.Variable' ABT.AssignList' ABT.ConditionalExpr' ABT.FuncCall' ABT.StoreEntry' ABT.Attribute' ABT.Stmt' ABT.PostIncrement' ABT.PostDecrement' ABT.PreIncrement' ABT.PreDecrement' ABT.Reference' ABT.Dereference' ABT.Negative' ABT.BitwiseNot' ABT.LogicalNot
C-Compiler,CodeGeneration,ABT.BinaryOpSupportingIntegralOperands' ABT.BinaryOpSupportingOnlyIntegralOperands' ABT.BinaryOpSupportingArithmeticOperands' ABT.BinaryArithmeticOp' ABT.BinaryComparisonOp' ABT.Modulo' ABT.Xor' ABT.BitwiseOr' ABT.BitwiseAnd' ABT.LShift' ABT.RShift' ABT.Add' ABT.Sub' ABT.Multiply' ABT.Divide' ABT.GEqual' ABT.Greater' ABT.LEqual' ABT.Less' ABT.Equal' ABT.NotEqual' ABT.LogicalAnd' ABT.LogicalOr' ABT.ConstLong' ABT.ConstULong' ABT.ConstShort' ABT.ConstUShort' ABT.ConstChar' ABT.ConstUChar' ABT.ConstPtr' ABT.ConstFloat' ABT.ConstDouble' ABT.ConstStringLiteral' ABT.Decln' ABT.Variable' ABT.AssignList' ABT.Assign' ABT.ConditionalExpr' ABT.FuncCall' ABT.Attribute' ABT.Reference' ABT.Dereference' ABT.Stmt' ABT.ReturnStmt' ABT.WhileStmt' ABT.DoWhileStmt' ABT.ForStmt' ABT.SwitchStmt' ABT.IfStmt' ABT.IfElseStmt' ABT.TypeCast' ABT.IncDecExpr' ABT.PostIncrement' ABT.PostDecrement' ABT.PreIncrement' ABT.PreDecrement' ABT.Negative' ABT.BitwiseNot' ABT.LogicalNot' ABT.BinaryOp' ABT.ConstExpr' ABT.Expr' ABT.TranslnUnit' ABT.ExternDecln' ABT.FuncDef' ABT.GotoStmt' ABT.LabeledStmt' ABT.ContStmt' ABT.BreakStmt' ABT.ExprStmt' ABT.CompoundStmt' ABT.CaseStmt' ABT.DefaultStmt' ABT.UnaryArithOp' Driver.Compiler,ABT.Utils
