Project,Namespace,Ca types,Ce types
NLog.monodevelop,NLog.ComInterop,,
NLog.monodevelop,NLog.Common,NLog.Targets.Wrappers.AutoFlushTargetWrapper' NLog.Targets.Wrappers.CompoundTargetBase' NLog.Targets.Wrappers.RepeatingTargetWrapper' NLog.Config.LoggingConfiguration' NLog.LogFactory' NLog.Targets.Target' NLog.Targets.Wrappers.SplitGroupTarget' NLog.Internal.SortHelpers' NLog.Targets.MessageBoxTarget' NLog.Targets.MethodCallTargetBase' NLog.LogEventInfo' NLog.Targets.NetworkTarget' NLog.Targets.LogReceiverWebServiceTarget' NLog.Targets.MailTarget' NLog.Targets.DatabaseTarget' NLog.Targets.Wrappers.AsyncRequestQueue' NLog.Targets.Wrappers.AsyncTargetWrapper' NLog.Targets.FileTarget' NLog.Targets.Wrappers.FallbackGroupTarget' NLog.Targets.Wrappers.FilteringTargetWrapper' NLog.Targets.Wrappers.RandomizeGroupTarget' NLog.Targets.Wrappers.RoundRobinGroupTarget' NLog.Targets.Wrappers.ImpersonatingTargetWrapper' NLog.Targets.Wrappers.RetryingTargetWrapper' NLog.Targets.Wrappers.BufferingTargetWrapper' NLog.Targets.Wrappers.PostFilteringTargetWrapper' NLog.Config.ConfigSectionHandler' NLog.Internal.FileAppenders.MutexMultiProcessFileAppender' NLog.Internal.FileAppenders.SingleProcessFileAppender' NLog.Config.MethodFactory<TClassAttributeType;TMethodAttributeType>' NLog.Internal.FileAppenders.BaseFileAppender' NLog.Internal.FileAppenders.UnixMultiProcessFileAppender' NLog.ComInterop.ComLogManager' NLog.Internal.ReflectionHelpers' NLog.Internal.SingleCallContinuation' NLog.Internal.PropertyHelper' NLog.Internal.TimeoutContinuation' NLog.Internal.ObjectGraphScanner' NLog.LayoutRenderers.FileContentsLayoutRenderer' NLog.LayoutRenderers.MachineNameLayoutRenderer' NLog.LayoutRenderers.LayoutRenderer' NLog.LayoutRenderers.ExceptionLayoutRenderer' NLog.Internal.MultiFileWatcher' NLog.Layouts.SimpleLayout' NLog.LogManager' NLog.Layouts.LayoutParser' NLog.Targets.EventLogTarget' NLog.Conditions.ConditionMethodExpression' NLog.Targets.PerformanceCounterTarget' NLog.LoggerImpl' NLog.Config.Factory<TBaseType;TAttributeType>' NLog.Config.XmlLoggingConfiguration,
NLog.monodevelop,NLog.Conditions,NLog.Filters.ConditionBasedFilter' NLog.Targets.ConsoleRowHighlightingRule' NLog.Internal.PropertyHelper' NLog.Targets.Wrappers.FilteringTargetWrapper' NLog.Targets.Wrappers.FilteringRule' NLog.Targets.Wrappers.PostFilteringTargetWrapper' NLog.Layouts.LayoutParser' NLog.LayoutRenderers.Wrappers.WhenLayoutRendererWrapper' NLog.Config.ConfigurationItemFactory,
NLog.monodevelop,NLog.Config,NLog.Targets.FileTarget' NLog.LayoutRenderers.TempDirLayoutRenderer' NLog.LayoutRenderers.MachineNameLayoutRenderer' NLog.LayoutRenderers.LiteralLayoutRenderer' NLog.LayoutRenderers.BaseDirLayoutRenderer' NLog.LayoutRenderers.NLogDirLayoutRenderer' NLog.LayoutRenderers.SpecialFolderLayoutRenderer' NLog.LayoutRenderers.ProcessNameLayoutRenderer' NLog.Layouts.LayoutParser' NLog.LayoutRenderers.Wrappers.Rot13LayoutRendererWrapper' NLog.LayoutRenderers.ProcessIdLayoutRenderer' NLog.Layouts.CsvLayout' NLog.Layouts.SimpleLayout' NLog.Targets.DatabaseCommandInfo' NLog.Targets.MethodCallTargetBase' NLog.Targets.Wrappers.PostFilteringTargetWrapper' NLog.Targets.NLogViewerTarget' NLog.Targets.ColoredConsoleTarget' NLog.Targets.LogReceiverWebServiceTarget' NLog.Targets.DatabaseTarget' NLog.Internal.PropertyHelper' NLog.Layouts.Layout' NLog.Conditions.ConditionParser' NLog.LayoutRenderers.Wrappers.WrapperLayoutRendererBase' NLog.LayoutRenderers.EnvironmentLayoutRenderer' NLog.LayoutRenderers.DateLayoutRenderer' NLog.LayoutRenderers.EventContextLayoutRenderer' NLog.LayoutRenderers.AspRequestValueLayoutRenderer' NLog.LayoutRenderers.AspSessionValueLayoutRenderer' NLog.LayoutRenderers.AspApplicationValueLayoutRenderer' NLog.LayoutRenderers.ExceptionLayoutRenderer' NLog.LayoutRenderers.FileContentsLayoutRenderer' NLog.LayoutRenderers.GdcLayoutRenderer' NLog.LayoutRenderers.InstallContextLayoutRenderer' NLog.LayoutRenderers.MdcLayoutRenderer' NLog.Targets.PerformanceCounterTarget' NLog.Targets.EventLogTarget' NLog.Internal.ISupportsInitialize' NLog.LogManager' NLog.Targets.Target' NLog.LayoutRenderers.LayoutRenderer' NLog.LogFactory' NLog.Conditions.ConditionMethodAttribute' NLog.LayoutRenderers.AmbientPropertyAttribute' NLog.Layouts.LayoutAttribute' NLog.Filters.FilterAttribute' NLog.Targets.TargetAttribute' NLog.LayoutRenderers.LayoutRendererAttribute' NLog.Filters.Filter' NLog.Targets.ConsoleRowHighlightingRule' NLog.Internal.TargetWithFilterChain' NLog.Targets.NLogViewerParameterInfo' NLog.Targets.ConsoleWordHighlightingRule' NLog.Targets.Wrappers.FilteringRule' NLog.Targets.MethodCallParameter' NLog.Conditions.ConditionExpression' NLog.Targets.DatabaseParameterInfo' NLog.Layouts.CsvColumn' NLog.Internal.ObjectGraphScanner' NLog.Filters.WhenNotEqualFilter' NLog.Filters.WhenEqualFilter' NLog.Filters.WhenNotContainsFilter' NLog.Filters.ConditionBasedFilter' NLog.Filters.WhenContainsFilter' NLog.LayoutRenderers.RegistryLayoutRenderer' NLog.LayoutRenderers.Wrappers.WhenLayoutRendererWrapper' NLog.Filters.LayoutBasedFilter' NLog.LayoutRenderers.PerformanceCounterLayoutRenderer' NLog.Targets.TargetWithLayout' NLog.Targets.TargetWithLayoutHeaderAndFooter' NLog.Targets.Wrappers.FilteringTargetWrapper' NLog.Targets.Wrappers.WrapperTargetBase' NLog.Targets.MailTarget' NLog.LayoutRenderers.Wrappers.WhenEmptyLayoutRendererWrapper' NLog.LayoutRenderers.StackTraceLayoutRenderer' NLog.LayoutRenderers.CallSiteLayoutRenderer' NLog.LayoutRenderers.Log4JXmlEventLayoutRenderer' NLog.Internal.StackTraceUsageUtils' NLog.Internal.IUsesStackTrace' NLog.LoggerImpl' NLog.LayoutRenderers.LongDateLayoutRenderer' NLog.LayoutRenderers.LevelLayoutRenderer' NLog.LayoutRenderers.MessageLayoutRenderer' NLog.LayoutRenderers.ProcessTimeLayoutRenderer' NLog.LayoutRenderers.LoggerNameLayoutRenderer' NLog.Layouts.LayoutWithHeaderAndFooter' NLog.LayoutRenderers.TicksLayoutRenderer' NLog.LayoutRenderers.TimeLayoutRenderer' NLog.LayoutRenderers.ShortDateLayoutRenderer' NLog.ComInterop.ComLogManager,
NLog.monodevelop,NLog.Filters,NLog.Config.ConfigurationItemFactory' NLog.Config.LoggingRule' NLog.Config.XmlLoggingConfiguration' NLog.LoggerImpl' NLog.Internal.TargetWithFilterChain,
NLog.monodevelop,NLog,NLog.LayoutRenderers.GdcLayoutRenderer' NLog.Targets.ConsoleRowHighlightingRule' NLog.Conditions.ConditionAndExpression' NLog.Conditions.ConditionLayoutExpression' NLog.Targets.Wrappers.RepeatingTargetWrapper' NLog.Conditions.ConditionLevelExpression' NLog.Conditions.ConditionExpression' NLog.Conditions.ConditionLoggerNameExpression' NLog.Conditions.ConditionMessageExpression' NLog.Conditions.ConditionNotExpression' NLog.Conditions.ConditionOrExpression' NLog.Layouts.SimpleLayout' NLog.Config.InstallationContext' NLog.LogReceiverService.LogReceiverForwardingService' NLog.Filters.ConditionBasedFilter' NLog.Conditions.ConditionRelationalExpression' NLog.Conditions.ConditionLiteralExpression' NLog.Common.AsyncLogEventInfo' NLog.Filters.WhenNotEqualFilter' NLog.Filters.WhenNotContainsFilter' NLog.Targets.Wrappers.WrapperTargetBase' NLog.LayoutRenderers.CounterLayoutRenderer' NLog.LayoutRenderers.BaseDirLayoutRenderer' NLog.LayoutRenderers.CallSiteLayoutRenderer' NLog.LayoutRenderers.AspRequestValueLayoutRenderer' NLog.LayoutRenderers.EventContextLayoutRenderer' NLog.LayoutRenderers.EnvironmentLayoutRenderer' NLog.LayoutRenderers.DateLayoutRenderer' NLog.LayoutRenderers.FileContentsLayoutRenderer' NLog.LayoutRenderers.ExceptionLayoutRenderer' NLog.LayoutRenderers.AspApplicationValueLayoutRenderer' NLog.Targets.Wrappers.CompoundTargetBase' NLog.LayoutRenderers.IdentityLayoutRenderer' NLog.Filters.Filter' NLog.Filters.WhenContainsFilter' NLog.LayoutRenderers.LiteralLayoutRenderer' NLog.LayoutRenderers.LongDateLayoutRenderer' NLog.LayoutRenderers.LoggerNameLayoutRenderer' NLog.LayoutRenderers.MachineNameLayoutRenderer' NLog.LayoutRenderers.MessageLayoutRenderer' NLog.Targets.TraceTarget' NLog.LayoutRenderers.MdcLayoutRenderer' NLog.Filters.WhenEqualFilter' NLog.LayoutRenderers.InstallContextLayoutRenderer' NLog.Conditions.ConditionMethodExpression' NLog.LayoutRenderers.NdcLayoutRenderer' NLog.LayoutRenderers.Log4JXmlEventLayoutRenderer' NLog.LayoutRenderers.LevelLayoutRenderer' NLog.LayoutRenderers.LayoutRenderer' NLog.LayoutRenderers.AspSessionValueLayoutRenderer' NLog.LayoutRenderers.NLogDirLayoutRenderer' NLog.LayoutRenderers.NewLineLayoutRenderer' NLog.LayoutRenderers.PerformanceCounterLayoutRenderer' NLog.LayoutRenderers.ProcessNameLayoutRenderer' NLog.LayoutRenderers.ProcessIdLayoutRenderer' NLog.LayoutRenderers.ShortDateLayoutRenderer' NLog.LayoutRenderers.QueryPerformanceCounterLayoutRenderer' NLog.LayoutRenderers.RegistryLayoutRenderer' NLog.Internal.IRenderable' NLog.LayoutRenderers.SpecialFolderLayoutRenderer' NLog.LayoutRenderers.ThreadNameLayoutRenderer' NLog.LayoutRenderers.GuidLayoutRenderer' NLog.LayoutRenderers.ProcessTimeLayoutRenderer' NLog.LayoutRenderers.StackTraceLayoutRenderer' NLog.LayoutRenderers.TimeLayoutRenderer' NLog.LayoutRenderers.TicksLayoutRenderer' NLog.LayoutRenderers.Wrappers.CachedLayoutRendererWrapper' NLog.LayoutRenderers.WindowsIdentityLayoutRenderer' NLog.LayoutRenderers.ThreadIdLayoutRenderer' NLog.LayoutRenderers.Wrappers.OnExceptionLayoutRendererWrapper' NLog.LayoutRenderers.Wrappers.WhenEmptyLayoutRendererWrapper' NLog.LayoutRenderers.Wrappers.WhenLayoutRendererWrapper' NLog.LayoutRenderers.Wrappers.WrapperLayoutRendererBase' NLog.Layouts.Log4JXmlEventLayout' NLog.Layouts.LayoutWithHeaderAndFooter' NLog.Layouts.LayoutParser' NLog.Layouts.CsvLayout' NLog.Layouts.Layout' NLog.Targets.AspResponseTarget' NLog.LogReceiverService.NLogEvent' NLog.Targets.ConsoleTarget' NLog.LogReceiverService.NLogEvents' NLog.Targets.DebugTarget' NLog.Targets.EventLogTarget' NLog.Targets.DebuggerTarget' NLog.Targets.MemoryTarget' NLog.Targets.MessageBoxTarget' NLog.Targets.LogReceiverWebServiceTarget' NLog.Targets.MethodCallParameter' NLog.Targets.ColoredConsoleTarget' NLog.Targets.NullTarget' NLog.Targets.DatabaseTarget' NLog.Targets.NetworkTarget' NLog.Targets.OutputDebugStringTarget' NLog.Targets.PerformanceCounterTarget' NLog.LayoutRenderers.TempDirLayoutRenderer' NLog.Targets.Target' NLog.Targets.MailTarget' NLog.Targets.FileTarget' NLog.ComInterop.ComLogger' NLog.Config.ConfigurationItemFactory' NLog.Internal.LoggerConfiguration' NLog.ComInterop.ComLogManager' NLog.Conditions.ConditionParser' NLog.Config.SimpleConfigurator' NLog.Config.XmlLoggingConfiguration' NLog.Config.LoggingRule' NLog.Common.InternalLogger' NLog.Config.LoggingConfiguration' NLog.Targets.NLogViewerTarget' NLog.Config.NLogXmlElement' NLog.Internal.FactoryHelper' NLog.Config.MethodFactory<TClassAttributeType;TMethodAttributeType>' NLog.Internal.PropertyHelper' NLog.Common.AsyncHelpers,
NLog.monodevelop,NLog.Internal,NLog.Targets.AspResponseTarget' NLog.LayoutRenderers.AspSessionValueLayoutRenderer' NLog.LayoutRenderers.AspApplicationValueLayoutRenderer' NLog.LayoutRenderers.AspRequestValueLayoutRenderer' NLog.NLogTraceListener' NLog.LogEventInfo' NLog.Internal.FileAppenders.BaseFileAppender' NLog.Common.InternalLogger' NLog.Config.LoggingConfiguration' NLog.Common.AsyncHelpers' NLog.LayoutRenderers.MessageLayoutRenderer' NLog.LayoutRenderers.ExceptionLayoutRenderer' NLog.LayoutRenderers.NewLineLayoutRenderer' NLog.LayoutRenderers.EnvironmentLayoutRenderer' NLog.Targets.FileTarget' NLog.LogFactory' NLog.Config.XmlLoggingConfiguration' NLog.Internal.FileAppenders.MutexMultiProcessFileAppender' NLog.Layouts.Layout' NLog.LayoutRenderers.LayoutRenderer' NLog.Layouts.LayoutParser' NLog.Targets.MailTarget' NLog.Targets.Target' NLog.LayoutRenderers.StackTraceLayoutRenderer' NLog.LayoutRenderers.CallSiteLayoutRenderer' NLog.LayoutRenderers.Log4JXmlEventLayoutRenderer' NLog.Logger' NLog.Targets.MessageBoxTarget' NLog.Targets.OutputDebugStringTarget' NLog.LayoutRenderers.QueryPerformanceCounterLayoutRenderer' NLog.Targets.Wrappers.ImpersonatingTargetWrapper' NLog.LogLevel' NLog.Conditions.ConditionTokenizer' NLog.Layouts.SimpleLayout' NLog.Conditions.ConditionParser' NLog.Targets.DatabaseTarget' NLog.LoggerImpl' NLog.LayoutRenderers.ProcessIdLayoutRenderer' NLog.LayoutRenderers.ProcessNameLayoutRenderer' NLog.MappedDiagnosticsContext' NLog.NestedDiagnosticsContext' NLog.LayoutRenderers.Wrappers.UrlEncodeLayoutRendererWrapper' NLog.Targets.WebServiceTarget,
NLog.monodevelop,NLog.Internal.FileAppenders,NLog.Targets.FileTarget,NLog.Common.InternalLogger
NLog.monodevelop,NLog.Internal.NetworkSenders,NLog.Targets.NetworkTarget,
NLog.monodevelop,NLog.LayoutRenderers,NLog.LayoutRenderers.Wrappers.FileSystemNormalizeLayoutRendererWrapper' NLog.LayoutRenderers.Wrappers.CachedLayoutRendererWrapper' NLog.LayoutRenderers.Wrappers.LowercaseLayoutRendererWrapper' NLog.LayoutRenderers.Wrappers.TrimWhiteSpaceLayoutRendererWrapper' NLog.LayoutRenderers.Wrappers.XmlEncodeLayoutRendererWrapper' NLog.LayoutRenderers.Wrappers.WhenEmptyLayoutRendererWrapper' NLog.LayoutRenderers.Wrappers.PaddingLayoutRendererWrapper' NLog.Config.ConfigurationItemFactory' NLog.LayoutRenderers.Wrappers.WhenLayoutRendererWrapper' NLog.LayoutRenderers.Wrappers.UppercaseLayoutRendererWrapper' NLog.LayoutRenderers.Wrappers.WrapperLayoutRendererBase' NLog.Layouts.SimpleLayout' NLog.Layouts.LayoutParser' NLog.LayoutRenderers.Wrappers.OnExceptionLayoutRendererWrapper' NLog.LayoutRenderers.Wrappers.ReplaceLayoutRendererWrapper' NLog.LayoutRenderers.Wrappers.Rot13LayoutRendererWrapper' NLog.LayoutRenderers.Wrappers.UrlEncodeLayoutRendererWrapper' NLog.Targets.NLogViewerTarget' NLog.Layouts.Log4JXmlEventLayout,
NLog.monodevelop,NLog.LayoutRenderers.Wrappers,NLog.Layouts.LayoutParser,
NLog.monodevelop,NLog.Layouts,NLog.Filters.LayoutBasedFilter' NLog.Conditions.ConditionLayoutExpression' NLog.Conditions.ConditionParser' NLog.Config.ConfigurationItemFactory' NLog.LayoutRenderers.Wrappers.WhenEmptyLayoutRendererWrapper' NLog.LayoutRenderers.Wrappers.Rot13LayoutRendererWrapper' NLog.LayoutRenderers.FileContentsLayoutRenderer' NLog.LayoutRenderers.Wrappers.WrapperLayoutRendererBase' NLog.Internal.PropertyHelper' NLog.LogEventInfo' NLog.Targets.TargetWithLayoutHeaderAndFooter' NLog.Targets.DatabaseCommandInfo' NLog.Config.XmlLoggingConfiguration' NLog.Targets.TargetWithLayout' NLog.Targets.EventLogTarget' NLog.Targets.NLogViewerParameterInfo' NLog.Targets.LogReceiverWebServiceTarget' NLog.Targets.NetworkTarget' NLog.Targets.MessageBoxTarget' NLog.Targets.NLogViewerTarget' NLog.Targets.DatabaseParameterInfo' NLog.Targets.FileTarget' NLog.Targets.MethodCallParameter' NLog.Targets.DatabaseTarget' NLog.Targets.MailTarget' NLog.Targets.Target,
NLog.monodevelop,NLog.LogReceiverService,NLog.Targets.LogReceiverWebServiceTarget,
NLog.monodevelop,NLog.Targets,NLog.Config.SimpleConfigurator' NLog.Config.ConfigurationItemFactory' NLog.LayoutRenderers.Log4JXmlEventLayoutRenderer' NLog.Targets.Wrappers.WrapperTargetBase' NLog.Targets.Wrappers.AutoFlushTargetWrapper' NLog.Targets.Wrappers.RetryingTargetWrapper' NLog.Targets.Wrappers.RepeatingTargetWrapper' NLog.Targets.Wrappers.ImpersonatingTargetWrapper' NLog.LogFactory' NLog.Targets.Wrappers.AsyncTargetWrapper' NLog.Targets.Wrappers.RandomizeGroupTarget' NLog.Targets.Wrappers.BufferingTargetWrapper' NLog.Targets.Wrappers.FallbackGroupTarget' NLog.Targets.Wrappers.FilteringTargetWrapper' NLog.Targets.Wrappers.SplitGroupTarget' NLog.LoggerImpl' NLog.Internal.TargetWithFilterChain' NLog.Targets.Wrappers.CompoundTargetBase' NLog.Targets.Wrappers.RoundRobinGroupTarget' NLog.Config.LoggingRule' NLog.Config.LoggingConfiguration' NLog.Config.XmlLoggingConfiguration' NLog.Targets.Wrappers.PostFilteringTargetWrapper' NLog.Internal.FileAppenders.ICreateFileParameters' NLog.Internal.Win32FileNativeMethods,
NLog.monodevelop,NLog.Targets.Wrappers,NLog.Config.XmlLoggingConfiguration,
