Namespace,Type,NOF,NOM,NOP,NOPF,NOPM,LOC,WMC,NC,DIT,LCOM,Fan-Out,Fan-In,Fan-Out types,Fan-In types
NBi.NUnit.Builder,AbstractResultSetBuilder,0,6,1,0,0,98,17,4,1,-1,22,0,NBi.Xml.Systems.ExecutionXml' NBi.Xml.Systems.ResultSetSystemXml' NBi.Xml.Systems.AbstractSystemUnderTestXml' NBi.Xml.Constraints.AbstractConstraintXml' NBi.Core.Query.CommandBuilder' NBi.NUnit.Builder.Helper.QueryResolverArgsBuilder' NBi.Core.ResultSet.Resolver.QueryResultSetResolverArgs' NBi.Core.ResultSet.Resolver.ResultSetResolverFactory' NBi.Core.ResultSet.Resolver.IResultSetResolver' NBi.Core.ResultSet.ResultSetServiceBuilder' NBi.Core.ResultSet.IResultSetService' NBi.Xml.Items.ExecutableXml' NBi.Xml.Items.QueryableXml' NBi.Xml.Items.QueryXml' NBi.Xml.Items.ReportXml' NBi.NUnit.Builder.Helper.ResultSetResolverArgsBuilder' NBi.NUnit.Builder.AbstractTestCaseBuilder' NBi.Core.Calculation.PredicateFilterFactory' NBi.Xml.Items.Alteration.AlterationXml' NBi.Xml.Items.Calculation.FilterXml' NBi.Core.Calculation.BasePredicateFilter' NBi.Xml.Items.Calculation.CombinationPredicateXml,
NBi.NUnit.Builder,AbstractMembersBuilder,1,7,1,0,2,103,17,6,1,0.29,12,0,NBi.Core.Analysis.Request.DiscoveryRequestFactory' NBi.Xml.Systems.MembersXml' NBi.Xml.Systems.AbstractSystemUnderTestXml' NBi.Xml.Constraints.AbstractConstraintXml' NBi.Core.Analysis.Request.MembersDiscoveryRequest' NBi.Xml.Items.HierarchyXml' NBi.Xml.Items.AbstractMembersItem' NBi.Xml.Items.LevelXml' NBi.Xml.Items.ExcludeXml' NBi.Xml.Items.SetXml' NBi.Core.Analysis.Member.PatternValue' NBi.Xml.Items.PatternXml,
NBi.NUnit.Builder,AbstractDataTypeBuilder,1,8,1,0,1,66,19,1,1,0.25,17,0,NBi.Core.DataType.DataTypeDiscoveryFactoryProvider' NBi.Xml.Systems.DataTypeXml' NBi.Xml.Systems.AbstractSystemUnderTestXml' NBi.Xml.Constraints.AbstractConstraintXml' NBi.Core.DataType.IDataTypeDiscoveryCommand' NBi.Core.DataType.IDataTypeDiscoveryFactory' NBi.Core.DataType.Target' NBi.Xml.Items.AbstractItem' NBi.Xml.Items.Filters.IPerspectiveFilter' NBi.Xml.Items.Filters.IDimensionFilter' NBi.Xml.Items.Filters.IHierarchyFilter' NBi.Xml.Items.Filters.ILevelFilter' NBi.Xml.Items.Filters.IMeasureGroupFilter' NBi.Xml.Items.Filters.ITableFilter' NBi.Xml.Items.MeasureXml' NBi.Xml.Items.ColumnXml' NBi.Xml.Items.PropertyXml,
NBi.NUnit.Builder,AbstractTestCaseBuilder,3,11,4,0,6,83,18,6,1,0.18,6,1,NBi.Framework.ITestConfiguration' NBi.Xml.Systems.AbstractSystemUnderTestXml' NBi.Xml.Constraints.AbstractConstraintXml' NBi.Core.Variable.ITestVariable' NBi.Core.NBiTraceSwitch' NBi.NUnit.NBiConstraint,NBi.NUnit.Builder.AbstractResultSetBuilder
NBi.NUnit.Builder,AbstractExecutionBuilder,0,4,1,0,0,47,8,4,2,-1,9,0,NBi.Xml.Systems.ExecutionXml' NBi.Xml.Systems.AbstractSystemUnderTestXml' NBi.Xml.Constraints.AbstractConstraintXml' NBi.Core.Query.CommandBuilder' NBi.NUnit.Builder.Helper.QueryResolverArgsBuilder' NBi.Xml.Items.ExecutableXml' NBi.Xml.Items.QueryableXml' NBi.Xml.Items.QueryXml' NBi.Xml.Items.ReportXml,
NBi.NUnit.Builder,AbstractStructureBuilder,1,8,1,0,1,92,33,4,2,0.25,46,0,NBi.Core.Structure.StructureDiscoveryFactoryProvider' NBi.Xml.Systems.StructureXml' NBi.Xml.Systems.AbstractSystemUnderTestXml' NBi.Xml.Constraints.AbstractConstraintXml' NBi.Core.Structure.StructureDiscoveryCommand' NBi.Core.Structure.IStructureDiscoveryFactory' NBi.Core.Structure.Target' NBi.Xml.Items.AbstractItem' NBi.Core.Structure.TargetType' NBi.Xml.Items.Filters.IPerspectiveFilter' NBi.Xml.Items.Filters.IDimensionFilter' NBi.Xml.Items.Filters.IHierarchyFilter' NBi.Xml.Items.Filters.ILevelFilter' NBi.Xml.Items.Filters.IMeasureGroupFilter' NBi.Xml.Items.Filters.IDisplayFolderFilter' NBi.Xml.Items.Filters.ITableFilter' NBi.Xml.Items.Filters.IRoutineFilter' NBi.Xml.Items.Filters.IResultFilter' NBi.Xml.Items.Filters.IsResultOption' NBi.Xml.Items.Filters.IParameterDirectionFilter' NBi.Xml.Items.Filters.ParameterDirectionOption' NBi.Xml.Items.Filters.IOwnerFilter' NBi.Xml.Items.MeasuresXml' NBi.Xml.Items.MeasureXml' NBi.Xml.Items.MeasureGroupsXml' NBi.Xml.Items.MeasureGroupXml' NBi.Xml.Items.ColumnsXml' NBi.Xml.Items.ColumnXml' NBi.Xml.Items.TablesXml' NBi.Xml.Items.TableXml' NBi.Xml.Items.PropertiesXml' NBi.Xml.Items.PropertyXml' NBi.Xml.Items.LevelsXml' NBi.Xml.Items.LevelXml' NBi.Xml.Items.HierarchiesXml' NBi.Xml.Items.HierarchyXml' NBi.Xml.Items.DimensionsXml' NBi.Xml.Items.DimensionXml' NBi.Xml.Items.SetsXml' NBi.Xml.Items.SetXml' NBi.Xml.Items.RoutineParametersXml' NBi.Xml.Items.RoutineParameterXml' NBi.Xml.Items.RoutinesXml' NBi.Xml.Items.RoutineXml' NBi.Xml.Items.PerspectivesXml' NBi.Xml.Items.PerspectiveXml,
NBi.NUnit.Builder,AbstractExecutionNonQueryBuilder,0,3,1,0,0,21,4,2,2,-1,5,0,NBi.Xml.Systems.ExecutionXml' NBi.Xml.Systems.AbstractSystemUnderTestXml' NBi.Xml.Constraints.AbstractConstraintXml' NBi.Core.ExecutionFactory' NBi.Core.IExecution,
NBi.NUnit.Builder,ResultSetSingleRowBuilder,0,3,0,0,0,19,4,0,1,-1,5,1,NBi.Xml.Constraints.SingleRowXml' NBi.Xml.Systems.AbstractSystemUnderTestXml' NBi.Xml.Constraints.AbstractConstraintXml' NBi.Core.Calculation.BasePredicateFilter' NBi.NUnit.Query.SingleRowConstraint,NBi.Testing.Unit.NUnit.Builder.ResultSetSingleRowBuilderTest
NBi.NUnit.Builder,ResultSetSomeRowsBuilder,0,3,0,0,0,19,4,0,1,-1,5,1,NBi.Xml.Constraints.SomeRowsXml' NBi.Xml.Systems.AbstractSystemUnderTestXml' NBi.Xml.Constraints.AbstractConstraintXml' NBi.Core.Calculation.BasePredicateFilter' NBi.NUnit.Query.SomeRowsConstraint,NBi.Testing.Unit.NUnit.Builder.ResultSetSomeRowsBuilderTest
NBi.NUnit.Builder,ResultSetUniqueRowsBuilder,0,3,1,0,1,26,4,0,2,-1,8,1,NBi.Xml.Constraints.UniqueRowsXml' NBi.Xml.Systems.AbstractSystemUnderTestXml' NBi.Xml.Constraints.AbstractConstraintXml' NBi.Core.ResultSet.Uniqueness.SettingsEvaluatorBuilder' NBi.NUnit.Query.UniqueRowsConstraint' NBi.Core.ResultSet.ISettingsResultSet' NBi.Core.ResultSet.Uniqueness.EvaluatorFactory' NBi.Core.ResultSet.Uniqueness.Evaluator,NBi.Testing.Unit.NUnit.Builder.ResultSetUniqueRowsBuilderTest
NBi.NUnit.Builder,ResultSetSubsetOfBuilder,0,4,1,0,1,37,6,0,1,-1,11,0,NBi.Xml.Constraints.SubsetOfXml' NBi.Xml.Systems.AbstractSystemUnderTestXml' NBi.Xml.Constraints.AbstractConstraintXml' NBi.NUnit.Builder.Helper.ResultSetResolverArgsBuilder' NBi.Core.ResultSet.Resolver.ResultSetResolverFactory' NBi.Core.ResultSet.Resolver.IResultSetResolver' NBi.Core.ResultSet.ResultSetServiceBuilder' NBi.Core.ResultSet.IResultSetService' NBi.Core.Transformation.TransformationProvider' NBi.NUnit.ResultSetComparison.SubsetOfConstraint' NBi.Xml.Settings.SettingsXml,
NBi.NUnit.Builder,ResultSetSupersetOfBuilder,0,4,1,0,1,34,6,0,1,-1,11,1,NBi.Xml.Constraints.SupersetOfXml' NBi.Xml.Systems.AbstractSystemUnderTestXml' NBi.Xml.Constraints.AbstractConstraintXml' NBi.NUnit.Builder.Helper.ResultSetResolverArgsBuilder' NBi.Core.ResultSet.Resolver.ResultSetResolverFactory' NBi.Core.ResultSet.Resolver.IResultSetResolver' NBi.Core.ResultSet.ResultSetServiceBuilder' NBi.Core.ResultSet.IResultSetService' NBi.Core.Transformation.TransformationProvider' NBi.NUnit.ResultSetComparison.SupersetOfConstraint' NBi.Xml.Settings.SettingsXml,NBi.Testing.Unit.NUnit.Builder.ResultSetSupersetOfBuilderTest
NBi.NUnit.Builder,ResultSetNoRowsBuilder,0,4,1,0,0,59,8,3,2,-1,8,0,NBi.Xml.Constraints.NoRowsXml' NBi.Xml.Systems.AbstractSystemUnderTestXml' NBi.Xml.Constraints.AbstractConstraintXml' NBi.Core.Calculation.BasePredicateFilter' NBi.NUnit.Query.NoRowsConstraint' NBi.Core.Calculation.PredicateFilterFactory' NBi.Xml.Items.Calculation.PredicationXml' NBi.Xml.Items.Calculation.CombinationPredicateXml,
NBi.NUnit.Builder,ResultSetAllRowsBuilder,0,3,0,0,0,19,4,0,3,-1,5,1,NBi.Xml.Constraints.AllRowsXml' NBi.Xml.Systems.AbstractSystemUnderTestXml' NBi.Xml.Constraints.AbstractConstraintXml' NBi.Core.Calculation.BasePredicateFilter' NBi.NUnit.Query.AllRowsConstraint,NBi.Testing.Unit.NUnit.Builder.ResultSetAllRowsBuilderTest
NBi.NUnit.Builder,ResultSetRowCountBuilder,0,5,1,0,1,95,17,0,2,-1,17,1,NBi.Xml.Constraints.RowCountXml' NBi.Xml.Systems.AbstractSystemUnderTestXml' NBi.Xml.Constraints.AbstractConstraintXml' NBi.NUnit.Query.RowCountConstraint' NBi.NUnit.DifferedConstraint' NBi.Core.Calculation.IResultSetFilter' NBi.Xml.Items.Calculation.FilterXml' NBi.Core.Calculation.PredicateFilterFactory' NBi.Xml.Constraints.Comparer.PredicateXml' NBi.Xml.Items.Calculation.CombinationPredicateXml' NBi.NUnit.Builder.Helper.ScalarResolverArgsBuilder' NBi.Core.Scalar.Resolver.IScalarResolverArgs' NBi.Core.Scalar.Resolver.ScalarResolverFactory' NBi.Core.Scalar.Resolver.IScalarResolver' NBi.Xml.Constraints.Comparer.LessThanXml' NBi.Xml.Constraints.Comparer.MoreThanXml' NBi.Xml.Constraints.Comparer.EqualXml,NBi.Testing.Unit.NUnit.Builder.ResultSetRowCountBuilderTest
NBi.NUnit.Builder,ExecutionFasterThanChooser,0,1,1,0,1,12,2,0,1,-1,4,0,NBi.Xml.Systems.AbstractSystemUnderTestXml' NBi.NUnit.BuilderRegistration' NBi.Core.IExecutable' NBi.Xml.Constraints.AbstractConstraintXml,
NBi.NUnit.Builder,ExecutionNonQuerySuccessfulBuilder,0,4,1,0,1,23,5,0,3,-1,4,0,NBi.Xml.Constraints.SuccessfulXml' NBi.Xml.Systems.AbstractSystemUnderTestXml' NBi.Xml.Constraints.AbstractConstraintXml' NBi.NUnit.Execution.SuccessfulConstraint,
NBi.NUnit.Builder,ExecutionNonQueryFasterThanBuilder,0,4,1,0,1,24,5,0,3,-1,4,0,NBi.Xml.Constraints.FasterThanXml' NBi.Xml.Systems.AbstractSystemUnderTestXml' NBi.Xml.Constraints.AbstractConstraintXml' NBi.NUnit.Execution.FasterThanConstraint,
NBi.NUnit.Builder,ExecutionMatchPatternBuilder,0,4,1,0,1,46,8,0,3,-1,7,1,NBi.Xml.Constraints.MatchPatternXml' NBi.Xml.Systems.AbstractSystemUnderTestXml' NBi.Xml.Constraints.AbstractConstraintXml' NBi.Core.Format.RegexBuilder' NBi.NUnit.Query.MatchPatternConstraint' NBi.Xml.Items.Format.NumericFormatXml' NBi.Xml.Items.Format.CurrencyFormatXml,NBi.Testing.Unit.NUnit.Builder.ExecutionMatchPatternBuilderTest
NBi.NUnit.Builder,ExecutionEvaluateRowsBuilder,0,4,1,0,1,23,5,0,3,-1,4,0,NBi.Xml.Constraints.EvaluateRowsXml' NBi.Xml.Systems.AbstractSystemUnderTestXml' NBi.Xml.Constraints.AbstractConstraintXml' NBi.NUnit.Query.EvaluateRowsConstraint,
NBi.NUnit.Builder,ITestCaseBuilderChooser,0,1,1,0,0,5,1,1,0,-1,2,2,NBi.Xml.Systems.AbstractSystemUnderTestXml' NBi.Xml.Constraints.AbstractConstraintXml,NBi.NUnit.TestCaseFactory' NBi.NUnit.BuilderRegistration
NBi.NUnit.Builder,MembersMatchPatternBuilder,0,5,1,0,1,28,7,0,2,-1,5,1,NBi.Core.Analysis.Request.DiscoveryRequestFactory' NBi.Xml.Constraints.MatchPatternXml' NBi.Xml.Systems.AbstractSystemUnderTestXml' NBi.Xml.Constraints.AbstractConstraintXml' NBi.NUnit.Member.MatchPatternConstraint,NBi.Testing.Unit.NUnit.Builder.MembersMatchPatternBuilderTest
NBi.NUnit.Builder,MetadataDiscoveryRequestBuilder,0,7,0,0,0,115,33,0,0,-1,27,0,NBi.Core.Analysis.Request.DiscoveryTarget' NBi.Xml.Items.MeasuresXml' NBi.Xml.Items.MeasureXml' NBi.Xml.Items.MeasureGroupsXml' NBi.Xml.Items.MeasureGroupXml' NBi.Xml.Items.PropertiesXml' NBi.Xml.Items.PropertyXml' NBi.Xml.Items.LevelsXml' NBi.Xml.Items.LevelXml' NBi.Xml.Items.HierarchiesXml' NBi.Xml.Items.HierarchyXml' NBi.Xml.Items.DimensionsXml' NBi.Xml.Items.DimensionXml' NBi.Xml.Items.ColumnsXml' NBi.Xml.Items.ColumnXml' NBi.Xml.Items.TablesXml' NBi.Xml.Items.TableXml' NBi.Xml.Items.PerspectivesXml' NBi.Xml.Items.PerspectiveXml' NBi.Xml.Items.SetsXml' NBi.Xml.Items.SetXml' NBi.Core.Analysis.Request.CaptionFilter' NBi.Core.Analysis.Request.IFilter' NBi.Core.Analysis.Request.DiscoveryRequestFactory' NBi.Core.Analysis.Request.MetadataDiscoveryRequest' NBi.Xml.Items.AbstractItem' NBi.NUnit.Builder.MetadataDiscoveryRequestType,
NBi.NUnit.Builder,MetadataDiscoveryRequestType,0,0,0,0,0,5,0,0,0,-1,0,1,,NBi.NUnit.Builder.MetadataDiscoveryRequestBuilder
NBi.NUnit.Builder,MembersContainedInBuilder,0,5,1,0,1,38,8,0,2,-1,7,0,NBi.Core.Analysis.Request.DiscoveryRequestFactory' NBi.Xml.Constraints.ContainedInXml' NBi.Xml.Systems.AbstractSystemUnderTestXml' NBi.Xml.Constraints.AbstractConstraintXml' NBi.NUnit.Member.ContainedInConstraint' NBi.Core.Analysis.Request.MembersDiscoveryRequest' NBi.Xml.Items.QueryXml,
NBi.NUnit.Builder,MembersEquivalentToBuilder,0,5,1,0,1,38,8,0,2,-1,7,1,NBi.Core.Analysis.Request.DiscoveryRequestFactory' NBi.Xml.Constraints.EquivalentToXml' NBi.Xml.Systems.AbstractSystemUnderTestXml' NBi.Xml.Constraints.AbstractConstraintXml' NBi.NUnit.Member.EquivalentToConstraint' NBi.Core.Analysis.Request.MembersDiscoveryRequest' NBi.Xml.Items.QueryXml,NBi.Testing.Unit.NUnit.Builder.MembersEquivalentToBuilderTest
NBi.NUnit.Builder,StructureEquivalentToBuilder,0,5,1,0,1,31,7,0,3,-1,5,1,NBi.Core.Structure.StructureDiscoveryFactoryProvider' NBi.Xml.Constraints.EquivalentToXml' NBi.Xml.Systems.AbstractSystemUnderTestXml' NBi.Xml.Constraints.AbstractConstraintXml' NBi.NUnit.Structure.EquivalentToConstraint,NBi.Testing.Unit.NUnit.Builder.StructureEquivalentToBuilderTest
NBi.NUnit.Builder,DataTypeIsBuilder,0,5,1,0,1,31,7,0,2,-1,6,0,NBi.Core.DataType.DataTypeDiscoveryFactoryProvider' NBi.Xml.Constraints.IsXml' NBi.Xml.Systems.DataTypeXml' NBi.Xml.Systems.AbstractSystemUnderTestXml' NBi.Xml.Constraints.AbstractConstraintXml' NBi.NUnit.DataType.IsConstraint,
NBi.NUnit.Builder,StructureContainedInBuilder,0,5,1,0,1,30,7,0,1,-1,5,1,NBi.Core.Structure.StructureDiscoveryFactoryProvider' NBi.Xml.Constraints.ContainedInXml' NBi.Xml.Systems.AbstractSystemUnderTestXml' NBi.Xml.Constraints.AbstractConstraintXml' NBi.NUnit.Structure.ContainedInConstraint,NBi.Testing.Unit.NUnit.Builder.StructureContainedInBuilderTest
NBi.NUnit.Builder,StructureLinkedToBuilder,0,8,1,0,1,54,13,0,3,-1,13,0,NBi.Core.Structure.StructureDiscoveryFactoryProvider' NBi.Xml.Constraints.LinkedToXml' NBi.Xml.Systems.AbstractSystemUnderTestXml' NBi.Xml.Constraints.AbstractConstraintXml' NBi.NUnit.Structure.LinkedToConstraint' NBi.Xml.Items.AbstractItem' NBi.Core.Structure.IStructureDiscoveryFactory' NBi.Core.Structure.Target' NBi.Core.Structure.StructureDiscoveryCommand' NBi.Core.Structure.TargetType' NBi.Xml.Items.MeasureGroupXml' NBi.Xml.Items.DimensionXml' NBi.Xml.Items.Filters.IPerspectiveFilter,
NBi.NUnit.Builder,StructureExistsBuilder,0,5,1,0,1,33,8,0,3,-1,7,1,NBi.Core.Structure.StructureDiscoveryFactoryProvider' NBi.Xml.Constraints.ExistsXml' NBi.Xml.Systems.StructureXml' NBi.Xml.Systems.AbstractSystemUnderTestXml' NBi.Xml.Constraints.AbstractConstraintXml' NBi.NUnit.Structure.ExistsConstraint' NBi.Xml.Items.AbstractItem,NBi.Testing.Unit.NUnit.Builder.StructureExistsBuilderTest
NBi.NUnit.Builder,StructureContainBuilder,0,5,1,0,1,31,7,1,3,-1,5,1,NBi.Core.Structure.StructureDiscoveryFactoryProvider' NBi.Xml.Constraints.ContainXml' NBi.Xml.Systems.AbstractSystemUnderTestXml' NBi.Xml.Constraints.AbstractConstraintXml' NBi.NUnit.Structure.ContainConstraint,NBi.Testing.Unit.NUnit.Builder.StructureContainBuilderTest
NBi.NUnit.Builder,MembersContainBuilder,0,5,1,0,1,43,8,0,2,-1,7,1,NBi.Core.Analysis.Request.DiscoveryRequestFactory' NBi.Xml.Constraints.ContainXml' NBi.Xml.Systems.AbstractSystemUnderTestXml' NBi.Xml.Constraints.AbstractConstraintXml' NBi.NUnit.Member.ContainConstraint' NBi.Core.Analysis.Request.MembersDiscoveryRequest' NBi.Xml.Items.QueryXml,NBi.Testing.Unit.NUnit.Builder.MembersContainsBuilderTest
NBi.NUnit.Builder,MembersOrderedBuilder,0,5,1,0,1,49,8,0,2,-1,7,1,NBi.Core.Analysis.Request.DiscoveryRequestFactory' NBi.Xml.Constraints.OrderedXml' NBi.Xml.Systems.AbstractSystemUnderTestXml' NBi.Xml.Constraints.AbstractConstraintXml' NBi.NUnit.Member.OrderedConstraint' NBi.Xml.Constraints.Order' NBi.Xml.Items.QueryXml,NBi.Testing.Unit.NUnit.Builder.MembersOrderedBuilderTest
NBi.NUnit.Builder,ExecutionSyntacticallyCorrectBuilder,0,4,1,0,1,38,5,0,3,-1,4,1,NBi.Xml.Constraints.SyntacticallyCorrectXml' NBi.Xml.Systems.AbstractSystemUnderTestXml' NBi.Xml.Constraints.AbstractConstraintXml' NBi.NUnit.Query.SyntacticallyCorrectConstraint,NBi.Testing.Unit.NUnit.Builder.QuerySyntacticallyCorrectBuilderTest
NBi.NUnit.Builder,ExecutionFasterThanBuilder,0,4,1,0,1,28,7,0,3,-1,4,1,NBi.Xml.Constraints.FasterThanXml' NBi.Xml.Systems.AbstractSystemUnderTestXml' NBi.Xml.Constraints.AbstractConstraintXml' NBi.NUnit.Query.FasterThanConstraint,NBi.Testing.Unit.NUnit.Builder.QueryFasterThanBuilderTest
NBi.NUnit.Builder,ITestCaseBuilder,0,6,0,0,0,9,6,1,0,-1,3,2,NBi.Xml.Systems.AbstractSystemUnderTestXml' NBi.Xml.Constraints.AbstractConstraintXml' NBi.Framework.ITestConfiguration,NBi.NUnit.TestCaseFactory' NBi.NUnit.BuilderRegistration
NBi.NUnit.Builder,MembersCountBuilder,0,5,1,0,1,32,9,0,2,-1,5,1,NBi.Core.Analysis.Request.DiscoveryRequestFactory' NBi.Xml.Constraints.CountXml' NBi.Xml.Systems.AbstractSystemUnderTestXml' NBi.Xml.Constraints.AbstractConstraintXml' NBi.NUnit.Member.CountConstraint,NBi.Testing.Unit.NUnit.Builder.MembersCountBuilderTest
NBi.NUnit.Builder,ResultSetEqualToBuilder,0,5,2,0,1,85,13,2,2,-1,18,2,NBi.Xml.Constraints.EqualToXml' NBi.Xml.Systems.AbstractSystemUnderTestXml' NBi.Xml.Constraints.AbstractConstraintXml' NBi.NUnit.ResultSetComparison.BaseResultSetComparisonConstraint' NBi.Core.Transformation.TransformationProvider' NBi.Core.ResultSet.Equivalence.SettingsEquivalerBuilder' NBi.Core.ResultSet.ISettingsResultSet' NBi.Core.ResultSet.Equivalence.EquivalerFactory' NBi.Core.ResultSet.Equivalence.IEquivaler' NBi.Core.ResultSet.IColumnDefinition' NBi.Xml.Constraints.ComparisonBehavior' NBi.NUnit.Builder.Helper.ResultSetResolverArgsBuilder' NBi.Core.ResultSet.Resolver.ResultSetResolverFactory' NBi.Core.ResultSet.Resolver.IResultSetResolver' NBi.Core.ResultSet.ResultSetServiceBuilder' NBi.Core.ResultSet.IResultSetService' NBi.NUnit.ResultSetComparison.EqualToConstraint' NBi.Xml.Settings.SettingsXml,NBi.Testing.Unit.NUnit.Builder.ResultSetSupersetOfBuilderTest' NBi.Testing.Unit.NUnit.Builder.ResultSetEqualToBuilderTest
NBi.NUnit.Builder.Helper,ScalarResolverArgsBuilder,5,5,0,0,5,62,8,0,0,0,8,3,NBi.Xml.Settings.SettingsXml' NBi.Core.Scalar.Resolver.IScalarResolverArgs' NBi.NUnit.Builder.Helper.QueryResolverArgsBuilder' NBi.NUnit.Builder.Helper.ResultSetResolverArgsBuilder' NBi.Xml.Variables.ScriptXml' NBi.Core.Transformation.LanguageType' NBi.Xml.Items.ProjectionXml' NBi.Xml.Items.QueryXml,NBi.NUnit.Builder.ResultSetRowCountBuilder' NBi.NUnit.Builder.Helper.QueryResolverArgsBuilder' NBi.NUnit.Runtime.TestSuite
NBi.NUnit.Builder.Helper,ResultSetResolverArgsBuilder,5,9,0,0,5,97,20,0,0,0,20,5,NBi.Xml.Settings.SettingsXml' NBi.Core.ResultSet.Resolver.ResultSetResolverArgs' NBi.Xml.Systems.ResultSetSystemXml' NBi.Xml.Items.ResultSet.ResultSetXml' NBi.Xml.Items.QueryXml' NBi.Xml.Items.Xml.XmlSourceXml' NBi.Core.NBiTraceSwitch' NBi.Core.ResultSet.Resolver.ContentResultSetResolverArgs' NBi.Core.ResultSet.IContent' NBi.NUnit.Builder.Helper.QueryResolverArgsBuilder' NBi.Core.Query.Resolver.QueryResolverArgs' NBi.Core.ResultSet.Resolver.QueryResultSetResolverArgs' NBi.Core.ResultSet.Resolver.CsvResultSetResolverArgs' NBi.Core.Xml.SelectFactory' NBi.Core.Xml.XPathEngine' NBi.Xml.Items.Xml.XPathXml' NBi.Xml.Items.Xml.SelectXml' NBi.Xml.Items.Xml.FromXml' NBi.Xml.Items.UrlXml' NBi.Core.ResultSet.Resolver.XPathResultSetResolverArgs,NBi.NUnit.Builder.AbstractResultSetBuilder' NBi.NUnit.Builder.ResultSetSubsetOfBuilder' NBi.NUnit.Builder.ResultSetSupersetOfBuilder' NBi.NUnit.Builder.ResultSetEqualToBuilder' NBi.NUnit.Builder.Helper.ScalarResolverArgsBuilder
NBi.NUnit.Builder.Helper,QueryResolverArgsBuilder,5,7,0,0,6,89,12,0,0,0,11,4,NBi.Xml.Items.QueryXml' NBi.Xml.Settings.SettingsXml' NBi.Core.Query.Resolver.QueryResolverArgs' NBi.Xml.Items.AssemblyXml' NBi.Xml.Items.ReportXml' NBi.Xml.Items.SharedDatasetXml' NBi.NUnit.Builder.Helper.ScalarResolverArgsBuilder' NBi.Core.Scalar.Resolver.IScalarResolverArgs' NBi.Core.Scalar.Resolver.ScalarResolverFactory' NBi.Core.Scalar.Resolver.IScalarResolver' NBi.Xml.Items.QueryParameterXml,NBi.NUnit.Builder.AbstractResultSetBuilder' NBi.NUnit.Builder.AbstractExecutionBuilder' NBi.NUnit.Builder.Helper.ScalarResolverArgsBuilder' NBi.NUnit.Builder.Helper.ResultSetResolverArgsBuilder
NBi.NUnit.DataType,DescriptionDataTypeHelper,0,2,0,0,2,60,6,0,0,-1,2,1,NBi.Core.DataType.CaptionFilter' NBi.Core.DataType.Target,NBi.NUnit.DataType.IsConstraint
NBi.NUnit.DataType,IsConstraint,1,5,2,0,4,70,7,0,1,0,8,2,NBi.Core.DataType.DataTypeInfo' NBi.Core.DataType.DataTypeInfoFactory' NBi.Core.DataType.ILength' NBi.Core.DataType.IScale' NBi.Core.DataType.IPrecision' NBi.Core.DataType.IDataTypeDiscoveryCommand' NBi.NUnit.DataType.DescriptionDataTypeHelper' NBi.Core.DataType.CommandDescription,NBi.NUnit.Builder.DataTypeIsBuilder' NBi.Testing.Unit.NUnit.DataType.IsConstraintTest
NBi.NUnit,DifferedConstraint,2,2,0,0,2,17,2,0,0,0,1,7,NBi.Core.Scalar.Resolver.IScalarResolver,NBi.NUnit.Builder.ResultSetRowCountBuilder' NBi.NUnit.Query.RowCountConstraint' NBi.NUnit.Query.RowCountFilterConstraint' NBi.NUnit.Query.RowCountFilterPercentageConstraint' NBi.Testing.Unit.NUnit.Builder.ResultSetRowCountBuilderTest' NBi.Testing.Unit.NUnit.DifferedConstraintTest' NBi.Testing.Unit.NUnit.ResultSetComparison.RowCountConstraintTest
NBi.NUnit,NBiConstraint,0,1,2,0,1,8,1,12,0,-1,0,24,,NBi.NUnit.Builder.AbstractTestCaseBuilder' NBi.NUnit.Query.RowCountConstraint' NBi.NUnit.Query.UniqueRowsConstraint' NBi.NUnit.Query.EvaluateRowsConstraint' NBi.NUnit.ResultSetComparison.BaseResultSetComparisonConstraint' NBi.Testing.Unit.NUnit.Builder.ResultSetAllRowsBuilderTest' NBi.Testing.Unit.NUnit.Builder.ResultSetSomeRowsBuilderTest' NBi.Testing.Unit.NUnit.Builder.ResultSetUniqueRowsBuilderTest' NBi.Testing.Unit.NUnit.Builder.ResultSetSingleRowBuilderTest' NBi.Testing.Unit.NUnit.Builder.ResultSetSupersetOfBuilderTest' NBi.Testing.Unit.NUnit.Builder.ResultSetRowCountBuilderTest' NBi.Testing.Unit.NUnit.Builder.ExecutionMatchPatternBuilderTest' NBi.Testing.Unit.NUnit.Builder.MembersMatchPatternBuilderTest' NBi.Testing.Unit.NUnit.Builder.MembersEquivalentToBuilderTest' NBi.Testing.Unit.NUnit.Builder.StructureContainedInBuilderTest' NBi.Testing.Unit.NUnit.Builder.StructureEquivalentToBuilderTest' NBi.Testing.Unit.NUnit.Builder.QuerySyntacticallyCorrectBuilderTest' NBi.Testing.Unit.NUnit.Builder.QueryFasterThanBuilderTest' NBi.Testing.Unit.NUnit.Builder.ResultSetEqualToBuilderTest' NBi.Testing.Unit.NUnit.Builder.StructureExistsBuilderTest' NBi.Testing.Unit.NUnit.Builder.MembersContainsBuilderTest' NBi.Testing.Unit.NUnit.Builder.MembersOrderedBuilderTest' NBi.Testing.Unit.NUnit.Builder.MembersCountBuilderTest' NBi.Testing.Unit.NUnit.Builder.StructureContainBuilderTest
NBi.NUnit,TestCase,0,1,2,0,1,10,1,0,0,-1,0,3,,NBi.NUnit.TestCaseFactory' NBi.NUnit.Runtime.TestSuite' NBi.Testing.Unit.NUnit.TestCaseFactoryTest
NBi.NUnit,TestCaseFactory,3,7,0,0,3,140,14,0,0,0.29,35,2,NBi.Framework.ITestConfiguration' NBi.Xml.Systems.ExecutionXml' NBi.Xml.Constraints.FasterThanXml' NBi.Xml.Constraints.SyntacticallyCorrectXml' NBi.Xml.Constraints.SuccessfulXml' NBi.Xml.Constraints.MatchPatternXml' NBi.Xml.Constraints.EvaluateRowsXml' NBi.Xml.Constraints.EqualToXml' NBi.Xml.Constraints.SupersetOfXml' NBi.Xml.Constraints.SubsetOfXml' NBi.Xml.Constraints.RowCountXml' NBi.Xml.Constraints.AllRowsXml' NBi.Xml.Constraints.NoRowsXml' NBi.Xml.Constraints.SomeRowsXml' NBi.Xml.Constraints.SingleRowXml' NBi.Xml.Constraints.UniqueRowsXml' NBi.Xml.Systems.ResultSetSystemXml' NBi.Xml.Systems.MembersXml' NBi.Xml.Constraints.CountXml' NBi.Xml.Constraints.OrderedXml' NBi.Xml.Constraints.ContainXml' NBi.Xml.Constraints.ContainedInXml' NBi.Xml.Constraints.SubsetOf1xXml' NBi.Xml.Constraints.EquivalentToXml' NBi.Xml.Systems.StructureXml' NBi.Xml.Constraints.ExistsXml' NBi.Xml.Constraints.LinkedToXml' NBi.Xml.Systems.DataTypeXml' NBi.Xml.Constraints.IsXml' NBi.NUnit.BuilderRegistration' NBi.NUnit.Builder.ITestCaseBuilder' NBi.NUnit.Builder.ITestCaseBuilderChooser' NBi.Xml.Systems.AbstractSystemUnderTestXml' NBi.Xml.Constraints.AbstractConstraintXml' NBi.NUnit.TestCase,NBi.NUnit.Runtime.TestSuite' NBi.Testing.Unit.NUnit.TestCaseFactoryTest
NBi.NUnit,BuilderRegistration,0,3,4,0,2,23,3,0,0,-1,2,2,NBi.NUnit.Builder.ITestCaseBuilder' NBi.NUnit.Builder.ITestCaseBuilderChooser,NBi.NUnit.Builder.ExecutionFasterThanChooser' NBi.NUnit.TestCaseFactory
NBi.NUnit,WriterHelper,0,0,0,0,0,10,0,0,0,-1,0,0,,
NBi.NUnit,NothingFoundMessage,0,1,0,0,1,7,1,0,0,-1,0,0,,
NBi.NUnit.Query,RowCountConstraint,4,8,2,0,5,85,9,1,1,0.38,10,4,NBi.Core.ResultSet.ResultSet' NBi.NUnit.DifferedConstraint' NBi.Framework.FailureMessage.IDataRowsMessageFormatter' NBi.Framework.FailureMessage.DataRowsMessageFormatterFactory' NBi.Framework.ITestConfiguration' NBi.Core.ResultSet.EngineStyle' NBi.Core.ResultSet.IResultSetService' NBi.Framework.IFailureReportProfile' NBi.Framework.FailureReportMode' NBi.NUnit.NBiConstraint,NBi.NUnit.Builder.ResultSetRowCountBuilder' NBi.NUnit.Query.RowCountFilterConstraint' NBi.Testing.Unit.NUnit.Builder.ResultSetRowCountBuilderTest' NBi.Testing.Unit.NUnit.ResultSetComparison.RowCountConstraintTest
NBi.NUnit.Query,SingleRowConstraint,0,5,0,0,4,31,9,0,1,-1,5,3,NBi.Core.Calculation.IResultSetFilter' NBi.Core.ResultSet.ResultSet' NBi.Framework.IFailureReportProfile' NBi.Framework.ITestConfiguration' NBi.Framework.FailureReportFormat,NBi.NUnit.Builder.ResultSetSingleRowBuilder' NBi.Testing.Unit.NUnit.Builder.ResultSetSingleRowBuilderTest' NBi.Testing.Unit.NUnit.ResultSetComparison.SingleRowConstraintTest
NBi.NUnit.Query,SomeRowsConstraint,0,5,0,0,4,28,8,0,1,-1,5,3,NBi.Core.Calculation.IResultSetFilter' NBi.Core.ResultSet.ResultSet' NBi.Framework.IFailureReportProfile' NBi.Framework.ITestConfiguration' NBi.Framework.FailureReportFormat,NBi.NUnit.Builder.ResultSetSomeRowsBuilder' NBi.Testing.Unit.NUnit.Builder.ResultSetSomeRowsBuilderTest' NBi.Testing.Unit.NUnit.ResultSetComparison.SomeRowsConstraintTest
