Project,Namespace,Ca types,Ce types
TinCanAPILibrary,RusticiSoftware.TinCanAPILibrary.Helper,RusticiSoftware.TinCanAPILibrary.Model.ActivityDefinition' RusticiSoftware.TinCanAPILibrary.Model.InteractionDefinition' RusticiSoftware.TinCanAPILibrary.TCAPI' RusticiSoftware.TinCanAPILibrary.TypeConverters.NullableDateTimeJsonConverter,
TinCanAPILibrary,RusticiSoftware.ScormContentPlayer.Util,RusticiSoftware.TinCanAPILibrary.TypeConverters.NullableDateTimeJsonConverter,
TinCanAPILibrary,RusticiSoftware.TinCanAPILibrary.Json,RusticiSoftware.TinCanAPILibrary.TinCanJsonConverter' RusticiSoftware.TinCanAPILibrary.ActivityDefinitionConverter' RusticiSoftware.TinCanAPILibrary.LanguageMapConverter' RusticiSoftware.TinCanAPILibrary.TinCanActorJsonConverter' RusticiSoftware.TinCanAPILibrary.TinCanStatementTargetJsonConverter' RusticiSoftware.TinCanAPILibrary.TypeConverters.NullableBooleanJsonConverter' RusticiSoftware.TinCanAPILibrary.TypeConverters.NullableDateTimeJsonConverter' RusticiSoftware.TinCanAPILibrary.TypeConverters.NullableDoubleJsonConverter' RusticiSoftware.TinCanAPILibrary.TypeConverters.NullableIntegerJsonConverter' RusticiSoftware.TinCanAPILibrary.TypeConverters.NullableScormTimeSpanJsonConverter,
TinCanAPILibrary,RusticiSoftware.TinCanAPILibrary,RusticiSoftware.TinCanAPILibrary.Model.StatementQueryObject' UnitTests.TCAPIFixture' TinCanAPILibraryUnitTests.JSONConverter.JSON.TinCanConverter.TinCanJsonConverterFixture,RusticiSoftware.TinCanAPILibrary.Model.NullableBoolean' RusticiSoftware.TinCanAPILibrary.Model.NullableInteger' RusticiSoftware.TinCanAPILibrary.Model.NullableDouble' RusticiSoftware.TinCanAPILibrary.Model.NullableDateTime' RusticiSoftware.TinCanAPILibrary.Model.NullableScormTimeSpan' RusticiSoftware.TinCanAPILibrary.Json.JsonConverter' RusticiSoftware.TinCanAPILibrary.Model.StatementTarget' RusticiSoftware.TinCanAPILibrary.Model.Activity' RusticiSoftware.TinCanAPILibrary.Model.StatementRef' RusticiSoftware.TinCanAPILibrary.Model.Actor' RusticiSoftware.TinCanAPILibrary.Model.Group' RusticiSoftware.TinCanAPILibrary.Model.LanguageMap' RusticiSoftware.TinCanAPILibrary.Model.ActivityDefinition' RusticiSoftware.TinCanAPILibrary.Model.InteractionDefinition' RusticiSoftware.TinCanAPILibrary.Model.TinCan090.Actor' RusticiSoftware.TinCanAPILibrary.Model.TinCan090.Person' RusticiSoftware.TinCanAPILibrary.Model.TinCan090.TargetedStatement
TinCanAPILibrary,RusticiSoftware.TinCanAPILibrary.TypeConverters,,RusticiSoftware.TinCanAPILibrary.Model.NullableBoolean' RusticiSoftware.TinCanAPILibrary.Json.JsonConverter' RusticiSoftware.ScormContentPlayer.Util.ParserUtil' RusticiSoftware.TinCanAPILibrary.Model.NullableDateTime' RusticiSoftware.TinCanAPILibrary.Helper.Constants' RusticiSoftware.TinCanAPILibrary.Model.NullableDouble' RusticiSoftware.TinCanAPILibrary.Model.NullableInteger' RusticiSoftware.TinCanAPILibrary.Model.NullableScormTimeSpan' RusticiSoftware.TinCanAPILibrary.Model.ScormTimeSpan
TinCanAPILibrary,RusticiSoftware.TinCanAPILibrary.Model,RusticiSoftware.TinCanAPILibrary.TCAPI' RusticiSoftware.TinCanAPILibrary.TinCanJsonConverter' RusticiSoftware.TinCanAPILibrary.TinCanStatementTargetJsonConverter' RusticiSoftware.TinCanAPILibrary.TypeFieldJsonHelper' UnitTests.TCAPIFixture' TinCanAPILibraryUnitTests.JSONConverter.JSON.TinCanConverter.TinCanJsonConverterFixture' TinCanAPILibraryUnitTests.Model.StatementFixture' RusticiSoftware.TinCanAPILibrary.ActivityDefinition_JsonTarget' RusticiSoftware.TinCanAPILibrary.TinCanActorJsonConverter' RusticiSoftware.TinCanAPILibrary.TinCanActor_JsonTarget' RusticiSoftware.TinCanAPILibrary.Model.TinCan090.Actor' RusticiSoftware.TinCanAPILibrary.Model.TinCan090.Person' RusticiSoftware.TinCanAPILibrary.Model.TinCan090.Statement' RusticiSoftware.TinCanAPILibrary.ActivityDefinitionConverter' RusticiSoftware.TinCanAPILibrary.LanguageMapConverter' RusticiSoftware.TinCanAPILibrary.AsyncPostCallback' RusticiSoftware.TinCanAPILibrary.JsonConverterBase' RusticiSoftware.TinCanAPILibrary.TypeConverters.NullableBooleanJsonConverter' RusticiSoftware.TinCanAPILibrary.TypeConverters.NullableDateTimeJsonConverter' RusticiSoftware.TinCanAPILibrary.TypeConverters.NullableDoubleJsonConverter' RusticiSoftware.TinCanAPILibrary.TypeConverters.NullableIntegerJsonConverter' RusticiSoftware.TinCanAPILibrary.TypeConverters.NullableScormTimeSpanJsonConverter,RusticiSoftware.TinCanAPILibrary.Helper.CommonFunctions' RusticiSoftware.TinCanAPILibrary.Model.TinCan090.TargetedStatement' RusticiSoftware.TinCanAPILibrary.Model.TinCan090.StatementVerb
TinCanAPILibrary,RusticiSoftware.TinCanAPILibrary.Model.TinCan090,RusticiSoftware.TinCanAPILibrary.TCAPI' RusticiSoftware.TinCanAPILibrary.TinCanJsonConverter' RusticiSoftware.TinCanAPILibrary.TinCan090Actor_JsonTarget' RusticiSoftware.TinCanAPILibrary.TypeFieldJsonHelper' RusticiSoftware.TinCanAPILibrary.Model.StatementVerb' RusticiSoftware.TinCanAPILibrary.Model.Statement,RusticiSoftware.TinCanAPILibrary.Model.AgentAccount' RusticiSoftware.TinCanAPILibrary.Model.ValidationFailure' RusticiSoftware.TinCanAPILibrary.Model.StatementTarget' RusticiSoftware.TinCanAPILibrary.Model.Result' RusticiSoftware.TinCanAPILibrary.Model.Context' RusticiSoftware.TinCanAPILibrary.Model.NullableDateTime' RusticiSoftware.TinCanAPILibrary.Model.NullableBoolean' RusticiSoftware.TinCanAPILibrary.Model.IValidatable
