Project,Namespace,Ca types,Ce types
Keyczar,Keyczar,KeyczarTool.UseKey' KeyczarTest.CreateDataManageTest' KeyczarTest.SignerAttachedTest' KeyczarTest.StreamBehaviorTest' KeyczarTest.CollisionTest' KeyczarTest.DsaJavaJunkTest' KeyczarTest.SessionDecryptTest' KeyczarTest.Interop.PublicVerifierFullInterop' KeyczarTest.Interop.VerifierFullInterop' KeyczarTest.Unofficial.BsonSessionDecryptTest' Keyczar.Pbe.PbeKeyStore' KeyczarTool.AddKey' KeyczarTool.Export' KeyczarTool.ImportKey' KeyczarTool.PubKey' KeyczarTest.CertificateImportTest' KeyczarTest.CrossCompatibilityTest' KeyczarTest.CrypterTest' KeyczarTest.FallbackTest' KeyczarTest.PerfTest' KeyczarTest.PkcsImportTest' KeyczarTest.RsaPaddingTest' KeyczarTest.SessionTest' KeyczarTest.ToolTest' KeyczarTest.Interop.AesCrypted' KeyczarTest.Interop.AesNoPrimary' KeyczarTest.Interop.CrypterBasicInterop' KeyczarTest.Unofficial.BlobKeySetTest' KeyczarTest.Unofficial.WebKeySetTest' Keyczar.Crypto.DsaPublicKey' Keyczar.Compat.ImportedKeySet' Keyczar.Crypto.AesKey' Keyczar.Crypto.DsaPrivateKey' Keyczar.Crypto.HmacSha1Key' Keyczar.Crypto.ISignerKey' Keyczar.Crypto.IVerifierKey' Keyczar.Crypto.IEncrypterKey' Keyczar.Crypto.ICrypterKey' Keyczar.Crypto.RsaPrivateKey' Keyczar.Crypto.RsaPrivateSignKeyBase<TPublicKey>' Keyczar.Crypto.RsaPublicKey' Keyczar.Crypto.RsaPublicSignKeyBase' Keyczar.Pbe.PbeAesKey' Keyczar.Unofficial.AesAeadKey' Keyczar.Unofficial.RsaPublicSignKey' Keyczar.Util.Utility' KeyczarTest.StdNET40AESKey' KeyczarTest.KeySetTest' Keyczar.Compat.Export' Keyczar.Compat.VanillaSigner' Keyczar.Compat.VanillaVerifier' KeyczarTool.Commands.Password' KeyczarTest.GetPrimary' Keyczar.Compat.Importer' Keyczar.Unofficial.BsonSessionKeyPacker' Keyczar.Unofficial.KeyPack' KeyczarTest.ExportTest' KeyczarTest.SignerTest' KeyczarTool.Create' KeyczarTool.Demote' KeyczarTool.Promote' KeyczarTool.Revoke' Keyczar.Unofficial.BlobKeySetWriter' KeyczarTest.CreateDataToolTest' Keyczar.Unofficial.UnofficialKeyType' KeyczarTest.Interop.CrypterFullInterop' KeyczarTest.SignerTimeoutTest' KeyczarTest.Interop.PublicVerifierBasicInterop' KeyczarTest.Interop.VerifierBasicInterop' Keyczar.Util.WebBase64JsonConverter' KeyczarTest.SignerVanillaTest,Keyczar.Util.Utility' Keyczar.Crypto.Streams.HashingStream' Keyczar.Crypto.ISignerKey' Keyczar.Util.ReadOnlyArray' Keyczar.Util.NondestructiveBinaryReader' Keyczar.Util.NondestructivePositionLengthLimitingStream' Keyczar.Crypto.Streams.VerifyingStream' Keyczar.Util.NondestructiveStreamReset' Keyczar.Crypto.ICrypterKey' Keyczar.Crypto.Streams.FinishingStream' Keyczar.Crypto.IEncrypterKey' Keyczar.Util.WebSafeBase64' Keyczar.Crypto.IPrivateKey' Keyczar.Util.CachedPrompt' Keyczar.Pbe.PbeKeyStore' Keyczar.Unofficial.UnofficialKeyType' Keyczar.Compat.ImportedKeySet' Keyczar.Util.Secure' Keyczar.Crypto.AesKey' Keyczar.Crypto.HmacSha1Key' Keyczar.Crypto.IVerifierKey
Keyczar,Keyczar.Compat,Keyczar.SessionCrypter' KeyczarTool.ImportKey' KeyczarTest.CertificateImportTest' KeyczarTest.PkcsImportTest' KeyczarTool.UseKey' KeyczarTest.SignerVanillaTest' KeyczarTest.StreamBehaviorTest' KeyczarTest.Interop.PublicVerifierFullInterop' KeyczarTest.Interop.VerifierFullInterop,Keyczar.Crypto.DsaPublicKey' Keyczar.Crypto.IRsaPublicKey' Keyczar.Crypto.DsaPrivateKey' Keyczar.Crypto.IRsaPrivateKey' Keyczar.KeyVersion' Keyczar.KeyMetadata' Keyczar.IKeySet' Keyczar.KeyStatus' Keyczar.Key' Keyczar.KeyType' Keyczar.Util.Secure' Keyczar.Crypto.IPrivateKey' Keyczar.KeyPurpose' Keyczar.Keyczar' Keyczar.Util.NondestructiveStreamReset' Keyczar.Util.CachedPrompt' Keyczar.Util.Utility' Keyczar.Crypto.Streams.HashingStream' Keyczar.Crypto.Streams.VerifyingStream
Keyczar,Keyczar.Crypto,Keyczar.NonceSessionMaterial' Keyczar.NonceSignedSessionPacker' Keyczar.SimpleAesHmacSha1KeyPacker' Keyczar.Pbe.PbeAesKey' Keyczar.Compat.Export' KeyczarTest.StdNET40AESKey' Keyczar.AttachedSignerHelper' Keyczar.Signer' Keyczar.Verifier' Keyczar.Encrypter' Keyczar.Crypter' Keyczar.MutableKeySet,Keyczar.Util.Utility' Keyczar.Keyczar' Keyczar.Util.Secure' Keyczar.KeyType' Keyczar.Crypto.Streams.HashingStream' Keyczar.Crypto.Streams.VerifyingStream' Keyczar.Crypto.Streams.SymmetricStream' Keyczar.Crypto.Streams.DigestStream' Keyczar.KeyczarConfig' Keyczar.Crypto.Streams.HmacStream' Keyczar.Crypto.Streams.FinishingStream' Keyczar.Crypto.Streams.AsymmetricStream
Keyczar,Keyczar.Crypto.Streams,Keyczar.Crypto.RsaPrivateKey' Keyczar.Crypto.RsaPublicKey' Keyczar.Crypto.DsaPrivateKey' Keyczar.Crypto.DsaPublicKey' Keyczar.Crypto.RsaPrivateSignKeyBase<TPublicKey>' Keyczar.Crypto.RsaPublicSignKeyBase' Keyczar.Crypter' Keyczar.Encrypter' Keyczar.Unofficial.SymmetricAeadStream' Keyczar.AttachedSignerHelper' Keyczar.Signer' Keyczar.TimeoutSignerHelper' Keyczar.Compat.VanillaSigner' Keyczar.Crypto.AesKey' Keyczar.Crypto.HmacSha1Key' Keyczar.Pbe.PbeAesKey' Keyczar.HelperAttachedVerify' Keyczar.TimeoutVerifierHelper' Keyczar.Verifier' Keyczar.Compat.VanillaVerifier,Keyczar.Util.Secure
Keyczar,Keyczar.Pbe,Keyczar.PbeKeySetWriter,Keyczar.Crypter' Keyczar.Util.Secure' Keyczar.KeyPurpose' Keyczar.Keyczar' Keyczar.Key' Keyczar.Util.ReadOnlyArray' Keyczar.KeyType' Keyczar.Util.Utility' Keyczar.Crypto.Streams.CipherTextOnlyFinishingStream' Keyczar.Crypto.AesKey
Keyczar,Keyczar.Unofficial,Keyczar.KeyType' KeyczarTool.Create' KeyczarTest.CreateDataManageTest' KeyczarTest.SessionTest' KeyczarTest.Unofficial.WebKeySetTest,Keyczar.Util.Secure' Keyczar.Util.Utility' Keyczar.Keyczar' Keyczar.KeyMetadata' Keyczar.Key' Keyczar.KeyType' Keyczar.Crypto.Streams.FinishingStream' Keyczar.KeyTypeSpec
Keyczar,Keyczar.Util,Keyczar.PbeKeySetWriter' Keyczar.PbeKeySet' Keyczar.Compat.Importer' KeyczarTool.AddKey' KeyczarTool.Export' KeyczarTool.ImportKey' KeyczarTool.PubKey' KeyczarTool.UseKey' KeyczarTool.Commands.Password' Keyczar.AttachedSignerHelper' Keyczar.HelperAttachedVerify' Keyczar.Crypter' Keyczar.Encrypter' Keyczar.Signer' Keyczar.TimeoutVerifier' Keyczar.Verifier' Keyczar.Pbe.PbeKeyStore' Keyczar.NonceSessionMaterial' Keyczar.WebBase64' Keyczar.Compat.Export' Keyczar.Crypto.AesKey' Keyczar.Crypto.DsaPrivateKey' Keyczar.Crypto.HmacSha1Key' Keyczar.Crypto.RsaPrivateSignKeyBase<TPublicKey>' Keyczar.Crypto.Streams.HmacStream' Keyczar.Pbe.PbeAesKey' Keyczar.Unofficial.AesAeadKey' Keyczar.Unofficial.SymmetricAeadStream' KeyczarTest.SecureTest' Keyczar.Keyczar' Keyczar.MutableKeySet' Keyczar.SimpleAesHmacSha1KeyPacker' Keyczar.TimeoutSignerHelper' Keyczar.Crypto.DsaPublicKey' Keyczar.Crypto.RsaPublicKey' Keyczar.Unofficial.BsonSessionKeyPacker' Keyczar.Unofficial.RsaPublicSignKey' KeyczarTest.CreateDataManageTest' KeyczarTest.StreamBehaviorTest' Keyczar.EncryptedKeySet' Keyczar.EncryptedKeySetWriter,Keyczar.Keyczar' Keyczar.WebBase64
