Namespace,Type,NOF,NOM,NOP,NOPF,NOPM,LOC,WMC,NC,DIT,LCOM,Fan-Out,Fan-In,Fan-Out types,Fan-In types
OSAE.UI.Controls,AddControlBrowser,16,12,0,0,2,361,30,0,0,0,6,1,OSAE.OSAESql' OSAE.OSAEObjectManager' OSAE.OSAEObjectPropertyManager' OSAE.OSAEScreenControlManager' OSAE.OSAEObjectProperty' OSAE.OSAEObject,Screens.MainWindow
OSAE.UI.Controls,AddControlClickImage,60,25,0,0,2,1067,54,0,0,0.12,10,1,OSAE.OSAEImage' OSAE.OSAESql' OSAE.OSAEImageManager' OSAE.OSAEObjectProperty' OSAE.OSAEObjectPropertyManager' OSAE.OSAEObjectManager' OSAE.OSAEScreenControlManager' OSAE.OSAEObject' OSAE.UI.Controls.selectImageWindow' OSAE.UI.Controls.ctrlSelectImage,Screens.MainWindow
OSAE.UI.Controls,AddControlNavigationImage,18,18,0,0,2,442,39,0,0,0.11,10,1,OSAE.OSAEImage' OSAE.OSAESql' OSAE.OSAEImageManager' OSAE.OSAEObjectProperty' OSAE.OSAEObjectPropertyManager' OSAE.UI.Controls.selectImageWindow' OSAE.UI.Controls.ctrlSelectImage' OSAE.OSAEObjectManager' OSAE.OSAEScreenControlManager' OSAE.OSAEObject,Screens.MainWindow
OSAE.UI.Controls,AddControlPropertyLabel,33,16,0,0,2,671,38,0,0,0,7,1,OSAE.OSAESql' OSAE.OSAEImageManager' OSAE.OSAEObjectProperty' OSAE.OSAEObjectPropertyManager' OSAE.OSAEObjectManager' OSAE.OSAEScreenControlManager' OSAE.OSAEObject,Screens.MainWindow
OSAE.UI.Controls,AddControlStateImage,55,37,0,0,2,1366,97,0,0,0,10,1,OSAE.OSAEImage' OSAE.OSAEObjectManager' OSAE.OSAEImageManager' OSAE.OSAEObjectProperty' OSAE.OSAEObjectPropertyManager' OSAE.OSAESql' OSAE.UI.Controls.selectImageWindow' OSAE.UI.Controls.ctrlSelectImage' OSAE.OSAEScreenControlManager' OSAE.OSAEObject,Screens.MainWindow
OSAE.UI.Controls,AddControlTimerLabel,21,16,0,0,2,482,35,0,0,0,6,1,OSAE.OSAESql' OSAE.OSAEObjectManager' OSAE.OSAEObjectPropertyManager' OSAE.OSAEScreenControlManager' OSAE.OSAEObject' OSAE.OSAEObjectProperty,Screens.MainWindow
OSAE.UI.Controls,AddControlUserControl,17,7,0,0,2,266,13,0,0,0.29,3,1,OSAE.UserControlServices' OSAE.GlobalUserControls' PluginInterface.IPlugin,Screens.MainWindow
OSAE.UI.Controls,AddNewCameraViewer,19,13,0,0,2,393,30,0,0,0,6,1,OSAE.OSAESql' OSAE.OSAEObjectProperty' OSAE.OSAEObjectPropertyManager' OSAE.OSAEObjectManager' OSAE.OSAEScreenControlManager' OSAE.OSAEObject,Screens.MainWindow
OSAE.UI.Controls,AddNewObject,18,10,0,0,2,336,16,0,0,0,2,0,OSAE.OSAESql' OSAE.OSAEObjectManager,
OSAE.UI.Controls,BrowserFrame,6,3,1,4,2,65,5,0,0,0,2,1,OSAE.OSAEObjectProperty' OSAE.OSAEObject,Screens.MainWindow
OSAE.UI.Controls,ctrlChangeScreen,4,8,0,0,2,137,14,0,0,0.38,6,0,OSAE.OSAEImageManager' OSAE.OSAEObjectCollection' OSAE.OSAEImage' OSAE.OSAEObjectManager' OSAE.OSAEObjectProperty' OSAE.OSAEObject,
OSAE.UI.Controls,AddControlScreen,16,15,0,1,2,361,33,0,0,0.13,10,1,OSAE.OSAEImage' OSAE.OSAEImageManager' OSAE.OSAESql' OSAE.OSAEObjectManager' OSAE.OSAEObjectPropertyManager' OSAE.OSAEObject' OSAE.OSAEObjectCollection' OSAE.UI.Controls.selectImageWindow' OSAE.UI.Controls.ctrlSelectImage' OSAE.OSAEObjectProperty,Screens.MainWindow
OSAE.UI.Controls,Logs,4,8,0,0,3,146,10,0,0,0,2,0,OSAE.OSAESql' OSAE.General.OSAELog,
OSAE.UI.Controls,ClickImage,26,5,1,3,2,239,23,0,0,0,7,1,OSAE.OSAEImageManager' OSAE.OSAEObjectProperty' OSAE.OSAEObject' OSAE.OSAEImage' OSAE.UI.Controls.ParamInput' OSAE.OSAEObjectPropertyManager' OSAE.OSAEMethodManager,Screens.MainWindow
OSAE.UI.Controls,ObjectList,8,3,0,4,2,84,5,0,0,0,1,0,OSAE.OSAEImageManager,
OSAE.UI.Controls,ScreenObjectList,17,8,1,9,2,223,14,0,0,0.25,4,1,OSAE.OSAEObjectManager' OSAE.OSAEObject' OSAE.OSAESql' OSAE.OSAEObjectPropertyManager,Screens.MainWindow
OSAE.UI.Controls,UserSelector,25,19,1,5,2,487,29,0,0,0.11,5,1,OSAE.OSAEImageManager' OSAE.OSAEObjectProperty' OSAE.OSAEObjectPropertyManager' OSAE.OSAEObjectManager' OSAE.OSAEObject,Screens.MainWindow
OSAE.UI.Controls,NavigationImage,6,3,2,3,2,81,6,0,0,0,4,1,OSAE.OSAEImageManager' OSAE.OSAEObjectProperty' OSAE.OSAEObject' OSAE.OSAEImage,Screens.MainWindow
OSAE.UI.Controls,ParamInput,13,7,0,0,2,235,17,0,0,0,3,1,OSAE.OSAEObjectProperty' OSAE.OSAEObject' OSAE.OSAEMethodManager,OSAE.UI.Controls.ClickImage
OSAE.UI.Controls,PropertyLabel,8,4,1,2,3,172,14,0,0,0,5,1,OSAE.OSAEObjectProperty' OSAE.OSAEObject' OSAE.OSAEObjectState' OSAE.OSAEObjectStateManager' OSAE.OSAEObjectPropertyManager,Screens.MainWindow
OSAE.UI.Controls,ctrlSelectImage,5,9,0,0,2,182,16,0,0,0.33,1,4,OSAE.OSAEImageManager,OSAE.UI.Controls.AddControlClickImage' OSAE.UI.Controls.AddControlNavigationImage' OSAE.UI.Controls.AddControlStateImage' OSAE.UI.Controls.AddControlScreen
OSAE.UI.Controls,selectImageWindow,1,0,0,1,0,4,0,0,0,-1,0,4,,OSAE.UI.Controls.AddControlClickImage' OSAE.UI.Controls.AddControlNavigationImage' OSAE.UI.Controls.AddControlStateImage' OSAE.UI.Controls.AddControlScreen
OSAE.UI.Controls,StateImage,30,9,1,15,3,427,34,0,0,0,11,1,OSAE.OSAEObject' OSAE.OSAEObjectProperty' OSAE.OSAEObjectManager' OSAE.OSAEObjectState' OSAE.OSAEObjectStateManager' OSAE.OSAEObjectPropertyManager' OSAE.OSAEImageManager' OSAE.OSAEImage' OSAE.OSAEObjectTypeManager' OSAE.OSAESql' OSAE.OSAEMethodManager,Screens.MainWindow
OSAE.UI.Controls,StaticLabel,4,3,1,2,2,99,9,0,0,0,2,1,OSAE.OSAEObjectProperty' OSAE.OSAEObject,Screens.MainWindow
OSAE.UI.Controls,TimerLabel,10,5,2,2,3,150,13,0,0,0,5,1,OSAE.OSAEObjectProperty' OSAE.OSAEObject' OSAE.OSAEObjectStateManager' OSAE.OSAEObjectState' OSAE.OSAEObjectPropertyManager,Screens.MainWindow
OSAE.UI.Controls,VideoStreamViewer,14,7,0,4,3,145,13,0,0,0,4,1,OSAE.OSAEObject' OSAE.General.OSAELog' OSAE.OSAEObjectProperty' OSAE.OSAEObjectPropertyManager,Screens.MainWindow
