Project,Namespace,Ca types,Ce types
Orchard.Users,Orchard.Users.Commands,,Orchard.Security.IMembershipService' Orchard.Users.Services.IUserService' Orchard.Security.IUser' Orchard.Commands.CommandContext
Orchard.Users,Orchard.Users.Controllers,,Orchard.Security.IAuthenticationService' Orchard.Security.IMembershipService' Orchard.Users.Services.IUserService' Orchard.IOrchardServices' Orchard.Users.Events.IUserEventHandler' Orchard.Logging.NullLogger' Orchard.Localization.NullLocalizer' Orchard.Security.IUser' Orchard.Logging.ILogger' Orchard.Localization.LocalizedString' Orchard.Mvc.ShapeResult' Orchard.Users.Models.RegistrationSettingsPart' Orchard.Settings.ISite' Orchard.WorkContext' Orchard.Users.Models.UserPart' Orchard.Users.Models.UserStatus' Orchard.Core.Settings.Models.SiteSettings2Part' Orchard.UI.Notify.INotifier' Orchard.Settings.ISiteService' Orchard.DisplayManagement.IShapeFactory' Orchard.UI.Navigation.Pager' Orchard.ContentManagement.IContentQuery' Orchard.Users.ViewModels.UsersIndexViewModel' Orchard.Security.IAuthorizer' Orchard.Security.StandardPermissions' Orchard.ContentManagement.IContentManager' Orchard.Users.ViewModels.UserIndexOptions' Orchard.Users.ViewModels.UsersFilter' Orchard.Users.Models.UserPartRecord' Orchard.Users.ViewModels.UsersOrder' Orchard.UI.Navigation.PagerParameters' Orchard.Users.ViewModels.UserEntry' Orchard.Users.ViewModels.UsersBulkAction' Orchard.Users.ViewModels.UserCreateViewModel' Orchard.Data.ITransactionManager' Orchard.Users.ViewModels.UserEditViewModel' Orchard.ContentManagement.VersionOptions' Orchard.Core.Settings.Models.SiteSettingsPart
Orchard.Users,Orchard.Users.Drivers,,Orchard.Users.Models.UserPartRecord' Orchard.Users.Models.UserPart' Orchard.ContentManagement.Handlers.ImportContentContext' Orchard.ContentManagement.MetaData.Models.ContentPartDefinition' Orchard.Users.Models.UserStatus' Orchard.ContentManagement.Handlers.ExportContentContext
Orchard.Users,Orchard.Users.Handlers,,Orchard.IOrchardServices' Orchard.Logging.NullLogger' Orchard.Localization.NullLocalizer' Orchard.Security.CheckAccessContext' Orchard.ContentManagement.IContentManager' Orchard.Settings.ISiteService' Orchard.Users.Models.UserPart' Orchard.Messaging.Models.MessageContext' Orchard.Users.Models.MessageTypes' Orchard.Localization.LocalizedString' Orchard.Users.Models.RegistrationSettingsPart' Orchard.Settings.ISite' Orchard.ContentManagement.ContentItem' Orchard.ContentManagement.Records.ContentItemRecord' Orchard.ContentManagement.Handlers.StorageFilter' Orchard.Data.IRepository' Orchard.ContentManagement.Handlers.GetContentItemMetadataContext' Orchard.ContentManagement.Handlers.ContentHandler' Orchard.ContentManagement.ContentItemMetadata' Orchard.ContentManagement.ContentIdentity
Orchard.Users,Orchard.Users,,Orchard.Data.Migration.Schema.SchemaBuilder' Orchard.Data.Migration.Schema.CreateTableCommand' Orchard.Data.Migration.Schema.CreateColumnCommand' Orchard.ContentManagement.MetaData.IContentDefinitionManager' Orchard.ContentManagement.MetaData.Builders.ContentTypeDefinitionBuilder' Orchard.UI.Navigation.NavigationBuilder' Orchard.UI.Navigation.NavigationItemBuilder' Orchard.Security.StandardPermissions
Orchard.Users,Orchard.Users.Events,Orchard.Users.Services.MembershipService' Orchard.Users.Controllers.AccountController' Orchard.Users.Controllers.AdminController,Orchard.Security.IUser
Orchard.Users,Orchard.Users.Models,Orchard.Users.Handlers.UserMessagesAlteration' Orchard.Users.Services.MembershipService' Orchard.Users.Services.UserService' Orchard.Users.Controllers.AccountController' Orchard.Users.Services.MissingSettingsBanner' Orchard.Users.Controllers.AdminController' Orchard.Users.Drivers.UserPartDriver' Orchard.Users.Handlers.UserPartHandler' Orchard.Users.Services.UserResolverSelector,
Orchard.Users,Orchard.Users.Services,Orchard.Users.Commands.UserCommands' Orchard.Users.Controllers.AccountController' Orchard.Users.Controllers.AdminController,Orchard.Security.IUser' Orchard.ContentManagement.IContentManager' Orchard.ContentManagement.ContentIdentity' Orchard.ContentManagement.IdentityResolverSelectorResult' Orchard.ContentManagement.ContentIdentityEqualityComparer' Orchard.ContentManagement.IContentQuery' Orchard.Users.Models.UserPartRecord' Orchard.ContentManagement.ContentItemMetadata' Orchard.IOrchardServices' Orchard.Messaging.Services.IMessageManager' Orchard.Security.IEncryptionService' Orchard.Logging.NullLogger' Orchard.Localization.NullLocalizer' Orchard.Services.IClock' Orchard.Security.MembershipSettings' Orchard.Users.Models.RegistrationSettingsPart' Orchard.Users.Models.UserPart' Orchard.Users.Events.UserContext' Orchard.Logging.ILogger' Orchard.Security.CreateUserParams' Orchard.Settings.ISite' Orchard.WorkContext' Orchard.Users.Models.UserStatus' Orchard.Users.Events.IUserEventHandler' Orchard.ContentManagement.ContentItem' Orchard.Users.Models.MessageTypes' Orchard.Localization.LocalizedString' Orchard.UI.Notify.NotifyType' Orchard.Security.IMembershipService' Orchard.Environment.Configuration.ShellSettings
Orchard.Users,Orchard.Users.ViewModels,Orchard.Users.Controllers.AdminController,
