Project,Namespace,Ca types,Ce types
Loyc.Syntax,Loyc.Syntax.Les,Loyc.Ecs.Parser.EcsLexer' Loyc.Syntax.Lexing.TokensToTreeTests' Loyc.Syntax.ParsingService' LeMP.Compiler' Samples.Samples' LeMP.Tests.TestOnFinallyReturnThrowMacros' LeMP.Tests.MacroTesterBase' Loyc.LLParserGenerator.LlpgGeneralTestsBase' Loyc.LLParserGenerator.LlpgParserTests' Loyc.Syntax.Lexing.TokenTests' Loyc.Syntax.StandardTriviaInjectorTests' Loyc.Syntax.Tests.StreamCharSourceTests' Samples.SExprParser' ADT.SExprParser' SingleFileGenerator.LeMP_les' SingleFileGenerator.LeMPCustomTool' Loyc.VisualStudio.LeMP_les' Loyc.VisualStudio.LeMPCustomTool' Loyc.Syntax.Lexing.IndentTokenGenerator<Token>' LeMP.CodeGeneratorForMatchCase' Loyc.Ecs.EcsNodePrinter' Loyc.Ecs.Indented_' Loyc.Ecs.With_,Loyc.Syntax.NodeStyle' Loyc.Symbol' Loyc.Syntax.Lexing.WhitespaceTag' Loyc.Syntax.CodeSymbols' Loyc.GSymbol' Loyc.NoValue' Loyc.Maybe' Loyc.UString' Loyc.IMessageSink' Loyc.Collections.ICharSource' Loyc.Collections.StringSlice' Loyc.Collections.CG' Loyc.Localize' Loyc.Syntax.EscapeC' Loyc.Syntax.ParseHelpers' Loyc.Syntax.PrintHelpers' Loyc.G' Loyc.Syntax.ParseNumberFlag' Loyc.Pair' Loyc.Syntax.LNodeFactory' Loyc.Syntax.Precedence' Loyc.Collections.VList' Loyc.Syntax.Lexing.Token' Loyc.Syntax.LNode' Loyc.Syntax.SourceRange' Loyc.Syntax.SourcePos' Loyc.Severity' Loyc.Syntax.Lexing.TokenTree' Loyc.Collections.IListAndListSource' Loyc.Syntax.ISourceFile' Loyc.Collections.IListSource' Loyc.CheckParam' Loyc.Syntax.OperatorShape' Loyc.Syntax.ParsingMode' Loyc.Syntax.ILNodePrinterOptions' Loyc.Syntax.ILNode' Loyc.Syntax.Lexing.ILexer' Loyc.Syntax.Lexing.TriviaSaver' Loyc.Syntax.StandardTriviaInjector' Loyc.Syntax.Lexing.WhitespaceFilter' Loyc.Collections.Impl.InternalList' Loyc.Syntax.Impl.PrinterState' Loyc.Syntax.Impl.Checkpoint' Loyc.Collections.INegListSource' Loyc.Syntax.LNodeKind' Loyc.MemoizedTypeName' Loyc.Collections.NegListSlice' Loyc.Syntax.LNodePrinter
Loyc.Syntax,Loyc.Syntax.Lexing,Loyc.Syntax.Les.Les3LanguageService' Loyc.Syntax.Les.Les2LanguageService' Samples.SExprParser' ADT.SExprParser' Loyc.Ecs.Parser.EcsLexer' Loyc.Syntax.IParsingService' Loyc.Syntax.ParsingService' Loyc.Ecs.Parser.EcsPreprocessor' Loyc.Ecs.Tests.EcsParserTests' Loyc.Ecs.EcsLanguageService' Loyc.LLParserGenerator.LlpgParserTests' Loyc.Syntax.Tests.StreamCharSourceTests' Samples.EmailAddress' ADT.EmailAddress' Loyc.Syntax.Les.Les2Parser' Loyc.Ecs.Parser.EcsParser' Loyc.Ecs.Tests.EcsPrinterAndParserTests' LeMP.StandardMacros' LeMP.UnrollCtx' Loyc.LLParserGenerator.AntlrStyleParser' Loyc.LLParserGenerator.StageOneParser' Loyc.LLPG.Macros' Loyc.Syntax.Les.Les2Lexer' Loyc.Syntax.Les.Les3Lexer' Loyc.Syntax.StandardTriviaInjector' Loyc.Syntax.StandardTriviaInjectorTests' Loyc.Syntax.Les.Les3Parser' Loyc.Syntax.Les.TokenExt' Loyc.Syntax.LNodeFactory' Loyc.Syntax.StdSimpleCallNode' Loyc.Syntax.StdSimpleCallNodeWithAttrs' Loyc.Syntax.SourceRange' Loyc.Ecs.Parser.TokenExt' Loyc.Ecs.Tests.EcsLexerTests' Loyc.LLParserGenerator.TokenExt' Loyc.Syntax.Les.Les3LexerTests' Loyc.Syntax.Les.Les2LexerTests' Loyc.Syntax.Tests.LexerSourceTests_Calculator' Loyc.Syntax.Tests.Calculator' Loyc.Syntax.BaseParser<Token;MatchType>,Loyc.UString' Loyc.Maybe' Loyc.Collections.DList' Loyc.Collections.IListAndListSource' Loyc.Collections.Impl.InternalDList' Loyc.Collections.Impl.InternalList' Loyc.Severity' Loyc.IMessageSink' Loyc.Syntax.SourceRange' Loyc.Syntax.Les.Les2Printer' Loyc.Collections.Repeated' Loyc.Collections.ListExt' Loyc.CheckParam' Loyc.Syntax.SourcePos' Loyc.Syntax.PrintHelpers' Loyc.Syntax.EscapeC' Loyc.Collections.ICharSource' Loyc.LogMessage' Loyc.Syntax.ISourceFile' Loyc.Collections.ICollectionAndReadOnly' Loyc.Collections.Slice_' Loyc.Collections.VList' Loyc.Symbol' Loyc.Syntax.NodeStyle' Loyc.Threading.SavedValue' Loyc.Collections.StringSlice' Loyc.GSymbol' Loyc.Syntax.LNode' Loyc.Syntax.CallNode' Loyc.Syntax.IdNode' Loyc.Syntax.CodeSymbols' Loyc.NoValue
Loyc.Syntax,LeMP,LeMP.Tests.TestMacros' LeMP.Prelude.BuiltinMacros' LeMP.CSharp6.CSharp6Macros' LeMP.Prelude.Les.Macros' Loyc.LLPG.Macros,Loyc.Collections.VList' Loyc.Syntax.LNode' Loyc.Syntax.CodeSymbols' Loyc.Pair' Loyc.Symbol' Loyc.CheckParam
Loyc.Syntax,Loyc.Syntax,Loyc.Syntax.Les.Les3LanguageService' Loyc.Syntax.Les.Les3PrettyPrinter' Loyc.Syntax.Les.Les3Printer' Loyc.Syntax.Les.Les2LanguageService' Loyc.Syntax.Les.Les2Printer' LeMP.Compiler' LeMP.InputOutput' LeMP.TestCompiler' TextEditor.Compiler' LeMP.Tests.TestCompiler' LeMP.Tests.MacroTesterBase' LeMP.StandardMacros' LeMP.CodeContractRewriter' SingleFileGenerator.Compiler' Loyc.VisualStudio.Compiler' Loyc.Ecs.EcsLanguageService' Loyc.Syntax.Les.Les3PrinterOptions' Loyc.Syntax.Les.Les2PrinterOptions' Loyc.Ecs.EcsNodePrinter' Loyc.Ecs.EcsPrinterOptions' Loyc.Ecs.Tests.EcsNodePrinterTests' LeMP.MacroProcessorTask' Loyc.LLParserGenerator.CodeGenHelperBase' Loyc.LLParserGenerator.GeneralCodeGenHelper' Loyc.LLParserGenerator.PGNodeSet' Loyc.LLParserGenerator.AntlrStyleParser' Loyc.LLParserGenerator.StageOneParser' Loyc.LLParserGenerator.AndPred' Loyc.LLParserGenerator.LlpgParserTests' Loyc.Syntax.Lexing.TokenTests' Loyc.Syntax.Les.Les3ParserTests' Loyc.Syntax.Les.Les3PrinterTests' Loyc.Syntax.Les.Les2ParserTests' Loyc.Syntax.Les.Les2PrinterTests' Loyc.Syntax.Les.Les2Lexer' Loyc.Syntax.Les.Les2Parser' Loyc.Syntax.Les.Les3Lexer' Loyc.Syntax.Les.Les3Parser' Loyc.Syntax.Les.Les3PrecedenceMap' Loyc.Syntax.Lexing.Token' LeMP.MacroContext' Loyc.Ecs.Parser.EcsLexer' Loyc.Ecs.Parser.EcsParser' Loyc.Ecs.Parser.EcsTriviaInjector' Loyc.Ecs.Parser.EcsPreprocessor' Loyc.Ecs.Tests.EcsPrinterAndParserTests' Loyc.Ecs.Tests.EcsParserTests' Loyc.Ecs.Tests.EcsLexerTests' Loyc.Ecs.EcsValidators' LeMP.TestMacros' LeMP.Tests.TestMacros' LeMP.Prelude.BuiltinMacros' LeMP.AltType' LeMP.AdtParam' LeMP.CodeQuoter' LeMP.CodeMatchContext' LeMP.CodeGeneratorForMatchCase' LeMP.EliminateRunSequences' LeMP.CSharp6.CSharp6Macros' LeMP.Prelude.Les.Macros' Loyc.LLParserGenerator.IntStreamCodeGenHelper' Loyc.LLParserGenerator.PGIntSet' Loyc.LLParserGenerator.GenerateCodeVisitor' Loyc.LLParserGenerator.AutoValueSaverVisitor' Loyc.LLParserGenerator.DataGatheringVisitor' Loyc.LLParserGenerator.StageTwoParser' Loyc.LLParserGenerator.Pred' Loyc.LLParserGenerator.Rule' Loyc.LLParserGenerator.LlpgHelpers' Loyc.LLParserGenerator.LlpgCoreTests' Loyc.LLPG.Macros' Loyc.Syntax.Les.Les3LexerTests' Loyc.Syntax.Les.Les3PrinterAndParserTests' Loyc.Syntax.Les.Les2PrinterAndParserTests' Samples.PlayPen' Loyc.LLParserGenerator.Program' Loyc.LLParserGenerator.LlpgGeneralTestsBase' Samples.Samples' LeMP.UnrollCtx' Loyc.Syntax.Les.INodePrinterWriter' Loyc.Syntax.Les.NodePrinterWriterBase' LeMP.IMacroContext' Loyc.Ecs.Parser.TentativeResult' Loyc.Ecs.With_' LeMP.Scope' LeMP.CurNodeState' LeMP.MacroResult' Loyc.LLParserGenerator.IPGCodeGenHelper' Loyc.LLParserGenerator.LLParserGenerator' Loyc.LLParserGenerator.RuleRef' Loyc.LLParserGenerator.Seq' Loyc.LLParserGenerator.Alts' Loyc.LLParserGenerator.Gate' Loyc.LLParserGenerator.ZeroWidthPred' Loyc.LLParserGenerator.ActionPred' Loyc.LLParserGenerator.TerminalPred' SingleFileGenerator.LeMP' SingleFileGenerator.LeMP_ecs' SingleFileGenerator.LeMP_les' SingleFileGenerator.LeMPCustomTool' Loyc.VisualStudio.LeMP' Loyc.VisualStudio.LeMP_ecs' Loyc.VisualStudio.LeMP_les' Loyc.VisualStudio.LeMPCustomTool' Samples.SExprParser' ADT.Samples' ADT.SExprParser' Loyc.Syntax.Tests.LexerSourceTests_Calculator' Loyc.Syntax.Les.Les2PrecedenceMap' Loyc.LLParserGenerator.IntSet' Benchmark.Program' Loyc.Tests.RunCoreTests' Loyc.Tests.ParseHelpersTests' Loyc.Syntax.Les.LesPrecedence' Loyc.Ecs.EcsPrecedence' Loyc.Syntax.Lexing.TokenListAsLexer' Loyc.Syntax.Lexing.TokenTree' Loyc.Syntax.Lexing.TokensToTree' Loyc.Syntax.Lexing.BaseLexer<CharSrc>' Loyc.Syntax.Lexing.LexerWrapper<Token>' Loyc.Syntax.Lexing.LexerSourceFile<CharSource>' TextEditor.LempDemoPanel' Loyc.Syntax.Lexing.IndentTokenGenerator<Token>' Loyc.Syntax.Tests.StreamCharSourceTests,Loyc.Symbol' Loyc.IMessageSink' Loyc.SymbolPool' Loyc.Syntax.Lexing.ISimpleToken' Loyc.Collections.ICharSource' Loyc.Localize' Loyc.Severity' Loyc.StringExt' Loyc.CheckParam' Loyc.Collections.IListAndListSource' Loyc.Collections.IListSource' Loyc.Collections.Impl.InternalDList' Loyc.GSymbol' Loyc.Syntax.Lexing.ILexer' Loyc.Threading.SavedValue' Loyc.Syntax.Les.Les2LanguageService' Loyc.Syntax.Les.Les3LanguageService' Loyc.MessageSink' Loyc.UString' Loyc.Collections.VList' Loyc.Maybe' Loyc.Collections.NestedEnumerable' Loyc.Collections.NegListSlice' Loyc.NoValue' Loyc.Collections.XfAction' Loyc.Collections.Slice_' Loyc.Syntax.Lexing.Token' Loyc.Collections.ArraySlice' Loyc.G' Loyc.Syntax.Lexing.WhitespaceTag' Loyc.Pair' Loyc.Collections.Impl.InternalList' Loyc.Collections.ListSlice' Loyc.Collections.StringSlice' Loyc.Collections.ListExt
Loyc.Syntax,Loyc.Syntax.Impl,Loyc.Syntax.Les.Les3Printer,Loyc.Collections.Impl.InternalList
