Project,Namespace,Ca types,Ce types
Rebel.Cms.Web,Rebel.Cms.Web,Rebel.Cms.Web.Packaging.PackageInstallation' Rebel.Cms.Web.PropertyEditors.Upload.UploadEditorModel' Rebel.Cms.Web.PropertyEditors.Upload.UploadEditorModel' Rebel.Cms.Web.Macros.ChildActionMacroEngine' Rebel.Cms.Web.Mvc.ControllerFactories.RenderControllerFactory' Rebel.Cms.Web.Mvc.Controllers.RebelController' Rebel.Cms.Web.Editors.DashboardEditorController' Rebel.Cms.Web.Trees.ApplicationTreeController' Rebel.Cms.Web.Mapping.SimpleFlattenedTypedEntityMapper' Rebel.Cms.Packages.DevDataset.DevDataset' Rebel.Cms.Web.DependencyManagement.CmsAttributeTypeRegistry' Rebel.Cms.Web.Mvc.Controllers.BackOffice.MediaController' Rebel.Cms.Web.Mvc.Controllers.MediaProxyController' Rebel.Cms.Web.Packaging.PackageBuilderHelper' Rebel.Cms.Web.Editors.LanguageEditorController' Rebel.Cms.Web.Editors.DataTypeEditorController' Rebel.Cms.Web.Editors.Dialogs.InsertFieldEditorController' Rebel.Cms.Web.PropertyEditors.TreePickers' Rebel.Cms.Web.PropertyEditors.RichTextBox.TinyMCE.Controllers.InsertMediaController' Rebel.Cms.Web.PropertyEditors.TreeNodePicker.TreeNodePickerPreValueModel' Rebel.Cms.Web.PropertyEditors.TreePickers' Rebel.Cms.Web.PropertyEditors.RichTextBox.TinyMCE.Controllers.InsertMediaController' Rebel.Cms.Web.PropertyEditors.TreeNodePicker.TreeNodePickerPreValueModel' Rebel.Cms.Web.Context.MapResolverContext' Rebel.Cms.Web.Mapping.CmsModelMapper' Rebel.Cms.Web.Mapping.AttributeTypeToPropertyEditorPackageName' Rebel.Cms.Web.Mapping.AttributeTypeToPropertyEditorId' Rebel.Cms.Web.Model.BackOffice.ParameterEditors.AbstractParameterEditor' Rebel.Cms.Web.Model.BackOffice.ParameterEditors.ParameterEditor<TParamEditorModel>' Rebel.Cms.Web.Model.BackOffice.ParameterEditors.ParameterEditor' Rebel.Cms.Web.ParameterEditors.ContentPicker.ContentPickerEditor' Rebel.Cms.Web.ParameterEditors.UserGroupPicker.UserGroupPicker' Rebel.Cms.Web.ParameterEditors.MemberGroupPicker.MemberGroupPicker' Rebel.Cms.Web.ParameterEditors.MediaTypePicker.MediaTypePicker' Rebel.Cms.Web.ParameterEditors.DocumentTypePicker.DocumentTypePicker' Rebel.Cms.Web.ParameterEditors.Integer.IntegerEditor' Rebel.Cms.Web.ParameterEditors.MediaPicker.MediaPickerEditor' Rebel.Cms.Web.ParameterEditors.MemberTypePicker.MemberTypePicker' Rebel.Cms.Web.ParameterEditors.Textarea.TextareaEditor' Rebel.Cms.Web.ParameterEditors.Textstring.TextstringEditor' Rebel.Cms.Web.ParameterEditors.TrueFalse.TrueFalseEditor' Rebel.Cms.Web.Editors.AbstractSchemaEditorController<TEditorModel;TCreateModel>' Rebel.Cms.Web.Mvc.ViewEngines.RenderViewPageActivator' Rebel.Cms.Web.Mvc.Controllers.BackOffice.UpgradeController' Rebel.Cms.Web.Editors.StylesheetEditorController' Rebel.Cms.Web.Trees.StylesheetTreeController,Rebel.Framework.HiveId' Rebel.Hive.IHiveManager' Rebel.Framework.Security.IMembershipService' Rebel.Framework.Security.IPublicAccessService' Rebel.Framework.Security.Model.Entities.Member' Rebel.Framework.Persistence.Model.TypedEntity' Rebel.Cms.Web.Model.Content' Rebel.Framework.Context.IFrameworkContext' Rebel.Framework.TypeMapping.AbstractMappingEngine' Rebel.Framework.TypeFinder' Rebel.Framework.Dynamics.DynamicExtensionsHelper' Rebel.Framework.Dynamics.BendyObject' Rebel.Framework.Dynamics.DynamicMethod' Rebel.Framework.Dynamics.Attributes.DynamicExtensionAttribute' Rebel.Framework.Dynamics.Signature' Rebel.Framework.TypeExtensions' Rebel.Framework.Persistence.Model.Attribution.TypedAttribute' Rebel.Framework.Dynamics.Attributes.DynamicFieldExtensionAttribute' Rebel.Hive.IBuilderStep' Rebel.Cms.Web.FluentExtensions.ICmsBuilderStep' Rebel.Hive.IFileStoreStep' Rebel.Cms.Web.FluentExtensions.IContentRevisionBuilderStep' Rebel.Hive.ISchemaBuilderStep' Rebel.Framework.Persistence.Model.Attribution.MetaData.EntitySchema' Rebel.Framework.Persistence.Model.Versioning.RevisionData' Rebel.Framework.Persistence.Model.Constants.FixedStatusTypes' Rebel.Framework.Mandate' Rebel.Framework.Persistence.Model.Constants.AttributeDefinitions.NodeNameAttributeDefinition' Rebel.Framework.Persistence.Model.Attribution.TypedAttributeValueCollection' Rebel.Framework.Persistence.Model.Constants.AttributeDefinitions.SelectedTemplateAttributeDefinition' Rebel.Framework.Persistence.Model.IRelatableEntity' Rebel.Framework.Persistence.Model.Associations.AbstractRelationType' Rebel.Framework.Persistence.Model.Associations.RelationMetaDatum' Rebel.Framework.AttemptTuple' Rebel.Framework.Persistence.Model.Constants.FixedRelationTypes' Rebel.Framework.Persistence.Model.Associations._Revised.RelationProxyCollection' Rebel.Framework.Persistence.Model.Attribution.MetaData.AttributeType' Rebel.Cms.Web.Model.BackOffice.Editors.DataType' Rebel.Cms.Web.Model.BackOffice.PropertyEditors.PreValueModel' Rebel.Hive.ProviderGrouping.GroupUnitFactory' Rebel.Hive.ProviderGrouping.IReadonlySchemaRepositoryGroup' Rebel.Hive.ProviderGrouping.IReadonlyEntityRepositoryGroup' Rebel.Hive.ProviderGrouping.IReadonlyGroupUnit' Rebel.Framework.Persistence.Model.Constants.FixedHiveIds' Rebel.Framework.TypeMapping.MappingEngineCollection' Rebel.Hive.ProviderSupport.RepositoryContext' Rebel.Framework.Persistence.Model.Attribution.MetaData.AttributeDefinition' Rebel.Framework.Persistence.Model.Attribution.MetaData.CompositeEntitySchema' Rebel.Framework.Persistence.Model.Attribution.TypedAttributeCollection' Rebel.Framework.Persistence.Model.Attribution.MetaData.InheritedAttributeDefinition' Rebel.Framework.Persistence.Model.Associations.IReadonlyRelation' Rebel.Framework.Persistence.Model.Associations._Revised.RelationProxy' Rebel.Framework.Persistence.Model.Attribution.MetaData.AttributeGroup' Rebel.Framework.Persistence.Model.Constants.FixedGroupDefinitions' Rebel.Hive.ProviderGrouping.IGroupUnit' Rebel.Hive.ProviderGrouping.IRevisionRepositoryGroup' Rebel.Hive.ProviderGrouping.IEntityRepositoryGroup' Rebel.Hive.ProviderGrouping.ISchemaRepositoryGroup' Rebel.Cms.Web.FluentExtensions.IContentRevisionSaveResult' Rebel.Cms.Web.Model.Template' Rebel.Framework.Persistence.Model.IO.File' Rebel.Hive.ProviderGrouping.IGroupUnitFactory' Rebel.Framework.Diagnostics.LogHelper' Rebel.Framework.Persistence.Model.Associations.IRelationById' Rebel.Cms.Web.Model.BackOffice.Trees.TreeMetadata' Rebel.Cms.Web.Mvc.ActionFilters.RebelAuthorizeAttribute' Rebel.Cms.Web.Mvc.Controllers.BackOffice.BackOfficeController' Rebel.Cms.Web.Macros.MacroRenderer' Rebel.Cms.Web.Macros.MacroSyntaxParser' Rebel.Cms.Web.Context.IRoutableRequestContext' Rebel.Cms.Web.Routing.IRoutingEngine' Rebel.Framework.EntityPath' Rebel.Framework.HiveIdValue' Rebel.Framework.Security.Model.FixedHiveIds' Rebel.Cms.Web.Mvc.ActionFilters.ProxyableResultAttribute' Rebel.Framework.ExpressionHelper' Rebel.Framework.PluginDefinition' Rebel.Framework.PluginMetadataComposition' Rebel.Hive.ProviderGrouping.ReadonlyGroupUnitFactory' Rebel.Framework.Dynamics.Expressions.DynamicMemberMetadata' Rebel.Cms.Web.Model.BackOffice.DashboardItemModel' Rebel.Cms.Web.DependencyManagement.ComponentRegistrations' Rebel.Cms.Web.Editors.EditorMetadata' Rebel.Framework.EntityPathCollection' Rebel.Cms.Web.Model.BackOffice.TinyMCE.InsertMedia.InsertMediaModel' Rebel.Cms.Web.Model.BackOffice.Trees.MenuItemMetadata' Rebel.Cms.Web.Model.BackOffice.ParameterEditors.ParameterEditorMetadata' Rebel.Cms.Web.Model.BackOffice.PropertyEditors.PropertyEditorMetadata' Rebel.Cms.Web.Model.BackOffice.PropertyEditors.PropertyEditor' Rebel.Cms.Web.Routing.EntityRouteResult' Rebel.Cms.Web.Macros.MacroDefinition' Rebel.Cms.Web.Surface.SurfaceMetadata' Rebel.Cms.Web.Security.AbstractRebelMembershipProvider' Rebel.Cms.Web.Context.IRenderModelFactory' Rebel.Cms.Web.Model.IRebelRenderModel' Rebel.Cms.Web.Mvc.Controllers.ControllerExtender' Rebel.Cms.Web.Configuration.RebelSystem.RouteMatchElement' Rebel.Cms.Web.Configuration.RebelSystem.RouteMatchTypes' Rebel.Framework.DependencyManagement.IDependencyRegistrar' Rebel.Framework.DependencyManagement.IContainerBuilder' Rebel.Cms.Web.DependencyManagement.ModelBinderMetadata' Rebel.Cms.Web.DependencyManagement.ModelBinderForAttribute' Rebel.Framework.DependencyManagement.IScopeManager' Rebel.Framework.HiveIdFormatStyle' Rebel.Cms.Web.Model.BackOffice.Editors.ContentProperty' Rebel.Cms.Web.Model.BackOffice.UIElements.IHasUIElements' Rebel.Framework.PropertyNamesCaseType' Rebel.Cms.Web.Model.BackOffice.UIElements.UIElement' Rebel.Framework.Persistence.Model.Associations.RelationType' Rebel.Framework.Security.ISecurityService' Rebel.Framework.AbstractScopedCache' Rebel.Hive.ProviderGrouping.IReadonlyRevisionRepositoryGroup' Rebel.Framework.Linq.CriteriaGeneration.StructureMetadata.MapsToAliasForQueryingAttribute' Rebel.Framework.Linq.CriteriaGeneration.StructureMetadata.MapsToInnerAliasForQueryingAttribute' Rebel.Cms.Web.Model.KeyedFieldValue' Rebel.Framework.Persistence.Abstractions.Attribution.MetaData.IAttributeSerializationDefinition' Rebel.Framework.Data.DataSerializationTypes' Rebel.Framework.StringAliasCaseType' Rebel.Framework.Caching.CacheKey' Rebel.Cms.Web.Routing.UrlResolutionResult' Rebel.Cms.Web.Context.IRebelApplicationContext' Rebel.Cms.Web.Dictionary.DictionaryHelper' Rebel.Framework.DependencyManagement.AbstractContainerBuilder' Rebel.Framework.AbstractFinalizer' Rebel.Cms.Web.System.Boot.BootManager' Rebel.Cms.Web.DependencyManagement.DemandBuilders.ContainerBuilderEventArgs' Rebel.Framework.Tasks.ApplicationTaskManager' Rebel.Framework.TaskTriggers' Rebel.Framework.Persistence.Model.Constants.Schemas.MediaImageSchema' Rebel.Cms.Web.Model.StylesheetRule' Rebel.Cms.Web.Configuration.RebelSystem.RebelPathsElement' Rebel.Cms.Web.Configuration.RebelSettings' Rebel.Cms.Web.Security.UserData' Rebel.Cms.Web.Model.BackOffice.TreePickerRenderModel' Rebel.Cms.Web.Model.BackOffice.TreeRenderModel' Rebel.Cms.Web.Model.BackOffice.Trees.MenuItem' Rebel.Cms.Web.Trees.SupportsEditorTreeController' Rebel.Cms.Web.Model.BackOffice.Trees.TreeNode' Rebel.Cms.Web.Context.IBackOfficeRequestContext' Rebel.Framework.AbstractApplicationCache' Rebel.Framework.ProviderSupport.InstallStatus' Rebel.Framework.ProviderSupport.InstallStatusType' Rebel.Cms.Web.Mvc.Controllers.RebelController' Rebel.Cms.Web.Editors.DashboardEditorController' Rebel.Cms.Web.Editors.EditorAttribute' Rebel.Cms.Web.Trees.TreeQueryStringParameters' Rebel.Cms.Web.Trees.ApplicationTreeController' Rebel.Cms.Web.Model.BackOffice.Trees.TreeAttribute' Rebel.Framework.Persistence.Model.Associations.RelationMetaDataCollection' Rebel.Cms.Web.Configuration.RebelSystem.RebelFoldersElement' Rebel.Framework.Configuration.PluginManagerConfiguration' Rebel.Framework.DependencyManagement.IDependencyResolver' Rebel.Cms.Web.Trees.TreeController
Rebel.Cms.Web,Rebel.Cms.Web.BuildManagerCodeDelegates,Rebel.Cms.Web.PropertyEditors.NodeSelector.CSharpExpressionsUtility' Rebel.Cms.Web.PropertyEditors.NodeSelector.CSharpExpressionsUtility' Rebel.Cms.Web.PropertyEditors.NodeSelector.DataTypeUpdatedTask' Rebel.Cms.Web.PropertyEditors.NodeSelector.DataTypeUpdatedTask,Rebel.Framework.AttemptTuple' Rebel.Framework.Mandate
Rebel.Cms.Web,Rebel.Cms.Web.Caching,Rebel.Cms.Web.Editors.AbstractRevisionalContentEditorController<TEditorModel>' Rebel.Cms.Web.Editors.Extenders.PublishController' Rebel.Cms.Web.Mvc.Controllers.RebelController,Rebel.Framework.Context.IFrameworkContext' Rebel.Framework.Persistence.Model.TypedEntity' Rebel.Framework.Context.IFrameworkCaches' Rebel.Framework.Caching.AbstractCacheProvider' Rebel.Framework.AbstractApplicationCache' Rebel.Framework.HiveId' Rebel.Cms.Web.Context.IRebelApplicationContext' Rebel.Cms.Web.Model.BackOffice.Editors.ContentEditorModel' Rebel.Cms.Web.Model.Content' Rebel.Cms.Web.Model.IRebelRenderModel' Rebel.Framework.DisposableTimer' Rebel.Framework.Persistence.Model.IO.File' Rebel.Hive.IHiveManager' Rebel.Hive.ProviderGrouping.IReadonlyEntityRepositoryGroup' Rebel.Hive.ProviderGrouping.IReadonlyGroupUnit' Rebel.Cms.Web.Model.Template' Rebel.Framework.Persistence.ModelFirst.CustomTypedEntity' Rebel.Cms.Web.Mapping.SimpleFlattenedTypedEntityMapper
Rebel.Cms.Web,Rebel.Cms.Web.Configuration.RebelSystem,Rebel.Cms.Web.PropertyEditors.RebelSystemEditors.NodeName.NodeNameEditor' Rebel.Cms.Web.PropertyEditors.RebelSystemEditors.NodeName.NodeNameEditor' Rebel.Cms.Web.Packaging.DefaultPackageContext' Rebel.Cms.Web.RouteMatchExtensions' Rebel.Cms.Web.UrlHelperExtensions' Rebel.Cms.Web.Mvc.ViewEngines.RenderViewEngine' Rebel.Cms.Web.Templates.TemplateHelper' Rebel.Cms.Web.Editors.AbstractSchemaEditorController<TEditorModel;TCreateModel>' Rebel.Cms.Web.Editors.AbstractRevisionalContentEditorController<TEditorModel>' Rebel.Cms.Web.Editors.AbstractFileEditorController' Rebel.Cms.Web.PropertyEditors.NodeSelector.NodeSelectorContentTreeControllerHelper' Rebel.Cms.Web.Trees.ContentTreeController' Rebel.Cms.Web.Trees.RecycleBinTreeController' Rebel.Cms.Web.PropertyEditors.NodeSelector.NodeSelectorContentTreeControllerHelper' Rebel.Cms.Web.AreaRegistrationExtensions' Rebel.Cms.Web.Macros.ChildActionMacroEngine' Rebel.Cms.Web.Mvc.ViewEngines.PluginViewEngine' Rebel.Cms.Web.Routing.IgnoreExistingControllersConstraint' Rebel.Cms.Web.Security.BackOfficeAuthenticationModule' Rebel.Cms.Web.Editors.DashboardEditorController' Rebel.Cms.Web.System.Boot.CmsBootstrapper' Rebel.Cms.Web.Mvc.Areas.PackageAreaRegistration' Rebel.Cms.Web.Trees.ApplicationTreeController' Rebel.Cms.Web.Configuration.RebelSettings,Rebel.Framework.WildcardRegex
Rebel.Cms.Web,Rebel.Cms.Web.DependencyManagement,Rebel.Cms.Web.DashboardItemModelExtensions' Rebel.Cms.Web.MacroModelExtensions' Rebel.Cms.Web.UrlHelperExtensions' Rebel.Cms.Web.Context.DefaultBackOfficeRequestContext' Rebel.Cms.Web.Context.RoutableRequestContext' Rebel.Cms.Web.Macros.ChildActionMacroEngine' Rebel.Cms.Web.Macros.MacroRenderer' Rebel.Cms.Web.Mvc.ActionInvokers.DashboardActionInvoker' Rebel.Cms.Web.Mvc.Controllers.BackOffice.TreePickerController' Rebel.Cms.Web.Mvc.Controllers.BackOffice.DefaultController' Rebel.Cms.Web.Mvc.Areas.PackageAreaRegistration' Rebel.Cms.Web.Mvc.Areas.RebelAreaRegistration' Rebel.Cms.Web.Trees.ApplicationTreeController' Rebel.Cms.Web.Trees.TreeController' Rebel.Cms.Web.Editors.AbstractUserGroupEditorController' Rebel.Cms.Web.Editors.MacroEditorController' Rebel.Cms.Web.Editors.DataTypeEditorController' Rebel.Cms.Web.Editors.PackagingEditorController' Rebel.Cms.Web.Editors.Extenders.PermissionsController' Rebel.Cms.Web.PropertyEditors.NodeSelector.NodeSelectorEditor' Rebel.Cms.Web.PropertyEditors.NodeSelector.NodeSelectorEditorModel' Rebel.Cms.Web.PropertyEditors.NodeSelector.NodeSelectorUtilityController' Rebel.Cms.Web.Trees.DictionaryTreeController' Rebel.Cms.Web.Trees.MediaTreeController' Rebel.Cms.Web.PropertyEditors.NodeSelector.NodeSelectorEditor' Rebel.Cms.Web.PropertyEditors.NodeSelector.NodeSelectorEditorModel' Rebel.Cms.Web.PropertyEditors.NodeSelector.NodeSelectorUtilityController' Rebel.Cms.Web.DependencyManagementExtensions' Rebel.Cms.Web.DependencyManagement.DemandBuilders.RebelContainerBuilder<TWebApp>,Rebel.Framework.Persistence.DefaultAttributeTypeRegistry' Rebel.Cms.Web.CorePluginConstants' Rebel.Framework.Persistence.IAttributeTypeRegistry' Rebel.Framework.Mandate' Rebel.Framework.Persistence.Model.Attribution.MetaData.AttributeType' Rebel.Framework.AttemptTuple' Rebel.Framework.DependencyManagement.IDependencyResolver' Rebel.Framework.DependencyManagement.IContainerBuilder' Rebel.Framework.TypeFinder' Rebel.Cms.Web.System.PluginManager' Rebel.Framework.PluginDefinition' Rebel.Framework.DependencyManagement.DemandsDependenciesDemandRunniner' Rebel.Framework.DisposableTimer' Rebel.Framework.Diagnostics.LogHelper' Rebel.Framework.DependencyManagement.IScopeManager' Rebel.Framework.DependencyManagement.IDependencyRegistrar' Rebel.Cms.Web.Macros.MacroEngineMetadata' Rebel.Cms.Web.Macros.MacroEngineAttribute' Rebel.Cms.Web.Macros.RebelMacroEngineAttribute' Rebel.Cms.Web.Surface.SurfaceMetadata' Rebel.Cms.Web.Mvc.Controllers.RebelController' Rebel.Cms.Web.Editors.EditorMetadata' Rebel.Cms.Web.Editors.EditorAttribute' Rebel.Cms.Web.Editors.RebelEditorAttribute' Rebel.Cms.Web.Model.BackOffice.Trees.MenuItemMetadata' Rebel.Cms.Web.Model.BackOffice.Trees.MenuItemAttribute' Rebel.Cms.Web.Model.BackOffice.Trees.TreeMetadata' Rebel.Cms.Web.Model.BackOffice.Trees.TreeAttribute' Rebel.Cms.Web.Model.BackOffice.Trees.RebelTreeAttribute' Rebel.Cms.Web.Model.BackOffice.PropertyEditors.PropertyEditorMetadata' Rebel.Cms.Web.Model.BackOffice.PropertyEditors.PropertyEditorAttribute' Rebel.Cms.Web.Model.BackOffice.PropertyEditors.RebelPropertyEditorAttribute' Rebel.Cms.Web.Model.BackOffice.ParameterEditors.ParameterEditorMetadata' Rebel.Cms.Web.Model.BackOffice.ParameterEditors.ParameterEditorAttribute' Rebel.Framework.Tasks.TaskMetadata' Rebel.Framework.Tasks.TaskAttribute' Rebel.Framework.Security.PermissionMetadata' Rebel.Framework.Security.PermissionAttribute
Rebel.Cms.Web,Rebel.Cms.Web.Configuration.ApplicationSettings,Rebel.Cms.Web.Mapping.CmsModelMapper' Rebel.Cms.Web.Trees.ApplicationTreeController' Rebel.Cms.Web.PropertyEditors.ListPicker.DataSources.ApplicationsListPickerDataSource' Rebel.Cms.Web.PropertyEditors.ListPicker.DataSources.ApplicationsListPickerDataSource,
Rebel.Cms.Web,Rebel.Cms.Web.Configuration.Dashboards,Rebel.Cms.Web.Mapping.CmsModelMapper' Rebel.Cms.Web.Editors.DashboardEditorController' Rebel.Cms.Web.Mvc.ActionInvokers.DashboardActionInvoker,
Rebel.Cms.Web,Rebel.Cms.Web.Configuration.Languages,Rebel.Cms.Web.Mapping.CmsModelMapper' Rebel.Cms.Web.Dictionary.DictionaryHelper' Rebel.Cms.Web.Packaging.PackageBuilderHelper' Rebel.Cms.Web.Packaging.PackageInstallation' Rebel.Cms.Web.Editors.LanguageEditorController' Rebel.Cms.Web.Editors.PackagingEditorController' Rebel.Cms.Web.Editors.Extenders.LanguageController' Rebel.Cms.Web.PropertyEditors.RebelSystemEditors.DictionaryItemTranslations.DictionaryItemTranslationsEditor' Rebel.Cms.Web.Trees.LanguageTreeController' Rebel.Cms.Web.PropertyEditors.RebelSystemEditors.DictionaryItemTranslations.DictionaryItemTranslationsEditor,
Rebel.Cms.Web,Rebel.Cms.Web.Configuration.Tasks,Rebel.Cms.Web.Context.ConfigurationTaskContext' Rebel.Cms.Web.Tasks.ConfigurationTaskBuilder' Rebel.Cms.Web.Tasks.CopyFileTask,
