Project,Namespace,Ca types,Ce types
Rebel.Cms.Web,Rebel.Cms.Web.Model.BackOffice.Editors,Rebel.Cms.Web.Mapping.CmsModelMapper' Rebel.Cms.Web.Editors.PackagingEditorController' Rebel.Cms.Web.Editors.Extenders.PublicAccessController' Rebel.Cms.Web.Editors.MemberTypeEditorController' Rebel.Cms.Web.Editors.Extenders.LanguageController' Rebel.Cms.Web.Editors.AbstractFileEditorController' Rebel.Cms.Web.Editors.Dialogs.ImplementSectionEditorController' Rebel.Cms.Web.Editors.Dialogs.InsertFieldEditorController' Rebel.Cms.Web.Editors.Dialogs.InsertPartialEditorController' Rebel.Cms.Web.Editors.MediaTypeEditorController' Rebel.Cms.Web.PropertyEditors.Upload.UploadEditor' Rebel.Cms.Web.PropertyEditors.Upload.UploadEditor' Rebel.Cms.Web.Editors.StylesheetEditorController' Rebel.Cms.Web.Mvc.Controllers.BackOffice.MediaController' Rebel.Cms.Web.Editors.MediaEditorController' Rebel.Cms.Web.Mvc.Metadata.RebelModelMetadataProvider' Rebel.Cms.Web.Mvc.ActionFilters.SupportClientNotificationsAttribute' Rebel.Cms.Web.Mvc.Controllers.BackOffice.BackOfficeController' Rebel.Cms.Web.Editors.AbstractUserEditorController<TUserType;TEditorModel>' Rebel.Cms.Web.Editors.AbstractSchemaEditorController<TEditorModel;TCreateModel>' Rebel.Cms.Web.Editors.AbstractUserGroupEditorController' Rebel.Cms.Web.Editors.AbstractRevisionalContentEditorController<TEditorModel>' Rebel.Cms.Web.Editors.LanguageEditorController' Rebel.Cms.Web.Editors.MacroEditorController' Rebel.Cms.Web.Editors.DataTypeEditorController' Rebel.Cms.Web.Editors.Extenders.RollbackController' Rebel.Cms.Web.Editors.Extenders.HostnameController' Rebel.Cms.Web.Editors.Extenders.PermissionsController' Rebel.Cms.Web.Editors.Extenders.PublishController' Rebel.Cms.Web.Editors.Extenders.SortController' Rebel.Cms.Web.PropertyEditors.NodeSelector.NodeSelectorUtilityController' Rebel.Cms.Web.PropertyEditors.NodeSelector.NodeSelectorUtilityController' Rebel.Cms.Packages.DevDataset.DevDataset' Rebel.Cms.Web.Caching.ContentCacheManager' Rebel.Cms.Web.Context.DefaultRenderModelFactory' Rebel.Cms.Web.Editors.ContentEditorController' Rebel.Cms.Web.Editors.Extenders.MoveCopyController' Rebel.Cms.Web.Model.BackOffice.PropertyEditors.ContentAwarePropertyEditor<TEditorModel;TPreValueModel>' Rebel.Cms.Web.Model.BackOffice.PropertyEditors.IContentAwarePropertyEditor' Rebel.Cms.Web.Editors.AbstractContentEditorController' Rebel.Cms.Web.PropertyEditors.NodeSelector.NodeSelectorEditor' Rebel.Cms.Web.PropertyEditors.RichTextBox.RichTextBoxEditor' Rebel.Cms.Web.PropertyEditors.NodeSelector.NodeSelectorEditor' Rebel.Cms.Web.PropertyEditors.RichTextBox.RichTextBoxEditor' Rebel.Cms.Web.HtmlHelperEditorExtensions' Rebel.Cms.Web.Mapping.ContentPropertyToTypedAttribute' Rebel.Cms.Web.Mapping.ContentEditorModelToTypedEntity<TContentModel;TTypedEntity>' Rebel.Cms.Web.Mapping.DocumentTypeToNewContentModel<TTarget>' Rebel.Cms.Web.Mapping.TypedEntityToContentEditorModel<TEntity;TContent>' Rebel.Cms.Web.Editors.DocumentTypeEditorController' Rebel.Cms.Web.Editors.TemplateEditorController' Rebel.Cms.Web.CmsBuildStepExtensions' Rebel.Cms.Web.RebelHelper' Rebel.Cms.Web.Mvc.ModelBinders.BackOffice.DocumentTypePropertyModelBinder' Rebel.Cms.Web.Packaging.PackageInstallation' Rebel.Cms.Web.PropertyEditors.RichTextBox.TinyMCE.Controllers.InsertMediaController' Rebel.Cms.Web.PropertyEditors.RichTextBox.TinyMCE.Controllers.InsertMediaController' Rebel.Cms.Web.PropertyEditors.NodeSelector.CSharpExpressionsUtility' Rebel.Cms.Web.PropertyEditors.NodeSelector.CSharpExpressionsUtility' Rebel.Cms.Web.PropertyEditors.RebelSystemEditors.SelectedTemplate.SelectedTemplateEditor' Rebel.Cms.Web.PropertyEditors.RebelSystemEditors.SelectedTemplate.SelectedTemplateEditor' Rebel.Cms.Web.Mapping.DocumentTypePropertyToAttributeDefinition' Rebel.Cms.Web.Mapping.DocumentTypePropertyToAttributeType' Rebel.Cms.Web.Mapping.DocumentTypePropertyToAttributeGroup' Rebel.Cms.Web.Mapping.SchemaEditorModelToEntitySchema<TEditorModel>' Rebel.Cms.Web.Mvc.ModelBinders.BackOffice.FileEditorModelBinder' Rebel.Cms.Web.Editors.MacroPartialsEditorController' Rebel.Cms.Web.Editors.PartialsEditorController' Rebel.Cms.Web.Macros.MacroSerializer' Rebel.Cms.Web.Macros.MacroRenderer' Rebel.Cms.Web.Packaging.PackageBuilderHelper' Rebel.Cms.Web.Editors.Dialogs.InsertMacroEditorController' Rebel.Cms.Web.PropertyEditors.RichTextBox.TinyMCE.Controllers.InsertMacroController' Rebel.Cms.Web.PropertyEditors.RichTextBox.TinyMCE.Controllers.InsertMacroController' Rebel.Cms.Web.Model.BackOffice.TinyMCE.InsertMacro.SetParametersModel' Rebel.Cms.Packages.SnapshotDashboard.Controllers.CreateSnapshotDashboardController' Rebel.Cms.Web.Mapping.EntitySchemaToSchemaEditorModel<TEditorModel>' Rebel.Cms.Web.PropertyEditors.RebelSystemEditors.UserGroupUsers.UserGroupUsersEditor' Rebel.Cms.Web.PropertyEditors.RebelSystemEditors.UserGroupUsers.UserGroupUsersEditor,Rebel.Framework.Mandate' Rebel.Framework.HiveId' Rebel.Framework.Persistence.Model.Constants.FixedGroupDefinitions' Rebel.Framework.Persistence.Model.Attribution.MetaData.AttributeGroup' Rebel.Cms.Web.Model.BackOffice.IModelUpdator' Rebel.Framework.Persistence.Model.Constants.FixedHiveIds' Rebel.Cms.Web.Model.BackOffice.PropertyEditors.PreValueModel' Rebel.Cms.Web.Model.BackOffice.PropertyEditors.EditorModel' Rebel.Framework.Security.PermissionStatus
Rebel.Cms.Web,Rebel.Cms.Web.Model.BackOffice.PropertyEditors,Rebel.Cms.Web.Mapping.ContentPropertyToTypedAttribute' Rebel.Cms.Web.Model.BackOffice.Editors.DocumentTypeProperty' Rebel.Cms.Web.PropertyEditors.DateTimePicker.DateTimePickerEditorModel' Rebel.Cms.Web.PropertyEditors.Slider.SliderEditorModel' Rebel.Cms.Web.PropertyEditors.DateTimePicker.DateTimePickerEditorModel' Rebel.Cms.Web.PropertyEditors.Slider.SliderEditorModel' Rebel.Cms.Web.Mapping.DocumentTypeToNewContentModel<TTarget>' Rebel.Cms.Web.Mapping.TypedEntityToContentEditorModel<TEntity;TContent>' Rebel.Cms.Web.Mapping.CmsModelMapper' Rebel.Cms.Web.CmsBuildStepExtensions' Rebel.Cms.Web.RebelHelper' Rebel.Cms.Web.Model.BackOffice.Editors.DataType' Rebel.Cms.Web.Model.BackOffice.Editors.DataTypeEditorModel' Rebel.Cms.Web.Packaging.PackageInstallation' Rebel.Cms.Web.PropertyEditors.NodeSelector.NodeSelectorPreValueModel' Rebel.Cms.Web.PropertyEditors.NodeSelector.NodeSelectorPreValueModel' Rebel.Cms.Web.PropertyEditorExtensions' Rebel.Cms.Web.DependencyManagement.RebelComponentRegistrar' Rebel.Cms.Web.Mapping.AttributeTypeToPropertyEditorPackageName' Rebel.Cms.Web.Mapping.AttributeTypeToPropertyEditorId' Rebel.Cms.Web.Model.BackOffice.ParameterEditors.AbstractParameterEditor' Rebel.Cms.Web.Editors.DataTypeEditorController,Rebel.Cms.Web.Model.BackOffice.Editors.ContentProperty' Rebel.Cms.Web.Model.BackOffice.Editors.BasicContentEditorModel' Rebel.Cms.Web.Model.BackOffice.Editors.DocumentTypeEditorModel' Rebel.Framework.AttemptTuple' Rebel.Framework.Diagnostics.LogHelper' Rebel.Framework.Mandate
Rebel.Cms.Web,Rebel.Cms.Web.Model.BackOffice.UIElements,Rebel.Cms.Web.HtmlHelperEditorExtensions' Rebel.Cms.Web.PropertyEditors.RichTextBox.RichTextBoxEditorModel' Rebel.Cms.Web.PropertyEditors.RichTextBox.RichTextBoxEditorModel,
Rebel.Cms.Web,Rebel.Cms.Web.Mvc.ActionFilters,Rebel.Cms.Web.ProxyControllerExtensions' Rebel.Cms.Web.ControllerExtensions' Rebel.Cms.Web.HtmlHelperEditorExtensions' Rebel.Cms.Web.Mvc.ActionInvokers.RebelInstallActionInvoker' Rebel.Cms.Web.Mvc.Controllers.BackOffice.InstallController' Rebel.Cms.Web.Editors.PackagingEditorController,Rebel.Cms.Web.Mvc.Controllers.BackOffice.DefaultController' Rebel.Cms.Web.Model.BackOffice.LoginDisplayType' Rebel.Cms.Web.Context.IRebelApplicationContext' Rebel.Cms.Web.Model.IRebelRenderModel' Rebel.Framework.HiveId' Rebel.Framework.Persistence.Model.Associations.IRelationById' Rebel.Framework.Persistence.Model.Associations.RelationMetaDatum' Rebel.Framework.DisposableTimer' Rebel.Framework.Diagnostics.LogHelper' Rebel.Cms.Web.Model.Content' Rebel.Hive.IHiveManager' Rebel.Hive.ProviderGrouping.IReadonlyEntityRepositoryGroup' Rebel.Hive.ProviderGrouping.IReadonlyGroupUnit' Rebel.Framework.Persistence.Model.Constants.FixedRelationTypes' Rebel.Framework.Persistence.Model.Associations.RelationMetaDataCollection' Rebel.Cms.Web.Context.IRoutableRequestContext' Rebel.Framework.Security.PublicAccessInfo' Rebel.Framework.Security.Model.Entities.Member' Rebel.Framework.Security.PublicAccessStatusResult' Rebel.Framework.Security.IPublicAccessService' Rebel.Framework.Security.ISecurityService' Rebel.Framework.Security.IMembershipService' Rebel.Cms.Web.Routing.IRoutingEngine' Rebel.Framework.Mandate' Rebel.Cms.Web.Trees.RebelTreeResult' Rebel.Cms.Web.Model.BackOffice.Trees.TreeNodeCollection' Rebel.Cms.Web.Model.BackOffice.Trees.TreeNode' Rebel.Cms.Web.Model.BackOffice.Trees.MenuItemMetadata' Rebel.Cms.Web.Context.IRequiresBackOfficeRequestContext' Rebel.Cms.Web.Context.IBackOfficeRequestContext' Rebel.Cms.Web.Mvc.Controllers.BackOffice.IGeneratePath' Rebel.Framework.EntityPathCollection' Rebel.Framework.Security.IRebelIdentity' Rebel.Framework.Persistence.Model.Constants.FixedHiveIds' Rebel.Framework.Security.PermissionResults' Rebel.Framework.Security.IPermissionsService' Rebel.Framework.Context.IFrameworkContext' Rebel.Framework.Tasks.ApplicationTaskManager' Rebel.Framework.TaskTriggers' Rebel.Cms.Web.Mvc.Areas.InstallAreaRegistration' Rebel.Cms.Web.Security.RebelBackOfficeIdentity' Rebel.Cms.Web.Mvc.Controllers.BackOffice.INotificationController' Rebel.Cms.Web.Model.BackOffice.Editors.ClientNotifications
Rebel.Cms.Web,Rebel.Cms.Web.Mvc.ActionInvokers,,Rebel.Cms.Web.Context.IRoutableRequestContext' Rebel.Cms.Web.Context.IRequiresRoutableRequestContext' Rebel.Cms.Web.Mvc.Controllers.ControllerExtender' Rebel.Cms.Web.Mvc.Controllers.ExtenderDefinition' Rebel.Cms.Web.Mvc.Controllers.ExtenderData' Rebel.Cms.Web.Context.IBackOfficeRequestContext' Rebel.Cms.Web.Model.BackOffice.DashboardItemModel' Rebel.Cms.Web.Dashboards.Filters.DashboardFilter' Rebel.Cms.Web.DependencyManagement.ComponentRegistrations' Rebel.Cms.Web.Dashboards.Rules.DashboardRuleMetadata' Rebel.Cms.Web.Configuration.Dashboards.MatchElement' Rebel.Cms.Web.Dashboards.Rules.DashboardMatchRule' Rebel.Cms.Web.Configuration.Dashboards.MatchFilterCollection' Rebel.Cms.Web.Configuration.Dashboards.MatchFilterElement' Rebel.Framework.Mandate' Rebel.Cms.Web.Context.IRequiresBackOfficeRequestContext' Rebel.Cms.Web.Mvc.ActionFilters.RebelInstallAuthorizeAttribute' Rebel.Cms.Web.Mvc.Controllers.RebelController
Rebel.Cms.Web,Rebel.Cms.Web.Mvc.ControllerFactories,,Rebel.Framework.Mandate' Rebel.Cms.Web.Context.IRebelApplicationContext' Rebel.Framework.Configuration.PluginManagerConfiguration' Rebel.Cms.Web.Configuration.RebelSettings' Rebel.Framework.Configuration.PluginManagerShadowCopyType' Rebel.Framework.Diagnostics.LogHelper' Rebel.Cms.Web.ControllerExtensions' Rebel.Cms.Web.Mvc.Controllers.RebelController
Rebel.Cms.Web,Rebel.Cms.Web.Mvc.Controllers.BackOffice,Rebel.Cms.Web.Mvc.ActionFilters.SupportsPathGeneration' Rebel.Cms.Web.Mvc.Areas.InstallAreaRegistration' Rebel.Cms.Web.Mvc.ActionFilters.SupportClientNotificationsAttribute' Rebel.Cms.Web.Trees.ApplicationTreeController' Rebel.Cms.Web.Editors.Extenders.ContentControllerExtenderBase' Rebel.Cms.Web.ControllerExtensions' Rebel.Cms.Web.Mvc.ActionFilters.HandleAuthorizationErrors' Rebel.Cms.Web.Mvc.Areas.RebelAreaRegistration,Rebel.Framework.Security.Model.Entities.User' Rebel.Framework.Persistence.Model.Attribution.MetaData.EntitySchema' Rebel.Cms.Web.UpgradeHelper' Rebel.Hive.ProviderGrouping.IEntityRepositoryGroup' Rebel.Hive.ProviderGrouping.IGroupUnit' Rebel.Framework.Security.Model.FixedEntities' Rebel.Hive.ProviderGrouping.ISchemaRepositoryGroup' Rebel.Framework.Security.Model.FixedSchemas' Rebel.Hive.ProviderGrouping.IReadonlyEntityRepositoryGroup' Rebel.Hive.ProviderGrouping.IReadonlyGroupUnit' Rebel.Framework.Persistence.Model.TypedEntity' Rebel.Framework.Persistence.Model.Constants.AttributeDefinitions.NodeNameAttributeDefinition' Rebel.Framework.Persistence.Model.Attribution.MetaData.AttributeDefinition' Rebel.Framework.Persistence.Model.Attribution.TypedAttribute' Rebel.Framework.Persistence.Model.Attribution.TypedAttributeCollection' Rebel.Framework.Persistence.Model.Attribution.TypedAttributeValueCollection' Rebel.Framework.Persistence.Model.Constants.FixedRelationTypes' Rebel.Framework.Persistence.Model.Associations.IRelationById' Rebel.Framework.Security.Model.FixedHiveIds' Rebel.Framework.Persistence.Model.Constants.FixedHiveIds' Rebel.Framework.Persistence.Model.Constants.Schemas.MediaImageSchema' Rebel.Framework.Persistence.IAttributeTypeRegistry' Rebel.Framework.Persistence.AttributeTypeRegistry' Rebel.Framework.EntityPathCollection' Rebel.Cms.Web.Context.IBackOfficeRequestContext' Rebel.Cms.Web.Routing.IRoutingEngine' Rebel.Framework.HiveId' Rebel.Cms.Web.Context.IRenderModelFactory' Rebel.Cms.Web.Macros.MacroRenderer' Rebel.Cms.Web.Context.IRoutableRequestContext' Rebel.Cms.Web.Model.IRebelRenderModel' Rebel.Cms.Web.Model.Content' Rebel.Hive.IHiveManager' Rebel.Cms.Web.Context.IRebelApplicationContext' Rebel.Framework.TypeMapping.MappingEngineCollection' Rebel.Framework.Context.IFrameworkContext' Rebel.Hive.ProviderGrouping.GroupUnitFactory' Rebel.Cms.Web.Model.BackOffice.Editors.MediaEditorModel' Rebel.Cms.Web.Model.BackOffice.Editors.DocumentTypeEditorModel' Rebel.Framework.Persistence.Model.Constants.FixedStatusTypes' Rebel.Cms.Web.Model.BackOffice.Editors.DocumentTypeProperty' Rebel.Cms.Web.Model.BackOffice.Editors.DataType' Rebel.Cms.Web.CorePluginConstants' Rebel.Hive.ProviderGrouping.IRevisionRepositoryGroup' Rebel.Framework.Persistence.Model.IO.File' Rebel.Framework.Mandate' Rebel.Cms.Web.Model.BackOffice.TreePickerRenderModel' Rebel.Framework.Security.Model.Entities.Member' Rebel.Cms.Web.DependencyManagement.ComponentRegistrations' Rebel.Cms.Web.Model.BackOffice.Trees.TreeMetadata' Rebel.Framework.Security.IMembershipService' Rebel.Framework.Security.ISecurityService' Rebel.Cms.Web.Packaging.PackageInstallUtility' Rebel.Framework.ProviderSupport.InstallStatus' Rebel.Framework.Configuration.DeepConfigManager' Rebel.Hive.AbstractProviderBootstrapper' Rebel.Hive.ProviderSetup' Rebel.Framework.ProviderSupport.InstallStatusType' Rebel.Framework.Persistence.ProviderSupport._Revised.ProviderMetadata' Rebel.Cms.Web.Model.Install.DatabaseInstallModel' Rebel.Cms.Web.Model.Install.DatabaseServerType' Rebel.Cms.Web.Model.Install.CreateNewUserModel' Rebel.Framework.Security.Model.Entities.UserGroup' Rebel.Framework.Diagnostics.LogHelper' Rebel.Cms.Web.Model.BackOffice.PackageModel' Rebel.Cms.Web.Packaging.PackageInstallation' Rebel.Cms.Web.Packaging.IPackageContext' Rebel.Cms.Web.Mvc.ActionFilters.SuccessfulOnRedirectAttribute' Rebel.Cms.Web.Context.RebelApplicationContext' Rebel.Framework.Tasks.TaskExecutionContext' Rebel.Framework.Tasks.ProviderInstallTask' Rebel.Framework.Tasks.ApplicationTaskManager' Rebel.Framework.Hive' Rebel.Framework.TaskTriggers' Rebel.Cms.Web.Model.BackOffice.PackageInstallationState' Rebel.Cms.Web.Model.BackOffice.Editors.ClientNotifications' Rebel.Cms.Web.Model.BackOffice.Editors.NotificationType' Rebel.Cms.Web.Model.BackOffice.LoginDisplayType' Rebel.Cms.Web.Security.UserData' Rebel.Cms.Web.Model.BackOffice.LoginModel' Rebel.Cms.Web.Model.BackOffice.BackOfficeDefaultModel' Rebel.Cms.Web.Security.RebelBackOfficeIdentity' Rebel.Cms.Web.Configuration.RebelSettings' Rebel.Cms.Web.Model.BackOffice.ApplicationTrayModel
Rebel.Cms.Web,Rebel.Cms.Web.Mvc.Controllers,Rebel.Cms.Web.Mvc.ActionInvokers.ControllerExtenderActionInvoker' Rebel.Cms.Web.RouteDataExtensions' Rebel.Cms.Web.UrlHelperExtensions' Rebel.Cms.Web.DependencyManagement.RebelComponentRegistrar' Rebel.Cms.Web.Mvc.ActionInvokers.RebelActionInvoker' Rebel.Cms.Web.Mvc.ControllerFactories.RenderControllerFactory' Rebel.Cms.Web.Routing.RenderRouteHandler' Rebel.Cms.Web.Mvc.Areas.RebelAreaRegistration' Rebel.Cms.Web.Editors.AbstractUserEditorController<TUserType;TEditorModel>' Rebel.Cms.Web.Editors.AbstractSchemaEditorController<TEditorModel;TCreateModel>' Rebel.Cms.Web.Editors.AbstractRevisionalContentEditorController<TEditorModel>' Rebel.Cms.Web.Editors.AbstractFileEditorController' Rebel.Cms.Web.Editors.Extenders.ContentControllerExtenderBase,Rebel.Cms.Web.Context.IRoutableRequestContext' Rebel.Cms.Web.Context.IRebelApplicationContext' Rebel.Framework.Persistence.Model.TypedEntity' Rebel.Framework.Security.Model.Entities.Member' Rebel.Framework.Persistence.Model.Attribution.TypedAttribute' Rebel.Framework.HiveId' Rebel.Framework.Persistence.Model.IO.File' Rebel.Framework.Persistence.Model.Associations.IReadonlyRelation' Rebel.Hive.IHiveManager' Rebel.Hive.ProviderGrouping.IReadonlyEntityRepositoryGroup' Rebel.Hive.ProviderGrouping.IReadonlyGroupUnit' Rebel.Framework.Security.IMembershipService' Rebel.Framework.Security.ISecurityService' Rebel.Framework.Security.PublicAccessStatusResult' Rebel.Framework.Security.IPublicAccessService' Rebel.Framework.Persistence.Model.Attribution.TypedAttributeCollection' Rebel.Framework.Persistence.Model.Attribution.MetaData.AttributeType' Rebel.Framework.Persistence.Model.Attribution.MetaData.AttributeDefinition' Rebel.Cms.Web.CorePluginConstants' Rebel.Framework.Persistence.Model.Constants.FixedRelationTypes' Rebel.Framework.Persistence.Model.Associations.RelationMetaDatum' Rebel.Framework.Persistence.Model.Associations.RelationMetaDataCollection' Rebel.Cms.Web.ControllerExtensions' Rebel.Cms.Web.Caching.ContentCacheManager' Rebel.Cms.Web.Model.IRebelRenderModel' Rebel.Cms.Web.EmbeddedViewEngine.EmbeddedViewPath' Rebel.Framework.Diagnostics.LogHelper' Rebel.Framework.AbstractFinalizer' Rebel.Framework.Context.IFrameworkContext' Rebel.Cms.Web.Mvc.RebelPageResult' Rebel.Cms.Web.Mvc.RedirectToRebelPageResult' Rebel.Cms.Web.Routing.RouteDefinition
Rebel.Cms.Web,Rebel.Cms.Web.Mvc,Rebel.Cms.Packages.DevDataset.DevDataset' Rebel.Cms.Web.Editors.AbstractSchemaEditorController<TEditorModel;TCreateModel>' Rebel.Cms.Web.Mvc.Controllers.RebelController' Rebel.Cms.Web.Surface.SurfaceController' Rebel.Cms.Web.Trees.ApplicationTreeController' Rebel.Cms.Web.Editors.AbstractUserEditorController<TUserType;TEditorModel>' Rebel.Cms.Web.Editors.AbstractFileEditorController' Rebel.Cms.Web.Editors.MacroEditorController' Rebel.Cms.Web.Editors.DataTypeEditorController' Rebel.Cms.Web.Editors.Extenders.PublicAccessController' Rebel.Cms.Web.Editors.Extenders.LanguageController' Rebel.Cms.Web.Editors.Extenders.RollbackController' Rebel.Cms.Web.Editors.Extenders.HostnameController' Rebel.Cms.Web.Editors.Extenders.MoveCopyController' Rebel.Cms.Web.Editors.Extenders.PermissionsController' Rebel.Cms.Web.Editors.Extenders.PublishController' Rebel.Cms.Web.Editors.Extenders.SortController' Rebel.Cms.Web.PropertyEditors.NodeSelector.NodeSelectorUtilityController' Rebel.Cms.Web.PropertyEditors.RichTextBox.TinyMCE.Controllers.InsertMediaController' Rebel.Cms.Web.PropertyEditors.NodeSelector.NodeSelectorUtilityController' Rebel.Cms.Web.PropertyEditors.RichTextBox.TinyMCE.Controllers.InsertMediaController,Rebel.Framework.Persistence.Model.TypedEntity' Rebel.Framework.HiveId' Rebel.Cms.Web.Context.IRoutableRequestContext' Rebel.Framework.Mandate' Rebel.Cms.Web.Routing.RouteDefinition' Rebel.Framework.DisposableTimer
Rebel.Cms.Web,Rebel.Cms.Web.Mvc.ModelBinders.BackOffice,,Rebel.Cms.Web.Context.IRebelApplicationContext' Rebel.Cms.Web.Model.BackOffice.Editors.DocumentTypeProperty' Rebel.Cms.Web.Model.BackOffice.Editors.DataType' Rebel.Framework.Persistence.Model.Attribution.MetaData.AttributeType' Rebel.Framework.HiveId' Rebel.Hive.IHiveManager' Rebel.Hive.ProviderGrouping.IReadonlySchemaRepositoryGroup' Rebel.Hive.ProviderGrouping.IReadonlyEntityRepositoryGroup' Rebel.Hive.ProviderGrouping.IReadonlyGroupUnit' Rebel.Framework.TypeMapping.MappingEngineCollection' Rebel.Framework.Context.IFrameworkContext' Rebel.Framework.AttemptTuple' Rebel.Cms.Web.Model.BackOffice.Editors.FileEditorModel
Rebel.Cms.Web,Rebel.Cms.Web.Mvc.ViewEngines,,Rebel.Cms.Web.Context.IRoutableRequestContext' Rebel.Cms.Web.Context.IRequiresRoutableRequestContext' Rebel.Cms.Web.Context.IRenderModelFactory' Rebel.Cms.Web.Context.IRequiresRebelHelper' Rebel.Cms.Web.RenderViewPage' Rebel.Cms.Web.Model.IRebelRenderModel' Rebel.Cms.Web.RenderViewPageContext' Rebel.Cms.Web.Context.IRequiresBackOfficeRequestContext' Rebel.Cms.Web.Configuration.RebelSettings' Rebel.Cms.Web.Configuration.RebelSystem.RebelFoldersElement' Rebel.Cms.Web.Packaging.IPackageContext' Rebel.Framework.Configuration.PluginManagerConfiguration' Rebel.Cms.Web.Configuration.RebelSystem.RebelPathsElement
Rebel.Cms.Web,Rebel.Cms.Web.Packaging,Rebel.Cms.Web.Editors.PackagingEditorController' Rebel.Cms.Web.Trees.PackagingTreeController' Rebel.Cms.Web.Mvc.Controllers.BackOffice.InstallController' Rebel.Cms.Web.Context.DefaultBackOfficeRequestContext' Rebel.Cms.Web.Macros.PartialViewMacroEngine' Rebel.Cms.Web.Mvc.ViewEngines.PluginViewEngine,Rebel.Framework.Persistence.Model.PackageDefinition' Rebel.Framework.Persistence.Model.TypedEntity' Rebel.Cms.Web.Model.BackOffice.Editors.MacroEditorModel' Rebel.Hive.IHiveManager' Rebel.Cms.Web.Context.IRebelApplicationContext' Rebel.Framework.HiveId' Rebel.Hive.ProviderGrouping.IReadonlyEntityRepositoryGroup' Rebel.Hive.ProviderGrouping.IReadonlyGroupUnit' Rebel.Framework.Persistence.Model.Constants.FixedRelationTypes' Rebel.Framework.Persistence.Model.Associations.IRelationById' Rebel.Framework.Persistence.Model.Attribution.TypedAttributeCollection' Rebel.Framework.Persistence.Model.Attribution.MetaData.AttributeType' Rebel.Framework.Persistence.Model.Attribution.MetaData.AttributeDefinition' Rebel.Framework.Persistence.Model.Attribution.TypedAttribute' Rebel.Cms.Web.CorePluginConstants' Rebel.Hive.ProviderGrouping.IReadonlySchemaRepositoryGroup' Rebel.Framework.Persistence.Model.Attribution.MetaData.EntitySchema' Rebel.Cms.Web.Macros.MacroSerializer' Rebel.Cms.Web.Configuration.RebelSettings' Rebel.Cms.Web.Configuration.Languages.LanguageElement' Rebel.Framework.Serialization.IStreamedResult' Rebel.Framework.Serialization.AbstractSerializationService' Rebel.Framework.Context.IFrameworkContext' Rebel.Framework.Persistence.Model.IO.File' Rebel.Hive.ProviderGrouping.IEntityRepositoryGroup' Rebel.Hive.ProviderGrouping.IGroupUnit' Rebel.Cms.Web.Context.IBackOfficeRequestContext' Rebel.Framework.Configuration.PluginManagerConfiguration' Rebel.Framework.Mandate' Rebel.Cms.Web.Model.BackOffice.Editors.DataType' Rebel.Cms.Web.Model.BackOffice.PropertyEditors.PreValueModel' Rebel.Hive.ProviderGrouping.ISchemaRepositoryGroup' Rebel.Framework.Persistence.Model.Associations.RelationMetaDataCollection' Rebel.Framework.TypeMapping.MappingEngineCollection' Rebel.Cms.Web.ContentExtensions' Rebel.Framework.Persistence.Model.Associations.Relation' Rebel.Framework.Persistence.Model.Attribution.MetaData.AttributeGroup' Rebel.Cms.Web.Configuration.RebelSystem.RebelFoldersElement' Rebel.Cms.Web.Configuration.RebelSystem.PackageRepositoryElement' Rebel.Cms.Web.Model.BackOffice.PackageFolder' Rebel.Cms.Web.Model.BackOffice.PackageInstallationState' Rebel.Framework.Tasks.ApplicationTaskManager' Rebel.Framework.TaskTriggers' Rebel.Framework.Tasks.TaskExecutionContext
Rebel.Cms.Web,Rebel.Cms.Web.Routing,Rebel.Cms.Web.Mvc.Controllers.RebelController' Rebel.Cms.Web.Mvc.RebelPageResult' Rebel.Cms.Web.EntityRouteResultExtensions' Rebel.Cms.Web.Context.DefaultRenderModelFactory' Rebel.Cms.Web.Editors.Extenders.HostnameController' Rebel.Cms.Web.FieldRenderer' Rebel.Cms.Web.RoutingEngineExtensions' Rebel.Cms.Web.RebelHelper' Rebel.Cms.Web.Context.DefaultBackOfficeRequestContext' Rebel.Cms.Web.Context.RoutableRequestContext' Rebel.Cms.Web.Mvc.ActionFilters.PublicAccessAuthorizeAttribute' Rebel.Cms.Web.Mvc.Controllers.BackOffice.ContentController' Rebel.Cms.Web.Editors.ContentEditorController' Rebel.Cms.Web.Editors.AbstractRevisionalContentEditorController<TEditorModel>' Rebel.Cms.Web.Editors.Extenders.MoveCopyController' Rebel.Cms.Web.PropertyEditors.RichTextBox.TinyMCE.Controllers.InsertMediaController' Rebel.Cms.Web.PropertyEditors.RichTextBox.TinyMCE.Controllers.InsertMediaController' Rebel.Cms.Web.UrlResolutionResultExtensions' Rebel.Cms.Web.DependencyManagement.DemandBuilders.MvcTypesDemandBuilder' Rebel.Cms.Web.DependencyManagement.DemandBuilders.RebelContainerBuilder<TWebApp>,Rebel.Cms.Web.Context.IRebelApplicationContext' Rebel.Cms.Web.Model.BackOffice.ControllerPluginMetadata' Rebel.Cms.Web.Configuration.RebelSystem.RebelPathsElement' Rebel.Cms.Web.Configuration.RebelSettings' Rebel.Framework.Persistence.Model.TypedEntity' Rebel.Framework.HiveId' Rebel.Framework.RevisionStatusType' Rebel.Cms.Web.Context.IRenderModelFactory' Rebel.Cms.Web.Model.IRebelRenderModel' Rebel.Framework.Persistence.Model.IO.File' Rebel.Cms.Web.Mvc.Controllers.RebelController' Rebel.Cms.Web.Model.Content' Rebel.Hive.IHiveManager' Rebel.Hive.ProviderGrouping.IReadonlyEntityRepositoryGroup' Rebel.Hive.ProviderGrouping.IReadonlyGroupUnit' Rebel.Cms.Web.Model.Template' Rebel.Framework.Persistence.Model.Attribution.MetaData.EntitySchema' Rebel.Framework.Diagnostics.LogHelper' Rebel.Framework.StringAliasCaseType' Rebel.Framework.AbstractApplicationCache' Rebel.Framework.Context.IFrameworkContext' Rebel.Hive.ProviderGrouping.ReadonlyGroupUnitFactory' Rebel.Framework.AttemptTuple' Rebel.Framework.Persistence.Model.Associations.IRelationById' Rebel.Framework.Mandate' Rebel.Framework.DisposableTimer' Rebel.Framework.Persistence.Model.Constants.FixedHiveIds' Rebel.Framework.Persistence.Model.Constants.FixedRelationTypes' Rebel.Framework.Persistence.Model.IRelatableEntity' Rebel.Framework.Persistence.Model.Constants.AttributeDefinitions.NodeNameAttributeDefinition' Rebel.Framework.Persistence.Model.Constants.FixedStatusTypes
