Project,Namespace,Ca types,Ce types
Rebel.Cms.Web,Rebel.Cms.Web.Context,Rebel.Cms.Web.Mvc.ViewEngines.RebelHelperViewPageActivator' Rebel.Cms.Packages.SnapshotDashboard.Controllers.CreateSnapshotDashboardController' Rebel.Cms.Packages.SystemInfo.Controllers.SystemInfoTreeController' Rebel.Cms.Web.RebelHelper' Rebel.Cms.Web.RebelWebApplication' Rebel.Cms.Web.AreaRegistrationExtensions' Rebel.Cms.Web.TreeNodeExtensions' Rebel.Cms.Web.RebelApplicationContextExtensions' Rebel.Cms.Web.Caching.ContentCacheManager' Rebel.Cms.Web.Dictionary.DictionaryHelper' Rebel.Cms.Web.Macros.ChildActionMacroEngine' Rebel.Cms.Web.Macros.PartialViewMacroEngine' Rebel.Cms.Web.Macros.MacroRenderer' Rebel.Cms.Web.Mvc.ActionFilters.InternationalizeAttribute' Rebel.Cms.Web.Mvc.ActionFilters.PublicAccessAuthorizeAttribute' Rebel.Cms.Web.Mvc.ActionFilters.RebelAuthorizeAttribute' Rebel.Cms.Web.Mvc.ActionFilters.InstalledFilterAttribute' Rebel.Cms.Web.Mvc.ActionFilters.RebelInstallAuthorizeAttribute' Rebel.Cms.Web.Mvc.ControllerFactories.PluginControllerFactory' Rebel.Cms.Web.Mvc.ControllerFactories.RenderControllerFactory' Rebel.Cms.Web.Mvc.Controllers.BackOffice.MacroController' Rebel.Cms.Web.Mvc.Controllers.BackOffice.MediaController' Rebel.Cms.Web.Mvc.Controllers.BackOffice.TreePickerController' Rebel.Cms.Web.Mvc.Controllers.BackOffice.InstallController' Rebel.Cms.Web.Mvc.Controllers.BackOffice.DefaultController' Rebel.Cms.Web.Mvc.Controllers.MediaProxyController' Rebel.Cms.Web.Mvc.Controllers.RebelController' Rebel.Cms.Web.Mvc.ModelBinders.BackOffice.DocumentTypePropertyModelBinder' Rebel.Cms.Web.Packaging.PackageBuilderHelper' Rebel.Cms.Web.Packaging.PackageInstallation' Rebel.Cms.Web.Packaging.PackageLogger' Rebel.Cms.Web.Packaging.PackageInstallUtility' Rebel.Cms.Web.Routing.BackOfficeRouteConstraint' Rebel.Cms.Web.Routing.IgnorePluginRoute' Rebel.Cms.Web.Routing.IgnoreExistingControllersConstraint' Rebel.Cms.Web.Routing.RenderRouteConstraint' Rebel.Cms.Web.Routing.RenderRouteHandler' Rebel.Cms.Web.Routing.DefaultRoutingEngine' Rebel.Cms.Web.Security.MembersMembershipProvider' Rebel.Cms.Web.Security.AbstractRebelRoleProvider<TUserType>' Rebel.Cms.Web.Security.AbstractRebelMembershipProvider' Rebel.Cms.Web.Model.RebelRenderModel' Rebel.Cms.Web.Editors.DashboardEditorController' Rebel.Cms.Web.Tasks.AbstractWebTask' Rebel.Cms.Web.System.Boot.BootManager' Rebel.Cms.Web.System.Boot.RenderBootstrapper' Rebel.Cms.Web.Mvc.Areas.PackageAreaRegistration' Rebel.Cms.Web.Mvc.Areas.RebelAreaRegistration' Rebel.Cms.Web.Trees.ApplicationTreeController' Rebel.Cms.Web.Trees.SupportsEditorTreeController' Rebel.Cms.Web.Editors.AbstractUserEditorController<TUserType;TEditorModel>' Rebel.Cms.Web.Editors.AbstractSchemaEditorController<TEditorModel;TCreateModel>' Rebel.Cms.Web.Editors.AbstractUserGroupEditorController' Rebel.Cms.Web.Editors.ContentEditorController' Rebel.Cms.Web.Editors.MacroPartialsEditorController' Rebel.Cms.Web.Editors.DictionaryEditorController' Rebel.Cms.Web.Editors.MemberEditorController' Rebel.Cms.Web.Editors.MemberGroupEditorController' Rebel.Cms.Web.Editors.PartialsEditorController' Rebel.Cms.Web.Editors.AbstractRevisionalContentEditorController<TEditorModel>' Rebel.Cms.Web.Editors.AbstractFileEditorController' Rebel.Cms.Web.Editors.LanguageEditorController' Rebel.Cms.Web.Editors.MacroEditorController' Rebel.Cms.Web.Editors.MediaEditorController' Rebel.Cms.Web.Editors.DocumentTypeEditorController' Rebel.Cms.Web.Editors.DataTypeEditorController' Rebel.Cms.Web.Editors.PackagingEditorController' Rebel.Cms.Web.Editors.ScriptEditorController' Rebel.Cms.Web.Editors.StylesheetEditorController' Rebel.Cms.Web.Editors.TemplateEditorController' Rebel.Cms.Web.Editors.UserEditorController' Rebel.Cms.Web.Editors.UserGroupEditorController' Rebel.Cms.Web.Editors.Extenders.PublicAccessController' Rebel.Cms.Web.Editors.Extenders.LanguageController' Rebel.Cms.Web.Editors.Extenders.HostnameController' Rebel.Cms.Web.Editors.Extenders.MoveCopyController' Rebel.Cms.Web.Editors.Extenders.PermissionsController' Rebel.Cms.Web.Editors.Extenders.PublishController' Rebel.Cms.Web.Editors.Dialogs.InsertPartialEditorController' Rebel.Cms.Web.Editors.Dialogs.InsertMacroEditorController' Rebel.Cms.Web.Editors.Dialogs.ImplementSectionEditorController' Rebel.Cms.Web.Editors.Dialogs.InsertFieldEditorController' Rebel.Cms.Web.PropertyEditors.NodeSelector.CSharpExpressionsUtility' Rebel.Cms.Web.PropertyEditors.NodeSelector.NodeSelectorContentTreeControllerHelper' Rebel.Cms.Web.PropertyEditors.UserGroupPicker.UserGroupPickerEditor' Rebel.Cms.Web.PropertyEditors.UserGroupPicker.UserGroupPickerEditorModel' Rebel.Cms.Web.PropertyEditors.RichTextBox.TinyMCE.Controllers.InsertMediaController' Rebel.Cms.Web.PropertyEditors.RichTextBox.TinyMCE.Controllers.InsertMacroController' Rebel.Cms.Web.PropertyEditors.TypePicker.TypePickerEditor' Rebel.Cms.Web.PropertyEditors.TypePicker.TypePickerEditorModel' Rebel.Cms.Web.PropertyEditors.RebelSystemEditors.DictionaryItemTranslations.DictionaryItemTranslationsEditor' Rebel.Cms.Web.PropertyEditors.RebelSystemEditors.SelectedTemplate.SelectedTemplateEditor' Rebel.Cms.Web.PropertyEditors.RebelSystemEditors.NodeName.NodeNameEditor' Rebel.Cms.Web.PropertyEditors.RichTextBox.RichTextBoxEditor' Rebel.Cms.Web.PropertyEditors.RichTextBox.RichTextBoxEditorModel' Rebel.Cms.Web.PropertyEditors.RichTextBox.RichTextBoxPreValueModel' Rebel.Cms.Web.PropertyEditors.RebelSystemEditors.UserGroupUsers.UserGroupUsersEditorModel' Rebel.Cms.Web.PropertyEditors.Upload.UploadEditorModel' Rebel.Cms.Web.Tasks.ConfigurationTaskBuilder' Rebel.Cms.Web.Tasks.PublishNodeTask' Rebel.Cms.Web.Trees.AbstractUserGroupTree' Rebel.Cms.Web.Trees.ContentTreeController' Rebel.Cms.Web.Trees.DataTypeTreeController' Rebel.Cms.Web.Trees.DictionaryTreeController' Rebel.Cms.Web.Trees.DocumentTypeTreeController' Rebel.Cms.Web.Trees.LanguageTreeController' Rebel.Cms.Web.Trees.MediaTreeController' Rebel.Cms.Web.Trees.MemberTreeController' Rebel.Cms.Web.Trees.PackagingTreeController' Rebel.Cms.Web.Trees.RecycleBinTreeController' Rebel.Cms.Web.Trees.UserTreeController' Rebel.Cms.Web.PropertyEditors.NodeSelector.CSharpExpressionsUtility' Rebel.Cms.Web.PropertyEditors.NodeSelector.NodeSelectorContentTreeControllerHelper' Rebel.Cms.Web.PropertyEditors.UserGroupPicker.UserGroupPickerEditor' Rebel.Cms.Web.PropertyEditors.UserGroupPicker.UserGroupPickerEditorModel' Rebel.Cms.Web.PropertyEditors.RichTextBox.TinyMCE.Controllers.InsertMediaController' Rebel.Cms.Web.PropertyEditors.RichTextBox.TinyMCE.Controllers.InsertMacroController' Rebel.Cms.Web.PropertyEditors.TypePicker.TypePickerEditor' Rebel.Cms.Web.PropertyEditors.TypePicker.TypePickerEditorModel' Rebel.Cms.Web.PropertyEditors.RebelSystemEditors.DictionaryItemTranslations.DictionaryItemTranslationsEditor' Rebel.Cms.Web.PropertyEditors.RebelSystemEditors.SelectedTemplate.SelectedTemplateEditor' Rebel.Cms.Web.PropertyEditors.RebelSystemEditors.NodeName.NodeNameEditor' Rebel.Cms.Web.PropertyEditors.RichTextBox.RichTextBoxEditor' Rebel.Cms.Web.PropertyEditors.RichTextBox.RichTextBoxEditorModel' Rebel.Cms.Web.PropertyEditors.RichTextBox.RichTextBoxPreValueModel' Rebel.Cms.Web.PropertyEditors.RebelSystemEditors.UserGroupUsers.UserGroupUsersEditorModel' Rebel.Cms.Web.PropertyEditors.Upload.UploadEditorModel' Rebel.Cms.Web.Mapping.AttributeTypeToPropertyEditorPackageName' Rebel.Cms.Web.Mapping.MembershipUserToUser<TUser>' Rebel.Cms.Web.Mapping.RenderTypesModelMapper' Rebel.Cms.Web.Mapping.UserEditorModelToTypedEntity' Rebel.Cms.Web.Mapping.DocumentTypePropertyToAttributeDefinition' Rebel.Cms.Web.Mapping.DocumentTypePropertyToAttributeType' Rebel.Cms.Web.Mapping.ContentEditorModelToTypedEntity<TContentModel;TTypedEntity>' Rebel.Cms.Web.Mapping.DocumentTypePropertyToAttributeGroup' Rebel.Cms.Web.Mapping.StandardMemberMapper<TFrom;TTo>' Rebel.Cms.Web.Mapping.TypedEntityToContentEditorModel<TEntity;TContent>' Rebel.Cms.Web.Mapping.CmsModelMapper' Rebel.Cms.Web.Mapping.TypedEntityToContentProperties<TEntity>' Rebel.Cms.Web.Mapping.SchemaEditorModelToEntitySchema<TEditorModel>' Rebel.Cms.Web.Mapping.ContentEditorModelToEntitySchema<TInput>' Rebel.Cms.Web.Mapping.AttributeTypeToPropertyEditorId' Rebel.Cms.Web.Tasks.ConfigurationTask' Rebel.Cms.Web.Tasks.CopyFileTask' Rebel.Cms.Web.Tasks.DisplayUITask' Rebel.Cms.Packages.SystemInfo.Controllers.SystemInfoEditorController' Rebel.Cms.Web.Macros.AbstractMacroEngine' Rebel.Cms.Web.Mvc.ActionFilters.SupportsPathGeneration' Rebel.Cms.Web.Mvc.ActionFilters.SuccessfulOnRedirectAttribute' Rebel.Cms.Web.Mvc.ActionInvokers.DashboardActionInvoker' Rebel.Cms.Web.Mvc.ActionInvokers.RebelBackOfficeActionInvoker' Rebel.Cms.Web.Mvc.ActionInvokers.RebelInstallActionInvoker' Rebel.Cms.Web.Mvc.Controllers.BackOffice.ContentController' Rebel.Cms.Web.Mvc.Controllers.BackOffice.SecuredBackOfficeController' Rebel.Cms.Web.Mvc.Controllers.BackOffice.BackOfficeController' Rebel.Cms.Web.Editors.AbstractEditorController' Rebel.Cms.Web.Editors.StandardEditorController' Rebel.Cms.Web.Trees.TreeController' Rebel.Cms.Web.Editors.AbstractContentEditorController' Rebel.Cms.Web.Editors.MemberTypeEditorController' Rebel.Cms.Web.Editors.MediaTypeEditorController' Rebel.Cms.Web.Editors.Extenders.ContentControllerExtenderBase' Rebel.Cms.Web.Editors.Extenders.RollbackController' Rebel.Cms.Web.Editors.Extenders.SortController' Rebel.Cms.Web.Editors.Dialogs.DefineSectionEditorController' Rebel.Cms.Web.PropertyEditors.NodeSelector.AbstractNodeFilter' Rebel.Cms.Web.PropertyEditors.NodeSelector.AbstractStartNodeQuery' Rebel.Cms.Web.PropertyEditors.NodeSelector.NodeSelectorMediaTreeController' Rebel.Cms.Web.PropertyEditors.NodeSelector.NodeSelectorEditor' Rebel.Cms.Web.PropertyEditors.NodeSelector.NodeSelectorEditorModel' Rebel.Cms.Web.PropertyEditors.NodeSelector.NodeSelectorContentTreeController' Rebel.Cms.Web.PropertyEditors.NodeSelector.NodeSelectorUtilityController' Rebel.Cms.Web.PropertyEditors.RichTextBox.TinyMCE.Controllers.InsertLinkController' Rebel.Cms.Web.PropertyEditors.RichTextBox.TinyMCE.Controllers.InsertCharController' Rebel.Cms.Web.PropertyEditors.RichTextBox.TinyMCE.Controllers.InsertAnchorController' Rebel.Cms.Web.PropertyEditors.RebelSystemEditors.UserGroupUsers.UserGroupUsersEditor' Rebel.Cms.Web.PropertyEditors.Upload.UploadEditor' Rebel.Cms.Web.Trees.MemberTypeTreeController' Rebel.Cms.Web.Trees.MacroPartialsTreeController' Rebel.Cms.Web.Trees.AbstractFileSystemTreeController' Rebel.Cms.Web.Trees.MacroTreeController' Rebel.Cms.Web.Trees.MediaTypeTreeController' Rebel.Cms.Web.Trees.MemberGroupTreeController' Rebel.Cms.Web.Trees.PartialsTreeController' Rebel.Cms.Web.Trees.ScriptTreeController' Rebel.Cms.Web.Trees.StylesheetTreeController' Rebel.Cms.Web.Trees.TemplateTreeController' Rebel.Cms.Web.Trees.UserGroupTreeController' Rebel.Cms.Web.PropertyEditors.NodeSelector.AbstractNodeFilter' Rebel.Cms.Web.PropertyEditors.NodeSelector.AbstractStartNodeQuery' Rebel.Cms.Web.PropertyEditors.NodeSelector.NodeSelectorMediaTreeController' Rebel.Cms.Web.PropertyEditors.NodeSelector.NodeSelectorEditor' Rebel.Cms.Web.PropertyEditors.NodeSelector.NodeSelectorEditorModel' Rebel.Cms.Web.PropertyEditors.NodeSelector.NodeSelectorContentTreeController' Rebel.Cms.Web.PropertyEditors.NodeSelector.NodeSelectorUtilityController' Rebel.Cms.Web.PropertyEditors.RichTextBox.TinyMCE.Controllers.InsertLinkController' Rebel.Cms.Web.PropertyEditors.RichTextBox.TinyMCE.Controllers.InsertCharController' Rebel.Cms.Web.PropertyEditors.RichTextBox.TinyMCE.Controllers.InsertAnchorController' Rebel.Cms.Web.PropertyEditors.RebelSystemEditors.UserGroupUsers.UserGroupUsersEditor' Rebel.Cms.Web.PropertyEditors.Upload.UploadEditor' Rebel.Cms.Web.Mvc.ViewEngines.RebelContextViewPageActivator' Rebel.Cms.Web.Mvc.ActionInvokers.RoutableRequestActionInvoker' Rebel.Cms.Web.Mvc.ViewEngines.PostViewPageActivatorExtensions' Rebel.Cms.Web.FieldRenderer' Rebel.Cms.Web.RenderViewPageContext' Rebel.Cms.Web.Mvc.ActionInvokers.RebelActionInvoker' Rebel.Cms.Web.Mvc.RedirectToRebelPageResult' Rebel.Cms.Web.Mvc.ViewEngines.RenderViewPageActivator' Rebel.Cms.Web.Surface.SurfaceController' Rebel.Cms.Web.Dashboards.Rules.UserRoleMatchRule' Rebel.Cms.Web.Mvc.ViewEngines.RenderViewEngine' Rebel.Cms.Web.Mvc.ModelBinders.FrontEnd.RenderModelBinder,Rebel.Framework.Context.IFrameworkContext' Rebel.Hive.IHiveManager' Rebel.Cms.Web.IPropertyEditorFactory' Rebel.Cms.Web.IParameterEditorFactory' Rebel.Framework.Tasks.ApplicationTaskManager' Rebel.Framework.Hive' Rebel.Framework.TaskTriggers' Rebel.Cms.Web.Configuration.RebelSettings' Rebel.Framework.Security.ISecurityService' Rebel.Framework.Persistence.ProviderSupport._Revised.ProviderMetadata' Rebel.Hive.ProviderSetup' Rebel.Hive.AbstractProviderBootstrapper' Rebel.Cms.Web.DependencyManagement.ComponentRegistrations' Rebel.Cms.Web.Packaging.IPackageContext' Rebel.Cms.Web.Routing.IRoutingEngine' Rebel.Framework.AbstractFinalizer' Rebel.Cms.Web.Configuration.Tasks.ITaskParameter' Rebel.Cms.Web.Configuration.Tasks.ITask' Rebel.Cms.Web.Model.BackOffice.Editors.ContentEditorModel' Rebel.Framework.DisposableTimer' Rebel.Cms.Web.Model.RebelRenderModel' Rebel.Cms.Web.Model.IRebelRenderModel' Rebel.Framework.AbstractApplicationCache' Rebel.Framework.Caching.AbstractCacheProvider' Rebel.Framework.Context.IFrameworkCaches' Rebel.Framework.Diagnostics.LogHelper' Rebel.Cms.Web.Model.Content' Rebel.Cms.Web.Security.RebelBackOfficeIdentity' Rebel.Framework.HiveId' Rebel.Framework.Security.PermissionResults' Rebel.Framework.Persistence.Model.Constants.FixedEntities' Rebel.Framework.Persistence.Model.Constants.FixedStatusTypes' Rebel.Cms.Web.Routing.EntityRouteStatus' Rebel.Framework.TypeMapping.MappingEngineCollection' Rebel.Cms.Web.Model.Template' Rebel.Cms.Web.Security.Permissions.ViewPermission' Rebel.Cms.Web.Security.BackOfficeAuthenticationModule' Rebel.Framework.Security.IPermissionsService' Rebel.Cms.Web.Security.Permissions.CreatePermission' Rebel.Framework.Mandate
Rebel.Cms.Web,Rebel.Cms.Web.Configuration,Rebel.Cms.Web.AreaRegistrationExtensions' Rebel.Cms.Web.AuthenticationExtensions' Rebel.Cms.Web.UrlHelperExtensions' Rebel.Cms.Web.Context.RebelApplicationContext' Rebel.Cms.Web.Macros.ChildActionMacroEngine' Rebel.Cms.Web.Macros.PartialViewMacroEngine' Rebel.Cms.Web.Mvc.ControllerFactories.PluginControllerFactory' Rebel.Cms.Web.Mvc.Controllers.BackOffice.DefaultController' Rebel.Cms.Web.Mvc.ViewEngines.RenderViewEngine' Rebel.Cms.Web.Mvc.ViewEngines.PluginViewEngine' Rebel.Cms.Web.Packaging.PackageBuilderHelper' Rebel.Cms.Web.Packaging.PackageInstallation' Rebel.Cms.Web.Packaging.PackageLogger' Rebel.Cms.Web.Packaging.DefaultPackageContext' Rebel.Cms.Web.Routing.IgnoreExistingControllersConstraint' Rebel.Cms.Web.Security.BackOfficeAuthenticationModule' Rebel.Cms.Web.System.PluginManager' Rebel.Cms.Web.IO.ApplicationIconFileResolver' Rebel.Cms.Web.IO.DocumentTypeIconFileResolver' Rebel.Cms.Web.IO.DocumentTypeThumbnailFileResolver' Rebel.Cms.Web.Editors.DashboardEditorController' Rebel.Cms.Web.DependencyManagement.DemandBuilders.RebelContainerBuilder<TWebApp>' Rebel.Cms.Web.Templates.TemplateHelper' Rebel.Cms.Web.System.Boot.CmsBootstrapper' Rebel.Cms.Web.Mvc.Areas.InstallAreaRegistration' Rebel.Cms.Web.Mvc.Areas.PackageAreaRegistration' Rebel.Cms.Web.Mvc.Areas.RebelAreaRegistration' Rebel.Cms.Web.Trees.ApplicationTreeController' Rebel.Cms.Web.Editors.AbstractSchemaEditorController<TEditorModel;TCreateModel>' Rebel.Cms.Web.Editors.MemberEditorController' Rebel.Cms.Web.Editors.AbstractRevisionalContentEditorController<TEditorModel>' Rebel.Cms.Web.Editors.AbstractFileEditorController' Rebel.Cms.Web.Editors.LanguageEditorController' Rebel.Cms.Web.Editors.PackagingEditorController' Rebel.Cms.Web.Editors.UserEditorController' Rebel.Cms.Web.Editors.Extenders.LanguageController' Rebel.Cms.Web.PropertyEditors.NodeSelector.NodeSelectorContentTreeControllerHelper' Rebel.Cms.Web.PropertyEditors.ListPicker.DataSources.ApplicationsListPickerDataSource' Rebel.Cms.Web.PropertyEditors.RebelSystemEditors.DictionaryItemTranslations.DictionaryItemTranslationsEditor' Rebel.Cms.Web.PropertyEditors.RebelSystemEditors.NodeName.NodeNameEditor' Rebel.Cms.Web.Tasks.ConfigurationTaskBuilder' Rebel.Cms.Web.Trees.ContentTreeController' Rebel.Cms.Web.Trees.LanguageTreeController' Rebel.Cms.Web.Trees.RecycleBinTreeController' Rebel.Cms.Web.PropertyEditors.NodeSelector.NodeSelectorContentTreeControllerHelper' Rebel.Cms.Web.PropertyEditors.ListPicker.DataSources.ApplicationsListPickerDataSource' Rebel.Cms.Web.PropertyEditors.RebelSystemEditors.DictionaryItemTranslations.DictionaryItemTranslationsEditor' Rebel.Cms.Web.PropertyEditors.RebelSystemEditors.NodeName.NodeNameEditor,Rebel.Cms.Web.Configuration.RebelSystem.RebelSystemConfiguration' Rebel.Framework.Mandate
Rebel.Cms.Web,Rebel.Cms.Web.Dictionary,Rebel.Cms.Web.RebelHelper,Rebel.Hive.IHiveManager' Rebel.Cms.Web.Context.IRebelApplicationContext' Rebel.Cms.Web.Configuration.Languages.LanguageElement' Rebel.Hive.ProviderGrouping.ReadonlyGroupUnitFactory' Rebel.Framework.Persistence.Model.TypedEntity' Rebel.Hive.ProviderGrouping.IReadonlyEntityRepositoryGroup' Rebel.Hive.ProviderGrouping.IReadonlyGroupUnit' Rebel.Framework.Persistence.Model.Constants.FixedHiveIds' Rebel.Framework.Persistence.Model.Constants.Schemas.DictionaryItemSchema' Rebel.Cms.Web.Configuration.Languages.FallbackElement
Rebel.Cms.Web,Rebel.Cms.Web.FluentExtensions,Rebel.Cms.Web.CmsBuildStepExtensions,Rebel.Hive.IHiveManager' Rebel.Framework.Persistence.Model.Versioning.IRevision' Rebel.Cms.Web.Model.Content
Rebel.Cms.Web,Rebel.Cms.Web.Macros,Rebel.Cms.Web.Editors.MacroEditorController' Rebel.Cms.Web.DependencyManagement.RebelComponentRegistrar' Rebel.Cms.Web.Packaging.PackageBuilderHelper' Rebel.Cms.Web.Editors.Dialogs.InsertMacroEditorController' Rebel.Cms.Web.PropertyEditors.RichTextBox.TinyMCE.Controllers.InsertMacroController' Rebel.Cms.Web.PropertyEditors.RichTextBox.TinyMCE.Controllers.InsertMacroController' Rebel.Cms.Web.MacroModelExtensions' Rebel.Cms.Web.FieldRenderer' Rebel.Cms.Web.RebelHelper' Rebel.Cms.Web.Mvc.Controllers.BackOffice.MacroController' Rebel.Cms.Web.Tasks.ClearMacroCacheTask,Rebel.Cms.Web.Editors.EditorAttribute' Rebel.Cms.Web.Model.Content' Rebel.Cms.Web.Context.IRoutableRequestContext' Rebel.Cms.Web.Context.IBackOfficeRequestContext' Rebel.Framework.TypeFinder' Rebel.Cms.Web.ControllerExtensions' Rebel.Cms.Web.Surface.SurfaceMetadata' Rebel.Cms.Web.Configuration.RebelSystem.RebelPathsElement' Rebel.Cms.Web.Configuration.RebelSettings' Rebel.Cms.Web.Context.IRebelApplicationContext' Rebel.Cms.Web.DependencyManagement.ComponentRegistrations' Rebel.Cms.Web.Model.PartialViewMacroModel' Rebel.Framework.Persistence.Model.IO.File' Rebel.Hive.IHiveManager' Rebel.Hive.ProviderGrouping.IReadonlyEntityRepositoryGroup' Rebel.Hive.ProviderGrouping.IReadonlyGroupUnit' Rebel.Framework.Persistence.Model.Constants.FixedRelationTypes' Rebel.Framework.Persistence.Model.Associations.IReadonlyRelation' Rebel.Cms.Web.Packaging.IPackageContext' Rebel.Framework.Configuration.PluginManagerConfiguration' Rebel.Cms.Web.System.PluginManager' Rebel.Cms.Web.Model.BackOffice.Editors.MacroEditorModel' Rebel.Cms.Web.Model.BackOffice.Editors.MacroParameterDefinitionModel' Rebel.Framework.DisposableTimer' Rebel.Framework.Diagnostics.LogHelper' Rebel.Framework.Security.Model.Entities.Member' Rebel.Framework.AbstractApplicationCache' Rebel.Framework.Context.IFrameworkContext' Rebel.Framework.HiveId' Rebel.Framework.AttemptTuple' Rebel.Framework.Dynamics.BendyObject
Rebel.Cms.Web,Rebel.Cms.Web.Mapping,Rebel.Cms.Web.Caching.ContentCacheManager,Rebel.Framework.TypeMapping.AbstractFluentMappingEngine' Rebel.Cms.Web.Context.MapResolverContext' Rebel.Framework.Persistence.Model.Attribution.MetaData.AttributeType' Rebel.Cms.Web.IPropertyEditorFactory' Rebel.Cms.Web.Model.BackOffice.PropertyEditors.PropertyEditorMetadata' Rebel.Framework.PluginDefinition' Rebel.Framework.Persistence.Model.Constants.FixedStatusTypes' Rebel.Framework.TypeMapping.IMappingExpression' Rebel.Framework.Persistence.Model.Attribution.TypedAttribute' Rebel.Framework.TypeMapping.IMemberMappingExpression' Rebel.Cms.Web.Model.BackOffice.Editors.ContentProperty' Rebel.Framework.Persistence.Model.Attribution.TypedAttributeValueCollection' Rebel.Cms.Web.Model.BackOffice.PropertyEditors.EditorModel' Rebel.Framework.Persistence.Model.Associations.IRelationById' Rebel.Hive.ProviderGrouping.ReadonlyGroupUnitFactory' Rebel.Framework.HiveId' Rebel.Framework.Persistence.Model.IO.File' Rebel.Framework.Persistence.Model.TypedEntity' Rebel.Hive.IHiveManager' Rebel.Hive.ProviderGrouping.IReadonlyEntityRepositoryGroup' Rebel.Hive.ProviderGrouping.IReadonlyGroupUnit' Rebel.Cms.Web.Model.Content' Rebel.Framework.Persistence.Model.Constants.FixedRelationTypes' Rebel.Framework.Persistence.Model.Constants.AttributeDefinitions.SelectedTemplateAttributeDefinition' Rebel.Framework.TypeMapping.MappingEngineCollection' Rebel.Framework.Context.IFrameworkContext' Rebel.Framework.Persistence.Model.Attribution.MetaData.EntitySchema' Rebel.Cms.Web.Model.Template' Rebel.Cms.Web.Model.Field' Rebel.Framework.Persistence.Model.Versioning.RevisionData' Rebel.Framework.Persistence.ModelFirst.CustomTypedEntity' Rebel.Cms.Web.IRenderViewHiveManagerWrapper' Rebel.Framework.LocalizedString' Rebel.Framework.Persistence.Model.Attribution.MetaData.AttributeDefinition' Rebel.Framework.Security.Model.Entities.User' Rebel.Cms.Web.Model.BackOffice.Editors.DocumentTypeProperty' Rebel.Cms.Web.Mvc.Metadata.RebelMetadataAdditionalInfo' Rebel.Hive.ProviderGrouping.IReadonlySchemaRepositoryGroup' Rebel.Framework.Persistence.Model.Associations._Revised.RelationProxyCollection' Rebel.Framework.Persistence.Model.Attribution.MetaData.CompositeEntitySchema' Rebel.Framework.Persistence.Model.Attribution.TypedAttributeCollection' Rebel.Framework.Persistence.AttributeTypeRegistry' Rebel.Framework.AttemptTuple' Rebel.Framework.Persistence.IAttributeTypeRegistry' Rebel.Framework.Persistence.Model.Attribution.MetaData.AttributeGroup' Rebel.Framework.Persistence.Model.Constants.FixedGroupDefinitions' Rebel.Cms.Web.Model.BackOffice.Editors.DocumentTypeEditorModel' Rebel.Cms.Web.Model.BackOffice.Editors.DataType' Rebel.Cms.Web.Model.BackOffice.PropertyEditors.IContentAwarePropertyEditor' Rebel.Framework.Persistence.Model.Associations.IReadonlyRelation' Rebel.Framework.Persistence.Model.Associations._Revised.RelationProxy' Rebel.Cms.Web.Model.BackOffice.TimestampedModel' Rebel.Cms.Web.Model.BackOffice.Editors.DataTypeEditorModel' Rebel.Cms.Web.Model.BackOffice.ApplicationTrayModel' Rebel.Cms.Web.Configuration.ApplicationSettings.IApplication' Rebel.Cms.Web.Model.BackOffice.IconType' Rebel.Cms.Web.Configuration.Dashboards.IDashboardGroup' Rebel.Cms.Web.Configuration.Dashboards.IDashboard' Rebel.Cms.Web.Model.BackOffice.DashboardApplicationModel' Rebel.Cms.Web.Model.BackOffice.TinyMCE.InsertMacro.SetParametersModel' Rebel.Cms.Web.Model.BackOffice.Editors.MacroEditorModel' Rebel.Cms.Web.IParameterEditorFactory' Rebel.Cms.Web.Model.BackOffice.Editors.MacroParameterDefinitionModel' Rebel.Cms.Web.Model.BackOffice.Editors.MacroParameterModel' Rebel.Cms.Web.Model.BackOffice.TinyMCE.InsertMacro.InsertMacroModel' Rebel.Cms.Web.Model.BackOffice.ParameterEditors.EditorModel' Rebel.Cms.Web.Model.BackOffice.PropertyEditors.PreValueModel' Rebel.Framework.Persistence.Model.Attribution.MetaData.InheritedAttributeDefinition' Rebel.Cms.Web.Model.BackOffice.Editors.DocumentTypeInfo' Rebel.Cms.Web.Model.BackOffice.Editors.UserGroupPermissionsModel' Rebel.Framework.Security.Model.Entities.UserGroup' Rebel.Cms.Web.Model.BackOffice.Editors.PermissionStatusModel' Rebel.Framework.Security.PermissionMetadata' Rebel.Cms.Web.Model.BackOffice.Editors.Tab' Rebel.Framework.Persistence.Model.Attribution.MetaData.InheritedAttributeGroup' Rebel.Cms.Web.Model.BackOffice.Editors.UserEditorModel' Rebel.Cms.Web.Model.BackOffice.Editors.MemberEditorModel' Rebel.Framework.Security.Model.Entities.Member' Rebel.Cms.Web.Model.BackOffice.Editors.UserGroupEditorModel' Rebel.Cms.Web.Security.UserData' Rebel.Framework.Persistence.Model.Constants.AttributeDefinitions.NodeNameAttributeDefinition' Rebel.Cms.Web.Model.BackOffice.Editors.LanguageEditorModel' Rebel.Cms.Web.Configuration.Languages.FallbackCollection' Rebel.Cms.Web.Configuration.Languages.LanguageElement' Rebel.Cms.Web.Configuration.Languages.FallbackElement' Rebel.Cms.Web.Model.BackOffice.Editors.StylesheetRuleEditorModel' Rebel.Cms.Web.Model.StylesheetRule' Rebel.Cms.Web.Model.BackOffice.Editors.FileEditorModel' Rebel.Cms.Web.Model.BackOffice.PropertyEditors.PropertyEditor' Rebel.Framework.Persistence.Model.Constants.Entities.Hostname' Rebel.Cms.Web.Model.BackOffice.Editors.HostnameEntryModel' Rebel.Framework.Security.PermissionStatus' Rebel.Cms.Web.Model.BackOffice.Editors.HostnamesModel' Rebel.Framework.Persistence.Model.Constants.FixedSchemaTypes
