Namespace,Type,NOF,NOM,NOP,NOPF,NOPM,LOC,WMC,NC,DIT,LCOM,Fan-Out,Fan-In,Fan-Out types,Fan-In types
System.Windows.Forms,ResourceTypeCombo,4,8,3,0,1,133,16,0,0,0.5,1,4,s4pi.Extensions.ExtList,S4PIDemoFE.ResourceDetails' S4PIDemoFE.Tools.SearchForm' System.Windows.Forms.MainForm' System.Windows.Forms.TGIBlockListEditorForm.MainForm
System.Windows.Forms,TGIBlockCombo,5,13,3,0,5,170,21,0,0,0.23,4,2,s4pi.Extensions.ExtList' s4pi.Interfaces.TGIBlock' s4pi.Interfaces.CountedTGIBlockList' System.Windows.Forms.TGIBlockListEditor,S4PIDemoFE.TGIBlockSelection' s3pe_VPXY_Resource_Editor.MainForm
System.Windows.Forms,MainForm,1,17,1,0,1,188,32,0,0,0.65,4,0,s4pi.Interfaces.TGIBlockList' System.Windows.Forms.ResourceTypeCombo' s4pi.Extensions.ExtList' s4pi.Interfaces.TGIBlock,
System.Windows.Forms,TGIBlockListEditor,0,2,1,0,2,39,4,0,0,-1,1,1,System.Windows.Forms.TGIBlockListEditorForm.MainForm,System.Windows.Forms.TGIBlockCombo
System.Windows.Forms.TGIBlockListEditorForm,MainForm,24,19,1,0,1,538,35,0,0,0,4,3,s4pi.Interfaces.TGIBlockList' System.Windows.Forms.ResourceTypeCombo' s4pi.Extensions.ExtList' s4pi.Interfaces.TGIBlock,S4PIDemoFE.TGIBlockListEditor' System.Windows.Forms.TGIBlockListEditor' System.Windows.Forms.TGIBlockListEditorForm.TGIBlockListEditor
System.Windows.Forms.TGIBlockListEditorForm,TGIBlockListEditor,0,2,1,0,2,39,4,0,0,-1,1,0,System.Windows.Forms.TGIBlockListEditorForm.MainForm,
