Namespace,Type,NOF,NOM,NOP,NOPF,NOPM,LOC,WMC,NC,DIT,LCOM,Fan-Out,Fan-In,Fan-Out types,Fan-In types
Tomboy.Bugzilla,BugzillaLink,2,4,2,0,1,78,7,0,2,0.75,7,2,Tomboy.DynamicNoteTag' Tomboy.Bugzilla.BugzillaNoteAddin' Tomboy.Logger' Tomboy.INativeApplication' Tomboy.Services' Tomboy.NoteEditor' Tomboy.GuiUtils,Tomboy.Bugzilla.BugzillaNoteAddin' Tomboy.Bugzilla.InsertBugAction
Tomboy.Bugzilla,BugzillaNoteAddin,2,7,1,1,3,87,13,0,2,0.71,7,2,Tomboy.NoteTagTable' Tomboy.Note' Tomboy.Bugzilla.BugzillaLink' Tomboy.NoteWindow' Tomboy.Logger' Tomboy.NoteBuffer' Tomboy.UndoManager,Tomboy.Bugzilla.BugzillaLink' Tomboy.Bugzilla.BugzillaPreferences
Tomboy.Bugzilla,BugzillaPreferences,5,10,0,0,1,262,22,0,0,0,3,1,Tomboy.Bugzilla.BugzillaNoteAddin' Tomboy.Logger' Tomboy.HIGMessageDialog,Tomboy.Bugzilla.BugzillaPreferenceFactory
Tomboy.Bugzilla,BugzillaPreferenceFactory,0,1,0,0,1,7,1,0,1,-1,1,0,Tomboy.Bugzilla.BugzillaPreferences,
Tomboy.Bugzilla,InsertBugAction,3,6,0,0,6,62,8,0,2,0.33,5,0,Tomboy.Bugzilla.BugzillaLink' Tomboy.TextRange' Tomboy.SplitterAction' Tomboy.EditAction' Tomboy.InsertAction,
