Project,Namespace,Ca types,Ce types
Obscur.Core,Obscur.Core.Cryptography.Support.Math.Field,Obscur.Core.Cryptography.Support.Math.EllipticCurve.AbstractFpCurve' Obscur.Core.Cryptography.Support.Math.EllipticCurve.AbstractF2mCurve' Obscur.Core.Cryptography.Support.Math.EllipticCurve.ECAlgorithms' Obscur.Core.Cryptography.Support.Math.EllipticCurve.ECCurve,Obscur.Core.Cryptography.Support.Math.BigInteger
Obscur.Core,Obscur.Core.Packaging,Obscur.Core.Packaging.Multiplexing.PayloadMux,Obscur.Core.Athena' Obscur.Core.Packaging' Obscur.Core.ConfigurationInvalidException' Obscur.Core.DataLengthException' Obscur.Core.DebugUtility' Obscur.Core.EnumerationParsingException' Obscur.Core.StratCom' Obscur.Core.Cryptography.Authentication.MacStream' Obscur.Core.Cryptography.Ciphers.CipherStream' Obscur.Core.Cryptography.CiphertextAuthenticationException' Obscur.Core.Cryptography.CryptoException' Obscur.Core.Cryptography.IKeyProvider' Obscur.Core.Cryptography.KeyConfirmationException' Obscur.Core.Cryptography.KeyAgreement.Primitives.Um1Exchange' Obscur.Core.Cryptography.KeyConfirmation.ConfirmationUtility' Obscur.Core.Cryptography.KeyDerivation.KeyStretchingUtility' Obscur.Core.Packaging.Multiplexing.PayloadLayoutScheme' Obscur.Core.Packaging.Multiplexing.PayloadMux' Obscur.Core.Packaging.Multiplexing.PayloadMuxFactory' Obscur.Core.Packaging.Parsing.PayloadTree' Obscur.Core.Cryptography' Obscur.Core.Cryptography.Authentication.AuthenticationConfigurationFactory' Obscur.Core.Cryptography.Authentication.HashFunction' Obscur.Core.Cryptography.Authentication.MacFunction' Obscur.Core.Cryptography.Ciphers.CipherConfigurationFactory' Obscur.Core.Cryptography.Ciphers.Block.BlockCipher' Obscur.Core.Cryptography.Ciphers.Block.BlockCipherMode' Obscur.Core.Cryptography.Ciphers.Block.BlockCipherPadding' Obscur.Core.Cryptography.Ciphers.Stream.StreamCipher' Obscur.Core.Cryptography.KeyConfirmation.ConfirmationConfigurationFactory' Obscur.Core.Cryptography.KeyDerivation.KeyDerivationFunction' Obscur.Core.Packaging.Multiplexing.PayloadLayoutConfigurationFactory
Obscur.Core,Obscur.Core.Packaging.Multiplexing.Entropy,Obscur.Core.Packaging.Multiplexing.Primitives.SimplePayloadMux,Obscur.Core.Cryptography.Entropy.CsPrng' Obscur.Core.ConfigurationInvalidException' Obscur.Core.StratCom' Obscur.Core.Cryptography.Entropy.CsRng' Obscur.Core.Cryptography.Entropy.CsPrngFactory
Obscur.Core,Obscur.Core.Packaging.Multiplexing,Obscur.Core.Packaging.Multiplexing.Primitives.FabricPayloadMux' Obscur.Core.Packaging.Multiplexing.Primitives.FrameshiftPayloadMux' Obscur.Core.Packaging.PackageWriter' Obscur.Core.Packaging.PackageReader' Obscur.Core.Support.Entropy.Rng' Obscur.Core.Packaging.Multiplexing.Primitives.SimplePayloadMux,Obscur.Core.StratCom' Obscur.Core.Cryptography.Entropy.CsPrngFactory' Obscur.Core.Cryptography.Entropy.CsPseudorandomNumberGenerator' Obscur.Core.Packaging.Multiplexing.Primitives.FabricPayloadMux' Obscur.Core.Packaging.Multiplexing.Primitives.FrameshiftPayloadMux' Obscur.Core.ConfigurationInvalidException' Obscur.Core.DebugUtility' Obscur.Core.Cryptography.Authentication.MacStream' Obscur.Core.Cryptography.Ciphers.CipherStream' Obscur.Core.Cryptography.KeyDerivation.KeyStretchingUtility' Obscur.Core.Packaging.ItemKeyMissingException' Obscur.Core.Packaging.Multiplexing.Primitives.SimplePayloadMux
Obscur.Core,Obscur.Core.Packaging.Multiplexing.Primitives,Obscur.Core.Packaging.Multiplexing.PayloadMuxFactory' Obscur.Core.Packaging.Multiplexing.PayloadLayoutConfigurationFactory,Obscur.Core.Athena' Obscur.Core.Packaging' Obscur.Core.DebugUtility' Obscur.Core.Cryptography.Authentication.MacStream' Obscur.Core.Cryptography.Ciphers.CipherStream' Obscur.Core.Cryptography.CiphertextAuthenticationException' Obscur.Core.Packaging.Multiplexing.FabricStripeMode' Obscur.Core.StratCom' Obscur.Core.Packaging.Multiplexing.FrameshiftPaddingMode' Obscur.Core.Packaging.Multiplexing.Entropy.MuxEntropySourceFacade' Obscur.Core.Packaging.Multiplexing.PayloadMux
Obscur.Core,Obscur.Core.Packaging.Parsing,Obscur.Core.Packaging.PackageReader,
Obscur.Core,Obscur.Core.Support,Obscur.Core.BasicExtensions' Obscur.Core.Cryptography.Information.EllipticCurve.EcCurveInformation' Obscur.Core.Cryptography.Support.Math.EllipticCurve.Custom.SEC.SecP192K1Curve' Obscur.Core.Cryptography.Support.Math.EllipticCurve.Custom.SEC.SecP256K1Curve' Obscur.Core.Cryptography.Support.Math.EllipticCurve.Custom.SEC.SecP224K1Curve' Obscur.Core.Cryptography.Support.Math.EllipticCurve.Custom.SEC.SecP192R1Curve' Obscur.Core.Cryptography.Support.Math.EllipticCurve.Custom.SEC.SecP384R1Curve' Obscur.Core.Cryptography.Support.Math.EllipticCurve.Custom.SEC.SecP256R1Curve' Obscur.Core.Cryptography.Support.Math.EllipticCurve.Custom.SEC.SecP521R1Curve' Obscur.Core.Cryptography.Support.Math.EllipticCurve.Custom.SEC.SecP224R1Curve,
Obscur.Core,Obscur.Core.Support.Entropy,Obscur.Core.Cryptography.Entropy.CsPrng' Obscur.Core.Cryptography.Entropy.Primitives.ReversedWindowCsRng' Obscur.Core.Cryptography.Entropy.Primitives.ReversedRandomWindowRng' Obscur.Core.Cryptography.Entropy.CsRng' Obscur.Core.StratCom,Obscur.Core.Packaging.Multiplexing.PayloadMux' Obscur.Core.DebugUtility
