Project,Namespace,Ca types,Ce types
Obscur.Core,Obscur.Core.Cryptography.KeyAgreement,Obscur.Core.Cryptography.KeyAgreement.Primitives.Um1Exchange,Obscur.Core.ConfigurationInvalidException' Obscur.Core.Cryptography.Information.EcInformationStore' Obscur.Core.Cryptography.Information.EllipticCurve.DjbCurve' Obscur.Core.Cryptography.KeyAgreement.Primitives.Curve25519' Obscur.Core.Cryptography.Signing.Primitives.Ed25519' Obscur.Core.Cryptography.Support.ECDomainParameters' Obscur.Core.Cryptography.Support.ECPrivateKeyParameters' Obscur.Core.Cryptography.Support.ECPublicKeyParameters' Obscur.Core.Cryptography.Support.Math.BigInteger' Obscur.Core.Cryptography.Support.Math.EllipticCurve.ECPoint' Obscur.Core.Athena' Obscur.Core.Cryptography' Obscur.Core.StratCom' Obscur.Core.Cryptography.Support.Math.EllipticCurve.Multiplier.ECMultiplier' Obscur.Core.Cryptography.Support.Math.EllipticCurve.Multiplier.FixedPointCombMultiplier' Obscur.Core.Cryptography.Support.Math.EllipticCurve.Multiplier.WNafUtilities
Obscur.Core,Obscur.Core.Cryptography.KeyAgreement.Primitives,Obscur.Core.Cryptography.Signing.Primitives.Ed25519' Obscur.Core.Cryptography.KeyAgreement.KeyAgreementFactory' Obscur.Core.Cryptography.KeyAgreement.KeypairFactory' Obscur.Core.Packaging.PackageReader' Obscur.Core.Packaging.PackageWriter,Obscur.Core.Cryptography.Ciphers.Stream.Primitives.XSalsa20Engine' Obscur.Core.Cryptography.Information.EllipticCurve.DjbCurve' Obscur.Core.Cryptography.Signing.Primitives.Ed25519' Obscur.Core.Cryptography.Support.Math.EllipticCurve.Custom.Ed25519.FieldOperations' Obscur.Core.Cryptography.Support.Math.EllipticCurve.Custom.Ed25519.FieldElement' Obscur.Core.Cryptography.Support.Math.EllipticCurve.Custom.Ed25519.GroupOperations' Obscur.Core.Cryptography.Support.Math.EllipticCurve.Custom.Ed25519.GroupElementP3' Obscur.Core.Cryptography.Support.Math.EllipticCurve.Custom.Ed25519.MontgomeryOperations' Obscur.Core.ConfigurationInvalidException' Obscur.Core.Cryptography.Authentication.IHash' Obscur.Core.Cryptography.Authentication.Primitives.Hmac' Obscur.Core.Cryptography.CryptoException' Obscur.Core.Cryptography.Entropy.CsRng' Obscur.Core.Cryptography.Support.ECDomainParameters' Obscur.Core.Cryptography.Support.Pack' Obscur.Core.Cryptography.Support.Math.BigInteger' Obscur.Core.Cryptography.Support.Math.EllipticCurve.Custom.SEC.SecP192K1Curve' Obscur.Core.Cryptography.Support.Math.EllipticCurve.Custom.SEC.SecP192R1Curve' Obscur.Core.Cryptography.Support.Math.EllipticCurve.Custom.SEC.SecP224K1Curve' Obscur.Core.Cryptography.Support.Math.EllipticCurve.Custom.SEC.SecP224R1Curve' Obscur.Core.Cryptography.Support.Math.EllipticCurve.Custom.SEC.SecP256K1Curve' Obscur.Core.Cryptography.Support.Math.EllipticCurve.Custom.SEC.SecP256R1Curve' Obscur.Core.Cryptography.Support.Math.EllipticCurve.Custom.SEC.SecP384R1Curve' Obscur.Core.Cryptography.Support.Math.EllipticCurve.Custom.SEC.SecP521R1Curve' Obscur.Core.Cryptography.Support.Math.EllipticCurve.ECCurve' Obscur.Core.Cryptography.Support.Math.EllipticCurve.FpCurve' Obscur.Core.Cryptography.Support.Math.EllipticCurve.ECPoint' Obscur.Core.Cryptography.Support.Math.EllipticCurve.Multiplier.ECMultiplier' Obscur.Core.Cryptography.Support.Math.EllipticCurve.Multiplier.FixedPointCombMultiplier' Obscur.Core.Cryptography.KeyAgreement.KeyAgreementFactory' Obscur.Core.Cryptography.KeyAgreement.KeypairFactory' Obscur.Core.Cryptography.Support.ECPrivateKeyParameters' Obscur.Core.Cryptography.Support.ECPublicKeyParameters
Obscur.Core,Obscur.Core.Cryptography.KeyConfirmation,Obscur.Core.Packaging.PackageWriter' Obscur.Core.Packaging.PackageReader,Obscur.Core.Cryptography.Authentication.AuthenticationConfigurationFactory' Obscur.Core.Cryptography.Authentication.HashFunction' Obscur.Core.Cryptography.Authentication.MacFunction' Obscur.Core.Cryptography.Ciphers.Block.BlockCipher' Obscur.Core.ConfigurationInvalidException' Obscur.Core.DebugUtility' Obscur.Core.EnumerationParsingException' Obscur.Core.Cryptography.Authentication.AuthenticatorFactory' Obscur.Core.Cryptography.Authentication.IMac' Obscur.Core.Cryptography.KeyDerivation.KdfFactory' Obscur.Core.Cryptography.KeyDerivation.KeyDerivationFunction
Obscur.Core,Obscur.Core.Cryptography.KeyDerivation,Obscur.Core.Cryptography.KeyConfirmation.ConfirmationUtility' Obscur.Core.Athena' Obscur.Core.Cryptography.KeyDerivation.Information.KdfInformation' Obscur.Core.Packaging.PackageWriter' Obscur.Core.Packaging.PackageReader' Obscur.Core.Packaging.Multiplexing.PayloadMux,Obscur.Core.Cryptography.KeyDerivation.Information.KdfInformation' Obscur.Core.Cryptography.Authentication.AuthenticatorFactory' Obscur.Core.Cryptography.Authentication.HashFunction' Obscur.Core.Cryptography.KeyDerivation.Primitives.Pbkdf2' Obscur.Core.Cryptography.KeyDerivation.Primitives.Scrypt
Obscur.Core,Obscur.Core.Cryptography.KeyDerivation.Information,Obscur.Core.Athena' Obscur.Core.Cryptography.KeyDerivation.KdfInformationStore,Obscur.Core.IPrimitiveInformation' Obscur.Core.Cryptography.KeyDerivation.KeyDerivationFunction
Obscur.Core,Obscur.Core.Cryptography.KeyDerivation.Primitives,Obscur.Core.Cryptography.KeyDerivation.Pbkdf2Module' Obscur.Core.Cryptography.KeyDerivation.ScryptModule,Obscur.Core.Cryptography.Authentication.IMac' Obscur.Core.Cryptography.Authentication.AuthenticatorFactory' Obscur.Core.Cryptography.Authentication.HashFunction' Obscur.Core.Cryptography.Ciphers.Stream.Primitives.XSalsa20Engine
Obscur.Core,Obscur.Core.Cryptography.Signing,Obscur.Core.Cryptography.Signing.Primitives.ECDsaSigner,Obscur.Core.Cryptography.Support.Math.BigInteger
Obscur.Core,Obscur.Core.Cryptography.Signing.Primitives,Obscur.Core.Cryptography.KeyAgreement.Primitives.Curve25519' Obscur.Core.Cryptography.KeyAgreement.KeyAgreementFactory' Obscur.Core.Cryptography.KeyAgreement.KeypairFactory,Obscur.Core.ConfigurationInvalidException' Obscur.Core.StratCom' Obscur.Core.Cryptography.Entropy.CsRng' Obscur.Core.Cryptography.Information.EcInformationStore' Obscur.Core.Cryptography.Information.EllipticCurve.EcCurveInformation' Obscur.Core.Cryptography.Signing.IDsa' Obscur.Core.Cryptography.Support.ECDomainParameters' Obscur.Core.Cryptography.Support.Math.BigInteger' Obscur.Core.Cryptography.Support.Math.EllipticCurve.ECAlgorithms' Obscur.Core.Cryptography.Support.Math.EllipticCurve.ECPoint' Obscur.Core.Cryptography.Support.Math.EllipticCurve.Multiplier.ECMultiplier' Obscur.Core.Cryptography.Support.Math.EllipticCurve.Multiplier.FixedPointCombMultiplier' Obscur.Core.Cryptography.Authentication.AuthenticatorFactory' Obscur.Core.Cryptography.Authentication.HashFunction' Obscur.Core.Cryptography.Authentication.IHash' Obscur.Core.Cryptography.KeyAgreement.Primitives.Curve25519' Obscur.Core.Cryptography.Support.Math.EllipticCurve.Custom.Ed25519.FieldOperations' Obscur.Core.Cryptography.Support.Math.EllipticCurve.Custom.Ed25519.FieldElement' Obscur.Core.Cryptography.Support.Math.EllipticCurve.Custom.Ed25519.Ed25519Operations' Obscur.Core.Cryptography.Support.Math.EllipticCurve.Custom.Ed25519.MontgomeryOperations' Obscur.Core.Cryptography.Support.Math.EllipticCurve.Custom.Ed25519.ScalarOperations' Obscur.Core.Cryptography.Authentication.Primitives.Hmac
Obscur.Core,Obscur.Core.Cryptography.Support,Obscur.Core.Cryptography.Information.EllipticCurve.EcCurveInformation' Obscur.Core.Cryptography.Information.EllipticCurve.DjbEcInformation' Obscur.Core.Cryptography.Signing.Primitives.ECDsaSigner' Obscur.Core.Cryptography.KeyAgreement.Primitives.ECJpakeSession' Obscur.Core.Cryptography.Information.EllipticCurve.CustomFpEcCurveInformation' Obscur.Core.Cryptography.Information.EllipticCurve.TpbF2mEcCurveInformation' Obscur.Core.Cryptography.KeyAgreement.KeypairFactory' Obscur.Core.Cryptography.KeyAgreement.KeyAgreementFactory' Obscur.Core.Cryptography.Information.EllipticCurve.PpbF2mEcCurveInformation' Obscur.Core.Cryptography.Information.EllipticCurve.FpEcCurveInformation' Obscur.Core.Cryptography.KeyAgreement.Primitives.Um1Exchange' Obscur.Core.Cryptography.Support.Math.EllipticCurve.Nat' Obscur.Core.Cryptography.Ciphers.Stream.Primitives.Hc128Engine' Obscur.Core.Cryptography.Support.Math.EllipticCurve.Mod' Obscur.Core.Cryptography.Authentication.Primitives.Sha1Digest' Obscur.Core.Cryptography.Authentication.Primitives.Sha512Digest' Obscur.Core.Cryptography.Ciphers.Stream.Primitives.Hc256Engine' Obscur.Core.Cryptography.Ciphers.Block.Primitives.BlowfishEngine' Obscur.Core.Cryptography.Support.Math.EllipticCurve.Custom.SEC.Nat256' Obscur.Core.Cryptography.Authentication.Primitives.Sha256Digest' Obscur.Core.Cryptography.Support.Math.EllipticCurve.Custom.SEC.Nat224' Obscur.Core.Cryptography.Support.Math.EllipticCurve.Custom.SEC.Nat192' Obscur.Core.Cryptography.Ciphers.Stream.Primitives.ChaChaEngine' Obscur.Core.Cryptography.Ciphers.Stream.Primitives.RabbitEngine' Obscur.Core.Cryptography.Ciphers.Block.Primitives.NoekeonEngine' Obscur.Core.Cryptography.Authentication.Primitives.LongDigest' Obscur.Core.Cryptography.Ciphers.Stream.Primitives.Salsa20Engine' Obscur.Core.Cryptography.Ciphers.Block.Primitives.AesEngine' Obscur.Core.Cryptography.Ciphers.Stream.Primitives.XSalsa20Engine' Obscur.Core.Cryptography.Authentication.Primitives.Poly1305Mac,Obscur.Core.Cryptography.Support.Math.BigInteger' Obscur.Core.Cryptography.Support.Math.EllipticCurve.ECCurve' Obscur.Core.Cryptography.Support.Math.EllipticCurve.ECPoint' Obscur.Core.Cryptography.Entropy.CsRng' Obscur.Core.Cryptography.Support.Math.EllipticCurve.ECFieldElement
Obscur.Core,Obscur.Core.Cryptography.Support.Math,Obscur.Core.Cryptography.Information.EllipticCurve.EcCurveInformation' Obscur.Core.Cryptography.Signing.IDsa' Obscur.Core.Cryptography.KeyAgreement.KeyAgreementFactory' Obscur.Core.Cryptography.Information.EllipticCurve.TpbF2mEcCurveInformation' Obscur.Core.Cryptography.Information.EllipticCurve.PpbF2mEcCurveInformation' Obscur.Core.Cryptography.KeyAgreement.Primitives.Um1Exchange' Obscur.Core.Cryptography.Signing.Primitives.IDsaKCalculator' Obscur.Core.Cryptography.Information.EllipticCurve.FpEcCurveInformation' Obscur.Core.Cryptography.KeyAgreement.KeypairFactory' Obscur.Core.Cryptography.Information.EllipticCurve.CustomFpEcCurveInformation' Obscur.Core.Cryptography.Support.ECPrivateKeyParameters' Obscur.Core.Cryptography.Signing.Primitives.HmacDsaKCalculator' Obscur.Core.Cryptography.Signing.Primitives.RandomDsaKCalculator' Obscur.Core.Cryptography.Support.Math.EllipticCurve.Custom.Curve25519Field' Obscur.Core.Cryptography.Support.ECDomainParameters' Obscur.Core.Cryptography.Support.Math.EllipticCurve.ABC.ZTauElement' Obscur.Core.Cryptography.Signing.Primitives.ECDsaSigner' Obscur.Core.Cryptography.Support.Math.EllipticCurve.Custom.SEC.SecP192K1Field' Obscur.Core.Cryptography.Support.Math.EllipticCurve.Custom.SEC.Nat192' Obscur.Core.Cryptography.Support.Math.EllipticCurve.Custom.SEC.Nat224' Obscur.Core.Cryptography.Support.Math.EllipticCurve.Custom.SEC.Nat256' Obscur.Core.Cryptography.Support.Math.EllipticCurve.Custom.SEC.SecP192K1FieldElement' Obscur.Core.Cryptography.Support.Math.EllipticCurve.Custom.SEC.SecP192R1Field' Obscur.Core.Cryptography.Support.Math.EllipticCurve.ABC.SimpleBigDecimal' Obscur.Core.Cryptography.Support.Math.EllipticCurve.Custom.SEC.SecP192K1Curve' Obscur.Core.Cryptography.Support.Math.EllipticCurve.Custom.SEC.SecP224K1Field' Obscur.Core.Cryptography.Support.Math.EllipticCurve.Custom.SEC.SecP192R1FieldElement' Obscur.Core.Cryptography.Support.Math.EllipticCurve.Custom.SEC.SecP224K1FieldElement' Obscur.Core.Cryptography.Support.Math.EllipticCurve.Custom.SEC.SecP224R1Field' Obscur.Core.Cryptography.Support.Math.EllipticCurve.Custom.SEC.SecP192R1Curve' Obscur.Core.Cryptography.Support.Math.EllipticCurve.Custom.SEC.SecP256K1Field' Obscur.Core.Cryptography.Support.Math.EllipticCurve.Custom.SEC.SecP224R1FieldElement' Obscur.Core.Cryptography.Support.Math.EllipticCurve.Custom.SEC.SecP256K1FieldElement' Obscur.Core.Cryptography.Support.Math.EllipticCurve.Custom.SEC.SecP224K1Curve' Obscur.Core.Cryptography.Support.Math.EllipticCurve.Custom.SEC.SecP256R1Field' Obscur.Core.Cryptography.Support.Math.EllipticCurve.Custom.SEC.SecP256R1FieldElement' Obscur.Core.Cryptography.Support.Math.EllipticCurve.Custom.SEC.SecP384R1Field' Obscur.Core.Cryptography.Support.Math.EllipticCurve.Custom.SEC.SecP224R1Curve' Obscur.Core.Cryptography.Support.X9IntegerConverter' Obscur.Core.Cryptography.Support.Math.EllipticCurve.Custom.SEC.SecP256K1Curve' Obscur.Core.Cryptography.Support.Math.EllipticCurve.Custom.SEC.SecP384R1FieldElement' Obscur.Core.Cryptography.Support.Math.EllipticCurve.Custom.SEC.SecP521R1Field' Obscur.Core.Cryptography.Support.Math.EllipticCurve.Custom.SEC.SecP521R1FieldElement' Obscur.Core.Cryptography.Support.Math.Field.PrimeField' Obscur.Core.Cryptography.Support.Math.EllipticCurve.Custom.SEC.SecP256R1Curve' Obscur.Core.Cryptography.Support.Math.Field.IFiniteField' Obscur.Core.Cryptography.Support.Math.EllipticCurve.Custom.SEC.SecP384R1Curve' Obscur.Core.Cryptography.Support.Math.EllipticCurve.Endomorphism.GlvEndomorphism' Obscur.Core.Cryptography.Support.Math.Field.GenericPolynomialExtensionField' Obscur.Core.Cryptography.Support.Math.EllipticCurve.Custom.SEC.SecP521R1Curve' Obscur.Core.Cryptography.Support.Math.Field.FiniteFields' Obscur.Core.Cryptography.Support.Math.EllipticCurve.Multiplier.AbstractECMultiplier' Obscur.Core.Cryptography.Support.Math.EllipticCurve.LongArray' Obscur.Core.Cryptography.Support.Math.EllipticCurve.Multiplier.DoubleAddMultiplier' Obscur.Core.Cryptography.Support.Math.EllipticCurve.Endomorphism.GlvTypeBParameters' Obscur.Core.Cryptography.Support.Math.EllipticCurve.Endomorphism.GlvTypeBEndomorphism' Obscur.Core.Cryptography.Support.Math.EllipticCurve.Multiplier.ECMultiplier' Obscur.Core.Cryptography.Support.Math.EllipticCurve.Nat' Obscur.Core.Cryptography.Support.Math.EllipticCurve.Multiplier.FixedPointCombMultiplier' Obscur.Core.Cryptography.Support.Math.EllipticCurve.Multiplier.FixedPointUtilities' Obscur.Core.Cryptography.Support.Math.EllipticCurve.ECPoint' Obscur.Core.Cryptography.Support.Math.EllipticCurve.ECPointBase' Obscur.Core.Cryptography.Support.Math.EllipticCurve.FpPoint' Obscur.Core.Cryptography.Support.Math.EllipticCurve.F2mPoint' Obscur.Core.Cryptography.Support.Math.EllipticCurve.Multiplier.ZSignedDigitR2LMultiplier' Obscur.Core.Cryptography.Support.Math.EllipticCurve.Multiplier.MixedNafR2LMultiplier' Obscur.Core.Cryptography.Support.Math.EllipticCurve.Multiplier.MontgomeryLadderMultiplier' Obscur.Core.Cryptography.Support.Math.EllipticCurve.Multiplier.ZSignedDigitL2RMultiplier' Obscur.Core.Cryptography.Support.Math.EllipticCurve.Multiplier.NafL2RMultiplier' Obscur.Core.Cryptography.Support.Math.EllipticCurve.Multiplier.GlvMultiplier' Obscur.Core.Cryptography.KeyAgreement.Primitives.ECJpakeSession' Obscur.Core.Cryptography.Support.Math.EllipticCurve.Multiplier.NafR2LMultiplier' Obscur.Core.Cryptography.Support.Math.EllipticCurve.Multiplier.ReferenceMultiplier' Obscur.Core.Cryptography.Support.Math.EllipticCurve.Multiplier.WNafL2RMultiplier' Obscur.Core.Cryptography.Support.Math.EllipticCurve.Multiplier.WTauNafMultiplier' Obscur.Core.Cryptography.Support.Math.EllipticCurve.ECAlgorithms' Obscur.Core.Cryptography.Support.Math.EllipticCurve.Multiplier.WNafUtilities' Obscur.Core.Cryptography.Support.Math.EllipticCurve.ABC.Tnaf' Obscur.Core.Cryptography.Support.Math.EllipticCurve.ECCurve' Obscur.Core.Cryptography.Support.Math.EllipticCurve.AbstractFpCurve' Obscur.Core.Cryptography.Support.Math.EllipticCurve.FpCurve' Obscur.Core.Cryptography.Support.Math.EllipticCurve.F2mCurve' Obscur.Core.Cryptography.Support.Math.EllipticCurve.ECFieldElement' Obscur.Core.Cryptography.Support.Math.EllipticCurve.FpFieldElement' Obscur.Core.Cryptography.Support.Math.EllipticCurve.F2mFieldElement,
Obscur.Core,Obscur.Core.Cryptography.Support.Math.EllipticCurve.ABC,Obscur.Core.Cryptography.Support.Math.EllipticCurve.F2mCurve' Obscur.Core.Cryptography.Support.Math.EllipticCurve.Multiplier.WTauNafMultiplier,Obscur.Core.Cryptography.Support.Math.BigInteger' Obscur.Core.Cryptography.Support.Math.EllipticCurve.F2mCurve' Obscur.Core.Cryptography.Support.Math.EllipticCurve.F2mPoint
Obscur.Core,Obscur.Core.Cryptography.Support.Math.EllipticCurve.Custom,,Obscur.Core.Cryptography.Support.Math.BigInteger' Obscur.Core.Cryptography.Support.Math.EllipticCurve.Custom.SEC.Nat256' Obscur.Core.Cryptography.Support.Math.EllipticCurve.Nat
Obscur.Core,Obscur.Core.Cryptography.Support.Math.EllipticCurve.Custom.Ed25519,Obscur.Core.Cryptography.Signing.Primitives.Ed25519' Obscur.Core.Cryptography.KeyAgreement.Primitives.Curve25519,Obscur.Core.Cryptography.Authentication.Primitives.Sha512Digest
Obscur.Core,Obscur.Core.Cryptography.Support.Math.EllipticCurve.Custom.SEC,Obscur.Core.Cryptography.Support.Math.EllipticCurve.Custom.Curve25519Field' Obscur.Core.Cryptography.KeyAgreement.Primitives.ECJpakeSession' Obscur.Core.Cryptography.Information.EcInformationStore,Obscur.Core.Cryptography.Support.Pack' Obscur.Core.Cryptography.Support.Math.BigInteger' Obscur.Core.Cryptography.Support.Math.EllipticCurve.Nat' Obscur.Core.Cryptography.Support.Math.EllipticCurve.ECCurve' Obscur.Core.Cryptography.Support.Math.EllipticCurve.AbstractFpCurve' Obscur.Core.Cryptography.Support.Math.EllipticCurve.ECFieldElement' Obscur.Core.Cryptography.Support.Math.EllipticCurve.ECPoint' Obscur.Core.Support.Hex' Obscur.Core.Cryptography.Support.Math.EllipticCurve.Mod' Obscur.Core.Cryptography.Support.Math.EllipticCurve.AbstractFpPoint
Obscur.Core,Obscur.Core.Cryptography.Support.Math.EllipticCurve,Obscur.Core.Cryptography.Support.Math.EllipticCurve.Multiplier.AbstractECMultiplier' Obscur.Core.Cryptography.Support.Math.EllipticCurve.Multiplier.ReferenceMultiplier' Obscur.Core.Cryptography.Signing.Primitives.ECDsaSigner' Obscur.Core.Cryptography.Support.Math.EllipticCurve.Multiplier.GlvMultiplier' Obscur.Core.Cryptography.Support.Math.EllipticCurve.Custom.SEC.SecP192K1Curve' Obscur.Core.Cryptography.Support.Math.EllipticCurve.Custom.SEC.SecP224R1Curve' Obscur.Core.Cryptography.Support.Math.EllipticCurve.Custom.SEC.SecP224K1Curve' Obscur.Core.Cryptography.Support.Math.EllipticCurve.Custom.SEC.SecP192R1Curve' Obscur.Core.Cryptography.Support.Math.EllipticCurve.Custom.SEC.SecP256K1Curve' Obscur.Core.Cryptography.Support.Math.EllipticCurve.Custom.SEC.SecP256R1Curve' Obscur.Core.Cryptography.KeyAgreement.Primitives.ECJpakeSession' Obscur.Core.Cryptography.Support.Math.EllipticCurve.Custom.SEC.SecP224K1Point' Obscur.Core.Cryptography.Support.Math.EllipticCurve.Custom.SEC.SecP224R1Point' Obscur.Core.Cryptography.Support.Math.EllipticCurve.Custom.SEC.SecP192K1Point' Obscur.Core.Cryptography.Support.Math.EllipticCurve.Custom.SEC.SecP192R1Point' Obscur.Core.Cryptography.Support.ECDomainParameters' Obscur.Core.Cryptography.Support.Math.EllipticCurve.Custom.SEC.SecP384R1Curve' Obscur.Core.Cryptography.Support.Math.EllipticCurve.Custom.SEC.SecP521R1Curve' Obscur.Core.Cryptography.Support.Math.EllipticCurve.Custom.SEC.SecP256K1Point' Obscur.Core.Cryptography.Support.Math.EllipticCurve.Custom.SEC.SecP256R1Point' Obscur.Core.Cryptography.Information.EllipticCurve.CustomFpEcCurveInformation' Obscur.Core.Cryptography.Support.Math.EllipticCurve.Endomorphism.GlvTypeBEndomorphism' Obscur.Core.Cryptography.Support.Math.EllipticCurve.Custom.SEC.SecP384R1Point' Obscur.Core.Cryptography.Support.Math.EllipticCurve.Multiplier.FixedPointCombMultiplier' Obscur.Core.Cryptography.Support.Math.EllipticCurve.Custom.SEC.SecP521R1Point' Obscur.Core.Cryptography.Support.Math.EllipticCurve.Multiplier.FixedPointUtilities' Obscur.Core.Cryptography.Support.X9IntegerConverter' Obscur.Core.Cryptography.Support.Math.EllipticCurve.Multiplier.WNafUtilities' Obscur.Core.Cryptography.Support.Math.EllipticCurve.Multiplier.MixedNafR2LMultiplier' Obscur.Core.Cryptography.Information.EllipticCurve.FpEcCurveInformation' Obscur.Core.Cryptography.Information.EllipticCurve.PpbF2mEcCurveInformation' Obscur.Core.Cryptography.Support.Math.EllipticCurve.Multiplier.WTauNafMultiplier' Obscur.Core.Cryptography.Information.EllipticCurve.TpbF2mEcCurveInformation' Obscur.Core.Cryptography.Support.Math.EllipticCurve.ABC.Tnaf' Obscur.Core.Cryptography.Support.Math.EllipticCurve.Custom.SEC.SecP192K1FieldElement' Obscur.Core.Cryptography.Support.Math.EllipticCurve.Custom.SEC.SecP192R1FieldElement' Obscur.Core.Cryptography.Support.Math.EllipticCurve.Custom.SEC.SecP224K1FieldElement' Obscur.Core.Cryptography.Support.Math.EllipticCurve.Custom.SEC.SecP224R1FieldElement' Obscur.Core.Cryptography.Support.Math.EllipticCurve.Custom.SEC.SecP256K1FieldElement' Obscur.Core.Cryptography.Support.Math.EllipticCurve.Custom.SEC.SecP384R1FieldElement' Obscur.Core.Cryptography.Support.Math.EllipticCurve.Custom.SEC.SecP256R1FieldElement' Obscur.Core.Cryptography.Support.Math.EllipticCurve.Custom.SEC.SecP521R1FieldElement' Obscur.Core.Cryptography.KeyAgreement.Primitives.Um1Exchange' Obscur.Core.Cryptography.Support.ECPublicKeyParameters' Obscur.Core.Cryptography.KeyAgreement.KeyAgreementFactory' Obscur.Core.Cryptography.KeyAgreement.KeypairFactory' Obscur.Core.Cryptography.Support.Math.EllipticCurve.Multiplier.ECMultiplier' Obscur.Core.Cryptography.Support.Math.EllipticCurve.Multiplier.FixedPointPreCompInfo' Obscur.Core.Cryptography.Support.Math.EllipticCurve.Multiplier.DoubleAddMultiplier' Obscur.Core.Cryptography.Support.Math.EllipticCurve.Multiplier.NafL2RMultiplier' Obscur.Core.Cryptography.Support.Math.EllipticCurve.Multiplier.WNafPreCompInfo' Obscur.Core.Cryptography.Support.Math.EllipticCurve.Multiplier.ZSignedDigitL2RMultiplier' Obscur.Core.Cryptography.Support.Math.EllipticCurve.Multiplier.ZSignedDigitR2LMultiplier' Obscur.Core.Cryptography.Support.Math.EllipticCurve.Multiplier.NafR2LMultiplier' Obscur.Core.Cryptography.Support.Math.EllipticCurve.Multiplier.WNafL2RMultiplier' Obscur.Core.Cryptography.Support.Math.EllipticCurve.Multiplier.MontgomeryLadderMultiplier' Obscur.Core.Cryptography.Support.Math.EllipticCurve.Multiplier.WTauNafPreCompInfo' Obscur.Core.Cryptography.Support.Math.EllipticCurve.Endomorphism.ECEndomorphism' Obscur.Core.Cryptography.Support.Math.EllipticCurve.Custom.SEC.Nat192' Obscur.Core.Cryptography.Support.Math.EllipticCurve.Custom.SEC.Nat512' Obscur.Core.Cryptography.Support.Math.EllipticCurve.Custom.SEC.Nat256' Obscur.Core.Cryptography.Support.Math.EllipticCurve.Custom.SEC.Nat224' Obscur.Core.Cryptography.Support.Math.EllipticCurve.Custom.SEC.SecP256R1Field' Obscur.Core.Cryptography.Support.Math.EllipticCurve.Custom.SEC.SecP224R1Field' Obscur.Core.Cryptography.Support.Math.EllipticCurve.Custom.SEC.Nat384' Obscur.Core.Cryptography.Support.Math.EllipticCurve.Custom.SEC.SecP192K1Field' Obscur.Core.Cryptography.Support.Math.EllipticCurve.Custom.SEC.SecP224K1Field' Obscur.Core.Cryptography.Support.Math.EllipticCurve.Custom.SEC.SecP256K1Field' Obscur.Core.Cryptography.Support.Math.EllipticCurve.Custom.SEC.SecP521R1Field' Obscur.Core.Cryptography.Support.Math.EllipticCurve.Custom.SEC.SecP384R1Field' Obscur.Core.Cryptography.Support.Math.EllipticCurve.Custom.Curve25519Field' Obscur.Core.Cryptography.Support.Math.EllipticCurve.Custom.SEC.SecP192R1Field,Obscur.Core.Cryptography.Support.Math.BigInteger' Obscur.Core.Cryptography.Support.Math.EllipticCurve.Endomorphism.GlvEndomorphism' Obscur.Core.Cryptography.Support.Math.EllipticCurve.Multiplier.WNafPreCompInfo' Obscur.Core.Cryptography.Support.Math.EllipticCurve.Multiplier.WNafUtilities' Obscur.Core.Cryptography.Support.Math.Field.IFiniteField' Obscur.Core.Cryptography.Support.Math.Field.IPolynomialExtensionField' Obscur.Core.Cryptography.Support.Math.EllipticCurve.Endomorphism.ECEndomorphism' Obscur.Core.Cryptography.Support.Math.EllipticCurve.Multiplier.ECMultiplier' Obscur.Core.Cryptography.Support.Math.EllipticCurve.Multiplier.GlvMultiplier' Obscur.Core.Cryptography.Support.Math.EllipticCurve.Multiplier.PreCompInfo' Obscur.Core.Cryptography.Support.Math.EllipticCurve.Multiplier.WNafL2RMultiplier' Obscur.Core.Cryptography.Support.Math.Field.FiniteFields' Obscur.Core.Cryptography.Support.Math.EllipticCurve.ABC.Tnaf' Obscur.Core.Cryptography.Support.Math.EllipticCurve.Multiplier.WTauNafMultiplier' Obscur.Core.Cryptography.Support.Pack
Obscur.Core,Obscur.Core.Cryptography.Support.Math.EllipticCurve.Endomorphism,Obscur.Core.Cryptography.Support.Math.EllipticCurve.ECCurve' Obscur.Core.Cryptography.Support.Math.EllipticCurve.Multiplier.GlvMultiplier' Obscur.Core.Cryptography.Support.Math.EllipticCurve.ECAlgorithms' Obscur.Core.Cryptography.Information.EllipticCurve.CustomFpEcCurveInformation,Obscur.Core.Cryptography.Support.Math.EllipticCurve.ECPointMap' Obscur.Core.Cryptography.Support.Math.BigInteger' Obscur.Core.Cryptography.Support.Math.EllipticCurve.ECCurve' Obscur.Core.Cryptography.Support.Math.EllipticCurve.ScaleXPointMap
Obscur.Core,Obscur.Core.Cryptography.Support.Math.EllipticCurve.Multiplier,Obscur.Core.Cryptography.KeyAgreement.KeypairFactory' Obscur.Core.Cryptography.Signing.Primitives.ECDsaSigner' Obscur.Core.Cryptography.KeyAgreement.Primitives.ECJpakeSession' Obscur.Core.Cryptography.Support.Math.EllipticCurve.ECCurve' Obscur.Core.Cryptography.Support.Math.EllipticCurve.F2mCurve' Obscur.Core.Cryptography.Support.Math.EllipticCurve.ECAlgorithms,Obscur.Core.Cryptography.Support.Math.BigInteger' Obscur.Core.Cryptography.Support.Math.EllipticCurve.ECAlgorithms' Obscur.Core.Cryptography.Support.Math.EllipticCurve.ECPoint' Obscur.Core.Cryptography.Support.Math.EllipticCurve.ECCurve' Obscur.Core.Cryptography.Support.Math.EllipticCurve.ECPointMap' Obscur.Core.Cryptography.Support.Math.EllipticCurve.Endomorphism.GlvEndomorphism' Obscur.Core.Cryptography.Support.Math.EllipticCurve.LongArray' Obscur.Core.Cryptography.Support.Math.EllipticCurve.ABC.Tnaf' Obscur.Core.Cryptography.Support.Math.EllipticCurve.ABC.ZTauElement' Obscur.Core.Cryptography.Support.Math.EllipticCurve.F2mCurve' Obscur.Core.Cryptography.Support.Math.EllipticCurve.F2mPoint
