Project,Namespace,Ca types,Ce types
Obscur.Core,Obscur.Core,Obscur.Core.Cryptography.Ciphers.CipherFactory' Obscur.Core.Cryptography.Authentication.Information.CmacInformation' Obscur.Core.Cryptography.Authentication.HashEngine' Obscur.Core.Cryptography.Ciphers.Block.BlockCipherModeBase' Obscur.Core.Cryptography.Ciphers.CipherKeySizeException' Obscur.Core.Cryptography.Ciphers.CipherStream' Obscur.Core.Cryptography.Ciphers.BlockSizeException' Obscur.Core.Cryptography.Ciphers.Block.BlockCipherBase' Obscur.Core.Cryptography.Information.EcInformationStore' Obscur.Core.Cryptography.Ciphers.Stream.StreamCipherEngine' Obscur.Core.Cryptography.KeyAgreement.KeypairFactory' Obscur.Core.Cryptography.Authentication.MacEngine' Obscur.Core.Cryptography.Authentication.AuthenticatorFactory' Obscur.Core.Packaging.Multiplexing.Primitives.FrameshiftPayloadMux' Obscur.Core.Packaging.Multiplexing.Primitives.FabricPayloadMux' Obscur.Core.Packaging.PackageReader' Obscur.Core.Packaging.PackageWriter' Obscur.Core.Cryptography.Entropy.Primitives.StreamCsPrng' Obscur.Core.Cryptography.Ciphers.Stream.StreamCipherConfigurationWrapper' Obscur.Core.Cryptography.Ciphers.Block.BlockCipherConfigurationWrapper' Obscur.Core.Cryptography.Ciphers.CipherConfigurationFactory' Obscur.Core.Cryptography.Authentication.AuthenticationConfigurationFactory' Obscur.Core.Cryptography.KeyAgreement.Primitives.ECJpakeSession' Obscur.Core.Cryptography.Signing.Primitives.ECDsaSigner' Obscur.Core.Packaging.Multiplexing.Entropy.MuxEntropySourceFacade' Obscur.Core.Cryptography.Ciphers.CipherConfigurationWrapper' Obscur.Core.Cryptography.Authentication.MacStream' Obscur.Core.Cryptography.KeyAgreement.KeyAgreementFactory' Obscur.Core.Packaging.Multiplexing.PayloadMux' Obscur.Core.Cryptography.Authentication.HashStream' Obscur.Core.Cryptography.KeyConfirmation.ConfirmationUtility' Obscur.Core.Cryptography.Ciphers.ICipherWrapper' Obscur.Core.Cryptography.Authentication.Primitives.Poly1305Mac' Obscur.Core.Cryptography.Authentication.Primitives.Blake2BMac' Obscur.Core.Cryptography.Authentication.Primitives.KeccakMac' Obscur.Core.Cryptography.Authentication.Primitives.SkeinEngine' Obscur.Core.Cryptography.CryptographyExtensions' Obscur.Core.Cryptography.Ciphers.Block.Primitives.ThreefishEngine' Obscur.Core.Support.Entropy.ThreadedSeedRng' Obscur.Core.Packaging.Multiplexing.Primitives.SimplePayloadMux' Obscur.Core.Cryptography.Ciphers.Information.StreamCipherInformation' Obscur.Core.Cryptography.Ciphers.Information.BlockCipherInformation' Obscur.Core.Cryptography.Authentication.Information.MacFunctionInformation' Obscur.Core.Cryptography.Authentication.Information.HashFunctionInformation' Obscur.Core.Cryptography.Ciphers.Information.BlockCipherPaddingInformation' Obscur.Core.Cryptography.Ciphers.Information.CipherInformation' Obscur.Core.Cryptography.Ciphers.Information.BlockCipherModeInformation' Obscur.Core.Cryptography.KeyDerivation.Information.KdfInformation' Obscur.Core.Packaging.Multiplexing.Entropy.PreallocatedMuxEntropySource' Obscur.Core.Cryptography.Ciphers.Block.Padding.Iso10126D2Padding' Obscur.Core.Packaging.Multiplexing.PayloadLayoutConfigurationFactory,Obscur.Core.Cryptography.Authentication.AuthenticationInformationStore' Obscur.Core.Cryptography.Authentication.HashFunction' Obscur.Core.Cryptography.Authentication.MacFunction' Obscur.Core.Cryptography.Authentication.Information.HashFunctionInformation' Obscur.Core.Cryptography.Authentication.Information.MacFunctionInformation' Obscur.Core.Cryptography.Ciphers.CipherInformationStore' Obscur.Core.Cryptography.Ciphers.Block.BlockCipher' Obscur.Core.Cryptography.Ciphers.Block.BlockCipherMode' Obscur.Core.Cryptography.Ciphers.Block.BlockCipherPadding' Obscur.Core.Cryptography.Ciphers.Information.BlockCipherInformation' Obscur.Core.Cryptography.Ciphers.Information.BlockCipherModeInformation' Obscur.Core.Cryptography.Ciphers.Information.BlockCipherPaddingInformation' Obscur.Core.Cryptography.Ciphers.Information.StreamCipherInformation' Obscur.Core.Cryptography.Ciphers.Stream.StreamCipher' Obscur.Core.Cryptography.Entropy.CsprngInformationStore' Obscur.Core.Cryptography.Entropy.CsPseudorandomNumberGenerator' Obscur.Core.Cryptography.Entropy.Information.CsprngDescription' Obscur.Core.Cryptography.Information.EcInformationStore' Obscur.Core.Cryptography.Information.EllipticCurve.EcCurveInformation' Obscur.Core.Cryptography.KeyDerivation.KdfInformationStore' Obscur.Core.Cryptography.KeyDerivation.KeyDerivationFunction' Obscur.Core.Cryptography.KeyDerivation.Information.KdfInformation' Obscur.Core.Support.Base64' Obscur.Core.Support.Hex' Obscur.Core.Support.UrlBase64' Obscur.Core.Cryptography.Authentication.AuthenticatorFactory' Obscur.Core.Cryptography.Entropy.CsRng' Obscur.Core.Cryptography.Entropy.Primitives.DigestCsRng' Obscur.Core.Cryptography.Entropy.Primitives.ReversedRandomWindowRng' Obscur.Core.Support.Entropy.ThreadedSeedRng' Obscur.Core.Cryptography.Ciphers.Information.CipherInformation
Obscur.Core,Obscur.Core.Cryptography.Authentication,Obscur.Core.Cryptography.KeyConfirmation.ConfirmationConfigurationFactory' Obscur.Core.Packaging.PackageWriter' Obscur.Core.Athena' Obscur.Core.StratCom' Obscur.Core.Cryptography.Signing.Primitives.Ed25519' Obscur.Core.Cryptography.KeyDerivation.Pbkdf2Module' Obscur.Core.Cryptography.KeyDerivation.Primitives.Scrypt' Obscur.Core.Cryptography.KeyConfirmation.ConfirmationUtility' Obscur.Core.Cryptography.Authentication.Primitives.KeccakDigest' Obscur.Core.Cryptography.Authentication.Primitives.Blake2BDigest' Obscur.Core.Cryptography.Authentication.Primitives.Hmac' Obscur.Core.Cryptography.Authentication.Information.HashFunctionInformation' Obscur.Core.Cryptography.Authentication.Primitives.GeneralDigest' Obscur.Core.Cryptography.Authentication.Primitives.LongDigest' Obscur.Core.Cryptography.Authentication.Primitives.Sha1Digest' Obscur.Core.Cryptography.Authentication.Primitives.RipeMD160Digest' Obscur.Core.Cryptography.Authentication.Primitives.Sha512Digest' Obscur.Core.Cryptography.Authentication.Primitives.Sha256Digest' Obscur.Core.Cryptography.Authentication.Primitives.WhirlpoolDigest' Obscur.Core.Cryptography.Authentication.Primitives.TigerDigest' Obscur.Core.Cryptography.Signing.Primitives.HmacDsaKCalculator' Obscur.Core.Cryptography.Entropy.Primitives.DigestCsRng' Obscur.Core.Cryptography.KeyAgreement.Primitives.ECJpakeSession' Obscur.Core.Cryptography.Authentication.Primitives.CMac' Obscur.Core.Cryptography.Authentication.Primitives.Blake2BMac' Obscur.Core.Cryptography.Authentication.Primitives.SkeinMac' Obscur.Core.Cryptography.Authentication.Primitives.KeccakMac' Obscur.Core.Cryptography.Authentication.Primitives.Poly1305Mac' Obscur.Core.Cryptography.KeyDerivation.Primitives.Pbkdf2' Obscur.Core.Cryptography.Authentication.Information.MacFunctionInformation' Obscur.Core.Packaging.Multiplexing.Primitives.FrameshiftPayloadMux' Obscur.Core.Packaging.PackageReader' Obscur.Core.Packaging.Multiplexing.Primitives.SimplePayloadMux' Obscur.Core.Packaging.Multiplexing.PayloadMux' Obscur.Core.Packaging.Multiplexing.Primitives.FabricPayloadMux,Obscur.Core.Athena' Obscur.Core.Cryptography' Obscur.Core.StratCom' Obscur.Core.Cryptography.Ciphers.Block.BlockCipher' Obscur.Core.Cryptography.Authentication.Information.HashFunctionInformation' Obscur.Core.Cryptography.Authentication.Information.MacFunctionInformation' Obscur.Core.Cryptography.Authentication.Primitives.Blake2BDigest' Obscur.Core.Cryptography.Authentication.Primitives.Blake2BMac' Obscur.Core.Cryptography.Authentication.Primitives.CMac' Obscur.Core.Cryptography.Authentication.Primitives.Hmac' Obscur.Core.Cryptography.Authentication.Primitives.KeccakDigest' Obscur.Core.Cryptography.Authentication.Primitives.KeccakMac' Obscur.Core.Cryptography.Authentication.Primitives.Poly1305Mac' Obscur.Core.Cryptography.Authentication.Primitives.RipeMD160Digest' Obscur.Core.Cryptography.Authentication.Primitives.Sha1Digest' Obscur.Core.Cryptography.Authentication.Primitives.Sha256Digest' Obscur.Core.Cryptography.Authentication.Primitives.Sha512Digest' Obscur.Core.Cryptography.Authentication.Primitives.TigerDigest' Obscur.Core.Cryptography.Authentication.Primitives.WhirlpoolDigest' Obscur.Core.Cryptography.Ciphers.CipherFactory' Obscur.Core.DataLengthException' Obscur.Core.ConfigurationInvalidException' Obscur.Core.IStreamDecorator
Obscur.Core,Obscur.Core.Cryptography.Authentication.Information,Obscur.Core.Athena' Obscur.Core.Cryptography.Authentication.AuthenticationInformationStore,Obscur.Core.IPrimitiveInformation' Obscur.Core.Cryptography.Authentication.HashFunction' Obscur.Core.Cryptography.Authentication.MacFunction' Obscur.Core.Athena' Obscur.Core.Cryptography' Obscur.Core.Cryptography.Ciphers.Block.BlockCipher
Obscur.Core,Obscur.Core.Cryptography.Authentication.Primitives,Obscur.Core.Cryptography.Authentication.AuthenticatorFactory' Obscur.Core.Cryptography.Signing.Primitives.HmacDsaKCalculator' Obscur.Core.Cryptography.KeyAgreement.Primitives.ECJpakeSession' Obscur.Core.Cryptography.Support.Math.EllipticCurve.Custom.Ed25519.Ed25519Operations,Obscur.Core.Cryptography.Authentication.HashEngine' Obscur.Core.Cryptography.Authentication.HashFunction' Obscur.Core.DataLengthException' Obscur.Core.Cryptography.Authentication.IMac' Obscur.Core.Cryptography.Authentication.MacFunction' Obscur.Core.Cryptography.Ciphers.Block.BlockCipherBase' Obscur.Core.Cryptography.Ciphers.Block.Modes.CbcBlockCipher' Obscur.Core.Cryptography.Ciphers.Block.Padding.Iso7816D4Padding' Obscur.Core.Cryptography.Authentication.IHash' Obscur.Core.Cryptography.Authentication.MacEngine' Obscur.Core.Cryptography.Support.Pack' Obscur.Core.IMemoable' Obscur.Core.MemoableResetException' Obscur.Core.Cryptography.Ciphers.Block.Primitives.ThreefishEngine
Obscur.Core,Obscur.Core.Cryptography.Ciphers,Obscur.Core.Cryptography.Ciphers.Block.BlockCipherConfigurationWrapper' Obscur.Core.Packaging.PackageWriter' Obscur.Core.Cryptography.Ciphers.Stream.StreamCipherConfigurationWrapper' Obscur.Core.Cryptography.Entropy.CsPrngFactory' Obscur.Core.Cryptography.Authentication.AuthenticatorFactory' Obscur.Core.Athena' Obscur.Core.Packaging.Multiplexing.Primitives.SimplePayloadMux' Obscur.Core.Packaging.Multiplexing.PayloadMux' Obscur.Core.Packaging.Multiplexing.Primitives.FabricPayloadMux' Obscur.Core.Packaging.PackageReader' Obscur.Core.Cryptography.Ciphers.Block.BlockCipherWrapper' Obscur.Core.Cryptography.Ciphers.Stream.StreamCipherWrapper' Obscur.Core.Cryptography.Ciphers.Block.Padding.X923Padding' Obscur.Core.Cryptography.Ciphers.Block.Padding.Pkcs7Padding' Obscur.Core.Cryptography.Ciphers.Block.Padding.Iso7816D4Padding' Obscur.Core.Cryptography.Ciphers.Block.Padding.Iso10126D2Padding,Obscur.Core.Athena' Obscur.Core.Cryptography' Obscur.Core.ConfigurationInvalidException' Obscur.Core.Cryptography.Ciphers.Block.BlockCipher' Obscur.Core.StratCom' Obscur.Core.Cryptography.Ciphers.Block.BlockCipherMode' Obscur.Core.Cryptography.Ciphers.Block.BlockCipherPadding' Obscur.Core.Cryptography.Ciphers.Information.PaddingRequirement' Obscur.Core.Cryptography.Ciphers.Stream.StreamCipher' Obscur.Core.Cryptography.CryptographicException' Obscur.Core.Cryptography.Ciphers.Block.BlockCipherBase' Obscur.Core.Cryptography.Ciphers.Block.BlockCipherModeBase' Obscur.Core.Cryptography.Ciphers.Block.BlockCipherWrapper' Obscur.Core.Cryptography.Ciphers.Block.Modes.CbcBlockCipher' Obscur.Core.Cryptography.Ciphers.Block.Modes.CfbBlockCipher' Obscur.Core.Cryptography.Ciphers.Block.Modes.CtrBlockCipher' Obscur.Core.Cryptography.Ciphers.Block.Modes.OfbBlockCipher' Obscur.Core.Cryptography.Ciphers.Block.Padding.IBlockCipherPadding' Obscur.Core.Cryptography.Ciphers.Block.Padding.Iso10126D2Padding' Obscur.Core.Cryptography.Ciphers.Block.Padding.Iso7816D4Padding' Obscur.Core.Cryptography.Ciphers.Block.Padding.Pkcs7Padding' Obscur.Core.Cryptography.Ciphers.Block.Padding.TbcPadding' Obscur.Core.Cryptography.Ciphers.Block.Padding.X923Padding' Obscur.Core.Cryptography.Ciphers.Block.Primitives.AesEngine' Obscur.Core.Cryptography.Ciphers.Block.Primitives.BlowfishEngine' Obscur.Core.Cryptography.Ciphers.Block.Primitives.CamelliaEngine' Obscur.Core.Cryptography.Ciphers.Block.Primitives.IdeaEngine' Obscur.Core.Cryptography.Ciphers.Block.Primitives.NoekeonEngine' Obscur.Core.Cryptography.Ciphers.Block.Primitives.Rc6Engine' Obscur.Core.Cryptography.Ciphers.Block.Primitives.SerpentEngine' Obscur.Core.Cryptography.Ciphers.Block.Primitives.ThreefishEngine' Obscur.Core.Cryptography.Ciphers.Block.Primitives.TwofishEngine' Obscur.Core.Cryptography.Ciphers.Stream.Primitives.ChaChaEngine' Obscur.Core.Cryptography.Ciphers.Stream.Primitives.Hc128Engine' Obscur.Core.Cryptography.Ciphers.Stream.Primitives.Hc256Engine' Obscur.Core.Cryptography.Ciphers.Stream.Primitives.NullEngine' Obscur.Core.Cryptography.Ciphers.Stream.Primitives.RabbitEngine' Obscur.Core.Cryptography.Ciphers.Stream.Primitives.Salsa20Engine' Obscur.Core.Cryptography.Ciphers.Stream.Primitives.SosemanukEngine' Obscur.Core.Cryptography.Ciphers.Stream.Primitives.XSalsa20Engine' Obscur.Core.Cryptography.Ciphers.Stream.StreamCipherEngine' Obscur.Core.Cryptography.Ciphers.Information.BlockCipherInformation' Obscur.Core.Cryptography.Ciphers.Information.BlockCipherModeInformation' Obscur.Core.Cryptography.Ciphers.Information.BlockCipherPaddingInformation' Obscur.Core.Cryptography.Ciphers.Information.NoncePolicy' Obscur.Core.Cryptography.Ciphers.Information.StreamCipherInformation' Obscur.Core.DataLengthException' Obscur.Core.IStreamDecorator' Obscur.Core.Cryptography.Ciphers.Block.BlockCipherConfigurationWrapper' Obscur.Core.Cryptography.Ciphers.Stream.StreamCipherConfigurationWrapper' Obscur.Core.Cryptography.Ciphers.Stream.StreamCipherWrapper' Obscur.Core.Cryptography.CryptoException
Obscur.Core,Obscur.Core.Cryptography.Ciphers.Block,Obscur.Core.Cryptography.Authentication.Information.CmacInformation' Obscur.Core.Athena' Obscur.Core.Cryptography.Ciphers.BlockSizeException' Obscur.Core.Cryptography.Authentication.AuthenticationConfigurationFactory' Obscur.Core.Cryptography.Ciphers.Block.Primitives.BlowfishEngine' Obscur.Core.Cryptography.Ciphers.Block.Primitives.CamelliaEngine' Obscur.Core.Cryptography.Ciphers.Block.Primitives.IdeaEngine' Obscur.Core.Cryptography.Ciphers.Block.Primitives.Rc6Engine' Obscur.Core.Cryptography.Ciphers.Block.Primitives.NoekeonEngine' Obscur.Core.Cryptography.Authentication.AuthenticatorFactory' Obscur.Core.Cryptography.Ciphers.Block.Primitives.AesEngine' Obscur.Core.Cryptography.Ciphers.Block.Primitives.SerpentEngine' Obscur.Core.Cryptography.Ciphers.CipherConfigurationFactory' Obscur.Core.Cryptography.Ciphers.CipherKeySizeException' Obscur.Core.Cryptography.Ciphers.Block.Primitives.TwofishEngine' Obscur.Core.Cryptography.KeyConfirmation.ConfirmationConfigurationFactory' Obscur.Core.Cryptography.Ciphers.Information.BlockCipherInformation' Obscur.Core.Cryptography.Ciphers.Block.Primitives.ThreefishEngine' Obscur.Core.Packaging.PackageWriter' Obscur.Core.Cryptography.Ciphers.CipherFactory' Obscur.Core.Cryptography.Ciphers.CipherInformationStore' Obscur.Core.Cryptography.Ciphers.Block.Modes.CbcBlockCipher' Obscur.Core.Cryptography.Ciphers.Block.Modes.OfbBlockCipher' Obscur.Core.Cryptography.Ciphers.Block.Modes.CtrBlockCipher' Obscur.Core.Cryptography.Ciphers.Block.Modes.CfbBlockCipher' Obscur.Core.Cryptography.Authentication.Primitives.Poly1305Mac' Obscur.Core.Cryptography.Authentication.Primitives.CMac' Obscur.Core.Cryptography.Ciphers.CipherStream' Obscur.Core.Cryptography.Ciphers.Information.BlockCipherModeInformation' Obscur.Core.Cryptography.Ciphers.Information.BlockCipherPaddingInformation,Obscur.Core.Athena' Obscur.Core.Cryptography' Obscur.Core.DataLengthException' Obscur.Core.ConfigurationInvalidException' Obscur.Core.EnumerationParsingException' Obscur.Core.Cryptography.Ciphers.BlockSizeException' Obscur.Core.Cryptography.Ciphers.CipherConfigurationWrapper' Obscur.Core.Cryptography.Ciphers.CipherKeySizeException' Obscur.Core.Cryptography.Ciphers.Information.PaddingRequirement' Obscur.Core.Cryptography.Ciphers.ICipherWrapper' Obscur.Core.Cryptography.Ciphers.Block.Padding.IBlockCipherPadding' Obscur.Core.Cryptography.CryptoException
Obscur.Core,Obscur.Core.Cryptography.Ciphers.Block.Modes,Obscur.Core.Cryptography.Ciphers.CipherFactory' Obscur.Core.Cryptography.Authentication.Primitives.CMac,Obscur.Core.Cryptography.Ciphers.Block.BlockCipherBase' Obscur.Core.Cryptography.Ciphers.Block.BlockCipherMode' Obscur.Core.Cryptography.Ciphers.Block.BlockCipherModeBase
Obscur.Core,Obscur.Core.Cryptography.Ciphers.Block.Padding,Obscur.Core.Cryptography.Ciphers.Block.BlockCipherWrapper' Obscur.Core.Cryptography.Ciphers.CipherStream' Obscur.Core.Cryptography.Ciphers.CipherFactory' Obscur.Core.Cryptography.Authentication.Primitives.CMac,Obscur.Core.Cryptography.Entropy.CsRng' Obscur.Core.StratCom' Obscur.Core.Cryptography.Ciphers.InvalidCipherTextException
Obscur.Core,Obscur.Core.Cryptography.Ciphers.Block.Primitives,Obscur.Core.Cryptography.Ciphers.CipherFactory' Obscur.Core.Cryptography.Authentication.Primitives.SkeinEngine,Obscur.Core.Cryptography.Ciphers.Block.BlockCipher' Obscur.Core.Cryptography.Ciphers.Block.BlockCipherBase' Obscur.Core.Cryptography.Support.Pack' Obscur.Core.DataLengthException
Obscur.Core,Obscur.Core.Cryptography.Ciphers.Information,Obscur.Core.Athena' Obscur.Core.Cryptography.Ciphers.CipherInformationStore' Obscur.Core.ValidationError' Obscur.Core.Cryptography.Ciphers.Block.BlockCipherModeBase' Obscur.Core.Cryptography.Ciphers.CipherConfigurationFactory' Obscur.Core.Cryptography.Ciphers.Block.BlockCipherConfigurationWrapper' Obscur.Core.Cryptography.Ciphers.Stream.StreamCipherConfigurationWrapper,Obscur.Core.IEnumeratedPrimitiveInformation' Obscur.Core.Cryptography.Ciphers.Block.BlockCipher' Obscur.Core.IPrimitiveInformation' Obscur.Core.Cryptography.Ciphers.Block.BlockCipherMode' Obscur.Core.Cryptography.Ciphers.Block.BlockCipherPadding' Obscur.Core.Cryptography.Ciphers.Stream.StreamCipher
Obscur.Core,Obscur.Core.Cryptography.Ciphers.Stream.Primitives,Obscur.Core.Cryptography.Ciphers.CipherFactory' Obscur.Core.Cryptography.KeyAgreement.Primitives.Curve25519' Obscur.Core.Cryptography.KeyDerivation.Primitives.Scrypt,Obscur.Core.Cryptography.Ciphers.Stream.StreamCipher' Obscur.Core.Cryptography.Ciphers.Stream.StreamCipherEngine' Obscur.Core.Cryptography.MaxBytesExceededException' Obscur.Core.Cryptography.Entropy.ICsPrngCompatible' Obscur.Core.Cryptography.Support.Pack
Obscur.Core,Obscur.Core.Cryptography.Ciphers.Stream,Obscur.Core.Cryptography.Ciphers.Stream.Primitives.Hc128Engine' Obscur.Core.Cryptography.Ciphers.Stream.Primitives.RabbitEngine' Obscur.Core.Cryptography.Ciphers.Stream.Primitives.Hc256Engine' Obscur.Core.Cryptography.Ciphers.Stream.Primitives.NullEngine' Obscur.Core.Cryptography.Ciphers.Stream.Primitives.ChaChaEngine' Obscur.Core.Cryptography.Ciphers.Stream.Primitives.XSalsa20Engine' Obscur.Core.Cryptography.Entropy.CsPrngFactory' Obscur.Core.Cryptography.Ciphers.Stream.Primitives.Salsa20Engine' Obscur.Core.Cryptography.Entropy.Primitives.StreamCsPrng' Obscur.Core.Cryptography.Ciphers.CipherKeySizeException' Obscur.Core.Athena' Obscur.Core.Cryptography.Ciphers.Information.StreamCipherInformation' Obscur.Core.Cryptography.Ciphers.Stream.Primitives.SosemanukEngine' Obscur.Core.Cryptography.Ciphers.CipherConfigurationFactory' Obscur.Core.Packaging.PackageWriter' Obscur.Core.Cryptography.Ciphers.CipherFactory' Obscur.Core.Cryptography.Ciphers.CipherInformationStore' Obscur.Core.Cryptography.Ciphers.CipherStream,Obscur.Core.Athena' Obscur.Core.Cryptography' Obscur.Core.ConfigurationInvalidException' Obscur.Core.EnumerationParsingException' Obscur.Core.Cryptography.Ciphers.CipherConfigurationWrapper' Obscur.Core.Cryptography.Ciphers.CipherKeySizeException' Obscur.Core.Cryptography.Ciphers.Information.StreamCipherInformation' Obscur.Core.DataLengthException' Obscur.Core.Cryptography.Ciphers.ICipherWrapper
Obscur.Core,Obscur.Core.Cryptography,Obscur.Core.Packaging.Multiplexing.Primitives.SimplePayloadMux' Obscur.Core.Packaging.Multiplexing.Primitives.FabricPayloadMux' Obscur.Core.Packaging.PackageReader' Obscur.Core.Cryptography.Ciphers.InvalidCipherTextException' Obscur.Core.Cryptography.Ciphers.Block.BlockCipherWrapper' Obscur.Core.Cryptography.Ciphers.CipherStream' Obscur.Core.Cryptography.KeyAgreement.Primitives.ECJpakeSession' Obscur.Core.Cryptography.Ciphers.CipherException' Obscur.Core.Cryptography.Ciphers.Stream.Primitives.ChaChaEngine' Obscur.Core.Cryptography.Ciphers.Stream.Primitives.Salsa20Engine,Obscur.Core.DataLengthException
Obscur.Core,Obscur.Core.Cryptography.Entropy,Obscur.Core.Packaging.Multiplexing.Entropy.CsprngMuxEntropySource' Obscur.Core.Cryptography.Entropy.Primitives.StreamCsPrng' Obscur.Core.Packaging.Multiplexing.Entropy.StreamCipherCsprngMuxEntropySource' Obscur.Core.Packaging.Multiplexing.PayloadLayoutConfigurationFactory' Obscur.Core.Athena' Obscur.Core.Cryptography.Entropy.Information.CsprngDescription' Obscur.Core.Cryptography.Ciphers.Block.Padding.Iso7816D4Padding' Obscur.Core.Cryptography.Ciphers.Block.Padding.Pkcs7Padding' Obscur.Core.Cryptography.Ciphers.Block.Padding.TbcPadding' Obscur.Core.Cryptography.Ciphers.Block.Padding.IBlockCipherPadding' Obscur.Core.Cryptography.Ciphers.Block.Padding.Iso10126D2Padding' Obscur.Core.Cryptography.Entropy.Primitives.DigestCsRng' Obscur.Core.Cryptography.Ciphers.Block.Padding.X923Padding' Obscur.Core.Cryptography.Signing.Primitives.IDsaKCalculator' Obscur.Core.Cryptography.Signing.Primitives.HmacDsaKCalculator' Obscur.Core.Cryptography.Entropy.Primitives.ReversedRandomWindowRng' Obscur.Core.Cryptography.Entropy.Primitives.ReversedWindowCsRng' Obscur.Core.Cryptography.Support.ECKeyGenerationParameters' Obscur.Core.Cryptography.KeyAgreement.Primitives.ECJpakeSession' Obscur.Core.Packaging.Multiplexing.Entropy.PreallocatedMuxEntropySource' Obscur.Core.StratCom' Obscur.Core.Cryptography.Signing.Primitives.RandomDsaKCalculator' Obscur.Core.Cryptography.Support.KeyGenerationParameters' Obscur.Core.Cryptography.Signing.Primitives.ECDsaSigner' Obscur.Core.Cryptography.Ciphers.Stream.Primitives.Salsa20Engine' Obscur.Core.Cryptography.Ciphers.Stream.Primitives.ChaChaEngine' Obscur.Core.Cryptography.Ciphers.Stream.Primitives.RabbitEngine' Obscur.Core.Cryptography.Ciphers.Stream.Primitives.SosemanukEngine,Obscur.Core.Support.Entropy.Prng' Obscur.Core.Cryptography.Ciphers.CipherFactory' Obscur.Core.Cryptography.Ciphers.Stream.StreamCipher' Obscur.Core.Cryptography.Ciphers.Stream.StreamCipherEngine' Obscur.Core.Cryptography.Entropy.Primitives.StreamCsPrng' Obscur.Core.Cryptography.Entropy.Information.CsprngDescription' Obscur.Core.Support.Entropy.Rng
Obscur.Core,Obscur.Core.Cryptography.Entropy.Information,Obscur.Core.Athena' Obscur.Core.Cryptography.Entropy.CsprngInformationStore,Obscur.Core.Cryptography.Entropy.CsPseudorandomNumberGenerator
Obscur.Core,Obscur.Core.Cryptography.Entropy.Primitives,Obscur.Core.StratCom' Obscur.Core.Cryptography.Entropy.CsPrngFactory,Obscur.Core.Cryptography.Authentication.IHash' Obscur.Core.Cryptography.Entropy.CsRng' Obscur.Core.Support.Entropy.Rng' Obscur.Core.Athena' Obscur.Core.Cryptography' Obscur.Core.StratCom' Obscur.Core.Cryptography.Ciphers.Stream.StreamCipher' Obscur.Core.Cryptography.Ciphers.Stream.StreamCipherEngine' Obscur.Core.Cryptography.Entropy.CsPrng' Obscur.Core.Cryptography.Entropy.CsPseudorandomNumberGenerator' Obscur.Core.Cryptography.Entropy.ICsPrngCompatible
Obscur.Core,Obscur.Core.Cryptography.Information,Obscur.Core.Athena' Obscur.Core.Cryptography.Signing.Primitives.ECDsaSigner' Obscur.Core.Cryptography.KeyAgreement.KeyAgreementFactory' Obscur.Core.Cryptography.KeyAgreement.KeypairFactory,Obscur.Core.Athena' Obscur.Core.Cryptography' Obscur.Core.Cryptography.Information.EllipticCurve.BrainpoolEllipticCurve' Obscur.Core.Cryptography.Information.EllipticCurve.CustomFpEcCurveInformation' Obscur.Core.Cryptography.Information.EllipticCurve.DjbCurve' Obscur.Core.Cryptography.Information.EllipticCurve.DjbEcInformation' Obscur.Core.Cryptography.Information.EllipticCurve.EcCurveInformation' Obscur.Core.Cryptography.Information.EllipticCurve.FpEcCurveInformation' Obscur.Core.Cryptography.Information.EllipticCurve.PpbF2mEcCurveInformation' Obscur.Core.Cryptography.Information.EllipticCurve.Sec2EllipticCurve' Obscur.Core.Cryptography.Information.EllipticCurve.TpbF2mEcCurveInformation' Obscur.Core.Cryptography.Support.Math.EllipticCurve.Custom.SEC.SecP192K1Curve' Obscur.Core.Cryptography.Support.Math.EllipticCurve.Custom.SEC.SecP192R1Curve' Obscur.Core.Cryptography.Support.Math.EllipticCurve.Custom.SEC.SecP224K1Curve' Obscur.Core.Cryptography.Support.Math.EllipticCurve.Custom.SEC.SecP224R1Curve' Obscur.Core.Cryptography.Support.Math.EllipticCurve.Custom.SEC.SecP256K1Curve' Obscur.Core.Cryptography.Support.Math.EllipticCurve.Custom.SEC.SecP256R1Curve' Obscur.Core.Cryptography.Support.Math.EllipticCurve.Custom.SEC.SecP384R1Curve' Obscur.Core.Cryptography.Support.Math.EllipticCurve.Custom.SEC.SecP521R1Curve
Obscur.Core,Obscur.Core.Cryptography.Information.EllipticCurve,Obscur.Core.Cryptography.Information.EcInformationStore' Obscur.Core.Cryptography.KeyAgreement.Primitives.Curve25519' Obscur.Core.Cryptography.KeyAgreement.KeyAgreementFactory' Obscur.Core.Cryptography.KeyAgreement.KeypairFactory' Obscur.Core.Athena' Obscur.Core.Cryptography.Signing.Primitives.ECDsaSigner,Obscur.Core.Cryptography.Support.ECDomainParameters' Obscur.Core.Cryptography.Support.Math.BigInteger' Obscur.Core.Cryptography.Support.Math.EllipticCurve.ECCurve' Obscur.Core.Cryptography.Support.Math.EllipticCurve.Endomorphism.GlvTypeBEndomorphism' Obscur.Core.Cryptography.Support.Math.EllipticCurve.Endomorphism.GlvTypeBParameters' Obscur.Core.Support.Hex' Obscur.Core.Cryptography.Support.Math.EllipticCurve.FpCurve' Obscur.Core.Cryptography.Support.Math.EllipticCurve.F2mCurve
