Project,Namespace,Ca types,Ce types
OpenTK,OpenTK,OpenGlobe.Renderer.GL3x.GraphicsWindowGL3x' Examples.Tests.TestResolutionChanges' OpenTK.Platform.IDisplayDeviceDriver' OpenTK.Platform.IPlatformFactory' OpenTK.Platform.Factory' OpenTK.Platform.UnsupportedPlatform' OpenTK.Platform.MacOS.MacOSFactory' OpenTK.Platform.MacOS.CarbonGLNative' OpenTK.Platform.MacOS.AglContext' OpenTK.Platform.MacOS.QuartzDisplayDeviceDriver' OpenTK.Platform.Windows.WinFactory' OpenTK.Platform.Windows.WinDisplayDeviceDriver' OpenTK.Platform.Windows.WinGLNative' OpenTK.Platform.X11.X11DisplayDevice' OpenTK.Platform.X11.X11GLNative' OpenTK.Platform.X11.X11Factory' Examples.Tests.GameWindowStates' OpenTK.Audio.Alc' OpenTK.Platform.Dummy.DummyGLContext' OpenTK.Platform.Egl.EglX11PlatformFactory' OpenTK.Platform.Egl.EglWinPlatformFactory' OpenTK.Platform.Egl.EglContext' OpenTK.Platform.Egl.EglMacPlatformFactory' OpenTK.Platform.Windows.WinGLContext' OpenTK.Platform.X11.Glx' OpenTK.Platform.X11.X11GLContext' OpenTK.Graphics.GraphicsContext' OpenTK.Graphics.GraphicsContextBase' OpenTK.Audio.AudioDeviceEnumerator' OpenTK.Audio.AudioContext' OpenTK.Audio.OpenAL.Alc' Examples.FullscreenAntialias' Examples.Tutorial.T02_Vertex_Arrays' Examples.Tutorial.T04_Vertex_Lighting' Examples.Tutorial.T10_GLSL_Cube' Examples.Tutorial.ThreadedRendering' Examples.Tutorial.SimpleWindow' Examples.Tests.Multithreading' OpenTK.Graphics.GL' Examples.WinForms.Extensions' OpenGlobe.Renderer.GL3x.FinalizerThreadContextGL3x' Examples.Tutorial.T07_Display_Lists_Flower' Examples.Tutorial.StencilCSG' Examples.Tutorial.Textures' Examples.Tutorial.T09_VBO_Dynamic' Examples.Tutorial.SimpleFBO' Examples.Tutorial.T03_Immediate_Mode_Cube' Examples.Tutorial.T08_VBO' Examples.Tutorial.TextureMatrix' Examples.Tutorial.Picking' Examples.Tutorial.SimpleGeometryShader' Examples.Tutorial.T13_GLSL_Earth' Examples.Tutorial.T12_GLSL_Parallax' Examples.Tutorial.SimpleGeometryShader2' Examples.Tutorial.JuliaSetFractal' Examples.Tutorial.HelloGL3' Examples.Tutorial.SimpleES20Window' Examples.Tests.InputLogger' OpenTK.Audio.AL' Examples.Parrot' Examples.Tests.BlittableValueTypes' OpenTK.Audio.AudioCapture' OpenTK.Audio.OpenAL.AL' OpenGlobe.Renderer.GL3x.ContextGL3x' Examples.Utilities' OpenTK.Platform.GdiPlus' OpenTK.Graphics.Text.GdiPlusGlyphRasterizer' OpenTK.Platform.Windows.WinGraphicsMode' OpenTK.Graphics.OpenGL.GL' OpenTK.Graphics.ES20.GL' OpenTK.Graphics.Glu' OpenTK.Graphics.Text.GL1TextOutputProvider' OpenTK.Audio.EffectsExtension' OpenTK.Audio.EaxReverb' OpenTK.Audio.EfxEaxReverb' Examples.Tutorial.VertexC4ubV3f' Examples.Tutorial.ParticleAttribut' Examples.Tutorial.Vertex' Examples.Tutorial.VertexPositionNormalTexture' Examples.Tutorial.VertexPositionColor' Examples.Shapes.VertexT2fN3fV3f' Examples.Shapes.IsoSphere' Examples.Shapes.Plane' Examples.Shapes.Shape' OpenTK.Audio.OpenAL.EffectsExtension' OpenTK.Audio.OpenAL.EaxReverb' OpenTK.Audio.OpenAL.EfxEaxReverb' Examples.Shapes.TorusKnot' Examples.Shapes.SlicedHose' Examples.Shapes.SlicedSphere' Examples.Shapes.VertexT2dN3dV3d' Examples.Shapes.DrawableShape' Examples.Shapes.SierpinskiTetrahedron' Examples.Shapes.TetrahedronFace' Examples.Shapes.VertexT2hN3hV3h' Examples.WinForms.GameLoopForm' Examples.Tutorial.T02_Vertex_Arrays' Examples.Tutorial.SimpleFBO' Examples.Tutorial.T03_Immediate_Mode_Cube' Examples.Tutorial.SimpleGeometryShader' Examples.Tutorial.SimpleGeometryShader2' OpenTK.Graphics.Imports' OpenTK.Graphics.NV' OpenTK.Graphics.OpenGL.Core' OpenTK.Graphics.OpenGL.NV' OpenTK.Graphics.DisplayListTextPrinter' OpenTK.Graphics.ITextPrinterImplementation' OpenTK.Graphics.VboTextPrinter' Examples.Tutorial.Particle' OpenGlobe.Scene.CameraFly' Examples.Shapes.MengerSponge' Examples.Shapes.ChamferCube' Examples.Shapes.MengerCube,OpenTK.Platform.IDisplayDeviceDriver' OpenTK.Platform.IPlatformFactory' OpenTK.Platform.Factory' OpenTK.Graphics.GraphicsMode' OpenTK.Graphics.ColorFormat' OpenTK.Graphics.IGraphicsContext' OpenTK.Graphics.GraphicsContextFlags' OpenTK.Graphics.IGraphicsContextInternal' OpenTK.Platform.X11.API' OpenTK.Input.IInputDriver
OpenTK,OpenTK.Platform,OpenTK.DisplayDevice' OpenTK.GLControl' OpenTK.WinGLControl' OpenTK.X11GLControl' OpenTK.CarbonGLControl' OpenTK.Platform.Dummy.DummyGLContext' OpenTK.Platform.Egl.EglX11PlatformFactory' OpenTK.Platform.Egl.EglWinPlatformFactory' OpenTK.Platform.Egl.EglContext' OpenTK.Platform.Egl.EglMacPlatformFactory' OpenTK.Platform.MacOS.MacOSFactory' OpenTK.Platform.MacOS.AglContext' OpenTK.Platform.Windows.WinFactory' OpenTK.Platform.Windows.WinGLContext' OpenTK.Platform.X11.X11GLContext' OpenTK.Platform.X11.X11Input' OpenTK.Platform.X11.X11Factory' OpenTK.Graphics.IGraphicsContext' OpenTK.Graphics.GraphicsContext' OpenTK.Graphics.GraphicsContextBase' OpenTK.NativeWindow' OpenTK.Graphics.GraphicsMode' OpenTK.Platform.Windows.Wgl,OpenTK.DisplayDevice' OpenTK.DisplayResolution' OpenTK.Graphics.ES10.GL' OpenTK.Graphics.ES11.GL' OpenTK.Graphics.ES20.GL' OpenTK.Graphics.GraphicsMode' OpenTK.GameWindowFlags' OpenTK.Graphics.IGraphicsContext' OpenTK.Graphics.GraphicsContextFlags' OpenTK.ContextHandle' OpenTK.Configuration' OpenTK.Platform.Egl.Egl' OpenTK.INativeWindow' OpenTK.Graphics.IGraphicsMode' OpenTK.Input.IKeyboardDriver' OpenTK.Graphics.GraphicsContext' OpenTK.Graphics.IGraphicsContextInternal' OpenTK.Platform.X11.X11WindowInfo' OpenTK.Platform.X11.XVisualInfo' OpenTK.Platform.Windows.WinWindowInfo' OpenTK.Platform.MacOS.CarbonWindowInfo' OpenTK.Platform.Dummy.DummyWindowInfo' OpenTK.Graphics.OpenGL.GL
OpenTK,OpenTK.Platform.Dummy,OpenTK.Platform.Utilities,OpenTK.ContextHandle' OpenTK.Graphics.IGraphicsContext' OpenTK.Platform.IWindowInfo
OpenTK,OpenTK.Platform.Egl,OpenTK.Platform.Factory,OpenTK.Platform.X11.X11WindowInfo' OpenTK.Graphics.GraphicsMode' OpenTK.Platform.IWindowInfo' OpenTK.Graphics.IGraphicsContext' OpenTK.Graphics.GraphicsContextFlags' OpenTK.ContextHandle' OpenTK.Platform.Windows.WinWindowInfo' OpenTK.Graphics.ColorFormat
OpenTK,OpenTK.Platform.MacOS.Carbon,OpenTK.Platform.MacOS.CarbonGLNative' OpenTK.Platform.MacOS.AglContext' OpenTK.Platform.MacOS.QuartzDisplayDeviceDriver' OpenTK.Platform.MacOS.CarbonWindowInfo' OpenTK.Platform.MacOS.MacOSKeyMap,OpenTK.Platform.MacOS.CarbonGLNative' OpenTK.Platform.MacOS.OSStatus
OpenTK,OpenTK.Platform.MacOS,OpenTK.Platform.MacOS.Carbon.Application' OpenTK.Platform.MacOS.Carbon.API' OpenTK.Platform.Utilities,OpenTK.Graphics.GraphicsMode' OpenTK.Graphics.ColorFormat' OpenTK.GameWindowFlags' OpenTK.DisplayDevice' OpenTK.Platform.IWindowInfo' OpenTK.Graphics.IGraphicsContext' OpenTK.Graphics.GraphicsContextFlags' OpenTK.ContextHandle' OpenTK.Platform.MacOS.Carbon.MacOSKeyCode' OpenTK.Input.Key' OpenTK.Platform.MacOS.Carbon.WindowAttributes' OpenTK.Platform.MacOS.Carbon.WindowClass' OpenTK.Platform.MacOS.Carbon.WindowPositionMethod' OpenTK.WindowBorder' OpenTK.WindowState' OpenTK.KeyPressEventArgs' OpenTK.Platform.MacOS.Carbon.Application' OpenTK.Platform.MacOS.Carbon.API' OpenTK.Platform.MacOS.Carbon.Rect' OpenTK.Platform.MacOS.Carbon.WindowRegionCode' OpenTK.Platform.MacOS.Carbon.EventTypeSpec' OpenTK.Platform.MacOS.Carbon.EventClass' OpenTK.Platform.MacOS.Carbon.WindowEventKind' OpenTK.Platform.MacOS.Carbon.EventInfo' OpenTK.Platform.MacOS.Carbon.KeyboardEventKind' OpenTK.Input.KeyboardDevice' OpenTK.Input.IInputDriver' OpenTK.Platform.MacOS.Carbon.MouseButton' OpenTK.Platform.MacOS.Carbon.HIPoint' OpenTK.Platform.MacOS.Carbon.MouseEventKind' OpenTK.Input.MouseButton' OpenTK.Input.MouseDevice' OpenTK.Platform.MacOS.Carbon.MacOSKeyModifiers' OpenTK.Platform.MacOS.Carbon.CarbonPoint' OpenTK.Platform.MacOS.Carbon.WindowPartCode' OpenTK.Graphics.IGraphicsContextInternal' OpenTK.Graphics.GraphicsContext' OpenTK.Platform.MacOS.Carbon.CG' OpenTK.Platform.MacOS.Carbon.CFArray' OpenTK.Platform.MacOS.Carbon.CFDictionary' OpenTK.Platform.MacOS.Carbon.HIRect' OpenTK.Platform.MacOS.Carbon.HISize' OpenTK.DisplayResolution
OpenTK,OpenTK.Platform.Windows,OpenTK.Platform.Utilities' OpenTK.Platform.Egl.EglWinPlatformFactory,OpenTK.Input.KeyboardDevice' OpenTK.Input.Key' OpenTK.Graphics.GraphicsMode' OpenTK.GameWindowFlags' OpenTK.DisplayDevice' OpenTK.Platform.IWindowInfo' OpenTK.Graphics.IGraphicsContext' OpenTK.Graphics.GraphicsContextFlags' OpenTK.ContextHandle' OpenTK.Input.MouseDevice' OpenTK.Input.MouseButton' OpenTK.DisplayResolution' OpenTK.WindowBorder' OpenTK.WindowState' OpenTK.KeyPressEventArgs' OpenTK.Graphics.IGraphicsContextInternal' OpenTK.Platform.DesktopGraphicsContext' OpenTK.Input.JoystickDevice' OpenTK.Input.JoystickAxisCollection' OpenTK.Input.JoystickButtonCollection' OpenTK.Platform.Utilities' OpenTK.Graphics.ColorFormat' OpenTK.INativeWindow
OpenTK,OpenTK.Platform.X11,OpenTK.Platform.Utilities' OpenTK.Platform.Egl.EglX11PlatformFactory' OpenTK.Configuration,OpenTK.Input.JoystickDevice' OpenTK.Input.JoystickAxisCollection' OpenTK.Input.JoystickButtonCollection' OpenTK.ContextHandle' OpenTK.DisplayDevice' OpenTK.DisplayResolution' OpenTK.Graphics.GraphicsMode' OpenTK.Graphics.ColorFormat' OpenTK.KeyPressEventArgs' OpenTK.GameWindowFlags' OpenTK.Input.Key' OpenTK.Graphics.IGraphicsContextInternal' OpenTK.Platform.IWindowInfo' OpenTK.Graphics.IGraphicsContext' OpenTK.Graphics.GraphicsContextFlags' OpenTK.Platform.DesktopGraphicsContext' OpenTK.Input.KeyboardDevice' OpenTK.Input.MouseDevice' OpenTK.Input.MouseButton
OpenTK,OpenTK.Graphics,OpenTK.Platform.Factory' Examples.Tutorial.SimpleES20Window' Examples.Tutorial.ThreadedRendering' Examples.Tutorial.Particle' Examples.Tests.Color4Serialization' OpenTK.Graphics.OpenGL.GL' OpenTK.Graphics.ES20.GL' Tao.Platform.Windows.SimpleOpenGlControl' Examples.WinForms.Extensions' OpenTK.GLControl' OpenTK.GameWindow' OpenTK.Platform.IPlatformFactory' OpenTK.Platform.UnsupportedPlatform' OpenTK.Platform.INativeGLWindow' OpenTK.Platform.Dummy.DummyGLContext' OpenTK.Platform.Egl.EglX11PlatformFactory' OpenTK.Platform.Egl.EglWinPlatformFactory' OpenTK.Platform.Egl.EglContext' OpenTK.Platform.Egl.EglMacPlatformFactory' OpenTK.Platform.MacOS.MacOSFactory' OpenTK.Platform.MacOS.AglContext' OpenTK.Platform.Windows.WinFactory' OpenTK.Platform.Windows.WinGLContext' OpenTK.Platform.X11.X11GLContext' OpenTK.Platform.X11.X11Factory' OpenTK.Graphics.OpenGL.ErrorHelper' OpenTK.Graphics.ES10.ErrorHelper' OpenTK.Graphics.ES11.ErrorHelper' OpenTK.Graphics.ES20.ErrorHelper' OpenTK.Platform.Utilities' Examples.Tests.TestGraphicsModes' Examples.Tests.InputLogger' OpenTK.GLControlFactory' OpenTK.WinGLControl' OpenTK.X11GLControl' OpenTK.CarbonGLControl' OpenTK.NativeWindow' OpenTK.Platform.Egl.EglGraphicsMode' OpenTK.Platform.MacOS.MacOSGraphicsMode' OpenTK.Platform.MacOS.CarbonGLNative' OpenTK.Platform.Windows.WinGraphicsMode' OpenTK.Platform.X11.X11GraphicsMode' OpenTK.Platform.X11.X11GLNative' OpenGlobe.Renderer.GL3x.FinalizerThreadContextGL3x' OpenGlobe.Renderer.GL3x.GraphicsWindowGL3x' OpenTK.DummyGLControl' OpenTK.IGLControl' OpenTK.Graphics.Text.GL1TextOutputProvider' OpenTK.Graphics.OpenGL.GL_3dfx' OpenTK.Graphics.OpenGL.Amd' OpenTK.Graphics.OpenGL.Apple' OpenTK.Graphics.OpenGL.Arb' OpenTK.Graphics.OpenGL.Ati' OpenTK.Graphics.OpenGL.Ext' OpenTK.Graphics.OpenGL.Gremedy' OpenTK.Graphics.OpenGL.HP' OpenTK.Graphics.OpenGL.Ibm' OpenTK.Graphics.OpenGL.Ingr' OpenTK.Graphics.OpenGL.Intel' OpenTK.Graphics.OpenGL.Mesa' OpenTK.Graphics.OpenGL.NV' OpenTK.Graphics.OpenGL.Pgi' OpenTK.Graphics.OpenGL.Sgi' OpenTK.Graphics.OpenGL.Sgis' OpenTK.Graphics.OpenGL.Sgix' OpenTK.Graphics.OpenGL.Sun' OpenTK.Graphics.OpenGL.Sunx' OpenTK.Graphics.ES10.GL' OpenTK.Graphics.ES11.GL' OpenTK.Graphics.ES11.NV' OpenTK.Graphics.ES11.Oes' OpenTK.Graphics.ES20.Amd' OpenTK.Graphics.ES20.NV' OpenTK.Graphics.ES20.Oes,OpenTK.Platform.IWindowInfo' OpenTK.Platform.IPlatformFactory' OpenTK.Platform.Factory' OpenTK.ContextHandle
OpenTK,OpenTK.Graphics.OpenGL,OpenGlobe.Renderer.Device' OpenGlobe.Renderer.GL3x.PixelBufferGL3x' OpenGlobe.Renderer.GL3x.ExtensionsGL3x' OpenGlobe.Renderer.GL3x.BufferNameGL3x' OpenGlobe.Renderer.GL3x.FenceNameGL3x' OpenGlobe.Renderer.GL3x.SamplerNameGL3x' OpenGlobe.Renderer.GL3x.TextureNameGL3x' OpenGlobe.Renderer.GL3x.ShaderProgramNameGL3x' OpenGlobe.Renderer.GL3x.FramebufferNameGL3x' OpenGlobe.Renderer.GL3x.VertexArrayNameGL3x' OpenGlobe.Renderer.GL3x.FenceGL3x' OpenGlobe.Renderer.GL3x.TextureSamplerGL3x' OpenGlobe.Renderer.GL3x.VertexBufferAttributesGL3x' OpenGlobe.Renderer.GL3x.VertexArrayGL3x' OpenGlobe.Renderer.GL3x.BufferGL3x' OpenGlobe.Renderer.GL3x.IndexBufferGL3x' OpenGlobe.Renderer.GL3x.VertexBufferGL3x' OpenGlobe.Renderer.GL3x.WritePixelBufferGL3x' OpenGlobe.Renderer.GL3x.ContextGL3x' OpenGlobe.Renderer.GL3x.FramebufferGL3x' OpenGlobe.Renderer.GL3x.ShaderObjectGL3x' OpenGlobe.Renderer.GL3x.ShaderProgramGL3x' OpenGlobe.Renderer.GL3x.UniformBlockGL3x' OpenGlobe.Renderer.GL3x.UniformBoolGL3x' OpenGlobe.Renderer.GL3x.UniformBoolVector2GL3x' OpenGlobe.Renderer.GL3x.UniformBoolVector3GL3x' OpenGlobe.Renderer.GL3x.UniformBoolVector4GL3x' OpenGlobe.Renderer.GL3x.UniformFloatGL3x' OpenGlobe.Renderer.GL3x.UniformFloatMatrix22GL3x' OpenGlobe.Renderer.GL3x.UniformFloatMatrix23GL3x' OpenGlobe.Renderer.GL3x.UniformFloatMatrix24GL3x' OpenGlobe.Renderer.GL3x.UniformFloatMatrix32GL3x' OpenGlobe.Renderer.GL3x.UniformFloatMatrix33GL3x' OpenGlobe.Renderer.GL3x.UniformFloatMatrix34GL3x' OpenGlobe.Renderer.GL3x.UniformFloatMatrix42GL3x' OpenGlobe.Renderer.GL3x.UniformFloatMatrix43GL3x' OpenGlobe.Renderer.GL3x.UniformFloatMatrix44GL3x' OpenGlobe.Renderer.GL3x.UniformFloatVector2GL3x' OpenGlobe.Renderer.GL3x.UniformFloatVector3GL3x' OpenGlobe.Renderer.GL3x.UniformFloatVector4GL3x' OpenGlobe.Renderer.GL3x.UniformIntGL3x' OpenGlobe.Renderer.GL3x.UniformIntVector2GL3x' OpenGlobe.Renderer.GL3x.UniformIntVector3GL3x' OpenGlobe.Renderer.GL3x.UniformIntVector4GL3x' OpenGlobe.Renderer.GL3x.Texture2DGL3x' OpenGlobe.Renderer.GL3x.TextureUnitGL3x' OpenGlobe.Renderer.GL3x.TextureUnitsGL3x' Tao.Platform.Windows.SimpleOpenGlControl' Examples.FullscreenAntialias' Examples.Tutorial.T07_Display_Lists_Flower' Examples.Tutorial.StencilCSG' Examples.Tutorial.T02_Vertex_Arrays' Examples.Tutorial.T04_Vertex_Lighting' Examples.Tutorial.Textures' Examples.Tutorial.T09_VBO_Dynamic' Examples.Tutorial.SimpleFBO' Examples.Tutorial.T03_Immediate_Mode_Cube' Examples.Tutorial.T08_VBO' Examples.Tutorial.TextureMatrix' Examples.Tutorial.Picking' Examples.Tutorial.T10_GLSL_Cube' Examples.Tutorial.SimpleGeometryShader' Examples.Tutorial.T13_GLSL_Earth' Examples.Tutorial.T12_GLSL_Parallax' Examples.Tutorial.SimpleGeometryShader2' Examples.Tutorial.JuliaSetFractal' Examples.Tutorial.HelloGL3' Examples.Tutorial.ThreadedRendering' Examples.Tutorial.SimpleWindow' Examples.TextureLoaders.ImageGDI' Examples.TextureLoaders.ImageDDS' Examples.Shapes.DrawableShape' Examples.WinForms.FontRenderingBasic' Examples.WinForms.SimpleForm' Examples.WinForms.DerivedGLControl' Examples.WinForms.GameLoopForm' Examples.WinForms.Extensions' Examples.Tests.GameWindowStates' Examples.Tests.InputLogger' OpenTK.GLControl' OpenTK.Platform.DesktopGraphicsContext' OpenGlobe.Renderer.GL3x.TypeConverterGL3x' Examples.Shapes.MengerSponge' Examples.Shapes.TorusKnot' Examples.Shapes.KochTetrahedron' Examples.Shapes.Capsule' Examples.Shapes.ChamferCube' Examples.Shapes.SlicedHose' Examples.Shapes.SlicedSphere' Examples.Shapes.SierpinskiTetrahedron' Examples.Shapes.VboShape' OpenGlobe.Renderer.GL3x.ReadPixelBufferGL3x' OpenGlobe.Renderer.GL3x.UniformBufferGL3x' Examples.TextureLoaders.TextureLoaderParameters,OpenTK.Vector3' OpenTK.Vector4' OpenTK.Graphics.Color4' OpenTK.Vector2' OpenTK.Matrix4' OpenTK.Vector3d' OpenTK.Vector2d' OpenTK.Vector4d' OpenTK.Matrix4d' OpenTK.Quaternion' OpenTK.Graphics.GraphicsContext' OpenTK.Graphics.IGraphicsContext' OpenTK.Half
OpenTK,OpenTK.Graphics.ES10,OpenTK.Platform.EmbeddedGraphicsContext,OpenTK.Graphics.GraphicsContext' OpenTK.Graphics.IGraphicsContext
OpenTK,OpenTK.Graphics.ES11,OpenTK.Platform.EmbeddedGraphicsContext,OpenTK.Graphics.GraphicsContext' OpenTK.Graphics.IGraphicsContext
OpenTK,OpenTK.Graphics.ES20,Examples.Tutorial.SimpleES20Window' OpenTK.Platform.EmbeddedGraphicsContext,OpenTK.Graphics.GraphicsContext' OpenTK.Graphics.Color4' OpenTK.Vector2' OpenTK.Vector3' OpenTK.Vector4' OpenTK.Quaternion' OpenTK.Matrix4' OpenTK.Graphics.IGraphicsContext
OpenTK,OpenTK.Input,OpenGlobe.Renderer.MouseGL3x' Examples.Tutorial.StencilCSG' Examples.Tutorial.T04_Vertex_Lighting' Examples.Tutorial.TextureMatrix' Examples.Tutorial.Picking' Examples.Tutorial.T13_GLSL_Earth' Examples.Tutorial.T12_GLSL_Parallax' Examples.Tests.GameWindowStates' Examples.Tests.InputLogger' OpenTK.Platform.MacOS.CarbonGLNative' OpenTK.Platform.Windows.WinRawMouse' OpenTK.Platform.Windows.WMInput' OpenTK.Platform.Windows.WinGLNative' OpenTK.Platform.X11.X11Input' OpenGlobe.Renderer.KeyboardGL3x' Examples.FullscreenAntialias' Examples.Tutorial.T07_Display_Lists_Flower' Examples.Tutorial.T02_Vertex_Arrays' Examples.Tutorial.Textures' Examples.Tutorial.T09_VBO_Dynamic' Examples.Tutorial.SimpleFBO' Examples.Tutorial.T03_Immediate_Mode_Cube' Examples.Tutorial.T08_VBO' Examples.Tutorial.T10_GLSL_Cube' Examples.Tutorial.SimpleGeometryShader' Examples.Tutorial.SimpleGeometryShader2' Examples.Tutorial.JuliaSetFractal' Examples.Tutorial.HelloGL3' Examples.Tutorial.SimpleES20Window' Examples.Tutorial.ThreadedRendering' Examples.Tutorial.SimpleWindow' Examples.Tests.Multithreading' OpenTK.Platform.MacOS.MacOSKeyMap' OpenTK.Platform.Windows.WinRawKeyboard' OpenTK.Platform.Windows.WinKeyMap' OpenTK.Platform.X11.X11KeyMap' OpenTK.InputDriver' OpenTK.Platform.Windows.WinMMJoystick' OpenTK.Platform.X11.X11Joystick' OpenTK.Platform.Factory,
OpenTK,OpenTK.Audio,Examples.RecorderDiagnostic' Examples.Parrot' Examples.TestApp' Examples.DeviceDiagnostic' Examples.ALDiagnostic' OpenTK.Audio.OpenAL.EffectsExtension,OpenTK.ContextHandle' OpenTK.Audio.OpenAL.Alc' OpenTK.Audio.OpenAL.AlcError' OpenTK.Audio.OpenAL.AlcGetStringList' OpenTK.Audio.OpenAL.AlcGetString' OpenTK.Audio.OpenAL.AlcContextAttributes' OpenTK.Audio.OpenAL.AlcGetInteger' OpenTK.Audio.OpenAL.ALFormat' OpenTK.BlittableValueType
OpenTK,OpenTK.Audio.OpenAL,OpenTK.Audio.AudioContext' Examples.OpenALDiagnostics' Examples.RecorderDiagnostic' OpenTK.Audio.AudioDeviceEnumerator' OpenTK.Audio.AudioDeviceErrorChecker' OpenTK.Audio.AudioCapture' Examples.AlcDiagnostic' Examples.ReverbExample' Examples.EfxDiagnostic' Examples.XRamDiagnostic' Examples.TestApp' Examples.ALDiagnostic' Examples.Parrot' Examples.Playback' Examples.OpenAL.StreamingPlayback,OpenTK.ContextHandle' OpenTK.Vector3' OpenTK.Audio.AudioContext' OpenTK.BlittableValueType
OpenTK,OpenTK.Properties,,
