Project,Namespace,Ca types,Ce types
Merchello.Core,Merchello.Core.Gateways,Merchello.Core.Gateways.Payment.Cash.CashPaymentGatewayMethod' Merchello.Core.Gateways.Shipping.FixedRate.FixedRateShippingGatewayMethod' Merchello.Core.Gateways.Shipping.FixedRate.FixedRateShippingGatewayProvider' Merchello.Core.Gateways.Taxation.FixedRate.FixedRateTaxationGatewayProvider' Merchello.Core.Gateways.Notification.Smtp.SmtpNotificationGatewayProvider' Merchello.Core.Gateways.Payment.Cash.CashPaymentGatewayProvider' Merchello.Core.Persistence.Factories.GatewayProviderSettingsFactory' Merchello.Core.CoreBootManager' Merchello.Core.Gateways.Taxation.TaxationContext' Merchello.Core.Gateways.Notification.NotificationContext' Merchello.Core.Gateways.Shipping.ShippingContext' Merchello.Core.Gateways.Payment.PaymentContext' Merchello.Core.Gateways.Taxation.ITaxationGatewayMethod' Merchello.Core.Gateways.Payment.IPaymentGatewayMethod' Merchello.Core.Gateways.Shipping.IShippingGatewayMethod' Merchello.Core.Gateways.Notification.INotificationGatewayMethod' Merchello.Core.Gateways.Notification.NotificationGatewayProviderBase' Merchello.Core.Gateways.Payment.PaymentGatewayProviderBase' Merchello.Core.Gateways.Taxation.TaxationGatewayProviderBase' Merchello.Core.Gateways.Shipping.ShippingGatewayProviderBase' Merchello.Core.Checkout.CheckoutContext' Merchello.Core.Checkout.ICheckoutContext' Merchello.Core.IMerchelloContext' Merchello.Core.MerchelloContext' Merchello.Core.Gateways.Payment.IPaymentGatewayProvider' Merchello.Core.Gateways.Taxation.ITaxationGatewayProvider' Merchello.Core.Gateways.Notification.INotificationGatewayProvider' Merchello.Core.Gateways.Shipping.IShippingGatewayProvider' Merchello.Core.Gateways.Taxation.ITaxationContext' Merchello.Core.Gateways.Notification.INotificationContext' Merchello.Core.Gateways.Shipping.IShippingContext' Merchello.Core.Gateways.Payment.IPaymentContext' Merchello.Core.Gateways.Shipping.ShippingGatewayMethodBase,Merchello.Core.MerchelloContext' Merchello.Core.Models.INotificationMessage' Merchello.Core.Models.IWarehouseCatalog' Merchello.Core.Services.INotificationMessageService' Merchello.Core.Services.IWarehouseCatalogService' Merchello.Core.Services.NotificationMessageService' Merchello.Core.Services.WarehouseCatalogService' Merchello.Core.Events.PaymentAttemptEventArgs<T>' Merchello.Core.Gateways.Notification.Monitors.INotificationMonitorBase' Merchello.Core.Gateways.Payment.PaymentGatewayMethodBase' Merchello.Core.Gateways.Payment.IPaymentResult' Merchello.Core.Observation.MonitorResolver' Merchello.Core.Gateways.Shipping.ShippingGatewayProviderBase' Merchello.Core.ActivatorHelper' Merchello.Core.GatewayProviderType' Merchello.Core.Models.GatewayProviderSettings' Merchello.Core.Models.IGatewayProviderSettings' Merchello.Core.Services.IGatewayProviderService' Merchello.Core.Gateways.Payment.PaymentGatewayProviderBase' Merchello.Core.Gateways.Taxation.TaxationGatewayProviderBase' Merchello.Core.Gateways.Notification.NotificationGatewayProviderBase' Merchello.Core.ObjectResolution.MerchelloManyObjectsResolverBase<TResolver;TResolved>' Merchello.Core.Persistence.Factories.GatewayProviderSettingsFactory' Merchello.Core.Services.IServiceContext' Merchello.Core.Services.IStoreSettingService' Merchello.Core.Gateways.Payment.IPaymentContext' Merchello.Core.Gateways.Payment.PaymentContext' Merchello.Core.Gateways.Taxation.ITaxationContext' Merchello.Core.Gateways.Taxation.TaxationContext' Merchello.Core.Gateways.Notification.INotificationContext' Merchello.Core.Gateways.Notification.NotificationContext' Merchello.Core.Gateways.Shipping.IShippingContext' Merchello.Core.Gateways.Shipping.ShippingContext' Merchello.Core.Models.ExtendedDataCollection' Merchello.Core.Models.IHasExtendedData
Merchello.Core,Merchello.Core.Gateways.Notification.Triggering,Merchello.Core.Gateways.Notification.Monitors.OrderShippedMonitor' Merchello.Core.Gateways.Notification.Monitors.PartialOrderShippedMonitor' Merchello.Core.Gateways.Notification.Monitors.OrderConfirmationMonitor,Merchello.Core.Constants' Merchello.Core.ExtendedDataKeys' Merchello.Core.IMerchelloContext' Merchello.Core.MerchelloContext' Merchello.Core.Models.IShipment' Merchello.Core.Services.IOrderService' Merchello.Core.Services.IInvoiceService' Merchello.Core.Services.IStoreSettingService' Merchello.Core.Models.MonitorModels.IShipmentResultNotifyModel' Merchello.Core.Models.MonitorModels.ShipmentResultNotifyModel' Merchello.Core.Observation.Topic' Merchello.Core.Observation.TriggerForAttribute' Merchello.Core.Observation.ITrigger' Merchello.Core.Logging.MultiLogHelper' Merchello.Core.Observation.TriggerBase<T>' Merchello.Core.Models.IShipMethod' Merchello.Core.Models.InvoiceLineItem' Merchello.Core.Services.IShipMethodService' Merchello.Core.Services.ServiceContext' Merchello.Core.Gateways.Payment.IPaymentResult' Merchello.Core.Models.MonitorModels.IPaymentResultMonitorModel
Merchello.Core,Merchello.Core.Models.MonitorModels,Merchello.Core.Gateways.Notification.Triggering.ShipmentResultNotifyModelFactory' Merchello.Core.Gateways.Notification.Triggering.OrderShippedTrigger' Merchello.Core.Gateways.Notification.Triggering.PartialOrderShippedTrigger' Merchello.Core.Gateways.Notification.Monitors.OrderShippedMonitor' Merchello.Core.Gateways.Notification.Monitors.PartialOrderShippedMonitor' Merchello.Core.Gateways.Notification.Triggering.OrderConfirmationTrigger' Merchello.Core.Gateways.Notification.Monitors.OrderConfirmationMonitor,Merchello.Core.Models.IInvoice' Merchello.Core.Models.IShipment' Merchello.Core.Models.IShipMethod' Merchello.Core.Gateways.Payment.IPaymentResult' Merchello.Core.Models.IPayment
Merchello.Core,Merchello.Core.Observation,Merchello.Core.Gateways.Notification.NotificationContext' Merchello.Core.Gateways.Notification.Monitors.INotificationMonitorBase' Merchello.Core.Gateways.Notification.Triggering.INotificationTrigger' Merchello.Core.Gateways.Notification.Monitors.NotificationMonitorBase<T>' Merchello.Core.Gateways.GatewayEvents' Merchello.Core.Gateways.Notification.Monitors.NotificationMonitorEvents' Merchello.Core.CoreBootManager' Merchello.Core.Gateways.Notification.Triggering.PartialOrderShippedTrigger' Merchello.Core.Gateways.Notification.Triggering.OrderConfirmationTrigger' Merchello.Core.Gateways.Notification.Triggering.OrderShippedTrigger' Merchello.Core.Gateways.Notification.Monitors.PartialOrderShippedMonitor' Merchello.Core.Gateways.Notification.Monitors.OrderConfirmationMonitor' Merchello.Core.Gateways.Notification.Monitors.OrderShippedMonitor' Merchello.Core.Gateways.Notification.Triggering.NotificationTriggerBase<TInputModel;TMonitorModel>,Merchello.Core.Logging.MultiLogger' Merchello.Core.Logging.MultiLogHelper' Merchello.Core.ActivatorHelper' Merchello.Core.Gateways.Notification.INotificationContext' Merchello.Core.ObjectResolution.MerchelloManyObjectsResolverBase<TResolver;TResolved>
Merchello.Core,Merchello.Core.Chains.InvoiceCreation.SalesPreparation,,Merchello.Core.Constants' Merchello.Core.ExtendedDataKeys' Merchello.Core.StoreSetting' Merchello.Core.LineItemType' Merchello.Core.Models.IAddress' Merchello.Core.Models.IInvoice' Merchello.Core.Models.InvoiceLineItem' Merchello.Core.Models.OrderLineItem' Merchello.Core.Sales.SalePreparationBase' Merchello.Core.Chains.AttemptChainTaskBase<T>
Merchello.Core,Merchello.Core.Chains.OrderCreation,,Merchello.Core.LineItemType' Merchello.Core.Models.IOrder' Merchello.Core.Models.IInvoice' Merchello.Core.Models.OrderLineItem' Merchello.Core.Chains.AttemptChainTaskBase<T>
Merchello.Core,Merchello.Core.Chains.ShipmentCreation,,Merchello.Core.IMerchelloContext' Merchello.Core.Chains.AttemptChainTaskBase<T>' Merchello.Core.Models.IOrder' Merchello.Core.Models.IShipment' Merchello.Core.Models.IProductVariant' Merchello.Core.Services.IOrderService' Merchello.Core.Services.IProductVariantService' Merchello.Core.Services.IShipmentService' Merchello.Core.Constants' Merchello.Core.OrderStatus' Merchello.Core.ShipmentStatus' Merchello.Core.Models.OrderLineItem
Merchello.Core,Merchello.Core.Gateways.Notification,Merchello.Core.Gateways.IGatewayContext' Merchello.Core.Gateways.Notification.Monitors.PartialOrderShippedMonitor' Merchello.Core.Gateways.Notification.Monitors.OrderShippedMonitor' Merchello.Core.Gateways.Notification.Monitors.OrderConfirmationMonitor' Merchello.Core.Observation.MonitorResolver' Merchello.Core.Gateways.Notification.Monitors.NotificationMonitorBase<T>' Merchello.Core.Gateways.GatewayContext' Merchello.Core.Gateways.Notification.Smtp.SmtpNotificationGatewayProvider' Merchello.Core.Gateways.Notification.Smtp.SmtpNotificationGatewayMethod' Merchello.Core.Gateways.GatewayProviderResolver' Merchello.Core.Gateways.Notification.Smtp.ISmtpNotificationGatewayProvider,Merchello.Core.Models.INotificationMessage' Merchello.Core.Formatters.IFormatter' Merchello.Core.Gateways.IGatewayProviderTypedContextBase' Merchello.Core.Models.INotificationMethod' Merchello.Core.Gateways.IGatewayMethod' Merchello.Core.Services.IGatewayProviderService' Merchello.Core.Formatters.DefaultFormatter' Merchello.Core.Gateways.IGatewayProviderResolver' Merchello.Core.Gateways.GatewayProviderTypedContextBase<T>' Merchello.Core.Observation.IMonitor' Merchello.Core.Models.IGatewayProviderSettings' Merchello.Core.Gateways.GatewayProviderBase' Merchello.Core.Gateways.IGatewayResource' Merchello.Core.Gateways.IProvider
Merchello.Core,Merchello.Core.Gateways.Notification.Smtp,,Merchello.Core.Gateways.Notification.INotificationGatewayProvider' Merchello.Core.Logging.MultiLogHelper' Merchello.Core.Models.INotificationMethod' Merchello.Core.Models.ExtendedDataCollection' Merchello.Core.Services.IGatewayProviderService' Merchello.Core.Events.ObjectEventArgs<T>' Merchello.Core.Gateways.Notification.NotificationGatewayMethodBase' Merchello.Core.Gateways.Notification.IFormattedNotificationMessage' Merchello.Core.Models.IGatewayProviderSettings' Merchello.Core.Gateways.GatewayProviderActivationAttribute' Merchello.Core.Gateways.GatewayProviderEditorAttribute' Merchello.Core.Gateways.GatewayResource' Merchello.Core.Gateways.IGatewayResource' Merchello.Core.Gateways.Notification.INotificationGatewayMethod' Merchello.Core.Gateways.Notification.NotificationGatewayProviderBase' Merchello.Core.Services.GatewayProviderService' Merchello.Core.Constants' Merchello.Core.ExtendedDataKeys
Merchello.Core,Merchello.Core.Gateways.Payment.Cash,,Merchello.Core.PaymentMethodType' Merchello.Core.AppliedPaymentType' Merchello.Core.Models.IPaymentMethod' Merchello.Core.Models.IInvoice' Merchello.Core.Models.IPayment' Merchello.Core.Services.IGatewayProviderService' Merchello.Core.Gateways.Payment.PaymentGatewayMethodAttribute' Merchello.Core.Gateways.Payment.PaymentResult' Merchello.Core.Gateways.Payment.ProcessorArgumentCollection' Merchello.Core.Gateways.Payment.PaymentGatewayMethodBase' Merchello.Core.Gateways.Payment.IPaymentResult' Merchello.Core.Gateways.GatewayMethodUiAttribute' Merchello.Core.Gateways.GatewayMethodEditorAttribute' Merchello.Core.Logging.MultiLogHelper' Merchello.Core.Models.IGatewayProviderSettings' Merchello.Core.Gateways.Payment.IPaymentGatewayMethod' Merchello.Core.Gateways.Payment.PaymentGatewayProviderBase' Merchello.Core.Gateways.GatewayProviderActivationAttribute' Merchello.Core.Gateways.GatewayResource' Merchello.Core.Gateways.IGatewayResource
Merchello.Core,Merchello.Core.ObjectResolution,Merchello.Core.Marketing.Offer.OfferProviderResolver' Merchello.Core.Gateways.GatewayProviderResolver' Merchello.Core.Observation.MonitorResolver' Merchello.Core.Observation.TriggerResolver,Merchello.Core.ActivatorHelper
Merchello.Core,Merchello.Core.Persistence,Merchello.Core.Persistence.UnitOfWork.PetaPocoUnitOfWorkProvider' Merchello.Core.Persistence.Repositories.MerchelloBulkOperationRepository<TEntity;TDto>' Merchello.Core.Persistence.Repositories.ProductVariantRepository' Merchello.Core.Persistence.UnitOfWork.PetaPocoUnitOfWork' Merchello.Core.Services.ServiceContext' Merchello.Core.Services.MerchelloRepositoryService' Merchello.Core.Services.AnonymousCustomerService' Merchello.Core.Services.DigitalMediaService' Merchello.Core.Services.NotificationMethodService' Merchello.Core.Services.AppliedPaymentService' Merchello.Core.Services.NotificationMessageService' Merchello.Core.Services.DetachedContentTypeService' Merchello.Core.CoreBootManager' Merchello.Core.Services.CustomerAddressService' Merchello.Core.Services.PageCachedServiceBase<TEntity>' Merchello.Core.Services.OfferRedeemedService' Merchello.Core.Services.NoteService' Merchello.Core.Services.PaymentMethodService' Merchello.Core.Services.PaymentService' Merchello.Core.Services.EntityCollectionService' Merchello.Core.Services.GatewayProviderService' Merchello.Core.Services.ProductOptionService' Merchello.Core.Services.OfferSettingsService' Merchello.Core.Services.TaxMethodService' Merchello.Core.Services.OrderService' Merchello.Core.Services.ShipCountryService' Merchello.Core.Services.AuditLogService' Merchello.Core.Services.ShipRateTierService' Merchello.Core.Services.ItemCacheService' Merchello.Core.Services.ShipMethodService' Merchello.Core.Services.ProductVariantService' Merchello.Core.Services.StoreSettingService' Merchello.Core.Services.WarehouseCatalogService' Merchello.Core.Services.WarehouseService' Merchello.Core.Services.ShipmentService' Merchello.Core.Services.InvoiceService' Merchello.Core.Services.CustomerService,Merchello.Core.Constants' Merchello.Core.Configuration.MerchelloConfiguration' Merchello.Core.Persistence.Repositories.ProductRepository' Merchello.Core.Persistence.Repositories.IProductOptionRepository' Merchello.Core.Persistence.Repositories.NoteRepository' Merchello.Core.Persistence.Repositories.AuditLogRepository' Merchello.Core.Persistence.Repositories.DetachedContentTypeRepository' Merchello.Core.Persistence.Repositories.DigitalMediaRepository' Merchello.Core.Persistence.Repositories.EntityCollectionRepository' Merchello.Core.Persistence.Repositories.INoteRepository' Merchello.Core.Persistence.Repositories.IAuditLogRepository' Merchello.Core.Persistence.Repositories.IDetachedContentTypeRepository' Merchello.Core.Persistence.Repositories.IDigitalMediaRepository' Merchello.Core.Persistence.Repositories.IEntityCollectionRepository' Merchello.Core.Persistence.Repositories.IOfferRedeemedRepository' Merchello.Core.Persistence.Repositories.IOfferSettingsRepository' Merchello.Core.Persistence.Repositories.IShipmentStatusRepository' Merchello.Core.Persistence.Repositories.IWarehouseCatalogRepository' Merchello.Core.Persistence.Repositories.OfferRedeemedRepository' Merchello.Core.Persistence.Repositories.OfferSettingsRepository' Merchello.Core.Persistence.Repositories.ProductOptionRepository' Merchello.Core.Persistence.Repositories.ShipmentStatusRepository' Merchello.Core.Persistence.Repositories.WarehouseCatalogRepository' Merchello.Core.Persistence.Repositories.IInvoiceLineItemRepository' Merchello.Core.Persistence.Repositories.IInvoiceStatusRepository' Merchello.Core.Persistence.Repositories.IItemCacheLineItemRepository' Merchello.Core.Persistence.Repositories.INotificationMessageRepository' Merchello.Core.Persistence.Repositories.INotificationMethodRepository' Merchello.Core.Persistence.Repositories.IOrderLineItemRepository' Merchello.Core.Persistence.Repositories.IOrderStatusRepository' Merchello.Core.Persistence.Repositories.InvoiceLineItemRepository' Merchello.Core.Persistence.Repositories.InvoiceStatusRepository' Merchello.Core.Persistence.Repositories.ItemCacheLineItemRepository' Merchello.Core.Persistence.Repositories.NotificationMessageRepository' Merchello.Core.Persistence.Repositories.NotificationMethodRepository' Merchello.Core.Persistence.Repositories.OrderLineItemRepository' Merchello.Core.Persistence.Repositories.OrderStatusRepository' Merchello.Core.Persistence.Repositories.AppliedPaymentRepository' Merchello.Core.Persistence.Repositories.IAppliedPaymentRepository' Merchello.Core.Persistence.Repositories.IOrderRepository' Merchello.Core.Persistence.Repositories.IPaymentMethodRepository' Merchello.Core.Persistence.Repositories.OrderRepository' Merchello.Core.Persistence.Repositories.PaymentMethodRepository' Merchello.Core.Persistence.Repositories.TaxMethodRepository' Merchello.Core.Persistence.Repositories.CustomerAddressRepository' Merchello.Core.Persistence.Repositories.CustomerRepository' Merchello.Core.Persistence.Repositories.GatewayProviderRepository' Merchello.Core.Persistence.Repositories.ITaxMethodRepository' Merchello.Core.Persistence.Repositories.ICustomerAddressRepository' Merchello.Core.Persistence.Repositories.ICustomerRepository' Merchello.Core.Persistence.Repositories.IGatewayProviderRepository' Merchello.Core.Persistence.Repositories.IInvoiceRepository' Merchello.Core.Persistence.Repositories.IItemCacheRepository' Merchello.Core.Persistence.Repositories.IPaymentRepository' Merchello.Core.Persistence.Repositories.IProductRepository' Merchello.Core.Persistence.Repositories.IProductVariantRepository' Merchello.Core.Persistence.Repositories.IShipCountryRepository' Merchello.Core.Persistence.Repositories.IShipmentRepository' Merchello.Core.Persistence.Repositories.IShipMethodRepository' Merchello.Core.Persistence.Repositories.IShipRateTierRepository' Merchello.Core.Persistence.Repositories.IStoreSettingRepository' Merchello.Core.Persistence.Repositories.IWarehouseRepository' Merchello.Core.Persistence.Repositories.InvoiceRepository' Merchello.Core.Persistence.Repositories.ItemCacheRepository' Merchello.Core.Persistence.Repositories.PaymentRepository' Merchello.Core.Persistence.Repositories.ProductVariantRepository' Merchello.Core.Persistence.Repositories.ShipCountryRepository' Merchello.Core.Persistence.Repositories.ShipmentRepository' Merchello.Core.Persistence.Repositories.ShipMethodRepository' Merchello.Core.Persistence.Repositories.ShipRateTierRepository' Merchello.Core.Persistence.Repositories.StoreSettingRepository' Merchello.Core.Persistence.Repositories.WarehouseRepository' Merchello.Core.Persistence.Repositories.AnonymousCustomerRepository' Merchello.Core.Persistence.Repositories.IAnonymousCustomerRepository' Merchello.Core.Services.IStoreSettingService' Merchello.Core.Persistence.UnitOfWork.IDatabaseUnitOfWork
