Project,Namespace,Ca types,Ce types
Merchello.Core,Merchello.Core.Services,Merchello.Core.EntityCollections.ProductFilterGroupProviderBase' Merchello.Core.EntityCollections.StaticProductCollectionProviderBase' Merchello.Core.EntityCollections.EntityCollectionEvents' Merchello.Core.EntityCollections.EntityCollectionProviderResolver' Merchello.Core.Persistence.Migrations.Upgrades.TargetVersionTwoZeroZero.CopyOriginalCustomerNotesToFirstNote' Merchello.Core.Gateways.GatewayEvents' Merchello.Core.Gateways.Notification.Monitors.NotificationMonitorEvents' Merchello.Core.Marketing.Offer.OfferManagerBase<TOffer>' Merchello.Core.Marketing.Offer.OfferProviderResolver' Merchello.Core.Chains.ShipmentCreation.RemoveShipmentOrderItemsFromInventoryAndPersistShipmentTask' Merchello.Core.Chains.ShipmentCreation.SetOrderStatusTask' Merchello.Core.Gateways.Notification.Triggering.ShipmentResultNotifyModelFactory' Merchello.Core.Gateways.Notification.Smtp.SmtpProviderEvents' Merchello.Core.Models.IGatewayProviderSettings' Merchello.Core.Gateways.Notification.NotificationContext' Merchello.Core.Gateways.Payment.Cash.CashPaymentGatewayMethod' Merchello.Core.Gateways.Notification.Smtp.SmtpNotificationGatewayMethod' Merchello.Core.Gateways.Notification.Smtp.SmtpNotificationGatewayProvider' Merchello.Core.Gateways.GatewayProviderResolver' Merchello.Core.Gateways.Shipping.FixedRate.FixedRateShippingGatewayProvider' Merchello.Core.Gateways.Notification.NotificationGatewayMethodBase' Merchello.Core.Gateways.Taxation.FixedRate.FixedRateTaxationGatewayProvider' Merchello.Core.Gateways.Payment.Cash.CashPaymentGatewayProvider' Merchello.Core.Gateways.Payment.PaymentContext' Merchello.Core.Gateways.Shipping.ShippingContext' Merchello.Core.Gateways.Payment.PaymentGatewayMethodBase' Merchello.Core.Gateways.GatewayContext' Merchello.Core.Gateways.Shipping.FixedRate.ShippingFixedRateTable' Merchello.Core.Gateways.Payment.PaymentGatewayProviderBase' Merchello.Core.Gateways.GatewayProviderTypedContextBase<T>' Merchello.Core.Gateways.Shipping.ShippingGatewayProviderBase' Merchello.Core.Gateways.Taxation.TaxationGatewayProviderBase' Merchello.Core.Gateways.Taxation.TaxationContext' Merchello.Core.Gateways.Notification.NotificationGatewayProviderBase' Merchello.Core.Gateways.GatewayProviderBase' Merchello.Core.IMerchelloContext' Merchello.Core.Chains.CopyEntity.CopyEntityTaskBase<T>' Merchello.Core.CoreBootManager' Merchello.Core.Checkout.ICheckoutContext' Merchello.Core.Checkout.CheckoutContext' Merchello.Core.MerchelloContext' Merchello.Core.Gateways.Notification.Triggering.OrderConfirmationTrigger' Merchello.Core.Persistence.Factories.ShipCountryFactory' Merchello.Core.CurrencyContext' Merchello.Core.Persistence.Repositories.ShipCountryRepository' Merchello.Core.UmbracoApplicationEventHandler' Merchello.Core.Persistence.RepositoryFactory' Merchello.Core.EntityCollections.Providers.DynamicOpenOrderCollectionProvider' Merchello.Core.EntityCollections.Providers.DynamicCancelledOrderCollectionProvider' Merchello.Core.EntityCollections.Providers.DynamicPartiallyPaidInvoiceCollectionProvider' Merchello.Core.EntityCollections.Providers.DynamicUnfulfilledOrderCollectionProvider' Merchello.Core.EntityCollections.Providers.DynamicFulfilledOrderCollectionProvider' Merchello.Core.EntityCollections.Providers.DynamicPaidInvoiceCollectionProvider' Merchello.Core.EntityCollections.Providers.DynamicUnpaidInvoiceCollectionProvider' Merchello.Core.Persistence.Migrations.Upgrades.TargetVersionOneFourteenZero.AddInvoiceCurrencyCodeColumn' Merchello.Core.EntityCollections.Providers.StaticInvoiceCollectionProvider' Merchello.Core.Sales.SalePreparationBase' Merchello.Core.Checkout.CheckoutCustomerDataManagerBase' Merchello.Core.EntityCollections.Providers.StaticCustomerCollectionProvider,Merchello.Core.PagedCollection<TResultType>' Merchello.Core.Models.IProduct' Merchello.Core.Services.Interfaces.IProductServicePortForward' Merchello.Core.Persistence.Querying.SortDirection' Merchello.Core.Models.AnonymousCustomer' Merchello.Core.Models.IAnonymousCustomer' Merchello.Core.Events.TransientMessageFactory' Merchello.Core.Events.NewEventArgs<T>' Merchello.Core.Persistence.RepositoryFactory' Merchello.Core.Persistence.Querying.Query<T>' Merchello.Core.Persistence.UnitOfWork.IDatabaseUnitOfWorkProvider' Merchello.Core.Persistence.UnitOfWork.PetaPocoUnitOfWorkProvider' Merchello.Core.AppliedPaymentType' Merchello.Core.Models.AppliedPayment' Merchello.Core.Models.IAppliedPayment' Merchello.Core.Models.TypeFields.EnumTypeFieldConverter' Merchello.Core.Models.IProductAttribute' Merchello.Core.Models.IProductOption' Merchello.Core.Models.Counting.IProductOptionUseCount' Merchello.Core.EntityType' Merchello.Core.Models.INote' Merchello.Core.Models.Note' Merchello.Core.Models.AuditLog' Merchello.Core.Models.ExtendedDataCollection' Merchello.Core.Models.Interfaces.IAuditLog' Merchello.Core.AddressType' Merchello.Core.Models.CustomerAddress' Merchello.Core.Models.ICustomerAddress' Merchello.Core.Models.DetachedContent.DetachedContentType' Merchello.Core.Models.DetachedContent.IDetachedContentType' Merchello.Core.Models.DigitalMedia' Merchello.Core.Models.Interfaces.IDigitalMedia' Merchello.Core.Models.EntityCollection' Merchello.Core.Models.Interfaces.IEntityFilterGroup' Merchello.Core.Models.Interfaces.IEntityCollection' Merchello.Core.Models.INotificationMethod' Merchello.Core.Models.INotificationMessage' Merchello.Core.Models.NotificationMessage' Merchello.Core.Models.IGatewayProviderSettings' Merchello.Core.Models.IInvoice' Merchello.Core.Models.Interfaces.IOfferRedeemed' Merchello.Core.Models.Interfaces.IOfferSettings' Merchello.Core.Models.OfferComponentDefinitionCollection' Merchello.Core.Models.OfferSettings' Merchello.Core.Models.IOrder' Merchello.Core.Models.IOrderStatus' Merchello.Core.Models.IInvoiceStatus' Merchello.Core.Models.EntityBase.IEntity' Merchello.Core.Models.IPaymentMethod' Merchello.Core.Models.ITaxMethod' Merchello.Core.PaymentMethodType' Merchello.Core.Models.IPayment' Merchello.Core.Models.IWarehouseCatalog' Merchello.Core.Models.NotificationMethod' Merchello.Core.Models.OfferRedeemed' Merchello.Core.Constants' Merchello.Core.OrderStatus' Merchello.Core.Logging.MultiLogHelper' Merchello.Core.Models.InvoiceAdjustmentResult' Merchello.Core.Models.Order' Merchello.Core.Models.IOrderLineItem' Merchello.Core.Models.IShipment' Merchello.Core.Models.OrderLineItem' Merchello.Core.Persistence.Repositories.OrderRepository' Merchello.Core.Events.StatusChangeEventArgs<T>' Merchello.Core.Models.Rdbms.IPageableDto' Merchello.Core.Persistence.Repositories.IPagedRepository' Merchello.Core.Models.PaymentMethod' Merchello.Core.Models.Payment' Merchello.Core.Models.ProductOption' Merchello.Core.CountryCodes' Merchello.Core.Models.ICountry' Merchello.Core.Models.TaxMethod' Merchello.Core.GatewayProviderType' Merchello.Core.Models.IShipMethod' Merchello.Core.Models.IShipRateTier' Merchello.Core.Models.IWarehouse' Merchello.Core.Models.IShipCountry' Merchello.Core.CustomerType' Merchello.Core.Models.InvoiceOrderShipment' Merchello.Core.ItemCacheType' Merchello.Core.Models.ICustomerBase' Merchello.Core.Models.IItemCache' Merchello.Core.Models.TypeFields.ITypeField' Merchello.Core.Models.IProductVariant' Merchello.Core.Models.ProductAttributeCollection' Merchello.Core.Models.ICurrency' Merchello.Core.Models.IStoreSetting' Merchello.Core.Models.Interfaces.ICurrencyFormat' Merchello.Core.Models.IShipmentStatus' Merchello.Core.Models.IAddress' Merchello.Core.Models.LineItemCollection' Merchello.Core.ExtendedDataKeys' Merchello.Core.StoreSetting' Merchello.Core.MerchelloContext' Merchello.Core.LineItemType' Merchello.Core.Models.InvoiceOrderShipmentLineItem' Merchello.Core.Models.IInvoiceLineItem' Merchello.Core.Models.ILineItem' Merchello.Core.Models.Invoice' Merchello.Core.Models.InvoiceLineItem' Merchello.Core.Persistence.Repositories.InvoiceRepository' Merchello.Core.Ensure' Merchello.Core.Models.ItemCache' Merchello.Core.Configuration.MerchelloConfiguration' Merchello.Core.Models.ProductVariant' Merchello.Core.Models.ShipCountry' Merchello.Core.Models.ShipMethod' Merchello.Core.Models.ShipRateTier' Merchello.Core.Configuration.Outline.CurrencyFormatElement' Merchello.Core.Models.CurrencyFormat' Merchello.Core.Models.Currency' Merchello.Core.Models.StoreSetting' Merchello.Core.Models.IProvince' Merchello.Core.Models.Address' Merchello.Core.Models.Shipment' Merchello.Core.Strategies.Packaging.ShippableProductVisitor' Merchello.Core.Warehouse' Merchello.Core.Models.WarehouseCatalog' Merchello.Core.Models.Warehouse' Merchello.Core.Models.Customer' Merchello.Core.Models.ICustomer
Merchello.Core,Merchello.Core.Strategies.Itemization,,Merchello.Core.LineItemType' Merchello.Core.Models.Invoice' Merchello.Core.Models.ILineItem' Merchello.Core.Ensure' Merchello.Core.Logging.MultiLogHelper' Merchello.Core.Models.InvoiceLineItem' Merchello.Core.Strategies.IStrategy' Merchello.Core.Constants' Merchello.Core.ExtendedDataKeys' Merchello.Core.Models.ILineItemVisitor
Merchello.Core,Merchello.Core.Trees,,Merchello.Core.Ensure' Merchello.Core.Models.EntityBase.IHasKeyId' Merchello.Core.Models.Interfaces.IVisitor' Merchello.Core.Models.IHasParent
Merchello.Core,Merchello.Core.Events,Merchello.Core.Models.LineItemCollection' Merchello.Core.Gateways.Notification.Smtp.SmtpNotificationGatewayMethod' Merchello.Core.Persistence.Repositories.ProductOptionRepository' Merchello.Core.Services.NotificationMethodService' Merchello.Core.Services.AnonymousCustomerService' Merchello.Core.Services.NotificationMessageService' Merchello.Core.Services.DetachedContentTypeService' Merchello.Core.Services.EntityCollectionService' Merchello.Core.Services.NoteService' Merchello.Core.Services.AppliedPaymentService' Merchello.Core.Services.CustomerAddressService' Merchello.Core.Services.AuditLogService' Merchello.Core.Services.OfferRedeemedService' Merchello.Core.CoreBootManager' Merchello.Core.Services.OfferSettingsService' Merchello.Core.Services.OrderService' Merchello.Core.Services.PaymentMethodService' Merchello.Core.Services.PaymentService' Merchello.Core.Services.TaxMethodService' Merchello.Core.Services.ProductOptionService' Merchello.Core.Services.ItemCacheService' Merchello.Core.Services.DigitalMediaService' Merchello.Core.Services.ProductVariantService' Merchello.Core.Services.ShipCountryService' Merchello.Core.Services.StoreSettingService' Merchello.Core.Services.ShipMethodService' Merchello.Core.Services.ShipRateTierService' Merchello.Core.Services.ShipmentService' Merchello.Core.Services.InvoiceService' Merchello.Core.Services.WarehouseCatalogService' Merchello.Core.Services.WarehouseService' Merchello.Core.Services.CustomerService' Merchello.Core.Services.GatewayProviderService' Merchello.Core.Persistence.Migrations.CoreMigrationManager' Merchello.Core.Gateways.GatewayEvents' Merchello.Core.Gateways.Payment.PaymentGatewayMethodBase' Merchello.Core.Sales.SalesPreparationEvents' Merchello.Core.Sales.SalePreparationBase' Merchello.Core.Persistence.Migrations.Initial.DatabaseSchemaCreation' Merchello.Core.EntityCollections.EntityCollectionEvents,Merchello.Core.Models.ILineItem' Merchello.Core.Persistence.Migrations.Analytics.MigrationRecord
Merchello.Core,Merchello.Core.Exceptions,Merchello.Core.Marketing.Offer.OfferManagerBase<TOffer>' Merchello.Core.Chains.OfferConstraints.OfferProcessorBase<TConstraint;TAward>' Merchello.Core.Marketing.Offer.OfferBase' Merchello.Core.Chains.CopyEntity.Product.CopyProductTaskChain,
Merchello.Core,Merchello.Core.Gateways.Notification.Monitors,Merchello.Core.Gateways.GatewayEvents,Merchello.Core.Models.INotificationMessage' Merchello.Core.Observation.IMonitor' Merchello.Core.Services.INotificationMessageService' Merchello.Core.Services.NotificationMessageService' Merchello.Core.Observation.MonitorResolver' Merchello.Core.Formatters.PatternReplaceFormatter' Merchello.Core.Gateways.Notification.Triggering.OrderShippedTrigger' Merchello.Core.Models.MonitorModels.IShipmentResultNotifyModel' Merchello.Core.Observation.MonitorForAttribute' Merchello.Core.Gateways.Notification.INotificationContext' Merchello.Core.Gateways.Notification.Triggering.PartialOrderShippedTrigger' Merchello.Core.Gateways.Notification.Triggering.OrderConfirmationTrigger' Merchello.Core.Models.MonitorModels.IPaymentResultMonitorModel' Merchello.Core.Logging.MultiLogHelper' Merchello.Core.Observation.MonitorBase<T>' Merchello.Core.Gateways.Notification.NotificationContext
Merchello.Core,Merchello.Core.Gateways.Payment,Merchello.Core.Gateways.Payment.Cash.CashPaymentGatewayMethod' Merchello.Core.Sales.SalePreparationBase' Merchello.Core.Sales.ISalePreparationBase' Merchello.Core.Checkout.CheckoutPaymentManagerBase' Merchello.Core.Checkout.ICheckoutPaymentManager' Merchello.Core.Gateways.GatewayEvents' Merchello.Core.Gateways.Payment.Cash.CashPaymentGatewayProvider' Merchello.Core.Sales.SalesPreparationEvents' Merchello.Core.NotificationExtensions' Merchello.Core.Gateways.Notification.Triggering.OrderConfirmationTrigger' Merchello.Core.Models.MonitorModels.MonitorModelExtensions' Merchello.Core.Gateways.IGatewayContext' Merchello.Core.Gateways.GatewayContext' Merchello.Core.Gateways.GatewayProviderResolver,Merchello.Core.Models.IPaymentMethod' Merchello.Core.Models.IInvoice' Merchello.Core.Models.IPayment' Merchello.Core.AppliedPaymentType' Merchello.Core.Configuration.MerchelloConfiguration' Merchello.Core.Services.IGatewayProviderService' Merchello.Core.Events.PaymentAttemptEventArgs<T>' Merchello.Core.Models.TypeFields.EnumTypeFieldConverter' Merchello.Core.Gateways.IGatewayMethod' Merchello.Core.Models.IOrder' Merchello.Core.Models.IShipment' Merchello.Core.Gateways.IGatewayProviderTypedContextBase' Merchello.Core.Gateways.IProvider' Merchello.Core.Gateways.IGatewayResource' Merchello.Core.Gateways.IGatewayProviderResolver' Merchello.Core.Gateways.GatewayProviderTypedContextBase<T>' Merchello.Core.Models.IGatewayProviderSettings' Merchello.Core.Gateways.GatewayProviderBase
Merchello.Core,Merchello.Core.Gateways.Taxation,Merchello.Core.Gateways.Taxation.FixedRate.FixRateTaxationGatewayMethod' Merchello.Core.Gateways.Taxation.FixedRate.FixedRateTaxationGatewayProvider' Merchello.Core.Gateways.Taxation.FixedRate.IFixedRateTaxationGatewayMethod' Merchello.Core.Gateways.Taxation.FixedRate.IFixedRateTaxationGatewayProvider' Merchello.Core.Persistence.Migrations.Upgrades.TargetVersionOneTenZero.InsertNewMerchelloSettingsGlobalTaxationApplicationKey' Merchello.Core.Gateways.Taxation.FixedRate.FixedRateTaxCalculationStrategy' Merchello.Core.Gateways.IGatewayContext' Merchello.Core.Gateways.GatewayContext' Merchello.Core.Gateways.GatewayProviderResolver,Merchello.Core.Models.IProductVariantDataModifierData' Merchello.Core.Constants' Merchello.Core.ExtendedDataKeys' Merchello.Core.Models.ExtendedDataCollection' Merchello.Core.Models.IAddress' Merchello.Core.Models.IInvoice' Merchello.Core.Models.ITaxMethod' Merchello.Core.Gateways.IGatewayMethod' Merchello.Core.LineItemType' Merchello.Core.Models.ILineItem' Merchello.Core.Models.ILineItemVisitor' Merchello.Core.Gateways.IGatewayProviderTypedContextBase' Merchello.Core.Gateways.IProvider' Merchello.Core.StoreSetting' Merchello.Core.Services.IGatewayProviderService' Merchello.Core.Services.IStoreSettingService' Merchello.Core.Gateways.IGatewayProviderResolver' Merchello.Core.Gateways.GatewayProviderTypedContextBase<T>' Merchello.Core.CountryCodes' Merchello.Core.Models.IGatewayProviderSettings' Merchello.Core.Gateways.GatewayProviderBase' Merchello.Core.Strategies.IStrategy
Merchello.Core,Merchello.Core.Marketing.Constraints,Merchello.Core.Marketing.Offer.OfferBase' Merchello.Core.Chains.OfferConstraints.OfferProcessorBase<TConstraint;TAward>' Merchello.Core.Chains.OfferConstraints.IOfferProcessor' Merchello.Core.Chains.OfferConstraints.LineItemContainerOfferConstraintTask' Merchello.Core.Chains.OfferConstraints.LineItemContainerOfferProcessor' Merchello.Core.Chains.OfferConstraints.OfferConstraintChainTask<T>,Merchello.Core.Marketing.Offer.OfferComponentType' Merchello.Core.Marketing.Offer.OfferComponentBase' Merchello.Core.Marketing.Offer.OfferComponentDefinition' Merchello.Core.IMerchelloContext' Merchello.Core.MerchelloContext' Merchello.Core.Models.ICustomerBase' Merchello.Core.Models.ILineItemContainer
Merchello.Core,Merchello.Core.Marketing.Offer,Merchello.Core.Checkout.ICheckoutOfferManager' Merchello.Core.Checkout.CheckoutOfferManagerBase' Merchello.Core.Sales.SalePreparationBase' Merchello.Core.Marketing.Constraints.OfferConstraintComponentBase' Merchello.Core.Marketing.Rewards.OfferRewardComponentBase' Merchello.Core.Persistence.Factories.OfferSettingsFactory' Merchello.Core.Chains.OfferConstraints.OfferConstraintChainTask<T>' Merchello.Core.Marketing.Constraints.OfferConstraintComponentBase<T>' Merchello.Core.Marketing.Rewards.OfferRewardComponentBase<TConstraint;TReward>' Merchello.Core.Models.OfferComponentDefinitionCollection' Merchello.Core.Chains.OfferConstraints.IOfferProcessorFactory' Merchello.Core.Chains.OfferConstraints.OfferProcessorFactory,Merchello.Core.Models.ICustomerBase' Merchello.Core.Models.IHasExtendedData' Merchello.Core.Models.ExtendedDataCollection' Merchello.Core.ActivatorHelper' Merchello.Core.Chains.OfferConstraints.IOfferProcessor' Merchello.Core.Chains.OfferConstraints.IOfferProcessorFactory' Merchello.Core.Chains.OfferConstraints.OfferProcessorFactory' Merchello.Core.Exceptions.OfferRedemptionException' Merchello.Core.Marketing.Constraints.OfferConstraintComponentBase' Merchello.Core.Marketing.Rewards.OfferRewardComponentBase' Merchello.Core.Models.Interfaces.IOfferSettings' Merchello.Core.Services.IOfferSettingsService' Merchello.Core.Logging.MultiLogHelper' Merchello.Core.ObjectResolution.MerchelloManyObjectsResolverBase<TResolver;TResolved>
Merchello.Core,Merchello.Core.Marketing.Rewards,Merchello.Core.Chains.OfferConstraints.IOfferProcessor' Merchello.Core.Marketing.Offer.OfferBase' Merchello.Core.Chains.OfferConstraints.OfferProcessorBase<TConstraint;TAward>,Merchello.Core.Marketing.Offer.OfferComponentType' Merchello.Core.Marketing.Offer.OfferComponentBase' Merchello.Core.Marketing.Offer.OfferComponentDefinition' Merchello.Core.Models.ICustomerBase
Merchello.Core,Merchello.Core.Models.Counting,Merchello.Core.Persistence.Factories.EntityUseCountFactory' Merchello.Core.Persistence.Repositories.ProductOptionRepository' Merchello.Core.Persistence.Repositories.IProductOptionRepository' Merchello.Core.Services.IProductOptionService' Merchello.Core.Services.ProductOptionService,
Merchello.Core,Merchello.Core.Models.Interfaces,Merchello.Core.Models.EntityFilterGroup' Merchello.Core.Services.IEntityCollectionService' Merchello.Core.EntityCollections.ProductFilterGroupProviderBase' Merchello.Core.Persistence.Repositories.IEntityCollectionRepository' Merchello.Core.Services.EntityCollectionService' Merchello.Core.Persistence.Repositories.EntityCollectionRepository' Merchello.Core.CurrencyContext' Merchello.Core.Services.IStoreSettingService' Merchello.Core.Models.CurrencyFormat' Merchello.Core.Services.StoreSettingService' Merchello.Core.Models.EntityCollection' Merchello.Core.EntityCollections.EntityCollectionProviderResolver' Merchello.Core.EntityCollections.EntityCollectionEvents' Merchello.Core.EntityCollections.Providers.StaticEntityCollectionCollectionProvider' Merchello.Core.EntityCollections.EntityCollectionBaseExtensions' Merchello.Core.Persistence.Factories.EntityCollectionFactory' Merchello.Core.Models.EntityFilterCollection' Merchello.Core.Services.IStaticCollectionService' Merchello.Core.Persistence.Mappers.MerchelloMapper' Merchello.Core.Services.CustomerService' Merchello.Core.EntityCollections.EntityCollectionProviderBase' Merchello.Core.Services.InvoiceService' Merchello.Core.EntityCollections.IEntityCollectionProviderMeta' Merchello.Core.Models.DetachedContent.IDetachedContentType' Merchello.Core.Models.IDataModifierData' Merchello.Core.Models.DataModifierLog' Merchello.Core.Models.ProductVariantDataModifierData' Merchello.Core.Models.OfferRedeemed' Merchello.Core.Persistence.Factories.OfferRedeemedFactory' Merchello.Core.Persistence.Repositories.IOfferRedeemedRepository' Merchello.Core.Services.IOfferRedeemedService' Merchello.Core.Persistence.Repositories.OfferRedeemedRepository' Merchello.Core.Services.OfferRedeemedService' Merchello.Core.Marketing.Offer.OfferManagerBase<TOffer>' Merchello.Core.Marketing.Offer.OfferBase' Merchello.Core.Models.OfferSettings' Merchello.Core.Persistence.Factories.OfferSettingsFactory' Merchello.Core.Persistence.Repositories.IOfferSettingsRepository' Merchello.Core.Services.IOfferSettingsService' Merchello.Core.Persistence.Repositories.OfferSettingsRepository' Merchello.Core.Services.OfferSettingsService' Merchello.Core.Persistence.Repositories.IDigitalMediaRepository' Merchello.Core.Models.DigitalMedia' Merchello.Core.Persistence.Factories.DigitalMediaFactory' Merchello.Core.Services.IDigitalMediaService' Merchello.Core.Persistence.Repositories.DigitalMediaRepository' Merchello.Core.Services.DigitalMediaService' Merchello.Core.Models.ILineItemVisitor' Merchello.Core.Trees.ITreeNodeVisitor' Merchello.Core.Models.DetachedContent.DetachedContentCollection<T>' Merchello.Core.Persistence.Repositories.IAuditLogRepository' Merchello.Core.Models.AuditLog' Merchello.Core.Persistence.Factories.AuditLogFactory' Merchello.Core.Services.IAuditLogService' Merchello.Core.Persistence.Repositories.AuditLogRepository' Merchello.Core.Services.AuditLogService' Merchello.Core.Models.IShipMethod' Merchello.Core.Gateways.Shipping.ShippingGatewayMethodBase' Merchello.Core.Models.ShipProvince' Merchello.Core.Gateways.Shipping.FixedRate.FixedRateShippingGatewayMethod' Merchello.Core.Persistence.Factories.ShipMethodFactory' Merchello.Core.Models.ShipMethod,Merchello.Core.Models.EntityFilterCollection' Merchello.Core.EntityType' Merchello.Core.Models.EntityBase.IEntity' Merchello.Core.Models.IHasParent' Merchello.Core.Models.IHasExtendedData' Merchello.Core.Models.ExtendedDataCollection' Merchello.Core.Models.OfferComponentDefinitionCollection' Merchello.Core.RateAdjustmentType' Merchello.Core.Models.IProvince
Merchello.Core,Merchello.Core.Formatters,Merchello.Core.Gateways.Notification.Monitors.OrderShippedMonitor' Merchello.Core.Gateways.Notification.Monitors.PartialOrderShippedMonitor' Merchello.Core.Gateways.Notification.Monitors.OrderConfirmationMonitor' Merchello.Core.Gateways.Notification.NotificationGatewayMethodBase' Merchello.Core.Gateways.Notification.NotificationContext' Merchello.Core.Gateways.Notification.INotificationContext' Merchello.Core.Gateways.Notification.INotificationGatewayMethod' Merchello.Core.Gateways.Notification.FormattedNotificationMessage,Merchello.Core.Configuration.MerchelloConfiguration' Merchello.Core.Configuration.Outline.ReplaceElement
