Namespace,Type,NOF,NOM,NOP,NOPF,NOPM,LOC,WMC,NC,DIT,LCOM,Fan-Out,Fan-In,Fan-Out types,Fan-In types
wmib,Labs,4,17,0,4,16,986,107,0,1,0.24,10,0,wmib.Nova' wmib.Instance' wmib.Core' wmib.Syslog' wmib.IRC' wmib.Module' wmib.Security' wmib.Channel' wmib.messages' wmib.Help,
wmib,Instance,17,1,1,16,1,41,1,0,0,0,1,1,wmib.Nova,wmib.Labs
wmib,Nova,4,1,0,4,1,11,1,0,0,0,0,2,,wmib.Labs' wmib.Instance
wmib,Link,1,9,0,1,7,293,46,0,1,0.33,7,0,wmib.System' wmib.Configuration' wmib.Security' wmib.Channel' wmib.IRC' wmib.messages' wmib.Variables,
wmib,Replag,0,4,0,0,3,44,7,0,1,-1,4,0,wmib.Database' wmib.Core' wmib.IRC' wmib.Channel,
wmib,Requests,4,7,0,2,3,195,30,0,1,0.29,7,0,wmib.Channel' wmib.IRC' wmib.Core' wmib.System' wmib.Configuration' wmib.Security' wmib.messages,
wmib,OpsTools,0,2,0,0,2,26,5,0,1,-1,2,0,wmib.Channel' wmib.IRC,
wmib.Extensions,RecentChanges,6,7,0,6,7,166,11,0,0,0.29,9,1,wmib.Channel' wmib.Extensions.IWatch' wmib.Module' wmib.Extensions.ModuleRC' wmib.Variables' wmib.Core' wmib.Configuration' wmib.IRC' wmib.messages,wmib.Extensions.ModuleRC
wmib.Extensions,IWatch,2,1,0,2,1,10,1,0,0,0,0,2,,wmib.Extensions.RecentChanges' wmib.Extensions.ModuleRC
wmib.Extensions,ModuleRC,1,25,0,1,13,452,67,0,1,0.96,14,1,wmib.Module' wmib.Channel' wmib.Extensions.RecentChanges' wmib.Configuration' wmib.IRC' wmib.CommandParams' wmib.Security' wmib.Role' wmib.Syslog' wmib.Variables' wmib.System' wmib.messages' wmib.Core' wmib.Extensions.IWatch,wmib.Extensions.RecentChanges
