Project,Namespace,Ca types,Ce types
MetroLog.NetCore,MetroLog,MetroLog.Targets.JsonPostTarget' MetroLog.Internal.Logger' MetroLog.Internal.LoggingEnvironmentBase' MetroLog.Internal.LogManager' MetroLog.Targets.BufferedTarget' MetroLog.Targets.SyncTarget' MetroLog.Layouts.FileSnapshotLayout' MetroLog.Targets.FileNamingParameters' MetroLog.Targets.JsonPostWrapper' MetroLog.Internal.LogConfiguratorBase' MetroLog.Layouts.Layout' MetroLog.Layouts.NullLayout' MetroLog.Layouts.SingleLineLayout' MetroLog.Targets.DebugTarget' MetroLog.Targets.FileTargetBase' MetroLog.Targets.Target' MetroLog.Targets.TraceTarget' MetroLog.Targets.LogReadQuery' MetroLog.Targets.TargetBinding,MetroLog.Layouts.Layout' MetroLog.Targets.FileNamingParameters' MetroLog.Targets.FileCreationMode' MetroLog.Internal.LogConfiguratorBase' MetroLog.Internal.SimpleJson' MetroLog.Internal.LogManager' MetroLog.Targets.Target
MetroLog.NetCore,MetroLog.Internal,MetroLog.Targets.FileTargetBase' MetroLog.LogConfigurator' MetroLog.InternalLogger' MetroLog.LogEventInfo' MetroLog.LogManagerFactory' MetroLog.Layouts.FileSnapshotLayout' MetroLog.Layouts.SingleLineLayout' Reflection.SimpleJson' MetroLog.ExceptionWrapper' Reflection.JsonArray' Reflection.JsonObject' MetroLog.Targets.JsonPostWrapper,MetroLog.LoggingConfiguration' MetroLog.LogLevel' MetroLog.ILogManager' MetroLog.LogEventInfo' MetroLog.LogWriteContext' MetroLog.ILogger' MetroLog.InternalLogger' MetroLog.LoggerEventArgs
MetroLog.NetCore,Reflection,,MetroLog.Internal.SimpleJson' MetroLog.Internal.IJsonSerializerStrategy' MetroLog.Internal.PocoJsonSerializerStrategy' MetroLog.Internal.JsonArray
MetroLog.NetCore,MetroLog.Layouts,MetroLog.FileTarget' MetroLog.Targets.SnapshotFileTarget' MetroLog.Targets.FileSnapshotTarget' MetroLog.Targets.StreamingFileTarget' MetroLog.Targets.FileStreamingTarget' MetroLog.Targets.AsyncTarget' MetroLog.Targets.BufferedTarget' MetroLog.Targets.DebugTarget' MetroLog.Targets.FileTargetBase' MetroLog.Targets.JsonPostTarget' MetroLog.Targets.SyncTarget' MetroLog.Targets.Target' MetroLog.Targets.TraceTarget,MetroLog.LogEventInfo' MetroLog.Internal.LogManager' MetroLog.LogLevel' MetroLog.ILoggingEnvironment' MetroLog.LogWriteContext
MetroLog.NetCore,MetroLog.Targets,MetroLog.FileTarget' MetroLog.LoggingConfiguration' MetroLog.LogWriteOperation,MetroLog.Layouts.Layout' MetroLog.ILogger' MetroLog.InternalLogger' MetroLog.LogWriteContext' MetroLog.LogEventInfo' MetroLog.LogWriteOperation' MetroLog.LogLevel' MetroLog.ILoggingEnvironment' MetroLog.Internal.AsyncLock' MetroLog.LoggingEnvironment' MetroLog.Internal.SimpleJson
