Design smell,Namespace,Class,File,Cause
Unnecessary Abstraction,Banks.Library.Accounts,IDiscountable,C:\repos\pdrosos_TelerikAcademy\OOP\05. OOP Principles - Part II\Homework\OopPrinciples\Banks\Library\Accounts\IDiscountable.cs,The tool detected the smell in this class because the class contains only a few data members without any method implementation' that indicates that the abstraction might not be required. Following fields and properties are declared in this class: DiscountMonths
Unutilized Abstraction,Banks.Library,Bank,C:\repos\pdrosos_TelerikAcademy\OOP\05. OOP Principles - Part II\Homework\OopPrinciples\Banks\Library\Bank.cs,The tool detected the smell in this class because this class is potentially unused.   (Please ignore the smell if the reported class is auto-generated and/or used to serve a specific known purpose.)
Unexloited Encapsulation,Banks.Library.Accounts,AccountFactory,C:\repos\pdrosos_TelerikAcademy\OOP\05. OOP Principles - Part II\Homework\OopPrinciples\Banks\Library\Accounts\AccountFactory.cs,The tool detected the smell because a set of type checks are performed while those types belong to the same hierarchy. The participating types that were checked are: Individual' Company (in method "CreateAccount" of class "AccountFactory").
Cyclically-dependent Modularization,Banks.Library.Accounts,Account,C:\repos\pdrosos_TelerikAcademy\OOP\05. OOP Principles - Part II\Homework\OopPrinciples\Banks\Library\Accounts\Account.cs,The tool detected the smell in this class because this class participates in a cyclic dependency. The participating classes in the cycle are: Account' Customer
Broken Hierarchy,Banks.Library.Accounts,Mortgage,C:\repos\pdrosos_TelerikAcademy\OOP\05. OOP Principles - Part II\Homework\OopPrinciples\Banks\Library\Accounts\Mortgage.cs,The tool detected a potential instance of the smell because this type does not implement or override any method from it's supertype(s): Account' IDiscountable
