Project,Namespace,Ca types,Ce types
NRack.Server.Net45,NRack.Server,NRack.Server.Service.NRackService' NRack.Server.Isolation.ProcessIsolation.ProcessApp' NRack.Server.Isolation.IsolationBootstrap' NRack.Server.Isolation.ProcessIsolation.ExternalProcessApp,NRack.Base.IBootstrap' NRack.Base.Config.IConfigSource' NRack.Base.IManagedApp' NRack.Base.Config.IServerConfig' NRack.Base.StartupType' NRack.Base.ServerState' NRack.Base.AppServerMetadata' NRack.Base.Metadata.StatusInfoAttribute' System.ComponentModel.Composition.Hosting.ExportProvider' NRack.Server.Utils.PerformanceCounterInfo' NRack.Base.IsolationMode' NRack.Base.IStatusCollector' NRack.Base.StatusInfoCollection' NRack.Server.Utils.ProcessPerformanceCounter' NRack.Base.AppServerStatus' NRack.Server.Isolation.AppDomainIsolation.AppDomainBootstrap' NRack.Server.Isolation.ProcessIsolation.ProcessBootstrap' NRack.Base.NRackEnv' NRack.Server.Service.SelfInstaller' NRack.Server.Isolation.IsolationAppConst' NRack.Base.Metadata.IAppServerMetadata
NRack.Server.Net45,NRack.Server.Isolation,NRack.Server.Isolation.ProcessIsolation.ExternalProcessApp' NRack.Server.Recycle.AssemblyUpdatedRecycleTrigger' NRack.Server.Isolation.AppDomainIsolation.AppDomainApp' NRack.Server.Program' NRack.Server.Isolation.ProcessIsolation.ProcessApp' NRack.Server.Isolation.ProcessIsolation.ProcessBootstrap,NRack.Base.AppServerMetadata' NRack.Base.Config.IServerConfig' NRack.Base.ServerState' NRack.Base.Metadata.StatusInfoAttribute' NRack.Base.StatusInfoCollection' NRack.Base.Metadata.StatusInfoKeys' NRack.Base.IBootstrap' NRack.Base.IManagedAppBase' NRack.Server.Recycle.IRecycleTrigger' NRack.Base.Config.IConfigSource' NRack.Base.Config.NRackConfig' NRack.Server.RemoteAppTypeValidator' NRack.Base.IsolationMode' NRack.Server.Config.RecycleTriggerConfigCollection' NRack.Base.Provider.IProviderMetadata' NRack.Server.Config.RecycleTriggerConfig' NRack.Base.IManagedApp
NRack.Server.Net45,NRack.Server.Isolation.ProcessIsolation,NRack.Server.BootstrapFactory,NRack.Server.Utils.ProcessPerformanceCounter' NRack.Server.ProcessLocker' NRack.Base.StatusInfoCollection' NRack.Server.Isolation.IsolationApp' NRack.Base.Config.IServerConfig' NRack.Base.IBootstrap' NRack.Server.Isolation.AppAssemblyUpdateState' NRack.Base.ServerState' NRack.Base.IManagedAppBase' NRack.Server.Utils.PerformanceCounterInfo' NRack.Base.Metadata.StatusInfoKeys' NRack.Base.Config.IConfigSource' NRack.Server.Isolation.IsolationBootstrap' NRack.Base.IManagedApp' NRack.Base.AppServerMetadata' NRack.Server.IRemoteManagedApp' NRack.Base.NRackEnv
NRack.Server.Net45,NRack.Server.Recycle,NRack.Server.Isolation.IsolationApp' NRack.Server.Isolation.IsolationBootstrap,NRack.Server.Isolation.AppAssemblyUpdateState' NRack.Server.Isolation.IsolationApp' NRack.Base.IManagedApp' NRack.Base.StatusInfoCollection' NRack.Base.Metadata.StatusInfoKeys
NRack.Server.Net45,NRack.Server.Config,NRack.Server.Isolation.IsolationBootstrap,
NRack.Server.Net45,NRack.Server.Isolation.AppDomainIsolation,NRack.Server.BootstrapFactory,NRack.Base.Config.IConfigSource' NRack.Base.AppServerMetadata' NRack.Server.Isolation.IsolationAppConst' NRack.Server.Isolation.AssemblyImport' NRack.Base.IManagedApp' NRack.Base.IsolationMode' NRack.Server.Isolation.MarshalManagedApp' NRack.Base.IManagedAppBase' NRack.Base.StatusInfoCollection' NRack.Base.Metadata.StatusInfoKeys
NRack.Server.Net45,NRack.Server.Service,NRack.Server.Program,NRack.Base.IBootstrap' NRack.Server.BootstrapFactory
NRack.Server.Net45,NRack.Server.Utils,NRack.Server.BootstrapBase' NRack.Server.Isolation.ProcessIsolation.ExternalProcessApp' NRack.Server.Isolation.ProcessIsolation.ProcessApp,NRack.Base.Metadata.StatusInfoKeys' NRack.Base.NRackEnv' NRack.Base.StatusInfoCollection
