Project,Namespace,Ca types,Ce types
SimpleSpeedTester,SimpleSpeedTester.Core.Events,SimpleSpeedTester.Core.TestGroup' SimpleSpeedTester.Interfaces.ITest' SimpleSpeedTester.Interfaces.ITestGroup' SimpleSpeedTester.Core.Test' SimpleSpeedTester.Interfaces.ITestResult' SimpleSpeedTester.Core.TestResult,SimpleSpeedTester.Interfaces.ITest' SimpleSpeedTester.Interfaces.ITestResult' SimpleSpeedTester.Core.TestOutcome' SimpleSpeedTester.Interfaces.ITestResultSummary' SimpleSpeedTester.Interfaces.ITestOutcomeFilter
SimpleSpeedTester,SimpleSpeedTester.Interfaces,SimpleSpeedTester.Core.Events.NewTestResultSummaryEventArgs' SimpleSpeedTester.Core.Test' SimpleSpeedTester.Core.Events.NewTestOutcomeEventArgs' SimpleSpeedTester.Core.Events.NewTestResultEventArgs' SimpleSpeedTester.Core.TestResult' SimpleSpeedTester.Core.TestGroup' SimpleSpeedTester.Core.TestResultSummary' SimpleSpeedTester.Core.OutcomeFilters.DefaultTestOutcomeFilter' SimpleSpeedTester.Core.OutcomeFilters.ExcludeMinAndMaxTestOutcomeFilter,SimpleSpeedTester.Core.Events.NewTestResultEventArgs' SimpleSpeedTester.Core.Events.NewTestOutcomeEventArgs' SimpleSpeedTester.Core.Events.NewTestResultSummaryEventArgs' SimpleSpeedTester.Core.TestOutcome' SimpleSpeedTester.Core.TestResult
SimpleSpeedTester,SimpleSpeedTester.Core.OutcomeFilters,SimpleSpeedTester.Core.TestResult,SimpleSpeedTester.Interfaces.ITestOutcomeFilter' SimpleSpeedTester.Core.TestOutcome
SimpleSpeedTester,SimpleSpeedTester.Core,SimpleSpeedTester.Interfaces.ITestResultSummary' SimpleSpeedTester.Interfaces.ITestResult' SimpleSpeedTester.Core.Events.NewTestOutcomeEventArgs' SimpleSpeedTester.Interfaces.ITestOutcomeFilter' SimpleSpeedTester.Core.OutcomeFilters.DefaultTestOutcomeFilter' SimpleSpeedTester.Core.OutcomeFilters.ExcludeMinAndMaxTestOutcomeFilter,SimpleSpeedTester.Core.Events.NewTestResultSummaryEventArgs' SimpleSpeedTester.Interfaces.ITest' SimpleSpeedTester.Interfaces.ITestResult' SimpleSpeedTester.Interfaces.ITestResultSummary' SimpleSpeedTester.Interfaces.ITestOutcomeFilter' SimpleSpeedTester.Core.OutcomeFilters.DefaultTestOutcomeFilter' SimpleSpeedTester.Core.Events.NewTestResultEventArgs' SimpleSpeedTester.Core.Events.NewTestOutcomeEventArgs' SimpleSpeedTester.Interfaces.ITestGroup
SimpleSpeedTester,System,,
