Implementation smell,Namespace,Class,File,Method,Description
Long Parameter List,BuildMonitorPackage,BuildMonitorPackage,C:\repos\vinntreus_BuildMonitor\BuildMonitorPackage\BuildMonitorPackage.cs,UpdateProjectCfg_Begin,The method has 5 parameters. Parameters: pHierProj' pCfgProj' pCfgSln' dwAction' pfCancel
Long Parameter List,BuildMonitorPackage,BuildMonitorPackage,C:\repos\vinntreus_BuildMonitor\BuildMonitorPackage\BuildMonitorPackage.cs,UpdateProjectCfg_Done,The method has 6 parameters. Parameters: pHierProj' pCfgProj' pCfgSln' dwAction' fSuccess' fCancel
Long Identifier,BuildMonitorPackage,GuidList,C:\repos\vinntreus_BuildMonitor\BuildMonitorPackage\Guids.cs,,The length of the parameter guidBuildMonitorPackagePkgString is 32.
Long Identifier,BuildMonitorPackage,GuidList,C:\repos\vinntreus_BuildMonitor\BuildMonitorPackage\Guids.cs,,The length of the parameter guidBuildMonitorPackageCmdSetString is 35.
Magic Number,BuildMonitorPackage,BuildMonitorPackage,C:\repos\vinntreus_BuildMonitor\BuildMonitorPackage\BuildMonitorPackage.cs,Solution_Opened,The following statement contains a magic number: PrintLine("{0}"' 60.Times("-"));
