Project,Namespace,Ca types,Ce types
Winium.StoreApps.InnerServer,Winium.StoreApps.InnerServer,TestApp.MainPage' Winium.StoreApps.InnerServer.Commands.ClearCommand' Winium.StoreApps.InnerServer.Commands.GetElementRectCommand' Winium.StoreApps.InnerServer.Commands.GetElementSizeCommand' Winium.StoreApps.InnerServer.Commands.IsElementEnabledCommand' Winium.StoreApps.InnerServer.Commands.CloseAppCommand' Winium.StoreApps.InnerServer.Commands.CommandBase' Winium.StoreApps.InnerServer.Commands.DisplayedCommand' Winium.StoreApps.InnerServer.Commands.ExecuteCommand' Winium.StoreApps.InnerServer.Commands.ElementCommand' Winium.StoreApps.InnerServer.Commands.ElementsCommand' Winium.StoreApps.InnerServer.Commands.GetElementAttributeCommand' Winium.StoreApps.InnerServer.Commands.LocationCommand' Winium.StoreApps.InnerServer.Commands.LocationInViewCommand' Winium.StoreApps.InnerServer.Commands.GetElementTagNameCommand' Winium.StoreApps.InnerServer.Commands.TextCommand' Winium.StoreApps.InnerServer.Commands.ValueCommand,Winium.Mobile.Common.HttpResponseHelper' Winium.Mobile.Common.ConnectionInformation' Winium.StoreApps.InnerServer.Commands.CommandBase' Winium.Mobile.Common.DriverCommand' Winium.StoreApps.InnerServer.Commands.With' Winium.StoreApps.InnerServer.Commands.AlertCommand' Winium.Mobile.Common.ExtendedDriverCommand' Winium.StoreApps.InnerServer.Element.WiniumElement' Winium.Mobile.Common.ResponseStatus
Winium.StoreApps.InnerServer,Winium.StoreApps.InnerServer.Commands,Winium.StoreApps.InnerServer.Automator' Winium.StoreApps.InnerServer.Tests.GetElementAttributeCommandTests' Winium.StoreApps.InnerServer.Tests.PageSourceCommandTests,Winium.StoreApps.InnerServer.Element.WiniumElement' Winium.StoreApps.InnerServer.ElementsRegistry' Winium.StoreApps.InnerServer.Automator' Winium.Mobile.Common.ResponseStatus' Winium.StoreApps.InnerServer.Commands.Helpers.By' Winium.StoreApps.InnerServer.Element.WiniumVirtualRoot' Winium.StoreApps.InnerServer.Element.TreeScope' Winium.Mobile.Common.Exceptions.AutomationException' Winium.Mobile.Common.JsonElementContent' Winium.Mobile.Common.CommandSettings.ElementAttributeAccessModifier' Winium.Mobile.Common.CommandSettings.ElementAttributeCommandSettings' Winium.Mobile.Common.CommandSettings.CommandSettings
Winium.StoreApps.InnerServer,Winium.StoreApps.InnerServer.Commands.Helpers,Winium.StoreApps.InnerServer.Commands.AlertCommand' Winium.StoreApps.InnerServer.Commands.AlertTextCommand' Winium.StoreApps.InnerServer.Commands.ElementCommand' Winium.StoreApps.InnerServer.Commands.ElementsCommand' Winium.StoreApps.InnerServer.Element.WiniumElement,Winium.Mobile.Common.ResponseStatus
Winium.StoreApps.InnerServer,Winium.StoreApps.InnerServer.Element.Helpers,Winium.StoreApps.InnerServer.Element.WiniumElement' Winium.StoreApps.InnerServer.Tests.PropertyAccessorsTests.DependencyPropertiesAccessorTests,
Winium.StoreApps.InnerServer,Winium.StoreApps.InnerServer.Element,Winium.StoreApps.InnerServer.Commands.AlertCommand' Winium.StoreApps.InnerServer.Commands.AlertTextCommand' Winium.StoreApps.InnerServer.Commands.ElementCommand' Winium.StoreApps.InnerServer.Commands.ElementsCommand' Winium.StoreApps.InnerServer.Commands.PageSourceCommand' Winium.StoreApps.InnerServer.ElementsRegistry' Winium.StoreApps.InnerServer.Commands.ClearCommand' Winium.StoreApps.InnerServer.Commands.GetElementRectCommand' Winium.StoreApps.InnerServer.Commands.GetElementSizeCommand' Winium.StoreApps.InnerServer.Commands.IsElementEnabledCommand' Winium.StoreApps.InnerServer.Commands.DisplayedCommand' Winium.StoreApps.InnerServer.Commands.ExecuteCommand' Winium.StoreApps.InnerServer.Commands.GetElementAttributeCommand' Winium.StoreApps.InnerServer.Commands.LocationCommand' Winium.StoreApps.InnerServer.Commands.LocationInViewCommand' Winium.StoreApps.InnerServer.Commands.GetElementTagNameCommand' Winium.StoreApps.InnerServer.Commands.TextCommand' Winium.StoreApps.InnerServer.Commands.ValueCommand' Winium.StoreApps.InnerServer.Tests.GetElementAttributeCommandTests' Winium.StoreApps.InnerServer.Tests.PageSourceCommandTests,Winium.StoreApps.InnerServer.Commands.Helpers.ScreenCoordinatesHelper' Winium.StoreApps.InnerServer.Element.Helpers.PropertiesAccessor' Winium.StoreApps.InnerServer.Element.Helpers.AutomationPropertiesAccessor' Winium.StoreApps.InnerServer.Element.Helpers.DependencyPropertiesAccessor
