Project,Namespace,Ca types,Ce types
ClockWpf,CrossGraphics,Clock.Clock,System.Drawing.PointF' System.Drawing.RectangleF' System.Drawing.Rectangle' System.Drawing.Point
ClockWpf,System.Drawing,CrossGraphics.GraphicsEx' CrossGraphics.PointEx' CrossGraphics.RectangleEx' CrossGraphics.Polygon' Clock.Clock,
ClockWpf,Clock,ClockWpf.MainWindow,CrossGraphics.Color' CrossGraphics.Font' System.Drawing.PointF' CrossGraphics.IGraphics' CrossGraphics.IFontMetrics' CrossGraphics.Colors
ClockWpf,ClockWpf,,Clock.Clock
ClockWpf,ClockWpf.Properties,,
