Project,Namespace,Ca types,Ce types
PayPal.SDK.NET45,PayPal.Api,PayPal.Util.ArgumentValidator' PayPal.Api.OpenIdConnect.Userinfo' PayPal.PaymentsException' PayPal.IdentityException' PayPal.Util.SDKUtil' PayPal.CertificateManager,
PayPal.SDK.NET45,PayPal,PayPal.Api.WebhookEvent' PayPal.Api.OAuthTokenCredential' PayPal.Api.ConnectionManager' PayPal.Log.Logger' PayPal.Api.ResponseDetails' PayPal.Api.HttpConnection' PayPal.Api.PayPalResource' PayPal.Util.SDKUtil' PayPal.Api.ConfigManager,
PayPal.SDK.NET45,PayPal.Log,PayPal.CertificateManager' PayPal.Api.ConfigManager' PayPal.Api.JsonFormatter' PayPal.Api.HttpConnection' PayPal.Api.PayPalResource' PayPal.PayPalException' PayPal.Api.ConnectionManager,
PayPal.SDK.NET45,PayPal.Api.OpenIdConnect,,
PayPal.SDK.NET45,PayPal.Util,PayPal.Api.FuturePayment' PayPal.Api.Payout' PayPal.Api.PayoutItem' PayPal.Api.Refund' PayPal.Api.VerifyWebhookSignature' PayPal.Api.Plan' PayPal.Api.Authorization' PayPal.Api.Payment' PayPal.Api.CreditCard' PayPal.Api.WebhookEventType' PayPal.Api.Sale' PayPal.Api.InvoiceTemplate' PayPal.Api.Webhook' PayPal.Api.WebhookEvent' PayPal.Api.PaymentInstruction' PayPal.Api.WebProfile' PayPal.Api.Capture' PayPal.Api.Order' PayPal.Api.BankAccount' PayPal.Api.Invoice' PayPal.Api.Agreement' PayPal.Api.BaseConstants' PayPal.Api.OpenIdConnect.Userinfo' PayPal.Api.Tokeninfo,
