Implementation smell,Namespace,Class,File,Method,Description
Complex Method,NServiceKit.OrmLite.PostgreSQL,PostgreSQLDialectProvider,C:\research\architectureSmells\repos\NServiceKit_NServiceKit.OrmLite\src\NServiceKit.OrmLite.PostgreSQL\PostgreSQLDialectProvider.cs,GetColumnDefinition,Cyclomatic complexity of the method is 9
Complex Method,NServiceKit.OrmLite.PostgreSQL,PostgreSQLDialectProvider,C:\research\architectureSmells\repos\NServiceKit_NServiceKit.OrmLite\src\NServiceKit.OrmLite.PostgreSQL\PostgreSQLDialectProvider.cs,GetQuotedValue,Cyclomatic complexity of the method is 8
Long Parameter List,NServiceKit.OrmLite.PostgreSQL,PostgreSQLDialectProvider,C:\research\architectureSmells\repos\NServiceKit_NServiceKit.OrmLite\src\NServiceKit.OrmLite.PostgreSQL\PostgreSQLDialectProvider.cs,GetColumnDefinition,The method has 8 parameters. Parameters: fieldName' fieldType' isPrimaryKey' autoIncrement' isNullable' fieldLength' scale' defaultValue
Long Statement,NServiceKit.OrmLite.PostgreSQL,PostgreSQLDialectProvider,C:\research\architectureSmells\repos\NServiceKit_NServiceKit.OrmLite\src\NServiceKit.OrmLite.PostgreSQL\PostgreSQLDialectProvider.cs,DoesTableExist,The length of the statement  "                // If a search path (schema) is specified' and there is only one' then assume the CREATE TABLE directive should apply to that schema." is 133.
Long Statement,NServiceKit.OrmLite.PostgreSQL,PostgreSQLDialectProvider,C:\research\architectureSmells\repos\NServiceKit_NServiceKit.OrmLite\src\NServiceKit.OrmLite.PostgreSQL\PostgreSQLDialectProvider.cs,DoesTableExist,The length of the statement  "                    sql = "SELECT COUNT(*) FROM pg_class JOIN pg_catalog.pg_namespace n ON n.oid = pg_class.relnamespace WHERE relname = {0} AND nspname = {1}"" is 139.
Complex Conditional,NServiceKit.OrmLite.PostgreSQL,PostgreSQLDialectProvider,C:\research\architectureSmells\repos\NServiceKit_NServiceKit.OrmLite\src\NServiceKit.OrmLite.PostgreSQL\PostgreSQLDialectProvider.cs,ToBinary,The conditional expression  "b >= 0x20 && b < 0x7F && b != 0x27 && b != 0x5C"  is complex.
Magic Number,NServiceKit.OrmLite.PostgreSQL,PostgreSQLDialectProvider,C:\research\architectureSmells\repos\NServiceKit_NServiceKit.OrmLite\src\NServiceKit.OrmLite.PostgreSQL\PostgreSQLDialectProvider.cs,ToBinary,The following statement contains a magic number: StringBuilder res = new StringBuilder(byteArray.Length * 5);
