Project,Namespace,Ca types,Ce types
Intelligencia.UrlRewriter,Intelligencia.UrlRewriter.Actions,Intelligencia.UrlRewriter.Parsers.AddHeaderActionParser' Intelligencia.UrlRewriter.Parsers.IfConditionActionParser' Intelligencia.UrlRewriter.Parsers.ForbiddenActionParser' Intelligencia.UrlRewriter.Parsers.GoneActionParser' Intelligencia.UrlRewriter.Parsers.NotAllowedActionParser' Intelligencia.UrlRewriter.Parsers.NotFoundActionParser' Intelligencia.UrlRewriter.Parsers.NotImplementedActionParser' Intelligencia.UrlRewriter.Parsers.RedirectActionParser' Intelligencia.UrlRewriter.Parsers.RewriteActionParser' Intelligencia.UrlRewriter.Parsers.SetAppSettingPropertyActionParser' Intelligencia.UrlRewriter.Parsers.SetCookieActionParser' Intelligencia.UrlRewriter.Parsers.SetPropertyActionParser' Intelligencia.UrlRewriter.Parsers.SetStatusActionParser,Intelligencia.UrlRewriter.IRewriteAction' Intelligencia.UrlRewriter.IRewriteContext' Intelligencia.UrlRewriter.RewriteProcessing' Intelligencia.UrlRewriter.IRewriteCondition
Intelligencia.UrlRewriter,Intelligencia.UrlRewriter,Intelligencia.UrlRewriter.Actions.SetCookieAction' Intelligencia.UrlRewriter.Actions.SetAppSettingPropertyAction' Intelligencia.UrlRewriter.Actions.SetPropertyAction' Intelligencia.UrlRewriter.Actions.AddHeaderAction' Intelligencia.UrlRewriter.Actions.SetLocationAction' Intelligencia.UrlRewriter.Actions.SetStatusAction' Intelligencia.UrlRewriter.Parsers.AddHeaderActionParser' Intelligencia.UrlRewriter.Parsers.NotImplementedActionParser' Intelligencia.UrlRewriter.Parsers.NotFoundActionParser' Intelligencia.UrlRewriter.Parsers.NotAllowedActionParser' Intelligencia.UrlRewriter.Parsers.RedirectActionParser' Intelligencia.UrlRewriter.Parsers.RewriteActionParser' Intelligencia.UrlRewriter.Parsers.RewriteActionParserBase' Intelligencia.UrlRewriter.Parsers.GoneActionParser' Intelligencia.UrlRewriter.Parsers.ForbiddenActionParser' Intelligencia.UrlRewriter.Parsers.SetAppSettingPropertyActionParser' Intelligencia.UrlRewriter.Parsers.SetCookieActionParser' Intelligencia.UrlRewriter.Parsers.SetStatusActionParser' Intelligencia.UrlRewriter.Configuration.RewriterConfigurationReader' Intelligencia.UrlRewriter.Parsers.SetPropertyActionParser' Intelligencia.UrlRewriter.Parsers.IfConditionActionParser' Intelligencia.UrlRewriter.Configuration.IRewriterConfiguration' Intelligencia.UrlRewriter.Configuration.RewriterConfiguration' Intelligencia.UrlRewriter.Actions.ConditionalAction' Intelligencia.UrlRewriter.Conditions.MatchCondition' Intelligencia.UrlRewriter.Conditions.AddressCondition' Intelligencia.UrlRewriter.Conditions.ExistsCondition' Intelligencia.UrlRewriter.Parsers.AddressConditionParser' Intelligencia.UrlRewriter.Conditions.UrlMatchCondition' Intelligencia.UrlRewriter.Parsers.ExistsConditionParser' Intelligencia.UrlRewriter.Parsers.HeaderMatchConditionParser' Intelligencia.UrlRewriter.Conditions.NegativeCondition' Intelligencia.UrlRewriter.Parsers.MethodConditionParser' Intelligencia.UrlRewriter.Parsers.PropertyMatchConditionParser' Intelligencia.UrlRewriter.Parsers.UrlMatchConditionParser' Intelligencia.UrlRewriter.Actions.RewriteAction' Intelligencia.UrlRewriter.Actions.RedirectAction' Intelligencia.UrlRewriter.Errors.DefaultErrorHandler' Intelligencia.UrlRewriter.Utilities.HttpContextFacade' Intelligencia.UrlRewriter.Utilities.IHttpContext' Intelligencia.UrlRewriter.Conditions.MethodCondition' Intelligencia.UrlRewriter.Conditions.PropertyMatchCondition' Intelligencia.UrlRewriter.Configuration.ActionParserFactory' Intelligencia.UrlRewriter.Configuration.ConditionParserPipeline' Intelligencia.UrlRewriter.Transforms.Base64DecodeTransform' Intelligencia.UrlRewriter.Transforms.Base64Transform' Intelligencia.UrlRewriter.Transforms.DecodeTransform' Intelligencia.UrlRewriter.Transforms.UpperTransform' Intelligencia.UrlRewriter.Transforms.LowerTransform' Intelligencia.UrlRewriter.Transforms.StaticMappingTransform' Intelligencia.UrlRewriter.Transforms.EncodeTransform' Intelligencia.UrlRewriter.Configuration.TransformFactory,Intelligencia.UrlRewriter.Utilities.Message' Intelligencia.UrlRewriter.Utilities.MessageProvider' Intelligencia.UrlRewriter.Utilities.Constants' Intelligencia.UrlRewriter.Configuration.IConfigurationManager' Intelligencia.UrlRewriter.Utilities.IHttpContext' Intelligencia.UrlRewriter.Configuration.IRewriterConfiguration' Intelligencia.UrlRewriter.Configuration.ConfigurationManagerFacade' Intelligencia.UrlRewriter.Configuration.RewriterConfiguration' Intelligencia.UrlRewriter.Utilities.HttpContextFacade
Intelligencia.UrlRewriter,Intelligencia.UrlRewriter.Conditions,Intelligencia.UrlRewriter.Parsers.AddressConditionParser' Intelligencia.UrlRewriter.Parsers.ExistsConditionParser' Intelligencia.UrlRewriter.Parsers.MethodConditionParser' Intelligencia.UrlRewriter.Parsers.RewriteActionParserBase' Intelligencia.UrlRewriter.Parsers.PropertyMatchConditionParser' Intelligencia.UrlRewriter.Parsers.HeaderMatchConditionParser' Intelligencia.UrlRewriter.Parsers.UrlMatchConditionParser,Intelligencia.UrlRewriter.IRewriteCondition' Intelligencia.UrlRewriter.IRewriteContext' Intelligencia.UrlRewriter.Utilities.Constants' Intelligencia.UrlRewriter.Utilities.IPRange
Intelligencia.UrlRewriter,Intelligencia.UrlRewriter.Configuration,Intelligencia.UrlRewriter.RewriterHttpModule' Intelligencia.UrlRewriter.IRewriteContext' Intelligencia.UrlRewriter.RewriteContext' Intelligencia.UrlRewriter.RewriterEngine' Intelligencia.UrlRewriter.Parsers.ForbiddenActionParser' Intelligencia.UrlRewriter.Parsers.AddHeaderActionParser' Intelligencia.UrlRewriter.IRewriteActionParser' Intelligencia.UrlRewriter.Parsers.GoneActionParser' Intelligencia.UrlRewriter.Parsers.NotAllowedActionParser' Intelligencia.UrlRewriter.Parsers.NotFoundActionParser' Intelligencia.UrlRewriter.Parsers.RedirectActionParser' Intelligencia.UrlRewriter.Parsers.NotImplementedActionParser' Intelligencia.UrlRewriter.Parsers.IfConditionActionParser' Intelligencia.UrlRewriter.Parsers.RewriteActionParser' Intelligencia.UrlRewriter.Parsers.SetAppSettingPropertyActionParser' Intelligencia.UrlRewriter.Parsers.RewriteActionParserBase' Intelligencia.UrlRewriter.Parsers.SetCookieActionParser' Intelligencia.UrlRewriter.Parsers.SetPropertyActionParser' Intelligencia.UrlRewriter.Parsers.SetStatusActionParser,Intelligencia.UrlRewriter.IRewriteActionParser' Intelligencia.UrlRewriter.IRewriteConditionParser' Intelligencia.UrlRewriter.IRewriteAction' Intelligencia.UrlRewriter.IRewriteErrorHandler' Intelligencia.UrlRewriter.Logging.IRewriteLogger' Intelligencia.UrlRewriter.Logging.NullLogger' Intelligencia.UrlRewriter.Parsers.AddHeaderActionParser' Intelligencia.UrlRewriter.Parsers.AddressConditionParser' Intelligencia.UrlRewriter.Parsers.IfConditionActionParser' Intelligencia.UrlRewriter.Parsers.ExistsConditionParser' Intelligencia.UrlRewriter.Parsers.ForbiddenActionParser' Intelligencia.UrlRewriter.Parsers.GoneActionParser' Intelligencia.UrlRewriter.Parsers.HeaderMatchConditionParser' Intelligencia.UrlRewriter.Parsers.MethodConditionParser' Intelligencia.UrlRewriter.Parsers.NotAllowedActionParser' Intelligencia.UrlRewriter.Parsers.NotFoundActionParser' Intelligencia.UrlRewriter.Parsers.NotImplementedActionParser' Intelligencia.UrlRewriter.Parsers.PropertyMatchConditionParser' Intelligencia.UrlRewriter.Parsers.RedirectActionParser' Intelligencia.UrlRewriter.Parsers.RewriteActionParser' Intelligencia.UrlRewriter.Parsers.SetAppSettingPropertyActionParser' Intelligencia.UrlRewriter.Parsers.SetCookieActionParser' Intelligencia.UrlRewriter.Parsers.SetPropertyActionParser' Intelligencia.UrlRewriter.Parsers.SetStatusActionParser' Intelligencia.UrlRewriter.Parsers.UnlessConditionActionParser' Intelligencia.UrlRewriter.Parsers.UrlMatchConditionParser' Intelligencia.UrlRewriter.Transforms.Base64Transform' Intelligencia.UrlRewriter.Transforms.Base64DecodeTransform' Intelligencia.UrlRewriter.Transforms.DecodeTransform' Intelligencia.UrlRewriter.Transforms.EncodeTransform' Intelligencia.UrlRewriter.Transforms.LowerTransform' Intelligencia.UrlRewriter.Transforms.UpperTransform' Intelligencia.UrlRewriter.Utilities.Constants' Intelligencia.UrlRewriter.Utilities.Message' Intelligencia.UrlRewriter.Utilities.MessageProvider' Intelligencia.UrlRewriter.IRewriteTransform' Intelligencia.UrlRewriter.Errors.DefaultErrorHandler' Intelligencia.UrlRewriter.Transforms.StaticMappingTransform' Intelligencia.UrlRewriter.Utilities.TypeHelper
Intelligencia.UrlRewriter,Intelligencia.UrlRewriter.Errors,Intelligencia.UrlRewriter.Configuration.RewriterConfigurationReader,Intelligencia.UrlRewriter.IRewriteErrorHandler
Intelligencia.UrlRewriter,Intelligencia.UrlRewriter.Logging,Intelligencia.UrlRewriter.Configuration.IRewriterConfiguration' Intelligencia.UrlRewriter.Configuration.RewriterConfiguration' Intelligencia.UrlRewriter.Configuration.RewriterConfigurationReader,
Intelligencia.UrlRewriter,Intelligencia.UrlRewriter.Parsers,Intelligencia.UrlRewriter.Configuration.RewriterConfiguration,Intelligencia.UrlRewriter.Actions.AddHeaderAction' Intelligencia.UrlRewriter.IRewriteAction' Intelligencia.UrlRewriter.Configuration.IRewriterConfiguration' Intelligencia.UrlRewriter.Utilities.Constants' Intelligencia.UrlRewriter.IRewriteCondition' Intelligencia.UrlRewriter.IRewriteConditionParser' Intelligencia.UrlRewriter.Conditions.AddressCondition' Intelligencia.UrlRewriter.Actions.ConditionalAction' Intelligencia.UrlRewriter.IRewriteActionParser' Intelligencia.UrlRewriter.Utilities.Message' Intelligencia.UrlRewriter.Utilities.MessageProvider' Intelligencia.UrlRewriter.Conditions.ExistsCondition' Intelligencia.UrlRewriter.Actions.ForbiddenAction' Intelligencia.UrlRewriter.Actions.GoneAction' Intelligencia.UrlRewriter.Conditions.PropertyMatchCondition' Intelligencia.UrlRewriter.Conditions.MethodCondition' Intelligencia.UrlRewriter.Actions.MethodNotAllowedAction' Intelligencia.UrlRewriter.Actions.NotFoundAction' Intelligencia.UrlRewriter.Actions.NotImplementedAction' Intelligencia.UrlRewriter.Actions.RedirectAction' Intelligencia.UrlRewriter.Actions.RewriteAction' Intelligencia.UrlRewriter.RewriteProcessing' Intelligencia.UrlRewriter.Conditions.NegativeCondition' Intelligencia.UrlRewriter.Actions.SetAppSettingPropertyAction' Intelligencia.UrlRewriter.Actions.SetCookieAction' Intelligencia.UrlRewriter.Actions.SetPropertyAction' Intelligencia.UrlRewriter.Actions.SetStatusAction' Intelligencia.UrlRewriter.Conditions.UrlMatchCondition
Intelligencia.UrlRewriter,Intelligencia.UrlRewriter.Transforms,Intelligencia.UrlRewriter.Configuration.RewriterConfiguration' Intelligencia.UrlRewriter.Configuration.RewriterConfigurationReader,Intelligencia.UrlRewriter.IRewriteTransform' Intelligencia.UrlRewriter.Utilities.Constants
Intelligencia.UrlRewriter,Intelligencia.UrlRewriter.Utilities,Intelligencia.UrlRewriter.Form' Intelligencia.UrlRewriter.Parsers.GoneActionParser' Intelligencia.UrlRewriter.Parsers.ForbiddenActionParser' Intelligencia.UrlRewriter.Parsers.NotFoundActionParser' Intelligencia.UrlRewriter.Parsers.NotAllowedActionParser' Intelligencia.UrlRewriter.Parsers.NotImplementedActionParser' Intelligencia.UrlRewriter.Transforms.UpperTransform' Intelligencia.UrlRewriter.Transforms.LowerTransform' Intelligencia.UrlRewriter.Transforms.EncodeTransform' Intelligencia.UrlRewriter.Transforms.DecodeTransform' Intelligencia.UrlRewriter.Transforms.Base64DecodeTransform' Intelligencia.UrlRewriter.Transforms.Base64Transform' Intelligencia.UrlRewriter.Parsers.IfConditionActionParser' Intelligencia.UrlRewriter.Parsers.AddressConditionParser' Intelligencia.UrlRewriter.Conditions.AddressCondition' Intelligencia.UrlRewriter.Parsers.MethodConditionParser' Intelligencia.UrlRewriter.Parsers.UrlMatchConditionParser' Intelligencia.UrlRewriter.Parsers.ExistsConditionParser' Intelligencia.UrlRewriter.Parsers.PropertyMatchConditionParser' Intelligencia.UrlRewriter.Parsers.HeaderMatchConditionParser' Intelligencia.UrlRewriter.Parsers.AddHeaderActionParser' Intelligencia.UrlRewriter.Parsers.UnlessConditionActionParser' Intelligencia.UrlRewriter.Configuration.RewriterConfiguration' Intelligencia.UrlRewriter.Parsers.SetAppSettingPropertyActionParser' Intelligencia.UrlRewriter.Parsers.SetPropertyActionParser' Intelligencia.UrlRewriter.Parsers.SetCookieActionParser' Intelligencia.UrlRewriter.Parsers.SetStatusActionParser' Intelligencia.UrlRewriter.Parsers.RewriteActionParserBase' Intelligencia.UrlRewriter.Configuration.RewriterConfigurationReader' Intelligencia.UrlRewriter.Parsers.RedirectActionParser' Intelligencia.UrlRewriter.Parsers.RewriteActionParser' Intelligencia.UrlRewriter.RewriterHttpModule' Intelligencia.UrlRewriter.IRewriteContext' Intelligencia.UrlRewriter.RewriteContext' Intelligencia.UrlRewriter.RewriterEngine' Intelligencia.UrlRewriter.XmlNodeExtensions,Intelligencia.UrlRewriter.IRewriteErrorHandler
