Project,Namespace,Ca types,Ce types
Expressions,Expressions.Ast,Expressions.BindingVisitor' Expressions.Csharp.argument_expression_list_return' Expressions.ConstantParsingVisitor' Expressions.Flee.FleeParser' Expressions.Csharp.CsharpParser' Expressions.VisualBasic.VisualBasicParser' Expressions.Csharp.constant_return' Expressions.ParseResult' Expressions.Resolver' Expressions.Csharp.prog_return' Expressions.Csharp.expression_return' Expressions.Csharp.conditional_expression_return' Expressions.Csharp.logical_or_expression_return' Expressions.Csharp.logical_and_expression_return' Expressions.Csharp.bitwise_or_expression_return' Expressions.Csharp.bitwise_xor_expression_return' Expressions.Csharp.bitwise_and_expression_return' Expressions.Csharp.unary_not_expression_return' Expressions.Csharp.equality_expression_return' Expressions.Csharp.relational_expression_return' Expressions.Csharp.shift_expression_return' Expressions.Csharp.additive_expression_return' Expressions.Csharp.multiplicative_expression_return' Expressions.Csharp.cast_expression_return' Expressions.Csharp.unary_expression_return' Expressions.Csharp.postfix_expression_return' Expressions.Csharp.primary_expression_return' Expressions.BoundExpressionCache' Expressions.Csharp.type_expression_return,Expressions.ExpressionType' Expressions.Require' Expressions.CastType
Expressions,Expressions,Expressions.Ast.Cast' Expressions.Expressions.Cast' Expressions.VisualBasic.VisualBasicLexer' Expressions.Flee.FleeLexer' Expressions.Csharp.CsharpLexer' Expressions.Flee.FleeParser' Expressions.VisualBasic.VisualBasicParser' Expressions.Csharp.CsharpParser' Expressions.Expressions.Constant' Expressions.Ast.BinaryExpression' Expressions.Expressions.UnaryExpression' Expressions.Expressions.BinaryExpression' Expressions.Ast.UnaryExpression' Expressions.Ast.Conditional' Expressions.Ast.AstNodeCollection' Expressions.Expressions.ImportAccess' Expressions.Ast.IdentifierAccess' Expressions.Ast.MethodCall' Expressions.Expressions.Conditional' Expressions.Ast.Index' Expressions.Ast.MemberAccess' Expressions.Ast.TypeIdentifier' Expressions.Expressions.TypeAccess' Expressions.Expressions.FieldAccess' Expressions.Expressions.MethodCall' Expressions.Expressions.VariableAccess' Expressions.Expressions.Index,Expressions.Ast.BinaryExpression' Expressions.Ast.Cast' Expressions.Ast.AstNodeCollection' Expressions.Ast.Conditional' Expressions.Ast.Constant' Expressions.Ast.IAstNode' Expressions.Ast.IAstVisitor' Expressions.Ast.IdentifierAccess' Expressions.Ast.Index' Expressions.Ast.MemberAccess' Expressions.Ast.MethodCall' Expressions.Ast.UnaryExpression' Expressions.Expressions.Conditional' Expressions.Expressions.ImportAccess' Expressions.Expressions.BinaryExpression' Expressions.Expressions.Cast' Expressions.Expressions.Constant' Expressions.Expressions.FieldAccess' Expressions.Expressions.TypeAccess' Expressions.Expressions.IExpression' Expressions.Expressions.Index' Expressions.Expressions.MethodCall' Expressions.Expressions.UnaryExpression' Expressions.Expressions.VariableAccess' Expressions.Ast.AstVisitor' Expressions.Expressions.ExpressionVisitor' JetBrains.Annotations.InvokerParameterNameAttribute' JetBrains.Annotations.AssertionMethodAttribute' JetBrains.Annotations.AssertionConditionAttribute' JetBrains.Annotations.AssertionConditionType' Expressions.Ast.IdentifierCollection' Expressions.Expressions.IExpressionVisitor' Expressions.VisualBasic.VisualBasicParser' Expressions.Flee.FleeParser' Expressions.Csharp.CsharpParser
Expressions,Expressions.VisualBasic,Expressions.DynamicExpressionCache,Expressions.ExpressionsException' Expressions.ExpressionsExceptionType' Expressions.Ast.Constant' Expressions.Ast.IdentifierAccess' Expressions.Ast.IdentifierCollection' Expressions.UnparsedNumber' Expressions.ParseResult
Expressions,Expressions.Expressions,Expressions.Compiler' Expressions.BindingVisitor' Expressions.ConversionVisitor' Expressions.Resolver' Expressions.BoundExpression,Expressions.Require' Expressions.Import' Expressions.ExpressionType' Expressions.CastType' Expressions.UnparsedNumber
Expressions,Expressions.Flee,Expressions.DynamicExpressionCache,Expressions.ExpressionsException' Expressions.ExpressionsExceptionType' Expressions.Ast.Constant' Expressions.Ast.IdentifierAccess' Expressions.Ast.IdentifierCollection' Expressions.UnparsedNumber' Expressions.ParseResult
Expressions,JetBrains.Annotations,Expressions.Require,
Expressions,Expressions.Csharp,Expressions.DynamicExpressionCache,Expressions.ExpressionsException' Expressions.ExpressionsExceptionType' Expressions.Ast.Constant' Expressions.Ast.IdentifierAccess' Expressions.Ast.IdentifierCollection' Expressions.UnparsedNumber' Expressions.ParseResult' Expressions.Ast.IAstNode' Expressions.Ast.TypeIdentifier' Expressions.Ast.AstNodeCollection
