Project,Namespace,Ca types,Ce types
itextsharp.xmlworker(VS2010),iTextSharp.tool.xml.parser,iTextSharp.tool.xml.parser.state.AttributeValueState' iTextSharp.tool.xml.parser.state.CdataState' iTextSharp.tool.xml.parser.state.CloseCommentState' iTextSharp.tool.xml.parser.state.CloseStarCommentState' iTextSharp.tool.xml.parser.state.ClosingTagState' iTextSharp.tool.xml.parser.state.CommentState' iTextSharp.tool.xml.parser.state.DocTypeState' iTextSharp.tool.xml.parser.state.DoubleQuotedAttrValueState' iTextSharp.tool.xml.parser.state.InsideTagHTMLState' iTextSharp.tool.xml.parser.state.InsideTagState' iTextSharp.tool.xml.parser.state.ProcessingInstructionEncounteredState' iTextSharp.tool.xml.parser.state.SelfClosingTagState' iTextSharp.tool.xml.parser.state.SingleQuotedAttrValueState' iTextSharp.tool.xml.parser.state.SpecialCharState' iTextSharp.tool.xml.parser.state.StarCommentState' iTextSharp.tool.xml.parser.state.TagAttributeState' iTextSharp.tool.xml.parser.state.TagEncounteredState' iTextSharp.tool.xml.parser.state.UnknownState' iTextSharp.tool.xml.parser.state.UnquotedAttrState' iTextSharp.tool.xml.parser.state.XmlState' iTextSharp.tool.xml.XMLWorkerHelper' itextsharp.xmlworker.tests.examples.XMLWorkerHTMLExample' itextsharp.xmlworker.tests.iTextSharp.tool.xml.examples.css.div.ComplexDiv01Test' itextsharp.xmlworker.tests.iTextSharp.tool.xml.examples.css.div.ComplexDiv02Test' itextsharp.xmlworker.tests.iTextSharp.tool.xml.examples.css.div.ComplexDivPagination01Test' itextsharp.xmlworker.tests.iTextSharp.tool.xml.examples.css.div.DivSampleTest' itextsharp.xmlworker.tests.iTextSharp.tool.xml.examples.css.div.PageOverflow01Test' itextsharp.xmlworker.tests.iTextSharp.tool.xml.examples.html.DivPagination01Test' itextsharp.xmlworker.tests.iTextSharp.tool.xml.examples.html.DivPagination02Test' itextsharp.xmlworker.tests.iTextSharp.tool.xml.examples.SampleTest' itextsharp.xmlworker.tests.iTextSharp.tool.xml.html.HTMLWorkerFactoryTest' itextsharp.xmlworker.tests.iTextSharp.tool.xml.html.LoadCssThroughLinkStyleTagTest' itextsharp.xmlworker.tests.iTextSharp.tool.xml.html.SpecialCharInPDFTest' itextsharp.xmlworker.tests.iTextSharp.tool.xml.parser.HTMLWhiteSpacesTest' itextsharp.xmlworker.tests.iTextSharp.tool.xml.parser.ParserTest' itextsharp.xmlworker.tests.iTextSharp.tool.xml.parser.SpecialCharactersTest,iTextSharp.tool.xml.parser.io.IParserMonitor' iTextSharp.text.xml.XMLUtil' iTextSharp.tool.xml.parser.io.EncodingUtil' iTextSharp.text.xml.simpleparser.IanaEncodings
itextsharp.xmlworker(VS2010),iTextSharp.tool.xml.parser.state,itextsharp.xmlworker.tests.iTextSharp.tool.xml.parser.SpecialCharactersTest,iTextSharp.tool.xml.parser.XMLParser' iTextSharp.tool.xml.parser.StateController' iTextSharp.tool.xml.html.HTMLUtils' iTextSharp.tool.xml.parser.XMLParserMemory' iTextSharp.tool.xml.html.Tag' iTextSharp.tool.xml.html.HTML' iTextSharp.tool.xml.parser.TagState' iTextSharp.text.xml.simpleparser.EntitiesToUnicode
itextsharp.xmlworker(VS2010),iTextSharp.tool.xml.pipeline,iTextSharp.tool.xml.pipeline.css.CssResolverPipeline' iTextSharp.tool.xml.pipeline.end.PdfWriterPipeline' itextsharp.xmlworker.tests.iTextSharp.tool.xml.pipeline.PipelineTest' iTextSharp.tool.xml.ElementList' iTextSharp.tool.xml.pipeline.html.HtmlPipeline' itextsharp.xmlworker.tests.examples.CustomElementHandler' itextsharp.xmlworker.tests.iTextSharp.tool.xml.html.CustomElementHandler' itextsharp.xmlworker.tests.iTextSharp.tool.xml.pipeline.ElementHandlerPipelineTest,iTextSharp.tool.xml.IPipeline' iTextSharp.tool.xml.IWorkerContext' iTextSharp.tool.xml.Tag' iTextSharp.tool.xml.ProcessObject' iTextSharp.tool.xml.ICustomContext' iTextSharp.tool.xml.exceptions.LocaleMessages' iTextSharp.text.IElement
itextsharp.xmlworker(VS2010),iTextSharp.tool.xml.pipeline.css,iTextSharp.tool.xml.XMLWorkerHelper' iTextSharp.tool.xml.html.AbstractTagProcessor' iTextSharp.tool.xml.html.head.Link' iTextSharp.tool.xml.html.head.Style' itextsharp.xmlworker.tests.iTextSharp.tool.xml.pipeline.CssResolverPipelineTest' itextsharp.xmlworker.tests.examples.XMLWorkerHTMLExample' itextsharp.xmlworker.tests.iTextSharp.tool.xml.examples.css.div.PageOverflow01Test,iTextSharp.tool.xml.IWorkerContext' iTextSharp.tool.xml.pipeline.AbstractPipeline' iTextSharp.tool.xml.IPipeline' iTextSharp.tool.xml.Tag' iTextSharp.tool.xml.ProcessObject' iTextSharp.tool.xml.css.ICssFile
itextsharp.xmlworker(VS2010),iTextSharp.tool.xml.pipeline.ctx,iTextSharp.tool.xml.html.Body' iTextSharp.tool.xml.pipeline.end.PdfWriterPipeline' iTextSharp.tool.xml.pipeline.html.AutoDocPipeline' iTextSharp.tool.xml.XMLWorker' itextsharp.xmlworker.tests.iTextSharp.tool.xml.html.table.TableTest' itextsharp.xmlworker.tests.iTextSharp.tool.xml.html.tps.AnchorTest' itextsharp.xmlworker.tests.iTextSharp.tool.xml.html.tps.BodyTest' itextsharp.xmlworker.tests.iTextSharp.tool.xml.html.tps.DivTest' itextsharp.xmlworker.tests.iTextSharp.tool.xml.html.tps.HeaderTest' itextsharp.xmlworker.tests.iTextSharp.tool.xml.html.tps.ListItemTest' itextsharp.xmlworker.tests.iTextSharp.tool.xml.html.tps.NonSanitizedTagTest' itextsharp.xmlworker.tests.iTextSharp.tool.xml.html.tps.OrderedUnorderedListTest' itextsharp.xmlworker.tests.iTextSharp.tool.xml.html.tps.ParaGraphTest' itextsharp.xmlworker.tests.iTextSharp.tool.xml.html.tps.SpanTest' itextsharp.xmlworker.tests.iTextSharp.tool.xml.html.tps.TPBreakTest' itextsharp.xmlworker.tests.iTextSharp.tool.xml.pipeline.CssResolverPipelineTest' itextsharp.xmlworker.tests.iTextSharp.tool.xml.pipeline.ElementHandlerPipelineTest' itextsharp.xmlworker.tests.iTextSharp.tool.xml.pipeline.HtmlPipelineTest,iTextSharp.tool.xml.Tag' iTextSharp.tool.xml.ICustomContext
itextsharp.xmlworker(VS2010),iTextSharp.tool.xml.pipeline.end,iTextSharp.tool.xml.XMLWorkerHelper' itextsharp.xmlworker.tests.iTextSharp.tool.xml.pipeline.ElementHandlerPipelineTest' iTextSharp.tool.xml.html.Body' iTextSharp.tool.xml.pipeline.html.AutoDocPipeline,iTextSharp.tool.xml.IElementHandler' iTextSharp.tool.xml.IPipeline' iTextSharp.tool.xml.IWorkerContext' iTextSharp.tool.xml.Tag' iTextSharp.tool.xml.ProcessObject' iTextSharp.tool.xml.IWritable' iTextSharp.text.log.ILogger' iTextSharp.text.Document' iTextSharp.text.pdf.PdfWriter' iTextSharp.tool.xml.pipeline.ctx.MapContext' iTextSharp.tool.xml.pipeline.AbstractPipeline' iTextSharp.tool.xml.pipeline.WritableElement' iTextSharp.text.log.Level' iTextSharp.tool.xml.exceptions.LocaleMessages' iTextSharp.text.IElement
itextsharp.xmlworker(VS2010),iTextSharp.tool.xml.pipeline.html,iTextSharp.tool.xml.XMLWorkerHelper' iTextSharp.tool.xml.html.AbstractTagProcessor' itextsharp.xmlworker.tests.iTextSharp.tool.xml.examples.css.div.ComplexDiv01Test' itextsharp.xmlworker.tests.iTextSharp.tool.xml.examples.css.div.ComplexDiv02Test' itextsharp.xmlworker.tests.iTextSharp.tool.xml.examples.css.div.ComplexDivPagination01Test' itextsharp.xmlworker.tests.iTextSharp.tool.xml.examples.css.div.DivSampleTest' itextsharp.xmlworker.tests.iTextSharp.tool.xml.examples.css.div.PageOverflow01Test' itextsharp.xmlworker.tests.iTextSharp.tool.xml.examples.html.DivPagination01Test' itextsharp.xmlworker.tests.iTextSharp.tool.xml.examples.html.DivPagination02Test' itextsharp.xmlworker.tests.iTextSharp.tool.xml.examples.SampleTest' itextsharp.xmlworker.tests.iTextSharp.tool.xml.html.table.TableTest' itextsharp.xmlworker.tests.iTextSharp.tool.xml.html.tps.AnchorTest' itextsharp.xmlworker.tests.iTextSharp.tool.xml.html.tps.BodyTest' itextsharp.xmlworker.tests.iTextSharp.tool.xml.html.tps.DivTest' itextsharp.xmlworker.tests.iTextSharp.tool.xml.html.tps.HeaderTest' itextsharp.xmlworker.tests.iTextSharp.tool.xml.html.tps.ImageTest' itextsharp.xmlworker.tests.iTextSharp.tool.xml.html.tps.ListItemTest' itextsharp.xmlworker.tests.iTextSharp.tool.xml.html.tps.NonSanitizedTagTest' itextsharp.xmlworker.tests.iTextSharp.tool.xml.html.tps.OrderedUnorderedListTest' itextsharp.xmlworker.tests.iTextSharp.tool.xml.html.tps.ParaGraphTest' itextsharp.xmlworker.tests.iTextSharp.tool.xml.html.tps.SpanTest' itextsharp.xmlworker.tests.iTextSharp.tool.xml.html.tps.TPBreakTest' itextsharp.xmlworker.tests.iTextSharp.tool.xml.pipeline.HtmlPipelineTest' iTextSharp.tool.xml.css.apply.ChunkCssApplier' iTextSharp.tool.xml.css.apply.DivCssApplier' iTextSharp.tool.xml.css.apply.HtmlCellCssApplier' iTextSharp.tool.xml.css.apply.ImageCssApplier' iTextSharp.tool.xml.css.apply.LineSeparatorCssApplier' iTextSharp.tool.xml.css.apply.ListStyleTypeCssApplier' iTextSharp.tool.xml.css.apply.NoNewLineParagraphCssApplier' iTextSharp.tool.xml.css.apply.ParagraphCssApplier' iTextSharp.tool.xml.html.Anchor' iTextSharp.tool.xml.html.Break' iTextSharp.tool.xml.html.CssApplier<T>' iTextSharp.tool.xml.html.ICssApplier' iTextSharp.tool.xml.html.CssAppliers' iTextSharp.tool.xml.html.CssAppliersImpl' iTextSharp.tool.xml.html.Div' iTextSharp.tool.xml.html.Header' iTextSharp.tool.xml.html.WriteH' iTextSharp.tool.xml.html.HorizontalRule' iTextSharp.tool.xml.html.Image' iTextSharp.tool.xml.html.OrderedUnorderedList' iTextSharp.tool.xml.html.ParaGraph' iTextSharp.tool.xml.html.head.Meta' iTextSharp.tool.xml.html.head.XML' iTextSharp.tool.xml.html.table.Table' iTextSharp.tool.xml.html.table.TableData' itextsharp.xmlworker.tests.examples.XMLWorkerHTMLExample' itextsharp.xmlworker.tests.iTextSharp.tool.xml.css.apply.HtmlCellCssApplierTest' itextsharp.xmlworker.tests.iTextSharp.tool.xml.css.apply.ParagraphCssApplierTest' itextsharp.xmlworker.tests.iTextSharp.tool.xml.css.WidthCalculatorTest' itextsharp.xmlworker.tests.iTextSharp.tool.xml.html.HTMLWorkerFactoryTest' itextsharp.xmlworker.tests.iTextSharp.tool.xml.html.LoadCssThroughLinkStyleTagTest' itextsharp.xmlworker.tests.iTextSharp.tool.xml.html.SpecialCharInPDFTest' itextsharp.xmlworker.tests.iTextSharp.tool.xml.pipeline.HtmlPipelineCloneTest' itextsharp.xmlworker.tests.iTextSharp.tool.xml.pipeline.HtmlPipelineContextTest' iTextSharp.tool.xml.net.ImageRetrieve' itextsharp.xmlworker.tests.iTextSharp.tool.xml.pipeline.StackKeeperTest,iTextSharp.text.Image' iTextSharp.text.Rectangle' iTextSharp.tool.xml.pipeline.ctx.MapContext' iTextSharp.text.Document' iTextSharp.tool.xml.css.CssUtils' iTextSharp.tool.xml.Tag' iTextSharp.tool.xml.IWorkerContext' iTextSharp.tool.xml.pipeline.end.PdfWriterPipeline' iTextSharp.text.pdf.PdfWriter' System.util.Util' iTextSharp.tool.xml.css.Property' iTextSharp.tool.xml.css.CSS' iTextSharp.tool.xml.exceptions.LocaleMessages' iTextSharp.tool.xml.IPipeline' iTextSharp.tool.xml.ProcessObject' iTextSharp.tool.xml.pipeline.ctx.WorkerContextImpl' iTextSharp.tool.xml.html.ITagProcessor' iTextSharp.tool.xml.pipeline.WritableElement' iTextSharp.text.IElement' iTextSharp.text.Element' iTextSharp.tool.xml.html.ITagProcessorFactory' iTextSharp.tool.xml.html.CssAppliers' iTextSharp.tool.xml.html.CssAppliersAware
itextsharp.xmlworker(VS2010),iTextSharp.tool.xml.util,iTextSharp.tool.xml.html.AbstractTagProcessor' iTextSharp.tool.xml.html.Header' iTextSharp.tool.xml.css.CssFilesImpl' iTextSharp.tool.xml.html.table.Table,iTextSharp.tool.xml.Tag' iTextSharp.tool.xml.html.Tag' iTextSharp.tool.xml.html.HTML
