Project,Namespace,Ca types,Ce types
itextsharp.xmlworker(VS2010),iTextSharp.tool.xml.css.apply,iTextSharp.tool.xml.html.Body' iTextSharp.tool.xml.html.CssAppliersImpl' iTextSharp.tool.xml.html.table.Table' itextsharp.xmlworker.tests.iTextSharp.tool.xml.css.apply.ChunkCssApplierTest' itextsharp.xmlworker.tests.iTextSharp.tool.xml.css.apply.FontFamilyTest' itextsharp.xmlworker.tests.iTextSharp.tool.xml.css.FontSizeTranslatorTest' itextsharp.xmlworker.tests.iTextSharp.tool.xml.html.FontAndColorTest' itextsharp.xmlworker.tests.iTextSharp.tool.xml.css.apply.HtmlCellCssApplierTest' iTextSharp.tool.xml.css.CssUtils' iTextSharp.tool.xml.html.CssApplier<T>' iTextSharp.tool.xml.html.ICssApplier' iTextSharp.tool.xml.html.CssAppliers' itextsharp.xmlworker.tests.iTextSharp.tool.xml.css.apply.ParagraphCssApplierTest' itextsharp.xmlworker.tests.iTextSharp.tool.xml.html.tps.OrderedUnorderedListTest,iTextSharp.tool.xml.css.CssUtils' iTextSharp.text.IFontProvider' iTextSharp.text.Chunk' iTextSharp.tool.xml.Tag' iTextSharp.text.Font' System.util.Util' iTextSharp.tool.xml.css.Property' iTextSharp.tool.xml.css.CSS' iTextSharp.tool.xml.css.Value' iTextSharp.text.pdf.PdfContentByte' iTextSharp.text.html.HtmlUtilities' iTextSharp.tool.xml.pipeline.html.HtmlPipelineContext' iTextSharp.text.BaseColor' iTextSharp.text.pdf.BaseFont' iTextSharp.tool.xml.css.FontSizeTranslator' iTextSharp.text.log.ILogger' iTextSharp.text.Image' iTextSharp.tool.xml.html.Attribute' iTextSharp.tool.xml.html.HTML' iTextSharp.text.pdf.PdfDiv' iTextSharp.text.Rectangle' iTextSharp.tool.xml.net.ImageRetrieve' iTextSharp.text.log.Level' iTextSharp.tool.xml.exceptions.LocaleMessages' iTextSharp.text.pdf.FloatType' iTextSharp.text.pdf.PositionType' iTextSharp.text.pdf.DisplayType' iTextSharp.text.pdf.BorderTopStyle' iTextSharp.tool.xml.html.pdfelement.HtmlCell' iTextSharp.tool.xml.html.table.TableStyleValues' iTextSharp.tool.xml.css.HeightCalculator' iTextSharp.tool.xml.html.Tag' iTextSharp.tool.xml.html.table.Table' iTextSharp.text.Element' iTextSharp.tool.xml.css.WidthCalculator' iTextSharp.text.pdf.draw.LineSeparator' iTextSharp.text.List' iTextSharp.tool.xml.html.pdfelement.NoNewLineParagraph' iTextSharp.tool.xml.html.CssAppliers' iTextSharp.text.Paragraph
itextsharp.xmlworker(VS2010),iTextSharp.tool.xml.css,iTextSharp.tool.xml.css.apply.ChunkCssApplier' iTextSharp.tool.xml.css.apply.DivCssApplier' iTextSharp.tool.xml.css.apply.HtmlCellCssApplier' iTextSharp.tool.xml.css.apply.ImageCssApplier' iTextSharp.tool.xml.css.apply.LineSeparatorCssApplier' iTextSharp.tool.xml.css.apply.ListStyleTypeCssApplier' iTextSharp.tool.xml.css.apply.MaxLeadingAndSize' iTextSharp.tool.xml.css.apply.NoNewLineParagraphCssApplier' iTextSharp.tool.xml.css.apply.ParagraphCssApplier' iTextSharp.tool.xml.html.AbstractTagProcessor' iTextSharp.tool.xml.html.Body' iTextSharp.tool.xml.html.HorizontalRule' iTextSharp.tool.xml.html.OrderedUnorderedList' iTextSharp.tool.xml.html.ParaGraph' iTextSharp.tool.xml.html.table.Table' iTextSharp.tool.xml.pipeline.html.AutoDocPipeline' itextsharp.xmlworker.tests.iTextSharp.tool.xml.css.apply.ParagraphCssApplierTest' itextsharp.xmlworker.tests.iTextSharp.tool.xml.css.CssUtilsTest' itextsharp.xmlworker.tests.iTextSharp.tool.xml.css.FontSizeTranslatorTest' itextsharp.xmlworker.tests.iTextSharp.tool.xml.css.CSSFilesTest' iTextSharp.tool.xml.XMLWorkerHelper' itextsharp.xmlworker.tests.iTextSharp.tool.xml.css.CSSFileProcessorTest' itextsharp.xmlworker.tests.iTextSharp.tool.xml.examples.css.div.ComplexDiv01Test' itextsharp.xmlworker.tests.iTextSharp.tool.xml.examples.css.div.ComplexDiv02Test' itextsharp.xmlworker.tests.iTextSharp.tool.xml.examples.css.div.ComplexDivPagination01Test' itextsharp.xmlworker.tests.iTextSharp.tool.xml.examples.css.div.DivSampleTest' itextsharp.xmlworker.tests.iTextSharp.tool.xml.examples.html.DivPagination01Test' itextsharp.xmlworker.tests.iTextSharp.tool.xml.examples.html.DivPagination02Test' itextsharp.xmlworker.tests.iTextSharp.tool.xml.examples.SampleTest' itextsharp.xmlworker.tests.iTextSharp.tool.xml.html.HTMLWorkerFactoryTest' itextsharp.xmlworker.tests.iTextSharp.tool.xml.html.LoadCssThroughLinkStyleTagTest' itextsharp.xmlworker.tests.iTextSharp.tool.xml.html.SpecialCharInPDFTest' itextsharp.xmlworker.tests.iTextSharp.tool.xml.css.CssFileWrapperTest' iTextSharp.tool.xml.css.parser.CssStateController' iTextSharp.tool.xml.html.Image' itextsharp.xmlworker.tests.iTextSharp.tool.xml.html.AlignAndMarginTest' itextsharp.xmlworker.tests.iTextSharp.tool.xml.html.LineHeightLetterSpacingTest' iTextSharp.tool.xml.pipeline.css.ICSSResolver' iTextSharp.tool.xml.css.parser.CssSelectorParser' itextsharp.xmlworker.tests.iTextSharp.tool.xml.css.DefaultCSSResolverTest' itextsharp.xmlworker.tests.iTextSharp.tool.xml.pipeline.CssResolverPipelineTest' itextsharp.xmlworker.tests.iTextSharp.tool.xml.css.WidthCalculatorTest,iTextSharp.text.Element' iTextSharp.tool.xml.css.parser.CssSelectorParser' iTextSharp.tool.xml.Tag' iTextSharp.tool.xml.css.parser.CssStateController' iTextSharp.tool.xml.util.SortUtil' System.util.Util' iTextSharp.text.html.WebColors' iTextSharp.text.html.HtmlTags' iTextSharp.tool.xml.css.apply.IMarginMemory' iTextSharp.tool.xml.html.Tag' iTextSharp.tool.xml.html.HTML' iTextSharp.text.Font' iTextSharp.tool.xml.html.Attribute' iTextSharp.tool.xml.net.IFileRetrieve
itextsharp.xmlworker(VS2010),iTextSharp.tool.xml.css.parser,iTextSharp.tool.xml.css.CssFileImpl' iTextSharp.tool.xml.css.CssFileProcessor' iTextSharp.tool.xml.css.parser.state.CommentEnd' iTextSharp.tool.xml.css.parser.state.CommentInside' iTextSharp.tool.xml.css.parser.state.CommentStart' iTextSharp.tool.xml.css.parser.state.Properties' iTextSharp.tool.xml.css.parser.state.Rule' iTextSharp.tool.xml.css.parser.state.Unknown,iTextSharp.tool.xml.css.ICssSelectorItem' iTextSharp.tool.xml.Tag' iTextSharp.tool.xml.css.CssUtils' iTextSharp.tool.xml.css.ICssFile
itextsharp.xmlworker(VS2010),iTextSharp.tool.xml.css.parser.state,,iTextSharp.tool.xml.css.parser.CssStateController
itextsharp.xmlworker(VS2010),iTextSharp.tool.xml,iTextSharp.tool.xml.pipeline.end.ElementHandlerPipeline' itextsharp.xmlworker.tests.iTextSharp.tool.xml.pipeline.ElementHandlerPipelineTest' iTextSharp.tool.xml.pipeline.AbstractPipeline' iTextSharp.tool.xml.pipeline.ctx.WorkerContextImpl' iTextSharp.tool.xml.pipeline.css.CssResolverPipeline' iTextSharp.tool.xml.pipeline.end.PdfWriterPipeline' iTextSharp.tool.xml.pipeline.html.AutoDocPipeline' iTextSharp.tool.xml.pipeline.html.HtmlPipeline' itextsharp.xmlworker.tests.examples.XMLWorkerHTMLExample' itextsharp.xmlworker.tests.iTextSharp.tool.xml.examples.css.div.ComplexDiv01Test' itextsharp.xmlworker.tests.iTextSharp.tool.xml.examples.css.div.ComplexDiv02Test' itextsharp.xmlworker.tests.iTextSharp.tool.xml.examples.css.div.ComplexDivPagination01Test' itextsharp.xmlworker.tests.iTextSharp.tool.xml.examples.css.div.DivSampleTest' itextsharp.xmlworker.tests.iTextSharp.tool.xml.examples.css.div.PageOverflow01Test' itextsharp.xmlworker.tests.iTextSharp.tool.xml.examples.html.DivPagination01Test' itextsharp.xmlworker.tests.iTextSharp.tool.xml.examples.html.DivPagination02Test' itextsharp.xmlworker.tests.iTextSharp.tool.xml.examples.SampleTest' itextsharp.xmlworker.tests.iTextSharp.tool.xml.html.HTMLWorkerFactoryTest' itextsharp.xmlworker.tests.iTextSharp.tool.xml.html.LoadCssThroughLinkStyleTagTest' itextsharp.xmlworker.tests.iTextSharp.tool.xml.html.SpecialCharInPDFTest' itextsharp.xmlworker.tests.iTextSharp.tool.xml.pipeline.CssResolverPipelineTest' itextsharp.xmlworker.tests.iTextSharp.tool.xml.pipeline.AbstractPipelineExtension' itextsharp.xmlworker.tests.iTextSharp.tool.xml.pipeline.CustomAbstractPipeline' iTextSharp.tool.xml.html.AbstractTagProcessor' iTextSharp.tool.xml.html.Anchor' iTextSharp.tool.xml.html.Body' iTextSharp.tool.xml.html.Break' iTextSharp.tool.xml.html.Div' iTextSharp.tool.xml.html.DummyTagProcessor' iTextSharp.tool.xml.html.Header' iTextSharp.tool.xml.html.HorizontalRule' iTextSharp.tool.xml.html.Image' iTextSharp.tool.xml.html.ITagProcessor' iTextSharp.tool.xml.html.NonSanitizedTag' iTextSharp.tool.xml.html.OrderedUnorderedList' iTextSharp.tool.xml.html.OrderedUnorderedListItem' iTextSharp.tool.xml.html.ParaGraph' iTextSharp.tool.xml.html.Span' iTextSharp.tool.xml.html.head.Link' iTextSharp.tool.xml.html.head.Meta' iTextSharp.tool.xml.html.head.Style' iTextSharp.tool.xml.html.head.Title' iTextSharp.tool.xml.html.head.XML' iTextSharp.tool.xml.html.table.Table' iTextSharp.tool.xml.html.table.TableData' iTextSharp.tool.xml.html.table.TableRow' itextsharp.xmlworker.tests.iTextSharp.tool.xml.CustomPipeline' itextsharp.xmlworker.tests.iTextSharp.tool.xml.html.tps.ImageTest' itextsharp.xmlworker.tests.iTextSharp.tool.xml.pipeline.CustomTagProcessor' itextsharp.xmlworker.tests.iTextSharp.tool.xml.pipeline.PipelineTest' itextsharp.xmlworker.tests.examples.CustomElementHandler' itextsharp.xmlworker.tests.iTextSharp.tool.xml.html.CustomElementHandler' itextsharp.xmlworker.tests.iTextSharp.tool.xml.pipeline.CustomElementHandler' iTextSharp.tool.xml.css.apply.ChunkCssApplier' iTextSharp.tool.xml.css.apply.DivCssApplier' iTextSharp.tool.xml.css.apply.HtmlCellCssApplier' iTextSharp.tool.xml.css.apply.ImageCssApplier' iTextSharp.tool.xml.css.apply.LineSeparatorCssApplier' iTextSharp.tool.xml.css.apply.ListStyleTypeCssApplier' iTextSharp.tool.xml.css.apply.MaxLeadingAndSize' iTextSharp.tool.xml.css.apply.NoNewLineParagraphCssApplier' iTextSharp.tool.xml.css.apply.ParagraphCssApplier' iTextSharp.tool.xml.css.CssFileImpl' iTextSharp.tool.xml.css.CssFilesImpl' iTextSharp.tool.xml.css.CSSFileWrapper' iTextSharp.tool.xml.css.CssSelector' iTextSharp.tool.xml.css.CssUtils' iTextSharp.tool.xml.css.DefaultCssInheritanceRules' iTextSharp.tool.xml.css.FontSizeTranslator' iTextSharp.tool.xml.css.HeightCalculator' iTextSharp.tool.xml.css.ICssFile' iTextSharp.tool.xml.css.ICssFiles' iTextSharp.tool.xml.css.ICssInheritanceRules' iTextSharp.tool.xml.css.ICssSelectorItem' iTextSharp.tool.xml.css.StyleAttrCSSResolver' iTextSharp.tool.xml.css.WidthCalculator' iTextSharp.tool.xml.css.parser.CssTagSelector' iTextSharp.tool.xml.css.parser.CssClassSelector' iTextSharp.tool.xml.css.parser.CssIdSelector' iTextSharp.tool.xml.css.parser.CssAttributeSelector' iTextSharp.tool.xml.css.parser.CssPseudoSelector' iTextSharp.tool.xml.css.parser.CssSeparatorSelector' iTextSharp.tool.xml.html.CssApplier<T>' iTextSharp.tool.xml.html.ICssApplier' iTextSharp.tool.xml.html.CssAppliers' iTextSharp.tool.xml.html.CssAppliersImpl' iTextSharp.tool.xml.html.WriteH' iTextSharp.tool.xml.pipeline.css.ICSSResolver' iTextSharp.tool.xml.pipeline.html.StackKeeper' iTextSharp.tool.xml.util.ParentTreeUtil' itextsharp.xmlworker.tests.iTextSharp.tool.xml.TagChildrenTest' itextsharp.xmlworker.tests.iTextSharp.tool.xml.TagTest' itextsharp.xmlworker.tests.iTextSharp.tool.xml.TagUtilsTest' itextsharp.xmlworker.tests.iTextSharp.tool.xml.css.apply.ChunkCssApplierTest' itextsharp.xmlworker.tests.iTextSharp.tool.xml.css.apply.FontFamilyTest' itextsharp.xmlworker.tests.iTextSharp.tool.xml.css.apply.HtmlCellCssApplierTest' itextsharp.xmlworker.tests.iTextSharp.tool.xml.css.apply.ParagraphCssApplierTest' itextsharp.xmlworker.tests.iTextSharp.tool.xml.css.CSSFilesTest' itextsharp.xmlworker.tests.iTextSharp.tool.xml.css.CssUtilsTest' itextsharp.xmlworker.tests.iTextSharp.tool.xml.css.DefaultCSSResolverTest' itextsharp.xmlworker.tests.iTextSharp.tool.xml.css.CustomCssInheritanceRulesOne' itextsharp.xmlworker.tests.iTextSharp.tool.xml.css.CustomCssInheritanceRulesTwo' itextsharp.xmlworker.tests.iTextSharp.tool.xml.css.FontSizeTranslatorTest' itextsharp.xmlworker.tests.iTextSharp.tool.xml.css.WidthCalculatorTest' itextsharp.xmlworker.tests.iTextSharp.tool.xml.html.FontAndColorTest' itextsharp.xmlworker.tests.iTextSharp.tool.xml.html.table.TableTest' itextsharp.xmlworker.tests.iTextSharp.tool.xml.html.tps.AbstractTagprocessorTest' itextsharp.xmlworker.tests.iTextSharp.tool.xml.html.tps.AnchorTest' itextsharp.xmlworker.tests.iTextSharp.tool.xml.html.tps.HeaderTest' itextsharp.xmlworker.tests.iTextSharp.tool.xml.html.tps.OrderedUnorderedListTest' itextsharp.xmlworker.tests.iTextSharp.tool.xml.pipeline.StackKeeperTest' itextsharp.xmlworker.tests.iTextSharp.tool.xml.XMLWorkerTest' itextsharp.xmlworker.tests.iTextSharp.tool.xml.html.LineHeightLetterSpacingTest' itextsharp.xmlworker.tests.examples.XMLWorkerHelperExample' itextsharp.xmlworker.tests.iTextSharp.tool.xml.BugRunnerTest' itextsharp.xmlworker.tests.iTextSharp.tool.xml.examples.css.div.DivInTableTest02' itextsharp.xmlworker.tests.iTextSharp.tool.xml.examples.css.div.DivInTableTest01' itextsharp.xmlworker.tests.iTextSharp.tool.xml.html.AlignAndMarginTest' itextsharp.xmlworker.tests.iTextSharp.tool.xml.html.HorAndVertScalingTest' itextsharp.xmlworker.tests.iTextSharp.tool.xml.html.PandBTest' itextsharp.xmlworker.tests.iTextSharp.tool.xml.html.SamplesTest' itextsharp.xmlworker.tests.iTextSharp.tool.xml.html.SubAndSupTest,iTextSharp.tool.xml.pipeline.WritableElement' iTextSharp.tool.xml.exceptions.LocaleMessages' iTextSharp.tool.xml.pipeline.ctx.WorkerContextImpl' iTextSharp.text.FontFactoryImp' iTextSharp.text.Font' iTextSharp.text.BaseColor' iTextSharp.text.FontFamily' iTextSharp.text.pdf.BaseFont' iTextSharp.tool.xml.css.ICssFile' iTextSharp.tool.xml.html.ITagProcessorFactory' iTextSharp.tool.xml.css.CssFileProcessor' iTextSharp.tool.xml.css.CssFilesImpl' iTextSharp.tool.xml.css.StyleAttrCSSResolver' iTextSharp.tool.xml.pipeline.html.HtmlPipelineContext' iTextSharp.tool.xml.parser.XMLParser' iTextSharp.text.pdf.PdfWriter' iTextSharp.text.Document' iTextSharp.text.IFontProvider' iTextSharp.tool.xml.pipeline.html.HtmlPipeline' iTextSharp.tool.xml.pipeline.css.ICSSResolver' iTextSharp.tool.xml.html.Tags' iTextSharp.tool.xml.html.CssAppliers' iTextSharp.tool.xml.pipeline.end.ElementHandlerPipeline' iTextSharp.tool.xml.pipeline.css.CssResolverPipeline' iTextSharp.text.FontFactory
itextsharp.xmlworker(VS2010),iTextSharp.tool.xml.exceptions,iTextSharp.tool.xml.css.apply.DivCssApplier' iTextSharp.tool.xml.css.apply.ListStyleTypeCssApplier' iTextSharp.tool.xml.TagUtils' iTextSharp.tool.xml.XMLWorker' iTextSharp.tool.xml.html.AbstractTagProcessor' iTextSharp.tool.xml.html.Anchor' iTextSharp.tool.xml.html.Body' iTextSharp.tool.xml.html.Break' iTextSharp.tool.xml.html.DefaultTagProcessorFactory' iTextSharp.tool.xml.html.Div' iTextSharp.tool.xml.html.Header' iTextSharp.tool.xml.html.WriteH' iTextSharp.tool.xml.html.HorizontalRule' iTextSharp.tool.xml.html.Image' iTextSharp.tool.xml.html.OrderedUnorderedList' iTextSharp.tool.xml.html.ParaGraph' iTextSharp.tool.xml.html.head.Link' iTextSharp.tool.xml.html.head.Meta' iTextSharp.tool.xml.html.head.Style' iTextSharp.tool.xml.html.head.XML' iTextSharp.tool.xml.html.table.Table' iTextSharp.tool.xml.html.table.TableData' iTextSharp.tool.xml.net.FileRetrieveImpl' iTextSharp.tool.xml.pipeline.AbstractPipeline' iTextSharp.tool.xml.pipeline.end.PdfWriterPipeline' iTextSharp.tool.xml.pipeline.html.AutoDocPipeline' iTextSharp.tool.xml.pipeline.html.HtmlPipeline' itextsharp.xmlworker.tests.iTextSharp.tool.xml.TagUtilsTest' itextsharp.xmlworker.tests.iTextSharp.tool.xml.html.tps.DefaultTagProcessorFactoryTest,iTextSharp.text.error_messages.LocalizedResource
itextsharp.xmlworker(VS2010),iTextSharp.tool.xml.html,itextsharp.xmlworker.tests.iTextSharp.tool.xml.html.table.TableTest' itextsharp.xmlworker.tests.iTextSharp.tool.xml.html.tps.AbstractTagprocessorTest' itextsharp.xmlworker.tests.iTextSharp.tool.xml.html.tps.AnchorTest' itextsharp.xmlworker.tests.iTextSharp.tool.xml.html.tps.DefaultTagProcessorFactoryTest' itextsharp.xmlworker.tests.iTextSharp.tool.xml.html.tps.BodyTest' itextsharp.xmlworker.tests.iTextSharp.tool.xml.html.tps.TPBreakTest' iTextSharp.tool.xml.css.apply.ParagraphCssApplier' iTextSharp.tool.xml.XMLWorkerHelper' iTextSharp.tool.xml.html.table.Table' iTextSharp.tool.xml.html.table.TableData' iTextSharp.tool.xml.pipeline.html.HtmlPipelineContext' itextsharp.xmlworker.tests.iTextSharp.tool.xml.html.tps.OrderedUnorderedListTest' itextsharp.xmlworker.tests.iTextSharp.tool.xml.html.tps.DivTest' itextsharp.xmlworker.tests.iTextSharp.tool.xml.html.tps.HeaderTest' iTextSharp.tool.xml.css.apply.DivCssApplier' iTextSharp.tool.xml.css.apply.HtmlCellCssApplier' iTextSharp.tool.xml.css.apply.ImageCssApplier' iTextSharp.tool.xml.css.apply.LineSeparatorCssApplier' iTextSharp.tool.xml.css.apply.ListStyleTypeCssApplier' iTextSharp.tool.xml.css.DefaultCssInheritanceRules' iTextSharp.tool.xml.css.HeightCalculator' iTextSharp.tool.xml.css.StyleAttrCSSResolver' iTextSharp.tool.xml.css.WidthCalculator' iTextSharp.tool.xml.html.head.Link' iTextSharp.tool.xml.html.table.TableRow' iTextSharp.tool.xml.parser.state.InsideTagHTMLState' iTextSharp.tool.xml.util.ParentTreeUtil' itextsharp.xmlworker.tests.iTextSharp.tool.xml.css.WidthCalculatorTest' itextsharp.xmlworker.tests.iTextSharp.tool.xml.html.tps.ImageTest' iTextSharp.tool.xml.parser.state.AttributeValueState' iTextSharp.tool.xml.parser.state.ClosingTagState' iTextSharp.tool.xml.parser.state.TagAttributeState' iTextSharp.tool.xml.parser.state.TagEncounteredState' itextsharp.xmlworker.tests.iTextSharp.tool.xml.html.HtmlUtilsTest' iTextSharp.tool.xml.pipeline.html.HtmlPipeline' itextsharp.xmlworker.tests.iTextSharp.tool.xml.pipeline.CustomTagProcessorFactory' itextsharp.xmlworker.tests.iTextSharp.tool.xml.html.LineHeightLetterSpacingTest' itextsharp.xmlworker.tests.iTextSharp.tool.xml.pipeline.HtmlPipelineTest' itextsharp.xmlworker.tests.iTextSharp.tool.xml.html.tps.NonSanitizedTagTest' itextsharp.xmlworker.tests.iTextSharp.tool.xml.html.tps.ListItemTest' itextsharp.xmlworker.tests.iTextSharp.tool.xml.html.tps.ParaGraphTest' itextsharp.xmlworker.tests.iTextSharp.tool.xml.html.tps.SpanTest' itextsharp.xmlworker.tests.examples.XMLWorkerHTMLExample' itextsharp.xmlworker.tests.iTextSharp.tool.xml.examples.css.div.ComplexDiv01Test' itextsharp.xmlworker.tests.iTextSharp.tool.xml.examples.css.div.ComplexDiv02Test' itextsharp.xmlworker.tests.iTextSharp.tool.xml.examples.css.div.ComplexDivPagination01Test' itextsharp.xmlworker.tests.iTextSharp.tool.xml.examples.css.div.DivSampleTest' itextsharp.xmlworker.tests.iTextSharp.tool.xml.examples.css.div.PageOverflow01Test' itextsharp.xmlworker.tests.iTextSharp.tool.xml.examples.html.DivPagination01Test' itextsharp.xmlworker.tests.iTextSharp.tool.xml.examples.html.DivPagination02Test' itextsharp.xmlworker.tests.iTextSharp.tool.xml.examples.SampleTest' itextsharp.xmlworker.tests.iTextSharp.tool.xml.html.HTMLWorkerFactoryTest' itextsharp.xmlworker.tests.iTextSharp.tool.xml.html.LoadCssThroughLinkStyleTagTest' itextsharp.xmlworker.tests.iTextSharp.tool.xml.html.SpecialCharInPDFTest,iTextSharp.tool.xml.css.FontSizeTranslator' iTextSharp.tool.xml.IWorkerContext' iTextSharp.tool.xml.pipeline.css.ICSSResolver' iTextSharp.tool.xml.pipeline.css.CssResolverPipeline' iTextSharp.tool.xml.pipeline.html.HtmlPipelineContext' iTextSharp.tool.xml.pipeline.html.HtmlPipeline' iTextSharp.text.Font' iTextSharp.tool.xml.Tag' iTextSharp.tool.xml.css.Property' iTextSharp.tool.xml.css.CSS' System.util.Util' iTextSharp.tool.xml.css.Value' iTextSharp.text.Chunk' iTextSharp.tool.xml.util.ParentTreeUtil' iTextSharp.text.pdf.PdfWriter' iTextSharp.text.Paragraph' iTextSharp.tool.xml.html.pdfelement.NoNewLineParagraph' iTextSharp.tool.xml.exceptions.LocaleMessages' iTextSharp.text.pdf.draw.LineSeparator' iTextSharp.text.api.IIndentable' iTextSharp.text.Element' iTextSharp.text.Phrase' iTextSharp.text.IElement' iTextSharp.text.log.ILogger' iTextSharp.text.log.Level' iTextSharp.tool.xml.pipeline.html.ILinkProvider' iTextSharp.text.pdf.ColumnText' iTextSharp.text.Document' iTextSharp.tool.xml.css.apply.ChunkCssApplier' iTextSharp.tool.xml.pipeline.ctx.MapContext' iTextSharp.text.Rectangle' iTextSharp.text.pdf.PdfBody' iTextSharp.tool.xml.pipeline.end.PdfWriterPipeline' iTextSharp.text.html.HtmlUtilities' iTextSharp.tool.xml.css.apply.IMarginMemory' iTextSharp.tool.xml.css.apply.IPageSizeContainable' iTextSharp.tool.xml.html.pdfelement.HtmlCell' iTextSharp.text.List' iTextSharp.text.Image' iTextSharp.text.pdf.PdfDiv' iTextSharp.text.IFontProvider' iTextSharp.text.pdf.PdfPTable' iTextSharp.text.pdf.PdfName' iTextSharp.text.WritableDirectElement' iTextSharp.text.pdf.PdfDestination' iTextSharp.text.pdf.PdfOutline' iTextSharp.tool.xml.css.CssUtils' iTextSharp.text.xml.XMLUtil' iTextSharp.tool.xml.net.ImageRetrieve' iTextSharp.text.ListItem' iTextSharp.tool.xml.html.pdfelement.TabbedChunk
itextsharp.xmlworker(VS2010),iTextSharp.tool.xml.html.head,,iTextSharp.text.log.ILogger' iTextSharp.tool.xml.Tag' iTextSharp.tool.xml.html.Attribute' iTextSharp.tool.xml.html.HTML' System.util.Util' iTextSharp.tool.xml.html.Value' iTextSharp.tool.xml.pipeline.css.ICSSResolver' iTextSharp.text.log.Level' iTextSharp.tool.xml.exceptions.LocaleMessages' iTextSharp.tool.xml.pipeline.css.CssResolverPipeline' iTextSharp.tool.xml.IWorkerContext' iTextSharp.tool.xml.pipeline.html.HtmlPipelineContext' iTextSharp.text.Document' iTextSharp.text.pdf.PdfWriter
itextsharp.xmlworker(VS2010),iTextSharp.tool.xml.html.pdfelement,iTextSharp.tool.xml.css.apply.HtmlCellCssApplier' iTextSharp.tool.xml.html.CssAppliersImpl' iTextSharp.tool.xml.html.table.Table' iTextSharp.tool.xml.html.table.TableData' iTextSharp.tool.xml.html.table.TableRow' iTextSharp.tool.xml.html.table.TableRowElement' itextsharp.xmlworker.tests.iTextSharp.tool.xml.css.apply.HtmlCellCssApplierTest' itextsharp.xmlworker.tests.iTextSharp.tool.xml.html.table.TableTest' iTextSharp.tool.xml.css.apply.NoNewLineParagraphCssApplier' iTextSharp.tool.xml.html.AbstractTagProcessor' iTextSharp.tool.xml.html.Anchor' iTextSharp.tool.xml.html.Body' iTextSharp.tool.xml.html.Div' itextsharp.xmlworker.tests.iTextSharp.tool.xml.html.pdfelement.NoNewLineParagraphTest' itextsharp.xmlworker.tests.iTextSharp.tool.xml.html.tps.BodyTest' itextsharp.xmlworker.tests.iTextSharp.tool.xml.html.tps.DivTest' itextsharp.xmlworker.tests.iTextSharp.tool.xml.html.tps.NonSanitizedTagTest' itextsharp.xmlworker.tests.iTextSharp.tool.xml.html.tps.SpanTest' iTextSharp.tool.xml.html.ParaGraph,iTextSharp.tool.xml.html.table.TableStyleValues' iTextSharp.text.pdf.PdfPCell' iTextSharp.text.Chunk' iTextSharp.text.Font' iTextSharp.text.Paragraph' iTextSharp.text.Phrase' iTextSharp.text.List' iTextSharp.text.Image' iTextSharp.text.IElement' iTextSharp.text.pdf.draw.VerticalPositionMark
itextsharp.xmlworker(VS2010),iTextSharp.tool.xml.html.table,iTextSharp.tool.xml.css.apply.HtmlCellCssApplier' itextsharp.xmlworker.tests.iTextSharp.tool.xml.css.apply.HtmlCellCssApplierTest' itextsharp.xmlworker.tests.iTextSharp.tool.xml.html.table.TableTest' iTextSharp.tool.xml.html.pdfelement.HtmlCell,iTextSharp.text.pdf.PdfContentByte' iTextSharp.text.BaseColor' iTextSharp.text.Rectangle' iTextSharp.text.pdf.PdfPTable' iTextSharp.text.pdf.PdfPCell' iTextSharp.text.log.ILogger' iTextSharp.tool.xml.css.CssUtils' iTextSharp.tool.xml.css.FontSizeTranslator' iTextSharp.tool.xml.pipeline.html.HtmlPipelineContext' iTextSharp.text.pdf.IPdfPTableEvent' iTextSharp.tool.xml.Tag' iTextSharp.tool.xml.html.Attribute' iTextSharp.tool.xml.html.HTML' iTextSharp.tool.xml.css.Property' iTextSharp.tool.xml.css.CSS' iTextSharp.tool.xml.html.pdfelement.HtmlCell' System.util.Util' iTextSharp.tool.xml.util.SortUtil' iTextSharp.tool.xml.css.Value' iTextSharp.text.log.Level' iTextSharp.tool.xml.exceptions.LocaleMessages' iTextSharp.tool.xml.css.WidthCalculator' iTextSharp.tool.xml.css.HeightCalculator' iTextSharp.text.pdf.PdfPRow' iTextSharp.tool.xml.html.Tag' iTextSharp.tool.xml.IWorkerContext' iTextSharp.text.Element' iTextSharp.text.html.HtmlUtilities' iTextSharp.text.IElement' iTextSharp.text.pdf.PdfDiv' iTextSharp.text.Phrase' iTextSharp.text.Chunk' iTextSharp.tool.xml.css.apply.ChunkCssApplier' iTextSharp.tool.xml.html.CssAppliers' iTextSharp.text.List' iTextSharp.text.ListItem' iTextSharp.text.Paragraph' iTextSharp.text.Image' iTextSharp.text.pdf.PdfWriter' iTextSharp.text.pdf.PdfName' iTextSharp.tool.xml.html.pdfelement.NoNewLineParagraph' iTextSharp.text.pdf.draw.LineSeparator' iTextSharp.text.IElementListener
itextsharp.xmlworker(VS2010),iTextSharp.tool.xml.net.exc,,
itextsharp.xmlworker(VS2010),iTextSharp.tool.xml.net,itextsharp.xmlworker.tests.iTextSharp.tool.xml.html.LoadCssThroughLinkStyleTagTest' itextsharp.xmlworker.tests.iTextSharp.tool.xml.net.FileRetrieveTest' iTextSharp.tool.xml.css.StyleAttrCSSResolver' itextsharp.xmlworker.tests.iTextSharp.tool.xml.css.CSSFileProcessorTest' iTextSharp.tool.xml.css.apply.DivCssApplier' iTextSharp.tool.xml.css.apply.ListStyleTypeCssApplier' iTextSharp.tool.xml.html.Image,iTextSharp.text.log.ILogger' iTextSharp.text.log.Level' iTextSharp.tool.xml.exceptions.LocaleMessages' iTextSharp.tool.xml.pipeline.html.IImageProvider' iTextSharp.text.Image' iTextSharp.tool.xml.pipeline.html.UrlLinkResolver
itextsharp.xmlworker(VS2010),iTextSharp.tool.xml.parser.io,iTextSharp.tool.xml.parser.XMLParser,
