Project,Namespace,Ca types,Ce types
nunit.uiexception.dll,NUnit.UiException.CodeFormatters,NUnit.UiException.Controls.CodeBox' NUnit.UiException.Controls.ICodeView' NUnit.UiException.Controls.SourceCodeDisplay' NUnit.UiException.Controls.ICodeRenderer' NUnit.UiException.Controls.DefaultCodeRenderer' NUnit.UiException.Controls.CodeRenderingContext,NUnit.UiException.UiExceptionHelper' NUnit.UiException.DefaultTextManager' NUnit.UiException.ITextManager
nunit.uiexception.dll,NUnit.UiException.Controls,,NUnit.UiException.CodeFormatters.GeneralCodeFormatter' NUnit.UiException.CodeFormatters.IFormatterCatalog' NUnit.UiException.CodeFormatters.FormattedCode' NUnit.UiException.CodeFormatters.ClassificationTag' NUnit.UiException.CodeFormatters.ClassifiedToken' NUnit.UiException.CodeFormatters.ClassifiedTokenCollection' NUnit.UiException.UiExceptionHelper' NUnit.UiException.ErrorItem' NUnit.UiException.ErrorItemCollection' NUnit.UiException.Properties.Resources' NUnit.UiException.StackTraceParser
nunit.uiexception.dll,NUnit.UiException,NUnit.UiException.CodeFormatters.PlainTextCodeFormatter' NUnit.UiException.Controls.IStackTraceView' NUnit.UiException.Controls.SourceCodeDisplay' NUnit.UiException.Controls.IErrorListRenderer' NUnit.UiException.StackTraceAnalyzers.RawError' NUnit.UiException.Controls.DefaultErrorListRenderer' NUnit.UiException.Controls.ErrorList' NUnit.UiException.CodeFormatters.FormattedCode' NUnit.UiException.StackTraceAnalysers.UnixPathParser' NUnit.UiException.StackTraceAnalyzers.IErrorParser' NUnit.UiException.StackTraceAnalysers.LineNumberParser' NUnit.UiException.StackTraceAnalysers.FunctionParser' NUnit.UiException.StackTraceAnalysers.PathCompositeParser' NUnit.UiException.StackTraceAnalysers.WindowsPathParser' NUnit.UiException.Controls.ErrorBrowser' NUnit.UiException.Controls.PaintLineLocation' NUnit.UiException.CodeFormatters.ClassifiedTokenCollection' NUnit.UiException.Controls.ErrorToolbar' NUnit.UiException.Controls.DefaultCodeRenderer' NUnit.UiException.CodeFormatters.GeneralCodeFormatter' NUnit.UiException.CodeFormatters.CodeFormatterCollection' NUnit.UiException.CodeFormatters.CSharpCodeFormatter' NUnit.UiException.CodeFormatters.Lexer' NUnit.UiException.CodeFormatters.TokenDictionary' NUnit.UiException.CodeFormatters.TokenClassifier,NUnit.UiException.StackTraceAnalysers.FunctionParser' NUnit.UiException.StackTraceAnalysers.LineNumberParser' NUnit.UiException.StackTraceAnalysers.PathCompositeParser' NUnit.UiException.StackTraceAnalyzers.RawError' NUnit.UiException.StackTraceAnalyzers.IErrorParser
nunit.uiexception.dll,NUnit.UiException.Properties,NUnit.UiException.Controls.ErrorToolbar' NUnit.UiException.Controls.StackTraceDisplay' NUnit.UiException.Controls.SourceCodeDisplay' NUnit.UiException.Controls.SplitterBox' NUnit.UiException.Controls.DefaultErrorListRenderer,
nunit.uiexception.dll,NUnit.UiException.StackTraceAnalysers,NUnit.UiException.StackTraceParser,NUnit.UiException.StackTraceParser' NUnit.UiException.UiExceptionHelper' NUnit.UiException.StackTraceAnalyzers.RawError' NUnit.UiException.StackTraceAnalyzers.IErrorParser
nunit.uiexception.dll,NUnit.UiException.StackTraceAnalyzers,NUnit.UiException.StackTraceAnalysers.LineNumberParser' NUnit.UiException.StackTraceAnalysers.FunctionParser' NUnit.UiException.StackTraceAnalysers.WindowsPathParser' NUnit.UiException.StackTraceAnalysers.UnixPathParser' NUnit.UiException.StackTraceAnalysers.PathCompositeParser' NUnit.UiException.StackTraceParser,NUnit.UiException.ErrorItem' NUnit.UiException.UiExceptionHelper' NUnit.UiException.StackTraceParser
