Project,Namespace,Ca types,Ce types
Microsoft.Http2.Owin.Server,Owin,Microsoft.Http2.Owin.Middleware.Http2Middleware' Microsoft.Http2.Owin.Server.Adapters.Http2OwinMessageContext' Microsoft.Http2.Owin.Server.Adapters.Http11ProtocolOwinAdapter' Microsoft.Http2.Owin.Server.Adapters.Http2OwinMessageHandler' Microsoft.Http2.BingPushMiddleware.BingPushMiddleware' Microsoft.Http2.Push.PushMiddleware' Microsoft.Http2.Push.PushMiddlewareBase,
Microsoft.Http2.Owin.Server,Microsoft.Http2.Owin.Server.Adapters,Microsoft.Http2.Owin.Server.HttpConnectingClient' Microsoft.Http2.Owin.Middleware.Http2Middleware,Microsoft.Http2.Protocol.Http2Stream' Microsoft.Http2.Protocol.HeadersList' Owin.CommonOwinKeys' Microsoft.Http2.Protocol.CommonHeaders' Microsoft.Http2.Protocol.Protocols' Microsoft.Http2.Protocol.Utils.Http2Logger' OpenSSL.SSL.SslProtocols' Microsoft.Http1.Protocol.Http11Helper' Microsoft.Http2.Protocol.Verbs' Microsoft.Http2.Protocol.StatusCode' Microsoft.Http2.Protocol.Http2Session' OpenSSL.ConnectionEnd' Microsoft.Http2.Protocol.Framing.ResetStatusCode' Microsoft.Http2.Protocol.Framing.Frame
Microsoft.Http2.Owin.Server,System.Collections.Generic,,
Microsoft.Http2.Owin.Server,Microsoft.Http1.Protocol,Microsoft.Http2.Owin.Server.Adapters.Http11ProtocolOwinAdapter,Microsoft.Http2.Protocol.StatusCode
Microsoft.Http2.Owin.Server,Microsoft.Http2.Owin.Server,Http2.Owin.BingProxy.Sample.Program' Http2.Owin.Service.Sample.Http2ServerService' Http2.Owin.StaticFiles.Sample.Program,OpenSSL.X509.X509Certificate' Microsoft.Http2.Protocol.Utils.Http2Logger' Microsoft.Http2.Protocol.Protocols' OpenSSL.SSL.SslStream' Microsoft.Http2.Owin.Server.Adapters.Http11ProtocolOwinAdapter' OpenSSL.SSL.SslProtocols' OpenSSL.ConnectionEnd' Microsoft.Http2.Owin.Server.Adapters.Http2OwinMessageHandler' OpenSSL.Core.BIO
