Project,Namespace,Ca types,Ce types
OxyPlot(netstandard1.0),OxyPlot.Annotations,OxyPlot.PlotModel,OxyPlot.Axes.Axis' OxyPlot.ITransposablePlotElement' OxyPlot.PlotElement' OxyPlot.TransposablePlotElementExtensions' OxyPlot.OxyRect' OxyPlot.IRenderContext' OxyPlot.ScreenPoint' OxyPlot.DataPoint' OxyPlot.HitTestArguments' OxyPlot.HitTestResult' OxyPlot.HorizontalAlignment' OxyPlot.LineJoin' OxyPlot.LineStyle' OxyPlot.OxyColor' OxyPlot.OxyColors' OxyPlot.ScreenPointHelper' OxyPlot.ScreenVector' OxyPlot.VerticalAlignment' OxyPlot.PlotLength' OxyPlot.PlotLengthUnit' OxyPlot.OxyImage' OxyPlot.PlotModel' OxyPlot.Axes.LinearAxis' OxyPlot.CohenSutherlandClipping' OxyPlot.MarkerType' OxyPlot.IInterpolationAlgorithm' OxyPlot.OxySize' OxyPlot.OxyThickness
OxyPlot(netstandard1.0),OxyPlot.Axes,OxyPlot.PlotModel' OxyPlot.Annotations.Annotation' OxyPlot.PlotManipulator<T>' OxyPlot.Series.BoxPlotSeries' OxyPlot.Series.CandleStickAndVolumeSeries' OxyPlot.Series.PieSeries' OxyPlot.Series.HighLowSeries' OxyPlot.Series.HeatMapSeries' OxyPlot.Series.RectangleSeries' OxyPlot.Series.Series' OxyPlot.Series.ScatterSeries' OxyPlot.Series.ScatterSeries<T>' OxyPlot.Series.BarSeries' OxyPlot.TrackerHitResult' OxyPlot.ITransposablePlotElement' OxyPlot.Series.IntervalBarSeries' OxyPlot.Series.TornadoBarSeries' OxyPlot.Series.XYAxisSeries' OxyPlot.Series.DataPointSeries' OxyPlot.Series.AreaSeries' OxyPlot.Series.CategorizedSeries' OxyPlot.Annotations.LineAnnotation,OxyPlot.DataPoint' OxyPlot.LineStyle' OxyPlot.OxyRect' OxyPlot.IRenderContext' OxyPlot.ScreenPoint' OxyPlot.PlotElement' OxyPlot.PlotModel' OxyPlot.FontWeights' OxyPlot.OxyColor' OxyPlot.OxyColors' OxyPlot.OxySize' OxyPlot.Series.Series' OxyPlot.Series.CategorizedSeries' OxyPlot.Series.IStackableSeries' OxyPlot.OxyPalette' OxyPlot.IPlotElement' OxyPlot.FractionHelper' OxyPlot.ImageFormat' OxyPlot.OxyImage' OxyPlot.OxyPalettes' OxyPlot.HorizontalAlignment' OxyPlot.VerticalAlignment' OxyPlot.OxyPen
OxyPlot(netstandard1.0),OxyPlot,OxyPlot.Series.ItemsSeries' OxyPlot.Series.IntervalBarItem' OxyPlot.Series.RectangleBarItem' OxyPlot.Series.HistogramItem' OxyPlot.Series.PieSlice' OxyPlot.Series.ErrorBarItem' OxyPlot.Series.ScatterErrorPoint' OxyPlot.Series.TornadoBarItem' OxyPlot.Series.RectangleItem' OxyPlot.Series.HighLowItem' OxyPlot.Series.ScatterPoint' OxyPlot.Series.BarItem' OxyPlot.Axes.AngleAxis' OxyPlot.Annotations.ArrowAnnotation' OxyPlot.Annotations.TextualAnnotation' OxyPlot.Annotations.PolygonAnnotation' OxyPlot.Annotations.PolylineAnnotation' OxyPlot.Axes.MagnitudeAxis' OxyPlot.Annotations.FunctionAnnotation' OxyPlot.Axes.DateTimeAxis' OxyPlot.Axes.Axis' OxyPlot.Annotations.LineAnnotation' OxyPlot.Series.BarSeries' OxyPlot.Series.XYAxisSeries' OxyPlot.Series.IntervalBarSeries' OxyPlot.Series.RectangleBarSeries' OxyPlot.Series.TornadoBarSeries' OxyPlot.Series.AreaSeries' OxyPlot.Series.LinearBarSeries' OxyPlot.Series.BoxPlotSeries' OxyPlot.Series.CandleStickAndVolumeSeries' OxyPlot.Series.CandleStickSeries' OxyPlot.Series.FunctionSeries' OxyPlot.Series.TwoColorAreaSeries' OxyPlot.Series.VolumeSeries' OxyPlot.Series.HeatMapSeries' OxyPlot.Series.HighLowSeries' OxyPlot.Series.RectangleSeries' OxyPlot.Series.StemSeries' OxyPlot.Series.DataPointSeries' OxyPlot.Series.HistogramSeries' OxyPlot.Series.StairStepSeries' OxyPlot.Series.ContourSeries' OxyPlot.Series.ScatterSeries<T>' OxyPlot.Series.LineSeries' OxyPlot.Annotations.PointAnnotation' OxyPlot.Annotations.ImageAnnotation' OxyPlot.Annotations.EllipseAnnotation' OxyPlot.Annotations.TextAnnotation' OxyPlot.Legends.Legend' OxyPlot.Annotations.PathAnnotation' OxyPlot.Series.Series' OxyPlot.Annotations.RectangleAnnotation' OxyPlot.Legends.LegendBase' OxyPlot.Axes.LinearColorAxis' OxyPlot.Series.PieSeries' OxyPlot.Axes.IColorAxis' OxyPlot.Annotations.Annotation' OxyPlot.Axes.AngleAxisRenderer' OxyPlot.Axes.AngleAxisFullPlotAreaRenderer' OxyPlot.Axes.MagnitudeAxisRenderer' OxyPlot.Axes.HorizontalAndVerticalAxisRenderer' OxyPlot.Axes.MagnitudeAxisFullPlotAreaRenderer' OxyPlot.Axes.AxisRendererBase' OxyPlot.Series.ErrorBarSeries' OxyPlot.Series.OldCandleStickSeries' OxyPlot.Series.ScatterErrorSeries' OxyPlot.Axes.MagnitudeAxisFullPlotArea' OxyPlot.Series.TwoColorLineSeries' OxyPlot.Series.ThreeColorLineSeries' OxyPlot.Axes.ColorAxisExtensions' OxyPlot.Annotations.ShapeAnnotation' OxyPlot.Axes.CategoryColorAxis' OxyPlot.Axes.RangeColorAxis' OxyPlot.Axes.AngleAxisFullPlotArea' OxyPlot.Axes.LogarithmicAxis' OxyPlot.Axes.LinearAxis' OxyPlot.Series.ScatterSeries,OxyPlot.Axes.Axis' OxyPlot.Series.Series' OxyPlot.Series.XYAxisSeries' OxyPlot.Annotations.Annotation' OxyPlot.Annotations.AnnotationLayer' OxyPlot.Axes.AngleAxis' OxyPlot.Axes.AxisLayer' OxyPlot.Axes.AxisPosition' OxyPlot.Axes.CategoryAxis' OxyPlot.Axes.IColorAxis' OxyPlot.Axes.LinearAxis' OxyPlot.Axes.MagnitudeAxis' OxyPlot.Legends.LegendBase' OxyPlot.Series.BarSeries' OxyPlot.Series.HistogramItem
OxyPlot(netstandard1.0),OxyPlot.Legends,OxyPlot.PlotModel,OxyPlot.HitTestArguments' OxyPlot.HitTestResult' OxyPlot.SelectionMode' OxyPlot.FontWeights' OxyPlot.HorizontalAlignment' OxyPlot.OxyColor' OxyPlot.OxyColors' OxyPlot.OxyRect' OxyPlot.ScreenPoint' OxyPlot.Series.Series' OxyPlot.PlotElement' OxyPlot.OxySize' OxyPlot.IRenderContext
OxyPlot(netstandard1.0),OxyPlot.Series,OxyPlot.PlotModel' OxyPlot.Axes.CategoryAxis' OxyPlot.HistogramHelpers' OxyPlot.TouchTrackerManipulator' OxyPlot.Axes.Axis' OxyPlot.Legends.Legend' OxyPlot.TrackerManipulator' OxyPlot.TrackerHitResult,OxyPlot.Axes.Axis' OxyPlot.DataPoint' OxyPlot.TrackerHitResult' OxyPlot.LineStyle' OxyPlot.OxyColor' OxyPlot.OxyColors' OxyPlot.OxyRect' OxyPlot.IRenderContext' OxyPlot.ScreenPoint' OxyPlot.ScreenPointHelper' OxyPlot.ListBuilder<T>' OxyPlot.StringHelper' OxyPlot.CodeGenerator' OxyPlot.ICodeGenerating' OxyPlot.Axes.CategoryAxis' OxyPlot.HorizontalAlignment' OxyPlot.ScreenVector' OxyPlot.VerticalAlignment' OxyPlot.LineJoin' OxyPlot.ComparerHelper' OxyPlot.MarkerType' OxyPlot.ArrayBuilder' OxyPlot.Conrec' OxyPlot.IDataPointProvider' OxyPlot.Axes.LinearAxis' OxyPlot.Axes.IColorAxis' OxyPlot.ImageFormat' OxyPlot.OxyImage' OxyPlot.PlotModel' OxyPlot.CodeGenerationAttribute' OxyPlot.IInterpolationAlgorithm' OxyPlot.PlotElement' OxyPlot.HitTestArguments' OxyPlot.HitTestResult' OxyPlot.ITransposablePlotElement
