Project,Namespace,Ca types,Ce types
Newtonsoft.Json(net45),Newtonsoft.Json.Bson,Newtonsoft.Json.Converters.BsonObjectIdConverter' Newtonsoft.Json.Converters.RegexConverter,Newtonsoft.Json.Utilities.DateTimeUtils' Newtonsoft.Json.Utilities.MathUtils' Newtonsoft.Json.Utilities.ValidationUtils' Newtonsoft.Json.FloatParseHandling' Newtonsoft.Json.JsonReader' Newtonsoft.Json.State' Newtonsoft.Json.JsonReaderException' Newtonsoft.Json.JsonToken' Newtonsoft.Json.Serialization.JsonTypeReflector' Newtonsoft.Json.JsonWriter' Newtonsoft.Json.JsonWriterException
Newtonsoft.Json(net45),Newtonsoft.Json,Newtonsoft.Json.Serialization.JsonSerializerProxy' Newtonsoft.Json.Serialization.JsonSerializerInternalReader' Newtonsoft.Json.Linq.JsonPath.BooleanQueryExpression' Newtonsoft.Json.Utilities.DateTimeUtils' Newtonsoft.Json.Serialization.CamelCasePropertyNamesContractResolver' Newtonsoft.Json.Serialization.DefaultContractResolver' Newtonsoft.Json.Serialization.JsonProperty' Newtonsoft.Json.Serialization.JsonObjectContract' Newtonsoft.Json.Schema.JsonSchemaGenerator' Newtonsoft.Json.Serialization.JsonSerializerInternalWriter' Newtonsoft.Json.Bson.BsonReader' Newtonsoft.Json.Serialization.TraceJsonWriter' Newtonsoft.Json.Schema.JsonSchema' Newtonsoft.Json.Serialization.TraceJsonReader' Newtonsoft.Json.Utilities.StringBuffer' Newtonsoft.Json.Utilities.BufferUtils' Newtonsoft.Json.Utilities.JavaScriptUtils' Newtonsoft.Json.Linq.JArray' Newtonsoft.Json.Linq.JConstructor' Newtonsoft.Json.Linq.JContainer' Newtonsoft.Json.Linq.JObject' Newtonsoft.Json.Linq.JProperty' Newtonsoft.Json.Linq.JToken' Newtonsoft.Json.Serialization.JsonSerializerInternalBase' Newtonsoft.Json.Linq.JTokenReader' Newtonsoft.Json.Serialization.JsonTypeReflector' Newtonsoft.Json.Serialization.JsonContainerContract' Newtonsoft.Json.Converters.KeyValuePairConverter' Newtonsoft.Json.Converters.DateTimeConverterBase' Newtonsoft.Json.Converters.DataSetConverter' Newtonsoft.Json.Converters.BinaryConverter' Newtonsoft.Json.Converters.EntityKeyMemberConverter' Newtonsoft.Json.Converters.DiscriminatedUnionConverter' Newtonsoft.Json.Converters.RegexConverter' Newtonsoft.Json.Converters.ExpandoObjectConverter' Newtonsoft.Json.Converters.CustomCreationConverter<T>' Newtonsoft.Json.Converters.VersionConverter' Newtonsoft.Json.Converters.StringEnumConverter' Newtonsoft.Json.Converters.XmlNodeConverter' Newtonsoft.Json.Linq.JValue' Newtonsoft.Json.Serialization.JsonContract' Newtonsoft.Json.Converters.BsonObjectIdConverter' Newtonsoft.Json.Converters.DataTableConverter' Newtonsoft.Json.Schema.JsonSchemaException' Newtonsoft.Json.Linq.JsonPath.ArrayIndexFilter' Newtonsoft.Json.Linq.JsonPath.FieldFilter' Newtonsoft.Json.Serialization.DefaultReferenceResolver' Newtonsoft.Json.Linq.JsonPath.FieldMultipleFilter' Newtonsoft.Json.Linq.JsonPath.ArraySliceFilter' Newtonsoft.Json.Schema.JsonSchemaBuilder' Newtonsoft.Json.Linq.JsonPath.PathFilter' Newtonsoft.Json.Linq.JsonPath.JPath' Newtonsoft.Json.Serialization.CamelCaseNamingStrategy' Newtonsoft.Json.Serialization.NamingStrategy' Newtonsoft.Json.Serialization.SnakeCaseNamingStrategy' Newtonsoft.Json.Serialization.KebabCaseNamingStrategy' Newtonsoft.Json.Converters.IsoDateTimeConverter' Newtonsoft.Json.Converters.UnixDateTimeConverter' Newtonsoft.Json.Converters.JavaScriptDateTimeConverter' Newtonsoft.Json.Linq.JRaw' Newtonsoft.Json.Linq.JTokenWriter' Newtonsoft.Json.Linq.DuplicatePropertyNameHandling' Newtonsoft.Json.Serialization.JsonPropertyCollection' Newtonsoft.Json.Serialization.DefaultSerializationBinder' Newtonsoft.Json.Serialization.DynamicValueProvider' Newtonsoft.Json.Serialization.ExpressionValueProvider' Newtonsoft.Json.Serialization.ReflectionValueProvider' Newtonsoft.Json.Serialization.JsonPrimitiveContract' Newtonsoft.Json.Bson.BsonWriter' Newtonsoft.Json.Utilities.JsonTokenUtils' Newtonsoft.Json.Schema.Extensions' Newtonsoft.Json.Schema.JsonSchemaWriter' Newtonsoft.Json.Utilities.ReflectionUtils,Newtonsoft.Json.Serialization.NamingStrategy' Newtonsoft.Json.Converters.XmlNodeConverter' Newtonsoft.Json.Linq.JToken' Newtonsoft.Json.Utilities.PrimitiveTypeCode' Newtonsoft.Json.Utilities.ConvertUtils' Newtonsoft.Json.Utilities.DateTimeUtils' Newtonsoft.Json.Utilities.JavaScriptUtils' Newtonsoft.Json.Utilities.StringUtils' Newtonsoft.Json.Utilities.ValidationUtils' System.Diagnostics.CodeAnalysis.MaybeNullAttribute' Newtonsoft.Json.Utilities.ReflectionUtils' System.Diagnostics.CodeAnalysis.AllowNullAttribute' Newtonsoft.Json.Utilities.MathUtils' Newtonsoft.Json.Utilities.AsyncUtils' Newtonsoft.Json.Utilities.JsonTokenUtils' Newtonsoft.Json.Serialization.DefaultContractResolver' Newtonsoft.Json.Serialization.DefaultReferenceResolver' Newtonsoft.Json.Serialization.DefaultSerializationBinder' Newtonsoft.Json.Serialization.ErrorEventArgs' Newtonsoft.Json.Serialization.IContractResolver' Newtonsoft.Json.Serialization.IReferenceResolver' Newtonsoft.Json.Serialization.ISerializationBinder' Newtonsoft.Json.Serialization.ITraceWriter' Newtonsoft.Json.Serialization.JsonSerializerInternalReader' Newtonsoft.Json.Serialization.JsonSerializerInternalWriter' Newtonsoft.Json.Serialization.SerializationBinderAdapter' Newtonsoft.Json.Serialization.TraceJsonReader' Newtonsoft.Json.Serialization.TraceJsonWriter' Newtonsoft.Json.Utilities.CollectionUtils' Newtonsoft.Json.Serialization.JsonTypeReflector' Newtonsoft.Json.Utilities.MiscellaneousUtils' Newtonsoft.Json.Utilities.StringReference' Newtonsoft.Json.Utilities.BufferUtils' Newtonsoft.Json.Linq.JTokenType' Newtonsoft.Json.Linq.JTokenWriter' Newtonsoft.Json.Linq.JValue' Newtonsoft.Json.Schema.JsonSchema' Newtonsoft.Json.Schema.JsonSchemaException' Newtonsoft.Json.Schema.JsonSchemaGenerator' Newtonsoft.Json.Schema.JsonSchemaModel' Newtonsoft.Json.Schema.JsonSchemaModelBuilder' Newtonsoft.Json.Schema.JsonSchemaType' Newtonsoft.Json.Schema.ValidationEventArgs
Newtonsoft.Json(net45),Newtonsoft.Json.Converters,Newtonsoft.Json.Serialization.DefaultContractResolver' Newtonsoft.Json.JsonConvert,Newtonsoft.Json.JsonConverter' Newtonsoft.Json.JsonReader' Newtonsoft.Json.JsonSerializationException' Newtonsoft.Json.JsonSerializer' Newtonsoft.Json.JsonToken' Newtonsoft.Json.JsonWriter' Newtonsoft.Json.Utilities.MiscellaneousUtils' Newtonsoft.Json.Utilities.ReflectionObject' Newtonsoft.Json.Utilities.ReflectionUtils' Newtonsoft.Json.Bson.BsonObjectId' Newtonsoft.Json.Bson.BsonWriter' Newtonsoft.Json.Serialization.DefaultContractResolver' Newtonsoft.Json.NullValueHandling' Newtonsoft.Json.Linq.JArray' Newtonsoft.Json.Linq.JToken' Newtonsoft.Json.Utilities.FSharpFunction' Newtonsoft.Json.Utilities.FSharpUtils' Newtonsoft.Json.Utilities.ThreadSafeStore<TKey;TValue>' Newtonsoft.Json.Serialization.JsonSerializerInternalWriter' Newtonsoft.Json.Utilities.JsonTokenUtils' Newtonsoft.Json.Utilities.StringUtils' Newtonsoft.Json.Utilities.DateTimeUtils' Newtonsoft.Json.Utilities.JavaScriptUtils' Newtonsoft.Json.Serialization.JsonContract' Newtonsoft.Json.Serialization.CamelCaseNamingStrategy' Newtonsoft.Json.Serialization.JsonTypeReflector' Newtonsoft.Json.Serialization.NamingStrategy' Newtonsoft.Json.Utilities.ConvertUtils' Newtonsoft.Json.Utilities.EnumUtils' Newtonsoft.Json.Utilities.ValidationUtils' System.Diagnostics.CodeAnalysis.NotNullWhenAttribute
Newtonsoft.Json(net45),Newtonsoft.Json.Linq,Newtonsoft.Json.Linq.JsonPath.ArrayIndexFilter' Newtonsoft.Json.Linq.JsonPath.PathFilter' Newtonsoft.Json.Converters.DiscriminatedUnionConverter' Newtonsoft.Json.Linq.JsonPath.ArraySliceFilter' Newtonsoft.Json.Linq.JsonPath.ScanFilter' Newtonsoft.Json.Linq.JsonPath.QueryScanFilter' Newtonsoft.Json.Linq.JsonPath.ScanMultipleFilter' Newtonsoft.Json.Linq.JsonPath.FieldFilter' Newtonsoft.Json.Schema.JsonSchemaBuilder' Newtonsoft.Json.Serialization.JsonSerializerInternalReader' Newtonsoft.Json.Linq.JsonPath.FieldMultipleFilter' Newtonsoft.Json.JsonConvert' Newtonsoft.Json.JsonValidatingReader' Newtonsoft.Json.Linq.JsonPath.ArrayMultipleIndexFilter' Newtonsoft.Json.Linq.JsonPath.QueryFilter' Newtonsoft.Json.Linq.JsonPath.JPath' Newtonsoft.Json.Linq.JsonPath.RootFilter' Newtonsoft.Json.Schema.JsonSchema' Newtonsoft.Json.Linq.JsonPath.QueryExpression' Newtonsoft.Json.Linq.JsonPath.CompositeExpression' Newtonsoft.Json.Linq.JsonPath.BooleanQueryExpression' Newtonsoft.Json.Schema.JsonSchemaWriter' Newtonsoft.Json.Serialization.JsonObjectContract' Newtonsoft.Json.Serialization.JsonFormatterConverter' Newtonsoft.Json.Schema.JsonSchemaGenerator' Newtonsoft.Json.Schema.JsonSchemaModel' Newtonsoft.Json.Schema.Extensions' Newtonsoft.Json.Serialization.JsonSerializerInternalWriter' Newtonsoft.Json.Serialization.DefaultContractResolver,Newtonsoft.Json.JsonReaderException' Newtonsoft.Json.Utilities.ReflectionUtils' Newtonsoft.Json.Utilities.ValidationUtils' System.Diagnostics.CodeAnalysis.MaybeNullAttribute' Newtonsoft.Json.IJsonLineInfo' Newtonsoft.Json.JsonConverter' Newtonsoft.Json.JsonReader' Newtonsoft.Json.JsonToken' Newtonsoft.Json.JsonWriter' Newtonsoft.Json.Utilities.MiscellaneousUtils' Newtonsoft.Json.Utilities.DynamicProxy<T>' System.Diagnostics.CodeAnalysis.NotNullWhenAttribute' Newtonsoft.Json.JsonTextWriter' Newtonsoft.Json.State' Newtonsoft.Json.Utilities.DateTimeUtils' Newtonsoft.Json.Utilities.StringUtils' Newtonsoft.Json.Utilities.AsyncUtils' Newtonsoft.Json.JsonSerializer' Newtonsoft.Json.Utilities.ConvertUtils
Newtonsoft.Json(net45),Newtonsoft.Json.Linq.JsonPath,,Newtonsoft.Json.JsonException' Newtonsoft.Json.Linq.JArray' Newtonsoft.Json.Linq.JConstructor' Newtonsoft.Json.Linq.JToken' Newtonsoft.Json.Linq.JObject' Newtonsoft.Json.Linq.JValue' Newtonsoft.Json.Utilities.ValidationUtils' Newtonsoft.Json.DateFormatHandling' Newtonsoft.Json.Linq.JTokenType' Newtonsoft.Json.Utilities.CollectionUtils' Newtonsoft.Json.Utilities.DateTimeUtils' Newtonsoft.Json.Utilities.MiscellaneousUtils' Newtonsoft.Json.Utilities.StringUtils' Newtonsoft.Json.Linq.JContainer' Newtonsoft.Json.Linq.JProperty
Newtonsoft.Json(net45),Newtonsoft.Json.Schema,Newtonsoft.Json.JsonValidatingReader,Newtonsoft.Json.JsonValidatingReader' Newtonsoft.Json.Linq.JToken' Newtonsoft.Json.Utilities.ValidationUtils' Newtonsoft.Json.Formatting' Newtonsoft.Json.JsonReader' Newtonsoft.Json.JsonTextReader' Newtonsoft.Json.JsonTextWriter' Newtonsoft.Json.JsonWriter' Newtonsoft.Json.JsonException' Newtonsoft.Json.Linq.JObject' Newtonsoft.Json.Linq.JProperty' Newtonsoft.Json.Linq.JTokenType' Newtonsoft.Json.Serialization.JsonTypeReflector' Newtonsoft.Json.Utilities.StringUtils' Newtonsoft.Json.DefaultValueHandling' Newtonsoft.Json.JsonArrayAttribute' Newtonsoft.Json.JsonContainerAttribute' Newtonsoft.Json.JsonConverter' Newtonsoft.Json.NullValueHandling' Newtonsoft.Json.Required' Newtonsoft.Json.Serialization.DefaultContractResolver' Newtonsoft.Json.Serialization.IContractResolver' Newtonsoft.Json.Serialization.JsonContractType' Newtonsoft.Json.Serialization.JsonContract' Newtonsoft.Json.Serialization.JsonISerializableContract' Newtonsoft.Json.Serialization.JsonObjectContract' Newtonsoft.Json.Serialization.JsonProperty' Newtonsoft.Json.Utilities.PrimitiveTypeCode' Newtonsoft.Json.Utilities.ConvertUtils' Newtonsoft.Json.Utilities.EnumInfo' Newtonsoft.Json.Utilities.EnumUtils' Newtonsoft.Json.Utilities.ReflectionUtils' Newtonsoft.Json.Utilities.MathUtils
Newtonsoft.Json(net45),Newtonsoft.Json.Serialization,Newtonsoft.Json.Utilities.EnumUtils' Newtonsoft.Json.Converters.StringEnumConverter' Newtonsoft.Json.MemberSerialization' Newtonsoft.Json.Schema.JsonSchemaGenerator' Newtonsoft.Json.Converters.DataTableConverter' Newtonsoft.Json.Converters.DataSetConverter' Newtonsoft.Json.Converters.DiscriminatedUnionConverter' Newtonsoft.Json.Converters.RegexConverter' Newtonsoft.Json.Converters.EntityKeyMemberConverter' Newtonsoft.Json.Converters.KeyValuePairConverter' Newtonsoft.Json.JsonSerializer' Newtonsoft.Json.JsonSerializerSettings' Newtonsoft.Json.Utilities.ReflectionUtils' Newtonsoft.Json.Schema.JsonSchemaWriter' Newtonsoft.Json.Utilities.ReflectionObject' Newtonsoft.Json.Bson.BsonReader' Newtonsoft.Json.Schema.JsonSchemaBuilder' Newtonsoft.Json.Utilities.ImmutableCollectionsUtils' Newtonsoft.Json.Utilities.DynamicUtils' Newtonsoft.Json.JsonTextReader' Newtonsoft.Json.Utilities.ConvertUtils' Newtonsoft.Json.Utilities.FSharpUtils' Newtonsoft.Json.Converters.XmlNodeConverter' Newtonsoft.Json.JsonPropertyAttribute' Newtonsoft.Json.JsonContainerAttribute,Newtonsoft.Json.Utilities.ThreadSafeStore<TKey;TValue>' Newtonsoft.Json.JsonPropertyAttribute' Newtonsoft.Json.Utilities.StringUtils' Newtonsoft.Json.DefaultJsonNameTable' Newtonsoft.Json.Utilities.StructMultiKey' Newtonsoft.Json.DefaultValueHandling' Newtonsoft.Json.JsonArrayAttribute' Newtonsoft.Json.JsonConstructorAttribute' Newtonsoft.Json.JsonContainerAttribute' Newtonsoft.Json.JsonConverter' Newtonsoft.Json.JsonDictionaryAttribute' Newtonsoft.Json.JsonException' Newtonsoft.Json.JsonExtensionDataAttribute' Newtonsoft.Json.JsonIgnoreAttribute' Newtonsoft.Json.JsonObjectAttribute' Newtonsoft.Json.JsonRequiredAttribute' Newtonsoft.Json.JsonSerializationException' Newtonsoft.Json.JsonSerializer' Newtonsoft.Json.MemberSerialization' Newtonsoft.Json.Required' Newtonsoft.Json.Converters.BinaryConverter' Newtonsoft.Json.Converters.BsonObjectIdConverter' Newtonsoft.Json.Converters.DataSetConverter' Newtonsoft.Json.Converters.DataTableConverter' Newtonsoft.Json.Converters.DiscriminatedUnionConverter' Newtonsoft.Json.Converters.EntityKeyMemberConverter' Newtonsoft.Json.Converters.ExpandoObjectConverter' Newtonsoft.Json.Converters.KeyValuePairConverter' Newtonsoft.Json.Converters.RegexConverter' Newtonsoft.Json.Converters.XmlNodeConverter' Newtonsoft.Json.Linq.JToken' Newtonsoft.Json.Utilities.CollectionUtils' Newtonsoft.Json.Utilities.PrimitiveTypeCode' Newtonsoft.Json.Utilities.ConvertUtils' Newtonsoft.Json.Utilities.FSharpUtils' Newtonsoft.Json.Utilities.ReflectionUtils' Newtonsoft.Json.Utilities.ValidationUtils' Newtonsoft.Json.Utilities.BidirectionalDictionary<TFirst;TSecond>' Newtonsoft.Json.Utilities.DynamicReflectionDelegateFactory' Newtonsoft.Json.Utilities.ExpressionReflectionDelegateFactory' Newtonsoft.Json.Utilities.IWrappedCollection' Newtonsoft.Json.Utilities.CollectionWrapper<T>' Newtonsoft.Json.Utilities.ImmutableCollectionsUtils' Newtonsoft.Json.Utilities.MiscellaneousUtils' Newtonsoft.Json.ReferenceLoopHandling' Newtonsoft.Json.TypeNameHandling' Newtonsoft.Json.ReadType' Newtonsoft.Json.Utilities.IWrappedDictionary' Newtonsoft.Json.Utilities.DictionaryWrapper<TKey;TValue>' Newtonsoft.Json.Utilities.DynamicUtils' Newtonsoft.Json.Utilities.BinderWrapper' Newtonsoft.Json.Utilities.NoThrowGetBinderMember' Newtonsoft.Json.Utilities.NoThrowSetBinderMember' Newtonsoft.Json.Utilities.NoThrowExpressionVisitor' Newtonsoft.Json.Linq.JValue' Newtonsoft.Json.MissingMemberHandling' Newtonsoft.Json.NullValueHandling' Newtonsoft.Json.JsonWriter' Newtonsoft.Json.ObjectCreationHandling' Newtonsoft.Json.Utilities.JavaScriptUtils' System.Diagnostics.CodeAnalysis.NotNullWhenAttribute' Newtonsoft.Json.IJsonLineInfo' Newtonsoft.Json.JsonPosition' Newtonsoft.Json.ConstructorHandling' Newtonsoft.Json.JsonReader' Newtonsoft.Json.JsonToken' Newtonsoft.Json.MetadataPropertyHandling' Newtonsoft.Json.Linq.JObject' Newtonsoft.Json.Linq.JProperty' Newtonsoft.Json.Linq.JRaw' Newtonsoft.Json.Linq.JTokenReader' Newtonsoft.Json.Linq.JTokenType' Newtonsoft.Json.Linq.JTokenWriter' Newtonsoft.Json.Utilities.DateTimeUtils' Newtonsoft.Json.Utilities.EnumUtils' Newtonsoft.Json.Utilities.JsonTokenUtils' Newtonsoft.Json.PreserveReferencesHandling' Newtonsoft.Json.WriteState' Newtonsoft.Json.DateFormatHandling' Newtonsoft.Json.DateParseHandling' Newtonsoft.Json.DateTimeZoneHandling' Newtonsoft.Json.FloatFormatHandling' Newtonsoft.Json.FloatParseHandling' Newtonsoft.Json.Formatting' Newtonsoft.Json.JsonConverterCollection' Newtonsoft.Json.StringEscapeHandling' Newtonsoft.Json.TypeNameAssemblyFormatHandling' Newtonsoft.Json.JsonConverterAttribute' Newtonsoft.Json.Utilities.LateBoundReflectionDelegateFactory' Newtonsoft.Json.Utilities.ReflectionDelegateFactory' Newtonsoft.Json.Utilities.ReflectionObject' Newtonsoft.Json.JsonTextWriter
Newtonsoft.Json(net45),Newtonsoft.Json.Utilities,Newtonsoft.Json.JsonReader' Newtonsoft.Json.Linq.JTokenWriter' Newtonsoft.Json.Linq.JValue' Newtonsoft.Json.JsonTextReader' Newtonsoft.Json.JsonWriter' Newtonsoft.Json.Serialization.DefaultReferenceResolver' Newtonsoft.Json.Serialization.JsonSerializerInternalBase' Newtonsoft.Json.Linq.JsonPath.BooleanQueryExpression' Newtonsoft.Json.Serialization.JsonDictionaryContract' Newtonsoft.Json.Serialization.JsonArrayContract' Newtonsoft.Json.Serialization.JsonSerializerInternalWriter' Newtonsoft.Json.JsonSerializer' Newtonsoft.Json.Serialization.DefaultContractResolver' Newtonsoft.Json.Serialization.JsonSerializerInternalReader' Newtonsoft.Json.Serialization.JsonPrimitiveContract' Newtonsoft.Json.Schema.JsonSchemaGenerator' Newtonsoft.Json.JsonConvert' Newtonsoft.Json.Converters.StringEnumConverter' Newtonsoft.Json.Serialization.JsonContract' Newtonsoft.Json.Linq.JValueDynamicProxy' Newtonsoft.Json.JsonTextWriter' Newtonsoft.Json.Bson.BsonWriter' Newtonsoft.Json.Converters.JavaScriptDateTimeConverter' Newtonsoft.Json.Bson.BsonBinaryWriter' Newtonsoft.Json.Linq.JTokenReader' Newtonsoft.Json.Bson.BsonReader' Newtonsoft.Json.Converters.XmlNodeConverter' Newtonsoft.Json.Linq.JObjectDynamicProxy' Newtonsoft.Json.Serialization.JsonTypeReflector' Newtonsoft.Json.Serialization.DynamicValueProvider' Newtonsoft.Json.Serialization.JsonDynamicContract' Newtonsoft.Json.Schema.JsonSchemaWriter' Newtonsoft.Json.Serialization.ExpressionValueProvider' Newtonsoft.Json.Converters.DiscriminatedUnionConverter' Newtonsoft.Json.JsonPosition' Newtonsoft.Json.Serialization.JsonProperty' Newtonsoft.Json.Converters.ExpandoObjectConverter' Newtonsoft.Json.JsonValidatingReader' Newtonsoft.Json.Schema.JsonSchemaModel' Newtonsoft.Json.Converters.RegexConverter' Newtonsoft.Json.Converters.BinaryConverter' Newtonsoft.Json.Converters.XDocumentWrapper' Newtonsoft.Json.Linq.JPropertyList' Newtonsoft.Json.Linq.JContainer' Newtonsoft.Json.Converters.EntityKeyMemberConverter' Newtonsoft.Json.Serialization.JsonPropertyCollection' Newtonsoft.Json.Converters.KeyValuePairConverter' Newtonsoft.Json.Linq.Extensions' Newtonsoft.Json.JsonConverter<T>' Newtonsoft.Json.Converters.IsoDateTimeConverter' Newtonsoft.Json.Serialization.DefaultSerializationBinder' Newtonsoft.Json.Serialization.ReflectionAttributeProvider' Newtonsoft.Json.Serialization.ReflectionValueProvider' Newtonsoft.Json.Converters.UnixDateTimeConverter' Newtonsoft.Json.Schema.JsonSchemaBuilder' Newtonsoft.Json.Serialization.CamelCaseNamingStrategy' Newtonsoft.Json.Serialization.KebabCaseNamingStrategy' Newtonsoft.Json.Serialization.SnakeCaseNamingStrategy' Newtonsoft.Json.Converters.XElementWrapper' Newtonsoft.Json.Serialization.CamelCasePropertyNamesContractResolver' Newtonsoft.Json.Serialization.CachedAttributeGetter<T>' Newtonsoft.Json.Bson.BsonObjectId' Newtonsoft.Json.Linq.JEnumerable' Newtonsoft.Json.Linq.JObject' Newtonsoft.Json.Linq.JsonPath.JPath' Newtonsoft.Json.Linq.JToken' Newtonsoft.Json.Schema.Extensions' Newtonsoft.Json.Schema.ValidationEventArgs' Newtonsoft.Json.Schema.JsonSchema' Newtonsoft.Json.Serialization.JsonSerializerProxy' Newtonsoft.Json.Serialization.JsonFormatterConverter,Newtonsoft.Json.Serialization.JsonTypeReflector' System.Diagnostics.CodeAnalysis.NotNullWhenAttribute' Newtonsoft.Json.DateFormatHandling' Newtonsoft.Json.DateTimeZoneHandling' System.Diagnostics.CodeAnalysis.MaybeNullAttribute' Newtonsoft.Json.Serialization.CamelCaseNamingStrategy' Newtonsoft.Json.Serialization.NamingStrategy' Newtonsoft.Json.IArrayPool' Newtonsoft.Json.JsonReader' Newtonsoft.Json.JsonTextWriter' Newtonsoft.Json.JsonToken' Newtonsoft.Json.StringEscapeHandling' System.Diagnostics.CodeAnalysis.DoesNotReturnIfAttribute' Newtonsoft.Json.TypeNameAssemblyFormatHandling' Newtonsoft.Json.Serialization.ISerializationBinder' System.Diagnostics.CodeAnalysis.NotNullAttribute
Newtonsoft.Json(net45),System.Diagnostics.CodeAnalysis,Newtonsoft.Json.Utilities.ValidationUtils' Newtonsoft.Json.Serialization.JsonPropertyCollection' Newtonsoft.Json.Linq.JPropertyKeyedCollection' Newtonsoft.Json.Utilities.JavaScriptUtils' Newtonsoft.Json.Utilities.EnumUtils' Newtonsoft.Json.Utilities.ImmutableCollectionsUtils' Newtonsoft.Json.Utilities.StringUtils' Newtonsoft.Json.Utilities.TypeExtensions' Newtonsoft.Json.Utilities.ReflectionUtils' Newtonsoft.Json.Converters.XmlNodeConverter' Newtonsoft.Json.Linq.JValueDynamicProxy' Newtonsoft.Json.Utilities.ConvertUtils' Newtonsoft.Json.Serialization.JsonSerializerInternalReader' Newtonsoft.Json.Serialization.JsonSerializerInternalWriter' Newtonsoft.Json.Utilities.DictionaryWrapper<TKey;TValue>' Newtonsoft.Json.Linq.Extensions' Newtonsoft.Json.JsonSerializer' Newtonsoft.Json.JsonConvert' Newtonsoft.Json.JsonConverter<T>' Newtonsoft.Json.Utilities.MiscellaneousUtils,
