Project,Namespace,Ca types,Ce types
Forge.Networking,Forge.Networking.AutomaticTurnGame,,Forge.Networking.Core.NetworkContext' Forge.Networking.Core.NetworkMessageRecipient' Forge.Networking.Core.Player' Forge.Networking.Core.INetworkMessage
Forge.Networking,Forge.Networking.Chat,,Forge.Networking.Core.Player' Forge.Networking.Core.NetworkContext' Forge.Networking.Core.INetworkMessage' Forge.Utilities.Maybe' Forge.Networking.Core.NetworkMessageRecipient
Forge.Networking,Forge.Networking.Core,NetworkDebug.Form1' Forge.Networking.AutomaticTurnGame.AutomaticTurnGame' Forge.Networking.AutomaticTurnGame.GameServerHandler' Forge.Networking.Chat.ChatManager' Forge.Networking.Lobby.LobbyHost' Forge.Networking.Lobby.MapDownloadServerMessageHandler' Forge.Networking.Lobby.MapDownloadClientMessageHandler' Forge.Networking.Lobby.PlayerManager' Forge.Networking.AutomaticTurnGame.GameClientHandler' Forge.Networking.Chat.ChatMessageHandler' Forge.Networking.Chat.ReceivedChatMessage' Forge.Networking.Lobby.LobbyHostPlayerReadinessMessageHandler' Forge.Networking.Lobby.LobbyLaunchedHandler' Forge.Networking.Lobby.LobbyMember' Forge.Networking.Lobby.LobbyCommon' Forge.Networking.Pausing.PauseMessageHandler' Forge.Networking.Pausing.PauseManager,Forge.Utilities.Log' Forge.Utilities.SerializationHelpers' Forge.Utilities.Maybe
Forge.Networking,Forge.Networking.Lobby,NetworkDebug.Form1,Forge.Networking.Core.NetworkContext' Forge.Networking.Core.NetworkMessageRecipient' Forge.Networking.Core.Player' Forge.Networking.Core.INetworkMessage' Forge.Utilities.Contract' Forge.Utilities.Maybe' Forge.Utilities.Log
Forge.Networking,Forge.Networking.Pausing,,Forge.Networking.Core.NetworkContext' Forge.Utilities.Maybe' Forge.Networking.Core.Player
