Project,Namespace,Ca types,Ce types
ElasticLINQ,ElasticLinq.Response.Materializers,ElasticLinq.Test.Response.Materializers.AggregatesTests' ElasticLinq.Test.Response.Materializers.AggregatesTests' ElasticLinq.Test.Response.Materializers.TermlessFacetsElasticMaterializerTests' ElasticLinq.Test.Response.Materializers.ListTermlessFacetsElasticMaterializerTests' ElasticLinq.Test.Response.Materializers.ListTermFacetsElasticMaterializerTests' ElasticLinq.Test.Response.Materializers.ListTermFacetsElasticMaterializerTests' ElasticLinq.Test.Response.Materializers.ListTermlessFacetsElasticMaterializerTests' ElasticLinq.Test.Response.Materializers.TermlessFacetsElasticMaterializerTests' ElasticLinq.Test.Response.Materializers.HighlightMaterializerTests' ElasticLinq.Test.Response.Materializers.HighlightMaterializerTests' ElasticLinq.Request.Visitors.ElasticQueryTranslator' ElasticLinq.Test.Response.Materializers.AnyElasticMaterializerTests' ElasticLinq.Test.Response.Materializers.AnyElasticMaterializerTests' ElasticLinq.Test.Response.Materializers.CountElasticMaterializerTests' ElasticLinq.Test.Response.Materializers.CountElasticMaterializerTests' ElasticLinq.Request.Visitors.FacetExpressionVisitor' ElasticLinq.Test.Response.Materializers.ManyFacetsElasticMaterializerTests' ElasticLinq.Test.Response.Materializers.ManyFacetsElasticMaterializerTests' ElasticLinq.Test.Response.Materializers.OneHitElasticMaterializerTests' ElasticLinq.Test.Response.Materializers.OneHitElasticMaterializerTests' ElasticLinq.Test.Request.Visitors.ElasticTranslateResultTests' ElasticLinq.Test.Response.Materializers.ManyHitsElasticMaterializerTests' ElasticLinq.Test.Request.Visitors.ElasticTranslateResultTests' ElasticLinq.Test.Response.Materializers.ManyHitsElasticMaterializerTests' ElasticLinq.ElasticQueryProvider' ElasticLinq.Request.Visitors.FacetRebindCollectionResult' ElasticLinq.Request.Visitors.ElasticTranslateResult' ElasticLinq.Test.Request.Visitors.ElasticQueryTranslation.ElasticQueryTranslationTests,ElasticLinq.Utility.TypeHelper' ElasticLinq.Response.Model.Hits' ElasticLinq.Response.Model.ElasticResponse' ElasticLinq.Response.Model.Hit' ElasticLinq.Utility.Argument
ElasticLINQ,ElasticLinq.Retry,ElasticLinq.Test.TestableElasticContext' ElasticLinq.Test.Retry.RetryPolicyTests' ElasticLinq.Test.Retry.RetryPolicyTests' ElasticLinq.Test.ElasticContextTests' ElasticLinq.Test.ElasticContextTests' ElasticLinq.ElasticContext' ElasticLinq.ElasticQueryProvider' ElasticLinq.Request.ElasticRequestProcessor' ElasticLinq.Test.ElasticQueryProviderTests' ElasticLinq.Test.NullRetryPolicy' ElasticLinq.Test.Integration.BasicConnectionTests' ElasticLinq.Test.Request.ElasticRequestProcessorTests' ElasticLinq.Test.Request.Visitors.ElasticQueryTranslation.ElasticQueryTranslationTestsBase' ElasticLinq.Test.ElasticQueryProviderTests' ElasticLinq.Test.NullRetryPolicy' ElasticLinq.Test.Integration.BasicConnectionTests' ElasticLinq.Test.Request.ElasticRequestProcessorTests' ElasticLinq.Test.Request.Visitors.ElasticQueryTranslation.ElasticQueryTranslationTestsBase,ElasticLinq.Logging.ILog
ElasticLINQ,ElasticLinq.Test,ElasticLinq.Test.Async.AsyncQueryableEntityTests' ElasticLinq.Test.Async.AsyncQueryableAverageTests' ElasticLinq.Test.Async.AsyncQueryableSumTests' ElasticLinq.Test.Async.AsyncQueryableTests' ElasticLinq.Test.Test.TestableElasticQueryProviderTests' ElasticLinq.Test.Test.TestableElasticQueryTests' ElasticLinq.Test.Test.TestableElasticContextTests' ElasticLinq.Test.Async.AsyncQueryableAverageTests' ElasticLinq.Test.Async.AsyncQueryableEntityTests' ElasticLinq.Test.Async.AsyncQueryableSumTests' ElasticLinq.Test.Async.AsyncQueryableTests' ElasticLinq.Test.Test.TestableElasticContextTests' ElasticLinq.Test.Test.TestableElasticQueryProviderTests' ElasticLinq.Test.Test.TestableElasticQueryTests,ElasticLinq.Logging.NullLog' ElasticLinq.Retry.NullDelay' ElasticLinq.Mapping.IElasticMapping' ElasticLinq.Logging.ILog' ElasticLinq.Request.Visitors.ElasticTranslateResult' ElasticLinq.Request.Formatters.SearchRequestFormatter' ElasticLinq.Request.Visitors.ElasticQueryTranslator' ElasticLinq.ElasticConnection' ElasticLinq.Request.QueryInfo' ElasticLinq.Utility.Argument' ElasticLinq.Utility.TypeHelper' ElasticLinq.ElasticFields
ElasticLINQ,ElasticLinq.Utility,ElasticLinq.BaseElasticConnection' ElasticLinq.ElasticConnection' ElasticLinq.ElasticContext' ElasticLinq.ElasticQuery<T>' ElasticLinq.ElasticQueryExtensions' ElasticLinq.ElasticQueryProvider' ElasticLinq.Mapping.ElasticMapping' ElasticLinq.Mapping.MappingHelpers' ElasticLinq.Request.Criteria.AndCriteria' ElasticLinq.Request.Criteria.CompoundCriteria' ElasticLinq.Request.Criteria.NotCriteria' ElasticLinq.Request.Criteria.OrCriteria' ElasticLinq.Request.Criteria.RangeCriteria' ElasticLinq.Request.Criteria.RangeSpecificationCriteria' ElasticLinq.Request.Criteria.SingleFieldCriteria' ElasticLinq.Request.Criteria.QueryStringCriteria' ElasticLinq.Request.Criteria.TermsCriteria' ElasticLinq.Request.SortOption' ElasticLinq.Request.ElasticRequestProcessor' ElasticLinq.Request.Facets.FilterFacet' ElasticLinq.Request.Facets.StatisticalFacet' ElasticLinq.Request.Facets.TermsFacet' ElasticLinq.Request.Facets.TermsStatsFacet' ElasticLinq.Request.Formatters.SearchRequestFormatter' ElasticLinq.Request.Visitors.FacetExpressionVisitor' ElasticLinq.Request.Visitors.ElasticFieldsExpressionVisitor' ElasticLinq.Request.Visitors.MemberProjectionExpressionVisitor' ElasticLinq.Response.Materializers.ChainMaterializer' ElasticLinq.Response.Materializers.ListTermFacetsElasticMaterializer' ElasticLinq.Response.Materializers.TermlessFacetElasticMaterializer' ElasticLinq.Response.Materializers.ListTermlessFacetsElasticMaterializer' ElasticLinq.Response.Materializers.OneHitElasticMaterializer' ElasticLinq.Response.Materializers.ListHitsElasticMaterializer' ElasticLinq.Test.TestableElasticQueryRewriter' ElasticLinq.Test.Utility.ArgumentTests' ElasticLinq.Test.Utility.ArgumentTests' ElasticLinq.Request.Visitors.CriteriaExpressionVisitor' ElasticLinq.Response.Materializers.AggregateStatisticalRow' ElasticLinq.Response.Materializers.AggregateTermRow' ElasticLinq.Test.Mapping.MappingHelpersTests' ElasticLinq.Test.Mapping.ElasticMappingTests' ElasticLinq.Test.TestSupport.FakeQueryProvider' ElasticLinq.Test.Utility.TypeHelperTests' ElasticLinq.Test.Mapping.ElasticMappingTests' ElasticLinq.Test.Mapping.MappingHelpersTests' ElasticLinq.Test.TestSupport.FakeQueryProvider' ElasticLinq.Test.Utility.TypeHelperTests,
ElasticLINQ,ElasticLinq.Response.Model,ElasticLinq.ElasticConnection' ElasticLinq.ElasticQueryProvider' ElasticLinq.Request.ElasticRequestProcessor' ElasticLinq.Response.Materializers.HighlightElasticMaterializer' ElasticLinq.Response.Materializers.ChainMaterializer' ElasticLinq.Response.Materializers.AnyElasticMaterializer' ElasticLinq.Response.Materializers.CountElasticMaterializer' ElasticLinq.Response.Materializers.ListTermFacetsElasticMaterializer' ElasticLinq.Response.Materializers.TermlessFacetElasticMaterializer' ElasticLinq.Response.Materializers.ListTermlessFacetsElasticMaterializer' ElasticLinq.Response.Materializers.OneHitElasticMaterializer' ElasticLinq.Response.Materializers.ListHitsElasticMaterializer' ElasticLinq.Response.Materializers.IElasticMaterializer' ElasticLinq.ElasticsearchNet.ElasticNetConnection' ElasticLinq.Test.ElasticConnectionTests' ElasticLinq.Test.Request.Visitors.ElasticQueryTranslation.ElasticQueryTranslationTests' ElasticLinq.Test.Response.Materializers.AnyElasticMaterializerTests' ElasticLinq.Test.Response.Materializers.CountElasticMaterializerTests' ElasticLinq.Test.Response.Materializers.HighlightMaterializerTests' ElasticLinq.Test.Response.Materializers.ManyFacetsElasticMaterializerTests' ElasticLinq.Test.Response.Materializers.MaterializerTestHelper' ElasticLinq.Test.Response.Materializers.OneHitElasticMaterializerTests' ElasticLinq.Test.Response.Materializers.ManyHitsElasticMaterializerTests' ElasticLinq.ElasticsearchNet.Test.ElasticNetConnectionTests' ElasticLinq.Test.ElasticConnectionTests' ElasticLinq.Test.Request.Visitors.ElasticQueryTranslation.ElasticQueryTranslationTests' ElasticLinq.Test.Response.Materializers.AnyElasticMaterializerTests' ElasticLinq.Test.Response.Materializers.CountElasticMaterializerTests' ElasticLinq.Test.Response.Materializers.HighlightMaterializerTests' ElasticLinq.Test.Response.Materializers.ManyFacetsElasticMaterializerTests' ElasticLinq.Test.Response.Materializers.ManyHitsElasticMaterializerTests' ElasticLinq.Test.Response.Materializers.MaterializerTestHelper' ElasticLinq.Test.Response.Materializers.OneHitElasticMaterializerTests' ElasticLinq.Request.Visitors.ElasticFieldsExpressionVisitor' ElasticLinq.Request.Visitors.MemberProjectionExpressionVisitor,
