Project,Namespace,Ca types,Ce types
ElasticLINQ,ElasticLinq.Async,,
ElasticLINQ,ElasticLinq,ElasticLinq.Test.TestableElasticQuery<T>' ElasticLinq.Test.ElasticContextTests' ElasticLinq.Test.ElasticQueryProviderTests' ElasticLinq.Test.ElasticQueryTests' ElasticLinq.Test.ElasticConnectionTests' ElasticLinq.Test.MyConnection' ElasticLinq.Test.Request.ElasticRequestProcessorTests' ElasticLinq.Test.Request.Formatters.SearchRequestFormatterCriteriaTests' ElasticLinq.Test.Request.Formatters.SearchRequestFormatterTests' ElasticLinq.Test.Request.Formatters.SearchRequestFormatterFacetTests' ElasticLinq.Test.Request.Visitors.ElasticQueryTranslation.ElasticQueryTranslationTestsBase' ElasticLinq.IntegrationTest.BreakOnInvalidQueryConnection' ElasticLinq.IntegrationTest.Data' ElasticLinq.IntegrationTest.FieldMappingTests' ElasticLinq.Test.ElasticConnectionTests' ElasticLinq.Test.MyConnection' ElasticLinq.Test.ElasticContextTests' ElasticLinq.Test.ElasticQueryProviderTests' ElasticLinq.Test.ElasticQueryTests' ElasticLinq.Test.Request.ElasticRequestProcessorTests' ElasticLinq.Test.Request.Formatters.SearchRequestFormatterCriteriaTests' ElasticLinq.Test.Request.Formatters.SearchRequestFormatterFacetTests' ElasticLinq.Test.Request.Formatters.SearchRequestFormatterTests' ElasticLinq.Test.Request.Visitors.ElasticQueryTranslation.ElasticQueryTranslationTestsBase' ElasticLinq.Request.Formatters.SearchRequestFormatter' ElasticLinq.ElasticsearchNet.ElasticNetConnection' ElasticLinq.Test.ElasticConnectionOptionsTests' ElasticLinq.ElasticsearchNet.Test.ElasticNetConnectionTests' ElasticLinq.Test.ElasticConnectionOptionsTests' ElasticLinq.Test.Integration.BasicConnectionTests' ElasticLinq.Test.Integration.BasicConnectionTests' ElasticLinq.Mapping.ElasticFieldsMappingWrapper' ElasticLinq.Request.Visitors.CriteriaExpressionVisitor' ElasticLinq.Request.Visitors.ElasticFieldsExpressionVisitor' ElasticLinq.Test.TestableElasticQueryRewriter' ElasticLinq.Test.ElasticFieldsTests' ElasticLinq.Test.Mapping.ElasticFieldsMappingWrapperTests' ElasticLinq.Test.Request.Visitors.ElasticFieldsExpressionVisitorTests' ElasticLinq.Test.Request.Visitors.PartialEvaluatorTests' ElasticLinq.Test.Request.Visitors.MemberProjectionExpressionVisitorTests' ElasticLinq.Test.Request.Visitors.ElasticQueryTranslation.ElasticQueryTranslationSelectTests' ElasticLinq.Test.Request.Visitors.ElasticQueryTranslation.ElasticQueryTranslationOrderByTests' ElasticLinq.Test.Test.TestableElasticContextTests' ElasticLinq.Test.ElasticFieldsTests' ElasticLinq.Test.Mapping.ElasticFieldsMappingWrapperTests' ElasticLinq.Test.Request.Visitors.ElasticFieldsExpressionVisitorTests' ElasticLinq.Test.Request.Visitors.MemberProjectionExpressionVisitorTests' ElasticLinq.Test.Request.Visitors.PartialEvaluatorTests' ElasticLinq.Test.Request.Visitors.ElasticQueryTranslation.ElasticQueryTranslationOrderByTests' ElasticLinq.Test.Request.Visitors.ElasticQueryTranslation.ElasticQueryTranslationSelectTests' ElasticLinq.Test.Test.TestableElasticContextTests' ElasticLinq.Request.Visitors.ElasticQueryTranslator' ElasticLinq.Test.ElasticMethodsTests' ElasticLinq.Test.Request.Visitors.ElasticQueryTranslation.ElasticQueryTranslationAggregateGroupByFieldTests' ElasticLinq.Test.Request.Visitors.ElasticQueryTranslation.ElasticQueryTranslationNotSupportedTests' ElasticLinq.Test.Request.Visitors.ElasticQueryTranslation.ElasticQueryTranslationQueryTests' ElasticLinq.Test.Request.Visitors.ElasticQueryTranslation.ElasticQueryTranslationWhereTests' ElasticLinq.Test.ElasticMethodsTests' ElasticLinq.Test.Request.Visitors.ElasticQueryTranslation.ElasticQueryTranslationAggregateGroupByFieldTests' ElasticLinq.Test.Request.Visitors.ElasticQueryTranslation.ElasticQueryTranslationNotSupportedTests' ElasticLinq.Test.Request.Visitors.ElasticQueryTranslation.ElasticQueryTranslationQueryTests' ElasticLinq.Test.Request.Visitors.ElasticQueryTranslation.ElasticQueryTranslationWhereTests' ElasticLinq.Test.ElasticQueryExtensionsTests' ElasticLinq.Test.ElasticQueryExtensionsTests' ElasticLinq.Request.ElasticRequestProcessor,ElasticLinq.Utility.Argument' ElasticLinq.Request.SearchRequest' ElasticLinq.Logging.ILog' ElasticLinq.Response.Model.ElasticResponse' ElasticLinq.Response.Model.Hits' ElasticLinq.Logging.NullLog' ElasticLinq.Mapping.IElasticMapping' ElasticLinq.Retry.IRetryPolicy' ElasticLinq.Request.Visitors.ElasticTranslateResult' ElasticLinq.Request.Formatters.SearchRequestFormatter' ElasticLinq.Request.Visitors.ElasticQueryTranslator' ElasticLinq.Request.QueryInfo' ElasticLinq.Request.Highlight' ElasticLinq.Request.ElasticRequestProcessor' ElasticLinq.Utility.TypeHelper' ElasticLinq.Utility.AsyncHelper' ElasticLinq.Request.Criteria.ConstantCriteria' ElasticLinq.Response.Materializers.IElasticMaterializer
ElasticLINQ,ElasticLinq.Logging,ElasticLinq.BaseElasticConnection' ElasticLinq.ElasticConnection' ElasticLinq.ElasticContext' ElasticLinq.ElasticQueryProvider' ElasticLinq.IElasticConnection' ElasticLinq.Request.ElasticRequestProcessor' ElasticLinq.Retry.RetryPolicy' ElasticLinq.Test.TestableElasticContext' ElasticLinq.ElasticsearchNet.ElasticNetConnection' ElasticLinq.Test.ElasticQueryProviderTests' ElasticLinq.Test.ElasticConnectionTests' ElasticLinq.Test.Integration.BasicConnectionTests' ElasticLinq.Test.Request.ElasticRequestProcessorTests' ElasticLinq.Test.Request.Visitors.ElasticQueryTranslation.ElasticQueryTranslationTestsBase' ElasticLinq.Test.Retry.RetryPolicyTests' ElasticLinq.IntegrationTest.BreakOnInvalidQueryConnection' ElasticLinq.ElasticsearchNet.Test.ElasticNetConnectionTests' ElasticLinq.Test.ElasticConnectionTests' ElasticLinq.Test.ElasticQueryProviderTests' ElasticLinq.Test.Integration.BasicConnectionTests' ElasticLinq.Test.Request.ElasticRequestProcessorTests' ElasticLinq.Test.Request.Visitors.ElasticQueryTranslation.ElasticQueryTranslationTestsBase' ElasticLinq.Test.Retry.RetryPolicyTests' ElasticLinq.Test.ElasticContextTests' ElasticLinq.Test.Test.TestableElasticContextTests' ElasticLinq.Test.ElasticContextTests' ElasticLinq.Test.Test.TestableElasticContextTests' ElasticLinq.Test.LogEntry' ElasticLinq.Test.SpyLog' ElasticLinq.Test.Logging.LogExtensionTests' ElasticLinq.ElasticsearchNet.Test.TestSupport.LogEntry' ElasticLinq.ElasticsearchNet.Test.TestSupport.SpyLog' ElasticLinq.Test.LogEntry' ElasticLinq.Test.SpyLog' ElasticLinq.Test.Logging.LogExtensionTests,
ElasticLINQ,ElasticLinq.Mapping,ElasticLinq.Test.Mapping.CouchbaseElasticMappingTests' ElasticLinq.Test.Mapping.CouchbaseElasticMappingTests' ElasticLinq.Test.Mapping.ElasticFieldsMappingWrapperTests' ElasticLinq.Test.Mapping.ElasticFieldsMappingWrapperTests' ElasticLinq.Test.Mapping.ElasticMappingTests' ElasticLinq.Test.Mapping.ElasticMappingTests' ElasticLinq.Test.MyCustomMapping' ElasticLinq.Test.Test.TestableElasticContextTests' ElasticLinq.Test.MyCustomMapping' ElasticLinq.Test.Test.TestableElasticContextTests' ElasticLinq.Test.Mapping.MappingHelpersTests' ElasticLinq.Test.Mapping.MappingHelpersTests' ElasticLinq.ElasticContext' ElasticLinq.ElasticQueryProvider' ElasticLinq.Request.ElasticRequestProcessor' ElasticLinq.Request.Formatters.SearchRequestFormatter' ElasticLinq.Request.Visitors.FacetExpressionVisitor' ElasticLinq.Request.Visitors.CriteriaExpressionVisitor' ElasticLinq.Request.Visitors.ElasticFieldsExpressionVisitor' ElasticLinq.Request.Visitors.ElasticQueryTranslator' ElasticLinq.Request.Visitors.MemberProjectionExpressionVisitor' ElasticLinq.Test.TestableElasticContext' ElasticLinq.Test.ElasticQueryProviderTests' ElasticLinq.Test.ElasticConnectionTests' ElasticLinq.Test.Integration.BasicConnectionTests' ElasticLinq.Test.Request.ElasticRequestProcessorTests' ElasticLinq.Test.Request.Formatters.SearchRequestFormatterCriteriaTests' ElasticLinq.Test.Request.Formatters.SearchRequestFormatterTests' ElasticLinq.Test.Request.Formatters.SearchRequestFormatterFacetTests' ElasticLinq.Test.Request.Visitors.SimpleCriteriaExpressionVisitor' ElasticLinq.Test.Request.Visitors.ElasticFieldsExpressionVisitorTests' ElasticLinq.Test.Request.Visitors.MemberProjectionExpressionVisitorTests' ElasticLinq.Test.Request.Visitors.ElasticQueryTranslation.ElasticQueryTranslationTestsBase' ElasticLinq.Test.Request.Visitors.ElasticQueryTranslation.ElasticQueryTranslationTests' ElasticLinq.ElasticsearchNet.Test.ElasticNetConnectionTests' ElasticLinq.Test.ElasticConnectionTests' ElasticLinq.Test.ElasticQueryProviderTests' ElasticLinq.Test.Integration.BasicConnectionTests' ElasticLinq.Test.Request.ElasticRequestProcessorTests' ElasticLinq.Test.Request.Formatters.SearchRequestFormatterCriteriaTests' ElasticLinq.Test.Request.Formatters.SearchRequestFormatterFacetTests' ElasticLinq.Test.Request.Formatters.SearchRequestFormatterTests' ElasticLinq.Test.Request.Visitors.SimpleCriteriaExpressionVisitor' ElasticLinq.Test.Request.Visitors.ElasticFieldsExpressionVisitorTests' ElasticLinq.Test.Request.Visitors.MemberProjectionExpressionVisitorTests' ElasticLinq.Test.Request.Visitors.ElasticQueryTranslation.ElasticQueryTranslationTests' ElasticLinq.Test.Request.Visitors.ElasticQueryTranslation.ElasticQueryTranslationTestsBase,ElasticLinq.Request.Criteria.ExistsCriteria' ElasticLinq.ElasticFields' ElasticLinq.Request.Criteria.ICriteria' ElasticLinq.Utility.Argument' ElasticLinq.Utility.TypeHelper
ElasticLINQ,ElasticLinq.Request.Criteria,ElasticLinq.Request.Formatters.SearchRequestFormatter' ElasticLinq.Test.Request.Formatters.SearchRequestFormatterCriteriaTests' ElasticLinq.Test.Request.Visitors.ElasticQueryTranslation.ElasticQueryTranslationQueryTests' ElasticLinq.Test.Request.Formatters.SearchRequestFormatterCriteriaTests' ElasticLinq.Test.Request.Visitors.ElasticQueryTranslation.ElasticQueryTranslationQueryTests' ElasticLinq.Request.Visitors.CriteriaExpressionVisitor' ElasticLinq.Request.Visitors.ElasticQueryTranslator' ElasticLinq.Test.Request.Criteria.QueryCriteriaRewriterTests' ElasticLinq.Test.Request.Criteria.ConstantCriteriaFilterReducerTests' ElasticLinq.Test.Request.Criteria.AndCriteriaTests' ElasticLinq.Test.Request.Criteria.AndCriteriaTests' ElasticLinq.Test.Request.Criteria.ConstantCriteriaFilterReducerTests' ElasticLinq.Test.Request.Criteria.QueryCriteriaRewriterTests' ElasticLinq.ElasticQueryProvider' ElasticLinq.Test.Request.Criteria.ConstantCriteriaTests' ElasticLinq.Test.Request.Visitors.ElasticQueryTranslation.ElasticQueryTranslationWhereTests' ElasticLinq.Test.Request.Criteria.ConstantCriteriaTests' ElasticLinq.Test.Request.Visitors.ElasticQueryTranslation.ElasticQueryTranslationWhereTests' ElasticLinq.Mapping.CouchbaseElasticMapping' ElasticLinq.Test.Request.Criteria.OrCriteriaTests' ElasticLinq.Test.Request.Criteria.ExistsCriteriaTests' ElasticLinq.Test.Request.Formatters.SearchRequestFormatterFacetTests' ElasticLinq.Test.Request.Visitors.ElasticQueryTranslation.ElasticQueryTranslationTests' ElasticLinq.Test.Request.Criteria.ExistsCriteriaTests' ElasticLinq.Test.Request.Criteria.OrCriteriaTests' ElasticLinq.Test.Request.Formatters.SearchRequestFormatterFacetTests' ElasticLinq.Test.Request.Visitors.ElasticQueryTranslation.ElasticQueryTranslationTests' ElasticLinq.Mapping.ElasticFieldsMappingWrapper' ElasticLinq.Request.Expressions.CriteriaExpression' ElasticLinq.Request.Facets.FilterFacet' ElasticLinq.Request.Facets.StatisticalFacet' ElasticLinq.Request.Facets.TermsFacet' ElasticLinq.Request.Facets.TermsStatsFacet' ElasticLinq.Test.ElasticConnectionTests' ElasticLinq.Test.Mapping.CouchbaseElasticMappingTests' ElasticLinq.Test.Mapping.ElasticMappingTests' ElasticLinq.Test.Request.Criteria.NotCriteriaTests' ElasticLinq.Test.Request.Facets.StatisticalFacetTests' ElasticLinq.Test.Request.Facets.TermsStatsFacetTests' ElasticLinq.Test.Request.Facets.TermsFacetTests' ElasticLinq.Test.Request.Facets.FilterFacetTests' ElasticLinq.Test.Request.Formatters.SearchRequestFormatterTests' ElasticLinq.Test.Request.Visitors.ElasticQueryTranslation.ElasticQueryTranslationSingularTests' ElasticLinq.Test.ElasticConnectionTests' ElasticLinq.Test.Mapping.CouchbaseElasticMappingTests' ElasticLinq.Test.Mapping.ElasticMappingTests' ElasticLinq.Test.Request.Criteria.NotCriteriaTests' ElasticLinq.Test.Request.Facets.FilterFacetTests' ElasticLinq.Test.Request.Facets.StatisticalFacetTests' ElasticLinq.Test.Request.Facets.TermsFacetTests' ElasticLinq.Test.Request.Facets.TermsStatsFacetTests' ElasticLinq.Test.Request.Formatters.SearchRequestFormatterTests' ElasticLinq.Test.Request.Visitors.ElasticQueryTranslation.ElasticQueryTranslationSingularTests' ElasticLinq.Test.Request.Criteria.TermsCriteriaTests' ElasticLinq.Test.Request.Expressions.CriteriaExpressionTests' ElasticLinq.Test.Request.Criteria.TermsCriteriaTests' ElasticLinq.Test.Request.Expressions.CriteriaExpressionTests' ElasticLinq.Request.Visitors.FacetExpressionVisitor' ElasticLinq.Test.Request.Criteria.MatchAllCriteriaTests' ElasticLinq.Test.Request.Visitors.ElasticQueryTranslation.ElasticQueryTranslationAggregateGroupedByConstantTests' ElasticLinq.Test.Request.Criteria.MatchAllCriteriaTests' ElasticLinq.Test.Request.Visitors.ElasticQueryTranslation.ElasticQueryTranslationAggregateGroupedByConstantTests' ElasticLinq.Test.Request.Criteria.MissingCriteriaTests' ElasticLinq.Test.Request.Criteria.MissingCriteriaTests' ElasticLinq.Test.Request.Criteria.PrefixCriteriaTests' ElasticLinq.Test.Request.Criteria.PrefixCriteriaTests' ElasticLinq.Test.Request.Criteria.RangeCriteriaTests' ElasticLinq.Test.Request.Visitors.ElasticQueryTranslation.ElasticQueryTranslationAggregateGroupByFieldTests' ElasticLinq.Test.Request.Criteria.RangeCriteriaTests' ElasticLinq.Test.Request.Visitors.ElasticQueryTranslation.ElasticQueryTranslationAggregateGroupByFieldTests' ElasticLinq.Test.Request.Visitors.ElasticQueryTranslation.ElasticQueryTranslationAggregateUngroupedTests' ElasticLinq.Test.Request.Visitors.ElasticQueryTranslation.ElasticQueryTranslationAggregateUngroupedTests' ElasticLinq.Test.Request.Criteria.RegexpCriteriaTests' ElasticLinq.Test.Request.Criteria.RegexpCriteriaTests' ElasticLinq.Test.Request.Criteria.QueryStringCriteriaTests' ElasticLinq.Test.Request.Criteria.QueryStringCriteriaTests,ElasticLinq.Utility.Argument
ElasticLINQ,ElasticLinq.Request,ElasticLinq.ElasticQuery<T>' ElasticLinq.ElasticQueryExtensions' ElasticLinq.Test.TestableElasticQuery<T>' ElasticLinq.Test.ElasticQueryExtensionsTests' ElasticLinq.Test.ElasticQueryTests' ElasticLinq.Test.JsonNetTests' ElasticLinq.Test.ElasticQueryExtensionsTests' ElasticLinq.Test.ElasticQueryTests' ElasticLinq.Test.JsonNetTests' ElasticLinq.Request.Formatters.SearchRequestFormatter' ElasticLinq.Test.Request.SortOptionTests' ElasticLinq.Test.Request.SortOptionTests' ElasticLinq.Request.Visitors.ElasticQueryTranslator' ElasticLinq.Test.Request.HighlightTests' ElasticLinq.Test.Request.HighlightTests' ElasticLinq.ElasticQueryProvider' ElasticLinq.Test.Request.ElasticRequestProcessorTests' ElasticLinq.Test.Request.ElasticRequestProcessorTests' ElasticLinq.BaseElasticConnection' ElasticLinq.ElasticConnection' ElasticLinq.IElasticConnection' ElasticLinq.Request.Visitors.ElasticTranslateResult' ElasticLinq.ElasticsearchNet.ElasticNetConnection' ElasticLinq.Test.ElasticConnectionTests' ElasticLinq.Test.Request.SearchRequestTests' ElasticLinq.Test.Request.Formatters.SearchRequestFormatterTests' ElasticLinq.Test.Request.Formatters.SearchRequestFormatterFacetTests' ElasticLinq.Test.Request.Visitors.ElasticTranslateResultTests' ElasticLinq.Test.Request.Visitors.ElasticQueryTranslation.ElasticQueryTranslationAggregateGroupByFieldTests' ElasticLinq.Test.Request.Visitors.ElasticQueryTranslation.ElasticQueryTranslationAggregateGroupedByConstantTests' ElasticLinq.Test.Request.Visitors.ElasticQueryTranslation.ElasticQueryTranslationSingularTests' ElasticLinq.Test.Request.Visitors.ElasticQueryTranslation.ElasticQueryTranslationSelectTests' ElasticLinq.Test.Request.Visitors.ElasticQueryTranslation.ElasticQueryTranslationOrderByTests' ElasticLinq.Test.Request.Visitors.ElasticQueryTranslation.ElasticQueryTranslationTests' ElasticLinq.Test.Request.Visitors.ElasticQueryTranslation.ElasticQueryTranslationQueryTests' ElasticLinq.Test.Request.Visitors.ElasticQueryTranslation.ElasticQueryTranslationWhereTests' ElasticLinq.Test.Request.Visitors.ElasticQueryTranslation.ElasticQueryTranslationAggregateUngroupedTests' ElasticLinq.IntegrationTest.BreakOnInvalidQueryConnection' ElasticLinq.ElasticsearchNet.Test.ElasticNetConnectionTests' ElasticLinq.Test.ElasticConnectionTests' ElasticLinq.Test.Request.SearchRequestTests' ElasticLinq.Test.Request.Formatters.SearchRequestFormatterFacetTests' ElasticLinq.Test.Request.Formatters.SearchRequestFormatterTests' ElasticLinq.Test.Request.Visitors.ElasticTranslateResultTests' ElasticLinq.Test.Request.Visitors.ElasticQueryTranslation.ElasticQueryTranslationAggregateGroupByFieldTests' ElasticLinq.Test.Request.Visitors.ElasticQueryTranslation.ElasticQueryTranslationAggregateGroupedByConstantTests' ElasticLinq.Test.Request.Visitors.ElasticQueryTranslation.ElasticQueryTranslationQueryTests' ElasticLinq.Test.Request.Visitors.ElasticQueryTranslation.ElasticQueryTranslationSelectTests' ElasticLinq.Test.Request.Visitors.ElasticQueryTranslation.ElasticQueryTranslationSingularTests' ElasticLinq.Test.Request.Visitors.ElasticQueryTranslation.ElasticQueryTranslationTests' ElasticLinq.Test.Request.Visitors.ElasticQueryTranslation.ElasticQueryTranslationWhereTests,ElasticLinq.Utility.Argument' ElasticLinq.IElasticConnection' ElasticLinq.Logging.ILog' ElasticLinq.Mapping.IElasticMapping' ElasticLinq.Retry.IRetryPolicy' ElasticLinq.Request.Formatters.SearchRequestFormatter' ElasticLinq.Response.Model.ElasticResponse' ElasticLinq.Response.Model.Hits
ElasticLINQ,ElasticLinq.Request.Expressions,ElasticLinq.Test.Request.Expressions.FacetExpressionTests' ElasticLinq.Test.Request.Expressions.FacetExpressionTests' ElasticLinq.Request.Visitors.FacetExpressionVisitor' ElasticLinq.Request.Visitors.CriteriaExpressionVisitor' ElasticLinq.Request.Visitors.ElasticQueryTranslator' ElasticLinq.Test.Request.Expressions.CriteriaExpressionTests' ElasticLinq.Test.Request.Expressions.CriteriaExpressionTests,ElasticLinq.Request.Facets.IFacet' ElasticLinq.Request.Criteria.ICriteria
ElasticLINQ,ElasticLinq.Request.Facets,ElasticLinq.Request.Formatters.SearchRequestFormatter' ElasticLinq.Test.Request.Facets.FilterFacetTests' ElasticLinq.Test.Request.Formatters.SearchRequestFormatterFacetTests' ElasticLinq.Test.Request.Facets.FilterFacetTests' ElasticLinq.Test.Request.Formatters.SearchRequestFormatterFacetTests' ElasticLinq.Request.Expressions.FacetExpression' ElasticLinq.Test.Request.Facets.StatisticalFacetTests' ElasticLinq.Test.Request.Facets.StatisticalFacetTests' ElasticLinq.Test.Request.Expressions.FacetExpressionTests' ElasticLinq.Test.Request.Facets.TermsFacetTests' ElasticLinq.Test.Request.Expressions.FacetExpressionTests' ElasticLinq.Test.Request.Facets.TermsFacetTests' ElasticLinq.Test.Request.Facets.TermsStatsFacetTests' ElasticLinq.Test.Request.Facets.TermsStatsFacetTests,ElasticLinq.Utility.Argument' ElasticLinq.Request.Criteria.ICriteria
ElasticLINQ,ElasticLinq.Request.Formatters,ElasticLinq.ElasticQuery<T>' ElasticLinq.Request.ElasticRequestProcessor' ElasticLinq.Test.TestableElasticQuery<T>' ElasticLinq.Test.ElasticConnectionTests' ElasticLinq.Test.Request.ElasticRequestProcessorTests' ElasticLinq.Test.Request.Formatters.SearchRequestFormatterCriteriaTests' ElasticLinq.Test.Request.Formatters.SearchRequestFormatterTests' ElasticLinq.Test.Request.Formatters.SearchRequestFormatterFacetTests' ElasticLinq.ElasticsearchNet.Test.ElasticNetConnectionTests' ElasticLinq.Test.ElasticConnectionTests' ElasticLinq.Test.Request.ElasticRequestProcessorTests' ElasticLinq.Test.Request.Formatters.SearchRequestFormatterCriteriaTests' ElasticLinq.Test.Request.Formatters.SearchRequestFormatterFacetTests' ElasticLinq.Test.Request.Formatters.SearchRequestFormatterTests,ElasticLinq.IElasticConnection' ElasticLinq.Mapping.IElasticMapping' ElasticLinq.Request.SearchRequest' ElasticLinq.ElasticConnectionOptions' ElasticLinq.Utility.Argument' ElasticLinq.Request.Facets.IOrderableFacet' ElasticLinq.Request.Facets.IFacet' ElasticLinq.Request.Facets.StatisticalFacet' ElasticLinq.Request.Facets.TermsStatsFacet' ElasticLinq.Request.Facets.TermsFacet' ElasticLinq.Request.Facets.FilterFacet' ElasticLinq.Request.SortOption' ElasticLinq.Request.Criteria.ICriteria' ElasticLinq.Request.Criteria.RangeCriteria' ElasticLinq.Request.Criteria.RegexpCriteria' ElasticLinq.Request.Criteria.PrefixCriteria' ElasticLinq.Request.Criteria.TermCriteria' ElasticLinq.Request.Criteria.TermsCriteria' ElasticLinq.Request.Criteria.NotCriteria' ElasticLinq.Request.Criteria.QueryStringCriteria' ElasticLinq.Request.Criteria.MatchAllCriteria' ElasticLinq.Request.Criteria.BoolCriteria' ElasticLinq.Request.Criteria.SingleFieldCriteria' ElasticLinq.Request.Criteria.CompoundCriteria' ElasticLinq.Request.Highlight' ElasticLinq.Request.Criteria.RangeSpecificationCriteria' ElasticLinq.Request.Criteria.TermsExecutionMode
ElasticLINQ,ElasticLinq.Request.Visitors,ElasticLinq.Test.Request.Visitors.SimpleCriteriaExpressionVisitor' ElasticLinq.Test.Request.Visitors.SimpleCriteriaExpressionVisitor' ElasticLinq.Test.Request.Visitors.BranchSelectExpressionVisitorTests' ElasticLinq.Test.Request.Visitors.BranchSelectExpressionVisitorTests' ElasticLinq.Test.Request.Visitors.ConstantMemberPairTests' ElasticLinq.Test.Request.Visitors.ConstantMemberPairTests' ElasticLinq.Test.Request.Visitors.ElasticFieldsExpressionVisitorTests' ElasticLinq.Test.Request.Visitors.ElasticFieldsExpressionVisitorTests' ElasticLinq.ElasticQuery<T>' ElasticLinq.ElasticQueryProvider' ElasticLinq.Test.TestableElasticQuery<T>' ElasticLinq.Test.Request.Visitors.ElasticQueryTranslation.ElasticQueryTranslationAggregateGroupByFieldTests' ElasticLinq.Test.Request.Visitors.ElasticQueryTranslation.ElasticQueryTranslationAggregateGroupedByConstantTests' ElasticLinq.Test.Request.Visitors.ElasticQueryTranslation.ElasticQueryTranslationNotSupportedTests' ElasticLinq.Test.Request.Visitors.ElasticQueryTranslation.ElasticQueryTranslationSingularTests' ElasticLinq.Test.Request.Visitors.ElasticQueryTranslation.ElasticQueryTranslationSelectTests' ElasticLinq.Test.Request.Visitors.ElasticQueryTranslation.ElasticQueryTranslationOrderByTests' ElasticLinq.Test.Request.Visitors.ElasticQueryTranslation.ElasticQueryTranslationTests' ElasticLinq.Test.Request.Visitors.ElasticQueryTranslation.ElasticQueryTranslationQueryTests' ElasticLinq.Test.Request.Visitors.ElasticQueryTranslation.ElasticQueryTranslationWhereTests' ElasticLinq.Test.Request.Visitors.ElasticQueryTranslation.ElasticQueryTranslationAggregateUngroupedTests' ElasticLinq.Test.Request.Visitors.ElasticQueryTranslation.ElasticQueryTranslationAggregateGroupByFieldTests' ElasticLinq.Test.Request.Visitors.ElasticQueryTranslation.ElasticQueryTranslationAggregateGroupedByConstantTests' ElasticLinq.Test.Request.Visitors.ElasticQueryTranslation.ElasticQueryTranslationAggregateUngroupedTests' ElasticLinq.Test.Request.Visitors.ElasticQueryTranslation.ElasticQueryTranslationNotSupportedTests' ElasticLinq.Test.Request.Visitors.ElasticQueryTranslation.ElasticQueryTranslationOrderByTests' ElasticLinq.Test.Request.Visitors.ElasticQueryTranslation.ElasticQueryTranslationQueryTests' ElasticLinq.Test.Request.Visitors.ElasticQueryTranslation.ElasticQueryTranslationSelectTests' ElasticLinq.Test.Request.Visitors.ElasticQueryTranslation.ElasticQueryTranslationSingularTests' ElasticLinq.Test.Request.Visitors.ElasticQueryTranslation.ElasticQueryTranslationTests' ElasticLinq.Test.Request.Visitors.ElasticQueryTranslation.ElasticQueryTranslationWhereTests' ElasticLinq.Test.Request.Visitors.ElasticTranslateResultTests' ElasticLinq.Test.Request.Visitors.ElasticTranslateResultTests' ElasticLinq.Test.Request.Visitors.EvaluatingExpressionVisitorTests' ElasticLinq.Test.Request.Visitors.EvaluatingExpressionVisitorTests' ElasticLinq.Test.Request.Visitors.PartialEvaluatorTests' ElasticLinq.Test.Request.Visitors.PartialEvaluatorTests' ElasticLinq.Test.Request.Visitors.MemberProjectionExpressionVisitorTests' ElasticLinq.Test.Request.Visitors.MemberProjectionExpressionVisitorTests,ElasticLinq.Response.Materializers.IElasticMaterializer' ElasticLinq.Mapping.IElasticMapping' ElasticLinq.Utility.Argument' ElasticLinq.Response.Materializers.TermlessFacetElasticMaterializer' ElasticLinq.Response.Materializers.ListTermlessFacetsElasticMaterializer' ElasticLinq.Response.Materializers.ListTermFacetsElasticMaterializer' ElasticLinq.Request.Criteria.MatchAllCriteria' ElasticLinq.Request.Expressions.CriteriaExpression' ElasticLinq.Request.Criteria.RangeComparison' ElasticLinq.ElasticMethods' ElasticLinq.Utility.TypeHelper' ElasticLinq.Request.Criteria.TermsExecutionMode' ElasticLinq.Request.Criteria.NotCriteria' ElasticLinq.ElasticFields' ElasticLinq.Request.Criteria.ConstantCriteria' ElasticLinq.Request.Criteria.ICriteria' ElasticLinq.Request.Criteria.TermsCriteria' ElasticLinq.Request.Criteria.OrCriteria' ElasticLinq.Request.Criteria.AndCriteria' ElasticLinq.Response.Model.Hit' ElasticLinq.Request.SearchRequest' ElasticLinq.Request.Criteria.QueryCriteriaRewriter' ElasticLinq.Request.Criteria.ConstantCriteriaFilterReducer' ElasticLinq.Response.Materializers.ChainMaterializer' ElasticLinq.ElasticQueryExtensions' ElasticLinq.Request.Highlight
