Project,Namespace,Ca types,Ce types
npantarhei.distribution,npantarhei.distribution.communication.local,npantarhei.distribution.tests.test_Integration,npantarhei.distribution.contract.messagetypes.HostInput' npantarhei.distribution.StandInOperation' npantarhei.distribution.OperationHost' npantarhei.distribution.contract.messagetypes.HostOutput
npantarhei.distribution,npantarhei.distribution.contract,npantarhei.distribution.StandInOperation' npantarhei.distribution.OperationHost,npantarhei.distribution.contract.messagetypes.HostInput
npantarhei.distribution,npantarhei.distribution,npantarhei.distribution.communication.local.SyncBus' npantarhei.distribution.pubnub.PubnubOperationHost' npantarhei.distribution.wcf.WcfOperationHost' npantarhei.distribution.pubnub.PubnubStandInOperation' npantarhei.distribution.wcf.WcfStandInOperation,npantarhei.distribution.contract.IHostStub' npantarhei.distribution.contract.IStandInProxy' npantarhei.distribution.translators.HostTranslator' npantarhei.distribution.translators.StandInTranslator' npantarhei.distribution.contract.IHostProxy' npantarhei.distribution.contract.IStandInStub
npantarhei.distribution,npantarhei.distribution.tests,,npantarhei.distribution.communication.local.SyncBus' npantarhei.distribution.translators.Element' npantarhei.distribution.translators.HostTranslator' npantarhei.distribution.contract.messagetypes.HostInput' npantarhei.distribution.contract.messagetypes.HostOutput' npantarhei.distribution.translators.StandInTranslator
npantarhei.distribution,npantarhei.distribution.translators,npantarhei.distribution.tests.test_CorrelationCache' npantarhei.distribution.OperationHost' npantarhei.distribution.tests.test_HostTranslator' npantarhei.distribution.StandInOperation' npantarhei.distribution.tests.StandIn,npantarhei.distribution.contract.messagetypes.HostInput' npantarhei.distribution.contract.messagetypes.HostOutput
npantarhei.distribution,npantarhei.distribution.contract.messagetypes,npantarhei.distribution.communication.local.HostTransceiver' npantarhei.distribution.communication.local.SyncBus' npantarhei.distribution.communication.local.StandInTransceiver' npantarhei.distribution.contract.IHostProxy' npantarhei.distribution.tests.test_HostTranslator' npantarhei.distribution.tests.StandIn' npantarhei.distribution.translators.HostTranslator' npantarhei.distribution.translators.StandInTranslator' npantarhei.distribution.pubnub.tests.test_Integration' npantarhei.distribution.pubnub.tests.test_PubnubHostTransceiver' npantarhei.distribution.pubnub.tests.test_PubnubStandInTransceiver' npantarhei.distribution.pubnub.transceivers.PubnubHostTransceiver' npantarhei.distribution.pubnub.transceivers.PubnubStandInTransceiver' npantarhei.distribution.wcf.contract.IHostService' npantarhei.distribution.wcf.tests.test_Transceivers' npantarhei.distribution.wcf.transceivers.WcfStandInTransceiver' npantarhei.distribution.wcf.contract.IStandInService,
