Project,Namespace,Ca types,Ce types
MonoDevelop.Ide,MonoDevelop.Components,MonoDevelop.Ide.Gui.Dialogs.FileSelectorDialog' MonoDevelop.Ide.Projects.AddFileDialog' MonoDevelop.Components.Extensions.SelectFileDialog<T>' MonoDevelop.Ide.Projects.NewProjectOptionsWidget' MonoDevelop.Ide.Gui.OptionPanels.SdkLocationWidget' MonoDevelop.Ide.Tasks.UserTasksView' MonoDevelop.Ide.Projects.OptionPanels.CodeFormattingPanelWidget' MonoDevelop.Ide.Projects.OptionPanels.CombineConfigurationPanelWidget' MonoDevelop.Ide.Execution.CustomExecutionModeManagerDialog' MonoDevelop.Ide.Gui.Components.StringTagSelectorButton' MonoDevelop.Ide.Projects.DefaultPolicyOptionsDialog' MonoDevelop.Components.DockNotebook.TabStrip' MonoDevelop.Ide.CodeCompletion.ParameterInformationWindow' MonoDevelop.Ide.CodeCompletion.TooltipInformationWindow' MonoDevelop.Ide.WelcomePage.WelcomePageProjectBar' MonoDevelop.Ide.Gui.Components.PadTreeView' MonoDevelop.Ide.ImageService' MonoDevelop.Components.AutoTest.Results.GtkWidgetResult' MonoDevelop.Ide.Projects.TemplatePickerWidget' MonoDevelop.Ide.Gui.Components.LogView' MonoDevelop.Ide.Projects.SelectReferenceDialog' MonoDevelop.Ide.Projects.CombinedBox' MonoDevelop.Ide.FindInFiles.FindInFilesDialog' MonoDevelop.Components.MainToolbar.MainToolbar' MonoDevelop.Ide.Gui.Pads.ErrorListPad' MonoDevelop.Ide.BuildOutputView.BuildOutputWidget' MonoDevelop.Ide.Gui.Content.IPathedDocument' MonoDevelop.Ide.Gui.Content.DocumentPathChangedEventArgs' MonoDevelop.Ide.Gui.Shell.GtkShellDocumentViewContent' MonoDevelop.Components.PropertyGrid.PropertyEditors.FilePathEditor' MonoDevelop.Ide.Projects.OptionPanels.CustomCommandWidget' MonoDevelop.Ide.Editor.TextMate.TextMateBundleOptionsPanelWidget' MonoDevelop.Ide.Projects.GtkProjectConfigurationWidget' MonoDevelop.Ide.Gui.OptionPanels.MonoRuntimePanelWidget' MonoDevelop.Ide.Gui.Pads.ProjectPad.FolderCommandHandler' MonoDevelop.Components.Theming.Theme' MonoDevelop.Components.Theming.GtkTheme' MonoDevelop.Components.Theming.GtkColors' MonoDevelop.Components.MainToolbar.StatusAreaBuildTheme' MonoDevelop.Ide.WelcomePage.WelcomePageListButton' MonoDevelop.Components.MainToolbar.StatusAreaTheme' MonoDevelop.Ide.WelcomePage.WelcomePageSection' MonoDevelop.Ide.WelcomePage.WelcomePageFirstRun' MonoDevelop.Ide.ThreadedRenderer' MonoDevelop.Ide.Gui.Pads.HelpTree' MonoDevelop.Ide.Gui.Pads.TaskListPad' MonoDevelop.Ide.Gui.Dialogs.VersionInformationTabPage' MonoDevelop.Components.PropertyGrid.PropertyGrid' MonoDevelop.Ide.Gui.Components.ExtensibleTreeView' MonoDevelop.Ide.FindInFiles.SearchResultWidget' MonoDevelop.Ide.CodeCompletion.CompletionListWindowGtk' MonoDevelop.Ide.Gui.Shell.GtkShellDocumentViewContainer' MonoDevelop.Ide.Gui.Shell.GtkShellDocumentViewContainerTabs' MonoDevelop.Ide.MonoDevelopStatusBar' MonoDevelop.Ide.Gui.Dialogs.OptionsDialog' MonoDevelop.Components.Extensions.GtkExtendedTitleBarWindowBackend' MonoDevelop.Components.Extensions.GtkExtendedTitleBarDialogBackend' MonoDevelop.Components.Extensions.SelectFileDialogData' MonoDevelop.Ide.Gui.OptionPanels.KeyBindingsPanel' MonoDevelop.Components.PropertyGrid.PropertyGridTable' MonoDevelop.Components.MainToolbar.StatusArea' MonoDevelop.Ide.Editor.TextMate.ShowTextMateScopesHandler' MonoDevelop.Components.DockNotebook.DockNotebookContainer' MonoDevelop.Components.Docking.DockItemTitleTab' MonoDevelop.Components.Docking.DockBarItem' MonoDevelop.Components.MainToolbar.SearchPopupWidget' MonoDevelop.Ide.Editor.TooltipProvider' MonoDevelop.Components.MainToolbar.MainToolbarController' MonoDevelop.Ide.Projects.NewFileDialog' MonoDevelop.Ide.CodeTemplates.CodeTemplatePanelWidget' MonoDevelop.Ide.Gui.Components.NodeInfo' MonoDevelop.Ide.Projects.AssemblyReferencePanel' MonoDevelop.Ide.Projects.ConfirmProjectDeleteDialog' MonoDevelop.Ide.Projects.ProjectReferencePanel' MonoDevelop.Ide.Projects.ProjectFileSelectorDialog' MonoDevelop.Ide.Projects.OptionPanels.NamespaceSynchronisationPanelWidget' MonoDevelop.Ide.Gui.Components.ProjectSelectorWidget' MonoDevelop.Ide.Projects.GtkProjectFolderPreviewWidget' MonoDevelop.Ide.Projects.PackageReferencePanel' MonoDevelop.Ide.Gui.Components.ZoomableCellRendererPixbuf' MonoDevelop.Ide.Projects.IncludeNewFilesDialog' MonoDevelop.Ide.Gui.Dialogs.AboutMonoDevelopTabPage' MonoDevelop.Ide.Projects.OptionPanels.PortableRuntimeSelectorDialog' MonoDevelop.Ide.Gui.ToolButtonStatus' MonoDevelop.Ide.Gui.Pads.DefaultMonitorPad' MonoDevelop.Components.Commands.CommandMenuItem' MonoDevelop.Components.Commands.CommandToolButton' MonoDevelop.Components.Commands.LinkCommandEntry' MonoDevelop.Ide.Gui.Dialogs.MultiMessageDialog' MonoDevelop.Ide.Gui.Dialogs.PolicyOptionsPanel<T>' MonoDevelop.Ide.Gui.Dialogs.MimeTypePolicyOptionsSection' MonoDevelop.Components.Docking.DockToolButton' MonoDevelop.Ide.Gui.Dialogs.GtkAlertDialog' MonoDevelop.Ide.WelcomePage.WelcomePageLinkButton' MonoDevelop.Components.PropertyGrid.PropertyEditors.CollectionEditor' MonoDevelop.Components.DockNotebook.DocumentTitleWindow' MonoDevelop.Components.Commands.CommandToggleToolButton' MonoDevelop.Ide.WelcomePage.WelcomePageFeedItem' MonoDevelop.Ide.Gui.Documents.DocumentToolButton' MonoDevelop.Ide.Gui.Shell.DocumentToolButton' MonoDevelop.Ide.Gui.WorkbenchWindow' MonoDevelop.Ide.Commands.RecentProjectListHandler' MonoDevelop.Ide.IdeInstanceConnection' MonoDevelop.Components.Commands.KeyBindingManager' MonoDevelop.Ide.ProgressMonitoring.MultiTaskDialogProgressMonitor' MonoDevelop.Ide.DocumentList' MonoDevelop.Components.Docking.PlaceholderWindow' MonoDevelop.Components.Docking.DockContainer' MonoDevelop.Ide.CodeCompletion.ListWidget' MonoDevelop.Components.Docking.DockFrame' MonoDevelop.Ide.MessageService' MonoDevelop.Ide.IdeApp' MonoDevelop.Components.Commands.CommandManager' MonoDevelop.Ide.IdeStartup' MonoDevelop.Ide.Projects.OptionPanels.PortableRuntimeOptionsPanelWidget' MonoDevelop.Components.Commands.KeyBinding' MonoDevelop.Ide.Projects.ApplyPolicyDialog' MonoDevelop.Ide.FindInFiles.MemberReference' MonoDevelop.Ide.FindInFiles.SearchResult' MonoDevelop.Ide.Editor.IGenericTextSegmentMarker' MonoDevelop.Ide.Editor.TextMarkerFactory' MonoDevelop.Ide.FindInFiles.PangoHelper' MonoDevelop.Ide.Editor.ITextMarkerFactory' MonoDevelop.Ide.Editor.Highlighting.SyntaxHighlightingService' MonoDevelop.Ide.Editor.Highlighting.TmSetting' MonoDevelop.Ide.Editor.Highlighting.TextMateFormat' MonoDevelop.Ide.Editor.Highlighting.ThemeSetting' MonoDevelop.Ide.Editor.Highlighting.EditorTheme' MonoDevelop.Ide.Editor.Highlighting.ChunkStyle' MonoDevelop.Ide.Editor.Highlighting.OldFormat' MonoDevelop.Ide.Gui.Components.ColumnSelectorMenu' MonoDevelop.Ide.Tasks.CommentTasksView' MonoDevelop.Components.Docking.DockItem' MonoDevelop.Components.DockNotebook.DockNotebook' MonoDevelop.Ide.Gui.OptionPanels.LoadSavePanel' MonoDevelop.Ide.Gui.OptionPanels.BuildPanel' MonoDevelop.Ide.Gui.Pads.TreeViewPad' MonoDevelop.Ide.Gui.OptionPanels.AddInsOptionsPanel' MonoDevelop.Ide.Gui.OptionPanels.TasksPanelWidget' MonoDevelop.Ide.Gui.PadContent' MonoDevelop.Ide.Tasks.ITaskListView' MonoDevelop.Ide.Gui.OptionPanels.IDEStyleOptionsPanel' MonoDevelop.Ide.ExternalTools.ExternalToolPane' MonoDevelop.Ide.Gui.OptionPanels.AuthorInformationPanel' MonoDevelop.Ide.Gui.OptionPanels.GlobalAuthorInformationPanel' MonoDevelop.Ide.Gui.OptionPanels.TextStylePolicyPanel' MonoDevelop.Ide.StandardHeader.StandardHeaderPolicyPanel' MonoDevelop.Ide.CodeTemplates.CodeTemplatePane' MonoDevelop.Ide.Gui.OptionPanels.MonoRuntimePanel' MonoDevelop.Ide.FindInFiles.SearchResultPad' MonoDevelop.Ide.Gui.OptionPanels.MaintenanceOptionsPanel' MonoDevelop.Ide.Gui.OptionPanels.BuildMessagePanel' MonoDevelop.Ide.Gui.PadFontChanger' MonoDevelop.Ide.Gui.DockItemToolbarLoader' MonoDevelop.Components.Chart.BasicChart' MonoDevelop.Components.Commands.CommandRouterContainer' MonoDevelop.Components.PropertyGrid.PropertyEditorCell' MonoDevelop.Components.PropertyGrid.EditSession' MonoDevelop.Ide.Gui.Dialogs.IOptionsPanel' MonoDevelop.Ide.Gui.Dialogs.OptionsPanel' MonoDevelop.Ide.Projects.OptionPanels.BaseDirectoryPanel' MonoDevelop.Ide.Gui.Dialogs.MultiConfigItemOptionsPanel' MonoDevelop.Ide.Projects.OptionPanels.CombineBuildOptions' MonoDevelop.Ide.Projects.OptionPanels.CodeFormattingPanel' MonoDevelop.Ide.Projects.OptionPanels.CombineConfigurationPanel' MonoDevelop.Ide.Projects.OptionPanels.CombineInformationPanel' MonoDevelop.Ide.Projects.OptionPanels.CommonAssemblySigningPreferencesPanel' MonoDevelop.Ide.Projects.OptionPanels.GeneralProjectOptions' MonoDevelop.Ide.Projects.OptionPanels.NamespaceSynchronisationPanel' MonoDevelop.Ide.Projects.OptionPanels.OutputOptionsPanel' MonoDevelop.Ide.Projects.OptionPanels.CustomCommandPanel' MonoDevelop.Ide.Projects.OptionPanels.RunOptionsPanel' MonoDevelop.Ide.Projects.OptionPanels.RuntimeOptionsPanel' MonoDevelop.Ide.Projects.OptionPanels.SolutionItemConfigurationsPanel' MonoDevelop.Ide.Fonts.FontChooserPanel' MonoDevelop.Ide.Gui.OptionPanels.LogAgentOptionsPanel' MonoDevelop.Components.Docking.DockItemToolbar' MonoDevelop.Ide.Gui.Pads.ClassBrowser.ClassBrowserPad' MonoDevelop.Ide.Projects.OptionPanels.PortableRuntimeOptionsPanel' MonoDevelop.Ide.WelcomePage.WelcomePageOptionPanel' MonoDevelop.Ide.Gui.OptionPanels.SdkLocationPanel' MonoDevelop.Ide.TextEditing.TopLevelWidgetExtension' MonoDevelop.Ide.WelcomePage.IWelcomePageProvider' MonoDevelop.Ide.Editor.TextEditorViewContent' MonoDevelop.Ide.Templates.WizardPage' MonoDevelop.Ide.Projects.ProjectConfigurationControl' MonoDevelop.Ide.Projects.OptionPanels.CodeAnalysisPanel' MonoDevelop.Ide.Editor.ITextEditorImpl' MonoDevelop.Ide.Execution.RunConfigurationEditor' MonoDevelop.Ide.Projects.OptionPanels.RunConfigurationPanel' MonoDevelop.Ide.Projects.OptionPanels.RunConfigurationsPanel' MonoDevelop.Ide.Editor.TextEditor' MonoDevelop.Ide.Projects.OptionPanels.ProcessRunConfigurationEditor' MonoDevelop.Ide.Editor.TextMate.TextMateBundleOptionsPanel' MonoDevelop.Ide.Projects.OptionPanels.AssemblyRunConfigurationEditor' MonoDevelop.Ide.Projects.OptionPanels.SolutionRunConfigurationsPanel' MonoDevelop.Components.Commands.ActiveWidgetEventArgs' MonoDevelop.Ide.Projects.OptionPanels.SolutionRunConfigurationPanel' MonoDevelop.Ide.GettingStarted.GettingStartedProvider' MonoDevelop.Ide.GettingStarted.GettingStartedViewContent' MonoDevelop.Ide.Gui.Wizard.IWizardDialogController' MonoDevelop.Ide.Gui.Wizard.IWizardDialogPage' MonoDevelop.Ide.Gui.Wizard.WizardDialogControllerBase' MonoDevelop.Ide.Gui.Wizard.WizardDialogController' MonoDevelop.Ide.BuildOutputView.BuildOutputViewContent' MonoDevelop.Ide.Gui.Wizard.WizardDialogPageBase' MonoDevelop.Ide.Gui.Shell.IShellDocumentViewContent' MonoDevelop.Ide.Gui.Shell.IShellDocumentToolbar' MonoDevelop.Ide.Gui.Documents.DocumentViewContent' MonoDevelop.Ide.Gui.Documents.DocumentToolbar' MonoDevelop.Ide.Gui.Shell.GtkDocumentToolbar' MonoDevelop.Ide.Gui.Documents.DocumentController' MonoDevelop.Ide.ExternalTools.ExternalToolPanelWidget' MonoDevelop.Ide.Gui.Dialogs.OpenFileDialog' MonoDevelop.Ide.Projects.ExportProjectPolicyDialog' MonoDevelop.Ide.Commands.OpenFileHandler' MonoDevelop.Ide.Gui.Document' MonoDevelop.Ide.Gui.Dialogs.AddinLoadErrorDialog' MonoDevelop.Ide.Gui.Dialogs.CommonAboutDialog' MonoDevelop.Ide.Gui.Dialogs.DirtyFilesDialog' MonoDevelop.Components.DockNotebook.DockWindow' MonoDevelop.Ide.Gui.Dialogs.TipOfTheDayWindow' MonoDevelop.Ide.DocumentSwitcher' MonoDevelop.Components.PropertyGrid.PropertyEditors.TextEditorDialog' MonoDevelop.Components.PropertyGrid.PropertyEditors.FlagsSelectorDialog' MonoDevelop.Ide.Gui.Dialogs.ProgressDialog' MonoDevelop.Ide.IdePreferences' MonoDevelop.Ide.Gui.DefaultWorkbench' MonoDevelop.Ide.Projects.AddExternalFileDialog' MonoDevelop.Ide.Gui.OptionPanels.IDEStyleOptionsPanelWidget' MonoDevelop.Ide.Gui.Styles' MonoDevelop.Ide.Commands.OpenWindowListHandler' MonoDevelop.Ide.Gui.Workbench' MonoDevelop.Components.Extensions.PlatformDialogData' MonoDevelop.Components.Extensions.PlatformDialog<T>' MonoDevelop.Ide.ProgressMonitoring.ProgressHelper' MonoDevelop.Ide.ProgressMonitoring.MessageDialogProgressMonitor' MonoDevelop.Ide.Gui.Dialogs.ItemOptionsDialog' MonoDevelop.Ide.Gui.Dialogs.MultiConfigItemOptionsDialog' MonoDevelop.Ide.Projects.CombineOptionsDialog' MonoDevelop.Ide.Projects.ProjectOptionsDialog' MonoDevelop.Ide.DesktopService' MonoDevelop.Ide.Desktop.PlatformService' MonoDevelop.Ide.WelcomePage.WelcomePageService' MonoDevelop.Ide.Editor.Projection.ProjectedTooltipProvider' MonoDevelop.Ide.WelcomePage.IWelcomeWindowProvider' MonoDevelop.Ide.Projects.OptionPanels.ProcessRunConfigurationEditorWidget' MonoDevelop.Ide.Projects.OptionPanels.DotNetRunConfigurationEditorWidget' MonoDevelop.Ide.Gui.Dialogs.NewFolderDialog' MonoDevelop.Ide.Gui.Dialogs.NewConfigurationDialog' MonoDevelop.Ide.Gui.Wizard.WizardDialog' MonoDevelop.Components.MainToolbar.SearchCategory' MonoDevelop.Components.MainToolbar.SearchPopupWindow' MonoDevelop.Ide.Gui.OptionPanels.LogAgentPanelWidget,MonoDevelop.Ide.IdeApp' MonoDevelop.Components.AtkCocoaHelper.AtkCocoa' MonoDevelop.Components.AtkCocoaHelper.Roles' MonoDevelop.Ide.IdeServices' MonoDevelop.Components.Commands.CommandEntrySet' MonoDevelop.Components.AtkCocoaHelper.ActionDelegate' MonoDevelop.Ide.Gui.Styles' MonoDevelop.Ide.ImageService' MonoDevelop.Components.AtkCocoaHelper.AccessibilityElementProxy' MonoDevelop.Components.Extensions.SelectFileDialogData' MonoDevelop.Components.Extensions.SelectFileDialog<T>' MonoDevelop.Components.Theming.Theme' MonoDevelop.Components.Theming.ThemeEngine' MonoDevelop.Components.Commands.ActionCommand' MonoDevelop.Components.Commands.CommandArrayInfo' MonoDevelop.Components.Commands.CommandHandlerAttribute' MonoDevelop.Components.Commands.CommandUpdateHandlerAttribute' MonoDevelop.Components.Commands.CommandManager' MonoDevelop.Components.Extensions.SelectFileDialogFilter' MonoDevelop.Ide.Gui.PopoverWindow' MonoDevelop.Ide.Tasks.TaskSeverity' MonoDevelop.Ide.Editor.Highlighting.SyntaxHighlightingService' MonoDevelop.Ide.Editor.Highlighting.EditorTheme' MonoDevelop.Ide.Editor.Highlighting.EditorThemeColors' MonoDevelop.Ide.Theme' MonoDevelop.Components.Extensions.IExtendedTitleBarWindowBackend' MonoDevelop.Components.Extensions.IExtendedTitleBarDialogBackend' MonoDevelop.Components.Commands.ICommandRouter' MonoDevelop.Components.Commands.CommandRouterContainer' MonoDevelop.Ide.AlertButton' MonoDevelop.Ide.MessageService' MonoDevelop.Ide.IdeStartupTracker' MonoDevelop.Ide.Gui.OptionPanels.IDEStyleOptionsPanelWidget' MonoDevelop.Ide.Gui.Components.AnimatedIcon' MonoDevelop.Components.PropertyGrid.PropertyGrid' MonoDevelop.Components.PropertyGrid.IToolbarProvider
MonoDevelop.Ide,MonoDevelop.Components.Chart,,MonoDevelop.Components.Control' MonoDevelop.Ide.IdeServices' MonoDevelop.Ide.Gui.Styles
MonoDevelop.Ide,MonoDevelop.Components.Commands.ExtensionNodes,MonoDevelop.Components.Commands.CommandManager' MonoDevelop.Components.MainToolbar.MainToolbarController' MonoDevelop.Components.Commands.KeyBindingService,MonoDevelop.Components.Commands.ActionCommand' MonoDevelop.Components.Commands.ActionType' MonoDevelop.Components.Commands.Command' MonoDevelop.Components.Commands.CustomCommand' MonoDevelop.Components.Commands.KeyBindingManager' MonoDevelop.Components.Commands.CommandEntry' MonoDevelop.Components.Commands.CommandEntrySet' MonoDevelop.Components.Commands.LinkCommandEntry' MonoDevelop.Components.Commands.KeyBindingService' MonoDevelop.Components.Commands.KeyBindingScheme' MonoDevelop.Components.Commands.KeyBindingSet
MonoDevelop.Ide,MonoDevelop.Components.Extensions,MonoDevelop.Ide.Extensions.IAddFileDialogHandler' MonoDevelop.Ide.Extensions.IOpenFileDialogHandler' MonoDevelop.Ide.Extensions.AddFileDialogData' MonoDevelop.Components.SelectFolderDialog' MonoDevelop.Ide.Extensions.OpenFileDialogData' MonoDevelop.Components.SelectFileDialog' MonoDevelop.Ide.Projects.ProjectFileSelectorDialog' MonoDevelop.Components.FileFilterSet' MonoDevelop.Ide.Projects.AddFileDialog' MonoDevelop.Ide.Gui.Dialogs.OpenFileDialog' MonoDevelop.Ide.MessageService' MonoDevelop.Components.ExtendedTitleBarWindow' MonoDevelop.Ide.IdeStartup' MonoDevelop.Components.ExtendedTitleBarDialog,MonoDevelop.Components.Window' MonoDevelop.Components.FileFilterSet' MonoDevelop.Components.FileChooserAction' MonoDevelop.Ide.MessageService' MonoDevelop.Components.FileSelector' MonoDevelop.Ide.AlertButton' MonoDevelop.Ide.AlertOption' MonoDevelop.Ide.MessageDescription' MonoDevelop.Ide.Gui.Dialogs.GtkAlertDialog' MonoDevelop.Components.HeaderBox' MonoDevelop.Components.ThemedGtkWindowBackend' MonoDevelop.Components.ThemedGtkDialogBackend
MonoDevelop.Ide,MonoDevelop.Components.PropertyGrid,MonoDevelop.Components.PropertyGrid.PropertyEditors.CollectionEditor' MonoDevelop.Components.PropertyGrid.PropertyEditors.DateTimeEditorCell' MonoDevelop.Components.PropertyGrid.PropertyEditors.ColorEditorCell' MonoDevelop.Components.PropertyGrid.PropertyEditors.EnumerationEditorCell' MonoDevelop.Components.PropertyGrid.PropertyEditors.DefaultEditor' MonoDevelop.Components.PropertyGrid.PropertyEditors.FlagsEditorCell' MonoDevelop.Components.PropertyGrid.PropertyEditors.EventEditorCell' MonoDevelop.Components.PropertyGrid.PropertyEditors.TimeSpanEditorCell' MonoDevelop.Components.PropertyGrid.PropertyEditors.BooleanEditorCell' MonoDevelop.Components.PropertyGrid.PropertyEditors.FilePathEditor' MonoDevelop.Components.PropertyGrid.PropertyEditors.ColorEditor' MonoDevelop.Components.PropertyGrid.PropertyEditors.CharPropertyEditor' MonoDevelop.Components.PropertyGrid.PropertyEditors.DateTimeEditor' MonoDevelop.Components.PropertyGrid.PropertyEditors.EventEditor' MonoDevelop.Components.PropertyGrid.PropertyEditors.FlagsEditor' MonoDevelop.Components.PropertyGrid.PropertyEditors.EnumerationEditor' MonoDevelop.Components.PropertyGrid.PropertyEditors.IntRangeEditor' MonoDevelop.Components.PropertyGrid.PropertyEditors.FloatRange' MonoDevelop.Components.PropertyGrid.PropertyEditors.TimeSpanEditor' MonoDevelop.Components.PropertyGrid.PropertyEditors.BooleanEditor' MonoDevelop.Components.PropertyGrid.PropertyEditors.PropertyTextEditor' MonoDevelop.Ide.CodeTemplates.EditTemplateDialog' MonoDevelop.Components.IPropertyGrid,MonoDevelop.Components.PropertyGrid.PropertyEditors.CollectionEditor' MonoDevelop.Components.PropertyGrid.PropertyEditors.EnumerationEditorCell' MonoDevelop.Components.PropertyGrid.PropertyEditors.FlagsEditorCell' MonoDevelop.Components.PropertyGrid.PropertyEditors.PropertyTextEditor' MonoDevelop.Ide.IdeServices' MonoDevelop.Ide.Gui.Styles' MonoDevelop.Components.Control' MonoDevelop.Ide.ImageService' MonoDevelop.Ide.Gui.Stock' MonoDevelop.Components.CompactScrolledWindow' MonoDevelop.Components.ImageView' MonoDevelop.Components.IPropertyGrid' MonoDevelop.Components.TooltipPopoverWindow' MonoDevelop.Components.PopupPosition' MonoDevelop.Components.GtkWorkarounds
MonoDevelop.Ide,MonoDevelop.Components.PropertyGrid.PropertyEditors,MonoDevelop.Components.PropertyGrid.EditorManager,MonoDevelop.Components.PropertyGrid.EditSession' MonoDevelop.Components.PropertyGrid.IPropertyEditor' MonoDevelop.Components.PropertyGrid.PropertyEditorTypeAttribute' MonoDevelop.Ide.MessageService' MonoDevelop.Components.ImageView' MonoDevelop.Components.IdeTheme' MonoDevelop.Components.PropertyGrid.EditorManager' MonoDevelop.Components.PropertyGrid.PropertyEditorCell' MonoDevelop.Components.PropertyGrid.PropertyGrid' MonoDevelop.Ide.IdeServices' MonoDevelop.Ide.Gui.Styles' MonoDevelop.Components.SelectFileDialog' MonoDevelop.Components.FileChooserAction
MonoDevelop.Ide,MonoDevelop.Components.Theming,MonoDevelop.Components.RoundedFrame,MonoDevelop.Components.CairoExtensions' MonoDevelop.Components.CairoCorners
MonoDevelop.Ide,MonoDevelop.Components.Docking,MonoDevelop.Components.DockNotebook.TabStrip' MonoDevelop.Ide.WelcomePage.WelcomePageService' MonoDevelop.Ide.Gui.DefaultWorkbench' MonoDevelop.Ide.Gui.PadWindow' MonoDevelop.Ide.Gui.Workbench' MonoDevelop.Ide.Gui.IPadWindow' MonoDevelop.Ide.MonoDevelopStatusBar' MonoDevelop.Components.DockNotebook.DocumentTitleWindow' MonoDevelop.Ide.Codons.PadCodon' MonoDevelop.Ide.Gui.IdeProgressMonitorManager' MonoDevelop.Ide.Extensions.LayoutPadExtensionNode' MonoDevelop.Ide.Gui.Pads.TaskListPad' MonoDevelop.Ide.Gui.Pads.DefaultMonitorPad' MonoDevelop.Ide.Gui.DockItemToolbarLoader' MonoDevelop.Ide.Gui.CommandDockBar' MonoDevelop.Ide.Gui.Pads.ErrorListPad,MonoDevelop.Components.AtkCocoaHelper.AtkCocoa' MonoDevelop.Components.AtkCocoaHelper.Roles' MonoDevelop.Ide.Gui.Styles' MonoDevelop.Ide.IdeServices' MonoDevelop.Components.MouseTracker' MonoDevelop.Components.AtkCocoaHelper.ActionDelegate' MonoDevelop.Components.GtkWorkarounds' MonoDevelop.Ide.IdeApp' MonoDevelop.Components.IdeWindow' MonoDevelop.Components.ContextMenu' MonoDevelop.Components.ContextMenuItem' MonoDevelop.Components.Control' MonoDevelop.Components.ImageView' MonoDevelop.Ide.Theme' MonoDevelop.Ide.ImageService' MonoDevelop.Components.ExtendedLabel' MonoDevelop.Components.ImageButton
MonoDevelop.Ide,MonoDevelop.Ide.ProgressMonitoring,MonoDevelop.Ide.Updater.AddinsUpdateHandler,MonoDevelop.Ide.MessageService' MonoDevelop.Ide.Gui.Dialogs.MultiMessageDialog' MonoDevelop.Components.Window' MonoDevelop.Ide.DispatchService' MonoDevelop.Ide.IdeServices' MonoDevelop.Ide.Gui.Dialogs.ProgressDialog' MonoDevelop.Ide.Gui.AsyncDispatchAttribute' MonoDevelop.Ide.Gui.Dialogs.MultiTaskProgressDialog' MonoDevelop.Components.GtkWorkarounds
MonoDevelop.Ide,MonoDevelop.Ide.WebBrowser,MonoDevelop.Ide.WebBrowserService,
MonoDevelop.Ide,MonoDevelop.Ide.CodeCompletion,MonoDevelop.Ide.Editor.Extension.CompletionTextEditorExtension' MonoDevelop.Ide.CodeTemplates.CodeTemplateCompletionData' MonoDevelop.Ide.Editor.Projection.ProjectedFilterCompletionTextEditorExtension' MonoDevelop.Ide.Editor.Projection.ProjectedCompletionExtension' MonoDevelop.Ide.CodeTemplates.CodeTemplateService' MonoDevelop.Ide.Editor.TextMate.TextMateCompletionTextEditorExtension' MonoDevelop.Ide.TypeSystem.AmbienceTooltipProvider' MonoDevelop.Components.MainToolbar.ISearchDataSource' MonoDevelop.Components.MainToolbar.SearchResult' MonoDevelop.Components.MainToolbar.DeclaredSymbolInfoResult' MonoDevelop.Ide.TypeSystem.Ambience' MonoDevelop.Components.MainToolbar.ResultsDataSource' MonoDevelop.Components.MainToolbar.SearchPopupWidget' MonoDevelop.Ide.Editor.TooltipProvider,MonoDevelop.Ide.Editor.Extension.CompletionTextEditorExtension' MonoDevelop.Ide.Editor.Extension.KeyDescriptor' MonoDevelop.Ide.IdeApp' MonoDevelop.Ide.Editor.Extension.SpecialKey' MonoDevelop.Ide.IdeServices' MonoDevelop.Ide.Gui.Styles' MonoDevelop.Ide.Gui.PopoverWindow' MonoDevelop.Components.FixedWidthWrapLabel' MonoDevelop.Components.WindowTransparencyDecorator' MonoDevelop.Components.XwtThemedPopup' MonoDevelop.Ide.Editor.Highlighting.SyntaxHighlightingService' MonoDevelop.Ide.TypeSystem.Stock' MonoDevelop.Ide.ImageService' MonoDevelop.Ide.Gui.CodeCompletion' MonoDevelop.Components.GtkWorkarounds' MonoDevelop.Ide.Editor.Highlighting.EditorTheme' MonoDevelop.Ide.Counters' MonoDevelop.Components.PopupPosition' MonoDevelop.Ide.Editor.TextEditor' MonoDevelop.Ide.Editor.DocumentContext' MonoDevelop.Ide.TypeSystem.Ambience' MonoDevelop.Ide.Editor.Highlighting.EditorThemeColors' MonoDevelop.Ide.Editor.DefaultSourceEditorOptions' MonoDevelop.Ide.Gui.Document' MonoDevelop.Ide.CodeTemplates.CodeTemplateService' MonoDevelop.Ide.Editor.Extension.ModifierKeys' MonoDevelop.Components.CompactScrolledWindow' MonoDevelop.Components.PopoverWindow' MonoDevelop.Components.ImageView
MonoDevelop.Ide,Mono.Profiler,,
MonoDevelop.Ide,MonoDevelop.Ide.Desktop,MonoDevelop.Ide.DesktopService' MonoDevelop.Ide.Gui.IExternalDisplayBinding' MonoDevelop.Ide.Gui.FileViewer' MonoDevelop.Ide.Templates.RecentTemplates' MonoDevelop.Ide.IdeStartup' MonoDevelop.Ide.IdeStartupTracker,MonoDevelop.Ide.DesktopService' MonoDevelop.Components.Commands.CommandManager' MonoDevelop.Ide.MimeTypeCatalog' MonoDevelop.Ide.IdeApp' MonoDevelop.Ide.ImageService' MonoDevelop.Ide.IdeServices' MonoDevelop.Ide.Extensions.MimeTypeNode' MonoDevelop.Components.Window' MonoDevelop.Components.MainToolbar.MainToolbar' MonoDevelop.Components.MainToolbar.IMainToolbarView' MonoDevelop.Ide.PlatformMemoryStatusEventArgs' MonoDevelop.Ide.PlatformThermalStatusEventArgs
