Project,Namespace,Ca types,Ce types
MonoDevelop.Ide,Microsoft.VisualStudio.Text.Editor,MonoDevelop.Ide.Editor.TextEditor,MonoDevelop.Ide.Editor.TextEditor
MonoDevelop.Ide,MonoDevelop.Ide.Gui,MonoDevelop.Ide.IdeServices' MonoDevelop.Ide.Gui.Documents.DocumentManager' MonoDevelop.Ide.IdeApp' MonoDevelop.Ide.ParseProgressMonitorFactory' MonoDevelop.Ide.Gui.Pads.DefaultMonitorPad' MonoDevelop.Ide.Gui.Pads.HelpTree' MonoDevelop.Ide.Gui.Pads.TreeViewPad' MonoDevelop.Ide.Codons.SolutionPadCodon' MonoDevelop.Ide.Gui.Pads.TaskListPad' MonoDevelop.Ide.FindInFiles.SearchResultPad' MonoDevelop.Ide.Gui.Pads.ErrorListPad' MonoDevelop.Ide.Codons.PadCodon' MonoDevelop.Ide.Gui.Documents.DocumentViewContent' MonoDevelop.Ide.Gui.Documents.DocumentViewContainer' MonoDevelop.Ide.Gui.Shell.IShell' MonoDevelop.Ide.Gui.Shell.SdiWorkspaceWindow' MonoDevelop.Ide.Gui.Documents.DocumentView' MonoDevelop.Ide.TypeSystem.MonoDevelopWorkspace' MonoDevelop.Ide.Gui.Pads.ClassBrowser.ClassBrowserPad' MonoDevelop.Ide.Gui.Pads.ClassBrowser.ClassBrowserPadWidget' MonoDevelop.Ide.Commands.InsertStandardHeaderHandler' MonoDevelop.Ide.Gui.Pads.ProjectPad.ProjectSolutionPad' MonoDevelop.Ide.Commands.OpenDocumentListHandler' MonoDevelop.Ide.CodeTemplates.CodeTemplate' MonoDevelop.Ide.Commands.NavigateHistory' MonoDevelop.Ide.StandardHeader.StandardHeaderService' MonoDevelop.Ide.Gui.Pads.ProjectPad.FolderCommandHandler' MonoDevelop.Ide.FindInFiles.FileProvider' MonoDevelop.Ide.Gui.Content.ITextEditorResolverProvider' MonoDevelop.Ide.Gui.Content.TextEditorResolverService' MonoDevelop.Ide.FindInFiles.SearchResultWidget' MonoDevelop.Ide.DocumentSwitcher' MonoDevelop.Ide.FindInFiles.AllOpenFilesScope' MonoDevelop.Ide.CodeFormatting.FormatBufferHandler' MonoDevelop.Ide.Gui.Dialogs.DirtyFilesDialog' MonoDevelop.Ide.Tasks.TaskStore' MonoDevelop.Ide.Navigation.TextFileNavigationPoint' MonoDevelop.Ide.Navigation.DocumentNavigationPoint' MonoDevelop.Ide.Commands.CloseAllHandler' MonoDevelop.Ide.Commands.CloseAllExceptPinnedHandler' MonoDevelop.Ide.Commands.CloseAllButThisHandler' MonoDevelop.Ide.Commands.CopyPathNameHandler' MonoDevelop.Ide.Navigation.NavigationPoint' MonoDevelop.Ide.TypeSystem.CodeGenerator' MonoDevelop.Components.DockNotebook.DockWindow' MonoDevelop.Ide.TextFileProvider' MonoDevelop.Ide.CodeFormatting.CodeFormatter' MonoDevelop.Ide.Editor.DynamicAbbrevHandler' MonoDevelop.Ide.CodeCompletion.RoslynCompletionData' MonoDevelop.Ide.RoslynServices.MonoDevelopDocumentTrackingService' MonoDevelop.Ide.Gui.Documents.DocumentController' MonoDevelop.Ide.Gui.Documents.DocumentCloseEventArgs' MonoDevelop.Ide.RootWorkspace' MonoDevelop.Ide.Navigation.NavigationHistoryService' MonoDevelop.Ide.WelcomePage.WelcomePageFrame' MonoDevelop.Ide.Tasks.TaskService' MonoDevelop.Ide.FindInFiles.SearchProgressMonitor' MonoDevelop.Ide.Commands.ViewListHandler' MonoDevelop.Ide.CustomTools.CustomToolService' MonoDevelop.Components.MainToolbar.StatusArea' MonoDevelop.Ide.StatusBar' MonoDevelop.Ide.StatusBarContext' MonoDevelop.Components.MainToolbar.MainStatusBarContextImpl' MonoDevelop.Ide.StatusBarContextImpl' MonoDevelop.Ide.Tasks.TaskListEntry' MonoDevelop.Ide.Commands.DefaultStringTagProvider' MonoDevelop.Ide.Editor.ITextEditorImpl' MonoDevelop.Ide.Editor.TextEditorViewContent' MonoDevelop.Ide.Commands.OpenFileHandler' MonoDevelop.Components.DockNotebook.DockNotebook' MonoDevelop.Ide.Extensions.StartupInfo' MonoDevelop.Ide.IdeStartup' MonoDevelop.Ide.Counters' MonoDevelop.Ide.Gui.Dialogs.OpenFileDialog' MonoDevelop.Ide.Gui.Pads.ProjectPad.SolutionFolderFileNodeCommandHandler' MonoDevelop.Ide.Gui.Dialogs.FileSelectorDialog' MonoDevelop.Ide.Gui.Pads.ProjectPad.ProjectFileNodeCommandHandler' MonoDevelop.Ide.Gui.Pads.ProjectPad.SystemFileNodeCommandHandler' MonoDevelop.Ide.Extensions.OpenFileDialogData' MonoDevelop.Ide.Gui.Components.PadTreeView' MonoDevelop.Ide.ProgressMonitoring.MultiTaskDialogProgressMonitor' MonoDevelop.Ide.DispatchService' MonoDevelop.Ide.MessageService' MonoDevelop.Ide.Composition.CompositionManager' MonoDevelop.Ide.Commands.ClearRecentFilesHandler' MonoDevelop.Ide.Commands.ClearRecentProjectsHandler' MonoDevelop.Ide.Gui.Pads.ProjectPad.SolutionFolderNodeBuilder' MonoDevelop.Ide.Gui.Pads.ProjectPad.ProjectNodeBuilder' MonoDevelop.Ide.Gui.Pads.ProjectPad.ProjectFolderNodeBuilder' MonoDevelop.Ide.Gui.Pads.ProjectPad.ProjectReferenceNodeBuilder' MonoDevelop.Ide.Gui.Pads.ProjectPad.ProjectReferenceFolderNodeBuilder' MonoDevelop.Ide.Gui.Pads.ProjectPad.ShowAllFilesCommandHandler' MonoDevelop.Ide.Gui.Pads.ProjectPad.UnknownEntryNodeBuilder' MonoDevelop.Ide.Gui.Pads.ProjectPad.SolutionNodeBuilder' MonoDevelop.Ide.Gui.Pads.ProjectPad.WorkspaceNodeBuilder' MonoDevelop.Ide.CodeTemplates.CodeTemplatePanelWidget' MonoDevelop.Components.PropertyGrid.PropertyGrid' MonoDevelop.Ide.Gui.Dialogs.MimeTypePolicyOptionsSection' MonoDevelop.Ide.Projects.AssemblyReferencePanel' MonoDevelop.Ide.Projects.ProjectFileSelectorDialog' MonoDevelop.Ide.Projects.IncludeNewFilesDialog' MonoDevelop.Ide.Projects.OptionPanels.NamespaceSynchronisationPanelWidget' MonoDevelop.Ide.Gui.Dialogs.PolicyOptionsPanel<T>' MonoDevelop.Ide.Gui.Pads.ClassPad.NamespaceNodeBuilder' MonoDevelop.Ide.Gui.Pads.ClassPad.CombineNodeBuilder' MonoDevelop.Ide.Gui.Pads.ClassPad.SolutionNodeBuilder' MonoDevelop.Ide.Gui.Components.ProjectSelectorWidget' MonoDevelop.Ide.Gui.Pads.ClassPad.ReferenceNodeBuilder' MonoDevelop.Ide.TypeSystem.TypeSystemService' MonoDevelop.Ide.Updater.AddinsUpdateHandler' MonoDevelop.Ide.Projects.PackageReferencePanel' MonoDevelop.Ide.Gui.Pads.ProjectPad.PortableFrameworkSubsetNodeBuilder' MonoDevelop.Ide.TypeSystem.EditorNotificationServiceFactory' MonoDevelop.Ide.RoslynServices.MonoDevelopNotificationServiceFactory' MonoDevelop.Ide.Gui.Components.XwtInfoBar' MonoDevelop.Ide.QuestionMessage' MonoDevelop.Ide.ConfirmationMessage' MonoDevelop.Ide.BuildOutputView.Resources' MonoDevelop.Ide.BuildOutputView.BuildOutputTreeCellView' MonoDevelop.Ide.Gui.Pads.ProjectPad.ProjectFileNodeBuilder' MonoDevelop.Ide.Gui.OptionPanels.TasksPanelWidget' MonoDevelop.Ide.MonoDevelopStatusBar' MonoDevelop.Ide.Gui.Components.LogView' MonoDevelop.Components.SearchEntry' MonoDevelop.Components.PropertyGrid.PropertyEditorCell' MonoDevelop.Ide.Gui.Shell.GtkDocumentToolbar' MonoDevelop.Components.PropertyGrid.PropertyEditors.BooleanEditorCell' MonoDevelop.Ide.Gui.Components.ExtensibleTreeView' MonoDevelop.Components.PropertyGrid.PropertyEditors.FlagsEditorCell' MonoDevelop.Ide.Gui.OptionPanels.KeyBindingsPanel' MonoDevelop.Components.Chart.ChartWidget' MonoDevelop.Components.Docking.DockBar' MonoDevelop.Components.Docking.DockContainer' MonoDevelop.Components.PathBar' MonoDevelop.Components.Docking.DockGroup' MonoDevelop.Ide.IdePreferences' MonoDevelop.Ide.Gui.Pads.ProjectPad.SolutionFolderFileNodeBuilder' MonoDevelop.Ide.Projects.CustomSelectedReferenceCellRenderer' MonoDevelop.Ide.CodeCompletion.ListWidget' MonoDevelop.Components.DropDownBoxListWindow' MonoDevelop.Components.Docking.DockBarItem' MonoDevelop.Ide.Fonts.FontService' MonoDevelop.Ide.CodeCompletion.ParameterInformationWindow' MonoDevelop.Components.MainToolbar.MainToolbar' MonoDevelop.Ide.WelcomePage.WelcomePageWidget' MonoDevelop.Components.VPanedThin' MonoDevelop.Components.HPanedThin' MonoDevelop.Components.TooltipPopoverWindow' MonoDevelop.Components.Tabstrip' MonoDevelop.Components.Tab' MonoDevelop.Components.PropertyGrid.PropertyGridTable' MonoDevelop.Ide.CodeCompletion.TooltipInformationWindow' MonoDevelop.Ide.WelcomePage.Styles' MonoDevelop.Components.MainToolbar.SearchPopupWindow' MonoDevelop.Components.MainToolbar.SearchPopupWidget' MonoDevelop.Components.MainToolbar.SearchResult' MonoDevelop.Ide.WelcomePage.WelcomePageBarButton' MonoDevelop.Ide.WelcomePage.WelcomePageFeedItem' MonoDevelop.Ide.WelcomePage.WelcomePageProjectBar' MonoDevelop.Ide.WelcomePage.WelcomePageListButton' MonoDevelop.Ide.WelcomePage.WelcomePageTipOfTheDaySection' MonoDevelop.Ide.WelcomePage.WelcomePageSection' MonoDevelop.Components.Docking.DockItemTitleTab' MonoDevelop.Ide.BuildOutputView.Styles' MonoDevelop.Ide.Projects.GtkProjectConfigurationWidget' MonoDevelop.Components.PopoverWindowTheme' MonoDevelop.Components.DockNotebook.TabStrip' MonoDevelop.Ide.Projects.GtkTemplateCategoryCellRenderer' MonoDevelop.Ide.Projects.GtkProjectFolderPreviewWidget' MonoDevelop.Ide.Projects.GtkTemplateCellRenderer' MonoDevelop.Components.IdeTheme' MonoDevelop.Components.ExtendedHeaderBox' MonoDevelop.Ide.CodeCompletion.CompletionListWindowGtk' MonoDevelop.Ide.BuildOutputView.BuildOutputWidget' MonoDevelop.Ide.Gui.Wizard.WizardDialog' MonoDevelop.Ide.Projects.LanguageCellRenderer' MonoDevelop.Components.RoundedFrameBox' MonoDevelop.Ide.CodeCompletion.CompletionController' MonoDevelop.Components.XwtBoxTooltip' MonoDevelop.Components.MainToolbar.StatusAreaTheme' MonoDevelop.Components.XwtPopupWindowTheme' MonoDevelop.Ide.IdeStartupTracker' MonoDevelop.Components.DockNotebook.PlaceholderWindow' MonoDevelop.Components.DockNotebook.DockNotebookContainer' MonoDevelop.Ide.WelcomePage.WelcomePageService' MonoDevelop.Components.MainToolbar.DeclaredSymbolInfoResult' MonoDevelop.Ide.RoslynServices.MonoDevelopDocumentNavigationService' MonoDevelop.Ide.Gui.Documents.DocumentControllerExtension,MonoDevelop.Ide.DesktopService' MonoDevelop.Ide.IdeServices' MonoDevelop.Ide.Gui.Documents.FileDescriptor' MonoDevelop.Ide.IdeApp' MonoDevelop.Ide.ImageService' MonoDevelop.Ide.StatusBarIcon' MonoDevelop.Ide.StatusBarContext' MonoDevelop.Components.Control' MonoDevelop.Ide.Gui.Shell.IShellDocumentViewItem' MonoDevelop.Ide.Gui.Shell.IShellDocumentViewContainer' MonoDevelop.Ide.Gui.Shell.IShellDocumentViewContent' MonoDevelop.Ide.Gui.Shell.IShellNotebook' MonoDevelop.Components.Commands.CommandHandlerAttribute' MonoDevelop.Components.Commands.CommandUpdateHandlerAttribute' MonoDevelop.Components.Commands.CommandInfo' MonoDevelop.Ide.Commands.EditCommands' MonoDevelop.Ide.Commands.FileCommands' MonoDevelop.Ide.Commands.SearchCommands' MonoDevelop.Ide.Commands.TextEditorCommands' MonoDevelop.Ide.AlertButton' MonoDevelop.Ide.MessageService' MonoDevelop.Ide.Gui.Content.IBookmarkBuffer' MonoDevelop.Ide.Gui.Content.IClipboardHandler' MonoDevelop.Ide.Gui.Content.IFoldable' MonoDevelop.Ide.Gui.Content.IUndoHandler' MonoDevelop.Ide.Editor.DefaultSourceEditorOptions' MonoDevelop.Ide.Editor.TextEditor' MonoDevelop.Components.Commands.CustomItem' MonoDevelop.Ide.FeatureSwitches' MonoDevelop.Components.Docking.VisibilityChangeEventArgs' MonoDevelop.Components.Docking.DockItemToolbar' MonoDevelop.Components.Docking.DockPositionType' MonoDevelop.Ide.Codons.PadCodon' MonoDevelop.Components.Docking.DockItem' MonoDevelop.Components.Docking.DockItemStatus' MonoDevelop.Ide.Counters' MonoDevelop.Ide.RootWorkspace' MonoDevelop.Ide.Tasks.TaskService' MonoDevelop.Ide.Gui.Dialogs.OpenFileDialog' MonoDevelop.Components.FileChooserAction' MonoDevelop.Ide.Editor.FileSettingsStore' MonoDevelop.Ide.Editor.DocumentContext' MonoDevelop.Ide.Editor.Highlighting.SyntaxHighlightingService' MonoDevelop.Ide.Editor.TextMate.TextMateLanguage' MonoDevelop.Ide.Gui.Documents.DocumentController' MonoDevelop.Ide.Gui.Documents.FileModel' MonoDevelop.Ide.Gui.Documents.DocumentControllerDescription' MonoDevelop.Ide.Gui.Documents.ModelDescriptor' MonoDevelop.Ide.Gui.Documents.DocumentManager' MonoDevelop.Ide.Gui.Documents.FileDocumentController' MonoDevelop.Ide.Gui.Documents.DocumentView' MonoDevelop.Ide.Gui.Documents.DocumentCloseEventArgs' MonoDevelop.Ide.Gui.Documents.ContentCallbackRegistry' MonoDevelop.Ide.Gui.Shell.IShell' MonoDevelop.Ide.Codons.CategoryNode' Microsoft.VisualStudio.Platform.NewTextSnapshotToTextReader' MonoDevelop.Ide.UserPreferencesEventArgs' MonoDevelop.Ide.StatusBar' MonoDevelop.Ide.Gui.Content.ILocationList' MonoDevelop.Ide.Gui.Dialogs.DirtyFilesDialog' MonoDevelop.Ide.Gui.Dialogs.OptionsDialog' MonoDevelop.Ide.Gui.Components.IInfoBarHost' MonoDevelop.Ide.Gui.Components.InfoBarOptions' MonoDevelop.Components.Window' MonoDevelop.Components.Docking.DockFloatingWindow' MonoDevelop.Ide.Projects.DefaultPolicyOptionsDialog' MonoDevelop.Ide.Navigation.NavigationPoint' MonoDevelop.Components.MainToolbar.MainToolbarController' MonoDevelop.Components.DockNotebook.DockNotebook' MonoDevelop.Components.DockNotebook.DockNotebookContainer' MonoDevelop.Components.DockNotebook.DockWindow' MonoDevelop.Ide.Gui.Documents.DocumentControllerRole' MonoDevelop.Ide.Gui.Documents.DocumentModelRegistry' MonoDevelop.Ide.Gui.Documents.DocumentControllerService' MonoDevelop.Ide.Gui.Shell.SdiWorkspaceWindow' MonoDevelop.Ide.Gui.Pads.DefaultMonitorPad' MonoDevelop.Ide.Gui.Pads.ErrorListPad' MonoDevelop.Ide.FindInFiles.SearchResultPad' MonoDevelop.Ide.FindInFiles.SearchProgressMonitor' MonoDevelop.Ide.Desktop.DesktopApplication' MonoDevelop.Components.GtkWorkarounds' MonoDevelop.Components.Commands.CommandEntry' MonoDevelop.Components.Commands.CommandEntrySet' MonoDevelop.Components.Commands.ActionCommand' MonoDevelop.Components.Commands.ActionType' MonoDevelop.Components.Commands.Command' MonoDevelop.Components.Commands.CommandSource' MonoDevelop.Components.Commands.CommandTargetRoute' MonoDevelop.Components.Commands.CustomCommand' MonoDevelop.Components.Commands.ICommandBar' MonoDevelop.Components.Commands.CommandEntryDisplayType' MonoDevelop.Components.Commands.KeyBindingManager' MonoDevelop.Components.ImageView' MonoDevelop.Ide.Theme' MonoDevelop.Components.IdeTheme' MonoDevelop.Ide.Gui.Pads.ProjectPad.ProjectSolutionPad' MonoDevelop.Ide.Extensions.StartupInfo' MonoDevelop.Components.Commands.CommandFrame' MonoDevelop.Components.Commands.CommandManager' MonoDevelop.Components.Commands.ICommandRouter' MonoDevelop.Ide.Services' MonoDevelop.Ide.MonoDevelopStatusBar' MonoDevelop.Ide.Gui.Components.XwtInfoBar' MonoDevelop.Ide.Extensions.LayoutExtensionNode' MonoDevelop.Ide.Extensions.LayoutPadExtensionNode' MonoDevelop.Components.Docking.DockFrame' MonoDevelop.Components.Docking.DockItemBehavior' MonoDevelop.Components.Docking.DockVisualStyle' MonoDevelop.Ide.WelcomePage.WelcomePageService' MonoDevelop.Components.DockNotebook.TabEventArgs' MonoDevelop.Components.DockNotebook.DockNotebookTab' MonoDevelop.Ide.Gui.Shell.WindowReorderedEventArgs' MonoDevelop.Ide.Gui.Shell.NotebookEventArgs' MonoDevelop.Components.Commands.CommandHandler' MonoDevelop.Components.Commands.CommandRouterContainer' MonoDevelop.Components.Commands.ICommandDelegatorRouter' MonoDevelop.Ide.Commands.NavigationCommands' MonoDevelop.Ide.TypeSystem.TypeSystemService' MonoDevelop.Ide.Gui.Documents.DocumentControllerExtension' MonoDevelop.Ide.Gui.Documents.ExportDocumentControllerExtensionAttribute' MonoDevelop.Ide.TypeSystem.ParsedDocument' MonoDevelop.Ide.TypeSystem.ParseOptions' MonoDevelop.Ide.TypeSystem.MonoDevelopWorkspace' MonoDevelop.Ide.Editor.Projection.Projection' MonoDevelop.Ide.ITestableStatusBar' MonoDevelop.Ide.StatusBarIconClickedEventArgs' MonoDevelop.Components.MainToolbar.StatusBarContextHandler
MonoDevelop.Ide,MonoDevelop.Ide.Projects.OptionPanels,MonoDevelop.Ide.Gui.Dialogs.OptionsDialog' MonoDevelop.Ide.Execution.ExecutionModeSelectorDialog,MonoDevelop.Components.ImageView' MonoDevelop.Ide.MessageService' MonoDevelop.Ide.Gui.Dialogs.IOptionsPanel' MonoDevelop.Ide.Gui.Dialogs.OptionsDialog' MonoDevelop.Components.Control' MonoDevelop.Ide.IdeServices' MonoDevelop.Ide.Gui.Dialogs.OptionsPanel' MonoDevelop.Ide.Gui.Dialogs.IMimeTypePolicyOptionsPanel' MonoDevelop.Ide.Gui.Dialogs.MimeTypePanelData' MonoDevelop.Ide.Extensions.MimeTypeOptionsPanelNode' MonoDevelop.Ide.Extensions.OptionsDialogSection' MonoDevelop.Ide.Projects.DefaultPolicyOptionsDialog' MonoDevelop.Ide.Gui.Dialogs.MimeTypePolicyOptionsSection' MonoDevelop.Ide.AlertButton' MonoDevelop.Components.CellRendererComboBox' MonoDevelop.Components.ComboSelectionChangedArgs' MonoDevelop.Components.CellRendererImage' MonoDevelop.Ide.Projects.AddMimeTypeDialog' MonoDevelop.Ide.Gui.Dialogs.ItemOptionsPanel' MonoDevelop.Ide.Gui.Dialogs.MultiConfigItemOptionsDialog' MonoDevelop.Ide.Gui.Dialogs.MultiConfigItemOptionsPanel' MonoDevelop.Ide.Gui.Dialogs.ConfigurationData' MonoDevelop.Components.SelectFileDialog' MonoDevelop.Ide.Projects.ProjectOptionsDialog' MonoDevelop.Ide.Gui.Dialogs.PolicyOptionsPanel<T>' MonoDevelop.Ide.Gui.Stock' MonoDevelop.Ide.Gui.Dialogs.NewConfigurationDialog' MonoDevelop.Ide.Projects.RenameConfigDialog' MonoDevelop.Ide.Projects.DeleteConfigDialog' MonoDevelop.Ide.TextFileProvider' MonoDevelop.Components.GtkWorkarounds' MonoDevelop.Ide.Editor.ITextDocument' MonoDevelop.Ide.Editor.TextEditorFactory' MonoDevelop.Components.XwtControl' MonoDevelop.Ide.Execution.RunConfigurationEditor' MonoDevelop.Ide.Execution.RunConfigurationService' MonoDevelop.Ide.Execution.MonoExecutionParametersWidget' MonoDevelop.Components.EnvironmentVariableCollectionEditor' MonoDevelop.Components.InformationPopoverWidget' MonoDevelop.Ide.ImageService
MonoDevelop.Ide,MonoDevelop.Ide.Tasks,MonoDevelop.Ide.Gui.Document' MonoDevelop.Ide.IdeServices' MonoDevelop.Ide.IdeApp' MonoDevelop.Ide.Gui.OptionPanels.TasksPanelWidget' MonoDevelop.Ide.CustomTools.CustomToolService' MonoDevelop.Ide.Codons.TaskListViewCodon' MonoDevelop.Ide.Gui.Pads.TaskListPad' MonoDevelop.Ide.Gui.Pads.ErrorListPad' MonoDevelop.Ide.TypeSystem.TodoItemExtensions' MonoDevelop.Components.MainToolbar.StatusArea' MonoDevelop.Ide.Editor.IMessageBubbleLineMarker' MonoDevelop.Ide.Gui.Pads.TaskListEntryExtensions' MonoDevelop.Ide.TypeSystem.MonoDevelopWorkspace' MonoDevelop.Ide.Gui.Dialogs.NewFolderDialog' MonoDevelop.Components.XwtBoxTooltip' MonoDevelop.Components.InformationPopoverWidget' MonoDevelop.Components.EventBoxTooltip' MonoDevelop.Ide.Gui.Pads.ProjectPad.UnknownEntryNodeBuilder' MonoDevelop.Ide.Gui.Pads.ProjectPad.ProjectReferenceNodeBuilder' MonoDevelop.Ide.Projects.GtkProjectConfigurationWidget' MonoDevelop.Ide.Gui.OptionPanels.KeyBindingsPanel' MonoDevelop.Ide.Gui.Pads.ProjectPad.ProjectNodeBuilder' MonoDevelop.Ide.ExternalTools.ExternalToolPanelWidget' MonoDevelop.Components.AutoTest.AutoTestSession' MonoDevelop.Components.AutoTest.AutoTestClientSession' MonoDevelop.Ide.Gui.Components.NodeInfo' MonoDevelop.Components.TooltipPopoverWindow' MonoDevelop.Ide.Gui.Dialogs.NewConfigurationDialog,MonoDevelop.Ide.IdeApp' MonoDevelop.Ide.RootWorkspace' MonoDevelop.Ide.Gui.Pad' MonoDevelop.Ide.Gui.Pads.ErrorListPad' MonoDevelop.Components.Control' MonoDevelop.Ide.TypeSystem.Tag' MonoDevelop.Ide.TypeSystem.MonoDevelopWorkspace' MonoDevelop.Ide.IdeServices' MonoDevelop.Ide.Gui.Components.PadTreeView' MonoDevelop.Ide.Gui.Components.ColumnSelectorMenu' MonoDevelop.Components.ContextMenu' MonoDevelop.Components.ContextMenuItem' MonoDevelop.Ide.Editor.DocumentLocation' MonoDevelop.Components.CellRendererComboBox' MonoDevelop.Components.ComboSelectionChangedArgs' MonoDevelop.Components.ImageView' MonoDevelop.Ide.Gui.Document' MonoDevelop.Ide.Gui.Content.ILocationList' MonoDevelop.Ide.Navigation.TextFileNavigationPoint' MonoDevelop.Ide.Navigation.NavigationPoint' MonoDevelop.Ide.TextEditing.TextEditorService' MonoDevelop.Ide.TextEditing.TextFileEventArgs' MonoDevelop.Ide.TextEditing.LineCountEventArgs' MonoDevelop.Ide.Gui.Pads.ProjectPad.ProjectSolutionPad' MonoDevelop.Ide.Gui.Components.ITreeNavigator' MonoDevelop.Ide.Extensions.ErrorDocumentationProvider' MonoDevelop.Ide.Composition.CompositionManager' MonoDevelop.Ide.Editor.DocumentContext' MonoDevelop.Ide.Gui.Documents.DocumentController' MonoDevelop.Ide.Gui.Documents.FileDocumentController' MonoDevelop.Ide.Gui.Documents.DocumentControllerExtension' MonoDevelop.Ide.Gui.Documents.ExportDocumentControllerExtensionAttribute
MonoDevelop.Ide,MonoDevelop.Ide.Codons,MonoDevelop.Ide.Templates.FileDescriptionTemplate' MonoDevelop.Ide.Templates.ProjectTemplate' MonoDevelop.Ide.Templates.FileTemplate' MonoDevelop.Ide.Gui.PadWindow' MonoDevelop.Ide.Gui.Pad' MonoDevelop.Ide.Gui.Workbench' MonoDevelop.Ide.Gui.DefaultWorkbench' MonoDevelop.Ide.Gui.PadActivationHandler' MonoDevelop.Ide.Gui.Pads.TaskListPad' MonoDevelop.Ide.Templates.FileTemplateCondition' MonoDevelop.Ide.Templates.TemplatingService' MonoDevelop.Ide.Templates.MicrosoftTemplateEngineSolutionTemplate' MonoDevelop.Ide.Templates.MicrosoftTemplateEngine' MonoDevelop.Ide.Templates.MicrosoftTemplateEngineItemTemplate,MonoDevelop.Ide.IdeApp' MonoDevelop.Ide.Gui.Components.NodeBuilder' MonoDevelop.Ide.Counters' MonoDevelop.Ide.Gui.PadContent' MonoDevelop.Ide.Gui.PadUserPrefs' MonoDevelop.Ide.Gui.IPadWindow' MonoDevelop.Ide.Gui.IMementoCapable' MonoDevelop.Components.Docking.DockItemStatus' MonoDevelop.Ide.Gui.Components.TreePadOption' MonoDevelop.Ide.Gui.Pads.SolutionPad' MonoDevelop.Ide.Gui.Pads.TreeViewPad' MonoDevelop.Ide.Tasks.ITaskListView' MonoDevelop.Ide.Templates.TemplateCategory' MonoDevelop.Ide.ImageService' MonoDevelop.Ide.Templates.SolutionTemplateVisibility
MonoDevelop.Ide,MonoDevelop.Ide.ExternalTools,MonoDevelop.Ide.Commands.RunCustomToolHandler' MonoDevelop.Ide.Commands.ToolListHandler' MonoDevelop.Ide.Commands.EditCustomToolsHandler,MonoDevelop.Ide.IdeApp' MonoDevelop.Ide.MessageService' MonoDevelop.Components.Commands.ActionCommand' MonoDevelop.Ide.Commands.RunCustomToolHandler' MonoDevelop.Ide.Gui.Dialogs.OptionsPanel' MonoDevelop.Components.Control' MonoDevelop.Components.Commands.KeyBindingManager' MonoDevelop.Components.Commands.KeyBinding' MonoDevelop.Ide.Tasks.TaskSeverity' MonoDevelop.Components.EventBoxTooltip
MonoDevelop.Ide,MonoDevelop.Ide.CodeTemplates,MonoDevelop.Ide.Editor.Extension.CompletionTextEditorExtension' MonoDevelop.Ide.Editor.TextMate.TextMateCompletionTextEditorExtension' MonoDevelop.Ide.CodeCompletion.RoslynCompletionData' MonoDevelop.Ide.Editor.TextLink,MonoDevelop.Ide.IdeServices' MonoDevelop.Ide.Gui.Document' MonoDevelop.Ide.CodeFormatting.CodeFormatterService' MonoDevelop.Ide.Editor.TextLink' MonoDevelop.Ide.Editor.TextEditor' MonoDevelop.Ide.Editor.ITextDocument' MonoDevelop.Ide.Editor.DocumentContext' MonoDevelop.Ide.Editor.TextEditorFactory' MonoDevelop.Ide.CodeCompletion.CompletionData' MonoDevelop.Ide.CodeCompletion.CompletionDataList' MonoDevelop.Ide.Editor.Highlighting.TmSnippet' MonoDevelop.Ide.Editor.TextMate.TextMateLanguage' MonoDevelop.Ide.ImageService' MonoDevelop.Ide.AlertButton' MonoDevelop.Ide.MessageService' MonoDevelop.Ide.Gui.Stock' MonoDevelop.Ide.Gui.Styles' MonoDevelop.Ide.Gui.Dialogs.OptionsDialog' MonoDevelop.Components.CellRendererImage' MonoDevelop.Ide.Editor.DefaultSourceEditorOptions' MonoDevelop.Ide.Gui.Dialogs.OptionsPanel' MonoDevelop.Components.Control' MonoDevelop.Components.PropertyGrid.PropertyGrid' MonoDevelop.Components.PropertyGrid.PropertySort' MonoDevelop.Ide.Editor.DocumentLocation' MonoDevelop.Ide.TypeSystem.Ambience' MonoDevelop.Ide.CodeCompletion.CompletionListWindow' MonoDevelop.Ide.CodeCompletion.KeyActions' MonoDevelop.Ide.Editor.Extension.TextEditorExtension' MonoDevelop.Ide.Editor.Extension.KeyDescriptor
MonoDevelop.Ide,MonoDevelop.Ide.Templates,MonoDevelop.Ide.Projects.NewFileDialog' MonoDevelop.Ide.Projects.TemplatePickerWidget' MonoDevelop.Ide.Projects.NewProjectDialogController' MonoDevelop.Ide.Projects.LanguageCellRenderer' MonoDevelop.Ide.Projects.GtkTemplateCellRenderer' MonoDevelop.Ide.Projects.INewProjectDialogController' MonoDevelop.Ide.Projects.FinalProjectConfigurationPage' MonoDevelop.Ide.Projects.GtkNewProjectDialogBackend' MonoDevelop.Ide.Projects.GtkTemplateCategoryCellRenderer' MonoDevelop.Ide.Codons.TemplateCategoryCodon' MonoDevelop.Ide.IdeServices' MonoDevelop.Ide.GettingStarted.GettingStartedProvider' MonoDevelop.Ide.Codons.TemplateExtensionNode,MonoDevelop.Ide.Codons.FileTemplateTypeCodon' MonoDevelop.Ide.IdeApp' MonoDevelop.Ide.ImageService' MonoDevelop.Ide.IdeServices' MonoDevelop.Ide.Codons.ProjectTemplateCodon' MonoDevelop.Ide.Gui.Documents.FileDescriptor' MonoDevelop.Ide.Services' MonoDevelop.Ide.MessageService' MonoDevelop.Ide.Editor.IDocumentLine' MonoDevelop.Ide.Editor.IReadonlyTextDocument' MonoDevelop.Ide.Editor.TextEditorFactory' MonoDevelop.Ide.AlertButton' MonoDevelop.Ide.Gui.Content.TextStylePolicy' MonoDevelop.Ide.StandardHeader.StandardHeaderService' MonoDevelop.Ide.CodeFormatting.CodeFormatterService' MonoDevelop.Ide.Editor.EditorConfigService' MonoDevelop.Ide.Codons.FileTemplateConditionTypeCodon' MonoDevelop.Ide.Projects.ProjectConfigurationControl' MonoDevelop.Components.Control' MonoDevelop.Ide.Codons.TemplateCategoryCodon' MonoDevelop.Ide.Codons.ImageCodon' MonoDevelop.Ide.Projects.NewProjectConfiguration' MonoDevelop.Ide.Desktop.RecentFileStorage' MonoDevelop.Ide.Desktop.RecentItem' MonoDevelop.Ide.Codons.TemplateExtensionNode' MonoDevelop.Ide.Codons.ItemTemplateExtensionNode
