Project,Namespace,Ca types,Ce types
MonoDevelop.Ide,MonoDevelop.Components.Commands,MonoDevelop.Components.MenuButtonEntry' MonoDevelop.Components.Commands.ExtensionNodes.CommandCodon' MonoDevelop.Ide.Gui.CommandDockBar' MonoDevelop.Components.MainToolbar.MainToolbarController' MonoDevelop.Ide.ExternalTools.ExternalToolService' MonoDevelop.Components.MainToolbar.CommandSearchCategory' MonoDevelop.Ide.Commands.ViewListHandler' MonoDevelop.Ide.Gui.OptionPanels.KeyBindingsPanel' MonoDevelop.Ide.Gui.DefaultWorkbench' MonoDevelop.Ide.Gui.Components.NodeCommandHandler' MonoDevelop.Ide.Gui.Components.ExtensibleTreeView' MonoDevelop.Components.Commands.ExtensionNodes.SeparatorItemCodon' MonoDevelop.Components.Commands.ExtensionNodes.LocalCommandItemCodon' MonoDevelop.Components.MainToolbar.CommandResult' MonoDevelop.Ide.Commands.NavigateHistory' MonoDevelop.Ide.Gui.Components.MultiSelectionNodeHandlerAttribute' MonoDevelop.Ide.Commands.OpenDocumentListHandler' MonoDevelop.Ide.Commands.OpenWindowListHandler' MonoDevelop.Ide.Commands.RunWithHandler' MonoDevelop.Ide.Commands.RunEntryWithHandler' MonoDevelop.Ide.Commands.CustomCommandListHandler' MonoDevelop.Ide.Commands.SelectActiveConfigurationHandler' MonoDevelop.Ide.Commands.SelectActiveRuntimeHandler' MonoDevelop.Ide.Commands.ToolListHandler' MonoDevelop.Ide.Gui.Pads.ProjectPad.SolutionFolderFileNodeCommandHandler' MonoDevelop.Ide.Editor.ToggleIssuesHandler' MonoDevelop.Ide.Commands.RecentFileListHandler' MonoDevelop.Ide.Commands.RecentProjectListHandler' MonoDevelop.Ide.Gui.Pads.ProjectPad.ProjectFileNodeCommandHandler' MonoDevelop.Ide.Execution.ExecutionModeCommandService' MonoDevelop.Ide.Gui.Pads.ProjectPad.SystemFileNodeCommandHandler' MonoDevelop.Ide.Commands.LayoutListHandler' MonoDevelop.Ide.Gui.ToolButtonStatus' MonoDevelop.Ide.Gui.DockItemToolbarLoader' MonoDevelop.Components.Commands.ExtensionNodes.CommandItemCodon' MonoDevelop.Components.Commands.ExtensionNodes.ItemSetCodon' MonoDevelop.Ide.FindInFiles.SearchResultWidget' MonoDevelop.Components.GtkUtil' MonoDevelop.Ide.Gui.Components.LogView' MonoDevelop.Ide.BuildOutputView.BuildOutputWidget' MonoDevelop.Ide.Commands.AddinManagerHandler' MonoDevelop.Ide.Commands.RunCustomToolHandler' MonoDevelop.Ide.Commands.EditCustomToolsHandler' MonoDevelop.Ide.Commands.InstrumentationViewerHandler' MonoDevelop.Ide.Commands.ToggleSessionRecorderHandler' MonoDevelop.Ide.Commands.ReplaySessionHandler' MonoDevelop.Ide.Commands.HelpHandler' MonoDevelop.Ide.Commands.OpenLogDirectoryHandler' MonoDevelop.Ide.Commands.TipOfTheDayHandler' MonoDevelop.Ide.Commands.AboutHandler' MonoDevelop.Ide.Commands.DumpUITreeHandler' MonoDevelop.Ide.Commands.DumpA11yTreeHandler' MonoDevelop.Ide.Commands.DumpA11yTreeDelayedHandler' MonoDevelop.Ide.Commands.MarkLogHandler' MonoDevelop.Ide.Commands.MonodevelopPreferencesHandler' MonoDevelop.Ide.Commands.DefaultPoliciesHandler' MonoDevelop.Ide.Commands.DefaultDeleteKeyHandler' MonoDevelop.Ide.Commands.DefaultDeleteHandler' MonoDevelop.Ide.Commands.DefaultCopyHandler' MonoDevelop.Ide.Commands.DefaultCutHandler' MonoDevelop.Ide.Commands.DefaultPasteHandler' MonoDevelop.Ide.Commands.InsertStandardHeaderHandler' MonoDevelop.Ide.Commands.DefaultSelectAllHandler' MonoDevelop.Ide.Commands.NextDocumentHandler' MonoDevelop.Ide.Commands.PrevDocumentHandler' MonoDevelop.Ide.Commands.OpenDocumentHandlerBase' MonoDevelop.Ide.Commands.SplitWindowVertically' MonoDevelop.Ide.Commands.SplitWindowHorizontally' MonoDevelop.Ide.Commands.UnsplitWindow' MonoDevelop.Ide.Commands.SwitchSplitWindow' MonoDevelop.Ide.Commands.SwitchNextDocument' MonoDevelop.Ide.Commands.SwitchNextPad' MonoDevelop.Ide.Commands.NewLayoutHandler' MonoDevelop.Ide.Commands.DeleteCurrentLayoutHandler' MonoDevelop.Ide.Commands.FullScreenHandler' MonoDevelop.Ide.Commands.ShowNextHandler' MonoDevelop.Ide.Commands.ShowPreviousHandler' MonoDevelop.Ide.Commands.ZoomIn' MonoDevelop.Ide.Commands.ZoomOut' MonoDevelop.Ide.Commands.ZoomReset' MonoDevelop.Ide.Commands.SideBySideModeHandler' MonoDevelop.Ide.Commands.SingleModeHandler' MonoDevelop.Ide.Commands.NextNotebookHandler' MonoDevelop.Ide.Commands.PreviousNotebookHandler' MonoDevelop.Ide.Commands.FocusCurrentDocumentHandler' MonoDevelop.Ide.Commands.CenterAndFocusCurrentDocumentHandler' MonoDevelop.Ide.Gui.Dialogs.TipOfTheDayWindow' MonoDevelop.Ide.Commands.OpenFileHandler' MonoDevelop.Ide.Commands.NewFileHandler' MonoDevelop.Ide.Commands.SaveAllHandler' MonoDevelop.Ide.Commands.NewProjectHandler' MonoDevelop.Ide.Commands.NewWorkspaceHandler' MonoDevelop.Ide.Commands.CloseAllFilesHandler' MonoDevelop.Ide.Commands.CloseFileHandler' MonoDevelop.Ide.Commands.CloseWorkspaceHandler' MonoDevelop.Ide.Commands.PrintHandler' MonoDevelop.Ide.Commands.PrintPreviewHandler' MonoDevelop.Ide.Commands.PrintPageSetupHandler' MonoDevelop.Ide.Commands.ClearRecentFilesHandler' MonoDevelop.Ide.Commands.ClearRecentProjectsHandler' MonoDevelop.Ide.Commands.ExitHandler' MonoDevelop.Ide.Commands.SolutionOptionsHandler' MonoDevelop.Ide.Commands.ProjectOptionsHandler' MonoDevelop.Ide.Commands.SolutionItemOptionsHandler' MonoDevelop.Ide.Commands.SetStartupProjectsHandler' MonoDevelop.Ide.Commands.EditReferencesHandler' MonoDevelop.Ide.Commands.BuildSolutionHandler' MonoDevelop.Ide.Commands.BuildHandler' MonoDevelop.Ide.Commands.RebuildSolutionHandler' MonoDevelop.Ide.Commands.RebuildHandler' MonoDevelop.Ide.Commands.RunHandler' MonoDevelop.Ide.Commands.RunEntryHandler' MonoDevelop.Ide.Commands.CleanHandler' MonoDevelop.Ide.Commands.CleanSolutionHandler' MonoDevelop.Ide.Commands.StopHandler' MonoDevelop.Ide.Commands.ExportSolutionHandler' MonoDevelop.Ide.Commands.ApplyPolicyHandler' MonoDevelop.Ide.Commands.ExportPolicyHandler' MonoDevelop.Ide.Commands.RunCodeAnalysisSolutionHandler' MonoDevelop.Ide.Commands.RunCodeAnalysisProjectHandler' MonoDevelop.Ide.Commands.ToggleFileNestingHandler' MonoDevelop.Ide.Commands.ToggleCompletionSuggestionModeHandler' MonoDevelop.Ide.Commands.NavigateBack' MonoDevelop.Ide.Commands.NavigateForward' MonoDevelop.Ide.Commands.ClearNavigationHistory' MonoDevelop.Ide.Commands.TabCommandHandler' MonoDevelop.Ide.Commands.ToggleMaximizeHandler' MonoDevelop.Ide.Commands.CopyPathNameHandler' MonoDevelop.Ide.Commands.ReopenClosedTabHandler' MonoDevelop.Ide.FindInFiles.InFilesHandler' MonoDevelop.Ide.CodeFormatting.FormatBufferHandler' MonoDevelop.Ide.Updater.UpdateCheckHandler' MonoDevelop.Ide.Updater.CheckForUpdatesHandler' MonoDevelop.Ide.IdeStartup' MonoDevelop.Ide.IdeApp' MonoDevelop.Ide.WelcomePage.ShowWelcomePageHandler' MonoDevelop.Ide.LogReportingStartup' MonoDevelop.Ide.Editor.DynamicAbbrevHandler' MonoDevelop.Ide.Editor.HideIssuesHandler' MonoDevelop.Components.MainToolbar.NavigateToHandler' MonoDevelop.Components.MainToolbar.GotoTypeHandler' MonoDevelop.Components.MainToolbar.GotoFileHandler' MonoDevelop.Components.MainToolbar.RunCommandHandler' MonoDevelop.Ide.Editor.TextMate.ShowTextMateScopesHandler' MonoDevelop.Ide.Gui.PadActivationHandler' MonoDevelop.Ide.BuildOutputView.BuildOutputViewContent' MonoDevelop.Ide.GettingStarted.GettingStartedNodeCommandHandler' MonoDevelop.Ide.Gui.Pads.ProjectPad.SolutionFolderNodeCommandHandler' MonoDevelop.Ide.Gui.Pads.ProjectPad.FolderCommandHandler' MonoDevelop.Ide.Gui.Pads.ProjectPad.ProjectFolderCommandHandler' MonoDevelop.Ide.Gui.Pads.ProjectPad.ProjectReferenceFolderNodeCommandHandler' MonoDevelop.Ide.Gui.Pads.ProjectPad.ProjectNodeCommandHandler' MonoDevelop.Ide.Gui.Pads.ErrorListPad' MonoDevelop.Ide.Gui.Pads.ProjectPad.ProjectReferenceNodeCommandHandler' MonoDevelop.Ide.Gui.Pads.ProjectPad.UnknownEntryCommandHandler' MonoDevelop.Ide.Gui.Pads.ProjectPad.FileOperationsCommandHandler' MonoDevelop.Ide.FindInFiles.SearchResultPad' MonoDevelop.Ide.Gui.Pads.ProjectPad.WorkspaceNodeCommandHandler' MonoDevelop.Ide.Gui.Pads.ProjectPad.SolutionNodeCommandHandler' MonoDevelop.Ide.Editor.Extension.BraceMatcherTextEditorExtension' MonoDevelop.Ide.Editor.Extension.CompletionTextEditorExtension' MonoDevelop.Ide.Gui.Pads.ClassPad.SolutionNodeCommandHandler' MonoDevelop.Ide.Gui.ViewCommandHandlers' MonoDevelop.Ide.Editor.Extension.DefaultCommandTextEditorExtension' MonoDevelop.Ide.Commands.CloseAllExceptPinnedHandler' MonoDevelop.Ide.Commands.PinTabHandler' MonoDevelop.Ide.Commands.CloseAllToTheRightHandler' MonoDevelop.Ide.DesktopService' MonoDevelop.Ide.Desktop.PlatformService' MonoDevelop.Components.AutoTest.AutoTestService' MonoDevelop.Components.AutoTest.SessionRecord' MonoDevelop.Ide.WelcomePage.WelcomePageService' MonoDevelop.Ide.WelcomePage.WelcomePageSection' MonoDevelop.Components.AutoTest.AutoTestClientSession' MonoDevelop.Components.AutoTest.AutoTestSession' MonoDevelop.Ide.WelcomePage.WelcomePageLinkButton' MonoDevelop.Components.Control' MonoDevelop.Ide.Editor.Extension.TextEditorExtension' MonoDevelop.Ide.Editor.TextEditorViewContent' MonoDevelop.Ide.Gui.Documents.DocumentControllerExtension' MonoDevelop.Components.Commands.ExtensionNodes.LinkItemCodon' MonoDevelop.Ide.Gui.Pads.TreeViewPad' MonoDevelop.Ide.Gui.SdiDragNotebook' MonoDevelop.Ide.Gui.Documents.DocumentController' MonoDevelop.Ide.Gui.Shell.SdiWorkspaceWindow' MonoDevelop.Ide.Gui.Components.NodeCommandTargetChain' MonoDevelop.Ide.Projects.GtkNewProjectDialogBackend' MonoDevelop.Ide.Gui.PadCommandRouterContainer' MonoDevelop.Ide.Projects.SelectReferenceDialog' MonoDevelop.Ide.Projects.CombinedBox' MonoDevelop.Ide.ExternalTools.ExternalToolPanelWidget' MonoDevelop.Components.Commands.ExtensionNodes.SchemeExtensionNode' MonoDevelop.Ide.Gui.ToolbarComboBox' MonoDevelop.Ide.Gui.ConfigurationComboBox' MonoDevelop.Ide.Editor.TextEditor' MonoDevelop.Ide.Gui.Components.AllowMultiSelectionAttribute' MonoDevelop.Ide.Gui.Documents.DocumentView' MonoDevelop.Ide.Gui.Shell.GtkShellDocumentViewItem,MonoDevelop.Ide.Counters' MonoDevelop.Ide.UpdateCommandInfoCounterMetadata' MonoDevelop.Ide.IdeApp' MonoDevelop.Components.GtkWorkarounds' MonoDevelop.Components.KeyboardShortcut' MonoDevelop.Components.Control' MonoDevelop.Components.Window' MonoDevelop.Components.Commands.ExtensionNodes.CommandCodon' MonoDevelop.Components.ImageView' MonoDevelop.Ide.MessageService' MonoDevelop.Components.Commands.ExtensionNodes.SchemeExtensionNode' MonoDevelop.Ide.Gui.Shell.IShell
MonoDevelop.Ide,MonoDevelop.Ide.Commands,MonoDevelop.Ide.Gui.Pads.ProjectPad.ProjectFolderCommandHandler' MonoDevelop.Ide.Gui.Pads.ProjectPad.ProjectNodeCommandHandler' MonoDevelop.Ide.Gui.Pads.ErrorListPad' MonoDevelop.Ide.Gui.Pads.ProjectPad.WorkspaceNodeCommandHandler' MonoDevelop.Ide.Gui.Pads.ProjectPad.ProjectFileNodeCommandHandler' MonoDevelop.Ide.FindInFiles.SearchResultPad' MonoDevelop.Ide.Gui.Components.NodeCommandHandler' MonoDevelop.Ide.Gui.Pads.ClassPad.SolutionNodeCommandHandler' MonoDevelop.Ide.GettingStarted.GettingStartedNodeCommandHandler' MonoDevelop.Ide.BuildOutputView.BuildOutputViewContent' MonoDevelop.Ide.FindInFiles.SearchResultWidget' MonoDevelop.Ide.BuildOutputView.BuildOutputWidget' MonoDevelop.Ide.Gui.Components.LogView' MonoDevelop.Ide.Gui.Components.ExtensibleTreeView' MonoDevelop.Ide.Editor.Extension.DefaultCommandTextEditorExtension' MonoDevelop.Ide.Gui.ViewCommandHandlers' MonoDevelop.Ide.Gui.Pads.ProjectPad.ProjectReferenceNodeCommandHandler' MonoDevelop.Ide.Gui.Pads.ProjectPad.SolutionNodeCommandHandler' MonoDevelop.Ide.Gui.Pads.ProjectPad.FileOperationsCommandHandler' MonoDevelop.Ide.Gui.Pads.ProjectPad.ProjectReferenceFolderNodeCommandHandler' MonoDevelop.Ide.Gui.Pads.ProjectPad.SystemFileNodeCommandHandler' MonoDevelop.Ide.Gui.Pads.ProjectPad.SolutionFolderNodeCommandHandler' MonoDevelop.Ide.Gui.Pads.ProjectPad.FolderCommandHandler' MonoDevelop.Ide.Gui.Pads.ProjectPad.UnknownEntryCommandHandler' MonoDevelop.Components.MainToolbar.MainToolbarController' MonoDevelop.Ide.ExternalTools.ExternalToolService' MonoDevelop.Ide.Gui.Pads.ProjectPad.SolutionFolderFileNodeCommandHandler' MonoDevelop.Ide.Gui.Dialogs.NewLayoutDialog' MonoDevelop.Ide.Gui.SdiDragNotebook' MonoDevelop.Ide.Editor.Extension.BraceMatcherTextEditorExtension' MonoDevelop.Ide.Editor.Extension.CompletionTextEditorExtension,MonoDevelop.Ide.Gui.Workbench' MonoDevelop.Components.Commands.CommandHandler' MonoDevelop.Ide.IdeApp' MonoDevelop.Components.Commands.CommandInfo' MonoDevelop.Ide.Gui.Document' MonoDevelop.Ide.StandardHeader.StandardHeaderService' MonoDevelop.Ide.Services' MonoDevelop.Ide.MessageService' MonoDevelop.Ide.Gui.OpenDocumentOptions' MonoDevelop.Ide.Gui.Dialogs.OpenFileDialog' MonoDevelop.Components.FileChooserAction' MonoDevelop.Ide.IdeServices' MonoDevelop.Ide.Projects.NewFileDialog' MonoDevelop.Ide.Gui.Content.IPrintable' MonoDevelop.Ide.Gui.Content.PrintingSettings' MonoDevelop.Components.Commands.CommandArrayInfo' MonoDevelop.Ide.AlertButton' MonoDevelop.Ide.Gui.Stock' MonoDevelop.Components.GtkWorkarounds' MonoDevelop.Ide.Gui.Dialogs.TipOfTheDayWindow' MonoDevelop.Ide.Gui.Dialogs.CommonAboutDialog' MonoDevelop.Ide.Projects.NewSolutionRunConfigurationDialog' MonoDevelop.Ide.Execution.ExecutionModeCommandService' MonoDevelop.Ide.FeatureSwitches' MonoDevelop.Ide.Projects.ApplyPolicyDialog' MonoDevelop.Ide.Projects.ExportProjectPolicyDialog' MonoDevelop.Ide.Projects.FileNesting.FileNestingService' MonoDevelop.Ide.Updater.AddinsUpdateHandler' MonoDevelop.Ide.ExternalTools.ExternalTool' MonoDevelop.Ide.ExternalTools.ExternalToolService' MonoDevelop.Ide.Gui.Dialogs.FileSelectorDialog' MonoDevelop.Components.AutoTest.AutoTestService' MonoDevelop.Components.Commands.ActionCommand' MonoDevelop.Components.Commands.CommandInfoSet' MonoDevelop.Ide.Counters' MonoDevelop.Ide.Gui.Pad' MonoDevelop.Ide.Gui.Dialogs.NewLayoutDialog' MonoDevelop.Ide.WelcomePage.WelcomePageService' MonoDevelop.Ide.Gui.Content.ILocationList' MonoDevelop.Ide.Gui.Content.IZoomable' MonoDevelop.Components.DockNotebook.DockNotebook' MonoDevelop.Ide.Gui.Shell.SdiWorkspaceWindow' MonoDevelop.Components.Window' MonoDevelop.Ide.Gui.Content.ISplittable' MonoDevelop.Ide.DocumentSwitcher' MonoDevelop.Ide.Navigation.NavigationHistoryItem' MonoDevelop.Ide.Gui.Dialogs.DirtyFilesDialog' MonoDevelop.Components.DockNotebook.DockNotebookTab
MonoDevelop.Ide,MonoDevelop.Ide.Composition,Microsoft.VisualStudio.Platform.PlatformCatalog' MonoDevelop.Ide.MimeTypeCatalog' MonoDevelop.Ide.IdeApp' MonoDevelop.Ide.Editor.Extension.TagCommentsTextEditorExtension' MonoDevelop.Ide.Tasks.CommentTasksProvider' MonoDevelop.Ide.TypeSystem.TypeSystemService' MonoDevelop.Ide.Editor.TextEditor' MonoDevelop.Ide.TypeSystem.MonoDevelopWorkspace' MonoDevelop.Ide.Editor.EditorPreferences' MonoDevelop.Ide.Gui.Documents.DocumentManager' MonoDevelop.Ide.TypeSystem.MiscellaneousFilesWorkspace,MonoDevelop.Ide.Counters' MonoDevelop.Ide.CompositionLoadMetadata' MonoDevelop.Ide.IdeApp' MonoDevelop.Ide.AlertButton' MonoDevelop.Ide.MessageService' MonoDevelop.Ide.IdeServices' MonoDevelop.Ide.Gui.Stock' Microsoft.VisualStudio.LanguageServices.VisualStudioMefHostServices' MonoDevelop.Ide.ExitEventArgs
MonoDevelop.Ide,Microsoft.VisualStudio.Text.Utilities,,
MonoDevelop.Ide,Microsoft.VisualStudio.Platform,MonoDevelop.Ide.MimeTypeCatalog' MonoDevelop.Ide.Gui.Documents.TextBufferFileModel' MonoDevelop.Ide.FindInFiles.OpenFileProvider' MonoDevelop.Ide.FindInFiles.FileProvider' MonoDevelop.Ide.Gui.Workbench,MonoDevelop.Ide.Composition.CompositionManager' MonoDevelop.Ide.Editor.TextEditor' MonoDevelop.Ide.Editor.ITextDocument
MonoDevelop.Ide,MonoDevelop.Ide.TypeSystem,MonoDevelop.Ide.RoslynServices.MonoDevelopDocumentSupportsFeatureService' MonoDevelop.Ide.RoslynServices.MonoDevelopDocumentNavigationService' MonoDevelop.Ide.Gui.RoslynDocumentExtension' MonoDevelop.Ide.Gui.RoslynDocumentContext' MonoDevelop.Ide.IdeServices' MonoDevelop.Ide.IdePreferences' MonoDevelop.Ide.IdeApp' MonoDevelop.Ide.RootWorkspace' MonoDevelop.Ide.FindInFiles.SearchResult' MonoDevelop.Ide.Gui.Pads.ClassPad.MemberNodeBuilder' MonoDevelop.Ide.Gui.Pads.ClassPad.MethodNodeBuilder' MonoDevelop.Ide.Gui.Pads.ClassPad.FieldNodeBuilder' MonoDevelop.Ide.Gui.Pads.ClassPad.ClassNodeBuilder' MonoDevelop.Ide.Gui.Pads.ClassPad.PropertyNodeBuilder' MonoDevelop.Components.MainToolbar.SearchResult' MonoDevelop.Ide.Gui.Pads.ClassPad.EventNodeBuilder' MonoDevelop.Ide.Editor.TextMate.ShowTextMateScopesHandler' MonoDevelop.Ide.CodeTemplates.ExpansionObject' MonoDevelop.Ide.CodeCompletion.TaggedTextUtil' MonoDevelop.Ide.Editor.Highlighting.TextMateFormat' MonoDevelop.Components.MainToolbar.DeclaredSymbolInfoResult' MonoDevelop.Ide.CodeCompletion.ListWidget' MonoDevelop.Ide.Editor.Extension.FoldingTextEditorExtension' MonoDevelop.Ide.Editor.TextMate.TextMateCompletionTextEditorExtension' MonoDevelop.Ide.Editor.DocumentContext' MonoDevelop.Ide.Editor.TextEditorViewContent' MonoDevelop.Ide.Editor.Extension.ErrorHandlerTextEditorExtension' MonoDevelop.Ide.Editor.Projection.ProjectedDocumentContext' MonoDevelop.Ide.Tasks.CommentTaskChange' MonoDevelop.Ide.Tasks.CommentTasksChangedEventArgs' MonoDevelop.Ide.Tasks.CommentTasksView' MonoDevelop.Ide.Tasks.CommentTasksProvider' MonoDevelop.Ide.Tasks.ProjectCommentTags' MonoDevelop.Components.MainToolbar.SearchPopupWidget' MonoDevelop.Ide.Editor.Extension.DefaultCommandTextEditorExtension' MonoDevelop.Ide.Editor.TextEditor' MonoDevelop.Ide.Editor.Extension.TagCommentsTextEditorExtension' MonoDevelop.Ide.RoslynServices.MonoDevelopProjectCacheHostServiceFactory' MonoDevelop.Ide.RoslynServices.MonoDevelopSymbolNavigationService' MonoDevelop.Ide.IdeStartupTracker' MonoDevelop.Ide.Editor.ITextMarkerFactory' MonoDevelop.Ide.Editor.TextMarkerFactory' MonoDevelop.Ide.Editor.IErrorMarker' MonoDevelop.Ide.TypeSystem.MetadataReferences.MonoDevelopMetadataServiceFactory' MonoDevelop.Ide.TypeSystem.MetadataReferences.MonoDevelopMetadataReferenceManagerFactory,MonoDevelop.Ide.Composition.CompositionManager' MonoDevelop.Ide.Services' MonoDevelop.Ide.IdeServices' MonoDevelop.Ide.Counters' MonoDevelop.Ide.ParserService' MonoDevelop.Ide.DesktopService' MonoDevelop.Ide.IdeApp' MonoDevelop.Ide.RootWorkspace' MonoDevelop.Ide.ImageService' MonoDevelop.Ide.StatusBarIcon' MonoDevelop.Ide.TaskUtil' MonoDevelop.Ide.Gui.Stock' MonoDevelop.Ide.Extensions.MimeTypeExtensionNode' MonoDevelop.Ide.Editor.IReadonlyTextDocument' MonoDevelop.Ide.RoslynServices.RoslynService' MonoDevelop.Ide.RoslynServices.Options.RoslynPreferences' MonoDevelop.Ide.Gui.Documents.DocumentManager' MonoDevelop.Ide.CodeCompletion.TooltipInformation' MonoDevelop.Ide.Editor.DocumentRegion' MonoDevelop.Ide.Tasks.CommentTag' MonoDevelop.Ide.Gui.Document' MonoDevelop.Ide.Editor.TextEditor' MonoDevelop.Ide.Editor.ITextDocument' MonoDevelop.Ide.Editor.DocumentContext' MonoDevelop.Ide.Editor.Projection.Projection' MonoDevelop.Ide.ProjectOperations' MonoDevelop.Ide.DispatchService' MonoDevelop.Ide.TextFileProvider' MonoDevelop.Ide.PlatformMemoryStatus' MonoDevelop.Ide.PlatformMemoryStatusEventArgs' MonoDevelop.Ide.Gui.WorkbenchUserPrefs' MonoDevelop.Ide.Gui.FileOpenInformation' MonoDevelop.Ide.Tasks.CommentTasksProvider' MonoDevelop.Ide.CodeFormatting.CodeFormatterService' MonoDevelop.Ide.Editor.InsertionPoint' MonoDevelop.Ide.Editor.InsertionCursorEventArgs' MonoDevelop.Ide.Editor.InsertionModeOptions' MonoDevelop.Ide.Editor.DocumentLocation' MonoDevelop.Ide.AlertButton' MonoDevelop.Ide.MessageService' MonoDevelop.Ide.Gui.Content.TextStylePolicy
