Project,Namespace,Ca types,Ce types
MonoDevelop.Ide,MonoDevelop.Ide.Gui.Content,MonoDevelop.Ide.Gui.ViewCommandHandlers' MonoDevelop.Ide.Commands.PrintHandler' MonoDevelop.Ide.Commands.PrintPreviewHandler' MonoDevelop.Ide.Commands.PrintPageSetupHandler' MonoDevelop.Ide.Commands.SplitWindowVertically' MonoDevelop.Ide.Commands.SplitWindowHorizontally' MonoDevelop.Ide.Commands.UnsplitWindow' MonoDevelop.Ide.Commands.SwitchSplitWindow' MonoDevelop.Ide.Commands.ZoomIn' MonoDevelop.Ide.Commands.ZoomOut' MonoDevelop.Ide.Commands.ZoomReset' MonoDevelop.Ide.Gui.Shell.IShellDocumentViewContent' MonoDevelop.Ide.BuildOutputView.BuildOutputWidget' MonoDevelop.Ide.Gui.Documents.DocumentViewContent' MonoDevelop.Ide.Gui.Shell.GtkShellDocumentViewContent' MonoDevelop.Ide.Gui.Documents.DocumentController' MonoDevelop.Ide.Navigation.NavigationHistoryService' MonoDevelop.Ide.Gui.OptionPanels.TextStylePolicyPanelWidget' MonoDevelop.Ide.CodeFormatting.DefaultCodeFormatter' MonoDevelop.Ide.Gui.OptionPanels.TextStylePolicyPanel' MonoDevelop.Ide.RoslynServices.Options.OptionsExtensions' MonoDevelop.Ide.RoslynServices.Options.MonoDevelopGlobalOptionPersister' MonoDevelop.Ide.TypeSystem.TextPolicyDocumentOptionsProvider' MonoDevelop.Ide.Editor.TextEditorViewContent' MonoDevelop.Ide.Editor.DefaultSourceEditorOptions' MonoDevelop.Ide.Templates.SingleFileDescriptionTemplate' MonoDevelop.Ide.StandardHeader.StandardHeaderService' MonoDevelop.Ide.Tasks.TaskStore' MonoDevelop.Ide.Commands.ShowNextHandler' MonoDevelop.Ide.Commands.ShowPreviousHandler' MonoDevelop.Ide.FindInFiles.SearchResultWidget' MonoDevelop.Ide.Gui.Workbench,MonoDevelop.Ide.Editor.TextEditor' MonoDevelop.Components.PathEntry' MonoDevelop.Components.Control' MonoDevelop.Ide.Navigation.NavigationPoint' MonoDevelop.Ide.Gui.Document' MonoDevelop.Ide.Editor.DocumentRegion
MonoDevelop.Ide,MonoDevelop.Ide.Gui.Dialogs,MonoDevelop.Ide.Commands.AboutHandler' MonoDevelop.Ide.Commands.CloseAllHandler' MonoDevelop.Components.DockNotebook.DockWindow' MonoDevelop.Ide.Gui.Workbench' MonoDevelop.Ide.Commands.NewLayoutHandler' MonoDevelop.Ide.Commands.TipOfTheDayHandler' MonoDevelop.Ide.IdeStartup' MonoDevelop.Ide.Commands.ToggleSessionRecorderHandler' MonoDevelop.Ide.Commands.ReplaySessionHandler' MonoDevelop.Ide.Projects.AssemblyReferencePanel' MonoDevelop.Ide.Gui.Document' MonoDevelop.Ide.Projects.DefaultPolicyOptionsDialog' MonoDevelop.Ide.BuildOutputView.BuildOutputWidget' MonoDevelop.Ide.Commands.OpenFileHandler' MonoDevelop.Ide.Projects.OptionPanels.BaseDirectoryPanel' MonoDevelop.Ide.Gui.OptionPanels.KeyBindingsPanel' MonoDevelop.Ide.Editor.TextMate.TextMateBundleOptionsPanel' MonoDevelop.Ide.Extensions.OptionsPanelNode' MonoDevelop.Ide.ProgressMonitoring.ProgressHelper' MonoDevelop.Ide.ProgressMonitoring.MultiTaskDialogProgressMonitor' MonoDevelop.Ide.CodeTemplates.CodeTemplatePanelWidget' MonoDevelop.Ide.Projects.OptionPanels.GeneralProjectOptionsWidget' MonoDevelop.Ide.Projects.OptionPanels.SolutionRunConfigurationPanel' MonoDevelop.Ide.Projects.OptionPanels.SolutionRunConfigurationsPanel' MonoDevelop.Ide.Projects.OptionPanels.SolutionRunConfigurationsPanelWidget' MonoDevelop.Ide.Projects.OptionPanels.RunConfigurationsPanel' MonoDevelop.Ide.Projects.OptionPanels.RunConfigurationsPanelWidget' MonoDevelop.Ide.Gui.OptionPanels.AuthorInformationPanel' MonoDevelop.Ide.Projects.OptionPanels.CodeFormattingPanel' MonoDevelop.Ide.Projects.OptionPanels.CodeFormattingPanelWidget' MonoDevelop.Ide.Projects.OptionPanels.RunConfigurationPanel' MonoDevelop.Ide.CodeTemplates.CodeTemplatePane' MonoDevelop.Ide.Gui.OptionPanels.IDEStyleOptionsPanel' MonoDevelop.Ide.ExternalTools.ExternalToolPane' MonoDevelop.Ide.Gui.OptionPanels.TasksPanelWidget' MonoDevelop.Ide.Gui.OptionPanels.GlobalAuthorInformationPanel' MonoDevelop.Ide.Gui.OptionPanels.BuildMessagePanel' MonoDevelop.Ide.Gui.OptionPanels.MaintenanceOptionsPanel' MonoDevelop.Ide.Gui.OptionPanels.MonoRuntimePanel' MonoDevelop.Ide.Fonts.FontChooserPanel' MonoDevelop.Ide.WelcomePage.WelcomePageOptionPanel' MonoDevelop.Ide.Gui.OptionPanels.LogAgentOptionsPanel' MonoDevelop.Ide.Gui.OptionPanels.BuildPanel' MonoDevelop.Ide.Gui.OptionPanels.SdkLocationPanel' MonoDevelop.Ide.Gui.OptionPanels.AddInsOptionsPanel' MonoDevelop.Ide.Gui.OptionPanels.LoadSavePanel' MonoDevelop.Ide.ProgressMonitoring.MessageDialogProgressMonitor' MonoDevelop.Ide.Projects.OptionPanels.CombineInformationPanel' MonoDevelop.Ide.Projects.OptionPanels.CombineBuildOptions' MonoDevelop.Ide.Projects.OptionPanels.RuntimeOptionsPanel' MonoDevelop.Ide.Projects.OptionPanels.SolutionItemConfigurationsPanel' MonoDevelop.Ide.Projects.OptionPanels.PortableRuntimeOptionsPanel' MonoDevelop.Ide.Projects.OptionPanels.GeneralProjectOptions' MonoDevelop.Ide.Gui.OptionPanels.TextStylePolicyPanel' MonoDevelop.Ide.Projects.OptionPanels.MimetypeOptionsDialogSection' MonoDevelop.Ide.Projects.ProjectOptionsDialog' MonoDevelop.Ide.Projects.CombineOptionsDialog' MonoDevelop.Ide.Projects.OptionPanels.CombineEntryConfigurationsPanelWidget' MonoDevelop.Ide.Projects.OptionPanels.CombineConfigurationPanel' MonoDevelop.Ide.Projects.OptionPanels.CombineConfigurationPanelWidget' MonoDevelop.Ide.Projects.OptionPanels.OutputOptionsPanel' MonoDevelop.Ide.Projects.OptionPanels.RunOptionsPanel' MonoDevelop.Ide.Projects.OptionPanels.CodeAnalysisPanel' MonoDevelop.Ide.Projects.OptionPanels.CustomCommandPanel' MonoDevelop.Ide.Projects.OptionPanels.CommonAssemblySigningPreferencesPanel' MonoDevelop.Ide.Projects.OptionPanels.NamespaceSynchronisationPanel' MonoDevelop.Ide.StandardHeader.StandardHeaderPolicyPanel' MonoDevelop.Components.Extensions.AlertDialog' MonoDevelop.Ide.Gui.Pads.ProjectPad.FolderCommandHandler,MonoDevelop.Ide.MessageService' MonoDevelop.Ide.IdeServices' MonoDevelop.Components.IdeDialog' MonoDevelop.Ide.IdeApp' MonoDevelop.Ide.Gui.Document' MonoDevelop.Ide.Commands.LayoutListHandler' MonoDevelop.Ide.Theme' MonoDevelop.Ide.IdeVersionInfo' MonoDevelop.Components.ImageView' MonoDevelop.Components.IdeTheme' MonoDevelop.Components.CompactScrolledWindow' MonoDevelop.Components.Commands.CommandHandler' MonoDevelop.Components.IdeWindow' MonoDevelop.Ide.AddinError' MonoDevelop.Ide.SelectEncodingsDialog' MonoDevelop.Ide.Gui.FileViewer' MonoDevelop.Components.FileSelector' MonoDevelop.Ide.Extensions.OpenFileDialogData' MonoDevelop.Components.FileChooserAction' MonoDevelop.Components.Extensions.SelectFileDialog<T>' MonoDevelop.Components.Control' MonoDevelop.Ide.ImageService' MonoDevelop.Ide.Projects.OptionPanels.MimetypeOptionsDialogSection' MonoDevelop.Ide.Extensions.OptionsDialogSection' MonoDevelop.Ide.Extensions.OptionsPanelNode' MonoDevelop.Ide.Extensions.PanelGrouping' MonoDevelop.Components.HeaderBox' MonoDevelop.Components.CellRendererImage' MonoDevelop.Components.Window' MonoDevelop.Ide.Gui.Stock' MonoDevelop.Ide.Projects.DefaultPolicyOptionsDialog' MonoDevelop.Components.AutoTest.SemanticModelAttribute' MonoDevelop.Components.BinContainer' MonoDevelop.Ide.AlertButton' MonoDevelop.Ide.MessageDescription' MonoDevelop.Ide.Tasks.TaskSeverity' MonoDevelop.Ide.Gui.Pads.ProjectPad.ProjectFolderCommandHandler' MonoDevelop.Components.InformationPopoverWidget
MonoDevelop.Ide,MonoDevelop.Ide.Gui.OptionPanels,MonoDevelop.Components.IdeTheme,MonoDevelop.Ide.Gui.Dialogs.OptionsPanel' MonoDevelop.Components.Control' MonoDevelop.Ide.IdeApp' MonoDevelop.Ide.BeforeCompileAction' MonoDevelop.Ide.OnStartupBehaviour' MonoDevelop.Ide.MessageService' MonoDevelop.Ide.Updater.UpdateService' MonoDevelop.Ide.Updater.UpdateSpanUnit' MonoDevelop.Ide.Gui.Styles' MonoDevelop.Ide.Tasks.TaskPriority' MonoDevelop.Ide.Tasks.CommentTag' MonoDevelop.Components.Commands.ActionCommand' MonoDevelop.Components.Commands.Command' MonoDevelop.Components.Commands.KeyBindingManager' MonoDevelop.Components.Commands.KeyBindingService' MonoDevelop.Components.Commands.KeyBindingScheme' MonoDevelop.Components.Commands.KeyBindingSet' MonoDevelop.Ide.Gui.KeyBindingsPanel' MonoDevelop.Ide.Tasks.TaskSeverity' MonoDevelop.Ide.Gui.Dialogs.IOptionsPanel' MonoDevelop.Ide.Gui.Dialogs.OptionsDialog' MonoDevelop.Components.TooltipPopoverWindow' MonoDevelop.Components.PopupPosition' MonoDevelop.Components.CellRendererImage' MonoDevelop.Components.ContextMenu' MonoDevelop.Components.ContextMenuItem' MonoDevelop.Components.SeparatorContextMenuItem' MonoDevelop.Ide.Theme' MonoDevelop.Ide.LocalizationService' MonoDevelop.Components.IdeTheme' MonoDevelop.Ide.Gui.Dialogs.ItemOptionsPanel' MonoDevelop.Ide.Gui.Content.TextStylePolicy' MonoDevelop.Ide.Gui.Dialogs.MimeTypePolicyOptionsPanel<T>' MonoDevelop.Ide.Gui.Content.EolMarker' MonoDevelop.Components.SelectFolderDialog' MonoDevelop.Ide.JumpToFirst' MonoDevelop.Ide.BuildResultStates' MonoDevelop.Ide.ShowMessageBubbles' MonoDevelop.Components.FolderEntry' MonoDevelop.Components.ImageView' MonoDevelop.Components.RestartPanel' MonoDevelop.Components.BinContainer
MonoDevelop.Ide,MonoDevelop.Ide.Gui.Pads,MonoDevelop.Ide.CustomTools.CustomToolService' MonoDevelop.Ide.Gui.IdeProgressMonitorManager' MonoDevelop.Ide.Gui.Pads.ProjectPad.ProjectSolutionPad' MonoDevelop.Ide.Gui.Pads.ClassBrowser.ClassBrowserPad' MonoDevelop.Ide.Codons.SolutionPadCodon' MonoDevelop.Ide.Gui.PadCollection' MonoDevelop.Components.MainToolbar.StatusArea' MonoDevelop.Ide.Tasks.TaskListEntry' MonoDevelop.Ide.Tasks.TaskService,MonoDevelop.Ide.IdeApp' MonoDevelop.Ide.Gui.PadContent' MonoDevelop.Ide.Gui.IPadWindow' MonoDevelop.Ide.Gui.Pad' MonoDevelop.Ide.Gui.Stock' MonoDevelop.Ide.Gui.Components.LogView' MonoDevelop.Ide.Gui.Components.LogViewProgressMonitor' MonoDevelop.Components.ImageView' MonoDevelop.Components.Control' MonoDevelop.Components.Docking.DockItemToolbar' MonoDevelop.Components.Docking.DockPositionType' MonoDevelop.Ide.IdeServices' MonoDevelop.Ide.Gui.Components.PadTreeView' MonoDevelop.Components.CompactScrolledWindow' MonoDevelop.Ide.Gui.Components.NodeBuilder' MonoDevelop.Ide.Gui.Components.TreePadOption' MonoDevelop.Components.Commands.ICommandDelegatorRouter' MonoDevelop.Ide.Gui.IMementoCapable' MonoDevelop.Ide.Gui.Components.ExtensibleTreeView' MonoDevelop.Ide.Gui.Components.NodeState' MonoDevelop.Ide.Tasks.ITaskListView' MonoDevelop.Ide.Codons.TaskListViewCodon' MonoDevelop.Components.Commands.CommandHandlerAttribute' MonoDevelop.Ide.Commands.EditCommands' MonoDevelop.Ide.DispatchService' MonoDevelop.Ide.ImageService' MonoDevelop.Ide.Gui.Document' MonoDevelop.Ide.Tasks.TaskEventArgs' MonoDevelop.Ide.Tasks.TaskListEntry' MonoDevelop.Ide.Tasks.TaskSeverity' MonoDevelop.Ide.Gui.Components.ColumnSelectorMenu' MonoDevelop.Components.SearchEntry' MonoDevelop.Components.CellRendererImage' MonoDevelop.Components.ContextMenu' MonoDevelop.Components.ContextMenuItem' MonoDevelop.Components.SeparatorContextMenuItem' MonoDevelop.Components.AutoTest.SemanticModelAttribute' MonoDevelop.Ide.BuildOutputView.BuildOutputViewContent' MonoDevelop.Ide.BuildOutputView.BuildOutput
MonoDevelop.Ide,MonoDevelop.Ide.Gui.Pads.ProjectPad,MonoDevelop.Ide.Gui.Dialogs.NewFolderDialog' MonoDevelop.Ide.Gui.PadCollection' MonoDevelop.Ide.Tasks.TaskListEntry' MonoDevelop.Ide.GettingStarted.GettingStarted' MonoDevelop.Ide.GettingStarted.GettingStartedNodeCommandHandler' MonoDevelop.Ide.GettingStarted.GettingStartedProjectExtension' MonoDevelop.Ide.GettingStarted.GettingStartedViewContent,MonoDevelop.Ide.Gui.Stock' MonoDevelop.Ide.Gui.Components.ITreeBuilder' MonoDevelop.Ide.Gui.Components.ITreeNavigator' MonoDevelop.Ide.Gui.Components.NodeAttributes' MonoDevelop.Ide.Gui.Components.NodeInfo' MonoDevelop.Ide.Gui.Components.TypeNodeBuilder' MonoDevelop.Components.Commands.CommandHandlerAttribute' MonoDevelop.Components.Commands.CommandUpdateHandlerAttribute' MonoDevelop.Components.Commands.CommandInfo' MonoDevelop.Ide.Commands.ProjectCommands' MonoDevelop.Ide.ProjectOperations' MonoDevelop.Ide.IdeApp' MonoDevelop.Ide.AlertButton' MonoDevelop.Ide.MessageService' MonoDevelop.Ide.Gui.Components.NodeCommandHandler' MonoDevelop.Ide.Gui.Components.AllowMultiSelectionAttribute' MonoDevelop.Ide.Gui.Components.DragOperation' MonoDevelop.Ide.Projects.FileNesting.FileNestingService' MonoDevelop.Ide.Gui.Document' MonoDevelop.Ide.Gui.Dialogs.NewFolderDialog' MonoDevelop.Components.SelectFolderDialog' MonoDevelop.Ide.Projects.AddFileDialog' MonoDevelop.Ide.Projects.IncludeNewFilesDialog' MonoDevelop.Ide.ImageService' MonoDevelop.Ide.IdeServices' MonoDevelop.Ide.Gui.Styles' MonoDevelop.Components.Commands.CommandArrayInfo' MonoDevelop.Ide.Commands.EditCommands' MonoDevelop.Ide.Commands.FileCommands' MonoDevelop.Ide.Commands.ViewCommands' MonoDevelop.Ide.Gui.FileViewer' MonoDevelop.Ide.QuestionMessage' MonoDevelop.Ide.Gui.Components.DropPosition' MonoDevelop.Ide.Tasks.TaskSeverity' MonoDevelop.Ide.Gui.Components.NodePosition' MonoDevelop.Ide.Gui.Pads.SolutionPad' MonoDevelop.Ide.Gui.Components.NodeBuilder' MonoDevelop.Ide.Gui.Components.TreePadOption' MonoDevelop.Ide.Gui.Components.NodeBuilderExtension' MonoDevelop.Ide.Commands.SearchCommands' MonoDevelop.Ide.FindInFiles.FindInFilesDialog' MonoDevelop.Ide.Gui.Components.TreeViewItem' MonoDevelop.Ide.GettingStarted.GettingStartedProjectExtension' MonoDevelop.Ide.GettingStarted.GettingStartedProvider' MonoDevelop.Ide.GettingStarted.GettingStartedNodeCommandHandler
MonoDevelop.Ide,MonoDevelop.Ide.StandardHeader,MonoDevelop.Ide.Commands.InsertStandardHeaderHandler' MonoDevelop.Ide.Templates.SingleFileDescriptionTemplate,MonoDevelop.Ide.Gui.Document' MonoDevelop.Ide.Gui.Content.TextStylePolicy' MonoDevelop.Ide.Gui.Dialogs.PolicyOptionsPanel<T>' MonoDevelop.Components.Control
MonoDevelop.Ide,MonoDevelop.Ide.Gui.Components,MonoDevelop.Ide.Gui.Pads.ClassBrowser.ClassBrowserPadWidget' MonoDevelop.Ide.Gui.Pads.TreeViewPad' MonoDevelop.Ide.Gui.Pads.ProjectPad.UnknownEntryNodeBuilder' MonoDevelop.Ide.Gui.Pads.ProjectPad.SystemFileNodeBuilder' MonoDevelop.Ide.Gui.Pads.ProjectPad.ProjectReferenceNodeBuilder' MonoDevelop.Ide.Gui.Pads.ProjectPad.FolderNodeBuilder' MonoDevelop.Ide.Gui.Pads.ProjectPad.GettingStartedNodeBuilderExtension' MonoDevelop.Ide.Gui.Pads.ProjectPad.ProjectFileNodeBuilder' MonoDevelop.Ide.Gui.Pads.ProjectPad.WorkspaceNodeBuilder' MonoDevelop.Ide.Gui.Pads.ProjectPad.SolutionFolderFileNodeBuilder' MonoDevelop.Ide.Gui.Pads.ProjectPad.SolutionFolderNodeBuilder' MonoDevelop.Ide.Gui.Pads.ProjectPad.ProjectFolderNodeBuilder' MonoDevelop.Ide.Gui.Pads.ClassPad.EventNodeBuilder' MonoDevelop.Ide.Gui.Pads.ClassPad.MethodNodeBuilder' MonoDevelop.Ide.Gui.Pads.ClassPad.FieldNodeBuilder' MonoDevelop.Ide.Gui.Pads.ProjectPad.ShowAllFilesBuilderExtension' MonoDevelop.Ide.Gui.Pads.ClassPad.NamespaceNodeBuilder' MonoDevelop.Ide.Gui.Pads.ClassPad.NamespaceData' MonoDevelop.Ide.Gui.Pads.ClassPad.ProjectNamespaceData' MonoDevelop.Ide.Gui.Pads.ClassPad.CombineNodeBuilder' MonoDevelop.Ide.Gui.Pads.ProjectPad.SolutionNodeBuilder' MonoDevelop.Ide.Gui.Pads.ProjectPad.ImplicitFrameworkAssemblyReferenceNodeBuilder' MonoDevelop.Ide.Gui.Pads.ClassPad.ClassNodeBuilder' MonoDevelop.Ide.Gui.Pads.ClassPad.ReferenceNodeBuilder' MonoDevelop.Ide.Gui.Pads.ProjectPad.PortableFrameworkSubsetNodeBuilder' MonoDevelop.Ide.Gui.Pads.ProjectPad.ProjectReferenceFolderNodeBuilder' MonoDevelop.Ide.Gui.Pads.ClassPad.ProjectNodeBuilder' MonoDevelop.Ide.Gui.Pads.ClassPad.PropertyNodeBuilder' MonoDevelop.Ide.Gui.Pads.ProjectPad.GettingStartedNodeBuilder' MonoDevelop.Ide.Gui.Pads.ClassPad.SolutionNodeBuilder' MonoDevelop.Ide.Gui.Pads.ProjectPad.ProjectNodeBuilder' MonoDevelop.Ide.Gui.Pads.ProjectPad.FolderCommandHandler' MonoDevelop.Ide.Gui.Pads.ProjectPad.ProjectSolutionPad' MonoDevelop.Ide.Tasks.TaskListEntry' MonoDevelop.Ide.Gui.Pads.ClassPad.SolutionNodeCommandHandler' MonoDevelop.Ide.Gui.Pads.ClassPad.MemberNodeBuilder' MonoDevelop.Ide.Gui.Pads.ProjectPad.ProjectReferenceNodeCommandHandler' MonoDevelop.Ide.Gui.Pads.ProjectPad.WorkspaceNodeCommandHandler' MonoDevelop.Ide.Gui.Pads.ProjectPad.ProjectNodeCommandHandler' MonoDevelop.Ide.Gui.Pads.ProjectPad.SolutionFolderNodeCommandHandler' MonoDevelop.Ide.Gui.Pads.ProjectPad.SolutionFolderFileNodeCommandHandler' MonoDevelop.Ide.Gui.Pads.ProjectPad.UnknownEntryCommandHandler' MonoDevelop.Ide.Gui.Pads.ProjectPad.ProjectReferenceFolderNodeCommandHandler' MonoDevelop.Ide.Gui.Pads.ProjectPad.SolutionNodeCommandHandler' MonoDevelop.Ide.Gui.Pads.ProjectPad.SystemFileNodeCommandHandler' MonoDevelop.Ide.Gui.Pads.ProjectPad.ProjectFileNodeCommandHandler' MonoDevelop.Ide.Gui.Pads.ProjectPad.ProjectFolderCommandHandler' MonoDevelop.Ide.Codons.NodeBuilderCodon' MonoDevelop.Ide.Codons.SolutionPadCodon' MonoDevelop.Ide.Gui.Pads.SolutionPad' MonoDevelop.Ide.Gui.Pads.ProjectPad.FileOperationsBuilderExtension' MonoDevelop.Ide.Gui.Pads.ProjectPad.FileOperationsCommandHandler' MonoDevelop.Ide.Gui.Pads.ProjectPad.ShowAllFilesCommandHandler' MonoDevelop.Ide.Gui.Pads.ClassPad.MemberNodeCommandHandler' MonoDevelop.Ide.Gui.Pads.ClassPad.ReferenceNodeCommandHandler' MonoDevelop.Ide.GettingStarted.GettingStartedNodeCommandHandler' MonoDevelop.Ide.Gui.Pads.ProjectPad.ImplicitFrameworkAssemblyReferenceNodeCommandHandler' MonoDevelop.Ide.Gui.Pads.ClassPad.ClassNodeCommandHandler' MonoDevelop.Ide.Codons.PadOptionCodon' MonoDevelop.Ide.Gui.Pads.HelpTree' MonoDevelop.Ide.FindInFiles.SearchResultWidget' MonoDevelop.Ide.Tasks.CommentTasksView' MonoDevelop.Ide.Tasks.UserTasksView' MonoDevelop.Ide.Gui.Pads.ErrorListPad' MonoDevelop.Ide.Gui.Pads.DefaultMonitorPad' MonoDevelop.Ide.Gui.Wizard.WizardDialog' MonoDevelop.Components.MDSpinner' MonoDevelop.Components.MainToolbar.StatusArea' MonoDevelop.Ide.ImageService' MonoDevelop.Ide.Gui.DefaultWorkbench' MonoDevelop.Ide.RoslynServices.MonoDevelopInfoBarService' MonoDevelop.Ide.Gui.Workbench,MonoDevelop.Components.Commands.Command' MonoDevelop.Components.Commands.CommandArrayInfo' MonoDevelop.Components.Commands.CommandEntrySet' MonoDevelop.Components.Commands.CommandHandlerAttribute' MonoDevelop.Components.Commands.CommandUpdateHandlerAttribute' MonoDevelop.Components.Commands.CommandInfo' MonoDevelop.Components.Commands.ICommandRouter' MonoDevelop.Components.Commands.IMultiCastCommandRouter' MonoDevelop.Ide.Commands.EditCommands' MonoDevelop.Ide.Commands.ProjectCommands' MonoDevelop.Ide.Commands.SearchCommands' MonoDevelop.Ide.Commands.ViewCommands' MonoDevelop.Ide.IdeApp' MonoDevelop.Ide.Theme' MonoDevelop.Ide.ImageService' MonoDevelop.Ide.Gui.Styles' MonoDevelop.Ide.Extensions.FileTypeCondition' MonoDevelop.Components.CompactScrolledWindow' MonoDevelop.Components.ContextMenuTreeView' MonoDevelop.Components.TooltipPopoverWindow' MonoDevelop.Components.PopupPosition' MonoDevelop.Components.CellRendererImage' MonoDevelop.Components.GtkGestures' MonoDevelop.Components.Control' MonoDevelop.Components.IdeTheme' MonoDevelop.Components.MainToolbar.Commands' MonoDevelop.Components.Commands.ICommandDelegatorRouter' MonoDevelop.Ide.Tasks.TaskSeverity' MonoDevelop.Components.Commands.CustomCommandTargetAttribute' MonoDevelop.Components.Commands.ICommandUpdateHandler' MonoDevelop.Components.Commands.ICommandArrayUpdateHandler' MonoDevelop.Components.Commands.CustomCommandUpdaterAttribute' MonoDevelop.Ide.Gui.PadFontChanger' MonoDevelop.Components.GtkUtil' MonoDevelop.Components.CheckBoxContextMenuItem' MonoDevelop.Components.ContextMenu' MonoDevelop.Ide.Execution.ExecutionModeCommandService' MonoDevelop.Ide.Execution.CommandExecutionContext' MonoDevelop.Components.Commands.KeyBindingManager' MonoDevelop.Ide.IdeServices' MonoDevelop.Components.SearchEntry' MonoDevelop.Components.ImageView' MonoDevelop.Ide.MessageService' MonoDevelop.Ide.Projects.ProjectFileSelectorDialog' MonoDevelop.Components.MenuButton' MonoDevelop.Components.ContextMenuItem' MonoDevelop.Components.SeparatorContextMenuItem' MonoDevelop.Ide.RootWorkspace' MonoDevelop.Ide.Gui.Stock' MonoDevelop.Ide.DispatchService' MonoDevelop.Ide.Gui.NotificationBar
MonoDevelop.Ide,MonoDevelop.Ide.CodeFormatting,MonoDevelop.Ide.CodeTemplates.CodeTemplate' MonoDevelop.Ide.Templates.MicrosoftTemplateEngine' MonoDevelop.Ide.TypeSystem.MonoDevelopWorkspace' MonoDevelop.Ide.Templates.SingleFileDescriptionTemplate' MonoDevelop.Ide.Editor.InsertionPoint,MonoDevelop.Ide.IdeServices' MonoDevelop.Ide.Editor.TextEditor' MonoDevelop.Ide.Editor.DocumentContext' MonoDevelop.Components.Commands.CommandHandler' MonoDevelop.Components.Commands.CommandInfo' MonoDevelop.Ide.IdeApp' MonoDevelop.Ide.Gui.Document' MonoDevelop.Ide.Gui.Content.TextStylePolicy' MonoDevelop.Ide.Editor.IDocumentLine
MonoDevelop.Ide,MonoDevelop.Ide.FindInFiles,MonoDevelop.Ide.Gui.IdeProgressMonitorManager' MonoDevelop.Ide.Gui.Pads.ClassPad.SolutionNodeCommandHandler' MonoDevelop.Ide.Gui.Pads.ProjectPad.FileOperationsCommandHandler' MonoDevelop.Components.MainToolbar.SearchInSolutionSearchCategory' MonoDevelop.Ide.Gui.ProgressMonitorManager' MonoDevelop.Ide.Editor.Extension.Usage' MonoDevelop.Ide.Editor.Extension.AbstractUsagesExtension<T>,MonoDevelop.Ide.TypeSystem.Ambience' MonoDevelop.Ide.IdeApp' MonoDevelop.Ide.IdeServices' MonoDevelop.Components.HslColor' MonoDevelop.Ide.Editor.IDocumentLine' MonoDevelop.Ide.Editor.TextEditor' MonoDevelop.Ide.Editor.DocumentLocation' MonoDevelop.Ide.Editor.TextEditorFactory' MonoDevelop.Ide.Editor.MarkupOptions' MonoDevelop.Ide.Editor.MarkupFormat' MonoDevelop.Ide.Editor.Highlighting.SyntaxHighlightingService' MonoDevelop.Ide.Editor.Highlighting.EditorTheme' MonoDevelop.Ide.Editor.Highlighting.EditorThemeColors' MonoDevelop.Components.Commands.CommandHandlerAttribute' MonoDevelop.Ide.Commands.EditCommands' MonoDevelop.Ide.Commands.ViewCommands' MonoDevelop.Ide.Gui.PadContent' MonoDevelop.Ide.Gui.IPadWindow' MonoDevelop.Ide.Gui.Stock' MonoDevelop.Components.Control' MonoDevelop.Ide.ImageService' MonoDevelop.Ide.AlertButton' MonoDevelop.Ide.MessageService' MonoDevelop.Components.SearchEntry' MonoDevelop.Components.SelectFolderDialog' MonoDevelop.Components.ImageView' MonoDevelop.Components.IdeTheme' MonoDevelop.Components.DockNotebook.DockWindow' MonoDevelop.Components.Commands.CommandHandler' MonoDevelop.Components.Commands.CommandInfo' MonoDevelop.Ide.Gui.Document' Microsoft.VisualStudio.Platform.NewTextSnapshotToTextReader' MonoDevelop.Components.Commands.CommandEntry' MonoDevelop.Components.Commands.CommandEntrySet' MonoDevelop.Ide.Theme' MonoDevelop.Ide.Gui.Content.ILocationList' MonoDevelop.Ide.Gui.Components.PadTreeView' MonoDevelop.Components.CompactScrolledWindow' MonoDevelop.Components.CellRendererImage' MonoDevelop.Ide.Navigation.TextFileNavigationPoint' MonoDevelop.Ide.Navigation.NavigationPoint' MonoDevelop.Ide.Gui.Pad
MonoDevelop.Ide,MonoDevelop.Ide.Execution,MonoDevelop.Ide.Gui.Components.ExecutionModeComboBox' MonoDevelop.Ide.Commands.RunWithHandler' MonoDevelop.Ide.Commands.RunEntryWithHandler' MonoDevelop.Ide.Projects.OptionPanels.DotNetRunConfigurationEditorWidget' MonoDevelop.Ide.Projects.OptionPanels.RunConfigurationPanel' MonoDevelop.Ide.Projects.OptionPanels.ProcessRunConfigurationEditor' MonoDevelop.Ide.Projects.OptionPanels.AssemblyRunConfigurationEditor,MonoDevelop.Components.Commands.CommandArrayInfo' MonoDevelop.Components.Commands.CommandInfo' MonoDevelop.Ide.IdeApp' MonoDevelop.Ide.MessageService' MonoDevelop.Ide.IdeServices' MonoDevelop.Ide.AlertButton' MonoDevelop.Components.TreeViewState' MonoDevelop.Components.Control' MonoDevelop.Ide.Extensions.RunConfigurationEditorExtensionNode' MonoDevelop.Ide.Projects.OptionPanels.RunConfigurationsList
MonoDevelop.Ide,MonoDevelop.Ide.Extensions,MonoDevelop.Ide.Gui.Dialogs.OpenFileDialog' MonoDevelop.Ide.Projects.AddFileDialog' MonoDevelop.Ide.Editor.Extension.AutoInsertBracketTextEditorExtension' MonoDevelop.Ide.Editor.TextEditor' MonoDevelop.Ide.Gui.DefaultWorkbench' MonoDevelop.Ide.CustomTools.CustomToolService' MonoDevelop.Ide.Desktop.PlatformService' MonoDevelop.Ide.MimeTypeCatalog' MonoDevelop.Ide.Projects.OptionPanels.CodeFormattingPanel' MonoDevelop.Ide.Gui.Dialogs.MimeTypePanelData' MonoDevelop.Ide.Projects.OptionPanels.RunConfigurationOptionsDialogSection' MonoDevelop.Ide.Projects.OptionPanels.SolutionRunConfigurationOptionsDialogSection' MonoDevelop.Ide.Projects.OptionPanels.MimetypeOptionsDialogSection' MonoDevelop.Ide.Gui.Dialogs.OptionsDialog' MonoDevelop.Ide.ImageService' MonoDevelop.Ide.Gui.Components.ExtensibleTreeView' MonoDevelop.Ide.TypeSystem.Ambience' MonoDevelop.Ide.Editor.Extension.BraceMatcherTextEditorExtension' MonoDevelop.Ide.TypeSystem.TypeSystemService' MonoDevelop.Ide.TypeSystem.CodeGenerator' MonoDevelop.Ide.MonoDevelopOptions' MonoDevelop.Ide.IdeApp' MonoDevelop.Ide.IdeStartup' MonoDevelop.Ide.Tasks.TaskListEntry' MonoDevelop.Ide.Execution.RunConfigurationService' MonoDevelop.Ide.Gui.StartupAssetType' MonoDevelop.Ide.IdeInstanceConnection' MonoDevelop.Ide.IdeStartupTracker' MonoDevelop.Ide.Gui.Documents.ExportDocumentControllerBaseAttribute,MonoDevelop.Components.Extensions.IDialogHandler' MonoDevelop.Ide.Gui.FileViewer' MonoDevelop.Components.Extensions.SelectFileDialogData' MonoDevelop.Components.Docking.DockItemStatus' MonoDevelop.Ide.CustomTools.ISingleFileCustomTool' MonoDevelop.Ide.CustomTools.SingleProjectFileCustomTool' MonoDevelop.Ide.CustomTools.SingleFileCustomToolWrapper' MonoDevelop.Ide.Gui.Dialogs.IOptionsPanel' MonoDevelop.Ide.IdeServices' MonoDevelop.Ide.Services' MonoDevelop.Ide.MonoDevelopOptions' MonoDevelop.Ide.Gui.OpenDocumentOptions' MonoDevelop.Ide.Gui.FileOpenInformation
MonoDevelop.Ide,MonoDevelop.Ide.CustomTools,MonoDevelop.Ide.Extensions.CustomToolExtensionNode' MonoDevelop.Ide.IdeApp,MonoDevelop.Ide.IdeApp' MonoDevelop.Ide.IdeServices' MonoDevelop.Ide.Gui.Pad' MonoDevelop.Ide.Gui.Stock' MonoDevelop.Ide.Tasks.TaskPriority' MonoDevelop.Ide.Tasks.TaskListEntry' MonoDevelop.Ide.Tasks.TaskSeverity' MonoDevelop.Ide.Gui.Pads.DefaultMonitorPad' MonoDevelop.Ide.Extensions.CustomToolExtensionNode
