Project,Namespace,Ca types,Ce types
Rubberduck,Rubberduck.UI.Command,Rubberduck.Root.RubberduckIoCInstaller' RubberduckTests.Commands.ExportAllTests' RubberduckTests.Commands.IndentCommandTests' Rubberduck.UI.Inspections.InspectionResultsViewModel' RubberduckTests.Commands.UnitTestCommandTests' Rubberduck.UI.CodeExplorer.Commands.AddTestModuleWithStubsCommand' Rubberduck.UI.CodeExplorer.Commands.AddTestModuleCommand' Rubberduck.App' Rubberduck.Common.RubberduckHooks' Rubberduck.Common.Hotkeys.Hotkey' Rubberduck.Navigation.CodeExplorer.CodeExplorerViewModel' Rubberduck.UI.About.AboutControlViewModel' Rubberduck.UI.CodeExplorer.Commands.UndoCommand' Rubberduck.UI.Command.MenuItems.CodeMetricsCommandMenuItem' Rubberduck.UI.Command.MenuItems.RefreshCommandMenuItem' Rubberduck.UI.Command.MenuItems.FormDesignerFindAllReferencesCommandMenuItem' Rubberduck.UI.Command.MenuItems.IndentCurrentProjectCommandMenuItem' Rubberduck.UI.Command.MenuItems.ExportAllCommandMenuItem' Rubberduck.UI.Command.MenuItems.RegexAssistantCommandMenuItem' Rubberduck.UI.Command.MenuItems.NoIndentAnnotationCommandMenuItem' Rubberduck.UI.Command.MenuItems.IndentCurrentModuleCommandMenuItem' Rubberduck.UI.Command.MenuItems.InspectionResultsCommandMenuItem' Rubberduck.UI.Command.MenuItems.AddTestMethodCommandMenuItem' Rubberduck.UI.Command.MenuItems.AddTestMethodExpectedErrorCommandMenuItem' Rubberduck.UI.Command.MenuItems.AddTestModuleCommandMenuItem' Rubberduck.UI.Command.MenuItems.ProjectExplorerRefactorRenameCommandMenuItem' Rubberduck.UI.Command.MenuItems.FormDesignerRefactorRenameCommandMenuItem' Rubberduck.UI.Command.MenuItems.FindAllReferencesCommandMenuItem' Rubberduck.UI.Command.MenuItems.FindSymbolCommandMenuItem' Rubberduck.UI.Command.MenuItems.FindAllImplementationsCommandMenuItem' Rubberduck.UI.Command.MenuItems.CodeExplorerCommandMenuItem' Rubberduck.UI.Command.MenuItems.AboutCommandMenuItem' Rubberduck.UI.Command.MenuItems.IndentCurrentProcedureCommandMenuItem' Rubberduck.UI.Command.MenuItems.CommandMenuItemBase' Rubberduck.UI.Command.MenuItems.RefactorEncapsulateFieldCommandMenuItem' Rubberduck.UI.Command.MenuItems.RefactorImplementInterfaceCommandMenuItem' Rubberduck.UI.Command.MenuItems.RefactorExtractInterfaceCommandMenuItem' Rubberduck.UI.Command.MenuItems.RefactorIntroduceFieldCommandMenuItem' Rubberduck.UI.Command.MenuItems.RefactorIntroduceParameterCommandMenuItem' Rubberduck.UI.Command.MenuItems.RefactorMoveCloserToUsageCommandMenuItem' Rubberduck.UI.Command.MenuItems.RegexSearchReplaceCommandMenuItem' Rubberduck.UI.Command.MenuItems.SettingsCommandMenuItem' Rubberduck.UI.Command.MenuItems.RefactorExtractMethodCommandMenuItem' Rubberduck.UI.Command.MenuItems.RefactorRemoveParametersCommandMenuItem' Rubberduck.UI.Command.MenuItems.CodePaneRefactorRenameCommandMenuItem' Rubberduck.UI.Command.MenuItems.RefactorReorderParametersCommandMenuItem' Rubberduck.UI.Command.MenuItems.RunAllTestsCommandMenuItem' Rubberduck.UI.Command.MenuItems.SourceControlCommandMenuItem' Rubberduck.UI.Command.MenuItems.TestExplorerCommandMenuItem' Rubberduck.UI.Command.MenuItems.ToDoExplorerCommandMenuItem' Rubberduck.UI.Command.MenuItems.CommandBars.AppCommandBarBase' Rubberduck.UI.Command.MenuItems.CommandBars.ReparseCommandMenuItem' Rubberduck.UI.Command.MenuItems.CommandBars.SerializeDeclarationsCommandMenuItem' Rubberduck.UI.Command.MenuItems.CommandBars.ShowParserErrorsCommandMenuItem' Rubberduck.UI.Refactorings.RemoveParameters.RemoveParametersView' Rubberduck.UI.Command.MenuItems.ParentMenus.ParentMenuItemBase' Rubberduck.UI.CodeExplorer.CodeExplorerControl' Rubberduck.UI.Settings.GeneralSettingsViewModel' Rubberduck.UI.Settings.InspectionSettings' Rubberduck.UI.Settings.InspectionSettingsViewModel' Rubberduck.UI.Settings.SettingsControlViewModel' Rubberduck.UI.Settings.TodoSettings' Rubberduck.UI.Settings.TodoSettingsViewModel' Rubberduck.UI.SourceControl.BranchesPanelViewModel' Rubberduck.UI.SourceControl.ChangesPanelViewModel' Rubberduck.UI.SourceControl.SettingsPanelViewModel' Rubberduck.UI.SourceControl.UnsyncedCommitsPanelViewModel' Rubberduck.UI.ToDoItems.ToDoExplorerControl' Rubberduck.UI.ToDoItems.ToDoExplorerViewModel' RubberduckTests.CodeExplorer.CodeExplorerTests' RubberduckTests.SourceControl.BranchesViewModelTests' RubberduckTests.SourceControl.ChangesViewModelTests' RubberduckTests.SourceControl.SettingsViewModelTests' RubberduckTests.SourceControl.SourceControlViewModelTests' RubberduckTests.SourceControl.UnsyncedCommitsViewModelTests' RubberduckTests.Settings.TodoSettingsTests' RubberduckTests.TodoExplorer.TodoExplorerTests' Rubberduck.UI.CodeExplorer.Commands.FindAllImplementationsCommand' RubberduckTests.Commands.FindAllImplementationsTests' Rubberduck.UI.CodeExplorer.Commands.FindAllReferencesCommand' Rubberduck.UI.Command.MenuItems.CommandBars.ReferenceCounterLabelMenuItem' RubberduckTests.Commands.FindAllReferencesTests' Rubberduck.UI.CodeExplorer.Commands.IndentCommand' Rubberduck.UI.CodeExplorer.Commands.OpenCommand' Rubberduck.UI.Controls.GroupingGrid' Rubberduck.UI.Controls.SearchResultsViewModel' Rubberduck.UI.UnitTesting.TestExplorerViewModel,Rubberduck.UI.IDockablePresenter' Rubberduck.VBEditor.SafeComWrappers.Abstract.IVBE' Rubberduck.UI.IFolderBrowserFactory' Rubberduck.Navigation.CodeExplorer.CodeExplorerProjectViewModel' Rubberduck.VBEditor.SafeComWrappers.Abstract.IVBProject' Rubberduck.Parsing.Symbols.Declaration' Rubberduck.Navigation.CodeExplorer.CodeExplorerItemViewModel' Rubberduck.VBEditor.SafeComWrappers.Abstract.IVBComponents' Rubberduck.UI.RubberduckUI' Rubberduck.UI.IFolderBrowser' Rubberduck.SmartIndenter.IIndenter' Rubberduck.Parsing.VBA.RubberduckParserState' Rubberduck.VBEditor.SafeComWrappers.ProjectProtection' Rubberduck.Parsing.VBA.ParserState' Rubberduck.UI.RegexAssistant.RegexAssistantDialog' Rubberduck.VersionCheck.IVersionCheck' Rubberduck.UI.IMessageBox' Rubberduck.VBEditor.SafeComWrappers.Abstract.ICodePane' Rubberduck.Parsing.Annotations.AnnotationType' Rubberduck.VBEditor.SafeComWrappers.Abstract.ICodeModule' Rubberduck.Parsing.Symbols.DeclarationType' Rubberduck.UI.Controls.ISearchResultsWindowViewModel' Rubberduck.UI.Controls.SearchResultPresenterInstanceManager' Rubberduck.UI.Command.MenuItems.UiDispatcher' Rubberduck.Parsing.VBA.ParserStateEventArgs' Rubberduck.UI.Controls.SearchResultsViewModel' Rubberduck.UI.Controls.SearchResultsDockablePresenter' Rubberduck.VBEditor.QualifiedModuleName' Rubberduck.Parsing.Symbols.DeclarationFinder' Rubberduck.Parsing.Symbols.Accessibility' Rubberduck.VBEditor.Selection' Rubberduck.Parsing.Symbols.ParsingExceptions.SyntaxErrorException' Rubberduck.VBEditor.QualifiedMemberName' Rubberduck.UI.NavigateCodeEventArgs' Rubberduck.UI.About.AboutDialog' Rubberduck.VBEditor.SafeComWrappers.Abstract.IVBComponent' Rubberduck.Settings.IGeneralConfigService' Rubberduck.Settings.IUnitTestSettings' Rubberduck.Settings.AssertMode' Rubberduck.Settings.BindingMode' Rubberduck.VBEditor.SafeComWrappers.Abstract.IVBProjects' Rubberduck.Settings.UnitTestSettings' Rubberduck.Settings.UserSettings' Rubberduck.Settings.Configuration' Rubberduck.VBEditor.SafeComWrappers.ComponentType' Rubberduck.Parsing.Symbols.ProceduralModuleDeclaration' Rubberduck.Parsing.Symbols.ClassModuleDeclaration' Rubberduck.Parsing.Grammar.ImplementsStmtContext' Rubberduck.Common.DeclarationIconCache' Rubberduck.UI.FindSymbol.FindSymbolViewModel' Rubberduck.UI.FindSymbol.FindSymbolDialog' Rubberduck.Common.IOperatingSystem' Rubberduck.UI.Settings.SettingsForm' Rubberduck.Navigation.RegexSearchReplace.RegexSearchReplacePresenter' Rubberduck.UnitTesting.ITestEngine' Rubberduck.UI.UnitTesting.TestExplorerModel
Rubberduck,Rubberduck.UI.Command.MenuItems,Rubberduck.Root.RubberduckIoCInstaller' Rubberduck.App' Rubberduck.UI.Command.MenuItems.ParentMenus.ParentMenuItemBase' Rubberduck.API.VBA.ParserState' Rubberduck.Navigation.CodeExplorer.CodeExplorerViewModel' Rubberduck.UI.Command.ShowParserErrorsCommand' Rubberduck.UI.Command.FindAllImplementationsCommand' Rubberduck.UI.Command.FindAllReferencesCommand' Rubberduck.UI.Command.MenuItems.CommandBars.AppCommandBarBase' Rubberduck.UI.Command.MenuItems.CommandBars.RubberduckCommandBar' Rubberduck.UI.Inspections.InspectionResultsViewModel' Rubberduck.UI.SourceControl.SourceControlViewViewModel,Rubberduck.UI.Command.CommandBase' Rubberduck.Parsing.VBA.RubberduckParserState' Rubberduck.Parsing.VBA.ParserState
Rubberduck,Rubberduck.UI.Converters,,
Rubberduck,Rubberduck.UI.Command.MenuItems.CommandBars,Rubberduck.Root.RubberduckIoCInstaller' Rubberduck.AppMenu,Rubberduck.Parsing.VBA.RubberduckParserState' Rubberduck.VBEditor.SafeComWrappers.Office.Core.CommandBarPosition' Rubberduck.UI.Command.MenuItems.UiDispatcher' Rubberduck.VBEditor.SafeComWrappers.Office.Core.Abstract.ICommandBars' Rubberduck.VBEditor.SafeComWrappers.Office.Core.Abstract.ICommandBar' Rubberduck.VBEditor.SafeComWrappers.Office.Core.Abstract.ICommandBarButton' Rubberduck.UI.Command.MenuItems.ParentMenus.CommandBarButtonFactory' Rubberduck.UI.Command.ICommandMenuItem' Rubberduck.VBEditor.SafeComWrappers.Office.Core.CommandBarButtonClickEventArgs' Rubberduck.UI.Command.CommandBase' Rubberduck.VBEditor.SafeComWrappers.Abstract.ICodePane' Rubberduck.Parsing.Symbols.Declaration' Rubberduck.VBEditor.QualifiedModuleName' Rubberduck.VBEditor.QualifiedMemberName' Rubberduck.Parsing.SymbolList' Rubberduck.UI.RubberduckUI' Rubberduck.UI.Settings.Settings' Rubberduck.Parsing.Symbols.DeclarationType' Rubberduck.UI.Command.FindAllReferencesCommand' Rubberduck.Parsing.IParseCoordinator' Rubberduck.UI.ISelectionChangeService' Rubberduck.Parsing.VBA.ParserState' Rubberduck.UI.DeclarationChangedEventArgs' Rubberduck.VBEditor.SafeComWrappers.Abstract.IVBProject' Rubberduck.VBEditor.SafeComWrappers.Abstract.IVBComponent' Rubberduck.Parsing.VBA.RubberduckStatusMessageEventArgs' Rubberduck.SettingsProvider.IPersistable
Rubberduck,Rubberduck.UI.Controls,Rubberduck.UI.Command.ShowParserErrorsCommand' Rubberduck.UI.Command.FindAllImplementationsCommand' Rubberduck.UI.Command.FindAllReferencesCommand' RubberduckTests.Commands.FindAllImplementationsTests' RubberduckTests.Commands.FindAllReferencesTests' Rubberduck.UI.Inspections.InspectionResultsViewModel,Rubberduck.UI.RubberduckUI' Rubberduck.VBEditor.SafeComWrappers.Abstract.IVBE' Rubberduck.VBEditor.SafeComWrappers.Abstract.IAddIn' Rubberduck.UI.Command.INavigateCommand' Rubberduck.UI.NavigateCodeEventArgs' Rubberduck.Parsing.Symbols.Declaration' Rubberduck.UI.IDockableUserControl
Rubberduck,Rubberduck.UI,Rubberduck.UI.SourceControl.SourceControlViewViewModel' Rubberduck.AppMenu' Rubberduck.UI.Command.MenuItems.CommandBars.RubberduckCommandBar' Rubberduck.Common.Hotkeys.HotkeyInfo' Rubberduck.UI.Settings.Converters.HotkeyDisplayConverter' Rubberduck.UI.Command.ExportAllCommand' Rubberduck.UI.SourceControl.SettingsPanelViewModel' Rubberduck.App' Rubberduck.UI.CodeExplorer.Commands.RenameCommand' Rubberduck.UI.CodeExplorer.Commands.RemoveCommand' Rubberduck.UI.CodeExplorer.Commands.UndoCommand' Rubberduck.UI.Command.VersionCheckCommand' Rubberduck.UI.Command.FindAllImplementationsCommand' Rubberduck.UI.Command.FindAllReferencesCommand' Rubberduck.Refactorings.ExtractInterface.ExtractInterfaceRefactoring' Rubberduck.Refactorings.ImplementInterface.ImplementInterfaceRefactoring' Rubberduck.Refactorings.IntroduceField.IntroduceFieldRefactoring' Rubberduck.Refactorings.IntroduceParameter.IntroduceParameterRefactoring' Rubberduck.Refactorings.MoveCloserToUsage.MoveCloserToUsageRefactoring' Rubberduck.Refactorings.RemoveParameters.RemoveParametersModel' Rubberduck.Refactorings.RemoveParameters.RemoveParametersPresenter' Rubberduck.Refactorings.RemoveParameters.RemoveParametersPresenterFactory' Rubberduck.Refactorings.Rename.RenameRefactoring' Rubberduck.Refactorings.ReorderParameters.ReorderParametersModel' Rubberduck.Refactorings.ReorderParameters.ReorderParametersPresenter' Rubberduck.Refactorings.ReorderParameters.ReorderParametersPresenterFactory' Rubberduck.Refactorings.ReorderParameters.ReorderParametersRefactoring' Rubberduck.UI.Command.Refactorings.FormDesignerRefactorRenameCommand' Rubberduck.UI.Command.Refactorings.ProjectExplorerRefactorRenameCommand' Rubberduck.UI.Command.Refactorings.RefactorImplementInterfaceCommand' Rubberduck.UI.Command.Refactorings.RefactorExtractInterfaceCommand' Rubberduck.UI.Command.Refactorings.RefactorIntroduceFieldCommand' Rubberduck.UI.Command.Refactorings.RefactorIntroduceParameterCommand' Rubberduck.UI.Command.Refactorings.RefactorMoveCloserToUsageCommand' Rubberduck.UI.Command.Refactorings.CodePaneRefactorRenameCommand' Rubberduck.UI.Command.Refactorings.RefactorReorderParametersCommand' Rubberduck.UI.Command.Refactorings.RefactorRemoveParametersCommand' Rubberduck.Inspections.QuickFixes.MoveFieldCloserToUsageQuickFix' Rubberduck.Inspections.QuickFixes.RemoveUnusedParameterQuickFix' Rubberduck.Inspections.QuickFixes.RenameDeclarationQuickFix' Rubberduck.UI.CodeExplorer.Commands.ImportCommand' Rubberduck.UI.Settings.GeneralSettingsViewModel' Rubberduck.UI.Settings.IndenterSettingsViewModel' Rubberduck.UI.Settings.InspectionSettingsViewModel' Rubberduck.UI.Settings.UnitTestSettingsViewModel' Rubberduck.UI.Settings.TodoSettingsViewModel' Rubberduck.UI.Settings.WindowSettingsViewModel' Rubberduck.UI.CodeExplorer.Commands.ExportCommand' Rubberduck._Extension' Rubberduck.Common.DeclarationExtensions' Rubberduck.Common.Hotkeys.Hotkey' Rubberduck.Settings.MinimumLogLevel' Rubberduck.Settings.DisplayLanguageSetting' Rubberduck.Settings.ToDoListSettings' Rubberduck.UI.About.AboutControl' Rubberduck.UI.Command.ShowParserErrorsCommand' Rubberduck.UI.Command.MenuItems.CommandBars.ContextFormatter' Rubberduck.UI.Command.MenuItems.CommandBars.ReferenceCounterLabelMenuItem' Rubberduck.UI.Controls.DeclarationTypeToStringConverter' Rubberduck.UI.Inspections.InspectionResultsViewModel' Rubberduck.UI.Refactorings.EncapsulateField.EncapsulateFieldDialog' Rubberduck.UI.Refactorings.AssignedByValParameterQuickFixDialog' Rubberduck.UI.Refactorings.ExtractInterfaceDialog' Rubberduck.UI.Refactorings.ExtractMethodDialog' Rubberduck.UI.Refactorings.RemoveParameters.RemoveParametersDialog' Rubberduck.UI.Refactorings.Rename.RenameDialog' Rubberduck.UI.Refactorings.ReorderParameters.ReorderParametersDialog' Rubberduck.UnitTesting.Verifier' Rubberduck.UnitTesting.AssertClass' Rubberduck.UnitTesting.AssertHandler' Rubberduck.UnitTesting.TestEngine' Rubberduck.UI.Command.Refactorings.RefactorCommandBase' Rubberduck.UI.RegexAssistant.RegexAssistantViewModel' Rubberduck.UI.Settings.Converters.AssertModeValueToTextConverter' Rubberduck.UI.Settings.Converters.DelimiterToTextConverter' Rubberduck.UI.Settings.Converters.EndOfLineCommentStyleToTextConverter' Rubberduck.UI.Settings.Converters.EndOfLineCommentStyleValueTextToEnumValueConverter' Rubberduck.UI.Settings.Converters.AssertModeToTextConverter' Rubberduck.UI.Settings.Converters.DelimiterValueToTextConverter' Rubberduck.UI.Settings.Converters.BindingModeValueToTextConverter' Rubberduck.UI.Settings.Converters.BindingModeToTextConverter' Rubberduck.UI.Settings.Settings' Rubberduck.UI.FindSymbol.FindSymbolDialog' Rubberduck.UI.SourceControl.BranchesPanelViewModel' Rubberduck.UI.SourceControl.ChangesPanelViewModel' Rubberduck.UI.SourceControl.UnsyncedCommitsPanelViewModel' Rubberduck.UI.SourceControl.Converters.ChangeTypesToTextConverter' Rubberduck.UI.SourceControl.Converters.CommitActionsToTextConverter' Rubberduck.UI.SourceControl.Converters.CommitActionTextToEnum' Rubberduck.UI.UnitTesting.TestResultToOutcomeTextConverter' Rubberduck.ToDoItems.ToDoItem' Rubberduck.Inspections.Concrete.IntegerDataTypeInspection' Rubberduck.Inspections.Concrete.ShadowedDeclarationInspection' Rubberduck.Inspections.Concrete.HungarianNotationInspection' Rubberduck.Inspections.Concrete.MultilineParameterInspection' Rubberduck.Inspections.Concrete.UseMeaningfulNameInspection' Rubberduck.Inspections.Inspector' RubberduckTests.Inspections.GeneralInspectionTests' RubberduckTests.SourceControl.ChangesViewModelTests' RubberduckTests.SourceControl.SourceControlViewModelTests' Rubberduck.UI.ParserErrors.ParserErrorsPresenter' Rubberduck.UI.IdentifierReferences.ImplementationsListDockablePresenter' Rubberduck.UI.IdentifierReferences.IdentifierReferencesListDockablePresenter' Rubberduck.UI.Command.SyntaxErrorExtensions' Rubberduck.UI.Command.FindSymbolCommand' Rubberduck.UI.Command.NavigateCommand' Rubberduck.UI.Controls.SearchResultItem' Rubberduck.UnitTesting.TestMethod' Rubberduck.UI.FindSymbol.FindSymbolViewModel' Rubberduck.Inspections.Abstract.InspectionResultBase' Rubberduck.UI.CodeExplorer.Commands.CommitCommand' Rubberduck.UI.Command.CodeMetricsCommand' Rubberduck.UI.Command.CodeExplorerCommand' Rubberduck.UI.Command.RunAllTestsCommand' Rubberduck.UI.Command.InspectionResultsCommand' Rubberduck.UI.Command.SourceControlCommand' Rubberduck.UI.Command.TestExplorerCommand' Rubberduck.UI.Command.ToDoExplorerCommand' Rubberduck.Settings.IWindowSettings' Rubberduck.Settings.WindowSettings' Rubberduck.UI.Controls.SearchResultsDockablePresenter,Rubberduck.Parsing.Symbols.Declaration' Rubberduck.VBEditor.SafeComWrappers.Abstract.IVBE' Rubberduck.Parsing.IParseCoordinator' Rubberduck.VBEditor.Events.VBENativeServices' Rubberduck.VBEditor.Events.SelectionChangedEventArgs' Rubberduck.VBEditor.SafeComWrappers.Abstract.ICodePane' Rubberduck.Parsing.VBA.RubberduckParserState' Rubberduck.VBEditor.Events.WindowChangedEventArgs' Rubberduck.VBEditor.Events.FocusType' Rubberduck.VBEditor.SafeComWrappers.Abstract.IWindow' Rubberduck.VBEditor.SafeComWrappers.MSForms.WindowKind' Rubberduck.VBEditor.SafeComWrappers.Abstract.IVBComponent' Rubberduck.VBEditor.SafeComWrappers.Office.Core.Abstract.IControls' Rubberduck.Parsing.Symbols.DeclarationFinder' Rubberduck.Parsing.Symbols.DeclarationType' Rubberduck.VBEditor.SafeComWrappers.Abstract.IVBProject' Rubberduck.VBEditor.SafeComWrappers.ComponentType' Rubberduck.UI.IdentifierReferences.ListItemActionEventArgs' Rubberduck.Properties.Resources' Rubberduck.VBEditor.QualifiedSelection' Rubberduck.Parsing.Symbols.IdentifierReference' Rubberduck.VBEditor.QualifiedModuleName' Rubberduck.VBEditor.Selection' Rubberduck.VBEditor.QualifiedMemberName' Rubberduck.VBEditor.SafeComWrappers.Abstract.IAddIn' Rubberduck.Settings.WindowSettings' Rubberduck.SettingsProvider.IConfigProvider' Rubberduck.VBEditor.SafeComWrappers.Abstract.ToolWindowInfo' Rubberduck.VBEditor.SafeComWrappers.Abstract.IWindows' Rubberduck.VBEditor.SubClassingWindowEventArgs' Rubberduck.VBEditor.WindowsApi.WM' Rubberduck.Common.WinAPI.User32' Rubberduck.VBEditor.WindowsApi.SubclassingWindow
Rubberduck,Rubberduck.UI.Inspections,Rubberduck.Settings.WindowSettings,Rubberduck.Parsing.Inspections.Abstract.IInspectionResult' Rubberduck.Parsing.Inspections.Abstract.IInspection' Rubberduck.Parsing.Inspections.Resources.InspectionsUI' Rubberduck.Parsing.Inspections.Resources.CodeInspectionType' Rubberduck.Parsing.Inspections.Abstract.IQuickFix' Rubberduck.Parsing.VBA.RubberduckParserState' Rubberduck.Parsing.Inspections.Abstract.IInspector' Rubberduck.Parsing.Inspections.Abstract.IQuickFixProvider' Rubberduck.Common.IClipboardWriter' Rubberduck.Settings.IGeneralConfigService' Rubberduck.Common.IOperatingSystem' Rubberduck.UI.Controls.INavigateSource' Rubberduck.UI.Command.ReparseCommand' Rubberduck.Parsing.VBA.ParserState' Rubberduck.Settings.CodeInspectionSettings' Rubberduck.Settings.UserSettings' Rubberduck.Settings.Configuration' Rubberduck.UI.Command.INavigateCommand' Rubberduck.Settings.ConfigurationChangedEventArgs' Rubberduck.UI.Settings.SettingsViews' Rubberduck.UI.Settings.SettingsForm' Rubberduck.UI.Command.MenuItems.UiDispatcher' Rubberduck.Parsing.Inspections.Resources.CodeInspectionSeverity' Rubberduck.UI.Command.CommandBase' Rubberduck.Common.ColumnInfo' Rubberduck.Common.hAlignment' Rubberduck.UI.RubberduckUI' Rubberduck.Common.ExportFormatter' Rubberduck.VBEditor.SafeComWrappers.Abstract.IVBE' Rubberduck.VBEditor.SafeComWrappers.Abstract.IAddIn' Rubberduck.SettingsProvider.IConfigProvider
Rubberduck,Rubberduck.UI.Refactorings.EncapsulateField,Rubberduck.Refactorings.EncapsulateField.EncapsulateFieldPresenter,Rubberduck.Parsing.Symbols.Declaration' Rubberduck.Parsing.VBA.RubberduckParserState' Rubberduck.SmartIndenter.IIndenter' Rubberduck.UI.RubberduckUI
Rubberduck,Rubberduck.UI.Refactorings,Rubberduck.Refactorings.ExtractInterface.ExtractInterfacePresenter' Rubberduck.Inspections.QuickFixes.AssignedByValParameterMakeLocalCopyQuickFix' Rubberduck.Refactorings.EncapsulateField.EncapsulateFieldPresenter' Rubberduck.Refactorings.EncapsulateField.EncapsulateFieldPresenterFactory' Rubberduck.UI.CodeExplorer.Commands.RenameCommand' Rubberduck.Refactorings.ExtractInterface.ExtractInterfacePresenterFactory' Rubberduck.Refactorings.RemoveParameters.RemoveParametersPresenter' Rubberduck.Refactorings.RemoveParameters.RemoveParametersPresenterFactory' Rubberduck.Refactorings.Rename.RenamePresenterFactory' Rubberduck.Refactorings.Rename.RenamePresenter' Rubberduck.Refactorings.ReorderParameters.ReorderParametersPresenter' Rubberduck.Refactorings.ReorderParameters.ReorderParametersPresenterFactory' Rubberduck.Refactorings.ExtractMethod.ExtractMethodPresenterFactory,Rubberduck.UI.RubberduckUI' Rubberduck.UI.Settings.Settings' Rubberduck.Common.VariableNameValidator' Rubberduck.Properties.Resources' Rubberduck.Parsing.Symbols.Accessibility' Rubberduck.Refactorings.ExtractMethod.ExtractedParameter' Rubberduck.Parsing.Grammar.Tokens
Rubberduck,Rubberduck.UI.Refactorings.RemoveParameters,Rubberduck.Refactorings.RemoveParameters.RemoveParametersPresenter,Rubberduck.Refactorings.RemoveParameters.Parameter' Rubberduck.UI.Command.CommandBase' Rubberduck.Parsing.Symbols.SubroutineDeclaration' Rubberduck.Parsing.Symbols.Accessibility' Rubberduck.Parsing.Symbols.FunctionDeclaration' Rubberduck.Parsing.Symbols.EventDeclaration' Rubberduck.Parsing.Symbols.PropertyGetDeclaration' Rubberduck.Parsing.Symbols.PropertyLetDeclaration' Rubberduck.Parsing.Symbols.PropertySetDeclaration' Rubberduck.Parsing.VBA.RubberduckParserState' Rubberduck.UI.RubberduckUI
Rubberduck,Rubberduck.UI.Refactorings.Rename,Rubberduck.Refactorings.Rename.RenamePresenter' RubberduckTests.Refactoring.RenameTests,Rubberduck.Parsing.Symbols.Declaration' Rubberduck.Parsing.VBA.RubberduckParserState' Rubberduck.UI.RubberduckUI
Rubberduck,Rubberduck.UI.Refactorings.ReorderParameters,Rubberduck.Refactorings.ReorderParameters.ReorderParametersPresenter,Rubberduck.Refactorings.ReorderParameters.Parameter' Rubberduck.Parsing.Symbols.SubroutineDeclaration' Rubberduck.Parsing.Symbols.Accessibility' Rubberduck.Parsing.Symbols.FunctionDeclaration' Rubberduck.Parsing.Symbols.EventDeclaration' Rubberduck.Parsing.Symbols.PropertyGetDeclaration' Rubberduck.Parsing.Symbols.PropertyLetDeclaration' Rubberduck.Parsing.Symbols.PropertySetDeclaration' Rubberduck.Parsing.VBA.RubberduckParserState' Rubberduck.UI.RubberduckUI
Rubberduck,Rubberduck.UnitTesting.Fakes,,Rubberduck.UnitTesting.FakeBase' Rubberduck.Parsing.Grammar.Tokens
Rubberduck,Rubberduck.UnitTesting,Rubberduck.UnitTesting.Fakes.DoEvents' Rubberduck.UnitTesting.Fakes.Shell' Rubberduck.UnitTesting.Fakes.MsgBox' Rubberduck.UnitTesting.Fakes.Timer' RubberduckTests.UnitTesting.AssertTests' Rubberduck.UI.UnitTesting.TestExplorerModel' RubberduckTests.UnitTesting.DiscoveryTests' Rubberduck.UI.Command.RunAllTestsCommand' Rubberduck.UI.UnitTesting.TestExplorerViewModel' Rubberduck.UI.UnitTesting.TestOutcomeImageSourceConverter' RubberduckTests.UnitTesting.ViewModelTests' Rubberduck.UI.UnitTesting.TestResultToOutcomeTextConverter,Rubberduck.Parsing.Grammar.Tokens' Rubberduck.UI.RubberduckUI' Rubberduck.Parsing.ComReflection.ComVariant' Rubberduck.VBEditor.SafeComWrappers.Abstract.IVBE' Rubberduck.Parsing.VBA.RubberduckParserState' Rubberduck.VBEditor.SafeComWrappers.Abstract.IVBComponent' Rubberduck.Parsing.Symbols.DeclarationType' Rubberduck.Parsing.Symbols.Declaration' Rubberduck.Parsing.Symbols.Accessibility' Rubberduck.Parsing.Annotations.AnnotationType' Rubberduck.VBEditor.QualifiedModuleName' Rubberduck.VBEditor.SafeComWrappers.Abstract.IReferences' Rubberduck.VBEditor.SafeComWrappers.Abstract.IVBProject' Rubberduck.VBEditor.Application.IHostApplication' Rubberduck.UI.UnitTesting.TestExplorerModel' Rubberduck.VBEditor.QualifiedMemberName' Rubberduck.UI.NavigateCodeEventArgs
Rubberduck,Rubberduck.VersionCheck,Rubberduck.App' Rubberduck.UI.About.AboutControlViewModel' Rubberduck.UI.Command.VersionCheckCommand,
Rubberduck,Rubberduck.UI.Command.MenuItems.ParentMenus,Rubberduck.UI.Command.MenuItems.CommandBars.AppCommandBarBase' Rubberduck.Root.RubberduckIoCInstaller,Rubberduck.VBEditor.SafeComWrappers.Office.Core.CommandBarButton' Rubberduck.VBEditor.SafeComWrappers.MSForms.ControlType' Rubberduck.VBEditor.SafeComWrappers.Office.Core.Abstract.ICommandBarButton' Rubberduck.VBEditor.SafeComWrappers.Office.Core.CommandBarPopup' Rubberduck.VBEditor.SafeComWrappers.Office.Core.Abstract.ICommandBarPopup' Rubberduck.UI.Command.MenuItems.CommandMenuItemBase' Rubberduck.UI.Command.CommandBase' Rubberduck.UI.Command.ICommandMenuItem' Rubberduck.Parsing.VBA.RubberduckParserState' Rubberduck.VBEditor.SafeComWrappers.Office.Core.Abstract.ICommandBar' Rubberduck.VBEditor.SafeComWrappers.Office.Core.CommandBarButtonClickEventArgs
