Project,Namespace,Ca types,Ce types
Rubberduck.VBEditor,Rubberduck.VBEditor.Events,Rubberduck.UI.SourceControl.SourceControlViewViewModel' Rubberduck.Parsing.VBA.RubberduckParserState' Rubberduck.UI.SelectionChangeService' Rubberduck._Extension' Rubberduck.VBEditor.WindowsApi.CodePaneSubclass' Rubberduck.VBEditor.WindowsApi.FocusSource' Rubberduck.VBEditor.WindowsApi.DesignerWindowSubclass,Rubberduck.VBEditor.SafeComWrappers.Abstract.IVBProject' Rubberduck.VBEditor.SafeComWrappers.Abstract.IVBComponent' Rubberduck.VBEditor.SafeComWrappers.Abstract.ICodePane' Rubberduck.VBEditor.SafeComWrappers.Abstract.IVBE' Rubberduck.VBEditor.WindowsApi.User32' Rubberduck.VBEditor.SafeComWrappers.Abstract.IWindow' Rubberduck.VBEditor.WindowsApi.WinEvent' Rubberduck.VBEditor.WindowsApi.WinEventFlags' Rubberduck.VBEditor.WindowsApi.IWindowEventProvider' Rubberduck.VBEditor.SafeComWrappers.VBA.VBProjects' Rubberduck.VBEditor.SafeComWrappers.VBA.VBComponents' Rubberduck.VBEditor.WindowsApi.ObjId' Rubberduck.VBEditor.SafeComWrappers.MSForms.WindowKind' Rubberduck.VBEditor.SafeComWrappers.Abstract.ICodePanes' Rubberduck.VBEditor.SafeComWrappers.Abstract.IWindows
Rubberduck.VBEditor,Rubberduck.VBEditor.Extensions,Rubberduck.VBEditor.SafeComWrappers.VB6.VBComponents' Rubberduck.VBEditor.SafeComWrappers.VBA.VBComponents,Rubberduck.VBEditor.SafeComWrappers.MSAccessComponentType' Rubberduck.VBEditor.SafeComWrappers.ComponentType' Rubberduck.VBEditor.SafeComWrappers.Abstract.IVBProject' Rubberduck.VBEditor.SafeComWrappers.Office.Core.Abstract.ICommandBars' Rubberduck.VBEditor.SafeComWrappers.Office.Core.Abstract.ICommandBarControl' Rubberduck.VBEditor.Application.IHostApplication' Rubberduck.VBEditor.SafeComWrappers.Abstract.IReferences' Rubberduck.VBEditor.SafeComWrappers.Abstract.IVBE' Rubberduck.VBEditor.SafeComWrappers.MSForms.ControlType' Rubberduck.VBEditor.SafeComWrappers.Abstract.IReference' Rubberduck.VBEditor.Application.SolidWorksApp' Rubberduck.VBEditor.Application.ExcelApp' Rubberduck.VBEditor.Application.AccessApp' Rubberduck.VBEditor.Application.WordApp' Rubberduck.VBEditor.Application.PowerPointApp' Rubberduck.VBEditor.Application.OutlookApp' Rubberduck.VBEditor.Application.ProjectApp' Rubberduck.VBEditor.Application.PublisherApp' Rubberduck.VBEditor.Application.VisioApp' Rubberduck.VBEditor.Application.AutoCADApp' Rubberduck.VBEditor.Application.CorelDRAWApp' Rubberduck.VBEditor.SafeComWrappers.Abstract.IVBComponents' Rubberduck.VBEditor.SafeComWrappers.Abstract.IVBComponent' Rubberduck.VBEditor.VBEEditorText
Rubberduck.VBEditor,Rubberduck.VBEditor.SafeComWrappers.Abstract,Rubberduck.VBEditor.SafeComWrappers.SafeComWrapper<T>' Rubberduck.VBEditor.SafeComWrappers.Office.Core.CommandBar' Rubberduck.VBEditor.SafeComWrappers.Office.Core.CommandBarControl' Rubberduck.VBEditor.SafeComWrappers.Office.Core.CommandBarControls' Rubberduck.VBEditor.SafeComWrappers.Office.Core.CommandBars' Rubberduck.VBEditor.SafeComWrappers.VB6.AddIn' Rubberduck.VBEditor.SafeComWrappers.VB6.AddIns' Rubberduck.VBEditor.SafeComWrappers.VB6.Application' Rubberduck.VBEditor.SafeComWrappers.VB6.CodeModule' Rubberduck.VBEditor.SafeComWrappers.VB6.CodePane' Rubberduck.VBEditor.SafeComWrappers.VB6.CodePanes' Rubberduck.VBEditor.SafeComWrappers.VB6.LinkedWindows' Rubberduck.VBEditor.SafeComWrappers.VB6.Properties' Rubberduck.VBEditor.SafeComWrappers.VB6.Property' Rubberduck.VBEditor.SafeComWrappers.VB6.Reference' Rubberduck.VBEditor.SafeComWrappers.VB6.References' Rubberduck.VBEditor.SafeComWrappers.VB6.VBComponent' Rubberduck.VBEditor.SafeComWrappers.VB6.VBComponents' Rubberduck.VBEditor.SafeComWrappers.VB6.VBE' Rubberduck.VBEditor.SafeComWrappers.VB6.VBProject' Rubberduck.VBEditor.SafeComWrappers.VB6.VBProjects' Rubberduck.VBEditor.SafeComWrappers.VB6.Window' Rubberduck.VBEditor.SafeComWrappers.VB6.Windows' Rubberduck.VBEditor.SafeComWrappers.VBA.AddIn' Rubberduck.VBEditor.SafeComWrappers.VBA.AddIns' Rubberduck.VBEditor.SafeComWrappers.VBA.Application' Rubberduck.VBEditor.SafeComWrappers.VBA.CodeModule' Rubberduck.VBEditor.SafeComWrappers.VBA.CodePane' Rubberduck.VBEditor.SafeComWrappers.VBA.CodePanes' Rubberduck.VBEditor.SafeComWrappers.VBA.Control' Rubberduck.VBEditor.SafeComWrappers.VBA.Controls' Rubberduck.VBEditor.SafeComWrappers.VBA.Properties' Rubberduck.VBEditor.SafeComWrappers.VBA.Property' Rubberduck.VBEditor.SafeComWrappers.VBA.LinkedWindows' Rubberduck.VBEditor.SafeComWrappers.VBA.Reference' Rubberduck.VBEditor.SafeComWrappers.VBA.References' Rubberduck.VBEditor.SafeComWrappers.VBA.VBComponent' Rubberduck.VBEditor.SafeComWrappers.VBA.VBComponents' Rubberduck.VBEditor.SafeComWrappers.VBA.VBProject' Rubberduck.VBEditor.SafeComWrappers.VBA.VBProjects' Rubberduck.VBEditor.SafeComWrappers.VBA.Window' Rubberduck.VBEditor.SafeComWrappers.VBA.Windows' Rubberduck.VBEditor.SafeComWrappers.VBA.VBE' RubberduckTests.Mocks.Windows' Rubberduck.Navigation.RegexSearchReplace.RegexSearchReplace' Rubberduck.VBEditor.Events.VBENativeServices' Rubberduck.Parsing.ComReflection.ReferencedDeclarationsCollector' Rubberduck.Parsing.VBA.COMReferenceSynchronizerBase' Rubberduck.Parsing.VBA.RubberduckParserState' Rubberduck.VBEditor.Extensions.VBEExtensions' Rubberduck.VBEditor.SafeComWrappers.ReferenceEventArgs' Rubberduck.VBEditor.QualifiedModuleName' Rubberduck.UnitTesting.ProjectTestExtensions' Rubberduck.Common.ModuleExporter' Rubberduck.Navigation.CodeExplorer.CodeExplorerComponentViewModel' Rubberduck.Navigation.CodeExplorer.CodeExplorerViewModel' Rubberduck.UI.CodeExplorer.Commands.RemoveCommand' Rubberduck.UI.CodeExplorer.Commands.ExportCommand' Rubberduck.UI.CodeExplorer.Commands.PrintCommand' Rubberduck.UI.CodeExplorer.Commands.OpenDesignerCommand' Rubberduck.UI.CodeExplorer.Commands.AddComponentCommand' Rubberduck.UI.CodeExplorer.Commands.UndoCommand' Rubberduck.UI.Command.AddTestMethodExpectedErrorCommand' Rubberduck.UI.Command.AddTestMethodCommand' Rubberduck.UI.Command.NavigateCommand' Rubberduck.UI.Command.MenuItems.CommandBars.RubberduckCommandBar' Rubberduck.UI.SelectionChangeService' Rubberduck.UI.DeclarationChangedEventArgs' Rubberduck.UnitTesting.UnitTestUtils' Rubberduck.Refactorings.ExtractInterface.ExtractInterfaceRefactoring' Rubberduck.Refactorings.Rename.RenameRefactoring' Rubberduck.UI.Command.Refactorings.ProjectExplorerRefactorRenameCommand' Rubberduck.UI.Command.Refactorings.RefactorExtractMethodCommand' Rubberduck.UI.IdentifierReferences.ImplementationsListDockablePresenter' Rubberduck.UI.IdentifierReferences.IdentifierReferencesListDockablePresenter' Rubberduck.UI.SourceControl.SourceControlViewViewModel' Rubberduck.Inspections.Abstract.InspectionResultBase' Rubberduck.Inspections.QuickFixes.IgnoreOnceQuickFix' Rubberduck.Parsing.Emitter' Rubberduck.Parsing.VBA.ReferenceResolveRunnerBase' Rubberduck.Parsing.VBA.DeclarationResolveRunnerBase' Rubberduck.Parsing.VBA.ComponentParseTask' Rubberduck.Parsing.VBA.IModuleExporter' Rubberduck.Parsing.VBA.ParseErrorEventArgs' Rubberduck.Parsing.Rewriter.MemberAttributesRewriter' Rubberduck.Parsing.Symbols.DeclarationSymbolsListener' Rubberduck.SmartIndenter.Indenter' Rubberduck.SmartIndenter.IIndenter' Rubberduck.SourceControl.SourceControlProviderBase' Rubberduck.VBEditor.Events.ComponentEventArgs' Rubberduck.VBEditor.Events.ComponentRenamedEventArgs' Rubberduck.VBEditor.Extensions.VBProjectExtensions' Rubberduck.VBEditor.Application.HostApplicationBase<TApplication>' Rubberduck.VBEditor.Application.PowerPointApp' RubberduckTests.CodeExplorer.CodeExplorerTests' RubberduckTests.Commands.RefactorCommandTests' RubberduckTests.Commands.IndentCommandTests' RubberduckTests.Commands.UnitTestCommandTests' RubberduckTests.Commands.FindAllImplementationsTests' RubberduckTests.Commands.FindAllReferencesTests' RubberduckTests.Grammar.ParserRuleContextExtensionTests' RubberduckTests.Grammar.SelectionExtensionsTests' RubberduckTests.Grammar.ResolverTests' RubberduckTests.Grammar.VBAParserValidityTests' RubberduckTests.Inspections.EmptyDoWhileBlockInspectionTests' RubberduckTests.Inspections.EmptyForEachInspectionTests' RubberduckTests.QuickFixes.MoveFieldCloserToUsageQuickFixTests' RubberduckTests.QuickFixes.RemoveUnusedParameterQuickFixTests' RubberduckTests.Mocks.TestAttributeParser' RubberduckTests.Mocks.MockParser' RubberduckTests.Mocks.MockProjectBuilder' RubberduckTests.Mocks.MockVbeBuilder' RubberduckTests.PostProcessing.ModuleRewriterTests' RubberduckTests.Symbols.DeclarationFinderTests' RubberduckTests.PreProcessing.VBAPreprocessorTests' RubberduckTests.Refactoring.EncapsulateFieldTests' RubberduckTests.Refactoring.ExtractInterfaceTests' RubberduckTests.Refactoring.IntroduceFieldTests' RubberduckTests.Refactoring.MoveCloserToUsageTests' RubberduckTests.Refactoring.IntroduceParameterTests' RubberduckTests.Refactoring.RemoveParametersTests' RubberduckTests.Refactoring.RenameTests' RubberduckTests.Refactoring.ReorderParametersTests' Rubberduck.UI.Command.ExportAllCommand' Rubberduck.Refactorings.ExtractInterface.ExtractInterfacePresenter' Rubberduck.Navigation.CodeExplorer.CodeExplorerProjectViewModel' Rubberduck.UI.CodeExplorer.Commands.ImportCommand' Rubberduck.UI.Command.IndentCurrentProjectCommand' Rubberduck.UI.Command.AddTestModuleCommand' Rubberduck.UI.Command.FindAllReferencesCommand' Rubberduck.UI.Command.Refactorings.FormDesignerRefactorRenameCommand' Rubberduck.UI.SourceControl.ISourceControlProviderFactory' Rubberduck.Inspections.QuickFixes.EncapsulateFieldQuickFix' Rubberduck.Inspections.QuickFixes.MoveFieldCloserToUsageQuickFix' Rubberduck.Inspections.QuickFixes.RenameDeclarationQuickFix' Rubberduck.Parsing.Symbols.ProjectDeclaration' Rubberduck.SourceControl.GitProvider' Rubberduck.SourceControl.Interop.GitProvider' Rubberduck.VBEditor.Events.ProjectEventArgs' Rubberduck.VBEditor.Events.ProjectRenamedEventArgs' Rubberduck.UI.CodeExplorer.Commands.OpenProjectPropertiesCommand' Rubberduck.UI.CodeExplorer.Commands.AddTestModuleCommand' Rubberduck.App' Rubberduck._Extension' Rubberduck.Common.RubberduckHooks' Rubberduck.Refactorings.EncapsulateField.EncapsulateFieldPresenterFactory' Rubberduck.Refactorings.EncapsulateField.EncapsulateFieldRefactoring' Rubberduck.Root.RubberduckIoCInstaller' Rubberduck.UI.CodeExplorer.Commands.AddTestModuleWithStubsCommand' Rubberduck.UI.CodeExplorer.Commands.RenameCommand' Rubberduck.UI.CodeMetrics.CodeMetricsDockablePresenter' Rubberduck.UI.Command.NoIndentAnnotationCommand' Rubberduck.UI.Command.IndentCurrentModuleCommand' Rubberduck.UI.Command.IndentCurrentProcedureCommand' Rubberduck.UI.Command.FindAllImplementationsCommand' Rubberduck.UI.Command.FindSymbolCommand' Rubberduck.UI.Command.RunAllTestsCommand' Rubberduck.UI.Controls.SearchResultPresenterInstanceManager' Rubberduck.UI.Controls.SearchResultsDockablePresenter' Rubberduck.UI.DockableToolwindowPresenter' Rubberduck.UI.Inspections.InspectionResultsDockablePresenter' Rubberduck.UnitTesting.TestEngine' Rubberduck.UnitTesting.TestMethod' Rubberduck.Refactorings.ExtractInterface.ExtractInterfacePresenterFactory' Rubberduck.Refactorings.ImplementInterface.ImplementInterfaceRefactoring' Rubberduck.Refactorings.IntroduceField.IntroduceFieldRefactoring' Rubberduck.Refactorings.IntroduceParameter.IntroduceParameterRefactoring' Rubberduck.Refactorings.MoveCloserToUsage.MoveCloserToUsageRefactoring' Rubberduck.Refactorings.RemoveParameters.RemoveParametersPresenterFactory' Rubberduck.Refactorings.RemoveParameters.RemoveParametersRefactoring' Rubberduck.Refactorings.Rename.RenameModel' Rubberduck.Refactorings.Rename.RenamePresenterFactory' Rubberduck.Refactorings.ReorderParameters.ReorderParametersPresenterFactory' Rubberduck.Refactorings.ReorderParameters.ReorderParametersRefactoring' Rubberduck.UI.CodeExplorer.CodeExplorerDockablePresenter' Rubberduck.UI.Command.Refactorings.RefactorEncapsulateFieldCommand' Rubberduck.UI.Command.Refactorings.RefactorImplementInterfaceCommand' Rubberduck.UI.Command.Refactorings.RefactorExtractInterfaceCommand' Rubberduck.UI.Command.Refactorings.RefactorIntroduceFieldCommand' Rubberduck.UI.Command.Refactorings.RefactorIntroduceParameterCommand' Rubberduck.UI.Command.Refactorings.RefactorMoveCloserToUsageCommand' Rubberduck.UI.Command.Refactorings.CodePaneRefactorRenameCommand' Rubberduck.UI.Command.Refactorings.RefactorReorderParametersCommand' Rubberduck.UI.Command.Refactorings.RefactorCommandBase' Rubberduck.UI.Command.Refactorings.RefactorRemoveParametersCommand' Rubberduck.UI.ParserErrors.ParserErrorsPresenter' Rubberduck.UI.SourceControl.SourceControlDockablePresenter' Rubberduck.UI.ToDoItems.ToDoExplorerDockablePresenter' Rubberduck.UI.UnitTesting.TestExplorerDockablePresenter' Rubberduck.UI.UnitTesting.TestExplorerModel' Rubberduck.UI.UnitTesting.TestExplorerViewModel' Rubberduck.Inspections.QuickFixes.RemoveUnusedParameterQuickFix' Rubberduck.Parsing.VBA.ProjectManagerBase' Rubberduck.Parsing.VBA.ProjectManager' Rubberduck.Parsing.VBA.SynchronousProjectManager' Rubberduck.VBEditor.Application.CorelDRAWApp' Rubberduck.VBEditor.Application.ProjectApp' Rubberduck.VBEditor.Application.ExcelApp' Rubberduck.VBEditor.Application.FallbackApp' Rubberduck.VBEditor.Application.SolidWorksApp' Rubberduck.VBEditor.Application.VisioApp' Rubberduck.VBEditor.Application.WordApp' Rubberduck.VBEditor.Events.WindowInfo' Rubberduck.VBEditor.Events.WindowChangedEventArgs' Rubberduck.Refactorings.ExtractMethod.ExtractMethodExtraction' Rubberduck.Refactorings.ExtractMethod.IExtractMethodExtraction' Rubberduck.Refactorings.ExtractMethod.ExtractMethodRefactoring' Rubberduck.Navigation.RegexSearchReplace.RegexSearchResult' Rubberduck.Parsing.VBA.ModuleState' Rubberduck.Parsing.Rewriter.ModuleRewriter' Rubberduck.UI.Command.MenuItems.CommandBars.IContextFormatter' Rubberduck.UI.Command.MenuItems.CommandBars.ContextFormatter' Rubberduck.Parsing.Symbols.DeclarationFinder' Rubberduck.VBEditor.Events.SelectionChangedEventArgs' Rubberduck.VBEditor.WindowsApi.CodePaneSubclass,Rubberduck.VBEditor.SafeComWrappers.ComponentType' Rubberduck.VBEditor.SafeComWrappers.ProjectType' Rubberduck.VBEditor.SafeComWrappers.MSForms.WindowKind' Rubberduck.VBEditor.Selection' Rubberduck.VBEditor.SafeComWrappers.ProcKind
Rubberduck.VBEditor,Rubberduck.VBEditor.SafeComWrappers,Rubberduck.VBEditor.Extensions.MSAccessComponentTypeExtensions' Rubberduck.Common.DeclarationExtensions' Rubberduck.Navigation.CodeExplorer.CompareByType' Rubberduck.Navigation.CodeExplorer.CodeExplorerComponentViewModel' Rubberduck.Navigation.CodeExplorer.CodeExplorerViewModel' Rubberduck.UI.CodeExplorer.Commands.AddUserFormCommand' Rubberduck.UI.CodeExplorer.Commands.RemoveCommand' Rubberduck.UI.CodeExplorer.Commands.ExportCommand' Rubberduck.UI.CodeExplorer.Commands.AddClassModuleCommand' Rubberduck.UI.CodeExplorer.Commands.AddStdModuleCommand' Rubberduck.UI.CodeExplorer.Commands.AddComponentCommand' Rubberduck.UI.CodeExplorer.Commands.UndoCommand' Rubberduck.UI.Command.AddTestModuleCommand' Rubberduck.UI.SelectionChangeService' Rubberduck.Refactorings.ExtractInterface.ExtractInterfaceRefactoring' Rubberduck.Refactorings.Rename.RenameRefactoring' Rubberduck.Inspections.Concrete.EmptyModuleInspection' Rubberduck.Inspections.Concrete.ShadowedDeclarationInspection' Rubberduck.Inspections.Concrete.ProcedureNotUsedInspection' Rubberduck.Parsing.Emitter' Rubberduck.Parsing.VBA.AttributeParser' Rubberduck.Parsing.VBA.ReferenceResolveRunnerBase' Rubberduck.Parsing.Rewriter.MemberAttributesRewriter' Rubberduck.Parsing.Symbols.DeclarationSymbolsListener' Rubberduck.VBEditor.Extensions.ComponentTypeExtensions' Rubberduck.VBEditor.SafeComWrappers.Abstract.IVBComponents' Rubberduck.VBEditor.QualifiedModuleName' Rubberduck.VBEditor.SafeComWrappers.VB6.VBComponent' Rubberduck.VBEditor.SafeComWrappers.VB6.VBComponents' Rubberduck.VBEditor.SafeComWrappers.VBA.VBComponent' Rubberduck.VBEditor.SafeComWrappers.VBA.VBComponents' Rubberduck.VBEditor.Application.HostApplicationBase<TApplication>' RubberduckTests.Binding.IndexDefaultBindingTests' RubberduckTests.Binding.MemberAccessDefaultBindingTests' RubberduckTests.Binding.MemberAccessTypeBindingTests' RubberduckTests.Binding.MemberAccessProcedurePointerBindingTests' RubberduckTests.Binding.SimpleNameProcedurePointerBindingTests' RubberduckTests.Binding.SimpleNameDefaultBindingTests' RubberduckTests.Binding.SimpleNameTypeBindingTests' RubberduckTests.CodeExplorer.CodeExplorerTests' RubberduckTests.Commands.ExportAllTests' RubberduckTests.Commands.RefactorCommandTests' RubberduckTests.Commands.IndentCommandTests' RubberduckTests.Commands.FindAllImplementationsTests' RubberduckTests.Grammar.ResolverTests' RubberduckTests.Inspections.ApplicationWorksheetFunctionInspectionTests' RubberduckTests.Inspections.IntegerDataTypeInspectionTests' RubberduckTests.Inspections.MissingAnnotationInspectionTests' RubberduckTests.Inspections.MissingAttributeInspectionTests' RubberduckTests.Inspections.HostSpecificExpressionInspectionTests' RubberduckTests.Inspections.HungarianNotationInspectionTests' RubberduckTests.Inspections.ImplicitActiveWorkbookReferenceInspectionTests' RubberduckTests.Inspections.MemberNotOnInterfaceInspectionTests' RubberduckTests.Inspections.ShadowedDeclarationInspectionTests' RubberduckTests.Inspections.EmptyModuleInspectionTests' RubberduckTests.Inspections.RedundantByRefModifierInspectionTests' RubberduckTests.Inspections.UndeclaredVariableInspectionTests' RubberduckTests.Inspections.FunctionReturnValueNotUsedInspectionTests' RubberduckTests.Inspections.ImplicitActiveSheetReferenceInspectionTests' RubberduckTests.Inspections.ObjectVariableNotSetInspectionTests' RubberduckTests.Inspections.SelfAssignedDeclarationInspectionTests' RubberduckTests.Inspections.UntypedFunctionUsageInspectionTests' RubberduckTests.Inspections.UnassignedVariableUsageInspectionTests' RubberduckTests.Inspections.WriteOnlyPropertyInspectionTests' RubberduckTests.Inspections.AssignedByValParameterInspectionTests' RubberduckTests.Inspections.OptionBaseInspectionTests' RubberduckTests.Inspections.ProcedureShouldBeFunctionInspectionTests' RubberduckTests.Inspections.UseMeaningfulNameInspectionTests' RubberduckTests.Inspections.DefaultProjectNameInspectionTests' RubberduckTests.Inspections.ImplicitByRefModifierInspectionTests' RubberduckTests.Inspections.NonReturningFunctionInspectionTests' RubberduckTests.Inspections.OptionExplicitInspectionTests' RubberduckTests.Inspections.ParameterCanBeByValInspectionTests' RubberduckTests.Inspections.ParameterNotUsedInspectionTests' RubberduckTests.Inspections.ProcedureNotUsedInspectionTests' RubberduckTests.QuickFixes.SynchronizeAttributesQuickFixTests' RubberduckTests.QuickFixes.ApplicationWorksheetFunctionQuickFixTests' RubberduckTests.QuickFixes.ChangeIntegerToLongQuickFixTests' RubberduckTests.QuickFixes.ConvertToProcedureQuickFixTests' RubberduckTests.QuickFixes.IgnoreOnceQuickFixTests' RubberduckTests.QuickFixes.PassParameterByValueQuickFixTests' RubberduckTests.QuickFixes.RemoveExplicitByRefModifierQuickFixTests' RubberduckTests.QuickFixes.SpecifyExplicitByRefModifierQuickFixTests' RubberduckTests.QuickFixes.UntypedFunctionUsageQuickFixTests' RubberduckTests.QuickFixes.WriteOnlyPropertyQuickFixTests' RubberduckTests.Mocks.TestAttributeParser' RubberduckTests.Mocks.MockProjectBuilder' RubberduckTests.Mocks.MockUserFormBuilder' RubberduckTests.Mocks.MockVbeBuilder' RubberduckTests.SourceControl.SourceControlViewModelTests' RubberduckTests.Symbols.DeclarationFinderTests' RubberduckTests.Symbols.TestComponentSpecification' RubberduckTests.Refactoring.EncapsulateFieldTests' RubberduckTests.Refactoring.ExtractInterfaceTests' RubberduckTests.Refactoring.ImplementInterfaceTests' RubberduckTests.Refactoring.MoveCloserToUsageTests' RubberduckTests.Refactoring.IntroduceParameterTests' RubberduckTests.Refactoring.RemoveParametersTests' RubberduckTests.Refactoring.RenameTests' RubberduckTests.Refactoring.RenameTestModuleDefinition' RubberduckTests.Refactoring.ReorderParametersTests' RubberduckTests.TodoExplorer.TodoExplorerTests' RubberduckTests.UnitTesting.DiscoveryTests' RubberduckTests.UnitTesting.ViewModelTests' Rubberduck.SmartIndenter.Indenter' Rubberduck.VBEditor.SafeComWrappers.Abstract.ICodeModule' Rubberduck.VBEditor.SafeComWrappers.VB6.CodeModule' Rubberduck.VBEditor.SafeComWrappers.VBA.CodeModule' Rubberduck.VBEditor.Application.FallbackApp' Rubberduck.Navigation.CodeExplorer.CodeExplorerProjectViewModel' Rubberduck.UI.Command.IndentCurrentProjectCommand' Rubberduck.Navigation.RegexSearchReplace.RegexSearchReplace' Rubberduck.Parsing.VBA.RubberduckParserState' RubberduckTests.Commands.FindAllReferencesTests' Rubberduck.VBEditor.SafeComWrappers.Abstract.IVBProjects' Rubberduck.VBEditor.SafeComWrappers.VB6.VBProjects' Rubberduck.VBEditor.SafeComWrappers.VBA.VBProjects,Rubberduck.VBEditor.SafeComWrappers.Abstract.IReference' Rubberduck.VBEditor.SafeComWrappers.Abstract.ISafeComWrapper
Rubberduck.VBEditor,Rubberduck.VBEditor.SafeComWrappers.MSForms,Rubberduck.UI.Command.MenuItems.ParentMenus.CommandBarButtonFactory' Rubberduck.UI.Command.MenuItems.ParentMenus.CommandBarPopupFactory' Rubberduck.VBEditor.Extensions.VBEExtensions' Rubberduck.VBEditor.SafeComWrappers.Office.Core.Abstract.ICommandBar' Rubberduck.VBEditor.SafeComWrappers.Office.Core.Abstract.ICommandBarControls' Rubberduck.VBEditor.SafeComWrappers.Office.Core.Abstract.ICommandBars' Rubberduck.VBEditor.SafeComWrappers.Office.Core.CommandBar' Rubberduck.VBEditor.SafeComWrappers.Office.Core.CommandBarControls' Rubberduck.VBEditor.SafeComWrappers.Office.Core.CommandBars' Rubberduck.VBEditor.SafeComWrappers.VBA.VBE' Rubberduck.UI.SelectionChangeService' Rubberduck.VBEditor.Events.VBENativeServices' Rubberduck.VBEditor.SafeComWrappers.Abstract.IWindow' Rubberduck.VBEditor.SafeComWrappers.VB6.Window' Rubberduck.VBEditor.SafeComWrappers.VBA.Window,
Rubberduck.VBEditor,Rubberduck.VBEditor.SafeComWrappers.Office.Core.Abstract,Rubberduck.UI.Command.MenuItems.CommandBars.AppCommandBarBase' Rubberduck.UI.Command.MenuItems.ParentMenus.CommandBarButtonFactory' Rubberduck.UI.Command.MenuItems.ParentMenus.ParentMenuItemBase' Rubberduck.VBEditor.SafeComWrappers.Office.Core.CommandBarButtonClickEventArgs' Rubberduck.VBEditor.Application.FallbackApp' Rubberduck.Root.RubberduckIoCInstaller' Rubberduck.VBEditor.SafeComWrappers.Office.Core.CommandBar' Rubberduck.VBEditor.SafeComWrappers.Office.Core.CommandBarButton' RubberduckTests.Mocks.MockVbeBuilder' Rubberduck.UI.CodeExplorer.Commands.OpenProjectPropertiesCommand' Rubberduck.VBEditor.Extensions.VBEExtensions' Rubberduck.VBEditor.SafeComWrappers.Office.Core.CommandBarControl' Rubberduck.VBEditor.SafeComWrappers.Office.Core.CommandBarPopup' Rubberduck.VBEditor.SafeComWrappers.VBA.VBE' Rubberduck.VBEditor.SafeComWrappers.Office.Core.CommandBarControls' Rubberduck.UI.Command.MenuItems.ParentMenus.CommandBarPopupFactory' Rubberduck.VBEditor.SafeComWrappers.Office.Core.CommandBars' Rubberduck.VBEditor.SafeComWrappers.VBA.Control' Rubberduck.UI.SelectionChangeService' Rubberduck.Refactorings.Rename.RenameRefactoring' Rubberduck.VBEditor.SafeComWrappers.VBA.Controls,Rubberduck.VBEditor.SafeComWrappers.MSForms.ControlType' Rubberduck.VBEditor.SafeComWrappers.Office.Core.CommandBarPosition
