Project,Namespace,Ca types,Ce types
Rubberduck.VBEditor,Rubberduck.VBEditor,Rubberduck.Parsing.Rewriter.RewriterInfo.RewriterInfo' Rubberduck.Parsing.Symbols.IdentifierReference' Rubberduck.VBEditor.SafeComWrappers.Office.Core.CommandBar' Rubberduck.VBEditor.SafeComWrappers.Office.Core.CommandBarControl' Rubberduck.VBEditor.SafeComWrappers.VB6.AddIn' Rubberduck.VBEditor.SafeComWrappers.VB6.AddIns' Rubberduck.VBEditor.SafeComWrappers.VB6.Application' Rubberduck.VBEditor.SafeComWrappers.VB6.Property' Rubberduck.VBEditor.SafeComWrappers.VB6.Reference' Rubberduck.VBEditor.SafeComWrappers.VB6.VBComponents' Rubberduck.VBEditor.SafeComWrappers.VB6.VBProject' Rubberduck.VBEditor.SafeComWrappers.VB6.VBProjects' Rubberduck.VBEditor.SafeComWrappers.VB6.Window' Rubberduck.VBEditor.SafeComWrappers.VBA.AddIn' Rubberduck.VBEditor.SafeComWrappers.VBA.AddIns' Rubberduck.VBEditor.SafeComWrappers.VBA.Application' Rubberduck.VBEditor.SafeComWrappers.VBA.Property' Rubberduck.VBEditor.SafeComWrappers.VBA.Reference' Rubberduck.VBEditor.SafeComWrappers.VBA.VBComponents' Rubberduck.VBEditor.SafeComWrappers.VBA.VBProject' Rubberduck.VBEditor.SafeComWrappers.VBA.VBProjects' Rubberduck.VBEditor.SafeComWrappers.VBA.Window' Rubberduck.Navigation.CodeExplorer.CodeExplorerComponentViewModel' Rubberduck.Navigation.CodeExplorer.CodeExplorerViewModel' Rubberduck.Refactorings.EncapsulateField.EncapsulateFieldRefactoring' Rubberduck.UI.CodeExplorer.Commands.RemoveCommand' Rubberduck.UI.CodeExplorer.Commands.ExportCommand' Rubberduck.UI.CodeExplorer.Commands.PrintCommand' Rubberduck.UI.CodeExplorer.Commands.OpenDesignerCommand' Rubberduck.UI.CodeExplorer.Commands.UndoCommand' Rubberduck.UI.Command.SyntaxErrorExtensions' Rubberduck.UI.Command.FindAllImplementationsCommand' Rubberduck.UI.Command.MenuItems.CommandBars.ContextFormatter' Rubberduck.UI.NavigateCodeEventArgs' Rubberduck.UnitTesting.TestMethod' Rubberduck.Refactorings.IntroduceField.IntroduceFieldRefactoring' Rubberduck.Refactorings.Rename.RenameRefactoring' Rubberduck.UI.IdentifierReferences.ImplementationsListDockablePresenter' Rubberduck.Inspections.Concrete.ShadowedDeclarationInspection' Rubberduck.Inspections.Concrete.MissingMemberAttributeListener' Rubberduck.Inspections.Concrete.MoveFieldCloserToUsageInspection' Rubberduck.Inspections.QuickFixes.SynchronizeAttributesQuickFix' Rubberduck.Inspections.Results.DeclarationInspectionResult' Rubberduck.Parsing.ComReflection.SerializableDeclaration' Rubberduck.Parsing.QualifiedContext' Rubberduck.Parsing.QualifiedContext<TContext>' Rubberduck.Parsing.VBA.DeclarationResolveRunnerBase' Rubberduck.Parsing.VBA.RubberduckParserState' Rubberduck.Parsing.Symbols.EventDeclaration' Rubberduck.Parsing.Symbols.ExternalProcedureDeclaration' Rubberduck.Parsing.Symbols.ClassModuleDeclaration' Rubberduck.Parsing.Symbols.DeclarationFinder' Rubberduck.Parsing.Symbols.PropertyLetDeclaration' Rubberduck.Parsing.Symbols.PropertySetDeclaration' Rubberduck.Parsing.Symbols.PropertyGetDeclaration' Rubberduck.Parsing.Symbols.FunctionDeclaration' Rubberduck.Parsing.Symbols.SquareBracketedNameComparer' Rubberduck.Parsing.Symbols.SubroutineDeclaration' Rubberduck.Parsing.Symbols.ParameterDeclaration' Rubberduck.Parsing.Symbols.ProceduralModuleDeclaration' Rubberduck.Parsing.Symbols.ProjectDeclaration' Rubberduck.Parsing.Symbols.Declaration' Rubberduck.Parsing.Symbols.ConstantDeclaration' Rubberduck.Parsing.Symbols.DeclarationLoaders.SpecialFormDeclarations' Rubberduck.Parsing.Symbols.DeclarationLoaders.DebugDeclarations' Rubberduck.Parsing.Symbols.DeclarationLoaders.AliasDeclarations' Rubberduck.Parsing.Symbols.DeclarationLoaders.FormEventDeclarations' Rubberduck.VBEditor.Application.AccessApp' Rubberduck.VBEditor.Application.ProjectApp' Rubberduck.VBEditor.Application.PowerPointApp' Rubberduck.VBEditor.Application.VisioApp' Rubberduck.VBEditor.Application.WordApp' RubberduckTests.Inspections.ShadowedDeclarationInspectionTests' RubberduckTests.Inspections.UntypedFunctionUsageInspectionTests' RubberduckTests.Symbols.AccessibilityCheckTests' RubberduckTests.Symbols.ClassModuleDeclarationTests' RubberduckTests.Symbols.DeclarationFinderTests' RubberduckTests.Symbols.ProjectDeclarationTests' RubberduckTests.Symbols.ConstantDeclarationTests' RubberduckTests.Symbols.ProceduralModuleDeclarationTests' RubberduckTests.Symbols.ParameterDeclarationTests' RubberduckTests.Symbols.ExternalProcedureDeclarationTests' RubberduckTests.Symbols.SubroutineDeclarationTests' RubberduckTests.Symbols.FunctionDeclarationTests' RubberduckTests.Symbols.PropertyGetDeclarationTests' RubberduckTests.Symbols.PropertyLetDeclarationTests' RubberduckTests.Symbols.PropertySetDeclarationTests' RubberduckTests.Refactoring.ExtractMethod.WhenSetValidFlagIsCalledWhenTheReferenceIsInternal' RubberduckTests.Refactoring.ExtractMethod.WhenSetValidFlagIsCalledWhenTheReferenceIsUsedInternallyOnly' Rubberduck.Common.DeclarationExtensions' Rubberduck.Navigation.CodeMetrics.CodeMetricsAnalyst' Rubberduck.Navigation.CodeMetrics.CodeMetricsListener' Rubberduck.Navigation.CodeMetrics.ModuleMetricsResult' Rubberduck.UI.Command.ShowParserErrorsCommand' Rubberduck.UI.Command.NavigateCommand' Rubberduck.UnitTesting.UnitTestUtils' Rubberduck.UnitTesting.TestModuleEventArgs' Rubberduck.UI.IdentifierReferences.IdentifierReferencesListDockablePresenter' Rubberduck.ToDoItems.ToDoItem' Rubberduck.Inspections.Abstract.InspectionBase' Rubberduck.Inspections.Abstract.InspectionResultBase' Rubberduck.Inspections.Concrete.IllegalAttributeAnnotationsListener' Rubberduck.Inspections.QuickFixProvider' Rubberduck.Inspections.QuickFixes.IgnoreOnceQuickFix' Rubberduck.Parsing.Annotations.AnnotationListener' Rubberduck.Parsing.Annotations.AnnotationService' Rubberduck.Parsing.ComReflection.ReferencedDeclarationsCollector' Rubberduck.Parsing.ParseProgressEventArgs' Rubberduck.Parsing.VBA.AttributeParser' Rubberduck.Parsing.VBA.SupertypeClearerBase' Rubberduck.Parsing.VBA.ISupertypeClearer' Rubberduck.Parsing.VBA.ParsingCacheService' Rubberduck.Parsing.VBA.ModuleToModuleReferenceManager' Rubberduck.Parsing.VBA.IParseTreeProvider' Rubberduck.Parsing.VBA.ReferenceRemoverBase' Rubberduck.Parsing.VBA.ReferenceResolveRunnerBase' Rubberduck.Parsing.VBA.IReferenceRemover' Rubberduck.Parsing.VBA.ParseRunnerBase' Rubberduck.Parsing.VBA.COMReferenceSynchronizerBase' Rubberduck.Parsing.VBA.ParserStateManagerBase' Rubberduck.Parsing.VBA.ModuleToModuleReferenceManagerBase' Rubberduck.Parsing.VBA.ComponentParseTask' Rubberduck.Parsing.VBA.IAttributeParser' Rubberduck.Parsing.VBA.IModuleToModuleReferenceManager' Rubberduck.Parsing.VBA.IParserStateManager' Rubberduck.Parsing.Symbols.AliasDeclaration' Rubberduck.Parsing.Symbols.BoundExpressionVisitor' Rubberduck.Parsing.Symbols.IdentifierReferenceResolver' Rubberduck.Parsing.Symbols.DeclarationSymbolsListener' Rubberduck.SourceControl.SourceControlProviderBase' Rubberduck.VBEditor.SafeComWrappers.VB6.CodePane' Rubberduck.VBEditor.SafeComWrappers.VBA.CodePane' RubberduckTests.Mocks.TestAttributeParser' RubberduckTests.Mocks.MockParser' RubberduckTests.Parsing.Coordination.IModuleToModuleReferenceManagerTestBase' RubberduckTests.Refactoring.ExtractMethod.WhenClassifyingDeclarations' RubberduckTests.Refactoring.ExtractMethod.WhenExtractingParameters' RubberduckTests.Refactoring.ExtractMethod.WhenSelectionSpansMoreThanASingleMethod' RubberduckTests.Refactoring.ExtractMethod.WhenSeletionSpansWithinMethod' RubberduckTests.Refactoring.ExtractMethod.WhenDeclarationsContainNoPreviousNewMethod' RubberduckTests.Refactoring.ExtractMethod.WhenDeclarationsContainAPreviousNewMethod' RubberduckTests.Refactoring.ExtractMethod.WhenDeclarationsContainAPreviousUnOrderedNewMethod' RubberduckTests.Refactoring.ExtractMethod.ExtractMethodModelTests' RubberduckTests.Refactoring.ExtractMethod.WhenExtractingFromASelection' RubberduckTests.Refactoring.ExtractMethod.WhenTheSelectionIsNotWithinAMethod' RubberduckTests.Refactoring.ExtractMethod.WhenLocalVariableConstantIsInternal' RubberduckTests.Refactoring.ExtractMethod.WhenSplittingSelection' RubberduckTests.UnitTesting.DiscoveryTests' Rubberduck.Refactorings.EncapsulateField.EncapsulateFieldModel' Rubberduck.Refactorings.ExtractMethod.ExtractMethodParameterClassification' Rubberduck.Refactorings.ExtractMethod.ExtractMethodSelectionValidation' Rubberduck.Refactorings.ExtractMethod.IExtractMethodModel' Rubberduck.Refactorings.ExtractMethod.IExtractMethodParameterClassification' Rubberduck.Refactorings.ExtractMethod.IExtractMethodSelectionValidation' Rubberduck.Refactorings.ExtractMethod.ExtractMethodRefactoring' Rubberduck.Refactorings.ExtractMethod.ExtractMethodModel' Rubberduck.UI.SelectionExtensions' Rubberduck.Navigation.RegexSearchReplace.RegexSearchReplace' Rubberduck.Refactorings.ExtractInterface.ExtractInterfaceRefactoring' Rubberduck.Refactorings.ExtractInterface.ExtractInterfaceModel' Rubberduck.Refactorings.ImplementInterface.ImplementInterfaceRefactoring' Rubberduck.Refactorings.IntroduceParameter.IntroduceParameterRefactoring' Rubberduck.Refactorings.MoveCloserToUsage.MoveCloserToUsageRefactoring' Rubberduck.Refactorings.RemoveParameters.RemoveParametersModel' Rubberduck.Refactorings.RemoveParameters.RemoveParametersRefactoring' Rubberduck.Refactorings.Rename.RenameModel' Rubberduck.Refactorings.Rename.RenamePresenterFactory' Rubberduck.Refactorings.ReorderParameters.ReorderParametersModel' Rubberduck.Refactorings.ReorderParameters.ReorderParametersRefactoring' Rubberduck.UI.Command.Refactorings.RefactorMoveCloserToUsageCommand' Rubberduck.UI.Command.Refactorings.RefactorReorderParametersCommand' Rubberduck.Refactorings.IRefactoring' Rubberduck.Inspections.QuickFixes.ReplaceIfElseWithConditionalStatementQuickFix' Rubberduck.Inspections.QuickFixes.ApplicationWorksheetFunctionQuickFix' Rubberduck.Inspections.QuickFixes.ChangeDimToPrivateQuickFix' Rubberduck.Inspections.QuickFixes.RemoveStopKeywordQuickFix' Rubberduck.Inspections.QuickFixes.ReplaceObsoleteErrorStatementQuickFix' Rubberduck.Inspections.QuickFixes.SpecifyExplicitByRefModifierQuickFix' Rubberduck.Inspections.QuickFixes.MakeSingleLineParameterQuickFix' Rubberduck.Inspections.QuickFixes.OptionExplicitQuickFix' Rubberduck.Inspections.QuickFixes.PassParameterByValueQuickFix' Rubberduck.Inspections.QuickFixes.RemoveCommentQuickFix' Rubberduck.Inspections.QuickFixes.RemoveEmptyElseBlockQuickFix' Rubberduck.Inspections.QuickFixes.RemoveEmptyIfBlockQuickFix' Rubberduck.Inspections.QuickFixes.RemoveExplicitCallStatmentQuickFix' Rubberduck.Inspections.QuickFixes.RemoveExplicitLetStatementQuickFix' Rubberduck.Inspections.QuickFixes.RemoveOptionBaseStatementQuickFix' Rubberduck.Inspections.QuickFixes.RemoveExplicitByRefModifierQuickFix' Rubberduck.Inspections.QuickFixes.RemoveUnassignedVariableUsageQuickFix' Rubberduck.Inspections.QuickFixes.ReplaceEmptyStringLiteralStatementQuickFix' Rubberduck.Inspections.QuickFixes.ReplaceObsoleteCommentMarkerQuickFix' Rubberduck.Inspections.QuickFixes.SplitMultipleDeclarationsQuickFix' Rubberduck.Inspections.QuickFixes.UntypedFunctionUsageQuickFix' Rubberduck.Inspections.QuickFixes.UseSetKeywordForObjectAssignmentQuickFix' Rubberduck.Parsing.Annotations.AnnotationBase' Rubberduck.Parsing.Annotations.DefaultMemberAnnotation' Rubberduck.Parsing.Annotations.DescriptionAnnotation' Rubberduck.Parsing.Annotations.EnumeratorMemberAnnotation' Rubberduck.Parsing.Annotations.ExposedModuleAnnotation' Rubberduck.Parsing.Annotations.FolderAnnotation' Rubberduck.Parsing.Annotations.IAnnotationFactory' Rubberduck.Parsing.Annotations.IgnoreAnnotation' Rubberduck.Parsing.Annotations.IgnoreModuleAnnotation' Rubberduck.Parsing.Annotations.InterfaceAnnotation' Rubberduck.Parsing.Annotations.ModuleCleanupAnnotation' Rubberduck.Parsing.Annotations.ModuleInitializeAnnotation' Rubberduck.Parsing.Annotations.IgnoreTestAnnotation' Rubberduck.Parsing.Annotations.NoIndentAnnotation' Rubberduck.Parsing.Annotations.PredeclaredIdAnnotation' Rubberduck.Parsing.Annotations.TestCleanupAnnotation' Rubberduck.Parsing.Annotations.TestInitializeAnnotation' Rubberduck.Parsing.Annotations.TestMethodAnnotation' Rubberduck.Parsing.Annotations.TestModuleAnnotation' Rubberduck.Parsing.Annotations.VBAParserAnnotationFactory' Rubberduck.Parsing.Inspections.Abstract.IQuickFixProvider' Rubberduck.Parsing.Symbols.CommentNode' RubberduckTests.Mocks.MockProjectBuilder' RubberduckTests.Refactoring.EncapsulateFieldTests' RubberduckTests.Refactoring.ExtractInterfaceTests' RubberduckTests.Refactoring.ImplementInterfaceTests' RubberduckTests.Refactoring.IntroduceFieldTests' RubberduckTests.Refactoring.MoveCloserToUsageTests' RubberduckTests.Refactoring.IntroduceParameterTests' RubberduckTests.Refactoring.RemoveParametersTests' RubberduckTests.Refactoring.RenameTests' RubberduckTests.Refactoring.ReorderParametersTests' Rubberduck.Refactorings.ExtractMethod.ExtractMethodExtraction' Rubberduck.Refactorings.ExtractMethod.IExtractMethodExtraction' Rubberduck.Refactorings.ExtractMethod.IExtractMethodRule' Rubberduck.Refactorings.ExtractMethod.ExtractMethodRuleUsedBefore' Rubberduck.Refactorings.ExtractMethod.ExtractMethodRuleExternalReference' Rubberduck.Refactorings.ExtractMethod.ExtractMethodRuleUsedAfter' Rubberduck.Refactorings.ExtractMethod.ExtractMethodRuleIsAssignedInSelection' Rubberduck.Refactorings.ExtractMethod.ExtractMethodRuleInSelection' Rubberduck.Inspections.Concrete.MultilineParameterInspection' Rubberduck.Inspections.Concrete.ParameterCanBeByValInspection' Rubberduck.Inspections.Concrete.UnassignedVariableUsageInspection' Rubberduck.Parsing.SelectionExtensions' Rubberduck.Parsing.ParserRuleContextExtensions' Rubberduck.Parsing.VBA.ParseErrorEventArgs' Rubberduck.Parsing.Symbols.Identifier' Rubberduck.SmartIndenter.Indenter' Rubberduck.SmartIndenter.IIndenter' Rubberduck.VBEditor.SafeComWrappers.Abstract.ICodeModule' Rubberduck.VBEditor.SafeComWrappers.VB6.CodeModule' Rubberduck.VBEditor.SafeComWrappers.VBA.CodeModule' Rubberduck.VBEditor.SafeComWrappers.VBA.VBE' RubberduckTests.Binding.MemberAccessTypeBindingTests' RubberduckTests.Commands.RefactorCommandTests' RubberduckTests.Grammar.ParserRuleContextExtensionTests' RubberduckTests.Grammar.SelectionExtensionsTests' RubberduckTests.Grammar.ResolverTests' RubberduckTests.Mocks.MockVbeBuilder' RubberduckTests.Refactoring.ExtractMethod.WhenSetValidFlagIsCalledWhenTheReferenceIsUsedAfter' RubberduckTests.Refactoring.ExtractMethod.WhenSetValidFlagIsCalledWhenTheReferenceIsUsedBefore' RubberduckTests.Refactoring.ExtractMethod.WhenSetValidFlagIsCalledWhenTheReferenceIsInSelection' RubberduckTests.Refactoring.ExtractMethod.AndIsAssigned' RubberduckTests.Refactoring.ExtractMethod.AndIsNotAssigned' RubberduckTests.Refactoring.ExtractMethod.AndIsBeforeSelection' RubberduckTests.Refactoring.ExtractMethod.AndIsAfterSelection' Rubberduck.UI._DockableWindowHost' Rubberduck.UI.ParentWindow' Rubberduck.VBEditor.Extensions.VBProjectExtensions,Rubberduck.VBEditor.SafeComWrappers.Abstract.IVBComponent' Rubberduck.VBEditor.SafeComWrappers.ComponentType' Rubberduck.VBEditor.SafeComWrappers.Abstract.IVBProject' Rubberduck.VBEditor.SafeComWrappers.Abstract.IReference' Rubberduck.VBEditor.SafeComWrappers.Abstract.ICodeModule' Rubberduck.VBEditor.SafeComWrappers.Abstract.IVBComponents
Rubberduck.VBEditor,Rubberduck.VBEditor.SafeComWrappers.Office.Core,Rubberduck.UI.Command.MenuItems.ParentMenus.CommandBarButtonFactory' Rubberduck.UI.Command.MenuItems.CommandBars.AppCommandBarBase' Rubberduck.UI.Command.MenuItems.ParentMenus.ParentMenuItemBase' RubberduckTests.Symbols.CommandBarControlCaptionGuardTests' Rubberduck.UI.Command.MenuItems.ParentMenus.CommandBarPopupFactory' Rubberduck.VBEditor.SafeComWrappers.Office.Core.Abstract.ICommandBars,Rubberduck.VBEditor.SafeComWrappers.MSForms.ControlType' Rubberduck.VBEditor.SafeComWrappers.Abstract.ISafeComWrapper' Rubberduck.VBEditor.SafeComWrappers.Office.Core.Abstract.ICommandBar' Rubberduck.VBEditor.HashCode' Rubberduck.VBEditor.SafeComWrappers.Office.Core.Abstract.ICommandBarControl' Rubberduck.VBEditor.SafeComWrappers.Office.Core.Abstract.ICommandBarButton' Rubberduck.VBEditor.SafeComWrappers.Office.Core.Abstract.ICommandBarControls' Rubberduck.VBEditor.SafeComWrappers.Office.Core.Abstract.ICommandBars
Rubberduck.VBEditor,Rubberduck.VBEditor.SafeComWrappers.VB6,,Rubberduck.VBEditor.SafeComWrappers.Abstract.ISafeComWrapper' Rubberduck.VBEditor.SafeComWrappers.Abstract.IAddIn' Rubberduck.VBEditor.HashCode' Rubberduck.VBEditor.SafeComWrappers.Abstract.IAddIns' Rubberduck.VBEditor.SafeComWrappers.Abstract.IApplication' Rubberduck.VBEditor.Selection' Rubberduck.VBEditor.SafeComWrappers.Abstract.ICodePane' Rubberduck.VBEditor.SafeComWrappers.ProcKind' Rubberduck.VBEditor.SafeComWrappers.Abstract.ICodeModule' Rubberduck.VBEditor.SafeComWrappers.Abstract.IVBComponent' Rubberduck.VBEditor.QualifiedModuleName' Rubberduck.VBEditor.QualifiedSelection' Rubberduck.VBEditor.SafeComWrappers.Abstract.IWindow' Rubberduck.VBEditor.WindowsApi.ChildWindowFinder' Rubberduck.VBEditor.SafeComWrappers.Abstract.IVBE' Rubberduck.VBEditor.WindowsApi.NativeMethods' Rubberduck.VBEditor.SafeComWrappers.Abstract.ICodePanes' Rubberduck.VBEditor.SafeComWrappers.Abstract.ILinkedWindows' Rubberduck.VBEditor.SafeComWrappers.Abstract.IProperties' Rubberduck.VBEditor.SafeComWrappers.Abstract.IProperty' Rubberduck.VBEditor.SafeComWrappers.Abstract.IReference' Rubberduck.VBEditor.SafeComWrappers.Abstract.IVBProject' Rubberduck.VBEditor.SafeComWrappers.Abstract.IReferences' Rubberduck.VBEditor.SafeComWrappers.ComponentType' Rubberduck.VBEditor.SafeComWrappers.Abstract.IVBComponents' Rubberduck.VBEditor.Extensions.ComponentTypeExtensions' Rubberduck.VBEditor.SafeComWrappers.Abstract.IWindows' Rubberduck.VBEditor.SafeComWrappers.Abstract.IVBProjects' Rubberduck.VBEditor.SafeComWrappers.ProjectType' Rubberduck.VBEditor.SafeComWrappers.VBA.VBProject' Rubberduck.VBEditor.SafeComWrappers.MSForms.WindowKind' Rubberduck.VBEditor.SafeComWrappers.Abstract.ToolWindowInfo
Rubberduck.VBEditor,Rubberduck.VBEditor.SafeComWrappers.VBA,Rubberduck.SourceControl.SourceControlProviderBase' Rubberduck.UI.SourceControl.SourceControlViewViewModel' Rubberduck.Parsing.VBA.RubberduckParserState' Rubberduck.VBEditor.Events.VBENativeServices' Rubberduck.SourceControl.Interop._ISourceControlClassFactory' Rubberduck.SourceControl.Interop.SourceControlClassFactory' Rubberduck.VBEditor.SafeComWrappers.VB6.VBProjects' Rubberduck._Extension' Rubberduck.API.VBA.ParserState,Rubberduck.VBEditor.SafeComWrappers.Abstract.ISafeComWrapper' Rubberduck.VBEditor.SafeComWrappers.Abstract.IAddIn' Rubberduck.VBEditor.HashCode' Rubberduck.VBEditor.SafeComWrappers.Abstract.IAddIns' Rubberduck.VBEditor.SafeComWrappers.Abstract.IApplication' Rubberduck.VBEditor.Selection' Rubberduck.VBEditor.SafeComWrappers.Abstract.ICodePane' Rubberduck.VBEditor.SafeComWrappers.ProcKind' Rubberduck.VBEditor.SafeComWrappers.Abstract.ICodeModule' Rubberduck.VBEditor.QualifiedModuleName' Rubberduck.VBEditor.SafeComWrappers.Abstract.IVBComponent' Rubberduck.VBEditor.QualifiedSelection' Rubberduck.VBEditor.SafeComWrappers.Abstract.IWindow' Rubberduck.VBEditor.WindowsApi.ChildWindowFinder' Rubberduck.VBEditor.SafeComWrappers.Abstract.IVBE' Rubberduck.VBEditor.WindowsApi.NativeMethods' Rubberduck.VBEditor.SafeComWrappers.Abstract.ICodePanes' Rubberduck.VBEditor.SafeComWrappers.Office.Core.Abstract.IControl' Rubberduck.VBEditor.SafeComWrappers.Office.Core.Abstract.IControls' Rubberduck.VBEditor.SafeComWrappers.Abstract.IProperties' Rubberduck.VBEditor.SafeComWrappers.Abstract.IProperty' Rubberduck.VBEditor.SafeComWrappers.Abstract.ILinkedWindows' Rubberduck.VBEditor.SafeComWrappers.Abstract.IReference' Rubberduck.VBEditor.SafeComWrappers.Abstract.IVBProject' Rubberduck.VBEditor.SafeComWrappers.Abstract.IReferences' Rubberduck.VBEditor.SafeComWrappers.ComponentType' Rubberduck.VBEditor.SafeComWrappers.Abstract.IVBComponents' Rubberduck.VBEditor.Extensions.ComponentTypeExtensions' Rubberduck.VBEditor.SafeComWrappers.ProjectProtection' Rubberduck.VBEditor.SafeComWrappers.Abstract.IVBProjects' Rubberduck.VBEditor.SafeComWrappers.ProjectType' Rubberduck.VBEditor.SafeComWrappers.MSForms.WindowKind' Rubberduck.VBEditor.SafeComWrappers.Abstract.ToolWindowInfo' Rubberduck.VBEditor.SafeComWrappers.Abstract.IWindows' Rubberduck.VBEditor.Application.IHostApplication' Rubberduck.VBEditor.SafeComWrappers.Office.Core.Abstract.ICommandBars' Rubberduck.VBEditor.SafeComWrappers.Office.Core.Abstract.ICommandBarControl' Rubberduck.VBEditor.SafeComWrappers.MSForms.ControlType' Rubberduck.VBEditor.Application.SolidWorksApp' Rubberduck.VBEditor.Application.ExcelApp' Rubberduck.VBEditor.Application.AccessApp' Rubberduck.VBEditor.Application.WordApp' Rubberduck.VBEditor.Application.PowerPointApp' Rubberduck.VBEditor.Application.OutlookApp' Rubberduck.VBEditor.Application.ProjectApp' Rubberduck.VBEditor.Application.PublisherApp' Rubberduck.VBEditor.Application.VisioApp' Rubberduck.VBEditor.Application.AutoCADApp' Rubberduck.VBEditor.Application.CorelDRAWApp
Rubberduck.VBEditor,Rubberduck.VBEditor.WindowsApi,Rubberduck.VBEditor.SafeComWrappers.VB6.CodePane' Rubberduck.VBEditor.SafeComWrappers.VBA.CodePane' Rubberduck.VBEditor.Events.VBENativeServices' Rubberduck.VBEditor.Events.WindowInfo' Rubberduck.VBEditor.SafeComWrappers.VB6.VBE' Rubberduck.VBEditor.SafeComWrappers.VBA.VBE' Rubberduck.Common.RubberduckHooks' Rubberduck.UI.ParentWindow' Rubberduck._Extension' Rubberduck.Common.WinAPI.User32' Rubberduck.UI._DockableWindowHost,Rubberduck.VBEditor.SafeComWrappers.Abstract.ICodePane' Rubberduck.VBEditor.Events.VBENativeServices' Rubberduck.VBEditor.Events.WindowInfo' Rubberduck.VBEditor.Events.FocusType' Rubberduck.VBEditor.Events.WindowChangedEventArgs
Rubberduck.VBEditor,Rubberduck.VBEditor.Application,Rubberduck.VBEditor.Extensions.VBEExtensions' Rubberduck.VBEditor.SafeComWrappers.VBA.VBE' Rubberduck.Root.RubberduckIoCInstaller' Rubberduck.UnitTesting.TestEngine' Rubberduck.UnitTesting.TestMethod' Rubberduck.Parsing.Emitter' Rubberduck.Parsing.VBA.RubberduckParserState' Rubberduck.Parsing.Symbols.DeclarationFinderFactory' Rubberduck.Parsing.Symbols.ConcurrentlyConstructedDeclarationFinderFactory' Rubberduck.Parsing.Symbols.ConcurrentlyConstructedDeclarationFinder' Rubberduck.Parsing.Symbols.IDeclarationFinderFactory' Rubberduck.Parsing.Symbols.DeclarationFinder' RubberduckTests.SourceControl.SynchrounouslyConstructedDeclarationFinderFactory,Rubberduck.VBEditor.QualifiedModuleName' Rubberduck.VBEditor.QualifiedMemberName' Rubberduck.VBEditor.SafeComWrappers.Abstract.IVBE' Rubberduck.VBEditor.SafeComWrappers.Office.Core.Abstract.ICommandBarButton' Rubberduck.VBEditor.SafeComWrappers.Office.Core.Abstract.ICommandBar' Rubberduck.VBEditor.SafeComWrappers.ProcKind' Rubberduck.VBEditor.SafeComWrappers.Abstract.IVBProjects' Rubberduck.VBEditor.SafeComWrappers.Abstract.IVBProject' Rubberduck.VBEditor.SafeComWrappers.ProjectProtection' Rubberduck.VBEditor.SafeComWrappers.Abstract.IVBComponent' Rubberduck.VBEditor.SafeComWrappers.ComponentType' Rubberduck.VBEditor.SafeComWrappers.Abstract.IProperties' Rubberduck.VBEditor.SafeComWrappers.Abstract.IProperty
