Project,Namespace,Ca types,Ce types
Rubberduck,Rubberduck.Navigation.RegexSearchReplace,Rubberduck.UI.Command.RegexSearchReplaceCommand,Rubberduck.VBEditor.SafeComWrappers.Abstract.IVBE' Rubberduck.Parsing.IParseCoordinator' Rubberduck.VBEditor.SafeComWrappers.Abstract.ICodeModule' Rubberduck.VBEditor.SafeComWrappers.Abstract.ICodePane' Rubberduck.VBEditor.Selection' Rubberduck.Parsing.Symbols.DeclarationType' Rubberduck.Parsing.VBA.RubberduckParserState' Rubberduck.VBEditor.QualifiedSelection' Rubberduck.Parsing.Symbols.Declaration' Rubberduck.VBEditor.SafeComWrappers.Abstract.ICodePanes' Rubberduck.VBEditor.SafeComWrappers.Abstract.IVBProject' Rubberduck.VBEditor.SafeComWrappers.Abstract.IVBComponents' Rubberduck.VBEditor.SafeComWrappers.Abstract.IVBProjects' Rubberduck.VBEditor.SafeComWrappers.ProjectProtection
Rubberduck,Rubberduck.Refactorings.ExtractInterface,Rubberduck.UI.Command.Refactorings.RefactorExtractInterfaceCommand' RubberduckTests.Refactoring.ExtractInterfaceTests,Rubberduck.VBEditor.SafeComWrappers.Abstract.IVBE' Rubberduck.UI.IMessageBox' Rubberduck.Refactorings.IRefactoringPresenterFactory' Rubberduck.VBEditor.SafeComWrappers.Abstract.ICodePane' Rubberduck.VBEditor.SafeComWrappers.Abstract.ICodeModule' Rubberduck.Parsing.VBA.RubberduckParserState' Rubberduck.VBEditor.QualifiedSelection' Rubberduck.Parsing.Symbols.Declaration' Rubberduck.Parsing.Rewriter.IModuleRewriter' Rubberduck.VBEditor.SafeComWrappers.Abstract.IVBComponents' Rubberduck.VBEditor.SafeComWrappers.Abstract.IVBComponent' Rubberduck.Parsing.Symbols.DeclarationFinder' Rubberduck.VBEditor.SafeComWrappers.Abstract.IVBProject' Rubberduck.VBEditor.SafeComWrappers.ComponentType' Rubberduck.Parsing.Grammar.Tokens' Rubberduck.Refactorings.ImplementInterface.ImplementInterfaceRefactoring' Rubberduck.Parsing.Symbols.DeclarationType' Rubberduck.Parsing.Symbols.Accessibility' Rubberduck.UI.Refactorings.IRefactoringDialog' Rubberduck.UI.Refactorings.ExtractInterfaceViewModel' Rubberduck.Parsing.Symbols.IParameterizedDeclaration' Rubberduck.Parsing.Grammar.ArgContext' Rubberduck.Parsing.Grammar.SubStmtContext' Rubberduck.Parsing.Grammar.FunctionStmtContext' Rubberduck.Parsing.Grammar.PropertyGetStmtContext' Rubberduck.Parsing.Grammar.PropertyLetStmtContext' Rubberduck.Parsing.Grammar.PropertySetStmtContext
Rubberduck,Rubberduck.Refactorings.ImplementInterface,Rubberduck.Refactorings.ExtractInterface.ExtractInterfaceRefactoring' Rubberduck.UI.Command.Refactorings.RefactorImplementInterfaceCommand' RubberduckTests.Refactoring.ImplementInterfaceTests,Rubberduck.VBEditor.SafeComWrappers.Abstract.IVBE' Rubberduck.Parsing.VBA.RubberduckParserState' Rubberduck.UI.IMessageBox' Rubberduck.Parsing.Symbols.Declaration' Rubberduck.UI.RubberduckUI' Rubberduck.VBEditor.SafeComWrappers.Abstract.ICodePane' Rubberduck.VBEditor.QualifiedSelection' Rubberduck.VBEditor.SafeComWrappers.Abstract.ICodeModule' Rubberduck.Parsing.Rewriter.IModuleRewriter' Rubberduck.Parsing.Symbols.DeclarationType' Rubberduck.Parsing.Grammar.ArgContext' Rubberduck.Parsing.Grammar.Tokens
Rubberduck,Rubberduck.Refactorings.IntroduceField,Rubberduck.UI.Command.Refactorings.RefactorIntroduceFieldCommand' RubberduckTests.Refactoring.IntroduceFieldTests,Rubberduck.VBEditor.SafeComWrappers.Abstract.IVBE' Rubberduck.Parsing.VBA.RubberduckParserState' Rubberduck.UI.IMessageBox' Rubberduck.Parsing.Symbols.DeclarationType' Rubberduck.VBEditor.SafeComWrappers.Abstract.ICodePane' Rubberduck.UI.RubberduckUI' Rubberduck.Parsing.Symbols.Declaration' Rubberduck.Parsing.Rewriter.IModuleRewriter' Rubberduck.VBEditor.QualifiedSelection' Rubberduck.VBEditor.SafeComWrappers.Abstract.ICodeModule' Rubberduck.Parsing.Grammar.Tokens' Rubberduck.Parsing.Symbols.DeclarationFinder' Rubberduck.VBEditor.QualifiedMemberName
Rubberduck,Rubberduck.Refactorings.IntroduceParameter,Rubberduck.UI.Command.Refactorings.RefactorIntroduceParameterCommand' RubberduckTests.Refactoring.IntroduceParameterTests,Rubberduck.VBEditor.SafeComWrappers.Abstract.IVBE' Rubberduck.Parsing.VBA.RubberduckParserState' Rubberduck.UI.IMessageBox' Rubberduck.Parsing.Symbols.DeclarationType' Rubberduck.VBEditor.SafeComWrappers.Abstract.ICodePane' Rubberduck.VBEditor.SafeComWrappers.Abstract.ICodeModule' Rubberduck.UI.RubberduckUI' Rubberduck.Parsing.Symbols.Declaration' Rubberduck.VBEditor.QualifiedSelection' Rubberduck.Parsing.Rewriter.IModuleRewriter' Rubberduck.Parsing.Grammar.ArgListContext' Rubberduck.Parsing.Grammar.Tokens
Rubberduck,Rubberduck.Refactorings.MoveCloserToUsage,Rubberduck.UI.Command.Refactorings.RefactorMoveCloserToUsageCommand' Rubberduck.Inspections.QuickFixes.MoveFieldCloserToUsageQuickFix' RubberduckTests.Refactoring.MoveCloserToUsageTests,Rubberduck.VBEditor.SafeComWrappers.Abstract.IVBE' Rubberduck.Parsing.VBA.RubberduckParserState' Rubberduck.UI.IMessageBox' Rubberduck.Parsing.Symbols.Declaration' Rubberduck.VBEditor.SafeComWrappers.Abstract.ICodeModule' Rubberduck.VBEditor.SafeComWrappers.Abstract.ICodePane' Rubberduck.UI.RubberduckUI' Rubberduck.VBEditor.QualifiedSelection' Rubberduck.Parsing.Symbols.DeclarationType' Rubberduck.Parsing.Symbols.DeclarationFinder' Rubberduck.Parsing.Rewriter.IModuleRewriter' Rubberduck.Parsing.Grammar.BlockStmtContext' Rubberduck.Parsing.Grammar.MemberAccessExprContext
Rubberduck,Rubberduck.Refactorings.RemoveParameters,Rubberduck.UI.Refactorings.RemoveParameters.RemoveParametersView' Rubberduck.UI.Refactorings.RemoveParameters.RemoveParametersViewModel' RubberduckTests.Refactoring.RemoveParametersTests' Rubberduck.UI.Command.Refactorings.RefactorRemoveParametersCommand' Rubberduck.Inspections.QuickFixes.RemoveUnusedParameterQuickFix,Rubberduck.Parsing.Symbols.Declaration' Rubberduck.UI.IMessageBox' Rubberduck.Parsing.Symbols.DeclarationType' Rubberduck.Parsing.VBA.RubberduckParserState' Rubberduck.VBEditor.QualifiedSelection' Rubberduck.Parsing.Symbols.IParameterizedDeclaration' Rubberduck.UI.RubberduckUI' Rubberduck.UI.Refactorings.IRefactoringDialog' Rubberduck.UI.Refactorings.RemoveParameters.RemoveParametersViewModel' Rubberduck.VBEditor.SafeComWrappers.Abstract.IVBE' Rubberduck.VBEditor.SafeComWrappers.Abstract.ICodePane' Rubberduck.Refactorings.IRefactoringPresenterFactory' Rubberduck.VBEditor.SafeComWrappers.Abstract.ICodeModule' Rubberduck.VBEditor.Selection' Rubberduck.Parsing.Grammar.ArgumentListContext' Rubberduck.Parsing.Grammar.CallStmtContext' Rubberduck.Parsing.Grammar.IndexExprContext' Rubberduck.Parsing.Symbols.ParserRuleContextHelper' Rubberduck.Parsing.Symbols.CallStatement' Rubberduck.Parsing.Rewriter.IModuleRewriter
Rubberduck,Rubberduck.Refactorings.Rename,RubberduckTests.Refactoring.RenameTests' Rubberduck.UI.CodeExplorer.Commands.RenameCommand' Rubberduck.UI.Command.Refactorings.FormDesignerRefactorRenameCommand' Rubberduck.UI.Command.Refactorings.ProjectExplorerRefactorRenameCommand' Rubberduck.UI.Command.Refactorings.CodePaneRefactorRenameCommand' Rubberduck.Inspections.QuickFixes.RenameDeclarationQuickFix,Rubberduck.Parsing.Symbols.Declaration' Rubberduck.Parsing.VBA.RubberduckParserState' Rubberduck.VBEditor.SafeComWrappers.Abstract.IVBE' Rubberduck.VBEditor.QualifiedSelection' Rubberduck.UI.Refactorings.IRefactoringDialog' Rubberduck.VBEditor.SafeComWrappers.Abstract.ICodePane' Rubberduck.VBEditor.SafeComWrappers.Abstract.ICodeModule' Rubberduck.Refactorings.IRefactoringPresenterFactory' Rubberduck.UI.IMessageBox' Rubberduck.VBEditor.Selection' Rubberduck.Parsing.Symbols.DeclarationType' Rubberduck.UI.RubberduckUI' Rubberduck.VBEditor.SafeComWrappers.Abstract.IVBComponent' Rubberduck.VBEditor.QualifiedModuleName' Rubberduck.VBEditor.QualifiedMemberName' Rubberduck.VBEditor.SafeComWrappers.Office.Core.Abstract.IControls' Rubberduck.Parsing.Symbols.DeclarationFinder' Rubberduck.Parsing.Grammar.ImplementsStmtContext' Rubberduck.VBEditor.SafeComWrappers.Abstract.IProperties' Rubberduck.VBEditor.SafeComWrappers.Abstract.IProperty' Rubberduck.Parsing.Symbols.ParserRuleContextHelper' Rubberduck.VBEditor.SafeComWrappers.ComponentType' Rubberduck.VBEditor.SafeComWrappers.Abstract.IVBProjects' Rubberduck.Parsing.Rewriter.IModuleRewriter' Rubberduck.Parsing.Grammar.IIdentifierContext' Rubberduck.UI.Refactorings.Rename.RenameViewModel
Rubberduck,Rubberduck.Refactorings.ReorderParameters,RubberduckTests.Refactoring.ReorderParametersTests' Rubberduck.UI.Command.Refactorings.RefactorReorderParametersCommand' Rubberduck.UI.Refactorings.ReorderParameters.ReorderParametersView' Rubberduck.UI.Refactorings.ReorderParameters.ReorderParametersViewModel,Rubberduck.UI.IMessageBox' Rubberduck.Parsing.Symbols.DeclarationType' Rubberduck.Parsing.VBA.RubberduckParserState' Rubberduck.VBEditor.QualifiedSelection' Rubberduck.Parsing.Symbols.IParameterizedDeclaration' Rubberduck.Parsing.Symbols.Declaration' Rubberduck.UI.RubberduckUI' Rubberduck.UI.Refactorings.IRefactoringDialog' Rubberduck.UI.Refactorings.ReorderParameters.ReorderParametersViewModel' Rubberduck.VBEditor.SafeComWrappers.Abstract.IVBE' Rubberduck.VBEditor.SafeComWrappers.Abstract.ICodePane' Rubberduck.Refactorings.IRefactoringPresenterFactory' Rubberduck.VBEditor.SafeComWrappers.Abstract.ICodeModule' Rubberduck.Parsing.Grammar.ArgumentListContext' Rubberduck.Parsing.Grammar.CallStmtContext' Rubberduck.Parsing.Grammar.IndexExprContext' Rubberduck.Parsing.Symbols.ParserRuleContextHelper' Rubberduck.Parsing.Symbols.CallStatement' Rubberduck.Parsing.Rewriter.IModuleRewriter' Rubberduck.Parsing.Grammar.ArgListContext' Rubberduck.Parsing.Symbols.ParameterDeclaration
Rubberduck,Rubberduck.UI.CodeExplorer,Rubberduck.Navigation.CodeExplorer.CodeExplorerMemberViewModel' Rubberduck.Navigation.CodeExplorer.CodeExplorerProjectViewModel' Rubberduck.Settings.WindowSettings,Rubberduck.UI.Command.CommandBase' Rubberduck.Navigation.CodeExplorer.CodeExplorerViewModel' Rubberduck.VBEditor.SafeComWrappers.Abstract.IVBE' Rubberduck.VBEditor.SafeComWrappers.Abstract.IAddIn' Rubberduck.SettingsProvider.IConfigProvider' Rubberduck.Properties.Resources
Rubberduck,Rubberduck.UI.Command.Refactorings,RubberduckTests.Commands.RefactorCommandTests' Rubberduck.Root.RubberduckIoCInstaller,Rubberduck.Parsing.VBA.RubberduckParserState' Rubberduck.UI.IMessageBox' Rubberduck.VBEditor.SafeComWrappers.Abstract.IVBE' Rubberduck.Parsing.VBA.ParserState' Rubberduck.Refactorings.Rename.RenamePresenterFactory' Rubberduck.Refactorings.Rename.RenameRefactoring' Rubberduck.Parsing.Symbols.Declaration' Rubberduck.VBEditor.SafeComWrappers.Abstract.IVBProject' Rubberduck.Parsing.Symbols.DeclarationFinder' Rubberduck.Parsing.Symbols.DeclarationType' Rubberduck.VBEditor.SafeComWrappers.Abstract.IVBComponent' Rubberduck.SmartIndenter.Indenter' Rubberduck.VBEditor.SafeComWrappers.Abstract.ICodePane' Rubberduck.Refactorings.EncapsulateField.EncapsulateFieldPresenterFactory' Rubberduck.Refactorings.EncapsulateField.EncapsulateFieldRefactoring' Rubberduck.Refactorings.ImplementInterface.ImplementInterfaceRefactoring' Rubberduck.Refactorings.ExtractInterface.ExtractInterfacePresenterFactory' Rubberduck.Refactorings.ExtractInterface.ExtractInterfaceRefactoring' Rubberduck.Refactorings.IntroduceField.IntroduceFieldRefactoring' Rubberduck.Refactorings.IntroduceParameter.IntroduceParameterRefactoring' Rubberduck.VBEditor.SafeComWrappers.Abstract.ICodeModule' Rubberduck.VBEditor.QualifiedSelection' Rubberduck.Refactorings.MoveCloserToUsage.MoveCloserToUsageRefactoring' Rubberduck.Refactorings.ReorderParameters.ReorderParametersPresenterFactory' Rubberduck.Refactorings.ReorderParameters.ReorderParametersRefactoring' Rubberduck.UI.RubberduckUI' Rubberduck.SmartIndenter.IIndenter' Rubberduck.Refactorings.ExtractMethod.ExtractMethodSelectionValidation' Rubberduck.Refactorings.ExtractMethod.ExtractMethodParameterClassification' Rubberduck.Refactorings.ExtractMethod.ExtractedMethod' Rubberduck.Refactorings.ExtractMethod.ExtractMethodModel' Rubberduck.Refactorings.ExtractMethod.ExtractMethodExtraction' Rubberduck.Refactorings.ExtractMethod.ExtractMethodRefactoring' Rubberduck.Refactorings.RemoveParameters.RemoveParametersPresenterFactory' Rubberduck.Refactorings.RemoveParameters.RemoveParametersRefactoring
Rubberduck,Rubberduck.UI.ParserErrors,,Rubberduck.Parsing.VBA.ParseErrorEventArgs' Rubberduck.UI.SimpleListControl' Rubberduck.VBEditor.SafeComWrappers.Abstract.IVBE' Rubberduck.VBEditor.SafeComWrappers.Abstract.IAddIn' Rubberduck.UI.IdentifierReferences.ListItemActionEventArgs
Rubberduck,Rubberduck.UI.RegexAssistant,Rubberduck.UI.Command.RegexAssistantCommand,Rubberduck.UI.RubberduckUI' Rubberduck.RegexAssistant.Pattern' Rubberduck.RegexAssistant.IRegularExpression' Rubberduck.RegexAssistant.ErrorExpression' Rubberduck.RegexAssistant.ConcatenatedExpression' Rubberduck.RegexAssistant.AlternativesExpression' Rubberduck.RegexAssistant.SingleAtomExpression' Rubberduck.RegexAssistant.IAtom' Rubberduck.RegexAssistant.Group
Rubberduck,Rubberduck.UI.Settings.Converters,,Rubberduck.UI.HotkeyDisplayConverter' Rubberduck.Settings.AssertMode' Rubberduck.UI.RubberduckUI' Rubberduck.SmartIndenter.EndOfLineCommentStyle' Rubberduck.UI.Settings.DelimiterOptions' Rubberduck.Settings.BindingMode' Rubberduck.Parsing.Inspections.Resources.InspectionsUI' Rubberduck.UI.Settings.SettingsView
Rubberduck,Rubberduck.UI.Settings,Rubberduck.UI.Settings.Converters.DelimiterValueToTextConverter' RubberduckTests.Settings.GeneralSettingsTests' RubberduckTests.Settings.IndenterSettingsTests' RubberduckTests.Settings.InspectionSettingsTests' Rubberduck.UI.Command.MenuItems.CommandBars.ContextFormatter' Rubberduck.UI.Refactorings.AssignedByValParameterQuickFixDialog' Rubberduck.UI.Command.SettingsCommand' Rubberduck.UI.Inspections.InspectionResultsViewModel' Rubberduck.UI.UnitTesting.TestExplorerViewModel' Rubberduck.UI.Settings.Converters.SettingsViewToPageConverter' RubberduckTests.Settings.UnitTestSettingsTests' RubberduckTests.Settings.TodoSettingsTests,Rubberduck.Common.IOperatingSystem' Rubberduck.Settings.DisplayLanguageSetting' Rubberduck.Settings.MinimumLogLevel' Rubberduck.UI.Command.CommandBase' Rubberduck.Common.LogLevelHelper' Rubberduck.Settings.UserSettings' Rubberduck.Settings.Configuration' Rubberduck.Common.ApplicationConstants' Rubberduck.Settings.HotkeySettings' Rubberduck.Settings.GeneralSettings' Rubberduck.Settings.IGeneralSettings' Rubberduck.Settings.IHotkeySettings' Rubberduck.UI.RubberduckUI' Rubberduck.UI.OpenFileDialog' Rubberduck.UI.SaveFileDialog' Rubberduck.SmartIndenter.EndOfLineCommentStyle' Rubberduck.SmartIndenter.IndenterSettings' Rubberduck.SmartIndenter.IIndenterSettings' Rubberduck.Parsing.Inspections.Resources.InspectionsUI' Rubberduck.Parsing.Inspections.Resources.CodeInspectionSeverity' Rubberduck.Settings.CodeInspectionSettings' Rubberduck.Settings.CodeInspectionSetting' Rubberduck.Settings.IGeneralConfigService' Rubberduck.Settings.ConfigurationChangedEventArgs' Rubberduck.Settings.BindingMode' Rubberduck.Settings.AssertMode' Rubberduck.Settings.UnitTestSettings' Rubberduck.Settings.ToDoListSettings' Rubberduck.Settings.WindowSettings
Rubberduck,Rubberduck.Properties,Rubberduck.Common.DeclarationExtensions' Rubberduck.Navigation.CodeExplorer.CodeExplorerCustomFolderViewModel' Rubberduck.UI.CodeMetrics.CodeMetricsWindow' Rubberduck.UI.Splash' Rubberduck.UI.Refactorings.AssignedByValParameterQuickFixDialog' Rubberduck.UI.Refactorings.ExtractMethodDialog' Rubberduck.UI.CodeExplorer.CodeExplorerWindow,
Rubberduck,Rubberduck.Refactorings,Rubberduck.Refactorings.EncapsulateField.EncapsulateFieldRefactoring' Rubberduck.Refactorings.ExtractInterface.ExtractInterfaceRefactoring' Rubberduck.Refactorings.RemoveParameters.RemoveParametersRefactoring' Rubberduck.Refactorings.Rename.RenameRefactoring' Rubberduck.Refactorings.ReorderParameters.ReorderParametersRefactoring,Rubberduck.VBEditor.QualifiedSelection' Rubberduck.Parsing.Symbols.Declaration
Rubberduck,Rubberduck.UI.FindSymbol,Rubberduck.UI.Command.FindSymbolCommand,Rubberduck.UI.NavigateCodeEventArgs' Rubberduck.UI.RubberduckUI' Rubberduck.Parsing.Symbols.DeclarationType' Rubberduck.Common.DeclarationIconCache' Rubberduck.Parsing.Symbols.Declaration
Rubberduck,Rubberduck.UI.IdentifierReferences,Rubberduck.UI.SimpleListControl' Rubberduck.UI.ParserErrors.ParserErrorsPresenter,Rubberduck.Parsing.Symbols.IdentifierReference' Rubberduck.Parsing.Symbols.Declaration' Rubberduck.VBEditor.SafeComWrappers.Abstract.IVBE' Rubberduck.VBEditor.SafeComWrappers.Abstract.IAddIn' Rubberduck.UI.IDockableUserControl' Rubberduck.UI.SimpleListControl' Rubberduck.VBEditor.SafeComWrappers.Abstract.ICodePane' Rubberduck.VBEditor.SafeComWrappers.Abstract.ICodeModule' Rubberduck.VBEditor.SafeComWrappers.Abstract.IVBComponent' Rubberduck.VBEditor.QualifiedModuleName' Rubberduck.VBEditor.QualifiedMemberName
Rubberduck,Rubberduck.UI.SourceControl,RubberduckTests.SourceControl.BranchesViewModelTests' RubberduckTests.SourceControl.SourceControlViewModelTests' Rubberduck.UI.CodeExplorer.Commands.UndoCommand' RubberduckTests.SourceControl.ChangesViewModelTests' Rubberduck.UI.SourceControl.Converters.CommitActionTextToEnum' RubberduckTests.SourceControl.SettingsViewModelTests' Rubberduck.UI.CodeExplorer.Commands.CommitCommand' Rubberduck.Settings.WindowSettings' RubberduckTests.SourceControl.UnsyncedCommitsViewModelTests,Rubberduck.SourceControl.ISourceControlProvider' Rubberduck.UI.Command.CommandBase' Rubberduck.SourceControl.IBranch' Rubberduck.SourceControl.SourceControlException' Rubberduck.UI.RubberduckUI' Rubberduck.SourceControl.FileStatus' Rubberduck.SourceControl.IFileStatusEntry' Rubberduck.SourceControl.IRepository' Rubberduck.SettingsProvider.IConfigProvider' Rubberduck.UI.IFolderBrowserFactory' Rubberduck.UI.IOpenFileDialog' Rubberduck.SourceControl.SourceControlSettings' Rubberduck.UI.IFolderBrowser' Rubberduck.SourceControl.GitSettingsFile' Rubberduck.SourceControl.DefaultSettings' Rubberduck.VBEditor.SafeComWrappers.Abstract.IVBProject' Rubberduck.SourceControl.SecureCredentials' Rubberduck.VBEditor.SafeComWrappers.Abstract.IVBE' Rubberduck.Parsing.VBA.RubberduckParserState' Rubberduck.UI.IMessageBox' Rubberduck.UI.IEnvironmentProvider' Rubberduck.VBEditor.SafeComWrappers.Abstract.IVBProjects' Rubberduck.VBEditor.SafeComWrappers.VBA.VBProjects' Rubberduck.VBEditor.SafeComWrappers.VBA.VBComponents' Rubberduck.VBEditor.Events.ComponentEventArgs' Rubberduck.VBEditor.SafeComWrappers.Abstract.IVBComponent' Rubberduck.VBEditor.Events.ComponentRenamedEventArgs' Rubberduck.VBEditor.Events.ProjectEventArgs' Rubberduck.UI.Command.MenuItems.UiDispatcher' Rubberduck.Parsing.VBA.ParserStateEventArgs' Rubberduck.Parsing.VBA.ParserState' Rubberduck.SourceControl.Repository' Rubberduck.VBEditor.SafeComWrappers.Abstract.IAddIn
Rubberduck,Rubberduck.UI.SourceControl.Converters,,Rubberduck.UI.RubberduckUI' Rubberduck.UI.SourceControl.CommitAction
Rubberduck,Rubberduck.UI.ToDoItems,Rubberduck.Settings.WindowSettings' RubberduckTests.TodoExplorer.TodoExplorerTests,Rubberduck.UI.Command.CommandBase' Rubberduck.VBEditor.SafeComWrappers.Abstract.IVBE' Rubberduck.VBEditor.SafeComWrappers.Abstract.IAddIn' Rubberduck.SettingsProvider.IConfigProvider' Rubberduck.Parsing.VBA.RubberduckParserState' Rubberduck.Settings.IGeneralConfigService' Rubberduck.Common.IOperatingSystem' Rubberduck.ToDoItems.ToDoItem' Rubberduck.UI.Command.NavigateCommand' Rubberduck.Parsing.VBA.ParserState' Rubberduck.Settings.ToDoListSettings' Rubberduck.Settings.UserSettings' Rubberduck.Settings.Configuration' Rubberduck.Parsing.Symbols.CommentNode
Rubberduck,Rubberduck.UI.UnitTesting,Rubberduck.Settings.WindowSettings' Rubberduck.UI.Command.RunAllTestsCommand' Rubberduck.UnitTesting.TestEngine' RubberduckTests.UnitTesting.ViewModelTests,Rubberduck.VBEditor.SafeComWrappers.Abstract.IVBE' Rubberduck.VBEditor.SafeComWrappers.Abstract.IAddIn' Rubberduck.SettingsProvider.IConfigProvider' Rubberduck.Parsing.VBA.RubberduckParserState' Rubberduck.Parsing.VBA.ParserStateEventArgs' Rubberduck.Parsing.VBA.ParserState' Rubberduck.UnitTesting.UnitTestUtils' Rubberduck.UnitTesting.TestOutcome' Rubberduck.Parsing.Symbols.Declaration' Rubberduck.UnitTesting.TestMethod' Rubberduck.UnitTesting.ITestEngine' Rubberduck.Common.IClipboardWriter' Rubberduck.Settings.IGeneralConfigService' Rubberduck.Common.IOperatingSystem' Rubberduck.UI.Command.NavigateCommand' Rubberduck.UI.Command.RunAllTestsCommand' Rubberduck.UI.Command.TestRunEventArgs' Rubberduck.UI.Settings.SettingsViews' Rubberduck.UI.Settings.SettingsForm' Rubberduck.Common.ColumnInfo' Rubberduck.Common.hAlignment' Rubberduck.Common.ExportFormatter' Rubberduck.UI.RubberduckUI' Rubberduck.UnitTesting.TestResult
Rubberduck,Rubberduck.ToDoItems,Rubberduck.UI.ToDoItems.ToDoExplorerViewModel' Rubberduck.UI.ToDoItems.ToDoItemClickEventArgs,Rubberduck.VBEditor.QualifiedSelection' Rubberduck.Parsing.Symbols.CommentNode' Rubberduck.UI.NavigateCodeEventArgs' Rubberduck.VBEditor.QualifiedModuleName' Rubberduck.VBEditor.Selection' Rubberduck.UI.RubberduckUI
