Project,Namespace,Ca types,Ce types
Microsoft.WindowsAzure.Storage,Microsoft.WindowsAzure.Storage,Microsoft.WindowsAzure.Storage.Blob.BlobReadStreamBase' Microsoft.WindowsAzure.Storage.Blob.BlobWriteStreamBase' Microsoft.WindowsAzure.Storage.Blob.CloudAppendBlob' Microsoft.WindowsAzure.Storage.Blob.CloudBlob' Microsoft.WindowsAzure.Storage.Blob.CloudBlobClient' Microsoft.WindowsAzure.Storage.Blob.CloudBlobContainer' Microsoft.WindowsAzure.Storage.Blob.CloudBlockBlob' Microsoft.WindowsAzure.Storage.Blob.CloudPageBlob' Microsoft.WindowsAzure.Storage.Blob.ICloudBlob' Microsoft.WindowsAzure.Storage.Blob.BlobReadStream' Microsoft.WindowsAzure.Storage.Blob.BlobReadStreamHelper' Microsoft.WindowsAzure.Storage.Blob.BlobWriteStream' Microsoft.WindowsAzure.Storage.Blob.BlobWriteStreamHelper' Microsoft.WindowsAzure.Storage.Blob.Protocol.BlobHttpRequestMessageFactory' Microsoft.WindowsAzure.Storage.Blob.Protocol.ContainerHttpRequestMessageFactory' Microsoft.WindowsAzure.Storage.Shared.Protocol.RequestMessageExtensions' Microsoft.WindowsAzure.Storage.Queue.CloudQueueClient' Microsoft.WindowsAzure.Storage.Table.CloudTableClient' Microsoft.WindowsAzure.Storage.Auth.StorageCredentials' Microsoft.WindowsAzure.Storage.Core.Util.AuthenticationUtility' DataBlobStorageSample.Program' DataFileStorageSample.Program' DataStorageQueueSample.Program' DataTableStorageSample.Program' Microsoft.WindowsAzure.Storage.Core.MultiBufferMemoryStream' Microsoft.WindowsAzure.Storage.Table.Protocol.HttpRequestAdapterMessage' Microsoft.WindowsAzure.Storage.Core.Util.CommonUtility' Microsoft.WindowsAzure.Storage.Table.TableQuery' Microsoft.WindowsAzure.Storage.Table.TableQuery<TElement>' Microsoft.WindowsAzure.Storage.Core.Auth.SharedAccessSignatureHelper' Microsoft.WindowsAzure.Storage.Queue.CloudQueue' Microsoft.WindowsAzure.Storage.Table.CloudTable' Microsoft.WindowsAzure.Storage.Core.Logger' Microsoft.WindowsAzure.Storage.Blob.CloudBlobDirectory' Microsoft.WindowsAzure.Storage.Core.Executor.ExecutionState<T>' Microsoft.WindowsAzure.Storage.Core.Executor.ExecutorBase' Microsoft.WindowsAzure.Storage.Core.Executor.Executor' Microsoft.WindowsAzure.Storage.Queue.Protocol.QueueHttpRequestMessageFactory' Microsoft.WindowsAzure.Storage.RetryPolicies.ExponentialRetry' Microsoft.WindowsAzure.Storage.RetryPolicies.IExtendedRetryPolicy' Microsoft.WindowsAzure.Storage.RetryPolicies.IRetryPolicy' Microsoft.WindowsAzure.Storage.RetryPolicies.LinearRetry' Microsoft.WindowsAzure.Storage.RetryPolicies.NoRetry' Microsoft.WindowsAzure.Storage.Shared.Protocol.HttpContentFactory' Microsoft.WindowsAzure.Storage.Shared.Protocol.HttpRequestMessageFactory' Microsoft.WindowsAzure.Storage.Table.DynamicTableEntity' Microsoft.WindowsAzure.Storage.Table.EntityPropertyConverter' Microsoft.WindowsAzure.Storage.Table.ITableEntity' Microsoft.WindowsAzure.Storage.Table.TableBatchOperation' Microsoft.WindowsAzure.Storage.Table.TableEntity' Microsoft.WindowsAzure.Storage.Table.TableOperation' Microsoft.WindowsAzure.Storage.Table.Protocol.TableHttpRequestMessageFactory' Microsoft.WindowsAzure.Storage.Table.Protocol.TableOperationHttpRequestMessageFactory' Microsoft.WindowsAzure.Storage.Table.Protocol.TableOperationHttpResponseParsers' Microsoft.WindowsAzure.Storage.Core.Executor.StorageCommandBase<T>' Microsoft.WindowsAzure.Storage.Core.Util.Exceptions' Microsoft.WindowsAzure.Storage.Core.Util.StreamExtensions' Microsoft.WindowsAzure.Storage.RetryPolicies.RetryContext' Microsoft.WindowsAzure.Storage.Table.Protocol.TableRequest' Microsoft.WindowsAzure.Storage.RetryPolicies.RetryInfo' Microsoft.WindowsAzure.Storage.Core.UriQueryBuilder' Microsoft.WindowsAzure.Storage.Core.Executor.RESTCommand<T>' Microsoft.WindowsAzure.Storage.Core.Util.NavigationHelper,Microsoft.WindowsAzure.Storage.Auth.StorageCredentials' Microsoft.WindowsAzure.Storage.Core.Util.CommonUtility' Microsoft.WindowsAzure.Storage.Core.SR' Microsoft.WindowsAzure.Storage.Table.CloudTableClient' Microsoft.WindowsAzure.Storage.Queue.CloudQueueClient' Microsoft.WindowsAzure.Storage.Blob.CloudBlobClient' Microsoft.WindowsAzure.Storage.Auth.StorageAccountKey' Microsoft.WindowsAzure.Storage.Core.UriQueryBuilder' Microsoft.WindowsAzure.Storage.Core.Auth.SharedAccessSignatureHelper' Microsoft.WindowsAzure.Storage.Shared.Protocol.HeaderConstants' Microsoft.WindowsAzure.Storage.Shared.Protocol.Constants' Microsoft.WindowsAzure.Storage.RetryPolicies.LocationMode
Microsoft.WindowsAzure.Storage,Microsoft.WindowsAzure.Storage.Auth,Microsoft.WindowsAzure.Storage.CloudStorageAccount' Microsoft.WindowsAzure.Storage.Blob.CloudBlob' Microsoft.WindowsAzure.Storage.Blob.CloudBlobContainer' Microsoft.WindowsAzure.Storage.Queue.CloudQueue' Microsoft.WindowsAzure.Storage.Table.CloudTable' Microsoft.WindowsAzure.Storage.Blob.CloudAppendBlob' Microsoft.WindowsAzure.Storage.Blob.CloudBlobClient' Microsoft.WindowsAzure.Storage.Blob.CloudBlockBlob' Microsoft.WindowsAzure.Storage.Blob.CloudPageBlob' Microsoft.WindowsAzure.Storage.Blob.Protocol.BlobHttpRequestMessageFactory' Microsoft.WindowsAzure.Storage.Blob.Protocol.ContainerHttpRequestMessageFactory' Microsoft.WindowsAzure.Storage.Core.Auth.SharedAccessSignatureHelper' Microsoft.WindowsAzure.Storage.Core.StorageRequestMessage' Microsoft.WindowsAzure.Storage.Core.Executor.RESTCommand<T>' Microsoft.WindowsAzure.Storage.Core.Executor.Executor' Microsoft.WindowsAzure.Storage.Core.Util.NavigationHelper' Microsoft.WindowsAzure.Storage.Queue.CloudQueueClient' Microsoft.WindowsAzure.Storage.Queue.Protocol.QueueHttpRequestMessageFactory' Microsoft.WindowsAzure.Storage.Shared.Protocol.HttpRequestMessageFactory' Microsoft.WindowsAzure.Storage.Table.CloudTableClient' Microsoft.WindowsAzure.Storage.Table.Protocol.TableHttpRequestMessageFactory' Microsoft.WindowsAzure.Storage.Table.Protocol.TableOperationHttpRequestMessageFactory' Microsoft.WindowsAzure.Storage.Auth.Protocol.StorageAuthenticationHttpHandler,Microsoft.WindowsAzure.Storage.Core.SasQueryBuilder' Microsoft.WindowsAzure.Storage.Core.Util.CommonUtility' Microsoft.WindowsAzure.Storage.Core.SR' Microsoft.WindowsAzure.Storage.StorageUri' Microsoft.WindowsAzure.Storage.CloudStorageAccount' Microsoft.WindowsAzure.Storage.Shared.Protocol.QueryConstants' Microsoft.WindowsAzure.Storage.Shared.Protocol.Constants' Microsoft.WindowsAzure.Storage.Shared.Protocol.HeaderConstants
Microsoft.WindowsAzure.Storage,Microsoft.WindowsAzure.Storage.Blob,Microsoft.WindowsAzure.Storage.Blob.Protocol.ListBlobEntry' Microsoft.WindowsAzure.Storage.Blob.Protocol.ListBlobsResponse' Microsoft.WindowsAzure.Storage.Blob.Protocol.ContainerHttpResponseParsers' Microsoft.WindowsAzure.Storage.Blob.Protocol.ListContainersResponse' Microsoft.WindowsAzure.Storage.Blob.Protocol.ContainerHttpRequestMessageFactory' DataBlobStorageSample.Program' Microsoft.WindowsAzure.Storage.Blob.Protocol.BlobListingContext' Microsoft.WindowsAzure.Storage.Blob.Protocol.BlobHttpResponseParsers' Microsoft.WindowsAzure.Storage.Blob.Protocol.BlobHttpRequestMessageFactory' Microsoft.WindowsAzure.Storage.Core.Util.CommonUtility' Microsoft.WindowsAzure.Storage.Blob.Protocol.BlobRequest' Microsoft.WindowsAzure.Storage.Blob.Protocol.PutBlockListItem' Microsoft.WindowsAzure.Storage.CloudStorageAccount' Microsoft.WindowsAzure.Storage.Blob.Protocol.GetBlockListResponse' Microsoft.WindowsAzure.Storage.Blob.Protocol.GetPageDiffRangesResponse' Microsoft.WindowsAzure.Storage.Blob.Protocol.GetPageRangesResponse' Microsoft.WindowsAzure.Storage.Core.Auth.SharedAccessSignatureHelper' Microsoft.WindowsAzure.Storage.Blob.Protocol.BlobAccessPolicyResponse,Microsoft.WindowsAzure.Storage.Core.SR' Microsoft.WindowsAzure.Storage.Core.Util.CommonUtility' Microsoft.WindowsAzure.Storage.Core.MultiBufferMemoryStream' Microsoft.WindowsAzure.Storage.AccessCondition' Microsoft.WindowsAzure.Storage.OperationContext' Microsoft.WindowsAzure.Storage.Core.Util.MD5Wrapper' Microsoft.WindowsAzure.Storage.Shared.Protocol.Constants' Microsoft.WindowsAzure.Storage.Core.Util.CounterEvent' Microsoft.WindowsAzure.Storage.Core.Util.AsyncSemaphore' Microsoft.WindowsAzure.Storage.Auth.StorageCredentials' Microsoft.WindowsAzure.Storage.StorageUri' Microsoft.WindowsAzure.Storage.Core.SyncMemoryStream' Microsoft.WindowsAzure.Storage.Core.Executor.Executor' Microsoft.WindowsAzure.Storage.Core.Util.StreamDescriptor' Microsoft.WindowsAzure.Storage.Core.StorageRequestMessage' Microsoft.WindowsAzure.Storage.Blob.Protocol.BlobHttpRequestMessageFactory' Microsoft.WindowsAzure.Storage.Shared.Protocol.HttpResponseParsers' Microsoft.WindowsAzure.Storage.Core.NullType' Microsoft.WindowsAzure.Storage.RequestResult' Microsoft.WindowsAzure.Storage.Shared.Protocol.HttpContentFactory' Microsoft.WindowsAzure.Storage.Shared.Protocol.HeaderConstants' Microsoft.WindowsAzure.Storage.Core.Util.NavigationHelper' Microsoft.WindowsAzure.Storage.Blob.Protocol.BlobHttpResponseParsers' Microsoft.WindowsAzure.Storage.Auth.StorageAccountKey' Microsoft.WindowsAzure.Storage.Core.UriQueryBuilder' Microsoft.WindowsAzure.Storage.Core.Auth.SharedAccessSignatureHelper' Microsoft.WindowsAzure.Storage.IPAddressOrRange' Microsoft.WindowsAzure.Storage.Shared.Protocol.Request' Microsoft.WindowsAzure.Storage.StorageExtendedErrorInformation' Microsoft.WindowsAzure.Storage.Blob.Protocol.BlobErrorCodeStrings' Microsoft.WindowsAzure.Storage.Core.CommandLocationMode' Microsoft.WindowsAzure.Storage.StorageLocation' Microsoft.WindowsAzure.Storage.AuthenticationScheme' Microsoft.WindowsAzure.Storage.Core.Auth.SharedKeyLiteCanonicalizer' Microsoft.WindowsAzure.Storage.Core.Auth.SharedKeyCanonicalizer' Microsoft.WindowsAzure.Storage.Shared.Protocol.ListingContext' Microsoft.WindowsAzure.Storage.Blob.Protocol.ListContainersResponse' Microsoft.WindowsAzure.Storage.Blob.Protocol.ContainerHttpRequestMessageFactory' Microsoft.WindowsAzure.Storage.Blob.Protocol.BlobContainerEntry' Microsoft.WindowsAzure.Storage.Shared.Protocol.ServiceProperties' Microsoft.WindowsAzure.Storage.RetryPolicies.LocationMode' Microsoft.WindowsAzure.Storage.StorageException' Microsoft.WindowsAzure.Storage.Blob.Protocol.ContainerHttpResponseParsers' Microsoft.WindowsAzure.Storage.Blob.Protocol.BlobRequest' Microsoft.WindowsAzure.Storage.Blob.Protocol.ListBlobEntry' Microsoft.WindowsAzure.Storage.Blob.Protocol.ListBlobPrefixEntry' Microsoft.WindowsAzure.Storage.Blob.Protocol.IListBlobEntry' Microsoft.WindowsAzure.Storage.Blob.Protocol.BlobListingContext' Microsoft.WindowsAzure.Storage.Blob.Protocol.ListBlobsResponse' Microsoft.WindowsAzure.Storage.Shared.Protocol.CappedLengthReadOnlyStream' Microsoft.WindowsAzure.Storage.Blob.Protocol.GetBlockListResponse' Microsoft.WindowsAzure.Storage.Blob.Protocol.GetPageRangesResponse' Microsoft.WindowsAzure.Storage.Blob.Protocol.GetPageDiffRangesResponse' Microsoft.WindowsAzure.Storage.Blob.Protocol.PageWrite' Microsoft.WindowsAzure.Storage.Core.Logger
Microsoft.WindowsAzure.Storage,Microsoft.WindowsAzure.Storage.Blob.Protocol,Microsoft.WindowsAzure.Storage.Blob.CloudBlobClient' Microsoft.WindowsAzure.Storage.Blob.CloudBlob' Microsoft.WindowsAzure.Storage.Blob.CloudBlobContainer' Microsoft.WindowsAzure.Storage.Blob.BlobWriteStream' Microsoft.WindowsAzure.Storage.Blob.CloudAppendBlob' Microsoft.WindowsAzure.Storage.Blob.CloudBlockBlob' Microsoft.WindowsAzure.Storage.Blob.CloudPageBlob,Microsoft.WindowsAzure.Storage.Blob.SharedAccessBlobPolicy' Microsoft.WindowsAzure.Storage.Core.Util.CommonUtility' Microsoft.WindowsAzure.Storage.Shared.Protocol.Constants' Microsoft.WindowsAzure.Storage.Shared.Protocol.HttpResponseParsers' Microsoft.WindowsAzure.Storage.Shared.Protocol.ServiceProperties' Microsoft.WindowsAzure.Storage.Shared.Protocol.ServiceStats' Microsoft.WindowsAzure.Storage.Blob.LeaseStatus' Microsoft.WindowsAzure.Storage.Core.SR' Microsoft.WindowsAzure.Storage.Blob.LeaseState' Microsoft.WindowsAzure.Storage.Blob.LeaseDuration' Microsoft.WindowsAzure.Storage.Blob.CopyState' Microsoft.WindowsAzure.Storage.Blob.CopyStatus' Microsoft.WindowsAzure.Storage.Shared.Protocol.HeaderConstants' Microsoft.WindowsAzure.Storage.Blob.BlobType' Microsoft.WindowsAzure.Storage.Blob.BlobProperties' Microsoft.WindowsAzure.Storage.Core.Util.HttpWebUtility' Microsoft.WindowsAzure.Storage.Blob.BlobListingDetails' Microsoft.WindowsAzure.Storage.Shared.Protocol.Request' Microsoft.WindowsAzure.Storage.Core.Auth.SharedAccessSignatureHelper' Microsoft.WindowsAzure.Storage.Blob.SharedAccessBlobPolicies' Microsoft.WindowsAzure.Storage.Blob.BlockSearchMode' Microsoft.WindowsAzure.Storage.Shared.Protocol.Response' Microsoft.WindowsAzure.Storage.Blob.BlobContainerPermissions' Microsoft.WindowsAzure.Storage.Blob.BlobContainerPublicAccessType' Microsoft.WindowsAzure.Storage.Blob.BlobContainerProperties' Microsoft.WindowsAzure.Storage.Blob.ListBlockItem' Microsoft.WindowsAzure.Storage.Blob.PageDiffRange' Microsoft.WindowsAzure.Storage.Blob.PageRange' Microsoft.WindowsAzure.Storage.Blob.BlobAttributes' Microsoft.WindowsAzure.Storage.Core.UriQueryBuilder' Microsoft.WindowsAzure.Storage.Core.Util.NavigationHelper' Microsoft.WindowsAzure.Storage.Core.StorageRequestMessage' Microsoft.WindowsAzure.Storage.Shared.Protocol.QueryConstants' Microsoft.WindowsAzure.Storage.Shared.Protocol.HttpRequestMessageFactory' Microsoft.WindowsAzure.Storage.AccessCondition' Microsoft.WindowsAzure.Storage.OperationContext' Microsoft.WindowsAzure.Storage.Core.Auth.ICanonicalizer' Microsoft.WindowsAzure.Storage.Auth.StorageCredentials' Microsoft.WindowsAzure.Storage.Blob.SequenceNumberAction' Microsoft.WindowsAzure.Storage.Blob.DeleteSnapshotsOption' Microsoft.WindowsAzure.Storage.Blob.LeaseAction' Microsoft.WindowsAzure.Storage.Blob.BlockListingFilter' Microsoft.WindowsAzure.Storage.Shared.Protocol.ListingContext' Microsoft.WindowsAzure.Storage.Blob.ContainerListingDetails
Microsoft.WindowsAzure.Storage,Microsoft.WindowsAzure.Storage.Core.Auth,Microsoft.WindowsAzure.Storage.CloudStorageAccount' Microsoft.WindowsAzure.Storage.Blob.CloudBlob' Microsoft.WindowsAzure.Storage.Blob.CloudBlobContainer' Microsoft.WindowsAzure.Storage.Blob.Protocol.BlobRequest' Microsoft.WindowsAzure.Storage.Core.Util.NavigationHelper' Microsoft.WindowsAzure.Storage.Queue.CloudQueue' Microsoft.WindowsAzure.Storage.Queue.Protocol.QueueRequest' Microsoft.WindowsAzure.Storage.Table.CloudTable' Microsoft.WindowsAzure.Storage.Table.Protocol.TableRequest' Microsoft.WindowsAzure.Storage.Blob.Protocol.BlobHttpRequestMessageFactory' Microsoft.WindowsAzure.Storage.Blob.Protocol.ContainerHttpRequestMessageFactory' Microsoft.WindowsAzure.Storage.Core.StorageRequestMessage' Microsoft.WindowsAzure.Storage.Queue.Protocol.QueueHttpRequestMessageFactory' Microsoft.WindowsAzure.Storage.Shared.Protocol.HttpRequestMessageFactory' Microsoft.WindowsAzure.Storage.Table.Protocol.TableHttpRequestMessageFactory' Microsoft.WindowsAzure.Storage.Table.Protocol.TableOperationHttpRequestMessageFactory' Microsoft.WindowsAzure.Storage.Blob.CloudBlobClient' Microsoft.WindowsAzure.Storage.Queue.CloudQueueClient' Microsoft.WindowsAzure.Storage.Table.CloudTableClient,Microsoft.WindowsAzure.Storage.Core.UriQueryBuilder' Microsoft.WindowsAzure.Storage.Core.Util.CommonUtility' Microsoft.WindowsAzure.Storage.Shared.Protocol.QueryConstants' Microsoft.WindowsAzure.Storage.Shared.Protocol.Constants' Microsoft.WindowsAzure.Storage.IPAddressOrRange' Microsoft.WindowsAzure.Storage.Blob.SharedAccessBlobPolicy' Microsoft.WindowsAzure.Storage.Blob.SharedAccessBlobHeaders' Microsoft.WindowsAzure.Storage.Queue.SharedAccessQueuePolicy' Microsoft.WindowsAzure.Storage.Table.SharedAccessTablePolicy' Microsoft.WindowsAzure.Storage.SharedAccessAccountPolicy' Microsoft.WindowsAzure.Storage.SharedAccessProtocol' Microsoft.WindowsAzure.Storage.Core.SR' Microsoft.WindowsAzure.Storage.Auth.StorageCredentials' Microsoft.WindowsAzure.Storage.Core.Logger' Microsoft.WindowsAzure.Storage.Core.CanonicalizedString' Microsoft.WindowsAzure.Storage.Core.Util.HttpWebUtility' Microsoft.WindowsAzure.Storage.Core.Util.AuthenticationUtility
Microsoft.WindowsAzure.Storage,Microsoft.WindowsAzure.Storage.Core,Microsoft.WindowsAzure.Storage.Core.Auth.SharedKeyCanonicalizer' Microsoft.WindowsAzure.Storage.Core.Auth.SharedKeyLiteCanonicalizer' Microsoft.WindowsAzure.Storage.Core.Auth.SharedKeyLiteTableCanonicalizer' Microsoft.WindowsAzure.Storage.Core.Auth.SharedKeyTableCanonicalizer' Microsoft.WindowsAzure.Storage.Core.Util.AuthenticationUtility' Microsoft.WindowsAzure.Storage.Blob.CloudBlob' Microsoft.WindowsAzure.Storage.Blob.CloudBlobClient' Microsoft.WindowsAzure.Storage.Blob.CloudBlobContainer' Microsoft.WindowsAzure.Storage.Blob.CloudBlockBlob' Microsoft.WindowsAzure.Storage.Blob.CloudPageBlob' Microsoft.WindowsAzure.Storage.Core.Executor.ExecutorBase' Microsoft.WindowsAzure.Storage.Core.Executor.RESTCommand<T>' Microsoft.WindowsAzure.Storage.Core.Util.CommonUtility' Microsoft.WindowsAzure.Storage.Queue.CloudQueue' Microsoft.WindowsAzure.Storage.Queue.CloudQueueClient' Microsoft.WindowsAzure.Storage.Table.CloudTable' Microsoft.WindowsAzure.Storage.Table.CloudTableClient' Microsoft.WindowsAzure.Storage.Table.TableBatchOperation' Microsoft.WindowsAzure.Storage.Table.TableOperation' Microsoft.WindowsAzure.Storage.Blob.BlobWriteStream' Microsoft.WindowsAzure.Storage.Core.Auth.SharedAccessSignatureHelper' Microsoft.WindowsAzure.Storage.Core.Executor.ExecutionState<T>' Microsoft.WindowsAzure.Storage.Core.Executor.Executor' Microsoft.WindowsAzure.Storage.Table.EntityPropertyConverter' Microsoft.WindowsAzure.Storage.Table.TableEntity' Microsoft.WindowsAzure.Storage.Table.Protocol.TableOperationHttpRequestMessageFactory' Microsoft.WindowsAzure.Storage.Table.Protocol.TableOperationHttpResponseParsers' Microsoft.WindowsAzure.Storage.Blob.BlobReadStreamBase' Microsoft.WindowsAzure.Storage.Blob.BlobWriteStreamBase' Microsoft.WindowsAzure.Storage.Blob.BlobReadStream' Microsoft.WindowsAzure.Storage.Table.Protocol.HttpRequestAdapterMessage' Microsoft.WindowsAzure.Storage.Blob.CloudAppendBlob' Microsoft.WindowsAzure.Storage.Auth.StorageCredentials' Microsoft.WindowsAzure.Storage.CloudStorageAccount' Microsoft.WindowsAzure.Storage.NameValidator' Microsoft.WindowsAzure.Storage.RequestResult' Microsoft.WindowsAzure.Storage.StorageUri' Microsoft.WindowsAzure.Storage.Blob.BlobAttributes' Microsoft.WindowsAzure.Storage.Blob.BlobRequestOptions' Microsoft.WindowsAzure.Storage.Blob.Protocol.BlobHttpResponseParsers' Microsoft.WindowsAzure.Storage.Blob.Protocol.BlobHttpRequestMessageFactory' Microsoft.WindowsAzure.Storage.Core.Util.Exceptions' Microsoft.WindowsAzure.Storage.Core.Util.NavigationHelper' Microsoft.WindowsAzure.Storage.Core.Util.StreamExtensions' Microsoft.WindowsAzure.Storage.Queue.CloudQueueMessage' Microsoft.WindowsAzure.Storage.Queue.QueueRequestOptions' Microsoft.WindowsAzure.Storage.RetryPolicies.ExponentialRetry' Microsoft.WindowsAzure.Storage.RetryPolicies.LinearRetry' Microsoft.WindowsAzure.Storage.Shared.Protocol.GeoReplicationStats' Microsoft.WindowsAzure.Storage.Shared.Protocol.HttpResponseParsers' Microsoft.WindowsAzure.Storage.Shared.Protocol.Request' Microsoft.WindowsAzure.Storage.Shared.Protocol.ServiceProperties' Microsoft.WindowsAzure.Storage.Shared.Protocol.HttpRequestMessageFactory' Microsoft.WindowsAzure.Storage.Shared.Protocol.RequestMessageExtensions' Microsoft.WindowsAzure.Storage.Table.TableQueryProvider' Microsoft.WindowsAzure.Storage.Table.TableRequestOptions' Microsoft.WindowsAzure.Storage.Blob.Protocol.ListBlobsResponse' Microsoft.WindowsAzure.Storage.Blob.Protocol.ContainerHttpRequestMessageFactory' Microsoft.WindowsAzure.Storage.Queue.Protocol.QueueHttpRequestMessageFactory' Microsoft.WindowsAzure.Storage.Table.TableContinuationToken' Microsoft.WindowsAzure.Storage.Table.TableQuery' Microsoft.WindowsAzure.Storage.Table.TableQuery<TElement>' Microsoft.WindowsAzure.Storage.Table.Protocol.TableHttpRequestMessageFactory' Microsoft.WindowsAzure.Storage.Auth.Protocol.StorageAuthenticationHttpHandler,Microsoft.WindowsAzure.Storage.OperationContext' Microsoft.WindowsAzure.Storage.LogLevel' Microsoft.WindowsAzure.Storage.IBufferManager' Microsoft.WindowsAzure.Storage.Core.Util.CommonUtility' Microsoft.WindowsAzure.Storage.Core.Util.MD5Wrapper' Microsoft.WindowsAzure.Storage.Core.Util.HttpWebUtility' Microsoft.WindowsAzure.Storage.Shared.Protocol.QueryConstants' Microsoft.WindowsAzure.Storage.Shared.Protocol.Constants' Microsoft.WindowsAzure.Storage.StorageUri' Microsoft.WindowsAzure.Storage.Core.Auth.ICanonicalizer' Microsoft.WindowsAzure.Storage.Auth.StorageCredentials
Microsoft.WindowsAzure.Storage,Microsoft.WindowsAzure.Storage.Core.Executor,Microsoft.WindowsAzure.Storage.Blob.CloudAppendBlob' Microsoft.WindowsAzure.Storage.Blob.CloudBlob' Microsoft.WindowsAzure.Storage.Blob.CloudBlobClient' Microsoft.WindowsAzure.Storage.Blob.CloudBlobContainer' Microsoft.WindowsAzure.Storage.Blob.CloudBlockBlob' Microsoft.WindowsAzure.Storage.Blob.CloudPageBlob' Microsoft.WindowsAzure.Storage.Queue.CloudQueue' Microsoft.WindowsAzure.Storage.Queue.CloudQueueClient' Microsoft.WindowsAzure.Storage.Table.CloudTable' Microsoft.WindowsAzure.Storage.Table.CloudTableClient' Microsoft.WindowsAzure.Storage.Table.TableBatchOperation' Microsoft.WindowsAzure.Storage.Table.TableOperation' Microsoft.WindowsAzure.Storage.Table.TableQuery' Microsoft.WindowsAzure.Storage.Table.TableQuery<TElement>,Microsoft.WindowsAzure.Storage.RetryPolicies.IRetryPolicy' Microsoft.WindowsAzure.Storage.OperationContext' Microsoft.WindowsAzure.Storage.Core.Logger' Microsoft.WindowsAzure.Storage.Core.SR' Microsoft.WindowsAzure.Storage.RetryPolicies.LocationMode' Microsoft.WindowsAzure.Storage.StorageLocation' Microsoft.WindowsAzure.Storage.Core.Util.CommonUtility' Microsoft.WindowsAzure.Storage.Shared.Protocol.HeaderConstants' Microsoft.WindowsAzure.Storage.Shared.Protocol.Constants' Microsoft.WindowsAzure.Storage.StorageUri' Microsoft.WindowsAzure.Storage.Core.CommandLocationMode' Microsoft.WindowsAzure.Storage.RequestResult' Microsoft.WindowsAzure.Storage.RequestEventArgs' Microsoft.WindowsAzure.Storage.StorageException' Microsoft.WindowsAzure.Storage.Core.Util.Exceptions' Microsoft.WindowsAzure.Storage.Auth.StorageCredentials' Microsoft.WindowsAzure.Storage.Core.UriQueryBuilder' Microsoft.WindowsAzure.Storage.Core.Util.StreamDescriptor' Microsoft.WindowsAzure.Storage.RetryPolicies.IExtendedRetryPolicy' Microsoft.WindowsAzure.Storage.RetryPolicies.RetryContext' Microsoft.WindowsAzure.Storage.RetryPolicies.RetryInfo' Microsoft.WindowsAzure.Storage.Shared.Protocol.HttpClientFactory
