Project,Namespace,Ca types,Ce types
Microsoft.WindowsAzure.Storage,Microsoft.WindowsAzure.Storage.Core.Util,Microsoft.WindowsAzure.Storage.Blob.BlobWriteStreamBase' Microsoft.WindowsAzure.Storage.Blob.BlobWriteStream' Microsoft.WindowsAzure.Storage.Core.Auth.SharedKeyCanonicalizer' Microsoft.WindowsAzure.Storage.Core.Auth.SharedKeyLiteCanonicalizer' Microsoft.WindowsAzure.Storage.Core.Auth.SharedKeyLiteTableCanonicalizer' Microsoft.WindowsAzure.Storage.Core.Auth.SharedKeyTableCanonicalizer' Microsoft.WindowsAzure.Storage.CloudStorageAccount' Microsoft.WindowsAzure.Storage.IPAddressOrRange' Microsoft.WindowsAzure.Storage.RequestResult' Microsoft.WindowsAzure.Storage.StorageException' Microsoft.WindowsAzure.Storage.StorageExtendedErrorInformation' Microsoft.WindowsAzure.Storage.StorageUri' Microsoft.WindowsAzure.Storage.ExceptionInfo' Microsoft.WindowsAzure.Storage.Auth.StorageCredentials' Microsoft.WindowsAzure.Storage.Blob.BlobProperties' Microsoft.WindowsAzure.Storage.Blob.BlobReadStreamBase' Microsoft.WindowsAzure.Storage.Blob.CloudAppendBlob' Microsoft.WindowsAzure.Storage.Blob.CloudBlob' Microsoft.WindowsAzure.Storage.Blob.CloudBlobClient' Microsoft.WindowsAzure.Storage.Blob.CloudBlobContainer' Microsoft.WindowsAzure.Storage.Blob.CloudBlobDirectory' Microsoft.WindowsAzure.Storage.Blob.CloudBlockBlob' Microsoft.WindowsAzure.Storage.Blob.CloudPageBlob' Microsoft.WindowsAzure.Storage.Blob.SharedAccessBlobHeaders' Microsoft.WindowsAzure.Storage.Blob.SharedAccessBlobPolicies' Microsoft.WindowsAzure.Storage.Blob.SharedAccessBlobPolicy' Microsoft.WindowsAzure.Storage.Blob.BlobReadStream' Microsoft.WindowsAzure.Storage.Blob.Protocol.BlobAccessPolicyResponse' Microsoft.WindowsAzure.Storage.Blob.Protocol.BlobRequest' Microsoft.WindowsAzure.Storage.Blob.Protocol.ContainerHttpResponseParsers' Microsoft.WindowsAzure.Storage.Blob.Protocol.BlobHttpRequestMessageFactory' Microsoft.WindowsAzure.Storage.Core.Auth.SharedAccessSignatureHelper' Microsoft.WindowsAzure.Storage.Core.MultiBufferMemoryStream' Microsoft.WindowsAzure.Storage.Core.SasQueryBuilder' Microsoft.WindowsAzure.Storage.Core.SyncMemoryStream' Microsoft.WindowsAzure.Storage.Core.UriQueryBuilder' Microsoft.WindowsAzure.Storage.Core.Executor.ExecutionState<T>' Microsoft.WindowsAzure.Storage.Core.Executor.ExecutorBase' Microsoft.WindowsAzure.Storage.Queue.CloudQueue' Microsoft.WindowsAzure.Storage.Queue.CloudQueueClient' Microsoft.WindowsAzure.Storage.Queue.SharedAccessQueuePolicies' Microsoft.WindowsAzure.Storage.Queue.SharedAccessQueuePolicy' Microsoft.WindowsAzure.Storage.Queue.Protocol.QueueAccessPolicyResponse' Microsoft.WindowsAzure.Storage.Queue.Protocol.QueueHttpResponseParsers' Microsoft.WindowsAzure.Storage.Queue.Protocol.QueueRequest' Microsoft.WindowsAzure.Storage.RetryPolicies.ExponentialRetry' Microsoft.WindowsAzure.Storage.RetryPolicies.LinearRetry' Microsoft.WindowsAzure.Storage.RetryPolicies.RetryInfo' Microsoft.WindowsAzure.Storage.Shared.Protocol.Request' Microsoft.WindowsAzure.Storage.Shared.Protocol.ServiceProperties' Microsoft.WindowsAzure.Storage.Shared.Protocol.HttpRequestMessageFactory' Microsoft.WindowsAzure.Storage.Table.CloudTable' Microsoft.WindowsAzure.Storage.Table.CloudTableClient' Microsoft.WindowsAzure.Storage.Table.DynamicTableEntity' Microsoft.WindowsAzure.Storage.Table.SharedAccessTablePolicies' Microsoft.WindowsAzure.Storage.Table.SharedAccessTablePolicy' Microsoft.WindowsAzure.Storage.Table.TableBatchOperation' Microsoft.WindowsAzure.Storage.Table.TableStorageModel' Microsoft.WindowsAzure.Storage.Table.TableEntity' Microsoft.WindowsAzure.Storage.Table.TableOperation' Microsoft.WindowsAzure.Storage.Table.TableQuery' Microsoft.WindowsAzure.Storage.Table.TableQuery<TElement>' Microsoft.WindowsAzure.Storage.Table.TableQueryProvider' Microsoft.WindowsAzure.Storage.Table.Protocol.TableAccessPolicyResponse' Microsoft.WindowsAzure.Storage.Core.Executor.Executor' Microsoft.WindowsAzure.Storage.Blob.Protocol.BlobHttpResponseParsers' Microsoft.WindowsAzure.Storage.Shared.Protocol.RequestMessageExtensions' Microsoft.WindowsAzure.Storage.Blob.Protocol.ListBlobsResponse' Microsoft.WindowsAzure.Storage.Blob.Protocol.ListContainersResponse' Microsoft.WindowsAzure.Storage.Queue.Protocol.ListQueuesResponse' Microsoft.WindowsAzure.Storage.Table.Protocol.TableOperationHttpRequestMessageFactory' Microsoft.WindowsAzure.Storage.Core.Executor.StorageCommandBase<T>' Microsoft.WindowsAzure.Storage.Shared.Protocol.HttpResponseParsers,Microsoft.WindowsAzure.Storage.Shared.Protocol.HeaderConstants' Microsoft.WindowsAzure.Storage.Shared.Protocol.Constants' Microsoft.WindowsAzure.Storage.Core.CanonicalizedString' Microsoft.WindowsAzure.Storage.CloudStorageAccount' Microsoft.WindowsAzure.Storage.IContinuationToken' Microsoft.WindowsAzure.Storage.StorageLocation' Microsoft.WindowsAzure.Storage.Core.CommandLocationMode' Microsoft.WindowsAzure.Storage.Blob.BlobRequestOptions' Microsoft.WindowsAzure.Storage.Core.SR' Microsoft.WindowsAzure.Storage.RequestResult' Microsoft.WindowsAzure.Storage.StorageException' Microsoft.WindowsAzure.Storage.StorageUri' Microsoft.WindowsAzure.Storage.Auth.StorageCredentials' Microsoft.WindowsAzure.Storage.Shared.Protocol.QueryConstants' Microsoft.WindowsAzure.Storage.Core.Auth.SharedAccessSignatureHelper
Microsoft.WindowsAzure.Storage,Microsoft.WindowsAzure.Storage.Queue,DataStorageQueueSample.Program' Microsoft.WindowsAzure.Storage.CloudStorageAccount' Microsoft.WindowsAzure.Storage.Queue.Protocol.QueueRequest' Microsoft.WindowsAzure.Storage.Core.Auth.SharedAccessSignatureHelper' Microsoft.WindowsAzure.Storage.Queue.Protocol.QueueAccessPolicyResponse,Microsoft.WindowsAzure.Storage.StorageUri' Microsoft.WindowsAzure.Storage.Auth.StorageCredentials' Microsoft.WindowsAzure.Storage.Core.Util.NavigationHelper' Microsoft.WindowsAzure.Storage.Shared.Protocol.Constants' Microsoft.WindowsAzure.Storage.Core.SR' Microsoft.WindowsAzure.Storage.Queue.Protocol.QueueMessage' Microsoft.WindowsAzure.Storage.Auth.StorageAccountKey' Microsoft.WindowsAzure.Storage.Core.UriQueryBuilder' Microsoft.WindowsAzure.Storage.Core.Auth.SharedAccessSignatureHelper' Microsoft.WindowsAzure.Storage.Shared.Protocol.HeaderConstants' Microsoft.WindowsAzure.Storage.IPAddressOrRange' Microsoft.WindowsAzure.Storage.OperationContext' Microsoft.WindowsAzure.Storage.Core.Executor.Executor' Microsoft.WindowsAzure.Storage.StorageExtendedErrorInformation' Microsoft.WindowsAzure.Storage.RequestResult' Microsoft.WindowsAzure.Storage.Queue.Protocol.QueueErrorCodeStrings' Microsoft.WindowsAzure.Storage.StorageException' Microsoft.WindowsAzure.Storage.Queue.Protocol.QueuePermissions' Microsoft.WindowsAzure.Storage.Core.StorageRequestMessage' Microsoft.WindowsAzure.Storage.Queue.Protocol.QueueHttpRequestMessageFactory' Microsoft.WindowsAzure.Storage.Shared.Protocol.HttpResponseParsers' Microsoft.WindowsAzure.Storage.Core.NullType' Microsoft.WindowsAzure.Storage.Core.CommandLocationMode' Microsoft.WindowsAzure.Storage.Core.MultiBufferMemoryStream' Microsoft.WindowsAzure.Storage.Queue.Protocol.QueueRequest' Microsoft.WindowsAzure.Storage.Shared.Protocol.HttpContentFactory' Microsoft.WindowsAzure.Storage.Queue.Protocol.QueueHttpResponseParsers' Microsoft.WindowsAzure.Storage.Queue.Protocol.GetMessagesResponse' Microsoft.WindowsAzure.Storage.Core.Util.CommonUtility' Microsoft.WindowsAzure.Storage.AuthenticationScheme' Microsoft.WindowsAzure.Storage.Core.Auth.SharedKeyLiteCanonicalizer' Microsoft.WindowsAzure.Storage.Core.Auth.SharedKeyCanonicalizer' Microsoft.WindowsAzure.Storage.Queue.Protocol.QueueListingDetails' Microsoft.WindowsAzure.Storage.Shared.Protocol.ListingContext' Microsoft.WindowsAzure.Storage.Queue.Protocol.ListQueuesResponse' Microsoft.WindowsAzure.Storage.Queue.Protocol.QueueEntry' Microsoft.WindowsAzure.Storage.Shared.Protocol.ServiceProperties' Microsoft.WindowsAzure.Storage.RetryPolicies.LocationMode
Microsoft.WindowsAzure.Storage,Microsoft.WindowsAzure.Storage.Queue.Protocol,Microsoft.WindowsAzure.Storage.Queue.CloudQueue' Microsoft.WindowsAzure.Storage.Queue.CloudQueueClient,Microsoft.WindowsAzure.Storage.Shared.Protocol.Constants' Microsoft.WindowsAzure.Storage.Shared.Protocol.Response' Microsoft.WindowsAzure.Storage.Core.Util.NavigationHelper' Microsoft.WindowsAzure.Storage.Queue.SharedAccessQueuePolicy' Microsoft.WindowsAzure.Storage.Core.Util.CommonUtility' Microsoft.WindowsAzure.Storage.Shared.Protocol.HttpResponseParsers' Microsoft.WindowsAzure.Storage.Shared.Protocol.ServiceProperties' Microsoft.WindowsAzure.Storage.Shared.Protocol.ServiceStats' Microsoft.WindowsAzure.Storage.Shared.Protocol.HeaderConstants' Microsoft.WindowsAzure.Storage.Shared.Protocol.Request' Microsoft.WindowsAzure.Storage.Core.Auth.SharedAccessSignatureHelper' Microsoft.WindowsAzure.Storage.Queue.SharedAccessQueuePolicies' Microsoft.WindowsAzure.Storage.Shared.Protocol.HttpRequestMessageFactory' Microsoft.WindowsAzure.Storage.Core.StorageRequestMessage' Microsoft.WindowsAzure.Storage.OperationContext' Microsoft.WindowsAzure.Storage.Core.Auth.ICanonicalizer' Microsoft.WindowsAzure.Storage.Auth.StorageCredentials' Microsoft.WindowsAzure.Storage.Core.UriQueryBuilder' Microsoft.WindowsAzure.Storage.Shared.Protocol.QueryConstants' Microsoft.WindowsAzure.Storage.Shared.Protocol.ListingContext
Microsoft.WindowsAzure.Storage,Microsoft.WindowsAzure.Storage.RetryPolicies,Microsoft.WindowsAzure.Storage.Core.Executor.Executor' Microsoft.WindowsAzure.Storage.Core.Executor.ExecutionState<T>' Microsoft.WindowsAzure.Storage.StorageUri' Microsoft.WindowsAzure.Storage.Blob.CloudBlobClient' Microsoft.WindowsAzure.Storage.Core.Executor.ExecutorBase' Microsoft.WindowsAzure.Storage.Core.Executor.RESTCommand<T>' Microsoft.WindowsAzure.Storage.Queue.CloudQueueClient' Microsoft.WindowsAzure.Storage.Table.CloudTableClient,Microsoft.WindowsAzure.Storage.Core.Util.CommonUtility' Microsoft.WindowsAzure.Storage.Core.SR' Microsoft.WindowsAzure.Storage.OperationContext' Microsoft.WindowsAzure.Storage.RequestResult' Microsoft.WindowsAzure.Storage.StorageLocation
Microsoft.WindowsAzure.Storage,Microsoft.WindowsAzure.Storage.Shared.Protocol,Microsoft.WindowsAzure.Storage.CloudStorageAccount' Microsoft.WindowsAzure.Storage.RequestResult' Microsoft.WindowsAzure.Storage.StorageExtendedErrorInformation' Microsoft.WindowsAzure.Storage.Auth.StorageCredentials' Microsoft.WindowsAzure.Storage.Blob.BlobReadStreamBase' Microsoft.WindowsAzure.Storage.Blob.BlobWriteStreamBase' Microsoft.WindowsAzure.Storage.Blob.CloudAppendBlob' Microsoft.WindowsAzure.Storage.Blob.CloudBlob' Microsoft.WindowsAzure.Storage.Blob.CloudBlobClient' Microsoft.WindowsAzure.Storage.Blob.CloudBlobContainer' Microsoft.WindowsAzure.Storage.Blob.CloudBlockBlob' Microsoft.WindowsAzure.Storage.Blob.CloudPageBlob' Microsoft.WindowsAzure.Storage.Blob.BlobWriteStream' Microsoft.WindowsAzure.Storage.Blob.Protocol.BlobAccessPolicyResponse' Microsoft.WindowsAzure.Storage.Blob.Protocol.BlobHttpResponseParsers' Microsoft.WindowsAzure.Storage.Blob.Protocol.BlobRequest' Microsoft.WindowsAzure.Storage.Blob.Protocol.ContainerHttpResponseParsers' Microsoft.WindowsAzure.Storage.Blob.Protocol.GetBlockListResponse' Microsoft.WindowsAzure.Storage.Blob.Protocol.GetPageDiffRangesResponse' Microsoft.WindowsAzure.Storage.Blob.Protocol.GetPageRangesResponse' Microsoft.WindowsAzure.Storage.Blob.Protocol.ListBlobsResponse' Microsoft.WindowsAzure.Storage.Blob.Protocol.ListContainersResponse' Microsoft.WindowsAzure.Storage.Blob.Protocol.BlobHttpRequestMessageFactory' Microsoft.WindowsAzure.Storage.Blob.Protocol.ContainerHttpRequestMessageFactory' Microsoft.WindowsAzure.Storage.Core.Auth.SharedAccessSignatureHelper' Microsoft.WindowsAzure.Storage.Core.SasQueryBuilder' Microsoft.WindowsAzure.Storage.Core.Executor.ExecutorBase' Microsoft.WindowsAzure.Storage.Core.Executor.Executor' Microsoft.WindowsAzure.Storage.Core.Util.AuthenticationUtility' Microsoft.WindowsAzure.Storage.Core.Util.NavigationHelper' Microsoft.WindowsAzure.Storage.Core.Util.StreamExtensions' Microsoft.WindowsAzure.Storage.Queue.CloudQueue' Microsoft.WindowsAzure.Storage.Queue.CloudQueueClient' Microsoft.WindowsAzure.Storage.Queue.Protocol.GetMessagesResponse' Microsoft.WindowsAzure.Storage.Queue.Protocol.ListQueuesResponse' Microsoft.WindowsAzure.Storage.Queue.Protocol.QueueAccessPolicyResponse' Microsoft.WindowsAzure.Storage.Queue.Protocol.QueueHttpResponseParsers' Microsoft.WindowsAzure.Storage.Queue.Protocol.QueueRequest' Microsoft.WindowsAzure.Storage.Queue.Protocol.QueueHttpRequestMessageFactory' Microsoft.WindowsAzure.Storage.Table.CloudTable' Microsoft.WindowsAzure.Storage.Table.CloudTableClient' Microsoft.WindowsAzure.Storage.Table.TableStorageModel' Microsoft.WindowsAzure.Storage.Table.TableStorageEntityContainer' Microsoft.WindowsAzure.Storage.Table.Protocol.TableAccessPolicyResponse' Microsoft.WindowsAzure.Storage.Table.Protocol.TableRequest' Microsoft.WindowsAzure.Storage.Table.Protocol.TableOperationHttpRequestMessageFactory' Microsoft.WindowsAzure.Storage.Table.Protocol.TableOperationHttpResponseParsers' Microsoft.WindowsAzure.Storage.Table.TableBatchOperation' Microsoft.WindowsAzure.Storage.Table.TableQuery' Microsoft.WindowsAzure.Storage.Table.TableQuery<TElement>' Microsoft.WindowsAzure.Storage.Table.Protocol.TableHttpRequestMessageFactory,Microsoft.WindowsAzure.Storage.Core.SR' Microsoft.WindowsAzure.Storage.Core.Util.StreamDescriptor' Microsoft.WindowsAzure.Storage.Core.Util.CommonUtility' Microsoft.WindowsAzure.Storage.OperationContext' Microsoft.WindowsAzure.Storage.Core.StorageRequestMessage' Microsoft.WindowsAzure.Storage.Core.UriQueryBuilder' Microsoft.WindowsAzure.Storage.Auth.StorageCredentials' Microsoft.WindowsAzure.Storage.Core.Auth.ICanonicalizer' Microsoft.WindowsAzure.Storage.AccessCondition' Microsoft.WindowsAzure.Storage.Core.Util.HttpWebUtility
Microsoft.WindowsAzure.Storage,Microsoft.WindowsAzure.Storage.Table,DataTableStorageSample.Program' Microsoft.WindowsAzure.Storage.CloudStorageAccount' Microsoft.WindowsAzure.Storage.Table.Protocol.TableOperationHttpRequestMessageFactory' Microsoft.WindowsAzure.Storage.Table.Protocol.TableOperationHttpResponseParsers' Microsoft.WindowsAzure.Storage.Table.Protocol.TableRequest' Microsoft.WindowsAzure.Storage.Core.Auth.SharedAccessSignatureHelper' Microsoft.WindowsAzure.Storage.Table.Protocol.TableAccessPolicyResponse' Microsoft.WindowsAzure.Storage.Table.DataServices.TableServiceQuery<TElement>,Microsoft.WindowsAzure.Storage.Auth.StorageCredentials' Microsoft.WindowsAzure.Storage.StorageUri' Microsoft.WindowsAzure.Storage.Core.Util.CommonUtility' Microsoft.WindowsAzure.Storage.Core.Util.NavigationHelper' Microsoft.WindowsAzure.Storage.Auth.StorageAccountKey' Microsoft.WindowsAzure.Storage.Core.UriQueryBuilder' Microsoft.WindowsAzure.Storage.Core.SR' Microsoft.WindowsAzure.Storage.Core.Auth.SharedAccessSignatureHelper' Microsoft.WindowsAzure.Storage.Shared.Protocol.HeaderConstants' Microsoft.WindowsAzure.Storage.Shared.Protocol.Constants' Microsoft.WindowsAzure.Storage.IPAddressOrRange' Microsoft.WindowsAzure.Storage.OperationContext' Microsoft.WindowsAzure.Storage.Table.Protocol.TableConstants' Microsoft.WindowsAzure.Storage.StorageExtendedErrorInformation' Microsoft.WindowsAzure.Storage.RequestResult' Microsoft.WindowsAzure.Storage.Table.Protocol.TableErrorCodeStrings' Microsoft.WindowsAzure.Storage.StorageException' Microsoft.WindowsAzure.Storage.Shared.Protocol.StorageErrorCodeStrings' Microsoft.WindowsAzure.Storage.Core.Executor.Executor' Microsoft.WindowsAzure.Storage.Core.MultiBufferMemoryStream' Microsoft.WindowsAzure.Storage.Table.Protocol.TableRequest' Microsoft.WindowsAzure.Storage.Table.Protocol.TableHttpRequestMessageFactory' Microsoft.WindowsAzure.Storage.Shared.Protocol.HttpContentFactory' Microsoft.WindowsAzure.Storage.Shared.Protocol.HttpResponseParsers' Microsoft.WindowsAzure.Storage.Core.NullType' Microsoft.WindowsAzure.Storage.Core.CommandLocationMode' Microsoft.WindowsAzure.Storage.AuthenticationScheme' Microsoft.WindowsAzure.Storage.Core.Auth.SharedKeyLiteTableCanonicalizer' Microsoft.WindowsAzure.Storage.Core.Auth.SharedKeyTableCanonicalizer' Microsoft.WindowsAzure.Storage.Shared.Protocol.ServiceProperties' Microsoft.WindowsAzure.Storage.RetryPolicies.LocationMode' Microsoft.WindowsAzure.Storage.Core.Logger' Microsoft.WindowsAzure.Storage.Table.Protocol.TableOperationHttpRequestMessageFactory' Microsoft.WindowsAzure.Storage.Table.Protocol.TableOperationHttpResponseParsers' Microsoft.WindowsAzure.Storage.IContinuationToken
Microsoft.WindowsAzure.Storage,Microsoft.WindowsAzure.Storage.Table.Protocol,Microsoft.WindowsAzure.Storage.Table.CloudTable' Microsoft.WindowsAzure.Storage.Table.CloudTableClient' Microsoft.WindowsAzure.Storage.Table.TableContinuationToken' Microsoft.WindowsAzure.Storage.Table.TableEntity' Microsoft.WindowsAzure.Storage.Table.TableOperation' Microsoft.WindowsAzure.Storage.Table.TableQuery' Microsoft.WindowsAzure.Storage.Table.TableQuery<TElement>' Microsoft.WindowsAzure.Storage.Table.TableBatchOperation,Microsoft.WindowsAzure.Storage.Table.SharedAccessTablePolicy' Microsoft.WindowsAzure.Storage.Core.Util.CommonUtility' Microsoft.WindowsAzure.Storage.Shared.Protocol.Constants' Microsoft.WindowsAzure.Storage.Shared.Protocol.Request' Microsoft.WindowsAzure.Storage.Core.Auth.SharedAccessSignatureHelper' Microsoft.WindowsAzure.Storage.Table.SharedAccessTablePolicies' Microsoft.WindowsAzure.Storage.RequestResult' Microsoft.WindowsAzure.Storage.StorageExtendedErrorInformation' Microsoft.WindowsAzure.Storage.Core.StorageRequestMessage' Microsoft.WindowsAzure.Storage.Core.MultiBufferMemoryStream' Microsoft.WindowsAzure.Storage.IBufferManager' Microsoft.WindowsAzure.Storage.Shared.Protocol.HttpRequestMessageFactory' Microsoft.WindowsAzure.Storage.OperationContext' Microsoft.WindowsAzure.Storage.Core.Auth.ICanonicalizer' Microsoft.WindowsAzure.Storage.Auth.StorageCredentials' Microsoft.WindowsAzure.Storage.Core.UriQueryBuilder' Microsoft.WindowsAzure.Storage.Core.Logger' Microsoft.WindowsAzure.Storage.Core.SR' Microsoft.WindowsAzure.Storage.Table.TablePayloadFormat' Microsoft.WindowsAzure.Storage.Table.TableOperation' Microsoft.WindowsAzure.Storage.Table.TableOperationType' Microsoft.WindowsAzure.Storage.Table.ITableEntity' Microsoft.WindowsAzure.Storage.Table.CloudTableClient' Microsoft.WindowsAzure.Storage.Shared.Protocol.HeaderConstants' Microsoft.WindowsAzure.Storage.Core.Util.NavigationHelper' Microsoft.WindowsAzure.Storage.Table.TableBatchOperation' Microsoft.WindowsAzure.Storage.Table.EntityProperty' Microsoft.WindowsAzure.Storage.Table.TableResult' Microsoft.WindowsAzure.Storage.Table.TableRequestOptions' Microsoft.WindowsAzure.Storage.Table.TableContinuationToken' Microsoft.WindowsAzure.Storage.Table.EntityReadFlags' Microsoft.WindowsAzure.Storage.Table.EdmType' Microsoft.WindowsAzure.Storage.Table.DynamicTableEntity
Microsoft.WindowsAzure.Storage,Microsoft.WindowsAzure.Storage.Auth.Protocol,,Microsoft.WindowsAzure.Storage.Core.StorageRequestMessage' Microsoft.WindowsAzure.Storage.Auth.StorageCredentials
