Project,Namespace,Ca types,Ce types
Newtonsoft.Json.Portable40,Newtonsoft.Json.Bson,Newtonsoft.Json.Converters.BsonObjectIdConverter' Newtonsoft.Json.Converters.RegexConverter,Newtonsoft.Json.Utilities.MathUtils' Newtonsoft.Json.Utilities.DateTimeUtils' Newtonsoft.Json.Utilities.ValidationUtils' Newtonsoft.Json.ReadType' Newtonsoft.Json.JsonReaderException' Newtonsoft.Json.JsonToken' Newtonsoft.Json.JsonReader' Newtonsoft.Json.State' Newtonsoft.Json.Serialization.JsonTypeReflector' Newtonsoft.Json.FloatParseHandling' Newtonsoft.Json.JsonWriter' Newtonsoft.Json.JsonWriterException
Newtonsoft.Json.Portable40,Newtonsoft.Json,Newtonsoft.Json.Serialization.JsonSerializerInternalReader' Newtonsoft.Json.Utilities.DateTimeUtils' Newtonsoft.Json.Schema.JsonSchemaGenerator' Newtonsoft.Json.Serialization.DefaultContractResolver' Newtonsoft.Json.Serialization.JsonSerializerInternalWriter' Newtonsoft.Json.Bson.BsonReader' Newtonsoft.Json.Linq.JToken' Newtonsoft.Json.Schema.JsonSchema' Newtonsoft.Json.Serialization.TraceJsonReader' Newtonsoft.Json.Serialization.TraceJsonWriter' Newtonsoft.Json.Linq.JContainer' Newtonsoft.Json.Linq.JTokenReader' Newtonsoft.Json.Serialization.JsonSerializerInternalBase' Newtonsoft.Json.Serialization.JsonContainerContract' Newtonsoft.Json.Linq.JArray' Newtonsoft.Json.Linq.JConstructor' Newtonsoft.Json.Linq.JObject' Newtonsoft.Json.Linq.JProperty' Newtonsoft.Json.Linq.JValue' Newtonsoft.Json.Serialization.JsonTypeReflector' Newtonsoft.Json.Schema.JsonSchemaBuilder' Newtonsoft.Json.Converters.BsonObjectIdConverter' Newtonsoft.Json.Converters.CustomCreationConverter<T>' Newtonsoft.Json.Converters.DiscriminatedUnionConverter' Newtonsoft.Json.Converters.IsoDateTimeConverter' Newtonsoft.Json.Converters.JavaScriptDateTimeConverter' Newtonsoft.Json.Converters.KeyValuePairConverter' Newtonsoft.Json.Converters.RegexConverter' Newtonsoft.Json.Converters.StringEnumConverter' Newtonsoft.Json.Converters.VersionConverter' Newtonsoft.Json.Linq.JRaw' Newtonsoft.Json.Serialization.JsonSerializerProxy' Newtonsoft.Json.Serialization.JsonContract' Newtonsoft.Json.Bson.BsonWriter' Newtonsoft.Json.Linq.JTokenWriter' Newtonsoft.Json.Utilities.JsonTokenUtils' Newtonsoft.Json.Schema.Extensions' Newtonsoft.Json.Schema.JsonSchemaWriter' Newtonsoft.Json.Serialization.JsonProperty' Newtonsoft.Json.Utilities.ReflectionUtils' Newtonsoft.Json.Utilities.JavaScriptUtils' Newtonsoft.Json.Serialization.ITraceWriter' Newtonsoft.Json.Serialization.MemoryTraceWriter,Newtonsoft.Json.Utilities.DateTimeUtils' Newtonsoft.Json.Utilities.StringUtils' Newtonsoft.Json.Utilities.JavaScriptUtils' Newtonsoft.Json.Utilities.PrimitiveTypeCode' Newtonsoft.Json.Utilities.ConvertUtils' Newtonsoft.Json.Utilities.ValidationUtils' Newtonsoft.Json.Utilities.JsonTokenUtils' Newtonsoft.Json.Serialization.JsonTypeReflector' System.Runtime.Serialization.Formatters.FormatterAssemblyStyle' Newtonsoft.Json.Serialization.IContractResolver' Newtonsoft.Json.Serialization.ITraceWriter' Newtonsoft.Json.Serialization.IReferenceResolver' Newtonsoft.Json.Serialization.DefaultSerializationBinder' Newtonsoft.Json.Serialization.DefaultContractResolver' Newtonsoft.Json.Utilities.CollectionUtils' Newtonsoft.Json.Serialization.TraceJsonReader' Newtonsoft.Json.Serialization.JsonSerializerInternalReader' Newtonsoft.Json.Serialization.DefaultContractResolverState' Newtonsoft.Json.Serialization.TraceJsonWriter' Newtonsoft.Json.Serialization.JsonSerializerInternalWriter' Newtonsoft.Json.Serialization.ErrorEventArgs' Newtonsoft.Json.Utilities.StringBuffer' Newtonsoft.Json.Utilities.StringReference' Newtonsoft.Json.Utilities.PropertyNameTable' Newtonsoft.Json.Utilities.ParseResult' Newtonsoft.Json.Utilities.Base64Encoder' Newtonsoft.Json.Utilities.MathUtils' Newtonsoft.Json.Schema.JsonSchema' Newtonsoft.Json.Schema.JsonSchemaModel' Newtonsoft.Json.Schema.JsonSchemaException' Newtonsoft.Json.Schema.JsonSchemaGenerator' Newtonsoft.Json.Schema.JsonSchemaType' Newtonsoft.Json.Schema.JsonSchemaModelBuilder' Newtonsoft.Json.Linq.JTokenType' Newtonsoft.Json.Linq.JToken' Newtonsoft.Json.Linq.JTokenWriter' Newtonsoft.Json.Linq.JValue' Newtonsoft.Json.Utilities.EnumUtils' Newtonsoft.Json.Utilities.MiscellaneousUtils' Newtonsoft.Json.Utilities.TypeInformation
Newtonsoft.Json.Portable40,Newtonsoft.Json.Converters,,Newtonsoft.Json.Bson.BsonObjectId' Newtonsoft.Json.Bson.BsonWriter' Newtonsoft.Json.JsonWriter' Newtonsoft.Json.JsonSerializer' Newtonsoft.Json.JsonReader' Newtonsoft.Json.JsonToken' Newtonsoft.Json.Utilities.FSharpUtils' Newtonsoft.Json.Serialization.DefaultContractResolver' Newtonsoft.Json.Utilities.FSharpFunction' Newtonsoft.Json.Linq.JArray' Newtonsoft.Json.Linq.JToken' Newtonsoft.Json.JsonSerializationException' Newtonsoft.Json.Utilities.ReflectionUtils' Newtonsoft.Json.Utilities.DateTimeUtils' Newtonsoft.Json.Utilities.ReflectionObject' Newtonsoft.Json.Utilities.EnumUtils' Newtonsoft.Json.Utilities.ConvertUtils' Newtonsoft.Json.Utilities.MiscellaneousUtils
Newtonsoft.Json.Portable40,System.Runtime.Serialization.Formatters,Newtonsoft.Json.JsonSerializer' Newtonsoft.Json.JsonSerializerSettings' Newtonsoft.Json.Utilities.ReflectionUtils,
Newtonsoft.Json.Portable40,Newtonsoft.Json.Linq,Newtonsoft.Json.Converters.DiscriminatedUnionConverter' Newtonsoft.Json.Linq.JsonPath.ArrayIndexFilter' Newtonsoft.Json.Linq.JsonPath.ArraySliceFilter' Newtonsoft.Json.Linq.JsonPath.PathFilter' Newtonsoft.Json.Linq.JsonPath.ScanFilter' Newtonsoft.Json.Linq.JsonPath.FieldFilter' Newtonsoft.Json.Linq.JsonPath.FieldMultipleFilter' Newtonsoft.Json.Schema.JsonSchemaBuilder' Newtonsoft.Json.Serialization.JsonSerializerInternalReader' Newtonsoft.Json.JsonValidatingReader' Newtonsoft.Json.Linq.JsonPath.ArrayMultipleIndexFilter' Newtonsoft.Json.Linq.JsonPath.JPath' Newtonsoft.Json.Linq.JsonPath.QueryExpression' Newtonsoft.Json.Linq.JsonPath.CompositeExpression' Newtonsoft.Json.Linq.JsonPath.BooleanQueryExpression' Newtonsoft.Json.Schema.Extensions' Newtonsoft.Json.Schema.JsonSchemaGenerator' Newtonsoft.Json.Schema.JsonSchemaModel' Newtonsoft.Json.Schema.JsonSchemaWriter' Newtonsoft.Json.Serialization.DefaultContractResolver' Newtonsoft.Json.Serialization.JsonSerializerInternalWriter' Newtonsoft.Json.SchemaScope,Newtonsoft.Json.Utilities.ValidationUtils' Newtonsoft.Json.Utilities.ReflectionUtils' Newtonsoft.Json.JsonReader' Newtonsoft.Json.JsonToken' Newtonsoft.Json.JsonReaderException' Newtonsoft.Json.JsonSerializer' Newtonsoft.Json.JsonWriter' Newtonsoft.Json.JsonConverter' Newtonsoft.Json.IJsonLineInfo' Newtonsoft.Json.JsonTextWriter' Newtonsoft.Json.Formatting' Newtonsoft.Json.Utilities.PrimitiveTypeCode' Newtonsoft.Json.JsonConvert' Newtonsoft.Json.Utilities.ConvertUtils' Newtonsoft.Json.Linq.JsonPath.JPath' Newtonsoft.Json.State' Newtonsoft.Json.ReadType' Newtonsoft.Json.Utilities.MiscellaneousUtils' Newtonsoft.Json.Utilities.DateTimeUtils' Newtonsoft.Json.Utilities.MathUtils
Newtonsoft.Json.Portable40,Newtonsoft.Json.Linq.JsonPath,Newtonsoft.Json.Linq.JToken,Newtonsoft.Json.Linq.JToken' Newtonsoft.Json.Linq.JArray' Newtonsoft.Json.Linq.JConstructor' Newtonsoft.Json.Linq.JObject' Newtonsoft.Json.Utilities.ValidationUtils' Newtonsoft.Json.Linq.JValue' Newtonsoft.Json.Linq.JProperty' Newtonsoft.Json.Linq.JContainer
Newtonsoft.Json.Portable40,Newtonsoft.Json.Schema,Newtonsoft.Json.JsonValidatingReader' Newtonsoft.Json.SchemaScope,Newtonsoft.Json.Linq.JToken' Newtonsoft.Json.Utilities.ValidationUtils' Newtonsoft.Json.JsonValidatingReader' Newtonsoft.Json.JsonReader' Newtonsoft.Json.JsonWriter' Newtonsoft.Json.JsonTextWriter' Newtonsoft.Json.Formatting' Newtonsoft.Json.Linq.JObject' Newtonsoft.Json.Linq.JTokenType' Newtonsoft.Json.JsonException' Newtonsoft.Json.Serialization.JsonTypeReflector' Newtonsoft.Json.Linq.JProperty' Newtonsoft.Json.Serialization.IContractResolver' Newtonsoft.Json.Required' Newtonsoft.Json.JsonContainerAttribute' Newtonsoft.Json.Serialization.JsonContract' Newtonsoft.Json.JsonConverter' Newtonsoft.Json.JsonArrayAttribute' Newtonsoft.Json.Serialization.JsonContractType' Newtonsoft.Json.Utilities.ReflectionUtils' Newtonsoft.Json.Utilities.EnumUtils' Newtonsoft.Json.DefaultValueHandling' Newtonsoft.Json.Serialization.JsonObjectContract' Newtonsoft.Json.Serialization.JsonProperty' Newtonsoft.Json.NullValueHandling' Newtonsoft.Json.Utilities.PrimitiveTypeCode' Newtonsoft.Json.Utilities.ConvertUtils' Newtonsoft.Json.Utilities.MathUtils
Newtonsoft.Json.Portable40,Newtonsoft.Json.Serialization,Newtonsoft.Json.JsonSerializer' Newtonsoft.Json.Converters.DiscriminatedUnionConverter' Newtonsoft.Json.Converters.KeyValuePairConverter' Newtonsoft.Json.Converters.RegexConverter' Newtonsoft.Json.Schema.JsonSchemaGenerator' Newtonsoft.Json.Bson.BsonReader' Newtonsoft.Json.JsonReader' Newtonsoft.Json.Schema.JsonSchemaBuilder' Newtonsoft.Json.Schema.JsonSchemaWriter' Newtonsoft.Json.Utilities.ConvertUtils' Newtonsoft.Json.Utilities.FSharpUtils' Newtonsoft.Json.Utilities.ReflectionObject,Newtonsoft.Json.Utilities.StringUtils' Newtonsoft.Json.Utilities.PropertyNameTable' Newtonsoft.Json.JsonConverter' Newtonsoft.Json.MemberSerialization' Newtonsoft.Json.Utilities.ReflectionUtils' Newtonsoft.Json.Utilities.MemberTypes' Newtonsoft.Json.JsonObjectAttribute' Newtonsoft.Json.JsonExtensionDataAttribute' Newtonsoft.Json.Linq.JToken' Newtonsoft.Json.Utilities.ReflectionDelegateFactory' Newtonsoft.Json.Linq.JValue' Newtonsoft.Json.JsonConstructorAttribute' Newtonsoft.Json.JsonContainerAttribute' Newtonsoft.Json.JsonSerializer' Newtonsoft.Json.Utilities.FSharpUtils' Newtonsoft.Json.Utilities.CollectionUtils' Newtonsoft.Json.JsonArrayAttribute' Newtonsoft.Json.JsonDictionaryAttribute' Newtonsoft.Json.Utilities.PrimitiveTypeCode' Newtonsoft.Json.Utilities.ConvertUtils' Newtonsoft.Json.JsonPropertyAttribute' Newtonsoft.Json.JsonRequiredAttribute' Newtonsoft.Json.Required' Newtonsoft.Json.DefaultValueHandling' Newtonsoft.Json.Utilities.ValidationUtils' Newtonsoft.Json.Utilities.ExpressionReflectionDelegateFactory' Newtonsoft.Json.TraceLevel' Newtonsoft.Json.Utilities.IWrappedCollection' Newtonsoft.Json.ReadType' Newtonsoft.Json.Utilities.IWrappedDictionary' Newtonsoft.Json.JsonWriter' Newtonsoft.Json.JsonPosition' Newtonsoft.Json.JsonException' Newtonsoft.Json.IJsonLineInfo' Newtonsoft.Json.JsonReader' Newtonsoft.Json.JsonToken' Newtonsoft.Json.JsonSerializationException' Newtonsoft.Json.MetadataPropertyHandling' Newtonsoft.Json.Linq.JRaw' Newtonsoft.Json.Linq.JTokenWriter' Newtonsoft.Json.Linq.JTokenReader' Newtonsoft.Json.Linq.JObject' Newtonsoft.Json.Linq.JTokenType' Newtonsoft.Json.TypeNameHandling' Newtonsoft.Json.SerializationBinder' Newtonsoft.Json.Utilities.MiscellaneousUtils' Newtonsoft.Json.ObjectCreationHandling' Newtonsoft.Json.NullValueHandling' Newtonsoft.Json.Utilities.JsonTokenUtils' Newtonsoft.Json.ConstructorHandling' Newtonsoft.Json.DateParseHandling' Newtonsoft.Json.Utilities.DateTimeUtils' Newtonsoft.Json.MissingMemberHandling' Newtonsoft.Json.JsonConverterCollection' Newtonsoft.Json.PreserveReferencesHandling' Newtonsoft.Json.ReferenceLoopHandling' Newtonsoft.Json.WriteState' Newtonsoft.Json.Utilities.ReflectionObject' Newtonsoft.Json.JsonConverterAttribute' Newtonsoft.Json.JsonTextWriter' Newtonsoft.Json.Formatting
Newtonsoft.Json.Portable40,Newtonsoft.Json.Utilities,Newtonsoft.Json.JsonTextWriter' Newtonsoft.Json.JsonSerializer' Newtonsoft.Json.Serialization.DefaultContractResolver' Newtonsoft.Json.Serialization.JsonArrayContract' Newtonsoft.Json.Serialization.JsonDictionaryContract' Newtonsoft.Json.Serialization.JsonSerializerInternalReader' Newtonsoft.Json.Serialization.JsonSerializerInternalWriter' Newtonsoft.Json.JsonConvert' Newtonsoft.Json.JsonWriter' Newtonsoft.Json.Linq.JToken' Newtonsoft.Json.Schema.JsonSchemaGenerator' Newtonsoft.Json.JsonTextReader' Newtonsoft.Json.JsonReader' Newtonsoft.Json.Converters.StringEnumConverter' Newtonsoft.Json.Serialization.JsonContract' Newtonsoft.Json.Serialization.JsonPrimitiveContract' Newtonsoft.Json.Bson.BsonBinaryWriter' Newtonsoft.Json.Bson.BsonReader' Newtonsoft.Json.Bson.BsonWriter' Newtonsoft.Json.Converters.JavaScriptDateTimeConverter' Newtonsoft.Json.Linq.JTokenWriter' Newtonsoft.Json.Schema.JsonSchemaWriter' Newtonsoft.Json.Serialization.ExpressionValueProvider' Newtonsoft.Json.Converters.DiscriminatedUnionConverter' Newtonsoft.Json.Converters.UnionCase' Newtonsoft.Json.JsonValidatingReader' Newtonsoft.Json.Linq.JValue' Newtonsoft.Json.Schema.JsonSchemaModel' Newtonsoft.Json.Linq.JTokenReader' Newtonsoft.Json.Serialization.DefaultContractResolverState' Newtonsoft.Json.Serialization.JsonTypeReflector' Newtonsoft.Json.Converters.KeyValuePairConverter' Newtonsoft.Json.Converters.IsoDateTimeConverter' Newtonsoft.Json.Linq.Extensions' Newtonsoft.Json.Serialization.JsonProperty' Newtonsoft.Json.Serialization.ReflectionAttributeProvider' Newtonsoft.Json.Serialization.ReflectionValueProvider' Newtonsoft.Json.Serialization.CamelCasePropertyNamesContractResolver' Newtonsoft.Json.Bson.BsonObjectId' Newtonsoft.Json.Linq.JConstructor' Newtonsoft.Json.Linq.JContainer' Newtonsoft.Json.Linq.JEnumerable' Newtonsoft.Json.Linq.JObject' Newtonsoft.Json.Linq.JProperty' Newtonsoft.Json.Linq.JsonPath.JPath' Newtonsoft.Json.Schema.Extensions' Newtonsoft.Json.Schema.JsonSchema' Newtonsoft.Json.Schema.TypeSchema' Newtonsoft.Json.Schema.ValidationEventArgs' Newtonsoft.Json.Serialization.DictionaryEnumerator' Newtonsoft.Json.Serialization.JsonPropertyCollection' Newtonsoft.Json.Serialization.JsonSerializerInternalBase' Newtonsoft.Json.Serialization.JsonSerializerProxy,Newtonsoft.Json.Serialization.JsonTypeReflector' Newtonsoft.Json.DateTimeZoneHandling' Newtonsoft.Json.DateParseHandling' Newtonsoft.Json.DateFormatHandling' Newtonsoft.Json.StringEscapeHandling' Newtonsoft.Json.JsonToken' Newtonsoft.Json.SerializationBinder' System.Runtime.Serialization.Formatters.FormatterAssemblyStyle
