Project,Namespace,Ca types,Ce types
OpenTween,OpenTween,OpenTween.Api.BitlyApi' OpenTween.Api.MicrosoftTranslatorApi' OpenTween.Connection.ImgurApi' OpenTween.Connection.MobypictureApi' OpenTween.Connection.TwitterApiConnection' OpenTween.Thumbnail.Services.FoursquareCheckin' OpenTween.Thumbnail.Services.Tinami' OpenTween.Thumbnail.Services.Tumblr' OpenTween.Setting.Panel.StartupPanel' OpenTween.Api.BitlyApiTest' OpenTween.Api.MicrosoftTranslatorApiTest' OpenTween.Thumbnail.Services.FoursquareCheckinTest' OpenTween.Thumbnail.Services.TumblrTest' OpenTween.Setting.Panel.SettingPanelBase' OpenTween.Setting.Panel.GetPeriodPanel' OpenTween.Setting.Panel.CooperatePanel' OpenTween.Setting.Panel.ShortUrlPanel' OpenTween.Api.TwitterApi' OpenTween.Connection.IMediaUploadService' OpenTween.Connection.Imgur' OpenTween.Connection.Mobypicture' OpenTween.Connection.TwitterPhoto' OpenTween.Connection.TwitterApiConnectionTest' OpenTween.Models.PostFilterRule' OpenTween.Connection.Networking' OpenTween.OpenTweenCustomControl.DetailsListView' OpenTween.Thumbnail.Services.Thumbnail' OpenTween.Thumbnail.ThumbnailInfo' OpenTween.Thumbnail.OSMThumbnailInfo' OpenTween.Setting.TestUtils' OpenTween.Setting.Panel.PreviewPanel' OpenTween.Models.ListTimelineTabModel' OpenTween.Api.TwitterApiStatus' OpenTween.Api.DataModel.TwitterConfiguration' OpenTween.Api.DataModel.TwitterError' OpenTween.Api.DataModel.TwitterFriendship' OpenTween.Api.DataModel.TwitterList' OpenTween.Api.DataModel.TwitterIds' OpenTween.Api.DataModel.TwitterUsers' OpenTween.Api.DataModel.TwitterLists' OpenTween.Api.DataModel.TwitterRateLimits' OpenTween.Api.DataModel.TwitterSearchResult' OpenTween.Api.DataModel.TwitterStatus' OpenTween.Api.DataModel.TwitterStatusCompat' OpenTween.Api.DataModel.TwitterDirectMessage' OpenTween.Api.DataModel.TwitterStreamEvent' OpenTween.Api.DataModel.TwitterStreamEvent<T>' OpenTween.Api.DataModel.TwitterStreamEventDirectMessage' OpenTween.Api.DataModel.TwitterTextConfiguration' OpenTween.Api.DataModel.TwitterUploadMediaResult' OpenTween.Api.DataModel.TwitterUser' OpenTween.Connection.LazyJson<T>' OpenTween.Connection.OAuthHandler' OpenTween.Connection.OAuthUtility' OpenTween.Models.DirectMessagesTabModel' OpenTween.Models.FilterTabModel' OpenTween.Models.PostClass' OpenTween.Models.TabModel' OpenTween.Models.TabInformations' OpenTween.Setting.Panel.ConnectionPanel' OpenTween.Setting.Panel.GetCountPanel' OpenTween.Setting.Panel.NotifyPanel' OpenTween.Setting.Panel.TweetPrvPanel' OpenTween.Api.TwitterApiTest' OpenTween.Connection.NetworkingTest' OpenTween.Models.PostFilterRuleTest' OpenTween.Models.TabInformationTest' OpenTween.Setting.Panel.EventCheckboxTblElement' OpenTween.Models.TabUsageTypeExt' OpenTween.Models.TabUsageTypeExtTest' OpenTween.Models.FavoritesTabModel' OpenTween.Models.HomeTabModel' OpenTween.Models.MentionsTabModel' OpenTween.Models.PublicSearchTabModel' OpenTween.Models.RelatedPostsTabModel' OpenTween.Models.UserTimelineTabModel' OpenTween.Setting.SettingManager' OpenTween.Setting.Panel.ActionPanel' OpenTween.Setting.Panel.BasedPanel' OpenTween.Setting.Panel.TweetActPanel' OpenTween.Thumbnail.MapThumbGoogle' OpenTween.Thumbnail.MapThumb' OpenTween.Thumbnail.MapThumbOSM' OpenTween.Setting.Panel.FontPanel' OpenTween.Setting.Panel.FontPanel2' OpenTween.Setting.Panel.ProxyPanel' OpenTween.Models.ExpandedUrlInfo' OpenTween.Models.LocalSearchTabModel' OpenTween.Models.MuteTabModel' OpenTween.Api.TwitterApiException,OpenTween.Api.ApiLimit' OpenTween.Api.TwitterApiStatus' OpenTween.Api.EndpointLimits' OpenTween.Api.AccessLimitUpdatedEventArgs' OpenTween.Properties.Resources' OpenTween.Setting.SettingManager' OpenTween.Api.TwitterApi' OpenTween.Setting.Panel.StartupPanel' OpenTween.Setting.Panel.PreviewPanel' OpenTween.Setting.Panel.TweetActPanel' OpenTween.Setting.Panel.GetCountPanel' OpenTween.Setting.Panel.ShortUrlPanel' OpenTween.Setting.Panel.BasedPanel' OpenTween.Setting.Panel.TweetPrvPanel' OpenTween.Setting.Panel.NotifyPanel' OpenTween.Setting.Panel.CooperatePanel' OpenTween.Setting.Panel.ProxyPanel' OpenTween.Setting.Panel.ConnectionPanel' OpenTween.Setting.Panel.GetPeriodPanel' OpenTween.Setting.Panel.ActionPanel' OpenTween.Setting.Panel.FontPanel' OpenTween.Setting.Panel.FontPanel2' OpenTween.Setting.Panel.SettingPanelBase' OpenTween.Connection.ProxyType' OpenTween.Connection.Networking' OpenTween.Connection.TwitterApiConnection' OpenTween.Api.MicrosoftTranslatorApi' OpenTween.Models.TabInformations' OpenTween.Models.TabModel' OpenTween.Models.FilterTabModel' OpenTween.Models.PostFilterRule' OpenTween.Api.DataModel.TwitterApiAccessLevel' OpenTween.Models.MediaInfo' OpenTween.Models.PostClass' OpenTween.Api.DataModel.TwitterEntityUrl' OpenTween.Connection.IMediaUploadService' OpenTween.Api.DataModel.TwitterConfiguration' OpenTween.Thumbnail.ThumbnailInfo' OpenTween.Api.DataModel.TwitterEntity' OpenTween.Api.DataModel.TwitterEntityMedia' OpenTween.Api.DataModel.TwitterEntityHashtag' OpenTween.Api.DataModel.TwitterEntityMention' OpenTween.Thumbnail.ThumbnailGenerator' OpenTween.Api.DataModel.TwitterList' OpenTween.Api.DataModel.TwitterUser' OpenTween.Api.DataModel.TwitterLists' OpenTween.Thumbnail.MapProvider' OpenTween.Api.BitlyApi' OpenTween.Api.DataModel.TwitterUserEntity' OpenTween.Api.DataModel.TwitterEntities' OpenTween.Api.DataModel.TwitterStatus' OpenTween.Api.DataModel.TwitterFriendship' OpenTween.Api.DataModel.RelationshipSource' OpenTween.Api.DataModel.RelationshipItem' OpenTween.Connection.LazyJson' OpenTween.OpenTweenCustomControl.DetailsListView' OpenTween.OpenTweenCustomControl.ToolStripLabelHistory' OpenTween.Models.ComparerMode' OpenTween.Thumbnail.Services.ImgAzyobuziNet' OpenTween.Thumbnail.Services.TonTwitterCom' OpenTween.Models.HomeTabModel' OpenTween.Models.MentionsTabModel' OpenTween.Models.DirectMessagesTabModel' OpenTween.Models.FavoritesTabModel' OpenTween.Models.PublicSearchTabModel' OpenTween.Models.UserTimelineTabModel' OpenTween.Models.ListTimelineTabModel' OpenTween.Models.RelatedPostsTabModel' OpenTween.Api.DataModel.TwitterError' OpenTween.Api.TwitterApiException' OpenTween.Api.DataModel.TwitterErrorItem' OpenTween.Api.DataModel.TwitterErrorCode' OpenTween.Connection.TwitterPhoto' OpenTween.Models.LocalSearchTabModel' OpenTween.Api.DataModel.TwitterTextConfiguration' OpenTween.Api.DataModel.TwitterUploadMediaResult' OpenTween.Api.DataModel.TwitterDirectMessage' OpenTween.Api.DataModel.GeoJsonPoint' OpenTween.Api.DataModel.TwitterSearchResult' OpenTween.Api.DataModel.TwitterIds' OpenTween.Api.DataModel.TwitterUsers' OpenTween.Api.DataModel.TwitterRateLimits' OpenTween.Api.DataModel.CodepointRange' OpenTween.Api.DataModel.TwitterStatusCompat' OpenTween.Api.DataModel.TwitterStreamEventDirectMessage' OpenTween.Api.DataModel.TwitterStreamEvent
OpenTween,OpenTween.Api,OpenTween.ApiInfoDialog' OpenTween.ToolStripAPIGauge' OpenTween.TestToolStripAPIGauge' OpenTween.ShortUrl' OpenTween.Setting.Panel.ShortUrlPanel' OpenTween.Bing' OpenTween.AppendSettingDialog' OpenTween.ListManage' OpenTween.MyLists' OpenTween.UserInfoDialog' OpenTween.TweenMain' OpenTween.Twitter' OpenTween.TwitterUserstream' OpenTween.Connection.MobypictureApi' OpenTween.Connection.TwitterPhoto' OpenTween.Connection.LazyJson<T>' OpenTween.Connection.TwitterApiConnection' OpenTween.MyCommon' OpenTween.ToolStripAPIGaugeTest' OpenTween.Connection.TwitterApiConnectionTest,OpenTween.MyCommon' OpenTween.ApplicationSettings' OpenTween.Connection.IApiConnection' OpenTween.Connection.TwitterApiConnection' OpenTween.Api.DataModel.TwitterUser' OpenTween.IMediaItem' OpenTween.Connection.OAuthEchoHandler' OpenTween.Api.DataModel.TwitterError' OpenTween.WebApiException' OpenTween.Api.DataModel.TwitterApiAccessLevel' OpenTween.Api.DataModel.TwitterRateLimits' OpenTween.Api.DataModel.TwitterRateLimit
OpenTween,OpenTween.Api.DataModel,OpenTween.Twitter' OpenTween.MediaSelector' OpenTween.TweenMain' OpenTween.Connection.IMediaUploadService' OpenTween.Connection.Imgur' OpenTween.Connection.Mobypicture' OpenTween.Connection.TwitterPhoto' OpenTween.MediaSelectorTest' OpenTween.TwitterTest' OpenTween.UserInfoDialog' OpenTween.TweetFormatterTest' OpenTween.TweetFormatter' OpenTween.TweenMainTest' OpenTween.TweetExtractor' OpenTween.Api.TwitterApiException' OpenTween.Connection.TwitterApiConnection' OpenTween.Connection.TwitterApiConnectionTest' OpenTween.ListElement' OpenTween.MyLists' OpenTween.Api.TwitterApiStatus' OpenTween.Api.TwitterApiStatusTest' OpenTween.UserInfo' OpenTween.Api.TwitterApi' OpenTween.ErrorReport,OpenTween.MyCommon
OpenTween,OpenTween.Connection,OpenTween.Api.TwitterApi' OpenTween.Thumbnail.Services.Thumbnail' OpenTween.MediaSelector' OpenTween.TweenMain' OpenTween.UserInfoDialog' OpenTween.Twitter' OpenTween.Api.TwitterApiTest' OpenTween.AppendSettingDialog' OpenTween.ImageCache' OpenTween.ListManage' OpenTween.ShortUrl' OpenTween.Thumbnail.Services.Nicovideo' OpenTween.Thumbnail.ThumbnailInfo' OpenTween.NativeMethods' OpenTween.SettingLocal' OpenTween.Setting.Panel.ProxyPanel,OpenTween.IMediaItem' OpenTween.PostStatusParams' OpenTween.Api.DataModel.TwitterConfiguration' OpenTween.Twitter' OpenTween.ApplicationSettings' OpenTween.MyCommon' OpenTween.Api.TwitterApiException' OpenTween.Api.TwitterApi' OpenTween.NativeMethods' OpenTween.Api.TwitterApiStatus' OpenTween.Api.DataModel.TwitterError' OpenTween.ACCOUNT_STATE' OpenTween.Api.DataModel.TwitterErrorItem' OpenTween.Api.DataModel.TwitterErrorCode
OpenTween,OpenTween.Models,OpenTween.TweenMain' OpenTween.Twitter' OpenTween.FilterDialog' OpenTween.TweetDetailsView' OpenTween.Thumbnail.Services.PbsTwimgCom' OpenTween.Thumbnail.Services.TwitterComVideo' OpenTween.Thumbnail.ThumbnailGenerator' OpenTween.TweetThumbnail' OpenTween.MyCommon' OpenTween.ListViewItemCache' OpenTween.Thumbnail.Services.FoursquareCheckin' OpenTween.Thumbnail.Services.ImgAzyobuziNet' OpenTween.Thumbnail.Services.IThumbnailService' OpenTween.Thumbnail.Services.MetaThumbnailService' OpenTween.Thumbnail.Services.Nicovideo' OpenTween.Thumbnail.Services.Pixiv' OpenTween.Thumbnail.Services.SimpleThumbnailService' OpenTween.Thumbnail.Services.Tinami' OpenTween.Thumbnail.Services.TonTwitterCom' OpenTween.Thumbnail.Services.Tumblr' OpenTween.Thumbnail.Services.ViaMe' OpenTween.Thumbnail.Services.Vimeo' OpenTween.Thumbnail.Services.Youtube' OpenTween.MyCommonTest' OpenTween.TweetDetailsViewTest' OpenTween.TweetThumbnailTest' OpenTween.TestThumbnailService' OpenTween.TwitterTest' OpenTween.Thumbnail.Services.FoursquareCheckinTest' OpenTween.Thumbnail.Services.ImgAzyobuziNetTest' OpenTween.Thumbnail.MapThumbGoogle' OpenTween.Thumbnail.MapThumb' OpenTween.Thumbnail.MapThumbOSM' OpenTween.TabsDialog' OpenTween.ListAvailable' OpenTween.ListManage' OpenTween.TabsDialogTest,OpenTween.SettingCommon' OpenTween.Setting.SettingManager' OpenTween.Properties.Resources' OpenTween.Twitter' OpenTween.WORKERTYPE' OpenTween.MyCommon' OpenTween.HITRESULT' OpenTween.TabUsageType' OpenTween.ListElement' OpenTween.ShortUrl' OpenTween.NotifyPropertyChangedBase
OpenTween,OpenTween.Setting,OpenTween.MyApplication' OpenTween.EventViewerDialog' OpenTween.TweetDetailsView' OpenTween.MyCommon' OpenTween.TweenMain' OpenTween.Twitter' OpenTween.Models.DirectMessagesTabModel' OpenTween.Models.FavoritesTabModel' OpenTween.Models.HomeTabModel' OpenTween.Models.ListTimelineTabModel' OpenTween.Models.MentionsTabModel' OpenTween.Models.PublicSearchTabModel' OpenTween.Models.RelatedPostsTabModel' OpenTween.Models.TabInformations' OpenTween.Models.UserTimelineTabModel' OpenTween.Thumbnail.MapThumbGoogle' OpenTween.Thumbnail.MapThumb' OpenTween.Thumbnail.MapThumbOSM' OpenTween.TwitterTest,OpenTween.SettingCommon' OpenTween.UserAccount
OpenTween,OpenTween.Thumbnail.Services,OpenTween.TweenMain' OpenTween.Thumbnail.ThumbnailGenerator,OpenTween.Thumbnail.ThumbnailInfo' OpenTween.Models.MediaInfo' OpenTween.Models.PostClass' OpenTween.Thumbnail.GlobalLocation' OpenTween.Thumbnail.MapThumb' OpenTween.ApplicationSettings' OpenTween.MyCommon' OpenTween.Connection.Networking' OpenTween.Properties.Resources' OpenTween.MemoryImage' OpenTween.Connection.IApiConnection
OpenTween,System,System.Runtime.CompilerServices.ValueTuple,
OpenTween,System.Runtime.CompilerServices,,System.ValueTuple
OpenTween,OpenTween.OpenTweenCustomControl,OpenTween.TweenMain,OpenTween.NativeMethods' OpenTween.ScrollBarDirection
OpenTween,OpenTween.Setting.Panel,OpenTween.AppendSettingDialog,OpenTween.SettingCommon' OpenTween.SettingLocal' OpenTween.Properties.Resources' OpenTween.ControlTransaction' OpenTween.HttpTimeOut' OpenTween.MyCommon' OpenTween.Bing' OpenTween.Twitter' OpenTween.WORKERTYPE' OpenTween.IntervalChangedEventArgs' OpenTween.EVENTTYPE' OpenTween.NameBalloonEnum' OpenTween.DispTitleEnum' OpenTween.REPLY_ICONSTATE' OpenTween.GrowlHelper' OpenTween.Connection.ProxyType' OpenTween.AppendSettingDialog' OpenTween.UrlConverter' OpenTween.Api.BitlyApi' OpenTween.LoginDialog' OpenTween.WebApiException' OpenTween.ApplicationSettings' OpenTween.IconSizes
OpenTween,OpenTween.Thumbnail,OpenTween.TweetThumbnail' OpenTween.TweenMain' OpenTween.TweetThumbnailTest' OpenTween.OTPictureBox' OpenTween.ThumbnailDoubleClickEventArgs' OpenTween.Thumbnail.Services.PbsTwimgCom' OpenTween.Thumbnail.Services.FoursquareCheckin' OpenTween.Thumbnail.Services.ImgAzyobuziNet' OpenTween.Thumbnail.Services.MetaThumbnailService' OpenTween.Thumbnail.Services.Nicovideo' OpenTween.Thumbnail.Services.Pixiv' OpenTween.Thumbnail.Services.SimpleThumbnailService' OpenTween.Thumbnail.Services.Tinami' OpenTween.Thumbnail.Services.Tumblr' OpenTween.Thumbnail.Services.TwitterComVideo' OpenTween.Thumbnail.Services.ViaMe' OpenTween.Thumbnail.Services.Vimeo' OpenTween.Thumbnail.Services.Youtube' OpenTween.Thumbnail.Services.TumblrTest' OpenTween.Thumbnail.Services.FoursquareCheckinTest' OpenTween.SettingCommon,OpenTween.Models.PostClass' OpenTween.Models.MediaInfo' OpenTween.Thumbnail.Services.IThumbnailService' OpenTween.Connection.Networking' OpenTween.MemoryImage' OpenTween.Models.StatusGeo' OpenTween.SettingCommon' OpenTween.Setting.SettingManager
OpenTween,OpenTween.Properties,OpenTween.MyApplication' OpenTween.AppendSettingDialog' OpenTween.AuthDialog' OpenTween.EventViewerDialog' OpenTween.FilterDialog' OpenTween.SendErrorReportForm' OpenTween.TweetDetailsView' OpenTween.MediaSelector' OpenTween.HashtagManage' OpenTween.ListManage' OpenTween.OTPictureBox' OpenTween.TabsDialog' OpenTween.GrowlHelper' OpenTween.InputTabName' OpenTween.MyCommon' OpenTween.MyLists' OpenTween.UserInfoDialog' OpenTween.TweenMain' OpenTween.TweenAboutBox' OpenTween.Twitter' OpenTween.Models.DirectMessagesTabModel' OpenTween.Models.FavoritesTabModel' OpenTween.Models.HomeTabModel' OpenTween.Models.MentionsTabModel' OpenTween.Models.TabInformations' OpenTween.Models.PostFilterRule' OpenTween.Thumbnail.Services.Nicovideo' OpenTween.Setting.Panel.ActionPanel' OpenTween.Setting.Panel.ConnectionPanel' OpenTween.Setting.Panel.GetCountPanel' OpenTween.Setting.Panel.GetPeriodPanel' OpenTween.Setting.Panel.ProxyPanel' OpenTween.Setting.Panel.ShortUrlPanel' OpenTween.Setting.Panel.TweetPrvPanel,
