Project,Namespace,Ca types,Ce types
FarsiLibrary.Win,FarsiLibrary.Win.BaseClasses,FarsiLibrary.Win.Controls.FAMultiView' FarsiLibrary.Win.Controls.FADayView' FarsiLibrary.Win.Controls.FAMonthView' FarsiLibrary.Win.Controls.FAContainerComboBox' FarsiLibrary.Win.Controls.DataGridViewFADateTimePickerCell' FarsiLibrary.Win.Controls.FADatePicker' FarsiLibrary.Win.Drawing.FAPainterFactory' FarsiLibrary.Win.Design.FABaseDesigner,FarsiLibrary.Win.Events.DateChangedEventArgs' FarsiLibrary.Win.Enums.FormatInfoTypes' FarsiLibrary.Win.Events.CollectionChangedEventArgs' FarsiLibrary.Win.Enums.CollectionChangeType' FarsiLibrary.Win.Design.AboutDialogEditor' FarsiLibrary.Win.Drawing.FAPainterFactory' FarsiLibrary.Win.Drawing.IFAPainter' FarsiLibrary.Win.Drawing.Office2003Colors' FarsiLibrary.Win.Enums.ThemeTypes' FarsiLibrary.Win.FAThemeManager' FarsiLibrary.Win.Events.ValueValidatingEventArgs' FarsiLibrary.Win.Enums.TextAlignment' FarsiLibrary.Win.Enums.Office2003Color
FarsiLibrary.Win,FarsiLibrary.Win.Controls,FarsiLibrary.Win.Design.FADatePickerDesigner' FarsiLibrary.Win.Design.FADayViewDesigner' FarsiLibrary.Win.Design.FAMultiViewDesigner' FarsiLibrary.Win.Events.CalendarButtonClickedEventArgs' FarsiLibrary.Win.Design.FAMonthViewDesigner,FarsiLibrary.Win.BaseClasses.DateEditBase' FarsiLibrary.Win.Enums.FormatInfoTypes' FarsiLibrary.Win.Enums.ThemeTypes' FarsiLibrary.Win.Drawing.Office2003Colors' FarsiLibrary.Win.Events.BindPopupControlEventArgs' FarsiLibrary.Win.Enums.Office2003Color' FarsiLibrary.Win.Enums.ItemState' FarsiLibrary.Win.FAPopup.IPopupControl' FarsiLibrary.Win.FAThemeManager' FarsiLibrary.Win.BaseClasses.BaseDateControl' FarsiLibrary.Win.Design.FADayViewDesigner' FarsiLibrary.Win.Events.CustomDrawEventArgs' FarsiLibrary.Win.Design.FAMultiViewDesigner' FarsiLibrary.Win.Enums.ViewType' FarsiLibrary.Win.Enums.ScrollOptionTypes' FarsiLibrary.Win.Enums.FocusedPart' FarsiLibrary.Win.BaseClasses.DateTimeCollection' FarsiLibrary.Win.Design.DateTimeCollectionEditor' FarsiLibrary.Win.Design.FADatePickerDesigner' FarsiLibrary.Win.Events.SelectedDateRangeChangedEventArgs' FarsiLibrary.Win.Events.SelectedDateTimeChangingEventArgs' FarsiLibrary.Win.Events.ValueValidatingEventArgs' FarsiLibrary.Win.Events.CalendarButtonClickedEventArgs' FarsiLibrary.Win.Design.FAMonthViewDesigner' FarsiLibrary.Win.Events.CustomDrawDayEventArgs' FarsiLibrary.Win.Events.CollectionChangedEventArgs' FarsiLibrary.Win.Enums.FAMonthViewButtons' FarsiLibrary.Win.Enums.TRectangleStatus' FarsiLibrary.Win.Enums.FAMessageBoxButtons' FarsiLibrary.Win.Enums.FarsiMessageBoxExIcon' FarsiLibrary.Win.FAMessageBoxResult' FarsiLibrary.Win.Enums.MessageBeepType' FarsiLibrary.Win.Win32.NONCLIENTMETRICS' FarsiLibrary.Win.Win32.User32' FarsiLibrary.Win.FAPopup.FAPopupContainer' FarsiLibrary.Win.FAPopup.FAHookPopup' FarsiLibrary.Win.FAPopup.FAHookPopupController' FarsiLibrary.Win.FAPopup.IPopupServiceControl' FarsiLibrary.Win.Helpers.ControlUtils
FarsiLibrary.Win,FarsiLibrary.Win.Design,FarsiLibrary.Win.BaseClasses.BaseStyledControl' FarsiLibrary.Win.Controls.FAMultiView' FarsiLibrary.Win.Controls.FADatePicker' FarsiLibrary.Win.Controls.FAMonthView' FarsiLibrary.Win.Controls.FADayView,FarsiLibrary.Win.Controls.FAMultiView' FarsiLibrary.Win.Controls.FAContainerComboBox' FarsiLibrary.Win.Controls.FADayView' FarsiLibrary.Win.BaseClasses.BaseControl' FarsiLibrary.Win.Controls.FAMonthView
FarsiLibrary.Win,FarsiLibrary.Win.Drawing,FarsiLibrary.Win.BaseClasses.BaseStyledControl' FarsiLibrary.Win.BaseClasses.BaseControl' FarsiLibrary.Win.BaseClasses.TextEditBase' FarsiLibrary.Win.Controls.FAContainerComboBox,FarsiLibrary.Win.BaseClasses.BaseStyledControl' FarsiLibrary.Win.Enums.ThemeTypes' FarsiLibrary.Win.Enums.ItemState' FarsiLibrary.Win.Enums.Office2003Color' FarsiLibrary.Win.Enums.XPThemeType
FarsiLibrary.Win,FarsiLibrary.Win.Events,FarsiLibrary.Win.Controls.FADatePicker' FarsiLibrary.Win.Controls.FAContainerComboBox' FarsiLibrary.Win.Controls.FAMonthView' FarsiLibrary.Win.BaseClasses.BaseControl' FarsiLibrary.Win.Controls.FADayView' FarsiLibrary.Win.BaseClasses.DateTimeCollection' FarsiLibrary.Win.BaseClasses.BaseDateControl,FarsiLibrary.Win.FAPopup.IPopupControl' FarsiLibrary.Win.Controls.FAMonthView' FarsiLibrary.Win.Controls.ActRect' FarsiLibrary.Win.Enums.FAMonthViewButtons' FarsiLibrary.Win.Enums.CollectionChangeType
FarsiLibrary.Win,FarsiLibrary.Win.Enums,FarsiLibrary.Win.Controls.FAMultiView' FarsiLibrary.Win.Events.CollectionChangedEventArgs' FarsiLibrary.Win.BaseClasses.DateTimeCollection' FarsiLibrary.Win.Controls.FAMessageBoxForm' FarsiLibrary.Win.Controls.FAMessageBox' FarsiLibrary.Win.Events.CalendarButtonClickedEventArgs' FarsiLibrary.Win.Controls.FAMonthView' FarsiLibrary.Win.Controls.FADatePicker' FarsiLibrary.Win.Controls.DataGridViewFADateTimePickerColumn' FarsiLibrary.Win.BaseClasses.DateEditBase' FarsiLibrary.Win.BaseClasses.TextEditBase' FarsiLibrary.Win.Controls.FAContainerComboBox' FarsiLibrary.Win.Drawing.FAPainterOffice2003' FarsiLibrary.Win.Drawing.Office2003Colors' FarsiLibrary.Win.Controls.FADatePickerStrip' FarsiLibrary.Win.FAThemeManager' FarsiLibrary.Win.Controls.FaMonthViewStrip' FarsiLibrary.Win.BaseClasses.BaseStyledControl' FarsiLibrary.Win.Drawing.FAPainterFactory' FarsiLibrary.Win.Drawing.IFAPainter' FarsiLibrary.Win.Drawing.FAPainterOffice2000' FarsiLibrary.Win.Drawing.FAPainterOffice2007' FarsiLibrary.Win.Drawing.FAPainterWindowsXP' FarsiLibrary.Win.BaseClasses.BaseControl,
FarsiLibrary.Win,FarsiLibrary.Win,FarsiLibrary.Win.Controls.FAMessageBox' FarsiLibrary.Win.Controls.FAMessageBoxForm' FarsiLibrary.Win.Controls.FADatePickerStrip' FarsiLibrary.Win.Controls.FaMonthViewStrip' FarsiLibrary.Win.BaseClasses.BaseStyledControl,FarsiLibrary.Win.Enums.ThemeTypes
FarsiLibrary.Win,FarsiLibrary.Win.FAPopup,FarsiLibrary.Win.Controls.FAMonthViewContainer' FarsiLibrary.Win.Events.BindPopupControlEventArgs' FarsiLibrary.Win.Controls.FAContainerComboBox,FarsiLibrary.Win.Win32.User32
FarsiLibrary.Win,FarsiLibrary.Win.Helpers,FarsiLibrary.Win.Controls.FAMonthViewContainer,
FarsiLibrary.Win,FarsiLibrary.Win.Win32,FarsiLibrary.Win.Controls.FAMessageBoxForm' FarsiLibrary.Win.FAPopup.FATopFormBase,
