Namespace,Type,NOF,NOM,NOP,NOPF,NOPM,LOC,WMC,NC,DIT,LCOM,Fan-Out,Fan-In,Fan-Out types,Fan-In types
DotNetNuke.Web.DDRMenu,Actions,2,9,4,0,0,153,19,0,2,0.22,10,0,DotNetNuke.Web.DDRMenu.DDRMenuNavigationProvider' DotNetNuke.UI.Containers.ActionBase' DotNetNuke.Modules.NavigationProvider.NavigationProvider' DotNetNuke.UI.Navigation' DotNetNuke.Services.Exceptions.Exceptions' DotNetNuke.Modules.NavigationProvider.NavigationEventArgs' DotNetNuke.Entities.Modules.Actions.ModuleAction' DotNetNuke.Modules.NavigationProvider.HoverAction' DotNetNuke.Modules.NavigationProvider.HoverDisplay' DotNetNuke.Common.Globals,
DotNetNuke.Web.DDRMenu,Controller,6,8,0,4,3,168,22,0,1,0.38,9,0,DotNetNuke.Entities.Modules.ModuleInfo' DotNetNuke.Web.DDRMenu.Settings' DotNetNuke.Entities.Modules.IModuleController' DotNetNuke.Entities.Modules.ModuleController' DotNetNuke.Common.Utilities.Null' DotNetNuke.Entities.Modules.Definitions.ModuleDefinitionController' DotNetNuke.Entities.Modules.DesktopModuleInfo' DotNetNuke.Entities.Modules.DesktopModuleController' DotNetNuke.Entities.Modules.Definitions.ModuleDefinitionInfo,
DotNetNuke.Web.DDRMenu,DDRMenuControl,1,3,4,0,1,38,3,0,0,0.67,2,1,DotNetNuke.Web.DDRMenu.MenuBase' DotNetNuke.Web.DDRMenu.Settings,DotNetNuke.Web.DDRMenu.DDRMenuNavigationProvider
DotNetNuke.Web.DDRMenu,DDRMenuNavigationProvider,1,4,83,0,3,178,14,0,2,0,4,1,DotNetNuke.Web.DDRMenu.DDRMenuControl' DotNetNuke.UI.Skins.CustomAttribute' DotNetNuke.Web.DDRMenu.Localisation.Localiser' DotNetNuke.Modules.NavigationProvider.NavigationProvider,DotNetNuke.Web.DDRMenu.Actions
DotNetNuke.Web.DDRMenu,INodeManipulator,0,1,0,0,0,4,1,0,0,-1,1,1,DotNetNuke.Entities.Portals.PortalSettings,DotNetNuke.Web.DDRMenu.MenuBase
DotNetNuke.Web.DDRMenu,MenuBase,4,11,5,0,1,289,36,0,0,0.18,22,3,DotNetNuke.Web.DDRMenu.Settings' DotNetNuke.Entities.Portals.PortalSettings' DotNetNuke.Web.DDRMenu.TemplateEngine.TemplateDefinition' DotNetNuke.Web.DDRMenu.TemplateEngine.ClientOption' DotNetNuke.Web.DDRMenu.Localisation.Localiser' DotNetNuke.Web.DDRMenu.MenuNode' DotNetNuke.Web.DDRMenu.DNNCommon.DNNContext' DotNetNuke.Entities.Users.UserInfo' DotNetNuke.Entities.Host.Host' DotNetNuke.Entities.Users.IUserController' DotNetNuke.Entities.Users.UserController' DotNetNuke.Web.DDRMenu.DNNCommon.PathResolver' DotNetNuke.Web.DDRMenu.DNNCommon.RelativeTo' DotNetNuke.Entities.Tabs.TabController' DotNetNuke.Entities.Tabs.TabInfo' DotNetNuke.Entities.Tabs.ITabController' DotNetNuke.Common.Utilities.Null' DotNetNuke.Security.Permissions.TabPermissionInfo' DotNetNuke.Entities.Content.Taxonomy.Term' DotNetNuke.Entities.Portals.IPortalController' DotNetNuke.Entities.Portals.PortalController' DotNetNuke.Web.DDRMenu.INodeManipulator,DotNetNuke.Web.DDRMenu.DDRMenuControl' DotNetNuke.Web.DDRMenu.MenuView' DotNetNuke.Web.DDRMenu.SkinObject
DotNetNuke.Web.DDRMenu,MenuNode,1,19,20,0,13,300,45,0,0,0.74,3,4,DotNetNuke.Web.DDRMenu.DNNAbstract' DotNetNuke.Web.DDRMenu.DNNCommon.DNNContext' DotNetNuke.Common.Globals,DotNetNuke.Web.DDRMenu.MenuBase' DotNetNuke.Web.DDRMenu.MenuView' DotNetNuke.Web.DDRMenu.DNNAbstract' DotNetNuke.Web.DDRMenu.Localisation.Localiser
DotNetNuke.Web.DDRMenu,MenuSettings,11,3,0,0,2,137,4,0,2,0.67,6,0,DotNetNuke.UI.WebControls.TextEditControl' DotNetNuke.UI.WebControls.CheckEditControl' DotNetNuke.UI.WebControls.MultiLineTextEditControl' DotNetNuke.Entities.Modules.IModuleController' DotNetNuke.Entities.Modules.ModuleController' DotNetNuke.Web.DDRMenu.DNNAbstract,
DotNetNuke.Web.DDRMenu,MenuView,1,2,0,0,0,79,2,0,1,0,9,0,DotNetNuke.Web.DDRMenu.MenuBase' DotNetNuke.Web.DDRMenu.Settings' DotNetNuke.Web.DDRMenu.MenuNode' DotNetNuke.Web.DDRMenu.ModuleBase' DotNetNuke.Web.DDRMenu.Localisation.Localiser' DotNetNuke.UI.Navigation' DotNetNuke.UI.ToolTipSource' DotNetNuke.Web.DDRMenu.DNNAbstract' DotNetNuke.Services.Exceptions.Exceptions,
DotNetNuke.Web.DDRMenu,MenuXml,0,0,2,0,0,9,0,0,0,-1,0,0,,
DotNetNuke.Web.DDRMenu,ModuleBase,0,6,0,0,0,45,10,1,2,-1,0,1,,DotNetNuke.Web.DDRMenu.MenuView
DotNetNuke.Web.DDRMenu,Settings,2,8,10,0,7,80,12,0,0,0.62,2,4,DotNetNuke.Web.DDRMenu.TemplateEngine.ClientOption' DotNetNuke.Web.DDRMenu.TemplateEngine.TemplateArgument,DotNetNuke.Web.DDRMenu.Controller' DotNetNuke.Web.DDRMenu.DDRMenuControl' DotNetNuke.Web.DDRMenu.MenuBase' DotNetNuke.Web.DDRMenu.MenuView
DotNetNuke.Web.DDRMenu,SkinObject,1,2,10,0,0,75,2,0,2,0,7,1,DotNetNuke.Web.DDRMenu.MenuBase' DotNetNuke.UI.Skins.SkinObjectBase' DotNetNuke.Web.DDRMenu.Localisation.Localiser' DotNetNuke.UI.Navigation' DotNetNuke.UI.ToolTipSource' DotNetNuke.Web.DDRMenu.DNNAbstract' DotNetNuke.Services.Exceptions.Exceptions,DotNetNuke.UI.ControlPanels.RibbonBar
DotNetNuke.Web.DDRMenu,DNNAbstract,0,7,0,0,7,60,11,0,0,-1,13,7,DotNetNuke.Common.Globals' DotNetNuke.Entities.Tabs.TabInfo' DotNetNuke.Entities.Portals.PortalSettings' DotNetNuke.Entities.Users.UserInfo' DotNetNuke.Common.PortalRegistrationType' DotNetNuke.Common.Utilities.Null' DotNetNuke.Entities.Users.IUserController' DotNetNuke.Entities.Users.UserController' DotNetNuke.Web.DDRMenu.DNNCommon.DNNContext' DotNetNuke.Web.DDRMenu.TemplateEngine.ITemplateProcessor' DotNetNuke.UI.NavNodeOptions' DotNetNuke.UI.Navigation' DotNetNuke.Web.DDRMenu.MenuNode,DotNetNuke.Web.DDRMenu.MenuNode' DotNetNuke.Web.DDRMenu.MenuSettings' DotNetNuke.Web.DDRMenu.MenuView' DotNetNuke.Web.DDRMenu.SkinObject' DotNetNuke.Web.DDRMenu.Localisation.EaloWorker' DotNetNuke.Web.DDRMenu.TemplateEngine.TemplateDefinition' DotNetNuke.Web.DDRMenu.TemplateEngine.XsltFunctions
DotNetNuke.Web.DDRMenu.DNNCommon,DNNContext,8,4,9,0,3,50,4,0,0,0.75,2,9,DotNetNuke.Entities.Portals.PortalSettings' DotNetNuke.Entities.Tabs.TabInfo,DotNetNuke.Web.DDRMenu.MenuBase' DotNetNuke.Web.DDRMenu.MenuNode' DotNetNuke.Web.DDRMenu.DNNAbstract' DotNetNuke.Web.DDRMenu.DNNCommon.PathResolver' DotNetNuke.Web.DDRMenu.TemplateEngine.RazorTemplateProcessor' DotNetNuke.Web.DDRMenu.TemplateEngine.TemplateDefinition' DotNetNuke.Web.DDRMenu.TemplateEngine.TokenTemplateProcessor' DotNetNuke.Web.DDRMenu.TemplateEngine.XsltFunctions' DotNetNuke.Web.DDRMenu.TemplateEngine.XsltTemplateProcessor
DotNetNuke.Web.DDRMenu.DNNCommon,PathResolver,1,2,0,0,2,107,12,0,0,0,4,6,DotNetNuke.Web.DDRMenu.DNNCommon.DNNContext' DotNetNuke.Web.DDRMenu.DNNCommon.RelativeTo' DotNetNuke.UI.Containers.Container' DotNetNuke.Entities.Portals.PortalSettings,DotNetNuke.Web.DDRMenu.MenuBase' DotNetNuke.Web.DDRMenu.TemplateEngine.RazorTemplateProcessor' DotNetNuke.Web.DDRMenu.TemplateEngine.TemplateDefinition' DotNetNuke.Web.DDRMenu.TemplateEngine.TokenTemplateProcessor' DotNetNuke.Web.DDRMenu.TemplateEngine.XsltFunctions' DotNetNuke.Web.DDRMenu.TemplateEngine.XsltTemplateProcessor
DotNetNuke.Web.DDRMenu.DNNCommon,RelativeTo,0,0,0,0,0,9,0,0,0,-1,0,7,,DotNetNuke.Web.DDRMenu.MenuBase' DotNetNuke.Web.DDRMenu.DNNCommon.PathResolver' DotNetNuke.Web.DDRMenu.TemplateEngine.RazorTemplateProcessor' DotNetNuke.Web.DDRMenu.TemplateEngine.TemplateDefinition' DotNetNuke.Web.DDRMenu.TemplateEngine.TokenTemplateProcessor' DotNetNuke.Web.DDRMenu.TemplateEngine.XsltFunctions' DotNetNuke.Web.DDRMenu.TemplateEngine.XsltTemplateProcessor
DotNetNuke.Web.DDRMenu.DNNCommon,Utilities,1,5,0,0,0,80,11,0,0,1,0,4,,DotNetNuke.Web.DDRMenu.TemplateEngine.RazorTemplateProcessor' DotNetNuke.Web.DDRMenu.TemplateEngine.TemplateDefinition' DotNetNuke.Web.DDRMenu.TemplateEngine.TokenTemplateProcessor' DotNetNuke.Web.DDRMenu.TemplateEngine.XsltTemplateProcessor
DotNetNuke.Web.DDRMenu.Localisation,Apollo,2,3,0,0,3,35,5,0,1,0.67,3,0,DotNetNuke.Entities.Modules.DesktopModuleController' DotNetNuke.Entities.Portals.PortalSettings' DotNetNuke.Entities.Tabs.TabInfo,
DotNetNuke.Web.DDRMenu.Localisation,Ealo,2,3,0,0,3,57,4,0,1,1,4,0,DotNetNuke.Entities.Modules.DesktopModuleController' DotNetNuke.Entities.Portals.PortalSettings' DotNetNuke.Web.DDRMenu.Localisation.EaloWorker' DotNetNuke.Entities.Tabs.TabInfo,
DotNetNuke.Web.DDRMenu.Localisation,EaloWorker,1,1,0,0,1,34,5,0,0,0,2,1,DotNetNuke.Web.DDRMenu.DNNAbstract' DotNetNuke.Entities.Tabs.TabInfo,DotNetNuke.Web.DDRMenu.Localisation.Ealo
DotNetNuke.Web.DDRMenu.Localisation,Generic,4,3,0,0,3,57,10,0,1,0,5,0,DotNetNuke.Entities.Modules.DesktopModuleController' DotNetNuke.Entities.Portals.PortalSettings' DotNetNuke.Entities.Modules.DesktopModuleInfo' DotNetNuke.Framework.Reflection' DotNetNuke.Entities.Tabs.TabInfo,
DotNetNuke.Web.DDRMenu.Localisation,ILocalisation,0,3,0,0,0,6,3,3,0,-1,1,1,DotNetNuke.Entities.Tabs.TabInfo,DotNetNuke.Web.DDRMenu.Localisation.Localiser
DotNetNuke.Web.DDRMenu.Localisation,Localiser,3,4,1,0,3,64,7,0,0,0.5,6,4,DotNetNuke.Web.DDRMenu.Localisation.ILocalisation' DotNetNuke.Entities.Tabs.TabInfo' DotNetNuke.Web.DDRMenu.MenuNode' DotNetNuke.Entities.Tabs.ITabController' DotNetNuke.Entities.Tabs.TabController' DotNetNuke.Common.Utilities.Null,DotNetNuke.Web.DDRMenu.DDRMenuNavigationProvider' DotNetNuke.Web.DDRMenu.MenuBase' DotNetNuke.Web.DDRMenu.MenuView' DotNetNuke.Web.DDRMenu.SkinObject
DotNetNuke.Web.DDRMenu.TemplateEngine,ClientOption,0,2,2,0,2,16,2,3,0,-1,0,6,,DotNetNuke.Web.DDRMenu.MenuBase' DotNetNuke.Web.DDRMenu.Settings' DotNetNuke.Web.DDRMenu.TemplateEngine.RazorTemplateProcessor' DotNetNuke.Web.DDRMenu.TemplateEngine.TemplateDefinition' DotNetNuke.Web.DDRMenu.TemplateEngine.TokenTemplateProcessor' DotNetNuke.Web.DDRMenu.TemplateEngine.XsltTemplateProcessor
DotNetNuke.Web.DDRMenu.TemplateEngine,ClientString,0,2,0,0,2,11,2,0,1,-1,0,3,,DotNetNuke.Web.DDRMenu.TemplateEngine.RazorTemplateProcessor' DotNetNuke.Web.DDRMenu.TemplateEngine.TokenTemplateProcessor' DotNetNuke.Web.DDRMenu.TemplateEngine.XsltTemplateProcessor
DotNetNuke.Web.DDRMenu.TemplateEngine,ClientNumber,0,2,0,0,2,11,2,0,1,-1,0,3,,DotNetNuke.Web.DDRMenu.TemplateEngine.RazorTemplateProcessor' DotNetNuke.Web.DDRMenu.TemplateEngine.TokenTemplateProcessor' DotNetNuke.Web.DDRMenu.TemplateEngine.XsltTemplateProcessor
DotNetNuke.Web.DDRMenu.TemplateEngine,ClientBoolean,0,2,0,0,2,11,2,0,1,-1,0,3,,DotNetNuke.Web.DDRMenu.TemplateEngine.RazorTemplateProcessor' DotNetNuke.Web.DDRMenu.TemplateEngine.TokenTemplateProcessor' DotNetNuke.Web.DDRMenu.TemplateEngine.XsltTemplateProcessor
DotNetNuke.Web.DDRMenu.TemplateEngine,ITemplateProcessor,0,2,0,0,0,5,2,3,0,-1,1,2,DotNetNuke.Web.DDRMenu.TemplateEngine.TemplateDefinition,DotNetNuke.Web.DDRMenu.DNNAbstract' DotNetNuke.Web.DDRMenu.TemplateEngine.TemplateDefinition
DotNetNuke.Web.DDRMenu.TemplateEngine,RazorTemplateProcessor,0,3,0,0,2,68,9,0,1,-1,10,0,DotNetNuke.Web.DDRMenu.TemplateEngine.TemplateDefinition' DotNetNuke.Web.DDRMenu.DNNCommon.PathResolver' DotNetNuke.Web.DDRMenu.DNNCommon.DNNContext' DotNetNuke.Web.DDRMenu.DNNCommon.RelativeTo' DotNetNuke.Web.DDRMenu.TemplateEngine.TemplateArgument' DotNetNuke.Web.DDRMenu.TemplateEngine.ClientOption' DotNetNuke.Web.DDRMenu.DNNCommon.Utilities' DotNetNuke.Web.DDRMenu.TemplateEngine.ClientNumber' DotNetNuke.Web.DDRMenu.TemplateEngine.ClientString' DotNetNuke.Web.DDRMenu.TemplateEngine.ClientBoolean,
DotNetNuke.Web.DDRMenu.TemplateEngine,TemplateArgument,0,2,2,0,2,13,2,0,0,-1,0,5,,DotNetNuke.Web.DDRMenu.Settings' DotNetNuke.Web.DDRMenu.TemplateEngine.RazorTemplateProcessor' DotNetNuke.Web.DDRMenu.TemplateEngine.TemplateDefinition' DotNetNuke.Web.DDRMenu.TemplateEngine.TokenTemplateProcessor' DotNetNuke.Web.DDRMenu.TemplateEngine.XsltTemplateProcessor
DotNetNuke.Web.DDRMenu.TemplateEngine,TemplateDefinition,15,11,0,2,4,325,36,0,0,0,14,5,DotNetNuke.Web.DDRMenu.TemplateEngine.ITemplateProcessor' DotNetNuke.Web.DDRMenu.DNNCommon.PathResolver' DotNetNuke.Web.DDRMenu.DNNCommon.RelativeTo' DotNetNuke.Framework.JavaScriptLibraries.SpecificVersion' DotNetNuke.Common.Globals' DotNetNuke.Framework.JavaScriptLibraries.CommonJs' DotNetNuke.Web.DDRMenu.DNNAbstract' DotNetNuke.Web.DDRMenu.TemplateEngine.ClientOption' DotNetNuke.Web.DDRMenu.TemplateEngine.TemplateArgument' DotNetNuke.Web.DDRMenu.DNNCommon.DNNContext' DotNetNuke.Web.Client.ClientResourceManagement.ClientResourceManager' DotNetNuke.Framework.JavaScriptLibraries.JavaScript' DotNetNuke.Web.DDRMenu.DNNCommon.Utilities' DotNetNuke.Entities.Tabs.TabInfo,DotNetNuke.Web.DDRMenu.MenuBase' DotNetNuke.Web.DDRMenu.TemplateEngine.ITemplateProcessor' DotNetNuke.Web.DDRMenu.TemplateEngine.RazorTemplateProcessor' DotNetNuke.Web.DDRMenu.TemplateEngine.TokenTemplateProcessor' DotNetNuke.Web.DDRMenu.TemplateEngine.XsltTemplateProcessor
DotNetNuke.Web.DDRMenu.TemplateEngine,TokenTemplateProcessor,3,3,0,0,2,182,13,0,1,0,10,0,DotNetNuke.Web.DDRMenu.TemplateEngine.TemplateDefinition' DotNetNuke.Web.DDRMenu.DNNCommon.Utilities' DotNetNuke.Web.DDRMenu.TemplateEngine.TemplateArgument' DotNetNuke.Web.DDRMenu.DNNCommon.PathResolver' DotNetNuke.Web.DDRMenu.DNNCommon.DNNContext' DotNetNuke.Web.DDRMenu.DNNCommon.RelativeTo' DotNetNuke.Web.DDRMenu.TemplateEngine.ClientOption' DotNetNuke.Web.DDRMenu.TemplateEngine.ClientNumber' DotNetNuke.Web.DDRMenu.TemplateEngine.ClientString' DotNetNuke.Web.DDRMenu.TemplateEngine.ClientBoolean,
DotNetNuke.Web.DDRMenu.TemplateEngine,XsltFunctions,0,9,0,0,9,91,12,0,0,-1,9,0,DotNetNuke.Entities.Users.UserInfo' DotNetNuke.Entities.Users.IUserController' DotNetNuke.Entities.Users.UserController' DotNetNuke.Web.DDRMenu.DNNAbstract' DotNetNuke.Services.Localization.Localization' DotNetNuke.Web.DDRMenu.DNNCommon.DNNContext' DotNetNuke.Web.DDRMenu.DNNCommon.PathResolver' DotNetNuke.Web.DDRMenu.DNNCommon.RelativeTo' DotNetNuke.Entities.Modules.Actions.ModuleActionType,
DotNetNuke.Web.DDRMenu.TemplateEngine,XsltTemplateProcessor,1,3,0,0,2,78,8,0,1,0,10,0,DotNetNuke.Web.DDRMenu.TemplateEngine.TemplateDefinition' DotNetNuke.Web.DDRMenu.DNNCommon.Utilities' DotNetNuke.Web.DDRMenu.DNNCommon.PathResolver' DotNetNuke.Web.DDRMenu.DNNCommon.DNNContext' DotNetNuke.Web.DDRMenu.DNNCommon.RelativeTo' DotNetNuke.Web.DDRMenu.TemplateEngine.TemplateArgument' DotNetNuke.Web.DDRMenu.TemplateEngine.ClientOption' DotNetNuke.Web.DDRMenu.TemplateEngine.ClientNumber' DotNetNuke.Web.DDRMenu.TemplateEngine.ClientString' DotNetNuke.Web.DDRMenu.TemplateEngine.ClientBoolean,
