Project,Namespace,Ca types,Ce types
Artemis_Mono,Artemis,Artemis.System.DelayedEntitySystem' Artemis.System.ParallelEntityProcessingSystem' Artemis.System.IntervalEntityProcessingSystem' Artemis.System.IntervalEntitySystem' Artemis.Manager.EntityManager' Artemis.System.DelayedEntityProcessingSystem' Artemis.System.EntityProcessingSystem' Artemis.System.EntityComponentProcessingSystem<T>' Artemis.System.EntityComponentProcessingSystem<T1;T2>' Artemis.System.EntityComponentProcessingSystem<T1;T2;T3>' Artemis.System.EntityComponentProcessingSystem<T1;T2;T3;T4>' Artemis.System.EntityComponentProcessingSystem<T1;T2;T3;T4;T5>' Artemis.System.EntitySystem' Artemis.Manager.SystemManager' Artemis.Manager.ComponentTypeManager' Artemis.Interface.IComponentPool' Artemis.Interface.IEntityTemplate' Artemis.Manager.QueueManager' Artemis.System.TagSystem' Artemis.System.ProcessingSystem' Artemis.System.QueueProcessingSystem' Artemis.Manager.TagManager' Artemis.Manager.GroupManager' Artemis.System.QueueSystemProcessingThreadSafe' Artemis.System.QueueSystemProcessingThreadSafe<T>,Artemis.Manager.ComponentTypeManager' Artemis.Manager.ComponentTypeManager' Artemis.Manager.ComponentTypeManager' Artemis.Manager.ComponentTypeManager' Artemis.Manager.ComponentTypeManager' Artemis.Manager.ComponentTypeManager' Artemis.Manager.ComponentTypeManager' Artemis.Interface.IComponent' Artemis.Manager.EntityManager' Artemis.Interface.IComponent' Artemis.Manager.EntityManager' Artemis.Interface.IComponent' Artemis.Manager.EntityManager' Artemis.Interface.IComponent' Artemis.Manager.EntityManager' Artemis.Interface.IComponent' Artemis.Manager.EntityManager' Artemis.Interface.IComponent' Artemis.Manager.EntityManager' Artemis.Interface.IComponent' Artemis.Manager.EntityManager' Artemis.Interface.IComponentPool' Artemis.Interface.IComponentPool' Artemis.Interface.IComponentPool' Artemis.Interface.IComponentPool' Artemis.Interface.IComponentPool' Artemis.Interface.IComponentPool' Artemis.Interface.IComponentPool' Artemis.Utils.Bag<T>' Artemis.Utils.Bag<T>' Artemis.Utils.Bag<T>' Artemis.Utils.Bag<T>' Artemis.Utils.Bag<T>' Artemis.Utils.Bag<T>' Artemis.Utils.Bag<T>' Artemis.Exceptions.MissingEntityTemplateException' Artemis.Interface.IEntityTemplate' Artemis.Manager.GroupManager' Artemis.Manager.SystemManager' Artemis.Manager.TagManager' Artemis.Utils.FastDateTime' Artemis.Exceptions.MissingEntityTemplateException' Artemis.Interface.IEntityTemplate' Artemis.Manager.GroupManager' Artemis.Manager.SystemManager' Artemis.Manager.TagManager' Artemis.Utils.FastDateTime' Artemis.Exceptions.MissingEntityTemplateException' Artemis.Interface.IEntityTemplate' Artemis.Manager.GroupManager' Artemis.Manager.SystemManager' Artemis.Manager.TagManager' Artemis.Utils.FastDateTime' Artemis.Exceptions.MissingEntityTemplateException' Artemis.Interface.IEntityTemplate' Artemis.Manager.GroupManager' Artemis.Manager.SystemManager' Artemis.Manager.TagManager' Artemis.Utils.FastDateTime' Artemis.Exceptions.MissingEntityTemplateException' Artemis.Interface.IEntityTemplate' Artemis.Manager.GroupManager' Artemis.Manager.SystemManager' Artemis.Manager.TagManager' Artemis.Utils.FastDateTime' Artemis.Exceptions.MissingEntityTemplateException' Artemis.Interface.IEntityTemplate' Artemis.Manager.GroupManager' Artemis.Manager.SystemManager' Artemis.Manager.TagManager' Artemis.Utils.FastDateTime' Artemis.Exceptions.MissingEntityTemplateException' Artemis.Interface.IEntityTemplate' Artemis.Manager.GroupManager' Artemis.Manager.SystemManager' Artemis.Manager.TagManager' Artemis.Utils.FastDateTime
Artemis_Mono,Artemis.Attributes,Artemis.Manager.SystemManager,Artemis.Manager.ExecutionType' Artemis.Manager.GameLoopType' Artemis.Manager.ExecutionType' Artemis.Manager.GameLoopType' Artemis.Manager.ExecutionType' Artemis.Manager.GameLoopType' Artemis.Manager.ExecutionType' Artemis.Manager.GameLoopType' Artemis.Manager.ExecutionType' Artemis.Manager.GameLoopType' Artemis.Manager.ExecutionType' Artemis.Manager.GameLoopType' Artemis.Manager.ExecutionType' Artemis.Manager.GameLoopType
Artemis_Mono,Artemis.Blackboard,Artemis.System.EntitySystem,
Artemis_Mono,Artemis.Exceptions,Artemis.EntityWorld,
Artemis_Mono,Artemis.Interface,Artemis.ComponentPoolable' Artemis.ComponentType<T>' Artemis.ComponentMapper<T>' Artemis.Entity' Artemis.System.EntityComponentProcessingSystem<T>' Artemis.System.EntityComponentProcessingSystem<T1;T2>' Artemis.System.EntityComponentProcessingSystem<T1;T2;T3>' Artemis.System.EntityComponentProcessingSystem<T1;T2;T3;T4>' Artemis.System.EntityComponentProcessingSystem<T1;T2;T3;T4;T5>' Artemis.Manager.ComponentTypeManager' Artemis.EntityWorld' Artemis.Manager.EntityManager' Artemis.ComponentPoolMultiThread<T>' Artemis.ComponentPool<T>' Artemis.Manager.SystemManager,Artemis.ComponentPoolable' Artemis.ComponentPoolable' Artemis.ComponentPoolable' Artemis.ComponentPoolable' Artemis.ComponentPoolable' Artemis.ComponentPoolable' Artemis.ComponentPoolable' Artemis.Entity' Artemis.EntityWorld' Artemis.Entity' Artemis.EntityWorld' Artemis.Entity' Artemis.EntityWorld' Artemis.Entity' Artemis.EntityWorld' Artemis.Entity' Artemis.EntityWorld' Artemis.Entity' Artemis.EntityWorld' Artemis.Entity' Artemis.EntityWorld
Artemis_Mono,Artemis.Manager,Artemis.ComponentMapper<T>' Artemis.Entity' Artemis.ComponentType<T>' Artemis.Aspect' Artemis.EntityWorld' Artemis.Attributes.ArtemisEntitySystem' Artemis.System.QueueSystemProcessingThreadSafe' Artemis.System.QueueSystemProcessingThreadSafe<T>,Artemis.ComponentPoolable' Artemis.ComponentType' Artemis.Interface.IComponent' Artemis.ComponentPoolable' Artemis.ComponentType' Artemis.Interface.IComponent' Artemis.ComponentPoolable' Artemis.ComponentType' Artemis.Interface.IComponent' Artemis.ComponentPoolable' Artemis.ComponentType' Artemis.Interface.IComponent' Artemis.ComponentPoolable' Artemis.ComponentType' Artemis.Interface.IComponent' Artemis.ComponentPoolable' Artemis.ComponentType' Artemis.Attributes.AppDomain' Artemis.Interface.IComponent' Artemis.ComponentPoolable' Artemis.ComponentType' Artemis.Interface.IComponent' Artemis.Aspect' Artemis.ComponentType<T>' Artemis.Entity' Artemis.EntityWorld' Artemis.Interface.IComponentPool' Artemis.System.EntitySystem' Artemis.Utils.Bag<T>' Artemis.Aspect' Artemis.ComponentType<T>' Artemis.Entity' Artemis.EntityWorld' Artemis.Interface.IComponentPool' Artemis.System.EntitySystem' Artemis.Utils.Bag<T>' Artemis.Aspect' Artemis.ComponentType<T>' Artemis.Entity' Artemis.EntityWorld' Artemis.Interface.IComponentPool' Artemis.System.EntitySystem' Artemis.Utils.Bag<T>' Artemis.Aspect' Artemis.ComponentType<T>' Artemis.Entity' Artemis.EntityWorld' Artemis.Interface.IComponentPool' Artemis.System.EntitySystem' Artemis.Utils.Bag<T>' Artemis.Aspect' Artemis.ComponentType<T>' Artemis.Entity' Artemis.EntityWorld' Artemis.Interface.IComponentPool' Artemis.System.EntitySystem' Artemis.Utils.Bag<T>' Artemis.Aspect' Artemis.ComponentType<T>' Artemis.Entity' Artemis.EntityWorld' Artemis.Interface.IComponentPool' Artemis.System.EntitySystem' Artemis.Utils.Bag<T>' Artemis.Aspect' Artemis.ComponentType<T>' Artemis.Entity' Artemis.EntityWorld' Artemis.Interface.IComponentPool' Artemis.System.EntitySystem' Artemis.Utils.Bag<T>' Artemis.ComponentPool<T>' Artemis.ComponentPoolMultiThread<T>' Artemis.Attributes.ArtemisComponentCreate' Artemis.Attributes.ArtemisComponentPool' Artemis.Attributes.ArtemisEntitySystem' Artemis.Attributes.ArtemisEntityTemplate' Artemis.Attributes.AttributesProcessor' Artemis.Interface.IEntityTemplate' Artemis.ComponentPool<T>' Artemis.ComponentPoolMultiThread<T>' Artemis.Attributes.ArtemisComponentCreate' Artemis.Attributes.ArtemisComponentPool' Artemis.Attributes.ArtemisEntitySystem' Artemis.Attributes.ArtemisEntityTemplate' Artemis.Attributes.AttributesProcessor' Artemis.Interface.IEntityTemplate' Artemis.ComponentPool<T>' Artemis.ComponentPoolMultiThread<T>' Artemis.Attributes.ArtemisComponentCreate' Artemis.Attributes.ArtemisComponentPool' Artemis.Attributes.ArtemisEntitySystem' Artemis.Attributes.ArtemisEntityTemplate' Artemis.Attributes.AttributesProcessor' Artemis.Interface.IEntityTemplate' Artemis.ComponentPool<T>' Artemis.ComponentPoolMultiThread<T>' Artemis.Attributes.ArtemisComponentCreate' Artemis.Attributes.ArtemisComponentPool' Artemis.Attributes.ArtemisEntitySystem' Artemis.Attributes.ArtemisEntityTemplate' Artemis.Attributes.AttributesProcessor' Artemis.Interface.IEntityTemplate' Artemis.ComponentPool<T>' Artemis.ComponentPoolMultiThread<T>' Artemis.Attributes.ArtemisComponentCreate' Artemis.Attributes.ArtemisComponentPool' Artemis.Attributes.ArtemisEntitySystem' Artemis.Attributes.ArtemisEntityTemplate' Artemis.Attributes.AttributesProcessor' Artemis.Interface.IEntityTemplate' Artemis.ComponentPool<T>' Artemis.ComponentPoolMultiThread<T>' Artemis.Attributes.ArtemisComponentCreate' Artemis.Attributes.ArtemisComponentPool' Artemis.Attributes.ArtemisEntitySystem' Artemis.Attributes.ArtemisEntityTemplate' Artemis.Attributes.AttributesProcessor' Artemis.Interface.IEntityTemplate' Artemis.ComponentPool<T>' Artemis.ComponentPoolMultiThread<T>' Artemis.Attributes.ArtemisComponentCreate' Artemis.Attributes.ArtemisComponentPool' Artemis.Attributes.ArtemisEntitySystem' Artemis.Attributes.ArtemisEntityTemplate' Artemis.Attributes.AttributesProcessor' Artemis.Interface.IEntityTemplate
Artemis_Mono,Artemis.System,Artemis.Manager.EntityManager' Artemis.Manager.SystemBitManager' Artemis.Manager.SystemManager,Artemis.Aspect' Artemis.Entity' Artemis.Aspect' Artemis.Entity' Artemis.Aspect' Artemis.Entity' Artemis.Aspect' Artemis.Entity' Artemis.Aspect' Artemis.Entity' Artemis.Aspect' Artemis.Entity' Artemis.Aspect' Artemis.Entity' Artemis.Utils.Timer' Artemis.Utils.Timer' Artemis.Utils.Timer' Artemis.Utils.Timer' Artemis.Utils.Timer' Artemis.Utils.Timer' Artemis.Utils.Timer' Artemis.Interface.IComponent' Artemis.Interface.IComponent' Artemis.Interface.IComponent' Artemis.Interface.IComponent' Artemis.Interface.IComponent' Artemis.Interface.IComponent' Artemis.Interface.IComponent' Artemis.EntityWorld' Artemis.Blackboard.BlackBoard' Artemis.EntityWorld' Artemis.Blackboard.BlackBoard' Artemis.EntityWorld' Artemis.Blackboard.BlackBoard' Artemis.EntityWorld' Artemis.Blackboard.BlackBoard' Artemis.EntityWorld' Artemis.Blackboard.BlackBoard' Artemis.EntityWorld' Artemis.Blackboard.BlackBoard' Artemis.EntityWorld' Artemis.Blackboard.BlackBoard' Artemis.Manager.QueueManager' Artemis.Manager.QueueManager' Artemis.Manager.QueueManager' Artemis.Manager.QueueManager' Artemis.Manager.QueueManager' Artemis.Manager.QueueManager' Artemis.Manager.QueueManager' Artemis.Manager.QueueManager<T>' Artemis.Manager.QueueManager<T>' Artemis.Manager.QueueManager<T>' Artemis.Manager.QueueManager<T>' Artemis.Manager.QueueManager<T>' Artemis.Manager.QueueManager<T>' Artemis.Manager.QueueManager<T>
Artemis_Mono,Artemis.Utils,Artemis.Entity' Artemis.EntityWorld' Artemis.Manager.GroupManager' Artemis.Manager.SystemManager' Artemis.Manager.EntityManager' Artemis.System.IntervalEntitySystem' Artemis.System.DelayedEntitySystem' Artemis.System.IntervalTagSystem,
