Project,Namespace,Ca types,Ce types
Common,Dwarrowdelf.AI,Dwarrowdelf.Client.DwarfAI' MyArea.Area' Dwarrowdelf.Server.EnvWildlifeHandler' Dwarrowdelf.Jobs.Assignments.GrazeMoveAssignment' Dwarrowdelf.Client.LivingObject' Dwarrowdelf.Server.LivingObject,Dwarrowdelf.ILivingObject' Dwarrowdelf.LivingCategory' Dwarrowdelf.IntGrid2Z' Dwarrowdelf.IntVector3' Dwarrowdelf.IEnvironmentObject' Dwarrowdelf.SaveGamePropertyAttribute' Dwarrowdelf.SaveGameContext' Dwarrowdelf.ActionPriority' Dwarrowdelf.Jobs.IAssignment' Dwarrowdelf.Jobs.Assignments.RandomMoveAssignment' Dwarrowdelf.Jobs.Assignments.AttackAssignment' Dwarrowdelf.MyTraceProxy' Dwarrowdelf.Jobs.IJob' Dwarrowdelf.Jobs.JobStatus' Dwarrowdelf.DoubleVector3' Dwarrowdelf.IWorld' Dwarrowdelf.Jobs.Assignments.FleeMoveAssignment' Dwarrowdelf.Jobs.Assignments.GrazeMoveAssignment' Dwarrowdelf.IBaseObject' Dwarrowdelf.ActionStartEvent' Dwarrowdelf.ActionProgressEvent' Dwarrowdelf.ActionDoneEvent' Dwarrowdelf.GameAction' Dwarrowdelf.ActionState
Common,Dwarrowdelf,Dwarrowdelf.Client.App' Dwarrowdelf.Client.GrowingTileGrid' Dwarrowdelf.Client.Chunk' Dwarrowdelf.Client.Designation' Dwarrowdelf.Client.EnvironmentObject' Dwarrowdelf.TerrainGen.DungeonTerrainGenerator' Dwarrowdelf.TerrainGen.TerrainData' Dwarrowdelf.TerrainGen.TerrainHelpers' Dwarrowdelf.Server.Fortress.DungeonGame' Dwarrowdelf.Server.Fortress.DungeonWorldCreator' Dwarrowdelf.Server.Fortress.FortressGame' Dwarrowdelf.Server.Fortress.FortressWorldPopulator' Dwarrowdelf.Server.EnvTreeHandler' Dwarrowdelf.Server.LivingObject' Dwarrowdelf.Server.EnvironmentObject' Dwarrowdelf.TerrainGen.RiverGen' Dwarrowdelf.Jobs.Assignments.HaulToAreaAssignment' Dwarrowdelf.Jobs.Assignments.MoveToAreaAssignment' Dwarrowdelf.Server.EnvWaterHandler' Dwarrowdelf.Client.ItemTracker' Dwarrowdelf.Jobs.Assignments.HaulAssignment' Dwarrowdelf.Jobs.Assignments.AttackAssignment' Dwarrowdelf.Jobs.Assignments.MoveAssignment' Dwarrowdelf.Server.Fortress.DwarfAI' Dwarrowdelf.Server.VisionTrackerGlobalFOV' Dwarrowdelf.Client.ChangeHandler' Dwarrowdelf.Messages.ChangeMessage' Dwarrowdelf.Client.World' Dwarrowdelf.Server.TickStartChange' Dwarrowdelf.Server.TurnStartChange' Dwarrowdelf.Server.TurnEndChange' Dwarrowdelf.Server.GameDateChange' Dwarrowdelf.Server.MapChange' Dwarrowdelf.Server.ObjectCreatedChange' Dwarrowdelf.Server.ObjectDestructedChange' Dwarrowdelf.Server.PropertyValueChange' Dwarrowdelf.Server.PropertyIntChange' Dwarrowdelf.Server.PropertyStringChange' Dwarrowdelf.Server.ObjectMoveChange' Dwarrowdelf.Server.ObjectMoveLocationChange' Dwarrowdelf.Server.SkillChange' Dwarrowdelf.Server.ActionStartedChange' Dwarrowdelf.Server.ActionProgressChange' Dwarrowdelf.Server.ActionDoneChange' Dwarrowdelf.Client.ChunkManager' Dwarrowdelf.Client.ClientUser' Dwarrowdelf.Server.User' Dwarrowdelf.Client.LivingObject' Dwarrowdelf.TerrainGen.MyTarget' Dwarrowdelf.Server.GameEngine' Dwarrowdelf.Client.UI.CoordinateValueConverter' Dwarrowdelf.AI.HerbivoreAI' Dwarrowdelf.Jobs.Assignments.FleeMoveAssignment' Dwarrowdelf.Client.TileControl.TileControlCore3D' Dwarrowdelf.Client.TileControl.TileControlCoreMap3D' Dwarrowdelf.Server.Fortress.EnvObserver' Dwarrowdelf.Client.UI.LaborManagerDialog' Dwarrowdelf.Client.UI.CreateLivingDialog' Dwarrowdelf.Client.UI.CreateItemDialog' Dwarrowdelf.Client.Program' Dwarrowdelf.Client.ItemSymbols' Dwarrowdelf.Client.LivingSymbols' Dwarrowdelf.Server.World' Dwarrowdelf.Client.ManualControlAI' Dwarrowdelf.AI.IAI' Dwarrowdelf.AI.AssignmentAI' Dwarrowdelf.Client.BuildItemManager' Dwarrowdelf.Jobs.AssignmentGroups.FetchItemAssignment' MyArea.Area' MyArea.MyEngine' Dwarrowdelf.Server.EnvWildlifeHandler' Dwarrowdelf.Server.LivingObjectBuilder' Dwarrowdelf.Client.DwarfAI' Dwarrowdelf.AI.AIHelpers' Dwarrowdelf.AI.MonsterAI' Dwarrowdelf.Client.ReportHandler' Dwarrowdelf.Server.Player' Dwarrowdelf.Client.BuildOrder' Dwarrowdelf.Client.ConstructManager' Dwarrowdelf.Client.InstallItemManager' Dwarrowdelf.Client.StoreToStockpileJob' Dwarrowdelf.Client.Stockpile' Dwarrowdelf.AI.CarnivoreAI' Dwarrowdelf.AI.Group' Dwarrowdelf.Jobs.AssignmentGroups.MoveSleepAssignment' Dwarrowdelf.Jobs.AssignmentGroups.MoveConstructAssignment' Dwarrowdelf.Jobs.AssignmentGroups.MoveInstallItemAssignment' Dwarrowdelf.Jobs.AssignmentGroups.AssignmentGroup' Dwarrowdelf.Jobs.AssignmentGroups.PatrolAssignment' Dwarrowdelf.Jobs.AssignmentGroups.MoveBaseAssignment' Dwarrowdelf.Jobs.AssignmentGroups.MoveConsumeAssignment' Dwarrowdelf.Jobs.AssignmentGroups.MoveFellTreeAssignment' Dwarrowdelf.Jobs.AssignmentGroups.MoveBuildItemAssignment' Dwarrowdelf.Jobs.AssignmentGroups.MoveMineAssignment' Dwarrowdelf.Jobs.Assignments.SleepAssignment' Dwarrowdelf.Jobs.Assignments.ConstructAssignment' Dwarrowdelf.Jobs.Assignments.CarryItemAssignment' Dwarrowdelf.Jobs.Assignments.InstallItemAssignment' Dwarrowdelf.Jobs.Assignments.GenericDebugAssignment' Dwarrowdelf.Jobs.Assignments.GrazeMoveAssignment' Dwarrowdelf.Jobs.Assignments.MoveAssignmentBase' Dwarrowdelf.Jobs.Assignments.RandomMoveAssignment' Dwarrowdelf.Jobs.Assignments.ConsumeItemAssignment' Dwarrowdelf.Jobs.Assignments.FellTreeAssignment' Dwarrowdelf.Jobs.Assignments.WaitAssignment' Dwarrowdelf.Jobs.Assignments.GetItemAssignment' Dwarrowdelf.Jobs.Assignments.BuildItemAssignment' Dwarrowdelf.Jobs.Assignments.MineAssignment' Dwarrowdelf.Jobs.Assignments.Assignment' Dwarrowdelf.Jobs.Assignments.DropItemAssignment' Dwarrowdelf.Jobs.JobGroups.ConstructJob' Dwarrowdelf.Jobs.JobGroups.InstallItemJob' Dwarrowdelf.Jobs.JobGroups.JobGroup' Dwarrowdelf.Jobs.JobGroups.FetchItems' Dwarrowdelf.Jobs.JobGroups.BuildItemJob' Dwarrowdelf.Server.Fortress.DungeonPlayer' Dwarrowdelf.Server.Fortress.FortressPlayer' Dwarrowdelf.Server.Fortress.FoodGenerator' Dwarrowdelf.Server.Fortress.WaterGenerator' Dwarrowdelf.Server.BaseObject' Dwarrowdelf.Server.ContainerObject' Dwarrowdelf.Server.ItemObject' Dwarrowdelf.Server.ConcreteObject' Dwarrowdelf.Server.ProcessableList<T>' Dwarrowdelf.Server.MovableObject' Dwarrowdelf.Client.ItemObject' Dwarrowdelf.Client.ClientSaveHelper' Dwarrowdelf.Client.UI.MainWindow' Dwarrowdelf.Client.CleanAreaJob' Dwarrowdelf.Server.Fortress.FortressWorldCreator' Dwarrowdelf.Client.UI.BuildMaterialsView' Dwarrowdelf.Client.UI.ItemIDAndMaterialIDToDrawingConverter' Dwarrowdelf.Client.UI.SelectableItemID' Dwarrowdelf.Server.Fortress.Helpers' Dwarrowdelf.Server.ItemObjectBuilder' Dwarrowdelf.Client.UI.BuildOrderEditable' Dwarrowdelf.Client.UI.StockpileCriteriaEditable' Dwarrowdelf.Client.CommandPromptHandler' Dwarrowdelf.Client.UI.SelectableItemCategory' Dwarrowdelf.Client.UI.InstallItemDialog' Dwarrowdelf.Client.UI.StockpileEditControlMockData' Dwarrowdelf.Client.TurnHandler' Dwarrowdelf.Client.TileControl.TileControlCore' Dwarrowdelf.Client.ConnectManager' Dwarrowdelf.Client.UI.ObjectIDConverter' Dwarrowdelf.Messages.ReportMessage' Dwarrowdelf.Client.EmbeddedServer' Dwarrowdelf.Server.ServerLauncher' Dwarrowdelf.Client.BuildableItemSaveConverter' Dwarrowdelf.Client.ChunkOutlineRenderer' Dwarrowdelf.Client.DesignationRenderer' Dwarrowdelf.Client.MousePositionService' Dwarrowdelf.Client.SelectionRenderer' Dwarrowdelf.Client.VoxelMap' Dwarrowdelf.Client.VoxelRayCast' Dwarrowdelf.TerrainGen.ArtificialGen' Dwarrowdelf.TerrainGen.NoiseTerrainGen' Dwarrowdelf.TerrainGen.TerrainGenerator' Dwarrowdelf.Server.Fortress.NoiseWorldCreator' Dwarrowdelf.Server.Fortress.ArtificialWorldCreator' Dwarrowdelf.Client.UI.MovableObjectPropertiesControl' Dwarrowdelf.Client.MapSelection' Dwarrowdelf.Client.UI.TileAreaView' Dwarrowdelf.Client.CursorService' Dwarrowdelf.Client.MapControl3D' Dwarrowdelf.Client.ToolTipService' Dwarrowdelf.Client.MyExtensions' Dwarrowdelf.Client.MyGame' Dwarrowdelf.Client.SelectionService' Dwarrowdelf.Client.SymbolEffect' Dwarrowdelf.Client.SymbolRenderer' Dwarrowdelf.Client.ViewGridAdjusterService' Dwarrowdelf.Client.ViewGridProvider' Dwarrowdelf.Client.CubeFaceInfo' Dwarrowdelf.Client.TerrainEffect' Dwarrowdelf.Client.TerrainVertex' Dwarrowdelf.Client.ConstructJobData' Dwarrowdelf.Client.ContainerObject' Dwarrowdelf.Client.ClientEvent' Dwarrowdelf.Client.Events' Dwarrowdelf.Client.InstallJobData' Dwarrowdelf.Client.Unreachables' Dwarrowdelf.Client.MovableObject' Dwarrowdelf.Client.TargetItemTracker' Dwarrowdelf.Client.LocationComparer' Dwarrowdelf.Server.VisionTrackerBase' Dwarrowdelf.Server.AdminVisionTracker' Dwarrowdelf.Server.AllVisibleVisionTracker' Dwarrowdelf.Server.MyTarget' Dwarrowdelf.Server.VisionTrackerLOS' Dwarrowdelf.Server.IVisionTracker' Dwarrowdelf.Client.TileSet' Dwarrowdelf.Client.TileKey' Dwarrowdelf.Client.UI.SymbolAndColorToDrawingConverter' Dwarrowdelf.Client.FaceTexture' Dwarrowdelf.Client.ConcreteObject' Dwarrowdelf.Client.UI.SelectableMaterialID' Dwarrowdelf.Client.UI.SelectableMaterial' Dwarrowdelf.Client.UI.SetTerrainDialog' Dwarrowdelf.Client.UI.SelectableMaterialCategory' Dwarrowdelf.Client.UI.FpsGraphControl' Dwarrowdelf.TerrainGen.BSPTree' Dwarrowdelf.TerrainGen.DiamondSquare' Dwarrowdelf.Messages.WorldDataMessage' Dwarrowdelf.Client.BaseObject' Dwarrowdelf.Messages.ObjectDataMessage' Dwarrowdelf.Server.PlayerChangeHandler' Dwarrowdelf.Server.PropertyChange' Dwarrowdelf.Server.AdminChangeHandler' Dwarrowdelf.Client.DebugScriptMessages' Dwarrowdelf.Jobs.JobGroups.FellTreeParallelJob' Dwarrowdelf.Messages.MapDataTerrainsMessage' Dwarrowdelf.Client.TileControl.TileRenderContext' Dwarrowdelf.Client.KeyboardHandler' Dwarrowdelf.Client.UI.LivingControlWindow' Dwarrowdelf.Client.KeyHelpers' Dwarrowdelf.Client.CameraKeyHandler' Dwarrowdelf.Jobs.Assignments.QueueConverter' Dwarrowdelf.TerrainGen.BSPNode' Dwarrowdelf.Client.UI.MainWindowCommandHandler' Dwarrowdelf.Client.GameDataBase' Dwarrowdelf.Messages.LogOnReplyBeginMessage' Dwarrowdelf.Server.GameFactory' Dwarrowdelf.Client.EmbeddedServerOptions' Dwarrowdelf.Client.Program' Dwarrowdelf.Client.ClientObjectRefResolver' Dwarrowdelf.Client.IdentifiableCollection' Dwarrowdelf.Client.IdentifiableCollection<T>' Dwarrowdelf.Messages.ObjectDataEndMessage' Dwarrowdelf.Messages.MapDataTerrainsListMessage' Dwarrowdelf.Messages.ControllablesDataMessage' Dwarrowdelf.Server.KeyedObjectCollection' Dwarrowdelf.Jobs.IAssignment' Dwarrowdelf.Jobs.JobManager' Dwarrowdelf.Jobs.IJobGroup' Dwarrowdelf.Jobs.IJobSource' Dwarrowdelf.Client.Camera' Dwarrowdelf.Server.TileGridReaderWriter' Dwarrowdelf.Client.UI.StockpileEditControl' Dwarrowdelf.Client.UI.ConstructDialog,MemoryMappedLog.LogComponent' MemoryMappedLog.MMLog' Dwarrowdelf.Messages.Message
Common,Dwarrowdelf.TerrainGen,Dwarrowdelf.Server.Fortress.ArtificialWorldCreator' Dwarrowdelf.Server.Fortress.NoiseWorldCreator' Dwarrowdelf.Server.Fortress.DungeonWorldCreator' Dwarrowdelf.Server.Fortress.FortressWorldCreator' Dwarrowdelf.Server.EnvironmentObject,Dwarrowdelf.IntVector3' Dwarrowdelf.MyMath' Dwarrowdelf.IntSize3' Dwarrowdelf.TileData' Dwarrowdelf.MaterialID' Dwarrowdelf.IntSize2' Dwarrowdelf.IntVector2' Dwarrowdelf.AStarResult' Dwarrowdelf.AStar' Dwarrowdelf.AStarStatus' Dwarrowdelf.DirectionSet' Dwarrowdelf.MWCRandom' Dwarrowdelf.DirectionExtensions' Dwarrowdelf.TileID' Dwarrowdelf.IntGrid2' Dwarrowdelf.Materials' Dwarrowdelf.MaterialInfo' Dwarrowdelf.TileFlags' Dwarrowdelf.MaterialCategory' Dwarrowdelf.DoubleVector3' Dwarrowdelf.IntGrid3
Common,Dwarrowdelf.Jobs.AssignmentGroups,Dwarrowdelf.Server.Fortress.DwarfAI' Dwarrowdelf.Jobs.JobGroups.FellTreeParallelJob,Dwarrowdelf.SaveGamePropertyAttribute' Dwarrowdelf.Jobs.IJobObserver' Dwarrowdelf.IItemObject' Dwarrowdelf.SaveGameContext' Dwarrowdelf.Jobs.JobStatus' Dwarrowdelf.Jobs.IAssignment' Dwarrowdelf.DirectionSet' Dwarrowdelf.ConstructMode' Dwarrowdelf.IEnvironmentObject' Dwarrowdelf.IntVector3' Dwarrowdelf.Jobs.Assignments.ConstructAssignment' Dwarrowdelf.InstallMode' Dwarrowdelf.LaborID' Dwarrowdelf.ILivingObject' Dwarrowdelf.ActionState' Dwarrowdelf.Jobs.IJob' Dwarrowdelf.Jobs.Assignments.MoveAssignment' Dwarrowdelf.Jobs.Assignments.FellTreeAssignment' Dwarrowdelf.Workbenches' Dwarrowdelf.WorkbenchInfo' Dwarrowdelf.BuildableItem' Dwarrowdelf.Jobs.Assignments.BuildItemAssignment' Dwarrowdelf.MineActionType' Dwarrowdelf.Jobs.Assignments.MineAssignment
Common,Dwarrowdelf.Jobs.Assignments,Dwarrowdelf.Jobs.AssignmentGroups.MoveConstructAssignment' Dwarrowdelf.AI.HerbivoreAI' Dwarrowdelf.Client.DwarfAI' Dwarrowdelf.AI.MonsterAI' Dwarrowdelf.AI.CarnivoreAI' Dwarrowdelf.Server.Fortress.DwarfAI' Dwarrowdelf.Jobs.AssignmentGroups.MoveFellTreeAssignment' Dwarrowdelf.Jobs.AssignmentGroups.PatrolAssignment' Dwarrowdelf.Jobs.AssignmentGroups.MoveBuildItemAssignment' Dwarrowdelf.Jobs.AssignmentGroups.MoveMineAssignment,Dwarrowdelf.SaveGamePropertyAttribute' Dwarrowdelf.Jobs.IJobObserver' Dwarrowdelf.IItemObject' Dwarrowdelf.SaveGameContext' Dwarrowdelf.SleepAction' Dwarrowdelf.Jobs.JobStatus' Dwarrowdelf.ConstructMode' Dwarrowdelf.IEnvironmentObject' Dwarrowdelf.IntVector3' Dwarrowdelf.ConstructAction' Dwarrowdelf.CarryItemAction' Dwarrowdelf.IntGrid3' Dwarrowdelf.DirectionSet' Dwarrowdelf.AStarResult' Dwarrowdelf.AStar' Dwarrowdelf.ILivingObject' Dwarrowdelf.AStarStatus' Dwarrowdelf.DoubleVector3' Dwarrowdelf.Direction' Dwarrowdelf.GameAction' Dwarrowdelf.IntVector2' Dwarrowdelf.WaitAction' Dwarrowdelf.MoveAction' Dwarrowdelf.ActionState' Dwarrowdelf.InstallMode' Dwarrowdelf.InstallItemAction' Dwarrowdelf.AI.Group' Dwarrowdelf.IWorld' Dwarrowdelf.DirectionExtensions' Dwarrowdelf.AttackAction' Dwarrowdelf.ConsumeAction' Dwarrowdelf.FellTreeAction' Dwarrowdelf.GetItemAction' Dwarrowdelf.BuildItemAction' Dwarrowdelf.MineActionType' Dwarrowdelf.MineAction' Dwarrowdelf.DropItemAction
Common,Dwarrowdelf.Jobs.JobGroups,Dwarrowdelf.Client.ConstructManager' Dwarrowdelf.Client.ConstructJobData' Dwarrowdelf.Client.BuildItemManager,Dwarrowdelf.SaveGamePropertyAttribute' Dwarrowdelf.ConstructMode' Dwarrowdelf.DirectionSet' Dwarrowdelf.Jobs.IJobObserver' Dwarrowdelf.IItemObject' Dwarrowdelf.IEnvironmentObject' Dwarrowdelf.IntVector3' Dwarrowdelf.SaveGameContext' Dwarrowdelf.Jobs.JobStatus' Dwarrowdelf.Jobs.IJob' Dwarrowdelf.InstallMode' Dwarrowdelf.IntGrid3' Dwarrowdelf.Jobs.AssignmentGroups.MoveFellTreeAssignment' Dwarrowdelf.TileData' Dwarrowdelf.Jobs.IAssignment' Dwarrowdelf.Jobs.IJobGroup' Dwarrowdelf.ILivingObject
Common,Dwarrowdelf.Jobs,Dwarrowdelf.Client.BuildItemManager' Dwarrowdelf.Client.ConstructManager' Dwarrowdelf.Client.Designation' Dwarrowdelf.Client.DwarfAI' Dwarrowdelf.Client.InstallItemManager' Dwarrowdelf.Client.CleanAreaJob' Dwarrowdelf.Client.StoreToStockpileJob' Dwarrowdelf.Client.Stockpile' Dwarrowdelf.AI.MonsterAI' Dwarrowdelf.AI.HerbivoreAI' Dwarrowdelf.AI.AssignmentAI' Dwarrowdelf.Jobs.AssignmentGroups.MoveSleepAssignment' Dwarrowdelf.Jobs.AssignmentGroups.MoveInstallItemAssignment' Dwarrowdelf.Jobs.AssignmentGroups.FetchItemAssignment' Dwarrowdelf.Jobs.AssignmentGroups.AssignmentGroup' Dwarrowdelf.Jobs.AssignmentGroups.MoveBaseAssignment' Dwarrowdelf.Jobs.AssignmentGroups.MoveConsumeAssignment' Dwarrowdelf.Jobs.Assignments.SleepAssignment' Dwarrowdelf.Jobs.Assignments.ConstructAssignment' Dwarrowdelf.Jobs.Assignments.CarryItemAssignment' Dwarrowdelf.Jobs.Assignments.HaulToAreaAssignment' Dwarrowdelf.Jobs.Assignments.HaulAssignment' Dwarrowdelf.Jobs.Assignments.FleeMoveAssignment' Dwarrowdelf.Jobs.Assignments.InstallItemAssignment' Dwarrowdelf.Jobs.Assignments.GenericDebugAssignment' Dwarrowdelf.Jobs.Assignments.GrazeMoveAssignment' Dwarrowdelf.Jobs.Assignments.MoveAssignmentBase' Dwarrowdelf.Jobs.Assignments.MoveToAreaAssignment' Dwarrowdelf.Jobs.Assignments.AttackAssignment' Dwarrowdelf.Jobs.Assignments.RandomMoveAssignment' Dwarrowdelf.Jobs.Assignments.ConsumeItemAssignment' Dwarrowdelf.Jobs.Assignments.FellTreeAssignment' Dwarrowdelf.Jobs.Assignments.WaitAssignment' Dwarrowdelf.Jobs.Assignments.MoveAssignment' Dwarrowdelf.Jobs.Assignments.GetItemAssignment' Dwarrowdelf.Jobs.Assignments.BuildItemAssignment' Dwarrowdelf.Jobs.Assignments.MineAssignment' Dwarrowdelf.Jobs.Assignments.Assignment' Dwarrowdelf.Jobs.Assignments.DropItemAssignment' Dwarrowdelf.Jobs.JobGroups.ConstructJob' Dwarrowdelf.Jobs.JobGroups.InstallItemJob' Dwarrowdelf.Jobs.JobGroups.FellTreeParallelJob' Dwarrowdelf.Jobs.JobGroups.JobGroup' Dwarrowdelf.Jobs.JobGroups.FetchItems' Dwarrowdelf.Jobs.JobGroups.BuildItemJob' Dwarrowdelf.Server.Fortress.DwarfAI' Dwarrowdelf.Jobs.AssignmentGroups.MoveConstructAssignment' Dwarrowdelf.Jobs.AssignmentGroups.PatrolAssignment' Dwarrowdelf.Jobs.AssignmentGroups.MoveFellTreeAssignment' Dwarrowdelf.Jobs.AssignmentGroups.MoveBuildItemAssignment' Dwarrowdelf.Jobs.AssignmentGroups.MoveMineAssignment' Dwarrowdelf.Client.UI.MainWindow' Dwarrowdelf.Client.DesignationData' Dwarrowdelf.Client.InstallJobData' Dwarrowdelf.Client.LivingObject' Dwarrowdelf.AI.CarnivoreAI' Dwarrowdelf.Server.LivingObject,Dwarrowdelf.ILivingObject' Dwarrowdelf.ActionState' Dwarrowdelf.IWorld
Common,Dwarrowdelf.Messages,Dwarrowdelf.Client.ClientUser' Dwarrowdelf.DirectConnection' Dwarrowdelf.IConnection' Dwarrowdelf.PipeConnection' Dwarrowdelf.TcpConnection' Dwarrowdelf.Serializer' Dwarrowdelf.Server.GameEngine' Dwarrowdelf.Server.Player' Dwarrowdelf.Server.User' Dwarrowdelf.Server.ChangeHandler' Dwarrowdelf.Server.IPlayer' Dwarrowdelf.Client.ReportHandler' Dwarrowdelf.Client.UI.ConsoleDialog' Dwarrowdelf.Client.DebugScriptMessages' Dwarrowdelf.Client.UI.BaseObjectPropertiesControl' Dwarrowdelf.Client.UI.ItemObjectPropertiesControl' Dwarrowdelf.Client.UI.MovableObjectPropertiesControl' Dwarrowdelf.Server.MyStream' Dwarrowdelf.Client.ChangeHandler' Dwarrowdelf.Server.AdminChangeHandler' Dwarrowdelf.Server.PlayerChangeHandler' Dwarrowdelf.Server.EnvironmentObject' Dwarrowdelf.Server.VisionTrackerGlobalFOV' Dwarrowdelf.Server.VisionTrackerLOS' Dwarrowdelf.Client.UI.MainWindowMenuBar,Dwarrowdelf.GameReport' Dwarrowdelf.GameMode' Dwarrowdelf.ChangeData' Dwarrowdelf.WorldData' Dwarrowdelf.BaseGameObjectData' Dwarrowdelf.ObjectID' Dwarrowdelf.IntGrid3
