Project,Namespace,Ca types,Ce types
Core.Net_3_5,Remotion.Linq.Clauses.ResultOperators,Remotion.Linq.Parsing.Structure.IntermediateModel.AggregateFromSeedExpressionNode' Remotion.Linq.Parsing.Structure.IntermediateModel.AggregateExpressionNode' Remotion.Linq.Parsing.Structure.IntermediateModel.AllExpressionNode' Remotion.Linq.Parsing.Structure.IntermediateModel.AnyExpressionNode' Remotion.Linq.Parsing.Structure.IntermediateModel.AsQueryableExpressionNode' Remotion.Linq.Clauses.ResultOperatorBase' Remotion.Linq.Parsing.Structure.IntermediateModel.AverageExpressionNode' Remotion.Linq.Parsing.Structure.IntermediateModel.CastExpressionNode' Remotion.Linq.Parsing.Structure.IntermediateModel.ConcatExpressionNode' Remotion.Linq.Parsing.Structure.IntermediateModel.ContainsExpressionNode' Remotion.Linq.QueryModel' Remotion.Linq.IQueryExecutor' Remotion.Linq.Parsing.Structure.IntermediateModel.CountExpressionNode' Remotion.Linq.Parsing.Structure.IntermediateModel.DefaultIfEmptyExpressionNode' Remotion.Linq.Parsing.Structure.IntermediateModel.DistinctExpressionNode' Remotion.Linq.Parsing.Structure.IntermediateModel.ExceptExpressionNode' Remotion.Linq.Parsing.Structure.IntermediateModel.FirstExpressionNode' Remotion.Linq.Parsing.Structure.IntermediateModel.GroupByExpressionNode' Remotion.Linq.Parsing.Structure.IntermediateModel.IntersectExpressionNode' Remotion.Linq.Parsing.Structure.IntermediateModel.LastExpressionNode' Remotion.Linq.Parsing.Structure.IntermediateModel.LongCountExpressionNode' Remotion.Linq.Parsing.Structure.IntermediateModel.MaxExpressionNode' Remotion.Linq.Parsing.Structure.IntermediateModel.MinExpressionNode' Remotion.Linq.Parsing.Structure.IntermediateModel.OfTypeExpressionNode' Remotion.Linq.Parsing.Structure.IntermediateModel.ReverseExpressionNode' Remotion.Linq.Parsing.Structure.IntermediateModel.SingleExpressionNode' Remotion.Linq.Parsing.Structure.IntermediateModel.SkipExpressionNode' Remotion.Linq.Parsing.Structure.IntermediateModel.SumExpressionNode' Remotion.Linq.Parsing.Structure.IntermediateModel.TakeExpressionNode' Remotion.Linq.Parsing.Structure.IntermediateModel.UnionExpressionNode,JetBrains.Annotations.NotNullAttribute' Remotion.Utilities.ArgumentUtility' Remotion.Utilities.Assertion' Remotion.Linq.Clauses.CloneContext' Remotion.Linq.Clauses.ResultOperatorBase' Remotion.Linq.Clauses.Expressions.QuerySourceReferenceExpression' Remotion.Linq.Clauses.ExpressionVisitors.ReverseResolvingExpressionVisitor' Remotion.Linq.Clauses.StreamedData.IStreamedDataInfo' Remotion.Linq.Clauses.StreamedData.StreamedScalarValueInfo' Remotion.Linq.Clauses.StreamedData.StreamedSequence' Remotion.Linq.Clauses.StreamedData.StreamedSequenceInfo' Remotion.Linq.Clauses.StreamedData.StreamedValue' Remotion.Linq.Clauses.StreamedData.StreamedValueInfo' JetBrains.Annotations.NotNullAttribute' Remotion.Utilities.ArgumentUtility' Remotion.Utilities.Assertion' Remotion.Linq.Clauses.CloneContext' Remotion.Linq.Clauses.ResultOperatorBase' Remotion.Linq.Clauses.Expressions.QuerySourceReferenceExpression' Remotion.Linq.Clauses.ExpressionVisitors.ReverseResolvingExpressionVisitor' Remotion.Linq.Clauses.StreamedData.IStreamedDataInfo' Remotion.Linq.Clauses.StreamedData.StreamedScalarValueInfo' Remotion.Linq.Clauses.StreamedData.StreamedSequence' Remotion.Linq.Clauses.StreamedData.StreamedSequenceInfo' Remotion.Linq.Clauses.StreamedData.StreamedValue' Remotion.Linq.Clauses.StreamedData.StreamedValueInfo' JetBrains.Annotations.NotNullAttribute' Remotion.Utilities.ArgumentUtility' Remotion.Utilities.Assertion' Remotion.Linq.Clauses.CloneContext' Remotion.Linq.Clauses.ResultOperatorBase' Remotion.Linq.Clauses.Expressions.QuerySourceReferenceExpression' Remotion.Linq.Clauses.ExpressionVisitors.ReverseResolvingExpressionVisitor' Remotion.Linq.Clauses.StreamedData.IStreamedDataInfo' Remotion.Linq.Clauses.StreamedData.StreamedScalarValueInfo' Remotion.Linq.Clauses.StreamedData.StreamedSequence' Remotion.Linq.Clauses.StreamedData.StreamedSequenceInfo' Remotion.Linq.Clauses.StreamedData.StreamedValue' Remotion.Linq.Clauses.StreamedData.StreamedValueInfo' Remotion.Linq.IQueryModelVisitor' Remotion.Linq.IQueryModelVisitor' Remotion.Linq.IQueryModelVisitor' Remotion.Linq.Clauses.StreamedData.StreamedSingleValueInfo' Remotion.Linq.Clauses.StreamedData.StreamedSingleValueInfo' Remotion.Linq.Clauses.StreamedData.StreamedSingleValueInfo' Remotion.Linq.Clauses.IQuerySource' Remotion.Linq.Clauses.IQuerySource' Remotion.Linq.Clauses.IQuerySource' Remotion.Linq.Utilities.ReflectionUtility' Remotion.Linq.Utilities.ReflectionUtility' Remotion.Linq.Utilities.ReflectionUtility' Remotion.Linq.Utilities.ReflectionUtility' Remotion.Linq.Utilities.ReflectionUtility' Remotion.Linq.Utilities.ReflectionUtility' Remotion.Linq.Utilities.ReflectionUtility' Remotion.Linq.Utilities.ReflectionUtility' Remotion.Linq.Utilities.ReflectionUtility' Remotion.Linq.Utilities.ReflectionUtility' Remotion.Linq.QueryModel' Remotion.Linq.QueryModel' Remotion.Linq.QueryModel' Remotion.Linq.Clauses.StreamedData.IStreamedData' Remotion.Linq.Clauses.StreamedData.IStreamedData' Remotion.Linq.Clauses.StreamedData.IStreamedData
Core.Net_3_5,Remotion.Linq.Clauses.StreamedData,Remotion.Linq.QueryProviderBase' Remotion.Linq.Clauses.ResultOperators.ValueFromSequenceResultOperatorBase' Remotion.Linq.Clauses.ResultOperatorBase' Remotion.Linq.Clauses.ResultOperators.SequenceFromSequenceResultOperatorBase' Remotion.Linq.QueryModel' Remotion.Linq.Clauses.ResultOperators.AverageResultOperator' Remotion.Linq.Clauses.ResultOperators.AnyResultOperator' Remotion.Linq.Clauses.ResultOperators.AggregateResultOperator' Remotion.Linq.Clauses.ResultOperators.CastResultOperator' Remotion.Linq.Clauses.ResultOperators.AllResultOperator' Remotion.Linq.Clauses.ResultOperators.AggregateFromSeedResultOperator' Remotion.Linq.Clauses.ResultOperators.ChoiceResultOperatorBase' Remotion.Linq.Clauses.ResultOperators.ConcatResultOperator' Remotion.Linq.Clauses.ResultOperators.CountResultOperator' Remotion.Linq.Clauses.ResultOperators.ContainsResultOperator' Remotion.Linq.Clauses.ResultOperators.GroupResultOperator' Remotion.Linq.Clauses.ResultOperators.LongCountResultOperator' Remotion.Linq.Clauses.ResultOperators.OfTypeResultOperator' Remotion.Linq.Clauses.ResultOperators.SequenceTypePreservingResultOperatorBase' Remotion.Linq.Clauses.ResultOperators.SumResultOperator' Remotion.Linq.Clauses.ResultOperators.UnionResultOperator' Remotion.Linq.Clauses.ResultOperators.FirstResultOperator' Remotion.Linq.Clauses.ResultOperators.MaxResultOperator' Remotion.Linq.Clauses.ResultOperators.SingleResultOperator' Remotion.Linq.Clauses.ResultOperators.MinResultOperator' Remotion.Linq.Clauses.ResultOperators.LastResultOperator' Remotion.Linq.Clauses.ResultOperators.AsQueryableResultOperator' Remotion.Linq.Clauses.ResultOperators.DefaultIfEmptyResultOperator' Remotion.Linq.Clauses.ResultOperators.DistinctResultOperator' Remotion.Linq.Clauses.ResultOperators.ExceptResultOperator' Remotion.Linq.Clauses.ResultOperators.IntersectResultOperator' Remotion.Linq.Clauses.ResultOperators.SkipResultOperator' Remotion.Linq.Clauses.ResultOperators.ReverseResultOperator' Remotion.Linq.Clauses.ResultOperators.TakeResultOperator' Remotion.Linq.Clauses.SelectClause,Remotion.Linq.IQueryExecutor' Remotion.Linq.QueryModel' Remotion.Linq.IQueryExecutor' Remotion.Linq.QueryModel' Remotion.Linq.IQueryExecutor' Remotion.Linq.QueryModel' Remotion.Utilities.ArgumentUtility' Remotion.Utilities.ArgumentUtility' Remotion.Utilities.ArgumentUtility' JetBrains.Annotations.NotNullAttribute' Remotion.Linq.Clauses.ResultOperatorBase' JetBrains.Annotations.NotNullAttribute' Remotion.Linq.Clauses.ResultOperatorBase' JetBrains.Annotations.NotNullAttribute' Remotion.Linq.Clauses.ResultOperatorBase' Remotion.Utilities.Assertion' Remotion.Linq.Utilities.ReflectionUtility' Remotion.Utilities.Assertion' Remotion.Linq.Utilities.ReflectionUtility' Remotion.Utilities.Assertion' Remotion.Linq.Utilities.ReflectionUtility' Remotion.Linq.Utilities.ReflectionUtility' Remotion.Linq.Utilities.ReflectionUtility' Remotion.Linq.Utilities.ReflectionUtility' Remotion.Linq.Utilities.ReflectionUtility' Remotion.Linq.Utilities.ReflectionUtility' Remotion.Linq.Utilities.ReflectionUtility' Remotion.Linq.Utilities.ReflectionUtility
Core.Net_3_5,Remotion.Linq.Collections,Remotion.Linq.Transformations.SubQueryFromClauseFlattener' Remotion.Linq.Clauses.OrderByClause' Remotion.Linq.QueryModelVisitorBase' Remotion.Linq.QueryModel,Remotion.Utilities.ArgumentUtility' Remotion.Utilities.ArgumentUtility' Remotion.Utilities.ArgumentUtility' Remotion.Utilities.ArgumentUtility' Remotion.Utilities.ArgumentUtility' Remotion.Utilities.ArgumentUtility' Remotion.Utilities.ArgumentUtility
Core.Net_3_5,Remotion.Linq,Remotion.Linq.Clauses.StreamedData.StreamedValueInfo' Remotion.Linq.Clauses.StreamedData.IStreamedDataInfo' Remotion.Linq.Clauses.StreamedData.StreamedScalarValueInfo' Remotion.Linq.Clauses.StreamedData.StreamedSingleValueInfo' Remotion.Linq.Clauses.StreamedData.StreamedSequenceInfo' Remotion.Linq.Clauses.IBodyClause' Remotion.Linq.Clauses.AdditionalFromClause' Remotion.Linq.Clauses.MainFromClause' Remotion.Linq.Clauses.GroupJoinClause' Remotion.Linq.Clauses.OrderByClause' Remotion.Linq.Clauses.Ordering' Remotion.Linq.Clauses.ResultOperators.AsQueryableResultOperator' Remotion.Linq.Clauses.ResultOperatorBase' Remotion.Linq.Clauses.JoinClause' Remotion.Linq.Clauses.WhereClause' Remotion.Linq.Clauses.SelectClause' Remotion.Linq.Clauses.FromClauseBase' Remotion.Linq.Clauses.CloneContext' Remotion.Linq.Clauses.IQuerySource' Remotion.Linq.Clauses.Expressions.SubQueryExpression' Remotion.Linq.Clauses.ResultOperators.GroupResultOperator' Remotion.Linq.Parsing.ExpressionVisitors.SubQueryFindingExpressionVisitor' Remotion.Linq.Parsing.Structure.IntermediateModel.GroupJoinExpressionNode' Remotion.Linq.Parsing.Structure.IntermediateModel.GroupByWithResultSelectorExpressionNode' Remotion.Linq.Parsing.Structure.IntermediateModel.JoinExpressionNode' Remotion.Linq.Parsing.Structure.IntermediateModel.IExpressionNode' Remotion.Linq.Parsing.Structure.IntermediateModel.OrderByExpressionNode' Remotion.Linq.Parsing.Structure.IntermediateModel.SelectManyExpressionNode' Remotion.Linq.Parsing.Structure.IntermediateModel.ThenByDescendingExpressionNode' Remotion.Linq.Parsing.Structure.IntermediateModel.ResultOperatorExpressionNodeBase' Remotion.Linq.Parsing.Structure.IntermediateModel.ThenByExpressionNode' Remotion.Linq.Parsing.Structure.IntermediateModel.WhereExpressionNode' Remotion.Linq.Parsing.Structure.IntermediateModel.MainSourceExpressionNode' Remotion.Linq.Parsing.Structure.IQueryParser' Remotion.Linq.Parsing.Structure.IntermediateModel.MethodCallExpressionNodeBase' Remotion.Linq.Transformations.SubQueryFromClauseFlattener' Remotion.Linq.Parsing.Structure.IntermediateModel.SelectExpressionNode' Remotion.Linq.Parsing.Structure.IntermediateModel.OrderByDescendingExpressionNode' Remotion.Linq.Parsing.Structure.QueryParser' Remotion.Linq.Parsing.Structure.ExpressionTreeParser,Remotion.Utilities.ArgumentUtility' Remotion.Linq.Parsing.Structure.IQueryParser' Remotion.Linq.Parsing.Structure.QueryParser' Remotion.Utilities.ArgumentUtility' Remotion.Linq.Parsing.Structure.IQueryParser' Remotion.Linq.Parsing.Structure.QueryParser' Remotion.Utilities.ArgumentUtility' Remotion.Linq.Parsing.Structure.IQueryParser' Remotion.Linq.Parsing.Structure.QueryParser' Remotion.Linq.Clauses.ResultOperators.CountResultOperator' Remotion.Linq.Clauses.ResultOperators.FirstResultOperator' Remotion.Linq.Clauses.ResultOperators.SingleResultOperator' Remotion.Linq.Clauses.ResultOperators.SumResultOperator' Remotion.Linq.Clauses.ResultOperators.CountResultOperator' Remotion.Linq.Clauses.ResultOperators.FirstResultOperator' Remotion.Linq.Clauses.ResultOperators.SingleResultOperator' Remotion.Linq.Clauses.ResultOperators.SumResultOperator' Remotion.Linq.Clauses.ResultOperators.CountResultOperator' Remotion.Linq.Clauses.ResultOperators.FirstResultOperator' Remotion.Linq.Clauses.ResultOperators.SingleResultOperator' Remotion.Linq.Clauses.ResultOperators.SumResultOperator' Remotion.Linq.Clauses.AdditionalFromClause' Remotion.Linq.Clauses.GroupJoinClause' Remotion.Linq.Clauses.JoinClause' Remotion.Linq.Clauses.MainFromClause' Remotion.Linq.Clauses.OrderByClause' Remotion.Linq.Clauses.Ordering' Remotion.Linq.Clauses.ResultOperatorBase' Remotion.Linq.Clauses.SelectClause' Remotion.Linq.Clauses.WhereClause' Remotion.Linq.Clauses.AdditionalFromClause' Remotion.Linq.Clauses.GroupJoinClause' Remotion.Linq.Clauses.JoinClause' Remotion.Linq.Clauses.MainFromClause' Remotion.Linq.Clauses.OrderByClause' Remotion.Linq.Clauses.Ordering' Remotion.Linq.Clauses.ResultOperatorBase' Remotion.Linq.Clauses.SelectClause' Remotion.Linq.Clauses.WhereClause' Remotion.Linq.Clauses.AdditionalFromClause' Remotion.Linq.Clauses.GroupJoinClause' Remotion.Linq.Clauses.JoinClause' Remotion.Linq.Clauses.MainFromClause' Remotion.Linq.Clauses.OrderByClause' Remotion.Linq.Clauses.Ordering' Remotion.Linq.Clauses.ResultOperatorBase' Remotion.Linq.Clauses.SelectClause' Remotion.Linq.Clauses.WhereClause' Remotion.Linq.Clauses.CloneContext' Remotion.Linq.Clauses.FromClauseBase' Remotion.Linq.Clauses.IBodyClause' Remotion.Linq.Clauses.IFromClause' Remotion.Linq.Clauses.QuerySourceMapping' Remotion.Linq.Clauses.Expressions.QuerySourceReferenceExpression' Remotion.Linq.Clauses.Expressions.SubQueryExpression' Remotion.Linq.Clauses.StreamedData.IStreamedData' Remotion.Linq.Clauses.StreamedData.IStreamedDataInfo' Remotion.Linq.Clauses.StreamedData.StreamedSequenceInfo' Remotion.Linq.Collections.ObservableCollection<T>' Remotion.Linq.Collections.NotifyCollectionChangedEventArgs' Remotion.Linq.Parsing.RelinqExpressionVisitor' Remotion.Linq.Clauses.CloneContext' Remotion.Linq.Clauses.FromClauseBase' Remotion.Linq.Clauses.IBodyClause' Remotion.Linq.Clauses.IFromClause' Remotion.Linq.Clauses.QuerySourceMapping' Remotion.Linq.Clauses.Expressions.QuerySourceReferenceExpression' Remotion.Linq.Clauses.Expressions.SubQueryExpression' Remotion.Linq.Clauses.StreamedData.IStreamedData' Remotion.Linq.Clauses.StreamedData.IStreamedDataInfo' Remotion.Linq.Clauses.StreamedData.StreamedSequenceInfo' Remotion.Linq.Parsing.RelinqExpressionVisitor' Remotion.Linq.Clauses.CloneContext' Remotion.Linq.Clauses.FromClauseBase' Remotion.Linq.Clauses.IBodyClause' Remotion.Linq.Clauses.IFromClause' Remotion.Linq.Clauses.QuerySourceMapping' Remotion.Linq.Clauses.Expressions.QuerySourceReferenceExpression' Remotion.Linq.Clauses.Expressions.SubQueryExpression' Remotion.Linq.Clauses.StreamedData.IStreamedData' Remotion.Linq.Clauses.StreamedData.IStreamedDataInfo' Remotion.Linq.Clauses.StreamedData.StreamedSequenceInfo' Remotion.Linq.Parsing.RelinqExpressionVisitor' Remotion.Linq.Clauses.IClause' Remotion.Linq.Clauses.IClause' Remotion.Linq.Clauses.IClause' Remotion.Linq.Parsing.Structure.ExpressionTreeParser' Remotion.Linq.Utilities.ReflectionUtility' Remotion.Linq.Parsing.Structure.ExpressionTreeParser' Remotion.Linq.Utilities.ReflectionUtility' Remotion.Linq.Parsing.Structure.ExpressionTreeParser' Remotion.Linq.Utilities.ReflectionUtility' Remotion.Linq.Utilities.ReflectionUtility' Remotion.Linq.Utilities.ReflectionUtility' Remotion.Linq.Utilities.ReflectionUtility' Remotion.Linq.Utilities.ReflectionUtility' Remotion.Linq.Utilities.ReflectionUtility' Remotion.Linq.Utilities.ReflectionUtility' Remotion.Linq.Utilities.ReflectionUtility
Core.Net_3_5,Remotion.Linq.Parsing.ExpressionVisitors.MemberBindings,Remotion.Linq.Parsing.ExpressionVisitors.TransparentIdentifierRemovingExpressionVisitor,Remotion.Utilities.ArgumentUtility' Remotion.Utilities.ArgumentUtility' Remotion.Utilities.ArgumentUtility
Core.Net_3_5,Remotion.Linq.Parsing.ExpressionVisitors,Remotion.Linq.Parsing.ExpressionVisitors.Transformation.PredefinedTransformations.InvocationOfLambdaExpressionTransformer' Remotion.Linq.Parsing.Structure.IntermediateModel.GroupByWithResultSelectorExpressionNode' Remotion.Linq.Parsing.Structure.ExpressionTreeProcessors.PartialEvaluatingExpressionTreeProcessor' Remotion.Linq.Parsing.Structure.IntermediateModel.SelectExpressionNode' Remotion.Linq.Parsing.Structure.IntermediateModel.GroupJoinExpressionNode' Remotion.Linq.Parsing.Structure.IntermediateModel.JoinExpressionNode' Remotion.Linq.Parsing.Structure.IntermediateModel.QuerySourceExpressionNodeUtility' Remotion.Linq.Parsing.Structure.IntermediateModel.OfTypeExpressionNode' Remotion.Linq.Parsing.Structure.IntermediateModel.SelectManyExpressionNode' Remotion.Linq.Parsing.Structure.IntermediateModel.CastExpressionNode' Remotion.Linq.Parsing.Structure.MethodCallExpressionParser' Remotion.Linq.Parsing.Structure.ExpressionTreeParser' Remotion.Linq.Parsing.Structure.ExpressionTreeProcessors.TransformingExpressionTreeProcessor' Remotion.Linq.Parsing.ExpressionVisitors.Transformation.ExpressionTransformerRegistry' Remotion.Linq.Parsing.Structure.IntermediateModel.ExpressionResolver,Remotion.Utilities.ArgumentUtility' Remotion.Linq.Clauses.Expressions.SubQueryExpression' Remotion.Linq.Parsing.RelinqExpressionVisitor' Remotion.Utilities.ArgumentUtility' Remotion.Linq.Clauses.Expressions.SubQueryExpression' Remotion.Linq.Parsing.RelinqExpressionVisitor' Remotion.Utilities.ArgumentUtility' Remotion.Linq.Clauses.Expressions.SubQueryExpression' Remotion.Linq.Parsing.RelinqExpressionVisitor' Remotion.Linq.Clauses.Expressions.PartialEvaluationExceptionExpression' Remotion.Linq.Parsing.ExpressionVisitors.TreeEvaluation.EvaluatableTreeFindingExpressionVisitor' Remotion.Linq.Parsing.ExpressionVisitors.TreeEvaluation.IEvaluatableExpressionFilter' Remotion.Linq.Parsing.ExpressionVisitors.TreeEvaluation.PartialEvaluationInfo' Remotion.Linq.Clauses.Expressions.PartialEvaluationExceptionExpression' Remotion.Linq.Parsing.ExpressionVisitors.TreeEvaluation.EvaluatableTreeFindingExpressionVisitor' Remotion.Linq.Parsing.ExpressionVisitors.TreeEvaluation.IEvaluatableExpressionFilter' Remotion.Linq.Parsing.ExpressionVisitors.TreeEvaluation.PartialEvaluationInfo' Remotion.Linq.Clauses.Expressions.PartialEvaluationExceptionExpression' Remotion.Linq.Parsing.ExpressionVisitors.TreeEvaluation.EvaluatableTreeFindingExpressionVisitor' Remotion.Linq.Parsing.ExpressionVisitors.TreeEvaluation.IEvaluatableExpressionFilter' Remotion.Linq.Parsing.ExpressionVisitors.TreeEvaluation.PartialEvaluationInfo' Remotion.Linq.QueryModel' Remotion.Linq.Parsing.Structure.ExpressionTreeParser' Remotion.Linq.Parsing.Structure.INodeTypeProvider' Remotion.Linq.Parsing.Structure.QueryParser' Remotion.Linq.Parsing.Structure.ExpressionTreeProcessors.NullExpressionTreeProcessor' Remotion.Linq.QueryModel' Remotion.Linq.Parsing.Structure.ExpressionTreeParser' Remotion.Linq.Parsing.Structure.INodeTypeProvider' Remotion.Linq.Parsing.Structure.QueryParser' Remotion.Linq.Parsing.Structure.ExpressionTreeProcessors.NullExpressionTreeProcessor' Remotion.Linq.QueryModel' Remotion.Linq.Parsing.Structure.ExpressionTreeParser' Remotion.Linq.Parsing.Structure.INodeTypeProvider' Remotion.Linq.Parsing.Structure.QueryParser' Remotion.Linq.Parsing.Structure.ExpressionTreeProcessors.NullExpressionTreeProcessor' Remotion.Utilities.Assertion' Remotion.Linq.Parsing.ExpressionVisitors.Transformation.IExpressionTranformationProvider' Remotion.Utilities.Assertion' Remotion.Linq.Parsing.ExpressionVisitors.Transformation.IExpressionTranformationProvider' Remotion.Utilities.Assertion' Remotion.Linq.Parsing.ExpressionVisitors.Transformation.IExpressionTranformationProvider' Remotion.Linq.Parsing.ExpressionVisitors.MemberBindings.MemberBinding' Remotion.Linq.Parsing.ExpressionVisitors.MemberBindings.MemberBinding' Remotion.Linq.Parsing.ExpressionVisitors.MemberBindings.MemberBinding
Core.Net_3_5,Remotion.Linq.Parsing.ExpressionVisitors.Transformation,Remotion.Linq.Parsing.Structure.QueryParser' Remotion.Linq.Parsing.Structure.ExpressionTreeParser' Remotion.Linq.Parsing.Structure.ExpressionTreeProcessors.TransformingExpressionTreeProcessor' Remotion.Linq.Parsing.ExpressionVisitors.TransformingExpressionVisitor' Remotion.Linq.Parsing.ExpressionVisitors.Transformation.PredefinedTransformations.MemberAddingNewExpressionTransformerBase' Remotion.Linq.Parsing.ExpressionVisitors.Transformation.PredefinedTransformations.InvocationOfLambdaExpressionTransformer' Remotion.Linq.Parsing.ExpressionVisitors.Transformation.PredefinedTransformations.VBInformationIsNothingExpressionTransformer' Remotion.Linq.Parsing.ExpressionVisitors.Transformation.PredefinedTransformations.NullableValueTransformer' Remotion.Linq.Parsing.ExpressionVisitors.Transformation.PredefinedTransformations.AttributeEvaluatingExpressionTransformer' Remotion.Linq.Parsing.ExpressionVisitors.Transformation.PredefinedTransformations.VBCompareStringExpressionTransformer' Remotion.Linq.Parsing.ExpressionVisitors.Transformation.PredefinedTransformations.MethodCallExpressionTransformerAttribute,Remotion.Utilities.ArgumentUtility' Remotion.Linq.Parsing.ExpressionVisitors.TransformingExpressionVisitor' Remotion.Linq.Parsing.ExpressionVisitors.Transformation.PredefinedTransformations.AttributeEvaluatingExpressionTransformer' Remotion.Linq.Parsing.ExpressionVisitors.Transformation.PredefinedTransformations.DictionaryEntryNewExpressionTransformer' Remotion.Linq.Parsing.ExpressionVisitors.Transformation.PredefinedTransformations.InvocationOfLambdaExpressionTransformer' Remotion.Linq.Parsing.ExpressionVisitors.Transformation.PredefinedTransformations.KeyValuePairNewExpressionTransformer' Remotion.Linq.Parsing.ExpressionVisitors.Transformation.PredefinedTransformations.NullableValueTransformer' Remotion.Linq.Parsing.ExpressionVisitors.Transformation.PredefinedTransformations.TupleNewExpressionTransformer' Remotion.Linq.Parsing.ExpressionVisitors.Transformation.PredefinedTransformations.VBCompareStringExpressionTransformer' Remotion.Linq.Parsing.ExpressionVisitors.Transformation.PredefinedTransformations.VBInformationIsNothingExpressionTransformer' Remotion.Utilities.ArgumentUtility' Remotion.Linq.Parsing.ExpressionVisitors.TransformingExpressionVisitor' Remotion.Linq.Parsing.ExpressionVisitors.Transformation.PredefinedTransformations.AttributeEvaluatingExpressionTransformer' Remotion.Linq.Parsing.ExpressionVisitors.Transformation.PredefinedTransformations.DictionaryEntryNewExpressionTransformer' Remotion.Linq.Parsing.ExpressionVisitors.Transformation.PredefinedTransformations.InvocationOfLambdaExpressionTransformer' Remotion.Linq.Parsing.ExpressionVisitors.Transformation.PredefinedTransformations.KeyValuePairNewExpressionTransformer' Remotion.Linq.Parsing.ExpressionVisitors.Transformation.PredefinedTransformations.NullableValueTransformer' Remotion.Linq.Parsing.ExpressionVisitors.Transformation.PredefinedTransformations.TupleNewExpressionTransformer' Remotion.Linq.Parsing.ExpressionVisitors.Transformation.PredefinedTransformations.VBCompareStringExpressionTransformer' Remotion.Linq.Parsing.ExpressionVisitors.Transformation.PredefinedTransformations.VBInformationIsNothingExpressionTransformer' Remotion.Utilities.ArgumentUtility' Remotion.Linq.Parsing.ExpressionVisitors.TransformingExpressionVisitor' Remotion.Linq.Parsing.ExpressionVisitors.Transformation.PredefinedTransformations.AttributeEvaluatingExpressionTransformer' Remotion.Linq.Parsing.ExpressionVisitors.Transformation.PredefinedTransformations.DictionaryEntryNewExpressionTransformer' Remotion.Linq.Parsing.ExpressionVisitors.Transformation.PredefinedTransformations.InvocationOfLambdaExpressionTransformer' Remotion.Linq.Parsing.ExpressionVisitors.Transformation.PredefinedTransformations.KeyValuePairNewExpressionTransformer' Remotion.Linq.Parsing.ExpressionVisitors.Transformation.PredefinedTransformations.NullableValueTransformer' Remotion.Linq.Parsing.ExpressionVisitors.Transformation.PredefinedTransformations.TupleNewExpressionTransformer' Remotion.Linq.Parsing.ExpressionVisitors.Transformation.PredefinedTransformations.VBCompareStringExpressionTransformer' Remotion.Linq.Parsing.ExpressionVisitors.Transformation.PredefinedTransformations.VBInformationIsNothingExpressionTransformer
Core.Net_3_5,Remotion.Linq.Parsing.ExpressionVisitors.Transformation.PredefinedTransformations,Remotion.Linq.Parsing.ExpressionVisitors.Transformation.ExpressionTransformerRegistry,Remotion.Utilities.ArgumentUtility' Remotion.Utilities.Assertion' Remotion.Linq.Parsing.ExpressionVisitors.Transformation.IExpressionTransformer' Remotion.Utilities.ArgumentUtility' Remotion.Utilities.Assertion' Remotion.Linq.Parsing.ExpressionVisitors.Transformation.IExpressionTransformer' Remotion.Utilities.ArgumentUtility' Remotion.Utilities.Assertion' Remotion.Linq.Parsing.ExpressionVisitors.Transformation.IExpressionTransformer' Remotion.Linq.Parsing.ExpressionVisitors.MultiReplacingExpressionVisitor' Remotion.Linq.Parsing.ExpressionVisitors.MultiReplacingExpressionVisitor' Remotion.Linq.Parsing.ExpressionVisitors.MultiReplacingExpressionVisitor' Remotion.Linq.Parsing.RelinqExpressionVisitor' Remotion.Linq.Parsing.RelinqExpressionVisitor' Remotion.Linq.Parsing.RelinqExpressionVisitor' Remotion.Linq.Clauses.Expressions.VBStringComparisonExpression' Remotion.Linq.Clauses.Expressions.VBStringComparisonExpression' Remotion.Linq.Clauses.Expressions.VBStringComparisonExpression
