Project,Namespace,Ca types,Ce types
Core.Net_3_5,System.Reflection,Remotion.Linq.Parsing.Structure.IntermediateModel.SupportedMethodSpecifications' Remotion.Linq.Utilities.ItemTypeReflectionUtility,JetBrains.Annotations.NotNullAttribute' JetBrains.Annotations.NotNullAttribute' JetBrains.Annotations.NotNullAttribute' JetBrains.Annotations.NotNullAttribute' JetBrains.Annotations.CanBeNullAttribute' JetBrains.Annotations.CanBeNullAttribute' JetBrains.Annotations.CanBeNullAttribute' JetBrains.Annotations.NotNullAttribute' JetBrains.Annotations.CanBeNullAttribute' JetBrains.Annotations.NotNullAttribute' JetBrains.Annotations.CanBeNullAttribute' JetBrains.Annotations.NotNullAttribute' JetBrains.Annotations.CanBeNullAttribute' JetBrains.Annotations.CanBeNullAttribute' JetBrains.Annotations.CanBeNullAttribute' JetBrains.Annotations.NotNullAttribute' Remotion.Utilities.Assertion
Core.Net_3_5,JetBrains.Annotations,Remotion.Utilities.Assertion' Remotion.Utilities.ArgumentUtility' System.Reflection.TypeExtensions' Remotion.Linq.Utilities.ItemTypeReflectionUtility' Remotion.Linq.Clauses.IFromClause' System.Reflection.TypeInfo' Remotion.Linq.Clauses.ResultOperators.AggregateResultOperator' Remotion.Linq.Clauses.ResultOperators.AggregateFromSeedResultOperator' Remotion.Linq.Clauses.ResultOperators.AllResultOperator' Remotion.Linq.Clauses.ResultOperators.AnyResultOperator' Remotion.Linq.Clauses.ResultOperators.AverageResultOperator' Remotion.Linq.Clauses.ResultOperators.ChoiceResultOperatorBase' Remotion.Linq.Clauses.ResultOperators.ContainsResultOperator' Remotion.Linq.Clauses.ResultOperators.CountResultOperator' Remotion.Linq.Clauses.ResultOperators.LongCountResultOperator' Remotion.Linq.Clauses.ResultOperators.SumResultOperator' System.Reflection.MethodInfoExtensions' Remotion.Linq.Parsing.ExpressionVisitors.TreeEvaluation.EvaluatableTreeFindingExpressionVisitor' Remotion.Linq.Clauses.StreamedData.StreamedSequence' Remotion.Linq.Parsing.ExpressionVisitors.TreeEvaluation.IEvaluatableExpressionFilter,
Core.Net_3_5,Remotion.Utilities,Remotion.Linq.Clauses.Expressions.SubQueryExpression' Remotion.Linq.Clauses.ExpressionVisitors.CloningExpressionVisitor' Remotion.Linq.Clauses.Expressions.VBStringComparisonExpression' System.Lazy<T>' Remotion.Linq.Clauses.ExpressionVisitors.ReferenceReplacingExpressionVisitor' Remotion.Linq.Clauses.ExpressionVisitors.AccessorFindingExpressionVisitor' Remotion.Linq.Clauses.MainFromClause' Remotion.Linq.Clauses.QuerySourceMapping' Remotion.Linq.Clauses.ResultOperatorBase' Remotion.Linq.Clauses.Expressions.PartialEvaluationExceptionExpression' Remotion.Linq.Clauses.OrderByClause' Remotion.Linq.Parsing.ExpressionVisitor' Remotion.Linq.Clauses.ExpressionVisitors.FormattingExpressionVisitor' Remotion.Linq.Clauses.Ordering' Remotion.Linq.Clauses.GroupJoinClause' Remotion.Linq.Clauses.FromClauseBase' Remotion.Linq.Clauses.Expressions.ExtensionExpression' Remotion.Linq.Clauses.JoinClause' Remotion.Linq.Utilities.ReflectionUtility' Remotion.Linq.Utilities.ItemTypeReflectionUtility' Remotion.Linq.UniqueIdentifierGenerator' Remotion.Linq.Transformations.SubQueryFromClauseFlattener' Remotion.Linq.QueryProviderBase' Remotion.Linq.QueryModelVisitorBase' Remotion.Linq.QueryModelBuilder' Remotion.Linq.QueryModel' Remotion.Linq.QueryableBase<T>' Remotion.Linq.Parsing.TupleExpressionBuilder' Remotion.Linq.Parsing.ThrowingExpressionVisitor' Remotion.Linq.Parsing.Structure.QueryParser' Remotion.Linq.Parsing.Structure.NodeTypeProviders.NameBasedRegistrationInfo' Remotion.Linq.Clauses.ResultOperators.DefaultIfEmptyResultOperator' Remotion.Linq.Clauses.ResultOperators.IntersectResultOperator' Remotion.Linq.Parsing.Structure.NodeTypeProviders.MethodNameBasedNodeTypeRegistry' Remotion.Linq.Parsing.Structure.NodeTypeProviders.MethodInfoBasedNodeTypeRegistry' Remotion.Linq.Parsing.Structure.NodeTypeProviders.CompoundNodeTypeProvider' Remotion.Linq.Parsing.Structure.MethodCallExpressionParser' Remotion.Linq.Parsing.Structure.IntermediateModel.WhereExpressionNode' Remotion.Linq.Parsing.Structure.IntermediateModel.ThenByExpressionNode' Remotion.Linq.Clauses.CloneContext' Remotion.Linq.Clauses.Expressions.QuerySourceReferenceExpression' Remotion.Linq.Parsing.Structure.IntermediateModel.ThenByDescendingExpressionNode' Remotion.Linq.Parsing.Structure.IntermediateModel.TakeExpressionNode' Remotion.Linq.Clauses.ResultOperators.GroupResultOperator' Remotion.Linq.Parsing.Structure.IntermediateModel.SupportedMethodSpecifications' Remotion.Linq.Parsing.Structure.IntermediateModel.SumExpressionNode' Remotion.Linq.Parsing.Structure.IntermediateModel.SkipExpressionNode' Remotion.Linq.Clauses.ResultOperators.OfTypeResultOperator' Remotion.Linq.Clauses.ResultOperators.LongCountResultOperator' Remotion.Linq.Clauses.ResultOperators.CastResultOperator' Remotion.Linq.Clauses.ResultOperators.SequenceFromSequenceResultOperatorBase' Remotion.Linq.Clauses.ResultOperators.AggregateFromSeedResultOperator' Remotion.Linq.Parsing.Structure.IntermediateModel.SingleExpressionNode' Remotion.Linq.Clauses.ResultOperators.ConcatResultOperator' Remotion.Linq.Clauses.ResultOperators.SequenceTypePreservingResultOperatorBase' Remotion.Linq.Clauses.ResultOperators.ValueFromSequenceResultOperatorBase' Remotion.Linq.Clauses.ResultOperators.CountResultOperator' Remotion.Linq.Clauses.ResultOperators.SumResultOperator' Remotion.Linq.Clauses.ResultOperators.SkipResultOperator' Remotion.Linq.Parsing.Structure.IntermediateModel.SelectManyExpressionNode' Remotion.Linq.Clauses.StreamedData.StreamedValue' Remotion.Linq.Clauses.StreamedData.StreamedScalarValueInfo' Remotion.Linq.Clauses.SelectClause' Remotion.Linq.Clauses.StreamedData.StreamedSingleValueInfo' Remotion.Linq.Clauses.ResultOperators.AggregateResultOperator' Remotion.Linq.Clauses.ResultOperators.AverageResultOperator' Remotion.Linq.Collections.IndexValuePair' Remotion.Linq.Collections.ChangeResistantObservableCollectionEnumerator<T>' Remotion.Linq.Parsing.Structure.IntermediateModel.SelectExpressionNode' Remotion.Linq.Collections.ObservableCollectionExtensions' Remotion.Linq.Clauses.WhereClause' Remotion.Linq.DefaultQueryProvider' Remotion.Linq.Clauses.ResultOperators.ExceptResultOperator' Remotion.Linq.Parsing.Structure.IntermediateModel.ReverseExpressionNode' Remotion.Linq.Collections.MultiDictionaryExtensions' Remotion.Linq.Parsing.ExpressionVisitors.MemberBindings.MemberBinding' Remotion.Linq.Parsing.ExpressionVisitors.MultiReplacingExpressionVisitor' Remotion.Linq.Parsing.Structure.IntermediateModel.ResultOperatorExpressionNodeBase' Remotion.Linq.Parsing.ExpressionVisitors.ReplacingExpressionVisitor' Remotion.Linq.Parsing.ExpressionVisitors.SubQueryFindingExpressionVisitor' Remotion.Linq.Parsing.ExpressionVisitors.Transformation.PredefinedTransformations.AttributeEvaluatingExpressionTransformer' Remotion.Linq.Parsing.ExpressionVisitors.Transformation.ExpressionTransformerRegistry' Remotion.Linq.Parsing.ExpressionVisitors.Transformation.PredefinedTransformations.InvocationOfLambdaExpressionTransformer' Remotion.Linq.Parsing.ExpressionVisitors.PartialEvaluatingExpressionVisitor' Remotion.Linq.Clauses.StreamedData.StreamedValueInfo' Remotion.Linq.Parsing.Structure.IntermediateModel.ResolvedExpressionCache<T>' Remotion.Linq.Parsing.ExpressionVisitors.Transformation.PredefinedTransformations.MemberAddingNewExpressionTransformerBase' Remotion.Linq.Parsing.ExpressionVisitors.Transformation.PredefinedTransformations.NullableValueTransformer' Remotion.Linq.Parsing.ExpressionVisitors.Transformation.PredefinedTransformations.VBCompareStringExpressionTransformer' Remotion.Linq.Parsing.ExpressionVisitors.Transformation.PredefinedTransformations.VBInformationIsNothingExpressionTransformer' Remotion.Linq.Parsing.ExpressionVisitors.Transformation.PredefinedTransformations.MethodCallExpressionTransformerAttribute' Remotion.Linq.Parsing.ExpressionVisitors.TransformingExpressionVisitor' Remotion.Linq.Parsing.Structure.IntermediateModel.QuerySourceSetOperationExpressionNodeBase' Remotion.Linq.Parsing.ExpressionVisitors.TreeEvaluation.PartialEvaluationInfo' Remotion.Linq.Parsing.Structure.ExpressionTreeProcessors.CompoundExpressionTreeProcessor' Remotion.Linq.Parsing.Structure.ExpressionTreeProcessors.NullExpressionTreeProcessor' Remotion.Linq.Parsing.RelinqExpressionVisitor' Remotion.Linq.Parsing.Structure.IntermediateModel.AggregateExpressionNode' Remotion.Linq.Parsing.Structure.IntermediateModel.QuerySourceExpressionNodeUtility' Remotion.Linq.Parsing.Structure.ExpressionTreeProcessors.PartialEvaluatingExpressionTreeProcessor' Remotion.Linq.Parsing.Structure.ExpressionTreeParser' Remotion.Linq.Parsing.Structure.ExpressionTreeProcessors.TransformingExpressionTreeProcessor' Remotion.Linq.Clauses.ResultOperators.AllResultOperator' Remotion.Linq.Parsing.Structure.IntermediateModel.AggregateFromSeedExpressionNode' Remotion.Linq.Parsing.ExpressionVisitors.TransparentIdentifierRemovingExpressionVisitor' Remotion.Linq.Parsing.Structure.IntermediateModel.AllExpressionNode' Remotion.Linq.Parsing.Structure.IntermediateModel.AsQueryableExpressionNode' Remotion.Linq.Parsing.Structure.IntermediateModel.AverageExpressionNode' Remotion.Linq.Parsing.Structure.IntermediateModel.ContainsExpressionNode' Remotion.Linq.Parsing.Structure.IntermediateModel.CastExpressionNode' Remotion.Linq.Parsing.Structure.IntermediateModel.DefaultIfEmptyExpressionNode' Remotion.Linq.Parsing.Structure.IntermediateModel.OrderByExpressionNode' Remotion.Linq.Parsing.Structure.IntermediateModel.DistinctExpressionNode' Remotion.Linq.Parsing.Structure.IntermediateModel.ClauseGenerationContext' Remotion.Linq.Parsing.Structure.IntermediateModel.ExceptExpressionNode' Remotion.Linq.Parsing.Structure.IntermediateModel.FirstExpressionNode' Remotion.Linq.Parsing.Structure.IntermediateModel.ExpressionResolver' Remotion.Linq.Parsing.Structure.IntermediateModel.GroupByExpressionNode' Remotion.Linq.Clauses.ResultOperators.ChoiceResultOperatorBase' Remotion.Linq.Parsing.ExpressionVisitors.TreeEvaluation.EvaluatableExpressionFilterBase' Remotion.Linq.Parsing.Structure.IntermediateModel.OrderByDescendingExpressionNode' Remotion.Linq.Parsing.Structure.IntermediateModel.LastExpressionNode' Remotion.Linq.Clauses.ResultOperators.AnyResultOperator' Remotion.Linq.Parsing.Structure.IntermediateModel.MaxExpressionNode' Remotion.Linq.Parsing.Structure.IntermediateModel.OfTypeExpressionNode' Remotion.Linq.Parsing.Structure.IntermediateModel.JoinExpressionNode' Remotion.Linq.Parsing.Structure.IntermediateModel.MainSourceExpressionNode' Remotion.Linq.Clauses.ExpressionVisitors.ReverseResolvingExpressionVisitor' Remotion.Linq.Parsing.Structure.IntermediateModel.MethodCallExpressionNodeBase' Remotion.Linq.Parsing.Structure.IntermediateModel.MethodCallExpressionNodeFactory' Remotion.Linq.Parsing.Structure.IntermediateModel.MethodCallExpressionParseInfo' Remotion.Linq.Clauses.ResultOperators.ContainsResultOperator' Remotion.Linq.Clauses.AdditionalFromClause' Remotion.Linq.Parsing.Structure.IntermediateModel.GroupByWithResultSelectorExpressionNode' Remotion.Linq.Parsing.Structure.IntermediateModel.MinExpressionNode' Remotion.Linq.Clauses.ResultOperators.TakeResultOperator' Remotion.Linq.Clauses.StreamedData.StreamedSequenceInfo' Remotion.Linq.Clauses.StreamedData.StreamedSequence' Remotion.Linq.Parsing.ExpressionVisitors.TreeEvaluation.EvaluatableTreeFindingExpressionVisitor' Remotion.Linq.Parsing.Structure.IntermediateModel.IntersectExpressionNode' Remotion.Linq.Clauses.ResultOperators.UnionResultOperator' Remotion.Linq.Parsing.Structure.IntermediateModel.GroupJoinExpressionNode' Remotion.Linq.Parsing.Structure.IntermediateModel.CountExpressionNode,JetBrains.Annotations.AssertionConditionAttribute' JetBrains.Annotations.AssertionConditionType' JetBrains.Annotations.AssertionMethodAttribute' JetBrains.Annotations.InvokerParameterNameAttribute' JetBrains.Annotations.NoEnumerationAttribute' JetBrains.Annotations.StringFormatMethodAttribute
Core.Net_3_5,Remotion.Linq.Clauses,Remotion.Linq.IQueryModelVisitor' Remotion.Linq.QueryModel' Remotion.Linq.QueryModelVisitorBase' Remotion.Linq.Transformations.SubQueryFromClauseFlattener' Remotion.Linq.Parsing.Structure.IntermediateModel.SelectManyExpressionNode' Remotion.Linq.Clauses.ResultOperators.AggregateResultOperator' Remotion.Linq.Clauses.ResultOperators.AllResultOperator' Remotion.Linq.Clauses.ResultOperators.AggregateFromSeedResultOperator' Remotion.Linq.Clauses.ResultOperators.AnyResultOperator' Remotion.Linq.Clauses.ResultOperators.AsQueryableResultOperator' Remotion.Linq.Clauses.ResultOperators.AverageResultOperator' Remotion.Linq.Clauses.ResultOperators.CastResultOperator' Remotion.Linq.Clauses.ResultOperators.ContainsResultOperator' Remotion.Linq.Clauses.ResultOperators.ConcatResultOperator' Remotion.Linq.Clauses.ResultOperators.CountResultOperator' Remotion.Linq.Clauses.ResultOperators.DefaultIfEmptyResultOperator' Remotion.Linq.Clauses.ResultOperators.DistinctResultOperator' Remotion.Linq.Clauses.ResultOperators.ExceptResultOperator' Remotion.Linq.Clauses.ResultOperators.FirstResultOperator' Remotion.Linq.Clauses.ResultOperators.LastResultOperator' Remotion.Linq.Clauses.ResultOperators.IntersectResultOperator' Remotion.Linq.Clauses.ResultOperators.LongCountResultOperator' Remotion.Linq.Clauses.ResultOperators.GroupResultOperator' Remotion.Linq.Clauses.ResultOperators.MaxResultOperator' Remotion.Linq.Clauses.ResultOperators.MinResultOperator' Remotion.Linq.Clauses.ResultOperators.OfTypeResultOperator' Remotion.Linq.Clauses.ResultOperators.ReverseResultOperator' Remotion.Linq.Clauses.ResultOperators.SingleResultOperator' Remotion.Linq.Clauses.ResultOperators.SkipResultOperator' Remotion.Linq.Clauses.ResultOperators.SumResultOperator' Remotion.Linq.Clauses.ResultOperators.TakeResultOperator' Remotion.Linq.Clauses.ResultOperators.UnionResultOperator' Remotion.Linq.Parsing.Structure.IntermediateModel.GroupJoinExpressionNode' Remotion.Linq.QueryModelBuilder' Remotion.Linq.Clauses.Expressions.QuerySourceReferenceExpression' Remotion.Linq.Parsing.Structure.IntermediateModel.QuerySourceExpressionNodeUtility' Remotion.Linq.Parsing.Structure.IntermediateModel.JoinExpressionNode' Remotion.Linq.Parsing.Structure.IntermediateModel.IExpressionNode' Remotion.Linq.Parsing.Structure.IntermediateModel.MethodCallExpressionNodeBase' Remotion.Linq.Parsing.Structure.IntermediateModel.MainSourceExpressionNode' Remotion.Linq.Parsing.Structure.IntermediateModel.OrderByExpressionNode' Remotion.Linq.Parsing.Structure.IntermediateModel.ThenByDescendingExpressionNode' Remotion.Linq.Parsing.Structure.IntermediateModel.ThenByExpressionNode' Remotion.Linq.Parsing.Structure.IntermediateModel.OrderByDescendingExpressionNode' Remotion.Linq.Clauses.ExpressionVisitors.CloningExpressionVisitor' Remotion.Linq.Clauses.ExpressionVisitors.ReferenceReplacingExpressionVisitor' Remotion.Linq.Clauses.ResultOperators.SequenceFromSequenceResultOperatorBase' Remotion.Linq.Clauses.ResultOperators.ValueFromSequenceResultOperatorBase' Remotion.Linq.Clauses.StreamedData.StreamedSequence' Remotion.Linq.Clauses.StreamedData.StreamedValue' Remotion.Linq.Parsing.Structure.IntermediateModel.AggregateExpressionNode' Remotion.Linq.Parsing.Structure.IntermediateModel.AggregateFromSeedExpressionNode' Remotion.Linq.Parsing.Structure.IntermediateModel.AllExpressionNode' Remotion.Linq.Parsing.Structure.IntermediateModel.AnyExpressionNode' Remotion.Linq.Parsing.Structure.IntermediateModel.AsQueryableExpressionNode' Remotion.Linq.Parsing.Structure.IntermediateModel.AverageExpressionNode' Remotion.Linq.Parsing.Structure.IntermediateModel.CastExpressionNode' Remotion.Linq.Parsing.Structure.IntermediateModel.ConcatExpressionNode' Remotion.Linq.Parsing.Structure.IntermediateModel.CountExpressionNode' Remotion.Linq.Parsing.Structure.IntermediateModel.ContainsExpressionNode' Remotion.Linq.Parsing.Structure.IntermediateModel.DefaultIfEmptyExpressionNode' Remotion.Linq.Parsing.Structure.IntermediateModel.DistinctExpressionNode' Remotion.Linq.Parsing.Structure.IntermediateModel.ExceptExpressionNode' Remotion.Linq.Parsing.Structure.IntermediateModel.FirstExpressionNode' Remotion.Linq.Parsing.Structure.IntermediateModel.GroupByExpressionNode' Remotion.Linq.Parsing.Structure.IntermediateModel.IntersectExpressionNode' Remotion.Linq.Parsing.Structure.IntermediateModel.LongCountExpressionNode' Remotion.Linq.Parsing.Structure.IntermediateModel.LastExpressionNode' Remotion.Linq.Parsing.Structure.IntermediateModel.MaxExpressionNode' Remotion.Linq.Parsing.Structure.IntermediateModel.MinExpressionNode' Remotion.Linq.Parsing.Structure.IntermediateModel.OfTypeExpressionNode' Remotion.Linq.Parsing.Structure.IntermediateModel.ResultOperatorExpressionNodeBase' Remotion.Linq.Parsing.Structure.IntermediateModel.ReverseExpressionNode' Remotion.Linq.Parsing.Structure.IntermediateModel.SingleExpressionNode' Remotion.Linq.Parsing.Structure.IntermediateModel.QuerySourceSetOperationExpressionNodeBase' Remotion.Linq.Parsing.Structure.IntermediateModel.SkipExpressionNode' Remotion.Linq.Parsing.Structure.IntermediateModel.SumExpressionNode' Remotion.Linq.Parsing.Structure.IntermediateModel.TakeExpressionNode' Remotion.Linq.Parsing.Structure.IntermediateModel.UnionExpressionNode' Remotion.Linq.Parsing.Structure.IntermediateModel.WhereExpressionNode,Remotion.Utilities.ArgumentUtility' Remotion.Linq.Clauses.Expressions.QuerySourceReferenceExpression' Remotion.Linq.IQueryModelVisitor' Remotion.Linq.QueryModel' Remotion.Utilities.ArgumentUtility' Remotion.Linq.Clauses.Expressions.QuerySourceReferenceExpression' Remotion.Linq.IQueryModelVisitor' Remotion.Linq.QueryModel' Remotion.Utilities.ArgumentUtility' Remotion.Linq.Clauses.Expressions.QuerySourceReferenceExpression' Remotion.Linq.IQueryModelVisitor' Remotion.Linq.QueryModel' Remotion.Linq.Utilities.ReflectionUtility' Remotion.Linq.Utilities.ReflectionUtility' Remotion.Linq.Utilities.ReflectionUtility' Remotion.Linq.Utilities.ReflectionUtility' Remotion.Linq.Utilities.ReflectionUtility' Remotion.Linq.Utilities.ReflectionUtility' Remotion.Linq.Utilities.ReflectionUtility' Remotion.Linq.Utilities.ReflectionUtility' Remotion.Linq.Utilities.ReflectionUtility' Remotion.Linq.Utilities.ReflectionUtility' JetBrains.Annotations.NotNullAttribute' JetBrains.Annotations.NotNullAttribute' JetBrains.Annotations.NotNullAttribute' Remotion.Linq.Collections.ObservableCollection<T>' Remotion.Linq.Collections.NotifyCollectionChangedEventArgs' Remotion.Linq.Utilities.StringUtility' Remotion.Linq.Utilities.StringUtility' Remotion.Linq.Utilities.StringUtility' Remotion.Linq.Utilities.StringUtility' Remotion.Linq.Utilities.StringUtility' Remotion.Linq.Utilities.StringUtility' Remotion.Linq.Utilities.StringUtility' Remotion.Linq.Utilities.StringUtility' Remotion.Linq.Utilities.StringUtility' Remotion.Linq.Utilities.StringUtility' Remotion.Linq.Clauses.ResultOperators.AsQueryableResultOperator' Remotion.Linq.Clauses.ResultOperators.ISupportedByIQueryModelVistor' Remotion.Linq.Clauses.StreamedData.IStreamedData' Remotion.Linq.Clauses.StreamedData.IStreamedDataInfo' Remotion.Linq.Clauses.StreamedData.StreamedSequenceInfo' Remotion.Linq.Clauses.ResultOperators.AsQueryableResultOperator' Remotion.Linq.Clauses.ResultOperators.ISupportedByIQueryModelVistor' Remotion.Linq.Clauses.StreamedData.IStreamedData' Remotion.Linq.Clauses.StreamedData.IStreamedDataInfo' Remotion.Linq.Clauses.StreamedData.StreamedSequenceInfo' Remotion.Linq.Clauses.ResultOperators.AsQueryableResultOperator' Remotion.Linq.Clauses.ResultOperators.ISupportedByIQueryModelVistor' Remotion.Linq.Clauses.StreamedData.IStreamedData' Remotion.Linq.Clauses.StreamedData.IStreamedDataInfo' Remotion.Linq.Clauses.StreamedData.StreamedSequenceInfo
Core.Net_3_5,Remotion.Linq.Clauses.Expressions,Remotion.Linq.Parsing.ExpressionVisitors.TreeEvaluation.EvaluatableTreeFindingExpressionVisitor' Remotion.Linq.Parsing.ExpressionVisitors.PartialEvaluatingExpressionVisitor' Remotion.Linq.Clauses.CloneContext' Remotion.Linq.Clauses.FromClauseBase' Remotion.Linq.Clauses.ExpressionVisitors.CloningExpressionVisitor' Remotion.Linq.Clauses.AdditionalFromClause' Remotion.Linq.Clauses.ExpressionVisitors.ReferenceReplacingExpressionVisitor' Remotion.Linq.Clauses.IQuerySource' Remotion.Linq.Clauses.ExpressionVisitors.ReverseResolvingExpressionVisitor' Remotion.Linq.Clauses.MainFromClause' Remotion.Linq.Clauses.ResultOperators.AggregateResultOperator' Remotion.Linq.Clauses.ResultOperators.AggregateFromSeedResultOperator' Remotion.Linq.Clauses.GroupJoinClause' Remotion.Linq.Clauses.JoinClause' Remotion.Linq.Clauses.ResultOperators.ConcatResultOperator' Remotion.Linq.Parsing.RelinqExpressionVisitor' Remotion.Linq.Parsing.Structure.IntermediateModel.IExpressionNode' Remotion.Linq.Clauses.ResultOperators.UnionResultOperator' Remotion.Linq.Clauses.ResultOperators.GroupResultOperator' Remotion.Linq.Parsing.Structure.IntermediateModel.MainSourceExpressionNode' Remotion.Linq.Clauses.ExpressionVisitors.FormattingExpressionVisitor' Remotion.Linq.Parsing.Structure.IntermediateModel.QuerySourceExpressionNodeUtility' Remotion.Linq.Transformations.SubQueryFromClauseFlattener' Remotion.Linq.Parsing.ThrowingExpressionVisitor' Remotion.Linq.QueryModel' Remotion.Linq.Parsing.ExpressionVisitors.MultiReplacingExpressionVisitor' Remotion.Linq.Parsing.ExpressionVisitors.ReplacingExpressionVisitor' Remotion.Linq.Parsing.ExpressionVisitors.TransparentIdentifierRemovingExpressionVisitor' Remotion.Linq.Parsing.ExpressionVisitors.SubQueryFindingExpressionVisitor' Remotion.Linq.Parsing.Structure.IntermediateModel.MethodCallExpressionNodeBase' Remotion.Linq.Parsing.ExpressionVisitors.Transformation.PredefinedTransformations.VBCompareStringExpressionTransformer' Remotion.Linq.Parsing.ExpressionVisitor,Remotion.Utilities.ArgumentUtility' Remotion.Linq.Parsing.ExpressionVisitor' Remotion.Utilities.ArgumentUtility' Remotion.Utilities.ArgumentUtility' Remotion.Linq.Clauses.IQuerySource' Remotion.Linq.Clauses.IQuerySource' Remotion.Linq.Parsing.RelinqExpressionVisitor' Remotion.Linq.Clauses.IQuerySource' Remotion.Linq.Parsing.RelinqExpressionVisitor' Remotion.Linq.QueryModel' Remotion.Linq.QueryModel' Remotion.Linq.QueryModel
Core.Net_3_5,Remotion.Linq.Clauses.ExpressionVisitors,Remotion.Linq.Transformations.SubQueryFromClauseFlattener' Remotion.Linq.Clauses.ResultOperators.AggregateResultOperator' Remotion.Linq.Clauses.ResultOperators.AllResultOperator' Remotion.Linq.Clauses.ResultOperators.AggregateFromSeedResultOperator' Remotion.Linq.Clauses.ResultOperators.GroupResultOperator' Remotion.Linq.Utilities.ExpressionExtensions,Remotion.Utilities.ArgumentUtility' Remotion.Utilities.Assertion' Remotion.Linq.Parsing.RelinqExpressionVisitor' Remotion.Utilities.ArgumentUtility' Remotion.Utilities.Assertion' Remotion.Linq.Parsing.RelinqExpressionVisitor' Remotion.Utilities.ArgumentUtility' Remotion.Utilities.Assertion' Remotion.Linq.Parsing.RelinqExpressionVisitor' Remotion.Linq.Clauses.QuerySourceMapping' Remotion.Linq.Clauses.Expressions.QuerySourceReferenceExpression' Remotion.Linq.Clauses.Expressions.SubQueryExpression' Remotion.Linq.Clauses.QuerySourceMapping' Remotion.Linq.Clauses.Expressions.QuerySourceReferenceExpression' Remotion.Linq.Clauses.Expressions.SubQueryExpression' Remotion.Linq.Clauses.QuerySourceMapping' Remotion.Linq.Clauses.Expressions.QuerySourceReferenceExpression' Remotion.Linq.Clauses.Expressions.SubQueryExpression' Remotion.Linq.Parsing.Structure.IntermediateModel.IExpressionNode' Remotion.Linq.Parsing.Structure.IntermediateModel.IExpressionNode' Remotion.Linq.Parsing.Structure.IntermediateModel.IExpressionNode' Remotion.Linq.Clauses.Expressions.ExtensionExpression
