Project,Namespace,Ca types,Ce types
Core.Net_3_5,Remotion.Linq.Parsing.ExpressionVisitors.TreeEvaluation,Remotion.Linq.Parsing.ExpressionVisitors.PartialEvaluatingExpressionVisitor' Remotion.Linq.Parsing.Structure.ExpressionTreeParser' Remotion.Linq.Parsing.Structure.ExpressionTreeProcessors.PartialEvaluatingExpressionTreeProcessor' Remotion.Linq.Parsing.Structure.QueryParser,Remotion.Utilities.ArgumentUtility' Remotion.Utilities.ArgumentUtility' Remotion.Utilities.ArgumentUtility' JetBrains.Annotations.NotNullAttribute' Remotion.Linq.Clauses.Expressions.IPartialEvaluationExceptionExpressionVisitor' Remotion.Linq.Clauses.Expressions.PartialEvaluationExceptionExpression' Remotion.Linq.Parsing.RelinqExpressionVisitor' JetBrains.Annotations.NotNullAttribute' Remotion.Linq.Clauses.Expressions.IPartialEvaluationExceptionExpressionVisitor' Remotion.Linq.Clauses.Expressions.PartialEvaluationExceptionExpression' Remotion.Linq.Parsing.RelinqExpressionVisitor' JetBrains.Annotations.NotNullAttribute' Remotion.Linq.Clauses.Expressions.IPartialEvaluationExceptionExpressionVisitor' Remotion.Linq.Clauses.Expressions.PartialEvaluationExceptionExpression' Remotion.Linq.Parsing.RelinqExpressionVisitor
Core.Net_3_5,Remotion.Linq.Parsing,Remotion.Linq.Clauses.ExpressionVisitors.FormattingExpressionVisitor' Remotion.Linq.Clauses.ExpressionVisitors.CloningExpressionVisitor' Remotion.Linq.Clauses.ExpressionVisitors.AccessorFindingExpressionVisitor' Remotion.Linq.Clauses.ExpressionVisitors.ReferenceReplacingExpressionVisitor' Remotion.Linq.Parsing.ExpressionVisitors.MultiReplacingExpressionVisitor' Remotion.Linq.Parsing.ExpressionVisitors.PartialEvaluatingExpressionVisitor' Remotion.Linq.QueryModel' Remotion.Linq.Clauses.ExpressionVisitors.ReverseResolvingExpressionVisitor' Remotion.Linq.Parsing.ExpressionVisitors.ReplacingExpressionVisitor' Remotion.Linq.Parsing.ExpressionVisitors.SubQueryFindingExpressionVisitor' Remotion.Linq.Parsing.ExpressionVisitors.TransformingExpressionVisitor' Remotion.Linq.Parsing.ExpressionVisitors.TreeEvaluation.EvaluatableTreeFindingExpressionVisitor' Remotion.Linq.Parsing.ExpressionVisitors.TransparentIdentifierRemovingExpressionVisitor' Remotion.Linq.Parsing.ExpressionVisitors.Transformation.PredefinedTransformations.MemberAddingNewExpressionTransformerBase' Remotion.Linq.Clauses.Expressions.VBStringComparisonExpression' Remotion.Linq.Clauses.Expressions.PartialEvaluationExceptionExpression' Remotion.Linq.Clauses.Expressions.ExtensionExpression,Remotion.Utilities.ArgumentUtility' Remotion.Linq.Clauses.Expressions.QuerySourceReferenceExpression' Remotion.Linq.Clauses.Expressions.SubQueryExpression' Remotion.Linq.Utilities.ReflectionUtility' Remotion.Utilities.ArgumentUtility' Remotion.Linq.Clauses.Expressions.QuerySourceReferenceExpression' Remotion.Linq.Clauses.Expressions.SubQueryExpression' Remotion.Linq.Utilities.ReflectionUtility' Remotion.Utilities.ArgumentUtility' Remotion.Linq.Clauses.Expressions.QuerySourceReferenceExpression' Remotion.Linq.Clauses.Expressions.SubQueryExpression' Remotion.Linq.Utilities.ReflectionUtility' Remotion.Linq.Utilities.ReflectionUtility' Remotion.Linq.Utilities.ReflectionUtility' Remotion.Linq.Utilities.ReflectionUtility' Remotion.Linq.Utilities.ReflectionUtility' Remotion.Linq.Utilities.ReflectionUtility' Remotion.Linq.Utilities.ReflectionUtility' Remotion.Linq.Utilities.ReflectionUtility' Remotion.Linq.Clauses.Expressions.ExtensionExpression' Remotion.Utilities.Assertion
Core.Net_3_5,Remotion.Linq.Parsing.Structure,Remotion.Linq.QueryProviderBase' Remotion.Linq.Parsing.Structure.IntermediateModel.IExpressionNode' Remotion.Linq.Parsing.ExpressionVisitors.SubQueryFindingExpressionVisitor' Remotion.Linq.Parsing.Structure.ExpressionTreeProcessors.TransformingExpressionTreeProcessor' Remotion.Linq.Parsing.Structure.ExpressionTreeProcessors.PartialEvaluatingExpressionTreeProcessor' Remotion.Linq.Parsing.Structure.ExpressionTreeProcessors.NullExpressionTreeProcessor' Remotion.Linq.Parsing.Structure.ExpressionTreeProcessors.CompoundExpressionTreeProcessor' Remotion.Linq.Parsing.Structure.NodeTypeProviders.MethodNameBasedNodeTypeRegistry' Remotion.Linq.Parsing.Structure.NodeTypeProviders.MethodInfoBasedNodeTypeRegistry' Remotion.Linq.Parsing.Structure.IntermediateModel.ClauseGenerationContext' Remotion.Linq.Parsing.Structure.NodeTypeProviders.CompoundNodeTypeProvider' Remotion.Linq.QueryableBase<T>' Remotion.Linq.DefaultQueryProvider,Remotion.Utilities.ArgumentUtility' Remotion.Utilities.Assertion' Remotion.Linq.UniqueIdentifierGenerator' Remotion.Linq.Parsing.ExpressionVisitors.SubQueryFindingExpressionVisitor' Remotion.Linq.Parsing.ExpressionVisitors.Transformation.ExpressionTransformerRegistry' Remotion.Linq.Parsing.ExpressionVisitors.Transformation.IExpressionTranformationProvider' Remotion.Linq.Parsing.ExpressionVisitors.TreeEvaluation.IEvaluatableExpressionFilter' Remotion.Linq.Parsing.ExpressionVisitors.TreeEvaluation.NullEvaluatableExpressionFilter' Remotion.Linq.Parsing.Structure.ExpressionTreeProcessors.CompoundExpressionTreeProcessor' Remotion.Linq.Parsing.Structure.ExpressionTreeProcessors.PartialEvaluatingExpressionTreeProcessor' Remotion.Linq.Parsing.Structure.ExpressionTreeProcessors.TransformingExpressionTreeProcessor' Remotion.Linq.Parsing.Structure.IntermediateModel.IExpressionNode' Remotion.Linq.Parsing.Structure.IntermediateModel.MainSourceExpressionNode' Remotion.Linq.Parsing.Structure.NodeTypeProviders.CompoundNodeTypeProvider' Remotion.Linq.Parsing.Structure.NodeTypeProviders.MethodInfoBasedNodeTypeRegistry' Remotion.Linq.Parsing.Structure.NodeTypeProviders.MethodNameBasedNodeTypeRegistry' Remotion.Utilities.ArgumentUtility' Remotion.Utilities.Assertion' Remotion.Linq.UniqueIdentifierGenerator' Remotion.Linq.Parsing.ExpressionVisitors.SubQueryFindingExpressionVisitor' Remotion.Linq.Parsing.ExpressionVisitors.Transformation.ExpressionTransformerRegistry' Remotion.Linq.Parsing.ExpressionVisitors.Transformation.IExpressionTranformationProvider' Remotion.Linq.Parsing.ExpressionVisitors.TreeEvaluation.IEvaluatableExpressionFilter' Remotion.Linq.Parsing.ExpressionVisitors.TreeEvaluation.NullEvaluatableExpressionFilter' Remotion.Linq.Parsing.Structure.ExpressionTreeProcessors.CompoundExpressionTreeProcessor' Remotion.Linq.Parsing.Structure.ExpressionTreeProcessors.PartialEvaluatingExpressionTreeProcessor' Remotion.Linq.Parsing.Structure.ExpressionTreeProcessors.TransformingExpressionTreeProcessor' Remotion.Linq.Parsing.Structure.IntermediateModel.IExpressionNode' Remotion.Linq.Parsing.Structure.IntermediateModel.MainSourceExpressionNode' Remotion.Linq.Parsing.Structure.NodeTypeProviders.CompoundNodeTypeProvider' Remotion.Linq.Parsing.Structure.NodeTypeProviders.MethodInfoBasedNodeTypeRegistry' Remotion.Linq.Parsing.Structure.NodeTypeProviders.MethodNameBasedNodeTypeRegistry' Remotion.Utilities.ArgumentUtility' Remotion.Utilities.Assertion' Remotion.Linq.UniqueIdentifierGenerator' Remotion.Linq.Parsing.ExpressionVisitors.SubQueryFindingExpressionVisitor' Remotion.Linq.Parsing.ExpressionVisitors.Transformation.ExpressionTransformerRegistry' Remotion.Linq.Parsing.ExpressionVisitors.Transformation.IExpressionTranformationProvider' Remotion.Linq.Parsing.ExpressionVisitors.TreeEvaluation.IEvaluatableExpressionFilter' Remotion.Linq.Parsing.ExpressionVisitors.TreeEvaluation.NullEvaluatableExpressionFilter' Remotion.Linq.Parsing.Structure.ExpressionTreeProcessors.CompoundExpressionTreeProcessor' Remotion.Linq.Parsing.Structure.ExpressionTreeProcessors.PartialEvaluatingExpressionTreeProcessor' Remotion.Linq.Parsing.Structure.ExpressionTreeProcessors.TransformingExpressionTreeProcessor' Remotion.Linq.Parsing.Structure.IntermediateModel.IExpressionNode' Remotion.Linq.Parsing.Structure.IntermediateModel.MainSourceExpressionNode' Remotion.Linq.Parsing.Structure.NodeTypeProviders.CompoundNodeTypeProvider' Remotion.Linq.Parsing.Structure.NodeTypeProviders.MethodInfoBasedNodeTypeRegistry' Remotion.Linq.Parsing.Structure.NodeTypeProviders.MethodNameBasedNodeTypeRegistry' Remotion.Linq.QueryModel' Remotion.Linq.QueryModel' Remotion.Linq.QueryModel' Remotion.Linq.Parsing.Structure.IntermediateModel.ExpressionNodeInstantiationException' Remotion.Linq.Parsing.Structure.IntermediateModel.MethodCallExpressionNodeFactory' Remotion.Linq.Parsing.Structure.IntermediateModel.MethodCallExpressionParseInfo' Remotion.Linq.Parsing.Structure.IntermediateModel.ExpressionNodeInstantiationException' Remotion.Linq.Parsing.Structure.IntermediateModel.MethodCallExpressionNodeFactory' Remotion.Linq.Parsing.Structure.IntermediateModel.MethodCallExpressionParseInfo' Remotion.Linq.Parsing.Structure.IntermediateModel.ExpressionNodeInstantiationException' Remotion.Linq.Parsing.Structure.IntermediateModel.MethodCallExpressionNodeFactory' Remotion.Linq.Parsing.Structure.IntermediateModel.MethodCallExpressionParseInfo' Remotion.Linq.Parsing.Structure.IntermediateModel.ClauseGenerationContext' Remotion.Linq.Parsing.Structure.IntermediateModel.ClauseGenerationContext' Remotion.Linq.Parsing.Structure.IntermediateModel.ClauseGenerationContext
Core.Net_3_5,Remotion.Linq.Parsing.Structure.ExpressionTreeProcessors,Remotion.Linq.Parsing.Structure.ExpressionTreeParser' Remotion.Linq.Parsing.ExpressionVisitors.SubQueryFindingExpressionVisitor,Remotion.Utilities.ArgumentUtility' Remotion.Linq.Parsing.Structure.IExpressionTreeProcessor' Remotion.Utilities.ArgumentUtility' Remotion.Linq.Parsing.Structure.IExpressionTreeProcessor' Remotion.Utilities.ArgumentUtility' Remotion.Linq.Parsing.Structure.IExpressionTreeProcessor' Remotion.Linq.Parsing.ExpressionVisitors.PartialEvaluatingExpressionVisitor' Remotion.Linq.Parsing.ExpressionVisitors.TreeEvaluation.IEvaluatableExpressionFilter' Remotion.Linq.Parsing.ExpressionVisitors.PartialEvaluatingExpressionVisitor' Remotion.Linq.Parsing.ExpressionVisitors.TreeEvaluation.IEvaluatableExpressionFilter' Remotion.Linq.Parsing.ExpressionVisitors.PartialEvaluatingExpressionVisitor' Remotion.Linq.Parsing.ExpressionVisitors.TreeEvaluation.IEvaluatableExpressionFilter' Remotion.Linq.Parsing.ExpressionVisitors.TransformingExpressionVisitor' Remotion.Linq.Parsing.ExpressionVisitors.Transformation.ExpressionTransformerRegistry' Remotion.Linq.Parsing.ExpressionVisitors.Transformation.IExpressionTranformationProvider' Remotion.Linq.Parsing.ExpressionVisitors.TransformingExpressionVisitor' Remotion.Linq.Parsing.ExpressionVisitors.Transformation.ExpressionTransformerRegistry' Remotion.Linq.Parsing.ExpressionVisitors.Transformation.IExpressionTranformationProvider' Remotion.Linq.Parsing.ExpressionVisitors.TransformingExpressionVisitor' Remotion.Linq.Parsing.ExpressionVisitors.Transformation.ExpressionTransformerRegistry' Remotion.Linq.Parsing.ExpressionVisitors.Transformation.IExpressionTranformationProvider
Core.Net_3_5,Remotion.Linq.Parsing.Structure.IntermediateModel,Remotion.Linq.Parsing.Structure.NodeTypeProviders.MethodInfoBasedNodeTypeRegistry' Remotion.Linq.Parsing.Structure.QueryParser' Remotion.Linq.Parsing.Structure.NodeTypeProviders.MethodNameBasedNodeTypeRegistry' Remotion.Linq.Parsing.Structure.MethodCallExpressionParser' Remotion.Linq.Parsing.Structure.INodeTypeProvider' Remotion.Linq.Parsing.Structure.ExpressionTreeParser' Remotion.Linq.Clauses.ExpressionVisitors.ReverseResolvingExpressionVisitor,Remotion.Utilities.ArgumentUtility' Remotion.Linq.Clauses.ResultOperatorBase' Remotion.Linq.Clauses.ResultOperators.AggregateResultOperator' Remotion.Linq.Utilities.ReflectionUtility' Remotion.Utilities.ArgumentUtility' Remotion.Linq.Clauses.ResultOperatorBase' Remotion.Linq.Clauses.ResultOperators.AggregateResultOperator' Remotion.Linq.Utilities.ReflectionUtility' Remotion.Utilities.ArgumentUtility' Remotion.Linq.Clauses.ResultOperatorBase' Remotion.Linq.Clauses.ResultOperators.AggregateResultOperator' Remotion.Linq.Utilities.ReflectionUtility' Remotion.Linq.Utilities.ReflectionUtility' Remotion.Linq.Utilities.ReflectionUtility' Remotion.Linq.Utilities.ReflectionUtility' Remotion.Linq.Utilities.ReflectionUtility' Remotion.Linq.Utilities.ReflectionUtility' Remotion.Linq.Utilities.ReflectionUtility' Remotion.Linq.Utilities.ReflectionUtility' Remotion.Linq.Clauses.ResultOperators.AggregateFromSeedResultOperator' Remotion.Linq.Clauses.ResultOperators.AggregateFromSeedResultOperator' Remotion.Linq.Clauses.ResultOperators.AggregateFromSeedResultOperator' Remotion.Linq.Clauses.ResultOperators.AllResultOperator' Remotion.Linq.Clauses.ResultOperators.AllResultOperator' Remotion.Linq.Clauses.ResultOperators.AllResultOperator' Remotion.Linq.Clauses.ResultOperators.AnyResultOperator' Remotion.Linq.Clauses.ResultOperators.AnyResultOperator' Remotion.Linq.Clauses.ResultOperators.AnyResultOperator' Remotion.Linq.Clauses.ResultOperators.AsQueryableResultOperator' Remotion.Linq.Clauses.ResultOperators.AsQueryableResultOperator' Remotion.Linq.Clauses.ResultOperators.AsQueryableResultOperator' Remotion.Linq.Clauses.ResultOperators.AverageResultOperator' Remotion.Linq.Clauses.ResultOperators.AverageResultOperator' Remotion.Linq.Clauses.ResultOperators.AverageResultOperator' Remotion.Linq.Clauses.ResultOperators.CastResultOperator' Remotion.Linq.Parsing.ExpressionVisitors.ReplacingExpressionVisitor' Remotion.Linq.Clauses.ResultOperators.CastResultOperator' Remotion.Linq.Parsing.ExpressionVisitors.ReplacingExpressionVisitor' Remotion.Linq.Clauses.ResultOperators.CastResultOperator' Remotion.Linq.Parsing.ExpressionVisitors.ReplacingExpressionVisitor' Remotion.Linq.Parsing.Structure.INodeTypeProvider' Remotion.Linq.Parsing.Structure.INodeTypeProvider' Remotion.Linq.Parsing.Structure.INodeTypeProvider' Remotion.Linq.Clauses.ResultOperators.ConcatResultOperator' Remotion.Linq.Clauses.ResultOperators.ConcatResultOperator' Remotion.Linq.Clauses.ResultOperators.ConcatResultOperator' Remotion.Linq.Clauses.ResultOperators.ContainsResultOperator' Remotion.Linq.Parsing.Structure.NodeTypeProviders.NameBasedRegistrationInfo' Remotion.Linq.Clauses.ResultOperators.ContainsResultOperator' Remotion.Linq.Parsing.Structure.NodeTypeProviders.NameBasedRegistrationInfo' Remotion.Linq.Clauses.ResultOperators.ContainsResultOperator' Remotion.Linq.Parsing.Structure.NodeTypeProviders.NameBasedRegistrationInfo' Remotion.Utilities.Assertion' Remotion.Linq.Clauses.ResultOperators.CountResultOperator' Remotion.Utilities.Assertion' Remotion.Linq.Clauses.ResultOperators.CountResultOperator' Remotion.Utilities.Assertion' Remotion.Linq.Clauses.ResultOperators.CountResultOperator' Remotion.Linq.Clauses.ResultOperators.DefaultIfEmptyResultOperator' Remotion.Linq.Clauses.ResultOperators.DefaultIfEmptyResultOperator' Remotion.Linq.Clauses.ResultOperators.DefaultIfEmptyResultOperator' Remotion.Linq.Clauses.ResultOperators.DistinctResultOperator' Remotion.Linq.Clauses.ResultOperators.DistinctResultOperator' Remotion.Linq.Clauses.ResultOperators.DistinctResultOperator' Remotion.Linq.Clauses.ResultOperators.ExceptResultOperator' Remotion.Linq.Clauses.ResultOperators.ExceptResultOperator' Remotion.Linq.Clauses.ResultOperators.ExceptResultOperator' Remotion.Linq.Parsing.ExpressionVisitors.TransparentIdentifierRemovingExpressionVisitor' Remotion.Linq.Parsing.ExpressionVisitors.TransparentIdentifierRemovingExpressionVisitor' Remotion.Linq.Parsing.ExpressionVisitors.TransparentIdentifierRemovingExpressionVisitor' Remotion.Linq.Clauses.ResultOperators.FirstResultOperator' Remotion.Linq.Clauses.ResultOperators.FirstResultOperator' Remotion.Linq.Clauses.ResultOperators.FirstResultOperator' Remotion.Linq.Clauses.ResultOperators.GroupResultOperator' Remotion.Linq.Clauses.ResultOperators.GroupResultOperator' Remotion.Linq.Clauses.ResultOperators.GroupResultOperator' Remotion.Linq.QueryModel' Remotion.Linq.Parsing.ExpressionVisitors.MultiReplacingExpressionVisitor' Remotion.Linq.QueryModel' Remotion.Linq.Parsing.ExpressionVisitors.MultiReplacingExpressionVisitor' Remotion.Linq.QueryModel' Remotion.Linq.Parsing.ExpressionVisitors.MultiReplacingExpressionVisitor' Remotion.Linq.Clauses.GroupJoinClause' Remotion.Linq.Clauses.GroupJoinClause' Remotion.Linq.Clauses.GroupJoinClause' Remotion.Linq.Clauses.MainFromClause' Remotion.Linq.Clauses.Expressions.QuerySourceReferenceExpression' Remotion.Linq.Parsing.Structure.ExpressionTreeParser' Remotion.Linq.Clauses.MainFromClause' Remotion.Linq.Clauses.Expressions.QuerySourceReferenceExpression' Remotion.Linq.Parsing.Structure.ExpressionTreeParser' Remotion.Linq.Clauses.MainFromClause' Remotion.Linq.Clauses.Expressions.QuerySourceReferenceExpression' Remotion.Linq.Parsing.Structure.ExpressionTreeParser' Remotion.Linq.Clauses.ResultOperators.IntersectResultOperator' Remotion.Linq.Clauses.ResultOperators.IntersectResultOperator' Remotion.Linq.Clauses.ResultOperators.IntersectResultOperator' Remotion.Linq.Clauses.JoinClause' Remotion.Linq.Clauses.JoinClause' Remotion.Linq.Clauses.JoinClause' Remotion.Linq.Clauses.ResultOperators.LastResultOperator' Remotion.Linq.Clauses.ResultOperators.LastResultOperator' Remotion.Linq.Clauses.ResultOperators.LastResultOperator' Remotion.Linq.Clauses.ResultOperators.LongCountResultOperator' Remotion.Linq.Clauses.ResultOperators.LongCountResultOperator' Remotion.Linq.Clauses.ResultOperators.LongCountResultOperator' Remotion.Linq.Clauses.SelectClause' Remotion.Linq.Utilities.ItemTypeReflectionUtility' Remotion.Linq.Clauses.SelectClause' Remotion.Linq.Utilities.ItemTypeReflectionUtility' Remotion.Linq.Clauses.SelectClause' Remotion.Linq.Utilities.ItemTypeReflectionUtility' Remotion.Linq.Clauses.ResultOperators.MaxResultOperator' Remotion.Linq.Clauses.ResultOperators.MaxResultOperator' Remotion.Linq.Clauses.ResultOperators.MaxResultOperator' Remotion.Linq.Clauses.Expressions.SubQueryExpression' Remotion.Linq.Clauses.Expressions.SubQueryExpression' Remotion.Linq.Clauses.Expressions.SubQueryExpression' Remotion.Linq.Clauses.ResultOperators.MinResultOperator' Remotion.Linq.Clauses.ResultOperators.MinResultOperator' Remotion.Linq.Clauses.ResultOperators.MinResultOperator' Remotion.Linq.Clauses.ResultOperators.OfTypeResultOperator' Remotion.Linq.Clauses.ResultOperators.OfTypeResultOperator' Remotion.Linq.Clauses.ResultOperators.OfTypeResultOperator' Remotion.Linq.Clauses.OrderByClause' Remotion.Linq.Clauses.Ordering' Remotion.Linq.Clauses.OrderingDirection' Remotion.Linq.Clauses.OrderByClause' Remotion.Linq.Clauses.Ordering' Remotion.Linq.Clauses.OrderingDirection' Remotion.Linq.Clauses.OrderByClause' Remotion.Linq.Clauses.Ordering' Remotion.Linq.Clauses.OrderingDirection' Remotion.Linq.Clauses.IQuerySource' Remotion.Linq.Clauses.IQuerySource' Remotion.Linq.Clauses.IQuerySource' Remotion.Linq.Clauses.ResultOperators.ReverseResultOperator' Remotion.Linq.Clauses.ResultOperators.ReverseResultOperator' Remotion.Linq.Clauses.ResultOperators.ReverseResultOperator' Remotion.Linq.Clauses.AdditionalFromClause' Remotion.Linq.Clauses.AdditionalFromClause' Remotion.Linq.Clauses.AdditionalFromClause' Remotion.Linq.Clauses.ResultOperators.SingleResultOperator' Remotion.Linq.Clauses.ResultOperators.SingleResultOperator' Remotion.Linq.Clauses.ResultOperators.SingleResultOperator' Remotion.Linq.Clauses.ResultOperators.SkipResultOperator' Remotion.Linq.Clauses.ResultOperators.SkipResultOperator' Remotion.Linq.Clauses.ResultOperators.SkipResultOperator' Remotion.Linq.Clauses.ResultOperators.SumResultOperator' Remotion.Linq.Clauses.ResultOperators.SumResultOperator' Remotion.Linq.Clauses.ResultOperators.SumResultOperator' System.Reflection.TypeInfo' System.Reflection.TypeInfo' System.Reflection.TypeInfo' System.Reflection.TypeInfo' System.Reflection.TypeInfo' System.Reflection.TypeInfo' System.Reflection.TypeInfo' Remotion.Linq.Clauses.ResultOperators.TakeResultOperator' Remotion.Linq.Clauses.ResultOperators.TakeResultOperator' Remotion.Linq.Clauses.ResultOperators.TakeResultOperator' Remotion.Linq.Clauses.ResultOperators.UnionResultOperator' Remotion.Linq.Clauses.ResultOperators.UnionResultOperator' Remotion.Linq.Clauses.ResultOperators.UnionResultOperator' Remotion.Linq.Clauses.WhereClause' Remotion.Linq.Clauses.WhereClause' Remotion.Linq.Clauses.WhereClause
