Namespace,Type,NOF,NOM,NOP,NOPF,NOPM,LOC,WMC,NC,DIT,LCOM,Fan-Out,Fan-In,Fan-Out types,Fan-In types
wojilu.Web.Controller.Security,SiteDataAdminMenu,0,4,4,0,3,27,6,0,0,-1,2,2,wojilu.Web.Controller.Security.SecurityUtils' wojilu.Web.Controller.Security.SiteAdminOperation,wojilu.Web.Controller.Security.OperationDB' wojilu.Web.Controller.Layouts.SiteLayoutController
wojilu.Web.Controller.Security,SiteLogString,0,86,0,0,85,111,87,0,0,-1,0,24,,wojilu.Web.Controller.Admin.MainController' wojilu.Web.Controller.Admin.SiteConfigController' wojilu.Web.Controller.Admin.SiteSkinController' wojilu.Web.Controller.Admin.Apps.Blog.MainController' wojilu.Web.Controller.Admin.Apps.Blog.SysCategoryController' wojilu.Web.Controller.Admin.Apps.Blog.TrashController' wojilu.Web.Controller.Admin.Apps.Content.MainController' wojilu.Web.Controller.Admin.Sys.FooterMenuController' wojilu.Web.Controller.Admin.Sys.PageController' wojilu.Web.Controller.Admin.Apps.Photo.PostAdminController' wojilu.Web.Controller.Admin.Apps.Photo.MainController' wojilu.Web.Controller.Admin.Apps.Photo.SysCategoryController' wojilu.Web.Controller.Admin.Groups.GroupController' wojilu.Web.Controller.Admin.Members.UserSettingController' wojilu.Web.Controller.Admin.Members.UserController' wojilu.Web.Controller.Admin.Credits.CreditController' wojilu.Web.Controller.Admin.Credits.CurrencyController' wojilu.Web.Controller.Admin.Security.PermissionBackController' wojilu.Web.Controller.Admin.Security.PermissionFrontController' wojilu.Web.Controller.Admin.Security.SecurityController' wojilu.Web.Controller.Groups.Admin.MainController' wojilu.Web.Controller.Groups.Admin.FriendController' wojilu.Web.Controller.Common.Admin.AppBaseController' wojilu.Web.Controller.Common.Admin.MenuBaseController
wojilu.Web.Controller.Security,AppRole,0,3,3,0,3,41,6,0,1,-1,1,5,wojilu.Members.Sites.Domain.SiteRole,wojilu.Web.Controller.SecurityController' wojilu.Web.Controller.Admin.Security.PermissionFrontController' wojilu.Web.Controller.Common.Admin.AppBaseController' wojilu.Web.Controller.Helpers.SiteInitHelper' wojilu.Web.Controller.BaseInstaller
wojilu.Web.Controller.Security,AppAdminRole,0,6,2,0,6,44,9,0,1,-1,7,6,wojilu.Members.Users.Domain.User' wojilu.Members.Interface.IUser' wojilu.Common.MemberApp.Interface.IMemberAppService' wojilu.Common.MemberApp.Interface.IMemberApp' wojilu.Common.ServiceMap' wojilu.Members.Interface.IMember' wojilu.Members.Sites.Domain.SiteRole,wojilu.Web.Controller.SecurityController' wojilu.Web.Controller.Admin.Security.PermissionBackController' wojilu.Web.Controller.Common.Admin.AppBaseController' wojilu.Web.Controller.Layouts.SiteLayoutController' wojilu.Web.Controller.Helpers.SiteInitHelper' wojilu.Web.Controller.BaseInstaller
wojilu.Web.Controller.Security,SecurityUtils,0,2,0,0,2,23,3,0,0,-1,2,3,wojilu.strUtil' wojilu.Web.Mvc.MvcConfig,wojilu.Web.Controller.Security.SiteDataAdminMenu' wojilu.Web.Controller.Security.SiteAdminMenu' wojilu.Web.Controller.Security.SiteAdminOperation
wojilu.Web.Controller.Security,SiteAdminMenu,2,4,5,1,3,32,4,0,0,0.5,2,2,wojilu.ILog' wojilu.Web.Controller.Security.SecurityUtils,wojilu.Web.Controller.Security.OperationDB' wojilu.Web.Controller.Layouts.SiteLayoutController
wojilu.Web.Controller.Security,SiteAdminOperation,2,20,6,0,14,126,32,0,1,0.45,7,5,wojilu.Web.Controller.Security.SecurityUtils' wojilu.rft' wojilu.Web.Mvc.MvcConfig' wojilu.strUtil' wojilu.Web.Controller.Security.OperationDB' wojilu.Common.Security.ISecurityAction' wojilu.Result,wojilu.Web.Controller.Admin.Security.PermissionBackController' wojilu.Web.Controller.Security.SiteAdminService' wojilu.Web.Controller.Security.SiteDataAdminMenu' wojilu.Web.Controller.Security.OperationDB' wojilu.Web.Controller.Layouts.SiteLayoutController
wojilu.Web.Controller.Security,OperationDB,2,8,3,0,3,103,12,0,0,0.25,28,3,wojilu.lang' wojilu.Web.Controller.Admin.Sys.DashboardController' wojilu.Web.Controller.Security.SiteAdminMenu' wojilu.Web.Controller.Admin.Members.UserController' wojilu.Web.Controller.Admin.Groups.GroupController' wojilu.Web.Controller.Admin.Security.SecurityController' wojilu.Web.Controller.Admin.Credits.CurrencyController' wojilu.Web.Controller.Admin.SiteConfigController' wojilu.Web.Controller.Admin.SiteSkinController' wojilu.Web.Controller.Admin.Sys.SiteLogController' wojilu.Web.Controller.Admin.Sys.FooterMenuController' wojilu.Web.Controller.Admin.Sys.PageCategoryController' wojilu.Web.Controller.Admin.Mb.MicroblogController' wojilu.Web.Controller.Admin.TagAdminController' wojilu.Web.Controller.Admin.CacheController' wojilu.Web.Controller.Admin.AdController' wojilu.Web.Controller.Admin.Spiders.TemplateController' wojilu.Web.Controller.Admin.CommentController' wojilu.Web.Controller.Admin.Sys.ConnectAdminController' wojilu.Web.Controller.Admin.AppController' wojilu.Web.Controller.Admin.MenuController' wojilu.Web.Controller.Admin.AppConfigController' wojilu.Web.Controller.Security.SiteDataAdminMenu' wojilu.Web.Controller.Admin.Security.PermissionFrontController' wojilu.Web.Controller.Admin.Security.PermissionBackController' wojilu.Web.Controller.Admin.Credits.CreditController' wojilu.Web.Controller.Admin.Sys.PageController' wojilu.Web.Controller.Security.SiteAdminOperation,wojilu.Web.Controller.Security.SiteAdminService' wojilu.Web.Controller.Security.SiteAdminOperation' wojilu.Web.Controller.Layouts.SiteLayoutController
wojilu.Web.Controller.Security,SiteAdminOperationConfig,0,2,2,0,1,32,6,0,1,-1,3,3,wojilu.Common.Security.Utils.SecurityTool' wojilu.Members.Sites.Service.SiteRoleService' wojilu.Members.Users.Domain.User,wojilu.Web.Controller.Admin.Security.PermissionBackController' wojilu.Web.Controller.Security.SiteAdminService' wojilu.Web.Controller.Layouts.SiteLayoutController
wojilu.Web.Controller.Security,UserDataRole,0,4,2,0,3,32,8,0,1,-1,3,3,wojilu.Common.AppInstall.AppInstaller' wojilu.strUtil' wojilu.Common.AppInstall.AppInstallerService,wojilu.Web.Controller.SecurityController' wojilu.Web.Controller.Admin.Security.PermissionBackController' wojilu.Web.Controller.Layouts.SiteLayoutController
wojilu.Web.Controller.Photo.Admin,PhotoController,0,4,2,0,3,40,6,0,1,-1,11,2,wojilu.Web.Mvc.ControllerBase' wojilu.Web.Controller.Photo.LayoutController' wojilu.Web.Controller.Photo.Admin.MyController' wojilu.Web.IBlock' wojilu.Web.Context.IViewerContext' wojilu.Web.Context.MvcContext' wojilu.Apps.Photo.Interface.IPhotoPostService' wojilu.Members.Users.Domain.User' wojilu.Apps.Photo.Domain.PhotoPost' wojilu.Web.Mvc.alink' wojilu.Members.Users.Interface.IFriendService,wojilu.Web.Controller.Photo.LayoutController' wojilu.Web.Controller.Photo.Admin.LayoutController
wojilu.Web.Controller.Photo.Admin,PostController,1,11,5,0,8,217,33,0,1,0.18,31,7,wojilu.ILog' wojilu.Web.Mvc.ControllerBase' wojilu.Web.Controller.Photo.LayoutController' wojilu.Web.Controller.Admin.AdminSecurityUtils' wojilu.strUtil' wojilu.UrlInfo' wojilu.Web.Context.MvcContext' wojilu.Apps.Photo.Interface.IPhotoAlbumService' wojilu.Web.Context.IAppContext' wojilu.Web.Controller.Photo.Admin.AlbumController' wojilu.Apps.Photo.Interface.IPhotoSysCategoryService' wojilu.SysPath' wojilu.sys' wojilu.Apps.Photo.Domain.PhotoAlbum' wojilu.Web.IBlock' wojilu.Web.Context.IOwnerContext' wojilu.Result' wojilu.Web.HttpFile' wojilu.Apps.Photo.Domain.PhotoPost' wojilu.Apps.Photo.Domain.PhotoApp' wojilu.Members.Users.Domain.User' wojilu.Web.Utils.Uploader' wojilu.Apps.Photo.Interface.IPhotoPostService' wojilu.Web.Controller.Photo.Admin.MyController' wojilu.Common.Microblogs.Interface.IMicroblogService' wojilu.Web.Context.IViewerContext' wojilu.Members.Interface.IUser' wojilu.Members.Interface.IMember' wojilu.Common.Tags.TagTool' wojilu.Web.IWebContext' wojilu.Common.Tags.TagService,wojilu.Web.Controller.Photo.LayoutController' wojilu.Web.Controller.Photo.Wf.HomeController' wojilu.Web.Controller.Photo.Admin.LayoutController' wojilu.Web.Controller.Photo.Admin.AlbumController' wojilu.Web.Controller.Photo.Admin.MyController' wojilu.Web.Controller.Photo.Caching.PhotoMainActionCache' wojilu.Web.Controller.Photo.Caching.PhotoMainLayoutCache
wojilu.Web.Controller.Photo.Admin,LayoutController,0,3,0,0,3,28,3,0,1,-1,9,0,wojilu.Members.Users.Service.UserAppService' wojilu.Common.MemberApp.Interface.IMemberApp' wojilu.Common.MemberApp.Interface.IMemberAppService' wojilu.Web.Context.IAppContext' wojilu.Web.Context.MvcContext' wojilu.Web.Controller.Photo.Admin.PhotoController' wojilu.Web.Controller.Photo.Admin.MyController' wojilu.Web.Controller.Photo.Admin.AlbumController' wojilu.Web.Controller.Photo.Admin.PostController,
wojilu.Web.Controller.Photo.Admin,AlbumController,0,11,2,0,10,148,25,0,1,-1,16,4,wojilu.Web.Mvc.ControllerBase' wojilu.Web.Controller.Photo.LayoutController' wojilu.Web.IBlock' wojilu.Apps.Photo.Interface.IPhotoAlbumService' wojilu.Web.Context.IAppContext' wojilu.Web.Context.MvcContext' wojilu.Apps.Photo.Domain.PhotoAlbum' wojilu.strUtil' wojilu.Web.Controller.Photo.PhotoHelper' wojilu.Apps.Photo.Domain.PhotoPost' wojilu.db' wojilu.Result' wojilu.Web.Context.IOwnerContext' wojilu.Members.Interface.IMember' wojilu.Apps.Photo.Interface.IPhotoPostService' wojilu.Web.Controller.Photo.Admin.PostController,wojilu.Web.Controller.Photo.PhotoLink' wojilu.Web.Controller.Photo.LayoutController' wojilu.Web.Controller.Photo.Admin.PostController' wojilu.Web.Controller.Photo.Admin.LayoutController
wojilu.Web.Controller.Photo.Admin,MyController,0,8,4,0,5,93,15,0,1,-1,15,6,wojilu.Web.Mvc.ControllerBase' wojilu.Web.Controller.Photo.LayoutController' wojilu.Apps.Photo.Interface.IPhotoAlbumService' wojilu.Web.Context.IAppContext' wojilu.Web.Context.MvcContext' wojilu.Apps.Photo.Interface.IPhotoPostService' wojilu.Web.Context.IOwnerContext' wojilu.Apps.Photo.Domain.PhotoAlbum' wojilu.Web.IBlock' wojilu.Apps.Photo.Domain.PhotoPost' wojilu.strUtil' wojilu.Web.Mvc.alink' wojilu.Web.Controller.Photo.Admin.PostController' wojilu.IEntity' wojilu.cvt,wojilu.Web.Controller.Photo.PhotoLink' wojilu.Web.Controller.Photo.LayoutController' wojilu.Web.Controller.Photo.Admin.PhotoController' wojilu.Web.Controller.Photo.Admin.PostController' wojilu.Web.Controller.Photo.Admin.LayoutController' wojilu.Web.Controller.Photo.Caching.PhotoMainActionCache
wojilu.Web.Controller.Photo.Caching,PhotoMainActionCache,0,3,0,0,3,23,3,0,2,-1,7,1,wojilu.Web.Context.MvcContext' wojilu.Web.Controller.Photo.Admin.PostController' wojilu.Web.Controller.Admin.Apps.Photo.SysCategoryController' wojilu.Web.Controller.Photo.Admin.MyController' wojilu.Web.Controller.Admin.Apps.Photo.MainController' wojilu.Caching.IApplicationCache' wojilu.Caching.CacheManager,wojilu.Web.Controller.Photo.Caching.PhotoMainPageCache
wojilu.Web.Controller.Photo.Caching,PhotoMainLayoutCache,0,3,0,0,3,14,3,0,2,-1,4,0,wojilu.Web.Context.MvcContext' wojilu.Web.Controller.Photo.Admin.PostController' wojilu.Caching.IApplicationCache' wojilu.Caching.CacheManager,
wojilu.Web.Controller.Photo.Caching,PhotoMainPageCache,0,2,0,0,2,11,2,0,1,-1,7,0,wojilu.Web.Controller.Common.Caching.SiteLayoutCache' wojilu.Web.Controller.Photo.Caching.PhotoMainActionCache' wojilu.Web.Mvc.Link' wojilu.Members.Sites.Domain.Site' wojilu.Web.Controller.Photo.MainController' wojilu.Web.Mvc.CorePageCache' wojilu.Web.Context.MvcContext,
wojilu.Web.Controller.Users.Admin,AvatarController,0,11,2,0,4,132,21,0,1,-1,18,1,wojilu.Members.Users.Interface.IUserErrorPicService' wojilu.Web.Context.IViewerContext' wojilu.Web.Context.MvcContext' wojilu.Members.Users.Domain.UserErrorPic' wojilu.UrlInfo' wojilu.Web.Controller.LayoutController' wojilu.Web.Controller.Users.Admin.LayoutController' wojilu.Web.Controller.Users.Admin.UserProfileController' wojilu.Members.Users.Domain.User' wojilu.Web.Context.IOwnerContext' wojilu.Web.IWebContext' wojilu.Result' wojilu.Web.Utils.AvatarUploader' wojilu.Members.Users.Domain.UserFactory' wojilu.Members.Users.Interface.IUserService' wojilu.SysRequest' wojilu.sys' wojilu.strUtil,wojilu.Web.Controller.Layouts.TopNavController
wojilu.Web.Controller.Users.Admin,HomeController,0,12,8,0,8,171,24,0,1,-1,34,7,wojilu.Members.Users.Domain.User' wojilu.Web.Context.IOwnerContext' wojilu.Web.Context.MvcContext' wojilu.Members.Users.Interface.IFollowerService' wojilu.Members.Users.Interface.IVisitorService' wojilu.Web.Controller.Users.FriendController' wojilu.Web.Controller.Users.VisitorController' wojilu.Common.Microblogs.Interface.IMicroblogService' wojilu.Members.Interface.IMember' wojilu.Common.Microblogs.MicroblogAppSetting' wojilu.Common.Microblogs.Service.MicroblogFavoriteService' wojilu.Web.Context.IViewerContext' wojilu.Web.Controller.Microblogs.MicroblogController' wojilu.Web.Controller.Microblogs.MicroblogSaveController' wojilu.Web.Controller.Microblogs.My.MbSaveController' wojilu.Web.Controller.Admin.AdminSecurityUtils' wojilu.SysPath' wojilu.sys' wojilu.Net.Video.VideoInfo' wojilu.Common.Microblogs.Domain.MicroblogVideoTemp' wojilu.strUtil' wojilu.Net.Video.IVideoSpider' wojilu.Web.Mvc.PageMeta' wojilu.Common.Microblogs.Service.MicroblogAtService' wojilu.Web.IBlock' wojilu.Common.Microblogs.Domain.Microblog' wojilu.Common.Comments.IOpenCommentService' wojilu.Common.Comments.OpenComment' wojilu.Web.Controller.Microblogs.MbLink' wojilu.Config.SiteSetting' wojilu.config' wojilu.Web.Mvc.alink' wojilu.Members.Users.Domain.MemberProfile' wojilu.UrlInfo,wojilu.Web.Controller.LinkController' wojilu.Web.Controller.MainController' wojilu.Web.Controller.Microblogs.MbLink' wojilu.Web.Controller.Users.Admin.NotificationController' wojilu.Web.Controller.Layouts.SpaceLayoutController' wojilu.Web.Controller.Layouts.TopNavController' wojilu.Web.Controller.Microblogs.My.MicroblogCommentsController
wojilu.Web.Controller.Users.Admin,MsgController,0,36,4,0,20,357,62,0,1,-1,31,8,wojilu.Members.Users.Domain.User' wojilu.Common.Msg.Domain.MessageStats' wojilu.Web.Controller.Users.Admin.NotificationController' wojilu.Members.Interface.IUser' wojilu.Web.Context.IViewerContext' wojilu.Web.Context.MvcContext' wojilu.Members.Sites.Domain.SiteRole' wojilu.Web.Controller.Users.Admin.SiteNfController' wojilu.Web.Context.IOwnerContext' wojilu.Common.Msg.Interface.IMessageService' wojilu.Web.IBlock' wojilu.Common.Msg.Domain.Message' wojilu.strUtil' wojilu.Common.Msg.Domain.MessageData' wojilu.SysPath' wojilu.sys' wojilu.Web.Controller.Users.UserUploadController' wojilu.Web.Controller.Admin.AdminSecurityUtils' wojilu.Members.Interface.IMember' wojilu.Members.Sites.Domain.Site' wojilu.UrlInfo' wojilu.Common.Msg.Interface.IMessageAttachmentService' wojilu.Common.Msg.Domain.MessageAttachment' wojilu.Common.Component' wojilu.Common.Msg.Domain.MessageApp' wojilu.Web.Mvc.Link' wojilu.Web.Controller.Users.Admin.Friends.FriendController' wojilu.Members.Users.Interface.IUserService' wojilu.Members.Users.Interface.IBlacklistService' wojilu.Result' wojilu.cvt,wojilu.Web.Controller.LinkController' wojilu.Web.Controller.Microblogs.LayoutController' wojilu.Web.Controller.Photo.Wf.UserHomeController' wojilu.Web.Controller.Users.Admin.SiteNfController' wojilu.Web.Controller.Users.Admin.NotificationController' wojilu.Web.Controller.Layouts.TopNavController' wojilu.Web.Controller.Users.HomeController' wojilu.Web.Controller.Users.ProfileController
wojilu.Web.Controller.Users.Admin,AppController,0,3,1,0,3,19,4,0,1,-1,6,4,wojilu.Common.Component' wojilu.Members.Users.Domain.UserAppAdmin' wojilu.Common.MemberApp.Interface.IMemberApp' wojilu.Members.Interface.IAdminLogService' wojilu.Web.Context.IViewerContext' wojilu.Web.Context.MvcContext,wojilu.Web.Controller.LinkController' wojilu.Web.Controller.Users.Admin.UserProfileController' wojilu.Web.Controller.Layouts.SpaceLayoutController' wojilu.Web.Controller.Layouts.TopNavController
wojilu.Web.Controller.Users.Admin,InviteController,0,7,1,0,5,69,15,0,1,-1,14,3,wojilu.Common.Component' wojilu.Members.Users.Domain.UserInviteApp' wojilu.Members.Users.Domain.User' wojilu.Web.Context.IOwnerContext' wojilu.Web.Context.MvcContext' wojilu.Members.Users.Interface.IInviteService' wojilu.Web.Mvc.Link' wojilu.Members.Sites.Domain.Site' wojilu.Web.Controller.RegisterController' wojilu.strUtil' wojilu.RegPattern' wojilu.Config.SiteSetting' wojilu.config' wojilu.UrlInfo,wojilu.Web.Controller.LinkController' wojilu.Web.Controller.Users.Admin.Friends.LayoutController' wojilu.Web.Controller.Layouts.TopNavController
wojilu.Web.Controller.Users.Admin,MenuController,0,4,1,0,4,20,5,0,1,-1,7,4,wojilu.Common.Component' wojilu.Members.Users.Domain.UserMenuAdmin' wojilu.Common.Menus.Interface.IMenu' wojilu.Members.Interface.IAdminLogService' wojilu.Web.Context.IViewerContext' wojilu.Web.Context.MvcContext' wojilu.Web.Controller.Users.Admin.MyLinkController,wojilu.Web.Controller.LinkController' wojilu.Web.Controller.Users.Admin.MyLinkController' wojilu.Web.Controller.Layouts.SpaceLayoutController' wojilu.Web.Controller.Layouts.TopNavController
wojilu.Web.Controller.Users.Admin,ShareCommentsController,0,7,2,0,5,107,13,0,1,-1,13,2,wojilu.Common.Feeds.Domain.Share' wojilu.Common.Feeds.Interface.IShareService' wojilu.Web.Mvc.ControllerCore' wojilu.Members.Interface.IUser' wojilu.Web.Context.IViewerContext' wojilu.Web.Context.MvcContext' wojilu.Web.IBlock' wojilu.Common.Feeds.Domain.ShareComment' wojilu.Members.Users.Domain.User' wojilu.strUtil' wojilu.Web.Mvc.Link' wojilu.Web.Controller.Users.Admin.ShareController' wojilu.cvt,wojilu.Web.Controller.Users.Admin.ShareController' wojilu.Web.Controller.Users.ShareController
wojilu.Web.Controller.Users.Admin,FeedController,0,26,4,0,6,247,50,0,1,-1,29,0,wojilu.Apps.Blog.Domain.BlogPost' wojilu.Apps.Photo.Domain.PhotoPost' wojilu.Apps.Forum.Domain.ForumPost' wojilu.Common.Feeds.Domain.Share' wojilu.Members.Users.Domain.FriendShip' wojilu.Web.Context.MvcContext' wojilu.Web.Controller.Users.Admin.FeedType' wojilu.Web.Controller.Common.Feeds.FeedView' wojilu.Web.IBlock' wojilu.Members.Users.Domain.Follower' wojilu.Members.Users.Domain.User' wojilu.Common.Feeds.Interface.IFeedService' wojilu.cvt' wojilu.strUtil' wojilu.JsonObject' wojilu.Json' wojilu.Members.Interface.IMember' wojilu.Web.Context.IOwnerContext' wojilu.Members.Users.Interface.IVisitorService' wojilu.Members.Users.Interface.IFriendService' wojilu.Members.Users.Interface.IFollowerService' wojilu.Common.Component' wojilu.Common.Feeds.Domain.FeedApp' wojilu.Web.Controller.Users.Admin.UserProfileController' wojilu.Web.Controller.Users.Admin.NotificationController' wojilu.Web.Controller.Microblogs.My.MicroblogController' wojilu.Web.Context.IViewerContext' wojilu.Common.Feeds.Domain.Feed' wojilu.Web.Controller.Common.Feeds.FeedUtils,
wojilu.Web.Controller.Users.Admin,UserProfileController,0,40,6,0,25,560,88,0,1,-1,46,7,wojilu.strUtil' wojilu.Members.Users.Domain.User' wojilu.Members.Users.Domain.MemberProfile' wojilu.Web.IBlock' wojilu.Common.Resource.AppResource' wojilu.Config.SiteSetting' wojilu.config' wojilu.Common.Money.Domain.KeyIncomeRule' wojilu.Web.Mvc.Html' wojilu.Members.Users.Enum.EmailConfirm' wojilu.SysPath' wojilu.sys' wojilu.Common.Money.Interface.ICurrencyService' wojilu.Web.Mvc.Link' wojilu.Members.Sites.Domain.Site' wojilu.Web.Controller.Common.ActivationController' wojilu.Common.AppInstall.AppInstaller' wojilu.Common.MemberApp.Interface.IMemberApp' wojilu.Members.Interface.IMember' wojilu.Web.Context.IOwnerContext' wojilu.Web.Context.MvcContext' wojilu.Common.AppBase.AccessStatus' wojilu.Web.Controller.MainController' wojilu.Common.Component' wojilu.Members.Users.Domain.UserPrivacy' wojilu.OAuth.UserConnect' wojilu.OAuth.AuthConnectConfig' wojilu.OAuth.IUserConnectService' wojilu.Web.Context.IViewerContext' wojilu.Web.Controller.ConnectController' wojilu.Result' wojilu.Web.Utils.AvatarUploader' wojilu.Members.Users.Domain.UserFactory' wojilu.Members.Users.Interface.IUserService' wojilu.Web.Context.MvcContextUtils' wojilu.db' wojilu.Members.Users.Interface.IUserTagService' wojilu.Members.Users.Domain.UserTag' wojilu.Members.Users.Domain.UserTagShip' wojilu.Web.Controller.Users.MainController' wojilu.RegPattern' wojilu.Web.Controller.Users.Admin.AppController' wojilu.Members.Users.Domain.UserSecurity' wojilu.Common.MemberApp.Interface.IMemberAppService' wojilu.Common.AppBase.AccessStatusUtil' wojilu.Common.AppInstall.IAppInstallerService,wojilu.Web.Controller.LinkController' wojilu.Web.Controller.Admin.Members.UserController' wojilu.Web.Controller.Users.Admin.AvatarController' wojilu.Web.Controller.Users.Admin.FeedController' wojilu.Web.Controller.Layouts.SpaceLayoutController' wojilu.Web.Controller.Layouts.TopNavController' wojilu.Web.Controller.Microblogs.My.MbSaveController
wojilu.Web.Controller.Users.Admin,SecurityController,0,1,0,0,1,6,2,0,1,-1,3,0,wojilu.Web.Context.IOwnerContext' wojilu.Web.Context.MvcContext' wojilu.Members.Users.Domain.User,
wojilu.Web.Controller.Users.Admin,LayoutController,0,1,0,0,1,5,2,0,1,-1,3,1,wojilu.Web.Context.IOwnerContext' wojilu.Web.Context.MvcContext' wojilu.Web.Context.IViewerContext,wojilu.Web.Controller.Users.Admin.AvatarController
wojilu.Web.Controller.Users.Admin,ShareController,0,11,4,0,5,124,20,0,1,-1,16,3,wojilu.Web.Context.IViewerContext' wojilu.Web.Context.MvcContext' wojilu.Common.Feeds.Interface.IShareService' wojilu.Web.Context.IOwnerContext' wojilu.Common.Feeds.Domain.Share' wojilu.Web.Mvc.ControllerCore' wojilu.Web.Controller.Users.Admin.ShareCommentsController' wojilu.Web.IBlock' wojilu.Members.Users.Domain.User' wojilu.Common.Feeds.Interface.IFeedService' wojilu.strUtil' wojilu.Members.Users.Interface.IFriendService' wojilu.Members.Interface.IMember' wojilu.Members.Users.Interface.IFollowerService' wojilu.Result' wojilu.RegPattern,wojilu.Web.Controller.Users.Admin.ShareCommentsController' wojilu.Web.Controller.Layouts.SpaceLayoutController' wojilu.Web.Controller.Layouts.TopNavController
wojilu.Web.Controller.Users.Admin,FeedType,1,5,0,0,4,30,9,0,0,0.4,5,2,wojilu.Apps.Blog.Domain.BlogPost' wojilu.Apps.Photo.Domain.PhotoPost' wojilu.Apps.Forum.Domain.ForumPost' wojilu.Common.Feeds.Domain.Share' wojilu.Members.Users.Domain.FriendShip,wojilu.Web.Controller.Admin.FeedAdminController' wojilu.Web.Controller.Users.Admin.FeedController
wojilu.Web.Controller.Users.Admin,SiteNfController,0,7,2,0,5,49,9,0,1,-1,10,2,wojilu.Web.Controller.Users.Admin.MsgController' wojilu.Members.Interface.IUser' wojilu.Web.Context.IViewerContext' wojilu.Web.Context.MvcContext' wojilu.Members.Sites.Domain.SiteRole' wojilu.Web.IWebContext' wojilu.Members.Sites.Domain.Site' wojilu.Web.IBlock' wojilu.Common.Msg.Interface.INotificationService' wojilu.Common.Msg.Domain.Notification,wojilu.Web.Controller.Users.Admin.MsgController' wojilu.Web.Controller.Layouts.TopNavController
wojilu.Web.Controller.Users.Admin,NotificationController,0,7,2,0,7,86,13,0,1,-1,11,4,wojilu.Web.Controller.Users.Admin.MsgController' wojilu.Web.IBlock' wojilu.Common.Msg.Interface.INotificationService' wojilu.Web.Context.IOwnerContext' wojilu.Web.Context.MvcContext' wojilu.Members.Interface.IMember' wojilu.Common.Msg.Domain.Notification' wojilu.Common.Msg.Enum.NotificationType' wojilu.Members.Users.Domain.User' wojilu.Web.Controller.Users.Admin.HomeController' wojilu.Members.Users.Interface.IFriendService,wojilu.Web.Controller.LinkController' wojilu.Web.Controller.Users.Admin.MsgController' wojilu.Web.Controller.Users.Admin.FeedController' wojilu.Web.Controller.Layouts.TopNavController
wojilu.Web.Controller.Users.Admin,MyLinkController,0,4,1,0,3,36,7,0,1,-1,18,3,wojilu.Common.Component' wojilu.Members.Users.Domain.UserLinks' wojilu.Web.IBlock' wojilu.Web.Controller.Users.Admin.MenuController' wojilu.Web.Controller.Users.ProfileController' wojilu.Web.Mvc.alink' wojilu.Web.Context.IOwnerContext' wojilu.Web.Context.MvcContext' wojilu.Web.Controller.Users.VisitorController' wojilu.Web.Controller.Users.FriendController' wojilu.Web.Controller.Users.FeedbackController' wojilu.Web.Controller.Users.ShareController' wojilu.Web.Controller.Users.ForumController' wojilu.Common.MemberApp.Interface.IMemberAppService' wojilu.Members.Interface.IMember' wojilu.Common.MemberApp.Interface.IMemberApp' wojilu.strUtil' wojilu.UrlInfo,wojilu.Web.Controller.Users.Admin.MenuController' wojilu.Web.Controller.Layouts.SpaceLayoutController' wojilu.Web.Controller.Layouts.TopNavController
wojilu.Web.Controller.Users.Admin,CreditController,1,7,3,0,6,97,14,0,1,0.71,16,2,wojilu.Members.Users.Domain.User' wojilu.Web.Context.IOwnerContext' wojilu.Web.Context.MvcContext' wojilu.Members.Sites.Domain.SiteRole' wojilu.Members.Sites.Domain.SiteRank' wojilu.Common.Money.Interface.IUserIncomeService' wojilu.Common.Money.Domain.UserIncome' wojilu.Common.Money.Domain.UserIncomeLog' wojilu.Web.IBlock' wojilu.Common.Money.Domain.KeyIncomeRule' wojilu.Common.Money.Interface.ICurrencyService' wojilu.Common.Money.Domain.KeyCurrency' wojilu.Common.Money.Domain.ICurrency' wojilu.Common.Money.Domain.UserAction' wojilu.Common.Money.Domain.IncomeRule' wojilu.Members.Sites.Service.ISiteRoleService,wojilu.Web.Controller.LinkController' wojilu.Web.Controller.Layouts.TopNavController
wojilu.Web.Controller.Users.Admin,SkinController,0,15,3,0,14,104,18,0,2,-1,16,3,wojilu.Web.Mvc.Link' wojilu.Web.Context.IOwnerContext' wojilu.Web.Context.MvcContext' wojilu.Common.Skins.SkinService' wojilu.Common.Component' wojilu.Members.Users.Domain.SkinApp' wojilu.Web.IBlock' wojilu.Apps.Photo.Interface.IPhotoPostService' wojilu.Web.Context.IViewerContext' wojilu.Apps.Photo.Domain.PhotoPost' wojilu.Web.HttpFile' wojilu.Result' wojilu.Web.Utils.Uploader' wojilu.Members.Interface.IMember' wojilu.Members.Interface.IUser' wojilu.strUtil,wojilu.Web.Controller.LinkController' wojilu.Web.Controller.Layouts.SpaceLayoutController' wojilu.Web.Controller.Layouts.TopNavController
