Namespace,Type,NOF,NOM,NOP,NOPF,NOPM,LOC,WMC,NC,DIT,LCOM,Fan-Out,Fan-In,Fan-Out types,Fan-In types
wojilu.Web.Controller.Content.Section,TextController,0,4,2,0,4,28,6,0,1,-1,7,4,wojilu.Apps.Content.Domain.ContentSection' wojilu.Apps.Content.Domain.ContentPost' wojilu.Apps.Content.Interface.IContentSectionService' wojilu.Web.Context.IAppContext' wojilu.Web.Context.MvcContext' wojilu.Apps.Content.Interface.IContentPostService' wojilu.Web.Controller.Content.Section.ListController,wojilu.Web.Controller.Common.Installers.SimpleInstaller' wojilu.Web.Controller.Common.Installers.PortalInstaller' wojilu.Web.Controller.Content.PostController' wojilu.Web.Controller.Content.Submit.PostController
wojilu.Web.Controller.Microblogs,MbLink,1,6,0,0,6,69,8,0,0,0,6,4,wojilu.Members.Interface.IMember' wojilu.Web.Mvc.Link' wojilu.Web.Controller.Users.HomeController' wojilu.Web.Controller.Microblogs.MicroblogController' wojilu.Web.Controller.Users.Admin.HomeController' wojilu.Web.Controller.Microblogs.My.MicroblogController,wojilu.Web.Controller.Microblogs.MainController' wojilu.Web.Controller.Microblogs.MicroblogController' wojilu.Web.Controller.Users.Admin.HomeController' wojilu.Web.Controller.Layouts.TopNavController
wojilu.Web.Controller.Microblogs,MicroblogSaveController,0,8,2,0,3,102,18,0,1,-1,10,5,wojilu.Members.Users.Domain.User' wojilu.Common.Microblogs.Domain.Microblog' wojilu.Web.Context.MvcContext' wojilu.strUtil' wojilu.Web.Context.IViewerContext' wojilu.Common.Microblogs.Interface.IMicroblogService' wojilu.Web.Controller.Microblogs.My.MicroblogController' wojilu.Common.Microblogs.Domain.MicroblogVo' wojilu.Web.Controller.Microblogs.MicroblogController' wojilu.Common.Microblogs.Domain.MicroblogVideoTemp,wojilu.Web.Controller.ShareController' wojilu.Web.Controller.Microblogs.MicroblogController' wojilu.Web.Controller.Users.Admin.HomeController' wojilu.Web.Controller.Microblogs.My.MbSaveController' wojilu.Web.Controller.Microblogs.My.MicroblogController
wojilu.Web.Controller.Microblogs,SecurityController,0,1,0,0,1,8,1,0,1,-1,0,0,,
wojilu.Web.Controller.Microblogs,MainController,0,10,1,0,4,98,18,0,1,-1,27,0,wojilu.Web.Controller.Microblogs.LayoutController' wojilu.Web.IBlock' wojilu.Web.Controller.Admin.Mb.MicroblogController' wojilu.Web.Controller.Admin.Mb.MbCommentController' wojilu.Web.Controller.Admin.Mb.TrashController' wojilu.Config.SiteSetting' wojilu.config' wojilu.Web.Mvc.alink' wojilu.Web.Controller.RegisterController' wojilu.Common.Tags.TagService' wojilu.Common.Tags.Tag' wojilu.strUtil' wojilu.UrlInfo' wojilu.Web.Context.MvcContext' wojilu.Web.Controller.MainController' wojilu.Web.Controller.Common.ResetPwdController' wojilu.Web.Mvc.MvcConfig' wojilu.Web.Context.IViewerContext' wojilu.Web.Mvc.Link' wojilu.Web.Controller.Microblogs.My.MicroblogController' wojilu.Web.Mvc.PageMeta' wojilu.Common.Microblogs.MicroblogAppSetting' wojilu.Common.Microblogs.Domain.Microblog' wojilu.Members.Users.Domain.User' wojilu.SysPath' wojilu.sys' wojilu.Web.Controller.Microblogs.MbLink,
wojilu.Web.Controller.Microblogs,FriendController,0,5,4,0,4,57,9,0,1,-1,10,1,wojilu.Web.Controller.Microblogs.MicroblogController' wojilu.Web.Context.IViewerContext' wojilu.Web.Context.MvcContext' wojilu.Web.Context.IOwnerContext' wojilu.Members.Users.Domain.UserPermission' wojilu.Members.Users.Interface.IFriendService' wojilu.Members.Users.Interface.IFollowerService' wojilu.Web.IBlock' wojilu.Members.Users.Domain.User' wojilu.Web.Mvc.alink,wojilu.Web.Controller.Microblogs.MicroblogController
wojilu.Web.Controller.Microblogs,LayoutController,0,3,1,0,2,32,6,0,1,-1,16,1,wojilu.Web.IBlock' wojilu.Web.Mvc.ControllerBase' wojilu.Web.Context.MvcContext' wojilu.Config.SiteSetting' wojilu.config' wojilu.Web.Mvc.alink' wojilu.Web.Mvc.ControllerCore' wojilu.Members.Sites.Interface.ISiteSkinService' wojilu.Web.Controller.Layouts.TopNavController' wojilu.Web.Context.IViewerContext' wojilu.Web.Mvc.Link' wojilu.Web.Controller.Microblogs.My.MicroblogController' wojilu.Web.Controller.Users.Admin.MsgController' wojilu.strUtil' wojilu.Web.Controller.LayoutController' wojilu.UrlInfo,wojilu.Web.Controller.Microblogs.MainController
wojilu.Web.Controller.Microblogs,MicroblogController,0,34,7,0,13,486,85,0,1,-1,48,9,wojilu.Members.Users.Domain.User' wojilu.Web.Context.IOwnerContext' wojilu.Web.Context.MvcContext' wojilu.Members.Users.Interface.IFollowerService' wojilu.Members.Users.Interface.IVisitorService' wojilu.Web.Controller.Microblogs.FriendController' wojilu.Web.Controller.Users.VisitorController' wojilu.Web.Mvc.PageMeta' wojilu.Members.Interface.IMember' wojilu.Config.SiteSetting' wojilu.config' wojilu.Web.Context.IViewerContext' wojilu.Members.Users.Domain.UserPermission' wojilu.Common.Microblogs.Interface.IMicroblogService' wojilu.Common.Microblogs.MicroblogAppSetting' wojilu.Common.Microblogs.Service.MicroblogFavoriteService' wojilu.Common.Microblogs.Domain.Microblog' wojilu.Web.IBlock' wojilu.Common.Microblogs.Domain.MicroblogVo' wojilu.Result' wojilu.strUtil' wojilu.Common.Comments.OpenComment' wojilu.Web.Controller.Microblogs.MbLink' wojilu.Common.Comments.IOpenCommentService' wojilu.Common.Microblogs.Domain.MicroblogLike' wojilu.Common.Microblogs.Interface.ILike' wojilu.Entity' wojilu.ndb' wojilu.db' wojilu.UrlInfo' wojilu.Web.Mvc.alink' wojilu.Web.Controller.Microblogs.My.MicroblogFavoriteController' wojilu.Web.Controller.Microblogs.My.MicroblogController' wojilu.Web.Controller.Microblogs.My.MicroblogCommentsController' wojilu.Common.Component' wojilu.Members.Users.Domain.MemberProfile' wojilu.Members.Users.Service.UserTagService' wojilu.Members.Users.Domain.UserTag' wojilu.Members.Users.Domain.UserTagShip' wojilu.Web.Mvc.Link' wojilu.Members.Sites.Domain.Site' wojilu.Web.Controller.Users.MainController' wojilu.Web.Controller.Microblogs.MicroblogSaveController' wojilu.Web.Controller.Open.CommentController' wojilu.SysPath' wojilu.sys' wojilu.Web.Utils.WebHelper' wojilu.Web.Mvc.ControllerCore,wojilu.Web.Controller.Admin.Sys.DashboardController' wojilu.Web.Controller.Microblogs.MbLink' wojilu.Web.Controller.Microblogs.MicroblogSaveController' wojilu.Web.Controller.Microblogs.FriendController' wojilu.Web.Controller.Admin.Mb.MicroblogController' wojilu.Web.Controller.Users.Admin.HomeController' wojilu.Web.Controller.Microblogs.My.MicroblogController' wojilu.Web.Controller.Microblogs.My.MicroblogFavoriteController' wojilu.Web.Controller.Users.HomeController
wojilu.Web.Controller.Open.Admin,CommentBaseController<T>,0,14,1,0,4,133,28,0,1,-1,14,0,wojilu.Web.Context.MvcContext' wojilu.Common.Comments.IOpenCommentService' wojilu.Common.Comments.OpenComment' wojilu.IEntity' wojilu.Common.AppBase.Interface.IAppData' wojilu.Web.IBlock' wojilu.strUtil' wojilu.Entity' wojilu.ndb' wojilu.Web.Mvc.alink' wojilu.Data.IDatabaseDialect' wojilu.ORM.EntityInfo' wojilu.Common.Comments.NullCommentTarget' wojilu.Web.Context.IAppContext,
wojilu.Web.Controller.Admin.Apps.Photo,PostAdminController,0,8,5,0,4,77,11,0,1,-1,12,2,wojilu.Apps.Photo.Interface.IPickedService' wojilu.Apps.Photo.Interface.ISysPhotoService' wojilu.Web.Controller.Admin.Apps.Photo.MainController' wojilu.Apps.Photo.Domain.PhotoPost' wojilu.Web.IBlock' wojilu.Web.Mvc.alink' wojilu.Web.Context.MvcContext' wojilu.strUtil' wojilu.cvt' wojilu.Web.Controller.Security.SiteLogString' wojilu.Members.Interface.IAdminLogService' wojilu.Web.Context.IViewerContext,wojilu.Web.Controller.Admin.Apps.Photo.LayoutController' wojilu.Web.Controller.Photo.Wf.LayoutController
wojilu.Web.Controller.Admin.Apps.Photo,SettingController,0,2,0,0,2,10,2,0,1,-1,2,1,wojilu.Apps.Photo.PhotoAppSetting' wojilu.Web.Context.MvcContext,wojilu.Web.Controller.Photo.Wf.LayoutController
wojilu.Web.Controller.Admin.Apps.Photo,CommentController,0,0,0,0,0,4,0,0,0,-1,0,2,,wojilu.Web.Controller.Admin.Apps.Photo.LayoutController' wojilu.Web.Controller.Photo.Wf.LayoutController
wojilu.Web.Controller.Admin.Apps.Photo,MainController,2,11,5,1,4,107,15,0,1,0.45,14,4,wojilu.Apps.Photo.Domain.PhotoPost' wojilu.Web.IBlock' wojilu.Web.Mvc.alink' wojilu.Apps.Photo.Interface.IPickedService' wojilu.Apps.Photo.Interface.IPhotoSysCategoryService' wojilu.Apps.Photo.Domain.PhotoSysCategory' wojilu.Members.Interface.IAdminLogService' wojilu.Web.Context.IViewerContext' wojilu.Web.Context.MvcContext' wojilu.Apps.Photo.Interface.ISysPhotoService' wojilu.strUtil' wojilu.cvt' wojilu.Web.Controller.Security.SiteLogString' wojilu.Common.AppBase.SaveStatus,wojilu.Web.Controller.Admin.Apps.Photo.PostAdminController' wojilu.Web.Controller.Admin.Apps.Photo.LayoutController' wojilu.Web.Controller.Photo.Wf.LayoutController' wojilu.Web.Controller.Photo.Caching.PhotoMainActionCache
wojilu.Web.Controller.Admin.Apps.Photo,LayoutController,0,2,2,0,2,19,2,0,1,-1,5,0,wojilu.Web.Controller.Admin.Apps.Photo.MainController' wojilu.Web.Controller.Admin.Apps.Photo.PostAdminController' wojilu.Web.Controller.Admin.Apps.Photo.CommentController' wojilu.Apps.Photo.Interface.ISysPhotoService' wojilu.Web.Controller.Admin.Apps.Photo.SysCategoryController,
wojilu.Web.Controller.Admin.Apps.Photo,SysCategoryController,0,11,2,0,8,98,19,0,1,-1,10,3,wojilu.Apps.Photo.Domain.PhotoSysCategory' wojilu.Members.Interface.IAdminLogService' wojilu.Web.Context.IViewerContext' wojilu.Web.Context.MvcContext' wojilu.Apps.Photo.Interface.IPhotoSysCategoryService' wojilu.Web.IBlock' wojilu.db' wojilu.Web.Controller.Security.SiteLogString' wojilu.strUtil' wojilu.Result,wojilu.Web.Controller.Admin.Apps.Photo.LayoutController' wojilu.Web.Controller.Photo.Wf.LayoutController' wojilu.Web.Controller.Photo.Caching.PhotoMainActionCache
wojilu.Web.Controller.Admin.Apps.Poll,MainController,0,1,0,0,1,6,1,0,1,-1,0,0,,
wojilu.Web.Controller.Admin.Apps.Reader,LayoutController,0,2,0,0,2,11,2,0,1,-1,2,0,wojilu.Web.Controller.Admin.Apps.Reader.MainController' wojilu.Web.Controller.Admin.Apps.Reader.SysCategoryController,
wojilu.Web.Controller.Admin.Apps.Reader,MainController,0,9,3,0,8,118,18,0,1,-1,9,1,wojilu.Web.IBlock' wojilu.Apps.Reader.Interface.IFeedSourceService' wojilu.Apps.Reader.Domain.FeedSource' wojilu.Apps.Reader.Domain.FeedSysCategory' wojilu.Web.Context.MvcContext' wojilu.Apps.Reader.Interface.IFeedSysCategoryService' wojilu.Web.Controller.Admin.Apps.Reader.SysCategoryController' wojilu.strUtil' wojilu.Result,wojilu.Web.Controller.Admin.Apps.Reader.LayoutController
wojilu.Web.Controller.Admin.Apps.Reader,SysCategoryController,0,0,0,0,0,99,0,0,0,-1,0,2,,wojilu.Web.Controller.Admin.Apps.Reader.LayoutController' wojilu.Web.Controller.Admin.Apps.Reader.MainController
wojilu.Web.Controller.Admin.Groups,SettingController,0,2,0,0,2,10,2,0,1,-1,2,1,wojilu.Members.Groups.GroupSetting' wojilu.Web.Context.MvcContext,wojilu.Web.Controller.Groups.MainController
wojilu.Web.Controller.Admin.Groups,CategoryController,0,0,0,0,0,2,0,0,0,-1,0,3,,wojilu.Web.Controller.Admin.Groups.LayoutController' wojilu.Web.Controller.Groups.Caching.GroupMainLayoutCache' wojilu.Web.Controller.Groups.MainController
wojilu.Web.Controller.Admin.Groups,GroupController,1,24,8,0,11,316,49,0,1,0.21,27,4,wojilu.Web.IBlock' wojilu.Apps.Forum.Interface.IGroupPostService' wojilu.Members.Groups.Interface.IGroupService' wojilu.Members.Groups.Domain.GroupCategory' wojilu.db' wojilu.Members.Groups.Domain.Group' wojilu.Web.Context.MvcContext' wojilu.strUtil' wojilu.Result' wojilu.Web.Controller.Security.SiteLogString' wojilu.Members.Groups.Interface.IMemberGroupService' wojilu.Common.Msg.Interface.IMessageService' wojilu.ORM.EntityInfo' wojilu.Entity' wojilu.Data.IDatabaseDialect' wojilu.Apps.Forum.Domain.ForumPost' wojilu.Members.Groups.Domain.GroupAccessStatus' wojilu.Apps.Forum.Domain.ForumTopic' wojilu.Apps.Forum.Interface.IForumTopicService' wojilu.Web.Mvc.alink' wojilu.cvt' wojilu.Members.Users.Domain.User' wojilu.Web.Mvc.Link' wojilu.Apps.Forum.Interface.IPost' wojilu.Members.Users.Interface.IUserService' wojilu.Members.Interface.IAdminLogService' wojilu.Web.Context.IViewerContext,wojilu.Web.Controller.Admin.Groups.LayoutController' wojilu.Web.Controller.Groups.Caching.GroupMainActionCache' wojilu.Web.Controller.Groups.MainController' wojilu.Web.Controller.Security.OperationDB
wojilu.Web.Controller.Admin.Groups,LayoutController,0,1,0,0,1,9,1,0,1,-1,2,0,wojilu.Web.Controller.Admin.Groups.GroupController' wojilu.Web.Controller.Admin.Groups.CategoryController,
wojilu.Web.Controller.Admin.Mb,MbCommentController,0,8,1,0,4,75,13,0,1,-1,7,1,wojilu.Common.Microblogs.Service.ISysMicroblogCommentService' wojilu.Web.Context.MvcContext' wojilu.Common.Microblogs.Domain.MicroblogComment' wojilu.Web.Mvc.alink' wojilu.ExtData' wojilu.db' wojilu.strUtil,wojilu.Web.Controller.Microblogs.MainController
wojilu.Web.Controller.Admin.Mb,TrashController,0,3,1,0,3,34,4,0,1,-1,7,1,wojilu.Common.Microblogs.Service.ISysMicroblogService' wojilu.Common.Microblogs.Domain.Microblog' wojilu.Web.Mvc.alink' wojilu.ExtData' wojilu.SysPath' wojilu.sys' wojilu.Web.Context.MvcContext,wojilu.Web.Controller.Microblogs.MainController
wojilu.Web.Controller.Admin.Mb,MicroblogController,0,16,3,0,11,158,23,0,1,-1,15,3,wojilu.Common.Microblogs.MicroblogAppSetting' wojilu.Web.Context.MvcContext' wojilu.Common.Microblogs.Service.ISysMicroblogService' wojilu.Common.Microblogs.Service.IMicroblogFavoriteService' wojilu.Web.Controller.Microblogs.MicroblogController' wojilu.strUtil' wojilu.db' wojilu.Common.Microblogs.Domain.Microblog' wojilu.Web.Mvc.alink' wojilu.ExtData' wojilu.SysPath' wojilu.sys' wojilu.ORM.EntityInfo' wojilu.Entity' wojilu.Data.IDatabaseDialect,wojilu.Web.Controller.Microblogs.MainController' wojilu.Web.Controller.Security.OperationDB' wojilu.Web.Controller.Users.MainController
wojilu.Web.Controller.Admin.Members,EmailConfirmController,1,3,3,0,3,41,9,0,1,1,13,3,wojilu.ILog' wojilu.Web.Controller.Admin.Sys.ViewsFileController' wojilu.Web.Controller.Common.IConfirmEmail' wojilu.Web.Mvc.MvcConfig' wojilu.Net.MailClient' wojilu.Members.Users.Domain.User' wojilu.Config.SiteSetting' wojilu.config' wojilu.Web.Context.MvcContext' wojilu.strUtil' wojilu.cvt' wojilu.Members.Users.Interface.IUserService' wojilu.RegPattern,wojilu.Web.Controller.Admin.Members.UserController' wojilu.Web.Controller.Admin.Members.LayoutController' wojilu.Web.Controller.Users.MainController
wojilu.Web.Controller.Admin.Members,UserRegController,1,7,0,0,2,94,21,0,1,0,11,2,wojilu.ILog' wojilu.Web.Mvc.MvcConfig' wojilu.Web.SystemInfo' wojilu.strUtil' wojilu.UrlInfo' wojilu.Web.Context.MvcContext' wojilu.Result' wojilu.Web.Controller.Admin.Members.UserVo' wojilu.Config.SiteSetting' wojilu.config' wojilu.Open.OpenService,wojilu.Web.Controller.Admin.Members.LayoutController' wojilu.Web.Controller.Users.MainController
wojilu.Web.Controller.Admin.Members,UserSettingController,0,4,1,0,3,112,14,0,1,-1,12,3,wojilu.Config.SiteSetting' wojilu.config' wojilu.Web.Controller.Admin.Sys.ViewsFileController' wojilu.Web.Mvc.MvcConfig' wojilu.Config.RegisterType' wojilu.Config.TopNavDisplay' wojilu.Web.Context.MvcContext' wojilu.Result' wojilu.strUtil' wojilu.Web.Controller.Security.SiteLogString' wojilu.Members.Interface.IAdminLogService' wojilu.Web.Context.IViewerContext,wojilu.Web.Controller.Admin.SiteConfigController' wojilu.Web.Controller.Admin.Members.LayoutController' wojilu.Web.Controller.Users.MainController
wojilu.Web.Controller.Admin.Members,SiteMsgController,0,9,2,0,7,71,13,0,1,-1,8,2,wojilu.Common.Msg.Interface.ISiteMessageService' wojilu.Web.IBlock' wojilu.Members.Sites.Service.ISiteRoleService' wojilu.Members.Sites.Domain.SiteRole' wojilu.Common.Msg.Domain.MessageSite' wojilu.Result' wojilu.Web.Context.MvcContext' wojilu.Web.Context.IViewerContext,wojilu.Web.Controller.Admin.Members.LayoutController' wojilu.Web.Controller.Users.MainController
wojilu.Web.Controller.Admin.Members,UserController,1,40,6,0,20,576,95,0,1,0.15,37,5,wojilu.ILog' wojilu.Web.IBlock' wojilu.Members.Users.Domain.User' wojilu.Members.Sites.Domain.SiteRole' wojilu.strUtil' wojilu.OAuth.UserConnect' wojilu.SysPath' wojilu.sys' wojilu.OAuth.AuthConnectConfig' wojilu.Members.Users.Enum.EmailConfirm' wojilu.Common.AppBase.MemberStatus' wojilu.ORM.EntityInfo' wojilu.Web.Context.MvcContext' wojilu.Entity' wojilu.Data.IDatabaseDialect' wojilu.cvt' wojilu.RegPattern' wojilu.Web.Controller.Admin.Members.MsgInfo' wojilu.Members.Users.Interface.IUserService' wojilu.Result' wojilu.Members.Interface.IAdminLogService' wojilu.Web.Context.IViewerContext' wojilu.Common.Resource.AppResource' wojilu.Members.Users.Domain.MemberProfile' wojilu.Config.SiteSetting' wojilu.config' wojilu.Members.Sites.Service.ISiteRoleService' wojilu.db' wojilu.Web.Controller.Security.SiteLogString' wojilu.Web.Controller.Users.Admin.UserProfileController' wojilu.Members.Users.Domain.UserApp' wojilu.Members.Users.Domain.UserMenu' wojilu.Net.MailClient' wojilu.Common.Msg.Interface.IMessageService' wojilu.Web.Controller.Admin.Members.EmailConfirmController' wojilu.Web.Controller.Common.IConfirmEmail' wojilu.Members.Users.Interface.IUserErrorPicService,wojilu.Web.Controller.Admin.Members.LayoutController' wojilu.Web.Controller.Security.OperationDB' wojilu.Web.Controller.Users.Caching.UserMainIndexCache' wojilu.Web.Controller.Users.Caching.UserMainLayoutCache' wojilu.Web.Controller.Users.MainController
wojilu.Web.Controller.Admin.Members,MsgInfo,0,0,3,0,0,5,0,0,0,-1,0,1,,wojilu.Web.Controller.Admin.Members.UserController
wojilu.Web.Controller.Admin.Members,LayoutController,0,1,0,0,1,10,1,0,1,-1,6,0,wojilu.Web.Controller.Admin.Members.EmailConfirmController' wojilu.Web.Controller.Admin.Members.UserController' wojilu.Web.Controller.Admin.Members.SiteMsgController' wojilu.Web.Controller.Admin.Members.ImportController' wojilu.Web.Controller.Admin.Members.UserRegController' wojilu.Web.Controller.Admin.Members.UserSettingController,
wojilu.Web.Controller.Admin.Members,ImportUser,0,0,2,0,0,4,0,0,0,-1,0,1,,wojilu.Web.Controller.Admin.Members.ImportController
wojilu.Web.Controller.Admin.Members,ImportController,2,7,0,0,2,97,23,0,1,0.29,12,2,wojilu.ILog' wojilu.Web.Context.MvcContext' wojilu.strUtil' wojilu.Result' wojilu.Web.Controller.Admin.Members.ImportUser' wojilu.Open.OpenService' wojilu.Members.Users.Domain.User' wojilu.Web.Utils.AvatarUploader' wojilu.PathHelper' wojilu.file' wojilu.Config.SiteSetting' wojilu.config,wojilu.Web.Controller.Admin.Members.LayoutController' wojilu.Web.Controller.Users.MainController
wojilu.Web.Controller.Admin.Members,UserVo,0,0,4,0,0,6,0,0,0,-1,0,1,,wojilu.Web.Controller.Admin.Members.UserRegController
wojilu.Web.Controller.Admin.Credits,LayoutController,0,1,0,0,1,8,1,0,1,-1,2,0,wojilu.Web.Controller.Admin.Credits.CurrencyController' wojilu.Web.Controller.Admin.Credits.CreditController,
wojilu.Web.Controller.Admin.Credits,CreditController,0,12,2,0,10,107,16,0,1,-1,11,3,wojilu.Common.Money.Domain.KeyIncomeRule' wojilu.Common.Money.Domain.KeyCurrency' wojilu.Common.Money.Domain.ICurrency' wojilu.Common.Money.Domain.UserAction' wojilu.Common.Money.Interface.ICurrencyService' wojilu.Common.Money.Domain.IncomeRule' wojilu.Members.Interface.IAdminLogService' wojilu.Web.Context.IViewerContext' wojilu.Web.Context.MvcContext' wojilu.Web.Controller.Security.SiteLogString' wojilu.Common.Money.Domain.Currency,wojilu.Web.Controller.Admin.Credits.LayoutController' wojilu.Web.Controller.Security.OperationDB' wojilu.Web.Controller.Common.Caching.SiteLayoutCache
wojilu.Web.Controller.Admin.Credits,CurrencyController,0,14,2,0,10,149,23,0,1,-1,12,3,wojilu.Web.IBlock' wojilu.Common.Money.Domain.KeyCurrency' wojilu.Common.Money.Domain.Currency' wojilu.Web.Context.MvcContext' wojilu.strUtil' wojilu.Result' wojilu.cvt' wojilu.Members.Interface.IAdminLogService' wojilu.Web.Context.IViewerContext' wojilu.Common.Money.Interface.ICurrencyService' wojilu.Web.Controller.Security.SiteLogString' wojilu.Common.Money.Domain.IncomeRule,wojilu.Web.Controller.Admin.Credits.LayoutController' wojilu.Web.Controller.Security.OperationDB' wojilu.Web.Controller.Common.Caching.SiteLayoutCache
wojilu.Web.Controller.Admin.Security,PermissionBackController,0,15,4,0,8,157,32,0,1,-1,22,2,wojilu.Members.Interface.IAdminLogService' wojilu.Web.Context.IViewerContext' wojilu.Web.Context.MvcContext' wojilu.Web.IBlock' wojilu.Common.Security.Utils.SecurityTool' wojilu.Common.Security.IRole' wojilu.Web.Controller.Security.SiteAdminOperationConfig' wojilu.Members.Sites.Service.SiteRoleService' wojilu.Common.MemberApp.Interface.IMemberApp' wojilu.Members.Sites.Domain.SiteRole' wojilu.Web.Controller.Security.AppAdminRole' wojilu.Common.AppInstall.AppInstaller' wojilu.Web.Controller.Security.UserDataRole' wojilu.Common.MemberApp.Interface.IMemberAppService' wojilu.Web.IWebContext' wojilu.Web.Controller.Security.SiteLogString' wojilu.Web.Controller.Security.SiteAdminOperation' wojilu.Members.Sites.Service.ISiteRoleService' wojilu.Members.Sites.Domain.Site' wojilu.strUtil' wojilu.cvt' wojilu.Common.AppInstall.IAppInstallerService,wojilu.Web.Controller.Admin.Security.LayoutController' wojilu.Web.Controller.Security.OperationDB
wojilu.Web.Controller.Admin.Security,PermissionFrontController,0,6,3,0,3,74,14,0,1,-1,13,2,wojilu.Web.IBlock' wojilu.Common.MemberApp.Interface.IMemberApp' wojilu.Common.Security.IRole' wojilu.Web.Controller.Security.AppRole' wojilu.Members.Interface.IAdminLogService' wojilu.Web.Context.IViewerContext' wojilu.Web.Context.MvcContext' wojilu.Common.MemberApp.Interface.IMemberAppService' wojilu.Members.Sites.Service.ISiteRoleService' wojilu.Members.Sites.Domain.Site' wojilu.strUtil' wojilu.cvt' wojilu.Web.Controller.Security.SiteLogString,wojilu.Web.Controller.Admin.Security.LayoutController' wojilu.Web.Controller.Security.OperationDB
wojilu.Web.Controller.Admin.Security,SecurityController,0,30,2,0,20,345,49,0,1,-1,17,2,wojilu.Common.Money.Domain.KeyCurrency' wojilu.Web.IBlock' wojilu.Members.Sites.Domain.SiteRole' wojilu.Members.Sites.Domain.SiteRank' wojilu.strUtil' wojilu.SysPath' wojilu.sys' wojilu.PathHelper' wojilu.Web.Mvc.Html' wojilu.Members.Sites.Domain.SiteRankOther' wojilu.Members.Interface.IAdminLogService' wojilu.Web.Context.IViewerContext' wojilu.Web.Context.MvcContext' wojilu.Members.Sites.Service.ISiteRoleService' wojilu.Web.Controller.Security.SiteLogString' wojilu.Result' wojilu.Common.Security.RoleGroup,wojilu.Web.Controller.Admin.Security.LayoutController' wojilu.Web.Controller.Security.OperationDB
wojilu.Web.Controller.Admin.Security,LayoutController,0,1,0,0,1,9,1,0,1,-1,3,0,wojilu.Web.Controller.Admin.Security.SecurityController' wojilu.Web.Controller.Admin.Security.PermissionFrontController' wojilu.Web.Controller.Admin.Security.PermissionBackController,
wojilu.Web.Controller.Blog.Admin,BlogController,0,6,2,0,4,44,8,0,1,-1,10,2,wojilu.Members.Users.Interface.IFriendService' wojilu.Web.Context.IViewerContext' wojilu.Web.Context.MvcContext' wojilu.Web.Controller.Blog.Admin.MyListController' wojilu.Apps.Blog.Interface.IBlogPostService' wojilu.Web.IBlock' wojilu.Members.Users.Domain.User' wojilu.Apps.Blog.Domain.BlogPost' wojilu.Web.Mvc.alink' wojilu.strUtil,wojilu.Web.Controller.Blog.Admin.LayoutController' wojilu.Web.Controller.Blog.LayoutController
wojilu.Web.Controller.Blog.Admin,DraftController,0,13,4,0,6,174,26,0,1,-1,22,7,wojilu.Apps.Blog.Interface.IBlogPostService' wojilu.Web.Context.IAppContext' wojilu.Web.Context.MvcContext' wojilu.Apps.Blog.Domain.BlogPost' wojilu.Web.Context.IOwnerContext' wojilu.Apps.Blog.Domain.BlogCategory' wojilu.Result' wojilu.cvt' wojilu.strUtil' wojilu.Common.AppBase.SaveStatus' wojilu.Common.Tags.TagService' wojilu.Web.Controller.Blog.Admin.MyListController' wojilu.Web.IBlock' wojilu.Web.Mvc.alink' wojilu.Apps.Blog.Interface.IBlogCategoryService' wojilu.Common.Tags.TagTool' wojilu.Common.AppBase.AccessStatusUtil' wojilu.Web.Mvc.Html' wojilu.IEntity' wojilu.Members.Interface.IMember' wojilu.Web.Context.IViewerContext' wojilu.Members.Interface.IUser,wojilu.Web.Controller.Blog.Admin.LayoutController' wojilu.Web.Controller.Blog.Admin.PostController' wojilu.Web.Controller.Blog.Caching.BlogIndexCache' wojilu.Web.Controller.Blog.Caching.BlogLayoutCache' wojilu.Web.Controller.Blog.Caching.BlogMainCache' wojilu.Web.Controller.Blog.Caching.BlogMainLayoutCache' wojilu.Web.Controller.Blog.LayoutController
wojilu.Web.Controller.Blog.Admin,MyListController,0,14,4,0,6,146,24,0,1,-1,17,10,wojilu.Apps.Blog.Interface.IBlogCategoryService' wojilu.Web.Context.IAppContext' wojilu.Web.Context.MvcContext' wojilu.Web.Controller.Blog.Admin.PostController' wojilu.Web.Mvc.Link' wojilu.Web.Context.IOwnerContext' wojilu.Apps.Blog.Interface.IBlogPostService' wojilu.Apps.Blog.Domain.BlogApp' wojilu.Apps.Blog.Domain.BlogCategory' wojilu.Members.Interface.IMember' wojilu.Web.IBlock' wojilu.Apps.Blog.Domain.BlogPost' wojilu.Web.Mvc.alink' wojilu.strUtil' wojilu.SysPath' wojilu.sys' wojilu.Web.Mvc.Html,wojilu.Web.Controller.Blog.Admin.BlogController' wojilu.Web.Controller.Blog.Admin.DraftController' wojilu.Web.Controller.Blog.Admin.TrashController' wojilu.Web.Controller.Blog.Admin.LayoutController' wojilu.Web.Controller.Blog.Admin.PostController' wojilu.Web.Controller.Blog.Caching.BlogIndexCache' wojilu.Web.Controller.Blog.Caching.BlogLayoutCache' wojilu.Web.Controller.Blog.Caching.BlogMainCache' wojilu.Web.Controller.Blog.Caching.BlogMainLayoutCache' wojilu.Web.Controller.Blog.LayoutController
wojilu.Web.Controller.Blog.Admin,SettingController,0,4,0,0,3,44,5,0,1,-1,7,4,wojilu.Apps.Blog.Domain.BlogApp' wojilu.Web.Context.IAppContext' wojilu.Web.Context.MvcContext' wojilu.Apps.Blog.Domain.BlogSetting' wojilu.Json' wojilu.Apps.Blog.Domain.BlogListMode' wojilu.Web.Mvc.Html,wojilu.Web.Controller.Blog.Admin.LayoutController' wojilu.Web.Controller.Blog.Caching.BlogIndexCache' wojilu.Web.Controller.Blog.Caching.BlogLayoutCache' wojilu.Web.Controller.Blog.LayoutController
