Namespace,Type,NOF,NOM,NOP,NOPF,NOPM,LOC,WMC,NC,DIT,LCOM,Fan-Out,Fan-In,Fan-Out types,Fan-In types
wojilu.Web.Controller.Admin,AdController,0,10,0,0,9,137,24,0,1,-1,8,4,wojilu.Web.IBlock' wojilu.cdb' wojilu.Common.AdCategory' wojilu.Common.AdItem' wojilu.Web.Context.MvcContext' wojilu.Web.Context.IViewerContext' wojilu.strUtil' wojilu.Result,wojilu.Web.Controller.Content.Caching.ContentLayoutCache' wojilu.Web.Controller.Forum.Caching.ForumIndexCache' wojilu.Web.Controller.Security.OperationDB' wojilu.Web.Controller.Common.Caching.SiteLayoutCache
wojilu.Web.Controller.Admin,AppConfigController,0,8,2,0,7,117,16,0,1,-1,15,2,wojilu.Web.IBlock' wojilu.Config.SiteSetting' wojilu.config' wojilu.cdb' wojilu.Common.Component' wojilu.Web.Context.MvcContext' wojilu.Common.AppInstall.AppInstaller' wojilu.Common.Themes.IThemeService' wojilu.Web.Controller.Admin.AppThemeController' wojilu.Common.AppInstall.AppCategory' wojilu.Common.AppInstall.AppCloseMode' wojilu.strUtil' wojilu.Result' wojilu.Common.AppInstall.IAppInstallerService' wojilu.Common.ComponentStatus,wojilu.Web.Controller.Security.OperationDB' wojilu.Web.Controller.Layouts.SiteLayoutController
wojilu.Web.Controller.Admin,AppController,0,2,1,0,2,13,2,0,1,-1,4,3,wojilu.Common.MemberApp.Interface.IMemberApp' wojilu.Members.Interface.IAdminLogService' wojilu.Web.Context.IViewerContext' wojilu.Web.Context.MvcContext,wojilu.Web.Controller.SiteInitController' wojilu.Web.Controller.Security.OperationDB' wojilu.Web.Controller.Layouts.SiteLayoutController
wojilu.Web.Controller.Admin,AppThemeController,0,4,1,0,4,29,5,0,1,-1,7,1,wojilu.Common.AppInstall.AppInstaller' wojilu.cdb' wojilu.Common.Themes.IThemeService' wojilu.Common.Themes.ITheme' wojilu.Web.IBlock' wojilu.Web.Mvc.Routes.Route' wojilu.Web.Context.MvcContext,wojilu.Web.Controller.Admin.AppConfigController
wojilu.Web.Controller.Admin,CommentController,0,0,0,0,0,3,0,0,0,-1,0,1,,wojilu.Web.Controller.Security.OperationDB
wojilu.Web.Controller.Admin,CacheController,1,10,0,0,10,98,23,0,1,0.5,10,2,wojilu.Caching.IApplicationCache' wojilu.Web.Context.IViewerContext' wojilu.Web.Context.MvcContext' wojilu.Web.IBlock' wojilu.Web.IWebContext' wojilu.strUtil' wojilu.Result' wojilu.Json' wojilu.CacheClear' wojilu.sys,wojilu.Web.Controller.Security.OperationDB' wojilu.Web.Controller.Layouts.SiteLayoutController
wojilu.Web.Controller.Admin,FeedAdminController,0,14,3,0,5,126,29,0,1,-1,16,2,wojilu.Members.Users.Domain.User' wojilu.Web.Controller.Users.Admin.FeedType' wojilu.Web.Context.MvcContext' wojilu.Members.Users.Interface.IUserService' wojilu.Common.Feeds.Interface.IFeedService' wojilu.strUtil' wojilu.cvt' wojilu.Common.Feeds.Domain.Feed' wojilu.Web.Controller.Common.Feeds.FeedUtils' wojilu.Apps.Blog.Domain.BlogPost' wojilu.Apps.Photo.Domain.PhotoPost' wojilu.Apps.Forum.Domain.ForumPost' wojilu.Common.Feeds.Domain.Share' wojilu.Members.Users.Domain.FriendShip' wojilu.Web.IBlock' wojilu.Web.Controller.Common.Feeds.FeedView,wojilu.Web.Controller.Admin.Sys.DashboardController' wojilu.Web.Controller.Users.MainController
wojilu.Web.Controller.Admin,JobController,0,7,0,0,6,77,13,0,1,-1,6,1,wojilu.Web.Mvc.ControllerBase' wojilu.Web.Controller.Admin.SiteConfigController' wojilu.Web.IBlock' wojilu.cdb' wojilu.Web.Jobs.WebJob' wojilu.Web.Context.MvcContext,wojilu.Web.Controller.Admin.SiteConfigController
wojilu.Web.Controller.Admin,MenuController,0,9,1,0,4,51,16,0,1,-1,8,3,wojilu.Common.Menus.Interface.IMenu' wojilu.Members.Interface.IAdminLogService' wojilu.Web.Context.IViewerContext' wojilu.Web.Context.MvcContext' wojilu.Web.Controller.Admin.Sys.DashboardController' wojilu.Web.Controller.Common.Admin.MenuBaseController' wojilu.file' wojilu.PathHelper,wojilu.Web.Controller.Admin.Sys.DashboardController' wojilu.Web.Controller.Security.OperationDB' wojilu.Web.Controller.Layouts.SiteLayoutController
wojilu.Web.Controller.Admin,SecurityController,0,1,0,0,1,6,2,0,1,-1,3,1,wojilu.Web.Context.IOwnerContext' wojilu.Web.Context.MvcContext' wojilu.Members.Sites.Domain.Site,wojilu.Web.Controller.Admin.MainController
wojilu.Web.Controller.Admin,MainController,0,5,2,0,5,59,10,0,1,-1,19,3,wojilu.Web.Controller.SecurityController' wojilu.Web.Controller.Admin.SecurityController' wojilu.Web.IWebContext' wojilu.Web.Context.MvcContext' wojilu.Web.Controller.LayoutController' wojilu.Web.Mvc.CtxLink' wojilu.Web.Controller.Admin.Sys.DashboardController' wojilu.Web.Controller.Security.SiteAdminService' wojilu.Web.Context.IViewerContext' wojilu.Members.Sites.Domain.SiteRole' wojilu.Members.Interface.IUser' wojilu.Members.Users.Interface.IUserService' wojilu.Result' wojilu.Members.Interface.IAdminLogService' wojilu.Web.Controller.Security.SiteLogString' wojilu.Members.Sites.Domain.SiteLogCategory' wojilu.Web.Controller.Admin.AdminSecurityUtils' wojilu.strUtil' wojilu.UrlInfo,wojilu.Web.Controller.SecurityController' wojilu.Web.Controller.Layouts.SiteLayoutController' wojilu.Web.Controller.Layouts.TopNavController
wojilu.Web.Controller.Admin,ShareController,0,6,2,0,3,52,9,0,1,-1,7,0,wojilu.Common.Feeds.Interface.IShareService' wojilu.Web.IBlock' wojilu.Common.Feeds.Domain.Share' wojilu.Members.Users.Domain.User' wojilu.Common.Feeds.Interface.IFeedService' wojilu.strUtil' wojilu.Result,
wojilu.Web.Controller.Admin,SiteConfigController,0,19,2,0,18,256,30,0,1,-1,20,5,wojilu.Web.Controller.Admin.Members.UserSettingController' wojilu.Web.Controller.Admin.JobController' wojilu.Web.Controller.Admin.Sys.SystemFileController' wojilu.Web.Controller.Admin.Sys.ConfigFileController' wojilu.Web.Controller.Admin.Sys.CacheFileController' wojilu.Web.Controller.Admin.Sys.SiteController' wojilu.Members.Interface.IAdminLogService' wojilu.Web.Context.IViewerContext' wojilu.Web.Context.MvcContext' wojilu.Config.SiteSetting' wojilu.config' wojilu.Web.Handler.ValidationType' wojilu.Web.Mvc.Html' wojilu.strUtil' wojilu.Result' wojilu.Web.Utils.Uploader' wojilu.Drawing.Img' wojilu.Web.Controller.Security.SiteLogString' wojilu.SysPath' wojilu.sys,wojilu.Web.Controller.Admin.JobController' wojilu.Web.Controller.Admin.Sys.SiteController' wojilu.Web.Controller.Admin.Sys.SystemFileController' wojilu.Web.Controller.Security.OperationDB' wojilu.Web.Controller.Common.Caching.SiteLayoutCache
wojilu.Web.Controller.Admin,SiteSkinController,0,22,2,0,18,165,30,0,1,-1,21,5,wojilu.Common.Skins.ResourceType' wojilu.Web.Controller.Admin.Sys.ViewsFileController' wojilu.Web.Controller.Admin.Sys.CssFileController' wojilu.Web.Controller.Admin.Sys.SkinFileController' wojilu.Common.Skins.Resource' wojilu.Web.IBlock' wojilu.Web.HttpFile' wojilu.Result' wojilu.Web.Context.MvcContext' wojilu.Web.Utils.Uploader' wojilu.strUtil' wojilu.Members.Sites.Interface.ISiteSkinService' wojilu.Web.Context.IOwnerContext' wojilu.Web.Mvc.Link' wojilu.Members.Sites.Domain.Site' wojilu.Members.Sites.Domain.SiteSkin' wojilu.Config.SiteSetting' wojilu.config' wojilu.Members.Interface.IAdminLogService' wojilu.Web.Context.IViewerContext' wojilu.Web.Controller.Security.SiteLogString,wojilu.Web.Controller.Admin.Sys.ViewsFileController' wojilu.Web.Controller.Admin.Sys.CssFileController' wojilu.Web.Controller.Admin.Sys.SkinFileController' wojilu.Web.Controller.Security.OperationDB' wojilu.Web.Controller.Layouts.SiteLayoutController
wojilu.Web.Controller.Admin,TagAdminController,0,14,0,0,8,109,24,0,1,-1,14,2,wojilu.Web.Context.MvcContext' wojilu.Common.Tags.Tag' wojilu.Common.Tags.DataTagShip' wojilu.Common.Tags.TagService' wojilu.Web.IBlock' wojilu.Web.Mvc.alink' wojilu.ORM.EntityInfo' wojilu.Common.AppBase.Interface.IAppData' wojilu.Entity' wojilu.ndb' wojilu.Apps.Blog.Domain.BlogPost' wojilu.Apps.Photo.Domain.PhotoPost' wojilu.Apps.Forum.Domain.ForumTopic' wojilu.Apps.Content.Domain.ContentPost,wojilu.Web.Controller.TagController' wojilu.Web.Controller.Security.OperationDB
wojilu.Web.Controller.Admin,AdminSecurityUtils,1,5,0,1,5,34,5,0,0,0,5,12,wojilu.Web.IWebContext' wojilu.Web.Context.MvcContext' wojilu.Web.Context.IViewerContext' wojilu.Common.LoginTime' wojilu.Web.SystemInfo,wojilu.Web.Controller.Download.Admin.FileController' wojilu.Web.Controller.Admin.MainController' wojilu.Web.Controller.Admin.Sys.ViewsFileController' wojilu.Web.Controller.SecurityController' wojilu.Web.Controller.Blog.Admin.PostController' wojilu.Web.Controller.Content.Admin.Common.PostController' wojilu.Web.Controller.Photo.Admin.PostController' wojilu.Web.Controller.Users.Admin.HomeController' wojilu.Web.Controller.Users.Admin.MsgController' wojilu.Web.Controller.Layouts.TopNavController' wojilu.Web.Controller.Microblogs.My.MicroblogController' wojilu.Web.Controller.Users.UserUploadController
wojilu.Web.Controller.Admin.Apps.Blog,BlogFileController,2,11,2,0,4,104,22,0,1,0.27,10,1,wojilu.Common.Upload.UserFile' wojilu.ExtData' wojilu.Apps.Blog.Service.BlogPicService' wojilu.SysPath' wojilu.sys' wojilu.Apps.Blog.Domain.BlogPost' wojilu.Web.Mvc.alink' wojilu.Common.Upload.UserFileService' wojilu.Web.Context.MvcContext' wojilu.strUtil,wojilu.Web.Controller.Blog.MainController
wojilu.Web.Controller.Admin.Apps.Blog,CommentController,0,0,0,0,0,4,0,0,0,-1,0,2,,wojilu.Web.Controller.Admin.Apps.Blog.LayoutController' wojilu.Web.Controller.Blog.MainController
wojilu.Web.Controller.Admin.Apps.Blog,MainController,1,14,5,0,6,155,23,0,1,0.29,14,4,wojilu.Apps.Blog.Interface.IBlogSysCategoryService' wojilu.Apps.Blog.Interface.ISysBlogService' wojilu.Web.IBlock' wojilu.Apps.Blog.Domain.BlogSysCategory' wojilu.Apps.Blog.Interface.IPickedService' wojilu.Web.Context.MvcContext' wojilu.strUtil' wojilu.Web.Controller.Security.SiteLogString' wojilu.Apps.Blog.Domain.BlogPost' wojilu.Apps.Blog.Interface.IBlogPostService' wojilu.Web.Mvc.alink' wojilu.Members.Users.Domain.User' wojilu.Members.Interface.IAdminLogService' wojilu.Web.Context.IViewerContext,wojilu.Web.Controller.Admin.Apps.Blog.LayoutController' wojilu.Web.Controller.Blog.Caching.BlogMainCache' wojilu.Web.Controller.Blog.Caching.BlogMainLayoutCache' wojilu.Web.Controller.Blog.MainController
wojilu.Web.Controller.Admin.Apps.Blog,PickedImgController,0,1,0,0,1,7,1,0,0,-1,3,1,wojilu.ndb' wojilu.IPageList' wojilu.Apps.Blog.Domain.BlogPickedImg,wojilu.Web.Controller.Admin.Apps.Blog.BlogPickController
wojilu.Web.Controller.Admin.Apps.Blog,SettingController,0,2,0,0,2,10,2,0,1,-1,2,1,wojilu.Apps.Blog.BlogAppSetting' wojilu.Web.Context.MvcContext,wojilu.Web.Controller.Blog.MainController
wojilu.Web.Controller.Admin.Apps.Blog,SysCategoryController,0,11,2,0,8,98,19,0,1,-1,10,2,wojilu.Apps.Blog.Domain.BlogSysCategory' wojilu.Members.Interface.IAdminLogService' wojilu.Web.Context.IViewerContext' wojilu.Web.Context.MvcContext' wojilu.Apps.Blog.Interface.IBlogSysCategoryService' wojilu.Web.IBlock' wojilu.db' wojilu.Web.Controller.Security.SiteLogString' wojilu.strUtil' wojilu.Result,wojilu.Web.Controller.Admin.Apps.Blog.LayoutController' wojilu.Web.Controller.Blog.MainController
wojilu.Web.Controller.Admin.Apps.Blog,TrashController,0,7,5,0,4,86,12,0,1,-1,11,4,wojilu.Apps.Blog.Interface.ISysBlogService' wojilu.Web.IBlock' wojilu.Apps.Blog.Domain.BlogPost' wojilu.Web.Mvc.alink' wojilu.Members.Users.Domain.User' wojilu.Web.Context.MvcContext' wojilu.strUtil' wojilu.Web.Controller.Security.SiteLogString' wojilu.Members.Interface.IAdminLogService' wojilu.Web.Context.IViewerContext' wojilu.Apps.Blog.Interface.IBlogPostService,wojilu.Web.Controller.Admin.Apps.Blog.LayoutController' wojilu.Web.Controller.Blog.Caching.BlogMainCache' wojilu.Web.Controller.Blog.Caching.BlogMainLayoutCache' wojilu.Web.Controller.Blog.MainController
wojilu.Web.Controller.Admin.Apps.Blog,BlogPickController,0,5,1,0,5,19,5,0,0,-1,2,2,wojilu.Apps.Blog.Interface.ISysBlogService' wojilu.Web.Controller.Admin.Apps.Blog.PickedImgController,wojilu.Web.Controller.Admin.Apps.Blog.LayoutController' wojilu.Web.Controller.Blog.MainController
wojilu.Web.Controller.Admin.Apps.Blog,LayoutController,0,2,2,0,2,19,2,0,1,-1,6,0,wojilu.Web.Controller.Admin.Apps.Blog.MainController' wojilu.Web.Controller.Admin.Apps.Blog.BlogPickController' wojilu.Web.Controller.Admin.Apps.Blog.TrashController' wojilu.Web.Controller.Admin.Apps.Blog.CommentController' wojilu.Apps.Blog.Interface.ISysBlogService' wojilu.Web.Controller.Admin.Apps.Blog.SysCategoryController,
wojilu.Web.Controller.Admin.Apps.Content,CommentController,0,0,0,0,0,4,0,0,0,-1,0,1,,wojilu.Web.Controller.Admin.Apps.Content.LayoutController
wojilu.Web.Controller.Admin.Apps.Content,LayoutController,0,2,1,0,2,15,2,0,1,-1,3,0,wojilu.Web.Controller.Admin.Apps.Content.MainController' wojilu.Web.Controller.Admin.Apps.Content.CommentController' wojilu.Apps.Content.Interface.ISysPostService,
wojilu.Web.Controller.Admin.Apps.Content,MainController,0,9,2,0,5,86,14,0,1,-1,13,1,wojilu.Apps.Content.Interface.ISysPostService' wojilu.Web.IBlock' wojilu.Apps.Content.Domain.ContentPost' wojilu.Web.Mvc.alink' wojilu.Members.Users.Domain.User' wojilu.strUtil' wojilu.SysPath' wojilu.sys' wojilu.Web.Context.MvcContext' wojilu.cvt' wojilu.Web.Controller.Security.SiteLogString' wojilu.Members.Interface.IAdminLogService' wojilu.Web.Context.IViewerContext,wojilu.Web.Controller.Admin.Apps.Content.LayoutController
wojilu.Web.Controller.Admin.Sys,ConnectAdminController,0,10,0,0,9,108,19,0,1,-1,6,1,wojilu.OAuth.AuthConnectConfig' wojilu.strUtil' wojilu.ExtData' wojilu.Web.Context.MvcContext' wojilu.Web.Context.IAppContext' wojilu.Result,wojilu.Web.Controller.Security.OperationDB
wojilu.Web.Controller.Admin.Sys,DashboardController,0,9,5,0,5,97,12,0,1,-1,24,5,wojilu.Web.IBlock' wojilu.Web.Controller.Admin.MenuController' wojilu.Web.Controller.Admin.Sys.FooterMenuController' wojilu.Web.Controller.Groups.MainController' wojilu.Web.Controller.Users.MainController' wojilu.Web.Controller.Blog.MainController' wojilu.Web.Controller.Photo.MainController' wojilu.Web.Controller.Photo.PhotoLink' wojilu.Web.Mvc.alink' wojilu.Web.Controller.TagController' wojilu.Web.Controller.LinkController' wojilu.Common.MemberApp.Interface.IMemberAppService' wojilu.Members.Sites.Domain.Site' wojilu.Common.MemberApp.Interface.IMemberApp' wojilu.strUtil' wojilu.UrlInfo' wojilu.Web.Context.MvcContext' wojilu.Common.Microblogs.Service.ISysMicroblogService' wojilu.Common.Microblogs.Service.IMicroblogFavoriteService' wojilu.Web.Controller.Microblogs.MicroblogController' wojilu.Web.Controller.Admin.FeedAdminController' wojilu.Members.Users.Interface.IUserService' wojilu.Members.Users.Domain.User' wojilu.cvt,wojilu.Web.Controller.Admin.MenuController' wojilu.Web.Controller.Admin.MainController' wojilu.Web.Controller.SiteInitController' wojilu.Web.Controller.Security.OperationDB' wojilu.Web.Controller.Layouts.SiteLayoutController
wojilu.Web.Controller.Admin.Sys,FooterMenuController,0,12,1,0,8,106,23,0,1,-1,11,3,wojilu.Common.Menus.FooterMenu' wojilu.Web.IBlock' wojilu.Web.Context.MvcContext' wojilu.cdb' wojilu.Web.Context.IAppContext' wojilu.UrlInfo' wojilu.strUtil' wojilu.Web.Controller.Security.SiteLogString' wojilu.Result' wojilu.Members.Interface.IAdminLogService' wojilu.Web.Context.IViewerContext,wojilu.Web.Controller.Admin.Sys.DashboardController' wojilu.Web.Controller.Security.OperationDB' wojilu.Web.Controller.Common.Caching.SiteLayoutCache
wojilu.Web.Controller.Admin.Sys,PageController,0,24,2,0,13,239,43,0,1,-1,15,2,wojilu.strUtil' wojilu.UrlInfo' wojilu.Web.Context.MvcContext' wojilu.Web.Controller.Common.PageController' wojilu.Web.IBlock' wojilu.Common.Pages.Domain.Page' wojilu.Common.Pages.Domain.PageCategory' wojilu.Result' wojilu.Common.Pages.Interface.IPageService' wojilu.Web.Context.IOwnerContext' wojilu.Web.Controller.Admin.Sys.PageCategoryController' wojilu.Web.Controller.Security.SiteLogString' wojilu.Members.Interface.IMember' wojilu.Web.Context.IViewerContext' wojilu.Members.Interface.IAdminLogService,wojilu.Web.Controller.Admin.Sys.PageCategoryController' wojilu.Web.Controller.Security.OperationDB
wojilu.Web.Controller.Admin.Sys,SiteController,0,4,0,0,4,19,4,0,1,-1,5,1,wojilu.Web.Controller.Admin.SiteConfigController' wojilu.UrlInfo' wojilu.Web.Context.MvcContext' wojilu.CacheClear' wojilu.sys,wojilu.Web.Controller.Admin.SiteConfigController
wojilu.Web.Controller.Admin.Sys,ViewsFileController,0,6,0,0,5,48,10,0,1,-1,14,3,wojilu.Web.Controller.Admin.SiteSkinController' wojilu.Web.Mvc.MvcConfig' wojilu.Web.IWebContext' wojilu.Web.Context.MvcContext' wojilu.strUtil' wojilu.Web.MockWebContext' wojilu.Web.Context.IViewerContext' wojilu.Web.Controller.Admin.AdminSecurityUtils' wojilu.Web.Mvc.CoreHandler' wojilu.Web.CurrentRequest' wojilu.Web.Template' wojilu.PathHelper' wojilu.CacheClear' wojilu.sys,wojilu.Web.Controller.Admin.SiteSkinController' wojilu.Web.Controller.Admin.Members.EmailConfirmController' wojilu.Web.Controller.Admin.Members.UserSettingController
wojilu.Web.Controller.Admin.Sys,PageCategoryController,0,17,2,0,8,180,40,0,1,-1,16,2,wojilu.Web.Controller.Admin.Sys.PageController' wojilu.Common.Pages.Interface.IPageService' wojilu.Web.Context.IOwnerContext' wojilu.Web.Context.MvcContext' wojilu.Web.IBlock' wojilu.Common.Pages.Domain.PageCategory' wojilu.Common.Pages.Domain.OpenStatus' wojilu.Members.Interface.IMember' wojilu.Web.Context.IViewerContext' wojilu.db' wojilu.strUtil' wojilu.Members.Users.Interface.IUserService' wojilu.cvt' wojilu.Members.Users.Domain.User' wojilu.Common.Msg.Service.MessageService' wojilu.Result,wojilu.Web.Controller.Admin.Sys.PageController' wojilu.Web.Controller.Security.OperationDB
wojilu.Web.Controller.Admin.Sys,SearchController,0,1,0,0,1,5,1,0,1,-1,0,0,,
wojilu.Web.Controller.Admin.Sys,SystemEnvController,0,1,0,0,1,49,1,0,1,-1,1,0,wojilu.Web.Mvc.ControllerBase,
wojilu.Web.Controller.Admin.Sys,CssFileController,0,2,0,0,2,4,2,0,1,-1,1,1,wojilu.Web.Controller.Admin.SiteSkinController,wojilu.Web.Controller.Admin.SiteSkinController
wojilu.Web.Controller.Admin.Sys,SkinFileController,0,2,0,0,2,4,2,0,1,-1,1,1,wojilu.Web.Controller.Admin.SiteSkinController,wojilu.Web.Controller.Admin.SiteSkinController
wojilu.Web.Controller.Admin.Sys,ConfigFileController,0,2,0,0,2,4,2,0,1,-1,0,1,,wojilu.Web.Controller.Admin.SiteConfigController
wojilu.Web.Controller.Admin.Sys,CacheFileController,0,2,0,0,2,4,2,0,1,-1,0,1,,wojilu.Web.Controller.Admin.SiteConfigController
wojilu.Web.Controller.Admin.Sys,SystemFileController,0,23,0,0,10,269,67,5,1,-1,8,1,wojilu.Web.Controller.Admin.SiteConfigController' wojilu.Result' wojilu.PathHelper' wojilu.Web.Context.MvcContext' wojilu.strUtil' wojilu.file' wojilu.SysPath' wojilu.sys,wojilu.Web.Controller.Admin.SiteConfigController
wojilu.Web.Controller.Admin.Sys,SiteLogController,0,7,2,0,3,87,14,0,1,-1,10,1,wojilu.Web.Context.MvcContext' wojilu.strUtil' wojilu.Members.Interface.IAdminLogService' wojilu.Members.Users.Interface.IUserService' wojilu.Members.Users.Domain.User' wojilu.ORM.EntityInfo' wojilu.Entity' wojilu.Data.IDatabaseDialect' wojilu.Members.Sites.Domain.SiteLog' wojilu.Web.IBlock,wojilu.Web.Controller.Security.OperationDB
wojilu.Web.Controller.Admin.Upgrade,ContentUpdateController,1,5,0,0,2,46,9,0,1,0.4,6,1,wojilu.ILog' wojilu.Apps.Content.Domain.ContentApp' wojilu.Apps.Content.Domain.ContentPost' wojilu.db' wojilu.Apps.Content.Domain.ContentPostSection' wojilu.Apps.Content.Domain.ContentSection,wojilu.Web.Controller.Admin.Upgrade.LayoutController
wojilu.Web.Controller.Admin.Upgrade,LayoutController,0,1,0,0,1,9,1,0,1,-1,4,0,wojilu.Web.Controller.Admin.Upgrade.StartController' wojilu.Web.Controller.Admin.Upgrade.ContentUpdateController' wojilu.Web.Controller.Admin.Upgrade.CommentImportController' wojilu.Web.Controller.Admin.Upgrade.PhotoController,
wojilu.Web.Controller.Admin.Upgrade,ThumbParam,3,0,0,3,0,5,0,0,0,-1,0,1,,wojilu.Web.Controller.Admin.Upgrade.PhotoController
wojilu.Web.Controller.Admin.Upgrade,PhotoController,3,14,0,0,4,164,30,0,1,0.14,17,1,wojilu.ILog' wojilu.Web.Controller.Admin.Upgrade.ThumbParam' wojilu.Web.Context.MvcContext' wojilu.Members.Users.Domain.User' wojilu.Drawing.ThumbConfig' wojilu.file' wojilu.Web.Utils.AvatarUploader' wojilu.Apps.Photo.Domain.PhotoPost' wojilu.strUtil' wojilu.Web.Utils.Uploader' wojilu.Drawing.Img' wojilu.SysPath' wojilu.sys' wojilu.PathHelper' wojilu.Apps.Photo.Helper.PhotoInfoHelper' wojilu.ObjectContext' wojilu.Data.DbContext,wojilu.Web.Controller.Admin.Upgrade.LayoutController
wojilu.Web.Controller.Admin.Upgrade,StartController,0,5,0,0,3,80,6,0,1,-1,1,1,wojilu.db,wojilu.Web.Controller.Admin.Upgrade.LayoutController
wojilu.Web.Controller.Admin.Upgrade,CommentImportController,0,5,0,0,5,27,5,0,1,-1,0,1,,wojilu.Web.Controller.Admin.Upgrade.LayoutController
wojilu.Web.Controller.Admin.Upgrade,ImportHelper<TComment;TTarget>,0,1,0,0,1,7,1,0,0,-1,1,0,wojilu.Web.Controller.Admin.Upgrade.ImportRawHelper,
wojilu.Web.Controller.Admin.Upgrade,ImportRawHelper,3,11,0,0,1,110,28,0,0,0,11,1,wojilu.ILog' wojilu.Common.Comments.OpenComment' wojilu.Common.Comments.OpenCommentService' wojilu.ORM.Query' wojilu.ndb' wojilu.ObjectContext' wojilu.Common.Comments.OpenCommentTrans' wojilu.Common.Comments.IComment' wojilu.IEntity' wojilu.Members.Users.Domain.User' wojilu.Web.Controller.Admin.Upgrade.CommentLevel,wojilu.Web.Controller.Admin.Upgrade.ImportHelper<TComment;TTarget>
wojilu.Web.Controller.Admin.Upgrade,CommentLevel,0,0,1,0,0,3,0,0,0,-1,0,1,,wojilu.Web.Controller.Admin.Upgrade.ImportRawHelper
wojilu.Web.Controller,ConnectController,1,17,3,0,8,315,47,0,1,0.12,23,3,wojilu.ILog' wojilu.OAuth.AuthConnect' wojilu.Web.Context.MvcContext' wojilu.OAuth.AuthConnectFactory' wojilu.OAuth.IUserConnectService' wojilu.Web.Context.IViewerContext' wojilu.Web.IWebContext' wojilu.strUtil' wojilu.OAuth.AccessToken' wojilu.OAuth.OAuthUserProfile' wojilu.Result' wojilu.OAuth.OAuthClient' wojilu.Net.HttpClientException' wojilu.OAuth.UserConnect' wojilu.Common.LoginTime' wojilu.Members.Users.Interface.ILoginService' wojilu.SysRequest' wojilu.sys' wojilu.Web.Mvc.MvcConfig' wojilu.Members.Users.Domain.User' wojilu.Members.Users.Interface.IUserService' wojilu.Web.Utils.AvatarUploader' wojilu.Web.Controller.Helpers.RegHelper,wojilu.Web.Controller.RenderHelper' wojilu.Web.Controller.MainController' wojilu.Web.Controller.Users.Admin.UserProfileController
wojilu.Web.Controller,ShareController,0,2,0,0,2,32,4,0,1,-1,10,3,wojilu.Web.IBlock' wojilu.Web.Mvc.Link' wojilu.Web.Context.IOwnerContext' wojilu.Web.Context.MvcContext' wojilu.Web.Controller.Microblogs.MicroblogSaveController' wojilu.Common.Microblogs.MicroblogAppSetting' wojilu.strUtil' wojilu.SysPath' wojilu.sys' wojilu.Drawing.ThumbnailType,wojilu.Web.Controller.Content.Binder.MyFaceBinderController' wojilu.Web.Controller.Photo.Wf.UserHomeController' wojilu.Web.Controller.Users.ProfileController
wojilu.Web.Controller,LinkController,0,20,0,0,20,95,20,0,1,-1,15,3,wojilu.Web.Mvc.Link' wojilu.Web.Context.IViewerContext' wojilu.Web.Context.MvcContext' wojilu.Web.Controller.Microblogs.My.MicroblogController' wojilu.Web.Controller.Users.Admin.HomeController' wojilu.Web.Controller.Users.Admin.MsgController' wojilu.Web.Controller.Users.Admin.Friends.FriendController' wojilu.Web.Controller.Users.Admin.AppController' wojilu.Web.Controller.Users.Admin.MenuController' wojilu.Web.Controller.Users.Admin.UserProfileController' wojilu.Web.Controller.Users.Admin.CreditController' wojilu.Web.Controller.Users.Admin.InviteController' wojilu.Web.Controller.Users.Admin.MyGroupController' wojilu.Web.Controller.Users.Admin.NotificationController' wojilu.Web.Controller.Users.Admin.SkinController,wojilu.Web.Controller.Admin.Sys.DashboardController' wojilu.Web.Controller.Common.Installers.PortalInstaller' wojilu.Web.Controller.Content.Binder.MyFaceBinderController
wojilu.Web.Controller,LangController,0,1,0,0,1,8,1,0,1,-1,2,1,wojilu.Web.Context.MvcContext' wojilu.Web.IWebContext,wojilu.Web.Controller.Layouts.TopNavController
wojilu.Web.Controller,RegisterController,1,16,7,0,13,285,48,0,1,0.31,32,9,wojilu.ILog' wojilu.Web.Controller.SecurityController' wojilu.Config.SiteSetting' wojilu.config' wojilu.Config.RegisterType' wojilu.Result' wojilu.Members.Users.Domain.User' wojilu.Web.Context.IViewerContext' wojilu.Web.Context.MvcContext' wojilu.Members.Users.Interface.IInviteService' wojilu.Members.Users.Interface.IUserService' wojilu.Web.Controller.MainController' wojilu.Web.IBlock' wojilu.Web.Mvc.PageMeta' wojilu.Web.Mvc.Html' wojilu.Common.Resource.AppResource' wojilu.Common.Component' wojilu.Web.Mvc.MvcConfig' wojilu.Web.SystemInfo' wojilu.strUtil' wojilu.UrlInfo' wojilu.Web.Controller.Common.ActivationController' wojilu.Web.Controller.Common.WebUtils' wojilu.Web.Controller.Helpers.RegHelper' wojilu.Common.AppBase.MemberStatus' wojilu.Members.Users.Interface.ILoginService' wojilu.Common.LoginTime' wojilu.Web.Controller.Common.IConfirmEmail' wojilu.SysPath' wojilu.sys' wojilu.Web.Mvc.Captcha' wojilu.RegPattern,wojilu.Web.Controller.SiteInitController' wojilu.Web.Controller.MainController' wojilu.Web.Controller.Microblogs.MainController' wojilu.Web.Controller.Forum.TopicListController' wojilu.Web.Controller.Forum.Caching.ForumIndexCache' wojilu.Web.Controller.Users.Admin.InviteController' wojilu.Web.Controller.Users.Caching.UserMainIndexCache' wojilu.Web.Controller.Layouts.GroupLayoutController' wojilu.Web.Controller.Layouts.TopNavController
wojilu.Web.Controller,RenderHelper,4,7,0,1,2,121,21,0,1,0.57,22,0,wojilu.ILog' wojilu.Web.Mvc.MvcEventPublisher' wojilu.Web.Context.MvcContext' wojilu.Web.Mvc.MvcConfig' wojilu.Web.SystemInfo' wojilu.Web.Mvc.MvcEventArgs' wojilu.UrlInfo' wojilu.strUtil' wojilu.Web.Mvc.MemberPath' wojilu.Members.Users.Domain.User' wojilu.Common.Onlines.OnlineStats' wojilu.Web.IWebContext' wojilu.Common.Onlines.OnlineManager' wojilu.Config.SiteSetting' wojilu.config' wojilu.Web.Context.MvcContextUtils' wojilu.OAuth.AuthConnectConfig' wojilu.Web.Mvc.Link' wojilu.Members.Sites.Domain.Site' wojilu.Web.Controller.ConnectController' wojilu.Web.WebStopwatch' wojilu.Data.DbContext,
