Namespace,Type,NOF,NOM,NOP,NOPF,NOPM,LOC,WMC,NC,DIT,LCOM,Fan-Out,Fan-In,Fan-Out types,Fan-In types
Sq1.Core.Execution,OrderStateMessageEventArgs,0,1,1,0,1,6,1,0,0,-1,1,1,Sq1.Core.Execution.OrderStateMessage,Sq1.Gui.Singletons.ExecutionForm
Sq1.Core.Execution,Position,14,9,46,8,7,539,39,0,0,0,9,27,Sq1.Core.Execution.PositionPrototype' Sq1.Core.Execution.Alert' Sq1.Core.Execution.PositionLongShort' Sq1.Core.Execution.MarketLimitStop' Sq1.Core.DataTypes.Bars' Sq1.Core.DataTypes.Bar' Sq1.Core.Backtesting.Backtester' Sq1.Core.Livesim.Livesimulator' Sq1.Core.Execution.Order,Sq1.Charting.AlertArrow' Sq1.Charting.ChartControl' Sq1.Charting.PanelBase' Sq1.Charting.PanelPrice' Sq1.Charting.ExecutorObjects_FrozenForRendering' Sq1.Charting.TooltipPosition' Sq1.Core.Backtesting.Backtester' Sq1.Core.Backtesting.BacktestMarketsim' Sq1.Core.Broker.BrokerAdapter' Sq1.Core.Broker.OrderProcessor' Sq1.Core.Broker.OrderPostProcessorEmergency' Sq1.Core.Broker.OrderPostProcessorRejected' Sq1.Core.Charting.ChartShadow' Sq1.Core.Execution.ExecutorDataSnapshot' Sq1.Core.Execution.PositionList' Sq1.Core.Execution.Alert' Sq1.Core.Execution.PositionEventArgs' Sq1.Core.StrategyBase.PositionPrototypeActivator' Sq1.Core.StrategyBase.Script' Sq1.Core.StrategyBase.ScriptExecutor' Sq1.Core.StrategyBase.SystemPerformance' Sq1.Core.StrategyBase.SystemPerformanceSlice' Sq1.Core.StrategyBase.AlertFactory' Sq1.Reporters.Positions' Sq1.Strategies.Demo.TwoMAsCompiled' Sq1.Strategies.Demo.StopLimitTestCompiled' Sq1.Strategies.Demo.EnterEveryBarCompiled
Sq1.Core.Execution,PositionSizeEventArgs,0,1,1,0,1,6,1,0,0,-1,1,0,Sq1.Core.Execution.PositionSize,
Sq1.Core.Execution,Alert,17,11,50,17,9,616,39,0,0,0,20,40,Newtonsoft.Json.JsonIgnoreAttribute' Newtonsoft.Json.JsonPropertyAttribute' Sq1.Core.Execution.MarketLimitStop' Sq1.Core.Execution.MarketOrderAs' Sq1.Core.Execution.Direction' Sq1.Core.DataTypes.BarScale' Sq1.Core.Assembler' Sq1.Core.DataTypes.Bar' Sq1.Core.DataTypes.Bars' Sq1.Core.DataTypes.SymbolInfo' Sq1.Core.DataFeed.DataSource' Sq1.Core.Broker.BrokerAdapter' Sq1.Core.Accounting.Account' Sq1.Core.StrategyBase.Strategy' Sq1.Core.Streaming.StreamingAdapter' Sq1.Core.Streaming.StreamingDataSnapshot' Sq1.Core.Execution.SpreadSide' Sq1.Core.Livesim.LivesimStreaming' Sq1.Core.Execution.Position' Sq1.Core.Execution.Order,Sq1.Charting.ChartControl' Sq1.Charting.PanelPrice' Sq1.Charting.ExecutorObjects_FrozenForRendering' Sq1.Charting.TooltipPrice' Sq1.Core.Backtesting.Backtester' Sq1.Core.Backtesting.BacktestMarketsim' Sq1.Core.Backtesting.BacktestBroker' Sq1.Core.Backtesting.BacktestQuotesGenerator' Sq1.Core.Broker.BrokerAdapter' Sq1.Core.Broker.OrderProcessor' Sq1.Core.Broker.OrdersAutoTree' Sq1.Core.Broker.OrderLaneByType' Sq1.Core.Broker.OrderLane' Sq1.Core.Broker.OrderProcessorDataSnapshot' Sq1.Core.Broker.OrderPostProcessorReplacerTidalThenCrossMarket' Sq1.Core.Broker.OrderPostProcessorSequencerCloseThenOpen' Sq1.Core.Broker.OrderPostProcessorEmergencyLock' Sq1.Core.Broker.OrderPostProcessorEmergency' Sq1.Core.Broker.OrderPostProcessorRejected' Sq1.Core.Charting.ChartShadow' Sq1.Core.DataTypes.SymbolInfo' Sq1.Core.Livesim.LivesimBroker' Sq1.Core.Execution.AlertList' Sq1.Core.Execution.ExecutorDataSnapshot' Sq1.Core.Execution.PositionList' Sq1.Core.Execution.Position' Sq1.Core.Execution.MarketConverter' Sq1.Core.Execution.PositionPrototype' Sq1.Core.Execution.AlertEventArgs' Sq1.Core.Execution.Order' Sq1.Core.StrategyBase.PositionPrototypeActivator' Sq1.Core.StrategyBase.Script' Sq1.Core.StrategyBase.ScriptExecutor' Sq1.Core.StrategyBase.SystemPerformanceSlice' Sq1.Core.StrategyBase.AlertFactory' Sq1.Gui.Singletons.ExecutionForm' Sq1.Strategies.Demo.TwoMAsCompiled' Sq1.Strategies.Demo.StopLimitTestCompiled' Sq1.Strategies.Demo.EnterEveryBarCompiled' Sq1.Widgets.Execution.ExecutionTreeControl
Sq1.Core.Execution,ByBarDumpStatus,0,0,0,0,0,5,0,0,0,-1,0,2,,Sq1.Core.Execution.AlertList' Sq1.Core.Execution.ExecutorDataSnapshot
Sq1.Core.Execution,ReporterPokeUnit,0,5,9,0,5,57,15,0,0,-1,4,18,Sq1.Core.DataTypes.Quote' Sq1.Core.Execution.AlertList' Sq1.Core.Execution.PositionList' Sq1.Core.Assembler,Sq1.Charting.ChartControl' Sq1.Charting.ExecutorObjects_FrozenForRendering' Sq1.Core.Backtesting.BacktestStreamingConsumer' Sq1.Core.Broker.OrderProcessor' Sq1.Core.Broker.OrderPostProcessorStateChangedTrigger' Sq1.Core.Charting.ChartShadow' Sq1.Core.Charting.StreamingConsumerChart' Sq1.Core.Livesim.LivesimBroker' Sq1.Core.Livesim.LivesimStreamingConsumer' Sq1.Core.Execution.ReporterPokeUnitEventArgs' Sq1.Core.StrategyBase.ScriptExecutor' Sq1.Core.StrategyBase.Reporter' Sq1.Core.StrategyBase.ScriptExecutorEventGenerator' Sq1.Core.StrategyBase.SystemPerformance' Sq1.Core.StrategyBase.SystemPerformanceSlice' Sq1.Gui.ReportersSupport.ReportersFormsManager' Sq1.Reporters.Performance' Sq1.Reporters.Positions
Sq1.Core.Execution,OrderStatesCollections,7,3,1,7,2,99,4,0,0,1,0,4,,Sq1.Core.Broker.OrderProcessor' Sq1.Core.Broker.OrderLane' Sq1.Core.Broker.OrderLaneByState' Sq1.Core.Broker.OrderProcessorDataSnapshot
Sq1.Core.Execution,MarketConverter,0,8,0,0,8,143,18,0,0,-1,5,1,Sq1.Core.Execution.Alert' Sq1.Core.Execution.Direction' Sq1.Core.Execution.PositionLongShort' Sq1.Core.Execution.MarketLimitStop' Sq1.Core.DataTypes.BidOrAsk,Sq1.Core.StrategyBase.PositionPrototypeActivator
Sq1.Core.Execution,MarketOrderAs,0,0,0,0,0,9,0,0,0,-1,0,5,,Sq1.Core.Broker.BrokerAdapter' Sq1.Core.Broker.OrderProcessor' Sq1.Core.DataTypes.SymbolInfo' Sq1.Core.Execution.Alert' Sq1.Core.Streaming.StreamingDataSnapshot
Sq1.Core.Execution,SpreadSide,0,0,0,0,0,11,0,0,0,-1,0,5,,Sq1.Core.Broker.BrokerAdapter' Sq1.Core.Execution.Alert' Sq1.Core.Execution.Order' Sq1.Core.Streaming.StreamingDataSnapshot' Sq1.Widgets.Execution.ExecutionTreeControl
Sq1.Core.Execution,PositionPrototype,8,12,6,8,12,141,21,0,0,0.25,2,9,Sq1.Core.Execution.PositionLongShort' Sq1.Core.Execution.Alert,Sq1.Charting.PanelPrice' Sq1.Core.Backtesting.BacktestMarketsim' Sq1.Core.Backtesting.BacktestBroker' Sq1.Core.Broker.BrokerAdapter' Sq1.Core.Broker.OrderProcessor' Sq1.Core.Execution.Position' Sq1.Core.StrategyBase.PositionPrototypeActivator' Sq1.Core.StrategyBase.ScriptExecutor' Sq1.Strategies.Demo.StopLimitTestCompiled
Sq1.Core.Execution,AlertEventArgs,0,1,1,0,1,6,1,0,0,-1,1,0,Sq1.Core.Execution.Alert,
Sq1.Core.Execution,ReporterPokeUnitEventArgs,1,1,0,1,1,6,1,0,0,0,1,1,Sq1.Core.Execution.ReporterPokeUnit,Sq1.Gui.ReportersSupport.ReportersFormsManager
Sq1.Core.Execution,PositionEventArgs,1,1,0,1,1,6,1,0,0,0,1,0,Sq1.Core.Execution.Position,
Sq1.Core.Execution,Order,22,18,34,20,13,471,45,0,0,0.28,14,26,Newtonsoft.Json.JsonPropertyAttribute' Newtonsoft.Json.JsonIgnoreAttribute' Sq1.Core.Execution.OrderState' Sq1.Core.Execution.SpreadSide' Sq1.Core.Execution.Alert' Sq1.Core.DataTypes.Quote' Sq1.Core.DataTypes.Bar' Sq1.Core.Assembler' Sq1.Core.DataTypes.MarketInfo' Sq1.Core.DataTypes.Bars' Sq1.Core.Execution.OrderStateMessage' Sq1.Core.DataTypes.SymbolInfo' Sq1.Core.DataFeed.DataSource' Sq1.Core.Streaming.StreamingDataSnapshot,Sq1.Core.Backtesting.BacktestBroker' Sq1.Core.Broker.BrokerAdapter' Sq1.Core.Broker.OrderProcessor' Sq1.Core.Broker.OrdersAutoTree' Sq1.Core.Broker.OrderLaneByType' Sq1.Core.Broker.OrderCallbackDupesChecker' Sq1.Core.Broker.OrderCallbackDupesCheckerTransparent' Sq1.Core.Broker.OrderLane' Sq1.Core.Broker.OrderLaneByState' Sq1.Core.Broker.OrderProcessorDataSnapshot' Sq1.Core.Broker.OrderPostProcessorStateChangedTrigger' Sq1.Core.Broker.OrderPostProcessorStateHook' Sq1.Core.Broker.OrderPostProcessorReplacerTidalThenCrossMarket' Sq1.Core.Broker.OrderPostProcessorSequencerCloseThenOpen' Sq1.Core.Broker.OrderPostProcessorEmergencyLock' Sq1.Core.Broker.OrderPostProcessorEmergency' Sq1.Core.Broker.OrderPostProcessorRejected' Sq1.Core.Livesim.LivesimBroker' Sq1.Core.Execution.OrderEventArgs' Sq1.Core.Execution.Position' Sq1.Core.Execution.Alert' Sq1.Core.Execution.OrderStateMessage' Sq1.Core.StrategyBase.PositionPrototypeActivator' Sq1.Core.StrategyBase.ScriptExecutor' Sq1.Gui.Singletons.ExecutionForm' Sq1.Widgets.Execution.ExecutionTreeControl
Sq1.Core.Execution,OrdersListEventArgs,0,1,1,0,1,17,1,0,0,-1,0,1,,Sq1.Gui.Singletons.ExecutionForm
Sq1.Core.Execution,OrderStateMessage,0,5,5,0,4,40,7,0,0,-1,3,13,Sq1.Core.Execution.Order' Sq1.Core.Execution.OrderState' Sq1.Core.Assembler,Sq1.Core.Broker.BrokerAdapter' Sq1.Core.Broker.OrderProcessor' Sq1.Core.Broker.OrderCallbackDupesChecker' Sq1.Core.Broker.OrderCallbackDupesCheckerTransparent' Sq1.Core.Broker.OrderPostProcessorReplacerTidalThenCrossMarket' Sq1.Core.Broker.OrderPostProcessorSequencerCloseThenOpen' Sq1.Core.Broker.OrderPostProcessorEmergency' Sq1.Core.Broker.OrderPostProcessorRejected' Sq1.Core.Livesim.LivesimBroker' Sq1.Core.Execution.OrderStateMessageEventArgs' Sq1.Core.Execution.Order' Sq1.Gui.Singletons.ExecutionForm' Sq1.Widgets.Execution.ExecutionTreeControl
Sq1.Core.Execution,OrderState,0,0,0,0,0,62,0,0,0,-1,0,14,,Sq1.Core.Broker.BrokerAdapter' Sq1.Core.Broker.OrderProcessor' Sq1.Core.Broker.OrderLaneByState' Sq1.Core.Broker.OrderProcessorDataSnapshot' Sq1.Core.Broker.OrderPostProcessorStateHook' Sq1.Core.Broker.OrderPostProcessorReplacerTidalThenCrossMarket' Sq1.Core.Broker.OrderPostProcessorSequencerCloseThenOpen' Sq1.Core.Broker.OrderPostProcessorEmergency' Sq1.Core.Broker.OrderPostProcessorRejected' Sq1.Core.Livesim.LivesimBroker' Sq1.Core.Execution.Order' Sq1.Core.Execution.OrderStateMessage' Sq1.Core.StrategyBase.ScriptExecutor' Sq1.Widgets.Execution.ExecutionTreeControl
Sq1.Core.Execution,MarketLimitStop,0,0,0,0,0,8,0,0,0,-1,0,19,,Sq1.Charting.PanelPrice' Sq1.Charting.TooltipPosition' Sq1.Core.CommissionCalculator' Sq1.Core.Backtesting.BacktestMarketsim' Sq1.Core.Backtesting.BacktestQuotesGenerator' Sq1.Core.Broker.BrokerAdapter' Sq1.Core.Broker.CommissionCalculatorZero' Sq1.Core.Broker.OrderProcessor' Sq1.Core.DataTypes.SymbolInfo' Sq1.Core.Execution.Position' Sq1.Core.Execution.Alert' Sq1.Core.Execution.MarketConverter' Sq1.Core.StrategyBase.PositionPrototypeActivator' Sq1.Core.StrategyBase.Script' Sq1.Core.StrategyBase.ScriptExecutor' Sq1.Core.StrategyBase.AlertFactory' Sq1.Core.Streaming.StreamingDataSnapshot' Sq1.Reporters.Positions' Sq1.Widgets.Execution.ExecutionTreeControl
Sq1.Core.Execution,PositionSize,3,4,0,3,3,41,6,0,0,0.5,1,4,Sq1.Core.Execution.PositionSizeMode,Sq1.Core.Execution.PositionSizeEventArgs' Sq1.Core.StrategyBase.ContextScript' Sq1.Core.StrategyBase.ScriptExecutor' Sq1.Gui.Forms.ChartForm
Sq1.Core.Execution,PositionLongShort,0,0,0,0,0,5,0,0,0,-1,0,11,,Sq1.Charting.TooltipPosition' Sq1.Core.Broker.OrderProcessor' Sq1.Core.Execution.Position' Sq1.Core.Execution.MarketConverter' Sq1.Core.Execution.PositionPrototype' Sq1.Core.StrategyBase.PositionPrototypeActivator' Sq1.Core.StrategyBase.Script' Sq1.Core.StrategyBase.SystemPerformanceSlice' Sq1.Core.Streaming.StreamingDataSnapshot' Sq1.Reporters.Positions' Sq1.Strategies.Demo.StopLimitTestCompiled
Sq1.Core.Execution,PositionSizeMode,0,0,0,0,0,5,0,0,0,-1,0,4,,Sq1.Core.Execution.PositionSize' Sq1.Core.StrategyBase.ContextScript' Sq1.Core.StrategyBase.ScriptExecutor' Sq1.Gui.Forms.ChartForm
Sq1.Core.Execution,Direction,0,0,0,0,0,7,0,0,0,-1,0,15,,Sq1.Core.CommissionCalculator' Sq1.Core.Backtesting.BacktestMarketsim' Sq1.Core.Backtesting.BacktestQuotesGenerator' Sq1.Core.Broker.BrokerAdapter' Sq1.Core.Broker.CommissionCalculatorZero' Sq1.Core.Broker.OrderProcessor' Sq1.Core.DataTypes.SymbolInfo' Sq1.Core.Execution.Alert' Sq1.Core.Execution.MarketConverter' Sq1.Core.StrategyBase.PositionPrototypeActivator' Sq1.Core.StrategyBase.Script' Sq1.Core.StrategyBase.ScriptExecutor' Sq1.Core.StrategyBase.AlertFactory' Sq1.Core.Streaming.StreamingDataSnapshot' Sq1.Widgets.Execution.ExecutionTreeControl
Sq1.Core.Indicators.HelperSeries,DataSeriesTimeBasedColorified,2,3,0,2,3,19,3,0,2,0,3,2,Sq1.Core.DataTypes.BarScaleInterval' Sq1.Core.DataTypes.DataSeriesTimeBased' Sq1.Core.DataTypes.Bar,Sq1.Core.Indicators.Indicator' Sq1.Core.Indicators.IndicatorAtrBand
Sq1.Core.Indicators.HelperSeries,MovingAverageSimple,2,4,0,2,4,69,15,0,2,0,4,2,Sq1.Core.DataTypes.DataSeriesTimeBased' Sq1.Core.DataTypes.Bar' Sq1.Core.Assembler' Sq1.Core.DataTypes.DataSeriesProxyBars,Sq1.Core.Indicators.IndicatorAverageTrueRange' Sq1.Core.Indicators.IndicatorMovingAverageSimple
Sq1.Core.Indicators.HelperSeries,TrueRangeSeries,0,3,0,0,3,36,6,0,2,-1,4,1,Sq1.Core.DataTypes.BarScaleInterval' Sq1.Core.DataTypes.DataSeriesTimeBased' Sq1.Core.DataTypes.Bar' Sq1.Core.Assembler,Sq1.Core.Indicators.IndicatorAverageTrueRange
Sq1.Core.Indicators,Indicator,15,22,19,7,16,607,77,3,0,0.23,17,12,Sq1.Core.Charting.ChartPanelType' Sq1.Core.DataTypes.DataSeriesProxyableFromBars' Sq1.Core.DataTypes.Bars' Sq1.Core.DataTypes.DataSeriesProxyBars' Sq1.Core.DataTypes.BarScale' Sq1.Core.StrategyBase.ScriptExecutor' Sq1.Core.DataTypes.DataSeriesTimeBased' Sq1.Core.Assembler' Sq1.Core.Charting.HostPanelForIndicator' Sq1.Core.DataTypes.SymbolInfo' Sq1.Core.Indicators.IndicatorParameter' Sq1.Core.DataTypes.Bar' Sq1.Core.DataTypes.Quote' Sq1.Core.Backtesting.Backtester' Sq1.Core.StrategyBase.ContextScript' Sq1.Core.StrategyBase.Strategy' Sq1.Core.Indicators.HelperSeries.DataSeriesTimeBasedColorified,Sq1.Charting.ChartControl' Sq1.Charting.PanelBase' Sq1.Charting.PanelIndicator' Sq1.Charting.ExecutorObjects_FrozenForRendering' Sq1.Charting.TooltipPrice' Sq1.Charting.MultiSplit.MultiSplitContainerGeneric<PANEL_BASE>' Sq1.Core.Charting.ChartShadow' Sq1.Core.Indicators.IndicatorAverageTrueRange' Sq1.Core.Indicators.IndicatorAtrBand' Sq1.Core.Indicators.IndicatorMovingAverageSimple' Sq1.Core.StrategyBase.Script' Sq1.Core.StrategyBase.ScriptExecutor
Sq1.Core.Indicators,IndicatorAverageTrueRange,3,3,1,1,3,31,5,0,1,0,7,1,Sq1.Core.Indicators.IndicatorParameter' Sq1.Core.Indicators.HelperSeries.TrueRangeSeries' Sq1.Core.Indicators.HelperSeries.MovingAverageSimple' Sq1.Core.Indicators.Indicator' Sq1.Core.Charting.ChartPanelType' Sq1.Core.DataTypes.DataSeriesTimeBased' Sq1.Core.DataTypes.Bar,Sq1.Strategies.Demo.ATRbandCompiled
Sq1.Core.Indicators,IndicatorAtrBand,4,5,1,3,4,112,11,0,1,0,14,1,Sq1.Core.Indicators.IndicatorParameter' Sq1.Core.Indicators.HelperSeries.DataSeriesTimeBasedColorified' Sq1.Core.Indicators.Indicator' Sq1.Core.Charting.ChartPanelType' Sq1.Core.DataTypes.DataSeriesTimeBased' Sq1.Core.DataTypes.Bar' Sq1.Core.DataTypes.SymbolInfo' Sq1.Core.DataTypes.Bars' Sq1.Core.Backtesting.BacktestSpreadModeler' Sq1.Core.Backtesting.BacktestStreaming' Sq1.Core.Backtesting.BacktestDataSource' Sq1.Core.Backtesting.Backtester' Sq1.Core.StrategyBase.ScriptExecutor' Sq1.Core.Assembler,Sq1.Strategies.Demo.ATRbandCompiled
Sq1.Core.Indicators,IndicatorMovingAverageSimple,2,6,1,1,5,171,22,0,1,0,10,3,Sq1.Core.Indicators.IndicatorParameter' Sq1.Core.Indicators.HelperSeries.MovingAverageSimple' Sq1.Core.Indicators.Indicator' Sq1.Core.DataTypes.Bars' Sq1.Core.DataTypes.DataSeriesProxyBars' Sq1.Core.Assembler' Sq1.Core.DataTypes.DataSeriesTimeBased' Sq1.Core.Backtesting.Backtester' Sq1.Core.StrategyBase.ScriptExecutor' Sq1.Core.DataTypes.Bar,Sq1.Strategies.Demo.TwoMAindicatorsCompiled' Sq1.Strategies.Demo.TwoMAsCompiled' Sq1.Strategies.Demo.EnterEveryBarCompiled
Sq1.Core.Indicators,IndicatorParameter,10,6,4,10,6,114,15,1,0,0.33,2,18,Newtonsoft.Json.JsonPropertyAttribute' Newtonsoft.Json.JsonIgnoreAttribute,Sq1.Core.Correlation.KPIsCalculator' Sq1.Core.Correlation.Correlator' Sq1.Core.Sequencing.ParametersSequencer' Sq1.Core.Sequencing.SystemPerformanceRestoreAble' Sq1.Core.Indicators.Indicator' Sq1.Core.Indicators.IndicatorAverageTrueRange' Sq1.Core.Indicators.IndicatorAtrBand' Sq1.Core.Indicators.IndicatorMovingAverageSimple' Sq1.Core.Indicators.IndicatorParameterEventArgs' Sq1.Core.StrategyBase.ContextScript' Sq1.Core.StrategyBase.Script' Sq1.Core.StrategyBase.Strategy' Sq1.Core.StrategyBase.ScriptParameter' Sq1.Core.StrategyBase.SystemPerformance' Sq1.Widgets.Sequencing.SequencerControl' Sq1.Widgets.Sequencing.AspectGetterDelegateWrapper' Sq1.Widgets.SteppingSlider.PanelFillSlider' Sq1.Widgets.SteppingSlider.SteppingSlidersAutoGrowControl
Sq1.Core.Indicators,IndicatorParameterEventArgs,0,1,1,0,1,6,1,1,0,-1,1,1,Sq1.Core.Indicators.IndicatorParameter,Sq1.Gui.MainFormEventManager
Sq1.Core.Serializers,SerializerLogrotate<T>,7,7,1,1,5,111,14,0,0,0.29,4,0,Newtonsoft.Json.JsonConvert' Newtonsoft.Json.Formatting' Newtonsoft.Json.TypeNameHandling' Sq1.Core.Assembler,
Sq1.Core.Serializers,SerializerLogrotatePeriodic<T>,2,3,2,1,2,34,4,0,0,0,1,0,Sq1.Core.Assembler,
Sq1.Core.Serializers,Serializer<T>,1,6,8,1,6,124,15,0,0,1,4,0,Sq1.Core.Assembler' Newtonsoft.Json.JsonConvert' Newtonsoft.Json.TypeNameHandling' Newtonsoft.Json.Formatting,
Sq1.Core.StrategyBase,ContextChart,8,4,0,8,4,50,7,1,0,0,5,9,Newtonsoft.Json.JsonPropertyAttribute' Sq1.Core.DataTypes.BarScale' Sq1.Core.DataTypes.BarScaleInterval' Sq1.Core.DataTypes.BarDataRange' Sq1.Core.StrategyBase.ContextScript,Sq1.Charting.ChartControl' Sq1.Core.Charting.ChartShadow' Sq1.Core.Charting.StreamingConsumerChart' Sq1.Core.StrategyBase.ContextScript' Sq1.Gui.FormFactories.SequencerFormFactory' Sq1.Gui.Forms.ChartForm' Sq1.Gui.Forms.ChartFormManager' Sq1.Gui.Forms.ChartFormInterformEventsConsumer' Sq1.Gui.MainFormEventManager
Sq1.Core.StrategyBase,ContextScript,29,13,5,29,9,343,53,0,1,0.15,13,27,Newtonsoft.Json.JsonIgnoreAttribute' Newtonsoft.Json.JsonPropertyAttribute' Sq1.Core.StrategyBase.ContextChart' Sq1.Core.Execution.PositionSizeMode' Sq1.Core.Backtesting.BacktestStreaming' Sq1.Core.Backtesting.BacktestStrokesPerBar' Sq1.Core.Backtesting.BacktestSpreadModelerPercentage' Sq1.Core.Assembler' Sq1.Core.Sequencing.SystemPerformanceRestoreAble' Sq1.Core.Execution.PositionSize' Sq1.Core.StrategyBase.ScriptParameter' Sq1.Core.Indicators.IndicatorParameter' Sq1.Core.StrategyBase.Reporter,Sq1.Core.Backtesting.Backtester' Sq1.Core.Backtesting.BacktestMarketsim' Sq1.Core.Correlation.MomentumsCalculator' Sq1.Core.Livesim.LivesimStreaming' Sq1.Core.Livesim.Livesimulator' Sq1.Core.Sequencing.SequencedBacktests' Sq1.Core.Sequencing.ReusableExecutor' Sq1.Core.Sequencing.ReusableExecutorsPool' Sq1.Core.Sequencing.ParametersSequencer' Sq1.Core.Sequencing.SystemPerformanceRestoreAble' Sq1.Core.Indicators.Indicator' Sq1.Core.StrategyBase.ContextChart' Sq1.Core.StrategyBase.Script' Sq1.Core.StrategyBase.ScriptExecutor' Sq1.Core.StrategyBase.Strategy' Sq1.Core.StrategyBase.SystemPerformance' Sq1.Gui.FormFactories.SequencerFormFactory' Sq1.Gui.Forms.ChartForm' Sq1.Gui.Forms.ChartFormManager' Sq1.Gui.MainForm' Sq1.Gui.MainFormEventManager' Sq1.Gui.ReportersSupport.ReportersFormsManager' Sq1.Gui.Singletons.SlidersForm' Sq1.Strategies.Demo.EnterEveryBarCompiled' Sq1.Widgets.Sequencing.SequencerControl' Sq1.Widgets.SteppingSlider.SteppingSlidersAutoGrowControl' Sq1.Widgets.StrategiesTree.StrategiesTreeControl
Sq1.Core.StrategyBase,KPIs,9,9,1,9,6,107,13,2,0,0.44,2,6,Newtonsoft.Json.JsonPropertyAttribute' Sq1.Core.Assembler,Sq1.Core.Correlation.KPIsMomentum' Sq1.Core.Correlation.KPIsAveraged' Sq1.Core.Sequencing.SequencedBacktests' Sq1.Core.Sequencing.SystemPerformanceRestoreAble' Sq1.Core.StrategyBase.SystemPerformanceSlice' Sq1.Widgets.Correlation.OneParameterControl
Sq1.Core.StrategyBase,PositionPrototypeActivator,1,18,0,0,10,526,78,0,0,0.11,20,4,Sq1.Core.StrategyBase.ScriptExecutor' Sq1.Core.Execution.Alert' Sq1.Core.Assembler' Sq1.Core.Execution.Position' Sq1.Core.Execution.PositionPrototype' Sq1.Core.Broker.BrokerAdapter' Sq1.Core.DataFeed.DataSource' Sq1.Core.Backtesting.Backtester' Sq1.Core.Execution.Order' Sq1.Core.DataTypes.Bars' Sq1.Core.Execution.MarketConverter' Sq1.Core.DataTypes.Bar' Sq1.Core.Execution.AlertList' Sq1.Core.Execution.ExecutorDataSnapshot' Sq1.Core.Execution.MarketLimitStop' Sq1.Core.DataTypes.Quote' Sq1.Core.Execution.Direction' Sq1.Core.Streaming.StreamingDataSnapshot' Sq1.Core.Streaming.StreamingAdapter' Sq1.Core.Execution.PositionLongShort,Sq1.Core.Backtesting.BacktestMarketsim' Sq1.Core.Broker.OrderProcessor' Sq1.Core.StrategyBase.ScriptExecutor' Sq1.Strategies.Demo.StopLimitTestCompiled
Sq1.Core.StrategyBase,Script,8,47,21,0,45,486,66,5,0,0.81,17,20,Sq1.Core.StrategyBase.ScriptExecutor' Sq1.Core.Charting.OnChart.OnChartObjectOperationStatus' Sq1.Core.DataTypes.Bar' Sq1.Core.Charting.HostPanelForIndicator' Sq1.Core.Indicators.Indicator' Sq1.Core.DataTypes.Quote' Sq1.Core.Execution.Alert' Sq1.Core.Execution.Position' Sq1.Core.Execution.Direction' Sq1.Core.Execution.MarketLimitStop' Sq1.Core.Execution.PositionLongShort' Sq1.Core.StrategyBase.Strategy' Sq1.Core.Assembler' Sq1.Core.Backtesting.Backtester' Sq1.Core.StrategyBase.ScriptParameter' Sq1.Core.Indicators.IndicatorParameter' Sq1.Core.StrategyBase.ContextScript,Sq1.Core.Backtesting.Backtester' Sq1.Core.Broker.OrderProcessor' Sq1.Core.Broker.OrderProcessorDataSnapshot' Sq1.Core.Broker.OrderPostProcessorEmergencyLock' Sq1.Core.Repositories.RepositoryDllJsonStrategies' Sq1.Core.Sequencing.Sequencer' Sq1.Core.Sequencing.ReusableExecutor' Sq1.Core.StrategyBase.ScriptExecutor' Sq1.Core.StrategyBase.Strategy' Sq1.Core.StrategyBase.SystemPerformance' Sq1.Core.StrategyBase.ScriptCompiler' Sq1.Gui.Forms.ChartFormManager' Sq1.Gui.MainForm' Sq1.Gui.MainFormEventManager' Sq1.Gui.Singletons.SlidersForm' Sq1.Strategies.Demo.TwoMAindicatorsCompiled' Sq1.Strategies.Demo.TwoMAsCompiled' Sq1.Strategies.Demo.StopLimitTestCompiled' Sq1.Strategies.Demo.EnterEveryBarCompiled' Sq1.Widgets.Sequencing.SequencerControl
Sq1.Core.StrategyBase,ScriptExecutor,9,51,19,5,34,1821,225,1,0,0,46,50,Sq1.Core.DataTypes.Bars' Sq1.Core.DataFeed.DataSource' Sq1.Core.DataTypes.Quote' Sq1.Core.DataTypes.Bar' Sq1.Core.Backtesting.Backtester' Sq1.Core.CommissionCalculator' Sq1.Core.Charting.ChartShadow' Sq1.Core.StrategyBase.Strategy' Sq1.Core.Assembler' Sq1.Core.StrategyBase.Script' Sq1.Core.Indicators.Indicator' Sq1.Core.StrategyBase.ScriptExecutorEventGenerator' Sq1.Core.DataTypes.DataSeriesTimeBased' Sq1.Core.Execution.ExecutorDataSnapshot' Sq1.Core.StrategyBase.SystemPerformance' Sq1.Core.Sequencing.Sequencer' Sq1.Core.Execution.Alert' Sq1.Core.Support.ConcurrentWatchdog' Sq1.Core.Execution.AlertList' Sq1.Core.Broker.OrderProcessor' Sq1.Core.Execution.Position' Sq1.Core.Execution.PositionList' Sq1.Core.Execution.PositionPrototype' Sq1.Core.Execution.ReporterPokeUnit' Sq1.Core.Streaming.StreamingDataSnapshot' Sq1.Core.Streaming.StreamingAdapter' Sq1.Core.StrategyBase.PositionPrototypeActivator' Sq1.Core.Livesim.Livesimulator' Sq1.Core.Execution.Order' Sq1.Core.DataTypes.SymbolInfo' Sq1.Core.DataTypes.MarketInfo' Sq1.Core.Livesim.LivesimBroker' Sq1.Core.StrategyBase.AlertFactory' Sq1.Core.Execution.Direction' Sq1.Core.Execution.MarketLimitStop' Sq1.Core.Charting.OnChart.OnChartObjectOperationStatus' Sq1.Core.Charting.HostPanelForIndicator' Sq1.Core.StrategyBase.ContextScript' Sq1.Core.Backtesting.BacktestBroker' Sq1.Core.Backtesting.BacktestDataSource' Sq1.Core.Execution.OrderState' Sq1.Core.Charting.StreamingConsumerChart' Sq1.Core.DataFeed.DataSourceSymbolRenamedEventArgs' Sq1.Core.DataTypes.SecurityType' Sq1.Core.Execution.PositionSize' Sq1.Core.Execution.PositionSizeMode,Sq1.Charting.ChartControl' Sq1.Core.CommissionCalculator' Sq1.Core.Backtesting.Backtester' Sq1.Core.Backtesting.BacktestStreamingConsumer' Sq1.Core.Backtesting.BacktestMarketsim' Sq1.Core.Backtesting.BacktestBroker' Sq1.Core.Backtesting.BacktestStreaming' Sq1.Core.Backtesting.BacktestQuotesGenerator' Sq1.Core.Broker.CommissionCalculatorZero' Sq1.Core.Broker.OrderProcessor' Sq1.Core.Broker.OrderProcessorDataSnapshot' Sq1.Core.Charting.ChartShadow' Sq1.Core.Charting.StreamingConsumerChart' Sq1.Core.Correlation.MomentumsCalculator' Sq1.Core.Correlation.Correlator' Sq1.Core.DataFeed.DataSource' Sq1.Core.Livesim.LivesimBroker' Sq1.Core.Livesim.LivesimStreamingConsumer' Sq1.Core.Livesim.LivesimStreaming' Sq1.Core.Livesim.Livesimulator' Sq1.Core.Livesim.LivesimDataSource' Sq1.Core.Sequencing.SequencedBacktests' Sq1.Core.Sequencing.Sequencer' Sq1.Core.Sequencing.ReusableExecutor' Sq1.Core.Sequencing.ReusableExecutorsPool' Sq1.Core.Sequencing.SystemPerformanceRestoreAble' Sq1.Core.Execution.ExecutorDataSnapshot' Sq1.Core.Indicators.Indicator' Sq1.Core.Indicators.IndicatorAtrBand' Sq1.Core.Indicators.IndicatorMovingAverageSimple' Sq1.Core.StrategyBase.PositionPrototypeActivator' Sq1.Core.StrategyBase.Script' Sq1.Core.StrategyBase.ScriptExecutorEventGenerator' Sq1.Core.StrategyBase.SystemPerformance' Sq1.Core.StrategyBase.AlertFactory' Sq1.Core.Streaming.StreamingAdapter' Sq1.Gui.Forms.CorrelatorForm' Sq1.Gui.Forms.ChartForm' Sq1.Gui.Forms.ChartFormManager' Sq1.Gui.Forms.ChartFormInterformEventsConsumer' Sq1.Gui.Forms.LivesimForm' Sq1.Gui.Forms.SequencerForm' Sq1.Gui.MainForm' Sq1.Gui.MainFormEventManager' Sq1.Gui.ReportersSupport.ReportersFormsManager' Sq1.Strategies.Demo.TwoMAindicatorsCompiled' Sq1.Strategies.Demo.TwoMAsCompiled' Sq1.Strategies.Demo.StopLimitTestCompiled' Sq1.Strategies.Demo.EnterEveryBarCompiled' Sq1.Widgets.Sequencing.SequencerControl
Sq1.Core.StrategyBase,SystemPerformancePositionsTracking,0,0,0,0,0,7,0,0,0,-1,0,2,,Sq1.Core.StrategyBase.SystemPerformance' Sq1.Core.StrategyBase.SystemPerformanceSlice
Sq1.Core.StrategyBase,Reporter,2,12,3,1,11,82,14,2,0,0.5,6,5,Sq1.Core.Charting.ChartShadow' Sq1.Core.Assembler' Sq1.Core.StrategyBase.SystemPerformance' Sq1.Core.DataTypes.SymbolInfo' Sq1.Core.DataTypes.Bars' Sq1.Core.Execution.ReporterPokeUnit,Sq1.Core.StrategyBase.ContextScript' Sq1.Gui.ReportersSupport.ReportersFormsManager' Sq1.Gui.ReportersSupport.ReporterFormWrapper' Sq1.Reporters.Performance' Sq1.Reporters.Positions
Sq1.Core.StrategyBase,ScriptParameterEventArgs,0,1,1,0,1,5,1,0,1,-1,1,0,Sq1.Core.StrategyBase.ScriptParameter,
