Namespace,Type,NOF,NOM,NOP,NOPF,NOPM,LOC,WMC,NC,DIT,LCOM,Fan-Out,Fan-In,Fan-Out types,Fan-In types
Sq1.Core.Accounting,Account,4,4,1,4,4,24,4,0,0,0.5,3,6,Newtonsoft.Json.JsonPropertyAttribute' Newtonsoft.Json.JsonIgnoreAttribute' Sq1.Core.Broker.BrokerAdapter,Sq1.Core.Backtesting.BacktestBroker' Sq1.Core.Broker.BrokerAdapter' Sq1.Core.Broker.OrderProcessor' Sq1.Core.Livesim.LivesimBroker' Sq1.Core.Repositories.RepositoryJsonDataSources' Sq1.Core.Execution.Alert
Sq1.Core,Assembler,27,12,7,26,10,296,22,0,0,0,13,176,Sq1.Core.Repositories.RepositorySerializerSymbolInfos' Sq1.Core.Repositories.RepositorySerializerMarketInfos' Sq1.Core.Repositories.RepositoryDllJsonStrategies' Sq1.Core.Repositories.RepositoryJsonDataSources' Sq1.Core.Repositories.RepositoryDllStreamingAdapters' Sq1.Core.Repositories.RepositoryDllBrokerAdapters' Sq1.Core.Repositories.RepositoryDllReporters' Sq1.Core.Repositories.RepositoryFoldersNoJson' Sq1.Core.Broker.OrderProcessor' Sq1.Core.Support.IStatusReporter' Sq1.Core.AssemblerDataSnapshot' Sq1.Core.Repositories.RepositoryJsonChartSettingsTemplates' Sq1.Core.DataTypes.ConnectionState,Sq1.Charting.ChartControl' Sq1.Charting.PanelBase' Sq1.Charting.PanelIndicator' Sq1.Charting.PanelLevel2' Sq1.Charting.PanelPrice' Sq1.Charting.PanelVolume' Sq1.Charting.ExecutorObjects_FrozenForRendering' Sq1.Charting.ChartSettingsEditorControl' Sq1.Charting.TooltipPosition' Sq1.Charting.TooltipPrice' Sq1.Charting.Demo.ExceptionsForm' Sq1.Charting.Demo.TestMultiSplit' Sq1.Charting.Demo.TestPanels' Sq1.Charting.Demo.TestChartForm' Sq1.Charting.MultiSplit.MultiSplitContainerGeneric<PANEL_BASE>' Sq1.Charting.MultiSplit.MultiSplitContainer' Sq1.Charting.MultiSplit.MultiSplitter' Sq1.Core.Backtesting.Backtester' Sq1.Core.Backtesting.BacktestStreamingConsumer' Sq1.Core.Backtesting.BacktestMarketsim' Sq1.Core.Backtesting.BacktestSpreadModeler' Sq1.Core.Backtesting.BacktestSpreadModelerPercentage' Sq1.Core.Backtesting.BacktestQuotesGenerator' Sq1.Core.Broker.BrokerAdapter' Sq1.Core.Broker.BrokerEditor' Sq1.Core.Broker.OrderProcessor' Sq1.Core.Broker.OrdersAutoTree' Sq1.Core.Broker.OrderLane' Sq1.Core.Broker.OrderProcessorDataSnapshot' Sq1.Core.Broker.OrderPostProcessorEmergency' Sq1.Core.Broker.OrderPostProcessorRejected' Sq1.Core.Charting.ChartShadow' Sq1.Core.Charting.StreamingConsumerChart' Sq1.Core.Charting.DictionaryManyToOne<CHART;ALERTS>' Sq1.Core.Charting.MultiSplitterProperties' Sq1.Core.Correlation.KPIsCalculator' Sq1.Core.Correlation.MomentumsCalculator' Sq1.Core.Correlation.KPIsMomentum' Sq1.Core.Correlation.KPIsAveraged' Sq1.Core.Correlation.OneParameterAllValuesAveraged' Sq1.Core.Correlation.OneParameterOneValue' Sq1.Core.Correlation.Correlator' Sq1.Core.DataFeed.DataSource' Sq1.Core.DataTypes.SymbolInfo' Sq1.Core.DataTypes.Bar' Sq1.Core.DataTypes.Bars' Sq1.Core.DataTypes.BarsUnscaled' Sq1.Core.DataTypes.DataSeriesBasic' Sq1.Core.DataTypes.MarketInfo' Sq1.Core.DataTypes.Quote' Sq1.Core.Livesim.LivesimBroker' Sq1.Core.Livesim.LevelTwoGenerator' Sq1.Core.Livesim.LivesimStreamingConsumer' Sq1.Core.Livesim.LivesimStreaming' Sq1.Core.Livesim.Livesimulator' Sq1.Core.Livesim.LivesimDataSource' Sq1.Core.Livesim.LivesimBrokerEditor' Sq1.Core.Livesim.LivesimStreamingEditor' Sq1.Core.Livesim.LivesimBrokerDataSnapshot' Sq1.Core.Repositories.DllScanner<T>' Sq1.Core.Repositories.RepositoryJsonsInFolderSimpleDictionary<SYSTEM_PERFORMANCE_RESTORE_ABLE>' Sq1.Core.Repositories.RepositoryJsonsInFolderSimpleDictionarySorted<SYSTEM_PERFORMANCE_RESTORE_ABLE>' Sq1.Core.Repositories.RepositoryJsonCorrelator' Sq1.Core.Repositories.RepositoryBarsFile' Sq1.Core.Repositories.RepositoryJsonsInFolderSimple<SYSTEM_PERFORMANCE_RESTORE_ABLE>' Sq1.Core.Repositories.RepositoryJsonsInFolderSimpleDictionarySequencer' Sq1.Core.Repositories.RepositoryBarsSameScaleInterval' Sq1.Core.Repositories.RepositoryJsonDataSources' Sq1.Core.Repositories.RepositoryJsonsInFolder<DATASOURCE>' Sq1.Core.Repositories.RepositorySerializerSymbolInfos' Sq1.Core.Repositories.RepositoryDllJsonStrategies' Sq1.Core.Repositories.RepositoryFoldersNoJson' Sq1.Core.Sequencing.SequencedBacktests' Sq1.Core.Sequencing.Sequencer' Sq1.Core.Sequencing.ReusableExecutor' Sq1.Core.Sequencing.ReusableExecutorsPool' Sq1.Core.Sequencing.ParametersSequencer' Sq1.Core.Sequencing.SystemPerformanceRestoreAble' Sq1.Core.DoubleBuffered.PanelDoubleBuffered' Sq1.Core.DoubleBuffered.UserControlDoubleBuffered' Sq1.Core.Execution.AlertList' Sq1.Core.Execution.ExecutorDataSnapshot' Sq1.Core.Execution.PositionList' Sq1.Core.Execution.Alert' Sq1.Core.Execution.ReporterPokeUnit' Sq1.Core.Execution.Order' Sq1.Core.Execution.OrderStateMessage' Sq1.Core.Indicators.HelperSeries.MovingAverageSimple' Sq1.Core.Indicators.HelperSeries.TrueRangeSeries' Sq1.Core.Indicators.Indicator' Sq1.Core.Indicators.IndicatorAtrBand' Sq1.Core.Indicators.IndicatorMovingAverageSimple' Sq1.Core.Serializers.SerializerLogrotate<T>' Sq1.Core.Serializers.SerializerLogrotatePeriodic<T>' Sq1.Core.Serializers.Serializer<T>' Sq1.Core.StrategyBase.ContextScript' Sq1.Core.StrategyBase.KPIs' Sq1.Core.StrategyBase.PositionPrototypeActivator' Sq1.Core.StrategyBase.Script' Sq1.Core.StrategyBase.ScriptExecutor' Sq1.Core.StrategyBase.Reporter' Sq1.Core.StrategyBase.Strategy' Sq1.Core.StrategyBase.ScriptExecutorEventGenerator' Sq1.Core.StrategyBase.SystemPerformance' Sq1.Core.StrategyBase.SystemPerformanceSlice' Sq1.Core.StrategyBase.ScriptCompiler' Sq1.Core.Streaming.BinderAttacher_perStreamingChart' Sq1.Core.Streaming.Distributor<STREAMING_CONSUMER_CHILD>' Sq1.Core.Streaming.LevelTwoFrozen' Sq1.Core.Streaming.DistributorCharts' Sq1.Core.Streaming.DistributorSolidifier' Sq1.Core.Streaming.LevelTwo' Sq1.Core.Streaming.LevelTwoHalfSortedFrozen' Sq1.Core.Streaming.StreamingAdapter' Sq1.Core.Streaming.PumpPerSymbol<QUOTE;STREAMING_CONSUMER_CHILD>' Sq1.Core.Streaming.QueuePerSymbol<QUOTE;STREAMING_CONSUMER_CHILD>' Sq1.Core.Streaming.SymbolScaleStreamSolidifier' Sq1.Core.Streaming.SolidifierBarsEmulator' Sq1.Core.Streaming.StreamingEditor' Sq1.Core.Streaming.StreamingConsumerSolidifier' Sq1.Core.Streaming.SymbolChannel<STREAMING_CONSUMER_CHILD>' Sq1.Core.Streaming.SymbolScaleStream<STREAMING_CONSUMER_CHILD>' Sq1.Core.Streaming.StreamingConsumer' Sq1.Core.Streaming.StreamingDataSnapshot' Sq1.Core.Support.ConcurrentDictionary<PRICE_LEVEL;TOTAL_LOTS>' Sq1.Core.Support.ConcurrentList<T>' Sq1.Core.Support.ConcurrentWatchdog' Sq1.Core.Support.TimeredBlock' Sq1.Core.Support.TimeredBlockTask' Sq1.Gui.FormFactories.SequencerFormFactory' Sq1.Gui.FormFactories.ScriptEditorFormFactory' Sq1.Gui.Forms.CorrelatorForm' Sq1.Gui.Forms.ChartForm' Sq1.Gui.Forms.ChartFormManager' Sq1.Gui.Forms.ChartFormInterformEventsConsumer' Sq1.Gui.Forms.LivesimForm' Sq1.Gui.Forms.SequencerForm' Sq1.Gui.MainForm' Sq1.Gui.MainFormEventManager' Sq1.Gui.MainFormWorkspacesManager' Sq1.Gui.ReportersSupport.ReportersFormsManager' Sq1.Gui.ReportersSupport.MenuItemsProvider' Sq1.Gui.Singletons.DataSourceEditorForm' Sq1.Gui.Singletons.ExecutionForm' Sq1.Gui.Singletons.ExceptionsForm' Sq1.Reporters.Performance' Sq1.Reporters.Positions' Sq1.Strategies.Demo.TwoMAsCompiled' Sq1.Strategies.Demo.StopLimitTestCompiled' Sq1.Strategies.Demo.EnterEveryBarCompiled' Sq1.Widgets.Correlation.CorrelatorControl' Sq1.Widgets.Correlation.OneParameterControl' Sq1.Widgets.CsvImporter.ColumnCatcher' Sq1.Widgets.CsvImporter.CsvImporterControl' Sq1.Widgets.CsvImporter.ImportSourceFileBrowser' Sq1.Widgets.DataSourceEditor.DataSourceEditorControl' Sq1.Widgets.DataSourceEditor.MarketInfoEditor' Sq1.Widgets.DataSourcesTree.DataSourcesTreeControl' Sq1.Widgets.DockContentImproved' Sq1.Widgets.Exceptions.ExceptionsControl' Sq1.Widgets.Exceptions.UserControlImproved' Sq1.Widgets.Execution.ExecutionTreeControl' Sq1.Widgets.FuturesMerger.BarsEditorUserControl' Sq1.Widgets.Level2.LevelTwoUserControl' Sq1.Widgets.RangeBar.RangeBar<T>' Sq1.Widgets.RangeBar.AsyncGraphBuilder<T>' Sq1.Widgets.Sequencing.SequencerControl' Sq1.Widgets.ScriptEditor.ScriptEditor' Sq1.Widgets.SteppingSlider.NumericUpDownWithMouseEvents' Sq1.Widgets.SteppingSlider.PanelFillSlider' Sq1.Widgets.SteppingSlider.SteppingSliderComboControl' Sq1.Widgets.SteppingSlider.SteppingSlidersAutoGrowControl' Sq1.Widgets.ToolStripImproved.ToolStripItemComboBox' Sq1.Widgets.ToolStripImproved.ToolStripItemWalkForward' Sq1.Widgets.StrategiesTree.StrategiesTreeControl' Sq1.Widgets.SymbolEditor.SymbolInfoEditorControl
Sq1.Core,AssemblerDataSnapshot,2,1,7,2,1,41,1,0,0,0,1,10,Newtonsoft.Json.JsonPropertyAttribute,Sq1.Core.Assembler' Sq1.Core.StrategyBase.ScriptCompiler' Sq1.Gui.Forms.ChartFormManager' Sq1.Gui.MainForm' Sq1.Gui.MainFormWorkspacesManager' Sq1.Widgets.CsvImporter.CsvImporterControl' Sq1.Widgets.DataSourcesTree.DataSourcesTreeControl' Sq1.Widgets.Exceptions.ExceptionsControl' Sq1.Widgets.Execution.ExecutionTreeControl' Sq1.Widgets.StrategiesTree.StrategiesTreeControl
Sq1.Core,CommissionCalculator,1,3,2,1,3,12,3,1,0,1,4,1,Sq1.Core.StrategyBase.ScriptExecutor' Sq1.Core.Execution.Direction' Sq1.Core.Execution.MarketLimitStop' Sq1.Core.DataTypes.Bars,Sq1.Core.StrategyBase.ScriptExecutor
Sq1.Core.Backtesting,Backtester,5,15,19,3,10,455,64,1,0,0.2,25,26,Sq1.Core.Backtesting.BacktestStreamingConsumer' Sq1.Core.StrategyBase.ScriptExecutor' Sq1.Core.DataTypes.Bars' Sq1.Core.Backtesting.BacktestQuotesGeneratorFourStroke' Sq1.Core.StrategyBase.ContextScript' Sq1.Core.StrategyBase.Strategy' Sq1.Core.DataTypes.Bar' Sq1.Core.StrategyBase.ScriptExecutorEventGenerator' Sq1.Core.Livesim.Livesimulator' Sq1.Core.Assembler' Sq1.Core.Execution.Alert' Sq1.Core.Execution.AlertList' Sq1.Core.Execution.ExecutorDataSnapshot' Sq1.Core.Execution.PositionList' Sq1.Core.StrategyBase.Script' Sq1.Core.Execution.Position' Sq1.Core.Backtesting.BacktestSpreadModeler' Sq1.Core.Streaming.StreamingAdapter' Sq1.Core.Streaming.DistributorCharts' Sq1.Core.Charting.ChartShadow' Sq1.Core.Backtesting.BacktestDataSource' Sq1.Core.DataFeed.DataSource' Sq1.Core.Backtesting.BacktestQuotesGenerator' Sq1.Core.Backtesting.QuoteGenerated' Sq1.Core.Backtesting.BacktestStreaming,Sq1.Charting.ChartControl' Sq1.Core.Backtesting.BacktestStreamingConsumer' Sq1.Core.Backtesting.BacktestMarketsim' Sq1.Core.Backtesting.BacktestQuotesGenerator' Sq1.Core.Broker.OrderProcessor' Sq1.Core.Broker.OrderProcessorDataSnapshot' Sq1.Core.Charting.StreamingConsumerChart' Sq1.Core.Livesim.LivesimBroker' Sq1.Core.Livesim.Livesimulator' Sq1.Core.Sequencing.ReusableExecutor' Sq1.Core.Sequencing.ReusableExecutorsPool' Sq1.Core.Execution.ExecutorDataSnapshot' Sq1.Core.Execution.Position' Sq1.Core.Indicators.Indicator' Sq1.Core.Indicators.IndicatorAtrBand' Sq1.Core.Indicators.IndicatorMovingAverageSimple' Sq1.Core.StrategyBase.PositionPrototypeActivator' Sq1.Core.StrategyBase.Script' Sq1.Core.StrategyBase.ScriptExecutor' Sq1.Core.StrategyBase.SystemPerformance' Sq1.Core.Streaming.SymbolChannel<STREAMING_CONSUMER_CHILD>' Sq1.Gui.Forms.ChartForm' Sq1.Gui.Forms.ChartFormInterformEventsConsumer' Sq1.Strategies.Demo.TwoMAsCompiled' Sq1.Strategies.Demo.StopLimitTestCompiled' Sq1.Strategies.Demo.EnterEveryBarCompiled
Sq1.Core.Backtesting,BacktestStreamingConsumer,1,6,2,0,6,69,12,0,1,0.5,12,2,Sq1.Core.Backtesting.Backtester' Sq1.Core.Charting.StreamingConsumerChart' Sq1.Core.DataTypes.Quote' Sq1.Core.Execution.ExecutorDataSnapshot' Sq1.Core.Execution.ReporterPokeUnit' Sq1.Core.StrategyBase.ScriptExecutor' Sq1.Core.Execution.AlertList' Sq1.Core.Backtesting.BacktestMarketsim' Sq1.Core.Backtesting.BacktestBroker' Sq1.Core.DataFeed.DataSource' Sq1.Core.Assembler' Sq1.Core.DataTypes.Bar,Sq1.Core.Backtesting.Backtester' Sq1.Core.Streaming.Distributor<STREAMING_CONSUMER_CHILD>
Sq1.Core.Backtesting,BacktestQuotesGeneratorFourStroke,0,2,0,0,1,34,3,0,1,-1,2,1,Sq1.Core.DataTypes.Bar' Sq1.Core.DataTypes.BidOrAsk,Sq1.Core.Backtesting.Backtester
Sq1.Core.Backtesting,BacktestQuotesGeneratorTenStroke,0,2,0,0,1,108,3,0,1,-1,3,0,Sq1.Core.DataTypes.Bar' Sq1.Core.DataTypes.BidOrAsk' Sq1.Core.Backtesting.BacktestQuotesGenerator,
Sq1.Core.Backtesting,BacktestQuotesGeneratorSixteenStroke,0,2,0,0,1,82,5,0,1,-1,3,0,Sq1.Core.DataTypes.Bar' Sq1.Core.DataTypes.BidOrAsk' Sq1.Core.Backtesting.BacktestQuotesGenerator,
Sq1.Core.Backtesting,QuoteGenerated,2,5,3,2,5,149,8,0,1,0.4,4,9,Newtonsoft.Json.JsonIgnoreAttribute' Sq1.Core.DataTypes.BidOrAsk' Sq1.Core.DataTypes.Quote' Sq1.Core.DataTypes.Bar,Sq1.Core.Backtesting.Backtester' Sq1.Core.Backtesting.BacktestStreaming' Sq1.Core.Backtesting.BacktestSpreadModeler' Sq1.Core.Backtesting.BacktestSpreadModelerPercentage' Sq1.Core.Backtesting.BacktestQuotesGenerator' Sq1.Core.Livesim.LevelTwoGenerator' Sq1.Core.Livesim.LivesimStreaming' Sq1.Core.Streaming.StreamingConsumerSolidifier' Sq1.Strategies.Demo.TwoMAsCompiled
Sq1.Core.Backtesting,BacktestMarketsim,3,16,0,0,11,618,66,0,0,0,22,4,Sq1.Core.Broker.BrokerAdapter' Sq1.Core.StrategyBase.ScriptExecutor' Sq1.Core.Execution.Alert' Sq1.Core.DataTypes.Quote' Sq1.Core.Streaming.StreamingDataSnapshot' Sq1.Core.DataTypes.Bars' Sq1.Core.Execution.MarketLimitStop' Sq1.Core.Execution.Direction' Sq1.Core.Streaming.StreamingAdapter' Sq1.Core.DataFeed.DataSource' Sq1.Core.Execution.Position' Sq1.Core.Backtesting.Backtester' Sq1.Core.Assembler' Sq1.Core.DataTypes.Bar' Sq1.Core.Execution.AlertList' Sq1.Core.Execution.ExecutorDataSnapshot' Sq1.Core.Execution.PositionPrototype' Sq1.Core.StrategyBase.ContextScript' Sq1.Core.StrategyBase.Strategy' Sq1.Core.Livesim.LivesimBroker' Sq1.Core.Backtesting.BacktestBroker' Sq1.Core.StrategyBase.PositionPrototypeActivator,Sq1.Core.Backtesting.BacktestStreamingConsumer' Sq1.Core.Backtesting.BacktestBroker' Sq1.Core.Livesim.LivesimBroker' Sq1.Core.Execution.ExecutorDataSnapshot
Sq1.Core.Backtesting,BacktestBroker,0,7,2,0,6,42,8,0,1,-1,7,5,Sq1.Core.Broker.BrokerAdapter' Sq1.Core.Accounting.Account' Sq1.Core.Backtesting.BacktestMarketsim' Sq1.Core.StrategyBase.ScriptExecutor' Sq1.Core.Execution.PositionPrototype' Sq1.Core.Execution.Order' Sq1.Core.Execution.Alert,Sq1.Core.Backtesting.BacktestStreamingConsumer' Sq1.Core.Backtesting.BacktestMarketsim' Sq1.Core.Sequencing.ReusableExecutor' Sq1.Core.Execution.ExecutorDataSnapshot' Sq1.Core.StrategyBase.ScriptExecutor
Sq1.Core.Backtesting,BacktestDataSource,0,3,0,0,3,26,4,1,1,-1,7,6,Sq1.Core.DataFeed.DataSource' Sq1.Core.DataTypes.Bars' Sq1.Core.Streaming.StreamingAdapter' Sq1.Core.Backtesting.BacktestStreaming' Sq1.Core.Broker.BrokerAdapter' Sq1.Core.Backtesting.BacktestSpreadModeler' Sq1.Core.DataTypes.BarScaleInterval,Sq1.Core.Backtesting.Backtester' Sq1.Core.Backtesting.BacktestQuotesGenerator' Sq1.Core.Livesim.LivesimDataSource' Sq1.Core.Sequencing.ReusableExecutor' Sq1.Core.Indicators.IndicatorAtrBand' Sq1.Core.StrategyBase.ScriptExecutor
Sq1.Core.Backtesting,BacktestStreaming,2,9,0,2,8,68,11,1,1,0.89,6,7,Newtonsoft.Json.JsonIgnoreAttribute' Sq1.Core.Streaming.StreamingAdapter' Sq1.Core.Backtesting.QuoteGenerated' Sq1.Core.DataFeed.DataSource' Sq1.Core.StrategyBase.ScriptExecutor' Sq1.Core.DataTypes.Bars,Sq1.Core.Backtesting.Backtester' Sq1.Core.Backtesting.BacktestDataSource' Sq1.Core.Backtesting.BacktestQuotesGenerator' Sq1.Core.DataFeed.DataSource' Sq1.Core.Livesim.LivesimStreaming' Sq1.Core.Indicators.IndicatorAtrBand' Sq1.Core.StrategyBase.ContextScript
Sq1.Core.Backtesting,BacktestStrokesPerBar,0,0,0,0,0,7,0,0,0,-1,0,3,,Sq1.Core.Backtesting.BacktestQuotesGenerator' Sq1.Core.StrategyBase.ContextScript' Sq1.Gui.Forms.ChartForm
Sq1.Core.Backtesting,BacktestSpreadModeler,1,7,0,1,5,164,27,1,0,0,6,7,Sq1.Core.Backtesting.QuoteGenerated' Sq1.Core.DataTypes.Bar' Sq1.Core.Assembler' Sq1.Core.DataTypes.BidOrAsk' Sq1.Core.DataTypes.SymbolInfo' Sq1.Core.DataTypes.Bars,Sq1.Core.Backtesting.Backtester' Sq1.Core.Backtesting.BacktestDataSource' Sq1.Core.Backtesting.BacktestSpreadModelerPercentage' Sq1.Core.Backtesting.BacktestQuotesGenerator' Sq1.Core.Livesim.Livesimulator' Sq1.Core.Livesim.LivesimDataSource' Sq1.Core.Indicators.IndicatorAtrBand
Sq1.Core.Backtesting,BacktestSpreadModelerPercentage,2,5,0,0,5,107,11,0,1,0,5,1,Sq1.Core.DataTypes.SymbolInfo' Sq1.Core.Backtesting.QuoteGenerated' Sq1.Core.Backtesting.BacktestSpreadModeler' Sq1.Core.Assembler' Sq1.Core.DataTypes.Bar,Sq1.Core.StrategyBase.ContextScript
Sq1.Core.Backtesting,BacktestQuotesGenerator,6,9,2,3,3,587,57,3,0,0,23,5,Sq1.Core.Backtesting.BacktestStrokesPerBar' Sq1.Core.Backtesting.Backtester' Sq1.Core.Backtesting.QuoteGenerated' Sq1.Core.Backtesting.BacktestSpreadModeler' Sq1.Core.DataTypes.SymbolInfo' Sq1.Core.DataTypes.Bars' Sq1.Core.Backtesting.BacktestStreaming' Sq1.Core.Backtesting.BacktestDataSource' Sq1.Core.DataTypes.BidOrAsk' Sq1.Core.Assembler' Sq1.Core.DataTypes.Bar' Sq1.Core.Execution.AlertList' Sq1.Core.Execution.ExecutorDataSnapshot' Sq1.Core.StrategyBase.ScriptExecutor' Sq1.Core.Livesim.LivesimBrokerSettings' Sq1.Core.StrategyBase.Strategy' Sq1.Core.DataTypes.Quote' Sq1.Core.Streaming.StreamingDataSnapshot' Sq1.Core.Execution.Alert' Sq1.Core.Execution.MarketLimitStop' Sq1.Core.Execution.Direction' Sq1.Core.DataTypes.MarketInfo' Sq1.Core.DataTypes.MarketClearingTimespan,Sq1.Core.Backtesting.Backtester' Sq1.Core.Backtesting.BacktestQuotesGeneratorTenStroke' Sq1.Core.Backtesting.BacktestQuotesGeneratorSixteenStroke' Sq1.Core.Livesim.Livesimulator' Sq1.Gui.Forms.ChartForm
Sq1.Core.Broker,BrokerAdapter,5,26,16,1,25,616,61,2,0,0.62,27,19,Newtonsoft.Json.JsonIgnoreAttribute' Newtonsoft.Json.JsonPropertyAttribute' Sq1.Core.DataFeed.IDataSourceEditor' Sq1.Core.Assembler' Sq1.Core.Accounting.Account' Sq1.Core.DataTypes.ConnectionState' Sq1.Core.DataFeed.DataSource' Sq1.Core.Streaming.StreamingAdapter' Sq1.Core.Broker.OrderProcessor' Sq1.Core.Execution.Order' Sq1.Core.Execution.PositionPrototype' Sq1.Core.Execution.OrderState' Sq1.Core.Execution.OrderStateMessage' Sq1.Core.Execution.Alert' Sq1.Core.Execution.Position' Sq1.Core.Execution.MarketLimitStop' Sq1.Core.Broker.OrderLane' Sq1.Core.DataTypes.SymbolInfo' Sq1.Core.DataTypes.Bars' Sq1.Core.Broker.OrderLaneByState' Sq1.Core.Broker.OrderProcessorDataSnapshot' Sq1.Core.StrategyBase.Strategy' Sq1.Core.Broker.OrderPostProcessorEmergency' Sq1.Core.Streaming.StreamingDataSnapshot' Sq1.Core.Execution.MarketOrderAs' Sq1.Core.Execution.SpreadSide' Sq1.Core.Execution.Direction,Sq1.Core.Accounting.Account' Sq1.Core.Backtesting.BacktestMarketsim' Sq1.Core.Backtesting.BacktestBroker' Sq1.Core.Backtesting.BacktestDataSource' Sq1.Core.Broker.BrokerEditor' Sq1.Core.Broker.OrderProcessor' Sq1.Core.Broker.OrderCallbackDupesChecker' Sq1.Core.Broker.OrderCallbackDupesCheckerTransparent' Sq1.Core.Broker.OrderPostProcessorReplacerTidalThenCrossMarket' Sq1.Core.Broker.OrderPostProcessorSequencerCloseThenOpen' Sq1.Core.Broker.OrderPostProcessorEmergency' Sq1.Core.Broker.OrderPostProcessorRejected' Sq1.Core.DataFeed.DataSource' Sq1.Core.Livesim.LivesimBroker' Sq1.Core.Livesim.LivesimBrokerEditorEmpty' Sq1.Core.Livesim.LivesimDataSource' Sq1.Core.Execution.Alert' Sq1.Core.StrategyBase.PositionPrototypeActivator' Sq1.Widgets.DataSourceEditor.DataSourceEditorControl
Sq1.Core.Broker,BrokerEditor,3,6,0,0,4,30,6,2,0,0.5,3,3,Sq1.Core.Broker.BrokerAdapter' Sq1.Core.DataFeed.IDataSourceEditor' Sq1.Core.Assembler,Sq1.Core.Livesim.LivesimBrokerEditorEmpty' Sq1.Core.Livesim.LivesimBrokerEditor' Sq1.Widgets.DataSourceEditor.DataSourceEditorControl
Sq1.Core.Broker,CommissionCalculatorZero,0,2,1,0,2,8,2,0,1,-1,4,0,Sq1.Core.StrategyBase.ScriptExecutor' Sq1.Core.Execution.Direction' Sq1.Core.Execution.MarketLimitStop' Sq1.Core.DataTypes.Bars,
Sq1.Core.Broker,OrderProcessor,1,38,5,1,27,1157,134,0,0,0.21,34,17,Sq1.Core.Execution.Alert' Sq1.Core.Execution.Order' Sq1.Core.Execution.Direction' Sq1.Core.Assembler' Sq1.Core.Broker.OrderLane' Sq1.Core.Execution.OrderState' Sq1.Core.Execution.OrderStateMessage' Sq1.Core.Broker.OrderLaneByState' Sq1.Core.Broker.OrderProcessorDataSnapshot' Sq1.Core.Execution.MarketLimitStop' Sq1.Core.DataTypes.SymbolInfo' Sq1.Core.DataTypes.Bars' Sq1.Core.Execution.MarketOrderAs' Sq1.Core.StrategyBase.ScriptExecutor' Sq1.Core.StrategyBase.Script' Sq1.Core.StrategyBase.Strategy' Sq1.Core.Execution.PositionLongShort' Sq1.Core.Broker.BrokerAdapter' Sq1.Core.Backtesting.Backtester' Sq1.Core.DataFeed.DataSource' Sq1.Core.Broker.OrderPostProcessorSequencerCloseThenOpen' Sq1.Core.Broker.OrderPostProcessorStateHook' Sq1.Core.Execution.PositionPrototype' Sq1.Core.Broker.OrderPostProcessorStateChangedTrigger' Sq1.Core.Execution.Position' Sq1.Core.StrategyBase.PositionPrototypeActivator' Sq1.Core.Execution.AlertList' Sq1.Core.Execution.ReporterPokeUnit' Sq1.Core.Execution.OrderStatesCollections' Sq1.Core.DataTypes.BarScaleInterval' Sq1.Core.Execution.OrderEventArgs' Sq1.Core.Accounting.Account' Sq1.Core.Broker.OrderPostProcessorEmergency' Sq1.Core.Broker.OrderPostProcessorRejected,Sq1.Core.Assembler' Sq1.Core.Broker.BrokerAdapter' Sq1.Core.Broker.OrderProcessorDataSnapshot' Sq1.Core.Broker.OrderPostProcessorStateChangedTrigger' Sq1.Core.Broker.OrderPostProcessorReplacerTidalThenCrossMarket' Sq1.Core.Broker.OrderPostProcessorSequencerCloseThenOpen' Sq1.Core.Broker.OrderPostProcessorEmergency' Sq1.Core.Broker.OrderPostProcessorRejected' Sq1.Core.DataFeed.DataSource' Sq1.Core.Livesim.LivesimBroker' Sq1.Core.Livesim.LivesimBrokerDefault' Sq1.Core.Livesim.Livesimulator' Sq1.Core.Repositories.RepositoryJsonDataSources' Sq1.Core.StrategyBase.ScriptExecutor' Sq1.Gui.Singletons.ExecutionForm' Sq1.Widgets.DataSourceEditor.DataSourceEditorControl' Sq1.Widgets.Execution.ExecutionTreeControl
Sq1.Core.Broker,OrdersAutoTree,1,5,0,0,4,83,21,0,1,0.8,4,2,Sq1.Core.Broker.OrderLane' Sq1.Core.Execution.Order' Sq1.Core.Assembler' Sq1.Core.Execution.Alert,Sq1.Core.Broker.OrderProcessorDataSnapshot' Sq1.Widgets.Execution.ExecutionTreeControl
Sq1.Core.Broker,OrderLaneByType,1,4,0,0,2,27,6,0,1,0.5,2,0,Sq1.Core.Execution.Alert' Sq1.Core.Execution.Order,
Sq1.Core.Broker,OrderCallbackDupesChecker,1,2,0,0,2,8,2,1,0,1,3,0,Sq1.Core.Broker.BrokerAdapter' Sq1.Core.Execution.Order' Sq1.Core.Execution.OrderStateMessage,
Sq1.Core.Broker,OrderCallbackDupesCheckerTransparent,0,2,0,0,2,9,2,0,1,-1,3,0,Sq1.Core.Broker.BrokerAdapter' Sq1.Core.Execution.Order' Sq1.Core.Execution.OrderStateMessage,
Sq1.Core.Broker,OrderLane,3,19,6,0,15,223,27,3,0,0,6,9,Sq1.Core.Broker.OrderProcessorDataSnapshot' Sq1.Core.Broker.OrderLaneByState' Sq1.Core.Assembler' Sq1.Core.Execution.Order' Sq1.Core.Execution.OrderStatesCollections' Sq1.Core.Execution.Alert,Sq1.Core.Broker.BrokerAdapter' Sq1.Core.Broker.OrderProcessor' Sq1.Core.Broker.OrdersAutoTree' Sq1.Core.Broker.OrderLaneByState' Sq1.Core.Broker.OrderProcessorDataSnapshot' Sq1.Core.Broker.OrderPostProcessorEmergency' Sq1.Core.Broker.OrderPostProcessorRejected' Sq1.Core.Livesim.Livesimulator' Sq1.Gui.Singletons.ExecutionForm
Sq1.Core.Broker,OrderLaneByState,0,7,1,0,5,35,11,0,1,-1,4,5,Sq1.Core.Execution.OrderStatesCollections' Sq1.Core.Broker.OrderLane' Sq1.Core.Execution.Order' Sq1.Core.Execution.OrderState,Sq1.Core.Broker.BrokerAdapter' Sq1.Core.Broker.OrderProcessor' Sq1.Core.Broker.OrderLane' Sq1.Core.Broker.OrderProcessorDataSnapshot' Sq1.Gui.Singletons.ExecutionForm
Sq1.Core.Broker,OrderProcessorDataSnapshot,3,10,10,1,9,160,30,0,0,0.5,13,8,Sq1.Core.Broker.OrderProcessor' Sq1.Core.Execution.OrderStatesCollections' Sq1.Core.Execution.Order' Sq1.Core.Execution.OrderState' Sq1.Core.Broker.OrdersAutoTree' Sq1.Core.Assembler' Sq1.Core.Broker.OrderLane' Sq1.Core.Backtesting.Backtester' Sq1.Core.StrategyBase.ScriptExecutor' Sq1.Core.StrategyBase.Script' Sq1.Core.StrategyBase.Strategy' Sq1.Core.Execution.Alert' Sq1.Core.Broker.OrderLaneByState,Sq1.Core.Broker.BrokerAdapter' Sq1.Core.Broker.OrderProcessor' Sq1.Core.Broker.OrderLane' Sq1.Core.Broker.OrderPostProcessorEmergency' Sq1.Core.Broker.OrderPostProcessorRejected' Sq1.Core.Livesim.Livesimulator' Sq1.Gui.Singletons.ExecutionForm' Sq1.Widgets.Execution.ExecutionTreeControl
Sq1.Core.Broker,OrderPostProcessorStateChangedTrigger,3,4,0,0,4,57,4,0,0,0,4,1,Sq1.Core.Broker.OrderProcessor' Sq1.Core.Broker.OrderPostProcessorStateHook' Sq1.Core.Execution.Order' Sq1.Core.Execution.ReporterPokeUnit,Sq1.Core.Broker.OrderProcessor
Sq1.Core.Broker,OrderPostProcessorStateHook,2,3,4,2,3,26,3,0,0,1,2,2,Sq1.Core.Execution.Order' Sq1.Core.Execution.OrderState,Sq1.Core.Broker.OrderProcessor' Sq1.Core.Broker.OrderPostProcessorStateChangedTrigger
Sq1.Core.Broker,OrderPostProcessorReplacerTidalThenCrossMarket,3,3,0,0,3,50,4,0,0,0,7,0,Sq1.Core.Broker.OrderProcessor' Sq1.Core.Execution.OrderStateMessage' Sq1.Core.Execution.OrderState' Sq1.Core.Execution.Order' Sq1.Core.Broker.BrokerAdapter' Sq1.Core.DataFeed.DataSource' Sq1.Core.Execution.Alert,
Sq1.Core.Broker,OrderPostProcessorSequencerCloseThenOpen,3,4,0,0,4,77,4,0,0,0,9,2,Sq1.Core.Broker.OrderProcessor' Sq1.Core.Execution.OrderStateMessage' Sq1.Core.Execution.OrderState' Sq1.Core.Execution.Order' Sq1.Core.Execution.Alert' Sq1.Core.Broker.BrokerAdapter' Sq1.Core.DataFeed.DataSource' Sq1.Core.DataTypes.SymbolInfo' Sq1.Core.DataTypes.Bars,Sq1.Core.Broker.OrderProcessor' Sq1.Core.Broker.OrderPostProcessorEmergency
Sq1.Core.Broker,OrderPostProcessorEmergencyLock,3,5,0,3,5,41,8,0,0,0.4,4,1,Sq1.Core.Execution.Order' Sq1.Core.StrategyBase.Strategy' Sq1.Core.StrategyBase.Script' Sq1.Core.Execution.Alert,Sq1.Core.Broker.OrderPostProcessorEmergency
