Namespace,Type,NOF,NOM,NOP,NOPF,NOPM,LOC,WMC,NC,DIT,LCOM,Fan-Out,Fan-In,Fan-Out types,Fan-In types
Sq1.Core.Broker,OrderPostProcessorEmergency,4,17,0,0,6,269,37,0,0,0,18,3,Sq1.Core.Broker.OrderProcessor' Sq1.Core.Broker.OrderPostProcessorSequencerCloseThenOpen' Sq1.Core.Execution.Order' Sq1.Core.Broker.OrderPostProcessorEmergencyLock' Sq1.Core.Execution.OrderState' Sq1.Core.Execution.OrderStateMessage' Sq1.Core.Assembler' Sq1.Core.DataTypes.SymbolInfo' Sq1.Core.DataTypes.Bars' Sq1.Core.Execution.Alert' Sq1.Core.Broker.BrokerAdapter' Sq1.Core.Streaming.StreamingDataSnapshot' Sq1.Core.Streaming.StreamingAdapter' Sq1.Core.DataFeed.DataSource' Sq1.Core.Execution.Position' Sq1.Core.DataTypes.MarketInfo' Sq1.Core.Broker.OrderProcessorDataSnapshot' Sq1.Core.Broker.OrderLane,Sq1.Core.Broker.BrokerAdapter' Sq1.Core.Broker.OrderProcessor' Sq1.Widgets.Execution.ExecutionTreeControl
Sq1.Core.Broker,OrderPostProcessorRejected,1,7,0,0,7,140,24,0,0,0,15,1,Sq1.Core.Broker.OrderProcessor' Sq1.Core.Execution.Order' Sq1.Core.Execution.OrderState' Sq1.Core.DataTypes.SymbolInfo' Sq1.Core.DataTypes.Bars' Sq1.Core.Execution.Alert' Sq1.Core.Assembler' Sq1.Core.Streaming.StreamingDataSnapshot' Sq1.Core.Streaming.StreamingAdapter' Sq1.Core.DataFeed.DataSource' Sq1.Core.Execution.Position' Sq1.Core.Broker.OrderProcessorDataSnapshot' Sq1.Core.Broker.OrderLane' Sq1.Core.Execution.OrderStateMessage' Sq1.Core.Broker.BrokerAdapter,Sq1.Core.Broker.OrderProcessor
Sq1.Core.Charting,ChartSettings,38,8,139,3,8,729,49,0,1,0.62,2,9,Sq1.Core.DataFeed.NamedObjectJsonSerializable' Newtonsoft.Json.JsonPropertyAttribute,Sq1.Charting.ChartControl' Sq1.Charting.PanelBase' Sq1.Charting.PanelLevel2' Sq1.Charting.PanelPrice' Sq1.Charting.PanelVolume' Sq1.Charting.ChartSettingsEditorControl' Sq1.Core.Repositories.RepositoryJsonChartSettingsTemplates' Sq1.Gui.Forms.ChartFormDataSnapshot' Sq1.Gui.Singletons.ChartSettingsEditorForm
Sq1.Core.Charting,ChartShadow,3,38,9,2,29,328,67,1,1,0.76,14,16,Sq1.Core.StrategyBase.ContextChart' Sq1.Core.DataFeed.SymbolOfDataSource' Sq1.Core.Assembler' Sq1.Core.DataTypes.Bars' Sq1.Core.DataFeed.DataSource' Sq1.Core.DataTypes.BarEventArgs' Sq1.Core.DoubleBuffered.UserControlDoubleBuffered' Sq1.Core.StrategyBase.ScriptExecutor' Sq1.Core.Execution.Position' Sq1.Core.Execution.Alert' Sq1.Core.Execution.ReporterPokeUnit' Sq1.Core.Charting.OnChart.OnChartObjectOperationStatus' Sq1.Core.Indicators.Indicator' Sq1.Core.StrategyBase.Strategy,Sq1.Charting.ChartControl' Sq1.Core.Backtesting.Backtester' Sq1.Core.Charting.StreamingConsumerChart' Sq1.Core.Livesim.Livesimulator' Sq1.Core.Sequencing.ReusableExecutor' Sq1.Core.StrategyBase.ScriptExecutor' Sq1.Core.StrategyBase.Reporter' Sq1.Core.Streaming.BinderAttacher_perStreamingChart' Sq1.Core.Streaming.StreamingAdapter' Sq1.Core.Streaming.SymbolScaleStreamChart' Sq1.Gui.Forms.ChartFormManager' Sq1.Gui.Singletons.ExecutionForm' Sq1.Reporters.Performance' Sq1.Reporters.Positions' Sq1.Widgets.DataSourceTree.ChartSelectedEventArgs' Sq1.Widgets.DataSourcesTree.DataSourcesTreeControl
Sq1.Core.Charting,ChartPanelType,0,0,0,0,0,6,0,0,0,-1,0,5,,Sq1.Charting.ChartControl' Sq1.Core.Indicators.Indicator' Sq1.Core.Indicators.IndicatorAverageTrueRange' Sq1.Core.Indicators.IndicatorAtrBand' Sq1.Strategies.Demo.ATRbandCompiled
Sq1.Core.Charting,StreamingConsumerChart,0,12,2,0,12,311,39,1,1,-1,19,11,Sq1.Core.Charting.ChartShadow' Sq1.Core.StrategyBase.ScriptExecutor' Sq1.Core.DataTypes.BarScaleInterval' Sq1.Core.Streaming.StreamingAdapter' Sq1.Core.StrategyBase.Strategy' Sq1.Core.StrategyBase.ContextChart' Sq1.Core.Streaming.StreamingConsumer' Sq1.Core.Assembler' Sq1.Core.DataTypes.Quote' Sq1.Core.DataTypes.Bars' Sq1.Core.DataFeed.DataSource' Sq1.Core.Execution.ReporterPokeUnit' Sq1.Core.DataTypes.Bar' Sq1.Core.Backtesting.Backtester' Sq1.Core.StrategyBase.ScriptExecutorEventGenerator' Sq1.Core.Execution.AlertList' Sq1.Core.Execution.ExecutorDataSnapshot' Sq1.Core.Execution.PositionList' Sq1.Core.StrategyBase.SystemPerformance,Sq1.Core.Backtesting.BacktestStreamingConsumer' Sq1.Core.Livesim.Livesimulator' Sq1.Core.StrategyBase.ScriptExecutor' Sq1.Core.Streaming.BinderAttacher_perStreamingChart' Sq1.Core.Streaming.Distributor<STREAMING_CONSUMER_CHILD>' Sq1.Core.Streaming.DistributorCharts' Sq1.Core.Streaming.StreamingAdapter' Sq1.Core.Streaming.SymbolScaleStreamChart' Sq1.Core.Streaming.SymbolChannel<STREAMING_CONSUMER_CHILD>' Sq1.Gui.Forms.ChartForm' Sq1.Gui.Forms.ChartFormManager
Sq1.Core.Charting,DictionaryManyToOne<CHART;ALERTS>,2,14,1,0,9,216,41,0,0,0.14,1,0,Sq1.Core.Assembler,
Sq1.Core.Charting,HostPanelForIndicator,0,2,1,0,0,7,2,1,0,-1,0,3,,Sq1.Core.Indicators.Indicator' Sq1.Core.StrategyBase.Script' Sq1.Core.StrategyBase.ScriptExecutor
Sq1.Core.Charting,MultiSplitterProperties,4,3,0,4,3,39,6,0,0,0.67,2,1,Newtonsoft.Json.JsonPropertyAttribute' Sq1.Core.Assembler,Sq1.Charting.MultiSplit.MultiSplitContainerGeneric<PANEL_BASE>
Sq1.Core.Charting.OnChart,OnChartObjectOperationStatus,0,0,0,0,0,8,0,0,0,-1,0,9,,Sq1.Charting.ChartControl' Sq1.Charting.ExecutorObjects_FrozenForRendering' Sq1.Charting.OnChart.OnChartBarAnnotation' Sq1.Charting.OnChart.OnChartLabel' Sq1.Charting.OnChart.OnChartLine' Sq1.Core.Charting.ChartShadow' Sq1.Core.StrategyBase.Script' Sq1.Core.StrategyBase.ScriptExecutor' Sq1.Strategies.Demo.TwoMAsCompiled
Sq1.Core.Correlation,KPIsCalculator,1,3,0,0,0,30,8,0,0,0,6,1,Sq1.Core.Correlation.Correlator' Sq1.Core.Indicators.IndicatorParameter' Sq1.Core.Correlation.OneParameterAllValuesAveraged' Sq1.Core.Sequencing.SequencedBacktests' Sq1.Core.Sequencing.SystemPerformanceRestoreAble' Sq1.Core.Assembler,Sq1.Core.Correlation.Correlator
Sq1.Core.Correlation,MomentumsCalculator,1,6,0,0,2,133,31,0,0,0,10,1,Sq1.Core.Correlation.Correlator' Sq1.Core.Correlation.OneParameterOneValue' Sq1.Core.Correlation.OneParameterAllValuesAveraged' Sq1.Core.Sequencing.SequencedBacktests' Sq1.Core.Sequencing.SystemPerformanceRestoreAble' Sq1.Core.Correlation.KPIsMomentum' Sq1.Core.Assembler' Sq1.Core.StrategyBase.ScriptExecutor' Sq1.Core.StrategyBase.ContextScript' Sq1.Core.StrategyBase.Strategy,Sq1.Core.Correlation.Correlator
Sq1.Core.Correlation,KPIsMomentum,12,7,0,3,4,95,13,0,1,0.29,4,3,Newtonsoft.Json.JsonIgnoreAttribute' Sq1.Core.Correlation.KPIsAveraged' Sq1.Core.StrategyBase.KPIs' Sq1.Core.Assembler,Sq1.Core.Correlation.MomentumsCalculator' Sq1.Core.Correlation.OneParameterOneValue' Sq1.Widgets.Correlation.OneParameterControl
Sq1.Core.Correlation,KPIsAveraged,10,9,1,0,3,107,18,1,1,0.44,3,3,Newtonsoft.Json.JsonIgnoreAttribute' Sq1.Core.StrategyBase.KPIs' Sq1.Core.Assembler,Sq1.Core.Correlation.KPIsMomentum' Sq1.Core.Correlation.OneParameterOneValue' Sq1.Widgets.Correlation.OneParameterControl
Sq1.Core.Correlation,OneParameterAllValuesAveraged,6,10,11,5,4,136,20,0,1,0.5,7,7,Newtonsoft.Json.JsonIgnoreAttribute' Newtonsoft.Json.JsonPropertyAttribute' Sq1.Core.Sequencing.MaximizationCriterion' Sq1.Core.Correlation.Correlator' Sq1.Core.Correlation.OneParameterOneValue' Sq1.Core.Sequencing.SystemPerformanceRestoreAble' Sq1.Core.Assembler,Sq1.Core.Correlation.KPIsCalculator' Sq1.Core.Correlation.MomentumsCalculator' Sq1.Core.Correlation.OneParameterAllValuesAveragedEventArgs' Sq1.Core.Correlation.OneParameterOneValue' Sq1.Core.Correlation.Correlator' Sq1.Widgets.Correlation.CorrelatorControl' Sq1.Widgets.Correlation.OneParameterControl
Sq1.Core.Correlation,OneParameterAllValuesAveragedEventArgs,1,1,0,1,1,6,1,0,0,0,1,1,Sq1.Core.Correlation.OneParameterAllValuesAveraged,Sq1.Widgets.Correlation.OneParameterControl
Sq1.Core.Correlation,OneParameterOneValue,9,7,14,3,1,320,14,0,0,0.43,6,4,Newtonsoft.Json.JsonIgnoreAttribute' Sq1.Core.Correlation.KPIsMomentum' Sq1.Core.Correlation.OneParameterAllValuesAveraged' Sq1.Core.Sequencing.SystemPerformanceRestoreAble' Sq1.Core.Assembler' Sq1.Core.Correlation.KPIsAveraged,Sq1.Core.Correlation.MomentumsCalculator' Sq1.Core.Correlation.OneParameterAllValuesAveraged' Sq1.Core.Correlation.Correlator' Sq1.Widgets.Correlation.OneParameterControl
Sq1.Core.Correlation,Correlator,5,13,13,0,9,214,30,0,0,0.23,11,7,Sq1.Core.Repositories.RepositoryJsonCorrelator' Sq1.Core.Sequencing.SequencedBacktests' Sq1.Core.StrategyBase.ScriptExecutor' Sq1.Core.Assembler' Sq1.Core.StrategyBase.Strategy' Sq1.Core.Correlation.MomentumsCalculator' Sq1.Core.Correlation.KPIsCalculator' Sq1.Core.Correlation.OneParameterAllValuesAveraged' Sq1.Core.Indicators.IndicatorParameter' Sq1.Core.Sequencing.SystemPerformanceRestoreAble' Sq1.Core.Correlation.OneParameterOneValue,Sq1.Core.Correlation.KPIsCalculator' Sq1.Core.Correlation.MomentumsCalculator' Sq1.Core.Correlation.OneParameterAllValuesAveraged' Sq1.Gui.Forms.CorrelatorForm' Sq1.Gui.Forms.ChartFormManager' Sq1.Widgets.Correlation.CorrelatorControl' Sq1.Widgets.Correlation.OneParameterControl
Sq1.Core.Correlation,Stats,0,3,0,0,3,31,7,0,0,-1,0,0,,
Sq1.Core.Correlation,CorrelatorOneParameterSnapshot,11,1,0,11,1,26,1,0,0,0,1,1,Newtonsoft.Json.JsonPropertyAttribute,Sq1.Widgets.Correlation.OneParameterControl
Sq1.Core.DataFeed,DataSource,8,28,12,8,18,570,89,1,1,0.11,21,43,Newtonsoft.Json.JsonPropertyAttribute' Newtonsoft.Json.JsonIgnoreAttribute' Sq1.Core.Streaming.DistributorCharts' Sq1.Core.Streaming.StreamingAdapter' Sq1.Core.DataTypes.Bars' Sq1.Core.StrategyBase.ScriptExecutor' Sq1.Core.Assembler' Sq1.Core.Livesim.LivesimStreaming' Sq1.Core.Backtesting.BacktestStreaming' Sq1.Core.Repositories.RepositoryBarsSameScaleInterval' Sq1.Core.Repositories.RepositoryBarsFile' Sq1.Core.DataTypes.BarScaleInterval' Sq1.Core.DataFeed.SymbolOfDataSource' Sq1.Core.DataFeed.DataSourceSymbolRenamedEventArgs' Sq1.Core.DataTypes.BarScale' Sq1.Core.Repositories.RepositorySerializerMarketInfos' Sq1.Core.DataTypes.MarketInfo' Sq1.Core.Broker.OrderProcessor' Sq1.Core.Broker.BrokerAdapter' Sq1.Core.DataTypes.Bar' Sq1.Core.Repositories.RepositorySerializerSymbolInfos,Sq1.Charting.ChartControl' Sq1.Core.Backtesting.Backtester' Sq1.Core.Backtesting.BacktestStreamingConsumer' Sq1.Core.Backtesting.BacktestMarketsim' Sq1.Core.Backtesting.BacktestDataSource' Sq1.Core.Backtesting.BacktestStreaming' Sq1.Core.Broker.BrokerAdapter' Sq1.Core.Broker.OrderProcessor' Sq1.Core.Broker.OrderPostProcessorReplacerTidalThenCrossMarket' Sq1.Core.Broker.OrderPostProcessorSequencerCloseThenOpen' Sq1.Core.Broker.OrderPostProcessorEmergency' Sq1.Core.Broker.OrderPostProcessorRejected' Sq1.Core.Charting.ChartShadow' Sq1.Core.Charting.StreamingConsumerChart' Sq1.Core.DataFeed.SymbolOfDataSource' Sq1.Core.DataFeed.DataSourceSymbolRenamedEventArgs' Sq1.Core.DataFeed.DataSourceEventArgs' Sq1.Core.DataFeed.DataSourceSymbolEventArgs' Sq1.Core.DataTypes.Bars' Sq1.Core.Livesim.LivesimStreamingDefault' Sq1.Core.Livesim.LivesimStreaming' Sq1.Core.Livesim.Livesimulator' Sq1.Core.Livesim.LivesimDataSource' Sq1.Core.Livesim.LivesimBrokerDataSnapshot' Sq1.Core.Repositories.RepositoryJsonDataSources' Sq1.Core.Execution.ExecutorDataSnapshot' Sq1.Core.Execution.Alert' Sq1.Core.Execution.Order' Sq1.Core.StrategyBase.PositionPrototypeActivator' Sq1.Core.StrategyBase.ScriptExecutor' Sq1.Core.Streaming.StreamingAdapter' Sq1.Core.Streaming.StreamingConsumerSolidifier' Sq1.Gui.Forms.ChartForm' Sq1.Gui.Forms.ChartFormManager' Sq1.Gui.Forms.ChartFormInterformEventsConsumer' Sq1.Gui.MainForm' Sq1.Gui.MainFormEventManager' Sq1.Gui.Singletons.DataSourceEditorForm' Sq1.Widgets.CsvImporter.CsvImporterControl' Sq1.Widgets.DataSourceEditor.DataSourceEditorControl' Sq1.Widgets.DataSourceEditor.MarketInfoEditor' Sq1.Widgets.DataSourcesTree.DataSourcesTreeControl' Sq1.Widgets.FuturesMerger.BarsEditorUserControl
Sq1.Core.DataFeed,SymbolOfDataSource,0,2,2,0,2,11,2,0,0,-1,1,3,Sq1.Core.DataFeed.DataSource,Sq1.Core.Charting.ChartShadow' Sq1.Core.DataFeed.DataSource' Sq1.Widgets.DataSourcesTree.DataSourcesTreeControl
Sq1.Core.DataFeed,DataSourceSymbolRenamedEventArgs,1,1,1,1,1,8,1,0,1,0,1,4,Sq1.Core.DataFeed.DataSource,Sq1.Core.DataFeed.DataSource' Sq1.Core.StrategyBase.ScriptExecutor' Sq1.Widgets.DataSourcesTree.DataSourcesTreeControl' Sq1.Widgets.SymbolEditor.SymbolInfoEditorControl
Sq1.Core.DataFeed,IDataSourceEditor,0,2,0,0,0,4,2,1,0,-1,0,8,,Sq1.Core.Broker.BrokerAdapter' Sq1.Core.Broker.BrokerEditor' Sq1.Core.Livesim.LivesimBroker' Sq1.Core.Livesim.LivesimBrokerEditorEmpty' Sq1.Core.Livesim.LivesimStreamingEditorEmpty' Sq1.Core.Livesim.LivesimStreaming' Sq1.Core.Streaming.StreamingAdapter' Sq1.Core.Streaming.StreamingEditor
Sq1.Core.DataFeed,NamedObjectJsonEventArgs<T>,3,1,0,3,1,10,1,0,0,0,0,0,,
Sq1.Core.DataFeed,NamedObjectJsonSerializable,2,0,0,2,0,20,0,4,0,-1,1,2,Newtonsoft.Json.JsonIgnoreAttribute,Sq1.Core.Charting.ChartSettings' Sq1.Core.Sequencing.SequencedBacktests
Sq1.Core.DataFeed,DataSourceEventArgs,0,1,1,0,1,4,1,1,0,-1,1,3,Sq1.Core.DataFeed.DataSource,Sq1.Gui.Forms.ChartFormManager' Sq1.Gui.MainFormEventManager' Sq1.Widgets.CsvImporter.CsvImporterControl
Sq1.Core.DataFeed,DataSourceSymbolEventArgs,1,1,1,1,1,8,1,1,1,0,1,9,Sq1.Core.DataFeed.DataSource,Sq1.Charting.ChartControl' Sq1.Core.Repositories.RepositoryJsonDataSources' Sq1.Gui.Forms.ChartFormInterformEventsConsumer' Sq1.Gui.MainFormEventManager' Sq1.Widgets.CsvImporter.CsvImporterControl' Sq1.Widgets.DataSourceEditor.DataSourceEditorControl' Sq1.Widgets.DataSourcesTree.DataSourcesTreeControl' Sq1.Widgets.FuturesMerger.BarsEditorUserControl' Sq1.Widgets.SymbolEditor.SymbolInfoEditorControl
Sq1.Core.DataTypes,SymbolInfo,2,12,35,1,10,345,29,0,0,0.67,7,35,Newtonsoft.Json.JsonIgnoreAttribute' Sq1.Core.Assembler' Sq1.Core.DataTypes.SecurityType' Sq1.Core.Execution.MarketOrderAs' Sq1.Core.Execution.Alert' Sq1.Core.Execution.Direction' Sq1.Core.Execution.MarketLimitStop,Sq1.Charting.ChartControl' Sq1.Charting.TooltipPosition' Sq1.Charting.TooltipPrice' Sq1.Core.Backtesting.BacktestSpreadModeler' Sq1.Core.Backtesting.BacktestSpreadModelerPercentage' Sq1.Core.Backtesting.BacktestQuotesGenerator' Sq1.Core.Broker.BrokerAdapter' Sq1.Core.Broker.OrderProcessor' Sq1.Core.Broker.OrderPostProcessorSequencerCloseThenOpen' Sq1.Core.Broker.OrderPostProcessorEmergency' Sq1.Core.Broker.OrderPostProcessorRejected' Sq1.Core.DataTypes.Bar' Sq1.Core.DataTypes.Bars' Sq1.Core.DataTypes.BarsUnscaled' Sq1.Core.DataTypes.SymbolInfoList' Sq1.Core.Livesim.LevelTwoGenerator' Sq1.Core.Livesim.LivesimStreaming' Sq1.Core.Repositories.RepositorySerializerSymbolInfos' Sq1.Core.Repositories.ASC' Sq1.Core.Sequencing.SystemPerformanceRestoreAble' Sq1.Core.Execution.Alert' Sq1.Core.Execution.Order' Sq1.Core.Indicators.Indicator' Sq1.Core.Indicators.IndicatorAtrBand' Sq1.Core.StrategyBase.ScriptExecutor' Sq1.Core.StrategyBase.Reporter' Sq1.Core.StrategyBase.AlertFactory' Sq1.Core.Streaming.LevelTwo' Sq1.Core.Streaming.StreamingDataSnapshot' Sq1.Reporters.Performance' Sq1.Widgets.Correlation.CorrelatorControl' Sq1.Widgets.DataSourcesTree.DataSourcesTreeControl' Sq1.Widgets.Level2.LevelTwoUserControl' Sq1.Widgets.Sequencing.SequencerControl' Sq1.Widgets.SymbolEditor.SymbolInfoEditorControl
Sq1.Core.DataTypes,Bar,6,19,31,6,17,745,80,0,0,0.21,7,58,Newtonsoft.Json.JsonPropertyAttribute' Sq1.Core.DataTypes.BarScaleInterval' Sq1.Core.DataTypes.SymbolInfo' Sq1.Core.Assembler' Sq1.Core.DataTypes.Bars' Sq1.Core.DataTypes.BarScale' Sq1.Core.DataTypes.Quote,Sq1.Charting.ChartControl' Sq1.Charting.PanelBase' Sq1.Charting.PanelPrice' Sq1.Charting.PanelVolume' Sq1.Charting.TooltipPrice' Sq1.Core.Backtesting.Backtester' Sq1.Core.Backtesting.BacktestStreamingConsumer' Sq1.Core.Backtesting.BacktestQuotesGeneratorFourStroke' Sq1.Core.Backtesting.BacktestQuotesGeneratorTenStroke' Sq1.Core.Backtesting.BacktestQuotesGeneratorSixteenStroke' Sq1.Core.Backtesting.QuoteGenerated' Sq1.Core.Backtesting.BacktestMarketsim' Sq1.Core.Backtesting.BacktestSpreadModeler' Sq1.Core.Backtesting.BacktestSpreadModelerPercentage' Sq1.Core.Backtesting.BacktestQuotesGenerator' Sq1.Core.Charting.StreamingConsumerChart' Sq1.Core.DataFeed.DataSource' Sq1.Core.DataTypes.Bars' Sq1.Core.DataTypes.BarsUnscaled' Sq1.Core.DataTypes.BarsUnscaledListTwins' Sq1.Core.DataTypes.BarEventArgs' Sq1.Core.DataTypes.Quote' Sq1.Core.Livesim.LivesimBroker' Sq1.Core.Livesim.LivesimStreamingConsumer' Sq1.Core.Repositories.RepositoryBarsFile' Sq1.Core.Execution.PositionList' Sq1.Core.Execution.Position' Sq1.Core.Execution.Alert' Sq1.Core.Execution.Order' Sq1.Core.Indicators.HelperSeries.DataSeriesTimeBasedColorified' Sq1.Core.Indicators.HelperSeries.MovingAverageSimple' Sq1.Core.Indicators.HelperSeries.TrueRangeSeries' Sq1.Core.Indicators.Indicator' Sq1.Core.Indicators.IndicatorAverageTrueRange' Sq1.Core.Indicators.IndicatorAtrBand' Sq1.Core.Indicators.IndicatorMovingAverageSimple' Sq1.Core.StrategyBase.PositionPrototypeActivator' Sq1.Core.StrategyBase.Script' Sq1.Core.StrategyBase.ScriptExecutor' Sq1.Core.StrategyBase.ScriptExecutorEventGenerator' Sq1.Core.StrategyBase.SystemPerformanceSlice' Sq1.Core.StrategyBase.AlertFactory' Sq1.Core.Streaming.BinderAttacher_perStreamingChart' Sq1.Core.Streaming.Distributor<STREAMING_CONSUMER_CHILD>' Sq1.Core.Streaming.StreamingAdapter' Sq1.Core.Streaming.SymbolScaleStreamSolidifier' Sq1.Core.Streaming.SolidifierBarsEmulator' Sq1.Core.Streaming.StreamingConsumerSolidifier' Sq1.Core.Streaming.StreamingConsumer' Sq1.Strategies.Demo.ATRbandCompiled' Sq1.Strategies.Demo.TwoMAindicatorsCompiled' Sq1.Strategies.Demo.TwoMAsCompiled' Sq1.Strategies.Demo.StopLimitTestCompiled' Sq1.Strategies.Demo.EnterEveryBarCompiled' Sq1.Widgets.CsvImporter.CsvImporterControl' Sq1.Widgets.FuturesMerger.BarsEditorUserControl' Sq1.Widgets.RangeBar.AsyncGraphBuilderBars' Sq1.Widgets.RangeBar.RangeBarDateTime
Sq1.Core.DataTypes,Bars,4,25,18,4,21,720,73,0,1,0.16,11,62,Newtonsoft.Json.JsonIgnoreAttribute' Sq1.Core.DataTypes.Bar' Sq1.Core.DataTypes.BarsUnscaled' Sq1.Core.Assembler' Sq1.Core.DataTypes.MarketInfo' Sq1.Core.DataTypes.BarScaleInterval' Sq1.Core.DataTypes.BarScale' Sq1.Core.DataTypes.SymbolInfo' Sq1.Core.DataTypes.BarDataRange' Sq1.Core.DataTypes.BarRange' Sq1.Core.DataFeed.DataSource,Sq1.Charting.ChartControl' Sq1.Charting.PanelBase' Sq1.Charting.PanelLevel2' Sq1.Charting.PanelPrice' Sq1.Charting.PanelVolume' Sq1.Charting.TooltipPosition' Sq1.Charting.TooltipPrice' Sq1.Core.CommissionCalculator' Sq1.Core.Backtesting.Backtester' Sq1.Core.Backtesting.BacktestMarketsim' Sq1.Core.Backtesting.BacktestDataSource' Sq1.Core.Backtesting.BacktestStreaming' Sq1.Core.Backtesting.BacktestSpreadModeler' Sq1.Core.Backtesting.BacktestQuotesGenerator' Sq1.Core.Broker.BrokerAdapter' Sq1.Core.Broker.CommissionCalculatorZero' Sq1.Core.Broker.OrderProcessor' Sq1.Core.Broker.OrderPostProcessorSequencerCloseThenOpen' Sq1.Core.Broker.OrderPostProcessorEmergency' Sq1.Core.Broker.OrderPostProcessorRejected' Sq1.Core.Charting.ChartShadow' Sq1.Core.Charting.StreamingConsumerChart' Sq1.Core.DataFeed.DataSource' Sq1.Core.DataTypes.Bar' Sq1.Core.DataTypes.DataSeriesProxyBars' Sq1.Core.DataTypes.BarsEventArgs' Sq1.Core.DataTypes.MarketInfo' Sq1.Core.Livesim.LivesimBroker' Sq1.Core.Livesim.LivesimStreaming' Sq1.Core.Livesim.Livesimulator' Sq1.Core.Livesim.LivesimDataSource' Sq1.Core.Repositories.RepositoryBarsFile' Sq1.Core.Sequencing.ReusableExecutor' Sq1.Core.Sequencing.SystemPerformanceRestoreAble' Sq1.Core.Execution.Position' Sq1.Core.Execution.Alert' Sq1.Core.Execution.Order' Sq1.Core.Indicators.Indicator' Sq1.Core.Indicators.IndicatorAtrBand' Sq1.Core.Indicators.IndicatorMovingAverageSimple' Sq1.Core.StrategyBase.PositionPrototypeActivator' Sq1.Core.StrategyBase.ScriptExecutor' Sq1.Core.StrategyBase.Reporter' Sq1.Core.StrategyBase.AlertFactory' Sq1.Core.Streaming.BinderAttacher_perStreamingChart' Sq1.Core.Streaming.Distributor<STREAMING_CONSUMER_CHILD>' Sq1.Core.Streaming.StreamingAdapter' Sq1.Core.Streaming.SymbolScaleStreamChart' Sq1.Core.Streaming.SymbolScaleStream<STREAMING_CONSUMER_CHILD>' Sq1.Gui.Forms.ChartForm' Sq1.Gui.Forms.ChartFormManager' Sq1.Gui.Forms.ChartFormInterformEventsConsumer' Sq1.Gui.MainFormEventManager' Sq1.Reporters.Performance' Sq1.Reporters.Positions' Sq1.Strategies.Demo.TwoMAsCompiled' Sq1.Strategies.Demo.StopLimitTestCompiled' Sq1.Strategies.Demo.EnterEveryBarCompiled' Sq1.Widgets.CsvImporter.CsvImporterControl' Sq1.Widgets.DataSourcesTree.DataSourcesTreeControl' Sq1.Widgets.Execution.ExecutionTreeControl' Sq1.Widgets.FuturesMerger.BarsEditorUserControl
Sq1.Core.DataTypes,BarsUnscaled,2,12,5,1,10,148,24,1,1,0.33,5,4,Sq1.Core.DataTypes.SymbolInfo' Sq1.Core.Assembler' Sq1.Core.Repositories.RepositorySerializerSymbolInfos' Sq1.Core.DataTypes.Bar' Sq1.Core.DataTypes.BarsUnscaledListTwins,Sq1.Core.DataTypes.Bars' Sq1.Core.DataTypes.BarsUnscaledEventArgs' Sq1.Widgets.RangeBar.AsyncGraphBuilderBars' Sq1.Widgets.RangeBar.RangeBarDateTime
Sq1.Core.DataTypes,BarsUnscaledEventArgs,0,1,1,0,1,6,1,0,0,-1,1,0,Sq1.Core.DataTypes.BarsUnscaled,
Sq1.Core.DataTypes,BarsUnscaledListTwins,5,4,1,0,4,90,4,1,0,0,1,1,Sq1.Core.DataTypes.Bar,Sq1.Core.DataTypes.BarsUnscaled
Sq1.Core.DataTypes,BidOrAsk,0,0,0,0,0,5,0,0,0,-1,0,13,,Sq1.Core.Backtesting.BacktestQuotesGeneratorFourStroke' Sq1.Core.Backtesting.BacktestQuotesGeneratorTenStroke' Sq1.Core.Backtesting.BacktestQuotesGeneratorSixteenStroke' Sq1.Core.Backtesting.QuoteGenerated' Sq1.Core.Backtesting.BacktestSpreadModeler' Sq1.Core.Backtesting.BacktestQuotesGenerator' Sq1.Core.DataTypes.Quote' Sq1.Core.Execution.MarketConverter' Sq1.Core.Streaming.LevelTwoFrozen' Sq1.Core.Streaming.LevelTwoHalfSortedFrozen' Sq1.Core.Streaming.LevelTwoEachLine' Sq1.Core.Streaming.StreamingDataSnapshot' Sq1.Widgets.Level2.LevelTwoUserControl
Sq1.Core.DataTypes,SymbolInfoList,0,1,0,0,1,12,3,0,0,-1,1,2,Sq1.Core.DataTypes.SymbolInfo,Sq1.Core.Repositories.RepositorySerializerSymbolInfos' Sq1.Widgets.SymbolEditor.SymbolInfoEditorControl
Sq1.Core.DataTypes,BarEventArgs,0,1,1,0,1,6,1,0,0,-1,1,3,Sq1.Core.DataTypes.Bar,Sq1.Charting.ChartControl' Sq1.Core.Charting.ChartShadow' Sq1.Gui.Forms.ChartForm
Sq1.Core.DataTypes,BarScaleIntervalEventArgs,0,1,1,0,1,6,1,0,0,-1,1,0,Sq1.Core.DataTypes.BarScaleInterval,
Sq1.Core.DataTypes,BarDataRangeEventArgs,0,1,1,0,1,6,1,0,0,-1,1,0,Sq1.Core.DataTypes.BarDataRange,
Sq1.Core.DataTypes,QuoteEventArgs,1,1,0,1,1,6,1,0,0,0,1,3,Sq1.Core.DataTypes.Quote,Sq1.Core.Livesim.Livesimulator' Sq1.Gui.Forms.ChartFormManager' Sq1.Gui.Forms.ChartFormInterformEventsConsumer
Sq1.Core.DataTypes,DataSeriesProxyBars,2,5,1,1,5,65,5,0,1,0,3,3,Sq1.Core.DataTypes.Bars' Sq1.Core.DataTypes.DataSeriesProxyableFromBars' Sq1.Core.DataTypes.DataSeriesTimeBased,Sq1.Core.Indicators.HelperSeries.MovingAverageSimple' Sq1.Core.Indicators.Indicator' Sq1.Core.Indicators.IndicatorMovingAverageSimple
Sq1.Core.DataTypes,DataSeriesTimeBased,2,9,2,1,7,114,15,4,1,0.33,2,14,Sq1.Core.DataTypes.BarScaleInterval' Sq1.Core.DataTypes.DataSeriesBasic,Sq1.Charting.ChartControl' Sq1.Charting.PanelIndicator' Sq1.Charting.ExecutorObjects_FrozenForRendering' Sq1.Core.DataTypes.DataSeriesProxyBars' Sq1.Core.Indicators.HelperSeries.DataSeriesTimeBasedColorified' Sq1.Core.Indicators.HelperSeries.MovingAverageSimple' Sq1.Core.Indicators.HelperSeries.TrueRangeSeries' Sq1.Core.Indicators.Indicator' Sq1.Core.Indicators.IndicatorAverageTrueRange' Sq1.Core.Indicators.IndicatorAtrBand' Sq1.Core.Indicators.IndicatorMovingAverageSimple' Sq1.Core.StrategyBase.ScriptExecutor' Sq1.Core.StrategyBase.SystemPerformanceSlice' Sq1.Strategies.Demo.TwoMAsCompiled
Sq1.Core.DataTypes,DataSeriesBasic,2,12,8,1,10,186,43,1,0,0.75,1,1,Sq1.Core.Assembler,Sq1.Core.DataTypes.DataSeriesTimeBased
Sq1.Core.DataTypes,MarketClearingTimespan,3,2,3,3,2,24,6,0,0,0,1,4,Newtonsoft.Json.JsonPropertyAttribute,Sq1.Core.Backtesting.BacktestQuotesGenerator' Sq1.Core.DataTypes.MarketInfo' Sq1.Core.Repositories.RepositorySerializerMarketInfos' Sq1.Widgets.DataSourceEditor.MarketInfoEditor
Sq1.Core.DataTypes,BarDataRange,5,7,0,5,7,107,9,0,0,0.29,1,8,Sq1.Core.DataTypes.BarRange,Sq1.Core.DataTypes.Bars' Sq1.Core.DataTypes.BarDataRangeEventArgs' Sq1.Core.StrategyBase.ContextChart' Sq1.Gui.Forms.ChartForm' Sq1.Gui.Forms.ChartFormManager' Sq1.Gui.Forms.ChartFormInterformEventsConsumer' Sq1.Widgets.CsvImporter.CsvImporterControl' Sq1.Widgets.FuturesMerger.BarsEditorUserControl
Sq1.Core.DataTypes,BarScaleInterval,7,12,5,5,12,223,32,0,0,0.42,3,28,Newtonsoft.Json.JsonPropertyAttribute' Newtonsoft.Json.JsonIgnoreAttribute' Sq1.Core.DataTypes.BarScale,Sq1.Core.Backtesting.BacktestDataSource' Sq1.Core.Broker.OrderProcessor' Sq1.Core.Charting.StreamingConsumerChart' Sq1.Core.DataFeed.DataSource' Sq1.Core.DataTypes.Bar' Sq1.Core.DataTypes.Bars' Sq1.Core.DataTypes.BarScaleIntervalEventArgs' Sq1.Core.DataTypes.DataSeriesTimeBased' Sq1.Core.DataTypes.MarketInfo' Sq1.Core.Repositories.RepositoryBarsFile' Sq1.Core.Repositories.RepositoryBarsSameScaleInterval' Sq1.Core.Indicators.HelperSeries.DataSeriesTimeBasedColorified' Sq1.Core.Indicators.HelperSeries.TrueRangeSeries' Sq1.Core.StrategyBase.ContextChart' Sq1.Core.Streaming.Distributor<STREAMING_CONSUMER_CHILD>' Sq1.Core.Streaming.DistributorCharts' Sq1.Core.Streaming.DistributorSolidifier' Sq1.Core.Streaming.SymbolScaleStreamChart' Sq1.Core.Streaming.SymbolScaleStreamSolidifier' Sq1.Core.Streaming.SolidifierBarsEmulator' Sq1.Core.Streaming.SymbolChannel<STREAMING_CONSUMER_CHILD>' Sq1.Core.Streaming.SymbolScaleStream<STREAMING_CONSUMER_CHILD>' Sq1.Gui.Forms.ChartForm' Sq1.Gui.Forms.ChartFormManager' Sq1.Widgets.CsvImporter.CsvImporterControl' Sq1.Widgets.DataSourceEditor.DataSourceEditorControl' Sq1.Widgets.DataSourcesTree.DataSourcesTreeControl' Sq1.Widgets.Execution.ExecutionTreeControl
Sq1.Core.DataTypes,BarRange,0,0,0,0,0,9,0,0,0,-1,0,3,,Sq1.Core.DataTypes.Bars' Sq1.Core.DataTypes.BarDataRange' Sq1.Gui.Forms.ChartForm
