Project,Namespace,Ca types,Ce types
Newtonsoft.Json.WinRT,Newtonsoft.Json.Bson,Newtonsoft.Json.Converters.BsonObjectIdConverter' Newtonsoft.Json.Converters.RegexConverter,
Newtonsoft.Json.WinRT,Newtonsoft.Json,Newtonsoft.Json.Serialization.JsonSerializerProxy' Newtonsoft.Json.Serialization.JsonSerializerInternalReader' Newtonsoft.Json.Utilities.DateTimeUtils' Newtonsoft.Json.Serialization.JsonProperty' Newtonsoft.Json.Serialization.JsonObjectContract' Newtonsoft.Json.Schema.JsonSchemaGenerator' Newtonsoft.Json.Serialization.JsonSerializerInternalWriter' Newtonsoft.Json.Serialization.DefaultContractResolver' Newtonsoft.Json.Bson.BsonReader' Newtonsoft.Json.Schema.JsonSchema' Newtonsoft.Json.Serialization.TraceJsonWriter' Newtonsoft.Json.Serialization.TraceJsonReader' Newtonsoft.Json.Linq.JToken' Newtonsoft.Json.Serialization.JsonSerializerInternalBase' Newtonsoft.Json.Linq.JArray' Newtonsoft.Json.Linq.JProperty' Newtonsoft.Json.Linq.JContainer' Newtonsoft.Json.Linq.JConstructor' Newtonsoft.Json.Linq.JObject' Newtonsoft.Json.Linq.JTokenReader' Newtonsoft.Json.Serialization.JsonContainerContract' Newtonsoft.Json.Converters.BsonObjectIdConverter' Newtonsoft.Json.Converters.DateTimeConverterBase' Newtonsoft.Json.Converters.CustomCreationConverter<T>' Newtonsoft.Json.Converters.KeyValuePairConverter' Newtonsoft.Json.Converters.JsonValueConverter' Newtonsoft.Json.Converters.ExpandoObjectConverter' Newtonsoft.Json.Converters.RegexConverter' Newtonsoft.Json.Converters.StringEnumConverter' Newtonsoft.Json.Converters.VersionConverter' Newtonsoft.Json.Converters.XmlNodeConverter' Newtonsoft.Json.Linq.JValue' Newtonsoft.Json.Serialization.JsonContract' Newtonsoft.Json.Serialization.JsonTypeReflector' Newtonsoft.Json.Linq.JsonPath.ArrayIndexFilter' Newtonsoft.Json.Schema.JsonSchemaException' Newtonsoft.Json.Linq.JsonPath.FieldFilter' Newtonsoft.Json.Linq.JsonPath.FieldMultipleFilter' Newtonsoft.Json.Serialization.DefaultReferenceResolver' Newtonsoft.Json.Linq.JsonPath.PathFilter' Newtonsoft.Json.Linq.JsonPath.ArraySliceFilter' Newtonsoft.Json.Schema.JsonSchemaBuilder' Newtonsoft.Json.Linq.JsonPath.JPath' Newtonsoft.Json.Converters.JavaScriptDateTimeConverter' Newtonsoft.Json.Converters.IsoDateTimeConverter' Newtonsoft.Json.Linq.JRaw' Newtonsoft.Json.Serialization.JsonPropertyCollection' Newtonsoft.Json.Serialization.ReflectionValueProvider' Newtonsoft.Json.Serialization.DefaultSerializationBinder' Newtonsoft.Json.Serialization.ExpressionValueProvider' Newtonsoft.Json.Bson.BsonWriter' Newtonsoft.Json.Linq.JTokenWriter' Newtonsoft.Json.Schema.Extensions' Newtonsoft.Json.Schema.JsonSchemaWriter' Newtonsoft.Json.Utilities.ReflectionUtils' Newtonsoft.Json.Utilities.JavaScriptUtils' Newtonsoft.Json.Serialization.ITraceWriter' Newtonsoft.Json.Serialization.MemoryTraceWriter,
Newtonsoft.Json.WinRT,Newtonsoft.Json.Converters,Newtonsoft.Json.Serialization.DefaultContractResolver' Newtonsoft.Json.JsonConvert,Newtonsoft.Json.JsonConverter' Newtonsoft.Json.JsonReader' Newtonsoft.Json.JsonSerializationException' Newtonsoft.Json.JsonSerializer' Newtonsoft.Json.JsonToken' Newtonsoft.Json.JsonWriter
Newtonsoft.Json.WinRT,System.Runtime.Serialization.Formatters,Newtonsoft.Json.Serialization.JsonSerializerProxy' Newtonsoft.Json.Utilities.ReflectionUtils' Newtonsoft.Json.JsonSerializerSettings' Newtonsoft.Json.JsonSerializer,
Newtonsoft.Json.WinRT,Newtonsoft.Json.Linq,Newtonsoft.Json.Linq.JsonPath.PathFilter' Newtonsoft.Json.Linq.JsonPath.ArraySliceFilter' Newtonsoft.Json.Linq.JsonPath.ArrayIndexFilter' Newtonsoft.Json.Linq.JsonPath.ScanFilter' Newtonsoft.Json.Linq.JsonPath.FieldMultipleFilter' Newtonsoft.Json.Linq.JsonPath.FieldFilter' Newtonsoft.Json.Schema.JsonSchemaBuilder' Newtonsoft.Json.Serialization.JsonSerializerInternalReader' Newtonsoft.Json.JsonConvert' Newtonsoft.Json.Serialization.JsonSerializerInternalWriter' Newtonsoft.Json.Linq.JsonPath.ArrayMultipleIndexFilter' Newtonsoft.Json.Linq.JsonPath.JPath' Newtonsoft.Json.JsonValidatingReader' Newtonsoft.Json.Linq.JsonPath.QueryFilter' Newtonsoft.Json.Schema.JsonSchema' Newtonsoft.Json.Schema.Extensions' Newtonsoft.Json.Linq.JsonPath.QueryExpression' Newtonsoft.Json.Linq.JsonPath.CompositeExpression' Newtonsoft.Json.Linq.JsonPath.BooleanQueryExpression' Newtonsoft.Json.Schema.JsonSchemaWriter' Newtonsoft.Json.Schema.JsonSchemaModel' Newtonsoft.Json.Schema.JsonSchemaGenerator' Newtonsoft.Json.Serialization.DefaultContractResolver,
Newtonsoft.Json.WinRT,Newtonsoft.Json.Linq.JsonPath,Newtonsoft.Json.Linq.JToken,
Newtonsoft.Json.WinRT,Newtonsoft.Json.Schema,Newtonsoft.Json.JsonConverter' Newtonsoft.Json.JsonValidatingReader,
Newtonsoft.Json.WinRT,Newtonsoft.Json.Serialization,Newtonsoft.Json.Schema.JsonSchemaGenerator' Newtonsoft.Json.MemberSerialization' Newtonsoft.Json.Converters.KeyValuePairConverter' Newtonsoft.Json.Converters.RegexConverter' Newtonsoft.Json.JsonSerializer' Newtonsoft.Json.JsonSerializerSettings' Newtonsoft.Json.Bson.BsonReader' Newtonsoft.Json.Schema.JsonSchemaWriter' Newtonsoft.Json.JsonReader' Newtonsoft.Json.Utilities.ReflectionObject' Newtonsoft.Json.Schema.JsonSchemaBuilder' Newtonsoft.Json.Utilities.ConvertUtils' Newtonsoft.Json.Utilities.DynamicUtils' Newtonsoft.Json.Utilities.ImmutableCollectionsUtils,
Newtonsoft.Json.WinRT,Newtonsoft.Json.Utilities,Newtonsoft.Json.JsonTextWriter' Newtonsoft.Json.Serialization.DefaultReferenceResolver' Newtonsoft.Json.Serialization.JsonSerializerInternalBase' Newtonsoft.Json.Converters.StringEnumConverter' Newtonsoft.Json.Serialization.JsonDictionaryContract' Newtonsoft.Json.Serialization.DefaultContractResolver' Newtonsoft.Json.Serialization.JsonArrayContract' Newtonsoft.Json.JsonSerializer' Newtonsoft.Json.Serialization.JsonSerializerInternalReader' Newtonsoft.Json.Converters.XmlNodeConverter' Newtonsoft.Json.Serialization.JsonSerializerInternalWriter' Newtonsoft.Json.Serialization.JsonPrimitiveContract' Newtonsoft.Json.Schema.JsonSchemaGenerator' Newtonsoft.Json.JsonConvert' Newtonsoft.Json.Linq.JToken' Newtonsoft.Json.JsonWriter' Newtonsoft.Json.JsonTextReader' Newtonsoft.Json.JsonReader' Newtonsoft.Json.Linq.JValue' Newtonsoft.Json.Serialization.JsonContract' Newtonsoft.Json.Bson.BsonBinaryWriter' Newtonsoft.Json.Bson.BsonReader' Newtonsoft.Json.Linq.JTokenWriter' Newtonsoft.Json.Bson.BsonWriter' Newtonsoft.Json.Converters.JavaScriptDateTimeConverter' Newtonsoft.Json.Linq.JObject' Newtonsoft.Json.Serialization.JsonDynamicContract' Newtonsoft.Json.Schema.JsonSchemaWriter' Newtonsoft.Json.Serialization.JsonTypeReflector' Newtonsoft.Json.Serialization.ExpressionValueProvider' Newtonsoft.Json.Serialization.JsonProperty' Newtonsoft.Json.Schema.JsonSchemaModel' Newtonsoft.Json.Linq.JTokenReader' Newtonsoft.Json.Linq.JArray' Newtonsoft.Json.Linq.JConstructor' Newtonsoft.Json.Converters.XDocumentWrapper' Newtonsoft.Json.Serialization.DefaultContractResolverState' Newtonsoft.Json.Converters.KeyValuePairConverter' Newtonsoft.Json.Converters.IsoDateTimeConverter' Newtonsoft.Json.Linq.Extensions' Newtonsoft.Json.Serialization.ReflectionValueProvider' Newtonsoft.Json.Serialization.CamelCasePropertyNamesContractResolver' Newtonsoft.Json.Serialization.CachedAttributeGetter<T>' Newtonsoft.Json.Serialization.DefaultSerializationBinder' Newtonsoft.Json.JsonValidatingReader' Newtonsoft.Json.Linq.JEnumerable' Newtonsoft.Json.Linq.JContainer' Newtonsoft.Json.Linq.JProperty' Newtonsoft.Json.Schema.Extensions' Newtonsoft.Json.Schema.ValidationEventArgs' Newtonsoft.Json.Bson.BsonObjectId' Newtonsoft.Json.Serialization.JsonPropertyCollection' Newtonsoft.Json.Schema.JsonSchema' Newtonsoft.Json.Serialization.JsonSerializerProxy' Newtonsoft.Json.Linq.JsonPath.JPath,
