Project,Namespace,Ca types,Ce types
MugenMvvmToolkit.WPF(4.5),MugenMvvmToolkit.WPF.Infrastructure.Callbacks,,MugenMvvmToolkit.Interfaces.ISerializer' MugenMvvmToolkit.Models.MemberFlags' MugenMvvmToolkit.Should' MugenMvvmToolkit.Interfaces.Callbacks.IAsyncOperation' MugenMvvmToolkit.Interfaces.Models.IDataContext' MugenMvvmToolkit.Tracer' MugenMvvmToolkit.Models.DataContext' MugenMvvmToolkit.DataConstants.OpeartionCallbackConstants' MugenMvvmToolkit.Interfaces.Navigation.INavigationContext' MugenMvvmToolkit.Interfaces.ViewModels.IViewModel' MugenMvvmToolkit.Infrastructure.ReferenceEqualityComparer' MugenMvvmToolkit.Interfaces.Callbacks.IOperationResult' MugenMvvmToolkit.Interfaces.ViewModels.IWrapperViewModel' MugenMvvmToolkit.Interfaces.Callbacks.IOperationCallbackStateManager' MugenMvvmToolkit.Empty' MugenMvvmToolkit.ToolkitServiceProvider' MugenMvvmToolkit.Interfaces.Callbacks.IAsyncOperationAwaiter' MugenMvvmToolkit.Interfaces.IViewModelProvider' MugenMvvmToolkit.ReflectionExtensions' MugenMvvmToolkit.Interfaces.IThreadManager' MugenMvvmToolkit.Models.ExecutionMode' MugenMvvmToolkit.Interfaces.Callbacks.ISerializableCallback' MugenMvvmToolkit.Infrastructure.Callbacks.OperationResult
MugenMvvmToolkit.WPF(4.5),MugenMvvmToolkit.WPF.Binding.Converters,,MugenMvvmToolkit.Empty' MugenMvvmToolkit.Interfaces.Models.IDataContext' MugenMvvmToolkit.Models.DataContext' MugenMvvmToolkit.DataConstants.NavigationConstants' MugenMvvmToolkit.Interfaces.IViewManager' MugenMvvmToolkit.ToolkitServiceProvider' MugenMvvmToolkit.Tracer' MugenMvvmToolkit.ToolkitExtensions
MugenMvvmToolkit.WPF(4.5),MugenMvvmToolkit.WPF.Infrastructure,,MugenMvvmToolkit.Models.NotifyPropertyChangedBase' MugenMvvmToolkit.Infrastructure.AttachedValueDictionary' MugenMvvmToolkit.Interfaces.IIocContainer' MugenMvvmToolkit.Interfaces.IMvvmApplication' MugenMvvmToolkit.Interfaces.ViewModels.IViewModel' MugenMvvmToolkit.Should' JetBrains.Annotations.NotNullAttribute' MugenMvvmToolkit.Models.PlatformInfo' MugenMvvmToolkit.Infrastructure.MemberCacheKeyComparer' MugenMvvmToolkit.Infrastructure.MethodDelegateCacheKey' MugenMvvmToolkit.Models.TraceLevel' MugenMvvmToolkit.ReflectionExtensions' MugenMvvmToolkit.ApplicationSettings' MugenMvvmToolkit.WPF.WpfToolkitExtensions' MugenMvvmToolkit.Interfaces.Presenters.IDynamicViewModelPresenter' MugenMvvmToolkit.Interfaces.Models.IDataContext' MugenMvvmToolkit.DataConstants.NavigationConstants' MugenMvvmToolkit.Interfaces.Presenters.IViewModelPresenter' MugenMvvmToolkit.WPF.Infrastructure.Presenters.WpfRootDynamicViewModelPresenter' MugenMvvmToolkit.Interfaces.IViewMappingProvider' MugenMvvmToolkit.Interfaces.Models.IViewMappingItem' MugenMvvmToolkit.Infrastructure.BootstrapperBase' MugenMvvmToolkit.Models.OperationPriority
MugenMvvmToolkit.WPF(4.5),MugenMvvmToolkit.WPF.Infrastructure.Presenters,MugenMvvmToolkit.WPF.Infrastructure.WpfBootstrapperBase,MugenMvvmToolkit.Interfaces.IThreadManager' MugenMvvmToolkit.Interfaces.IReflectionManager' MugenMvvmToolkit.ToolkitServiceProvider' MugenMvvmToolkit.Should' JetBrains.Annotations.NotNullAttribute' MugenMvvmToolkit.Models.ToastPosition' MugenMvvmToolkit.Interfaces.Models.IDataContext' MugenMvvmToolkit.Interfaces.IAttachedValueProvider' MugenMvvmToolkit.Interfaces.Callbacks.IAsyncOperation' MugenMvvmToolkit.Interfaces.Presenters.IViewModelPresenter' MugenMvvmToolkit.ToolkitExtensions' MugenMvvmToolkit.Models.MessageButton' MugenMvvmToolkit.Models.MessageImage' MugenMvvmToolkit.Models.MessageResult
MugenMvvmToolkit.WPF(4.5),MugenMvvmToolkit.WPF.Modules,,MugenMvvmToolkit.Interfaces.IConfigurableWrapperManager' MugenMvvmToolkit.Should' MugenMvvmToolkit.Modules.InitializationModuleBase' MugenMvvmToolkit.ApplicationSettings' MugenMvvmToolkit.Interfaces.IThreadManager' MugenMvvmToolkit.ToolkitServiceProvider' MugenMvvmToolkit.Models.ExecutionMode' MugenMvvmToolkit.Interfaces.Models.IModuleContext' MugenMvvmToolkit.Models.PlatformInfo' MugenMvvmToolkit.Models.PlatformType' MugenMvvmToolkit.Interfaces.IIocContainer' MugenMvvmToolkit.Models.IoC.DependencyLifecycle' MugenMvvmToolkit.Interfaces.IAttachedValueProvider' MugenMvvmToolkit.Interfaces.IReflectionManager' MugenMvvmToolkit.Interfaces.Presenters.IViewModelPresenter' MugenMvvmToolkit.Infrastructure.Presenters.DynamicViewModelWindowPresenter' MugenMvvmToolkit.Interfaces.ITracer
MugenMvvmToolkit.WPF(4.5),MugenMvvmToolkit.WPF.MarkupExtensions,,MugenMvvmToolkit.ToolkitServiceProvider' MugenMvvmToolkit.Should
MugenMvvmToolkit.WPF(4.5),MugenMvvmToolkit.WPF.Infrastructure.Mediators,,JetBrains.Annotations.NotNullAttribute' MugenMvvmToolkit.Interfaces.ViewModels.IViewModel' MugenMvvmToolkit.Interfaces.Mediators.IWindowViewMediator' MugenMvvmToolkit.Interfaces.Models.IDataContext' MugenMvvmToolkit.DataConstants.NavigationConstants' MugenMvvmToolkit.Interfaces.Models.IViewModelSettings' MugenMvvmToolkit.DataConstants.WindowPresenterConstants' MugenMvvmToolkit.WPF.Interfaces.Views.IWindowView' MugenMvvmToolkit.DataConstants.ViewModelConstants
MugenMvvmToolkit.WPF(4.5),MugenMvvmToolkit.WPF,MugenMvvmToolkit.WPF.Infrastructure.WpfBootstrapperBase,MugenMvvmToolkit.Models.PlatformType' MugenMvvmToolkit.Models.PlatformIdiom' MugenMvvmToolkit.Models.PlatformInfo
MugenMvvmToolkit.WPF(4.5),MugenMvvmToolkit.WPF.Interfaces.Views,MugenMvvmToolkit.WPF.Infrastructure.Mediators.WindowViewMediator,
