Project,Namespace,Ca types,Ce types
EventStore.Core,EventStore.Core.Data,EventStore.Core.ClusterVNode' EventStore.Core.VNodeBuilder' EventStore.Core.Cluster.Settings.ClusterVNodeSettings' EventStore.ClientAPI.Embedded.VNodeBuilder' EventStore.Core.Index.PTable' EventStore.Core.TransactionLog.Chunks.TFChunk.TFChunkReadSideScavenged' EventStore.Core.Services.PersistentSubscription.PersistentSubscriptionCheckpointWriter' EventStore.Core.Services.PersistentSubscription.PersistentSubscriptionMessageParker' EventStore.Core.Services.Storage.ReaderIndex.IndexReader' EventStore.Projections.Core.Services.Processing.CoreProjectionCheckpointWriter' EventStore.Projections.Core.Services.Processing.EmittedStream' EventStore.Core.Services.Storage.ReaderIndex.IIndexBackend' EventStore.Core.Services.Storage.ReaderIndex.IndexBackend' EventStore.Core.Services.Storage.ReaderIndex.IndexCommitter' EventStore.Core.Cluster.VNodeInfoHelper' EventStore.Core.Messages.ReconnectToMaster' EventStore.Core.Messages.ReplicaStateMessage' EventStore.Core.Messages.BecomePreReplica' EventStore.Core.Messages.BecomeCatchingUp' EventStore.Core.Messages.BecomeClone' EventStore.Core.Messages.BecomeSlave' EventStore.Core.Services.ElectionsService' EventStore.Core.Services.HttpSendService' EventStore.Core.Services.Gossip.GossipServiceBase' EventStore.Core.Services.Gossip.NodeGossipService' EventStore.Core.Services.Replication.ReplicaService' EventStore.Core.Services.VNode.ClusterVNodeController' EventStore.Core.VNodeStatusChangeArgs' EventStore.Core.Cluster.MemberInfo' EventStore.Core.Messages.StateChangeMessage' EventStore.Core.Services.ClusterStorageWriterService' EventStore.Core.Services.PersistentSubscription.PersistentSubscriptionService' EventStore.Core.Services.Replication.MasterReplicationService' EventStore.Core.Services.Monitoring.MonitoringService' EventStore.Core.Services.Storage.StorageWriterService' EventStore.Core.Services.Transport.Http.Controllers.InfoController' EventStore.Core.Services.VNode.VNodeFSMUnoptimized' EventStore.Core.Services.VNode.VNodeFSM' EventStore.Core.Services.VNode.VNodeFSMBuilder' EventStore.Core.Services.VNode.VNodeFSMStatesDefinition' EventStore.Projections.Core.Services.Management.ProjectionCoreCoordinator' EventStore.Projections.Core.Services.Management.ProjectionManager' EventStore.Core.Services.Storage.ReaderIndex.IndexReadAllResult' EventStore.Core.Services.Storage.StorageReaderWorker' EventStore.Core.Messages.ReplicaSubscriptionRequest' EventStore.Core.TransactionLog.LogRecords.EpochRecordExtensions' EventStore.ClientAPI.Embedded.ClientMessageConverterExtensions' EventStore.ClientAPI.Embedded.EmbeddedPersistentSubscription' EventStore.ClientAPI.Embedded.ReadEvent' EventStore.ClientAPI.Embedded.EmbeddedSubscription' EventStore.Core.Authentication.InternalAuthenticationProvider' EventStore.Core.Messages.ReadEventCompletedText' EventStore.Core.Messages.ResolvedEvent' EventStore.Core.Messages.ReadEventCompleted' EventStore.Core.Messages.PersistentSubscriptionStreamEventAppeared' EventStore.Core.Messages.StreamEventAppeared' EventStore.Core.Messages.ReadStreamEventsForwardCompleted' EventStore.Core.Messages.ReadStreamEventsBackwardCompleted' EventStore.Core.Messages.ReadAllEventsForwardCompleted' EventStore.Core.Messages.ReadAllEventsBackwardCompleted' EventStore.Core.Messages.ReadNextNPersistentMessagesCompleted' EventStore.Core.Messages.ReplayParkedMessage' EventStore.Core.Services.SubscriptionsService' EventStore.Core.Services.PersistentSubscription.ConsumerStrategy.DispatchToSinglePersistentSubscriptionConsumerStrategy' EventStore.Core.Services.PersistentSubscription.ConsumerStrategy.IPersistentSubscriptionConsumerStrategy' EventStore.Core.Services.PersistentSubscription.ConsumerStrategy.PinnedPersistentSubscriptionConsumerStrategy' EventStore.Core.Services.PersistentSubscription.ConsumerStrategy.RoundRobinPersistentSubscriptionConsumerStrategy' EventStore.Core.Services.PersistentSubscription.IPersistentSubscriptionMessageParker' EventStore.Core.Services.PersistentSubscription.OutstandingMessage' EventStore.Core.Services.PersistentSubscription.OutstandingMessageCache' EventStore.Core.Services.PersistentSubscription.PersistentSubscription' EventStore.Core.Services.PersistentSubscription.ResponseHandler' EventStore.Core.Services.PersistentSubscription.PersistentSubscriptionClient' EventStore.Core.Services.PersistentSubscription.PersistentSubscriptionClientCollection' EventStore.Core.Services.PersistentSubscription.SequencedEvent' EventStore.Core.Services.PersistentSubscription.StreamBuffer' EventStore.Core.Services.Transport.Http.Authentication.PasswordChangeNotificationReader' EventStore.Core.Services.Transport.Http.Configure' EventStore.Core.Services.Transport.Http.AutoEventConverter' EventStore.Core.Services.Transport.Http.Format' EventStore.Core.Services.Transport.Http.Convert' EventStore.Core.Services.Transport.Tcp.ClientTcpDispatcher' EventStore.Core.Services.UserManagement.AllUsersReader' EventStore.Core.Services.UserManagement.UserManagementService' EventStore.Projections.Core.Services.Management.MasterCoreProjectionResponseReader' EventStore.Projections.Core.Services.Management.ManagedProjection' EventStore.Projections.Core.Services.Management.ProjectionManagerResponseReader' EventStore.Projections.Core.Services.Processing.AllStreamsCatalogEventReader' EventStore.Projections.Core.Services.Processing.DeliverEventOutItem' EventStore.Projections.Core.Services.Processing.ByStreamCatalogEventReader' EventStore.Projections.Core.Services.Processing.CoreProjectionCheckpointManager' EventStore.Projections.Core.Services.Processing.CoreProjectionCheckpointReader' EventStore.Projections.Core.Services.Processing.DefaultCheckpointManager' EventStore.Projections.Core.Services.Processing.EmittedStreamsDeleter' EventStore.Projections.Core.Services.Processing.EmittedStreamsTracker' EventStore.Projections.Core.Services.Processing.PendingEvent' EventStore.Projections.Core.Services.Processing.IndexBased' EventStore.Projections.Core.Services.Processing.TfBased' EventStore.Projections.Core.Services.Processing.ExternallyFedByStreamEventReader' EventStore.Projections.Core.Services.Processing.MultiStreamEventReader' EventStore.Projections.Core.Services.Processing.MultiStreamMultiOutputCheckpointManager' EventStore.Projections.Core.Services.Processing.Item' EventStore.Projections.Core.Services.Processing.ProjectionCoreServiceCommandReader' EventStore.Projections.Core.Services.Processing.ResolvedEvent' EventStore.Projections.Core.Services.Processing.StreamEventReader' EventStore.Projections.Core.Services.Processing.TransactionFileEventReader' EventStore.Core.Messages.WriteEventsCompleted' EventStore.Core.Messages.TransactionCommitCompleted' EventStore.Core.Services.Storage.ReaderIndex.IndexWriter' EventStore.Core.Services.Storage.ReaderIndex.ReadIndex' EventStore.Core.Services.Storage.StorageChaser' EventStore.Core.TransactionLog.Chunks.TFChunkScavenger' EventStore.Projections.Core.Standard.StreamDeletedHelper' EventStore.Core.Messages.ResolvedIndexedEvent' EventStore.Core.Messages.EventRecord' EventStore.Core.Messages.EventCommitted' EventStore.Core.Services.AwakeReaderService.AwakeService' EventStore.Core.Services.Storage.ReaderIndex.AllReader' EventStore.Core.Services.Storage.ReaderIndex.IndexReadEventResult' EventStore.Core.Services.Storage.ReaderIndex.IndexReadStreamResult' EventStore.ClientAPI.Embedded.ReadAllEventsBackward' EventStore.ClientAPI.Embedded.ReadAllEventsForward' EventStore.ClientAPI.Embedded.ReadStreamEventsBackward' EventStore.ClientAPI.Embedded.ReadStreamForwardEvents' EventStore.Core.Helpers.IODispatcher' EventStore.Projections.Core.Services.Processing.EventReader' EventStore.Core.Helpers.IODispatcherAsync' EventStore.Core.Services.Storage.ReaderIndex.MetadataCached' EventStore.Core.Services.Storage.ReaderIndex.StreamMeta' EventStore.Core.Services.Storage.StorageScavenger' EventStore.Core.Index.IndexMap' EventStore.Core.Services.AwakeReaderService.SubscribeAwake' EventStore.Core.Services.Storage.ReaderIndex.IAllReader' EventStore.Core.Services.Storage.ReaderIndex.IReadIndex' EventStore.Core.Services.Transport.Http.Controllers.AtomController' EventStore.Projections.Core.Messages.CommittedEventDistributed' EventStore.Projections.Core.Services.Processing.EventByTypeIndexEventReader' EventStore.Projections.Core.Services.Processing.State' EventStore.Projections.Core.Services.Processing.EventByTypeIndexPositionTagger' EventStore.Projections.Core.Services.Processing.EventReorderingReaderSubscription' EventStore.Projections.Core.Services.Processing.PreparePositionTagger' EventStore.Projections.Core.Services.Processing.ReaderSubscriptionBase' EventStore.Projections.Core.Services.Processing.CheckpointTag' EventStore.Projections.Core.Services.Processing.HeadingEventReader' EventStore.Projections.Core.Services.Processing.TransactionFilePositionTagger' EventStore.Core.Messages.WriteEvents' EventStore.Core.Messages.TransactionWrite' EventStore.Core.Messages.WritePrepares' EventStore.Core.Messages.WriteTransactionData' EventStore.Projections.Core.Services.Management.MultiStreamMessageWriter' EventStore.Projections.Core.Services.Management.ResponseWriter' EventStore.Projections.Core.Services.Processing.EmittedStreamsWriter' EventStore.Projections.Core.Services.Processing.IEmittedStreamsWriter' EventStore.Projections.Core.Services.Processing.QueuedEmittedStreamsWriter' EventStore.Core.Messages.DeleteStream' EventStore.Core.Messages.TransactionStart' EventStore.Core.TransactionLog.LogRecords.LogRecord' EventStore.Core.TransactionLog.LogRecords.PrepareLogRecord' EventStore.Projections.Core.Services.Processing.MultiStreamPositionTagger,EventStore.Core.Services.SystemMetadata' EventStore.Common.Utils.Helper' EventStore.Common.Utils.Ensure' EventStore.Core.TransactionLog.LogRecords.PrepareFlags' EventStore.Core.TransactionLog.LogRecords.PrepareLogRecord' EventStore.Common.Utils.Empty' EventStore.Core.TransactionLog.Chunks.TFConsts
EventStore.Core,EventStore.Core.Exceptions,EventStore.Core.TransactionLog.Chunks.TFChunkScavenger' EventStore.Core.TransactionLog.Chunks.TFChunkDb,
EventStore.Core,EventStore.Core.Helpers,EventStore.Projections.Core.Services.Management.MasterCoreProjectionResponseReader' EventStore.Projections.Core.Services.Management.MultiStreamMessageWriter' EventStore.Projections.Core.Services.Management.ProjectionManagerResponseReader' EventStore.Projections.Core.Services.Management.ResponseWriter' EventStore.Projections.Core.Services.Processing.ProjectionCoreServiceCommandReader' EventStore.Core.Services.ClusterStorageWriterService' EventStore.Core.Authentication.InternalAuthenticationProviderFactory' EventStore.Core.Authentication.InternalAuthenticationProvider' EventStore.Core.ClusterVNode' EventStore.Core.Services.PersistentSubscription.PersistentSubscriptionCheckpointReader' EventStore.Core.Services.PersistentSubscription.PersistentSubscriptionCheckpointWriter' EventStore.Core.Services.PersistentSubscription.PersistentSubscriptionMessageParker' EventStore.Core.Services.PersistentSubscription.PersistentSubscriptionService' EventStore.Core.Services.PersistentSubscription.PersistentSubscriptionStreamReader' EventStore.Core.Services.Storage.StorageScavenger' EventStore.Core.Services.Transport.Http.Authentication.PasswordChangeNotificationReader' EventStore.Core.Services.UserManagement.AllUsersReader' EventStore.Core.Services.UserManagement.UserManagementService' EventStore.Core.TransactionLog.Chunks.TFChunkScavenger' EventStore.Projections.Core.ProjectionManagerNode' EventStore.Projections.Core.ProjectionWorkerNode' EventStore.Projections.Core.Services.Management.ManagedProjection' EventStore.Projections.Core.Services.Management.ProjectionManager' EventStore.Projections.Core.Services.Processing.AllStreamsCatalogEventReader' EventStore.Projections.Core.Services.Processing.DeliverEventOutItem' EventStore.Projections.Core.Services.Processing.ByStreamCatalogEventReader' EventStore.Projections.Core.Services.Processing.ContinuousProjectionProcessingStrategy' EventStore.Projections.Core.Services.Processing.CoreProjectionCheckpointReader' EventStore.Projections.Core.Services.Processing.CoreProjectionCheckpointWriter' EventStore.Projections.Core.Services.Processing.DefaultCheckpointManager' EventStore.Projections.Core.Services.Processing.EventReaderBasedProjectionProcessingStrategy' EventStore.Projections.Core.Services.Processing.EmittedStreamsDeleter' EventStore.Projections.Core.Services.Processing.EmittedStreamsTracker' EventStore.Projections.Core.Services.Processing.EmittedStreamsWriter' EventStore.Projections.Core.Services.Processing.ExternallyFedByStreamEventReader' EventStore.Projections.Core.Services.Processing.ExternallyFedReaderStrategy' EventStore.Projections.Core.Services.Processing.IReaderStrategy' EventStore.Projections.Core.Services.Processing.MultiStreamEventReader' EventStore.Projections.Core.Services.Processing.MultiStreamMultiOutputCheckpointManager' EventStore.Projections.Core.Services.Processing.IReaderSubscription' EventStore.Projections.Core.Services.Processing.ParallelQueryAllStreamsMasterReaderStrategy' EventStore.Projections.Core.Services.Processing.ParallelQueryMasterReaderStrategy' EventStore.Projections.Core.Services.Processing.ParallelQueryProcessingStrategy' EventStore.Projections.Core.Services.Processing.EventReaderCoreService' EventStore.Projections.Core.Services.Processing.ProjectionProcessingStrategy' EventStore.Projections.Core.Services.Processing.QueuedEmittedStreamsWriter' EventStore.Projections.Core.Services.Processing.ReaderSubscriptionBase' EventStore.Projections.Core.Services.Processing.QueryProcessingStrategy' EventStore.Projections.Core.Services.Processing.SlaveQueryProcessingStrategy' EventStore.Projections.Core.Services.Processing.EmittedStream' EventStore.Projections.Core.Services.Processing.ReaderStrategy' EventStore.Projections.Core.Services.Processing.CoreProjection' EventStore.Projections.Core.Services.Processing.ProjectionCheckpoint' EventStore.Projections.Core.Services.Processing.ProjectionCoreService' EventStore.Core.Services.Transport.Tcp.ClientTcpDispatcher,EventStore.Core.Messages.ReadStreamEventsForwardCompleted' EventStore.Core.Messages.ReadStreamEventsBackwardCompleted' EventStore.Core.Data.Event' EventStore.Core.Data.TFPos' EventStore.Core.Data.StreamMetadata' EventStore.Core.Data.ExpectedVersion' EventStore.Core.Messages.WriteEventsCompleted' EventStore.Core.Messages.DeleteStreamCompleted' EventStore.Core.Services.SystemStreams' EventStore.Core.Services.SystemEventTypes' EventStore.Core.Messages.OperationResult' EventStore.Common.Log.ILogger' EventStore.Common.Utils.Ensure' EventStore.Common.Utils.Helper' EventStore.Core.Bus.IPublisher' EventStore.Core.Messaging.IEnvelope' EventStore.Core.Messages.ReadStreamEventsForward' EventStore.Core.Messages.ReadStreamEventsBackward' EventStore.Core.Messages.WriteEvents' EventStore.Core.Messages.DeleteStream' EventStore.Core.Services.AwakeReaderService.SubscribeAwake' EventStore.Core.Data.ReadStreamResult' EventStore.Core.Services.TimerService.Schedule' EventStore.Core.Services.TimerService.TimerMessage
EventStore.Core,EventStore.Core.Index,EventStore.Core.Services.Storage.ReaderIndex.IndexCommitter' EventStore.Core.Services.Storage.ReaderIndex.IndexReader' EventStore.Core.TransactionLog.Chunks.TFChunkScavenger' EventStore.Core.Services.Storage.ReaderIndex.ReadIndex' EventStore.Core.Services.Storage.StorageScavenger' EventStore.Core.TransactionLog.Chunks.ChunkHeader,EventStore.Common.Log.ILogger' EventStore.Common.Utils.Ensure' EventStore.Core.Util.MD5Hash' EventStore.Core.Data.TFPos' EventStore.Core.TransactionLog.Unbuffered.UnbufferedFileStream' EventStore.Common.Utils.Empty' EventStore.Core.Data.Range' EventStore.Core.IndexEntryV2' EventStore.Core.Index.Hashes.IHasher' EventStore.Common.Utils.Helper' EventStore.Core.Util.FileUtils' EventStore.Core.TransactionLog.TFReaderLease' EventStore.Core.TransactionLog.RecordReadResult' EventStore.Core.TransactionLog.LogRecords.LogRecord' EventStore.Core.TransactionLog.LogRecords.LogRecordType' EventStore.Core.TransactionLog.LogRecords.PrepareLogRecord
EventStore.Core,EventStore.Core.Index.Hashes,EventStore.Core.Index.TableIndex' EventStore.Core.Services.PersistentSubscription.ConsumerStrategy.PinnedPersistentSubscriptionConsumerStrategy,
EventStore.Core,EventStore.Core.Messages,EventStore.Core.Cluster.ClusterInfo' EventStore.Core.Services.Transport.Http.Controllers.GossipController' EventStore.Core.Services.ElectionsService' EventStore.Core.Services.Transport.Http.Controllers.ElectController' EventStore.Core.Services.VNode.ClusterVNodeController' EventStore.Core.Services.Gossip.GossipServiceBase' EventStore.Core.Services.Transport.Http.Format' EventStore.Core.Cluster.MemberInfo' EventStore.Core.Services.Transport.Tcp.InternalTcpDispatcher' EventStore.Core.Services.Replication.ReplicaService' EventStore.Core.Services.Replication.MasterReplicationService' EventStore.Core.Services.ClusterStorageWriterService' EventStore.Core.Services.Transport.Http.Configure' EventStore.Core.Services.RequestManager.Managers.SingleAckRequestManager' EventStore.Core.Services.RequestManager.Managers.TwoPhaseRequestManagerBase' EventStore.Core.Services.RequestManager.RequestManagementService' EventStore.Core.Services.SubscriptionsService' EventStore.Core.Services.PersistentSubscription.PersistentSubscriptionService' EventStore.Core.Services.Transport.Http.AutoEventConverter' EventStore.Core.Authentication.InternalAuthenticationProvider' EventStore.Core.Bus.MultiQueuedHandler' EventStore.Core.Services.Transport.Tcp.ClientTcpDispatcher' EventStore.Core.Services.Transport.Tcp.TcpConnectionManager' EventStore.Core.Services.RequestForwardingService' EventStore.Core.Services.Transport.Http.Controllers.UsersController' EventStore.Core.Services.UserManagement.AllUsersReader' EventStore.Core.Services.UserManagement.UserManagementService' EventStore.Core.Services.Storage.StorageScavenger' EventStore.Core.Helpers.IODispatcher' EventStore.Core.Helpers.WriterQueueSet' EventStore.Core.Helpers.WriterQueue' EventStore.Core.Services.RequestManager.Managers.WriteStreamTwoPhaseRequestManager' EventStore.Core.Services.Monitoring.MonitoringService' EventStore.Core.Services.Transport.Http.Controllers.AtomController' EventStore.Projections.Core.Services.Management.ManagedProjection' EventStore.Projections.Core.Services.Management.ProjectionManager' EventStore.Projections.Core.Services.Processing.RequestResponseQueueForwarder' EventStore.ClientAPI.Embedded.AppendToStream' EventStore.ClientAPI.Embedded.ConditionalAppendToStream' EventStore.Core.Helpers.IODispatcherAsync' EventStore.Core.Helpers.PendingRequests' EventStore.Core.Services.PersistentSubscription.PersistentSubscriptionCheckpointWriter' EventStore.Core.Services.PersistentSubscription.PersistentSubscriptionMessageParker' EventStore.Core.TransactionLog.Chunks.TFChunkScavenger' EventStore.Projections.Core.Services.Management.MultiStreamMessageWriter' EventStore.Projections.Core.Services.Management.ProjectionManagerResponseReader' EventStore.Projections.Core.Services.Management.ResponseWriter' EventStore.Projections.Core.Services.Processing.CoreProjectionCheckpointWriter' EventStore.Projections.Core.Services.Processing.EmittedStreamsDeleter' EventStore.Projections.Core.Services.Processing.EmittedStreamsTracker' EventStore.Projections.Core.Services.Processing.EmittedStream' EventStore.Core.Services.RequestManager.Managers.DeleteStreamTwoPhaseRequestManager' EventStore.ClientAPI.Embedded.DeleteStream' EventStore.ClientAPI.Embedded.TransactionStart' EventStore.ClientAPI.Embedded.TransactionWrite' EventStore.Core.Services.RequestManager.Managers.TransactionCommitTwoPhaseRequestManager' EventStore.ClientAPI.Embedded.TransactionCommit' EventStore.Core.Services.Storage.StorageReaderWorker' EventStore.ClientAPI.Embedded.ReadEvent' EventStore.Core.Services.Transport.Http.Controllers.PersistentSubscriptionController' EventStore.ClientAPI.Embedded.UpdatePersistentSubscription' EventStore.ClientAPI.Embedded.CreatePersistentSubscription' EventStore.ClientAPI.Embedded.DeletePersistentSubscription' EventStore.ClientAPI.Embedded.EmbeddedSubscriber' EventStore.Core.Services.PersistentSubscription.PersistentSubscription' EventStore.Core.Services.PersistentSubscription.PersistentSubscriptionStats' EventStore.Core.Services.Storage.StorageReaderService' EventStore.Core.Services.Storage.StorageWriterService' EventStore.Core.Services.Monitoring.StatsCollectorEnvelope' EventStore.Core.Services.AwakeReaderService.AwakeService' EventStore.Core.Bus.QueuedHandlerAutoReset' EventStore.Core.Bus.QueuedHandlerMRES' EventStore.Core.Bus.QueuedHandlerThreadPool' EventStore.Core.Bus.QueuedHandlerSleep' EventStore.Core.Bus.QueuedHandlerMresWithMpsc' EventStore.Core.Bus.QueuedHandlerPulse' EventStore.Core.Bus.InMemoryBus' EventStore.Core.Bus.QueuedHandlerAutoResetWithMpsc' EventStore.Core.Services.Storage.StorageChaser' EventStore.Core.Services.Transport.Http.HttpService' EventStore.Core.Services.Transport.Tcp.TcpService' EventStore.Core.Services.Transport.Http.Authentication.PasswordChangeNotificationReader' EventStore.Projections.Core.Services.Management.ProjectionCoreCoordinator' EventStore.Core.ClusterVNode' EventStore.Core.Services.HttpSendService' EventStore.Core.Services.Transport.Http.Controllers.InfoController' EventStore.Core.Services.TimerService.TimerService' EventStore.Projections.Core.Services.Processing.AllStreamsCatalogEventReader' EventStore.Projections.Core.Services.Processing.IndexBased' EventStore.Projections.Core.Services.Processing.MultiStreamEventReader' EventStore.Projections.Core.Services.Processing.StreamEventReader' EventStore.ClientAPI.Embedded.ReadStreamForwardEvents' EventStore.Core.Services.PersistentSubscription.ResponseHandler' EventStore.Core.Services.Transport.Http.Convert' EventStore.Projections.Core.Services.Management.MasterCoreProjectionResponseReader' EventStore.Projections.Core.Services.Processing.ByStreamCatalogEventReader' EventStore.Projections.Core.Services.Processing.ExternallyFedByStreamEventReader' EventStore.Projections.Core.Services.Processing.EventReader' EventStore.Projections.Core.Services.Processing.ProjectionCoreServiceCommandReader' EventStore.ClientAPI.Embedded.ReadStreamEventsBackward' EventStore.Projections.Core.Services.Processing.DeliverEventOutItem' EventStore.Projections.Core.Services.Processing.CoreProjectionCheckpointReader' EventStore.Projections.Core.Services.Processing.DefaultCheckpointManager' EventStore.Projections.Core.Services.Processing.MultiStreamMultiOutputCheckpointManager' EventStore.Projections.Core.Services.Processing.TfBased' EventStore.Projections.Core.Services.Processing.TransactionFileEventReader' EventStore.ClientAPI.Embedded.ReadAllEventsForward' EventStore.ClientAPI.Embedded.ReadAllEventsBackward' EventStore.Core.Services.Transport.Http.AuthenticatedHttpRequestProcessor' EventStore.Core.Services.Transport.Http.Controllers.PingController' EventStore.Core.Services.TcpSendService,EventStore.Core.Cluster.ClusterInfo' EventStore.Core.Cluster.MemberInfo' EventStore.Common.Utils.Ensure' EventStore.Core.Messaging.IEnvelope' EventStore.Core.TransactionLog.LogRecords.EpochRecord' EventStore.Core.Services.Transport.Tcp.TcpConnectionManager' EventStore.Core.Data.Epoch' EventStore.Core.Data.VNodeInfo' EventStore.Core.TransactionLog.Chunks.ChunkHeader' EventStore.Core.TransactionLog.LogRecords.PrepareFlags' EventStore.Core.Messaging.Message' EventStore.Common.Utils.Helper' EventStore.Core.TransactionLog.LogRecords.LogRecord' EventStore.Core.Data.ResolvedEvent' EventStore.Core.Data.EventRecord' EventStore.Common.Utils.Empty' EventStore.Core.Data.EventNumber' EventStore.Core.Data.Event' EventStore.Core.Data.ExpectedVersion' EventStore.Core.Data.ReadEventResult' EventStore.Core.Data.StreamMetadata' EventStore.Core.Services.SubscriptionDropReason' EventStore.Core.Services.Storage.ReaderIndex.StreamAccessType' EventStore.Core.Services.Storage.ReaderIndex.StreamAccess' EventStore.Core.Data.VNodeState' EventStore.Core.Data.ReadStreamResult' EventStore.Core.Data.ReadAllResult' EventStore.Core.Data.TFPos' EventStore.Transport.Http.EntityManagement.HttpEntityManager' EventStore.Core.Services.Transport.Http.ResponseConfiguration' EventStore.Core.Services.Transport.Http.ServiceAccessibility
