Project,Namespace,Ca types,Ce types
EventStore.Core,EventStore.Core.Services.Transport.Http.Messages,EventStore.Core.Services.Transport.Http.AuthenticatedHttpRequestProcessor' EventStore.Core.Services.Transport.Http.Authentication.HttpAuthenticationProvider' EventStore.Core.Services.Transport.Http.Authentication.BasicHttpAuthenticationProvider' EventStore.Core.Services.Transport.Http.Authentication.HttpBasicAuthenticationRequest' EventStore.Core.Services.Transport.Http.Authentication.AnonymousHttpAuthenticationProvider' EventStore.Core.Services.Transport.Http.Authentication.TrustedHttpAuthenticationProvider' EventStore.Core.Services.Transport.Http.IncomingHttpRequestAuthenticationManager,EventStore.Core.Services.Transport.Http.HttpService' EventStore.Transport.Http.EntityManagement.HttpEntity' EventStore.Core.Bus.IPublisher
EventStore.Core,EventStore.Core.Services.Transport.Tcp,EventStore.Core.Services.Replication.ReplicaService' EventStore.Core.ClusterVNode' EventStore.Core.Messages.ReplicaSubscriptionRequest' EventStore.Core.Messages.TcpSend' EventStore.Core.Messages.ConnectionEstablished' EventStore.Core.Messages.ConnectionClosed' EventStore.Core.Services.SubscriptionsService' EventStore.Core.Services.TcpSendService' EventStore.Core.Services.PersistentSubscription.PersistentSubscriptionService' EventStore.Core.Services.Replication.MasterReplicationService' EventStore.Core.Services.Replication.ReplicaSubscription' EventStore.Projections.Core.Messages.Connected,EventStore.Core.Messages.PrepareAck' EventStore.Core.Messaging.IEnvelope' EventStore.Core.Messages.CommitAck' EventStore.Core.Messages.SubscribeReplica' EventStore.Core.Messages.Epoch' EventStore.Core.Messages.ReplicaSubscriptionRequest' EventStore.Core.TransactionLog.LogRecords.EpochRecord' EventStore.Core.Messages.ReplicaLogPositionAck' EventStore.Core.Messages.AckLogPosition' EventStore.Core.Messages.CreateChunk' EventStore.Core.TransactionLog.Chunks.ChunkHeader' EventStore.Core.Messages.RawChunkBulk' EventStore.Core.Messages.DataChunkBulk' EventStore.Core.Messages.ReplicaSubscriptionRetry' EventStore.Core.Messages.ReplicaSubscribed' EventStore.Core.Messages.SlaveAssignment' EventStore.Core.Messages.CloneAssignment' EventStore.Core.Messaging.Message' EventStore.Common.Log.ILogger' EventStore.Core.Bus.IPublisher' EventStore.Transport.Tcp.TcpServerListener' EventStore.Core.Authentication.IAuthenticationProvider' EventStore.Common.Utils.Ensure' EventStore.Common.Utils.Application' EventStore.Common.Utils.ExitCode' EventStore.Core.Messages.SystemInit' EventStore.Core.Messages.SystemStart' EventStore.Core.Messages.BecomeShuttingDown' EventStore.Transport.Tcp.ITcpConnection' EventStore.Transport.Tcp.TcpConnectionSsl' EventStore.Transport.Tcp.TcpConnection' EventStore.Core.Messages.PongMessage' EventStore.Core.Messages.IdentifyClient' EventStore.Core.Messages.WriteEvents' EventStore.Core.Data.Event' EventStore.Core.Messages.NewEvent' EventStore.Core.Messages.WriteRequestMessage' EventStore.Core.Services.UserManagement.SystemAccount' EventStore.Core.Messages.WriteEventsCompleted' EventStore.Core.Messages.OperationResult' EventStore.Core.Messages.TcpClientMessageDto' EventStore.Core.Messages.TransactionStart' EventStore.Core.Messages.TransactionStartCompleted' EventStore.Core.Messages.TransactionWrite' EventStore.Core.Messages.TransactionWriteCompleted' EventStore.Core.Messages.TransactionCommit' EventStore.Core.Messages.TransactionCommitCompleted' EventStore.Core.Messages.DeleteStream' EventStore.Core.Messages.DeleteStreamCompleted' EventStore.Core.Messages.ReadEvent' EventStore.Core.Messages.ReadEventCompleted' EventStore.Core.Data.ResolvedEvent' EventStore.Core.Messages.ReadStreamEvents' EventStore.Core.Messages.ReadStreamEventsForward' EventStore.Core.Messages.ReadStreamEventsCompleted' EventStore.Core.Messages.ReadStreamEventsForwardCompleted' EventStore.Core.Messages.ReadStreamEventsBackward' EventStore.Core.Messages.ReadStreamEventsBackwardCompleted' EventStore.Core.Messages.ResolvedIndexedEvent' EventStore.Core.Messages.ReadAllEvents' EventStore.Core.Messages.ReadAllEventsForward' EventStore.Core.Messages.ReadAllEventsCompleted' EventStore.Core.Data.TFPos' EventStore.Core.Messages.ReadAllEventsForwardCompleted' EventStore.Core.Messages.ReadAllEventsBackward' EventStore.Core.Messages.ReadAllEventsBackwardCompleted' EventStore.Core.Messages.ResolvedEvent' EventStore.Core.Messages.SubscribeToStream' EventStore.Core.Messages.UnsubscribeFromStream' EventStore.Core.Messages.SubscriptionConfirmation' EventStore.Core.Messages.CreatePersistentSubscription' EventStore.Core.Services.SystemConsumerStrategies' EventStore.Core.Messages.UpdatePersistentSubscription' EventStore.Core.Messages.DeletePersistentSubscription' EventStore.Core.Messages.DeletePersistentSubscriptionCompleted' EventStore.Core.Messages.CreatePersistentSubscriptionCompleted' EventStore.Core.Messages.UpdatePersistentSubscriptionCompleted' EventStore.Core.Messages.ConnectToPersistentSubscription' EventStore.Core.Messages.PersistentSubscriptionAckEvents' EventStore.Core.Messages.PersistentSubscriptionNakEvents' EventStore.Core.Messages.PersistentSubscriptionNackEvents' EventStore.Core.Messages.PersistentSubscriptionConfirmation' EventStore.Core.Messages.PersistentSubscriptionStreamEventAppeared' EventStore.Core.Messages.StreamEventAppeared' EventStore.Core.Messages.SubscriptionDropped' EventStore.Core.Messages.ScavengeDatabase' EventStore.Core.Messages.ScavengeDatabaseCompleted' EventStore.Core.Messages.NotHandled' EventStore.Core.Messages.NotAuthenticated' EventStore.Common.Utils.Helper' EventStore.Core.Messages.Authenticated' EventStore.Common.Utils.Empty' EventStore.Core.Helpers.StreamVersionConverter' EventStore.Core.Messages.EventRecord' EventStore.Core.Data.EventRecord' EventStore.Transport.Tcp.Framing.IMessageFramer' EventStore.Core.Settings.ESConsts' EventStore.Transport.Tcp.TcpClientConnector' EventStore.Transport.Tcp.Framing.PackageFramingException' EventStore.Core.Messages.NotHandledReason' EventStore.Core.Messages.Heartbeat' EventStore.Core.Services.TimerService.Schedule' EventStore.Core.Services.TimerService.TimerMessage' EventStore.Core.Messages.HeartbeatTimeout' EventStore.Core.Bus.IHandle
EventStore.Core,EventStore.Core.Services.UserManagement,EventStore.ClientAPI.Embedded.EmbeddedSubscriptionBase<TSubscription>' EventStore.Core.Authentication.InternalAuthenticationProvider' EventStore.Core.Services.PersistentSubscription.PersistentSubscriptionCheckpointReader' EventStore.Core.Services.PersistentSubscription.PersistentSubscriptionCheckpointWriter' EventStore.Core.Services.PersistentSubscription.PersistentSubscriptionMessageParker' EventStore.Core.Services.PersistentSubscription.PersistentSubscriptionService' EventStore.Core.Services.PersistentSubscription.PersistentSubscriptionStreamReader' EventStore.Core.Services.Monitoring.MonitoringService' EventStore.Core.Services.Storage.StorageScavenger' EventStore.Core.Services.Transport.Http.Authentication.PasswordChangeNotificationReader' EventStore.Core.Services.Transport.Tcp.ClientTcpDispatcher' EventStore.Core.Services.Transport.Tcp.TcpConnectionManager' EventStore.Core.TransactionLog.Chunks.TFChunkScavenger' EventStore.Projections.Core.Messages.Persisted.Commands.PersistedProjectionConfig' EventStore.Projections.Core.Services.Management.MasterCoreProjectionResponseReader' EventStore.Projections.Core.Services.Management.MultiStreamMessageWriter' EventStore.Projections.Core.Services.Management.ManagedProjection' EventStore.Projections.Core.Services.Management.SerializedRunAs' EventStore.Projections.Core.Services.Management.ProjectionManagerResponseReader' EventStore.Projections.Core.Services.Management.ResponseWriter' EventStore.Projections.Core.Services.Management.ProjectionManager' EventStore.Projections.Core.Services.Processing.CoreProjectionCheckpointReader' EventStore.Projections.Core.Services.Processing.CoreProjectionCheckpointWriter' EventStore.Projections.Core.Services.Processing.DefaultCheckpointManager' EventStore.Projections.Core.Services.Processing.EmittedStreamsDeleter' EventStore.Projections.Core.Services.Processing.EmittedStreamsTracker' EventStore.Projections.Core.Services.Processing.ExternallyFedReaderStrategy' EventStore.Projections.Core.Services.Processing.MultiStreamMultiOutputCheckpointManager' EventStore.Projections.Core.Services.Processing.ParallelQueryProcessingStrategy' EventStore.Projections.Core.Services.Processing.ProjectionCoreServiceCommandReader' EventStore.Projections.Core.Services.Processing.EventReaderCoreService' EventStore.Projections.Core.Services.Processing.QueryProcessingStrategy' EventStore.Projections.Core.Services.Processing.EmittedStream' EventStore.Core.Authentication.InternalAuthenticationProviderFactory,EventStore.Core.Helpers.IODispatcher' EventStore.Core.Messages.ReadStreamEventsForwardCompleted' EventStore.Core.Data.ReadStreamResult' EventStore.Core.Data.ResolvedEvent' EventStore.Core.Data.EventRecord' EventStore.Common.Utils.Helper' EventStore.Core.Messages.Error' EventStore.Core.Messages.UserManagementMessage' EventStore.Core.Data.UserData' EventStore.Core.Messages.ReadStreamEventsBackwardCompleted' EventStore.Core.Messages.UserData' EventStore.Core.Bus.IPublisher' EventStore.Core.Authentication.PasswordHashAlgorithm' EventStore.Common.Log.ILogger' EventStore.Common.Log.LogManager' EventStore.Core.Messages.Create' EventStore.Core.Messages.Update' EventStore.Core.Messages.Enable' EventStore.Core.Messages.Disable' EventStore.Core.Messages.ResetPassword' EventStore.Core.Messages.ChangePassword' EventStore.Core.Messages.Delete' EventStore.Core.Messages.DeleteStreamCompleted' EventStore.Core.Messaging.IEnvelope' EventStore.Core.Messages.Get' EventStore.Core.Messages.GetAll' EventStore.Core.Messages.BecomeMaster' EventStore.Core.Messages.UserManagementRequestMessage' EventStore.Core.Data.ExpectedVersion' EventStore.Core.Messages.WriteEventsCompleted' EventStore.Core.Messages.OperationResult' EventStore.Core.Data.Event' EventStore.Core.Services.SystemRoles' EventStore.Core.Services.SystemUsers
EventStore.Core,EventStore.Core.Services.VNode,EventStore.Core.ClusterVNode' EventStore.Core.Services.RequestForwardingService,EventStore.Common.Log.ILogger' EventStore.Core.Bus.IPublisher' EventStore.Core.Data.VNodeInfo' EventStore.Core.TransactionLog.Chunks.TFChunkDb' EventStore.Core.ClusterVNode' EventStore.Core.Data.VNodeState' EventStore.Core.Bus.IQueuedHandler' EventStore.Core.Messaging.IEnvelope' EventStore.Core.ISubsystem' EventStore.Common.Utils.Ensure' EventStore.Core.Cluster.Settings.ClusterVNodeSettings' EventStore.Common.Utils.Application' EventStore.Common.Utils.ExitCode' EventStore.Core.Messages.StateChangeMessage' EventStore.Core.Messages.ReadRequestMessage' EventStore.Core.Messages.WriteRequestMessage' EventStore.Core.Messaging.Message' EventStore.Core.Messages.SystemInit' EventStore.Core.Messages.SystemStart' EventStore.Core.Messages.BecomeUnknown' EventStore.Core.Messages.BecomePreReplica' EventStore.Core.Messages.BecomeCatchingUp' EventStore.Core.Messages.BecomeClone' EventStore.Core.Messages.BecomeSlave' EventStore.Core.Messages.BecomePreMaster' EventStore.Core.Messages.BecomeMaster' EventStore.Core.Messages.BecomeShuttingDown' EventStore.Core.Services.TimerService.Schedule' EventStore.Core.Services.TimerService.TimerMessage' EventStore.Core.Bus.MultiQueuedHandler' EventStore.Core.Messages.BecomeShutdown' EventStore.Core.Cluster.MemberInfo' EventStore.Core.Messages.ElectionsDone' EventStore.Core.Cluster.VNodeInfoHelper' EventStore.Core.Messages.ServiceInitialized' EventStore.Core.Messages.UserManagementServiceInitialized' EventStore.Core.Messages.SystemCoreReady' EventStore.Core.Messages.SubSystemInitialized' EventStore.Core.Messages.ReadEvent' EventStore.Core.Messages.ReadStreamEventsForward' EventStore.Core.Messages.ReadStreamEventsBackward' EventStore.Core.Messages.ReadAllEventsForward' EventStore.Core.Messages.ReadAllEventsBackward' EventStore.Core.Messages.CreatePersistentSubscription' EventStore.Core.Messages.ConnectToPersistentSubscription' EventStore.Core.Messages.UpdatePersistentSubscription' EventStore.Core.Messages.DeletePersistentSubscription' EventStore.Core.Messages.WriteEventsCompleted' EventStore.Core.Messages.WriteEvents' EventStore.Core.Messages.OperationResult' EventStore.Core.Messages.TransactionStartCompleted' EventStore.Core.Messages.TransactionStart' EventStore.Core.Messages.TransactionWriteCompleted' EventStore.Core.Messages.TransactionWrite' EventStore.Core.Messages.TransactionCommitCompleted' EventStore.Core.Messages.TransactionCommit' EventStore.Core.Messages.DeleteStreamCompleted' EventStore.Core.Messages.DeleteStream' EventStore.Core.Messages.NotHandledReason' EventStore.Core.Messages.NotHandled' EventStore.Core.Messages.TcpClientMessageDto' EventStore.Core.Messages.VNodeConnectionLost' EventStore.Core.Cluster.ClusterInfo' EventStore.Core.Messages.GossipUpdated' EventStore.Core.Messages.NoQuorumMessage' EventStore.Core.Messages.WaitForChaserToCatchUp' EventStore.Core.Messages.ChaserCaughtUp' EventStore.Core.Messages.ReconnectToMaster' EventStore.Core.Messages.SubscribeToMaster' EventStore.Core.Messages.ReplicaSubscriptionRetry' EventStore.Core.Messages.ReplicaSubscribed' EventStore.Core.Messages.SlaveAssignment' EventStore.Core.Messages.CloneAssignment' EventStore.Core.Messages.IReplicationMessage' EventStore.Core.Messages.RequestShutdown' EventStore.Core.Messages.ServiceShutdown' EventStore.Core.Messages.ShutdownTimeout' EventStore.Core.Messaging.MessageHierarchy
EventStore.Core,EventStore.Core.Settings,EventStore.Core.Authentication.InternalAuthenticationProviderFactory' EventStore.Core.ClusterVNode' EventStore.Core.Services.Transport.Http.Controllers.AtomController' EventStore.Core.Services.Transport.Http.HttpService' EventStore.Core.Services.Transport.Tcp.TcpConnectionManager' EventStore.Core.TransactionLog.Chunks.TFChunk.TFChunk' EventStore.Projections.Core.Services.Management.ProjectionManagerResponseReader' EventStore.Projections.Core.Services.Processing.IndexBased' EventStore.Projections.Core.Services.Processing.TfBased' EventStore.Projections.Core.Services.Processing.MultiStreamEventReader' EventStore.Projections.Core.Services.Processing.EmittedStream' EventStore.Projections.Core.Services.Processing.StreamEventReader' EventStore.Projections.Core.Services.Processing.TransactionFileEventReader,EventStore.Core.Services.Monitoring.StatsStorage' EventStore.Common.Utils.Ensure
EventStore.Core,EventStore.Core.TransactionLog.Checkpoint,EventStore.Core.VNodeBuilder' EventStore.ClientAPI.Embedded.VNodeBuilder' EventStore.Core.Bus.QueueStatsCollector' EventStore.Core.ClusterVNode' EventStore.Core.Services.ClusterStorageWriterService' EventStore.Core.Services.ElectionsService' EventStore.Core.Services.Gossip.NodeGossipService' EventStore.Core.Services.Replication.MasterReplicationService' EventStore.Core.Services.Replication.ReplicaService' EventStore.Core.Services.Storage.EpochManager.EpochManager' EventStore.Core.Services.Monitoring.SystemStatsHelper' EventStore.Core.Services.Monitoring.MonitoringService' EventStore.Core.Services.Storage.StorageReaderWorker' EventStore.Core.Services.Storage.StorageChaser' EventStore.Core.Services.Storage.StorageReaderService' EventStore.Core.Services.Storage.StorageWriterService' EventStore.Core.TransactionLog.Chunks.TFChunkDbTruncator' EventStore.Core.TransactionLog.Chunks.TFChunkScavenger' EventStore.Core.TransactionLog.Chunks.TFChunkChaser' EventStore.Core.TransactionLog.Chunks.TFChunkDbConfig' EventStore.Core.TransactionLog.Chunks.TFChunkDb' EventStore.Core.TransactionLog.Chunks.TFChunkReader' EventStore.Core.TransactionLog.Chunks.TFChunkWriter' EventStore.Projections.Core.Services.Processing.EventReaderCoreService,
EventStore.Core,EventStore.Core.TransactionLog.Chunks,EventStore.Core.ClusterVNode' EventStore.Core.Services.Replication.MasterReplicationService' EventStore.Core.Services.Replication.ReplicaSubscription' EventStore.Core.TransactionLog.Chunks.TFChunk.TFChunk' EventStore.Core.Services.Storage.StorageScavenger' EventStore.Core.VNodeBuilder' EventStore.Core.TransactionLog.Chunks.TFChunk.TFChunkReadSideScavenged' EventStore.ClientAPI.Embedded.VNodeBuilder' EventStore.Core.Messages.CreateChunk' EventStore.Core.Services.ClusterStorageWriterService' EventStore.Core.Services.Replication.ReplicaService' EventStore.Core.Services.Transport.Tcp.InternalTcpDispatcher' EventStore.Core.TransactionLog.Chunks.TFChunk.TFChunkReadSideUnscavenged' EventStore.Core.Services.Storage.StorageWriterService' EventStore.Projections.Core.ProjectionWorkerNode' EventStore.Core.StandardComponents' EventStore.Core.Services.VNode.ClusterVNodeController' EventStore.Core.Services.Storage.ReaderIndex.ReadIndex' EventStore.Core.Data.Event' EventStore.Core.TransactionLog.Chunks.TFChunk.TFChunkReadSide' EventStore.Core.TransactionLog.LogRecords.PrepareLogRecord,EventStore.Common.Log.ILogger' EventStore.Common.Utils.Ensure' EventStore.Core.TransactionLog.FileNamingStrategy.IFileNamingStrategy' EventStore.Core.TransactionLog.Checkpoint.ICheckpoint' EventStore.Core.TransactionLog.Chunks.TFChunk.TFChunk' EventStore.Core.TransactionLog.Chunks.TFChunk.BulkReadResult' EventStore.Core.Helpers.IODispatcher' EventStore.Core.Index.ITableIndex' EventStore.Core.Services.Storage.ReaderIndex.IReadIndex' EventStore.Core.TransactionLog.LogRecords.CommitLogRecord' EventStore.Core.TransactionLog.Chunks.TFChunk.PosMap' EventStore.Core.Exceptions.FileBeingDeletedException' EventStore.Core.Data.Event' EventStore.Core.Services.SystemEventTypes' EventStore.Core.Services.SystemStreams' EventStore.Core.Data.ExpectedVersion' EventStore.Core.Services.UserManagement.SystemAccount' EventStore.Core.Messages.WriteEventsCompleted' EventStore.Core.Messages.OperationResult' EventStore.Core.Data.StreamMetadata' EventStore.Core.TransactionLog.LogRecords.PrepareLogRecord' EventStore.Core.TransactionLog.LogRecords.PrepareFlags' EventStore.Core.Data.EventNumber' EventStore.Core.Services.Storage.ReaderIndex.IndexReadEventResult' EventStore.Core.Data.ReadEventResult' EventStore.Core.Data.EventRecord' EventStore.Core.Index.IndexEntry' EventStore.Core.TransactionLog.RecordReadResult' EventStore.Core.TransactionLog.LogRecords.LogRecord' EventStore.Core.TransactionLog.LogRecords.SystemLogRecord' EventStore.Core.TransactionLog.LogRecords.LogRecordType' EventStore.Core.TransactionLog.RecordWriteResult' EventStore.Core.Index.FileType' EventStore.Core.TransactionLog.SeqReadResult' EventStore.Common.Utils.Application' EventStore.Common.Utils.ExitCode
EventStore.Core,EventStore.Core.TransactionLog.Chunks.TFChunk,EventStore.Core.Services.Replication.MasterReplicationService' EventStore.Core.TransactionLog.Chunks.TFChunkBulkReader' EventStore.Core.TransactionLog.Chunks.TFChunkScavenger' EventStore.Core.TransactionLog.Chunks.ChunkFooter' EventStore.Core.Services.ClusterStorageWriterService' EventStore.Core.Services.Replication.ReplicaService' EventStore.Core.TransactionLog.Chunks.TFChunkDb' EventStore.Core.TransactionLog.Chunks.TFChunkReader' EventStore.Core.TransactionLog.Chunks.TFChunkWriter' EventStore.Core.TransactionLog.Chunks.TFChunkManager,EventStore.Common.Log.ILogger' EventStore.Core.TransactionLog.Chunks.ChunkHeader' EventStore.Core.TransactionLog.Chunks.ChunkFooter' EventStore.Common.Utils.Ensure' EventStore.Core.Settings.ESConsts' EventStore.Core.TransactionLog.Chunks.TFConsts' EventStore.Core.TransactionLog.Unbuffered.UnbufferedFileStream' EventStore.Core.Util.MD5Hash' EventStore.Common.Utils.Helper' EventStore.Core.TransactionLog.Chunks.TFChunkBulkReader' EventStore.Common.Utils.Empty' EventStore.Core.TransactionLog.RecordReadResult' EventStore.Core.TransactionLog.LogRecords.LogRecord' EventStore.Core.TransactionLog.RecordWriteResult' EventStore.Core.Data.Range
EventStore.Core,EventStore.Core.TransactionLog,EventStore.Core.Services.Storage.StorageChaser' EventStore.Core.Services.Storage.EpochManager.EpochManager' EventStore.Core.Index.TableIndex' EventStore.Core.Services.Storage.ReaderIndex.AllReader' EventStore.Core.Services.Storage.ReaderIndex.IndexBackend' EventStore.Core.Services.Storage.ReaderIndex.IndexCommitter' EventStore.Core.Services.Storage.ReaderIndex.IndexReader' EventStore.Core.Services.Storage.ReaderIndex.IndexWriter' EventStore.Core.TransactionLog.Chunks.TFChunkScavenger' EventStore.Core.TransactionLog.Chunks.TFChunkReader' EventStore.Core.TransactionLog.Chunks.TFChunk.TFChunk' EventStore.Core.TransactionLog.Chunks.TFChunk.TFChunkReadSideUnscavenged' EventStore.Core.TransactionLog.Chunks.TFChunk.TFChunkReadSideScavenged' EventStore.Core.TransactionLog.Chunks.TFChunkChaser' EventStore.Core.TransactionLog.Chunks.TFChunkWriter,EventStore.Core.TransactionLog.LogRecords.LogRecord
EventStore.Core,EventStore.Core.TransactionLog.LogRecords,EventStore.Core.Services.Replication.MasterReplicationService' EventStore.Core.Cluster.MemberInfo' EventStore.Core.Messages.SubscribeReplica' EventStore.Core.Messages.EpochWritten' EventStore.Core.Services.ClusterStorageWriterService' EventStore.Core.Services.ElectionsService' EventStore.Core.Services.Gossip.NodeGossipService' EventStore.Core.Services.Replication.ReplicaService' EventStore.Core.Services.Storage.EpochManager.EpochManager' EventStore.Core.Services.Storage.EpochManager.IEpochManager' EventStore.Core.Services.Storage.StorageChaser' EventStore.Core.Services.Transport.Tcp.InternalTcpDispatcher' EventStore.Projections.Core.Services.Management.ProjectionCoreCoordinator' EventStore.Projections.Core.Services.Management.ProjectionManager' EventStore.Core.TransactionLog.Chunks.TFChunkScavenger' EventStore.Core.Services.Storage.ReaderIndex.AllReader' EventStore.Core.Services.Storage.ReaderIndex.IIndexCommitter' EventStore.Core.Services.Storage.ReaderIndex.IndexCommitter' EventStore.Core.Services.Storage.ReaderIndex.IIndexWriter' EventStore.Core.Services.Storage.ReaderIndex.IndexWriter' EventStore.Core.Services.Storage.StorageWriterService' EventStore.Core.TransactionLog.Chunks.CommitInfo' EventStore.Core.Index.TableIndex' EventStore.Core.Services.Storage.ReaderIndex.IndexReader' EventStore.Core.Messages.ClientEventText' EventStore.Core.TransactionLog.Chunks.TFChunkChaser' EventStore.Core.TransactionLog.Chunks.TFChunkReader' EventStore.Core.TransactionLog.Chunks.TFChunkWriter' EventStore.Core.TransactionLog.Chunks.TFChunk.TFChunk' EventStore.Core.TransactionLog.Chunks.TFChunk.TFChunkReadSideUnscavenged' EventStore.Core.TransactionLog.Chunks.TFChunk.TFChunkReadSideScavenged' EventStore.Core.TransactionLog.Chunks.TFChunk.TFChunkReadSide' EventStore.Core.TransactionLog.ITransactionFileChaser' EventStore.Core.TransactionLog.RecordReadResult' EventStore.Core.TransactionLog.SeqReadResult' EventStore.Core.TransactionLog.ITransactionFileWriter' EventStore.Core.Data.EventRecord' EventStore.Core.Messages.PrepareAck' EventStore.Core.Services.RequestManager.Managers.SingleAckRequestManager' EventStore.Core.Services.RequestManager.Managers.TwoPhaseRequestManagerBase' EventStore.Core.Services.Transport.Http.AutoEventConverter' EventStore.Core.Services.Transport.Http.Convert' EventStore.Projections.Core.Services.Processing.ResolvedEvent' EventStore.Core.Services.Storage.WriteResult' EventStore.Projections.Core.Services.Processing.PrepareInfo,EventStore.Core.Data.Epoch' EventStore.Common.Utils.Ensure' EventStore.Core.Data.ExpectedVersion' EventStore.Core.Services.SystemEventTypes' EventStore.Core.TransactionLog.Chunks.TFConsts
EventStore.Core,EventStore.Core.TransactionLog.FileNamingStrategy,EventStore.Core.TransactionLog.Chunks.TFChunkDbTruncator' EventStore.Core.TransactionLog.Chunks.TFChunkDbConfig' EventStore.Core.TransactionLog.Chunks.TFChunkDb' EventStore.Core.TransactionLog.Chunks.TFChunkManager,EventStore.Common.Utils.Ensure
EventStore.Core,EventStore.Core.TransactionLog.Unbuffered,EventStore.Core.Index.PTable' EventStore.Core.TransactionLog.Chunks.TFChunk.TFChunk,EventStore.Common.Utils.OS' EventStore.Common.Utils.OsFlavor
EventStore.Core,EventStore.Core.Util,EventStore.Core.Index.TableIndex' EventStore.Core.ExclusiveDbLock' EventStore.Core.Index.IndexMap' EventStore.Core.TransactionLog.Chunks.TFChunk.TFChunk' EventStore.Core.Services.Transport.Http.Controllers.ClusterWebUiController' EventStore.Projections.Core.Services.Http.ProjectionsController' EventStore.ClusterNode.Program' EventStore.ClusterNode.ClusterNodeOptions' EventStore.Core.ProgramBase<TOptions>' EventStore.Core.VNodeBuilder' EventStore.ClientAPI.Embedded.VNodeBuilder,EventStore.Common.Utils.Ensure' EventStore.Common.Utils.Empty' EventStore.Common.Log.ILogger' EventStore.Core.Services.Transport.Http.IHttpService' EventStore.Transport.Http.HttpMethod' EventStore.Transport.Http.Codecs.Codec' EventStore.Transport.Http.EntityManagement.HttpEntityManager' EventStore.Core.Services.Transport.Http.ResponseConfiguration' EventStore.Common.Utils.Helper' EventStore.Core.Services.Transport.Http.Configure' EventStore.Common.Utils.Locations' EventStore.Common.Options.ProjectionType' EventStore.Common.Utils.Platforms' EventStore.Common.Utils.Platform
EventStore.Core,EventStore.Core.Services.Monitoring.Utils,EventStore.Core.Services.Monitoring.SystemStatsHelper' EventStore.Core.Services.Monitoring.MonitoringService,EventStore.Common.Log.ILogger' EventStore.Core.Services.Monitoring.Stats.GcStats
