Project,Namespace,Ca types,Ce types
EventStore.Core,EventStore.Core.Authentication,EventStore.ClientAPI.Embedded.AuthenticationExtensions' EventStore.ClientAPI.Embedded.EmbeddedEventStoreConnection' EventStore.ClientAPI.Embedded.EmbeddedPersistentSubscription' EventStore.ClientAPI.Embedded.EmbeddedSubscriber' EventStore.ClientAPI.Embedded.EmbeddedSubscription' EventStore.ClientAPI.Embedded.EventStoreEmbeddedNodeConnection' EventStore.Core.ClusterVNode' EventStore.Core.Services.Replication.ReplicaService' EventStore.Core.Services.Transport.Http.Authentication.BasicHttpAuthenticationProvider' EventStore.Core.Services.Transport.Tcp.TcpService' EventStore.Core.Services.Transport.Tcp.TcpConnectionManager' EventStore.ClusterNode.Program' EventStore.Core.VNodeBuilder' EventStore.Core.Cluster.Settings.ClusterVNodeSettings' EventStore.ClientAPI.Embedded.VNodeBuilder' EventStore.Core.Services.Transport.Http.Authentication.TrustedHttpAuthenticationProvider' EventStore.Projections.Core.Messages.Persisted.Commands.PersistedProjectionConfig' EventStore.Projections.Core.Services.Management.SerializedRunAs' EventStore.Core.Services.UserManagement.UserManagementService,EventStore.Core.Bus.IPublisher' EventStore.Core.Bus.ISubscriber' EventStore.Core.Bus.InMemoryBus' EventStore.Core.Services.Transport.Http.HttpService' EventStore.Core.Services.HttpSendService' EventStore.Core.Services.Transport.Http.Authentication.Rfc2898PasswordHashAlgorithm' EventStore.Core.Helpers.IODispatcher' EventStore.Core.Services.UserManagement.UserManagementService' EventStore.Core.Services.Transport.Http.Authentication.PasswordChangeNotificationReader' EventStore.Core.Settings.ESConsts' EventStore.Core.Services.Transport.Http.Controllers.UsersController' EventStore.Core.Services.UserManagement.SystemAccount' EventStore.Core.Data.UserData' EventStore.Core.Messages.ReadStreamEventsBackwardCompleted' EventStore.Core.Data.ReadStreamResult' EventStore.Core.Data.EventRecord' EventStore.Core.Data.ResolvedEvent' EventStore.Core.Messages.ResetPasswordCache
EventStore.Core,EventStore.Core.Bus,EventStore.Core.ClusterVNode' EventStore.Core.Services.Replication.MasterReplicationService' EventStore.Core.Services.Storage.StorageChaser' EventStore.Core.Services.TimerService.ThreadBasedScheduler' EventStore.Core.StandardComponents' EventStore.Core.Services.SubscriptionsService' EventStore.Core.Services.PersistentSubscription.PersistentSubscriptionService' EventStore.Core.Services.Monitoring.MonitoringService' EventStore.Core.Services.Storage.StorageWriterService' EventStore.Core.Services.VNode.ClusterVNodeController' EventStore.Projections.Core.ProjectionCoreWorkersNode' EventStore.Projections.Core.ProjectionManagerNode' EventStore.Projections.Core.ProjectionsStandardComponents' EventStore.Projections.Core.ProjectionsSubsystem' EventStore.Projections.Core.ProjectionWorkerNode' EventStore.Core.Services.Storage.StorageReaderService' EventStore.Core.Services.Transport.Http.HttpService' EventStore.ClientAPI.Embedded.EventStoreEmbeddedNodeConnection' EventStore.Projections.Core.Services.Management.ProjectionCoreCoordinator' EventStore.Core.Authentication.IAuthenticationProviderFactory' EventStore.Core.Authentication.InternalAuthenticationProviderFactory' EventStore.ClientAPI.Embedded.EmbeddedEventStoreConnection' EventStore.Core.Services.ClusterStorageWriterService' EventStore.Core.Services.ElectionsService' EventStore.Core.Services.PersistentSubscription.ConsumerStrategy.DelegatePersistentSubscriptionConsumerStrategyFactory' EventStore.Core.Services.PersistentSubscription.ConsumerStrategy.IPersistentSubscriptionConsumerStrategyFactory' EventStore.Core.Services.PersistentSubscription.ConsumerStrategy.PersistentSubscriptionConsumerStrategyRegistry' EventStore.ClientAPI.Embedded.AuthenticationExtensions' EventStore.ClientAPI.Embedded.EmbeddedPersistentSubscription' EventStore.ClientAPI.Embedded.EmbeddedSubscriber' EventStore.ClientAPI.Embedded.EmbeddedSubscription' EventStore.ClientAPI.Embedded.EmbeddedSubscriptionBase<TSubscription>' EventStore.Core.Helpers.IODispatcher' EventStore.Core.Messaging.RequestResponseDispatcher<TRequest;TResponse>' EventStore.Core.Messaging.Forwarder' EventStore.Core.Messaging.F<T>' EventStore.Core.Messaging.FTracing<T>' EventStore.Core.Messaging.Balancing<T>' EventStore.Core.Messaging.PublishEnvelope' EventStore.Core.Services.RequestForwardingService' EventStore.Core.Services.Gossip.GossipServiceBase' EventStore.Core.Services.Gossip.NodeGossipService' EventStore.Core.Services.Replication.ReplicaSubscription' EventStore.Core.Services.Replication.ReplicaService' EventStore.Core.Services.Storage.EpochManager.EpochManager' EventStore.Core.Services.Storage.ReaderIndex.IndexCommitter' EventStore.Core.Services.Storage.ReaderIndex.ReadIndex' EventStore.Core.Services.RequestManager.Managers.DeleteStreamTwoPhaseRequestManager' EventStore.Core.Services.RequestManager.Managers.SingleAckRequestManager' EventStore.Core.Services.RequestManager.Managers.TransactionCommitTwoPhaseRequestManager' EventStore.Core.Services.RequestManager.Managers.TwoPhaseRequestManagerBase' EventStore.Core.Services.RequestManager.Managers.WriteStreamTwoPhaseRequestManager' EventStore.Core.Services.Storage.StorageReaderWorker' EventStore.Core.Services.Transport.Http.Authentication.HttpAuthenticationProvider' EventStore.Core.Services.Transport.Http.Authentication.PasswordChangeNotificationReader' EventStore.Core.Services.Transport.Http.Controllers.ClusterWebUiController' EventStore.Core.Services.Transport.Http.Controllers.ElectController' EventStore.Core.Services.Transport.Http.Controllers.GossipController' EventStore.Core.Services.Transport.Http.Controllers.PersistentSubscriptionController' EventStore.Core.Services.Transport.Http.Controllers.UsersController' EventStore.Core.Services.Transport.Http.Controllers.AdminController' EventStore.Core.Services.Transport.Http.Controllers.CommunicationController' EventStore.Core.Services.Transport.Http.Controllers.StatController' EventStore.Core.Services.Transport.Http.Controllers.AtomController' EventStore.Core.Services.Transport.Http.SendToHttpWithConversionEnvelope<TExpectedResponseMessage;TExpectedHttpFormattedResponseMessage>' EventStore.Core.Services.Transport.Http.SendToHttpEnvelope' EventStore.Core.Services.Transport.Http.SendToHttpEnvelope<TExpectedResponseMessage>' EventStore.Core.Services.Transport.Http.Messages.IncomingHttpRequestMessage' EventStore.Core.Services.Transport.Tcp.TcpService' EventStore.Core.Services.Transport.Tcp.SendOverTcpEnvelope' EventStore.Core.Services.Transport.Tcp.TcpConnectionManager' EventStore.Core.Services.UserManagement.UserManagementService' EventStore.Core.Services.VNode.VNodeFSMHandling<TMessage>' EventStore.Core.Services.RequestManager.RequestManagementService' EventStore.Projections.Core.Messaging.PublishToWrapEnvelop' EventStore.Projections.Core.Services.Http.ProjectionsController' EventStore.Projections.Core.Services.PublishSubscribeDispatcher<TGuid;TSubscribeRequest;TControlMessageBase;TResponseBase>' EventStore.Projections.Core.Services.ReaderSubscriptionDispatcher' EventStore.Projections.Core.Services.SpooledStreamReadingDispatcher' EventStore.Projections.Core.Services.Management.MasterCoreProjectionResponseReader' EventStore.Projections.Core.Services.Management.ManagedProjection' EventStore.Projections.Core.Services.Management.ProjectionManagerResponseReader' EventStore.Projections.Core.Services.Management.ProjectionManagerMessageDispatcher' EventStore.Projections.Core.Services.Management.ProjectionManager' EventStore.Projections.Core.Services.Processing.AllStreamsCatalogEventReader' EventStore.Projections.Core.Services.Processing.SendOutItem' EventStore.Projections.Core.Services.Processing.ByStreamCatalogEventReader' EventStore.Projections.Core.Services.Processing.ContinuousProjectionProcessingStrategy' EventStore.Projections.Core.Services.Processing.CoreProjectionCheckpointManager' EventStore.Projections.Core.Services.Processing.CoreProjectionCheckpointReader' EventStore.Projections.Core.Services.Processing.DefaultCheckpointManager' EventStore.Projections.Core.Services.Processing.EventReaderBasedProjectionProcessingStrategy' EventStore.Projections.Core.Services.Processing.DefaultProjectionProcessingStrategy' EventStore.Projections.Core.Services.Processing.EventByTypeIndexEventReader' EventStore.Projections.Core.Services.Processing.State' EventStore.Projections.Core.Services.Processing.IndexBased' EventStore.Projections.Core.Services.Processing.TfBased' EventStore.Projections.Core.Services.Processing.EventReorderingReaderSubscription' EventStore.Projections.Core.Services.Processing.ExternallyFedByStreamEventReader' EventStore.Projections.Core.Services.Processing.ExternallyFedReaderStrategy' EventStore.Projections.Core.Services.Processing.GetDataWorkItemBase' EventStore.Projections.Core.Services.Processing.GetResultWorkItem' EventStore.Projections.Core.Services.Processing.GetStateWorkItem' EventStore.Projections.Core.Services.Processing.IReaderStrategy' EventStore.Projections.Core.Services.Processing.MultiStreamEventReader' EventStore.Projections.Core.Services.Processing.MultiStreamMultiOutputCheckpointManager' EventStore.Projections.Core.Services.Processing.CoreProjectionQueue' EventStore.Projections.Core.Services.Processing.EventReader' EventStore.Projections.Core.Services.Processing.IReaderSubscription' EventStore.Projections.Core.Services.Processing.NoopCheckpointManager' EventStore.Projections.Core.Services.Processing.ParallelQueryAllStreamsMasterReaderStrategy' EventStore.Projections.Core.Services.Processing.ParallelQueryMasterProjectionProcessingPhase' EventStore.Projections.Core.Services.Processing.ParallelQueryMasterReaderStrategy' EventStore.Projections.Core.Services.Processing.ParallelQueryProcessingStrategy' EventStore.Projections.Core.Services.Processing.ProcessingStrategySelector' EventStore.Projections.Core.Services.Processing.ProjectionCoreServiceCommandReader' EventStore.Projections.Core.Services.Processing.EventReaderCoreService' EventStore.Projections.Core.Services.Processing.EventProcessingProjectionProcessingPhase' EventStore.Projections.Core.Services.Processing.EventSubscriptionBasedProjectionProcessingPhase' EventStore.Projections.Core.Services.Processing.ProjectionProcessingStrategy' EventStore.Projections.Core.Services.Processing.ReaderSubscriptionBase' EventStore.Projections.Core.Services.Processing.QueryProcessingStrategy' EventStore.Projections.Core.Services.Processing.SlaveQueryProcessingStrategy' EventStore.Projections.Core.Services.Processing.SlaveResultWriter' EventStore.Projections.Core.Services.Processing.EmittedStream' EventStore.Projections.Core.Services.Processing.HeadingEventReader' EventStore.Projections.Core.Services.Processing.ReaderStrategy' EventStore.Projections.Core.Services.Processing.SpoolStreamProcessingWorkItem' EventStore.Projections.Core.Services.Processing.StreamEventReader' EventStore.Projections.Core.Services.Processing.CoreProjection' EventStore.Projections.Core.Services.Processing.ProjectionCheckpoint' EventStore.Projections.Core.Services.Processing.ReaderSubscription' EventStore.Projections.Core.Services.Processing.TransactionFileEventReader' EventStore.Projections.Core.Services.Processing.WriteQueryEofProjectionProcessingPhase' EventStore.Projections.Core.Services.Processing.WriteQueryResultProjectionProcessingPhase' EventStore.Projections.Core.Services.Processing.WriteQueryResultProjectionProcessingPhaseBase' EventStore.Projections.Core.Services.Processing.ProjectionCoreService' EventStore.Projections.Core.Services.Processing.RequestResponseQueueForwarder' EventStore.Core.Messaging.SendToThisEnvelope' EventStore.Core.Services.Transport.Tcp.SendToWeakThisEnvelope' EventStore.Core.Services.Monitoring.SystemStatsHelper,EventStore.Common.Utils.Ensure' EventStore.Core.Messaging.Message' EventStore.Common.Log.ILogger' EventStore.Core.Messages.SystemInit' EventStore.Core.Services.Monitoring.Stats.QueueStats' EventStore.Core.TransactionLog.Checkpoint.ICheckpoint' EventStore.Core.Messages.IQueueAffineMessage' EventStore.Core.Messaging.MessageHierarchy' EventStore.Common.Utils.Application
EventStore.Core,EventStore.Core,EventStore.ClusterNode.Program' EventStore.ClientAPI.Embedded.EmbeddedEventStoreConnection' EventStore.Core.Services.VNode.ClusterVNodeController' EventStore.ClientAPI.Embedded.VNodeBuilder' EventStore.Core.Services.Transport.Http.Controllers.ClusterWebUiController' EventStore.Projections.Core.ProjectionCoreWorkersNode' EventStore.Projections.Core.ProjectionManagerNode' EventStore.Projections.Core.ProjectionsSubsystem' EventStore.ClientAPI.Embedded.EmbeddedVNodeBuilder' EventStore.ClusterNode.ClusterVNodeBuilder' EventStore.Core.Index.PTable,EventStore.Common.Log.ILogger' EventStore.Core.Data.VNodeInfo' EventStore.Core.Bus.IQueuedHandler' EventStore.Core.Bus.ISubscriber' EventStore.Core.Services.VNode.ClusterVNodeController' EventStore.Core.Services.TimerService.TimerService' EventStore.Core.Services.Transport.Http.HttpService' EventStore.Core.Services.TimerService.ITimeProvider' EventStore.Core.Authentication.IAuthenticationProvider' EventStore.Core.Bus.InMemoryBus' EventStore.Core.Bus.MultiQueuedHandler' EventStore.Common.Utils.Ensure' EventStore.Core.Cluster.Settings.ClusterVNodeSettings' EventStore.Core.Services.Histograms.HistogramService' EventStore.Core.Bus.QueuedHandler' EventStore.Core.TransactionLog.Chunks.TFChunkDbConfig' EventStore.Core.TransactionLog.Chunks.TFChunkDb' EventStore.Core.Bus.QueuedHandlerThreadPool' EventStore.Core.TransactionLog.Checkpoint.ICheckpoint' EventStore.Core.TransactionLog.Chunks.TFChunkDbTruncator' EventStore.Core.Settings.ESConsts' EventStore.Common.Utils.Application' EventStore.Core.Services.Storage.EpochManager.EpochManager' EventStore.Core.Services.Storage.ReaderIndex.ReadIndex' EventStore.Core.Bus.QueueStatsCollector' EventStore.Core.Authentication.IAuthenticationProviderFactory' EventStore.Core.Services.Transport.Tcp.TcpServiceType' EventStore.Core.Services.Transport.Tcp.TcpSecurityType' EventStore.Core.Services.Transport.Http.Controllers.GossipController' EventStore.Core.Services.Transport.Http.Controllers.ElectController' EventStore.Core.Services.Transport.Http.ServiceAccessibility' EventStore.Core.Data.GossipAdvertiseInfo' EventStore.Core.Helpers.IODispatcher' EventStore.Core.Services.ElectionsService' EventStore.Core.Services.Gossip.IGossipSeedSource' EventStore.Core.Services.Transport.Http.Controllers.InfoController' EventStore.Core.Messages.StateChangeMessage' EventStore.Core.Messages.BecomeShutdown' EventStore.Common.Utils.Helper' EventStore.Core.Util.MD5Hash' EventStore.Core.Services.Transport.Http.IHttpForwarder' EventStore.Core.Bus.IPublisher' EventStore.Common.Options.EventStoreOptions' EventStore.Core.Util.Opts' EventStore.Common.Utils.Locations' EventStore.Core.Util.DefaultFiles' EventStore.Common.Utils.VersionInfo' EventStore.Common.Log.LogManager' EventStore.Common.Utils.OS' EventStore.Common.Utils.ExitCode' EventStore.Core.Data.VNodeState' EventStore.Core.Services.Monitoring.StatsStorage' EventStore.Common.Options.ProjectionType' EventStore.Core.TransactionLog.Chunks.TFConsts' EventStore.Common.Utils.IPFinder' EventStore.Common.Utils.FileStreamExtensions' EventStore.Common.Options.IOptions' EventStore.Core.Services.PersistentSubscription.ConsumerStrategy.IPersistentSubscriptionConsumerStrategyFactory' EventStore.Core.TransactionLog.Checkpoint.Checkpoint' EventStore.Common.Utils.Runtime' EventStore.Core.TransactionLog.Chunks.ChunkHeader' EventStore.Core.TransactionLog.Chunks.ChunkFooter' EventStore.ClientAPI.Embedded.ProjectionsMode
EventStore.Core,EventStore.Core.Cluster,EventStore.Core.Messages.ClusterInfoDto' EventStore.Core.Messages.GossipReceived' EventStore.Core.Messages.SendGossip' EventStore.Core.Messages.GossipUpdated' EventStore.Core.Services.ElectionsService' EventStore.Core.Services.Gossip.GossipServiceBase' EventStore.Core.Services.VNode.ClusterVNodeController' EventStore.Core.Messages.ElectionsDone' EventStore.Core.Messages.MemberInfoDto' EventStore.Core.Services.Gossip.NodeGossipService,EventStore.Common.Utils.IPEndPointComparer' EventStore.Core.Messages.ClusterInfoDto' EventStore.Core.Data.VNodeState' EventStore.Common.Utils.Ensure' EventStore.Core.Messages.MemberInfoDto' EventStore.Core.TransactionLog.LogRecords.EpochRecord' EventStore.Core.Data.VNodeInfo
EventStore.Core,EventStore.Core.Cluster.Settings,EventStore.Core.Services.Replication.ReplicaService' EventStore.Core.ClusterVNode' EventStore.Core.VNodeBuilder' EventStore.Core.Services.VNode.ClusterVNodeController' EventStore.ClientAPI.Embedded.VNodeBuilder,EventStore.Core.Data.VNodeInfo' EventStore.Core.Data.GossipAdvertiseInfo' EventStore.Core.Services.Monitoring.StatsStorage' EventStore.Core.Authentication.IAuthenticationProviderFactory' EventStore.Core.Services.PersistentSubscription.ConsumerStrategy.IPersistentSubscriptionConsumerStrategyFactory' EventStore.Common.Utils.Ensure
EventStore.Core,EventStore.Core.DataStructures,EventStore.Core.Services.Storage.ReaderIndex.IndexBackend' EventStore.Core.Services.Storage.ReaderIndex.IndexWriter,EventStore.Common.Utils.Ensure
