Project,Namespace,Ca types,Ce types
EventStore.Core,EventStore.Core.Messaging,EventStore.Projections.Core.ProjectionCoreWorkersNode' EventStore.Projections.Core.ProjectionManagerNode' EventStore.Core.Services.Transport.Http.Controllers.PersistentSubscriptionController' EventStore.Projections.Core.ProjectionsSubsystem' EventStore.Core.Helpers.IODispatcher' EventStore.Core.Messages.GossipReceived' EventStore.Core.Messages.ReplicaSubscriptionRequest' EventStore.Core.Messages.GetReplicationStats' EventStore.Core.Messages.RequestMessage' EventStore.Core.Messages.UserManagementRequestMessage' EventStore.Core.Messages.Create' EventStore.Core.Messages.Update' EventStore.Core.Messages.Disable' EventStore.Core.Messages.Enable' EventStore.Core.Messages.Delete' EventStore.Core.Messages.ResetPassword' EventStore.Core.Messages.ChangePassword' EventStore.Core.Messages.GetAll' EventStore.Core.Messages.Get' EventStore.Core.Messages.WriteEvents' EventStore.Core.Messages.DeleteStream' EventStore.Core.Messages.TransactionStart' EventStore.Core.Messages.TransactionWrite' EventStore.Core.Messages.TransactionCommit' EventStore.Core.Messages.ReadEvent' EventStore.Core.Messages.CreatePersistentSubscription' EventStore.Core.Messages.DeletePersistentSubscription' EventStore.Core.Messages.UpdatePersistentSubscription' EventStore.Core.Messages.ConnectToPersistentSubscription' EventStore.Core.Messages.PersistentSubscriptionAckEvents' EventStore.Core.Messages.PersistentSubscriptionNakEvents' EventStore.Core.Messages.SubscribeToStream' EventStore.Core.Messages.UnsubscribeFromStream' EventStore.Core.Messages.ScavengeDatabase' EventStore.Core.Messages.GetAllPersistentSubscriptionStats' EventStore.Core.Messages.GetPersistentSubscriptionStats' EventStore.Core.Messages.GetStreamPersistentSubscriptionStats' EventStore.Core.Messages.GetFreshStats' EventStore.Core.Messages.GetFreshTcpConnectionStats' EventStore.Core.Messages.InternalStatsRequest' EventStore.Core.Messages.WritePrepares' EventStore.Core.Messages.WriteDelete' EventStore.Core.Messages.WriteCommit' EventStore.Core.Messages.WriteTransactionStart' EventStore.Core.Messages.WriteTransactionData' EventStore.Core.Messages.WriteTransactionPrepare' EventStore.Core.Messages.CheckStreamAccess' EventStore.Core.Messages.WriteRequestMessage' EventStore.Core.Messages.ReadRequestMessage' EventStore.Core.Messages.ReadStreamEventsForward' EventStore.Core.Messages.ReadStreamEventsBackward' EventStore.Core.Messages.ReadAllEventsForward' EventStore.Core.Messages.ReadAllEventsBackward' EventStore.Core.Messages.ReadNextNPersistentMessages' EventStore.Core.Messages.PersistentSubscriptionNackEvents' EventStore.Core.Messages.ReplayAllParkedMessages' EventStore.Core.Messages.ReplayParkedMessage' EventStore.Core.Messages.HttpSendMessage' EventStore.Core.Messages.HttpBeginSend' EventStore.Core.Messages.HttpSendPart' EventStore.Core.Messages.HttpEndSend' EventStore.Core.Services.AwakeReaderService.AwakeService' EventStore.Core.Services.AwakeReaderService.SubscribeAwake' EventStore.Core.Services.ElectionsService' EventStore.Core.Services.SubscriptionsService' EventStore.Core.Services.Subscription' EventStore.Core.Services.HttpSendService' EventStore.Core.Services.Gossip.GossipServiceBase' EventStore.Core.Services.PersistentSubscription.PersistentSubscription' EventStore.Core.Services.PersistentSubscription.PersistentSubscriptionClient' EventStore.Core.Services.PersistentSubscription.PersistentSubscriptionService' EventStore.Core.Services.Replication.MasterReplicationService' EventStore.Core.Services.RequestManager.Managers.DeleteStreamTwoPhaseRequestManager' EventStore.Core.Services.RequestManager.Managers.SingleAckRequestManager' EventStore.Core.Services.RequestManager.Managers.TransactionCommitTwoPhaseRequestManager' EventStore.Core.Services.RequestManager.Managers.TwoPhaseRequestManagerBase' EventStore.Core.Services.RequestManager.Managers.WriteStreamTwoPhaseRequestManager' EventStore.Core.Services.Monitoring.MonitoringService' EventStore.Core.Services.Storage.StorageReaderWorker' EventStore.Core.Services.Storage.StorageScavenger' EventStore.Core.Services.Storage.StorageReaderService' EventStore.Core.Services.Storage.StorageWriterService' EventStore.Core.Services.Transport.Http.SendToHttpWithConversionEnvelope<TExpectedResponseMessage;TExpectedHttpFormattedResponseMessage>' EventStore.Core.Services.Transport.Http.HttpService' EventStore.Core.Services.Transport.Http.SendToHttpEnvelope<TExpectedResponseMessage>' EventStore.Core.Services.Transport.Tcp.InternalTcpDispatcher' EventStore.Core.Services.Transport.Tcp.ITcpDispatcher' EventStore.Core.Services.Transport.Tcp.TcpDispatcher' EventStore.Core.Services.Transport.Tcp.ClientTcpDispatcher' EventStore.Core.Services.Transport.Tcp.TcpConnectionManager' EventStore.Core.Services.UserManagement.UserManagementService' EventStore.Core.Services.VNode.ClusterVNodeController' EventStore.Core.Services.VNode.MessageForwardingProxy' EventStore.Core.Services.VNode.Forwarding' EventStore.Core.Services.TimerService.Schedule' EventStore.Projections.Core.EventReaders.Feeds.FeedReader' EventStore.Projections.Core.Messages.GetState' EventStore.Projections.Core.Messages.GetResult' EventStore.Projections.Core.Messages.EmittedStreamAwaiting' EventStore.Projections.Core.Messages.ControlMessage' EventStore.Projections.Core.Messages.Post' EventStore.Projections.Core.Messages.Disable' EventStore.Projections.Core.Messages.Enable' EventStore.Projections.Core.Messages.Abort' EventStore.Projections.Core.Messages.SetRunAs' EventStore.Projections.Core.Messages.UpdateQuery' EventStore.Projections.Core.Messages.Reset' EventStore.Projections.Core.Messages.Delete' EventStore.Projections.Core.Messages.GetQuery' EventStore.Projections.Core.Messages.GetConfig' EventStore.Projections.Core.Messages.UpdateConfig' EventStore.Projections.Core.Messages.StartSlaveProjections' EventStore.Projections.Core.Messages.GetStatistics' EventStore.Projections.Core.Messages.RunAs' EventStore.Projections.Core.Messages.RequestSystemProjections' EventStore.Projections.Core.Messages.EventReaders.Feeds.ReadPage' EventStore.Projections.Core.Messaging.PublishToWrapEnvelop' EventStore.Projections.Core.Services.Management.ManagedProjection' EventStore.Projections.Core.Services.Management.ProjectionCoreCoordinator' EventStore.Projections.Core.Services.Management.ProjectionManager' EventStore.Projections.Core.Services.Management.NewProjectionInitializer' EventStore.Projections.Core.Services.Processing.CoreProjectionCheckpointWriter' EventStore.Projections.Core.Services.Processing.ProjectionCheckpoint' EventStore.ClientAPI.Embedded.AuthenticationExtensions' EventStore.ClientAPI.Embedded.IEmbeddedResponder' EventStore.ClientAPI.Embedded.EmbeddedResponderBase<TResult;TResponse>' EventStore.Core.Bus.ISingleConsumerMessageQueue' EventStore.Core.Bus.MPSCMessageQueue' EventStore.Core.Bus.MessageItem' EventStore.Core.Bus.QueuedHandlerAutoReset' EventStore.Core.Bus.QueuedHandlerMRES' EventStore.Core.Bus.QueueStatsCollector' EventStore.Core.Bus.QueuedHandlerThreadPool' EventStore.Core.Bus.MultiQueuedHandler' EventStore.Core.Bus.QueuedHandlerSleep' EventStore.Core.Bus.QueuedHandlerMresWithMpsc' EventStore.Core.Bus.QueuedHandlerPulse' EventStore.Core.Bus.SPSCMessageQueue' EventStore.Core.Bus.InMemoryBusUnoptimized' EventStore.Core.Bus.InMemoryBus2' EventStore.Core.Bus.InMemoryBus' EventStore.Core.Bus.IMessageHandler' EventStore.Core.Bus.MessageHandler<T>' EventStore.Core.Bus.QueuedHandlerAutoResetWithMpsc' EventStore.Core.Bus.IPublisher' EventStore.Core.Messages.PollStream' EventStore.Core.Messages.TcpForwardMessage' EventStore.Core.Messages.HttpSend' EventStore.Core.Messages.SendOverHttp' EventStore.Core.Messages.TcpSend' EventStore.Core.Services.PollSubscription' EventStore.Core.Services.Replication.ReplicaSubscription' EventStore.Core.Services.Replication.ReplicaService' EventStore.Core.Services.Transport.Http.Controllers.ElectController' EventStore.Core.Services.Transport.Http.Controllers.CommunicationController' EventStore.Core.Services.Transport.Http.Configure' EventStore.Core.Services.Transport.Http.Format' EventStore.Core.Services.Transport.Http.HttpMessagePipe' EventStore.Core.Services.Transport.Http.IMessageSender' EventStore.Core.Services.Transport.Http.MessageSender<T>' EventStore.Core.Services.VNode.VNodeFSMUnoptimized' EventStore.Core.Services.VNode.VNodeFSM' EventStore.Projections.Core.Services.Management.ProjectionManagerMessageDispatcher' EventStore.Projections.Core.Services.Processing.AllStreamsCatalogEventReader' EventStore.Projections.Core.Services.Processing.SendOutItem' EventStore.Projections.Core.Services.Processing.EventByTypeIndexEventReader' EventStore.Projections.Core.Services.Processing.IndexBased' EventStore.Projections.Core.Services.Processing.StreamEventReader' EventStore.Projections.Core.Services.Processing.TransactionFileEventReader' EventStore.Projections.Core.Services.Processing.EventSubscriptionBasedProjectionProcessingPhase,EventStore.Common.Utils.Ensure' EventStore.Core.Bus.IPublisher' EventStore.Core.Bus.IHandle' EventStore.Common.Log.ILogger' EventStore.Core.Bus.IThreadSafePublisher
EventStore.Core,EventStore.Core.PluginModel,EventStore.ClusterNode.Program,
EventStore.Core,EventStore.Core.Services.AwakeReaderService,EventStore.Projections.Core.ProjectionsSubsystem' EventStore.Core.Helpers.IODispatcher,EventStore.Core.Data.TFPos' EventStore.Core.Messaging.IEnvelope' EventStore.Core.Messages.EventCommitted' EventStore.Core.Data.EventRecord' EventStore.Core.Messages.TfEofAtNonCommitRecord' EventStore.Core.Messaging.Message
EventStore.Core,EventStore.Core.Services,EventStore.Core.ClusterVNode' EventStore.ClientAPI.Embedded.EmbeddedPersistentSubscription' EventStore.ClientAPI.Embedded.EmbeddedSubscription' EventStore.ClientAPI.Embedded.EmbeddedSubscriptionBase<TSubscription>' EventStore.ClientAPI.Embedded.IEmbeddedSubscription' EventStore.Core.Messages.SubscriptionDropped' EventStore.Core.Services.PersistentSubscription.PersistentSubscriptionClient' EventStore.Core.Services.PersistentSubscription.PersistentSubscriptionService' EventStore.Core.Services.Storage.StorageReaderWorker' EventStore.Core.Authentication.IAuthenticationProviderFactory' EventStore.Core.Authentication.InternalAuthenticationProviderFactory' EventStore.Core.Services.Transport.Http.Authentication.TrustedHttpAuthenticationProvider' EventStore.Core.Services.Transport.Http.Controllers.AtomController' EventStore.Core.Services.Transport.Http.Configure' EventStore.Projections.Core.Services.Http.ProjectionsController' EventStore.Core.Helpers.IODispatcherAsync' EventStore.Core.Helpers.IODispatcher' EventStore.Core.Services.PersistentSubscription.PersistentSubscriptionCheckpointWriter' EventStore.Core.Services.PersistentSubscription.PersistentSubscriptionMessageParker' EventStore.Core.Services.Storage.ReaderIndex.IndexCommitter' EventStore.Core.Services.Storage.ReaderIndex.IndexReader' EventStore.Core.Services.Storage.ReaderIndex.IndexWriter' EventStore.Core.Services.Monitoring.MonitoringService' EventStore.Core.Services.Storage.StorageScavenger' EventStore.Core.Services.Storage.StorageWriterService' EventStore.Core.TransactionLog.Chunks.TFChunkScavenger' EventStore.Projections.Core.Services.Processing.AllStreamsCatalogEventReader' EventStore.Projections.Core.Services.Processing.DeliverEventOutItem' EventStore.Projections.Core.Services.Processing.ByPositionStreamStatePartitionSelector' EventStore.Projections.Core.Services.Processing.ByStreamStatePartitionSelector' EventStore.Projections.Core.Services.Processing.CoreProjectionCheckpointWriter' EventStore.Projections.Core.Services.Processing.EventByTypeIndexEventFilter' EventStore.Projections.Core.Services.Processing.ParallelQueryProcessingStrategy' EventStore.Projections.Core.Services.Processing.EmittedStream' EventStore.Projections.Core.Services.Processing.TransactionFileEventFilter' EventStore.Projections.Core.Standard.IndexStreams' EventStore.Projections.Core.Standard.StreamDeletedHelper' EventStore.Core.Data.SystemSettings' EventStore.Core.Data.StreamMetadata' EventStore.Core.Services.PersistentSubscription.ConsumerStrategy.PinnedPersistentSubscriptionConsumerStrategy' EventStore.Core.TransactionLog.LogRecords.LogRecord' EventStore.Projections.Core.Services.Processing.ByStreamCatalogEventReader' EventStore.Projections.Core.Services.Processing.ResolvedEvent' EventStore.Projections.Core.Services.Processing.SpoolStreamProcessingWorkItem' EventStore.Projections.Core.Standard.CategorizeEventsByStreamPath' EventStore.Projections.Core.Standard.CategorizeStreamByPath' EventStore.Core.Services.UserManagement.UserManagementService' EventStore.Core.Services.Transport.Http.Controllers.InfoController' EventStore.Core.Services.Transport.Http.Controllers.AdminController' EventStore.Projections.Core.Messages.RunAs' EventStore.Core.Services.PersistentSubscription.ConsumerStrategy.PersistentSubscriptionConsumerStrategyRegistry' EventStore.Core.Services.PersistentSubscription.PersistentSubscriptionConfig' EventStore.Core.Services.Transport.Http.Controllers.PersistentSubscriptionController' EventStore.Core.Services.Transport.Tcp.ClientTcpDispatcher,EventStore.Common.Log.ILogger' EventStore.Core.Helpers.LengthPrefixSuffixFramer' EventStore.Core.TransactionLog.Chunks.TFChunk.TFChunk' EventStore.Common.Utils.Ensure' EventStore.Core.TransactionLog.Chunks.TFConsts' EventStore.Core.Bus.IPublisher' EventStore.Core.Bus.ISubscriber' EventStore.Core.TransactionLog.Chunks.TFChunkDb' EventStore.Core.TransactionLog.Chunks.TFChunkWriter' EventStore.Core.Services.Storage.ReaderIndex.IIndexWriter' EventStore.Core.Services.Storage.EpochManager.IEpochManager' EventStore.Core.Messages.StateChangeMessage' EventStore.Core.Data.VNodeState' EventStore.Core.Services.Storage.StorageWriterService' EventStore.Core.TransactionLog.LogRecords.EpochRecord' EventStore.Core.Messages.ReplicaSubscribed' EventStore.Core.TransactionLog.Checkpoint.ICheckpoint' EventStore.Core.TransactionLog.Chunks.TFChunkDbConfig' EventStore.Core.Messages.CreateChunk' EventStore.Core.TransactionLog.Chunks.TFChunkManager' EventStore.Core.TransactionLog.Chunks.ChunkHeader' EventStore.Core.Messages.RawChunkBulk' EventStore.Core.Services.Replication.MasterReplicationService' EventStore.Core.Messages.DataChunkBulk' EventStore.Core.TransactionLog.LogRecords.LogRecord' EventStore.Common.Utils.Application' EventStore.Common.Utils.ExitCode' EventStore.Common.Utils.IPEndPointComparer' EventStore.Core.Messaging.IEnvelope' EventStore.Core.Data.VNodeInfo' EventStore.Core.Cluster.MemberInfo' EventStore.Core.Messages.BecomeShuttingDown' EventStore.Core.Cluster.ClusterInfo' EventStore.Core.Messages.GossipUpdated' EventStore.Core.Services.TimerService.Schedule' EventStore.Core.Services.TimerService.TimerMessage' EventStore.Core.Messages.StartElections' EventStore.Core.Messages.ElectionsTimedOut' EventStore.Core.Messages.ViewChange' EventStore.Core.Messaging.Message' EventStore.Core.Messages.SendViewChangeProof' EventStore.Core.Messages.ViewChangeProof' EventStore.Core.Messages.PrepareOk' EventStore.Core.Messages.Prepare' EventStore.Core.Messages.Proposal' EventStore.Core.Messages.Accept' EventStore.Core.Services.VNode.MessageForwardingProxy' EventStore.Core.Messages.SystemStart' EventStore.Core.Messages.RequestForwardingTimerTick' EventStore.Core.Messages.NotHandled' EventStore.Core.Messages.WriteEventsCompleted' EventStore.Core.Messages.TransactionStartCompleted' EventStore.Core.Messages.TransactionWriteCompleted' EventStore.Core.Messages.TransactionCommitCompleted' EventStore.Core.Messages.DeleteStreamCompleted' EventStore.Core.Bus.IQueuedHandler' EventStore.Core.Services.Storage.ReaderIndex.IReadIndex' EventStore.Core.Services.Transport.Tcp.TcpConnectionManager' EventStore.Core.Messages.ConnectionClosed' EventStore.Core.Services.Storage.ReaderIndex.StreamAccess' EventStore.Core.Messages.SubscriptionConfirmation' EventStore.Core.Messages.SubscribeToStream' EventStore.Core.Services.Storage.ReaderIndex.StreamAccessType' EventStore.Core.Messages.UnsubscribeFromStream' EventStore.Core.Messages.PollStream' EventStore.Core.Messages.CheckPollTimeout' EventStore.Core.Messages.ReadStreamEventsForward' EventStore.Core.Messages.ReadAllEventsForward' EventStore.Core.Messages.EventCommitted' EventStore.Core.Data.EventRecord' EventStore.Core.Data.ResolvedEvent' EventStore.Core.Services.Storage.ReaderIndex.IndexReadEventResult' EventStore.Common.Utils.Helper' EventStore.Core.Data.ReadEventResult' EventStore.Core.Services.Transport.Http.HttpMessagePipe' EventStore.Core.Messages.ReplicaStateMessage' EventStore.Core.Messages.SendOverHttp' EventStore.Core.Messages.DeniedToHandle' EventStore.Core.Services.Transport.Http.ResponseConfiguration' EventStore.Core.Messages.HttpSend' EventStore.Core.Messages.DenialReason' EventStore.Transport.Http.HttpStatusCode' EventStore.Transport.Http.EntityManagement.HttpEntityManager' EventStore.Core.Services.Histograms.HistogramService' EventStore.Core.Messages.HttpBeginSend' EventStore.Core.Messages.HttpSendPart' EventStore.Core.Messages.HttpEndSend' EventStore.Transport.Http.EntityManagement.HttpEntity' EventStore.Transport.Http.ProxyHeaders' EventStore.Core.Messages.TcpSend
EventStore.Core,EventStore.Core.Services.Gossip,EventStore.Core.ClusterVNode' EventStore.Core.VNodeBuilder' EventStore.ClientAPI.Embedded.VNodeBuilder,EventStore.Common.Log.ILogger' EventStore.Core.Data.VNodeInfo' EventStore.Core.Data.VNodeState' EventStore.Core.Bus.IPublisher' EventStore.Core.Messaging.IEnvelope' EventStore.Core.Cluster.ClusterInfo' EventStore.Common.Utils.Ensure' EventStore.Core.Cluster.MemberInfo' EventStore.Core.Messages.SystemInit' EventStore.Core.Services.TimerService.Schedule' EventStore.Core.Services.TimerService.TimerMessage' EventStore.Core.Messages.RetrieveGossipSeedSources' EventStore.Core.Messages.GotGossipSeedSources' EventStore.Core.Messages.Gossip' EventStore.Core.Messages.GossipReceived' EventStore.Core.Messages.ReplicaStateMessage' EventStore.Core.Messages.StateChangeMessage' EventStore.Core.Messages.GossipSendFailed' EventStore.Core.Messages.VNodeConnectionLost' EventStore.Core.Messages.VNodeConnectionEstablished' EventStore.Common.Utils.IPEndPointComparer' EventStore.Core.TransactionLog.Checkpoint.ICheckpoint' EventStore.Core.Services.Storage.EpochManager.IEpochManager' EventStore.Core.TransactionLog.LogRecords.EpochRecord
EventStore.Core,EventStore.Core.Services.Histograms,EventStore.Core.ClusterVNode' EventStore.Core.Services.HttpSendService' EventStore.Core.Services.TcpSendService' EventStore.Core.Services.Storage.StorageReaderWorker' EventStore.Core.Services.Storage.StorageChaser' EventStore.Core.Services.Storage.StorageWriterService' EventStore.Core.Services.Transport.Http.Controllers.HistogramController' EventStore.Core.Services.RequestManager.RequestManagementService,
EventStore.Core,EventStore.Core.Services.PersistentSubscription.ConsumerStrategy,EventStore.Core.Services.PersistentSubscription.PersistentSubscription' EventStore.Core.Services.PersistentSubscription.PersistentSubscriptionClientCollection' EventStore.Core.Services.PersistentSubscription.PersistentSubscriptionParams' EventStore.Core.Services.PersistentSubscription.PersistentSubscriptionParamsBuilder' EventStore.Core.Services.PersistentSubscription.PersistentSubscriptionStats' EventStore.Core.VNodeBuilder' EventStore.Core.Cluster.Settings.ClusterVNodeSettings' EventStore.ClientAPI.Embedded.VNodeBuilder' EventStore.Core.Services.PersistentSubscription.PersistentSubscriptionService,EventStore.Core.Bus.IPublisher' EventStore.Core.Bus.ISubscriber' EventStore.Core.Services.PersistentSubscription.PersistentSubscriptionClient' EventStore.Core.Data.ResolvedEvent' EventStore.Core.Services.SystemConsumerStrategies' EventStore.Core.Index.Hashes.IHasher' EventStore.Core.Services.PersistentSubscription.ConsumerStrategy.PinnedState.PinnedConsumerState' EventStore.Core.Services.PersistentSubscription.ConsumerStrategy.PinnedState.Node' EventStore.Core.Services.PersistentSubscription.ConsumerStrategy.PinnedState.BucketAssignment' EventStore.Core.Services.PersistentSubscription.ConsumerStrategy.PinnedState.BucketState' EventStore.Core.Data.EventRecord' EventStore.Core.Services.SystemEventTypes' EventStore.Common.Utils.Helper
EventStore.Core,EventStore.Core.Services.PersistentSubscription.ConsumerStrategy.PinnedState,EventStore.Core.Services.PersistentSubscription.ConsumerStrategy.PinnedPersistentSubscriptionConsumerStrategy,EventStore.Core.Services.PersistentSubscription.PersistentSubscriptionClient
EventStore.Core,EventStore.Core.Services.PersistentSubscription,EventStore.Core.Services.Transport.Http.Controllers.PersistentSubscriptionController' EventStore.Core.Services.PersistentSubscription.ConsumerStrategy.DispatchToSinglePersistentSubscriptionConsumerStrategy' EventStore.Core.Services.PersistentSubscription.ConsumerStrategy.IPersistentSubscriptionConsumerStrategy' EventStore.Core.Services.PersistentSubscription.ConsumerStrategy.PinnedPersistentSubscriptionConsumerStrategy' EventStore.Core.Services.PersistentSubscription.ConsumerStrategy.RoundRobinPersistentSubscriptionConsumerStrategy' EventStore.Core.Services.PersistentSubscription.ConsumerStrategy.PinnedState.Node,EventStore.Core.Data.ResolvedEvent' EventStore.Common.Log.ILogger' EventStore.Common.Utils.Ensure' EventStore.Core.Data.EventRecord' EventStore.Core.Services.PersistentSubscription.ConsumerStrategy.ConsumerPushResult' EventStore.Core.Messaging.IEnvelope' EventStore.Core.Messages.OperationResult' EventStore.Core.Messages.SubscriptionInfo' EventStore.Core.Helpers.IODispatcher' EventStore.Core.Services.UserManagement.SystemAccount' EventStore.Core.Messages.ReadStreamEventsBackwardCompleted' EventStore.Core.Messages.ReadStreamEventsForwardCompleted' EventStore.Core.Data.ExpectedVersion' EventStore.Core.Data.Event' EventStore.Core.Services.SystemStreams' EventStore.Core.Messages.WriteEventsCompleted' EventStore.Core.Data.StreamAcl' EventStore.Core.Data.StreamMetadata' EventStore.Core.Services.SystemRoles' EventStore.Core.Services.SystemEventTypes' EventStore.Core.Services.SubscriptionDropReason' EventStore.Core.Services.PersistentSubscription.ConsumerStrategy.IPersistentSubscriptionConsumerStrategy' EventStore.Core.Services.SystemConsumerStrategies' EventStore.Core.Data.ReadStreamResult' EventStore.Core.Bus.IQueuedHandler' EventStore.Core.Services.Storage.ReaderIndex.IReadIndex' EventStore.Core.Bus.IPublisher' EventStore.Core.Services.PersistentSubscription.ConsumerStrategy.PersistentSubscriptionConsumerStrategyRegistry' EventStore.Core.Data.VNodeState' EventStore.Core.Services.TimerService.Schedule' EventStore.Core.Services.TimerService.TimerMessage' EventStore.Core.Messages.StateChangeMessage' EventStore.Core.Messages.BecomeMaster' EventStore.Core.Messages.BecomeShuttingDown' EventStore.Core.Messages.UnsubscribeFromStream' EventStore.Core.Services.Storage.ReaderIndex.StreamAccess' EventStore.Core.Messages.CreatePersistentSubscription' EventStore.Core.Services.Storage.ReaderIndex.StreamAccessType' EventStore.Core.Messages.CreatePersistentSubscriptionResult' EventStore.Core.Messages.CreatePersistentSubscriptionCompleted' EventStore.Core.Messages.ClientMessage' EventStore.Core.Messages.UpdatePersistentSubscription' EventStore.Core.Messages.UpdatePersistentSubscriptionResult' EventStore.Core.Messages.UpdatePersistentSubscriptionCompleted' EventStore.Core.Messages.DeletePersistentSubscription' EventStore.Core.Messages.DeletePersistentSubscriptionResult' EventStore.Core.Messages.DeletePersistentSubscriptionCompleted' EventStore.Core.Services.Transport.Tcp.TcpConnectionManager' EventStore.Core.Messages.ConnectionClosed' EventStore.Core.Messages.PersistentSubscriptionConfirmation' EventStore.Core.Messages.ConnectToPersistentSubscription' EventStore.Core.Messages.EventCommitted' EventStore.Core.Services.Storage.ReaderIndex.IndexReadEventResult' EventStore.Common.Utils.Helper' EventStore.Core.Data.ReadEventResult' EventStore.Core.Messages.PersistentSubscriptionAckEvents' EventStore.Core.Messages.PersistentSubscriptionNackEvents' EventStore.Core.Messages.ReadNextNPersistentMessages' EventStore.Core.Messages.ReadNextNPersistentMessagesResult' EventStore.Core.Messages.ReadNextNPersistentMessagesCompleted' EventStore.Core.Messages.ReplayAllParkedMessages' EventStore.Core.Messages.ReplayMessagesReceivedResult' EventStore.Core.Messages.ReplayMessagesReceived' EventStore.Core.Messages.ReplayParkedMessage' EventStore.Core.Messages.GetPersistentSubscriptionStats' EventStore.Core.Messages.OperationStatus' EventStore.Core.Messages.GetPersistentSubscriptionStatsCompleted' EventStore.Core.Messages.MonitoringMessage' EventStore.Core.Messages.GetStreamPersistentSubscriptionStats' EventStore.Core.Messages.GetAllPersistentSubscriptionStats' EventStore.Core.Messages.PersistentSubscriptionTimerTick
