Project,Namespace,Ca types,Ce types
Mono.NuoDb.Data.Client_4.0,NuoDb.Data.Client,,NuoDb.Data.Client.EntityFramework6.NuoDbProviderServices' NuoDb.Data.Client.EntityFramework.NuoDbProviderServices' NuoDb.Data.Client.EntityFramework.NuoDbProviderServices' NuoDb.Data.Client.Security.RemotePassword' NuoDb.Data.Client.Security.CipherRC4' NuoDb.Data.Client.Util.StringUtils' NuoDb.Data.Client.Xml.Tag' NuoDb.Data.Client.Net.CryptoInputStream' NuoDb.Data.Client.Net.CryptoOutputStream' NuoDb.Data.Client.Net.CryptoSocket' NuoDb.Data.Client.Util.StringUtils' NuoDb.Data.Client.Net.CryptoInputStream' NuoDb.Data.Client.Net.CryptoOutputStream' NuoDb.Data.Client.Net.CryptoSocket' NuoDb.Data.Client.Security.RemotePassword' NuoDb.Data.Client.Security.CipherRC4' NuoDb.Data.Client.Xml.Tag' NuoDb.Data.Client.Security.RemotePassword' NuoDb.Data.Client.Security.CipherRC4' NuoDb.Data.Client.Util.StringUtils' NuoDb.Data.Client.Xml.Tag' NuoDb.Data.Client.Net.CryptoInputStream' NuoDb.Data.Client.Net.CryptoOutputStream' NuoDb.Data.Client.Net.CryptoSocket' NuoDb.Data.Client.Security.RemotePassword' NuoDb.Data.Client.Security.CipherRC4' NuoDb.Data.Client.Util.StringUtils' NuoDb.Data.Client.Xml.Tag' NuoDb.Data.Client.Net.CryptoInputStream' NuoDb.Data.Client.Net.CryptoOutputStream' NuoDb.Data.Client.Net.CryptoSocket' NuoDb.Data.Client.Security.RemotePassword' NuoDb.Data.Client.Security.CipherRC4' NuoDb.Data.Client.Util.StringUtils' NuoDb.Data.Client.Xml.Tag' NuoDb.Data.Client.Net.CryptoInputStream' NuoDb.Data.Client.Net.CryptoOutputStream' NuoDb.Data.Client.Net.CryptoSocket' NuoDb.Data.Client.Security.BigInteger' NuoDb.Data.Client.Security.BigInteger' NuoDb.Data.Client.Security.BigInteger' NuoDb.Data.Client.Security.BigInteger' NuoDb.Data.Client.Security.BigInteger
Mono.NuoDb.Data.Client_4.0,NuoDb.Data.Client.Security,NuoDb.Data.Client.EncodedDataStream' NuoDb.Data.Client.NuoDbConnectionInternal' NuoDb.Data.Client.Net.CryptoOutputStream' NuoDb.Data.Client.Net.CryptoInputStream,
Mono.NuoDb.Data.Client_4.0,NuoDb.Data.Client.Util,NuoDb.Data.Client.Xml.Tag' NuoDb.Data.Client.NuoDbConnectionInternal,
Mono.NuoDb.Data.Client_4.0,NuoDb.Data.Client.Xml,NuoDb.Data.Client.NuoDbConnectionInternal,NuoDb.Data.Client.Util.Op' NuoDb.Data.Client.Util.Op' NuoDb.Data.Client.Util.Op' NuoDb.Data.Client.Util.Op' NuoDb.Data.Client.Util.Op
Mono.NuoDb.Data.Client_4.0,NuoDb.Data.Client.Net,NuoDb.Data.Client.DataStream' NuoDb.Data.Client.NuoDbConnectionInternal' NuoDb.Data.Client.EncodedDataStream,NuoDb.Data.Client.Security.Cipher' NuoDb.Data.Client.Security.Cipher' NuoDb.Data.Client.Security.Cipher' NuoDb.Data.Client.Security.Cipher' NuoDb.Data.Client.Security.Cipher
