Project,Namespace,Ca types,Ce types
C3DE,C3DE.Graphics,C3DE.Components.Controllers.Mobile.SwipeZone' C3DE.Components.Controllers.Mobile.VirtualGamepad' C3DE.Skybox' C3DE.UI.GUISkin' C3DE.Components.Lighting.Light,C3DE.Application' C3DE.Utils.RandomHelper' C3DE.Application' C3DE.Utils.RandomHelper' C3DE.Components.Rendering.Renderer' C3DE.Components.Lighting.Light' C3DE.Components.Rendering.Renderer' C3DE.Components.Lighting.Light
C3DE,C3DE.Utils,C3DE.Components.Rendering.Terrain' C3DE.Graphics.TextureFactory,
C3DE,OculusRiftSample,C3DE.VR.OculusRiftService,
C3DE,C3DE.VR,C3DE.Graphics.Rendering.BaseRenderer' C3DE.Graphics.PostProcessing.PostProcessPass' C3DE.Demo.Scripts.MotionController' C3DE.Graphics.PostProcessing.Tonemapping' C3DE.Graphics.PostProcessing.FastPostProcessing' C3DE.Graphics.PostProcessing.GrayScaleFilter' C3DE.Graphics.PostProcessing.FilmFilter' C3DE.Graphics.PostProcessing.C64Filter' C3DE.Graphics.PostProcessing.Vignette' C3DE.Graphics.PostProcessing.ConvolutionFilter' C3DE.Graphics.PostProcessing.CGAFilter' C3DE.Graphics.PostProcessing.FastBloom' C3DE.Graphics.PostProcessing.SimpleBlur' C3DE.Graphics.PostProcessing.GlobalFog,OculusRiftSample.OculusRift' OculusRiftSample.OculusRift' OculusRiftSample.OculusRift' Valve.VR.EVRButtonId' Valve.VR.EVRButtonId' Valve.VR.EVRButtonId' C3DE.Components.Camera' Valve.VR.CVRSystem' Valve.VR.ETrackingUniverseOrigin' Valve.VR.TrackedDevicePose_t' Valve.VR.VRControllerState_t' C3DE.Components.Camera' Valve.VR.CVRSystem' Valve.VR.ETrackingUniverseOrigin' Valve.VR.TrackedDevicePose_t' Valve.VR.VRControllerState_t' C3DE.Components.Camera' Valve.VR.CVRSystem' Valve.VR.ETrackingUniverseOrigin' Valve.VR.TrackedDevicePose_t' Valve.VR.VRControllerState_t' Valve.VR.HmdMatrix34_t' Valve.VR.HmdMatrix44_t' Valve.VR.HmdMatrix34_t' Valve.VR.HmdMatrix44_t' Valve.VR.HmdMatrix34_t' Valve.VR.HmdMatrix44_t' C3DE.Application' C3DE.Application' C3DE.Application' C3DE.Input' C3DE.Screen' C3DE.Time' C3DE.Input' C3DE.Screen' C3DE.Time' C3DE.Input' C3DE.Screen' C3DE.Time' C3DE.Debug' Valve.VR.EVREye' Valve.VR.ETextureType' Valve.VR.EColorSpace' Valve.VR.ETrackedDeviceClass' Valve.VR.ETrackedControllerRole' Valve.VR.ETrackedDeviceProperty' Valve.VR.ETrackedPropertyError' Valve.VR.EVRSubmitFlags' Valve.VR.EVRInitError' Valve.VR.Texture_t' Valve.VR.VRTextureBounds_t' Valve.VR.VREvent_t' Valve.VR.OpenVR' C3DE.Debug' Valve.VR.EVREye' Valve.VR.ETextureType' Valve.VR.EColorSpace' Valve.VR.ETrackedDeviceClass' Valve.VR.ETrackedControllerRole' Valve.VR.ETrackedDeviceProperty' Valve.VR.ETrackedPropertyError' Valve.VR.EVRSubmitFlags' Valve.VR.EVRInitError' Valve.VR.Texture_t' Valve.VR.VRTextureBounds_t' Valve.VR.VREvent_t' Valve.VR.OpenVR' C3DE.Debug' Valve.VR.EVREye' Valve.VR.ETextureType' Valve.VR.EColorSpace' Valve.VR.ETrackedDeviceClass' Valve.VR.ETrackedControllerRole' Valve.VR.ETrackedDeviceProperty' Valve.VR.ETrackedPropertyError' Valve.VR.EVRSubmitFlags' Valve.VR.EVRInitError' Valve.VR.Texture_t' Valve.VR.VRTextureBounds_t' Valve.VR.VREvent_t' Valve.VR.OpenVR
C3DE,Valve.VR,C3DE.VR.OpenVRService' C3DE.VR.OpenVRController' C3DE.VR.ButtonMask' C3DE.VR.OpenVRExtensions,
