Project,Namespace,Ca types,Ce types
C3DE,C3DE,C3DE.Components.Rendering.LensFlare' C3DE.Components.Rendering.BoundingBoxRenderer' C3DE.Components.Rendering.RigidbodyRenderer' C3DE.VR.OpenHMDService' C3DE.Components.Rendering.Terrain' C3DE.Graphics.Materials.PBRMaterial' C3DE.Graphics.Materials.StandardMaterial' C3DE.Graphics.Materials.UnlitMaterial' C3DE.Graphics.Materials.LavaMaterial' C3DE.Graphics.PostProcessing.TemporaryRenderTarget' C3DE.Graphics.Materials.StandardTerrainMaterial' C3DE.Graphics.PostProcessing.PostProcessManager' C3DE.Graphics.Primitives.Mesh' C3DE.Graphics.Materials.TransparentMaterial' C3DE.Graphics.Materials.StandardWaterMaterial' C3DE.Graphics.Materials.Material' C3DE.Graphics.Rendering.BaseRenderer' C3DE.Graphics.ShadowGenerator' C3DE.Resources.ResourcesHelper' C3DE.Graphics.PostProcessing.PostProcessPass' C3DE.Components.Rendering.DepthRenderer' C3DE.VR.OpenVRService' C3DE.VR.VRManager' C3DE.Graphics.PostProcessing.GlobalFog' C3DE.Components.Rendering.ReflectionProbe' C3DE.Components.Lighting.Light' C3DE.Components.Camera' C3DE.Graphics.TextureFactory' C3DE.VR.NullVRService' C3DE.Components.Controllers.Mobile.SwipeZone' C3DE.Components.Controllers.Mobile.VirtualButton' C3DE.Components.Controllers.Mobile.VirtualGamepad' C3DE.Graphics.PostProcessing.MotionBlur' C3DE.Components.Controllers.FirstPersonController' C3DE.Components.Controllers.OrbitController' C3DE.UI.GUI' C3DE.Graphics.PostProcessing.ConvolutionFilter' C3DE.Graphics.Materials.Shaders.LPPStandardTerrain' C3DE.Graphics.Materials.Shaders.LPPStandardWater' C3DE.Graphics.Materials.Shaders.LPPStandard' C3DE.Inputs.MouseComponent' C3DE.Components.Component' Microsoft.Xna.Framework.Graphics.ModelExtensions' C3DE.Graphics.Materials.Shaders.Forward.ForwardPBR' C3DE.Graphics.Rendering.DeferredRenderer' C3DE.Graphics.Rendering.ForwardRenderer' C3DE.Graphics.Materials.Shaders.ForwardTransparent' C3DE.Graphics.Materials.Shaders.ForwardSkybox' C3DE.Graphics.Rendering.LightPrePassRenderer' C3DE.Graphics.Materials.Shaders.ForwardStandardBase' C3DE.Components.Physics.Rigidbody' C3DE.Graphics.Materials.Shaders.DeferredSkybox' C3DE.Graphics.PostProcessing.FilmFilter' C3DE.Graphics.Materials.Shaders.ForwardStandardWater' C3DE.Graphics.Materials.Shaders.ForwardLava' C3DE.Components.Coroutine,C3DE.Components.Camera' C3DE.Components.Rendering.MeshRenderer' C3DE.Components.Rendering.Terrain' C3DE.Components.Rendering.ModelRenderer' C3DE.Components.Physics.BoxCollider' C3DE.Components.Physics.SphereCollider' C3DE.Components.Lighting.LightType' C3DE.Components.Lighting.Light' C3DE.Demo.Scripts.MotionController' C3DE.Graphics.Materials.LavaMaterial' C3DE.Graphics.Materials.StandardWaterMaterial' C3DE.Graphics.Primitives.CubeMesh' C3DE.Graphics.Primitives.CylinderMesh' C3DE.Graphics.Primitives.Mesh' C3DE.Graphics.Primitives.PlaneMesh' C3DE.Graphics.Primitives.SphereMesh' C3DE.Components.Camera' C3DE.Components.Rendering.MeshRenderer' C3DE.Components.Rendering.Terrain' C3DE.Components.Rendering.ModelRenderer' C3DE.Components.Physics.BoxCollider' C3DE.Components.Physics.SphereCollider' C3DE.Components.Lighting.LightType' C3DE.Components.Lighting.Light' C3DE.Demo.Scripts.MotionController' C3DE.Graphics.Materials.LavaMaterial' C3DE.Graphics.Materials.StandardWaterMaterial' C3DE.Graphics.Primitives.CubeMesh' C3DE.Graphics.Primitives.CylinderMesh' C3DE.Graphics.Primitives.Mesh' C3DE.Graphics.Primitives.PlaneMesh' C3DE.Graphics.Primitives.SphereMesh' C3DE.Components.Camera' C3DE.Components.Rendering.MeshRenderer' C3DE.Components.Rendering.Terrain' C3DE.Components.Rendering.ModelRenderer' C3DE.Components.Physics.BoxCollider' C3DE.Components.Physics.SphereCollider' C3DE.Components.Lighting.LightType' C3DE.Components.Lighting.Light' C3DE.Demo.Scripts.MotionController' C3DE.Graphics.Materials.LavaMaterial' C3DE.Graphics.Materials.StandardWaterMaterial' C3DE.Graphics.Primitives.CubeMesh' C3DE.Graphics.Primitives.CylinderMesh' C3DE.Graphics.Primitives.Mesh' C3DE.Graphics.Primitives.PlaneMesh' C3DE.Graphics.Primitives.SphereMesh' C3DE.Inputs.TouchComponent' C3DE.Inputs.GamepadComponent' C3DE.Inputs.KeyboardComponent' C3DE.Inputs.MouseComponent' C3DE.Inputs.TouchComponent' C3DE.Inputs.GamepadComponent' C3DE.Inputs.KeyboardComponent' C3DE.Inputs.MouseComponent' C3DE.Inputs.TouchComponent' C3DE.Inputs.GamepadComponent' C3DE.Inputs.KeyboardComponent' C3DE.Inputs.MouseComponent' C3DE.Components.Physics.Collider' C3DE.Components.Physics.Collider' C3DE.Components.Physics.Collider' C3DE.UI.GUI' C3DE.UI.GUI' C3DE.UI.GUI' C3DE.Components.Component' C3DE.Components.Component' C3DE.Components.Component' C3DE.Graphics.Rendering.BaseRenderer' C3DE.Graphics.Rendering.ForwardRenderer' C3DE.Graphics.Rendering.BaseRenderer' C3DE.Graphics.Rendering.ForwardRenderer' C3DE.Graphics.Rendering.BaseRenderer' C3DE.Graphics.Rendering.ForwardRenderer' C3DE.Graphics.Materials.Material' C3DE.Graphics.Materials.Material' C3DE.Graphics.Materials.Material' C3DE.Components.Behaviour' C3DE.Components.Rendering.ReflectionProbe' C3DE.Components.Rendering.Renderer' C3DE.Graphics.Materials.UnlitMaterial' C3DE.Graphics.PostProcessing.PostProcessPass' C3DE.Components.Behaviour' C3DE.Components.Rendering.ReflectionProbe' C3DE.Components.Rendering.Renderer' C3DE.Graphics.Materials.UnlitMaterial' C3DE.Graphics.PostProcessing.PostProcessPass' C3DE.Components.Behaviour' C3DE.Components.Rendering.Renderer' C3DE.Graphics.Materials.UnlitMaterial' C3DE.Graphics.PostProcessing.PostProcessPass' C3DE.Components.Transform' C3DE.Graphics.Primitives.PrimitiveTypes' C3DE.Graphics.Primitives.QuadMesh' C3DE.Graphics.Primitives.PyramidMesh' C3DE.Graphics.Primitives.TorusMesh' C3DE.Components.Transform' C3DE.Graphics.Primitives.PrimitiveTypes' C3DE.Graphics.Primitives.QuadMesh' C3DE.Graphics.Primitives.PyramidMesh' C3DE.Graphics.Primitives.TorusMesh' C3DE.Components.Transform' C3DE.Graphics.Primitives.PrimitiveTypes' C3DE.Graphics.Primitives.QuadMesh' C3DE.Graphics.Primitives.PyramidMesh' C3DE.Graphics.Primitives.TorusMesh' C3DE.Graphics.Materials.Shaders.DeferredSkybox' C3DE.Graphics.Materials.Shaders.ForwardSkybox' C3DE.Graphics.Materials.Shaders.ShaderMaterial' C3DE.Graphics.PostProcessing.QuadRenderer' C3DE.Graphics.Rendering.DeferredRenderer' C3DE.Graphics.TextureFactory' C3DE.Graphics.Materials.Shaders.DeferredSkybox' C3DE.Graphics.Materials.Shaders.ForwardSkybox' C3DE.Graphics.Materials.Shaders.ShaderMaterial' C3DE.Graphics.PostProcessing.QuadRenderer' C3DE.Graphics.Rendering.DeferredRenderer' C3DE.Graphics.TextureFactory' C3DE.Graphics.Materials.Shaders.DeferredSkybox' C3DE.Graphics.Materials.Shaders.ForwardSkybox' C3DE.Graphics.Materials.Shaders.ShaderMaterial' C3DE.Graphics.PostProcessing.QuadRenderer' C3DE.Graphics.Rendering.DeferredRenderer
C3DE,C3DE.Components,C3DE.Components.Controllers.Controller' C3DE.Components.Controllers.Mobile.VirtualButton' C3DE.Components.Controllers.Mobile.SwipeZone' C3DE.Demo.Scripts.MotionController' C3DE.Graphics.Rendering.BaseRenderer' C3DE.Components.Controllers.Mobile.VirtualGamepad' C3DE.Scene' C3DE.Graphics.Materials.Shaders.DeferredSkybox' C3DE.Graphics.Materials.Shaders.ForwardTransparent' C3DE.Graphics.Materials.Shaders.ForwardLava' C3DE.Graphics.Materials.Shaders.ForwardSkybox' C3DE.Graphics.Materials.Shaders.DeferredStandard' C3DE.Graphics.Materials.Shaders.DeferredStandardWater' C3DE.Components.Rendering.RigidbodyRenderer' C3DE.Components.Rendering.LensFlare' C3DE.Components.Rendering.BoundingBoxRenderer' C3DE.Components.Lighting.Light' C3DE.Graphics.Materials.Shaders.ShaderMaterial' C3DE.Graphics.Materials.Shaders.ForwardUnlit' C3DE.Graphics.Materials.Shaders.LPPStandardWater' C3DE.Graphics.Materials.Shaders.LPPStandard' C3DE.Graphics.Materials.Shaders.ForwardStandardBase' C3DE.SceneManager' C3DE.Skybox' C3DE.VR.OpenVRController' C3DE.Components.Rendering.ModelRenderer' C3DE.Graphics.Rendering.ForwardRenderer' C3DE.Components.Rendering.ReflectionProbe' C3DE.Graphics.Materials.Shaders.DeferredStandardTerrain' C3DE.Graphics.Rendering.DeferredRenderer' C3DE.Graphics.Materials.Shaders.LPPStandardTerrain' C3DE.Graphics.Materials.Shaders.Forward.ForwardPBR' C3DE.Components.Rendering.DepthRenderer' C3DE.VR.NullVRService' C3DE.Graphics.PostProcessing.GlobalFog' C3DE.Graphics.Rendering.LightPrePassRenderer' C3DE.Components.Controllers.FirstPersonController' C3DE.Components.Controllers.OrbitController' C3DE.GameObjectFactory' C3DE.Components.Rendering.Terrain' C3DE.Components.Physics.Collider' C3DE.Components.Physics.Rigidbody' C3DE.Components.Rendering.Renderer' C3DE.ComponentChangedEventArgs' C3DE.GameObject,C3DE.UI.GUI' C3DE.UI.GUI' C3DE.UI.GUI' C3DE.Application' C3DE.Screen' C3DE.Application' C3DE.Screen' C3DE.Application' C3DE.Screen' C3DE.PropertyChangedEventArgs' C3DE.GameObject' C3DE.PropertyChangedEventArgs' C3DE.GameObject' C3DE.PropertyChangedEventArgs' C3DE.GameObject' C3DE.Time' C3DE.Time' C3DE.Time
C3DE,C3DE.Components.Rendering,C3DE.GameObject' C3DE.Graphics.Rendering.ForwardRenderer' Microsoft.Xna.Framework.Graphics.ModelExtensions' C3DE.GameObjectFactory' C3DE.Scene' C3DE.Graphics.Materials.Shaders.DeferredStandardWater' C3DE.Graphics.Materials.Shaders.DeferredStandardTerrain' C3DE.Components.Physics.SphereCollider' C3DE.Components.Physics.BoxCollider' C3DE.Graphics.Rendering.LightPrePassRenderer' C3DE.Graphics.Rendering.DeferredRenderer' C3DE.Graphics.Materials.IMultipassLightingMaterial' C3DE.Graphics.Materials.Shaders.Forward.ForwardPBR' C3DE.Graphics.ShadowGenerator' C3DE.Graphics.Materials.Shaders.DeferredSkybox' C3DE.Graphics.Materials.Shaders.ForwardLava' C3DE.Graphics.Materials.Shaders.DeferredStandard' C3DE.Graphics.Materials.Shaders.ForwardSkybox' C3DE.Graphics.Materials.Shaders.ForwardTransparent' C3DE.Graphics.Materials.Shaders.LPPShader' C3DE.Graphics.Materials.Shaders.ForwardStandardWater' C3DE.Graphics.Materials.Shaders.ForwardStandardTerrain' C3DE.Graphics.Materials.Shaders.ForwardUnlit' C3DE.Graphics.Materials.Shaders.ForwardStandard' C3DE.Components.Physics.Rigidbody' C3DE.Graphics.Materials.Shaders.ShaderMaterial' C3DE.Graphics.Materials.Shaders.LPPStandardTerrain' C3DE.Graphics.Materials.Shaders.LPPStandardWater' C3DE.Graphics.Materials.Shaders.LPPStandard' C3DE.Graphics.Materials.Shaders.ForwardStandardBase,C3DE.Application' C3DE.Components.Camera' C3DE.Components.Lighting.Light' C3DE.Application' C3DE.Components.Camera' C3DE.Components.Lighting.Light' C3DE.Application' C3DE.Components.Camera' C3DE.Components.Lighting.Light' C3DE.Components.Physics.BoxCollider' C3DE.Components.Physics.BoxCollider' C3DE.Components.Physics.BoxCollider' C3DE.Graphics.Primitives.VertexType' C3DE.Graphics.Primitives.Mesh' C3DE.Graphics.Primitives.VertexType' C3DE.Graphics.Primitives.Mesh' C3DE.Graphics.Primitives.VertexType' C3DE.Graphics.Primitives.Mesh' C3DE.Components.Physics.Rigidbody' C3DE.Components.Physics.Rigidbody' C3DE.Components.Physics.Rigidbody' C3DE.Components.Component' C3DE.Components.Transform' C3DE.Graphics.Primitives.TerrainMesh' C3DE.Utils.NoiseGenerator' C3DE.Components.Component' C3DE.Components.Transform' C3DE.Graphics.Primitives.TerrainMesh' C3DE.Utils.NoiseGenerator' C3DE.Components.Component' C3DE.Components.Transform' C3DE.Graphics.Primitives.TerrainMesh' C3DE.Utils.NoiseGenerator' C3DE.GameObject' C3DE.Graphics.Rendering.BaseRenderer' C3DE.GameObject' C3DE.Graphics.Rendering.BaseRenderer' C3DE.Components.Physics.Collider' C3DE.Graphics.Materials.Material' C3DE.Components.Physics.Collider' C3DE.Graphics.Materials.Material' C3DE.Components.Physics.Collider' C3DE.Graphics.Materials.Material' C3DE.Scene' C3DE.Scene' C3DE.Scene
C3DE,C3DE.Components.Controllers,,C3DE.Components.Behaviour' C3DE.Components.Behaviour' C3DE.Components.Behaviour' C3DE.Input' C3DE.Time' C3DE.Components.Camera' C3DE.Components.Transform' C3DE.Inputs.MouseButton' C3DE.Input' C3DE.Time' C3DE.Components.Camera' C3DE.Components.Transform' C3DE.Inputs.MouseButton' C3DE.Input' C3DE.Time' C3DE.Components.Camera' C3DE.Components.Transform' C3DE.Inputs.MouseButton' C3DE.Screen' C3DE.Components.Controllers.Mobile.SwipeZone' C3DE.Components.Controllers.Mobile.VirtualGamepad' C3DE.Screen' C3DE.Components.Controllers.Mobile.SwipeZone' C3DE.Components.Controllers.Mobile.VirtualGamepad' C3DE.Screen' C3DE.Components.Controllers.Mobile.SwipeZone' C3DE.Components.Controllers.Mobile.VirtualGamepad
C3DE,C3DE.Components.Physics,C3DE.Components.Rendering.BoundingBoxRenderer' C3DE.GameObjectFactory' C3DE.Components.Rendering.Renderer' C3DE.RaycastInfo' C3DE.Scene' C3DE.QuadTree' C3DE.GameObject' C3DE.Components.Rendering.RigidbodyRenderer,C3DE.Components.Rendering.Renderer' C3DE.Components.Rendering.Renderer' C3DE.Components.Rendering.Renderer' C3DE.Components.Component' C3DE.Components.Component' C3DE.Components.Component' C3DE.Scene' C3DE.Scene' C3DE.Scene
C3DE,C3DE.Components.Controllers.Mobile,C3DE.Components.Controllers.FirstPersonController,C3DE.Input' C3DE.Screen' C3DE.Components.Behaviour' C3DE.UI.GUI' C3DE.Graphics.TextureFactory' C3DE.Input' C3DE.Screen' C3DE.Components.Behaviour' C3DE.Graphics.TextureFactory' C3DE.UI.GUI' C3DE.Input' C3DE.Screen' C3DE.Components.Behaviour' C3DE.UI.GUI
C3DE,C3DE.Components.Lighting,C3DE.GameObjectFactory' C3DE.Graphics.Rendering.BaseRenderer' C3DE.Graphics.Materials.Shaders.ForwardStandardTerrain' C3DE.Graphics.Materials.Shaders.ForwardStandard' C3DE.Graphics.ShadowGenerator' C3DE.Graphics.Materials.Shaders.ForwardStandardBase' C3DE.Graphics.Materials.IMultipassLightingMaterial' C3DE.Graphics.Materials.Shaders.ForwardStandardWater' C3DE.Components.Rendering.LensFlare' C3DE.Scene,C3DE.Application' C3DE.Screen' C3DE.Components.Camera' C3DE.Components.Component' C3DE.Graphics.PostProcessing.QuadRenderer' C3DE.Graphics.Primitives.SphereMesh' C3DE.Graphics.ShadowGenerator' C3DE.Application' C3DE.Screen' C3DE.Components.Camera' C3DE.Components.Component' C3DE.Graphics.PostProcessing.QuadRenderer' C3DE.Graphics.ShadowGenerator' C3DE.Graphics.Primitives.SphereMesh' C3DE.Application' C3DE.Screen' C3DE.Components.Camera' C3DE.Components.Component' C3DE.Graphics.PostProcessing.QuadRenderer' C3DE.Graphics.Primitives.SphereMesh
C3DE,C3DE.Demo.Scripts,C3DE.GameObjectFactory,C3DE.Components.Behaviour' C3DE.VR.VRManager' C3DE.VR.VRService' C3DE.Components.Behaviour' C3DE.VR.VRManager' C3DE.VR.VRService' C3DE.Components.Behaviour' C3DE.VR.VRManager' C3DE.VR.VRService
C3DE,Microsoft.Xna.Framework,C3DE.Graphics.PostProcessing.GlobalFog,
C3DE,Microsoft.Xna.Framework.Graphics,,C3DE.Scene' C3DE.GameObject' C3DE.Components.Rendering.MeshRenderer' C3DE.Graphics.Materials.StandardMaterial' C3DE.Graphics.Primitives.Mesh' C3DE.Scene' C3DE.GameObject' C3DE.Components.Rendering.MeshRenderer' C3DE.Graphics.Materials.StandardMaterial' C3DE.Graphics.Primitives.Mesh' C3DE.Scene' C3DE.GameObject' C3DE.Components.Rendering.MeshRenderer' C3DE.Graphics.Materials.StandardMaterial' C3DE.Graphics.Primitives.Mesh
C3DE,C3DE.Graphics.Materials,C3DE.Graphics.Materials.Shaders.Forward.ForwardPBR' C3DE.Graphics.Materials.Shaders.ForwardStandardBase' C3DE.Graphics.Rendering.ForwardRenderer' C3DE.Graphics.Materials.Shaders.LPPStandard' C3DE.Graphics.Materials.Shaders.DeferredStandard' C3DE.Graphics.Materials.Shaders.ForwardStandard' Microsoft.Xna.Framework.Graphics.ModelExtensions' C3DE.Graphics.Materials.Shaders.DeferredUnlit' C3DE.Graphics.Materials.Shaders.ForwardUnlit' C3DE.Scene' C3DE.Graphics.Materials.Shaders.ForwardLava' C3DE.Graphics.Materials.Shaders.DeferredLava' C3DE.GameObjectFactory' C3DE.Graphics.Materials.Shaders.DeferredStandardTerrain' C3DE.Graphics.Materials.Shaders.ForwardStandardTerrain' C3DE.Graphics.Materials.Shaders.LPPStandardTerrain' C3DE.Graphics.Materials.Shaders.DeferredTransparent' C3DE.Graphics.Materials.Shaders.ForwardTransparent' C3DE.Graphics.Materials.Shaders.DeferredStandardWater' C3DE.Graphics.Materials.Shaders.ForwardStandardWater' C3DE.Graphics.Materials.Shaders.LPPStandardWater' C3DE.Graphics.Rendering.DeferredRenderer' C3DE.Graphics.Rendering.LightPrePassRenderer' C3DE.Components.Rendering.Renderer' C3DE.GameObject' C3DE.SerializedScene,C3DE.Application' C3DE.Graphics.Materials.Shaders.Forward.ForwardPBR' C3DE.Graphics.Rendering.BaseRenderer' C3DE.Application' C3DE.Graphics.Materials.Shaders.Forward.ForwardPBR' C3DE.Graphics.Rendering.BaseRenderer' C3DE.Components.Rendering.Renderer' C3DE.Components.Lighting.Light' C3DE.Components.Rendering.Renderer' C3DE.Components.Lighting.Light' C3DE.Components.Rendering.Renderer' C3DE.Components.Lighting.Light' C3DE.Graphics.Materials.Shaders.DeferredStandard' C3DE.Graphics.Materials.Shaders.ForwardStandard' C3DE.Graphics.Materials.Shaders.LPPStandard' C3DE.Graphics.Rendering.DeferredRenderer' C3DE.Graphics.Rendering.LightPrePassRenderer' C3DE.Graphics.Rendering.ForwardRenderer' C3DE.Graphics.Materials.Shaders.DeferredStandard' C3DE.Graphics.Materials.Shaders.ForwardStandard' C3DE.Graphics.Materials.Shaders.LPPStandard' C3DE.Graphics.Rendering.DeferredRenderer' C3DE.Graphics.Rendering.LightPrePassRenderer' C3DE.Graphics.Rendering.ForwardRenderer' C3DE.Application' C3DE.Graphics.Materials.Shaders.DeferredStandard' C3DE.Graphics.Materials.Shaders.ForwardStandard' C3DE.Graphics.Materials.Shaders.LPPStandard' C3DE.Graphics.Rendering.DeferredRenderer' C3DE.Graphics.Rendering.LightPrePassRenderer' C3DE.Graphics.Rendering.BaseRenderer' C3DE.Graphics.Rendering.ForwardRenderer' C3DE.Graphics.Materials.Shaders.DeferredUnlit' C3DE.Graphics.Materials.Shaders.ForwardUnlit' C3DE.Graphics.Materials.Shaders.DeferredUnlit' C3DE.Graphics.Materials.Shaders.ForwardUnlit' C3DE.Graphics.Materials.Shaders.ForwardUnlit' C3DE.Graphics.Materials.Shaders.DeferredLava' C3DE.Graphics.Materials.Shaders.ForwardLava' C3DE.Graphics.Materials.Shaders.DeferredLava' C3DE.Graphics.Materials.Shaders.ForwardLava' C3DE.Graphics.Materials.Shaders.ForwardLava' C3DE.Graphics.Materials.Shaders.DeferredStandardTerrain' C3DE.Graphics.Materials.Shaders.ForwardStandardTerrain' C3DE.Graphics.Materials.Shaders.DeferredStandardTerrain' C3DE.Graphics.Materials.Shaders.ForwardStandardTerrain' C3DE.Graphics.Materials.Shaders.ForwardStandardTerrain' C3DE.Graphics.Materials.Shaders.DeferredTransparent' C3DE.Graphics.Materials.Shaders.ForwardTransparent' C3DE.Graphics.Materials.Shaders.DeferredTransparent' C3DE.Graphics.Materials.Shaders.ForwardTransparent' C3DE.Graphics.Materials.Shaders.ForwardTransparent' C3DE.Graphics.Materials.Shaders.DeferredStandardWater' C3DE.Graphics.Materials.Shaders.ForwardStandardWater' C3DE.Graphics.Materials.Shaders.DeferredStandardWater' C3DE.Graphics.Materials.Shaders.ForwardStandardWater' C3DE.Graphics.Materials.Shaders.ForwardStandardWater' C3DE.Scene' C3DE.Graphics.Materials.Shaders.ShaderMaterial' C3DE.Scene' C3DE.Graphics.Materials.Shaders.ShaderMaterial' C3DE.Scene' C3DE.Graphics.Materials.Shaders.ShaderMaterial
C3DE,C3DE.Graphics.Materials.Shaders,C3DE.Graphics.Materials.LavaMaterial' C3DE.Graphics.Materials.StandardTerrainMaterial' C3DE.Graphics.Materials.StandardWaterMaterial' C3DE.Graphics.Materials.TransparentMaterial' C3DE.Graphics.Materials.UnlitMaterial' C3DE.Skybox' C3DE.Graphics.Materials.StandardMaterial' C3DE.Graphics.Rendering.LightPrePassRenderer' C3DE.Graphics.Materials.Shaders.Forward.ForwardPBR' C3DE.Graphics.Materials.Material' C3DE.Graphics.Rendering.DeferredRenderer' C3DE.Graphics.Rendering.ForwardRenderer,C3DE.Graphics.Materials.LavaMaterial' C3DE.Graphics.Materials.LavaMaterial' C3DE.Components.Camera' C3DE.Components.Rendering.Renderer' C3DE.Graphics.Materials.StandardTerrainMaterial' C3DE.Components.Camera' C3DE.Components.Rendering.Renderer' C3DE.Graphics.Materials.StandardTerrainMaterial' C3DE.Graphics.Materials.StandardWaterMaterial' C3DE.Graphics.Materials.StandardWaterMaterial' C3DE.Graphics.Materials.TransparentMaterial' C3DE.Graphics.Materials.TransparentMaterial' C3DE.Graphics.Materials.UnlitMaterial' C3DE.Graphics.Materials.UnlitMaterial' C3DE.Skybox' C3DE.Skybox' C3DE.Skybox' C3DE.Components.Camera' C3DE.Components.Rendering.Renderer' C3DE.Graphics.Materials.StandardMaterial' C3DE.Graphics.Materials.StandardMaterial' C3DE.Graphics.Materials.StandardMaterial' C3DE.Time' C3DE.Time' C3DE.Time' C3DE.Graphics.Materials.LavaMaterial' C3DE.Scene' C3DE.Scene' C3DE.Components.Lighting.Light' C3DE.Components.Lighting.Light' C3DE.Components.Lighting.Light' C3DE.Graphics.Materials.StandardTerrainMaterial' C3DE.Graphics.Materials.StandardWaterMaterial' C3DE.Scene' C3DE.Graphics.Materials.TransparentMaterial' C3DE.Graphics.Materials.UnlitMaterial' C3DE.Screen' C3DE.Screen' C3DE.Screen' C3DE.Graphics.Materials.IMultipassLightingMaterial' C3DE.Graphics.Materials.StandardMaterialBase' C3DE.Graphics.Materials.IMultipassLightingMaterial' C3DE.Graphics.Materials.StandardMaterialBase' C3DE.Graphics.Materials.IMultipassLightingMaterial' C3DE.Graphics.Materials.StandardMaterialBase
C3DE,C3DE.Graphics.Materials.Shaders.Forward,C3DE.Graphics.Materials.PBRMaterial,C3DE.Scene' C3DE.Components.Camera' C3DE.Components.Rendering.Renderer' C3DE.Graphics.Materials.PBRMaterial' C3DE.Graphics.Materials.Shaders.ShaderMaterial' C3DE.Scene' C3DE.Components.Camera' C3DE.Components.Rendering.Renderer' C3DE.Graphics.Materials.PBRMaterial' C3DE.Graphics.Materials.Shaders.ShaderMaterial
C3DE,C3DE.Graphics.PostProcessing,C3DE.Skybox' C3DE.Graphics.Rendering.DeferredRenderer' C3DE.Components.Lighting.Light' C3DE.Graphics.Rendering.BaseRenderer' C3DE.Scene,C3DE.VR.VRService' C3DE.VR.VRService' C3DE.VR.VRService' C3DE.Application' C3DE.FogMode' C3DE.Scene' C3DE.Components.Camera' Microsoft.Xna.Framework.MatrixExtensions' C3DE.Graphics.Rendering.DeferredRenderer' C3DE.Graphics.Rendering.LightPrePassRenderer' C3DE.Graphics.Rendering.ForwardRenderer' C3DE.Application' C3DE.FogMode' C3DE.Scene' C3DE.Components.Camera' Microsoft.Xna.Framework.MatrixExtensions' C3DE.Graphics.Rendering.DeferredRenderer' C3DE.Graphics.Rendering.LightPrePassRenderer' C3DE.Graphics.Rendering.ForwardRenderer' C3DE.Application' C3DE.FogMode' C3DE.Scene' C3DE.Components.Camera' Microsoft.Xna.Framework.MatrixExtensions' C3DE.Graphics.Rendering.DeferredRenderer' C3DE.Graphics.Rendering.LightPrePassRenderer' C3DE.Graphics.Rendering.ForwardRenderer' C3DE.Input' C3DE.Time' C3DE.Input' C3DE.Time' C3DE.Input' C3DE.Time' C3DE.Screen' C3DE.Screen' C3DE.Screen' C3DE.VR.VRManager' C3DE.VR.VRManager' C3DE.VR.VRManager
C3DE,C3DE.Graphics.Rendering,C3DE.Skybox' C3DE.Graphics.Materials.UnlitMaterial' C3DE.Graphics.Materials.StandardMaterial' C3DE.Graphics.Materials.StandardWaterMaterial' C3DE.Graphics.Materials.TransparentMaterial' C3DE.Graphics.Materials.StandardTerrainMaterial' C3DE.Graphics.Materials.LavaMaterial' C3DE.Graphics.PostProcessing.GlobalFog' C3DE.Components.Rendering.ReflectionProbe' C3DE.Graphics.Materials.PBRMaterial' C3DE.Graphics.Materials.Material' C3DE.Engine,C3DE.Scene' C3DE.Components.Camera' C3DE.Components.Rendering.Renderer' C3DE.Graphics.Materials.Material' C3DE.Graphics.Materials.Shaders.ShaderMaterial' C3DE.Graphics.PostProcessing.QuadRenderer' C3DE.Scene' C3DE.Components.Camera' C3DE.Components.Rendering.Renderer' C3DE.Graphics.Materials.Material' C3DE.Graphics.Materials.Shaders.ShaderMaterial' C3DE.Graphics.PostProcessing.QuadRenderer' C3DE.Scene' C3DE.Components.Camera' C3DE.Components.Rendering.Renderer' C3DE.Graphics.Materials.Material' C3DE.Graphics.Materials.Shaders.ShaderMaterial' C3DE.Graphics.PostProcessing.QuadRenderer' C3DE.Graphics.Materials.Shaders.LPPShader' C3DE.Graphics.Materials.Shaders.LPPShader' C3DE.Graphics.Materials.Shaders.LPPShader' C3DE.Application' C3DE.Components.Behaviour' C3DE.Components.Lighting.LightType' C3DE.Components.Lighting.Light' C3DE.Graphics.PostProcessing.PostProcessPass' C3DE.UI.GUI' C3DE.VR.VRManager' C3DE.VR.VRService' C3DE.Application' C3DE.Components.Behaviour' C3DE.Components.Lighting.LightType' C3DE.Components.Lighting.Light' C3DE.Graphics.PostProcessing.PostProcessPass' C3DE.UI.GUI' C3DE.VR.VRManager' C3DE.VR.VRService' C3DE.Application' C3DE.Components.Behaviour' C3DE.Components.Lighting.LightType' C3DE.Components.Lighting.Light' C3DE.Graphics.PostProcessing.PostProcessPass' C3DE.UI.GUI' C3DE.VR.VRManager' C3DE.VR.VRService' C3DE.Components.Rendering.MeshRenderer' C3DE.Components.Rendering.ModelRenderer' C3DE.Components.Rendering.DepthRenderer' C3DE.Graphics.Materials.IMultipassLightingMaterial' C3DE.Components.Rendering.MeshRenderer' C3DE.Components.Rendering.ModelRenderer' C3DE.Components.Rendering.DepthRenderer' C3DE.Graphics.Materials.IMultipassLightingMaterial' C3DE.Components.Rendering.MeshRenderer' C3DE.Components.Rendering.ModelRenderer' C3DE.Components.Rendering.DepthRenderer' C3DE.Graphics.Materials.IMultipassLightingMaterial
C3DE,C3DE.Graphics.Primitives,C3DE.Skybox' C3DE.GameObjectFactory' C3DE.GameObject' C3DE.Components.Rendering.MeshRenderer' Microsoft.Xna.Framework.Graphics.ModelExtensions' C3DE.Components.Lighting.Light' C3DE.Components.Rendering.Terrain,C3DE.Application' C3DE.Application' C3DE.Application
C3DE,C3DE.Inputs,C3DE.Input' C3DE.Engine' C3DE.Components.Controllers.FirstPersonController' C3DE.Components.Controllers.OrbitController,C3DE.Screen' C3DE.Screen' C3DE.Screen
C3DE,C3DE.Resources,,C3DE.Application' C3DE.Application' C3DE.Application
C3DE,C3DE.UI,C3DE.Components.Behaviour' C3DE.Components.Controllers.Mobile.VirtualGamepad' C3DE.SceneManager' C3DE.Engine' C3DE.Screen' C3DE.Components.Controllers.Mobile.SwipeZone' C3DE.Components.Controllers.Mobile.VirtualButton' C3DE.Graphics.Rendering.BaseRenderer,C3DE.Graphics.TextureFactory' C3DE.Graphics.TextureFactory' C3DE.Input' C3DE.Input' C3DE.Input
