Project,Namespace,Ca types,Ce types
Griffin.Networking.JsonRpc,Griffin.Networking.JsonRpc.Handlers,,Griffin.Networking.JsonRpc.Messages.ReceivedRequest' Griffin.Networking.JsonRpc.Messages.SendResponse' Griffin.Networking.JsonRpc.Remoting.IRpcInvoker' Griffin.Networking.JsonRpc.Messages.ReceivedHeader' Griffin.Networking.JsonRpc.SimpleHeader' Griffin.Networking.JsonRpc.Request' Griffin.Networking.JsonRpc.ErrorResponse' Griffin.Networking.JsonRpc.RpcError' Griffin.Networking.JsonRpc.RpcErrorCode
Griffin.Networking.JsonRpc,Griffin.Networking.JsonRpc.Infrastructure,Griffin.Networking.JsonRpc.Request,
Griffin.Networking.JsonRpc,Griffin.Networking.JsonRpc.Messages,Griffin.Networking.JsonRpc.Handlers.BodyDecoder' Griffin.Networking.JsonRpc.Handlers.HeaderDecoder' Griffin.Networking.JsonRpc.Handlers.RequestHandler' Griffin.Networking.JsonRpc.Handlers.ResponseEncoder,Griffin.Networking.JsonRpc.SimpleHeader' Griffin.Networking.JsonRpc.Request' Griffin.Networking.JsonRpc.ResponseBase
Griffin.Networking.JsonRpc,Griffin.Networking.JsonRpc.Remoting,Griffin.Networking.JsonRpc.Handlers.RequestHandler,Griffin.Networking.JsonRpc.Request' Griffin.Networking.JsonRpc.ResponseBase' Griffin.Networking.JsonRpc.ErrorResponse' Griffin.Networking.JsonRpc.RpcError' Griffin.Networking.JsonRpc.RpcErrorCode' Griffin.Networking.JsonRpc.Response
Griffin.Networking.JsonRpc,Griffin.Networking.JsonRpc,Griffin.Networking.JsonRpc.Remoting.IRpcInvoker' Griffin.Networking.JsonRpc.Messages.ReceivedRequest' Griffin.Networking.JsonRpc.Remoting.RpcServiceInvoker' Griffin.Networking.JsonRpc.Handlers.BodyDecoder' Griffin.Networking.JsonRpc.Messages.SendResponse' Griffin.Networking.JsonRpc.Messages.ReceivedHeader' Griffin.Networking.JsonRpc.Handlers.HeaderDecoder,Griffin.Networking.JsonRpc.Infrastructure.ArgumentConverter
