Project,Namespace,Ca types,Ce types
Griffin.Networking,Griffin.Networking.Buffers,Griffin.Networking.Clients.ClientBase' Griffin.Networking.Messaging.MessagingClient' Griffin.Networking.Messaging.MessagingClientContext' Griffin.Networking.Pipelines.Messages.Sent' Griffin.Networking.Servers.ClientExceptionEventArgs' Griffin.Networking.Servers.ServerClientContext' Griffin.Networking.Tests.Buffers.BufferSliceReaderTests' Griffin.Networking.Tests.Buffers.PeekableStreamTests' Griffin.Networking.Tests.Buffers.SliceStreamTests' Griffin.Networking.Servers.ServerBase' Griffin.Networking.Servers.ServerConfiguration' Griffin.Networking.Protocol.Http.Pipeline.Handlers.ResponseEncoder' Griffin.Networking.JsonRpc.Handlers.BodyDecoder' Griffin.Networking.JsonRpc.Handlers.ResponseEncoder' Griffin.Networking.Tests.Buffers.Reusable.BufferSliceStackTests' Griffin.Networking.Tests.Buffers.Reusable.ReusableBufferTests' Griffin.Networking.Tests.Buffers.BufferWorkerTests' Griffin.Networking.Clients.ReceivedBufferEventArgs' Griffin.Networking.Messaging.IMessageBuilder' Griffin.Networking.Pipelines.Messages.Received' Griffin.Networking.Protocol.Basic.BasicMessageBuilder' Griffin.Networking.Protocol.Http.HttpMessageBuilder' Griffin.Networking.Protocol.Http.Implementation.HttpHeaderParser' Griffin.Networking.Protocol.Http.Pipeline.Handlers.BodyDecoder' Griffin.Networking.Protocol.Http.Pipeline.Handlers.BufferTracer' Griffin.Networking.Protocol.Http.Pipeline.Handlers.HeaderDecoder' Griffin.Networking.JsonRpc.Handlers.HeaderDecoder' Griffin.Networking.Clients.BinaryClient' Griffin.Networking.SliceSocketWriterJob' Griffin.Networking.SocketWriter' Griffin.Networking.StreamSocketWriterJob' Griffin.Networking.Messaging.MessagingServer' Griffin.Networking.Pipelines.Messages.SendSlice' Griffin.Networking.Servers.IServerClientContext' Griffin.Networking.Servers.ServiceExceptionContext' Griffin.Networking.Protocol.Http.HttpService' Griffin.Networking.Protocol.Http.HttpMessageFactory' Griffin.Networking.Messaging.IMessageSerializer' Griffin.Networking.Protocol.Basic.BasicMessageSerializer' Griffin.Networking.Protocol.Http.HttpMessageSerializer' Griffin.Networking.Protocol.Http.Implementation.HttpHeaderSerializer' Griffin.Networking.Pipelines.Messages.ReceivedInStream' Griffin.Networking.Pipelines.PipelineNetworkService,
Griffin.Networking,Griffin.Networking.Clients,,Griffin.Networking.Buffers.IBufferSlice' Griffin.Networking.Buffers.BufferSlice' Griffin.Networking.SocketWriter' Griffin.Networking.Buffers.IBufferReader
Griffin.Networking,Griffin.Networking,Griffin.Networking.Servers.ServerClientContext' Griffin.Networking.Pipelines.ServiceLocatorPipelineFactory' Griffin.Networking.JsonRpc.Remoting.RpcServiceInvoker' Griffin.Networking.Clients.ClientBase' Griffin.Networking.Tests.SocketWriterTests,Griffin.Networking.Buffers.IBufferSlice' Griffin.Networking.Logging.ILogger
Griffin.Networking,Griffin.Networking.Messaging,BasicDemo.Program' BasicDemo.MyService,Griffin.Networking.Buffers.IBufferSlice' Griffin.Networking.Buffers.BufferSlice' Griffin.Networking.Buffers.BufferWriter' Griffin.Networking.Servers.IServerClientContext' Griffin.Networking.Servers.ServiceExceptionContext' Griffin.Networking.Servers.IServiceFactory' Griffin.Networking.Buffers.IBufferReader' Griffin.Networking.Buffers.IBufferWriter' Griffin.Networking.Servers.ServerClientContext' Griffin.Networking.Buffers.SliceStream
Griffin.Networking,Griffin.Networking.Pipelines,Griffin.Networking.Tests.Channels.MyPipeline' Griffin.Networking.Protocol.Http.Pipeline.Handlers.AuthenticationHandler' Griffin.Networking.Protocol.Http.Pipeline.Handlers.BodyDecoder' Griffin.Networking.Protocol.Http.Pipeline.Handlers.BufferTracer' Griffin.Networking.Protocol.Http.Pipeline.Handlers.HttpErrorHandler' Griffin.Networking.Protocol.Http.Pipeline.Handlers.PipelineFailureHandler' Griffin.Networking.Protocol.Http.Pipeline.Handlers.HeaderDecoder' Griffin.Networking.Protocol.Http.Pipeline.Handlers.RequestScope' Griffin.Networking.Protocol.Http.Pipeline.Handlers.ResponseEncoder' Griffin.Networking.JsonRpc.Handlers.RequestHandler' Griffin.Networking.JsonRpc.Handlers.HeaderDecoder' Griffin.Networking.JsonRpc.Handlers.BodyDecoder' Griffin.Networking.JsonRpc.Handlers.ResponseEncoder' ServerDemo.MyApplication' Griffin.Networking.WebSocket.Protocol.RequestDecoder' Griffin.Networking.Tests.Pipelines.DownstreamOrderHandler' Griffin.Networking.Tests.Pipelines.MyDownHandler' Griffin.Networking.Tests.Pipelines.MyUpHandler' Griffin.Networking.Tests.Pipelines.PipelineTest' Griffin.Networking.Tests.Pipelines.UpHandler2' Griffin.Networking.Tests.Pipelines.UpstreamOrderHandler' ServerDemo.Program' Griffin.Networking.Tests.Pipelines.PipelineTests,Griffin.Networking.Logging.ILogger' Griffin.Networking.Servers.ServerConfiguration' Griffin.Networking.Servers.IServerClientContext' Griffin.Networking.Pipelines.Messages.SendBuffer' Griffin.Networking.Pipelines.Messages.SendSlice' Griffin.Networking.Pipelines.Messages.SendStream' Griffin.Networking.Pipelines.Messages.Disconnect' Griffin.Networking.Buffers.SliceStream' Griffin.Networking.Servers.ServiceExceptionContext' Griffin.Networking.IServiceLocator
Griffin.Networking,Griffin.Networking.Logging,Griffin.Networking.SocketWriter' Griffin.Networking.StreamSocketWriterJob' Griffin.Networking.Pipelines.Pipeline' Griffin.Networking.Pipelines.PipelineDownstreamContext' Griffin.Networking.Pipelines.PipelineUpstreamContext' Griffin.Networking.Servers.ServerClientContext' Griffin.Networking.Protocol.Http.Implementation.ByteRangeStream' Griffin.Networking.Protocol.Http.Implementation.HttpHeaderParser' Griffin.Networking.Protocol.Http.Pipeline.Handlers.BufferTracer' Griffin.Networking.Protocol.Http.Pipeline.Handlers.HttpErrorHandler' Griffin.Networking.Protocol.Http.Services.Authentication.DigestAuthenticator' Griffin.Networking.Tests.Channels.MyPipeline' ServerDemo.Program,
Griffin.Networking,Griffin.Networking.Pipelines.Messages,Griffin.Networking.Protocol.Http.Pipeline.Handlers.HeaderDecoder' Griffin.Networking.Pipelines.PipelineNetworkService' Griffin.Networking.Protocol.Http.Pipeline.Handlers.PipelineFailureHandler' Griffin.Networking.Protocol.Http.Pipeline.Handlers.BodyDecoder' Griffin.Networking.Protocol.Http.Pipeline.Handlers.BufferTracer' Griffin.Networking.JsonRpc.Handlers.HeaderDecoder' Griffin.Networking.JsonRpc.Handlers.BodyDecoder' Griffin.Networking.WebSocket.Protocol.RequestDecoder,Griffin.Networking.Servers.INetworkService' Griffin.Networking.Buffers.IBufferReader' Griffin.Networking.Buffers.IPeekable' Griffin.Networking.Buffers.IBufferSlice' Griffin.Networking.Buffers.BufferSlice
Griffin.Networking,Griffin.Networking.Servers,Griffin.Networking.Messaging.MessagingClientContext' Griffin.Networking.Tests.Servers.ServerClientContextTests' Griffin.Networking.Messaging.MessagingServer' Griffin.Networking.Pipelines.Messages.ClientConnected' Griffin.Networking.Tests.Servers.MyServer' Griffin.Networking.Messaging.MessagingService' Griffin.Networking.Pipelines.PipelineNetworkService' Griffin.Networking.Protocol.Http.HttpService' Griffin.Networking.Tests.Servers.MyTest' Griffin.Networking.Pipelines.PipelineServer,Griffin.Networking.Buffers.BufferSlice' Griffin.Networking.Buffers.BufferSliceStack' Griffin.Networking.Buffers.IBufferSlice' Griffin.Networking.Buffers.SliceStream' Griffin.Networking.SocketWriter' Griffin.Networking.Logging.ILogger' Griffin.Networking.DisconnectEventArgs
